{
  "productName": "Amortisseur de vibrations",
  "searchText": "Amortisseur de vibrations",
  "found": true,
  "hasMatch": false,
  "timestamp": "2025-12-02T18:49:45.381Z",
  "productId": 3294,
  "arborescence": {
    "Boîte de vitesses": {
      "categoryId": 100238,
      "categoryName": "Boîte de vitesses",
      "level": 1,
      "children": {
        "Boîte de vitesses manuelle": {
          "categoryId": null,
          "categoryName": "Boîte de vitesses manuelle",
          "level": 2,
          "children": {
            "Amortisseur de vibrations, boîte de vitesses": {
              "categoryId": 100239,
              "categoryName": "Manual Transmission",
              "level": 2,
              "children": {
                "Amortisseur de vibrations": {
                  "categoryId": null,
                  "categoryName": "Amortisseur de vibrations",
                  "level": 4,
                  "children": {
                    "Amortisseur de vibrations, boîte de vitesses": {
                      "categoryId": 706805,
                      "categoryName": "Vibration Damper",
                      "level": 3,
                      "children": [],
                      "productId": 60911
                    }
                  }
                }
              },
              "productId": 60911
            },
            "Amortisseur de vibrations, tringlerie de commande": {
              "categoryId": 100239,
              "categoryName": "Manual Transmission",
              "level": 2,
              "children": {
                "Commande de boîte de vitesses": {
                  "categoryId": null,
                  "categoryName": "Commande de boîte de vitesses",
                  "level": 4,
                  "children": {
                    "Amortisseur de vibrations, tringlerie de commande": {
                      "categoryId": 101808,
                      "categoryName": "Transmission Control",
                      "level": 3,
                      "children": [],
                      "productId": 4202
                    }
                  }
                }
              },
              "productId": 4202
            }
          }
        }
      }
    },
    "Commande à courroie": {
      "categoryId": 100016,
      "categoryName": "Commande à courroie",
      "level": 1,
      "children": {
        "Courroie crantée/kit de courroie crantée": {
          "categoryId": null,
          "categoryName": "Courroie crantée/kit de courroie crantée",
          "level": 2,
          "children": {
            "Amortisseur de vibrations, courroie crantée": {
              "categoryId": 100085,
              "categoryName": "Timing Belt/Set",
              "level": 2,
              "children": {
                "Amortisseur de vibrations": {
                  "categoryId": null,
                  "categoryName": "Amortisseur de vibrations",
                  "level": 4,
                  "children": {
                    "Amortisseur de vibrations, courroie crantée": {
                      "categoryId": 100877,
                      "categoryName": "Vibration Damper",
                      "level": 3,
                      "children": [],
                      "productId": 2453
                    }
                  }
                }
              },
              "productId": 2453
            }
          }
        },
        "Jeu/ courroies trapézoïdales à nervures": {
          "categoryId": null,
          "categoryName": "Jeu/ courroies trapézoïdales à nervures",
          "level": 2,
          "children": {
            "Amortisseur de vibrations, courroie trapézoïdale à nervures": {
              "categoryId": 100082,
              "categoryName": "V-Ribbed Belt/Set",
              "level": 2,
              "children": {
                "Amortisseur de vibrations": {
                  "categoryId": null,
                  "categoryName": "Amortisseur de vibrations",
                  "level": 4,
                  "children": {
                    "Amortisseur de vibrations, courroie trapézoïdale à nervures": {
                      "categoryId": 100876,
                      "categoryName": "Vibration Damper",
                      "level": 3,
                      "children": [],
                      "productId": 1637
                    }
                  }
                }
              },
              "productId": 1637
            }
          }
        }
      }
    },
    "Échappement": {
      "categoryId": 100004,
      "categoryName": "Échappement",
      "level": 1,
      "children": {
        "Pièces de montage": {
          "categoryId": null,
          "categoryName": "Pièces de montage",
          "level": 2,
          "children": {
            "Amortisseur de vibrations, système d'échappement": {
              "categoryId": 100222,
              "categoryName": "Assembly Parts",
              "level": 2,
              "children": {
                "Pièces détachées de montage": {
                  "categoryId": null,
                  "categoryName": "Pièces détachées de montage",
                  "level": 4,
                  "children": {
                    "Amortisseur de vibrations, système d'échappement": {
                      "categoryId": 100317,
                      "categoryName": "Individual Assembly Parts",
                      "level": 3,
                      "children": {
                        "Amortisseur de vibrations": {
                          "categoryId": null,
                          "categoryName": "Amortisseur de vibrations",
                          "level": 6,
                          "children": {
                            "Amortisseur de vibrations, système d'échappement": {
                              "categoryId": 706788,
                              "categoryName": "Vibration Damper",
                              "level": 4,
                              "children": [],
                              "productId": 60837
                            }
                          }
                        }
                      },
                      "productId": 60837
                    }
                  }
                }
              },
              "productId": 60837
            }
          }
        }
      }
    },
    "Entraînement des essieux": {
      "categoryId": 100400,
      "categoryName": "Entraînement des essieux",
      "level": 1,
      "children": {
        "Arbre de transmission": {
          "categoryId": null,
          "categoryName": "Arbre de transmission",
          "level": 2,
          "children": {
            "Amortisseur de vibrations, arbre de cardan": {
              "categoryId": 100703,
              "categoryName": "Propshaft",
              "level": 2,
              "children": {
                "Arbre de transmission": {
                  "categoryId": null,
                  "categoryName": "Arbre de transmission",
                  "level": 4,
                  "children": {
                    "Amortisseur de vibrations, arbre de cardan": {
                      "categoryId": 100805,
                      "categoryName": "Propshaft",
                      "level": 3,
                      "children": [],
                      "productId": 2108
                    }
                  }
                }
              },
              "productId": 2108
            }
          }
        }
      }
    },
    "Entraînement des roues": {
      "categoryId": 100014,
      "categoryName": "Entraînement des roues",
      "level": 1,
      "children": {
        "Arbre de transmission": {
          "categoryId": null,
          "categoryName": "Arbre de transmission",
          "level": 2,
          "children": {
            "Amortisseur de vibrations, arbre de transmission": {
              "categoryId": 100062,
              "categoryName": "Drive Shaft",
              "level": 2,
              "children": [],
              "productId": 1786
            }
          }
        },
        "Pièces de fixation / accessoires": {
          "categoryId": null,
          "categoryName": "Pièces de fixation / accessoires",
          "level": 2,
          "children": {
            "Amortisseur de vibrations, arbre de transmission": {
              "categoryId": 100066,
              "categoryName": "Assembly Parts",
              "level": 2,
              "children": [],
              "productId": 1786
            }
          }
        }
      }
    },
    "Moteur": {
      "categoryId": 100002,
      "categoryName": "Moteur",
      "level": 1,
      "children": {
        "Commande à courroie": {
          "categoryId": null,
          "categoryName": "Commande à courroie",
          "level": 2,
          "children": {
            "Amortisseur de vibrations, courroie crantée": {
              "categoryId": 104302,
              "categoryName": "Belt Drive",
              "level": 2,
              "children": {
                "Courroie crantée/kit de courroie crantée": {
                  "categoryId": null,
                  "categoryName": "Courroie crantée/kit de courroie crantée",
                  "level": 4,
                  "children": {
                    "Amortisseur de vibrations, courroie crantée": {
                      "categoryId": 104317,
                      "categoryName": "Timing Belt/Set",
                      "level": 3,
                      "children": {
                        "Amortisseur de vibrations": {
                          "categoryId": null,
                          "categoryName": "Amortisseur de vibrations",
                          "level": 6,
                          "children": {
                            "Amortisseur de vibrations, courroie crantée": {
                              "categoryId": 104324,
                              "categoryName": "Vibration Damper",
                              "level": 4,
                              "children": [],
                              "productId": 2453
                            }
                          }
                        }
                      },
                      "productId": 2453
                    }
                  }
                }
              },
              "productId": 2453
            },
            "Amortisseur de vibrations, courroie trapézoïdale à nervures": {
              "categoryId": 104302,
              "categoryName": "Belt Drive",
              "level": 2,
              "children": {
                "Jeu/ courroies trapézoïdales à nervures": {
                  "categoryId": null,
                  "categoryName": "Jeu/ courroies trapézoïdales à nervures",
                  "level": 4,
                  "children": {
                    "Amortisseur de vibrations, courroie trapézoïdale à nervures": {
                      "categoryId": 104308,
                      "categoryName": "V-Ribbed Belt/Set",
                      "level": 3,
                      "children": {
                        "Amortisseur de vibrations": {
                          "categoryId": null,
                          "categoryName": "Amortisseur de vibrations",
                          "level": 6,
                          "children": {
                            "Amortisseur de vibrations, courroie trapézoïdale à nervures": {
                              "categoryId": 104315,
                              "categoryName": "Vibration Damper",
                              "level": 4,
                              "children": [],
                              "productId": 1637
                            }
                          }
                        }
                      },
                      "productId": 1637
                    }
                  }
                }
              },
              "productId": 1637
            },
            "Douille de rép., amortisseur vibr. (entraînement courroie)": {
              "categoryId": 104302,
              "categoryName": "Belt Drive",
              "level": 2,
              "children": {
                "Jeu/ courroies trapézoïdales à nervures": {
                  "categoryId": null,
                  "categoryName": "Jeu/ courroies trapézoïdales à nervures",
                  "level": 4,
                  "children": {
                    "Douille de rép., amortisseur vibr. (entraînement courroie)": {
                      "categoryId": 104308,
                      "categoryName": "V-Ribbed Belt/Set",
                      "level": 3,
                      "children": {
                        "Amortisseur de vibrations": {
                          "categoryId": null,
                          "categoryName": "Amortisseur de vibrations",
                          "level": 6,
                          "children": {
                            "Douille de rép., amortisseur vibr. (entraînement courroie)": {
                              "categoryId": 104315,
                              "categoryName": "Vibration Damper",
                              "level": 4,
                              "children": [],
                              "productId": 8244
                            }
                          }
                        }
                      },
                      "productId": 8244
                    }
                  }
                }
              },
              "productId": 8244
            }
          }
        },
        "Distribution moteur": {
          "categoryId": null,
          "categoryName": "Distribution moteur",
          "level": 2,
          "children": {
            "Amortisseur de vibrations, courroie crantée": {
              "categoryId": 100003,
              "categoryName": "Engine Timing",
              "level": 2,
              "children": {
                "Courroie crantée/tension/guidage": {
                  "categoryId": null,
                  "categoryName": "Courroie crantée/tension/guidage",
                  "level": 4,
                  "children": {
                    "Amortisseur de vibrations, courroie crantée": {
                      "categoryId": 100396,
                      "categoryName": "Timing Belt/Tensioner/Guide",
                      "level": 3,
                      "children": {
                        "Amortisseur de vibrations": {
                          "categoryId": null,
                          "categoryName": "Amortisseur de vibrations",
                          "level": 6,
                          "children": {
                            "Amortisseur de vibrations, courroie crantée": {
                              "categoryId": 100875,
                              "categoryName": "Vibration Damper",
                              "level": 4,
                              "children": [],
                              "productId": 2453
                            }
                          }
                        }
                      },
                      "productId": 2453
                    }
                  }
                }
              },
              "productId": 2453
            },
            "Kit de montage, amortisseur de vibrations (courroie crantée)": {
              "categoryId": 100003,
              "categoryName": "Engine Timing",
              "level": 2,
              "children": {
                "Courroie crantée/tension/guidage": {
                  "categoryId": null,
                  "categoryName": "Courroie crantée/tension/guidage",
                  "level": 4,
                  "children": {
                    "Kit de montage, amortisseur de vibrations (courroie crantée)": {
                      "categoryId": 100396,
                      "categoryName": "Timing Belt/Tensioner/Guide",
                      "level": 3,
                      "children": {
                        "Amortisseur de vibrations": {
                          "categoryId": null,
                          "categoryName": "Amortisseur de vibrations",
                          "level": 6,
                          "children": {
                            "Kit de montage, amortisseur de vibrations (courroie crantée)": {
                              "categoryId": 100875,
                              "categoryName": "Vibration Damper",
                              "level": 4,
                              "children": [],
                              "productId": 8279
                            }
                          }
                        }
                      },
                      "productId": 8279
                    }
                  }
                }
              },
              "productId": 8279
            },
            "Outils d’ajustage, amortisseur de vibrations (vilebrequin)": {
              "categoryId": 100003,
              "categoryName": "Engine Timing",
              "level": 2,
              "children": {
                "Outils": {
                  "categoryId": null,
                  "categoryName": "Outils",
                  "level": 4,
                  "children": {
                    "Outils d’ajustage, amortisseur de vibrations (vilebrequin)": {
                      "categoryId": 706307,
                      "categoryName": "Tools",
                      "level": 3,
                      "children": [],
                      "productId": 8951
                    }
                  }
                }
              },
              "productId": 8951
            }
          }
        }
      }
    }
  },
  "arborescenceText": "├── Boîte de vitesses [ID: 100238] (Niveau 1)\n│   └── Boîte de vitesses manuelle (Niveau 2)\n│       ├── Manual Transmission [ID: 100239] (Niveau 2) → ProductId: 60911\n│       │   └── Amortisseur de vibrations (Niveau 4)\n│       │       └── Vibration Damper [ID: 706805] (Niveau 3) → ProductId: 60911\n│       └── Manual Transmission [ID: 100239] (Niveau 2) → ProductId: 4202\n│           └── Commande de boîte de vitesses (Niveau 4)\n│               └── Transmission Control [ID: 101808] (Niveau 3) → ProductId: 4202\n\n├── Commande à courroie [ID: 100016] (Niveau 1)\n│   ├── Courroie crantée/kit de courroie crantée (Niveau 2)\n│   │   └── Timing Belt/Set [ID: 100085] (Niveau 2) → ProductId: 2453\n│   │       └── Amortisseur de vibrations (Niveau 4)\n│   │           └── Vibration Damper [ID: 100877] (Niveau 3) → ProductId: 2453\n│   └── Jeu/ courroies trapézoïdales à nervures (Niveau 2)\n│       └── V-Ribbed Belt/Set [ID: 100082] (Niveau 2) → ProductId: 1637\n│           └── Amortisseur de vibrations (Niveau 4)\n│               └── Vibration Damper [ID: 100876] (Niveau 3) → ProductId: 1637\n\n├── Échappement [ID: 100004] (Niveau 1)\n│   └── Pièces de montage (Niveau 2)\n│       └── Assembly Parts [ID: 100222] (Niveau 2) → ProductId: 60837\n│           └── Pièces détachées de montage (Niveau 4)\n│               └── Individual Assembly Parts [ID: 100317] (Niveau 3) → ProductId: 60837\n│                   └── Amortisseur de vibrations (Niveau 6)\n│                       └── Vibration Damper [ID: 706788] (Niveau 4) → ProductId: 60837\n\n├── Entraînement des essieux [ID: 100400] (Niveau 1)\n│   └── Arbre de transmission (Niveau 2)\n│       └── Propshaft [ID: 100703] (Niveau 2) → ProductId: 2108\n│           └── Arbre de transmission (Niveau 4)\n│               └── Propshaft [ID: 100805] (Niveau 3) → ProductId: 2108\n\n├── Entraînement des roues [ID: 100014] (Niveau 1)\n│   ├── Arbre de transmission (Niveau 2)\n│   │   └── Drive Shaft [ID: 100062] (Niveau 2) → ProductId: 1786\n│   └── Pièces de fixation / accessoires (Niveau 2)\n│       └── Assembly Parts [ID: 100066] (Niveau 2) → ProductId: 1786\n\n└── Moteur [ID: 100002] (Niveau 1)\n    ├── Commande à courroie (Niveau 2)\n    │   ├── Belt Drive [ID: 104302] (Niveau 2) → ProductId: 2453\n    │   │   └── Courroie crantée/kit de courroie crantée (Niveau 4)\n    │   │       └── Timing Belt/Set [ID: 104317] (Niveau 3) → ProductId: 2453\n    │   │           └── Amortisseur de vibrations (Niveau 6)\n    │   │               └── Vibration Damper [ID: 104324] (Niveau 4) → ProductId: 2453\n    │   ├── Belt Drive [ID: 104302] (Niveau 2) → ProductId: 1637\n    │   │   └── Jeu/ courroies trapézoïdales à nervures (Niveau 4)\n    │   │       └── V-Ribbed Belt/Set [ID: 104308] (Niveau 3) → ProductId: 1637\n    │   │           └── Amortisseur de vibrations (Niveau 6)\n    │   │               └── Vibration Damper [ID: 104315] (Niveau 4) → ProductId: 1637\n    │   └── Belt Drive [ID: 104302] (Niveau 2) → ProductId: 8244\n    │       └── Jeu/ courroies trapézoïdales à nervures (Niveau 4)\n    │           └── V-Ribbed Belt/Set [ID: 104308] (Niveau 3) → ProductId: 8244\n    │               └── Amortisseur de vibrations (Niveau 6)\n    │                   └── Vibration Damper [ID: 104315] (Niveau 4) → ProductId: 8244\n    └── Distribution moteur (Niveau 2)\n        ├── Engine Timing [ID: 100003] (Niveau 2) → ProductId: 2453\n        │   └── Courroie crantée/tension/guidage (Niveau 4)\n        │       └── Timing Belt/Tensioner/Guide [ID: 100396] (Niveau 3) → ProductId: 2453\n        │           └── Amortisseur de vibrations (Niveau 6)\n        │               └── Vibration Damper [ID: 100875] (Niveau 4) → ProductId: 2453\n        ├── Engine Timing [ID: 100003] (Niveau 2) → ProductId: 8279\n        │   └── Courroie crantée/tension/guidage (Niveau 4)\n        │       └── Timing Belt/Tensioner/Guide [ID: 100396] (Niveau 3) → ProductId: 8279\n        │           └── Amortisseur de vibrations (Niveau 6)\n        │               └── Vibration Damper [ID: 100875] (Niveau 4) → ProductId: 8279\n        └── Engine Timing [ID: 100003] (Niveau 2) → ProductId: 8951\n            └── Outils (Niveau 4)\n                └── Tools [ID: 706307] (Niveau 3) → ProductId: 8951",
  "arborescencePaths": [
    {
      "path": [
        "Boîte de vitesses",
        "Boîte de vitesses manuelle",
        "Manual Transmission"
      ],
      "categoryIds": [
        100238,
        null,
        100239
      ],
      "finalCategoryId": 100239,
      "productId": 60911
    },
    {
      "path": [
        "Boîte de vitesses",
        "Boîte de vitesses manuelle",
        "Manual Transmission"
      ],
      "categoryIds": [
        100238,
        null,
        100239
      ],
      "finalCategoryId": 100239,
      "productId": 4202
    },
    {
      "path": [
        "Commande à courroie",
        "Courroie crantée/kit de courroie crantée",
        "Timing Belt/Set"
      ],
      "categoryIds": [
        100016,
        null,
        100085
      ],
      "finalCategoryId": 100085,
      "productId": 2453
    },
    {
      "path": [
        "Commande à courroie",
        "Jeu/ courroies trapézoïdales à nervures",
        "V-Ribbed Belt/Set"
      ],
      "categoryIds": [
        100016,
        null,
        100082
      ],
      "finalCategoryId": 100082,
      "productId": 1637
    },
    {
      "path": [
        "Échappement",
        "Pièces de montage",
        "Assembly Parts"
      ],
      "categoryIds": [
        100004,
        null,
        100222
      ],
      "finalCategoryId": 100222,
      "productId": 60837
    },
    {
      "path": [
        "Entraînement des essieux",
        "Arbre de transmission",
        "Propshaft"
      ],
      "categoryIds": [
        100400,
        null,
        100703
      ],
      "finalCategoryId": 100703,
      "productId": 2108
    },
    {
      "path": [
        "Entraînement des roues",
        "Arbre de transmission",
        "Drive Shaft"
      ],
      "categoryIds": [
        100014,
        null,
        100062
      ],
      "finalCategoryId": 100062,
      "productId": 1786
    },
    {
      "path": [
        "Entraînement des roues",
        "Pièces de fixation / accessoires",
        "Assembly Parts"
      ],
      "categoryIds": [
        100014,
        null,
        100066
      ],
      "finalCategoryId": 100066,
      "productId": 1786
    },
    {
      "path": [
        "Moteur",
        "Commande à courroie",
        "Belt Drive"
      ],
      "categoryIds": [
        100002,
        null,
        104302
      ],
      "finalCategoryId": 104302,
      "productId": 2453
    },
    {
      "path": [
        "Moteur",
        "Commande à courroie",
        "Belt Drive"
      ],
      "categoryIds": [
        100002,
        null,
        104302
      ],
      "finalCategoryId": 104302,
      "productId": 1637
    },
    {
      "path": [
        "Moteur",
        "Commande à courroie",
        "Belt Drive"
      ],
      "categoryIds": [
        100002,
        null,
        104302
      ],
      "finalCategoryId": 104302,
      "productId": 8244
    },
    {
      "path": [
        "Moteur",
        "Distribution moteur",
        "Engine Timing"
      ],
      "categoryIds": [
        100002,
        null,
        100003
      ],
      "finalCategoryId": 100003,
      "productId": 2453
    },
    {
      "path": [
        "Moteur",
        "Distribution moteur",
        "Engine Timing"
      ],
      "categoryIds": [
        100002,
        null,
        100003
      ],
      "finalCategoryId": 100003,
      "productId": 8279
    },
    {
      "path": [
        "Moteur",
        "Distribution moteur",
        "Engine Timing"
      ],
      "categoryIds": [
        100002,
        null,
        100003
      ],
      "finalCategoryId": 100003,
      "productId": 8951
    }
  ],
  "productIdsInArbo": [
    1637,
    1786,
    2108,
    2453,
    4202,
    8244,
    8279,
    8951,
    60837,
    60911
  ],
  "closestProductIds": [
    {
      "productId": 1637,
      "productName": "Amortisseur de vibrations, courroie trapézoïdale à nervures"
    },
    {
      "productId": 1786,
      "productName": "Amortisseur de vibrations, arbre de transmission"
    },
    {
      "productId": 2108,
      "productName": "Amortisseur de vibrations, arbre de cardan"
    },
    {
      "productId": 2453,
      "productName": "Amortisseur de vibrations, courroie crantée"
    },
    {
      "productId": 4202,
      "productName": "Amortisseur de vibrations, tringlerie de commande"
    }
  ]
}