{
  "productName": "Ampoule, projecteur longue portée",
  "searchText": "Ampoule, projecteur longue portée",
  "found": true,
  "hasMatch": true,
  "timestamp": "2025-12-02T18:50:34.840Z",
  "productId": 106,
  "arborescence": {
    "Carrosserie": {
      "categoryId": 100001,
      "categoryName": "Carrosserie",
      "level": 1,
      "children": {
        "Avant du véhicule": {
          "categoryId": null,
          "categoryName": "Avant du véhicule",
          "level": 2,
          "children": {
            "Ampoule, feu de route/diurne": {
              "categoryId": 101648,
              "categoryName": "Vehicle Front",
              "level": 2,
              "children": {
                "Projecteur longue portée / composants": {
                  "categoryId": null,
                  "categoryName": "Projecteur longue portée / composants",
                  "level": 4,
                  "children": {
                    "Ampoule, feu de route/diurne": {
                      "categoryId": 101665,
                      "categoryName": "Spotlight/Parts",
                      "level": 3,
                      "children": {
                        "Ampoule /projecteur longue portée": {
                          "categoryId": null,
                          "categoryName": "Ampoule /projecteur longue portée",
                          "level": 6,
                          "children": {
                            "Ampoule, feu de route/diurne": {
                              "categoryId": 101667,
                              "categoryName": "Spotlight Bulb",
                              "level": 4,
                              "children": [],
                              "productId": 60366
                            }
                          }
                        }
                      },
                      "productId": 60366
                    }
                  }
                }
              },
              "productId": 60366
            },
            "Ampoule, feu de route/diurne/position": {
              "categoryId": 101648,
              "categoryName": "Vehicle Front",
              "level": 2,
              "children": {
                "Projecteur longue portée / composants": {
                  "categoryId": null,
                  "categoryName": "Projecteur longue portée / composants",
                  "level": 4,
                  "children": {
                    "Ampoule, feu de route/diurne/position": {
                      "categoryId": 101665,
                      "categoryName": "Spotlight/Parts",
                      "level": 3,
                      "children": {
                        "Ampoule /projecteur longue portée": {
                          "categoryId": null,
                          "categoryName": "Ampoule /projecteur longue portée",
                          "level": 6,
                          "children": {
                            "Ampoule, feu de route/diurne/position": {
                              "categoryId": 101667,
                              "categoryName": "Spotlight Bulb",
                              "level": 4,
                              "children": [],
                              "productId": 60365
                            }
                          }
                        }
                      },
                      "productId": 60365
                    }
                  }
                }
              },
              "productId": 60365
            },
            "Ampoule, projecteur longue portée": {
              "categoryId": 101648,
              "categoryName": "Vehicle Front",
              "level": 2,
              "children": {
                "Projecteur longue portée / composants": {
                  "categoryId": null,
                  "categoryName": "Projecteur longue portée / composants",
                  "level": 4,
                  "children": {
                    "Ampoule, projecteur longue portée": {
                      "categoryId": 101665,
                      "categoryName": "Spotlight/Parts",
                      "level": 3,
                      "children": {
                        "Ampoule /projecteur longue portée": {
                          "categoryId": null,
                          "categoryName": "Ampoule /projecteur longue portée",
                          "level": 6,
                          "children": {
                            "Ampoule, projecteur longue portée": {
                              "categoryId": 101667,
                              "categoryName": "Spotlight Bulb",
                              "level": 4,
                              "children": [],
                              "productId": 106
                            }
                          }
                        }
                      },
                      "productId": 106
                    }
                  }
                }
              },
              "productId": 106
            }
          }
        },
        "Phares supplémentaires/composants": {
          "categoryId": null,
          "categoryName": "Phares supplémentaires/composants",
          "level": 2,
          "children": {
            "Ampoule, feu de route/diurne": {
              "categoryId": 101340,
              "categoryName": "Additional Headlight/Parts",
              "level": 2,
              "children": {
                "Projecteur longue portée / composants": {
                  "categoryId": null,
                  "categoryName": "Projecteur longue portée / composants",
                  "level": 4,
                  "children": {
                    "Ampoule, feu de route/diurne": {
                      "categoryId": 101345,
                      "categoryName": "Spotlight/Parts",
                      "level": 3,
                      "children": {
                        "Ampoule /projecteur longue portée": {
                          "categoryId": null,
                          "categoryName": "Ampoule /projecteur longue portée",
                          "level": 6,
                          "children": {
                            "Ampoule, feu de route/diurne": {
                              "categoryId": 101347,
                              "categoryName": "Spotlight Bulb",
                              "level": 4,
                              "children": [],
                              "productId": 60366
                            }
                          }
                        }
                      },
                      "productId": 60366
                    }
                  }
                }
              },
              "productId": 60366
            },
            "Ampoule, feu de route/diurne/position": {
              "categoryId": 101340,
              "categoryName": "Additional Headlight/Parts",
              "level": 2,
              "children": {
                "Projecteur longue portée / composants": {
                  "categoryId": null,
                  "categoryName": "Projecteur longue portée / composants",
                  "level": 4,
                  "children": {
                    "Ampoule, feu de route/diurne/position": {
                      "categoryId": 101345,
                      "categoryName": "Spotlight/Parts",
                      "level": 3,
                      "children": {
                        "Ampoule /projecteur longue portée": {
                          "categoryId": null,
                          "categoryName": "Ampoule /projecteur longue portée",
                          "level": 6,
                          "children": {
                            "Ampoule, feu de route/diurne/position": {
                              "categoryId": 101347,
                              "categoryName": "Spotlight Bulb",
                              "level": 4,
                              "children": [],
                              "productId": 60365
                            }
                          }
                        }
                      },
                      "productId": 60365
                    }
                  }
                }
              },
              "productId": 60365
            },
            "Ampoule, projecteur longue portée": {
              "categoryId": 101340,
              "categoryName": "Additional Headlight/Parts",
              "level": 2,
              "children": {
                "Projecteur longue portée / composants": {
                  "categoryId": null,
                  "categoryName": "Projecteur longue portée / composants",
                  "level": 4,
                  "children": {
                    "Ampoule, projecteur longue portée": {
                      "categoryId": 101345,
                      "categoryName": "Spotlight/Parts",
                      "level": 3,
                      "children": {
                        "Ampoule /projecteur longue portée": {
                          "categoryId": null,
                          "categoryName": "Ampoule /projecteur longue portée",
                          "level": 6,
                          "children": {
                            "Ampoule, projecteur longue portée": {
                              "categoryId": 101347,
                              "categoryName": "Spotlight Bulb",
                              "level": 4,
                              "children": [],
                              "productId": 106
                            }
                          }
                        }
                      },
                      "productId": 106
                    }
                  }
                }
              },
              "productId": 106
            }
          }
        }
      }
    },
    "Système électrique": {
      "categoryId": 100010,
      "categoryName": "Système électrique",
      "level": 1,
      "children": {
        "Phares supplémentaires/composants": {
          "categoryId": null,
          "categoryName": "Phares supplémentaires/composants",
          "level": 2,
          "children": {
            "Ampoule, feu de route/diurne": {
              "categoryId": 100787,
              "categoryName": "Additional Headlight/Parts",
              "level": 2,
              "children": {
                "Projecteur longue portée / composants": {
                  "categoryId": null,
                  "categoryName": "Projecteur longue portée / composants",
                  "level": 4,
                  "children": {
                    "Ampoule, feu de route/diurne": {
                      "categoryId": 100276,
                      "categoryName": "Spotlight/Parts",
                      "level": 3,
                      "children": {
                        "Ampoule /projecteur longue portée": {
                          "categoryId": null,
                          "categoryName": "Ampoule /projecteur longue portée",
                          "level": 6,
                          "children": {
                            "Ampoule, feu de route/diurne": {
                              "categoryId": 100442,
                              "categoryName": "Spotlight Bulb",
                              "level": 4,
                              "children": [],
                              "productId": 60366
                            }
                          }
                        }
                      },
                      "productId": 60366
                    }
                  }
                }
              },
              "productId": 60366
            },
            "Ampoule, feu de route/diurne/position": {
              "categoryId": 100787,
              "categoryName": "Additional Headlight/Parts",
              "level": 2,
              "children": {
                "Projecteur longue portée / composants": {
                  "categoryId": null,
                  "categoryName": "Projecteur longue portée / composants",
                  "level": 4,
                  "children": {
                    "Ampoule, feu de route/diurne/position": {
                      "categoryId": 100276,
                      "categoryName": "Spotlight/Parts",
                      "level": 3,
                      "children": {
                        "Ampoule /projecteur longue portée": {
                          "categoryId": null,
                          "categoryName": "Ampoule /projecteur longue portée",
                          "level": 6,
                          "children": {
                            "Ampoule, feu de route/diurne/position": {
                              "categoryId": 100442,
                              "categoryName": "Spotlight Bulb",
                              "level": 4,
                              "children": [],
                              "productId": 60365
                            }
                          }
                        }
                      },
                      "productId": 60365
                    }
                  }
                }
              },
              "productId": 60365
            },
            "Ampoule, projecteur longue portée": {
              "categoryId": 100787,
              "categoryName": "Additional Headlight/Parts",
              "level": 2,
              "children": {
                "Projecteur longue portée / composants": {
                  "categoryId": null,
                  "categoryName": "Projecteur longue portée / composants",
                  "level": 4,
                  "children": {
                    "Ampoule, projecteur longue portée": {
                      "categoryId": 100276,
                      "categoryName": "Spotlight/Parts",
                      "level": 3,
                      "children": {
                        "Ampoule /projecteur longue portée": {
                          "categoryId": null,
                          "categoryName": "Ampoule /projecteur longue portée",
                          "level": 6,
                          "children": {
                            "Ampoule, projecteur longue portée": {
                              "categoryId": 100442,
                              "categoryName": "Spotlight Bulb",
                              "level": 4,
                              "children": [],
                              "productId": 106
                            }
                          }
                        }
                      },
                      "productId": 106
                    }
                  }
                }
              },
              "productId": 106
            }
          }
        },
        "Projecteurs principaux / composants": {
          "categoryId": null,
          "categoryName": "Projecteurs principaux / composants",
          "level": 2,
          "children": {
            "Ampoule, feu de route/diurne": {
              "categoryId": 100143,
              "categoryName": "Headlight/Parts",
              "level": 2,
              "children": {
                "Ampoule /projecteur longue portée": {
                  "categoryId": null,
                  "categoryName": "Ampoule /projecteur longue portée",
                  "level": 4,
                  "children": {
                    "Ampoule, feu de route/diurne": {
                      "categoryId": 706742,
                      "categoryName": "Spotlight Bulb",
                      "level": 3,
                      "children": [],
                      "productId": 60366
                    }
                  }
                }
              },
              "productId": 60366
            },
            "Ampoule, feu de route/diurne/position": {
              "categoryId": 100143,
              "categoryName": "Headlight/Parts",
              "level": 2,
              "children": {
                "Ampoule /projecteur longue portée": {
                  "categoryId": null,
                  "categoryName": "Ampoule /projecteur longue portée",
                  "level": 4,
                  "children": {
                    "Ampoule, feu de route/diurne/position": {
                      "categoryId": 706742,
                      "categoryName": "Spotlight Bulb",
                      "level": 3,
                      "children": [],
                      "productId": 60365
                    }
                  }
                }
              },
              "productId": 60365
            },
            "Ampoule, projecteur longue portée": {
              "categoryId": 100143,
              "categoryName": "Headlight/Parts",
              "level": 2,
              "children": {
                "Ampoule /projecteur longue portée": {
                  "categoryId": null,
                  "categoryName": "Ampoule /projecteur longue portée",
                  "level": 4,
                  "children": {
                    "Ampoule, projecteur longue portée": {
                      "categoryId": 706742,
                      "categoryName": "Spotlight Bulb",
                      "level": 3,
                      "children": [],
                      "productId": 106
                    }
                  }
                }
              },
              "productId": 106
            }
          }
        }
      }
    }
  },
  "arborescenceText": "├── Carrosserie [ID: 100001] (Niveau 1)\n│   ├── Avant du véhicule (Niveau 2)\n│   │   ├── Vehicle Front [ID: 101648] (Niveau 2) → ProductId: 60366\n│   │   │   └── Projecteur longue portée / composants (Niveau 4)\n│   │   │       └── Spotlight/Parts [ID: 101665] (Niveau 3) → ProductId: 60366\n│   │   │           └── Ampoule /projecteur longue portée (Niveau 6)\n│   │   │               └── Spotlight Bulb [ID: 101667] (Niveau 4) → ProductId: 60366\n│   │   ├── Vehicle Front [ID: 101648] (Niveau 2) → ProductId: 60365\n│   │   │   └── Projecteur longue portée / composants (Niveau 4)\n│   │   │       └── Spotlight/Parts [ID: 101665] (Niveau 3) → ProductId: 60365\n│   │   │           └── Ampoule /projecteur longue portée (Niveau 6)\n│   │   │               └── Spotlight Bulb [ID: 101667] (Niveau 4) → ProductId: 60365\n│   │   └── Vehicle Front [ID: 101648] (Niveau 2) → ProductId: 106\n│   │       └── Projecteur longue portée / composants (Niveau 4)\n│   │           └── Spotlight/Parts [ID: 101665] (Niveau 3) → ProductId: 106\n│   │               └── Ampoule /projecteur longue portée (Niveau 6)\n│   │                   └── Spotlight Bulb [ID: 101667] (Niveau 4) → ProductId: 106\n│   └── Phares supplémentaires/composants (Niveau 2)\n│       ├── Additional Headlight/Parts [ID: 101340] (Niveau 2) → ProductId: 60366\n│       │   └── Projecteur longue portée / composants (Niveau 4)\n│       │       └── Spotlight/Parts [ID: 101345] (Niveau 3) → ProductId: 60366\n│       │           └── Ampoule /projecteur longue portée (Niveau 6)\n│       │               └── Spotlight Bulb [ID: 101347] (Niveau 4) → ProductId: 60366\n│       ├── Additional Headlight/Parts [ID: 101340] (Niveau 2) → ProductId: 60365\n│       │   └── Projecteur longue portée / composants (Niveau 4)\n│       │       └── Spotlight/Parts [ID: 101345] (Niveau 3) → ProductId: 60365\n│       │           └── Ampoule /projecteur longue portée (Niveau 6)\n│       │               └── Spotlight Bulb [ID: 101347] (Niveau 4) → ProductId: 60365\n│       └── Additional Headlight/Parts [ID: 101340] (Niveau 2) → ProductId: 106\n│           └── Projecteur longue portée / composants (Niveau 4)\n│               └── Spotlight/Parts [ID: 101345] (Niveau 3) → ProductId: 106\n│                   └── Ampoule /projecteur longue portée (Niveau 6)\n│                       └── Spotlight Bulb [ID: 101347] (Niveau 4) → ProductId: 106\n\n└── Système électrique [ID: 100010] (Niveau 1)\n    ├── Phares supplémentaires/composants (Niveau 2)\n    │   ├── Additional Headlight/Parts [ID: 100787] (Niveau 2) → ProductId: 60366\n    │   │   └── Projecteur longue portée / composants (Niveau 4)\n    │   │       └── Spotlight/Parts [ID: 100276] (Niveau 3) → ProductId: 60366\n    │   │           └── Ampoule /projecteur longue portée (Niveau 6)\n    │   │               └── Spotlight Bulb [ID: 100442] (Niveau 4) → ProductId: 60366\n    │   ├── Additional Headlight/Parts [ID: 100787] (Niveau 2) → ProductId: 60365\n    │   │   └── Projecteur longue portée / composants (Niveau 4)\n    │   │       └── Spotlight/Parts [ID: 100276] (Niveau 3) → ProductId: 60365\n    │   │           └── Ampoule /projecteur longue portée (Niveau 6)\n    │   │               └── Spotlight Bulb [ID: 100442] (Niveau 4) → ProductId: 60365\n    │   └── Additional Headlight/Parts [ID: 100787] (Niveau 2) → ProductId: 106\n    │       └── Projecteur longue portée / composants (Niveau 4)\n    │           └── Spotlight/Parts [ID: 100276] (Niveau 3) → ProductId: 106\n    │               └── Ampoule /projecteur longue portée (Niveau 6)\n    │                   └── Spotlight Bulb [ID: 100442] (Niveau 4) → ProductId: 106\n    └── Projecteurs principaux / composants (Niveau 2)\n        ├── Headlight/Parts [ID: 100143] (Niveau 2) → ProductId: 60366\n        │   └── Ampoule /projecteur longue portée (Niveau 4)\n        │       └── Spotlight Bulb [ID: 706742] (Niveau 3) → ProductId: 60366\n        ├── Headlight/Parts [ID: 100143] (Niveau 2) → ProductId: 60365\n        │   └── Ampoule /projecteur longue portée (Niveau 4)\n        │       └── Spotlight Bulb [ID: 706742] (Niveau 3) → ProductId: 60365\n        └── Headlight/Parts [ID: 100143] (Niveau 2) → ProductId: 106\n            └── Ampoule /projecteur longue portée (Niveau 4)\n                └── Spotlight Bulb [ID: 706742] (Niveau 3) → ProductId: 106",
  "arborescencePaths": [
    {
      "path": [
        "Carrosserie",
        "Avant du véhicule",
        "Vehicle Front"
      ],
      "categoryIds": [
        100001,
        null,
        101648
      ],
      "finalCategoryId": 101648,
      "productId": 60366
    },
    {
      "path": [
        "Carrosserie",
        "Avant du véhicule",
        "Vehicle Front"
      ],
      "categoryIds": [
        100001,
        null,
        101648
      ],
      "finalCategoryId": 101648,
      "productId": 60365
    },
    {
      "path": [
        "Carrosserie",
        "Avant du véhicule",
        "Vehicle Front"
      ],
      "categoryIds": [
        100001,
        null,
        101648
      ],
      "finalCategoryId": 101648,
      "productId": 106
    },
    {
      "path": [
        "Carrosserie",
        "Phares supplémentaires/composants",
        "Additional Headlight/Parts"
      ],
      "categoryIds": [
        100001,
        null,
        101340
      ],
      "finalCategoryId": 101340,
      "productId": 60366
    },
    {
      "path": [
        "Carrosserie",
        "Phares supplémentaires/composants",
        "Additional Headlight/Parts"
      ],
      "categoryIds": [
        100001,
        null,
        101340
      ],
      "finalCategoryId": 101340,
      "productId": 60365
    },
    {
      "path": [
        "Carrosserie",
        "Phares supplémentaires/composants",
        "Additional Headlight/Parts"
      ],
      "categoryIds": [
        100001,
        null,
        101340
      ],
      "finalCategoryId": 101340,
      "productId": 106
    },
    {
      "path": [
        "Système électrique",
        "Phares supplémentaires/composants",
        "Additional Headlight/Parts"
      ],
      "categoryIds": [
        100010,
        null,
        100787
      ],
      "finalCategoryId": 100787,
      "productId": 60366
    },
    {
      "path": [
        "Système électrique",
        "Phares supplémentaires/composants",
        "Additional Headlight/Parts"
      ],
      "categoryIds": [
        100010,
        null,
        100787
      ],
      "finalCategoryId": 100787,
      "productId": 60365
    },
    {
      "path": [
        "Système électrique",
        "Phares supplémentaires/composants",
        "Additional Headlight/Parts"
      ],
      "categoryIds": [
        100010,
        null,
        100787
      ],
      "finalCategoryId": 100787,
      "productId": 106
    },
    {
      "path": [
        "Système électrique",
        "Projecteurs principaux / composants",
        "Headlight/Parts"
      ],
      "categoryIds": [
        100010,
        null,
        100143
      ],
      "finalCategoryId": 100143,
      "productId": 60366
    },
    {
      "path": [
        "Système électrique",
        "Projecteurs principaux / composants",
        "Headlight/Parts"
      ],
      "categoryIds": [
        100010,
        null,
        100143
      ],
      "finalCategoryId": 100143,
      "productId": 60365
    },
    {
      "path": [
        "Système électrique",
        "Projecteurs principaux / composants",
        "Headlight/Parts"
      ],
      "categoryIds": [
        100010,
        null,
        100143
      ],
      "finalCategoryId": 100143,
      "productId": 106
    }
  ],
  "productIdsInArbo": [
    106,
    60365,
    60366
  ],
  "matchedProductIds": [
    106
  ]
}