{
  "productName": "Ampoule, projecteur de travail",
  "searchText": "Ampoule, projecteur de travail",
  "found": true,
  "hasMatch": true,
  "timestamp": "2025-12-02T18:50:32.486Z",
  "productId": 104,
  "arborescence": {
    "Carrosserie": {
      "categoryId": 100001,
      "categoryName": "Carrosserie",
      "level": 1,
      "children": {
        "Phares supplémentaires/composants": {
          "categoryId": null,
          "categoryName": "Phares supplémentaires/composants",
          "level": 2,
          "children": {
            "Ampoule, projecteur de travail": {
              "categoryId": 101340,
              "categoryName": "Additional Headlight/Parts",
              "level": 2,
              "children": {
                "Projecteur de travail, composants": {
                  "categoryId": null,
                  "categoryName": "Projecteur de travail, composants",
                  "level": 4,
                  "children": {
                    "Ampoule, projecteur de travail": {
                      "categoryId": 101349,
                      "categoryName": "Worklight/Parts",
                      "level": 3,
                      "children": {
                        "Ampoule, projecteurs de travail": {
                          "categoryId": null,
                          "categoryName": "Ampoule, projecteurs de travail",
                          "level": 6,
                          "children": {
                            "Ampoule, projecteur de travail": {
                              "categoryId": 101351,
                              "categoryName": "Worklight Bulb",
                              "level": 4,
                              "children": [],
                              "productId": 104
                            }
                          }
                        }
                      },
                      "productId": 104
                    }
                  }
                }
              },
              "productId": 104
            }
          }
        }
      }
    },
    "Système électrique": {
      "categoryId": 100010,
      "categoryName": "Système électrique",
      "level": 1,
      "children": {
        "Phares supplémentaires/composants": {
          "categoryId": null,
          "categoryName": "Phares supplémentaires/composants",
          "level": 2,
          "children": {
            "Ampoule, projecteur de travail": {
              "categoryId": 100787,
              "categoryName": "Additional Headlight/Parts",
              "level": 2,
              "children": {
                "Projecteur de travail, composants": {
                  "categoryId": null,
                  "categoryName": "Projecteur de travail, composants",
                  "level": 4,
                  "children": {
                    "Ampoule, projecteur de travail": {
                      "categoryId": 100280,
                      "categoryName": "Worklight/Parts",
                      "level": 3,
                      "children": {
                        "Ampoule, projecteurs de travail": {
                          "categoryId": null,
                          "categoryName": "Ampoule, projecteurs de travail",
                          "level": 6,
                          "children": {
                            "Ampoule, projecteur de travail": {
                              "categoryId": 100448,
                              "categoryName": "Worklight Bulb",
                              "level": 4,
                              "children": [],
                              "productId": 104
                            }
                          }
                        }
                      },
                      "productId": 104
                    }
                  }
                }
              },
              "productId": 104
            }
          }
        }
      }
    }
  },
  "arborescenceText": "├── Carrosserie [ID: 100001] (Niveau 1)\n│   └── Phares supplémentaires/composants (Niveau 2)\n│       └── Additional Headlight/Parts [ID: 101340] (Niveau 2) → ProductId: 104\n│           └── Projecteur de travail, composants (Niveau 4)\n│               └── Worklight/Parts [ID: 101349] (Niveau 3) → ProductId: 104\n│                   └── Ampoule, projecteurs de travail (Niveau 6)\n│                       └── Worklight Bulb [ID: 101351] (Niveau 4) → ProductId: 104\n\n└── Système électrique [ID: 100010] (Niveau 1)\n    └── Phares supplémentaires/composants (Niveau 2)\n        └── Additional Headlight/Parts [ID: 100787] (Niveau 2) → ProductId: 104\n            └── Projecteur de travail, composants (Niveau 4)\n                └── Worklight/Parts [ID: 100280] (Niveau 3) → ProductId: 104\n                    └── Ampoule, projecteurs de travail (Niveau 6)\n                        └── Worklight Bulb [ID: 100448] (Niveau 4) → ProductId: 104",
  "arborescencePaths": [
    {
      "path": [
        "Carrosserie",
        "Phares supplémentaires/composants",
        "Additional Headlight/Parts"
      ],
      "categoryIds": [
        100001,
        null,
        101340
      ],
      "finalCategoryId": 101340,
      "productId": 104
    },
    {
      "path": [
        "Système électrique",
        "Phares supplémentaires/composants",
        "Additional Headlight/Parts"
      ],
      "categoryIds": [
        100010,
        null,
        100787
      ],
      "finalCategoryId": 100787,
      "productId": 104
    }
  ],
  "productIdsInArbo": [
    104
  ],
  "matchedProductIds": [
    104
  ]
}