{
  "productName": "Ampoule, feu clignotant",
  "searchText": "Ampoule, feu clignotant",
  "found": true,
  "hasMatch": true,
  "timestamp": "2025-12-02T18:50:15.692Z",
  "productId": 105,
  "arborescence": {
    "Carrosserie": {
      "categoryId": 100001,
      "categoryName": "Carrosserie",
      "level": 1,
      "children": {
        "Arrière de la voiture": {
          "categoryId": null,
          "categoryName": "Arrière de la voiture",
          "level": 2,
          "children": {
            "Ampoule, feu clignotant": {
              "categoryId": 101705,
              "categoryName": "Vehicle Rear",
              "level": 2,
              "children": {
                "Feu clignotant/composants": {
                  "categoryId": null,
                  "categoryName": "Feu clignotant/composants",
                  "level": 4,
                  "children": {
                    "Ampoule, feu clignotant": {
                      "categoryId": 101727,
                      "categoryName": "Direction Indicator/Parts",
                      "level": 3,
                      "children": {
                        "Ampoule de feu clignotant": {
                          "categoryId": null,
                          "categoryName": "Ampoule de feu clignotant",
                          "level": 6,
                          "children": {
                            "Ampoule, feu clignotant": {
                              "categoryId": 101730,
                              "categoryName": "Indicator Bulb",
                              "level": 4,
                              "children": [],
                              "productId": 105
                            }
                          }
                        }
                      },
                      "productId": 105
                    }
                  }
                }
              },
              "productId": 105
            },
            "Ampoule, feu clignotant/feu-position avant": {
              "categoryId": 101705,
              "categoryName": "Vehicle Rear",
              "level": 2,
              "children": {
                "Feu clignotant/composants": {
                  "categoryId": null,
                  "categoryName": "Feu clignotant/composants",
                  "level": 4,
                  "children": {
                    "Ampoule, feu clignotant/feu-position avant": {
                      "categoryId": 101727,
                      "categoryName": "Direction Indicator/Parts",
                      "level": 3,
                      "children": {
                        "Feu clignotant": {
                          "categoryId": null,
                          "categoryName": "Feu clignotant",
                          "level": 6,
                          "children": {
                            "Ampoule, feu clignotant/feu-position avant": {
                              "categoryId": 101728,
                              "categoryName": "Direction Indicator",
                              "level": 4,
                              "children": [],
                              "productId": 3193
                            }
                          }
                        }
                      },
                      "productId": 3193
                    }
                  }
                },
                "Feu de position / d'encombrement / composants": {
                  "categoryId": null,
                  "categoryName": "Feu de position / d'encombrement / composants",
                  "level": 4,
                  "children": {
                    "Ampoule, feu clignotant/feu-position avant": {
                      "categoryId": 101785,
                      "categoryName": "Side Marker/End Outline Marker Light/Parts",
                      "level": 3,
                      "children": {
                        "Feu d'encombrement": {
                          "categoryId": null,
                          "categoryName": "Feu d'encombrement",
                          "level": 6,
                          "children": {
                            "Ampoule, feu clignotant/feu-position avant": {
                              "categoryId": 101787,
                              "categoryName": "End Outline Marker Light",
                              "level": 4,
                              "children": [],
                              "productId": 3193
                            }
                          }
                        }
                      },
                      "productId": 3193
                    }
                  }
                }
              },
              "productId": 3193
            }
          }
        },
        "Avant du véhicule": {
          "categoryId": null,
          "categoryName": "Avant du véhicule",
          "level": 2,
          "children": {
            "Ampoule, feu clignotant": {
              "categoryId": 101648,
              "categoryName": "Vehicle Front",
              "level": 2,
              "children": {
                "Feu clignotant/composants": {
                  "categoryId": null,
                  "categoryName": "Feu clignotant/composants",
                  "level": 4,
                  "children": {
                    "Ampoule, feu clignotant": {
                      "categoryId": 101669,
                      "categoryName": "Direction Indicator/Parts",
                      "level": 3,
                      "children": {
                        "Ampoule de feu clignotant": {
                          "categoryId": null,
                          "categoryName": "Ampoule de feu clignotant",
                          "level": 6,
                          "children": {
                            "Ampoule, feu clignotant": {
                              "categoryId": 101672,
                              "categoryName": "Indicator Bulb",
                              "level": 4,
                              "children": [],
                              "productId": 105
                            }
                          }
                        }
                      },
                      "productId": 105
                    }
                  }
                }
              },
              "productId": 105
            },
            "Ampoule, feu clignotant/feu-position avant": {
              "categoryId": 101648,
              "categoryName": "Vehicle Front",
              "level": 2,
              "children": {
                "Feu clignotant/composants": {
                  "categoryId": null,
                  "categoryName": "Feu clignotant/composants",
                  "level": 4,
                  "children": {
                    "Ampoule, feu clignotant/feu-position avant": {
                      "categoryId": 101669,
                      "categoryName": "Direction Indicator/Parts",
                      "level": 3,
                      "children": {
                        "Feu clignotant": {
                          "categoryId": null,
                          "categoryName": "Feu clignotant",
                          "level": 6,
                          "children": {
                            "Ampoule, feu clignotant/feu-position avant": {
                              "categoryId": 101670,
                              "categoryName": "Direction Indicator",
                              "level": 4,
                              "children": [],
                              "productId": 3193
                            }
                          }
                        }
                      },
                      "productId": 3193
                    }
                  }
                },
                "Feu de position / d'encombrement / composants": {
                  "categoryId": null,
                  "categoryName": "Feu de position / d'encombrement / composants",
                  "level": 4,
                  "children": {
                    "Ampoule, feu clignotant/feu-position avant": {
                      "categoryId": 101766,
                      "categoryName": "Side Marker/End Outline Marker Light/Parts",
                      "level": 3,
                      "children": {
                        "Feu d'encombrement": {
                          "categoryId": null,
                          "categoryName": "Feu d'encombrement",
                          "level": 6,
                          "children": {
                            "Ampoule, feu clignotant/feu-position avant": {
                              "categoryId": 101768,
                              "categoryName": "End Outline Marker Light",
                              "level": 4,
                              "children": [],
                              "productId": 3193
                            }
                          }
                        }
                      },
                      "productId": 3193
                    }
                  }
                }
              },
              "productId": 3193
            }
          }
        },
        "Feux": {
          "categoryId": null,
          "categoryName": "Feux",
          "level": 2,
          "children": {
            "Ampoule, feu clignotant": {
              "categoryId": 101407,
              "categoryName": "Lights",
              "level": 2,
              "children": {
                "Feu clignotant/composants": {
                  "categoryId": null,
                  "categoryName": "Feu clignotant/composants",
                  "level": 4,
                  "children": {
                    "Ampoule, feu clignotant": {
                      "categoryId": 101420,
                      "categoryName": "Direction Indicator/Parts",
                      "level": 3,
                      "children": {
                        "Ampoule de feu clignotant": {
                          "categoryId": null,
                          "categoryName": "Ampoule de feu clignotant",
                          "level": 6,
                          "children": {
                            "Ampoule, feu clignotant": {
                              "categoryId": 101423,
                              "categoryName": "Indicator Bulb",
                              "level": 4,
                              "children": [],
                              "productId": 105
                            }
                          }
                        }
                      },
                      "productId": 105
                    }
                  }
                }
              },
              "productId": 105
            },
            "Ampoule, feu clignotant/feu-position avant": {
              "categoryId": 101407,
              "categoryName": "Lights",
              "level": 2,
              "children": {
                "Feu clignotant/composants": {
                  "categoryId": null,
                  "categoryName": "Feu clignotant/composants",
                  "level": 4,
                  "children": {
                    "Ampoule, feu clignotant/feu-position avant": {
                      "categoryId": 101420,
                      "categoryName": "Direction Indicator/Parts",
                      "level": 3,
                      "children": {
                        "Feu clignotant": {
                          "categoryId": null,
                          "categoryName": "Feu clignotant",
                          "level": 6,
                          "children": {
                            "Ampoule, feu clignotant/feu-position avant": {
                              "categoryId": 101421,
                              "categoryName": "Direction Indicator",
                              "level": 4,
                              "children": [],
                              "productId": 3193
                            }
                          }
                        }
                      },
                      "productId": 3193
                    }
                  }
                },
                "Feu de position / d'encombrement / composants": {
                  "categoryId": null,
                  "categoryName": "Feu de position / d'encombrement / composants",
                  "level": 4,
                  "children": {
                    "Ampoule, feu clignotant/feu-position avant": {
                      "categoryId": 101441,
                      "categoryName": "Side Marker/End Outline Marker Light/Parts",
                      "level": 3,
                      "children": {
                        "Feu d'encombrement": {
                          "categoryId": null,
                          "categoryName": "Feu d'encombrement",
                          "level": 6,
                          "children": {
                            "Ampoule, feu clignotant/feu-position avant": {
                              "categoryId": 101443,
                              "categoryName": "End Outline Marker Light",
                              "level": 4,
                              "children": [],
                              "productId": 3193
                            }
                          }
                        }
                      },
                      "productId": 3193
                    }
                  }
                }
              },
              "productId": 3193
            }
          }
        }
      }
    },
    "Système électrique": {
      "categoryId": 100010,
      "categoryName": "Système électrique",
      "level": 1,
      "children": {
        "Feux": {
          "categoryId": null,
          "categoryName": "Feux",
          "level": 2,
          "children": {
            "Ampoule, feu clignotant": {
              "categoryId": 100043,
              "categoryName": "Lights",
              "level": 2,
              "children": {
                "Feu arrière / composants": {
                  "categoryId": null,
                  "categoryName": "Feu arrière / composants",
                  "level": 4,
                  "children": {
                    "Ampoule, feu clignotant": {
                      "categoryId": 100275,
                      "categoryName": "Tail Light Assembly/Parts",
                      "level": 3,
                      "children": {
                        "Ampoule pour feux arrières": {
                          "categoryId": null,
                          "categoryName": "Ampoule pour feux arrières",
                          "level": 6,
                          "children": {
                            "Ampoule, feu clignotant": {
                              "categoryId": 101495,
                              "categoryName": "Tail Light Assembly Bulb",
                              "level": 4,
                              "children": [],
                              "productId": 105
                            }
                          }
                        }
                      },
                      "productId": 105
                    }
                  }
                },
                "Feu clignotant/composants": {
                  "categoryId": null,
                  "categoryName": "Feu clignotant/composants",
                  "level": 4,
                  "children": {
                    "Ampoule, feu clignotant": {
                      "categoryId": 100145,
                      "categoryName": "Direction Indicator/Parts",
                      "level": 3,
                      "children": {
                        "Ampoule de feu clignotant": {
                          "categoryId": null,
                          "categoryName": "Ampoule de feu clignotant",
                          "level": 6,
                          "children": {
                            "Ampoule, feu clignotant": {
                              "categoryId": 100498,
                              "categoryName": "Indicator Bulb",
                              "level": 4,
                              "children": [],
                              "productId": 105
                            }
                          }
                        }
                      },
                      "productId": 105
                    }
                  }
                }
              },
              "productId": 105
            },
            "Ampoule, feu clignotant/feu-position avant": {
              "categoryId": 100043,
              "categoryName": "Lights",
              "level": 2,
              "children": {
                "Feu clignotant/composants": {
                  "categoryId": null,
                  "categoryName": "Feu clignotant/composants",
                  "level": 4,
                  "children": {
                    "Ampoule, feu clignotant/feu-position avant": {
                      "categoryId": 100145,
                      "categoryName": "Direction Indicator/Parts",
                      "level": 3,
                      "children": {
                        "Feu clignotant": {
                          "categoryId": null,
                          "categoryName": "Feu clignotant",
                          "level": 6,
                          "children": {
                            "Ampoule, feu clignotant/feu-position avant": {
                              "categoryId": 100463,
                              "categoryName": "Direction Indicator",
                              "level": 4,
                              "children": [],
                              "productId": 3193
                            }
                          }
                        }
                      },
                      "productId": 3193
                    }
                  }
                },
                "Feu de position / d'encombrement / composants": {
                  "categoryId": null,
                  "categoryName": "Feu de position / d'encombrement / composants",
                  "level": 4,
                  "children": {
                    "Ampoule, feu clignotant/feu-position avant": {
                      "categoryId": 100290,
                      "categoryName": "Side Marker/End Outline Marker Light/Parts",
                      "level": 3,
                      "children": {
                        "Feu d'encombrement": {
                          "categoryId": null,
                          "categoryName": "Feu d'encombrement",
                          "level": 6,
                          "children": {
                            "Ampoule, feu clignotant/feu-position avant": {
                              "categoryId": 100469,
                              "categoryName": "End Outline Marker Light",
                              "level": 4,
                              "children": [],
                              "productId": 3193
                            }
                          }
                        }
                      },
                      "productId": 3193
                    }
                  }
                }
              },
              "productId": 3193
            }
          }
        }
      }
    }
  },
  "arborescenceText": "├── Carrosserie [ID: 100001] (Niveau 1)\n│   ├── Arrière de la voiture (Niveau 2)\n│   │   ├── Vehicle Rear [ID: 101705] (Niveau 2) → ProductId: 105\n│   │   │   └── Feu clignotant/composants (Niveau 4)\n│   │   │       └── Direction Indicator/Parts [ID: 101727] (Niveau 3) → ProductId: 105\n│   │   │           └── Ampoule de feu clignotant (Niveau 6)\n│   │   │               └── Indicator Bulb [ID: 101730] (Niveau 4) → ProductId: 105\n│   │   └── Vehicle Rear [ID: 101705] (Niveau 2) → ProductId: 3193\n│   │       ├── Feu clignotant/composants (Niveau 4)\n│   │       │   └── Direction Indicator/Parts [ID: 101727] (Niveau 3) → ProductId: 3193\n│   │       │       └── Feu clignotant (Niveau 6)\n│   │       │           └── Direction Indicator [ID: 101728] (Niveau 4) → ProductId: 3193\n│   │       └── Feu de position / d'encombrement / composants (Niveau 4)\n│   │           └── Side Marker/End Outline Marker Light/Parts [ID: 101785] (Niveau 3) → ProductId: 3193\n│   │               └── Feu d'encombrement (Niveau 6)\n│   │                   └── End Outline Marker Light [ID: 101787] (Niveau 4) → ProductId: 3193\n│   ├── Avant du véhicule (Niveau 2)\n│   │   ├── Vehicle Front [ID: 101648] (Niveau 2) → ProductId: 105\n│   │   │   └── Feu clignotant/composants (Niveau 4)\n│   │   │       └── Direction Indicator/Parts [ID: 101669] (Niveau 3) → ProductId: 105\n│   │   │           └── Ampoule de feu clignotant (Niveau 6)\n│   │   │               └── Indicator Bulb [ID: 101672] (Niveau 4) → ProductId: 105\n│   │   └── Vehicle Front [ID: 101648] (Niveau 2) → ProductId: 3193\n│   │       ├── Feu clignotant/composants (Niveau 4)\n│   │       │   └── Direction Indicator/Parts [ID: 101669] (Niveau 3) → ProductId: 3193\n│   │       │       └── Feu clignotant (Niveau 6)\n│   │       │           └── Direction Indicator [ID: 101670] (Niveau 4) → ProductId: 3193\n│   │       └── Feu de position / d'encombrement / composants (Niveau 4)\n│   │           └── Side Marker/End Outline Marker Light/Parts [ID: 101766] (Niveau 3) → ProductId: 3193\n│   │               └── Feu d'encombrement (Niveau 6)\n│   │                   └── End Outline Marker Light [ID: 101768] (Niveau 4) → ProductId: 3193\n│   └── Feux (Niveau 2)\n│       ├── Lights [ID: 101407] (Niveau 2) → ProductId: 105\n│       │   └── Feu clignotant/composants (Niveau 4)\n│       │       └── Direction Indicator/Parts [ID: 101420] (Niveau 3) → ProductId: 105\n│       │           └── Ampoule de feu clignotant (Niveau 6)\n│       │               └── Indicator Bulb [ID: 101423] (Niveau 4) → ProductId: 105\n│       └── Lights [ID: 101407] (Niveau 2) → ProductId: 3193\n│           ├── Feu clignotant/composants (Niveau 4)\n│           │   └── Direction Indicator/Parts [ID: 101420] (Niveau 3) → ProductId: 3193\n│           │       └── Feu clignotant (Niveau 6)\n│           │           └── Direction Indicator [ID: 101421] (Niveau 4) → ProductId: 3193\n│           └── Feu de position / d'encombrement / composants (Niveau 4)\n│               └── Side Marker/End Outline Marker Light/Parts [ID: 101441] (Niveau 3) → ProductId: 3193\n│                   └── Feu d'encombrement (Niveau 6)\n│                       └── End Outline Marker Light [ID: 101443] (Niveau 4) → ProductId: 3193\n\n└── Système électrique [ID: 100010] (Niveau 1)\n    └── Feux (Niveau 2)\n        ├── Lights [ID: 100043] (Niveau 2) → ProductId: 105\n        │   ├── Feu arrière / composants (Niveau 4)\n        │   │   └── Tail Light Assembly/Parts [ID: 100275] (Niveau 3) → ProductId: 105\n        │   │       └── Ampoule pour feux arrières (Niveau 6)\n        │   │           └── Tail Light Assembly Bulb [ID: 101495] (Niveau 4) → ProductId: 105\n        │   └── Feu clignotant/composants (Niveau 4)\n        │       └── Direction Indicator/Parts [ID: 100145] (Niveau 3) → ProductId: 105\n        │           └── Ampoule de feu clignotant (Niveau 6)\n        │               └── Indicator Bulb [ID: 100498] (Niveau 4) → ProductId: 105\n        └── Lights [ID: 100043] (Niveau 2) → ProductId: 3193\n            ├── Feu clignotant/composants (Niveau 4)\n            │   └── Direction Indicator/Parts [ID: 100145] (Niveau 3) → ProductId: 3193\n            │       └── Feu clignotant (Niveau 6)\n            │           └── Direction Indicator [ID: 100463] (Niveau 4) → ProductId: 3193\n            └── Feu de position / d'encombrement / composants (Niveau 4)\n                └── Side Marker/End Outline Marker Light/Parts [ID: 100290] (Niveau 3) → ProductId: 3193\n                    └── Feu d'encombrement (Niveau 6)\n                        └── End Outline Marker Light [ID: 100469] (Niveau 4) → ProductId: 3193",
  "arborescencePaths": [
    {
      "path": [
        "Carrosserie",
        "Arrière de la voiture",
        "Vehicle Rear"
      ],
      "categoryIds": [
        100001,
        null,
        101705
      ],
      "finalCategoryId": 101705,
      "productId": 105
    },
    {
      "path": [
        "Carrosserie",
        "Arrière de la voiture",
        "Vehicle Rear"
      ],
      "categoryIds": [
        100001,
        null,
        101705
      ],
      "finalCategoryId": 101705,
      "productId": 3193
    },
    {
      "path": [
        "Carrosserie",
        "Avant du véhicule",
        "Vehicle Front"
      ],
      "categoryIds": [
        100001,
        null,
        101648
      ],
      "finalCategoryId": 101648,
      "productId": 105
    },
    {
      "path": [
        "Carrosserie",
        "Avant du véhicule",
        "Vehicle Front"
      ],
      "categoryIds": [
        100001,
        null,
        101648
      ],
      "finalCategoryId": 101648,
      "productId": 3193
    },
    {
      "path": [
        "Carrosserie",
        "Feux",
        "Lights"
      ],
      "categoryIds": [
        100001,
        null,
        101407
      ],
      "finalCategoryId": 101407,
      "productId": 105
    },
    {
      "path": [
        "Carrosserie",
        "Feux",
        "Lights"
      ],
      "categoryIds": [
        100001,
        null,
        101407
      ],
      "finalCategoryId": 101407,
      "productId": 3193
    },
    {
      "path": [
        "Système électrique",
        "Feux",
        "Lights"
      ],
      "categoryIds": [
        100010,
        null,
        100043
      ],
      "finalCategoryId": 100043,
      "productId": 105
    },
    {
      "path": [
        "Système électrique",
        "Feux",
        "Lights"
      ],
      "categoryIds": [
        100010,
        null,
        100043
      ],
      "finalCategoryId": 100043,
      "productId": 3193
    }
  ],
  "productIdsInArbo": [
    105,
    3193
  ],
  "matchedProductIds": [
    105
  ]
}