{
  "productName": "Ampoule, projecteur antibrouillard",
  "searchText": "Ampoule, projecteur antibrouillard",
  "found": true,
  "hasMatch": true,
  "timestamp": "2025-12-02T18:50:30.073Z",
  "productId": 108,
  "arborescence": {
    "Carrosserie": {
      "categoryId": 100001,
      "categoryName": "Carrosserie",
      "level": 1,
      "children": {
        "Avant du véhicule": {
          "categoryId": null,
          "categoryName": "Avant du véhicule",
          "level": 2,
          "children": {
            "Ampoule, projecteur antibrouillard": {
              "categoryId": 101648,
              "categoryName": "Vehicle Front",
              "level": 2,
              "children": {
                "Projecteur antibrouillard/ composants": {
                  "categoryId": null,
                  "categoryName": "Projecteur antibrouillard/ composants",
                  "level": 4,
                  "children": {
                    "Ampoule, projecteur antibrouillard": {
                      "categoryId": 101661,
                      "categoryName": "Front Fog Light/Parts",
                      "level": 3,
                      "children": {
                        "Ampoule pour projecteur antibrouillard": {
                          "categoryId": null,
                          "categoryName": "Ampoule pour projecteur antibrouillard",
                          "level": 6,
                          "children": {
                            "Ampoule, projecteur antibrouillard": {
                              "categoryId": 101663,
                              "categoryName": "Fog Light Bulb",
                              "level": 4,
                              "children": [],
                              "productId": 108
                            }
                          }
                        }
                      },
                      "productId": 108
                    }
                  }
                }
              },
              "productId": 108
            }
          }
        },
        "Phares supplémentaires/composants": {
          "categoryId": null,
          "categoryName": "Phares supplémentaires/composants",
          "level": 2,
          "children": {
            "Ampoule, projecteur antibrouillard": {
              "categoryId": 101340,
              "categoryName": "Additional Headlight/Parts",
              "level": 2,
              "children": {
                "Projecteur antibrouillard/ composants": {
                  "categoryId": null,
                  "categoryName": "Projecteur antibrouillard/ composants",
                  "level": 4,
                  "children": {
                    "Ampoule, projecteur antibrouillard": {
                      "categoryId": 101341,
                      "categoryName": "Front Fog Light/Parts",
                      "level": 3,
                      "children": {
                        "Ampoule pour projecteur antibrouillard": {
                          "categoryId": null,
                          "categoryName": "Ampoule pour projecteur antibrouillard",
                          "level": 6,
                          "children": {
                            "Ampoule, projecteur antibrouillard": {
                              "categoryId": 101343,
                              "categoryName": "Fog Light Bulb",
                              "level": 4,
                              "children": [],
                              "productId": 108
                            }
                          }
                        }
                      },
                      "productId": 108
                    }
                  }
                }
              },
              "productId": 108
            }
          }
        }
      }
    },
    "Système électrique": {
      "categoryId": 100010,
      "categoryName": "Système électrique",
      "level": 1,
      "children": {
        "Phares supplémentaires/composants": {
          "categoryId": null,
          "categoryName": "Phares supplémentaires/composants",
          "level": 2,
          "children": {
            "Ampoule, projecteur antibrouillard": {
              "categoryId": 100787,
              "categoryName": "Additional Headlight/Parts",
              "level": 2,
              "children": {
                "Projecteur antibrouillard/ composants": {
                  "categoryId": null,
                  "categoryName": "Projecteur antibrouillard/ composants",
                  "level": 4,
                  "children": {
                    "Ampoule, projecteur antibrouillard": {
                      "categoryId": 100277,
                      "categoryName": "Front Fog Light/Parts",
                      "level": 3,
                      "children": {
                        "Ampoule pour projecteur antibrouillard": {
                          "categoryId": null,
                          "categoryName": "Ampoule pour projecteur antibrouillard",
                          "level": 6,
                          "children": {
                            "Ampoule, projecteur antibrouillard": {
                              "categoryId": 100447,
                              "categoryName": "Fog Light Bulb",
                              "level": 4,
                              "children": [],
                              "productId": 108
                            }
                          }
                        }
                      },
                      "productId": 108
                    }
                  }
                }
              },
              "productId": 108
            }
          }
        }
      }
    }
  },
  "arborescenceText": "├── Carrosserie [ID: 100001] (Niveau 1)\n│   ├── Avant du véhicule (Niveau 2)\n│   │   └── Vehicle Front [ID: 101648] (Niveau 2) → ProductId: 108\n│   │       └── Projecteur antibrouillard/ composants (Niveau 4)\n│   │           └── Front Fog Light/Parts [ID: 101661] (Niveau 3) → ProductId: 108\n│   │               └── Ampoule pour projecteur antibrouillard (Niveau 6)\n│   │                   └── Fog Light Bulb [ID: 101663] (Niveau 4) → ProductId: 108\n│   └── Phares supplémentaires/composants (Niveau 2)\n│       └── Additional Headlight/Parts [ID: 101340] (Niveau 2) → ProductId: 108\n│           └── Projecteur antibrouillard/ composants (Niveau 4)\n│               └── Front Fog Light/Parts [ID: 101341] (Niveau 3) → ProductId: 108\n│                   └── Ampoule pour projecteur antibrouillard (Niveau 6)\n│                       └── Fog Light Bulb [ID: 101343] (Niveau 4) → ProductId: 108\n\n└── Système électrique [ID: 100010] (Niveau 1)\n    └── Phares supplémentaires/composants (Niveau 2)\n        └── Additional Headlight/Parts [ID: 100787] (Niveau 2) → ProductId: 108\n            └── Projecteur antibrouillard/ composants (Niveau 4)\n                └── Front Fog Light/Parts [ID: 100277] (Niveau 3) → ProductId: 108\n                    └── Ampoule pour projecteur antibrouillard (Niveau 6)\n                        └── Fog Light Bulb [ID: 100447] (Niveau 4) → ProductId: 108",
  "arborescencePaths": [
    {
      "path": [
        "Carrosserie",
        "Avant du véhicule",
        "Vehicle Front"
      ],
      "categoryIds": [
        100001,
        null,
        101648
      ],
      "finalCategoryId": 101648,
      "productId": 108
    },
    {
      "path": [
        "Carrosserie",
        "Phares supplémentaires/composants",
        "Additional Headlight/Parts"
      ],
      "categoryIds": [
        100001,
        null,
        101340
      ],
      "finalCategoryId": 101340,
      "productId": 108
    },
    {
      "path": [
        "Système électrique",
        "Phares supplémentaires/composants",
        "Additional Headlight/Parts"
      ],
      "categoryIds": [
        100010,
        null,
        100787
      ],
      "finalCategoryId": 100787,
      "productId": 108
    }
  ],
  "productIdsInArbo": [
    108
  ],
  "matchedProductIds": [
    108
  ]
}