{
  "productName": "Ampoule, feu de brouillard arrière",
  "searchText": "Ampoule, feu de brouillard arrière",
  "found": true,
  "hasMatch": true,
  "timestamp": "2025-12-02T18:50:18.602Z",
  "productId": 113,
  "arborescence": {
    "Carrosserie": {
      "categoryId": 100001,
      "categoryName": "Carrosserie",
      "level": 1,
      "children": {
        "Arrière de la voiture": {
          "categoryId": null,
          "categoryName": "Arrière de la voiture",
          "level": 2,
          "children": {
            "Ampoule, feu de brouillard arrière": {
              "categoryId": 101705,
              "categoryName": "Vehicle Rear",
              "level": 2,
              "children": {
                "Feu de brouillard arrière/Composants": {
                  "categoryId": null,
                  "categoryName": "Feu de brouillard arrière/Composants",
                  "level": 4,
                  "children": {
                    "Ampoule, feu de brouillard arrière": {
                      "categoryId": 101735,
                      "categoryName": "Rear Fog Light/Parts",
                      "level": 3,
                      "children": {
                        "Ampoules de feu de brouillard arrière": {
                          "categoryId": null,
                          "categoryName": "Ampoules de feu de brouillard arrière",
                          "level": 6,
                          "children": {
                            "Ampoule, feu de brouillard arrière": {
                              "categoryId": 101738,
                              "categoryName": "Rear Fog Light Bulb",
                              "level": 4,
                              "children": [],
                              "productId": 113
                            }
                          }
                        }
                      },
                      "productId": 113
                    }
                  }
                }
              },
              "productId": 113
            }
          }
        },
        "Feux": {
          "categoryId": null,
          "categoryName": "Feux",
          "level": 2,
          "children": {
            "Ampoule, feu (arrière) de brouillard": {
              "categoryId": 101407,
              "categoryName": "Lights",
              "level": 2,
              "children": {
                "Feu de brouillard arrière/Composants": {
                  "categoryId": null,
                  "categoryName": "Feu de brouillard arrière/Composants",
                  "level": 4,
                  "children": {
                    "Ampoule, feu (arrière) de brouillard": {
                      "categoryId": 101428,
                      "categoryName": "Rear Fog Light/Parts",
                      "level": 3,
                      "children": {
                        "Ampoules de feu de brouillard arrière": {
                          "categoryId": null,
                          "categoryName": "Ampoules de feu de brouillard arrière",
                          "level": 6,
                          "children": {
                            "Ampoule, feu (arrière) de brouillard": {
                              "categoryId": 101431,
                              "categoryName": "Rear Fog Light Bulb",
                              "level": 4,
                              "children": [],
                              "productId": 2992
                            }
                          }
                        }
                      },
                      "productId": 2992
                    }
                  }
                }
              },
              "productId": 2992
            },
            "Ampoule, feu de brouillard arrière": {
              "categoryId": 101407,
              "categoryName": "Lights",
              "level": 2,
              "children": {
                "Feu de brouillard arrière/Composants": {
                  "categoryId": null,
                  "categoryName": "Feu de brouillard arrière/Composants",
                  "level": 4,
                  "children": {
                    "Ampoule, feu de brouillard arrière": {
                      "categoryId": 101428,
                      "categoryName": "Rear Fog Light/Parts",
                      "level": 3,
                      "children": {
                        "Ampoules de feu de brouillard arrière": {
                          "categoryId": null,
                          "categoryName": "Ampoules de feu de brouillard arrière",
                          "level": 6,
                          "children": {
                            "Ampoule, feu de brouillard arrière": {
                              "categoryId": 101431,
                              "categoryName": "Rear Fog Light Bulb",
                              "level": 4,
                              "children": [],
                              "productId": 113
                            }
                          }
                        }
                      },
                      "productId": 113
                    }
                  }
                }
              },
              "productId": 113
            }
          }
        }
      }
    },
    "Système électrique": {
      "categoryId": 100010,
      "categoryName": "Système électrique",
      "level": 1,
      "children": {
        "Feux": {
          "categoryId": null,
          "categoryName": "Feux",
          "level": 2,
          "children": {
            "Ampoule, feu (arrière) de brouillard": {
              "categoryId": 100043,
              "categoryName": "Lights",
              "level": 2,
              "children": {
                "Feu de brouillard arrière/Composants": {
                  "categoryId": null,
                  "categoryName": "Feu de brouillard arrière/Composants",
                  "level": 4,
                  "children": {
                    "Ampoule, feu (arrière) de brouillard": {
                      "categoryId": 100285,
                      "categoryName": "Rear Fog Light/Parts",
                      "level": 3,
                      "children": {
                        "Ampoules de feu de brouillard arrière": {
                          "categoryId": null,
                          "categoryName": "Ampoules de feu de brouillard arrière",
                          "level": 6,
                          "children": {
                            "Ampoule, feu (arrière) de brouillard": {
                              "categoryId": 100500,
                              "categoryName": "Rear Fog Light Bulb",
                              "level": 4,
                              "children": [],
                              "productId": 2992
                            }
                          }
                        }
                      },
                      "productId": 2992
                    }
                  }
                }
              },
              "productId": 2992
            },
            "Ampoule, feu de brouillard arrière": {
              "categoryId": 100043,
              "categoryName": "Lights",
              "level": 2,
              "children": {
                "Feu arrière / composants": {
                  "categoryId": null,
                  "categoryName": "Feu arrière / composants",
                  "level": 4,
                  "children": {
                    "Ampoule, feu de brouillard arrière": {
                      "categoryId": 100275,
                      "categoryName": "Tail Light Assembly/Parts",
                      "level": 3,
                      "children": {
                        "Ampoule pour feux arrières": {
                          "categoryId": null,
                          "categoryName": "Ampoule pour feux arrières",
                          "level": 6,
                          "children": {
                            "Ampoule, feu de brouillard arrière": {
                              "categoryId": 101495,
                              "categoryName": "Tail Light Assembly Bulb",
                              "level": 4,
                              "children": [],
                              "productId": 113
                            }
                          }
                        }
                      },
                      "productId": 113
                    }
                  }
                },
                "Feu de brouillard arrière/Composants": {
                  "categoryId": null,
                  "categoryName": "Feu de brouillard arrière/Composants",
                  "level": 4,
                  "children": {
                    "Ampoule, feu de brouillard arrière": {
                      "categoryId": 100285,
                      "categoryName": "Rear Fog Light/Parts",
                      "level": 3,
                      "children": {
                        "Ampoules de feu de brouillard arrière": {
                          "categoryId": null,
                          "categoryName": "Ampoules de feu de brouillard arrière",
                          "level": 6,
                          "children": {
                            "Ampoule, feu de brouillard arrière": {
                              "categoryId": 100500,
                              "categoryName": "Rear Fog Light Bulb",
                              "level": 4,
                              "children": [],
                              "productId": 113
                            }
                          }
                        }
                      },
                      "productId": 113
                    }
                  }
                }
              },
              "productId": 113
            }
          }
        }
      }
    }
  },
  "arborescenceText": "├── Carrosserie [ID: 100001] (Niveau 1)\n│   ├── Arrière de la voiture (Niveau 2)\n│   │   └── Vehicle Rear [ID: 101705] (Niveau 2) → ProductId: 113\n│   │       └── Feu de brouillard arrière/Composants (Niveau 4)\n│   │           └── Rear Fog Light/Parts [ID: 101735] (Niveau 3) → ProductId: 113\n│   │               └── Ampoules de feu de brouillard arrière (Niveau 6)\n│   │                   └── Rear Fog Light Bulb [ID: 101738] (Niveau 4) → ProductId: 113\n│   └── Feux (Niveau 2)\n│       ├── Lights [ID: 101407] (Niveau 2) → ProductId: 2992\n│       │   └── Feu de brouillard arrière/Composants (Niveau 4)\n│       │       └── Rear Fog Light/Parts [ID: 101428] (Niveau 3) → ProductId: 2992\n│       │           └── Ampoules de feu de brouillard arrière (Niveau 6)\n│       │               └── Rear Fog Light Bulb [ID: 101431] (Niveau 4) → ProductId: 2992\n│       └── Lights [ID: 101407] (Niveau 2) → ProductId: 113\n│           └── Feu de brouillard arrière/Composants (Niveau 4)\n│               └── Rear Fog Light/Parts [ID: 101428] (Niveau 3) → ProductId: 113\n│                   └── Ampoules de feu de brouillard arrière (Niveau 6)\n│                       └── Rear Fog Light Bulb [ID: 101431] (Niveau 4) → ProductId: 113\n\n└── Système électrique [ID: 100010] (Niveau 1)\n    └── Feux (Niveau 2)\n        ├── Lights [ID: 100043] (Niveau 2) → ProductId: 2992\n        │   └── Feu de brouillard arrière/Composants (Niveau 4)\n        │       └── Rear Fog Light/Parts [ID: 100285] (Niveau 3) → ProductId: 2992\n        │           └── Ampoules de feu de brouillard arrière (Niveau 6)\n        │               └── Rear Fog Light Bulb [ID: 100500] (Niveau 4) → ProductId: 2992\n        └── Lights [ID: 100043] (Niveau 2) → ProductId: 113\n            ├── Feu arrière / composants (Niveau 4)\n            │   └── Tail Light Assembly/Parts [ID: 100275] (Niveau 3) → ProductId: 113\n            │       └── Ampoule pour feux arrières (Niveau 6)\n            │           └── Tail Light Assembly Bulb [ID: 101495] (Niveau 4) → ProductId: 113\n            └── Feu de brouillard arrière/Composants (Niveau 4)\n                └── Rear Fog Light/Parts [ID: 100285] (Niveau 3) → ProductId: 113\n                    └── Ampoules de feu de brouillard arrière (Niveau 6)\n                        └── Rear Fog Light Bulb [ID: 100500] (Niveau 4) → ProductId: 113",
  "arborescencePaths": [
    {
      "path": [
        "Carrosserie",
        "Arrière de la voiture",
        "Vehicle Rear"
      ],
      "categoryIds": [
        100001,
        null,
        101705
      ],
      "finalCategoryId": 101705,
      "productId": 113
    },
    {
      "path": [
        "Carrosserie",
        "Feux",
        "Lights"
      ],
      "categoryIds": [
        100001,
        null,
        101407
      ],
      "finalCategoryId": 101407,
      "productId": 2992
    },
    {
      "path": [
        "Carrosserie",
        "Feux",
        "Lights"
      ],
      "categoryIds": [
        100001,
        null,
        101407
      ],
      "finalCategoryId": 101407,
      "productId": 113
    },
    {
      "path": [
        "Système électrique",
        "Feux",
        "Lights"
      ],
      "categoryIds": [
        100010,
        null,
        100043
      ],
      "finalCategoryId": 100043,
      "productId": 2992
    },
    {
      "path": [
        "Système électrique",
        "Feux",
        "Lights"
      ],
      "categoryIds": [
        100010,
        null,
        100043
      ],
      "finalCategoryId": 100043,
      "productId": 113
    }
  ],
  "productIdsInArbo": [
    113,
    2992
  ],
  "matchedProductIds": [
    113
  ]
}