{
  "productName": "Anneau de palpeur, ABS",
  "searchText": "Anneau de palpeur, ABS",
  "found": true,
  "hasMatch": true,
  "timestamp": "2025-12-02T18:51:05.590Z",
  "productId": 2254,
  "arborescence": {
    "Dispositif de freinage": {
      "categoryId": 100006,
      "categoryName": "Dispositif de freinage",
      "level": 1,
      "children": {
        "Frein à disque": {
          "categoryId": null,
          "categoryName": "Frein à disque",
          "level": 2,
          "children": {
            "Anneau de palpeur, ABS": {
              "categoryId": 100626,
              "categoryName": "Disc Brake",
              "level": 2,
              "children": {
                "Accessoires / composants": {
                  "categoryId": null,
                  "categoryName": "Accessoires / composants",
                  "level": 4,
                  "children": {
                    "Anneau de palpeur, ABS": {
                      "categoryId": 100630,
                      "categoryName": "Accessories/Parts",
                      "level": 3,
                      "children": [],
                      "productId": 2254
                    }
                  }
                }
              },
              "productId": 2254
            }
          }
        },
        "Réglage du comportement dynamique": {
          "categoryId": null,
          "categoryName": "Réglage du comportement dynamique",
          "level": 2,
          "children": {
            "Anneau de palpeur, ABS": {
              "categoryId": 100038,
              "categoryName": "Drive Dynamics Control",
              "level": 2,
              "children": [],
              "productId": 2254
            }
          }
        }
      }
    },
    "Suspension d'essieu/Guidage des roues/Roues": {
      "categoryId": 100013,
      "categoryName": "Suspension d'essieu/Guidage des roues/Roues",
      "level": 1,
      "children": {
        "Moyeu de roue / fixation": {
          "categoryId": null,
          "categoryName": "Moyeu de roue / fixation",
          "level": 2,
          "children": {
            "Anneau de palpeur, ABS": {
              "categoryId": 100206,
              "categoryName": "Wheel Hub/Mounting",
              "level": 2,
              "children": {
                "Moyeu de roue": {
                  "categoryId": null,
                  "categoryName": "Moyeu de roue",
                  "level": 4,
                  "children": {
                    "Anneau de palpeur, ABS": {
                      "categoryId": 100578,
                      "categoryName": "Wheel Hub",
                      "level": 3,
                      "children": [],
                      "productId": 2254
                    }
                  }
                },
                "Roulement de roue": {
                  "categoryId": null,
                  "categoryName": "Roulement de roue",
                  "level": 4,
                  "children": {
                    "Anneau de palpeur, ABS": {
                      "categoryId": 100579,
                      "categoryName": "Wheel Bearing",
                      "level": 3,
                      "children": [],
                      "productId": 2254
                    }
                  }
                }
              },
              "productId": 2254
            }
          }
        }
      }
    }
  },
  "arborescenceText": "├── Dispositif de freinage [ID: 100006] (Niveau 1)\n│   ├── Frein à disque (Niveau 2)\n│   │   └── Disc Brake [ID: 100626] (Niveau 2) → ProductId: 2254\n│   │       └── Accessoires / composants (Niveau 4)\n│   │           └── Accessories/Parts [ID: 100630] (Niveau 3) → ProductId: 2254\n│   └── Réglage du comportement dynamique (Niveau 2)\n│       └── Drive Dynamics Control [ID: 100038] (Niveau 2) → ProductId: 2254\n\n└── Suspension d'essieu/Guidage des roues/Roues [ID: 100013] (Niveau 1)\n    └── Moyeu de roue / fixation (Niveau 2)\n        └── Wheel Hub/Mounting [ID: 100206] (Niveau 2) → ProductId: 2254\n            ├── Moyeu de roue (Niveau 4)\n            │   └── Wheel Hub [ID: 100578] (Niveau 3) → ProductId: 2254\n            └── Roulement de roue (Niveau 4)\n                └── Wheel Bearing [ID: 100579] (Niveau 3) → ProductId: 2254",
  "arborescencePaths": [
    {
      "path": [
        "Dispositif de freinage",
        "Frein à disque",
        "Disc Brake"
      ],
      "categoryIds": [
        100006,
        null,
        100626
      ],
      "finalCategoryId": 100626,
      "productId": 2254
    },
    {
      "path": [
        "Dispositif de freinage",
        "Réglage du comportement dynamique",
        "Drive Dynamics Control"
      ],
      "categoryIds": [
        100006,
        null,
        100038
      ],
      "finalCategoryId": 100038,
      "productId": 2254
    },
    {
      "path": [
        "Suspension d'essieu/Guidage des roues/Roues",
        "Moyeu de roue / fixation",
        "Wheel Hub/Mounting"
      ],
      "categoryIds": [
        100013,
        null,
        100206
      ],
      "finalCategoryId": 100206,
      "productId": 2254
    }
  ],
  "productIdsInArbo": [
    2254
  ],
  "matchedProductIds": [
    2254
  ]
}