{
  "productName": "Arbre intermédiaire",
  "searchText": "Arbre intermédiaire",
  "found": true,
  "hasMatch": true,
  "timestamp": "2025-12-02T18:57:04.122Z",
  "productId": 2131,
  "arborescence": {
    "Boîte de vitesses": {
      "categoryId": 100238,
      "categoryName": "Boîte de vitesses",
      "level": 1,
      "children": {
        "Boîte de vitesses manuelle": {
          "categoryId": null,
          "categoryName": "Boîte de vitesses manuelle",
          "level": 2,
          "children": {
            "Arbre intermédiaire, boîte manuelle": {
              "categoryId": 100239,
              "categoryName": "Manual Transmission",
              "level": 2,
              "children": {
                "Carter/composants": {
                  "categoryId": null,
                  "categoryName": "Carter/composants",
                  "level": 4,
                  "children": {
                    "Arbre intermédiaire, boîte manuelle": {
                      "categoryId": 100774,
                      "categoryName": "Transmission Housing/Parts",
                      "level": 3,
                      "children": [],
                      "productId": 4093
                    }
                  }
                }
              },
              "productId": 4093
            },
            "Bague d'étanchéité système S.P.I., arbre intermédiaire": {
              "categoryId": 100239,
              "categoryName": "Manual Transmission",
              "level": 2,
              "children": {
                "Joints": {
                  "categoryId": null,
                  "categoryName": "Joints",
                  "level": 4,
                  "children": {
                    "Bague d'étanchéité système S.P.I., arbre intermédiaire": {
                      "categoryId": 100769,
                      "categoryName": "Gaskets/Seals",
                      "level": 3,
                      "children": [],
                      "productId": 3427
                    }
                  }
                }
              },
              "productId": 3427
            },
            "Kit de réparation, arbre intermédiaire (BM)": {
              "categoryId": 100239,
              "categoryName": "Manual Transmission",
              "level": 2,
              "children": {
                "Réparation/entretien": {
                  "categoryId": null,
                  "categoryName": "Réparation/entretien",
                  "level": 4,
                  "children": {
                    "Kit de réparation, arbre intermédiaire (BM)": {
                      "categoryId": 101809,
                      "categoryName": "Repair/Maintenance",
                      "level": 3,
                      "children": [],
                      "productId": 60459
                    }
                  }
                }
              },
              "productId": 60459
            },
            "Roue dentée, arbre intermédiaire": {
              "categoryId": 100239,
              "categoryName": "Manual Transmission",
              "level": 2,
              "children": {
                "Carter/composants": {
                  "categoryId": null,
                  "categoryName": "Carter/composants",
                  "level": 4,
                  "children": {
                    "Roue dentée, arbre intermédiaire": {
                      "categoryId": 100774,
                      "categoryName": "Transmission Housing/Parts",
                      "level": 3,
                      "children": [],
                      "productId": 4904
                    }
                  }
                }
              },
              "productId": 4904
            },
            "Roulement, arbre intermédiaire (boîte manuelle)": {
              "categoryId": 100239,
              "categoryName": "Manual Transmission",
              "level": 2,
              "children": {
                "Support / coussinet / palier": {
                  "categoryId": null,
                  "categoryName": "Support / coussinet / palier",
                  "level": 4,
                  "children": {
                    "Roulement, arbre intermédiaire (boîte manuelle)": {
                      "categoryId": 706086,
                      "categoryName": "Bearing",
                      "level": 3,
                      "children": [],
                      "productId": 8284
                    }
                  }
                }
              },
              "productId": 8284
            }
          }
        },
        "Boîte de vitesses manuelle robotisée (BVR)": {
          "categoryId": null,
          "categoryName": "Boîte de vitesses manuelle robotisée (BVR)",
          "level": 2,
          "children": {
            "Arbre intermédiaire, BV manuelle robotisée (BVR)": {
              "categoryId": 706584,
              "categoryName": "Automated manual transmission (AMT)",
              "level": 2,
              "children": {
                "Arbres de boîte de vitesses/composants": {
                  "categoryId": null,
                  "categoryName": "Arbres de boîte de vitesses/composants",
                  "level": 4,
                  "children": {
                    "Arbre intermédiaire, BV manuelle robotisée (BVR)": {
                      "categoryId": 706615,
                      "categoryName": "Transmission shaft/parts",
                      "level": 3,
                      "children": [],
                      "productId": 60313
                    }
                  }
                }
              },
              "productId": 60313
            },
            "Joint d’arbre, arbre intermédiaire (BVR)": {
              "categoryId": 706584,
              "categoryName": "Automated manual transmission (AMT)",
              "level": 2,
              "children": {
                "Joints/Bagues d’étanchéité": {
                  "categoryId": null,
                  "categoryName": "Joints/Bagues d’étanchéité",
                  "level": 4,
                  "children": {
                    "Joint d’arbre, arbre intermédiaire (BVR)": {
                      "categoryId": 706585,
                      "categoryName": "Seals, seal rings",
                      "level": 3,
                      "children": [],
                      "productId": 60224
                    }
                  }
                }
              },
              "productId": 60224
            },
            "Kit de réparation, arbre intermédiaire (BVR)": {
              "categoryId": 706584,
              "categoryName": "Automated manual transmission (AMT)",
              "level": 2,
              "children": {
                "Réparation/entretien": {
                  "categoryId": null,
                  "categoryName": "Réparation/entretien",
                  "level": 4,
                  "children": {
                    "Kit de réparation, arbre intermédiaire (BVR)": {
                      "categoryId": 706603,
                      "categoryName": "Repair/Maintenance",
                      "level": 3,
                      "children": [],
                      "productId": 60285
                    }
                  }
                }
              },
              "productId": 60285
            },
            "Pignon, arbre intermédiaire (BVR)": {
              "categoryId": 706584,
              "categoryName": "Automated manual transmission (AMT)",
              "level": 2,
              "children": {
                "Carter/composants": {
                  "categoryId": null,
                  "categoryName": "Carter/composants",
                  "level": 4,
                  "children": {
                    "Pignon, arbre intermédiaire (BVR)": {
                      "categoryId": 706586,
                      "categoryName": "Transmission Housing/Parts",
                      "level": 3,
                      "children": [],
                      "productId": 60316
                    }
                  }
                }
              },
              "productId": 60316
            },
            "Roulement, arbre intermédiaire (BVR)": {
              "categoryId": 706584,
              "categoryName": "Automated manual transmission (AMT)",
              "level": 2,
              "children": {
                "Support / coussinet / palier": {
                  "categoryId": null,
                  "categoryName": "Support / coussinet / palier",
                  "level": 4,
                  "children": {
                    "Roulement, arbre intermédiaire (BVR)": {
                      "categoryId": 706606,
                      "categoryName": "Bearing",
                      "level": 3,
                      "children": [],
                      "productId": 60261
                    }
                  }
                }
              },
              "productId": 60261
            }
          }
        }
      }
    },
    "Entraînement des essieux": {
      "categoryId": 100400,
      "categoryName": "Entraînement des essieux",
      "level": 1,
      "children": {
        "Arbre de transmission": {
          "categoryId": null,
          "categoryName": "Arbre de transmission",
          "level": 2,
          "children": {
            "Arbre de transmission, entraînement essieux": {
              "categoryId": 100703,
              "categoryName": "Propshaft",
              "level": 2,
              "children": {
                "Arbre de transmission": {
                  "categoryId": null,
                  "categoryName": "Arbre de transmission",
                  "level": 4,
                  "children": {
                    "Arbre de transmission, entraînement essieux": {
                      "categoryId": 100805,
                      "categoryName": "Propshaft",
                      "level": 3,
                      "children": [],
                      "productId": 3675
                    }
                  }
                }
              },
              "productId": 3675
            }
          }
        }
      }
    },
    "Entraînement des roues": {
      "categoryId": 100014,
      "categoryName": "Entraînement des roues",
      "level": 1,
      "children": {
        "Arbre de transmission": {
          "categoryId": null,
          "categoryName": "Arbre de transmission",
          "level": 2,
          "children": {
            "Arbre intermédiaire d'entraînement": {
              "categoryId": 100062,
              "categoryName": "Drive Shaft",
              "level": 2,
              "children": [],
              "productId": 60761
            }
          }
        }
      }
    },
    "Moteur": {
      "categoryId": 100002,
      "categoryName": "Moteur",
      "level": 1,
      "children": {
        "Carter de vilebrequin": {
          "categoryId": null,
          "categoryName": "Carter de vilebrequin",
          "level": 2,
          "children": {
            "Arbre intermédiaire": {
              "categoryId": 100514,
              "categoryName": "Crankcase",
              "level": 2,
              "children": {
                "Arbre intermédiaire/arbre à contrepoids d'équilibrage": {
                  "categoryId": null,
                  "categoryName": "Arbre intermédiaire/arbre à contrepoids d'équilibrage",
                  "level": 4,
                  "children": {
                    "Arbre intermédiaire": {
                      "categoryId": 105860,
                      "categoryName": "Intermediate/Balance Shaft",
                      "level": 3,
                      "children": [],
                      "productId": 2131
                    }
                  }
                }
              },
              "productId": 2131
            },
            "Bague d'étanchéité, arbre intermédiaire": {
              "categoryId": 100514,
              "categoryName": "Crankcase",
              "level": 2,
              "children": {
                "Arbre intermédiaire/arbre à contrepoids d'équilibrage": {
                  "categoryId": null,
                  "categoryName": "Arbre intermédiaire/arbre à contrepoids d'équilibrage",
                  "level": 4,
                  "children": {
                    "Bague d'étanchéité, arbre intermédiaire": {
                      "categoryId": 105860,
                      "categoryName": "Intermediate/Balance Shaft",
                      "level": 3,
                      "children": [],
                      "productId": 1652
                    }
                  }
                }
              },
              "productId": 1652
            },
            "Bague d’étanchéité, arbre d’équilibrage": {
              "categoryId": 100514,
              "categoryName": "Crankcase",
              "level": 2,
              "children": {
                "Arbre intermédiaire/arbre à contrepoids d'équilibrage": {
                  "categoryId": null,
                  "categoryName": "Arbre intermédiaire/arbre à contrepoids d'équilibrage",
                  "level": 4,
                  "children": {
                    "Bague d’étanchéité, arbre d’équilibrage": {
                      "categoryId": 105860,
                      "categoryName": "Intermediate/Balance Shaft",
                      "level": 3,
                      "children": [],
                      "productId": 8288
                    }
                  }
                }
              },
              "productId": 8288
            },
            "Jeu d'arbres intermédiaires": {
              "categoryId": 100514,
              "categoryName": "Crankcase",
              "level": 2,
              "children": {
                "Arbre intermédiaire/arbre à contrepoids d'équilibrage": {
                  "categoryId": null,
                  "categoryName": "Arbre intermédiaire/arbre à contrepoids d'équilibrage",
                  "level": 4,
                  "children": {
                    "Jeu d'arbres intermédiaires": {
                      "categoryId": 105860,
                      "categoryName": "Intermediate/Balance Shaft",
                      "level": 3,
                      "children": [],
                      "productId": 1809
                    }
                  }
                }
              },
              "productId": 1809
            },
            "Joint d'étanchéité, arbre intermédiaire": {
              "categoryId": 100514,
              "categoryName": "Crankcase",
              "level": 2,
              "children": {
                "Arbre intermédiaire/arbre à contrepoids d'équilibrage": {
                  "categoryId": null,
                  "categoryName": "Arbre intermédiaire/arbre à contrepoids d'équilibrage",
                  "level": 4,
                  "children": {
                    "Joint d'étanchéité, arbre intermédiaire": {
                      "categoryId": 105860,
                      "categoryName": "Intermediate/Balance Shaft",
                      "level": 3,
                      "children": [],
                      "productId": 1653
                    }
                  }
                }
              },
              "productId": 1653
            },
            "Kit de réparation, arbre intermédiaire": {
              "categoryId": 100514,
              "categoryName": "Crankcase",
              "level": 2,
              "children": {
                "Arbre intermédiaire/arbre à contrepoids d'équilibrage": {
                  "categoryId": null,
                  "categoryName": "Arbre intermédiaire/arbre à contrepoids d'équilibrage",
                  "level": 4,
                  "children": {
                    "Kit de réparation, arbre intermédiaire": {
                      "categoryId": 105860,
                      "categoryName": "Intermediate/Balance Shaft",
                      "level": 3,
                      "children": [],
                      "productId": 1651
                    }
                  }
                }
              },
              "productId": 1651
            },
            "Palier, arbre à contrepoids d'équilibrage": {
              "categoryId": 100514,
              "categoryName": "Crankcase",
              "level": 2,
              "children": {
                "Arbre intermédiaire/arbre à contrepoids d'équilibrage": {
                  "categoryId": null,
                  "categoryName": "Arbre intermédiaire/arbre à contrepoids d'équilibrage",
                  "level": 4,
                  "children": {
                    "Palier, arbre à contrepoids d'équilibrage": {
                      "categoryId": 105860,
                      "categoryName": "Intermediate/Balance Shaft",
                      "level": 3,
                      "children": [],
                      "productId": 4430
                    }
                  }
                }
              },
              "productId": 4430
            },
            "Roue dentée, arbre à contrepoids d'équilibrage": {
              "categoryId": 100514,
              "categoryName": "Crankcase",
              "level": 2,
              "children": {
                "Arbre intermédiaire/arbre à contrepoids d'équilibrage": {
                  "categoryId": null,
                  "categoryName": "Arbre intermédiaire/arbre à contrepoids d'équilibrage",
                  "level": 4,
                  "children": {
                    "Roue dentée, arbre à contrepoids d'équilibrage": {
                      "categoryId": 105860,
                      "categoryName": "Intermediate/Balance Shaft",
                      "level": 3,
                      "children": [],
                      "productId": 580
                    }
                  }
                }
              },
              "productId": 580
            }
          }
        },
        "Distribution moteur": {
          "categoryId": null,
          "categoryName": "Distribution moteur",
          "level": 2,
          "children": {
            "Chaîne, arbre intermédiaire": {
              "categoryId": 100003,
              "categoryName": "Engine Timing",
              "level": 2,
              "children": {
                "Chaîne de distribution/tension/guidage": {
                  "categoryId": null,
                  "categoryName": "Chaîne de distribution/tension/guidage",
                  "level": 4,
                  "children": {
                    "Chaîne, arbre intermédiaire": {
                      "categoryId": 100403,
                      "categoryName": "Timing Chain/Tensioner/Guide",
                      "level": 3,
                      "children": {
                        "Chaîne de distribution": {
                          "categoryId": null,
                          "categoryName": "Chaîne de distribution",
                          "level": 6,
                          "children": {
                            "Chaîne, arbre intermédiaire": {
                              "categoryId": 100411,
                              "categoryName": "Timing Chain",
                              "level": 4,
                              "children": [],
                              "productId": 1634
                            }
                          }
                        }
                      },
                      "productId": 1634
                    }
                  }
                }
              },
              "productId": 1634
            },
            "Kit de réparation, arbre intermédiaire": {
              "categoryId": 100003,
              "categoryName": "Engine Timing",
              "level": 2,
              "children": {
                "Arbre intermédiaire": {
                  "categoryId": null,
                  "categoryName": "Arbre intermédiaire",
                  "level": 4,
                  "children": {
                    "Kit de réparation, arbre intermédiaire": {
                      "categoryId": 100852,
                      "categoryName": "Intermediate Shaft",
                      "level": 3,
                      "children": [],
                      "productId": 1651
                    }
                  }
                }
              },
              "productId": 1651
            },
            "Moyeu, arbre de réducteur": {
              "categoryId": 100003,
              "categoryName": "Engine Timing",
              "level": 2,
              "children": {
                "Moyeu": {
                  "categoryId": null,
                  "categoryName": "Moyeu",
                  "level": 4,
                  "children": {
                    "Moyeu, arbre de réducteur": {
                      "categoryId": 706314,
                      "categoryName": "Crankshaft Gear",
                      "level": 3,
                      "children": [],
                      "productId": 8833
                    }
                  }
                }
              },
              "productId": 8833
            },
            "Roue dentée, arbre à contrepoids d'équilibrage": {
              "categoryId": 100003,
              "categoryName": "Engine Timing",
              "level": 2,
              "children": {
                "Pignon droit": {
                  "categoryId": null,
                  "categoryName": "Pignon droit",
                  "level": 4,
                  "children": {
                    "Roue dentée, arbre à contrepoids d'équilibrage": {
                      "categoryId": 100425,
                      "categoryName": "Timing Gear",
                      "level": 3,
                      "children": [],
                      "productId": 580
                    }
                  }
                },
                "roues dentées": {
                  "categoryId": null,
                  "categoryName": "roues dentées",
                  "level": 4,
                  "children": {
                    "Roue dentée, arbre à contrepoids d'équilibrage": {
                      "categoryId": 101833,
                      "categoryName": "Timing Gears",
                      "level": 3,
                      "children": [],
                      "productId": 580
                    }
                  }
                }
              },
              "productId": 580
            },
            "Roue dentée, arbre intermédiaire": {
              "categoryId": 100003,
              "categoryName": "Engine Timing",
              "level": 2,
              "children": {
                "Pignon droit": {
                  "categoryId": null,
                  "categoryName": "Pignon droit",
                  "level": 4,
                  "children": {
                    "Roue dentée, arbre intermédiaire": {
                      "categoryId": 100425,
                      "categoryName": "Timing Gear",
                      "level": 3,
                      "children": [],
                      "productId": 1069
                    }
                  }
                },
                "roues dentées": {
                  "categoryId": null,
                  "categoryName": "roues dentées",
                  "level": 4,
                  "children": {
                    "Roue dentée, arbre intermédiaire": {
                      "categoryId": 101833,
                      "categoryName": "Timing Gears",
                      "level": 3,
                      "children": [],
                      "productId": 1069
                    }
                  }
                }
              },
              "productId": 1069
            }
          }
        },
        "Joints": {
          "categoryId": null,
          "categoryName": "Joints",
          "level": 2,
          "children": {
            "Bague d'étanchéité, arbre intermédiaire": {
              "categoryId": 100223,
              "categoryName": "Gaskets",
              "level": 2,
              "children": {
                "Kit-/bagues d'étanchéité": {
                  "categoryId": null,
                  "categoryName": "Kit-/bagues d'étanchéité",
                  "level": 4,
                  "children": {
                    "Bague d'étanchéité, arbre intermédiaire": {
                      "categoryId": 100789,
                      "categoryName": "Shaft Seal/Set",
                      "level": 3,
                      "children": [],
                      "productId": 1652
                    }
                  }
                }
              },
              "productId": 1652
            }
          }
        },
        "Lubrification": {
          "categoryId": null,
          "categoryName": "Lubrification",
          "level": 2,
          "children": {
            "Guidage d’arbre intermédiaire, pompe à huile": {
              "categoryId": 100245,
              "categoryName": "Lubrication",
              "level": 2,
              "children": {
                "Pompe à huile et pièces de montage": {
                  "categoryId": null,
                  "categoryName": "Pompe à huile et pièces de montage",
                  "level": 4,
                  "children": {
                    "Guidage d’arbre intermédiaire, pompe à huile": {
                      "categoryId": 100476,
                      "categoryName": "Oil Pump/Attachment Parts",
                      "level": 3,
                      "children": {
                        "Pièces de montage": {
                          "categoryId": null,
                          "categoryName": "Pièces de montage",
                          "level": 6,
                          "children": {
                            "Guidage d’arbre intermédiaire, pompe à huile": {
                              "categoryId": 706087,
                              "categoryName": "Assembly Parts",
                              "level": 4,
                              "children": [],
                              "productId": 9055
                            }
                          }
                        }
                      },
                      "productId": 9055
                    }
                  }
                }
              },
              "productId": 9055
            }
          }
        },
        "Système bielle-manivelle": {
          "categoryId": null,
          "categoryName": "Système bielle-manivelle",
          "level": 2,
          "children": {
            "Arbre de compensation, système bielle-manivelle": {
              "categoryId": 100515,
              "categoryName": "Crankshaft Drive",
              "level": 2,
              "children": {
                "Arbre intermédiaire/arbre à contrepoids d'équilibrage": {
                  "categoryId": null,
                  "categoryName": "Arbre intermédiaire/arbre à contrepoids d'équilibrage",
                  "level": 4,
                  "children": {
                    "Arbre de compensation, système bielle-manivelle": {
                      "categoryId": 103120,
                      "categoryName": "Intermediate/Balance Shaft",
                      "level": 3,
                      "children": [],
                      "productId": 60662
                    }
                  }
                }
              },
              "productId": 60662
            },
            "Arbre intermédiaire": {
              "categoryId": 100515,
              "categoryName": "Crankshaft Drive",
              "level": 2,
              "children": {
                "Arbre intermédiaire/arbre à contrepoids d'équilibrage": {
                  "categoryId": null,
                  "categoryName": "Arbre intermédiaire/arbre à contrepoids d'équilibrage",
                  "level": 4,
                  "children": {
                    "Arbre intermédiaire": {
                      "categoryId": 103120,
                      "categoryName": "Intermediate/Balance Shaft",
                      "level": 3,
                      "children": [],
                      "productId": 2131
                    }
                  }
                }
              },
              "productId": 2131
            },
            "Bague d'étanchéité, arbre intermédiaire": {
              "categoryId": 100515,
              "categoryName": "Crankshaft Drive",
              "level": 2,
              "children": {
                "Arbre intermédiaire/arbre à contrepoids d'équilibrage": {
                  "categoryId": null,
                  "categoryName": "Arbre intermédiaire/arbre à contrepoids d'équilibrage",
                  "level": 4,
                  "children": {
                    "Bague d'étanchéité, arbre intermédiaire": {
                      "categoryId": 103120,
                      "categoryName": "Intermediate/Balance Shaft",
                      "level": 3,
                      "children": [],
                      "productId": 1652
                    }
                  }
                }
              },
              "productId": 1652
            },
            "Bague d’étanchéité, arbre d’équilibrage": {
              "categoryId": 100515,
              "categoryName": "Crankshaft Drive",
              "level": 2,
              "children": {
                "Arbre intermédiaire/arbre à contrepoids d'équilibrage": {
                  "categoryId": null,
                  "categoryName": "Arbre intermédiaire/arbre à contrepoids d'équilibrage",
                  "level": 4,
                  "children": {
                    "Bague d’étanchéité, arbre d’équilibrage": {
                      "categoryId": 103120,
                      "categoryName": "Intermediate/Balance Shaft",
                      "level": 3,
                      "children": [],
                      "productId": 8288
                    }
                  }
                }
              },
              "productId": 8288
            },
            "Jeu d'arbres intermédiaires": {
              "categoryId": 100515,
              "categoryName": "Crankshaft Drive",
              "level": 2,
              "children": {
                "Arbre intermédiaire/arbre à contrepoids d'équilibrage": {
                  "categoryId": null,
                  "categoryName": "Arbre intermédiaire/arbre à contrepoids d'équilibrage",
                  "level": 4,
                  "children": {
                    "Jeu d'arbres intermédiaires": {
                      "categoryId": 103120,
                      "categoryName": "Intermediate/Balance Shaft",
                      "level": 3,
                      "children": [],
                      "productId": 1809
                    }
                  }
                }
              },
              "productId": 1809
            },
            "Joint d'étanchéité, arbre intermédiaire": {
              "categoryId": 100515,
              "categoryName": "Crankshaft Drive",
              "level": 2,
              "children": {
                "Arbre intermédiaire/arbre à contrepoids d'équilibrage": {
                  "categoryId": null,
                  "categoryName": "Arbre intermédiaire/arbre à contrepoids d'équilibrage",
                  "level": 4,
                  "children": {
                    "Joint d'étanchéité, arbre intermédiaire": {
                      "categoryId": 103120,
                      "categoryName": "Intermediate/Balance Shaft",
                      "level": 3,
                      "children": [],
                      "productId": 1653
                    }
                  }
                }
              },
              "productId": 1653
            },
            "Kit de réparation, arbre intermédiaire": {
              "categoryId": 100515,
              "categoryName": "Crankshaft Drive",
              "level": 2,
              "children": {
                "Arbre intermédiaire/arbre à contrepoids d'équilibrage": {
                  "categoryId": null,
                  "categoryName": "Arbre intermédiaire/arbre à contrepoids d'équilibrage",
                  "level": 4,
                  "children": {
                    "Kit de réparation, arbre intermédiaire": {
                      "categoryId": 103120,
                      "categoryName": "Intermediate/Balance Shaft",
                      "level": 3,
                      "children": [],
                      "productId": 1651
                    }
                  }
                }
              },
              "productId": 1651
            },
            "Module d’arbre de compensation": {
              "categoryId": 100515,
              "categoryName": "Crankshaft Drive",
              "level": 2,
              "children": {
                "Arbre intermédiaire/arbre à contrepoids d'équilibrage": {
                  "categoryId": null,
                  "categoryName": "Arbre intermédiaire/arbre à contrepoids d'équilibrage",
                  "level": 4,
                  "children": {
                    "Module d’arbre de compensation": {
                      "categoryId": 103120,
                      "categoryName": "Intermediate/Balance Shaft",
                      "level": 3,
                      "children": [],
                      "productId": 60524
                    }
                  }
                }
              },
              "productId": 60524
            },
            "Palier, arbre à contrepoids d'équilibrage": {
              "categoryId": 100515,
              "categoryName": "Crankshaft Drive",
              "level": 2,
              "children": {
                "Arbre intermédiaire/arbre à contrepoids d'équilibrage": {
                  "categoryId": null,
                  "categoryName": "Arbre intermédiaire/arbre à contrepoids d'équilibrage",
                  "level": 4,
                  "children": {
                    "Palier, arbre à contrepoids d'équilibrage": {
                      "categoryId": 103120,
                      "categoryName": "Intermediate/Balance Shaft",
                      "level": 3,
                      "children": [],
                      "productId": 4430
                    }
                  }
                }
              },
              "productId": 4430
            },
            "Roue dentée, arbre à contrepoids d'équilibrage": {
              "categoryId": 100515,
              "categoryName": "Crankshaft Drive",
              "level": 2,
              "children": {
                "Arbre intermédiaire/arbre à contrepoids d'équilibrage": {
                  "categoryId": null,
                  "categoryName": "Arbre intermédiaire/arbre à contrepoids d'équilibrage",
                  "level": 4,
                  "children": {
                    "Roue dentée, arbre à contrepoids d'équilibrage": {
                      "categoryId": 103120,
                      "categoryName": "Intermediate/Balance Shaft",
                      "level": 3,
                      "children": [],
                      "productId": 580
                    }
                  }
                }
              },
              "productId": 580
            }
          }
        }
      }
    }
  },
  "arborescenceText": "├── Boîte de vitesses [ID: 100238] (Niveau 1)\n│   ├── Boîte de vitesses manuelle (Niveau 2)\n│   │   ├── Manual Transmission [ID: 100239] (Niveau 2) → ProductId: 4093\n│   │   │   └── Carter/composants (Niveau 4)\n│   │   │       └── Transmission Housing/Parts [ID: 100774] (Niveau 3) → ProductId: 4093\n│   │   ├── Manual Transmission [ID: 100239] (Niveau 2) → ProductId: 3427\n│   │   │   └── Joints (Niveau 4)\n│   │   │       └── Gaskets/Seals [ID: 100769] (Niveau 3) → ProductId: 3427\n│   │   ├── Manual Transmission [ID: 100239] (Niveau 2) → ProductId: 60459\n│   │   │   └── Réparation/entretien (Niveau 4)\n│   │   │       └── Repair/Maintenance [ID: 101809] (Niveau 3) → ProductId: 60459\n│   │   ├── Manual Transmission [ID: 100239] (Niveau 2) → ProductId: 4904\n│   │   │   └── Carter/composants (Niveau 4)\n│   │   │       └── Transmission Housing/Parts [ID: 100774] (Niveau 3) → ProductId: 4904\n│   │   └── Manual Transmission [ID: 100239] (Niveau 2) → ProductId: 8284\n│   │       └── Support / coussinet / palier (Niveau 4)\n│   │           └── Bearing [ID: 706086] (Niveau 3) → ProductId: 8284\n│   └── Boîte de vitesses manuelle robotisée (BVR) (Niveau 2)\n│       ├── Automated manual transmission (AMT) [ID: 706584] (Niveau 2) → ProductId: 60313\n│       │   └── Arbres de boîte de vitesses/composants (Niveau 4)\n│       │       └── Transmission shaft/parts [ID: 706615] (Niveau 3) → ProductId: 60313\n│       ├── Automated manual transmission (AMT) [ID: 706584] (Niveau 2) → ProductId: 60224\n│       │   └── Joints/Bagues d’étanchéité (Niveau 4)\n│       │       └── Seals, seal rings [ID: 706585] (Niveau 3) → ProductId: 60224\n│       ├── Automated manual transmission (AMT) [ID: 706584] (Niveau 2) → ProductId: 60285\n│       │   └── Réparation/entretien (Niveau 4)\n│       │       └── Repair/Maintenance [ID: 706603] (Niveau 3) → ProductId: 60285\n│       ├── Automated manual transmission (AMT) [ID: 706584] (Niveau 2) → ProductId: 60316\n│       │   └── Carter/composants (Niveau 4)\n│       │       └── Transmission Housing/Parts [ID: 706586] (Niveau 3) → ProductId: 60316\n│       └── Automated manual transmission (AMT) [ID: 706584] (Niveau 2) → ProductId: 60261\n│           └── Support / coussinet / palier (Niveau 4)\n│               └── Bearing [ID: 706606] (Niveau 3) → ProductId: 60261\n\n├── Entraînement des essieux [ID: 100400] (Niveau 1)\n│   └── Arbre de transmission (Niveau 2)\n│       └── Propshaft [ID: 100703] (Niveau 2) → ProductId: 3675\n│           └── Arbre de transmission (Niveau 4)\n│               └── Propshaft [ID: 100805] (Niveau 3) → ProductId: 3675\n\n├── Entraînement des roues [ID: 100014] (Niveau 1)\n│   └── Arbre de transmission (Niveau 2)\n│       └── Drive Shaft [ID: 100062] (Niveau 2) → ProductId: 60761\n\n└── Moteur [ID: 100002] (Niveau 1)\n    ├── Carter de vilebrequin (Niveau 2)\n    │   ├── Crankcase [ID: 100514] (Niveau 2) → ProductId: 2131\n    │   │   └── Arbre intermédiaire/arbre à contrepoids d'équilibrage (Niveau 4)\n    │   │       └── Intermediate/Balance Shaft [ID: 105860] (Niveau 3) → ProductId: 2131\n    │   ├── Crankcase [ID: 100514] (Niveau 2) → ProductId: 1652\n    │   │   └── Arbre intermédiaire/arbre à contrepoids d'équilibrage (Niveau 4)\n    │   │       └── Intermediate/Balance Shaft [ID: 105860] (Niveau 3) → ProductId: 1652\n    │   ├── Crankcase [ID: 100514] (Niveau 2) → ProductId: 8288\n    │   │   └── Arbre intermédiaire/arbre à contrepoids d'équilibrage (Niveau 4)\n    │   │       └── Intermediate/Balance Shaft [ID: 105860] (Niveau 3) → ProductId: 8288\n    │   ├── Crankcase [ID: 100514] (Niveau 2) → ProductId: 1809\n    │   │   └── Arbre intermédiaire/arbre à contrepoids d'équilibrage (Niveau 4)\n    │   │       └── Intermediate/Balance Shaft [ID: 105860] (Niveau 3) → ProductId: 1809\n    │   ├── Crankcase [ID: 100514] (Niveau 2) → ProductId: 1653\n    │   │   └── Arbre intermédiaire/arbre à contrepoids d'équilibrage (Niveau 4)\n    │   │       └── Intermediate/Balance Shaft [ID: 105860] (Niveau 3) → ProductId: 1653\n    │   ├── Crankcase [ID: 100514] (Niveau 2) → ProductId: 1651\n    │   │   └── Arbre intermédiaire/arbre à contrepoids d'équilibrage (Niveau 4)\n    │   │       └── Intermediate/Balance Shaft [ID: 105860] (Niveau 3) → ProductId: 1651\n    │   ├── Crankcase [ID: 100514] (Niveau 2) → ProductId: 4430\n    │   │   └── Arbre intermédiaire/arbre à contrepoids d'équilibrage (Niveau 4)\n    │   │       └── Intermediate/Balance Shaft [ID: 105860] (Niveau 3) → ProductId: 4430\n    │   └── Crankcase [ID: 100514] (Niveau 2) → ProductId: 580\n    │       └── Arbre intermédiaire/arbre à contrepoids d'équilibrage (Niveau 4)\n    │           └── Intermediate/Balance Shaft [ID: 105860] (Niveau 3) → ProductId: 580\n    ├── Distribution moteur (Niveau 2)\n    │   ├── Engine Timing [ID: 100003] (Niveau 2) → ProductId: 1634\n    │   │   └── Chaîne de distribution/tension/guidage (Niveau 4)\n    │   │       └── Timing Chain/Tensioner/Guide [ID: 100403] (Niveau 3) → ProductId: 1634\n    │   │           └── Chaîne de distribution (Niveau 6)\n    │   │               └── Timing Chain [ID: 100411] (Niveau 4) → ProductId: 1634\n    │   ├── Engine Timing [ID: 100003] (Niveau 2) → ProductId: 1651\n    │   │   └── Arbre intermédiaire (Niveau 4)\n    │   │       └── Intermediate Shaft [ID: 100852] (Niveau 3) → ProductId: 1651\n    │   ├── Engine Timing [ID: 100003] (Niveau 2) → ProductId: 8833\n    │   │   └── Moyeu (Niveau 4)\n    │   │       └── Crankshaft Gear [ID: 706314] (Niveau 3) → ProductId: 8833\n    │   ├── Engine Timing [ID: 100003] (Niveau 2) → ProductId: 580\n    │   │   ├── Pignon droit (Niveau 4)\n    │   │   │   └── Timing Gear [ID: 100425] (Niveau 3) → ProductId: 580\n    │   │   └── roues dentées (Niveau 4)\n    │   │       └── Timing Gears [ID: 101833] (Niveau 3) → ProductId: 580\n    │   └── Engine Timing [ID: 100003] (Niveau 2) → ProductId: 1069\n    │       ├── Pignon droit (Niveau 4)\n    │       │   └── Timing Gear [ID: 100425] (Niveau 3) → ProductId: 1069\n    │       └── roues dentées (Niveau 4)\n    │           └── Timing Gears [ID: 101833] (Niveau 3) → ProductId: 1069\n    ├── Joints (Niveau 2)\n    │   └── Gaskets [ID: 100223] (Niveau 2) → ProductId: 1652\n    │       └── Kit-/bagues d'étanchéité (Niveau 4)\n    │           └── Shaft Seal/Set [ID: 100789] (Niveau 3) → ProductId: 1652\n    ├── Lubrification (Niveau 2)\n    │   └── Lubrication [ID: 100245] (Niveau 2) → ProductId: 9055\n    │       └── Pompe à huile et pièces de montage (Niveau 4)\n    │           └── Oil Pump/Attachment Parts [ID: 100476] (Niveau 3) → ProductId: 9055\n    │               └── Pièces de montage (Niveau 6)\n    │                   └── Assembly Parts [ID: 706087] (Niveau 4) → ProductId: 9055\n    └── Système bielle-manivelle (Niveau 2)\n        ├── Crankshaft Drive [ID: 100515] (Niveau 2) → ProductId: 60662\n        │   └── Arbre intermédiaire/arbre à contrepoids d'équilibrage (Niveau 4)\n        │       └── Intermediate/Balance Shaft [ID: 103120] (Niveau 3) → ProductId: 60662\n        ├── Crankshaft Drive [ID: 100515] (Niveau 2) → ProductId: 2131\n        │   └── Arbre intermédiaire/arbre à contrepoids d'équilibrage (Niveau 4)\n        │       └── Intermediate/Balance Shaft [ID: 103120] (Niveau 3) → ProductId: 2131\n        ├── Crankshaft Drive [ID: 100515] (Niveau 2) → ProductId: 1652\n        │   └── Arbre intermédiaire/arbre à contrepoids d'équilibrage (Niveau 4)\n        │       └── Intermediate/Balance Shaft [ID: 103120] (Niveau 3) → ProductId: 1652\n        ├── Crankshaft Drive [ID: 100515] (Niveau 2) → ProductId: 8288\n        │   └── Arbre intermédiaire/arbre à contrepoids d'équilibrage (Niveau 4)\n        │       └── Intermediate/Balance Shaft [ID: 103120] (Niveau 3) → ProductId: 8288\n        ├── Crankshaft Drive [ID: 100515] (Niveau 2) → ProductId: 1809\n        │   └── Arbre intermédiaire/arbre à contrepoids d'équilibrage (Niveau 4)\n        │       └── Intermediate/Balance Shaft [ID: 103120] (Niveau 3) → ProductId: 1809\n        ├── Crankshaft Drive [ID: 100515] (Niveau 2) → ProductId: 1653\n        │   └── Arbre intermédiaire/arbre à contrepoids d'équilibrage (Niveau 4)\n        │       └── Intermediate/Balance Shaft [ID: 103120] (Niveau 3) → ProductId: 1653\n        ├── Crankshaft Drive [ID: 100515] (Niveau 2) → ProductId: 1651\n        │   └── Arbre intermédiaire/arbre à contrepoids d'équilibrage (Niveau 4)\n        │       └── Intermediate/Balance Shaft [ID: 103120] (Niveau 3) → ProductId: 1651\n        ├── Crankshaft Drive [ID: 100515] (Niveau 2) → ProductId: 60524\n        │   └── Arbre intermédiaire/arbre à contrepoids d'équilibrage (Niveau 4)\n        │       └── Intermediate/Balance Shaft [ID: 103120] (Niveau 3) → ProductId: 60524\n        ├── Crankshaft Drive [ID: 100515] (Niveau 2) → ProductId: 4430\n        │   └── Arbre intermédiaire/arbre à contrepoids d'équilibrage (Niveau 4)\n        │       └── Intermediate/Balance Shaft [ID: 103120] (Niveau 3) → ProductId: 4430\n        └── Crankshaft Drive [ID: 100515] (Niveau 2) → ProductId: 580\n            └── Arbre intermédiaire/arbre à contrepoids d'équilibrage (Niveau 4)\n                └── Intermediate/Balance Shaft [ID: 103120] (Niveau 3) → ProductId: 580",
  "arborescencePaths": [
    {
      "path": [
        "Boîte de vitesses",
        "Boîte de vitesses manuelle",
        "Manual Transmission"
      ],
      "categoryIds": [
        100238,
        null,
        100239
      ],
      "finalCategoryId": 100239,
      "productId": 4093
    },
    {
      "path": [
        "Boîte de vitesses",
        "Boîte de vitesses manuelle",
        "Manual Transmission"
      ],
      "categoryIds": [
        100238,
        null,
        100239
      ],
      "finalCategoryId": 100239,
      "productId": 3427
    },
    {
      "path": [
        "Boîte de vitesses",
        "Boîte de vitesses manuelle",
        "Manual Transmission"
      ],
      "categoryIds": [
        100238,
        null,
        100239
      ],
      "finalCategoryId": 100239,
      "productId": 60459
    },
    {
      "path": [
        "Boîte de vitesses",
        "Boîte de vitesses manuelle",
        "Manual Transmission"
      ],
      "categoryIds": [
        100238,
        null,
        100239
      ],
      "finalCategoryId": 100239,
      "productId": 4904
    },
    {
      "path": [
        "Boîte de vitesses",
        "Boîte de vitesses manuelle",
        "Manual Transmission"
      ],
      "categoryIds": [
        100238,
        null,
        100239
      ],
      "finalCategoryId": 100239,
      "productId": 8284
    },
    {
      "path": [
        "Boîte de vitesses",
        "Boîte de vitesses manuelle robotisée (BVR)",
        "Automated manual transmission (AMT)"
      ],
      "categoryIds": [
        100238,
        null,
        706584
      ],
      "finalCategoryId": 706584,
      "productId": 60313
    },
    {
      "path": [
        "Boîte de vitesses",
        "Boîte de vitesses manuelle robotisée (BVR)",
        "Automated manual transmission (AMT)"
      ],
      "categoryIds": [
        100238,
        null,
        706584
      ],
      "finalCategoryId": 706584,
      "productId": 60224
    },
    {
      "path": [
        "Boîte de vitesses",
        "Boîte de vitesses manuelle robotisée (BVR)",
        "Automated manual transmission (AMT)"
      ],
      "categoryIds": [
        100238,
        null,
        706584
      ],
      "finalCategoryId": 706584,
      "productId": 60285
    },
    {
      "path": [
        "Boîte de vitesses",
        "Boîte de vitesses manuelle robotisée (BVR)",
        "Automated manual transmission (AMT)"
      ],
      "categoryIds": [
        100238,
        null,
        706584
      ],
      "finalCategoryId": 706584,
      "productId": 60316
    },
    {
      "path": [
        "Boîte de vitesses",
        "Boîte de vitesses manuelle robotisée (BVR)",
        "Automated manual transmission (AMT)"
      ],
      "categoryIds": [
        100238,
        null,
        706584
      ],
      "finalCategoryId": 706584,
      "productId": 60261
    },
    {
      "path": [
        "Entraînement des essieux",
        "Arbre de transmission",
        "Propshaft"
      ],
      "categoryIds": [
        100400,
        null,
        100703
      ],
      "finalCategoryId": 100703,
      "productId": 3675
    },
    {
      "path": [
        "Entraînement des roues",
        "Arbre de transmission",
        "Drive Shaft"
      ],
      "categoryIds": [
        100014,
        null,
        100062
      ],
      "finalCategoryId": 100062,
      "productId": 60761
    },
    {
      "path": [
        "Moteur",
        "Carter de vilebrequin",
        "Crankcase"
      ],
      "categoryIds": [
        100002,
        null,
        100514
      ],
      "finalCategoryId": 100514,
      "productId": 2131
    },
    {
      "path": [
        "Moteur",
        "Carter de vilebrequin",
        "Crankcase"
      ],
      "categoryIds": [
        100002,
        null,
        100514
      ],
      "finalCategoryId": 100514,
      "productId": 1652
    },
    {
      "path": [
        "Moteur",
        "Carter de vilebrequin",
        "Crankcase"
      ],
      "categoryIds": [
        100002,
        null,
        100514
      ],
      "finalCategoryId": 100514,
      "productId": 8288
    },
    {
      "path": [
        "Moteur",
        "Carter de vilebrequin",
        "Crankcase"
      ],
      "categoryIds": [
        100002,
        null,
        100514
      ],
      "finalCategoryId": 100514,
      "productId": 1809
    },
    {
      "path": [
        "Moteur",
        "Carter de vilebrequin",
        "Crankcase"
      ],
      "categoryIds": [
        100002,
        null,
        100514
      ],
      "finalCategoryId": 100514,
      "productId": 1653
    },
    {
      "path": [
        "Moteur",
        "Carter de vilebrequin",
        "Crankcase"
      ],
      "categoryIds": [
        100002,
        null,
        100514
      ],
      "finalCategoryId": 100514,
      "productId": 1651
    },
    {
      "path": [
        "Moteur",
        "Carter de vilebrequin",
        "Crankcase"
      ],
      "categoryIds": [
        100002,
        null,
        100514
      ],
      "finalCategoryId": 100514,
      "productId": 4430
    },
    {
      "path": [
        "Moteur",
        "Carter de vilebrequin",
        "Crankcase"
      ],
      "categoryIds": [
        100002,
        null,
        100514
      ],
      "finalCategoryId": 100514,
      "productId": 580
    },
    {
      "path": [
        "Moteur",
        "Distribution moteur",
        "Engine Timing"
      ],
      "categoryIds": [
        100002,
        null,
        100003
      ],
      "finalCategoryId": 100003,
      "productId": 1634
    },
    {
      "path": [
        "Moteur",
        "Distribution moteur",
        "Engine Timing"
      ],
      "categoryIds": [
        100002,
        null,
        100003
      ],
      "finalCategoryId": 100003,
      "productId": 1651
    },
    {
      "path": [
        "Moteur",
        "Distribution moteur",
        "Engine Timing"
      ],
      "categoryIds": [
        100002,
        null,
        100003
      ],
      "finalCategoryId": 100003,
      "productId": 8833
    },
    {
      "path": [
        "Moteur",
        "Distribution moteur",
        "Engine Timing"
      ],
      "categoryIds": [
        100002,
        null,
        100003
      ],
      "finalCategoryId": 100003,
      "productId": 580
    },
    {
      "path": [
        "Moteur",
        "Distribution moteur",
        "Engine Timing"
      ],
      "categoryIds": [
        100002,
        null,
        100003
      ],
      "finalCategoryId": 100003,
      "productId": 1069
    },
    {
      "path": [
        "Moteur",
        "Joints",
        "Gaskets"
      ],
      "categoryIds": [
        100002,
        null,
        100223
      ],
      "finalCategoryId": 100223,
      "productId": 1652
    },
    {
      "path": [
        "Moteur",
        "Lubrification",
        "Lubrication"
      ],
      "categoryIds": [
        100002,
        null,
        100245
      ],
      "finalCategoryId": 100245,
      "productId": 9055
    },
    {
      "path": [
        "Moteur",
        "Système bielle-manivelle",
        "Crankshaft Drive"
      ],
      "categoryIds": [
        100002,
        null,
        100515
      ],
      "finalCategoryId": 100515,
      "productId": 60662
    },
    {
      "path": [
        "Moteur",
        "Système bielle-manivelle",
        "Crankshaft Drive"
      ],
      "categoryIds": [
        100002,
        null,
        100515
      ],
      "finalCategoryId": 100515,
      "productId": 2131
    },
    {
      "path": [
        "Moteur",
        "Système bielle-manivelle",
        "Crankshaft Drive"
      ],
      "categoryIds": [
        100002,
        null,
        100515
      ],
      "finalCategoryId": 100515,
      "productId": 1652
    },
    {
      "path": [
        "Moteur",
        "Système bielle-manivelle",
        "Crankshaft Drive"
      ],
      "categoryIds": [
        100002,
        null,
        100515
      ],
      "finalCategoryId": 100515,
      "productId": 8288
    },
    {
      "path": [
        "Moteur",
        "Système bielle-manivelle",
        "Crankshaft Drive"
      ],
      "categoryIds": [
        100002,
        null,
        100515
      ],
      "finalCategoryId": 100515,
      "productId": 1809
    },
    {
      "path": [
        "Moteur",
        "Système bielle-manivelle",
        "Crankshaft Drive"
      ],
      "categoryIds": [
        100002,
        null,
        100515
      ],
      "finalCategoryId": 100515,
      "productId": 1653
    },
    {
      "path": [
        "Moteur",
        "Système bielle-manivelle",
        "Crankshaft Drive"
      ],
      "categoryIds": [
        100002,
        null,
        100515
      ],
      "finalCategoryId": 100515,
      "productId": 1651
    },
    {
      "path": [
        "Moteur",
        "Système bielle-manivelle",
        "Crankshaft Drive"
      ],
      "categoryIds": [
        100002,
        null,
        100515
      ],
      "finalCategoryId": 100515,
      "productId": 60524
    },
    {
      "path": [
        "Moteur",
        "Système bielle-manivelle",
        "Crankshaft Drive"
      ],
      "categoryIds": [
        100002,
        null,
        100515
      ],
      "finalCategoryId": 100515,
      "productId": 4430
    },
    {
      "path": [
        "Moteur",
        "Système bielle-manivelle",
        "Crankshaft Drive"
      ],
      "categoryIds": [
        100002,
        null,
        100515
      ],
      "finalCategoryId": 100515,
      "productId": 580
    }
  ],
  "productIdsInArbo": [
    580,
    1069,
    1634,
    1651,
    1652,
    1653,
    1809,
    2131,
    3427,
    3675,
    4093,
    4430,
    4904,
    8284,
    8288,
    8833,
    9055,
    60224,
    60261,
    60285,
    60313,
    60316,
    60459,
    60524,
    60662,
    60761
  ],
  "matchedProductIds": [
    2131
  ]
}