{
  "productName": "Bague d'étanchéité, arbre intermédiaire",
  "searchText": "Bague d'étanchéité, arbre intermédiaire",
  "found": true,
  "hasMatch": true,
  "timestamp": "2025-12-02T20:02:47.832Z",
  "productId": 1652,
  "arborescence": {
    "Moteur": {
      "categoryId": 100002,
      "categoryName": "Moteur",
      "level": 1,
      "children": {
        "Carter de vilebrequin": {
          "categoryId": null,
          "categoryName": "Carter de vilebrequin",
          "level": 2,
          "children": {
            "Bague d'étanchéité, arbre intermédiaire": {
              "categoryId": 100514,
              "categoryName": "Crankcase",
              "level": 2,
              "children": {
                "Arbre intermédiaire/arbre à contrepoids d'équilibrage": {
                  "categoryId": null,
                  "categoryName": "Arbre intermédiaire/arbre à contrepoids d'équilibrage",
                  "level": 4,
                  "children": {
                    "Bague d'étanchéité, arbre intermédiaire": {
                      "categoryId": 105860,
                      "categoryName": "Intermediate/Balance Shaft",
                      "level": 3,
                      "children": [],
                      "productId": 1652
                    }
                  }
                }
              },
              "productId": 1652
            }
          }
        },
        "Joints": {
          "categoryId": null,
          "categoryName": "Joints",
          "level": 2,
          "children": {
            "Bague d'étanchéité, arbre intermédiaire": {
              "categoryId": 100223,
              "categoryName": "Gaskets",
              "level": 2,
              "children": {
                "Kit-/bagues d'étanchéité": {
                  "categoryId": null,
                  "categoryName": "Kit-/bagues d'étanchéité",
                  "level": 4,
                  "children": {
                    "Bague d'étanchéité, arbre intermédiaire": {
                      "categoryId": 100789,
                      "categoryName": "Shaft Seal/Set",
                      "level": 3,
                      "children": [],
                      "productId": 1652
                    }
                  }
                }
              },
              "productId": 1652
            }
          }
        },
        "Système bielle-manivelle": {
          "categoryId": null,
          "categoryName": "Système bielle-manivelle",
          "level": 2,
          "children": {
            "Bague d'étanchéité, arbre intermédiaire": {
              "categoryId": 100515,
              "categoryName": "Crankshaft Drive",
              "level": 2,
              "children": {
                "Arbre intermédiaire/arbre à contrepoids d'équilibrage": {
                  "categoryId": null,
                  "categoryName": "Arbre intermédiaire/arbre à contrepoids d'équilibrage",
                  "level": 4,
                  "children": {
                    "Bague d'étanchéité, arbre intermédiaire": {
                      "categoryId": 103120,
                      "categoryName": "Intermediate/Balance Shaft",
                      "level": 3,
                      "children": [],
                      "productId": 1652
                    }
                  }
                }
              },
              "productId": 1652
            }
          }
        }
      }
    }
  },
  "arborescenceText": "└── Moteur [ID: 100002] (Niveau 1)\n    ├── Carter de vilebrequin (Niveau 2)\n    │   └── Crankcase [ID: 100514] (Niveau 2) → ProductId: 1652\n    │       └── Arbre intermédiaire/arbre à contrepoids d'équilibrage (Niveau 4)\n    │           └── Intermediate/Balance Shaft [ID: 105860] (Niveau 3) → ProductId: 1652\n    ├── Joints (Niveau 2)\n    │   └── Gaskets [ID: 100223] (Niveau 2) → ProductId: 1652\n    │       └── Kit-/bagues d'étanchéité (Niveau 4)\n    │           └── Shaft Seal/Set [ID: 100789] (Niveau 3) → ProductId: 1652\n    └── Système bielle-manivelle (Niveau 2)\n        └── Crankshaft Drive [ID: 100515] (Niveau 2) → ProductId: 1652\n            └── Arbre intermédiaire/arbre à contrepoids d'équilibrage (Niveau 4)\n                └── Intermediate/Balance Shaft [ID: 103120] (Niveau 3) → ProductId: 1652",
  "arborescencePaths": [
    {
      "path": [
        "Moteur",
        "Carter de vilebrequin",
        "Crankcase"
      ],
      "categoryIds": [
        100002,
        null,
        100514
      ],
      "finalCategoryId": 100514,
      "productId": 1652
    },
    {
      "path": [
        "Moteur",
        "Joints",
        "Gaskets"
      ],
      "categoryIds": [
        100002,
        null,
        100223
      ],
      "finalCategoryId": 100223,
      "productId": 1652
    },
    {
      "path": [
        "Moteur",
        "Système bielle-manivelle",
        "Crankshaft Drive"
      ],
      "categoryIds": [
        100002,
        null,
        100515
      ],
      "finalCategoryId": 100515,
      "productId": 1652
    }
  ],
  "productIdsInArbo": [
    1652
  ],
  "matchedProductIds": [
    1652
  ]
}