{
  "productName": "Barre de connexion",
  "searchText": "Barre de connexion",
  "found": true,
  "hasMatch": true,
  "timestamp": "2025-12-02T20:06:27.668Z",
  "productId": 284,
  "arborescence": {
    "Direction": {
      "categoryId": 100012,
      "categoryName": "Direction",
      "level": 1,
      "children": {
        "Barre de connexion / composants": {
          "categoryId": null,
          "categoryName": "Barre de connexion / composants",
          "level": 2,
          "children": {
            "Barre de connexion": {
              "categoryId": 100601,
              "categoryName": "Tie Rod Assembly/ Parts",
              "level": 2,
              "children": {
                "Barre de connexion": {
                  "categoryId": null,
                  "categoryName": "Barre de connexion",
                  "level": 4,
                  "children": {
                    "Barre de connexion": {
                      "categoryId": 100197,
                      "categoryName": "Tie Rod Assembly",
                      "level": 3,
                      "children": [],
                      "productId": 284
                    }
                  }
                }
              },
              "productId": 284
            },
            "Boulon à rotule, barre de connexion": {
              "categoryId": 100601,
              "categoryName": "Tie Rod Assembly/ Parts",
              "level": 2,
              "children": {
                "Composants de barre de connexion": {
                  "categoryId": null,
                  "categoryName": "Composants de barre de connexion",
                  "level": 4,
                  "children": {
                    "Boulon à rotule, barre de connexion": {
                      "categoryId": 100603,
                      "categoryName": "Parts, tie rod assy.",
                      "level": 3,
                      "children": [],
                      "productId": 176
                    }
                  }
                }
              },
              "productId": 176
            },
            "Douille, rotule barre-connexion (amortisseur de direction)": {
              "categoryId": 100601,
              "categoryName": "Tie Rod Assembly/ Parts",
              "level": 2,
              "children": {
                "Composants de barre de connexion": {
                  "categoryId": null,
                  "categoryName": "Composants de barre de connexion",
                  "level": 4,
                  "children": {
                    "Douille, rotule barre-connexion (amortisseur de direction)": {
                      "categoryId": 100603,
                      "categoryName": "Parts, tie rod assy.",
                      "level": 3,
                      "children": [],
                      "productId": 5756
                    }
                  }
                }
              },
              "productId": 5756
            },
            "Kit de barres de connexion": {
              "categoryId": 100601,
              "categoryName": "Tie Rod Assembly/ Parts",
              "level": 2,
              "children": {
                "Barre de connexion": {
                  "categoryId": null,
                  "categoryName": "Barre de connexion",
                  "level": 4,
                  "children": {
                    "Kit de barres de connexion": {
                      "categoryId": 100197,
                      "categoryName": "Tie Rod Assembly",
                      "level": 3,
                      "children": [],
                      "productId": 3236
                    }
                  }
                }
              },
              "productId": 3236
            },
            "Kit de montage, barre de connexion": {
              "categoryId": 100601,
              "categoryName": "Tie Rod Assembly/ Parts",
              "level": 2,
              "children": {
                "Composants de barre de connexion": {
                  "categoryId": null,
                  "categoryName": "Composants de barre de connexion",
                  "level": 4,
                  "children": {
                    "Kit de montage, barre de connexion": {
                      "categoryId": 100603,
                      "categoryName": "Parts, tie rod assy.",
                      "level": 3,
                      "children": [],
                      "productId": 9260
                    }
                  }
                }
              },
              "productId": 9260
            },
            "Kit de montage, rotule de direction (barre de connexion)": {
              "categoryId": 100601,
              "categoryName": "Tie Rod Assembly/ Parts",
              "level": 2,
              "children": {
                "Composants de barre de connexion": {
                  "categoryId": null,
                  "categoryName": "Composants de barre de connexion",
                  "level": 4,
                  "children": {
                    "Kit de montage, rotule de direction (barre de connexion)": {
                      "categoryId": 100603,
                      "categoryName": "Parts, tie rod assy.",
                      "level": 3,
                      "children": [],
                      "productId": 9259
                    }
                  }
                }
              },
              "productId": 9259
            },
            "Kit de réparation, barre de connexion": {
              "categoryId": 100601,
              "categoryName": "Tie Rod Assembly/ Parts",
              "level": 2,
              "children": {
                "Composants de barre de connexion": {
                  "categoryId": null,
                  "categoryName": "Composants de barre de connexion",
                  "level": 4,
                  "children": {
                    "Kit de réparation, barre de connexion": {
                      "categoryId": 100603,
                      "categoryName": "Parts, tie rod assy.",
                      "level": 3,
                      "children": [],
                      "productId": 770
                    }
                  }
                },
                "Kit de réparation": {
                  "categoryId": null,
                  "categoryName": "Kit de réparation",
                  "level": 4,
                  "children": {
                    "Kit de réparation, barre de connexion": {
                      "categoryId": 100602,
                      "categoryName": "Repair Kit",
                      "level": 3,
                      "children": [],
                      "productId": 770
                    }
                  }
                }
              },
              "productId": 770
            },
            "Kit de réparation, boulon à rotule de barre de connexion": {
              "categoryId": 100601,
              "categoryName": "Tie Rod Assembly/ Parts",
              "level": 2,
              "children": {
                "Kit de réparation": {
                  "categoryId": null,
                  "categoryName": "Kit de réparation",
                  "level": 4,
                  "children": {
                    "Kit de réparation, boulon à rotule de barre de connexion": {
                      "categoryId": 100602,
                      "categoryName": "Repair Kit",
                      "level": 3,
                      "children": [],
                      "productId": 774
                    }
                  }
                }
              },
              "productId": 774
            },
            "Kit de réparation, rotule de barre de connexion": {
              "categoryId": 100601,
              "categoryName": "Tie Rod Assembly/ Parts",
              "level": 2,
              "children": {
                "Kit de réparation": {
                  "categoryId": null,
                  "categoryName": "Kit de réparation",
                  "level": 4,
                  "children": {
                    "Kit de réparation, rotule de barre de connexion": {
                      "categoryId": 100602,
                      "categoryName": "Repair Kit",
                      "level": 3,
                      "children": [],
                      "productId": 773
                    }
                  }
                }
              },
              "productId": 773
            },
            "Kit de réparation, rotule de direction, barre de connexion": {
              "categoryId": 100601,
              "categoryName": "Tie Rod Assembly/ Parts",
              "level": 2,
              "children": {
                "Composants de barre de connexion": {
                  "categoryId": null,
                  "categoryName": "Composants de barre de connexion",
                  "level": 4,
                  "children": {
                    "Kit de réparation, rotule de direction, barre de connexion": {
                      "categoryId": 100603,
                      "categoryName": "Parts, tie rod assy.",
                      "level": 3,
                      "children": [],
                      "productId": 1213
                    }
                  }
                },
                "Kit de réparation": {
                  "categoryId": null,
                  "categoryName": "Kit de réparation",
                  "level": 4,
                  "children": {
                    "Kit de réparation, rotule de direction, barre de connexion": {
                      "categoryId": 100602,
                      "categoryName": "Repair Kit",
                      "level": 3,
                      "children": [],
                      "productId": 1213
                    }
                  }
                }
              },
              "productId": 1213
            },
            "Oeil de levier, barre de connexion": {
              "categoryId": 100601,
              "categoryName": "Tie Rod Assembly/ Parts",
              "level": 2,
              "children": {
                "Composants de barre de connexion": {
                  "categoryId": null,
                  "categoryName": "Composants de barre de connexion",
                  "level": 4,
                  "children": {
                    "Oeil de levier, barre de connexion": {
                      "categoryId": 100603,
                      "categoryName": "Parts, tie rod assy.",
                      "level": 3,
                      "children": [],
                      "productId": 388
                    }
                  }
                }
              },
              "productId": 388
            },
            "Pièce de serrage, barre d'accouplement": {
              "categoryId": 100601,
              "categoryName": "Tie Rod Assembly/ Parts",
              "level": 2,
              "children": {
                "Barre de connexion": {
                  "categoryId": null,
                  "categoryName": "Barre de connexion",
                  "level": 4,
                  "children": {
                    "Pièce de serrage, barre d'accouplement": {
                      "categoryId": 100197,
                      "categoryName": "Tie Rod Assembly",
                      "level": 3,
                      "children": [],
                      "productId": 60780
                    }
                  }
                }
              },
              "productId": 60780
            },
            "Rondelle d’équilibrage, réglage du pincement/parallélisme": {
              "categoryId": 100601,
              "categoryName": "Tie Rod Assembly/ Parts",
              "level": 2,
              "children": {
                "Composants de barre de connexion": {
                  "categoryId": null,
                  "categoryName": "Composants de barre de connexion",
                  "level": 4,
                  "children": {
                    "Rondelle d’équilibrage, réglage du pincement/parallélisme": {
                      "categoryId": 100603,
                      "categoryName": "Parts, tie rod assy.",
                      "level": 3,
                      "children": [],
                      "productId": 8984
                    }
                  }
                }
              },
              "productId": 8984
            },
            "Rotule de barre de connexion": {
              "categoryId": 100601,
              "categoryName": "Tie Rod Assembly/ Parts",
              "level": 2,
              "children": {
                "Composants de barre de connexion": {
                  "categoryId": null,
                  "categoryName": "Composants de barre de connexion",
                  "level": 4,
                  "children": {
                    "Rotule de barre de connexion": {
                      "categoryId": 100603,
                      "categoryName": "Parts, tie rod assy.",
                      "level": 3,
                      "children": [],
                      "productId": 914
                    }
                  }
                }
              },
              "productId": 914
            },
            "Rotule de direction intérieure, barre de connexion": {
              "categoryId": 100601,
              "categoryName": "Tie Rod Assembly/ Parts",
              "level": 2,
              "children": {
                "Composants de barre de connexion": {
                  "categoryId": null,
                  "categoryName": "Composants de barre de connexion",
                  "level": 4,
                  "children": {
                    "Rotule de direction intérieure, barre de connexion": {
                      "categoryId": 100603,
                      "categoryName": "Parts, tie rod assy.",
                      "level": 3,
                      "children": [],
                      "productId": 51
                    }
                  }
                }
              },
              "productId": 51
            },
            "Suspension, barre de connexion": {
              "categoryId": 100601,
              "categoryName": "Tie Rod Assembly/ Parts",
              "level": 2,
              "children": {
                "Composants de barre de connexion": {
                  "categoryId": null,
                  "categoryName": "Composants de barre de connexion",
                  "level": 4,
                  "children": {
                    "Suspension, barre de connexion": {
                      "categoryId": 100603,
                      "categoryName": "Parts, tie rod assy.",
                      "level": 3,
                      "children": [],
                      "productId": 1542
                    }
                  }
                }
              },
              "productId": 1542
            },
            "Tuyau de la barre de connexion": {
              "categoryId": 100601,
              "categoryName": "Tie Rod Assembly/ Parts",
              "level": 2,
              "children": {
                "Composants de barre de connexion": {
                  "categoryId": null,
                  "categoryName": "Composants de barre de connexion",
                  "level": 4,
                  "children": {
                    "Tuyau de la barre de connexion": {
                      "categoryId": 100603,
                      "categoryName": "Parts, tie rod assy.",
                      "level": 3,
                      "children": [],
                      "productId": 915
                    }
                  }
                }
              },
              "productId": 915
            },
            "Vis, alignement des roues": {
              "categoryId": 100601,
              "categoryName": "Tie Rod Assembly/ Parts",
              "level": 2,
              "children": {
                "Composants de barre de connexion": {
                  "categoryId": null,
                  "categoryName": "Composants de barre de connexion",
                  "level": 4,
                  "children": {
                    "Vis, alignement des roues": {
                      "categoryId": 100603,
                      "categoryName": "Parts, tie rod assy.",
                      "level": 3,
                      "children": [],
                      "productId": 1381
                    }
                  }
                }
              },
              "productId": 1381
            }
          }
        },
        "Outils": {
          "categoryId": null,
          "categoryName": "Outils",
          "level": 2,
          "children": {
            "Embout de clé à douille, rotule de barre de connexion": {
              "categoryId": 103158,
              "categoryName": "Tools",
              "level": 2,
              "children": [],
              "productId": 60928
            },
            "Jeu de jauges, barre de connexion": {
              "categoryId": 103158,
              "categoryName": "Tools",
              "level": 2,
              "children": [],
              "productId": 9061
            }
          }
        },
        "Pièces de transmission de direction": {
          "categoryId": null,
          "categoryName": "Pièces de transmission de direction",
          "level": 2,
          "children": {
            "Joint à fourche, barre de connexion": {
              "categoryId": 100594,
              "categoryName": "Steering Linkage",
              "level": 2,
              "children": [],
              "productId": 237
            },
            "Levier intermédiaire de direction": {
              "categoryId": 100594,
              "categoryName": "Steering Linkage",
              "level": 2,
              "children": [],
              "productId": 507
            },
            "Oeil de levier, barre de connexion": {
              "categoryId": 100594,
              "categoryName": "Steering Linkage",
              "level": 2,
              "children": [],
              "productId": 388
            },
            "Rotule de barre de connexion": {
              "categoryId": 100594,
              "categoryName": "Steering Linkage",
              "level": 2,
              "children": [],
              "productId": 914
            }
          }
        },
        "Rotules": {
          "categoryId": null,
          "categoryName": "Rotules",
          "level": 2,
          "children": {
            "Boulon à rotule, barre de connexion": {
              "categoryId": 100198,
              "categoryName": "Joints",
              "level": 2,
              "children": [],
              "productId": 176
            },
            "Kit de montage, rotule de barre de connexion": {
              "categoryId": 100198,
              "categoryName": "Joints",
              "level": 2,
              "children": [],
              "productId": 3511
            },
            "Kit de réparation, rotule de direction, barre de connexion": {
              "categoryId": 100198,
              "categoryName": "Joints",
              "level": 2,
              "children": [],
              "productId": 1213
            },
            "Rotule de barre de connexion": {
              "categoryId": 100198,
              "categoryName": "Joints",
              "level": 2,
              "children": [],
              "productId": 914
            },
            "Rotule de direction intérieure, barre de connexion": {
              "categoryId": 100198,
              "categoryName": "Joints",
              "level": 2,
              "children": [],
              "productId": 51
            }
          }
        }
      }
    },
    "Suspension d'essieu/Guidage des roues/Roues": {
      "categoryId": 100013,
      "categoryName": "Suspension d'essieu/Guidage des roues/Roues",
      "level": 1,
      "children": {
        "Pièce de stabilisateur / pièces de fixation": {
          "categoryId": null,
          "categoryName": "Pièce de stabilisateur / pièces de fixation",
          "level": 2,
          "children": {
            "Bague d'écartement, barre d'accouplement": {
              "categoryId": 100210,
              "categoryName": "Stabiliser Bar/Fastening Parts",
              "level": 2,
              "children": {
                "Pièces de fixation": {
                  "categoryId": null,
                  "categoryName": "Pièces de fixation",
                  "level": 4,
                  "children": {
                    "Bague d'écartement, barre d'accouplement": {
                      "categoryId": 100596,
                      "categoryName": "Fasteners",
                      "level": 3,
                      "children": [],
                      "productId": 3185
                    }
                  }
                }
              },
              "productId": 3185
            }
          }
        }
      }
    }
  },
  "arborescenceText": "├── Direction [ID: 100012] (Niveau 1)\n│   ├── Barre de connexion / composants (Niveau 2)\n│   │   ├── Tie Rod Assembly/ Parts [ID: 100601] (Niveau 2) → ProductId: 284\n│   │   │   └── Barre de connexion (Niveau 4)\n│   │   │       └── Tie Rod Assembly [ID: 100197] (Niveau 3) → ProductId: 284\n│   │   ├── Tie Rod Assembly/ Parts [ID: 100601] (Niveau 2) → ProductId: 176\n│   │   │   └── Composants de barre de connexion (Niveau 4)\n│   │   │       └── Parts, tie rod assy. [ID: 100603] (Niveau 3) → ProductId: 176\n│   │   ├── Tie Rod Assembly/ Parts [ID: 100601] (Niveau 2) → ProductId: 5756\n│   │   │   └── Composants de barre de connexion (Niveau 4)\n│   │   │       └── Parts, tie rod assy. [ID: 100603] (Niveau 3) → ProductId: 5756\n│   │   ├── Tie Rod Assembly/ Parts [ID: 100601] (Niveau 2) → ProductId: 3236\n│   │   │   └── Barre de connexion (Niveau 4)\n│   │   │       └── Tie Rod Assembly [ID: 100197] (Niveau 3) → ProductId: 3236\n│   │   ├── Tie Rod Assembly/ Parts [ID: 100601] (Niveau 2) → ProductId: 9260\n│   │   │   └── Composants de barre de connexion (Niveau 4)\n│   │   │       └── Parts, tie rod assy. [ID: 100603] (Niveau 3) → ProductId: 9260\n│   │   ├── Tie Rod Assembly/ Parts [ID: 100601] (Niveau 2) → ProductId: 9259\n│   │   │   └── Composants de barre de connexion (Niveau 4)\n│   │   │       └── Parts, tie rod assy. [ID: 100603] (Niveau 3) → ProductId: 9259\n│   │   ├── Tie Rod Assembly/ Parts [ID: 100601] (Niveau 2) → ProductId: 770\n│   │   │   ├── Composants de barre de connexion (Niveau 4)\n│   │   │   │   └── Parts, tie rod assy. [ID: 100603] (Niveau 3) → ProductId: 770\n│   │   │   └── Kit de réparation (Niveau 4)\n│   │   │       └── Repair Kit [ID: 100602] (Niveau 3) → ProductId: 770\n│   │   ├── Tie Rod Assembly/ Parts [ID: 100601] (Niveau 2) → ProductId: 774\n│   │   │   └── Kit de réparation (Niveau 4)\n│   │   │       └── Repair Kit [ID: 100602] (Niveau 3) → ProductId: 774\n│   │   ├── Tie Rod Assembly/ Parts [ID: 100601] (Niveau 2) → ProductId: 773\n│   │   │   └── Kit de réparation (Niveau 4)\n│   │   │       └── Repair Kit [ID: 100602] (Niveau 3) → ProductId: 773\n│   │   ├── Tie Rod Assembly/ Parts [ID: 100601] (Niveau 2) → ProductId: 1213\n│   │   │   ├── Composants de barre de connexion (Niveau 4)\n│   │   │   │   └── Parts, tie rod assy. [ID: 100603] (Niveau 3) → ProductId: 1213\n│   │   │   └── Kit de réparation (Niveau 4)\n│   │   │       └── Repair Kit [ID: 100602] (Niveau 3) → ProductId: 1213\n│   │   ├── Tie Rod Assembly/ Parts [ID: 100601] (Niveau 2) → ProductId: 388\n│   │   │   └── Composants de barre de connexion (Niveau 4)\n│   │   │       └── Parts, tie rod assy. [ID: 100603] (Niveau 3) → ProductId: 388\n│   │   ├── Tie Rod Assembly/ Parts [ID: 100601] (Niveau 2) → ProductId: 60780\n│   │   │   └── Barre de connexion (Niveau 4)\n│   │   │       └── Tie Rod Assembly [ID: 100197] (Niveau 3) → ProductId: 60780\n│   │   ├── Tie Rod Assembly/ Parts [ID: 100601] (Niveau 2) → ProductId: 8984\n│   │   │   └── Composants de barre de connexion (Niveau 4)\n│   │   │       └── Parts, tie rod assy. [ID: 100603] (Niveau 3) → ProductId: 8984\n│   │   ├── Tie Rod Assembly/ Parts [ID: 100601] (Niveau 2) → ProductId: 914\n│   │   │   └── Composants de barre de connexion (Niveau 4)\n│   │   │       └── Parts, tie rod assy. [ID: 100603] (Niveau 3) → ProductId: 914\n│   │   ├── Tie Rod Assembly/ Parts [ID: 100601] (Niveau 2) → ProductId: 51\n│   │   │   └── Composants de barre de connexion (Niveau 4)\n│   │   │       └── Parts, tie rod assy. [ID: 100603] (Niveau 3) → ProductId: 51\n│   │   ├── Tie Rod Assembly/ Parts [ID: 100601] (Niveau 2) → ProductId: 1542\n│   │   │   └── Composants de barre de connexion (Niveau 4)\n│   │   │       └── Parts, tie rod assy. [ID: 100603] (Niveau 3) → ProductId: 1542\n│   │   ├── Tie Rod Assembly/ Parts [ID: 100601] (Niveau 2) → ProductId: 915\n│   │   │   └── Composants de barre de connexion (Niveau 4)\n│   │   │       └── Parts, tie rod assy. [ID: 100603] (Niveau 3) → ProductId: 915\n│   │   └── Tie Rod Assembly/ Parts [ID: 100601] (Niveau 2) → ProductId: 1381\n│   │       └── Composants de barre de connexion (Niveau 4)\n│   │           └── Parts, tie rod assy. [ID: 100603] (Niveau 3) → ProductId: 1381\n│   ├── Outils (Niveau 2)\n│   │   ├── Tools [ID: 103158] (Niveau 2) → ProductId: 60928\n│   │   └── Tools [ID: 103158] (Niveau 2) → ProductId: 9061\n│   ├── Pièces de transmission de direction (Niveau 2)\n│   │   ├── Steering Linkage [ID: 100594] (Niveau 2) → ProductId: 237\n│   │   ├── Steering Linkage [ID: 100594] (Niveau 2) → ProductId: 507\n│   │   ├── Steering Linkage [ID: 100594] (Niveau 2) → ProductId: 388\n│   │   └── Steering Linkage [ID: 100594] (Niveau 2) → ProductId: 914\n│   └── Rotules (Niveau 2)\n│       ├── Joints [ID: 100198] (Niveau 2) → ProductId: 176\n│       ├── Joints [ID: 100198] (Niveau 2) → ProductId: 3511\n│       ├── Joints [ID: 100198] (Niveau 2) → ProductId: 1213\n│       ├── Joints [ID: 100198] (Niveau 2) → ProductId: 914\n│       └── Joints [ID: 100198] (Niveau 2) → ProductId: 51\n\n└── Suspension d'essieu/Guidage des roues/Roues [ID: 100013] (Niveau 1)\n    └── Pièce de stabilisateur / pièces de fixation (Niveau 2)\n        └── Stabiliser Bar/Fastening Parts [ID: 100210] (Niveau 2) → ProductId: 3185\n            └── Pièces de fixation (Niveau 4)\n                └── Fasteners [ID: 100596] (Niveau 3) → ProductId: 3185",
  "arborescencePaths": [
    {
      "path": [
        "Direction",
        "Barre de connexion / composants",
        "Tie Rod Assembly/ Parts"
      ],
      "categoryIds": [
        100012,
        null,
        100601
      ],
      "finalCategoryId": 100601,
      "productId": 284
    },
    {
      "path": [
        "Direction",
        "Barre de connexion / composants",
        "Tie Rod Assembly/ Parts"
      ],
      "categoryIds": [
        100012,
        null,
        100601
      ],
      "finalCategoryId": 100601,
      "productId": 176
    },
    {
      "path": [
        "Direction",
        "Barre de connexion / composants",
        "Tie Rod Assembly/ Parts"
      ],
      "categoryIds": [
        100012,
        null,
        100601
      ],
      "finalCategoryId": 100601,
      "productId": 5756
    },
    {
      "path": [
        "Direction",
        "Barre de connexion / composants",
        "Tie Rod Assembly/ Parts"
      ],
      "categoryIds": [
        100012,
        null,
        100601
      ],
      "finalCategoryId": 100601,
      "productId": 3236
    },
    {
      "path": [
        "Direction",
        "Barre de connexion / composants",
        "Tie Rod Assembly/ Parts"
      ],
      "categoryIds": [
        100012,
        null,
        100601
      ],
      "finalCategoryId": 100601,
      "productId": 9260
    },
    {
      "path": [
        "Direction",
        "Barre de connexion / composants",
        "Tie Rod Assembly/ Parts"
      ],
      "categoryIds": [
        100012,
        null,
        100601
      ],
      "finalCategoryId": 100601,
      "productId": 9259
    },
    {
      "path": [
        "Direction",
        "Barre de connexion / composants",
        "Tie Rod Assembly/ Parts"
      ],
      "categoryIds": [
        100012,
        null,
        100601
      ],
      "finalCategoryId": 100601,
      "productId": 770
    },
    {
      "path": [
        "Direction",
        "Barre de connexion / composants",
        "Tie Rod Assembly/ Parts"
      ],
      "categoryIds": [
        100012,
        null,
        100601
      ],
      "finalCategoryId": 100601,
      "productId": 774
    },
    {
      "path": [
        "Direction",
        "Barre de connexion / composants",
        "Tie Rod Assembly/ Parts"
      ],
      "categoryIds": [
        100012,
        null,
        100601
      ],
      "finalCategoryId": 100601,
      "productId": 773
    },
    {
      "path": [
        "Direction",
        "Barre de connexion / composants",
        "Tie Rod Assembly/ Parts"
      ],
      "categoryIds": [
        100012,
        null,
        100601
      ],
      "finalCategoryId": 100601,
      "productId": 1213
    },
    {
      "path": [
        "Direction",
        "Barre de connexion / composants",
        "Tie Rod Assembly/ Parts"
      ],
      "categoryIds": [
        100012,
        null,
        100601
      ],
      "finalCategoryId": 100601,
      "productId": 388
    },
    {
      "path": [
        "Direction",
        "Barre de connexion / composants",
        "Tie Rod Assembly/ Parts"
      ],
      "categoryIds": [
        100012,
        null,
        100601
      ],
      "finalCategoryId": 100601,
      "productId": 60780
    },
    {
      "path": [
        "Direction",
        "Barre de connexion / composants",
        "Tie Rod Assembly/ Parts"
      ],
      "categoryIds": [
        100012,
        null,
        100601
      ],
      "finalCategoryId": 100601,
      "productId": 8984
    },
    {
      "path": [
        "Direction",
        "Barre de connexion / composants",
        "Tie Rod Assembly/ Parts"
      ],
      "categoryIds": [
        100012,
        null,
        100601
      ],
      "finalCategoryId": 100601,
      "productId": 914
    },
    {
      "path": [
        "Direction",
        "Barre de connexion / composants",
        "Tie Rod Assembly/ Parts"
      ],
      "categoryIds": [
        100012,
        null,
        100601
      ],
      "finalCategoryId": 100601,
      "productId": 51
    },
    {
      "path": [
        "Direction",
        "Barre de connexion / composants",
        "Tie Rod Assembly/ Parts"
      ],
      "categoryIds": [
        100012,
        null,
        100601
      ],
      "finalCategoryId": 100601,
      "productId": 1542
    },
    {
      "path": [
        "Direction",
        "Barre de connexion / composants",
        "Tie Rod Assembly/ Parts"
      ],
      "categoryIds": [
        100012,
        null,
        100601
      ],
      "finalCategoryId": 100601,
      "productId": 915
    },
    {
      "path": [
        "Direction",
        "Barre de connexion / composants",
        "Tie Rod Assembly/ Parts"
      ],
      "categoryIds": [
        100012,
        null,
        100601
      ],
      "finalCategoryId": 100601,
      "productId": 1381
    },
    {
      "path": [
        "Direction",
        "Outils",
        "Tools"
      ],
      "categoryIds": [
        100012,
        null,
        103158
      ],
      "finalCategoryId": 103158,
      "productId": 60928
    },
    {
      "path": [
        "Direction",
        "Outils",
        "Tools"
      ],
      "categoryIds": [
        100012,
        null,
        103158
      ],
      "finalCategoryId": 103158,
      "productId": 9061
    },
    {
      "path": [
        "Direction",
        "Pièces de transmission de direction",
        "Steering Linkage"
      ],
      "categoryIds": [
        100012,
        null,
        100594
      ],
      "finalCategoryId": 100594,
      "productId": 237
    },
    {
      "path": [
        "Direction",
        "Pièces de transmission de direction",
        "Steering Linkage"
      ],
      "categoryIds": [
        100012,
        null,
        100594
      ],
      "finalCategoryId": 100594,
      "productId": 507
    },
    {
      "path": [
        "Direction",
        "Pièces de transmission de direction",
        "Steering Linkage"
      ],
      "categoryIds": [
        100012,
        null,
        100594
      ],
      "finalCategoryId": 100594,
      "productId": 388
    },
    {
      "path": [
        "Direction",
        "Pièces de transmission de direction",
        "Steering Linkage"
      ],
      "categoryIds": [
        100012,
        null,
        100594
      ],
      "finalCategoryId": 100594,
      "productId": 914
    },
    {
      "path": [
        "Direction",
        "Rotules",
        "Joints"
      ],
      "categoryIds": [
        100012,
        null,
        100198
      ],
      "finalCategoryId": 100198,
      "productId": 176
    },
    {
      "path": [
        "Direction",
        "Rotules",
        "Joints"
      ],
      "categoryIds": [
        100012,
        null,
        100198
      ],
      "finalCategoryId": 100198,
      "productId": 3511
    },
    {
      "path": [
        "Direction",
        "Rotules",
        "Joints"
      ],
      "categoryIds": [
        100012,
        null,
        100198
      ],
      "finalCategoryId": 100198,
      "productId": 1213
    },
    {
      "path": [
        "Direction",
        "Rotules",
        "Joints"
      ],
      "categoryIds": [
        100012,
        null,
        100198
      ],
      "finalCategoryId": 100198,
      "productId": 914
    },
    {
      "path": [
        "Direction",
        "Rotules",
        "Joints"
      ],
      "categoryIds": [
        100012,
        null,
        100198
      ],
      "finalCategoryId": 100198,
      "productId": 51
    },
    {
      "path": [
        "Suspension d'essieu/Guidage des roues/Roues",
        "Pièce de stabilisateur / pièces de fixation",
        "Stabiliser Bar/Fastening Parts"
      ],
      "categoryIds": [
        100013,
        null,
        100210
      ],
      "finalCategoryId": 100210,
      "productId": 3185
    }
  ],
  "productIdsInArbo": [
    51,
    176,
    237,
    284,
    388,
    507,
    770,
    773,
    774,
    914,
    915,
    1213,
    1381,
    1542,
    3185,
    3236,
    3511,
    5756,
    8984,
    9061,
    9259,
    9260,
    60780,
    60928
  ],
  "matchedProductIds": [
    284
  ]
}