{
  "productName": "Bouchon de radiateur",
  "searchText": "Bouchon de radiateur",
  "found": true,
  "hasMatch": true,
  "timestamp": "2025-12-02T20:08:07.594Z",
  "productId": 548,
  "arborescence": {
    "Entraînement hybride/électrique": {
      "categoryId": 706209,
      "categoryName": "Entraînement hybride/électrique",
      "level": 1,
      "children": {
        "Refroidissement": {
          "categoryId": null,
          "categoryName": "Refroidissement",
          "level": 2,
          "children": {
            "Bouchon de radiateur": {
              "categoryId": 706210,
              "categoryName": "Cooling System",
              "level": 2,
              "children": {
                "Radiateur pour moteur électrique": {
                  "categoryId": null,
                  "categoryName": "Radiateur pour moteur électrique",
                  "level": 4,
                  "children": {
                    "Bouchon de radiateur": {
                      "categoryId": 706215,
                      "categoryName": "Radiator for electric motor",
                      "level": 3,
                      "children": [],
                      "productId": 548
                    }
                  }
                }
              },
              "productId": 548
            }
          }
        }
      }
    },
    "Refroidissement": {
      "categoryId": 100007,
      "categoryName": "Refroidissement",
      "level": 1,
      "children": {
        "Outils": {
          "categoryId": null,
          "categoryName": "Outils",
          "level": 2,
          "children": {
            "Outil de desserrage, bouchon de radiateur": {
              "categoryId": 103131,
              "categoryName": "Tools",
              "level": 2,
              "children": [],
              "productId": 9274
            }
          }
        },
        "Radiateur d'eau/d'huile": {
          "categoryId": null,
          "categoryName": "Radiateur d'eau/d'huile",
          "level": 2,
          "children": {
            "Bouchon de radiateur": {
              "categoryId": 100102,
              "categoryName": "Radiator/Oil Cooler",
              "level": 2,
              "children": {
                "Radiateur d'eau/composants": {
                  "categoryId": null,
                  "categoryName": "Radiateur d'eau/composants",
                  "level": 4,
                  "children": {
                    "Bouchon de radiateur": {
                      "categoryId": 100103,
                      "categoryName": "Radiator/Parts",
                      "level": 3,
                      "children": [],
                      "productId": 548
                    }
                  }
                }
              },
              "productId": 548
            },
            "Vis, bouchon de radiateur": {
              "categoryId": 100102,
              "categoryName": "Radiator/Oil Cooler",
              "level": 2,
              "children": {
                "Radiateur d'eau/composants": {
                  "categoryId": null,
                  "categoryName": "Radiateur d'eau/composants",
                  "level": 4,
                  "children": {
                    "Vis, bouchon de radiateur": {
                      "categoryId": 100103,
                      "categoryName": "Radiator/Parts",
                      "level": 3,
                      "children": [],
                      "productId": 549
                    }
                  }
                }
              },
              "productId": 549
            }
          }
        }
      }
    }
  },
  "arborescenceText": "├── Entraînement hybride/électrique [ID: 706209] (Niveau 1)\n│   └── Refroidissement (Niveau 2)\n│       └── Cooling System [ID: 706210] (Niveau 2) → ProductId: 548\n│           └── Radiateur pour moteur électrique (Niveau 4)\n│               └── Radiator for electric motor [ID: 706215] (Niveau 3) → ProductId: 548\n\n└── Refroidissement [ID: 100007] (Niveau 1)\n    ├── Outils (Niveau 2)\n    │   └── Tools [ID: 103131] (Niveau 2) → ProductId: 9274\n    └── Radiateur d'eau/d'huile (Niveau 2)\n        ├── Radiator/Oil Cooler [ID: 100102] (Niveau 2) → ProductId: 548\n        │   └── Radiateur d'eau/composants (Niveau 4)\n        │       └── Radiator/Parts [ID: 100103] (Niveau 3) → ProductId: 548\n        └── Radiator/Oil Cooler [ID: 100102] (Niveau 2) → ProductId: 549\n            └── Radiateur d'eau/composants (Niveau 4)\n                └── Radiator/Parts [ID: 100103] (Niveau 3) → ProductId: 549",
  "arborescencePaths": [
    {
      "path": [
        "Entraînement hybride/électrique",
        "Refroidissement",
        "Cooling System"
      ],
      "categoryIds": [
        706209,
        null,
        706210
      ],
      "finalCategoryId": 706210,
      "productId": 548
    },
    {
      "path": [
        "Refroidissement",
        "Outils",
        "Tools"
      ],
      "categoryIds": [
        100007,
        null,
        103131
      ],
      "finalCategoryId": 103131,
      "productId": 9274
    },
    {
      "path": [
        "Refroidissement",
        "Radiateur d'eau/d'huile",
        "Radiator/Oil Cooler"
      ],
      "categoryIds": [
        100007,
        null,
        100102
      ],
      "finalCategoryId": 100102,
      "productId": 548
    },
    {
      "path": [
        "Refroidissement",
        "Radiateur d'eau/d'huile",
        "Radiator/Oil Cooler"
      ],
      "categoryIds": [
        100007,
        null,
        100102
      ],
      "finalCategoryId": 100102,
      "productId": 549
    }
  ],
  "productIdsInArbo": [
    548,
    549,
    9274
  ],
  "matchedProductIds": [
    548
  ]
}