{
  "productName": "Bras oscillant",
  "searchText": "Bras oscillant",
  "found": true,
  "hasMatch": false,
  "timestamp": "2025-12-02T20:11:41.865Z",
  "productId": 3291,
  "arborescence": {
    "Carburation": {
      "categoryId": 100254,
      "categoryName": "Carburation",
      "level": 1,
      "children": {
        "Carburateurs": {
          "categoryId": null,
          "categoryName": "Carburateurs",
          "level": 2,
          "children": {
            "Bras oscillant, carburateur": {
              "categoryId": 102903,
              "categoryName": "Carburettor System",
              "level": 2,
              "children": {
                "Composants du carburateur": {
                  "categoryId": null,
                  "categoryName": "Composants du carburateur",
                  "level": 4,
                  "children": {
                    "Bras oscillant, carburateur": {
                      "categoryId": 102906,
                      "categoryName": "Carburettor Parts",
                      "level": 3,
                      "children": [],
                      "productId": 1969
                    }
                  }
                }
              },
              "productId": 1969
            }
          }
        }
      }
    },
    "Outils spéciaux": {
      "categoryId": 706365,
      "categoryName": "Outils spéciaux",
      "level": 1,
      "children": {
        "Outils spéciaux suspension d’essieu/guidage des roues/roues": {
          "categoryId": null,
          "categoryName": "Outils spéciaux suspension d’essieu/guidage des roues/roues",
          "level": 2,
          "children": {
            "Éjecteur, Douille de palier bras transversal": {
              "categoryId": 706380,
              "categoryName": "Special Tools, axle mounting/steering/wheels",
              "level": 2,
              "children": {
                "barre oscillant transversal": {
                  "categoryId": null,
                  "categoryName": "barre oscillant transversal",
                  "level": 4,
                  "children": {
                    "Éjecteur, Douille de palier bras transversal": {
                      "categoryId": 706384,
                      "categoryName": "Control Arm",
                      "level": 3,
                      "children": [],
                      "productId": 8953
                    }
                  }
                }
              },
              "productId": 8953
            },
            "Kit d’outils, caoutchouc de bras longitudinal": {
              "categoryId": 706380,
              "categoryName": "Special Tools, axle mounting/steering/wheels",
              "level": 2,
              "children": {
                "Bras oscillant longitudinal": {
                  "categoryId": null,
                  "categoryName": "Bras oscillant longitudinal",
                  "level": 4,
                  "children": {
                    "Kit d’outils, caoutchouc de bras longitudinal": {
                      "categoryId": 706385,
                      "categoryName": "Trailing Arm",
                      "level": 3,
                      "children": [],
                      "productId": 8942
                    }
                  }
                }
              },
              "productId": 8942
            },
            "Kit d’outils, douille de bras longitudinal": {
              "categoryId": 706380,
              "categoryName": "Special Tools, axle mounting/steering/wheels",
              "level": 2,
              "children": {
                "Bras oscillant longitudinal": {
                  "categoryId": null,
                  "categoryName": "Bras oscillant longitudinal",
                  "level": 4,
                  "children": {
                    "Kit d’outils, douille de bras longitudinal": {
                      "categoryId": 706385,
                      "categoryName": "Trailing Arm",
                      "level": 3,
                      "children": [],
                      "productId": 8943
                    }
                  }
                }
              },
              "productId": 8943
            },
            "Outils d’extract., tenon d’artic. (bras oscillant transv.)": {
              "categoryId": 706380,
              "categoryName": "Special Tools, axle mounting/steering/wheels",
              "level": 2,
              "children": {
                "barre oscillant transversal": {
                  "categoryId": null,
                  "categoryName": "barre oscillant transversal",
                  "level": 4,
                  "children": {
                    "Outils d’extract., tenon d’artic. (bras oscillant transv.)": {
                      "categoryId": 706384,
                      "categoryName": "Control Arm",
                      "level": 3,
                      "children": [],
                      "productId": 8516
                    }
                  }
                }
              },
              "productId": 8516
            }
          }
        }
      }
    },
    "Suspension d'essieu/Guidage des roues/Roues": {
      "categoryId": 100013,
      "categoryName": "Suspension d'essieu/Guidage des roues/Roues",
      "level": 1,
      "children": {
        "Bras oscillant / suspension": {
          "categoryId": null,
          "categoryName": "Bras oscillant / suspension",
          "level": 2,
          "children": {
            "Boulon de fixation, bras transversal": {
              "categoryId": 100208,
              "categoryName": "Steering Link/Control/Trailing Arm Mounting",
              "level": 2,
              "children": {
                "Fixation/placement": {
                  "categoryId": null,
                  "categoryName": "Fixation/placement",
                  "level": 4,
                  "children": {
                    "Boulon de fixation, bras transversal": {
                      "categoryId": 100572,
                      "categoryName": "Mounting/Fastening",
                      "level": 3,
                      "children": [],
                      "productId": 3240
                    }
                  }
                }
              },
              "productId": 3240
            },
            "Bras de liaison, suspension de roue": {
              "categoryId": 100208,
              "categoryName": "Steering Link/Control/Trailing Arm Mounting",
              "level": 2,
              "children": {
                "Bras (transversal, longitudinal, oblique)": {
                  "categoryId": null,
                  "categoryName": "Bras (transversal, longitudinal, oblique)",
                  "level": 4,
                  "children": {
                    "Bras de liaison, suspension de roue": {
                      "categoryId": 100571,
                      "categoryName": "Steering Links (control arm, trailing link, diagonal arm)",
                      "level": 3,
                      "children": [],
                      "productId": 273
                    }
                  }
                }
              },
              "productId": 273
            },
            "Capuchon de protection, palier de guidon": {
              "categoryId": 100208,
              "categoryName": "Steering Link/Control/Trailing Arm Mounting",
              "level": 2,
              "children": {
                "Bras (transversal, longitudinal, oblique)": {
                  "categoryId": null,
                  "categoryName": "Bras (transversal, longitudinal, oblique)",
                  "level": 4,
                  "children": {
                    "Capuchon de protection, palier de guidon": {
                      "categoryId": 100571,
                      "categoryName": "Steering Links (control arm, trailing link, diagonal arm)",
                      "level": 3,
                      "children": [],
                      "productId": 61100
                    }
                  }
                }
              },
              "productId": 61100
            },
            "Jeu de bras, suspension de roue": {
              "categoryId": 100208,
              "categoryName": "Steering Link/Control/Trailing Arm Mounting",
              "level": 2,
              "children": {
                "Bras (transversal, longitudinal, oblique)": {
                  "categoryId": null,
                  "categoryName": "Bras (transversal, longitudinal, oblique)",
                  "level": 4,
                  "children": {
                    "Jeu de bras, suspension de roue": {
                      "categoryId": 100571,
                      "categoryName": "Steering Links (control arm, trailing link, diagonal arm)",
                      "level": 3,
                      "children": [],
                      "productId": 2905
                    }
                  }
                }
              },
              "productId": 2905
            },
            "Jeu de paliers, direction": {
              "categoryId": 100208,
              "categoryName": "Steering Link/Control/Trailing Arm Mounting",
              "level": 2,
              "children": {
                "Fixation/placement": {
                  "categoryId": null,
                  "categoryName": "Fixation/placement",
                  "level": 4,
                  "children": {
                    "Jeu de paliers, direction": {
                      "categoryId": 100572,
                      "categoryName": "Mounting/Fastening",
                      "level": 3,
                      "children": [],
                      "productId": 60566
                    }
                  }
                }
              },
              "productId": 60566
            },
            "Kit d'assemblage, bras de liaison": {
              "categoryId": 100208,
              "categoryName": "Steering Link/Control/Trailing Arm Mounting",
              "level": 2,
              "children": {
                "Bras (transversal, longitudinal, oblique)": {
                  "categoryId": null,
                  "categoryName": "Bras (transversal, longitudinal, oblique)",
                  "level": 4,
                  "children": {
                    "Kit d'assemblage, bras de liaison": {
                      "categoryId": 100571,
                      "categoryName": "Steering Links (control arm, trailing link, diagonal arm)",
                      "level": 3,
                      "children": [],
                      "productId": 1597
                    }
                  }
                }
              },
              "productId": 1597
            },
            "Kit de montage, palier de guidon": {
              "categoryId": 100208,
              "categoryName": "Steering Link/Control/Trailing Arm Mounting",
              "level": 2,
              "children": {
                "Fixation/placement": {
                  "categoryId": null,
                  "categoryName": "Fixation/placement",
                  "level": 4,
                  "children": {
                    "Kit de montage, palier de guidon": {
                      "categoryId": 100572,
                      "categoryName": "Mounting/Fastening",
                      "level": 3,
                      "children": [],
                      "productId": 9262
                    }
                  }
                }
              },
              "productId": 9262
            },
            "Kit de remise en état, bras de liaison": {
              "categoryId": 100208,
              "categoryName": "Steering Link/Control/Trailing Arm Mounting",
              "level": 2,
              "children": {
                "Bras (transversal, longitudinal, oblique)": {
                  "categoryId": null,
                  "categoryName": "Bras (transversal, longitudinal, oblique)",
                  "level": 4,
                  "children": {
                    "Kit de remise en état, bras de liaison": {
                      "categoryId": 100571,
                      "categoryName": "Steering Links (control arm, trailing link, diagonal arm)",
                      "level": 3,
                      "children": [],
                      "productId": 2473
                    }
                  }
                }
              },
              "productId": 2473
            },
            "Kit de réparation, bras triangulaire": {
              "categoryId": 100208,
              "categoryName": "Steering Link/Control/Trailing Arm Mounting",
              "level": 2,
              "children": {
                "Bras (transversal, longitudinal, oblique)": {
                  "categoryId": null,
                  "categoryName": "Bras (transversal, longitudinal, oblique)",
                  "level": 4,
                  "children": {
                    "Kit de réparation, bras triangulaire": {
                      "categoryId": 100571,
                      "categoryName": "Steering Links (control arm, trailing link, diagonal arm)",
                      "level": 3,
                      "children": [],
                      "productId": 772
                    }
                  }
                }
              },
              "productId": 772
            },
            "Manchon, fixation du bras transversal": {
              "categoryId": 100208,
              "categoryName": "Steering Link/Control/Trailing Arm Mounting",
              "level": 2,
              "children": {
                "Fixation/placement": {
                  "categoryId": null,
                  "categoryName": "Fixation/placement",
                  "level": 4,
                  "children": {
                    "Manchon, fixation du bras transversal": {
                      "categoryId": 100572,
                      "categoryName": "Mounting/Fastening",
                      "level": 3,
                      "children": [],
                      "productId": 1599
                    }
                  }
                }
              },
              "productId": 1599
            },
            "Protection anti-pierres, bras oscillant": {
              "categoryId": 100208,
              "categoryName": "Steering Link/Control/Trailing Arm Mounting",
              "level": 2,
              "children": {
                "Bras (transversal, longitudinal, oblique)": {
                  "categoryId": null,
                  "categoryName": "Bras (transversal, longitudinal, oblique)",
                  "level": 4,
                  "children": {
                    "Protection anti-pierres, bras oscillant": {
                      "categoryId": 100571,
                      "categoryName": "Steering Links (control arm, trailing link, diagonal arm)",
                      "level": 3,
                      "children": [],
                      "productId": 3169
                    }
                  }
                }
              },
              "productId": 3169
            },
            "Support, silentbloc du bras transversal": {
              "categoryId": 100208,
              "categoryName": "Steering Link/Control/Trailing Arm Mounting",
              "level": 2,
              "children": {
                "Fixation/placement": {
                  "categoryId": null,
                  "categoryName": "Fixation/placement",
                  "level": 4,
                  "children": {
                    "Support, silentbloc du bras transversal": {
                      "categoryId": 100572,
                      "categoryName": "Mounting/Fastening",
                      "level": 3,
                      "children": [],
                      "productId": 3238
                    }
                  }
                }
              },
              "productId": 3238
            },
            "Suspension, bras de liaison": {
              "categoryId": 100208,
              "categoryName": "Steering Link/Control/Trailing Arm Mounting",
              "level": 2,
              "children": {
                "Fixation/placement": {
                  "categoryId": null,
                  "categoryName": "Fixation/placement",
                  "level": 4,
                  "children": {
                    "Suspension, bras de liaison": {
                      "categoryId": 100572,
                      "categoryName": "Mounting/Fastening",
                      "level": 3,
                      "children": [],
                      "productId": 251
                    }
                  }
                }
              },
              "productId": 251
            },
            "Vis, bras transversal": {
              "categoryId": 100208,
              "categoryName": "Steering Link/Control/Trailing Arm Mounting",
              "level": 2,
              "children": {
                "Bras (transversal, longitudinal, oblique)": {
                  "categoryId": null,
                  "categoryName": "Bras (transversal, longitudinal, oblique)",
                  "level": 4,
                  "children": {
                    "Vis, bras transversal": {
                      "categoryId": 100571,
                      "categoryName": "Steering Links (control arm, trailing link, diagonal arm)",
                      "level": 3,
                      "children": [],
                      "productId": 4840
                    }
                  }
                }
              },
              "productId": 4840
            }
          }
        },
        "Bras transversal de suspension / bras oscillant transversal": {
          "categoryId": null,
          "categoryName": "Bras transversal de suspension / bras oscillant transversal",
          "level": 2,
          "children": {
            "Bras oscillant de suspension": {
              "categoryId": 100758,
              "categoryName": "Dome-/Transverse Link Strut",
              "level": 2,
              "children": [],
              "productId": 1586
            },
            "Support de bras transversal": {
              "categoryId": 100758,
              "categoryName": "Dome-/Transverse Link Strut",
              "level": 2,
              "children": [],
              "productId": 3228
            }
          }
        },
        "Outils": {
          "categoryId": null,
          "categoryName": "Outils",
          "level": 2,
          "children": {
            "Éjecteur, Douille de palier bras transversal": {
              "categoryId": 103159,
              "categoryName": "Tools",
              "level": 2,
              "children": [],
              "productId": 8953
            },
            "Kit d’outils, caoutchouc de bras longitudinal": {
              "categoryId": 103159,
              "categoryName": "Tools",
              "level": 2,
              "children": [],
              "productId": 8942
            },
            "Kit d’outils, douille de bras longitudinal": {
              "categoryId": 103159,
              "categoryName": "Tools",
              "level": 2,
              "children": [],
              "productId": 8943
            },
            "Outils d’extract., tenon d’artic. (bras oscillant transv.)": {
              "categoryId": 103159,
              "categoryName": "Tools",
              "level": 2,
              "children": [],
              "productId": 8516
            }
          }
        }
      }
    }
  },
  "arborescenceText": "├── Carburation [ID: 100254] (Niveau 1)\n│   └── Carburateurs (Niveau 2)\n│       └── Carburettor System [ID: 102903] (Niveau 2) → ProductId: 1969\n│           └── Composants du carburateur (Niveau 4)\n│               └── Carburettor Parts [ID: 102906] (Niveau 3) → ProductId: 1969\n\n├── Outils spéciaux [ID: 706365] (Niveau 1)\n│   └── Outils spéciaux suspension d’essieu/guidage des roues/roues (Niveau 2)\n│       ├── Special Tools, axle mounting/steering/wheels [ID: 706380] (Niveau 2) → ProductId: 8953\n│       │   └── barre oscillant transversal (Niveau 4)\n│       │       └── Control Arm [ID: 706384] (Niveau 3) → ProductId: 8953\n│       ├── Special Tools, axle mounting/steering/wheels [ID: 706380] (Niveau 2) → ProductId: 8942\n│       │   └── Bras oscillant longitudinal (Niveau 4)\n│       │       └── Trailing Arm [ID: 706385] (Niveau 3) → ProductId: 8942\n│       ├── Special Tools, axle mounting/steering/wheels [ID: 706380] (Niveau 2) → ProductId: 8943\n│       │   └── Bras oscillant longitudinal (Niveau 4)\n│       │       └── Trailing Arm [ID: 706385] (Niveau 3) → ProductId: 8943\n│       └── Special Tools, axle mounting/steering/wheels [ID: 706380] (Niveau 2) → ProductId: 8516\n│           └── barre oscillant transversal (Niveau 4)\n│               └── Control Arm [ID: 706384] (Niveau 3) → ProductId: 8516\n\n└── Suspension d'essieu/Guidage des roues/Roues [ID: 100013] (Niveau 1)\n    ├── Bras oscillant / suspension (Niveau 2)\n    │   ├── Steering Link/Control/Trailing Arm Mounting [ID: 100208] (Niveau 2) → ProductId: 3240\n    │   │   └── Fixation/placement (Niveau 4)\n    │   │       └── Mounting/Fastening [ID: 100572] (Niveau 3) → ProductId: 3240\n    │   ├── Steering Link/Control/Trailing Arm Mounting [ID: 100208] (Niveau 2) → ProductId: 273\n    │   │   └── Bras (transversal, longitudinal, oblique) (Niveau 4)\n    │   │       └── Steering Links (control arm, trailing link, diagonal arm) [ID: 100571] (Niveau 3) → ProductId: 273\n    │   ├── Steering Link/Control/Trailing Arm Mounting [ID: 100208] (Niveau 2) → ProductId: 61100\n    │   │   └── Bras (transversal, longitudinal, oblique) (Niveau 4)\n    │   │       └── Steering Links (control arm, trailing link, diagonal arm) [ID: 100571] (Niveau 3) → ProductId: 61100\n    │   ├── Steering Link/Control/Trailing Arm Mounting [ID: 100208] (Niveau 2) → ProductId: 2905\n    │   │   └── Bras (transversal, longitudinal, oblique) (Niveau 4)\n    │   │       └── Steering Links (control arm, trailing link, diagonal arm) [ID: 100571] (Niveau 3) → ProductId: 2905\n    │   ├── Steering Link/Control/Trailing Arm Mounting [ID: 100208] (Niveau 2) → ProductId: 60566\n    │   │   └── Fixation/placement (Niveau 4)\n    │   │       └── Mounting/Fastening [ID: 100572] (Niveau 3) → ProductId: 60566\n    │   ├── Steering Link/Control/Trailing Arm Mounting [ID: 100208] (Niveau 2) → ProductId: 1597\n    │   │   └── Bras (transversal, longitudinal, oblique) (Niveau 4)\n    │   │       └── Steering Links (control arm, trailing link, diagonal arm) [ID: 100571] (Niveau 3) → ProductId: 1597\n    │   ├── Steering Link/Control/Trailing Arm Mounting [ID: 100208] (Niveau 2) → ProductId: 9262\n    │   │   └── Fixation/placement (Niveau 4)\n    │   │       └── Mounting/Fastening [ID: 100572] (Niveau 3) → ProductId: 9262\n    │   ├── Steering Link/Control/Trailing Arm Mounting [ID: 100208] (Niveau 2) → ProductId: 2473\n    │   │   └── Bras (transversal, longitudinal, oblique) (Niveau 4)\n    │   │       └── Steering Links (control arm, trailing link, diagonal arm) [ID: 100571] (Niveau 3) → ProductId: 2473\n    │   ├── Steering Link/Control/Trailing Arm Mounting [ID: 100208] (Niveau 2) → ProductId: 772\n    │   │   └── Bras (transversal, longitudinal, oblique) (Niveau 4)\n    │   │       └── Steering Links (control arm, trailing link, diagonal arm) [ID: 100571] (Niveau 3) → ProductId: 772\n    │   ├── Steering Link/Control/Trailing Arm Mounting [ID: 100208] (Niveau 2) → ProductId: 1599\n    │   │   └── Fixation/placement (Niveau 4)\n    │   │       └── Mounting/Fastening [ID: 100572] (Niveau 3) → ProductId: 1599\n    │   ├── Steering Link/Control/Trailing Arm Mounting [ID: 100208] (Niveau 2) → ProductId: 3169\n    │   │   └── Bras (transversal, longitudinal, oblique) (Niveau 4)\n    │   │       └── Steering Links (control arm, trailing link, diagonal arm) [ID: 100571] (Niveau 3) → ProductId: 3169\n    │   ├── Steering Link/Control/Trailing Arm Mounting [ID: 100208] (Niveau 2) → ProductId: 3238\n    │   │   └── Fixation/placement (Niveau 4)\n    │   │       └── Mounting/Fastening [ID: 100572] (Niveau 3) → ProductId: 3238\n    │   ├── Steering Link/Control/Trailing Arm Mounting [ID: 100208] (Niveau 2) → ProductId: 251\n    │   │   └── Fixation/placement (Niveau 4)\n    │   │       └── Mounting/Fastening [ID: 100572] (Niveau 3) → ProductId: 251\n    │   └── Steering Link/Control/Trailing Arm Mounting [ID: 100208] (Niveau 2) → ProductId: 4840\n    │       └── Bras (transversal, longitudinal, oblique) (Niveau 4)\n    │           └── Steering Links (control arm, trailing link, diagonal arm) [ID: 100571] (Niveau 3) → ProductId: 4840\n    ├── Bras transversal de suspension / bras oscillant transversal (Niveau 2)\n    │   ├── Dome-/Transverse Link Strut [ID: 100758] (Niveau 2) → ProductId: 1586\n    │   └── Dome-/Transverse Link Strut [ID: 100758] (Niveau 2) → ProductId: 3228\n    └── Outils (Niveau 2)\n        ├── Tools [ID: 103159] (Niveau 2) → ProductId: 8953\n        ├── Tools [ID: 103159] (Niveau 2) → ProductId: 8942\n        ├── Tools [ID: 103159] (Niveau 2) → ProductId: 8943\n        └── Tools [ID: 103159] (Niveau 2) → ProductId: 8516",
  "arborescencePaths": [
    {
      "path": [
        "Carburation",
        "Carburateurs",
        "Carburettor System"
      ],
      "categoryIds": [
        100254,
        null,
        102903
      ],
      "finalCategoryId": 102903,
      "productId": 1969
    },
    {
      "path": [
        "Outils spéciaux",
        "Outils spéciaux suspension d’essieu/guidage des roues/roues",
        "Special Tools, axle mounting/steering/wheels"
      ],
      "categoryIds": [
        706365,
        null,
        706380
      ],
      "finalCategoryId": 706380,
      "productId": 8953
    },
    {
      "path": [
        "Outils spéciaux",
        "Outils spéciaux suspension d’essieu/guidage des roues/roues",
        "Special Tools, axle mounting/steering/wheels"
      ],
      "categoryIds": [
        706365,
        null,
        706380
      ],
      "finalCategoryId": 706380,
      "productId": 8942
    },
    {
      "path": [
        "Outils spéciaux",
        "Outils spéciaux suspension d’essieu/guidage des roues/roues",
        "Special Tools, axle mounting/steering/wheels"
      ],
      "categoryIds": [
        706365,
        null,
        706380
      ],
      "finalCategoryId": 706380,
      "productId": 8943
    },
    {
      "path": [
        "Outils spéciaux",
        "Outils spéciaux suspension d’essieu/guidage des roues/roues",
        "Special Tools, axle mounting/steering/wheels"
      ],
      "categoryIds": [
        706365,
        null,
        706380
      ],
      "finalCategoryId": 706380,
      "productId": 8516
    },
    {
      "path": [
        "Suspension d'essieu/Guidage des roues/Roues",
        "Bras oscillant / suspension",
        "Steering Link/Control/Trailing Arm Mounting"
      ],
      "categoryIds": [
        100013,
        null,
        100208
      ],
      "finalCategoryId": 100208,
      "productId": 3240
    },
    {
      "path": [
        "Suspension d'essieu/Guidage des roues/Roues",
        "Bras oscillant / suspension",
        "Steering Link/Control/Trailing Arm Mounting"
      ],
      "categoryIds": [
        100013,
        null,
        100208
      ],
      "finalCategoryId": 100208,
      "productId": 273
    },
    {
      "path": [
        "Suspension d'essieu/Guidage des roues/Roues",
        "Bras oscillant / suspension",
        "Steering Link/Control/Trailing Arm Mounting"
      ],
      "categoryIds": [
        100013,
        null,
        100208
      ],
      "finalCategoryId": 100208,
      "productId": 61100
    },
    {
      "path": [
        "Suspension d'essieu/Guidage des roues/Roues",
        "Bras oscillant / suspension",
        "Steering Link/Control/Trailing Arm Mounting"
      ],
      "categoryIds": [
        100013,
        null,
        100208
      ],
      "finalCategoryId": 100208,
      "productId": 2905
    },
    {
      "path": [
        "Suspension d'essieu/Guidage des roues/Roues",
        "Bras oscillant / suspension",
        "Steering Link/Control/Trailing Arm Mounting"
      ],
      "categoryIds": [
        100013,
        null,
        100208
      ],
      "finalCategoryId": 100208,
      "productId": 60566
    },
    {
      "path": [
        "Suspension d'essieu/Guidage des roues/Roues",
        "Bras oscillant / suspension",
        "Steering Link/Control/Trailing Arm Mounting"
      ],
      "categoryIds": [
        100013,
        null,
        100208
      ],
      "finalCategoryId": 100208,
      "productId": 1597
    },
    {
      "path": [
        "Suspension d'essieu/Guidage des roues/Roues",
        "Bras oscillant / suspension",
        "Steering Link/Control/Trailing Arm Mounting"
      ],
      "categoryIds": [
        100013,
        null,
        100208
      ],
      "finalCategoryId": 100208,
      "productId": 9262
    },
    {
      "path": [
        "Suspension d'essieu/Guidage des roues/Roues",
        "Bras oscillant / suspension",
        "Steering Link/Control/Trailing Arm Mounting"
      ],
      "categoryIds": [
        100013,
        null,
        100208
      ],
      "finalCategoryId": 100208,
      "productId": 2473
    },
    {
      "path": [
        "Suspension d'essieu/Guidage des roues/Roues",
        "Bras oscillant / suspension",
        "Steering Link/Control/Trailing Arm Mounting"
      ],
      "categoryIds": [
        100013,
        null,
        100208
      ],
      "finalCategoryId": 100208,
      "productId": 772
    },
    {
      "path": [
        "Suspension d'essieu/Guidage des roues/Roues",
        "Bras oscillant / suspension",
        "Steering Link/Control/Trailing Arm Mounting"
      ],
      "categoryIds": [
        100013,
        null,
        100208
      ],
      "finalCategoryId": 100208,
      "productId": 1599
    },
    {
      "path": [
        "Suspension d'essieu/Guidage des roues/Roues",
        "Bras oscillant / suspension",
        "Steering Link/Control/Trailing Arm Mounting"
      ],
      "categoryIds": [
        100013,
        null,
        100208
      ],
      "finalCategoryId": 100208,
      "productId": 3169
    },
    {
      "path": [
        "Suspension d'essieu/Guidage des roues/Roues",
        "Bras oscillant / suspension",
        "Steering Link/Control/Trailing Arm Mounting"
      ],
      "categoryIds": [
        100013,
        null,
        100208
      ],
      "finalCategoryId": 100208,
      "productId": 3238
    },
    {
      "path": [
        "Suspension d'essieu/Guidage des roues/Roues",
        "Bras oscillant / suspension",
        "Steering Link/Control/Trailing Arm Mounting"
      ],
      "categoryIds": [
        100013,
        null,
        100208
      ],
      "finalCategoryId": 100208,
      "productId": 251
    },
    {
      "path": [
        "Suspension d'essieu/Guidage des roues/Roues",
        "Bras oscillant / suspension",
        "Steering Link/Control/Trailing Arm Mounting"
      ],
      "categoryIds": [
        100013,
        null,
        100208
      ],
      "finalCategoryId": 100208,
      "productId": 4840
    },
    {
      "path": [
        "Suspension d'essieu/Guidage des roues/Roues",
        "Bras transversal de suspension / bras oscillant transversal",
        "Dome-/Transverse Link Strut"
      ],
      "categoryIds": [
        100013,
        null,
        100758
      ],
      "finalCategoryId": 100758,
      "productId": 1586
    },
    {
      "path": [
        "Suspension d'essieu/Guidage des roues/Roues",
        "Bras transversal de suspension / bras oscillant transversal",
        "Dome-/Transverse Link Strut"
      ],
      "categoryIds": [
        100013,
        null,
        100758
      ],
      "finalCategoryId": 100758,
      "productId": 3228
    },
    {
      "path": [
        "Suspension d'essieu/Guidage des roues/Roues",
        "Outils",
        "Tools"
      ],
      "categoryIds": [
        100013,
        null,
        103159
      ],
      "finalCategoryId": 103159,
      "productId": 8953
    },
    {
      "path": [
        "Suspension d'essieu/Guidage des roues/Roues",
        "Outils",
        "Tools"
      ],
      "categoryIds": [
        100013,
        null,
        103159
      ],
      "finalCategoryId": 103159,
      "productId": 8942
    },
    {
      "path": [
        "Suspension d'essieu/Guidage des roues/Roues",
        "Outils",
        "Tools"
      ],
      "categoryIds": [
        100013,
        null,
        103159
      ],
      "finalCategoryId": 103159,
      "productId": 8943
    },
    {
      "path": [
        "Suspension d'essieu/Guidage des roues/Roues",
        "Outils",
        "Tools"
      ],
      "categoryIds": [
        100013,
        null,
        103159
      ],
      "finalCategoryId": 103159,
      "productId": 8516
    }
  ],
  "productIdsInArbo": [
    251,
    273,
    772,
    1586,
    1597,
    1599,
    1969,
    2473,
    2905,
    3169,
    3228,
    3238,
    3240,
    4840,
    8516,
    8942,
    8943,
    8953,
    9262,
    60566,
    61100
  ],
  "closestProductIds": [
    {
      "productId": 251,
      "productName": "Suspension, bras de liaison"
    },
    {
      "productId": 273,
      "productName": "Bras de liaison, suspension de roue"
    },
    {
      "productId": 772,
      "productName": "Kit de réparation, bras triangulaire"
    },
    {
      "productId": 1586,
      "productName": "Bras oscillant de suspension"
    },
    {
      "productId": 1597,
      "productName": "Kit d'assemblage, bras de liaison"
    }
  ]
}