{
  "productName": "Butée de débrayage",
  "searchText": "Butée de débrayage",
  "found": true,
  "hasMatch": true,
  "timestamp": "2025-12-02T20:12:31.394Z",
  "productId": 48,
  "arborescence": {
    "Embrayage / composants": {
      "categoryId": 100050,
      "categoryName": "Embrayage / composants",
      "level": 1,
      "children": {
        "Butée d’embrayage/butée hydraulique": {
          "categoryId": null,
          "categoryName": "Butée d’embrayage/butée hydraulique",
          "level": 2,
          "children": {
            "Anneau métallique, plateau de débrayage": {
              "categoryId": 100054,
              "categoryName": "Clutch Release Bearing/Central Slave Cylinder",
              "level": 2,
              "children": {
                "Butée de débrayage": {
                  "categoryId": null,
                  "categoryName": "Butée de débrayage",
                  "level": 4,
                  "children": {
                    "Anneau métallique, plateau de débrayage": {
                      "categoryId": 100055,
                      "categoryName": "Clutch Release Bearing",
                      "level": 3,
                      "children": [],
                      "productId": 155
                    }
                  }
                }
              },
              "productId": 155
            },
            "Arbre de butée, embrayage": {
              "categoryId": 100054,
              "categoryName": "Clutch Release Bearing/Central Slave Cylinder",
              "level": 2,
              "children": {
                "Butée de débrayage": {
                  "categoryId": null,
                  "categoryName": "Butée de débrayage",
                  "level": 4,
                  "children": {
                    "Arbre de butée, embrayage": {
                      "categoryId": 100055,
                      "categoryName": "Clutch Release Bearing",
                      "level": 3,
                      "children": [],
                      "productId": 4688
                    }
                  }
                }
              },
              "productId": 4688
            },
            "Bouchon, butée de débrayage": {
              "categoryId": 100054,
              "categoryName": "Clutch Release Bearing/Central Slave Cylinder",
              "level": 2,
              "children": {
                "Butée de débrayage": {
                  "categoryId": null,
                  "categoryName": "Butée de débrayage",
                  "level": 4,
                  "children": {
                    "Bouchon, butée de débrayage": {
                      "categoryId": 100055,
                      "categoryName": "Clutch Release Bearing",
                      "level": 3,
                      "children": [],
                      "productId": 3378
                    }
                  }
                }
              },
              "productId": 3378
            },
            "Butée de débrayage": {
              "categoryId": 100054,
              "categoryName": "Clutch Release Bearing/Central Slave Cylinder",
              "level": 2,
              "children": {
                "Butée de débrayage": {
                  "categoryId": null,
                  "categoryName": "Butée de débrayage",
                  "level": 4,
                  "children": {
                    "Butée de débrayage": {
                      "categoryId": 100055,
                      "categoryName": "Clutch Release Bearing",
                      "level": 3,
                      "children": [],
                      "productId": 48
                    }
                  }
                }
              },
              "productId": 48
            },
            "Butée, commande d'embrayage": {
              "categoryId": 100054,
              "categoryName": "Clutch Release Bearing/Central Slave Cylinder",
              "level": 2,
              "children": {
                "Butée de débrayage": {
                  "categoryId": null,
                  "categoryName": "Butée de débrayage",
                  "level": 4,
                  "children": {
                    "Butée, commande d'embrayage": {
                      "categoryId": 100055,
                      "categoryName": "Clutch Release Bearing",
                      "level": 3,
                      "children": [],
                      "productId": 4117
                    }
                  }
                },
                "Fourchette de débrayage": {
                  "categoryId": null,
                  "categoryName": "Fourchette de débrayage",
                  "level": 4,
                  "children": {
                    "Butée, commande d'embrayage": {
                      "categoryId": 102080,
                      "categoryName": "Release Fork",
                      "level": 3,
                      "children": [],
                      "productId": 4117
                    }
                  }
                }
              },
              "productId": 4117
            },
            "Clip, butée de débrayage": {
              "categoryId": 100054,
              "categoryName": "Clutch Release Bearing/Central Slave Cylinder",
              "level": 2,
              "children": {
                "Butée de débrayage": {
                  "categoryId": null,
                  "categoryName": "Butée de débrayage",
                  "level": 4,
                  "children": {
                    "Clip, butée de débrayage": {
                      "categoryId": 100055,
                      "categoryName": "Clutch Release Bearing",
                      "level": 3,
                      "children": [],
                      "productId": 5743
                    }
                  }
                }
              },
              "productId": 5743
            },
            "Joint d'étanchéité, arbre de butée": {
              "categoryId": 100054,
              "categoryName": "Clutch Release Bearing/Central Slave Cylinder",
              "level": 2,
              "children": {
                "Butée de débrayage": {
                  "categoryId": null,
                  "categoryName": "Butée de débrayage",
                  "level": 4,
                  "children": {
                    "Joint d'étanchéité, arbre de butée": {
                      "categoryId": 100055,
                      "categoryName": "Clutch Release Bearing",
                      "level": 3,
                      "children": [],
                      "productId": 3807
                    }
                  }
                }
              },
              "productId": 3807
            },
            "Kit d'assemblage, butée de débrayage": {
              "categoryId": 100054,
              "categoryName": "Clutch Release Bearing/Central Slave Cylinder",
              "level": 2,
              "children": {
                "Butée de débrayage": {
                  "categoryId": null,
                  "categoryName": "Butée de débrayage",
                  "level": 4,
                  "children": {
                    "Kit d'assemblage, butée de débrayage": {
                      "categoryId": 100055,
                      "categoryName": "Clutch Release Bearing",
                      "level": 3,
                      "children": [],
                      "productId": 619
                    }
                  }
                }
              },
              "productId": 619
            },
            "Kit de montage, butée de débrayage à ressort de maintien": {
              "categoryId": 100054,
              "categoryName": "Clutch Release Bearing/Central Slave Cylinder",
              "level": 2,
              "children": {
                "Butée de débrayage": {
                  "categoryId": null,
                  "categoryName": "Butée de débrayage",
                  "level": 4,
                  "children": {
                    "Kit de montage, butée de débrayage à ressort de maintien": {
                      "categoryId": 100055,
                      "categoryName": "Clutch Release Bearing",
                      "level": 3,
                      "children": [],
                      "productId": 8578
                    }
                  }
                }
              },
              "productId": 8578
            },
            "Plateau de débrayage, embrayage": {
              "categoryId": 100054,
              "categoryName": "Clutch Release Bearing/Central Slave Cylinder",
              "level": 2,
              "children": {
                "Butée de débrayage": {
                  "categoryId": null,
                  "categoryName": "Butée de débrayage",
                  "level": 4,
                  "children": {
                    "Plateau de débrayage, embrayage": {
                      "categoryId": 100055,
                      "categoryName": "Clutch Release Bearing",
                      "level": 3,
                      "children": [],
                      "productId": 49
                    }
                  }
                }
              },
              "productId": 49
            },
            "Revêtement, arbre de butée de débrayage": {
              "categoryId": 100054,
              "categoryName": "Clutch Release Bearing/Central Slave Cylinder",
              "level": 2,
              "children": {
                "Butée de débrayage": {
                  "categoryId": null,
                  "categoryName": "Butée de débrayage",
                  "level": 4,
                  "children": {
                    "Revêtement, arbre de butée de débrayage": {
                      "categoryId": 100055,
                      "categoryName": "Clutch Release Bearing",
                      "level": 3,
                      "children": [],
                      "productId": 4687
                    }
                  }
                }
              },
              "productId": 4687
            },
            "Tuyau d'huile, butée de débrayage": {
              "categoryId": 100054,
              "categoryName": "Clutch Release Bearing/Central Slave Cylinder",
              "level": 2,
              "children": {
                "Butée de débrayage": {
                  "categoryId": null,
                  "categoryName": "Butée de débrayage",
                  "level": 4,
                  "children": {
                    "Tuyau d'huile, butée de débrayage": {
                      "categoryId": 100055,
                      "categoryName": "Clutch Release Bearing",
                      "level": 3,
                      "children": [],
                      "productId": 4837
                    }
                  }
                }
              },
              "productId": 4837
            },
            "Vis, arbre de butée": {
              "categoryId": 100054,
              "categoryName": "Clutch Release Bearing/Central Slave Cylinder",
              "level": 2,
              "children": {
                "Butée de débrayage": {
                  "categoryId": null,
                  "categoryName": "Butée de débrayage",
                  "level": 4,
                  "children": {
                    "Vis, arbre de butée": {
                      "categoryId": 100055,
                      "categoryName": "Clutch Release Bearing",
                      "level": 3,
                      "children": [],
                      "productId": 4741
                    }
                  }
                }
              },
              "productId": 4741
            }
          }
        },
        "Outils": {
          "categoryId": null,
          "categoryName": "Outils",
          "level": 2,
          "children": {
            "Outil de montage, butée de débrayage": {
              "categoryId": 103156,
              "categoryName": "Tools",
              "level": 2,
              "children": [],
              "productId": 8822
            }
          }
        }
      }
    }
  },
  "arborescenceText": "└── Embrayage / composants [ID: 100050] (Niveau 1)\n    ├── Butée d’embrayage/butée hydraulique (Niveau 2)\n    │   ├── Clutch Release Bearing/Central Slave Cylinder [ID: 100054] (Niveau 2) → ProductId: 155\n    │   │   └── Butée de débrayage (Niveau 4)\n    │   │       └── Clutch Release Bearing [ID: 100055] (Niveau 3) → ProductId: 155\n    │   ├── Clutch Release Bearing/Central Slave Cylinder [ID: 100054] (Niveau 2) → ProductId: 4688\n    │   │   └── Butée de débrayage (Niveau 4)\n    │   │       └── Clutch Release Bearing [ID: 100055] (Niveau 3) → ProductId: 4688\n    │   ├── Clutch Release Bearing/Central Slave Cylinder [ID: 100054] (Niveau 2) → ProductId: 3378\n    │   │   └── Butée de débrayage (Niveau 4)\n    │   │       └── Clutch Release Bearing [ID: 100055] (Niveau 3) → ProductId: 3378\n    │   ├── Clutch Release Bearing/Central Slave Cylinder [ID: 100054] (Niveau 2) → ProductId: 48\n    │   │   └── Butée de débrayage (Niveau 4)\n    │   │       └── Clutch Release Bearing [ID: 100055] (Niveau 3) → ProductId: 48\n    │   ├── Clutch Release Bearing/Central Slave Cylinder [ID: 100054] (Niveau 2) → ProductId: 4117\n    │   │   ├── Butée de débrayage (Niveau 4)\n    │   │   │   └── Clutch Release Bearing [ID: 100055] (Niveau 3) → ProductId: 4117\n    │   │   └── Fourchette de débrayage (Niveau 4)\n    │   │       └── Release Fork [ID: 102080] (Niveau 3) → ProductId: 4117\n    │   ├── Clutch Release Bearing/Central Slave Cylinder [ID: 100054] (Niveau 2) → ProductId: 5743\n    │   │   └── Butée de débrayage (Niveau 4)\n    │   │       └── Clutch Release Bearing [ID: 100055] (Niveau 3) → ProductId: 5743\n    │   ├── Clutch Release Bearing/Central Slave Cylinder [ID: 100054] (Niveau 2) → ProductId: 3807\n    │   │   └── Butée de débrayage (Niveau 4)\n    │   │       └── Clutch Release Bearing [ID: 100055] (Niveau 3) → ProductId: 3807\n    │   ├── Clutch Release Bearing/Central Slave Cylinder [ID: 100054] (Niveau 2) → ProductId: 619\n    │   │   └── Butée de débrayage (Niveau 4)\n    │   │       └── Clutch Release Bearing [ID: 100055] (Niveau 3) → ProductId: 619\n    │   ├── Clutch Release Bearing/Central Slave Cylinder [ID: 100054] (Niveau 2) → ProductId: 8578\n    │   │   └── Butée de débrayage (Niveau 4)\n    │   │       └── Clutch Release Bearing [ID: 100055] (Niveau 3) → ProductId: 8578\n    │   ├── Clutch Release Bearing/Central Slave Cylinder [ID: 100054] (Niveau 2) → ProductId: 49\n    │   │   └── Butée de débrayage (Niveau 4)\n    │   │       └── Clutch Release Bearing [ID: 100055] (Niveau 3) → ProductId: 49\n    │   ├── Clutch Release Bearing/Central Slave Cylinder [ID: 100054] (Niveau 2) → ProductId: 4687\n    │   │   └── Butée de débrayage (Niveau 4)\n    │   │       └── Clutch Release Bearing [ID: 100055] (Niveau 3) → ProductId: 4687\n    │   ├── Clutch Release Bearing/Central Slave Cylinder [ID: 100054] (Niveau 2) → ProductId: 4837\n    │   │   └── Butée de débrayage (Niveau 4)\n    │   │       └── Clutch Release Bearing [ID: 100055] (Niveau 3) → ProductId: 4837\n    │   └── Clutch Release Bearing/Central Slave Cylinder [ID: 100054] (Niveau 2) → ProductId: 4741\n    │       └── Butée de débrayage (Niveau 4)\n    │           └── Clutch Release Bearing [ID: 100055] (Niveau 3) → ProductId: 4741\n    └── Outils (Niveau 2)\n        └── Tools [ID: 103156] (Niveau 2) → ProductId: 8822",
  "arborescencePaths": [
    {
      "path": [
        "Embrayage / composants",
        "Butée d’embrayage/butée hydraulique",
        "Clutch Release Bearing/Central Slave Cylinder"
      ],
      "categoryIds": [
        100050,
        null,
        100054
      ],
      "finalCategoryId": 100054,
      "productId": 155
    },
    {
      "path": [
        "Embrayage / composants",
        "Butée d’embrayage/butée hydraulique",
        "Clutch Release Bearing/Central Slave Cylinder"
      ],
      "categoryIds": [
        100050,
        null,
        100054
      ],
      "finalCategoryId": 100054,
      "productId": 4688
    },
    {
      "path": [
        "Embrayage / composants",
        "Butée d’embrayage/butée hydraulique",
        "Clutch Release Bearing/Central Slave Cylinder"
      ],
      "categoryIds": [
        100050,
        null,
        100054
      ],
      "finalCategoryId": 100054,
      "productId": 3378
    },
    {
      "path": [
        "Embrayage / composants",
        "Butée d’embrayage/butée hydraulique",
        "Clutch Release Bearing/Central Slave Cylinder"
      ],
      "categoryIds": [
        100050,
        null,
        100054
      ],
      "finalCategoryId": 100054,
      "productId": 48
    },
    {
      "path": [
        "Embrayage / composants",
        "Butée d’embrayage/butée hydraulique",
        "Clutch Release Bearing/Central Slave Cylinder"
      ],
      "categoryIds": [
        100050,
        null,
        100054
      ],
      "finalCategoryId": 100054,
      "productId": 4117
    },
    {
      "path": [
        "Embrayage / composants",
        "Butée d’embrayage/butée hydraulique",
        "Clutch Release Bearing/Central Slave Cylinder"
      ],
      "categoryIds": [
        100050,
        null,
        100054
      ],
      "finalCategoryId": 100054,
      "productId": 5743
    },
    {
      "path": [
        "Embrayage / composants",
        "Butée d’embrayage/butée hydraulique",
        "Clutch Release Bearing/Central Slave Cylinder"
      ],
      "categoryIds": [
        100050,
        null,
        100054
      ],
      "finalCategoryId": 100054,
      "productId": 3807
    },
    {
      "path": [
        "Embrayage / composants",
        "Butée d’embrayage/butée hydraulique",
        "Clutch Release Bearing/Central Slave Cylinder"
      ],
      "categoryIds": [
        100050,
        null,
        100054
      ],
      "finalCategoryId": 100054,
      "productId": 619
    },
    {
      "path": [
        "Embrayage / composants",
        "Butée d’embrayage/butée hydraulique",
        "Clutch Release Bearing/Central Slave Cylinder"
      ],
      "categoryIds": [
        100050,
        null,
        100054
      ],
      "finalCategoryId": 100054,
      "productId": 8578
    },
    {
      "path": [
        "Embrayage / composants",
        "Butée d’embrayage/butée hydraulique",
        "Clutch Release Bearing/Central Slave Cylinder"
      ],
      "categoryIds": [
        100050,
        null,
        100054
      ],
      "finalCategoryId": 100054,
      "productId": 49
    },
    {
      "path": [
        "Embrayage / composants",
        "Butée d’embrayage/butée hydraulique",
        "Clutch Release Bearing/Central Slave Cylinder"
      ],
      "categoryIds": [
        100050,
        null,
        100054
      ],
      "finalCategoryId": 100054,
      "productId": 4687
    },
    {
      "path": [
        "Embrayage / composants",
        "Butée d’embrayage/butée hydraulique",
        "Clutch Release Bearing/Central Slave Cylinder"
      ],
      "categoryIds": [
        100050,
        null,
        100054
      ],
      "finalCategoryId": 100054,
      "productId": 4837
    },
    {
      "path": [
        "Embrayage / composants",
        "Butée d’embrayage/butée hydraulique",
        "Clutch Release Bearing/Central Slave Cylinder"
      ],
      "categoryIds": [
        100050,
        null,
        100054
      ],
      "finalCategoryId": 100054,
      "productId": 4741
    },
    {
      "path": [
        "Embrayage / composants",
        "Outils",
        "Tools"
      ],
      "categoryIds": [
        100050,
        null,
        103156
      ],
      "finalCategoryId": 103156,
      "productId": 8822
    }
  ],
  "productIdsInArbo": [
    48,
    49,
    155,
    619,
    3378,
    3807,
    4117,
    4687,
    4688,
    4741,
    4837,
    5743,
    8578,
    8822
  ],
  "matchedProductIds": [
    48
  ]
}