{
  "productName": "Cache, fixation rétro extérieur",
  "searchText": "Cache, fixation rétro extérieur",
  "found": true,
  "hasMatch": true,
  "timestamp": "2025-12-02T20:13:16.819Z",
  "productId": 3830,
  "arborescence": {
    "Carrosserie": {
      "categoryId": 100001,
      "categoryName": "Carrosserie",
      "level": 1,
      "children": {
        "Habitacle": {
          "categoryId": null,
          "categoryName": "Habitacle",
          "level": 2,
          "children": {
            "Cache, fixation rétro extérieur": {
              "categoryId": 101690,
              "categoryName": "Passenger Cabin",
              "level": 2,
              "children": {
                "Miroirs": {
                  "categoryId": null,
                  "categoryName": "Miroirs",
                  "level": 4,
                  "children": {
                    "Cache, fixation rétro extérieur": {
                      "categoryId": 101698,
                      "categoryName": "Mirrors",
                      "level": 3,
                      "children": [],
                      "productId": 3830
                    }
                  }
                },
                "Portière avant/composants": {
                  "categoryId": null,
                  "categoryName": "Portière avant/composants",
                  "level": 4,
                  "children": {
                    "Cache, fixation rétro extérieur": {
                      "categoryId": 101694,
                      "categoryName": "Doors/Parts",
                      "level": 3,
                      "children": [],
                      "productId": 3830
                    }
                  }
                }
              },
              "productId": 3830
            }
          }
        },
        "Trappes/capots/portes/toit coul./toit panoram./toit pliant": {
          "categoryId": null,
          "categoryName": "Trappes/capots/portes/toit coul./toit panoram./toit pliant",
          "level": 2,
          "children": {
            "Cache, fixation rétro extérieur": {
              "categoryId": 100746,
              "categoryName": "Hatches/Bonnets/Doors/Sunroof/Panoramic Roof",
              "level": 2,
              "children": {
                "Portière avant/composants": {
                  "categoryId": null,
                  "categoryName": "Portière avant/composants",
                  "level": 4,
                  "children": {
                    "Cache, fixation rétro extérieur": {
                      "categoryId": 100189,
                      "categoryName": "Doors/Parts",
                      "level": 3,
                      "children": [],
                      "productId": 3830
                    }
                  }
                }
              },
              "productId": 3830
            }
          }
        },
        "Vitrages/Miroirs": {
          "categoryId": null,
          "categoryName": "Vitrages/Miroirs",
          "level": 2,
          "children": {
            "Cache, fixation rétro extérieur": {
              "categoryId": 100744,
              "categoryName": "Glazing/Mirrors",
              "level": 2,
              "children": {
                "Miroirs": {
                  "categoryId": null,
                  "categoryName": "Miroirs",
                  "level": 4,
                  "children": {
                    "Cache, fixation rétro extérieur": {
                      "categoryId": 100566,
                      "categoryName": "Mirrors",
                      "level": 3,
                      "children": [],
                      "productId": 3830
                    }
                  }
                }
              },
              "productId": 3830
            }
          }
        }
      }
    }
  },
  "arborescenceText": "└── Carrosserie [ID: 100001] (Niveau 1)\n    ├── Habitacle (Niveau 2)\n    │   └── Passenger Cabin [ID: 101690] (Niveau 2) → ProductId: 3830\n    │       ├── Miroirs (Niveau 4)\n    │       │   └── Mirrors [ID: 101698] (Niveau 3) → ProductId: 3830\n    │       └── Portière avant/composants (Niveau 4)\n    │           └── Doors/Parts [ID: 101694] (Niveau 3) → ProductId: 3830\n    ├── Trappes/capots/portes/toit coul./toit panoram./toit pliant (Niveau 2)\n    │   └── Hatches/Bonnets/Doors/Sunroof/Panoramic Roof [ID: 100746] (Niveau 2) → ProductId: 3830\n    │       └── Portière avant/composants (Niveau 4)\n    │           └── Doors/Parts [ID: 100189] (Niveau 3) → ProductId: 3830\n    └── Vitrages/Miroirs (Niveau 2)\n        └── Glazing/Mirrors [ID: 100744] (Niveau 2) → ProductId: 3830\n            └── Miroirs (Niveau 4)\n                └── Mirrors [ID: 100566] (Niveau 3) → ProductId: 3830",
  "arborescencePaths": [
    {
      "path": [
        "Carrosserie",
        "Habitacle",
        "Passenger Cabin"
      ],
      "categoryIds": [
        100001,
        null,
        101690
      ],
      "finalCategoryId": 101690,
      "productId": 3830
    },
    {
      "path": [
        "Carrosserie",
        "Trappes/capots/portes/toit coul./toit panoram./toit pliant",
        "Hatches/Bonnets/Doors/Sunroof/Panoramic Roof"
      ],
      "categoryIds": [
        100001,
        null,
        100746
      ],
      "finalCategoryId": 100746,
      "productId": 3830
    },
    {
      "path": [
        "Carrosserie",
        "Vitrages/Miroirs",
        "Glazing/Mirrors"
      ],
      "categoryIds": [
        100001,
        null,
        100744
      ],
      "finalCategoryId": 100744,
      "productId": 3830
    }
  ],
  "productIdsInArbo": [
    3830
  ],
  "matchedProductIds": [
    3830
  ]
}