{
  "productName": "Cadre, projecteur longue portée",
  "searchText": "Cadre, projecteur longue portée",
  "found": true,
  "hasMatch": true,
  "timestamp": "2025-12-02T20:13:51.446Z",
  "productId": 715,
  "arborescence": {
    "Carrosserie": {
      "categoryId": 100001,
      "categoryName": "Carrosserie",
      "level": 1,
      "children": {
        "Avant du véhicule": {
          "categoryId": null,
          "categoryName": "Avant du véhicule",
          "level": 2,
          "children": {
            "Cadre, projecteur longue portée": {
              "categoryId": 101648,
              "categoryName": "Vehicle Front",
              "level": 2,
              "children": {
                "Composants/suppléments": {
                  "categoryId": null,
                  "categoryName": "Composants/suppléments",
                  "level": 4,
                  "children": {
                    "Cadre, projecteur longue portée": {
                      "categoryId": 101673,
                      "categoryName": "Parts",
                      "level": 3,
                      "children": {
                        "Fixation/Support/collerette": {
                          "categoryId": null,
                          "categoryName": "Fixation/Support/collerette",
                          "level": 6,
                          "children": {
                            "Cadre, projecteur longue portée": {
                              "categoryId": 101773,
                              "categoryName": "Racks/Carriers/Frames",
                              "level": 4,
                              "children": [],
                              "productId": 715
                            }
                          }
                        }
                      },
                      "productId": 715
                    }
                  }
                },
                "Projecteur longue portée / composants": {
                  "categoryId": null,
                  "categoryName": "Projecteur longue portée / composants",
                  "level": 4,
                  "children": {
                    "Cadre, projecteur longue portée": {
                      "categoryId": 101665,
                      "categoryName": "Spotlight/Parts",
                      "level": 3,
                      "children": {
                        "Projecteur longue portée / composants": {
                          "categoryId": null,
                          "categoryName": "Projecteur longue portée / composants",
                          "level": 6,
                          "children": {
                            "Cadre, projecteur longue portée": {
                              "categoryId": 101668,
                              "categoryName": "Spotlight Parts",
                              "level": 4,
                              "children": [],
                              "productId": 715
                            }
                          }
                        }
                      },
                      "productId": 715
                    }
                  }
                }
              },
              "productId": 715
            }
          }
        },
        "Fixation/Support/collerette": {
          "categoryId": null,
          "categoryName": "Fixation/Support/collerette",
          "level": 2,
          "children": {
            "Cadre, projecteur longue portée": {
              "categoryId": 101454,
              "categoryName": "Racks/Carriers/Frames",
              "level": 2,
              "children": [],
              "productId": 715
            }
          }
        },
        "Phares supplémentaires/composants": {
          "categoryId": null,
          "categoryName": "Phares supplémentaires/composants",
          "level": 2,
          "children": {
            "Cadre, projecteur longue portée": {
              "categoryId": 101340,
              "categoryName": "Additional Headlight/Parts",
              "level": 2,
              "children": {
                "Projecteur longue portée / composants": {
                  "categoryId": null,
                  "categoryName": "Projecteur longue portée / composants",
                  "level": 4,
                  "children": {
                    "Cadre, projecteur longue portée": {
                      "categoryId": 101345,
                      "categoryName": "Spotlight/Parts",
                      "level": 3,
                      "children": {
                        "Projecteur longue portée / composants": {
                          "categoryId": null,
                          "categoryName": "Projecteur longue portée / composants",
                          "level": 6,
                          "children": {
                            "Cadre, projecteur longue portée": {
                              "categoryId": 101348,
                              "categoryName": "Spotlight Parts",
                              "level": 4,
                              "children": [],
                              "productId": 715
                            }
                          }
                        }
                      },
                      "productId": 715
                    }
                  }
                }
              },
              "productId": 715
            }
          }
        }
      }
    },
    "Système électrique": {
      "categoryId": 100010,
      "categoryName": "Système électrique",
      "level": 1,
      "children": {
        "Phares supplémentaires/composants": {
          "categoryId": null,
          "categoryName": "Phares supplémentaires/composants",
          "level": 2,
          "children": {
            "Cadre, projecteur longue portée": {
              "categoryId": 100787,
              "categoryName": "Additional Headlight/Parts",
              "level": 2,
              "children": {
                "Projecteur longue portée / composants": {
                  "categoryId": null,
                  "categoryName": "Projecteur longue portée / composants",
                  "level": 4,
                  "children": {
                    "Cadre, projecteur longue portée": {
                      "categoryId": 100276,
                      "categoryName": "Spotlight/Parts",
                      "level": 3,
                      "children": {
                        "Projecteur longue portée / composants": {
                          "categoryId": null,
                          "categoryName": "Projecteur longue portée / composants",
                          "level": 6,
                          "children": {
                            "Cadre, projecteur longue portée": {
                              "categoryId": 100443,
                              "categoryName": "Spotlight Parts",
                              "level": 4,
                              "children": [],
                              "productId": 715
                            }
                          }
                        }
                      },
                      "productId": 715
                    }
                  }
                }
              },
              "productId": 715
            }
          }
        }
      }
    }
  },
  "arborescenceText": "├── Carrosserie [ID: 100001] (Niveau 1)\n│   ├── Avant du véhicule (Niveau 2)\n│   │   └── Vehicle Front [ID: 101648] (Niveau 2) → ProductId: 715\n│   │       ├── Composants/suppléments (Niveau 4)\n│   │       │   └── Parts [ID: 101673] (Niveau 3) → ProductId: 715\n│   │       │       └── Fixation/Support/collerette (Niveau 6)\n│   │       │           └── Racks/Carriers/Frames [ID: 101773] (Niveau 4) → ProductId: 715\n│   │       └── Projecteur longue portée / composants (Niveau 4)\n│   │           └── Spotlight/Parts [ID: 101665] (Niveau 3) → ProductId: 715\n│   │               └── Projecteur longue portée / composants (Niveau 6)\n│   │                   └── Spotlight Parts [ID: 101668] (Niveau 4) → ProductId: 715\n│   ├── Fixation/Support/collerette (Niveau 2)\n│   │   └── Racks/Carriers/Frames [ID: 101454] (Niveau 2) → ProductId: 715\n│   └── Phares supplémentaires/composants (Niveau 2)\n│       └── Additional Headlight/Parts [ID: 101340] (Niveau 2) → ProductId: 715\n│           └── Projecteur longue portée / composants (Niveau 4)\n│               └── Spotlight/Parts [ID: 101345] (Niveau 3) → ProductId: 715\n│                   └── Projecteur longue portée / composants (Niveau 6)\n│                       └── Spotlight Parts [ID: 101348] (Niveau 4) → ProductId: 715\n\n└── Système électrique [ID: 100010] (Niveau 1)\n    └── Phares supplémentaires/composants (Niveau 2)\n        └── Additional Headlight/Parts [ID: 100787] (Niveau 2) → ProductId: 715\n            └── Projecteur longue portée / composants (Niveau 4)\n                └── Spotlight/Parts [ID: 100276] (Niveau 3) → ProductId: 715\n                    └── Projecteur longue portée / composants (Niveau 6)\n                        └── Spotlight Parts [ID: 100443] (Niveau 4) → ProductId: 715",
  "arborescencePaths": [
    {
      "path": [
        "Carrosserie",
        "Avant du véhicule",
        "Vehicle Front"
      ],
      "categoryIds": [
        100001,
        null,
        101648
      ],
      "finalCategoryId": 101648,
      "productId": 715
    },
    {
      "path": [
        "Carrosserie",
        "Fixation/Support/collerette",
        "Racks/Carriers/Frames"
      ],
      "categoryIds": [
        100001,
        null,
        101454
      ],
      "finalCategoryId": 101454,
      "productId": 715
    },
    {
      "path": [
        "Carrosserie",
        "Phares supplémentaires/composants",
        "Additional Headlight/Parts"
      ],
      "categoryIds": [
        100001,
        null,
        101340
      ],
      "finalCategoryId": 101340,
      "productId": 715
    },
    {
      "path": [
        "Système électrique",
        "Phares supplémentaires/composants",
        "Additional Headlight/Parts"
      ],
      "categoryIds": [
        100010,
        null,
        100787
      ],
      "finalCategoryId": 100787,
      "productId": 715
    }
  ],
  "productIdsInArbo": [
    715
  ],
  "matchedProductIds": [
    715
  ]
}