{
  "productName": "Caméra",
  "searchText": "Caméra",
  "found": true,
  "hasMatch": false,
  "timestamp": "2025-12-02T20:14:17.361Z",
  "productId": 6093,
  "arborescence": {
    "Alimentation carburant": {
      "categoryId": 100214,
      "categoryName": "Alimentation carburant",
      "level": 1,
      "children": {
        "Pompe / accessoires": {
          "categoryId": null,
          "categoryName": "Pompe / accessoires",
          "level": 2,
          "children": {
            "Support, amortisseur de pot de stabilisation": {
              "categoryId": 100251,
              "categoryName": "Pump/Accessories",
              "level": 2,
              "children": {
                "Accessoires/Composants": {
                  "categoryId": null,
                  "categoryName": "Accessoires/Composants",
                  "level": 4,
                  "children": {
                    "Support, amortisseur de pot de stabilisation": {
                      "categoryId": 100718,
                      "categoryName": "Accessories/Parts",
                      "level": 3,
                      "children": [],
                      "productId": 1408
                    }
                  }
                }
              },
              "productId": 1408
            }
          }
        }
      }
    },
    "Boîte de vitesses": {
      "categoryId": 100238,
      "categoryName": "Boîte de vitesses",
      "level": 1,
      "children": {
        "Boîte de vitesse automatique": {
          "categoryId": null,
          "categoryName": "Boîte de vitesse automatique",
          "level": 2,
          "children": {
            "Boîte de dépression, commande de la boîte de vitesse": {
              "categoryId": 100240,
              "categoryName": "Automatic Transmission",
              "level": 2,
              "children": {
                "Contrôle / hydraulique": {
                  "categoryId": null,
                  "categoryName": "Contrôle / hydraulique",
                  "level": 4,
                  "children": {
                    "Boîte de dépression, commande de la boîte de vitesse": {
                      "categoryId": 100776,
                      "categoryName": "Transmission Control/Hydraulics",
                      "level": 3,
                      "children": [],
                      "productId": 1794
                    }
                  }
                }
              },
              "productId": 1794
            }
          }
        },
        "Boîte de vitesses manuelle": {
          "categoryId": null,
          "categoryName": "Boîte de vitesses manuelle",
          "level": 2,
          "children": {
            "Capteur, module de commutation": {
              "categoryId": 100239,
              "categoryName": "Manual Transmission",
              "level": 2,
              "children": {
                "Capteur": {
                  "categoryId": null,
                  "categoryName": "Capteur",
                  "level": 4,
                  "children": {
                    "Capteur, module de commutation": {
                      "categoryId": 102930,
                      "categoryName": "Sensor",
                      "level": 3,
                      "children": [],
                      "productId": 4150
                    }
                  }
                }
              },
              "productId": 4150
            }
          }
        }
      }
    },
    "Carburation": {
      "categoryId": 100254,
      "categoryName": "Carburation",
      "level": 1,
      "children": {
        "Carburateurs": {
          "categoryId": null,
          "categoryName": "Carburateurs",
          "level": 2,
          "children": {
            "Amortisseur de carburateur": {
              "categoryId": 102903,
              "categoryName": "Carburettor System",
              "level": 2,
              "children": {
                "Commande / Amortisseurs / Boîtiers": {
                  "categoryId": null,
                  "categoryName": "Commande / Amortisseurs / Boîtiers",
                  "level": 4,
                  "children": {
                    "Amortisseur de carburateur": {
                      "categoryId": 102910,
                      "categoryName": "Control Linkage/Damper/Chambers",
                      "level": 3,
                      "children": [],
                      "productId": 1151
                    }
                  }
                }
              },
              "productId": 1151
            },
            "Amortisseur de papillon, carburateur": {
              "categoryId": 102903,
              "categoryName": "Carburettor System",
              "level": 2,
              "children": {
                "Commande / Amortisseurs / Boîtiers": {
                  "categoryId": null,
                  "categoryName": "Commande / Amortisseurs / Boîtiers",
                  "level": 4,
                  "children": {
                    "Amortisseur de papillon, carburateur": {
                      "categoryId": 102910,
                      "categoryName": "Control Linkage/Damper/Chambers",
                      "level": 3,
                      "children": [],
                      "productId": 1152
                    }
                  }
                }
              },
              "productId": 1152
            },
            "Boîte de dépression, carburateur": {
              "categoryId": 102903,
              "categoryName": "Carburettor System",
              "level": 2,
              "children": {
                "Commande / Amortisseurs / Boîtiers": {
                  "categoryId": null,
                  "categoryName": "Commande / Amortisseurs / Boîtiers",
                  "level": 4,
                  "children": {
                    "Boîte de dépression, carburateur": {
                      "categoryId": 102910,
                      "categoryName": "Control Linkage/Damper/Chambers",
                      "level": 3,
                      "children": [],
                      "productId": 976
                    }
                  }
                }
              },
              "productId": 976
            },
            "Boîtier de starter, carburateur": {
              "categoryId": 102903,
              "categoryName": "Carburettor System",
              "level": 2,
              "children": {
                "Composants du carburateur": {
                  "categoryId": null,
                  "categoryName": "Composants du carburateur",
                  "level": 4,
                  "children": {
                    "Boîtier de starter, carburateur": {
                      "categoryId": 102906,
                      "categoryName": "Carburettor Parts",
                      "level": 3,
                      "children": [],
                      "productId": 1972
                    }
                  }
                }
              },
              "productId": 1972
            },
            "Câble d'accélération": {
              "categoryId": 102903,
              "categoryName": "Carburettor System",
              "level": 2,
              "children": {
                "Commande / Amortisseurs / Boîtiers": {
                  "categoryId": null,
                  "categoryName": "Commande / Amortisseurs / Boîtiers",
                  "level": 4,
                  "children": {
                    "Câble d'accélération": {
                      "categoryId": 102910,
                      "categoryName": "Control Linkage/Damper/Chambers",
                      "level": 3,
                      "children": [],
                      "productId": 618
                    }
                  }
                }
              },
              "productId": 618
            },
            "Gaine de protection, câble d'accélérateur": {
              "categoryId": 102903,
              "categoryName": "Carburettor System",
              "level": 2,
              "children": {
                "Commande / Amortisseurs / Boîtiers": {
                  "categoryId": null,
                  "categoryName": "Commande / Amortisseurs / Boîtiers",
                  "level": 4,
                  "children": {
                    "Gaine de protection, câble d'accélérateur": {
                      "categoryId": 102910,
                      "categoryName": "Control Linkage/Damper/Chambers",
                      "level": 3,
                      "children": [],
                      "productId": 5980
                    }
                  }
                }
              },
              "productId": 5980
            },
            "Levier, carburateur": {
              "categoryId": 102903,
              "categoryName": "Carburettor System",
              "level": 2,
              "children": {
                "Commande / Amortisseurs / Boîtiers": {
                  "categoryId": null,
                  "categoryName": "Commande / Amortisseurs / Boîtiers",
                  "level": 4,
                  "children": {
                    "Levier, carburateur": {
                      "categoryId": 102910,
                      "categoryName": "Control Linkage/Damper/Chambers",
                      "level": 3,
                      "children": [],
                      "productId": 1939
                    }
                  }
                }
              },
              "productId": 1939
            },
            "Ressort, conmmande d'accélération": {
              "categoryId": 102903,
              "categoryName": "Carburettor System",
              "level": 2,
              "children": {
                "Commande / Amortisseurs / Boîtiers": {
                  "categoryId": null,
                  "categoryName": "Commande / Amortisseurs / Boîtiers",
                  "level": 4,
                  "children": {
                    "Ressort, conmmande d'accélération": {
                      "categoryId": 102910,
                      "categoryName": "Control Linkage/Damper/Chambers",
                      "level": 3,
                      "children": [],
                      "productId": 1755
                    }
                  }
                },
                "Composants du carburateur": {
                  "categoryId": null,
                  "categoryName": "Composants du carburateur",
                  "level": 4,
                  "children": {
                    "Ressort, conmmande d'accélération": {
                      "categoryId": 102906,
                      "categoryName": "Carburettor Parts",
                      "level": 3,
                      "children": [],
                      "productId": 1755
                    }
                  }
                }
              },
              "productId": 1755
            },
            "Tirette à câble, contrôle de démarrage à froid": {
              "categoryId": 102903,
              "categoryName": "Carburettor System",
              "level": 2,
              "children": {
                "Commande / Amortisseurs / Boîtiers": {
                  "categoryId": null,
                  "categoryName": "Commande / Amortisseurs / Boîtiers",
                  "level": 4,
                  "children": {
                    "Tirette à câble, contrôle de démarrage à froid": {
                      "categoryId": 102910,
                      "categoryName": "Control Linkage/Damper/Chambers",
                      "level": 3,
                      "children": [],
                      "productId": 4736
                    }
                  }
                }
              },
              "productId": 4736
            },
            "Vis de serrage, câble de carburateur": {
              "categoryId": 102903,
              "categoryName": "Carburettor System",
              "level": 2,
              "children": {
                "Commande / Amortisseurs / Boîtiers": {
                  "categoryId": null,
                  "categoryName": "Commande / Amortisseurs / Boîtiers",
                  "level": 4,
                  "children": {
                    "Vis de serrage, câble de carburateur": {
                      "categoryId": 102910,
                      "categoryName": "Control Linkage/Damper/Chambers",
                      "level": 3,
                      "children": [],
                      "productId": 60004
                    }
                  }
                }
              },
              "productId": 60004
            }
          }
        },
        "Mélange air-carburant": {
          "categoryId": null,
          "categoryName": "Mélange air-carburant",
          "level": 2,
          "children": {
            "Capteur, pression de la chambre de combustion": {
              "categoryId": 102793,
              "categoryName": "Mixture Formation",
              "level": 2,
              "children": {
                "Capteur/sonde lambda": {
                  "categoryId": null,
                  "categoryName": "Capteur/sonde lambda",
                  "level": 4,
                  "children": {
                    "Capteur, pression de la chambre de combustion": {
                      "categoryId": 102809,
                      "categoryName": "Sensor/Probe",
                      "level": 3,
                      "children": [],
                      "productId": 60924
                    }
                  }
                }
              },
              "productId": 60924
            },
            "Outil de nettoyage/fraisage, préchambre de buse d’injection": {
              "categoryId": 102793,
              "categoryName": "Mixture Formation",
              "level": 2,
              "children": {
                "Outils": {
                  "categoryId": null,
                  "categoryName": "Outils",
                  "level": 4,
                  "children": {
                    "Outil de nettoyage/fraisage, préchambre de buse d’injection": {
                      "categoryId": 103150,
                      "categoryName": "Tools",
                      "level": 3,
                      "children": [],
                      "productId": 8511
                    }
                  }
                }
              },
              "productId": 8511
            }
          }
        }
      }
    },
    "Moteur": {
      "categoryId": 100002,
      "categoryName": "Moteur",
      "level": 1,
      "children": {
        "Alimentation en air": {
          "categoryId": null,
          "categoryName": "Alimentation en air",
          "level": 2,
          "children": {
            "Câble d'accélération": {
              "categoryId": 100383,
              "categoryName": "Air Supply",
              "level": 2,
              "children": {
                "Câble d'accélérateur/tringlerie": {
                  "categoryId": null,
                  "categoryName": "Câble d'accélérateur/tringlerie",
                  "level": 4,
                  "children": {
                    "Câble d'accélération": {
                      "categoryId": 100385,
                      "categoryName": "Accelerator Cable/Linkage",
                      "level": 3,
                      "children": [],
                      "productId": 618
                    }
                  }
                }
              },
              "productId": 618
            },
            "Gaine de protection, câble d'accélérateur": {
              "categoryId": 100383,
              "categoryName": "Air Supply",
              "level": 2,
              "children": {
                "Câble d'accélérateur/tringlerie": {
                  "categoryId": null,
                  "categoryName": "Câble d'accélérateur/tringlerie",
                  "level": 4,
                  "children": {
                    "Gaine de protection, câble d'accélérateur": {
                      "categoryId": 100385,
                      "categoryName": "Accelerator Cable/Linkage",
                      "level": 3,
                      "children": [],
                      "productId": 5980
                    }
                  }
                }
              },
              "productId": 5980
            }
          }
        },
        "Culasse / pieces de montage": {
          "categoryId": null,
          "categoryName": "Culasse / pieces de montage",
          "level": 2,
          "children": {
            "Bague d'étanchéité, préchambre": {
              "categoryId": 100373,
              "categoryName": "Cylinder Head/Attachment Parts",
              "level": 2,
              "children": {
                "Culasse": {
                  "categoryId": null,
                  "categoryName": "Culasse",
                  "level": 4,
                  "children": {
                    "Bague d'étanchéité, préchambre": {
                      "categoryId": 100380,
                      "categoryName": "Cylinder Head",
                      "level": 3,
                      "children": [],
                      "productId": 2906
                    }
                  }
                }
              },
              "productId": 2906
            },
            "Préchambre": {
              "categoryId": 100373,
              "categoryName": "Cylinder Head/Attachment Parts",
              "level": 2,
              "children": {
                "Culasse": {
                  "categoryId": null,
                  "categoryName": "Culasse",
                  "level": 4,
                  "children": {
                    "Préchambre": {
                      "categoryId": 100380,
                      "categoryName": "Cylinder Head",
                      "level": 3,
                      "children": [],
                      "productId": 1648
                    }
                  }
                }
              },
              "productId": 1648
            }
          }
        },
        "Distribution moteur": {
          "categoryId": null,
          "categoryName": "Distribution moteur",
          "level": 2,
          "children": {
            "Joint, couvercle de la chambre du pilon": {
              "categoryId": 100003,
              "categoryName": "Engine Timing",
              "level": 2,
              "children": {
                "Poussoir /tige/ tuyau de protection": {
                  "categoryId": null,
                  "categoryName": "Poussoir /tige/ tuyau de protection",
                  "level": 4,
                  "children": {
                    "Joint, couvercle de la chambre du pilon": {
                      "categoryId": 100399,
                      "categoryName": "Tappet/Push Rod/Push Rod Protection Tube",
                      "level": 3,
                      "children": [],
                      "productId": 3814
                    }
                  }
                }
              },
              "productId": 3814
            }
          }
        },
        "Joints": {
          "categoryId": null,
          "categoryName": "Joints",
          "level": 2,
          "children": {
            "Joint, couvercle de la chambre du pilon": {
              "categoryId": 100223,
              "categoryName": "Gaskets",
              "level": 2,
              "children": {
                "Joint de carter de distribution": {
                  "categoryId": null,
                  "categoryName": "Joint de carter de distribution",
                  "level": 4,
                  "children": {
                    "Joint, couvercle de la chambre du pilon": {
                      "categoryId": 100235,
                      "categoryName": "Timing Case Gasket",
                      "level": 3,
                      "children": [],
                      "productId": 3814
                    }
                  }
                }
              },
              "productId": 3814
            }
          }
        },
        "Outils": {
          "categoryId": null,
          "categoryName": "Outils",
          "level": 2,
          "children": {
            "Clé à douille, Préchambre": {
              "categoryId": 103129,
              "categoryName": "Tools",
              "level": 2,
              "children": [],
              "productId": 4525
            },
            "Extracteur par impact, préchambre": {
              "categoryId": 103129,
              "categoryName": "Tools",
              "level": 2,
              "children": [],
              "productId": 8159
            }
          }
        }
      }
    },
    "Système d'information et de communication": {
      "categoryId": 100339,
      "categoryName": "Système d'information et de communication",
      "level": 1,
      "children": {
        "Système audio": {
          "categoryId": null,
          "categoryName": "Système audio",
          "level": 2,
          "children": {
            "Câble de connexion, interface mulitmédia": {
              "categoryId": 100694,
              "categoryName": "Audio System",
              "level": 2,
              "children": [],
              "productId": 60205
            },
            "Interface multimédia": {
              "categoryId": 100694,
              "categoryName": "Audio System",
              "level": 2,
              "children": [],
              "productId": 60204
            },
            "Interface, caméra de recul": {
              "categoryId": 100694,
              "categoryName": "Audio System",
              "level": 2,
              "children": [],
              "productId": 60824
            },
            "Interface, caméra de recul (réglage d'usine)": {
              "categoryId": 100694,
              "categoryName": "Audio System",
              "level": 2,
              "children": [],
              "productId": 60836
            }
          }
        }
      }
    },
    "Système électrique": {
      "categoryId": 100010,
      "categoryName": "Système électrique",
      "level": 1,
      "children": {
        "Capteurs": {
          "categoryId": null,
          "categoryName": "Capteurs",
          "level": 2,
          "children": {
            "Capteur, pression de la chambre de combustion": {
              "categoryId": 102747,
              "categoryName": "Sensors",
              "level": 2,
              "children": [],
              "productId": 60924
            }
          }
        },
        "Kit/pièces de câble": {
          "categoryId": null,
          "categoryName": "Kit/pièces de câble",
          "level": 2,
          "children": {
            "Kit réparation de câble, caméra": {
              "categoryId": 103066,
              "categoryName": "Cable Set/individual parts",
              "level": 2,
              "children": [],
              "productId": 9874
            }
          }
        },
        "Phares supplémentaires/composants": {
          "categoryId": null,
          "categoryName": "Phares supplémentaires/composants",
          "level": 2,
          "children": {
            "Éclairage de virage": {
              "categoryId": 100787,
              "categoryName": "Additional Headlight/Parts",
              "level": 2,
              "children": {
                "Éclairage de virage/composants": {
                  "categoryId": null,
                  "categoryName": "Éclairage de virage/composants",
                  "level": 4,
                  "children": {
                    "Éclairage de virage": {
                      "categoryId": 102671,
                      "categoryName": "Cornering Light/Parts",
                      "level": 3,
                      "children": [],
                      "productId": 3681
                    }
                  }
                }
              },
              "productId": 3681
            }
          }
        }
      }
    },
    "Systèmes de confort": {
      "categoryId": 100335,
      "categoryName": "Systèmes de confort",
      "level": 1,
      "children": {
        "Aide au stationnement/Alarme de marche arrière": {
          "categoryId": null,
          "categoryName": "Aide au stationnement/Alarme de marche arrière",
          "level": 2,
          "children": {
            "Caméra de marche arrière, aide au stationnement": {
              "categoryId": 100618,
              "categoryName": "park distance control/Back-up Alarm",
              "level": 2,
              "children": [],
              "productId": 3817
            },
            "Écran, aide au stationnement": {
              "categoryId": 100618,
              "categoryName": "park distance control/Back-up Alarm",
              "level": 2,
              "children": [],
              "productId": 3819
            }
          }
        },
        "Caméra": {
          "categoryId": null,
          "categoryName": "Caméra",
          "level": 2,
          "children": {
            "Caméra avant": {
              "categoryId": 706838,
              "categoryName": "Camera",
              "level": 2,
              "children": [],
              "productId": 61094
            }
          }
        }
      }
    },
    "Systèmes de sécurité": {
      "categoryId": 100417,
      "categoryName": "Systèmes de sécurité",
      "level": 1,
      "children": {
        "Assistant-changement de voie": {
          "categoryId": null,
          "categoryName": "Assistant-changement de voie",
          "level": 2,
          "children": {
            "Support de Caméra, assistant de maintien de voie": {
              "categoryId": 104739,
              "categoryName": "Lane Changing Assist",
              "level": 2,
              "children": [],
              "productId": 60651
            }
          }
        }
      }
    }
  },
  "arborescenceText": "├── Alimentation carburant [ID: 100214] (Niveau 1)\n│   └── Pompe / accessoires (Niveau 2)\n│       └── Pump/Accessories [ID: 100251] (Niveau 2) → ProductId: 1408\n│           └── Accessoires/Composants (Niveau 4)\n│               └── Accessories/Parts [ID: 100718] (Niveau 3) → ProductId: 1408\n\n├── Boîte de vitesses [ID: 100238] (Niveau 1)\n│   ├── Boîte de vitesse automatique (Niveau 2)\n│   │   └── Automatic Transmission [ID: 100240] (Niveau 2) → ProductId: 1794\n│   │       └── Contrôle / hydraulique (Niveau 4)\n│   │           └── Transmission Control/Hydraulics [ID: 100776] (Niveau 3) → ProductId: 1794\n│   └── Boîte de vitesses manuelle (Niveau 2)\n│       └── Manual Transmission [ID: 100239] (Niveau 2) → ProductId: 4150\n│           └── Capteur (Niveau 4)\n│               └── Sensor [ID: 102930] (Niveau 3) → ProductId: 4150\n\n├── Carburation [ID: 100254] (Niveau 1)\n│   ├── Carburateurs (Niveau 2)\n│   │   ├── Carburettor System [ID: 102903] (Niveau 2) → ProductId: 1151\n│   │   │   └── Commande / Amortisseurs / Boîtiers (Niveau 4)\n│   │   │       └── Control Linkage/Damper/Chambers [ID: 102910] (Niveau 3) → ProductId: 1151\n│   │   ├── Carburettor System [ID: 102903] (Niveau 2) → ProductId: 1152\n│   │   │   └── Commande / Amortisseurs / Boîtiers (Niveau 4)\n│   │   │       └── Control Linkage/Damper/Chambers [ID: 102910] (Niveau 3) → ProductId: 1152\n│   │   ├── Carburettor System [ID: 102903] (Niveau 2) → ProductId: 976\n│   │   │   └── Commande / Amortisseurs / Boîtiers (Niveau 4)\n│   │   │       └── Control Linkage/Damper/Chambers [ID: 102910] (Niveau 3) → ProductId: 976\n│   │   ├── Carburettor System [ID: 102903] (Niveau 2) → ProductId: 1972\n│   │   │   └── Composants du carburateur (Niveau 4)\n│   │   │       └── Carburettor Parts [ID: 102906] (Niveau 3) → ProductId: 1972\n│   │   ├── Carburettor System [ID: 102903] (Niveau 2) → ProductId: 618\n│   │   │   └── Commande / Amortisseurs / Boîtiers (Niveau 4)\n│   │   │       └── Control Linkage/Damper/Chambers [ID: 102910] (Niveau 3) → ProductId: 618\n│   │   ├── Carburettor System [ID: 102903] (Niveau 2) → ProductId: 5980\n│   │   │   └── Commande / Amortisseurs / Boîtiers (Niveau 4)\n│   │   │       └── Control Linkage/Damper/Chambers [ID: 102910] (Niveau 3) → ProductId: 5980\n│   │   ├── Carburettor System [ID: 102903] (Niveau 2) → ProductId: 1939\n│   │   │   └── Commande / Amortisseurs / Boîtiers (Niveau 4)\n│   │   │       └── Control Linkage/Damper/Chambers [ID: 102910] (Niveau 3) → ProductId: 1939\n│   │   ├── Carburettor System [ID: 102903] (Niveau 2) → ProductId: 1755\n│   │   │   ├── Commande / Amortisseurs / Boîtiers (Niveau 4)\n│   │   │   │   └── Control Linkage/Damper/Chambers [ID: 102910] (Niveau 3) → ProductId: 1755\n│   │   │   └── Composants du carburateur (Niveau 4)\n│   │   │       └── Carburettor Parts [ID: 102906] (Niveau 3) → ProductId: 1755\n│   │   ├── Carburettor System [ID: 102903] (Niveau 2) → ProductId: 4736\n│   │   │   └── Commande / Amortisseurs / Boîtiers (Niveau 4)\n│   │   │       └── Control Linkage/Damper/Chambers [ID: 102910] (Niveau 3) → ProductId: 4736\n│   │   └── Carburettor System [ID: 102903] (Niveau 2) → ProductId: 60004\n│   │       └── Commande / Amortisseurs / Boîtiers (Niveau 4)\n│   │           └── Control Linkage/Damper/Chambers [ID: 102910] (Niveau 3) → ProductId: 60004\n│   └── Mélange air-carburant (Niveau 2)\n│       ├── Mixture Formation [ID: 102793] (Niveau 2) → ProductId: 60924\n│       │   └── Capteur/sonde lambda (Niveau 4)\n│       │       └── Sensor/Probe [ID: 102809] (Niveau 3) → ProductId: 60924\n│       └── Mixture Formation [ID: 102793] (Niveau 2) → ProductId: 8511\n│           └── Outils (Niveau 4)\n│               └── Tools [ID: 103150] (Niveau 3) → ProductId: 8511\n\n├── Moteur [ID: 100002] (Niveau 1)\n│   ├── Alimentation en air (Niveau 2)\n│   │   ├── Air Supply [ID: 100383] (Niveau 2) → ProductId: 618\n│   │   │   └── Câble d'accélérateur/tringlerie (Niveau 4)\n│   │   │       └── Accelerator Cable/Linkage [ID: 100385] (Niveau 3) → ProductId: 618\n│   │   └── Air Supply [ID: 100383] (Niveau 2) → ProductId: 5980\n│   │       └── Câble d'accélérateur/tringlerie (Niveau 4)\n│   │           └── Accelerator Cable/Linkage [ID: 100385] (Niveau 3) → ProductId: 5980\n│   ├── Culasse / pieces de montage (Niveau 2)\n│   │   ├── Cylinder Head/Attachment Parts [ID: 100373] (Niveau 2) → ProductId: 2906\n│   │   │   └── Culasse (Niveau 4)\n│   │   │       └── Cylinder Head [ID: 100380] (Niveau 3) → ProductId: 2906\n│   │   └── Cylinder Head/Attachment Parts [ID: 100373] (Niveau 2) → ProductId: 1648\n│   │       └── Culasse (Niveau 4)\n│   │           └── Cylinder Head [ID: 100380] (Niveau 3) → ProductId: 1648\n│   ├── Distribution moteur (Niveau 2)\n│   │   └── Engine Timing [ID: 100003] (Niveau 2) → ProductId: 3814\n│   │       └── Poussoir /tige/ tuyau de protection (Niveau 4)\n│   │           └── Tappet/Push Rod/Push Rod Protection Tube [ID: 100399] (Niveau 3) → ProductId: 3814\n│   ├── Joints (Niveau 2)\n│   │   └── Gaskets [ID: 100223] (Niveau 2) → ProductId: 3814\n│   │       └── Joint de carter de distribution (Niveau 4)\n│   │           └── Timing Case Gasket [ID: 100235] (Niveau 3) → ProductId: 3814\n│   └── Outils (Niveau 2)\n│       ├── Tools [ID: 103129] (Niveau 2) → ProductId: 4525\n│       └── Tools [ID: 103129] (Niveau 2) → ProductId: 8159\n\n├── Système d'information et de communication [ID: 100339] (Niveau 1)\n│   └── Système audio (Niveau 2)\n│       ├── Audio System [ID: 100694] (Niveau 2) → ProductId: 60205\n│       ├── Audio System [ID: 100694] (Niveau 2) → ProductId: 60204\n│       ├── Audio System [ID: 100694] (Niveau 2) → ProductId: 60824\n│       └── Audio System [ID: 100694] (Niveau 2) → ProductId: 60836\n\n├── Système électrique [ID: 100010] (Niveau 1)\n│   ├── Capteurs (Niveau 2)\n│   │   └── Sensors [ID: 102747] (Niveau 2) → ProductId: 60924\n│   ├── Kit/pièces de câble (Niveau 2)\n│   │   └── Cable Set/individual parts [ID: 103066] (Niveau 2) → ProductId: 9874\n│   └── Phares supplémentaires/composants (Niveau 2)\n│       └── Additional Headlight/Parts [ID: 100787] (Niveau 2) → ProductId: 3681\n│           └── Éclairage de virage/composants (Niveau 4)\n│               └── Cornering Light/Parts [ID: 102671] (Niveau 3) → ProductId: 3681\n\n├── Systèmes de confort [ID: 100335] (Niveau 1)\n│   ├── Aide au stationnement/Alarme de marche arrière (Niveau 2)\n│   │   ├── park distance control/Back-up Alarm [ID: 100618] (Niveau 2) → ProductId: 3817\n│   │   └── park distance control/Back-up Alarm [ID: 100618] (Niveau 2) → ProductId: 3819\n│   └── Caméra (Niveau 2)\n│       └── Camera [ID: 706838] (Niveau 2) → ProductId: 61094\n\n└── Systèmes de sécurité [ID: 100417] (Niveau 1)\n    └── Assistant-changement de voie (Niveau 2)\n        └── Lane Changing Assist [ID: 104739] (Niveau 2) → ProductId: 60651",
  "arborescencePaths": [
    {
      "path": [
        "Alimentation carburant",
        "Pompe / accessoires",
        "Pump/Accessories"
      ],
      "categoryIds": [
        100214,
        null,
        100251
      ],
      "finalCategoryId": 100251,
      "productId": 1408
    },
    {
      "path": [
        "Boîte de vitesses",
        "Boîte de vitesse automatique",
        "Automatic Transmission"
      ],
      "categoryIds": [
        100238,
        null,
        100240
      ],
      "finalCategoryId": 100240,
      "productId": 1794
    },
    {
      "path": [
        "Boîte de vitesses",
        "Boîte de vitesses manuelle",
        "Manual Transmission"
      ],
      "categoryIds": [
        100238,
        null,
        100239
      ],
      "finalCategoryId": 100239,
      "productId": 4150
    },
    {
      "path": [
        "Carburation",
        "Carburateurs",
        "Carburettor System"
      ],
      "categoryIds": [
        100254,
        null,
        102903
      ],
      "finalCategoryId": 102903,
      "productId": 1151
    },
    {
      "path": [
        "Carburation",
        "Carburateurs",
        "Carburettor System"
      ],
      "categoryIds": [
        100254,
        null,
        102903
      ],
      "finalCategoryId": 102903,
      "productId": 1152
    },
    {
      "path": [
        "Carburation",
        "Carburateurs",
        "Carburettor System"
      ],
      "categoryIds": [
        100254,
        null,
        102903
      ],
      "finalCategoryId": 102903,
      "productId": 976
    },
    {
      "path": [
        "Carburation",
        "Carburateurs",
        "Carburettor System"
      ],
      "categoryIds": [
        100254,
        null,
        102903
      ],
      "finalCategoryId": 102903,
      "productId": 1972
    },
    {
      "path": [
        "Carburation",
        "Carburateurs",
        "Carburettor System"
      ],
      "categoryIds": [
        100254,
        null,
        102903
      ],
      "finalCategoryId": 102903,
      "productId": 618
    },
    {
      "path": [
        "Carburation",
        "Carburateurs",
        "Carburettor System"
      ],
      "categoryIds": [
        100254,
        null,
        102903
      ],
      "finalCategoryId": 102903,
      "productId": 5980
    },
    {
      "path": [
        "Carburation",
        "Carburateurs",
        "Carburettor System"
      ],
      "categoryIds": [
        100254,
        null,
        102903
      ],
      "finalCategoryId": 102903,
      "productId": 1939
    },
    {
      "path": [
        "Carburation",
        "Carburateurs",
        "Carburettor System"
      ],
      "categoryIds": [
        100254,
        null,
        102903
      ],
      "finalCategoryId": 102903,
      "productId": 1755
    },
    {
      "path": [
        "Carburation",
        "Carburateurs",
        "Carburettor System"
      ],
      "categoryIds": [
        100254,
        null,
        102903
      ],
      "finalCategoryId": 102903,
      "productId": 4736
    },
    {
      "path": [
        "Carburation",
        "Carburateurs",
        "Carburettor System"
      ],
      "categoryIds": [
        100254,
        null,
        102903
      ],
      "finalCategoryId": 102903,
      "productId": 60004
    },
    {
      "path": [
        "Carburation",
        "Mélange air-carburant",
        "Mixture Formation"
      ],
      "categoryIds": [
        100254,
        null,
        102793
      ],
      "finalCategoryId": 102793,
      "productId": 60924
    },
    {
      "path": [
        "Carburation",
        "Mélange air-carburant",
        "Mixture Formation"
      ],
      "categoryIds": [
        100254,
        null,
        102793
      ],
      "finalCategoryId": 102793,
      "productId": 8511
    },
    {
      "path": [
        "Moteur",
        "Alimentation en air",
        "Air Supply"
      ],
      "categoryIds": [
        100002,
        null,
        100383
      ],
      "finalCategoryId": 100383,
      "productId": 618
    },
    {
      "path": [
        "Moteur",
        "Alimentation en air",
        "Air Supply"
      ],
      "categoryIds": [
        100002,
        null,
        100383
      ],
      "finalCategoryId": 100383,
      "productId": 5980
    },
    {
      "path": [
        "Moteur",
        "Culasse / pieces de montage",
        "Cylinder Head/Attachment Parts"
      ],
      "categoryIds": [
        100002,
        null,
        100373
      ],
      "finalCategoryId": 100373,
      "productId": 2906
    },
    {
      "path": [
        "Moteur",
        "Culasse / pieces de montage",
        "Cylinder Head/Attachment Parts"
      ],
      "categoryIds": [
        100002,
        null,
        100373
      ],
      "finalCategoryId": 100373,
      "productId": 1648
    },
    {
      "path": [
        "Moteur",
        "Distribution moteur",
        "Engine Timing"
      ],
      "categoryIds": [
        100002,
        null,
        100003
      ],
      "finalCategoryId": 100003,
      "productId": 3814
    },
    {
      "path": [
        "Moteur",
        "Joints",
        "Gaskets"
      ],
      "categoryIds": [
        100002,
        null,
        100223
      ],
      "finalCategoryId": 100223,
      "productId": 3814
    },
    {
      "path": [
        "Moteur",
        "Outils",
        "Tools"
      ],
      "categoryIds": [
        100002,
        null,
        103129
      ],
      "finalCategoryId": 103129,
      "productId": 4525
    },
    {
      "path": [
        "Moteur",
        "Outils",
        "Tools"
      ],
      "categoryIds": [
        100002,
        null,
        103129
      ],
      "finalCategoryId": 103129,
      "productId": 8159
    },
    {
      "path": [
        "Système d'information et de communication",
        "Système audio",
        "Audio System"
      ],
      "categoryIds": [
        100339,
        null,
        100694
      ],
      "finalCategoryId": 100694,
      "productId": 60205
    },
    {
      "path": [
        "Système d'information et de communication",
        "Système audio",
        "Audio System"
      ],
      "categoryIds": [
        100339,
        null,
        100694
      ],
      "finalCategoryId": 100694,
      "productId": 60204
    },
    {
      "path": [
        "Système d'information et de communication",
        "Système audio",
        "Audio System"
      ],
      "categoryIds": [
        100339,
        null,
        100694
      ],
      "finalCategoryId": 100694,
      "productId": 60824
    },
    {
      "path": [
        "Système d'information et de communication",
        "Système audio",
        "Audio System"
      ],
      "categoryIds": [
        100339,
        null,
        100694
      ],
      "finalCategoryId": 100694,
      "productId": 60836
    },
    {
      "path": [
        "Système électrique",
        "Capteurs",
        "Sensors"
      ],
      "categoryIds": [
        100010,
        null,
        102747
      ],
      "finalCategoryId": 102747,
      "productId": 60924
    },
    {
      "path": [
        "Système électrique",
        "Kit/pièces de câble",
        "Cable Set/individual parts"
      ],
      "categoryIds": [
        100010,
        null,
        103066
      ],
      "finalCategoryId": 103066,
      "productId": 9874
    },
    {
      "path": [
        "Système électrique",
        "Phares supplémentaires/composants",
        "Additional Headlight/Parts"
      ],
      "categoryIds": [
        100010,
        null,
        100787
      ],
      "finalCategoryId": 100787,
      "productId": 3681
    },
    {
      "path": [
        "Systèmes de confort",
        "Aide au stationnement/Alarme de marche arrière",
        "park distance control/Back-up Alarm"
      ],
      "categoryIds": [
        100335,
        null,
        100618
      ],
      "finalCategoryId": 100618,
      "productId": 3817
    },
    {
      "path": [
        "Systèmes de confort",
        "Aide au stationnement/Alarme de marche arrière",
        "park distance control/Back-up Alarm"
      ],
      "categoryIds": [
        100335,
        null,
        100618
      ],
      "finalCategoryId": 100618,
      "productId": 3819
    },
    {
      "path": [
        "Systèmes de confort",
        "Caméra",
        "Camera"
      ],
      "categoryIds": [
        100335,
        null,
        706838
      ],
      "finalCategoryId": 706838,
      "productId": 61094
    },
    {
      "path": [
        "Systèmes de sécurité",
        "Assistant-changement de voie",
        "Lane Changing Assist"
      ],
      "categoryIds": [
        100417,
        null,
        104739
      ],
      "finalCategoryId": 104739,
      "productId": 60651
    }
  ],
  "productIdsInArbo": [
    618,
    976,
    1151,
    1152,
    1408,
    1648,
    1755,
    1794,
    1939,
    1972,
    2906,
    3681,
    3814,
    3817,
    3819,
    4150,
    4525,
    4736,
    5980,
    8159,
    8511,
    9874,
    60004,
    60204,
    60205,
    60651,
    60824,
    60836,
    60924,
    61094
  ],
  "closestProductIds": [
    {
      "productId": 618,
      "productName": "Câble d'accélération"
    },
    {
      "productId": 976,
      "productName": "Boîte de dépression, carburateur"
    },
    {
      "productId": 1151,
      "productName": "Amortisseur de carburateur"
    },
    {
      "productId": 1152,
      "productName": "Amortisseur de papillon, carburateur"
    },
    {
      "productId": 1408,
      "productName": "Support, amortisseur de pot de stabilisation"
    }
  ]
}