{
  "productName": "Capot-moteur",
  "searchText": "Capot-moteur",
  "found": true,
  "hasMatch": true,
  "timestamp": "2025-12-02T20:14:31.327Z",
  "productId": 531,
  "arborescence": {
    "Carrosserie": {
      "categoryId": 100001,
      "categoryName": "Carrosserie",
      "level": 1,
      "children": {
        "Arrière de la voiture": {
          "categoryId": null,
          "categoryName": "Arrière de la voiture",
          "level": 2,
          "children": {
            "Butoir, capot-moteur": {
              "categoryId": 101705,
              "categoryName": "Vehicle Rear",
              "level": 2,
              "children": {
                "Capot avant / composants / insonorisation": {
                  "categoryId": null,
                  "categoryName": "Capot avant / composants / insonorisation",
                  "level": 4,
                  "children": {
                    "Butoir, capot-moteur": {
                      "categoryId": 101783,
                      "categoryName": "Bonnet/Parts/Noise Insulation",
                      "level": 3,
                      "children": [],
                      "productId": 1708
                    }
                  }
                }
              },
              "productId": 1708
            },
            "Capot-moteur": {
              "categoryId": 101705,
              "categoryName": "Vehicle Rear",
              "level": 2,
              "children": {
                "Capot avant / composants / insonorisation": {
                  "categoryId": null,
                  "categoryName": "Capot avant / composants / insonorisation",
                  "level": 4,
                  "children": {
                    "Capot-moteur": {
                      "categoryId": 101783,
                      "categoryName": "Bonnet/Parts/Noise Insulation",
                      "level": 3,
                      "children": [],
                      "productId": 531
                    }
                  }
                }
              },
              "productId": 531
            },
            "Charnière, capot-moteur": {
              "categoryId": 101705,
              "categoryName": "Vehicle Rear",
              "level": 2,
              "children": {
                "Capot avant / composants / insonorisation": {
                  "categoryId": null,
                  "categoryName": "Capot avant / composants / insonorisation",
                  "level": 4,
                  "children": {
                    "Charnière, capot-moteur": {
                      "categoryId": 101783,
                      "categoryName": "Bonnet/Parts/Noise Insulation",
                      "level": 3,
                      "children": [],
                      "productId": 740
                    }
                  }
                }
              },
              "productId": 740
            },
            "Joint, capot-moteur": {
              "categoryId": 101705,
              "categoryName": "Vehicle Rear",
              "level": 2,
              "children": {
                "Capot avant / composants / insonorisation": {
                  "categoryId": null,
                  "categoryName": "Capot avant / composants / insonorisation",
                  "level": 4,
                  "children": {
                    "Joint, capot-moteur": {
                      "categoryId": 101783,
                      "categoryName": "Bonnet/Parts/Noise Insulation",
                      "level": 3,
                      "children": [],
                      "productId": 4211
                    }
                  }
                }
              },
              "productId": 4211
            },
            "Kit d'assemblage, capot-moteur": {
              "categoryId": 101705,
              "categoryName": "Vehicle Rear",
              "level": 2,
              "children": {
                "Capot avant / composants / insonorisation": {
                  "categoryId": null,
                  "categoryName": "Capot avant / composants / insonorisation",
                  "level": 4,
                  "children": {
                    "Kit d'assemblage, capot-moteur": {
                      "categoryId": 101783,
                      "categoryName": "Bonnet/Parts/Noise Insulation",
                      "level": 3,
                      "children": [],
                      "productId": 3714
                    }
                  }
                }
              },
              "productId": 3714
            }
          }
        },
        "Avant du véhicule": {
          "categoryId": null,
          "categoryName": "Avant du véhicule",
          "level": 2,
          "children": {
            "Butoir, capot-moteur": {
              "categoryId": 101648,
              "categoryName": "Vehicle Front",
              "level": 2,
              "children": {
                "Capot avant / composants / insonorisation": {
                  "categoryId": null,
                  "categoryName": "Capot avant / composants / insonorisation",
                  "level": 4,
                  "children": {
                    "Butoir, capot-moteur": {
                      "categoryId": 101654,
                      "categoryName": "Bonnet/Parts/Noise Insulation",
                      "level": 3,
                      "children": [],
                      "productId": 1708
                    }
                  }
                }
              },
              "productId": 1708
            },
            "Capot-moteur": {
              "categoryId": 101648,
              "categoryName": "Vehicle Front",
              "level": 2,
              "children": {
                "Capot avant / composants / insonorisation": {
                  "categoryId": null,
                  "categoryName": "Capot avant / composants / insonorisation",
                  "level": 4,
                  "children": {
                    "Capot-moteur": {
                      "categoryId": 101654,
                      "categoryName": "Bonnet/Parts/Noise Insulation",
                      "level": 3,
                      "children": [],
                      "productId": 531
                    }
                  }
                }
              },
              "productId": 531
            },
            "Charnière, capot-moteur": {
              "categoryId": 101648,
              "categoryName": "Vehicle Front",
              "level": 2,
              "children": {
                "Capot avant / composants / insonorisation": {
                  "categoryId": null,
                  "categoryName": "Capot avant / composants / insonorisation",
                  "level": 4,
                  "children": {
                    "Charnière, capot-moteur": {
                      "categoryId": 101654,
                      "categoryName": "Bonnet/Parts/Noise Insulation",
                      "level": 3,
                      "children": [],
                      "productId": 740
                    }
                  }
                }
              },
              "productId": 740
            },
            "Crochet de sécurité serrure de capot moteur": {
              "categoryId": 101648,
              "categoryName": "Vehicle Front",
              "level": 2,
              "children": {
                "Capot avant / composants / insonorisation": {
                  "categoryId": null,
                  "categoryName": "Capot avant / composants / insonorisation",
                  "level": 4,
                  "children": {
                    "Crochet de sécurité serrure de capot moteur": {
                      "categoryId": 101654,
                      "categoryName": "Bonnet/Parts/Noise Insulation",
                      "level": 3,
                      "children": [],
                      "productId": 8109
                    }
                  }
                }
              },
              "productId": 8109
            },
            "Joint, capot-moteur": {
              "categoryId": 101648,
              "categoryName": "Vehicle Front",
              "level": 2,
              "children": {
                "Capot avant / composants / insonorisation": {
                  "categoryId": null,
                  "categoryName": "Capot avant / composants / insonorisation",
                  "level": 4,
                  "children": {
                    "Joint, capot-moteur": {
                      "categoryId": 101654,
                      "categoryName": "Bonnet/Parts/Noise Insulation",
                      "level": 3,
                      "children": [],
                      "productId": 4211
                    }
                  }
                }
              },
              "productId": 4211
            },
            "Kit d'assemblage, capot-moteur": {
              "categoryId": 101648,
              "categoryName": "Vehicle Front",
              "level": 2,
              "children": {
                "Capot avant / composants / insonorisation": {
                  "categoryId": null,
                  "categoryName": "Capot avant / composants / insonorisation",
                  "level": 4,
                  "children": {
                    "Kit d'assemblage, capot-moteur": {
                      "categoryId": 101654,
                      "categoryName": "Bonnet/Parts/Noise Insulation",
                      "level": 3,
                      "children": [],
                      "productId": 3714
                    }
                  }
                }
              },
              "productId": 3714
            },
            "Serrure de capot-moteur": {
              "categoryId": 101648,
              "categoryName": "Vehicle Front",
              "level": 2,
              "children": {
                "Capot avant / composants / insonorisation": {
                  "categoryId": null,
                  "categoryName": "Capot avant / composants / insonorisation",
                  "level": 4,
                  "children": {
                    "Serrure de capot-moteur": {
                      "categoryId": 101654,
                      "categoryName": "Bonnet/Parts/Noise Insulation",
                      "level": 3,
                      "children": [],
                      "productId": 1365
                    }
                  }
                }
              },
              "productId": 1365
            },
            "Vérin, capot-moteur": {
              "categoryId": 101648,
              "categoryName": "Vehicle Front",
              "level": 2,
              "children": {
                "Composants/suppléments": {
                  "categoryId": null,
                  "categoryName": "Composants/suppléments",
                  "level": 4,
                  "children": {
                    "Vérin, capot-moteur": {
                      "categoryId": 101673,
                      "categoryName": "Parts",
                      "level": 3,
                      "children": {
                        "Ressorts pneumatiques": {
                          "categoryId": null,
                          "categoryName": "Ressorts pneumatiques",
                          "level": 6,
                          "children": {
                            "Vérin, capot-moteur": {
                              "categoryId": 101777,
                              "categoryName": "Gas Springs",
                              "level": 4,
                              "children": [],
                              "productId": 514
                            }
                          }
                        }
                      },
                      "productId": 514
                    }
                  }
                }
              },
              "productId": 514
            }
          }
        },
        "Ressorts pneumatiques": {
          "categoryId": null,
          "categoryName": "Ressorts pneumatiques",
          "level": 2,
          "children": {
            "Vérin, capot-moteur": {
              "categoryId": 100826,
              "categoryName": "Gas Springs",
              "level": 2,
              "children": [],
              "productId": 514
            }
          }
        },
        "Trappes/capots/portes/toit coul./toit panoram./toit pliant": {
          "categoryId": null,
          "categoryName": "Trappes/capots/portes/toit coul./toit panoram./toit pliant",
          "level": 2,
          "children": {
            "Butoir, capot-moteur": {
              "categoryId": 100746,
              "categoryName": "Hatches/Bonnets/Doors/Sunroof/Panoramic Roof",
              "level": 2,
              "children": {
                "Capot avant / composants / insonorisation": {
                  "categoryId": null,
                  "categoryName": "Capot avant / composants / insonorisation",
                  "level": 4,
                  "children": {
                    "Butoir, capot-moteur": {
                      "categoryId": 100184,
                      "categoryName": "Bonnet/Parts/Noise Insulation",
                      "level": 3,
                      "children": [],
                      "productId": 1708
                    }
                  }
                }
              },
              "productId": 1708
            },
            "Capot-moteur": {
              "categoryId": 100746,
              "categoryName": "Hatches/Bonnets/Doors/Sunroof/Panoramic Roof",
              "level": 2,
              "children": {
                "Capot avant / composants / insonorisation": {
                  "categoryId": null,
                  "categoryName": "Capot avant / composants / insonorisation",
                  "level": 4,
                  "children": {
                    "Capot-moteur": {
                      "categoryId": 100184,
                      "categoryName": "Bonnet/Parts/Noise Insulation",
                      "level": 3,
                      "children": [],
                      "productId": 531
                    }
                  }
                }
              },
              "productId": 531
            },
            "Charnière, capot-moteur": {
              "categoryId": 100746,
              "categoryName": "Hatches/Bonnets/Doors/Sunroof/Panoramic Roof",
              "level": 2,
              "children": {
                "Capot avant / composants / insonorisation": {
                  "categoryId": null,
                  "categoryName": "Capot avant / composants / insonorisation",
                  "level": 4,
                  "children": {
                    "Charnière, capot-moteur": {
                      "categoryId": 100184,
                      "categoryName": "Bonnet/Parts/Noise Insulation",
                      "level": 3,
                      "children": [],
                      "productId": 740
                    }
                  }
                }
              },
              "productId": 740
            },
            "Joint, capot-moteur": {
              "categoryId": 100746,
              "categoryName": "Hatches/Bonnets/Doors/Sunroof/Panoramic Roof",
              "level": 2,
              "children": {
                "Capot avant / composants / insonorisation": {
                  "categoryId": null,
                  "categoryName": "Capot avant / composants / insonorisation",
                  "level": 4,
                  "children": {
                    "Joint, capot-moteur": {
                      "categoryId": 100184,
                      "categoryName": "Bonnet/Parts/Noise Insulation",
                      "level": 3,
                      "children": [],
                      "productId": 4211
                    }
                  }
                }
              },
              "productId": 4211
            },
            "Kit d'assemblage, capot-moteur": {
              "categoryId": 100746,
              "categoryName": "Hatches/Bonnets/Doors/Sunroof/Panoramic Roof",
              "level": 2,
              "children": {
                "Capot avant / composants / insonorisation": {
                  "categoryId": null,
                  "categoryName": "Capot avant / composants / insonorisation",
                  "level": 4,
                  "children": {
                    "Kit d'assemblage, capot-moteur": {
                      "categoryId": 100184,
                      "categoryName": "Bonnet/Parts/Noise Insulation",
                      "level": 3,
                      "children": [],
                      "productId": 3714
                    }
                  }
                }
              },
              "productId": 3714
            }
          }
        }
      }
    },
    "Verrouillage": {
      "categoryId": 100685,
      "categoryName": "Verrouillage",
      "level": 1,
      "children": {
        "Serrure extérieure": {
          "categoryId": null,
          "categoryName": "Serrure extérieure",
          "level": 2,
          "children": {
            "Serrure de capot-moteur": {
              "categoryId": 100687,
              "categoryName": "Exterior Locks",
              "level": 2,
              "children": [],
              "productId": 1365
            }
          }
        }
      }
    }
  },
  "arborescenceText": "├── Carrosserie [ID: 100001] (Niveau 1)\n│   ├── Arrière de la voiture (Niveau 2)\n│   │   ├── Vehicle Rear [ID: 101705] (Niveau 2) → ProductId: 1708\n│   │   │   └── Capot avant / composants / insonorisation (Niveau 4)\n│   │   │       └── Bonnet/Parts/Noise Insulation [ID: 101783] (Niveau 3) → ProductId: 1708\n│   │   ├── Vehicle Rear [ID: 101705] (Niveau 2) → ProductId: 531\n│   │   │   └── Capot avant / composants / insonorisation (Niveau 4)\n│   │   │       └── Bonnet/Parts/Noise Insulation [ID: 101783] (Niveau 3) → ProductId: 531\n│   │   ├── Vehicle Rear [ID: 101705] (Niveau 2) → ProductId: 740\n│   │   │   └── Capot avant / composants / insonorisation (Niveau 4)\n│   │   │       └── Bonnet/Parts/Noise Insulation [ID: 101783] (Niveau 3) → ProductId: 740\n│   │   ├── Vehicle Rear [ID: 101705] (Niveau 2) → ProductId: 4211\n│   │   │   └── Capot avant / composants / insonorisation (Niveau 4)\n│   │   │       └── Bonnet/Parts/Noise Insulation [ID: 101783] (Niveau 3) → ProductId: 4211\n│   │   └── Vehicle Rear [ID: 101705] (Niveau 2) → ProductId: 3714\n│   │       └── Capot avant / composants / insonorisation (Niveau 4)\n│   │           └── Bonnet/Parts/Noise Insulation [ID: 101783] (Niveau 3) → ProductId: 3714\n│   ├── Avant du véhicule (Niveau 2)\n│   │   ├── Vehicle Front [ID: 101648] (Niveau 2) → ProductId: 1708\n│   │   │   └── Capot avant / composants / insonorisation (Niveau 4)\n│   │   │       └── Bonnet/Parts/Noise Insulation [ID: 101654] (Niveau 3) → ProductId: 1708\n│   │   ├── Vehicle Front [ID: 101648] (Niveau 2) → ProductId: 531\n│   │   │   └── Capot avant / composants / insonorisation (Niveau 4)\n│   │   │       └── Bonnet/Parts/Noise Insulation [ID: 101654] (Niveau 3) → ProductId: 531\n│   │   ├── Vehicle Front [ID: 101648] (Niveau 2) → ProductId: 740\n│   │   │   └── Capot avant / composants / insonorisation (Niveau 4)\n│   │   │       └── Bonnet/Parts/Noise Insulation [ID: 101654] (Niveau 3) → ProductId: 740\n│   │   ├── Vehicle Front [ID: 101648] (Niveau 2) → ProductId: 8109\n│   │   │   └── Capot avant / composants / insonorisation (Niveau 4)\n│   │   │       └── Bonnet/Parts/Noise Insulation [ID: 101654] (Niveau 3) → ProductId: 8109\n│   │   ├── Vehicle Front [ID: 101648] (Niveau 2) → ProductId: 4211\n│   │   │   └── Capot avant / composants / insonorisation (Niveau 4)\n│   │   │       └── Bonnet/Parts/Noise Insulation [ID: 101654] (Niveau 3) → ProductId: 4211\n│   │   ├── Vehicle Front [ID: 101648] (Niveau 2) → ProductId: 3714\n│   │   │   └── Capot avant / composants / insonorisation (Niveau 4)\n│   │   │       └── Bonnet/Parts/Noise Insulation [ID: 101654] (Niveau 3) → ProductId: 3714\n│   │   ├── Vehicle Front [ID: 101648] (Niveau 2) → ProductId: 1365\n│   │   │   └── Capot avant / composants / insonorisation (Niveau 4)\n│   │   │       └── Bonnet/Parts/Noise Insulation [ID: 101654] (Niveau 3) → ProductId: 1365\n│   │   └── Vehicle Front [ID: 101648] (Niveau 2) → ProductId: 514\n│   │       └── Composants/suppléments (Niveau 4)\n│   │           └── Parts [ID: 101673] (Niveau 3) → ProductId: 514\n│   │               └── Ressorts pneumatiques (Niveau 6)\n│   │                   └── Gas Springs [ID: 101777] (Niveau 4) → ProductId: 514\n│   ├── Ressorts pneumatiques (Niveau 2)\n│   │   └── Gas Springs [ID: 100826] (Niveau 2) → ProductId: 514\n│   └── Trappes/capots/portes/toit coul./toit panoram./toit pliant (Niveau 2)\n│       ├── Hatches/Bonnets/Doors/Sunroof/Panoramic Roof [ID: 100746] (Niveau 2) → ProductId: 1708\n│       │   └── Capot avant / composants / insonorisation (Niveau 4)\n│       │       └── Bonnet/Parts/Noise Insulation [ID: 100184] (Niveau 3) → ProductId: 1708\n│       ├── Hatches/Bonnets/Doors/Sunroof/Panoramic Roof [ID: 100746] (Niveau 2) → ProductId: 531\n│       │   └── Capot avant / composants / insonorisation (Niveau 4)\n│       │       └── Bonnet/Parts/Noise Insulation [ID: 100184] (Niveau 3) → ProductId: 531\n│       ├── Hatches/Bonnets/Doors/Sunroof/Panoramic Roof [ID: 100746] (Niveau 2) → ProductId: 740\n│       │   └── Capot avant / composants / insonorisation (Niveau 4)\n│       │       └── Bonnet/Parts/Noise Insulation [ID: 100184] (Niveau 3) → ProductId: 740\n│       ├── Hatches/Bonnets/Doors/Sunroof/Panoramic Roof [ID: 100746] (Niveau 2) → ProductId: 4211\n│       │   └── Capot avant / composants / insonorisation (Niveau 4)\n│       │       └── Bonnet/Parts/Noise Insulation [ID: 100184] (Niveau 3) → ProductId: 4211\n│       └── Hatches/Bonnets/Doors/Sunroof/Panoramic Roof [ID: 100746] (Niveau 2) → ProductId: 3714\n│           └── Capot avant / composants / insonorisation (Niveau 4)\n│               └── Bonnet/Parts/Noise Insulation [ID: 100184] (Niveau 3) → ProductId: 3714\n\n└── Verrouillage [ID: 100685] (Niveau 1)\n    └── Serrure extérieure (Niveau 2)\n        └── Exterior Locks [ID: 100687] (Niveau 2) → ProductId: 1365",
  "arborescencePaths": [
    {
      "path": [
        "Carrosserie",
        "Arrière de la voiture",
        "Vehicle Rear"
      ],
      "categoryIds": [
        100001,
        null,
        101705
      ],
      "finalCategoryId": 101705,
      "productId": 1708
    },
    {
      "path": [
        "Carrosserie",
        "Arrière de la voiture",
        "Vehicle Rear"
      ],
      "categoryIds": [
        100001,
        null,
        101705
      ],
      "finalCategoryId": 101705,
      "productId": 531
    },
    {
      "path": [
        "Carrosserie",
        "Arrière de la voiture",
        "Vehicle Rear"
      ],
      "categoryIds": [
        100001,
        null,
        101705
      ],
      "finalCategoryId": 101705,
      "productId": 740
    },
    {
      "path": [
        "Carrosserie",
        "Arrière de la voiture",
        "Vehicle Rear"
      ],
      "categoryIds": [
        100001,
        null,
        101705
      ],
      "finalCategoryId": 101705,
      "productId": 4211
    },
    {
      "path": [
        "Carrosserie",
        "Arrière de la voiture",
        "Vehicle Rear"
      ],
      "categoryIds": [
        100001,
        null,
        101705
      ],
      "finalCategoryId": 101705,
      "productId": 3714
    },
    {
      "path": [
        "Carrosserie",
        "Avant du véhicule",
        "Vehicle Front"
      ],
      "categoryIds": [
        100001,
        null,
        101648
      ],
      "finalCategoryId": 101648,
      "productId": 1708
    },
    {
      "path": [
        "Carrosserie",
        "Avant du véhicule",
        "Vehicle Front"
      ],
      "categoryIds": [
        100001,
        null,
        101648
      ],
      "finalCategoryId": 101648,
      "productId": 531
    },
    {
      "path": [
        "Carrosserie",
        "Avant du véhicule",
        "Vehicle Front"
      ],
      "categoryIds": [
        100001,
        null,
        101648
      ],
      "finalCategoryId": 101648,
      "productId": 740
    },
    {
      "path": [
        "Carrosserie",
        "Avant du véhicule",
        "Vehicle Front"
      ],
      "categoryIds": [
        100001,
        null,
        101648
      ],
      "finalCategoryId": 101648,
      "productId": 8109
    },
    {
      "path": [
        "Carrosserie",
        "Avant du véhicule",
        "Vehicle Front"
      ],
      "categoryIds": [
        100001,
        null,
        101648
      ],
      "finalCategoryId": 101648,
      "productId": 4211
    },
    {
      "path": [
        "Carrosserie",
        "Avant du véhicule",
        "Vehicle Front"
      ],
      "categoryIds": [
        100001,
        null,
        101648
      ],
      "finalCategoryId": 101648,
      "productId": 3714
    },
    {
      "path": [
        "Carrosserie",
        "Avant du véhicule",
        "Vehicle Front"
      ],
      "categoryIds": [
        100001,
        null,
        101648
      ],
      "finalCategoryId": 101648,
      "productId": 1365
    },
    {
      "path": [
        "Carrosserie",
        "Avant du véhicule",
        "Vehicle Front"
      ],
      "categoryIds": [
        100001,
        null,
        101648
      ],
      "finalCategoryId": 101648,
      "productId": 514
    },
    {
      "path": [
        "Carrosserie",
        "Ressorts pneumatiques",
        "Gas Springs"
      ],
      "categoryIds": [
        100001,
        null,
        100826
      ],
      "finalCategoryId": 100826,
      "productId": 514
    },
    {
      "path": [
        "Carrosserie",
        "Trappes/capots/portes/toit coul./toit panoram./toit pliant",
        "Hatches/Bonnets/Doors/Sunroof/Panoramic Roof"
      ],
      "categoryIds": [
        100001,
        null,
        100746
      ],
      "finalCategoryId": 100746,
      "productId": 1708
    },
    {
      "path": [
        "Carrosserie",
        "Trappes/capots/portes/toit coul./toit panoram./toit pliant",
        "Hatches/Bonnets/Doors/Sunroof/Panoramic Roof"
      ],
      "categoryIds": [
        100001,
        null,
        100746
      ],
      "finalCategoryId": 100746,
      "productId": 531
    },
    {
      "path": [
        "Carrosserie",
        "Trappes/capots/portes/toit coul./toit panoram./toit pliant",
        "Hatches/Bonnets/Doors/Sunroof/Panoramic Roof"
      ],
      "categoryIds": [
        100001,
        null,
        100746
      ],
      "finalCategoryId": 100746,
      "productId": 740
    },
    {
      "path": [
        "Carrosserie",
        "Trappes/capots/portes/toit coul./toit panoram./toit pliant",
        "Hatches/Bonnets/Doors/Sunroof/Panoramic Roof"
      ],
      "categoryIds": [
        100001,
        null,
        100746
      ],
      "finalCategoryId": 100746,
      "productId": 4211
    },
    {
      "path": [
        "Carrosserie",
        "Trappes/capots/portes/toit coul./toit panoram./toit pliant",
        "Hatches/Bonnets/Doors/Sunroof/Panoramic Roof"
      ],
      "categoryIds": [
        100001,
        null,
        100746
      ],
      "finalCategoryId": 100746,
      "productId": 3714
    },
    {
      "path": [
        "Verrouillage",
        "Serrure extérieure",
        "Exterior Locks"
      ],
      "categoryIds": [
        100685,
        null,
        100687
      ],
      "finalCategoryId": 100687,
      "productId": 1365
    }
  ],
  "productIdsInArbo": [
    514,
    531,
    740,
    1365,
    1708,
    3714,
    4211,
    8109
  ],
  "matchedProductIds": [
    531
  ]
}