{
  "productName": "Capteur, température d'huile",
  "searchText": "Capteur, température d'huile",
  "found": true,
  "hasMatch": true,
  "timestamp": "2025-12-02T20:17:03.550Z",
  "productId": 829,
  "arborescence": {
    "Moteur": {
      "categoryId": 100002,
      "categoryName": "Moteur",
      "level": 1,
      "children": {
        "Circuit électrique du moteur": {
          "categoryId": null,
          "categoryName": "Circuit électrique du moteur",
          "level": 2,
          "children": {
            "Capteur, température d'huile": {
              "categoryId": 100754,
              "categoryName": "Engine Electrics",
              "level": 2,
              "children": [],
              "productId": 829
            }
          }
        },
        "Lubrification": {
          "categoryId": null,
          "categoryName": "Lubrification",
          "level": 2,
          "children": {
            "Capteur, température d'huile": {
              "categoryId": 100245,
              "categoryName": "Lubrication",
              "level": 2,
              "children": {
                "Indicateur de pression d'huile / capteur / soupape": {
                  "categoryId": null,
                  "categoryName": "Indicateur de pression d'huile / capteur / soupape",
                  "level": 4,
                  "children": {
                    "Capteur, température d'huile": {
                      "categoryId": 100478,
                      "categoryName": "Oil Pressure Switch/Sensor/Valve",
                      "level": 3,
                      "children": [],
                      "productId": 829
                    }
                  }
                }
              },
              "productId": 829
            }
          }
        }
      }
    },
    "Refroidissement": {
      "categoryId": 100007,
      "categoryName": "Refroidissement",
      "level": 1,
      "children": {
        "Interrupteur / capteur": {
          "categoryId": null,
          "categoryName": "Interrupteur / capteur",
          "level": 2,
          "children": {
            "Capteur, température d'huile": {
              "categoryId": 100334,
              "categoryName": "Switch/Sensor",
              "level": 2,
              "children": [],
              "productId": 829
            }
          }
        }
      }
    },
    "Système électrique": {
      "categoryId": 100010,
      "categoryName": "Système électrique",
      "level": 1,
      "children": {
        "Capteurs": {
          "categoryId": null,
          "categoryName": "Capteurs",
          "level": 2,
          "children": {
            "Capteur, température d'huile": {
              "categoryId": 102747,
              "categoryName": "Sensors",
              "level": 2,
              "children": [],
              "productId": 2201
            }
          }
        },
        "Instruments": {
          "categoryId": null,
          "categoryName": "Instruments",
          "level": 2,
          "children": {
            "Capteur, température d'huile": {
              "categoryId": 100322,
              "categoryName": "Instruments",
              "level": 2,
              "children": {
                "Capteurs/Conatct": {
                  "categoryId": null,
                  "categoryName": "Capteurs/Conatct",
                  "level": 4,
                  "children": {
                    "Capteur, température d'huile": {
                      "categoryId": 100553,
                      "categoryName": "Sensors/Switches",
                      "level": 3,
                      "children": [],
                      "productId": 2201
                    }
                  }
                }
              },
              "productId": 2201
            }
          }
        }
      }
    }
  },
  "arborescenceText": "├── Moteur [ID: 100002] (Niveau 1)\n│   ├── Circuit électrique du moteur (Niveau 2)\n│   │   └── Engine Electrics [ID: 100754] (Niveau 2) → ProductId: 829\n│   └── Lubrification (Niveau 2)\n│       └── Lubrication [ID: 100245] (Niveau 2) → ProductId: 829\n│           └── Indicateur de pression d'huile / capteur / soupape (Niveau 4)\n│               └── Oil Pressure Switch/Sensor/Valve [ID: 100478] (Niveau 3) → ProductId: 829\n\n├── Refroidissement [ID: 100007] (Niveau 1)\n│   └── Interrupteur / capteur (Niveau 2)\n│       └── Switch/Sensor [ID: 100334] (Niveau 2) → ProductId: 829\n\n└── Système électrique [ID: 100010] (Niveau 1)\n    ├── Capteurs (Niveau 2)\n    │   └── Sensors [ID: 102747] (Niveau 2) → ProductId: 2201\n    └── Instruments (Niveau 2)\n        └── Instruments [ID: 100322] (Niveau 2) → ProductId: 2201\n            └── Capteurs/Conatct (Niveau 4)\n                └── Sensors/Switches [ID: 100553] (Niveau 3) → ProductId: 2201",
  "arborescencePaths": [
    {
      "path": [
        "Moteur",
        "Circuit électrique du moteur",
        "Engine Electrics"
      ],
      "categoryIds": [
        100002,
        null,
        100754
      ],
      "finalCategoryId": 100754,
      "productId": 829
    },
    {
      "path": [
        "Moteur",
        "Lubrification",
        "Lubrication"
      ],
      "categoryIds": [
        100002,
        null,
        100245
      ],
      "finalCategoryId": 100245,
      "productId": 829
    },
    {
      "path": [
        "Refroidissement",
        "Interrupteur / capteur",
        "Switch/Sensor"
      ],
      "categoryIds": [
        100007,
        null,
        100334
      ],
      "finalCategoryId": 100334,
      "productId": 829
    },
    {
      "path": [
        "Système électrique",
        "Capteurs",
        "Sensors"
      ],
      "categoryIds": [
        100010,
        null,
        102747
      ],
      "finalCategoryId": 102747,
      "productId": 2201
    },
    {
      "path": [
        "Système électrique",
        "Instruments",
        "Instruments"
      ],
      "categoryIds": [
        100010,
        null,
        100322
      ],
      "finalCategoryId": 100322,
      "productId": 2201
    }
  ],
  "productIdsInArbo": [
    829,
    2201
  ],
  "matchedProductIds": [
    829
  ]
}