{
  "productName": "Capteur, position d'accelerateur",
  "searchText": "Capteur, position d'accelerateur",
  "found": true,
  "hasMatch": true,
  "timestamp": "2025-12-02T20:16:08.484Z",
  "productId": 3941,
  "arborescence": {
    "Carburation": {
      "categoryId": 100254,
      "categoryName": "Carburation",
      "level": 1,
      "children": {
        "Mélange air-carburant": {
          "categoryId": null,
          "categoryName": "Mélange air-carburant",
          "level": 2,
          "children": {
            "Capteur, position d'accelerateur": {
              "categoryId": 102793,
              "categoryName": "Mixture Formation",
              "level": 2,
              "children": {
                "Capteur/sonde lambda": {
                  "categoryId": null,
                  "categoryName": "Capteur/sonde lambda",
                  "level": 4,
                  "children": {
                    "Capteur, position d'accelerateur": {
                      "categoryId": 102809,
                      "categoryName": "Sensor/Probe",
                      "level": 3,
                      "children": [],
                      "productId": 3941
                    }
                  }
                },
                "Pédale d'accélérateur/potenciomètre": {
                  "categoryId": null,
                  "categoryName": "Pédale d'accélérateur/potenciomètre",
                  "level": 4,
                  "children": {
                    "Capteur, position d'accelerateur": {
                      "categoryId": 102801,
                      "categoryName": "Accelerator Pedal",
                      "level": 3,
                      "children": [],
                      "productId": 3941
                    }
                  }
                }
              },
              "productId": 3941
            }
          }
        }
      }
    },
    "Moteur": {
      "categoryId": 100002,
      "categoryName": "Moteur",
      "level": 1,
      "children": {
        "Circuit électrique du moteur": {
          "categoryId": null,
          "categoryName": "Circuit électrique du moteur",
          "level": 2,
          "children": {
            "Capteur, position d'accelerateur": {
              "categoryId": 100754,
              "categoryName": "Engine Electrics",
              "level": 2,
              "children": [],
              "productId": 3941
            }
          }
        }
      }
    },
    "Système électrique": {
      "categoryId": 100010,
      "categoryName": "Système électrique",
      "level": 1,
      "children": {
        "Capteurs": {
          "categoryId": null,
          "categoryName": "Capteurs",
          "level": 2,
          "children": {
            "Capteur, position d'accelerateur": {
              "categoryId": 102747,
              "categoryName": "Sensors",
              "level": 2,
              "children": [],
              "productId": 3941
            }
          }
        }
      }
    }
  },
  "arborescenceText": "├── Carburation [ID: 100254] (Niveau 1)\n│   └── Mélange air-carburant (Niveau 2)\n│       └── Mixture Formation [ID: 102793] (Niveau 2) → ProductId: 3941\n│           ├── Capteur/sonde lambda (Niveau 4)\n│           │   └── Sensor/Probe [ID: 102809] (Niveau 3) → ProductId: 3941\n│           └── Pédale d'accélérateur/potenciomètre (Niveau 4)\n│               └── Accelerator Pedal [ID: 102801] (Niveau 3) → ProductId: 3941\n\n├── Moteur [ID: 100002] (Niveau 1)\n│   └── Circuit électrique du moteur (Niveau 2)\n│       └── Engine Electrics [ID: 100754] (Niveau 2) → ProductId: 3941\n\n└── Système électrique [ID: 100010] (Niveau 1)\n    └── Capteurs (Niveau 2)\n        └── Sensors [ID: 102747] (Niveau 2) → ProductId: 3941",
  "arborescencePaths": [
    {
      "path": [
        "Carburation",
        "Mélange air-carburant",
        "Mixture Formation"
      ],
      "categoryIds": [
        100254,
        null,
        102793
      ],
      "finalCategoryId": 102793,
      "productId": 3941
    },
    {
      "path": [
        "Moteur",
        "Circuit électrique du moteur",
        "Engine Electrics"
      ],
      "categoryIds": [
        100002,
        null,
        100754
      ],
      "finalCategoryId": 100754,
      "productId": 3941
    },
    {
      "path": [
        "Système électrique",
        "Capteurs",
        "Sensors"
      ],
      "categoryIds": [
        100010,
        null,
        102747
      ],
      "finalCategoryId": 102747,
      "productId": 3941
    }
  ],
  "productIdsInArbo": [
    3941
  ],
  "matchedProductIds": [
    3941
  ]
}