{
  "productName": "Capteur, aide au stationnement",
  "searchText": "Capteur, aide au stationnement",
  "found": true,
  "hasMatch": true,
  "timestamp": "2025-12-02T20:15:36.735Z",
  "productId": 2412,
  "arborescence": {
    "Carrosserie": {
      "categoryId": 100001,
      "categoryName": "Carrosserie",
      "level": 1,
      "children": {
        "Pièces de carrosserie/ailes/pares-chocs": {
          "categoryId": null,
          "categoryName": "Pièces de carrosserie/ailes/pares-chocs",
          "level": 2,
          "children": {
            "Capteur, aide au stationnement": {
              "categoryId": 100743,
              "categoryName": "Body Parts/Wing/Bumper",
              "level": 2,
              "children": {
                "Pare-chocs/composants": {
                  "categoryId": null,
                  "categoryName": "Pare-chocs/composants",
                  "level": 4,
                  "children": {
                    "Capteur, aide au stationnement": {
                      "categoryId": 100187,
                      "categoryName": "Bumper/Parts",
                      "level": 3,
                      "children": [],
                      "productId": 2412
                    }
                  }
                }
              },
              "productId": 2412
            }
          }
        }
      }
    },
    "Système électrique": {
      "categoryId": 100010,
      "categoryName": "Système électrique",
      "level": 1,
      "children": {
        "Capteurs": {
          "categoryId": null,
          "categoryName": "Capteurs",
          "level": 2,
          "children": {
            "Capteur, aide au stationnement": {
              "categoryId": 102747,
              "categoryName": "Sensors",
              "level": 2,
              "children": [],
              "productId": 2412
            }
          }
        }
      }
    },
    "Systèmes de confort": {
      "categoryId": 100335,
      "categoryName": "Systèmes de confort",
      "level": 1,
      "children": {
        "Aide au stationnement/Alarme de marche arrière": {
          "categoryId": null,
          "categoryName": "Aide au stationnement/Alarme de marche arrière",
          "level": 2,
          "children": {
            "Capteur, aide au stationnement": {
              "categoryId": 100618,
              "categoryName": "park distance control/Back-up Alarm",
              "level": 2,
              "children": [],
              "productId": 2412
            }
          }
        }
      }
    }
  },
  "arborescenceText": "├── Carrosserie [ID: 100001] (Niveau 1)\n│   └── Pièces de carrosserie/ailes/pares-chocs (Niveau 2)\n│       └── Body Parts/Wing/Bumper [ID: 100743] (Niveau 2) → ProductId: 2412\n│           └── Pare-chocs/composants (Niveau 4)\n│               └── Bumper/Parts [ID: 100187] (Niveau 3) → ProductId: 2412\n\n├── Système électrique [ID: 100010] (Niveau 1)\n│   └── Capteurs (Niveau 2)\n│       └── Sensors [ID: 102747] (Niveau 2) → ProductId: 2412\n\n└── Systèmes de confort [ID: 100335] (Niveau 1)\n    └── Aide au stationnement/Alarme de marche arrière (Niveau 2)\n        └── park distance control/Back-up Alarm [ID: 100618] (Niveau 2) → ProductId: 2412",
  "arborescencePaths": [
    {
      "path": [
        "Carrosserie",
        "Pièces de carrosserie/ailes/pares-chocs",
        "Body Parts/Wing/Bumper"
      ],
      "categoryIds": [
        100001,
        null,
        100743
      ],
      "finalCategoryId": 100743,
      "productId": 2412
    },
    {
      "path": [
        "Système électrique",
        "Capteurs",
        "Sensors"
      ],
      "categoryIds": [
        100010,
        null,
        102747
      ],
      "finalCategoryId": 102747,
      "productId": 2412
    },
    {
      "path": [
        "Systèmes de confort",
        "Aide au stationnement/Alarme de marche arrière",
        "park distance control/Back-up Alarm"
      ],
      "categoryIds": [
        100335,
        null,
        100618
      ],
      "finalCategoryId": 100618,
      "productId": 2412
    }
  ],
  "productIdsInArbo": [
    2412
  ],
  "matchedProductIds": [
    2412
  ]
}