{
  "productName": "Carburateur",
  "searchText": "Carburateur",
  "found": true,
  "hasMatch": true,
  "timestamp": "2025-12-02T20:17:51.165Z",
  "productId": 981,
  "arborescence": {
    "Alimentation carburant": {
      "categoryId": 100214,
      "categoryName": "Alimentation carburant",
      "level": 1,
      "children": {
        "Additifs": {
          "categoryId": null,
          "categoryName": "Additifs",
          "level": 2,
          "children": {
            "Additif au carburant": {
              "categoryId": 706479,
              "categoryName": "Additive",
              "level": 2,
              "children": [],
              "productId": 9797
            }
          }
        },
        "Pompe / accessoires": {
          "categoryId": null,
          "categoryName": "Pompe / accessoires",
          "level": 2,
          "children": {
            "Pompe à carburant": {
              "categoryId": 100251,
              "categoryName": "Pump/Accessories",
              "level": 2,
              "children": {
                "Pompe d'alimentation": {
                  "categoryId": null,
                  "categoryName": "Pompe d'alimentation",
                  "level": 4,
                  "children": {
                    "Pompe à carburant": {
                      "categoryId": 100717,
                      "categoryName": "Fuel Pump",
                      "level": 3,
                      "children": [],
                      "productId": 458
                    }
                  }
                }
              },
              "productId": 458
            }
          }
        },
        "Soupapes": {
          "categoryId": null,
          "categoryName": "Soupapes",
          "level": 2,
          "children": {
            "Soupape, air de circulation de carburant": {
              "categoryId": 100252,
              "categoryName": "Valves",
              "level": 2,
              "children": [],
              "productId": 974
            }
          }
        }
      }
    },
    "Carburation": {
      "categoryId": 100254,
      "categoryName": "Carburation",
      "level": 1,
      "children": {
        "Carburateurs": {
          "categoryId": null,
          "categoryName": "Carburateurs",
          "level": 2,
          "children": {
            "Actionneur, papillon des gaz": {
              "categoryId": 102903,
              "categoryName": "Carburettor System",
              "level": 2,
              "children": {
                "Composants du carburateur": {
                  "categoryId": null,
                  "categoryName": "Composants du carburateur",
                  "level": 4,
                  "children": {
                    "Actionneur, papillon des gaz": {
                      "categoryId": 102906,
                      "categoryName": "Carburettor Parts",
                      "level": 3,
                      "children": [],
                      "productId": 1928
                    }
                  }
                }
              },
              "productId": 1928
            },
            "Aiguille d'injection, carburateur": {
              "categoryId": 102903,
              "categoryName": "Carburettor System",
              "level": 2,
              "children": {
                "Composants du carburateur": {
                  "categoryId": null,
                  "categoryName": "Composants du carburateur",
                  "level": 4,
                  "children": {
                    "Aiguille d'injection, carburateur": {
                      "categoryId": 102906,
                      "categoryName": "Carburettor Parts",
                      "level": 3,
                      "children": [],
                      "productId": 1694
                    }
                  }
                }
              },
              "productId": 1694
            },
            "Aiguille de guidage, carburateur": {
              "categoryId": 102903,
              "categoryName": "Carburettor System",
              "level": 2,
              "children": {
                "Composants du carburateur": {
                  "categoryId": null,
                  "categoryName": "Composants du carburateur",
                  "level": 4,
                  "children": {
                    "Aiguille de guidage, carburateur": {
                      "categoryId": 102906,
                      "categoryName": "Carburettor Parts",
                      "level": 3,
                      "children": [],
                      "productId": 1955
                    }
                  }
                }
              },
              "productId": 1955
            },
            "Amortisseur de carburateur": {
              "categoryId": 102903,
              "categoryName": "Carburettor System",
              "level": 2,
              "children": {
                "Commande / Amortisseurs / Boîtiers": {
                  "categoryId": null,
                  "categoryName": "Commande / Amortisseurs / Boîtiers",
                  "level": 4,
                  "children": {
                    "Amortisseur de carburateur": {
                      "categoryId": 102910,
                      "categoryName": "Control Linkage/Damper/Chambers",
                      "level": 3,
                      "children": [],
                      "productId": 1151
                    }
                  }
                }
              },
              "productId": 1151
            },
            "Amortisseur de papillon, carburateur": {
              "categoryId": 102903,
              "categoryName": "Carburettor System",
              "level": 2,
              "children": {
                "Commande / Amortisseurs / Boîtiers": {
                  "categoryId": null,
                  "categoryName": "Commande / Amortisseurs / Boîtiers",
                  "level": 4,
                  "children": {
                    "Amortisseur de papillon, carburateur": {
                      "categoryId": 102910,
                      "categoryName": "Control Linkage/Damper/Chambers",
                      "level": 3,
                      "children": [],
                      "productId": 1152
                    }
                  }
                }
              },
              "productId": 1152
            },
            "Appareil de commande, carburateur": {
              "categoryId": 102903,
              "categoryName": "Carburettor System",
              "level": 2,
              "children": {
                "Contrôle": {
                  "categoryId": null,
                  "categoryName": "Contrôle",
                  "level": 4,
                  "children": {
                    "Appareil de commande, carburateur": {
                      "categoryId": 102913,
                      "categoryName": "Control Unit",
                      "level": 3,
                      "children": [],
                      "productId": 935
                    }
                  }
                }
              },
              "productId": 935
            },
            "Arbre de starter, carburateur": {
              "categoryId": 102903,
              "categoryName": "Carburettor System",
              "level": 2,
              "children": {
                "Composants du carburateur": {
                  "categoryId": null,
                  "categoryName": "Composants du carburateur",
                  "level": 4,
                  "children": {
                    "Arbre de starter, carburateur": {
                      "categoryId": 102906,
                      "categoryName": "Carburettor Parts",
                      "level": 3,
                      "children": [],
                      "productId": 1976
                    }
                  }
                }
              },
              "productId": 1976
            },
            "Axe, papillon des gaz": {
              "categoryId": 102903,
              "categoryName": "Carburettor System",
              "level": 2,
              "children": {
                "Composants du carburateur": {
                  "categoryId": null,
                  "categoryName": "Composants du carburateur",
                  "level": 4,
                  "children": {
                    "Axe, papillon des gaz": {
                      "categoryId": 102906,
                      "categoryName": "Carburettor Parts",
                      "level": 3,
                      "children": [],
                      "productId": 1927
                    }
                  }
                }
              },
              "productId": 1927
            },
            "Bague d'étanchéité, carburateur": {
              "categoryId": 102903,
              "categoryName": "Carburettor System",
              "level": 2,
              "children": {
                "Composants du carburateur": {
                  "categoryId": null,
                  "categoryName": "Composants du carburateur",
                  "level": 4,
                  "children": {
                    "Bague d'étanchéité, carburateur": {
                      "categoryId": 102906,
                      "categoryName": "Carburettor Parts",
                      "level": 3,
                      "children": [],
                      "productId": 1922
                    }
                  }
                }
              },
              "productId": 1922
            },
            "Bielle de connexion, carburateur": {
              "categoryId": 102903,
              "categoryName": "Carburettor System",
              "level": 2,
              "children": {
                "Composants du carburateur": {
                  "categoryId": null,
                  "categoryName": "Composants du carburateur",
                  "level": 4,
                  "children": {
                    "Bielle de connexion, carburateur": {
                      "categoryId": 102906,
                      "categoryName": "Carburettor Parts",
                      "level": 3,
                      "children": [],
                      "productId": 1982
                    }
                  }
                }
              },
              "productId": 1982
            },
            "Bielle de connexion, pompe d'accélération": {
              "categoryId": 102903,
              "categoryName": "Carburettor System",
              "level": 2,
              "children": {
                "Composants du carburateur": {
                  "categoryId": null,
                  "categoryName": "Composants du carburateur",
                  "level": 4,
                  "children": {
                    "Bielle de connexion, pompe d'accélération": {
                      "categoryId": 102906,
                      "categoryName": "Carburettor Parts",
                      "level": 3,
                      "children": [],
                      "productId": 1964
                    }
                  }
                }
              },
              "productId": 1964
            },
            "Bielle de connexion, starter": {
              "categoryId": 102903,
              "categoryName": "Carburettor System",
              "level": 2,
              "children": {
                "Composants du carburateur": {
                  "categoryId": null,
                  "categoryName": "Composants du carburateur",
                  "level": 4,
                  "children": {
                    "Bielle de connexion, starter": {
                      "categoryId": 102906,
                      "categoryName": "Carburettor Parts",
                      "level": 3,
                      "children": [],
                      "productId": 1979
                    }
                  }
                }
              },
              "productId": 1979
            },
            "Boîte de dépression, carburateur": {
              "categoryId": 102903,
              "categoryName": "Carburettor System",
              "level": 2,
              "children": {
                "Commande / Amortisseurs / Boîtiers": {
                  "categoryId": null,
                  "categoryName": "Commande / Amortisseurs / Boîtiers",
                  "level": 4,
                  "children": {
                    "Boîte de dépression, carburateur": {
                      "categoryId": 102910,
                      "categoryName": "Control Linkage/Damper/Chambers",
                      "level": 3,
                      "children": [],
                      "productId": 976
                    }
                  }
                }
              },
              "productId": 976
            },
            "Boîtier de starter, carburateur": {
              "categoryId": 102903,
              "categoryName": "Carburettor System",
              "level": 2,
              "children": {
                "Composants du carburateur": {
                  "categoryId": null,
                  "categoryName": "Composants du carburateur",
                  "level": 4,
                  "children": {
                    "Boîtier de starter, carburateur": {
                      "categoryId": 102906,
                      "categoryName": "Carburettor Parts",
                      "level": 3,
                      "children": [],
                      "productId": 1972
                    }
                  }
                }
              },
              "productId": 1972
            },
            "Bonnete/tête/bout, carburateur": {
              "categoryId": 102903,
              "categoryName": "Carburettor System",
              "level": 2,
              "children": {
                "Composants du carburateur": {
                  "categoryId": null,
                  "categoryName": "Composants du carburateur",
                  "level": 4,
                  "children": {
                    "Bonnete/tête/bout, carburateur": {
                      "categoryId": 102906,
                      "categoryName": "Carburettor Parts",
                      "level": 3,
                      "children": [],
                      "productId": 1940
                    }
                  }
                }
              },
              "productId": 1940
            },
            "Bouchon, carburateur": {
              "categoryId": 102903,
              "categoryName": "Carburettor System",
              "level": 2,
              "children": {
                "Composants du carburateur": {
                  "categoryId": null,
                  "categoryName": "Composants du carburateur",
                  "level": 4,
                  "children": {
                    "Bouchon, carburateur": {
                      "categoryId": 102906,
                      "categoryName": "Carburettor Parts",
                      "level": 3,
                      "children": [],
                      "productId": 1980
                    }
                  }
                }
              },
              "productId": 1980
            },
            "Bouton de poignée, carburateur": {
              "categoryId": 102903,
              "categoryName": "Carburettor System",
              "level": 2,
              "children": {
                "Composants du carburateur": {
                  "categoryId": null,
                  "categoryName": "Composants du carburateur",
                  "level": 4,
                  "children": {
                    "Bouton de poignée, carburateur": {
                      "categoryId": 102906,
                      "categoryName": "Carburettor Parts",
                      "level": 3,
                      "children": [],
                      "productId": 1937
                    }
                  }
                }
              },
              "productId": 1937
            },
            "Bras oscillant, carburateur": {
              "categoryId": 102903,
              "categoryName": "Carburettor System",
              "level": 2,
              "children": {
                "Composants du carburateur": {
                  "categoryId": null,
                  "categoryName": "Composants du carburateur",
                  "level": 4,
                  "children": {
                    "Bras oscillant, carburateur": {
                      "categoryId": 102906,
                      "categoryName": "Carburettor Parts",
                      "level": 3,
                      "children": [],
                      "productId": 1969
                    }
                  }
                }
              },
              "productId": 1969
            },
            "Câble d'accélération": {
              "categoryId": 102903,
              "categoryName": "Carburettor System",
              "level": 2,
              "children": {
                "Commande / Amortisseurs / Boîtiers": {
                  "categoryId": null,
                  "categoryName": "Commande / Amortisseurs / Boîtiers",
                  "level": 4,
                  "children": {
                    "Câble d'accélération": {
                      "categoryId": 102910,
                      "categoryName": "Control Linkage/Damper/Chambers",
                      "level": 3,
                      "children": [],
                      "productId": 618
                    }
                  }
                }
              },
              "productId": 618
            },
            "Câble de masse, carburateur": {
              "categoryId": 102903,
              "categoryName": "Carburettor System",
              "level": 2,
              "children": {
                "Composants du carburateur": {
                  "categoryId": null,
                  "categoryName": "Composants du carburateur",
                  "level": 4,
                  "children": {
                    "Câble de masse, carburateur": {
                      "categoryId": 102906,
                      "categoryName": "Carburettor Parts",
                      "level": 3,
                      "children": [],
                      "productId": 1951
                    }
                  }
                }
              },
              "productId": 1951
            },
            "Capsule de commande, carburateur": {
              "categoryId": 102903,
              "categoryName": "Carburettor System",
              "level": 2,
              "children": {
                "Composants du carburateur": {
                  "categoryId": null,
                  "categoryName": "Composants du carburateur",
                  "level": 4,
                  "children": {
                    "Capsule de commande, carburateur": {
                      "categoryId": 102906,
                      "categoryName": "Carburettor Parts",
                      "level": 3,
                      "children": [],
                      "productId": 1917
                    }
                  }
                }
              },
              "productId": 1917
            },
            "Capteur, position du papillon": {
              "categoryId": 102903,
              "categoryName": "Carburettor System",
              "level": 2,
              "children": {
                "Composants du carburateur": {
                  "categoryId": null,
                  "categoryName": "Composants du carburateur",
                  "level": 4,
                  "children": {
                    "Capteur, position du papillon": {
                      "categoryId": 102906,
                      "categoryName": "Carburettor Parts",
                      "level": 3,
                      "children": [],
                      "productId": 1926
                    }
                  }
                }
              },
              "productId": 1926
            },
            "Carburateur": {
              "categoryId": 102903,
              "categoryName": "Carburettor System",
              "level": 2,
              "children": {
                "Carburateur complet": {
                  "categoryId": null,
                  "categoryName": "Carburateur complet",
                  "level": 4,
                  "children": {
                    "Carburateur": {
                      "categoryId": 102904,
                      "categoryName": "Carburettor Complete",
                      "level": 3,
                      "children": [],
                      "productId": 981
                    }
                  }
                }
              },
              "productId": 981
            },
            "Chauffage de bypass": {
              "categoryId": 102903,
              "categoryName": "Carburettor System",
              "level": 2,
              "children": {
                "Composants du carburateur": {
                  "categoryId": null,
                  "categoryName": "Composants du carburateur",
                  "level": 4,
                  "children": {
                    "Chauffage de bypass": {
                      "categoryId": 102906,
                      "categoryName": "Carburettor Parts",
                      "level": 3,
                      "children": [],
                      "productId": 1920
                    }
                  }
                }
              },
              "productId": 1920
            },
            "Chauffage, carburateur": {
              "categoryId": 102903,
              "categoryName": "Carburettor System",
              "level": 2,
              "children": {
                "Composants du carburateur": {
                  "categoryId": null,
                  "categoryName": "Composants du carburateur",
                  "level": 4,
                  "children": {
                    "Chauffage, carburateur": {
                      "categoryId": 102906,
                      "categoryName": "Carburettor Parts",
                      "level": 3,
                      "children": [],
                      "productId": 1956
                    }
                  }
                }
              },
              "productId": 1956
            },
            "Commande de papillon d'étranglement primaire, carburateur": {
              "categoryId": 102903,
              "categoryName": "Carburettor System",
              "level": 2,
              "children": {
                "Composants du carburateur": {
                  "categoryId": null,
                  "categoryName": "Composants du carburateur",
                  "level": 4,
                  "children": {
                    "Commande de papillon d'étranglement primaire, carburateur": {
                      "categoryId": 102906,
                      "categoryName": "Carburettor Parts",
                      "level": 3,
                      "children": [],
                      "productId": 1984
                    }
                  }
                }
              },
              "productId": 1984
            },
            "Corps du starter, carburateur": {
              "categoryId": 102903,
              "categoryName": "Carburettor System",
              "level": 2,
              "children": {
                "Composants du carburateur": {
                  "categoryId": null,
                  "categoryName": "Composants du carburateur",
                  "level": 4,
                  "children": {
                    "Corps du starter, carburateur": {
                      "categoryId": 102906,
                      "categoryName": "Carburettor Parts",
                      "level": 3,
                      "children": [],
                      "productId": 1977
                    }
                  }
                }
              },
              "productId": 1977
            },
            "Coupure de gicleur principal, carburateur": {
              "categoryId": 102903,
              "categoryName": "Carburettor System",
              "level": 2,
              "children": {
                "Composants du carburateur": {
                  "categoryId": null,
                  "categoryName": "Composants du carburateur",
                  "level": 4,
                  "children": {
                    "Coupure de gicleur principal, carburateur": {
                      "categoryId": 102906,
                      "categoryName": "Carburettor Parts",
                      "level": 3,
                      "children": [],
                      "productId": 1938
                    }
                  }
                }
              },
              "productId": 1938
            },
            "Couvercle de diaphragme, carburateur": {
              "categoryId": 102903,
              "categoryName": "Carburettor System",
              "level": 2,
              "children": {
                "Composants du carburateur": {
                  "categoryId": null,
                  "categoryName": "Composants du carburateur",
                  "level": 4,
                  "children": {
                    "Couvercle de diaphragme, carburateur": {
                      "categoryId": 102906,
                      "categoryName": "Carburettor Parts",
                      "level": 3,
                      "children": [],
                      "productId": 1952
                    }
                  }
                }
              },
              "productId": 1952
            },
            "Couvercle de starter, carburateur": {
              "categoryId": 102903,
              "categoryName": "Carburettor System",
              "level": 2,
              "children": {
                "Composants du carburateur": {
                  "categoryId": null,
                  "categoryName": "Composants du carburateur",
                  "level": 4,
                  "children": {
                    "Couvercle de starter, carburateur": {
                      "categoryId": 102906,
                      "categoryName": "Carburettor Parts",
                      "level": 3,
                      "children": [],
                      "productId": 1971
                    }
                  }
                }
              },
              "productId": 1971
            },
            "Couvercle, carburateur": {
              "categoryId": 102903,
              "categoryName": "Carburettor System",
              "level": 2,
              "children": {
                "Composants du carburateur": {
                  "categoryId": null,
                  "categoryName": "Composants du carburateur",
                  "level": 4,
                  "children": {
                    "Couvercle, carburateur": {
                      "categoryId": 102906,
                      "categoryName": "Carburettor Parts",
                      "level": 3,
                      "children": [],
                      "productId": 1921
                    }
                  }
                }
              },
              "productId": 1921
            },
            "Couvercle, pompe d'accélération": {
              "categoryId": 102903,
              "categoryName": "Carburettor System",
              "level": 2,
              "children": {
                "Composants du carburateur": {
                  "categoryId": null,
                  "categoryName": "Composants du carburateur",
                  "level": 4,
                  "children": {
                    "Couvercle, pompe d'accélération": {
                      "categoryId": 102906,
                      "categoryName": "Carburettor Parts",
                      "level": 3,
                      "children": [],
                      "productId": 1960
                    }
                  }
                }
              },
              "productId": 1960
            },
            "Diaphragme pulldown, carburateur": {
              "categoryId": 102903,
              "categoryName": "Carburettor System",
              "level": 2,
              "children": {
                "Composants du carburateur": {
                  "categoryId": null,
                  "categoryName": "Composants du carburateur",
                  "level": 4,
                  "children": {
                    "Diaphragme pulldown, carburateur": {
                      "categoryId": 102906,
                      "categoryName": "Carburettor Parts",
                      "level": 3,
                      "children": [],
                      "productId": 1958
                    }
                  }
                }
              },
              "productId": 1958
            },
            "Diaphragme, carburateur": {
              "categoryId": 102903,
              "categoryName": "Carburettor System",
              "level": 2,
              "children": {
                "Composants du carburateur": {
                  "categoryId": null,
                  "categoryName": "Composants du carburateur",
                  "level": 4,
                  "children": {
                    "Diaphragme, carburateur": {
                      "categoryId": 102906,
                      "categoryName": "Carburettor Parts",
                      "level": 3,
                      "children": [],
                      "productId": 1953
                    }
                  }
                }
              },
              "productId": 1953
            },
            "Élément pulldown, carburateur": {
              "categoryId": 102903,
              "categoryName": "Carburettor System",
              "level": 2,
              "children": {
                "Composants du carburateur": {
                  "categoryId": null,
                  "categoryName": "Composants du carburateur",
                  "level": 4,
                  "children": {
                    "Élément pulldown, carburateur": {
                      "categoryId": 102906,
                      "categoryName": "Carburettor Parts",
                      "level": 3,
                      "children": [],
                      "productId": 1957
                    }
                  }
                }
              },
              "productId": 1957
            },
            "Flasque chauffante, carburateur": {
              "categoryId": 102903,
              "categoryName": "Carburettor System",
              "level": 2,
              "children": {
                "Bride": {
                  "categoryId": null,
                  "categoryName": "Bride",
                  "level": 4,
                  "children": {
                    "Flasque chauffante, carburateur": {
                      "categoryId": 102908,
                      "categoryName": "Flange",
                      "level": 3,
                      "children": [],
                      "productId": 371
                    }
                  }
                }
              },
              "productId": 371
            },
            "Flasque intermédiaire, carburateur": {
              "categoryId": 102903,
              "categoryName": "Carburettor System",
              "level": 2,
              "children": {
                "Composants du carburateur": {
                  "categoryId": null,
                  "categoryName": "Composants du carburateur",
                  "level": 4,
                  "children": {
                    "Flasque intermédiaire, carburateur": {
                      "categoryId": 102906,
                      "categoryName": "Carburettor Parts",
                      "level": 3,
                      "children": [],
                      "productId": 1992
                    }
                  }
                }
              },
              "productId": 1992
            },
            "Flasque, carburateur": {
              "categoryId": 102903,
              "categoryName": "Carburettor System",
              "level": 2,
              "children": {
                "Bride": {
                  "categoryId": null,
                  "categoryName": "Bride",
                  "level": 4,
                  "children": {
                    "Flasque, carburateur": {
                      "categoryId": 102908,
                      "categoryName": "Flange",
                      "level": 3,
                      "children": [],
                      "productId": 1081
                    }
                  }
                }
              },
              "productId": 1081
            },
            "Flotteur, carburateur": {
              "categoryId": 102903,
              "categoryName": "Carburettor System",
              "level": 2,
              "children": {
                "Composants du carburateur": {
                  "categoryId": null,
                  "categoryName": "Composants du carburateur",
                  "level": 4,
                  "children": {
                    "Flotteur, carburateur": {
                      "categoryId": 102906,
                      "categoryName": "Carburettor Parts",
                      "level": 3,
                      "children": [],
                      "productId": 1967
                    }
                  }
                }
              },
              "productId": 1967
            },
            "Gaine de protection, câble d'accélérateur": {
              "categoryId": 102903,
              "categoryName": "Carburettor System",
              "level": 2,
              "children": {
                "Commande / Amortisseurs / Boîtiers": {
                  "categoryId": null,
                  "categoryName": "Commande / Amortisseurs / Boîtiers",
                  "level": 4,
                  "children": {
                    "Gaine de protection, câble d'accélérateur": {
                      "categoryId": 102910,
                      "categoryName": "Control Linkage/Damper/Chambers",
                      "level": 3,
                      "children": [],
                      "productId": 5980
                    }
                  }
                }
              },
              "productId": 5980
            },
            "Galet de blocage, carburateur": {
              "categoryId": 102903,
              "categoryName": "Carburettor System",
              "level": 2,
              "children": {
                "Composants du carburateur": {
                  "categoryId": null,
                  "categoryName": "Composants du carburateur",
                  "level": 4,
                  "children": {
                    "Galet de blocage, carburateur": {
                      "categoryId": 102906,
                      "categoryName": "Carburettor Parts",
                      "level": 3,
                      "children": [],
                      "productId": 1941
                    }
                  }
                }
              },
              "productId": 1941
            },
            "Gicleur de ralenti, carburateur": {
              "categoryId": 102903,
              "categoryName": "Carburettor System",
              "level": 2,
              "children": {
                "Composants du carburateur": {
                  "categoryId": null,
                  "categoryName": "Composants du carburateur",
                  "level": 4,
                  "children": {
                    "Gicleur de ralenti, carburateur": {
                      "categoryId": 102906,
                      "categoryName": "Carburettor Parts",
                      "level": 3,
                      "children": [],
                      "productId": 1946
                    }
                  }
                }
              },
              "productId": 1946
            },
            "Gicleur, carburateur": {
              "categoryId": 102903,
              "categoryName": "Carburettor System",
              "level": 2,
              "children": {
                "Composants du carburateur": {
                  "categoryId": null,
                  "categoryName": "Composants du carburateur",
                  "level": 4,
                  "children": {
                    "Gicleur, carburateur": {
                      "categoryId": 102906,
                      "categoryName": "Carburettor Parts",
                      "level": 3,
                      "children": [],
                      "productId": 1929
                    }
                  }
                }
              },
              "productId": 1929
            },
            "Interrupteur de température, préchauffage tube d'admission": {
              "categoryId": 102903,
              "categoryName": "Carburettor System",
              "level": 2,
              "children": {
                "Interrupteur / relais": {
                  "categoryId": null,
                  "categoryName": "Interrupteur / relais",
                  "level": 4,
                  "children": {
                    "Interrupteur de température, préchauffage tube d'admission": {
                      "categoryId": 102911,
                      "categoryName": "Switch/ Relay",
                      "level": 3,
                      "children": [],
                      "productId": 2136
                    }
                  }
                }
              },
              "productId": 2136
            },
            "Interrupteur de température, starter automatique": {
              "categoryId": 102903,
              "categoryName": "Carburettor System",
              "level": 2,
              "children": {
                "Interrupteur / relais": {
                  "categoryId": null,
                  "categoryName": "Interrupteur / relais",
                  "level": 4,
                  "children": {
                    "Interrupteur de température, starter automatique": {
                      "categoryId": 102911,
                      "categoryName": "Switch/ Relay",
                      "level": 3,
                      "children": [],
                      "productId": 2134
                    }
                  }
                }
              },
              "productId": 2134
            },
            "Interrupteur, carburateur": {
              "categoryId": 102903,
              "categoryName": "Carburettor System",
              "level": 2,
              "children": {
                "Interrupteur / relais": {
                  "categoryId": null,
                  "categoryName": "Interrupteur / relais",
                  "level": 4,
                  "children": {
                    "Interrupteur, carburateur": {
                      "categoryId": 102911,
                      "categoryName": "Switch/ Relay",
                      "level": 3,
                      "children": [],
                      "productId": 1104
                    }
                  }
                }
              },
              "productId": 1104
            },
            "Jeu de câbles, carburateur": {
              "categoryId": 102903,
              "categoryName": "Carburettor System",
              "level": 2,
              "children": {
                "Faisceau de câbles": {
                  "categoryId": null,
                  "categoryName": "Faisceau de câbles",
                  "level": 4,
                  "children": {
                    "Jeu de câbles, carburateur": {
                      "categoryId": 102912,
                      "categoryName": "Cable Harness",
                      "level": 3,
                      "children": [],
                      "productId": 1098
                    }
                  }
                }
              },
              "productId": 1098
            },
            "Jeu de joints d'étanchéité, carburateur": {
              "categoryId": 102903,
              "categoryName": "Carburettor System",
              "level": 2,
              "children": {
                "Joints": {
                  "categoryId": null,
                  "categoryName": "Joints",
                  "level": 4,
                  "children": {
                    "Jeu de joints d'étanchéité, carburateur": {
                      "categoryId": 102907,
                      "categoryName": "Gaskets",
                      "level": 3,
                      "children": [],
                      "productId": 1089
                    }
                  }
                }
              },
              "productId": 1089
            },
            "Joint d'étanchéité, bride de carburateur": {
              "categoryId": 102903,
              "categoryName": "Carburettor System",
              "level": 2,
              "children": {
                "Joints": {
                  "categoryId": null,
                  "categoryName": "Joints",
                  "level": 4,
                  "children": {
                    "Joint d'étanchéité, bride de carburateur": {
                      "categoryId": 102907,
                      "categoryName": "Gaskets",
                      "level": 3,
                      "children": [],
                      "productId": 205
                    }
                  }
                }
              },
              "productId": 205
            },
            "Kit de mise à niveau, contrôle de démarrage à froid": {
              "categoryId": 102903,
              "categoryName": "Carburettor System",
              "level": 2,
              "children": {
                "Kit de mise à niveau": {
                  "categoryId": null,
                  "categoryName": "Kit de mise à niveau",
                  "level": 4,
                  "children": {
                    "Kit de mise à niveau, contrôle de démarrage à froid": {
                      "categoryId": 102914,
                      "categoryName": "Conversion Kit",
                      "level": 3,
                      "children": [],
                      "productId": 2792
                    }
                  }
                }
              },
              "productId": 2792
            },
            "Kit de réparation, carburateur": {
              "categoryId": 102903,
              "categoryName": "Carburettor System",
              "level": 2,
              "children": {
                "Kit de réparation": {
                  "categoryId": null,
                  "categoryName": "Kit de réparation",
                  "level": 4,
                  "children": {
                    "Kit de réparation, carburateur": {
                      "categoryId": 102905,
                      "categoryName": "Repair Kit",
                      "level": 3,
                      "children": [],
                      "productId": 1090
                    }
                  }
                }
              },
              "productId": 1090
            },
            "Kit de réparation, pointeau d'arrivée d'essence": {
              "categoryId": 102903,
              "categoryName": "Carburettor System",
              "level": 2,
              "children": {
                "Composants du carburateur": {
                  "categoryId": null,
                  "categoryName": "Composants du carburateur",
                  "level": 4,
                  "children": {
                    "Kit de réparation, pointeau d'arrivée d'essence": {
                      "categoryId": 102906,
                      "categoryName": "Carburettor Parts",
                      "level": 3,
                      "children": [],
                      "productId": 1968
                    }
                  }
                }
              },
              "productId": 1968
            },
            "Kit de starter, carburateur": {
              "categoryId": 102903,
              "categoryName": "Carburettor System",
              "level": 2,
              "children": {
                "Composants du carburateur": {
                  "categoryId": null,
                  "categoryName": "Composants du carburateur",
                  "level": 4,
                  "children": {
                    "Kit de starter, carburateur": {
                      "categoryId": 102906,
                      "categoryName": "Carburettor Parts",
                      "level": 3,
                      "children": [],
                      "productId": 1978
                    }
                  }
                }
              },
              "productId": 1978
            },
            "Kit réparation de câble, automatisme de démarrage": {
              "categoryId": 102903,
              "categoryName": "Carburettor System",
              "level": 2,
              "children": {
                "Faisceau de câbles": {
                  "categoryId": null,
                  "categoryName": "Faisceau de câbles",
                  "level": 4,
                  "children": {
                    "Kit réparation de câble, automatisme de démarrage": {
                      "categoryId": 102912,
                      "categoryName": "Cable Harness",
                      "level": 3,
                      "children": [],
                      "productId": 60054
                    }
                  }
                }
              },
              "productId": 60054
            },
            "Kit réparation de câble, vanne d’arrêt d’air ambiant": {
              "categoryId": 102903,
              "categoryName": "Carburettor System",
              "level": 2,
              "children": {
                "Faisceau de câbles": {
                  "categoryId": null,
                  "categoryName": "Faisceau de câbles",
                  "level": 4,
                  "children": {
                    "Kit réparation de câble, vanne d’arrêt d’air ambiant": {
                      "categoryId": 102912,
                      "categoryName": "Cable Harness",
                      "level": 3,
                      "children": [],
                      "productId": 60056
                    }
                  }
                },
                "Soupapes": {
                  "categoryId": null,
                  "categoryName": "Soupapes",
                  "level": 4,
                  "children": {
                    "Kit réparation de câble, vanne d’arrêt d’air ambiant": {
                      "categoryId": 102909,
                      "categoryName": "Valves",
                      "level": 3,
                      "children": [],
                      "productId": 60056
                    }
                  }
                }
              },
              "productId": 60056
            },
            "Levier d'arrêt, carburateur": {
              "categoryId": 102903,
              "categoryName": "Carburettor System",
              "level": 2,
              "children": {
                "Composants du carburateur": {
                  "categoryId": null,
                  "categoryName": "Composants du carburateur",
                  "level": 4,
                  "children": {
                    "Levier d'arrêt, carburateur": {
                      "categoryId": 102906,
                      "categoryName": "Carburettor Parts",
                      "level": 3,
                      "children": [],
                      "productId": 1916
                    }
                  }
                }
              },
              "productId": 1916
            },
            "Levier d'entraînement, carburateur": {
              "categoryId": 102903,
              "categoryName": "Carburettor System",
              "level": 2,
              "children": {
                "Composants du carburateur": {
                  "categoryId": null,
                  "categoryName": "Composants du carburateur",
                  "level": 4,
                  "children": {
                    "Levier d'entraînement, carburateur": {
                      "categoryId": 102906,
                      "categoryName": "Carburettor Parts",
                      "level": 3,
                      "children": [],
                      "productId": 1954
                    }
                  }
                }
              },
              "productId": 1954
            },
            "Levier de papillon, carburateur": {
              "categoryId": 102903,
              "categoryName": "Carburettor System",
              "level": 2,
              "children": {
                "Composants du carburateur": {
                  "categoryId": null,
                  "categoryName": "Composants du carburateur",
                  "level": 4,
                  "children": {
                    "Levier de papillon, carburateur": {
                      "categoryId": 102906,
                      "categoryName": "Carburettor Parts",
                      "level": 3,
                      "children": [],
                      "productId": 1924
                    }
                  }
                }
              },
              "productId": 1924
            },
            "Levier de starter, carburateur": {
              "categoryId": 102903,
              "categoryName": "Carburettor System",
              "level": 2,
              "children": {
                "Composants du carburateur": {
                  "categoryId": null,
                  "categoryName": "Composants du carburateur",
                  "level": 4,
                  "children": {
                    "Levier de starter, carburateur": {
                      "categoryId": 102906,
                      "categoryName": "Carburettor Parts",
                      "level": 3,
                      "children": [],
                      "productId": 1975
                    }
                  }
                }
              },
              "productId": 1975
            },
            "Levier, carburateur": {
              "categoryId": 102903,
              "categoryName": "Carburettor System",
              "level": 2,
              "children": {
                "Commande / Amortisseurs / Boîtiers": {
                  "categoryId": null,
                  "categoryName": "Commande / Amortisseurs / Boîtiers",
                  "level": 4,
                  "children": {
                    "Levier, carburateur": {
                      "categoryId": 102910,
                      "categoryName": "Control Linkage/Damper/Chambers",
                      "level": 3,
                      "children": [],
                      "productId": 1939
                    }
                  }
                }
              },
              "productId": 1939
            },
            "Levier, pompe d'accélération": {
              "categoryId": 102903,
              "categoryName": "Carburettor System",
              "level": 2,
              "children": {
                "Composants du carburateur": {
                  "categoryId": null,
                  "categoryName": "Composants du carburateur",
                  "level": 4,
                  "children": {
                    "Levier, pompe d'accélération": {
                      "categoryId": 102906,
                      "categoryName": "Carburettor Parts",
                      "level": 3,
                      "children": [],
                      "productId": 1961
                    }
                  }
                }
              },
              "productId": 1961
            },
            "Manchon d'injecteur, carburateur": {
              "categoryId": 102903,
              "categoryName": "Carburettor System",
              "level": 2,
              "children": {
                "Composants du carburateur": {
                  "categoryId": null,
                  "categoryName": "Composants du carburateur",
                  "level": 4,
                  "children": {
                    "Manchon d'injecteur, carburateur": {
                      "categoryId": 102906,
                      "categoryName": "Carburettor Parts",
                      "level": 3,
                      "children": [],
                      "productId": 1931
                    }
                  }
                }
              },
              "productId": 1931
            },
            "Manchon de raccord, conduite de carburant": {
              "categoryId": 102903,
              "categoryName": "Carburettor System",
              "level": 2,
              "children": {
                "Composants du carburateur": {
                  "categoryId": null,
                  "categoryName": "Composants du carburateur",
                  "level": 4,
                  "children": {
                    "Manchon de raccord, conduite de carburant": {
                      "categoryId": 102906,
                      "categoryName": "Carburettor Parts",
                      "level": 3,
                      "children": [],
                      "productId": 1943
                    }
                  }
                }
              },
              "productId": 1943
            },
            "Manchon de raccord, conduite du liquide de refroidissement": {
              "categoryId": 102903,
              "categoryName": "Carburettor System",
              "level": 2,
              "children": {
                "Composants du carburateur": {
                  "categoryId": null,
                  "categoryName": "Composants du carburateur",
                  "level": 4,
                  "children": {
                    "Manchon de raccord, conduite du liquide de refroidissement": {
                      "categoryId": 102906,
                      "categoryName": "Carburettor Parts",
                      "level": 3,
                      "children": [],
                      "productId": 1989
                    }
                  }
                }
              },
              "productId": 1989
            },
            "Palier, arbre du papillon des gaz": {
              "categoryId": 102903,
              "categoryName": "Carburettor System",
              "level": 2,
              "children": {
                "Composants du carburateur": {
                  "categoryId": null,
                  "categoryName": "Composants du carburateur",
                  "level": 4,
                  "children": {
                    "Palier, arbre du papillon des gaz": {
                      "categoryId": 102906,
                      "categoryName": "Carburettor Parts",
                      "level": 3,
                      "children": [],
                      "productId": 60835
                    }
                  }
                }
              },
              "productId": 60835
            },
            "Piston, pompe d'accélération": {
              "categoryId": 102903,
              "categoryName": "Carburettor System",
              "level": 2,
              "children": {
                "Composants du carburateur": {
                  "categoryId": null,
                  "categoryName": "Composants du carburateur",
                  "level": 4,
                  "children": {
                    "Piston, pompe d'accélération": {
                      "categoryId": 102906,
                      "categoryName": "Carburettor Parts",
                      "level": 3,
                      "children": [],
                      "productId": 1962
                    }
                  }
                }
              },
              "productId": 1962
            },
            "Pivot, carburateur": {
              "categoryId": 102903,
              "categoryName": "Carburettor System",
              "level": 2,
              "children": {
                "Composants du carburateur": {
                  "categoryId": null,
                  "categoryName": "Composants du carburateur",
                  "level": 4,
                  "children": {
                    "Pivot, carburateur": {
                      "categoryId": 102906,
                      "categoryName": "Carburettor Parts",
                      "level": 3,
                      "children": [],
                      "productId": 1945
                    }
                  }
                }
              },
              "productId": 1945
            },
            "Pointeau d'arrivée d'essence": {
              "categoryId": 102903,
              "categoryName": "Carburettor System",
              "level": 2,
              "children": {
                "Composants du carburateur": {
                  "categoryId": null,
                  "categoryName": "Composants du carburateur",
                  "level": 4,
                  "children": {
                    "Pointeau d'arrivée d'essence": {
                      "categoryId": 102906,
                      "categoryName": "Carburettor Parts",
                      "level": 3,
                      "children": [],
                      "productId": 1785
                    }
                  }
                },
                "Soupapes": {
                  "categoryId": null,
                  "categoryName": "Soupapes",
                  "level": 4,
                  "children": {
                    "Pointeau d'arrivée d'essence": {
                      "categoryId": 102909,
                      "categoryName": "Valves",
                      "level": 3,
                      "children": [],
                      "productId": 1785
                    }
                  }
                }
              },
              "productId": 1785
            },
            "Pompe d'accélération, carburateur": {
              "categoryId": 102903,
              "categoryName": "Carburettor System",
              "level": 2,
              "children": {
                "Composants du carburateur": {
                  "categoryId": null,
                  "categoryName": "Composants du carburateur",
                  "level": 4,
                  "children": {
                    "Pompe d'accélération, carburateur": {
                      "categoryId": 102906,
                      "categoryName": "Carburettor Parts",
                      "level": 3,
                      "children": [],
                      "productId": 1959
                    }
                  }
                }
              },
              "productId": 1959
            },
            "Réglage d'air de ralenti, carburateur": {
              "categoryId": 102903,
              "categoryName": "Carburettor System",
              "level": 2,
              "children": {
                "Composants du carburateur": {
                  "categoryId": null,
                  "categoryName": "Composants du carburateur",
                  "level": 4,
                  "children": {
                    "Réglage d'air de ralenti, carburateur": {
                      "categoryId": 102906,
                      "categoryName": "Carburettor Parts",
                      "level": 3,
                      "children": [],
                      "productId": 1947
                    }
                  }
                }
              },
              "productId": 1947
            },
            "Régulateur à dépression, carburateur": {
              "categoryId": 102903,
              "categoryName": "Carburettor System",
              "level": 2,
              "children": {
                "Composants du carburateur": {
                  "categoryId": null,
                  "categoryName": "Composants du carburateur",
                  "level": 4,
                  "children": {
                    "Régulateur à dépression, carburateur": {
                      "categoryId": 102906,
                      "categoryName": "Carburettor Parts",
                      "level": 3,
                      "children": [],
                      "productId": 1981
                    }
                  }
                }
              },
              "productId": 1981
            },
            "Relais, contrôle de démarrage à froid": {
              "categoryId": 102903,
              "categoryName": "Carburettor System",
              "level": 2,
              "children": {
                "Interrupteur / relais": {
                  "categoryId": null,
                  "categoryName": "Interrupteur / relais",
                  "level": 4,
                  "children": {
                    "Relais, contrôle de démarrage à froid": {
                      "categoryId": 102911,
                      "categoryName": "Switch/ Relay",
                      "level": 3,
                      "children": [],
                      "productId": 797
                    }
                  }
                }
              },
              "productId": 797
            },
            "Relais, préchauffage du tube d'admission": {
              "categoryId": 102903,
              "categoryName": "Carburettor System",
              "level": 2,
              "children": {
                "Interrupteur / relais": {
                  "categoryId": null,
                  "categoryName": "Interrupteur / relais",
                  "level": 4,
                  "children": {
                    "Relais, préchauffage du tube d'admission": {
                      "categoryId": 102911,
                      "categoryName": "Switch/ Relay",
                      "level": 3,
                      "children": [],
                      "productId": 1187
                    }
                  }
                }
              },
              "productId": 1187
            },
            "Ressort de torsion, carburateur": {
              "categoryId": 102903,
              "categoryName": "Carburettor System",
              "level": 2,
              "children": {
                "Composants du carburateur": {
                  "categoryId": null,
                  "categoryName": "Composants du carburateur",
                  "level": 4,
                  "children": {
                    "Ressort de torsion, carburateur": {
                      "categoryId": 102906,
                      "categoryName": "Carburettor Parts",
                      "level": 3,
                      "children": [],
                      "productId": 1923
                    }
                  }
                }
              },
              "productId": 1923
            },
            "Ressort de traction, carburateur": {
              "categoryId": 102903,
              "categoryName": "Carburettor System",
              "level": 2,
              "children": {
                "Composants du carburateur": {
                  "categoryId": null,
                  "categoryName": "Composants du carburateur",
                  "level": 4,
                  "children": {
                    "Ressort de traction, carburateur": {
                      "categoryId": 102906,
                      "categoryName": "Carburettor Parts",
                      "level": 3,
                      "children": [],
                      "productId": 1991
                    }
                  }
                }
              },
              "productId": 1991
            },
            "Ressort spiral, carburateur": {
              "categoryId": 102903,
              "categoryName": "Carburettor System",
              "level": 2,
              "children": {
                "Composants du carburateur": {
                  "categoryId": null,
                  "categoryName": "Composants du carburateur",
                  "level": 4,
                  "children": {
                    "Ressort spiral, carburateur": {
                      "categoryId": 102906,
                      "categoryName": "Carburettor Parts",
                      "level": 3,
                      "children": [],
                      "productId": 1918
                    }
                  }
                }
              },
              "productId": 1918
            },
            "Ressort, conmmande d'accélération": {
              "categoryId": 102903,
              "categoryName": "Carburettor System",
              "level": 2,
              "children": {
                "Commande / Amortisseurs / Boîtiers": {
                  "categoryId": null,
                  "categoryName": "Commande / Amortisseurs / Boîtiers",
                  "level": 4,
                  "children": {
                    "Ressort, conmmande d'accélération": {
                      "categoryId": 102910,
                      "categoryName": "Control Linkage/Damper/Chambers",
                      "level": 3,
                      "children": [],
                      "productId": 1755
                    }
                  }
                },
                "Composants du carburateur": {
                  "categoryId": null,
                  "categoryName": "Composants du carburateur",
                  "level": 4,
                  "children": {
                    "Ressort, conmmande d'accélération": {
                      "categoryId": 102906,
                      "categoryName": "Carburettor Parts",
                      "level": 3,
                      "children": [],
                      "productId": 1755
                    }
                  }
                }
              },
              "productId": 1755
            },
            "Séparateur de gaz, carburateur": {
              "categoryId": 102903,
              "categoryName": "Carburettor System",
              "level": 2,
              "children": {
                "Composants du carburateur": {
                  "categoryId": null,
                  "categoryName": "Composants du carburateur",
                  "level": 4,
                  "children": {
                    "Séparateur de gaz, carburateur": {
                      "categoryId": 102906,
                      "categoryName": "Carburettor Parts",
                      "level": 3,
                      "children": [],
                      "productId": 217
                    }
                  }
                }
              },
              "productId": 217
            },
            "Soupape de réglage du ralenti, carburateur": {
              "categoryId": 102903,
              "categoryName": "Carburettor System",
              "level": 2,
              "children": {
                "Soupapes": {
                  "categoryId": null,
                  "categoryName": "Soupapes",
                  "level": 4,
                  "children": {
                    "Soupape de réglage du ralenti, carburateur": {
                      "categoryId": 102909,
                      "categoryName": "Valves",
                      "level": 3,
                      "children": [],
                      "productId": 31
                    }
                  }
                }
              },
              "productId": 31
            },
            "Soupape, air de circulation de carburant": {
              "categoryId": 102903,
              "categoryName": "Carburettor System",
              "level": 2,
              "children": {
                "Soupapes": {
                  "categoryId": null,
                  "categoryName": "Soupapes",
                  "level": 4,
                  "children": {
                    "Soupape, air de circulation de carburant": {
                      "categoryId": 102909,
                      "categoryName": "Valves",
                      "level": 3,
                      "children": [],
                      "productId": 974
                    }
                  }
                }
              },
              "productId": 974
            },
            "Soupape, carburateur": {
              "categoryId": 102903,
              "categoryName": "Carburettor System",
              "level": 2,
              "children": {
                "Soupapes": {
                  "categoryId": null,
                  "categoryName": "Soupapes",
                  "level": 4,
                  "children": {
                    "Soupape, carburateur": {
                      "categoryId": 102909,
                      "categoryName": "Valves",
                      "level": 3,
                      "children": [],
                      "productId": 1306
                    }
                  }
                }
              },
              "productId": 1306
            },
            "Starter supplémemtaire, carburateur": {
              "categoryId": 102903,
              "categoryName": "Carburettor System",
              "level": 2,
              "children": {
                "Composants du carburateur": {
                  "categoryId": null,
                  "categoryName": "Composants du carburateur",
                  "level": 4,
                  "children": {
                    "Starter supplémemtaire, carburateur": {
                      "categoryId": 102906,
                      "categoryName": "Carburettor Parts",
                      "level": 3,
                      "children": [],
                      "productId": 1987
                    }
                  }
                }
              },
              "productId": 1987
            },
            "Support d'actionneur": {
              "categoryId": 102903,
              "categoryName": "Carburettor System",
              "level": 2,
              "children": {
                "Composants du carburateur": {
                  "categoryId": null,
                  "categoryName": "Composants du carburateur",
                  "level": 4,
                  "children": {
                    "Support d'actionneur": {
                      "categoryId": 102906,
                      "categoryName": "Carburettor Parts",
                      "level": 3,
                      "children": [],
                      "productId": 1930
                    }
                  }
                }
              },
              "productId": 1930
            },
            "Support, carburateur": {
              "categoryId": 102903,
              "categoryName": "Carburettor System",
              "level": 2,
              "children": {
                "Composants du carburateur": {
                  "categoryId": null,
                  "categoryName": "Composants du carburateur",
                  "level": 4,
                  "children": {
                    "Support, carburateur": {
                      "categoryId": 102906,
                      "categoryName": "Carburettor Parts",
                      "level": 3,
                      "children": [],
                      "productId": 1936
                    }
                  }
                }
              },
              "productId": 1936
            },
            "Support, commande de papillon d'étranglement primaire": {
              "categoryId": 102903,
              "categoryName": "Carburettor System",
              "level": 2,
              "children": {
                "Composants du carburateur": {
                  "categoryId": null,
                  "categoryName": "Composants du carburateur",
                  "level": 4,
                  "children": {
                    "Support, commande de papillon d'étranglement primaire": {
                      "categoryId": 102906,
                      "categoryName": "Carburettor Parts",
                      "level": 3,
                      "children": [],
                      "productId": 1986
                    }
                  }
                }
              },
              "productId": 1986
            },
            "Support, levier de papillon": {
              "categoryId": 102903,
              "categoryName": "Carburettor System",
              "level": 2,
              "children": {
                "Composants du carburateur": {
                  "categoryId": null,
                  "categoryName": "Composants du carburateur",
                  "level": 4,
                  "children": {
                    "Support, levier de papillon": {
                      "categoryId": 102906,
                      "categoryName": "Carburettor Parts",
                      "level": 3,
                      "children": [],
                      "productId": 1925
                    }
                  }
                }
              },
              "productId": 1925
            },
            "Support, tirette à câble": {
              "categoryId": 102903,
              "categoryName": "Carburettor System",
              "level": 2,
              "children": {
                "Composants du carburateur": {
                  "categoryId": null,
                  "categoryName": "Composants du carburateur",
                  "level": 4,
                  "children": {
                    "Support, tirette à câble": {
                      "categoryId": 102906,
                      "categoryName": "Carburettor Parts",
                      "level": 3,
                      "children": [],
                      "productId": 1919
                    }
                  }
                }
              },
              "productId": 1919
            },
            "Tamis de carburant, carburateur": {
              "categoryId": 102903,
              "categoryName": "Carburettor System",
              "level": 2,
              "children": {
                "Composants du carburateur": {
                  "categoryId": null,
                  "categoryName": "Composants du carburateur",
                  "level": 4,
                  "children": {
                    "Tamis de carburant, carburateur": {
                      "categoryId": 102906,
                      "categoryName": "Carburettor Parts",
                      "level": 3,
                      "children": [],
                      "productId": 1944
                    }
                  }
                }
              },
              "productId": 1944
            },
            "Tamis, carburateur": {
              "categoryId": 102903,
              "categoryName": "Carburettor System",
              "level": 2,
              "children": {
                "Composants du carburateur": {
                  "categoryId": null,
                  "categoryName": "Composants du carburateur",
                  "level": 4,
                  "children": {
                    "Tamis, carburateur": {
                      "categoryId": 102906,
                      "categoryName": "Carburettor Parts",
                      "level": 3,
                      "children": [],
                      "productId": 1970
                    }
                  }
                }
              },
              "productId": 1970
            },
            "Tirette à câble, contrôle de démarrage à froid": {
              "categoryId": 102903,
              "categoryName": "Carburettor System",
              "level": 2,
              "children": {
                "Commande / Amortisseurs / Boîtiers": {
                  "categoryId": null,
                  "categoryName": "Commande / Amortisseurs / Boîtiers",
                  "level": 4,
                  "children": {
                    "Tirette à câble, contrôle de démarrage à froid": {
                      "categoryId": 102910,
                      "categoryName": "Control Linkage/Damper/Chambers",
                      "level": 3,
                      "children": [],
                      "productId": 4736
                    }
                  }
                }
              },
              "productId": 4736
            },
            "Tube d'injection, pompe d'accélération": {
              "categoryId": 102903,
              "categoryName": "Carburettor System",
              "level": 2,
              "children": {
                "Composants du carburateur": {
                  "categoryId": null,
                  "categoryName": "Composants du carburateur",
                  "level": 4,
                  "children": {
                    "Tube d'injection, pompe d'accélération": {
                      "categoryId": 102906,
                      "categoryName": "Carburettor Parts",
                      "level": 3,
                      "children": [],
                      "productId": 1963
                    }
                  }
                }
              },
              "productId": 1963
            },
            "Tuyau d'angle, carburateur": {
              "categoryId": 102903,
              "categoryName": "Carburettor System",
              "level": 2,
              "children": {
                "Composants du carburateur": {
                  "categoryId": null,
                  "categoryName": "Composants du carburateur",
                  "level": 4,
                  "children": {
                    "Tuyau d'angle, carburateur": {
                      "categoryId": 102906,
                      "categoryName": "Carburettor Parts",
                      "level": 3,
                      "children": [],
                      "productId": 1990
                    }
                  }
                }
              },
              "productId": 1990
            },
            "Tuyau, carburateur": {
              "categoryId": 102903,
              "categoryName": "Carburettor System",
              "level": 2,
              "children": {
                "Composants du carburateur": {
                  "categoryId": null,
                  "categoryName": "Composants du carburateur",
                  "level": 4,
                  "children": {
                    "Tuyau, carburateur": {
                      "categoryId": 102906,
                      "categoryName": "Carburettor Parts",
                      "level": 3,
                      "children": [],
                      "productId": 1966
                    }
                  }
                }
              },
              "productId": 1966
            },
            "Ventilation d'inversion, carburateur": {
              "categoryId": 102903,
              "categoryName": "Carburettor System",
              "level": 2,
              "children": {
                "Composants du carburateur": {
                  "categoryId": null,
                  "categoryName": "Composants du carburateur",
                  "level": 4,
                  "children": {
                    "Ventilation d'inversion, carburateur": {
                      "categoryId": 102906,
                      "categoryName": "Carburettor Parts",
                      "level": 3,
                      "children": [],
                      "productId": 1933
                    }
                  }
                }
              },
              "productId": 1933
            },
            "Venturi secondaire, carburateur": {
              "categoryId": 102903,
              "categoryName": "Carburettor System",
              "level": 2,
              "children": {
                "Composants du carburateur": {
                  "categoryId": null,
                  "categoryName": "Composants du carburateur",
                  "level": 4,
                  "children": {
                    "Venturi secondaire, carburateur": {
                      "categoryId": 102906,
                      "categoryName": "Carburettor Parts",
                      "level": 3,
                      "children": [],
                      "productId": 1988
                    }
                  }
                }
              },
              "productId": 1988
            },
            "Vis à tête bombée, carburateur": {
              "categoryId": 102903,
              "categoryName": "Carburettor System",
              "level": 2,
              "children": {
                "Composants du carburateur": {
                  "categoryId": null,
                  "categoryName": "Composants du carburateur",
                  "level": 4,
                  "children": {
                    "Vis à tête bombée, carburateur": {
                      "categoryId": 102906,
                      "categoryName": "Carburettor Parts",
                      "level": 3,
                      "children": [],
                      "productId": 1949
                    }
                  }
                }
              },
              "productId": 1949
            },
            "Vis de réglage, carburateur": {
              "categoryId": 102903,
              "categoryName": "Carburettor System",
              "level": 2,
              "children": {
                "Composants du carburateur": {
                  "categoryId": null,
                  "categoryName": "Composants du carburateur",
                  "level": 4,
                  "children": {
                    "Vis de réglage, carburateur": {
                      "categoryId": 102906,
                      "categoryName": "Carburettor Parts",
                      "level": 3,
                      "children": [],
                      "productId": 1965
                    }
                  }
                }
              },
              "productId": 1965
            },
            "Vis de serrage, câble de carburateur": {
              "categoryId": 102903,
              "categoryName": "Carburettor System",
              "level": 2,
              "children": {
                "Commande / Amortisseurs / Boîtiers": {
                  "categoryId": null,
                  "categoryName": "Commande / Amortisseurs / Boîtiers",
                  "level": 4,
                  "children": {
                    "Vis de serrage, câble de carburateur": {
                      "categoryId": 102910,
                      "categoryName": "Control Linkage/Damper/Chambers",
                      "level": 3,
                      "children": [],
                      "productId": 60004
                    }
                  }
                }
              },
              "productId": 60004
            },
            "Vis de serrage, carburateur": {
              "categoryId": 102903,
              "categoryName": "Carburettor System",
              "level": 2,
              "children": {
                "Composants du carburateur": {
                  "categoryId": null,
                  "categoryName": "Composants du carburateur",
                  "level": 4,
                  "children": {
                    "Vis de serrage, carburateur": {
                      "categoryId": 102906,
                      "categoryName": "Carburettor Parts",
                      "level": 3,
                      "children": [],
                      "productId": 1942
                    }
                  }
                }
              },
              "productId": 1942
            },
            "Vis-bouchon, carburateur": {
              "categoryId": 102903,
              "categoryName": "Carburettor System",
              "level": 2,
              "children": {
                "Composants du carburateur": {
                  "categoryId": null,
                  "categoryName": "Composants du carburateur",
                  "level": 4,
                  "children": {
                    "Vis-bouchon, carburateur": {
                      "categoryId": 102906,
                      "categoryName": "Carburettor Parts",
                      "level": 3,
                      "children": [],
                      "productId": 1983
                    }
                  }
                }
              },
              "productId": 1983
            },
            "Vis, contrôle du mélange": {
              "categoryId": 102903,
              "categoryName": "Carburettor System",
              "level": 2,
              "children": {
                "Composants du carburateur": {
                  "categoryId": null,
                  "categoryName": "Composants du carburateur",
                  "level": 4,
                  "children": {
                    "Vis, contrôle du mélange": {
                      "categoryId": 102906,
                      "categoryName": "Carburettor Parts",
                      "level": 3,
                      "children": [],
                      "productId": 1935
                    }
                  }
                }
              },
              "productId": 1935
            }
          }
        },
        "Mélange air-carburant": {
          "categoryId": null,
          "categoryName": "Mélange air-carburant",
          "level": 2,
          "children": {
            "Corps papillon": {
              "categoryId": 102793,
              "categoryName": "Mixture Formation",
              "level": 2,
              "children": {
                "Papillon des gaz / tubulure / tuyau de dépression": {
                  "categoryId": null,
                  "categoryName": "Papillon des gaz / tubulure / tuyau de dépression",
                  "level": 4,
                  "children": {
                    "Corps papillon": {
                      "categoryId": 102796,
                      "categoryName": "Throttle Valve/Throttle Body/Vacuum Pipe",
                      "level": 3,
                      "children": [],
                      "productId": 158
                    }
                  }
                }
              },
              "productId": 158
            },
            "Kit réparation de câble, capteur position papillon": {
              "categoryId": 102793,
              "categoryName": "Mixture Formation",
              "level": 2,
              "children": {
                "Kit de réparation/Kit complet": {
                  "categoryId": null,
                  "categoryName": "Kit de réparation/Kit complet",
                  "level": 4,
                  "children": {
                    "Kit réparation de câble, capteur position papillon": {
                      "categoryId": 102807,
                      "categoryName": "Repair Kit",
                      "level": 3,
                      "children": [],
                      "productId": 9571
                    }
                  }
                }
              },
              "productId": 9571
            }
          }
        }
      }
    },
    "Moteur": {
      "categoryId": 100002,
      "categoryName": "Moteur",
      "level": 1,
      "children": {
        "Alimentation en air": {
          "categoryId": null,
          "categoryName": "Alimentation en air",
          "level": 2,
          "children": {
            "Câble d'accélération": {
              "categoryId": 100383,
              "categoryName": "Air Supply",
              "level": 2,
              "children": {
                "Câble d'accélérateur/tringlerie": {
                  "categoryId": null,
                  "categoryName": "Câble d'accélérateur/tringlerie",
                  "level": 4,
                  "children": {
                    "Câble d'accélération": {
                      "categoryId": 100385,
                      "categoryName": "Accelerator Cable/Linkage",
                      "level": 3,
                      "children": [],
                      "productId": 618
                    }
                  }
                }
              },
              "productId": 618
            },
            "Corps papillon": {
              "categoryId": 100383,
              "categoryName": "Air Supply",
              "level": 2,
              "children": {
                "Papillon des gaz /-capteur": {
                  "categoryId": null,
                  "categoryName": "Papillon des gaz /-capteur",
                  "level": 4,
                  "children": {
                    "Corps papillon": {
                      "categoryId": 100704,
                      "categoryName": "Throttle Valve/Sensor",
                      "level": 3,
                      "children": {
                        "Corps papillon": {
                          "categoryId": null,
                          "categoryName": "Corps papillon",
                          "level": 6,
                          "children": {
                            "Corps papillon": {
                              "categoryId": 102339,
                              "categoryName": "Throttle Body",
                              "level": 4,
                              "children": [],
                              "productId": 158
                            }
                          }
                        }
                      },
                      "productId": 158
                    }
                  }
                }
              },
              "productId": 158
            },
            "Gaine de protection, câble d'accélérateur": {
              "categoryId": 100383,
              "categoryName": "Air Supply",
              "level": 2,
              "children": {
                "Câble d'accélérateur/tringlerie": {
                  "categoryId": null,
                  "categoryName": "Câble d'accélérateur/tringlerie",
                  "level": 4,
                  "children": {
                    "Gaine de protection, câble d'accélérateur": {
                      "categoryId": 100385,
                      "categoryName": "Accelerator Cable/Linkage",
                      "level": 3,
                      "children": [],
                      "productId": 5980
                    }
                  }
                }
              },
              "productId": 5980
            }
          }
        },
        "Circuit électrique du moteur": {
          "categoryId": null,
          "categoryName": "Circuit électrique du moteur",
          "level": 2,
          "children": {
            "Appareil de commande, carburateur": {
              "categoryId": 100754,
              "categoryName": "Engine Electrics",
              "level": 2,
              "children": [],
              "productId": 935
            }
          }
        },
        "Culasse / pieces de montage": {
          "categoryId": null,
          "categoryName": "Culasse / pieces de montage",
          "level": 2,
          "children": {
            "Pompe à carburant": {
              "categoryId": 100373,
              "categoryName": "Cylinder Head/Attachment Parts",
              "level": 2,
              "children": {
                "Pompe à vide": {
                  "categoryId": null,
                  "categoryName": "Pompe à vide",
                  "level": 4,
                  "children": {
                    "Pompe à carburant": {
                      "categoryId": 102450,
                      "categoryName": "Vacuum Pump",
                      "level": 3,
                      "children": [],
                      "productId": 458
                    }
                  }
                }
              },
              "productId": 458
            }
          }
        }
      }
    },
    "Système électrique": {
      "categoryId": 100010,
      "categoryName": "Système électrique",
      "level": 1,
      "children": {
        "Appareils de commande": {
          "categoryId": null,
          "categoryName": "Appareils de commande",
          "level": 2,
          "children": {
            "Appareil de commande, carburateur": {
              "categoryId": 100727,
              "categoryName": "Control Units",
              "level": 2,
              "children": [],
              "productId": 935
            }
          }
        },
        "Capteurs": {
          "categoryId": null,
          "categoryName": "Capteurs",
          "level": 2,
          "children": {
            "Capteur, position du papillon": {
              "categoryId": 102747,
              "categoryName": "Sensors",
              "level": 2,
              "children": [],
              "productId": 1926
            }
          }
        },
        "Kit/pièces de câble": {
          "categoryId": null,
          "categoryName": "Kit/pièces de câble",
          "level": 2,
          "children": {
            "Jeu de câbles, carburateur": {
              "categoryId": 103066,
              "categoryName": "Cable Set/individual parts",
              "level": 2,
              "children": [],
              "productId": 1098
            }
          }
        },
        "Relais": {
          "categoryId": null,
          "categoryName": "Relais",
          "level": 2,
          "children": {
            "Relais, contrôle de démarrage à froid": {
              "categoryId": 100785,
              "categoryName": "Relay",
              "level": 2,
              "children": [],
              "productId": 797
            },
            "Relais, préchauffage du tube d'admission": {
              "categoryId": 100785,
              "categoryName": "Relay",
              "level": 2,
              "children": [],
              "productId": 1187
            }
          }
        }
      }
    }
  },
  "arborescenceText": "├── Alimentation carburant [ID: 100214] (Niveau 1)\n│   ├── Additifs (Niveau 2)\n│   │   └── Additive [ID: 706479] (Niveau 2) → ProductId: 9797\n│   ├── Pompe / accessoires (Niveau 2)\n│   │   └── Pump/Accessories [ID: 100251] (Niveau 2) → ProductId: 458\n│   │       └── Pompe d'alimentation (Niveau 4)\n│   │           └── Fuel Pump [ID: 100717] (Niveau 3) → ProductId: 458\n│   └── Soupapes (Niveau 2)\n│       └── Valves [ID: 100252] (Niveau 2) → ProductId: 974\n\n├── Carburation [ID: 100254] (Niveau 1)\n│   ├── Carburateurs (Niveau 2)\n│   │   ├── Carburettor System [ID: 102903] (Niveau 2) → ProductId: 1928\n│   │   │   └── Composants du carburateur (Niveau 4)\n│   │   │       └── Carburettor Parts [ID: 102906] (Niveau 3) → ProductId: 1928\n│   │   ├── Carburettor System [ID: 102903] (Niveau 2) → ProductId: 1694\n│   │   │   └── Composants du carburateur (Niveau 4)\n│   │   │       └── Carburettor Parts [ID: 102906] (Niveau 3) → ProductId: 1694\n│   │   ├── Carburettor System [ID: 102903] (Niveau 2) → ProductId: 1955\n│   │   │   └── Composants du carburateur (Niveau 4)\n│   │   │       └── Carburettor Parts [ID: 102906] (Niveau 3) → ProductId: 1955\n│   │   ├── Carburettor System [ID: 102903] (Niveau 2) → ProductId: 1151\n│   │   │   └── Commande / Amortisseurs / Boîtiers (Niveau 4)\n│   │   │       └── Control Linkage/Damper/Chambers [ID: 102910] (Niveau 3) → ProductId: 1151\n│   │   ├── Carburettor System [ID: 102903] (Niveau 2) → ProductId: 1152\n│   │   │   └── Commande / Amortisseurs / Boîtiers (Niveau 4)\n│   │   │       └── Control Linkage/Damper/Chambers [ID: 102910] (Niveau 3) → ProductId: 1152\n│   │   ├── Carburettor System [ID: 102903] (Niveau 2) → ProductId: 935\n│   │   │   └── Contrôle (Niveau 4)\n│   │   │       └── Control Unit [ID: 102913] (Niveau 3) → ProductId: 935\n│   │   ├── Carburettor System [ID: 102903] (Niveau 2) → ProductId: 1976\n│   │   │   └── Composants du carburateur (Niveau 4)\n│   │   │       └── Carburettor Parts [ID: 102906] (Niveau 3) → ProductId: 1976\n│   │   ├── Carburettor System [ID: 102903] (Niveau 2) → ProductId: 1927\n│   │   │   └── Composants du carburateur (Niveau 4)\n│   │   │       └── Carburettor Parts [ID: 102906] (Niveau 3) → ProductId: 1927\n│   │   ├── Carburettor System [ID: 102903] (Niveau 2) → ProductId: 1922\n│   │   │   └── Composants du carburateur (Niveau 4)\n│   │   │       └── Carburettor Parts [ID: 102906] (Niveau 3) → ProductId: 1922\n│   │   ├── Carburettor System [ID: 102903] (Niveau 2) → ProductId: 1982\n│   │   │   └── Composants du carburateur (Niveau 4)\n│   │   │       └── Carburettor Parts [ID: 102906] (Niveau 3) → ProductId: 1982\n│   │   ├── Carburettor System [ID: 102903] (Niveau 2) → ProductId: 1964\n│   │   │   └── Composants du carburateur (Niveau 4)\n│   │   │       └── Carburettor Parts [ID: 102906] (Niveau 3) → ProductId: 1964\n│   │   ├── Carburettor System [ID: 102903] (Niveau 2) → ProductId: 1979\n│   │   │   └── Composants du carburateur (Niveau 4)\n│   │   │       └── Carburettor Parts [ID: 102906] (Niveau 3) → ProductId: 1979\n│   │   ├── Carburettor System [ID: 102903] (Niveau 2) → ProductId: 976\n│   │   │   └── Commande / Amortisseurs / Boîtiers (Niveau 4)\n│   │   │       └── Control Linkage/Damper/Chambers [ID: 102910] (Niveau 3) → ProductId: 976\n│   │   ├── Carburettor System [ID: 102903] (Niveau 2) → ProductId: 1972\n│   │   │   └── Composants du carburateur (Niveau 4)\n│   │   │       └── Carburettor Parts [ID: 102906] (Niveau 3) → ProductId: 1972\n│   │   ├── Carburettor System [ID: 102903] (Niveau 2) → ProductId: 1940\n│   │   │   └── Composants du carburateur (Niveau 4)\n│   │   │       └── Carburettor Parts [ID: 102906] (Niveau 3) → ProductId: 1940\n│   │   ├── Carburettor System [ID: 102903] (Niveau 2) → ProductId: 1980\n│   │   │   └── Composants du carburateur (Niveau 4)\n│   │   │       └── Carburettor Parts [ID: 102906] (Niveau 3) → ProductId: 1980\n│   │   ├── Carburettor System [ID: 102903] (Niveau 2) → ProductId: 1937\n│   │   │   └── Composants du carburateur (Niveau 4)\n│   │   │       └── Carburettor Parts [ID: 102906] (Niveau 3) → ProductId: 1937\n│   │   ├── Carburettor System [ID: 102903] (Niveau 2) → ProductId: 1969\n│   │   │   └── Composants du carburateur (Niveau 4)\n│   │   │       └── Carburettor Parts [ID: 102906] (Niveau 3) → ProductId: 1969\n│   │   ├── Carburettor System [ID: 102903] (Niveau 2) → ProductId: 618\n│   │   │   └── Commande / Amortisseurs / Boîtiers (Niveau 4)\n│   │   │       └── Control Linkage/Damper/Chambers [ID: 102910] (Niveau 3) → ProductId: 618\n│   │   ├── Carburettor System [ID: 102903] (Niveau 2) → ProductId: 1951\n│   │   │   └── Composants du carburateur (Niveau 4)\n│   │   │       └── Carburettor Parts [ID: 102906] (Niveau 3) → ProductId: 1951\n│   │   ├── Carburettor System [ID: 102903] (Niveau 2) → ProductId: 1917\n│   │   │   └── Composants du carburateur (Niveau 4)\n│   │   │       └── Carburettor Parts [ID: 102906] (Niveau 3) → ProductId: 1917\n│   │   ├── Carburettor System [ID: 102903] (Niveau 2) → ProductId: 1926\n│   │   │   └── Composants du carburateur (Niveau 4)\n│   │   │       └── Carburettor Parts [ID: 102906] (Niveau 3) → ProductId: 1926\n│   │   ├── Carburettor System [ID: 102903] (Niveau 2) → ProductId: 981\n│   │   │   └── Carburateur complet (Niveau 4)\n│   │   │       └── Carburettor Complete [ID: 102904] (Niveau 3) → ProductId: 981\n│   │   ├── Carburettor System [ID: 102903] (Niveau 2) → ProductId: 1920\n│   │   │   └── Composants du carburateur (Niveau 4)\n│   │   │       └── Carburettor Parts [ID: 102906] (Niveau 3) → ProductId: 1920\n│   │   ├── Carburettor System [ID: 102903] (Niveau 2) → ProductId: 1956\n│   │   │   └── Composants du carburateur (Niveau 4)\n│   │   │       └── Carburettor Parts [ID: 102906] (Niveau 3) → ProductId: 1956\n│   │   ├── Carburettor System [ID: 102903] (Niveau 2) → ProductId: 1984\n│   │   │   └── Composants du carburateur (Niveau 4)\n│   │   │       └── Carburettor Parts [ID: 102906] (Niveau 3) → ProductId: 1984\n│   │   ├── Carburettor System [ID: 102903] (Niveau 2) → ProductId: 1977\n│   │   │   └── Composants du carburateur (Niveau 4)\n│   │   │       └── Carburettor Parts [ID: 102906] (Niveau 3) → ProductId: 1977\n│   │   ├── Carburettor System [ID: 102903] (Niveau 2) → ProductId: 1938\n│   │   │   └── Composants du carburateur (Niveau 4)\n│   │   │       └── Carburettor Parts [ID: 102906] (Niveau 3) → ProductId: 1938\n│   │   ├── Carburettor System [ID: 102903] (Niveau 2) → ProductId: 1952\n│   │   │   └── Composants du carburateur (Niveau 4)\n│   │   │       └── Carburettor Parts [ID: 102906] (Niveau 3) → ProductId: 1952\n│   │   ├── Carburettor System [ID: 102903] (Niveau 2) → ProductId: 1971\n│   │   │   └── Composants du carburateur (Niveau 4)\n│   │   │       └── Carburettor Parts [ID: 102906] (Niveau 3) → ProductId: 1971\n│   │   ├── Carburettor System [ID: 102903] (Niveau 2) → ProductId: 1921\n│   │   │   └── Composants du carburateur (Niveau 4)\n│   │   │       └── Carburettor Parts [ID: 102906] (Niveau 3) → ProductId: 1921\n│   │   ├── Carburettor System [ID: 102903] (Niveau 2) → ProductId: 1960\n│   │   │   └── Composants du carburateur (Niveau 4)\n│   │   │       └── Carburettor Parts [ID: 102906] (Niveau 3) → ProductId: 1960\n│   │   ├── Carburettor System [ID: 102903] (Niveau 2) → ProductId: 1958\n│   │   │   └── Composants du carburateur (Niveau 4)\n│   │   │       └── Carburettor Parts [ID: 102906] (Niveau 3) → ProductId: 1958\n│   │   ├── Carburettor System [ID: 102903] (Niveau 2) → ProductId: 1953\n│   │   │   └── Composants du carburateur (Niveau 4)\n│   │   │       └── Carburettor Parts [ID: 102906] (Niveau 3) → ProductId: 1953\n│   │   ├── Carburettor System [ID: 102903] (Niveau 2) → ProductId: 1957\n│   │   │   └── Composants du carburateur (Niveau 4)\n│   │   │       └── Carburettor Parts [ID: 102906] (Niveau 3) → ProductId: 1957\n│   │   ├── Carburettor System [ID: 102903] (Niveau 2) → ProductId: 371\n│   │   │   └── Bride (Niveau 4)\n│   │   │       └── Flange [ID: 102908] (Niveau 3) → ProductId: 371\n│   │   ├── Carburettor System [ID: 102903] (Niveau 2) → ProductId: 1992\n│   │   │   └── Composants du carburateur (Niveau 4)\n│   │   │       └── Carburettor Parts [ID: 102906] (Niveau 3) → ProductId: 1992\n│   │   ├── Carburettor System [ID: 102903] (Niveau 2) → ProductId: 1081\n│   │   │   └── Bride (Niveau 4)\n│   │   │       └── Flange [ID: 102908] (Niveau 3) → ProductId: 1081\n│   │   ├── Carburettor System [ID: 102903] (Niveau 2) → ProductId: 1967\n│   │   │   └── Composants du carburateur (Niveau 4)\n│   │   │       └── Carburettor Parts [ID: 102906] (Niveau 3) → ProductId: 1967\n│   │   ├── Carburettor System [ID: 102903] (Niveau 2) → ProductId: 5980\n│   │   │   └── Commande / Amortisseurs / Boîtiers (Niveau 4)\n│   │   │       └── Control Linkage/Damper/Chambers [ID: 102910] (Niveau 3) → ProductId: 5980\n│   │   ├── Carburettor System [ID: 102903] (Niveau 2) → ProductId: 1941\n│   │   │   └── Composants du carburateur (Niveau 4)\n│   │   │       └── Carburettor Parts [ID: 102906] (Niveau 3) → ProductId: 1941\n│   │   ├── Carburettor System [ID: 102903] (Niveau 2) → ProductId: 1946\n│   │   │   └── Composants du carburateur (Niveau 4)\n│   │   │       └── Carburettor Parts [ID: 102906] (Niveau 3) → ProductId: 1946\n│   │   ├── Carburettor System [ID: 102903] (Niveau 2) → ProductId: 1929\n│   │   │   └── Composants du carburateur (Niveau 4)\n│   │   │       └── Carburettor Parts [ID: 102906] (Niveau 3) → ProductId: 1929\n│   │   ├── Carburettor System [ID: 102903] (Niveau 2) → ProductId: 2136\n│   │   │   └── Interrupteur / relais (Niveau 4)\n│   │   │       └── Switch/ Relay [ID: 102911] (Niveau 3) → ProductId: 2136\n│   │   ├── Carburettor System [ID: 102903] (Niveau 2) → ProductId: 2134\n│   │   │   └── Interrupteur / relais (Niveau 4)\n│   │   │       └── Switch/ Relay [ID: 102911] (Niveau 3) → ProductId: 2134\n│   │   ├── Carburettor System [ID: 102903] (Niveau 2) → ProductId: 1104\n│   │   │   └── Interrupteur / relais (Niveau 4)\n│   │   │       └── Switch/ Relay [ID: 102911] (Niveau 3) → ProductId: 1104\n│   │   ├── Carburettor System [ID: 102903] (Niveau 2) → ProductId: 1098\n│   │   │   └── Faisceau de câbles (Niveau 4)\n│   │   │       └── Cable Harness [ID: 102912] (Niveau 3) → ProductId: 1098\n│   │   ├── Carburettor System [ID: 102903] (Niveau 2) → ProductId: 1089\n│   │   │   └── Joints (Niveau 4)\n│   │   │       └── Gaskets [ID: 102907] (Niveau 3) → ProductId: 1089\n│   │   ├── Carburettor System [ID: 102903] (Niveau 2) → ProductId: 205\n│   │   │   └── Joints (Niveau 4)\n│   │   │       └── Gaskets [ID: 102907] (Niveau 3) → ProductId: 205\n│   │   ├── Carburettor System [ID: 102903] (Niveau 2) → ProductId: 2792\n│   │   │   └── Kit de mise à niveau (Niveau 4)\n│   │   │       └── Conversion Kit [ID: 102914] (Niveau 3) → ProductId: 2792\n│   │   ├── Carburettor System [ID: 102903] (Niveau 2) → ProductId: 1090\n│   │   │   └── Kit de réparation (Niveau 4)\n│   │   │       └── Repair Kit [ID: 102905] (Niveau 3) → ProductId: 1090\n│   │   ├── Carburettor System [ID: 102903] (Niveau 2) → ProductId: 1968\n│   │   │   └── Composants du carburateur (Niveau 4)\n│   │   │       └── Carburettor Parts [ID: 102906] (Niveau 3) → ProductId: 1968\n│   │   ├── Carburettor System [ID: 102903] (Niveau 2) → ProductId: 1978\n│   │   │   └── Composants du carburateur (Niveau 4)\n│   │   │       └── Carburettor Parts [ID: 102906] (Niveau 3) → ProductId: 1978\n│   │   ├── Carburettor System [ID: 102903] (Niveau 2) → ProductId: 60054\n│   │   │   └── Faisceau de câbles (Niveau 4)\n│   │   │       └── Cable Harness [ID: 102912] (Niveau 3) → ProductId: 60054\n│   │   ├── Carburettor System [ID: 102903] (Niveau 2) → ProductId: 60056\n│   │   │   ├── Faisceau de câbles (Niveau 4)\n│   │   │   │   └── Cable Harness [ID: 102912] (Niveau 3) → ProductId: 60056\n│   │   │   └── Soupapes (Niveau 4)\n│   │   │       └── Valves [ID: 102909] (Niveau 3) → ProductId: 60056\n│   │   ├── Carburettor System [ID: 102903] (Niveau 2) → ProductId: 1916\n│   │   │   └── Composants du carburateur (Niveau 4)\n│   │   │       └── Carburettor Parts [ID: 102906] (Niveau 3) → ProductId: 1916\n│   │   ├── Carburettor System [ID: 102903] (Niveau 2) → ProductId: 1954\n│   │   │   └── Composants du carburateur (Niveau 4)\n│   │   │       └── Carburettor Parts [ID: 102906] (Niveau 3) → ProductId: 1954\n│   │   ├── Carburettor System [ID: 102903] (Niveau 2) → ProductId: 1924\n│   │   │   └── Composants du carburateur (Niveau 4)\n│   │   │       └── Carburettor Parts [ID: 102906] (Niveau 3) → ProductId: 1924\n│   │   ├── Carburettor System [ID: 102903] (Niveau 2) → ProductId: 1975\n│   │   │   └── Composants du carburateur (Niveau 4)\n│   │   │       └── Carburettor Parts [ID: 102906] (Niveau 3) → ProductId: 1975\n│   │   ├── Carburettor System [ID: 102903] (Niveau 2) → ProductId: 1939\n│   │   │   └── Commande / Amortisseurs / Boîtiers (Niveau 4)\n│   │   │       └── Control Linkage/Damper/Chambers [ID: 102910] (Niveau 3) → ProductId: 1939\n│   │   ├── Carburettor System [ID: 102903] (Niveau 2) → ProductId: 1961\n│   │   │   └── Composants du carburateur (Niveau 4)\n│   │   │       └── Carburettor Parts [ID: 102906] (Niveau 3) → ProductId: 1961\n│   │   ├── Carburettor System [ID: 102903] (Niveau 2) → ProductId: 1931\n│   │   │   └── Composants du carburateur (Niveau 4)\n│   │   │       └── Carburettor Parts [ID: 102906] (Niveau 3) → ProductId: 1931\n│   │   ├── Carburettor System [ID: 102903] (Niveau 2) → ProductId: 1943\n│   │   │   └── Composants du carburateur (Niveau 4)\n│   │   │       └── Carburettor Parts [ID: 102906] (Niveau 3) → ProductId: 1943\n│   │   ├── Carburettor System [ID: 102903] (Niveau 2) → ProductId: 1989\n│   │   │   └── Composants du carburateur (Niveau 4)\n│   │   │       └── Carburettor Parts [ID: 102906] (Niveau 3) → ProductId: 1989\n│   │   ├── Carburettor System [ID: 102903] (Niveau 2) → ProductId: 60835\n│   │   │   └── Composants du carburateur (Niveau 4)\n│   │   │       └── Carburettor Parts [ID: 102906] (Niveau 3) → ProductId: 60835\n│   │   ├── Carburettor System [ID: 102903] (Niveau 2) → ProductId: 1962\n│   │   │   └── Composants du carburateur (Niveau 4)\n│   │   │       └── Carburettor Parts [ID: 102906] (Niveau 3) → ProductId: 1962\n│   │   ├── Carburettor System [ID: 102903] (Niveau 2) → ProductId: 1945\n│   │   │   └── Composants du carburateur (Niveau 4)\n│   │   │       └── Carburettor Parts [ID: 102906] (Niveau 3) → ProductId: 1945\n│   │   ├── Carburettor System [ID: 102903] (Niveau 2) → ProductId: 1785\n│   │   │   ├── Composants du carburateur (Niveau 4)\n│   │   │   │   └── Carburettor Parts [ID: 102906] (Niveau 3) → ProductId: 1785\n│   │   │   └── Soupapes (Niveau 4)\n│   │   │       └── Valves [ID: 102909] (Niveau 3) → ProductId: 1785\n│   │   ├── Carburettor System [ID: 102903] (Niveau 2) → ProductId: 1959\n│   │   │   └── Composants du carburateur (Niveau 4)\n│   │   │       └── Carburettor Parts [ID: 102906] (Niveau 3) → ProductId: 1959\n│   │   ├── Carburettor System [ID: 102903] (Niveau 2) → ProductId: 1947\n│   │   │   └── Composants du carburateur (Niveau 4)\n│   │   │       └── Carburettor Parts [ID: 102906] (Niveau 3) → ProductId: 1947\n│   │   ├── Carburettor System [ID: 102903] (Niveau 2) → ProductId: 1981\n│   │   │   └── Composants du carburateur (Niveau 4)\n│   │   │       └── Carburettor Parts [ID: 102906] (Niveau 3) → ProductId: 1981\n│   │   ├── Carburettor System [ID: 102903] (Niveau 2) → ProductId: 797\n│   │   │   └── Interrupteur / relais (Niveau 4)\n│   │   │       └── Switch/ Relay [ID: 102911] (Niveau 3) → ProductId: 797\n│   │   ├── Carburettor System [ID: 102903] (Niveau 2) → ProductId: 1187\n│   │   │   └── Interrupteur / relais (Niveau 4)\n│   │   │       └── Switch/ Relay [ID: 102911] (Niveau 3) → ProductId: 1187\n│   │   ├── Carburettor System [ID: 102903] (Niveau 2) → ProductId: 1923\n│   │   │   └── Composants du carburateur (Niveau 4)\n│   │   │       └── Carburettor Parts [ID: 102906] (Niveau 3) → ProductId: 1923\n│   │   ├── Carburettor System [ID: 102903] (Niveau 2) → ProductId: 1991\n│   │   │   └── Composants du carburateur (Niveau 4)\n│   │   │       └── Carburettor Parts [ID: 102906] (Niveau 3) → ProductId: 1991\n│   │   ├── Carburettor System [ID: 102903] (Niveau 2) → ProductId: 1918\n│   │   │   └── Composants du carburateur (Niveau 4)\n│   │   │       └── Carburettor Parts [ID: 102906] (Niveau 3) → ProductId: 1918\n│   │   ├── Carburettor System [ID: 102903] (Niveau 2) → ProductId: 1755\n│   │   │   ├── Commande / Amortisseurs / Boîtiers (Niveau 4)\n│   │   │   │   └── Control Linkage/Damper/Chambers [ID: 102910] (Niveau 3) → ProductId: 1755\n│   │   │   └── Composants du carburateur (Niveau 4)\n│   │   │       └── Carburettor Parts [ID: 102906] (Niveau 3) → ProductId: 1755\n│   │   ├── Carburettor System [ID: 102903] (Niveau 2) → ProductId: 217\n│   │   │   └── Composants du carburateur (Niveau 4)\n│   │   │       └── Carburettor Parts [ID: 102906] (Niveau 3) → ProductId: 217\n│   │   ├── Carburettor System [ID: 102903] (Niveau 2) → ProductId: 31\n│   │   │   └── Soupapes (Niveau 4)\n│   │   │       └── Valves [ID: 102909] (Niveau 3) → ProductId: 31\n│   │   ├── Carburettor System [ID: 102903] (Niveau 2) → ProductId: 974\n│   │   │   └── Soupapes (Niveau 4)\n│   │   │       └── Valves [ID: 102909] (Niveau 3) → ProductId: 974\n│   │   ├── Carburettor System [ID: 102903] (Niveau 2) → ProductId: 1306\n│   │   │   └── Soupapes (Niveau 4)\n│   │   │       └── Valves [ID: 102909] (Niveau 3) → ProductId: 1306\n│   │   ├── Carburettor System [ID: 102903] (Niveau 2) → ProductId: 1987\n│   │   │   └── Composants du carburateur (Niveau 4)\n│   │   │       └── Carburettor Parts [ID: 102906] (Niveau 3) → ProductId: 1987\n│   │   ├── Carburettor System [ID: 102903] (Niveau 2) → ProductId: 1930\n│   │   │   └── Composants du carburateur (Niveau 4)\n│   │   │       └── Carburettor Parts [ID: 102906] (Niveau 3) → ProductId: 1930\n│   │   ├── Carburettor System [ID: 102903] (Niveau 2) → ProductId: 1936\n│   │   │   └── Composants du carburateur (Niveau 4)\n│   │   │       └── Carburettor Parts [ID: 102906] (Niveau 3) → ProductId: 1936\n│   │   ├── Carburettor System [ID: 102903] (Niveau 2) → ProductId: 1986\n│   │   │   └── Composants du carburateur (Niveau 4)\n│   │   │       └── Carburettor Parts [ID: 102906] (Niveau 3) → ProductId: 1986\n│   │   ├── Carburettor System [ID: 102903] (Niveau 2) → ProductId: 1925\n│   │   │   └── Composants du carburateur (Niveau 4)\n│   │   │       └── Carburettor Parts [ID: 102906] (Niveau 3) → ProductId: 1925\n│   │   ├── Carburettor System [ID: 102903] (Niveau 2) → ProductId: 1919\n│   │   │   └── Composants du carburateur (Niveau 4)\n│   │   │       └── Carburettor Parts [ID: 102906] (Niveau 3) → ProductId: 1919\n│   │   ├── Carburettor System [ID: 102903] (Niveau 2) → ProductId: 1944\n│   │   │   └── Composants du carburateur (Niveau 4)\n│   │   │       └── Carburettor Parts [ID: 102906] (Niveau 3) → ProductId: 1944\n│   │   ├── Carburettor System [ID: 102903] (Niveau 2) → ProductId: 1970\n│   │   │   └── Composants du carburateur (Niveau 4)\n│   │   │       └── Carburettor Parts [ID: 102906] (Niveau 3) → ProductId: 1970\n│   │   ├── Carburettor System [ID: 102903] (Niveau 2) → ProductId: 4736\n│   │   │   └── Commande / Amortisseurs / Boîtiers (Niveau 4)\n│   │   │       └── Control Linkage/Damper/Chambers [ID: 102910] (Niveau 3) → ProductId: 4736\n│   │   ├── Carburettor System [ID: 102903] (Niveau 2) → ProductId: 1963\n│   │   │   └── Composants du carburateur (Niveau 4)\n│   │   │       └── Carburettor Parts [ID: 102906] (Niveau 3) → ProductId: 1963\n│   │   ├── Carburettor System [ID: 102903] (Niveau 2) → ProductId: 1990\n│   │   │   └── Composants du carburateur (Niveau 4)\n│   │   │       └── Carburettor Parts [ID: 102906] (Niveau 3) → ProductId: 1990\n│   │   ├── Carburettor System [ID: 102903] (Niveau 2) → ProductId: 1966\n│   │   │   └── Composants du carburateur (Niveau 4)\n│   │   │       └── Carburettor Parts [ID: 102906] (Niveau 3) → ProductId: 1966\n│   │   ├── Carburettor System [ID: 102903] (Niveau 2) → ProductId: 1933\n│   │   │   └── Composants du carburateur (Niveau 4)\n│   │   │       └── Carburettor Parts [ID: 102906] (Niveau 3) → ProductId: 1933\n│   │   ├── Carburettor System [ID: 102903] (Niveau 2) → ProductId: 1988\n│   │   │   └── Composants du carburateur (Niveau 4)\n│   │   │       └── Carburettor Parts [ID: 102906] (Niveau 3) → ProductId: 1988\n│   │   ├── Carburettor System [ID: 102903] (Niveau 2) → ProductId: 1949\n│   │   │   └── Composants du carburateur (Niveau 4)\n│   │   │       └── Carburettor Parts [ID: 102906] (Niveau 3) → ProductId: 1949\n│   │   ├── Carburettor System [ID: 102903] (Niveau 2) → ProductId: 1965\n│   │   │   └── Composants du carburateur (Niveau 4)\n│   │   │       └── Carburettor Parts [ID: 102906] (Niveau 3) → ProductId: 1965\n│   │   ├── Carburettor System [ID: 102903] (Niveau 2) → ProductId: 60004\n│   │   │   └── Commande / Amortisseurs / Boîtiers (Niveau 4)\n│   │   │       └── Control Linkage/Damper/Chambers [ID: 102910] (Niveau 3) → ProductId: 60004\n│   │   ├── Carburettor System [ID: 102903] (Niveau 2) → ProductId: 1942\n│   │   │   └── Composants du carburateur (Niveau 4)\n│   │   │       └── Carburettor Parts [ID: 102906] (Niveau 3) → ProductId: 1942\n│   │   ├── Carburettor System [ID: 102903] (Niveau 2) → ProductId: 1983\n│   │   │   └── Composants du carburateur (Niveau 4)\n│   │   │       └── Carburettor Parts [ID: 102906] (Niveau 3) → ProductId: 1983\n│   │   └── Carburettor System [ID: 102903] (Niveau 2) → ProductId: 1935\n│   │       └── Composants du carburateur (Niveau 4)\n│   │           └── Carburettor Parts [ID: 102906] (Niveau 3) → ProductId: 1935\n│   └── Mélange air-carburant (Niveau 2)\n│       ├── Mixture Formation [ID: 102793] (Niveau 2) → ProductId: 158\n│       │   └── Papillon des gaz / tubulure / tuyau de dépression (Niveau 4)\n│       │       └── Throttle Valve/Throttle Body/Vacuum Pipe [ID: 102796] (Niveau 3) → ProductId: 158\n│       └── Mixture Formation [ID: 102793] (Niveau 2) → ProductId: 9571\n│           └── Kit de réparation/Kit complet (Niveau 4)\n│               └── Repair Kit [ID: 102807] (Niveau 3) → ProductId: 9571\n\n├── Moteur [ID: 100002] (Niveau 1)\n│   ├── Alimentation en air (Niveau 2)\n│   │   ├── Air Supply [ID: 100383] (Niveau 2) → ProductId: 618\n│   │   │   └── Câble d'accélérateur/tringlerie (Niveau 4)\n│   │   │       └── Accelerator Cable/Linkage [ID: 100385] (Niveau 3) → ProductId: 618\n│   │   ├── Air Supply [ID: 100383] (Niveau 2) → ProductId: 158\n│   │   │   └── Papillon des gaz /-capteur (Niveau 4)\n│   │   │       └── Throttle Valve/Sensor [ID: 100704] (Niveau 3) → ProductId: 158\n│   │   │           └── Corps papillon (Niveau 6)\n│   │   │               └── Throttle Body [ID: 102339] (Niveau 4) → ProductId: 158\n│   │   └── Air Supply [ID: 100383] (Niveau 2) → ProductId: 5980\n│   │       └── Câble d'accélérateur/tringlerie (Niveau 4)\n│   │           └── Accelerator Cable/Linkage [ID: 100385] (Niveau 3) → ProductId: 5980\n│   ├── Circuit électrique du moteur (Niveau 2)\n│   │   └── Engine Electrics [ID: 100754] (Niveau 2) → ProductId: 935\n│   └── Culasse / pieces de montage (Niveau 2)\n│       └── Cylinder Head/Attachment Parts [ID: 100373] (Niveau 2) → ProductId: 458\n│           └── Pompe à vide (Niveau 4)\n│               └── Vacuum Pump [ID: 102450] (Niveau 3) → ProductId: 458\n\n└── Système électrique [ID: 100010] (Niveau 1)\n    ├── Appareils de commande (Niveau 2)\n    │   └── Control Units [ID: 100727] (Niveau 2) → ProductId: 935\n    ├── Capteurs (Niveau 2)\n    │   └── Sensors [ID: 102747] (Niveau 2) → ProductId: 1926\n    ├── Kit/pièces de câble (Niveau 2)\n    │   └── Cable Set/individual parts [ID: 103066] (Niveau 2) → ProductId: 1098\n    └── Relais (Niveau 2)\n        ├── Relay [ID: 100785] (Niveau 2) → ProductId: 797\n        └── Relay [ID: 100785] (Niveau 2) → ProductId: 1187",
  "arborescencePaths": [
    {
      "path": [
        "Alimentation carburant",
        "Additifs",
        "Additive"
      ],
      "categoryIds": [
        100214,
        null,
        706479
      ],
      "finalCategoryId": 706479,
      "productId": 9797
    },
    {
      "path": [
        "Alimentation carburant",
        "Pompe / accessoires",
        "Pump/Accessories"
      ],
      "categoryIds": [
        100214,
        null,
        100251
      ],
      "finalCategoryId": 100251,
      "productId": 458
    },
    {
      "path": [
        "Alimentation carburant",
        "Soupapes",
        "Valves"
      ],
      "categoryIds": [
        100214,
        null,
        100252
      ],
      "finalCategoryId": 100252,
      "productId": 974
    },
    {
      "path": [
        "Carburation",
        "Carburateurs",
        "Carburettor System"
      ],
      "categoryIds": [
        100254,
        null,
        102903
      ],
      "finalCategoryId": 102903,
      "productId": 1928
    },
    {
      "path": [
        "Carburation",
        "Carburateurs",
        "Carburettor System"
      ],
      "categoryIds": [
        100254,
        null,
        102903
      ],
      "finalCategoryId": 102903,
      "productId": 1694
    },
    {
      "path": [
        "Carburation",
        "Carburateurs",
        "Carburettor System"
      ],
      "categoryIds": [
        100254,
        null,
        102903
      ],
      "finalCategoryId": 102903,
      "productId": 1955
    },
    {
      "path": [
        "Carburation",
        "Carburateurs",
        "Carburettor System"
      ],
      "categoryIds": [
        100254,
        null,
        102903
      ],
      "finalCategoryId": 102903,
      "productId": 1151
    },
    {
      "path": [
        "Carburation",
        "Carburateurs",
        "Carburettor System"
      ],
      "categoryIds": [
        100254,
        null,
        102903
      ],
      "finalCategoryId": 102903,
      "productId": 1152
    },
    {
      "path": [
        "Carburation",
        "Carburateurs",
        "Carburettor System"
      ],
      "categoryIds": [
        100254,
        null,
        102903
      ],
      "finalCategoryId": 102903,
      "productId": 935
    },
    {
      "path": [
        "Carburation",
        "Carburateurs",
        "Carburettor System"
      ],
      "categoryIds": [
        100254,
        null,
        102903
      ],
      "finalCategoryId": 102903,
      "productId": 1976
    },
    {
      "path": [
        "Carburation",
        "Carburateurs",
        "Carburettor System"
      ],
      "categoryIds": [
        100254,
        null,
        102903
      ],
      "finalCategoryId": 102903,
      "productId": 1927
    },
    {
      "path": [
        "Carburation",
        "Carburateurs",
        "Carburettor System"
      ],
      "categoryIds": [
        100254,
        null,
        102903
      ],
      "finalCategoryId": 102903,
      "productId": 1922
    },
    {
      "path": [
        "Carburation",
        "Carburateurs",
        "Carburettor System"
      ],
      "categoryIds": [
        100254,
        null,
        102903
      ],
      "finalCategoryId": 102903,
      "productId": 1982
    },
    {
      "path": [
        "Carburation",
        "Carburateurs",
        "Carburettor System"
      ],
      "categoryIds": [
        100254,
        null,
        102903
      ],
      "finalCategoryId": 102903,
      "productId": 1964
    },
    {
      "path": [
        "Carburation",
        "Carburateurs",
        "Carburettor System"
      ],
      "categoryIds": [
        100254,
        null,
        102903
      ],
      "finalCategoryId": 102903,
      "productId": 1979
    },
    {
      "path": [
        "Carburation",
        "Carburateurs",
        "Carburettor System"
      ],
      "categoryIds": [
        100254,
        null,
        102903
      ],
      "finalCategoryId": 102903,
      "productId": 976
    },
    {
      "path": [
        "Carburation",
        "Carburateurs",
        "Carburettor System"
      ],
      "categoryIds": [
        100254,
        null,
        102903
      ],
      "finalCategoryId": 102903,
      "productId": 1972
    },
    {
      "path": [
        "Carburation",
        "Carburateurs",
        "Carburettor System"
      ],
      "categoryIds": [
        100254,
        null,
        102903
      ],
      "finalCategoryId": 102903,
      "productId": 1940
    },
    {
      "path": [
        "Carburation",
        "Carburateurs",
        "Carburettor System"
      ],
      "categoryIds": [
        100254,
        null,
        102903
      ],
      "finalCategoryId": 102903,
      "productId": 1980
    },
    {
      "path": [
        "Carburation",
        "Carburateurs",
        "Carburettor System"
      ],
      "categoryIds": [
        100254,
        null,
        102903
      ],
      "finalCategoryId": 102903,
      "productId": 1937
    },
    {
      "path": [
        "Carburation",
        "Carburateurs",
        "Carburettor System"
      ],
      "categoryIds": [
        100254,
        null,
        102903
      ],
      "finalCategoryId": 102903,
      "productId": 1969
    },
    {
      "path": [
        "Carburation",
        "Carburateurs",
        "Carburettor System"
      ],
      "categoryIds": [
        100254,
        null,
        102903
      ],
      "finalCategoryId": 102903,
      "productId": 618
    },
    {
      "path": [
        "Carburation",
        "Carburateurs",
        "Carburettor System"
      ],
      "categoryIds": [
        100254,
        null,
        102903
      ],
      "finalCategoryId": 102903,
      "productId": 1951
    },
    {
      "path": [
        "Carburation",
        "Carburateurs",
        "Carburettor System"
      ],
      "categoryIds": [
        100254,
        null,
        102903
      ],
      "finalCategoryId": 102903,
      "productId": 1917
    },
    {
      "path": [
        "Carburation",
        "Carburateurs",
        "Carburettor System"
      ],
      "categoryIds": [
        100254,
        null,
        102903
      ],
      "finalCategoryId": 102903,
      "productId": 1926
    },
    {
      "path": [
        "Carburation",
        "Carburateurs",
        "Carburettor System"
      ],
      "categoryIds": [
        100254,
        null,
        102903
      ],
      "finalCategoryId": 102903,
      "productId": 981
    },
    {
      "path": [
        "Carburation",
        "Carburateurs",
        "Carburettor System"
      ],
      "categoryIds": [
        100254,
        null,
        102903
      ],
      "finalCategoryId": 102903,
      "productId": 1920
    },
    {
      "path": [
        "Carburation",
        "Carburateurs",
        "Carburettor System"
      ],
      "categoryIds": [
        100254,
        null,
        102903
      ],
      "finalCategoryId": 102903,
      "productId": 1956
    },
    {
      "path": [
        "Carburation",
        "Carburateurs",
        "Carburettor System"
      ],
      "categoryIds": [
        100254,
        null,
        102903
      ],
      "finalCategoryId": 102903,
      "productId": 1984
    },
    {
      "path": [
        "Carburation",
        "Carburateurs",
        "Carburettor System"
      ],
      "categoryIds": [
        100254,
        null,
        102903
      ],
      "finalCategoryId": 102903,
      "productId": 1977
    },
    {
      "path": [
        "Carburation",
        "Carburateurs",
        "Carburettor System"
      ],
      "categoryIds": [
        100254,
        null,
        102903
      ],
      "finalCategoryId": 102903,
      "productId": 1938
    },
    {
      "path": [
        "Carburation",
        "Carburateurs",
        "Carburettor System"
      ],
      "categoryIds": [
        100254,
        null,
        102903
      ],
      "finalCategoryId": 102903,
      "productId": 1952
    },
    {
      "path": [
        "Carburation",
        "Carburateurs",
        "Carburettor System"
      ],
      "categoryIds": [
        100254,
        null,
        102903
      ],
      "finalCategoryId": 102903,
      "productId": 1971
    },
    {
      "path": [
        "Carburation",
        "Carburateurs",
        "Carburettor System"
      ],
      "categoryIds": [
        100254,
        null,
        102903
      ],
      "finalCategoryId": 102903,
      "productId": 1921
    },
    {
      "path": [
        "Carburation",
        "Carburateurs",
        "Carburettor System"
      ],
      "categoryIds": [
        100254,
        null,
        102903
      ],
      "finalCategoryId": 102903,
      "productId": 1960
    },
    {
      "path": [
        "Carburation",
        "Carburateurs",
        "Carburettor System"
      ],
      "categoryIds": [
        100254,
        null,
        102903
      ],
      "finalCategoryId": 102903,
      "productId": 1958
    },
    {
      "path": [
        "Carburation",
        "Carburateurs",
        "Carburettor System"
      ],
      "categoryIds": [
        100254,
        null,
        102903
      ],
      "finalCategoryId": 102903,
      "productId": 1953
    },
    {
      "path": [
        "Carburation",
        "Carburateurs",
        "Carburettor System"
      ],
      "categoryIds": [
        100254,
        null,
        102903
      ],
      "finalCategoryId": 102903,
      "productId": 1957
    },
    {
      "path": [
        "Carburation",
        "Carburateurs",
        "Carburettor System"
      ],
      "categoryIds": [
        100254,
        null,
        102903
      ],
      "finalCategoryId": 102903,
      "productId": 371
    },
    {
      "path": [
        "Carburation",
        "Carburateurs",
        "Carburettor System"
      ],
      "categoryIds": [
        100254,
        null,
        102903
      ],
      "finalCategoryId": 102903,
      "productId": 1992
    },
    {
      "path": [
        "Carburation",
        "Carburateurs",
        "Carburettor System"
      ],
      "categoryIds": [
        100254,
        null,
        102903
      ],
      "finalCategoryId": 102903,
      "productId": 1081
    },
    {
      "path": [
        "Carburation",
        "Carburateurs",
        "Carburettor System"
      ],
      "categoryIds": [
        100254,
        null,
        102903
      ],
      "finalCategoryId": 102903,
      "productId": 1967
    },
    {
      "path": [
        "Carburation",
        "Carburateurs",
        "Carburettor System"
      ],
      "categoryIds": [
        100254,
        null,
        102903
      ],
      "finalCategoryId": 102903,
      "productId": 5980
    },
    {
      "path": [
        "Carburation",
        "Carburateurs",
        "Carburettor System"
      ],
      "categoryIds": [
        100254,
        null,
        102903
      ],
      "finalCategoryId": 102903,
      "productId": 1941
    },
    {
      "path": [
        "Carburation",
        "Carburateurs",
        "Carburettor System"
      ],
      "categoryIds": [
        100254,
        null,
        102903
      ],
      "finalCategoryId": 102903,
      "productId": 1946
    },
    {
      "path": [
        "Carburation",
        "Carburateurs",
        "Carburettor System"
      ],
      "categoryIds": [
        100254,
        null,
        102903
      ],
      "finalCategoryId": 102903,
      "productId": 1929
    },
    {
      "path": [
        "Carburation",
        "Carburateurs",
        "Carburettor System"
      ],
      "categoryIds": [
        100254,
        null,
        102903
      ],
      "finalCategoryId": 102903,
      "productId": 2136
    },
    {
      "path": [
        "Carburation",
        "Carburateurs",
        "Carburettor System"
      ],
      "categoryIds": [
        100254,
        null,
        102903
      ],
      "finalCategoryId": 102903,
      "productId": 2134
    },
    {
      "path": [
        "Carburation",
        "Carburateurs",
        "Carburettor System"
      ],
      "categoryIds": [
        100254,
        null,
        102903
      ],
      "finalCategoryId": 102903,
      "productId": 1104
    },
    {
      "path": [
        "Carburation",
        "Carburateurs",
        "Carburettor System"
      ],
      "categoryIds": [
        100254,
        null,
        102903
      ],
      "finalCategoryId": 102903,
      "productId": 1098
    },
    {
      "path": [
        "Carburation",
        "Carburateurs",
        "Carburettor System"
      ],
      "categoryIds": [
        100254,
        null,
        102903
      ],
      "finalCategoryId": 102903,
      "productId": 1089
    },
    {
      "path": [
        "Carburation",
        "Carburateurs",
        "Carburettor System"
      ],
      "categoryIds": [
        100254,
        null,
        102903
      ],
      "finalCategoryId": 102903,
      "productId": 205
    },
    {
      "path": [
        "Carburation",
        "Carburateurs",
        "Carburettor System"
      ],
      "categoryIds": [
        100254,
        null,
        102903
      ],
      "finalCategoryId": 102903,
      "productId": 2792
    },
    {
      "path": [
        "Carburation",
        "Carburateurs",
        "Carburettor System"
      ],
      "categoryIds": [
        100254,
        null,
        102903
      ],
      "finalCategoryId": 102903,
      "productId": 1090
    },
    {
      "path": [
        "Carburation",
        "Carburateurs",
        "Carburettor System"
      ],
      "categoryIds": [
        100254,
        null,
        102903
      ],
      "finalCategoryId": 102903,
      "productId": 1968
    },
    {
      "path": [
        "Carburation",
        "Carburateurs",
        "Carburettor System"
      ],
      "categoryIds": [
        100254,
        null,
        102903
      ],
      "finalCategoryId": 102903,
      "productId": 1978
    },
    {
      "path": [
        "Carburation",
        "Carburateurs",
        "Carburettor System"
      ],
      "categoryIds": [
        100254,
        null,
        102903
      ],
      "finalCategoryId": 102903,
      "productId": 60054
    },
    {
      "path": [
        "Carburation",
        "Carburateurs",
        "Carburettor System"
      ],
      "categoryIds": [
        100254,
        null,
        102903
      ],
      "finalCategoryId": 102903,
      "productId": 60056
    },
    {
      "path": [
        "Carburation",
        "Carburateurs",
        "Carburettor System"
      ],
      "categoryIds": [
        100254,
        null,
        102903
      ],
      "finalCategoryId": 102903,
      "productId": 1916
    },
    {
      "path": [
        "Carburation",
        "Carburateurs",
        "Carburettor System"
      ],
      "categoryIds": [
        100254,
        null,
        102903
      ],
      "finalCategoryId": 102903,
      "productId": 1954
    },
    {
      "path": [
        "Carburation",
        "Carburateurs",
        "Carburettor System"
      ],
      "categoryIds": [
        100254,
        null,
        102903
      ],
      "finalCategoryId": 102903,
      "productId": 1924
    },
    {
      "path": [
        "Carburation",
        "Carburateurs",
        "Carburettor System"
      ],
      "categoryIds": [
        100254,
        null,
        102903
      ],
      "finalCategoryId": 102903,
      "productId": 1975
    },
    {
      "path": [
        "Carburation",
        "Carburateurs",
        "Carburettor System"
      ],
      "categoryIds": [
        100254,
        null,
        102903
      ],
      "finalCategoryId": 102903,
      "productId": 1939
    },
    {
      "path": [
        "Carburation",
        "Carburateurs",
        "Carburettor System"
      ],
      "categoryIds": [
        100254,
        null,
        102903
      ],
      "finalCategoryId": 102903,
      "productId": 1961
    },
    {
      "path": [
        "Carburation",
        "Carburateurs",
        "Carburettor System"
      ],
      "categoryIds": [
        100254,
        null,
        102903
      ],
      "finalCategoryId": 102903,
      "productId": 1931
    },
    {
      "path": [
        "Carburation",
        "Carburateurs",
        "Carburettor System"
      ],
      "categoryIds": [
        100254,
        null,
        102903
      ],
      "finalCategoryId": 102903,
      "productId": 1943
    },
    {
      "path": [
        "Carburation",
        "Carburateurs",
        "Carburettor System"
      ],
      "categoryIds": [
        100254,
        null,
        102903
      ],
      "finalCategoryId": 102903,
      "productId": 1989
    },
    {
      "path": [
        "Carburation",
        "Carburateurs",
        "Carburettor System"
      ],
      "categoryIds": [
        100254,
        null,
        102903
      ],
      "finalCategoryId": 102903,
      "productId": 60835
    },
    {
      "path": [
        "Carburation",
        "Carburateurs",
        "Carburettor System"
      ],
      "categoryIds": [
        100254,
        null,
        102903
      ],
      "finalCategoryId": 102903,
      "productId": 1962
    },
    {
      "path": [
        "Carburation",
        "Carburateurs",
        "Carburettor System"
      ],
      "categoryIds": [
        100254,
        null,
        102903
      ],
      "finalCategoryId": 102903,
      "productId": 1945
    },
    {
      "path": [
        "Carburation",
        "Carburateurs",
        "Carburettor System"
      ],
      "categoryIds": [
        100254,
        null,
        102903
      ],
      "finalCategoryId": 102903,
      "productId": 1785
    },
    {
      "path": [
        "Carburation",
        "Carburateurs",
        "Carburettor System"
      ],
      "categoryIds": [
        100254,
        null,
        102903
      ],
      "finalCategoryId": 102903,
      "productId": 1959
    },
    {
      "path": [
        "Carburation",
        "Carburateurs",
        "Carburettor System"
      ],
      "categoryIds": [
        100254,
        null,
        102903
      ],
      "finalCategoryId": 102903,
      "productId": 1947
    },
    {
      "path": [
        "Carburation",
        "Carburateurs",
        "Carburettor System"
      ],
      "categoryIds": [
        100254,
        null,
        102903
      ],
      "finalCategoryId": 102903,
      "productId": 1981
    },
    {
      "path": [
        "Carburation",
        "Carburateurs",
        "Carburettor System"
      ],
      "categoryIds": [
        100254,
        null,
        102903
      ],
      "finalCategoryId": 102903,
      "productId": 797
    },
    {
      "path": [
        "Carburation",
        "Carburateurs",
        "Carburettor System"
      ],
      "categoryIds": [
        100254,
        null,
        102903
      ],
      "finalCategoryId": 102903,
      "productId": 1187
    },
    {
      "path": [
        "Carburation",
        "Carburateurs",
        "Carburettor System"
      ],
      "categoryIds": [
        100254,
        null,
        102903
      ],
      "finalCategoryId": 102903,
      "productId": 1923
    },
    {
      "path": [
        "Carburation",
        "Carburateurs",
        "Carburettor System"
      ],
      "categoryIds": [
        100254,
        null,
        102903
      ],
      "finalCategoryId": 102903,
      "productId": 1991
    },
    {
      "path": [
        "Carburation",
        "Carburateurs",
        "Carburettor System"
      ],
      "categoryIds": [
        100254,
        null,
        102903
      ],
      "finalCategoryId": 102903,
      "productId": 1918
    },
    {
      "path": [
        "Carburation",
        "Carburateurs",
        "Carburettor System"
      ],
      "categoryIds": [
        100254,
        null,
        102903
      ],
      "finalCategoryId": 102903,
      "productId": 1755
    },
    {
      "path": [
        "Carburation",
        "Carburateurs",
        "Carburettor System"
      ],
      "categoryIds": [
        100254,
        null,
        102903
      ],
      "finalCategoryId": 102903,
      "productId": 217
    },
    {
      "path": [
        "Carburation",
        "Carburateurs",
        "Carburettor System"
      ],
      "categoryIds": [
        100254,
        null,
        102903
      ],
      "finalCategoryId": 102903,
      "productId": 31
    },
    {
      "path": [
        "Carburation",
        "Carburateurs",
        "Carburettor System"
      ],
      "categoryIds": [
        100254,
        null,
        102903
      ],
      "finalCategoryId": 102903,
      "productId": 974
    },
    {
      "path": [
        "Carburation",
        "Carburateurs",
        "Carburettor System"
      ],
      "categoryIds": [
        100254,
        null,
        102903
      ],
      "finalCategoryId": 102903,
      "productId": 1306
    },
    {
      "path": [
        "Carburation",
        "Carburateurs",
        "Carburettor System"
      ],
      "categoryIds": [
        100254,
        null,
        102903
      ],
      "finalCategoryId": 102903,
      "productId": 1987
    },
    {
      "path": [
        "Carburation",
        "Carburateurs",
        "Carburettor System"
      ],
      "categoryIds": [
        100254,
        null,
        102903
      ],
      "finalCategoryId": 102903,
      "productId": 1930
    },
    {
      "path": [
        "Carburation",
        "Carburateurs",
        "Carburettor System"
      ],
      "categoryIds": [
        100254,
        null,
        102903
      ],
      "finalCategoryId": 102903,
      "productId": 1936
    },
    {
      "path": [
        "Carburation",
        "Carburateurs",
        "Carburettor System"
      ],
      "categoryIds": [
        100254,
        null,
        102903
      ],
      "finalCategoryId": 102903,
      "productId": 1986
    },
    {
      "path": [
        "Carburation",
        "Carburateurs",
        "Carburettor System"
      ],
      "categoryIds": [
        100254,
        null,
        102903
      ],
      "finalCategoryId": 102903,
      "productId": 1925
    },
    {
      "path": [
        "Carburation",
        "Carburateurs",
        "Carburettor System"
      ],
      "categoryIds": [
        100254,
        null,
        102903
      ],
      "finalCategoryId": 102903,
      "productId": 1919
    },
    {
      "path": [
        "Carburation",
        "Carburateurs",
        "Carburettor System"
      ],
      "categoryIds": [
        100254,
        null,
        102903
      ],
      "finalCategoryId": 102903,
      "productId": 1944
    },
    {
      "path": [
        "Carburation",
        "Carburateurs",
        "Carburettor System"
      ],
      "categoryIds": [
        100254,
        null,
        102903
      ],
      "finalCategoryId": 102903,
      "productId": 1970
    },
    {
      "path": [
        "Carburation",
        "Carburateurs",
        "Carburettor System"
      ],
      "categoryIds": [
        100254,
        null,
        102903
      ],
      "finalCategoryId": 102903,
      "productId": 4736
    },
    {
      "path": [
        "Carburation",
        "Carburateurs",
        "Carburettor System"
      ],
      "categoryIds": [
        100254,
        null,
        102903
      ],
      "finalCategoryId": 102903,
      "productId": 1963
    },
    {
      "path": [
        "Carburation",
        "Carburateurs",
        "Carburettor System"
      ],
      "categoryIds": [
        100254,
        null,
        102903
      ],
      "finalCategoryId": 102903,
      "productId": 1990
    },
    {
      "path": [
        "Carburation",
        "Carburateurs",
        "Carburettor System"
      ],
      "categoryIds": [
        100254,
        null,
        102903
      ],
      "finalCategoryId": 102903,
      "productId": 1966
    },
    {
      "path": [
        "Carburation",
        "Carburateurs",
        "Carburettor System"
      ],
      "categoryIds": [
        100254,
        null,
        102903
      ],
      "finalCategoryId": 102903,
      "productId": 1933
    },
    {
      "path": [
        "Carburation",
        "Carburateurs",
        "Carburettor System"
      ],
      "categoryIds": [
        100254,
        null,
        102903
      ],
      "finalCategoryId": 102903,
      "productId": 1988
    },
    {
      "path": [
        "Carburation",
        "Carburateurs",
        "Carburettor System"
      ],
      "categoryIds": [
        100254,
        null,
        102903
      ],
      "finalCategoryId": 102903,
      "productId": 1949
    },
    {
      "path": [
        "Carburation",
        "Carburateurs",
        "Carburettor System"
      ],
      "categoryIds": [
        100254,
        null,
        102903
      ],
      "finalCategoryId": 102903,
      "productId": 1965
    },
    {
      "path": [
        "Carburation",
        "Carburateurs",
        "Carburettor System"
      ],
      "categoryIds": [
        100254,
        null,
        102903
      ],
      "finalCategoryId": 102903,
      "productId": 60004
    },
    {
      "path": [
        "Carburation",
        "Carburateurs",
        "Carburettor System"
      ],
      "categoryIds": [
        100254,
        null,
        102903
      ],
      "finalCategoryId": 102903,
      "productId": 1942
    },
    {
      "path": [
        "Carburation",
        "Carburateurs",
        "Carburettor System"
      ],
      "categoryIds": [
        100254,
        null,
        102903
      ],
      "finalCategoryId": 102903,
      "productId": 1983
    },
    {
      "path": [
        "Carburation",
        "Carburateurs",
        "Carburettor System"
      ],
      "categoryIds": [
        100254,
        null,
        102903
      ],
      "finalCategoryId": 102903,
      "productId": 1935
    },
    {
      "path": [
        "Carburation",
        "Mélange air-carburant",
        "Mixture Formation"
      ],
      "categoryIds": [
        100254,
        null,
        102793
      ],
      "finalCategoryId": 102793,
      "productId": 158
    },
    {
      "path": [
        "Carburation",
        "Mélange air-carburant",
        "Mixture Formation"
      ],
      "categoryIds": [
        100254,
        null,
        102793
      ],
      "finalCategoryId": 102793,
      "productId": 9571
    },
    {
      "path": [
        "Moteur",
        "Alimentation en air",
        "Air Supply"
      ],
      "categoryIds": [
        100002,
        null,
        100383
      ],
      "finalCategoryId": 100383,
      "productId": 618
    },
    {
      "path": [
        "Moteur",
        "Alimentation en air",
        "Air Supply"
      ],
      "categoryIds": [
        100002,
        null,
        100383
      ],
      "finalCategoryId": 100383,
      "productId": 158
    },
    {
      "path": [
        "Moteur",
        "Alimentation en air",
        "Air Supply"
      ],
      "categoryIds": [
        100002,
        null,
        100383
      ],
      "finalCategoryId": 100383,
      "productId": 5980
    },
    {
      "path": [
        "Moteur",
        "Circuit électrique du moteur",
        "Engine Electrics"
      ],
      "categoryIds": [
        100002,
        null,
        100754
      ],
      "finalCategoryId": 100754,
      "productId": 935
    },
    {
      "path": [
        "Moteur",
        "Culasse / pieces de montage",
        "Cylinder Head/Attachment Parts"
      ],
      "categoryIds": [
        100002,
        null,
        100373
      ],
      "finalCategoryId": 100373,
      "productId": 458
    },
    {
      "path": [
        "Système électrique",
        "Appareils de commande",
        "Control Units"
      ],
      "categoryIds": [
        100010,
        null,
        100727
      ],
      "finalCategoryId": 100727,
      "productId": 935
    },
    {
      "path": [
        "Système électrique",
        "Capteurs",
        "Sensors"
      ],
      "categoryIds": [
        100010,
        null,
        102747
      ],
      "finalCategoryId": 102747,
      "productId": 1926
    },
    {
      "path": [
        "Système électrique",
        "Kit/pièces de câble",
        "Cable Set/individual parts"
      ],
      "categoryIds": [
        100010,
        null,
        103066
      ],
      "finalCategoryId": 103066,
      "productId": 1098
    },
    {
      "path": [
        "Système électrique",
        "Relais",
        "Relay"
      ],
      "categoryIds": [
        100010,
        null,
        100785
      ],
      "finalCategoryId": 100785,
      "productId": 797
    },
    {
      "path": [
        "Système électrique",
        "Relais",
        "Relay"
      ],
      "categoryIds": [
        100010,
        null,
        100785
      ],
      "finalCategoryId": 100785,
      "productId": 1187
    }
  ],
  "productIdsInArbo": [
    31,
    158,
    205,
    217,
    371,
    458,
    618,
    797,
    935,
    974,
    976,
    981,
    1081,
    1089,
    1090,
    1098,
    1104,
    1151,
    1152,
    1187,
    1306,
    1694,
    1755,
    1785,
    1916,
    1917,
    1918,
    1919,
    1920,
    1921,
    1922,
    1923,
    1924,
    1925,
    1926,
    1927,
    1928,
    1929,
    1930,
    1931,
    1933,
    1935,
    1936,
    1937,
    1938,
    1939,
    1940,
    1941,
    1942,
    1943,
    1944,
    1945,
    1946,
    1947,
    1949,
    1951,
    1952,
    1953,
    1954,
    1955,
    1956,
    1957,
    1958,
    1959,
    1960,
    1961,
    1962,
    1963,
    1964,
    1965,
    1966,
    1967,
    1968,
    1969,
    1970,
    1971,
    1972,
    1975,
    1976,
    1977,
    1978,
    1979,
    1980,
    1981,
    1982,
    1983,
    1984,
    1986,
    1987,
    1988,
    1989,
    1990,
    1991,
    1992,
    2134,
    2136,
    2792,
    4736,
    5980,
    9571,
    9797,
    60004,
    60054,
    60056,
    60835
  ],
  "matchedProductIds": [
    981
  ]
}