{
  "productName": "Charnière de porte",
  "searchText": "Charnière de porte",
  "found": true,
  "hasMatch": true,
  "timestamp": "2025-12-02T20:19:12.907Z",
  "productId": 1568,
  "arborescence": {
    "Carrosserie": {
      "categoryId": 100001,
      "categoryName": "Carrosserie",
      "level": 1,
      "children": {
        "Arrière de la voiture": {
          "categoryId": null,
          "categoryName": "Arrière de la voiture",
          "level": 2,
          "children": {
            "Charnière de porte": {
              "categoryId": 101705,
              "categoryName": "Vehicle Rear",
              "level": 2,
              "children": {
                "Hayon/composants": {
                  "categoryId": null,
                  "categoryName": "Hayon/composants",
                  "level": 4,
                  "children": {
                    "Charnière de porte": {
                      "categoryId": 101781,
                      "categoryName": "Back Door/Parts",
                      "level": 3,
                      "children": [],
                      "productId": 1568
                    }
                  }
                }
              },
              "productId": 1568
            }
          }
        },
        "Habitacle": {
          "categoryId": null,
          "categoryName": "Habitacle",
          "level": 2,
          "children": {
            "Charnière de porte": {
              "categoryId": 101690,
              "categoryName": "Passenger Cabin",
              "level": 2,
              "children": {
                "Portière avant/composants": {
                  "categoryId": null,
                  "categoryName": "Portière avant/composants",
                  "level": 4,
                  "children": {
                    "Charnière de porte": {
                      "categoryId": 101694,
                      "categoryName": "Doors/Parts",
                      "level": 3,
                      "children": [],
                      "productId": 1568
                    }
                  }
                }
              },
              "productId": 1568
            }
          }
        },
        "Trappes/capots/portes/toit coul./toit panoram./toit pliant": {
          "categoryId": null,
          "categoryName": "Trappes/capots/portes/toit coul./toit panoram./toit pliant",
          "level": 2,
          "children": {
            "Charnière de porte": {
              "categoryId": 100746,
              "categoryName": "Hatches/Bonnets/Doors/Sunroof/Panoramic Roof",
              "level": 2,
              "children": {
                "Portière avant/composants": {
                  "categoryId": null,
                  "categoryName": "Portière avant/composants",
                  "level": 4,
                  "children": {
                    "Charnière de porte": {
                      "categoryId": 100189,
                      "categoryName": "Doors/Parts",
                      "level": 3,
                      "children": [],
                      "productId": 1568
                    }
                  }
                }
              },
              "productId": 1568
            }
          }
        }
      }
    }
  },
  "arborescenceText": "└── Carrosserie [ID: 100001] (Niveau 1)\n    ├── Arrière de la voiture (Niveau 2)\n    │   └── Vehicle Rear [ID: 101705] (Niveau 2) → ProductId: 1568\n    │       └── Hayon/composants (Niveau 4)\n    │           └── Back Door/Parts [ID: 101781] (Niveau 3) → ProductId: 1568\n    ├── Habitacle (Niveau 2)\n    │   └── Passenger Cabin [ID: 101690] (Niveau 2) → ProductId: 1568\n    │       └── Portière avant/composants (Niveau 4)\n    │           └── Doors/Parts [ID: 101694] (Niveau 3) → ProductId: 1568\n    └── Trappes/capots/portes/toit coul./toit panoram./toit pliant (Niveau 2)\n        └── Hatches/Bonnets/Doors/Sunroof/Panoramic Roof [ID: 100746] (Niveau 2) → ProductId: 1568\n            └── Portière avant/composants (Niveau 4)\n                └── Doors/Parts [ID: 100189] (Niveau 3) → ProductId: 1568",
  "arborescencePaths": [
    {
      "path": [
        "Carrosserie",
        "Arrière de la voiture",
        "Vehicle Rear"
      ],
      "categoryIds": [
        100001,
        null,
        101705
      ],
      "finalCategoryId": 101705,
      "productId": 1568
    },
    {
      "path": [
        "Carrosserie",
        "Habitacle",
        "Passenger Cabin"
      ],
      "categoryIds": [
        100001,
        null,
        101690
      ],
      "finalCategoryId": 101690,
      "productId": 1568
    },
    {
      "path": [
        "Carrosserie",
        "Trappes/capots/portes/toit coul./toit panoram./toit pliant",
        "Hatches/Bonnets/Doors/Sunroof/Panoramic Roof"
      ],
      "categoryIds": [
        100001,
        null,
        100746
      ],
      "finalCategoryId": 100746,
      "productId": 1568
    }
  ],
  "productIdsInArbo": [
    1568
  ],
  "matchedProductIds": [
    1568
  ]
}