{
  "productName": "Circlip",
  "searchText": "Circlip",
  "found": true,
  "hasMatch": false,
  "timestamp": "2025-12-02T20:19:54.680Z",
  "productId": 1656,
  "arborescence": {
    "Boîte de vitesses": {
      "categoryId": 100238,
      "categoryName": "Boîte de vitesses",
      "level": 1,
      "children": {
        "Boîte de vitesses manuelle": {
          "categoryId": null,
          "categoryName": "Boîte de vitesses manuelle",
          "level": 2,
          "children": {
            "Circlip, synchroniseur": {
              "categoryId": 100239,
              "categoryName": "Manual Transmission",
              "level": 2,
              "children": {
                "Carter/composants": {
                  "categoryId": null,
                  "categoryName": "Carter/composants",
                  "level": 4,
                  "children": {
                    "Circlip, synchroniseur": {
                      "categoryId": 100774,
                      "categoryName": "Transmission Housing/Parts",
                      "level": 3,
                      "children": [],
                      "productId": 4139
                    }
                  }
                }
              },
              "productId": 4139
            }
          }
        },
        "Transmission à double embrayage": {
          "categoryId": null,
          "categoryName": "Transmission à double embrayage",
          "level": 2,
          "children": {
            "Circlip, corps de synchron. (boîte vitesses double embray.)": {
              "categoryId": 706835,
              "categoryName": "Dual-Clutch Transmission",
              "level": 2,
              "children": {
                "Carter/composants": {
                  "categoryId": null,
                  "categoryName": "Carter/composants",
                  "level": 4,
                  "children": {
                    "Circlip, corps de synchron. (boîte vitesses double embray.)": {
                      "categoryId": 706846,
                      "categoryName": "Transmission Housing/Parts",
                      "level": 3,
                      "children": [],
                      "productId": 61240
                    }
                  }
                }
              },
              "productId": 61240
            }
          }
        }
      }
    },
    "Dispositif de freinage": {
      "categoryId": 100006,
      "categoryName": "Dispositif de freinage",
      "level": 1,
      "children": {
        "Frein à tambour": {
          "categoryId": null,
          "categoryName": "Frein à tambour",
          "level": 2,
          "children": {
            "Kit d'accessoires, mâchoire de frein": {
              "categoryId": 100627,
              "categoryName": "Drum Brake",
              "level": 2,
              "children": {
                "Accessoires / composants": {
                  "categoryId": null,
                  "categoryName": "Accessoires / composants",
                  "level": 4,
                  "children": {
                    "Kit d'accessoires, mâchoire de frein": {
                      "categoryId": 100634,
                      "categoryName": "Accessories/Parts",
                      "level": 3,
                      "children": [],
                      "productId": 1502
                    }
                  }
                }
              },
              "productId": 1502
            }
          }
        }
      }
    },
    "Échappement": {
      "categoryId": 100004,
      "categoryName": "Échappement",
      "level": 1,
      "children": {
        "Pièces de montage": {
          "categoryId": null,
          "categoryName": "Pièces de montage",
          "level": 2,
          "children": {
            "Clip de sécurité, système d'échappement": {
              "categoryId": 100222,
              "categoryName": "Assembly Parts",
              "level": 2,
              "children": {
                "Pièces détachées de montage": {
                  "categoryId": null,
                  "categoryName": "Pièces détachées de montage",
                  "level": 4,
                  "children": {
                    "Clip de sécurité, système d'échappement": {
                      "categoryId": 100317,
                      "categoryName": "Individual Assembly Parts",
                      "level": 3,
                      "children": {
                        "Clip de protection": {
                          "categoryId": null,
                          "categoryName": "Clip de protection",
                          "level": 6,
                          "children": {
                            "Clip de sécurité, système d'échappement": {
                              "categoryId": 706766,
                              "categoryName": "Locking clip",
                              "level": 4,
                              "children": [],
                              "productId": 60709
                            }
                          }
                        }
                      },
                      "productId": 60709
                    }
                  }
                }
              },
              "productId": 60709
            }
          }
        }
      }
    },
    "Entraînement des essieux": {
      "categoryId": 100400,
      "categoryName": "Entraînement des essieux",
      "level": 1,
      "children": {
        "Boîte de transfert": {
          "categoryId": null,
          "categoryName": "Boîte de transfert",
          "level": 2,
          "children": {
            "Circlip, arbre d'entrée (boîte de transfert)": {
              "categoryId": 100416,
              "categoryName": "Transfer Case",
              "level": 2,
              "children": [],
              "productId": 61008
            }
          }
        },
        "Différentiel": {
          "categoryId": null,
          "categoryName": "Différentiel",
          "level": 2,
          "children": {
            "Kit de réparation, différentiel": {
              "categoryId": 100415,
              "categoryName": "Differential",
              "level": 2,
              "children": [],
              "productId": 4022
            }
          }
        }
      }
    },
    "Moteur": {
      "categoryId": 100002,
      "categoryName": "Moteur",
      "level": 1,
      "children": {
        "Cylindre et piston": {
          "categoryId": null,
          "categoryName": "Cylindre et piston",
          "level": 2,
          "children": {
            "Axe de piston, système bielle-manivelle": {
              "categoryId": 104377,
              "categoryName": "Cylinders/Pistons",
              "level": 2,
              "children": [],
              "productId": 587
            },
            "Fusible, axe de piston": {
              "categoryId": 104377,
              "categoryName": "Cylinders/Pistons",
              "level": 2,
              "children": [],
              "productId": 588
            }
          }
        },
        "Système bielle-manivelle": {
          "categoryId": null,
          "categoryName": "Système bielle-manivelle",
          "level": 2,
          "children": {
            "Axe de piston, système bielle-manivelle": {
              "categoryId": 100515,
              "categoryName": "Crankshaft Drive",
              "level": 2,
              "children": {
                "Piston": {
                  "categoryId": null,
                  "categoryName": "Piston",
                  "level": 4,
                  "children": {
                    "Axe de piston, système bielle-manivelle": {
                      "categoryId": 100520,
                      "categoryName": "Piston",
                      "level": 3,
                      "children": {
                        "Axe de piston / fixation": {
                          "categoryId": null,
                          "categoryName": "Axe de piston / fixation",
                          "level": 6,
                          "children": {
                            "Axe de piston, système bielle-manivelle": {
                              "categoryId": 100532,
                              "categoryName": "Piston Pin/Circlip",
                              "level": 4,
                              "children": [],
                              "productId": 587
                            }
                          }
                        }
                      },
                      "productId": 587
                    }
                  }
                }
              },
              "productId": 587
            },
            "Fusible, axe de piston": {
              "categoryId": 100515,
              "categoryName": "Crankshaft Drive",
              "level": 2,
              "children": {
                "Piston": {
                  "categoryId": null,
                  "categoryName": "Piston",
                  "level": 4,
                  "children": {
                    "Fusible, axe de piston": {
                      "categoryId": 100520,
                      "categoryName": "Piston",
                      "level": 3,
                      "children": {
                        "Axe de piston / fixation": {
                          "categoryId": null,
                          "categoryName": "Axe de piston / fixation",
                          "level": 6,
                          "children": {
                            "Fusible, axe de piston": {
                              "categoryId": 100532,
                              "categoryName": "Piston Pin/Circlip",
                              "level": 4,
                              "children": [],
                              "productId": 588
                            }
                          }
                        }
                      },
                      "productId": 588
                    }
                  }
                }
              },
              "productId": 588
            }
          }
        }
      }
    },
    "Suspension d'essieu/Guidage des roues/Roues": {
      "categoryId": 100013,
      "categoryName": "Suspension d'essieu/Guidage des roues/Roues",
      "level": 1,
      "children": {
        "Fusée d'essieu / kit de réparation": {
          "categoryId": null,
          "categoryName": "Fusée d'essieu / kit de réparation",
          "level": 2,
          "children": {
            "Circlip, pivot de fusée d'essieu": {
              "categoryId": 100207,
              "categoryName": "Steering Knuckle/Repair Kit",
              "level": 2,
              "children": {
                "Pivot de fusée d'essieu": {
                  "categoryId": null,
                  "categoryName": "Pivot de fusée d'essieu",
                  "level": 4,
                  "children": {
                    "Circlip, pivot de fusée d'essieu": {
                      "categoryId": 100588,
                      "categoryName": "Kingpin",
                      "level": 3,
                      "children": [],
                      "productId": 3651
                    }
                  }
                }
              },
              "productId": 3651
            }
          }
        },
        "Outils": {
          "categoryId": null,
          "categoryName": "Outils",
          "level": 2,
          "children": {
            "Coupe sangle avec verrouillage": {
              "categoryId": 103159,
              "categoryName": "Tools",
              "level": 2,
              "children": [],
              "productId": 9351
            }
          }
        },
        "Support d'essieu / arbre d'essieu / fixation": {
          "categoryId": null,
          "categoryName": "Support d'essieu / arbre d'essieu / fixation",
          "level": 2,
          "children": {
            "Kit de réparation, corps de l'essieu": {
              "categoryId": 100212,
              "categoryName": "Axle Cross Member/Axle Beam/Axle Beam Mounting",
              "level": 2,
              "children": {
                "Corps de l'essieu": {
                  "categoryId": null,
                  "categoryName": "Corps de l'essieu",
                  "level": 4,
                  "children": {
                    "Kit de réparation, corps de l'essieu": {
                      "categoryId": 100585,
                      "categoryName": "Axle Beam",
                      "level": 3,
                      "children": [],
                      "productId": 1281
                    }
                  }
                },
                "Fixation": {
                  "categoryId": null,
                  "categoryName": "Fixation",
                  "level": 4,
                  "children": {
                    "Kit de réparation, corps de l'essieu": {
                      "categoryId": 100586,
                      "categoryName": "Axle Mounting",
                      "level": 3,
                      "children": [],
                      "productId": 1281
                    }
                  }
                }
              },
              "productId": 1281
            }
          }
        }
      }
    }
  },
  "arborescenceText": "├── Boîte de vitesses [ID: 100238] (Niveau 1)\n│   ├── Boîte de vitesses manuelle (Niveau 2)\n│   │   └── Manual Transmission [ID: 100239] (Niveau 2) → ProductId: 4139\n│   │       └── Carter/composants (Niveau 4)\n│   │           └── Transmission Housing/Parts [ID: 100774] (Niveau 3) → ProductId: 4139\n│   └── Transmission à double embrayage (Niveau 2)\n│       └── Dual-Clutch Transmission [ID: 706835] (Niveau 2) → ProductId: 61240\n│           └── Carter/composants (Niveau 4)\n│               └── Transmission Housing/Parts [ID: 706846] (Niveau 3) → ProductId: 61240\n\n├── Dispositif de freinage [ID: 100006] (Niveau 1)\n│   └── Frein à tambour (Niveau 2)\n│       └── Drum Brake [ID: 100627] (Niveau 2) → ProductId: 1502\n│           └── Accessoires / composants (Niveau 4)\n│               └── Accessories/Parts [ID: 100634] (Niveau 3) → ProductId: 1502\n\n├── Échappement [ID: 100004] (Niveau 1)\n│   └── Pièces de montage (Niveau 2)\n│       └── Assembly Parts [ID: 100222] (Niveau 2) → ProductId: 60709\n│           └── Pièces détachées de montage (Niveau 4)\n│               └── Individual Assembly Parts [ID: 100317] (Niveau 3) → ProductId: 60709\n│                   └── Clip de protection (Niveau 6)\n│                       └── Locking clip [ID: 706766] (Niveau 4) → ProductId: 60709\n\n├── Entraînement des essieux [ID: 100400] (Niveau 1)\n│   ├── Boîte de transfert (Niveau 2)\n│   │   └── Transfer Case [ID: 100416] (Niveau 2) → ProductId: 61008\n│   └── Différentiel (Niveau 2)\n│       └── Differential [ID: 100415] (Niveau 2) → ProductId: 4022\n\n├── Moteur [ID: 100002] (Niveau 1)\n│   ├── Cylindre et piston (Niveau 2)\n│   │   ├── Cylinders/Pistons [ID: 104377] (Niveau 2) → ProductId: 587\n│   │   └── Cylinders/Pistons [ID: 104377] (Niveau 2) → ProductId: 588\n│   └── Système bielle-manivelle (Niveau 2)\n│       ├── Crankshaft Drive [ID: 100515] (Niveau 2) → ProductId: 587\n│       │   └── Piston (Niveau 4)\n│       │       └── Piston [ID: 100520] (Niveau 3) → ProductId: 587\n│       │           └── Axe de piston / fixation (Niveau 6)\n│       │               └── Piston Pin/Circlip [ID: 100532] (Niveau 4) → ProductId: 587\n│       └── Crankshaft Drive [ID: 100515] (Niveau 2) → ProductId: 588\n│           └── Piston (Niveau 4)\n│               └── Piston [ID: 100520] (Niveau 3) → ProductId: 588\n│                   └── Axe de piston / fixation (Niveau 6)\n│                       └── Piston Pin/Circlip [ID: 100532] (Niveau 4) → ProductId: 588\n\n└── Suspension d'essieu/Guidage des roues/Roues [ID: 100013] (Niveau 1)\n    ├── Fusée d'essieu / kit de réparation (Niveau 2)\n    │   └── Steering Knuckle/Repair Kit [ID: 100207] (Niveau 2) → ProductId: 3651\n    │       └── Pivot de fusée d'essieu (Niveau 4)\n    │           └── Kingpin [ID: 100588] (Niveau 3) → ProductId: 3651\n    ├── Outils (Niveau 2)\n    │   └── Tools [ID: 103159] (Niveau 2) → ProductId: 9351\n    └── Support d'essieu / arbre d'essieu / fixation (Niveau 2)\n        └── Axle Cross Member/Axle Beam/Axle Beam Mounting [ID: 100212] (Niveau 2) → ProductId: 1281\n            ├── Corps de l'essieu (Niveau 4)\n            │   └── Axle Beam [ID: 100585] (Niveau 3) → ProductId: 1281\n            └── Fixation (Niveau 4)\n                └── Axle Mounting [ID: 100586] (Niveau 3) → ProductId: 1281",
  "arborescencePaths": [
    {
      "path": [
        "Boîte de vitesses",
        "Boîte de vitesses manuelle",
        "Manual Transmission"
      ],
      "categoryIds": [
        100238,
        null,
        100239
      ],
      "finalCategoryId": 100239,
      "productId": 4139
    },
    {
      "path": [
        "Boîte de vitesses",
        "Transmission à double embrayage",
        "Dual-Clutch Transmission"
      ],
      "categoryIds": [
        100238,
        null,
        706835
      ],
      "finalCategoryId": 706835,
      "productId": 61240
    },
    {
      "path": [
        "Dispositif de freinage",
        "Frein à tambour",
        "Drum Brake"
      ],
      "categoryIds": [
        100006,
        null,
        100627
      ],
      "finalCategoryId": 100627,
      "productId": 1502
    },
    {
      "path": [
        "Échappement",
        "Pièces de montage",
        "Assembly Parts"
      ],
      "categoryIds": [
        100004,
        null,
        100222
      ],
      "finalCategoryId": 100222,
      "productId": 60709
    },
    {
      "path": [
        "Entraînement des essieux",
        "Boîte de transfert",
        "Transfer Case"
      ],
      "categoryIds": [
        100400,
        null,
        100416
      ],
      "finalCategoryId": 100416,
      "productId": 61008
    },
    {
      "path": [
        "Entraînement des essieux",
        "Différentiel",
        "Differential"
      ],
      "categoryIds": [
        100400,
        null,
        100415
      ],
      "finalCategoryId": 100415,
      "productId": 4022
    },
    {
      "path": [
        "Moteur",
        "Cylindre et piston",
        "Cylinders/Pistons"
      ],
      "categoryIds": [
        100002,
        null,
        104377
      ],
      "finalCategoryId": 104377,
      "productId": 587
    },
    {
      "path": [
        "Moteur",
        "Cylindre et piston",
        "Cylinders/Pistons"
      ],
      "categoryIds": [
        100002,
        null,
        104377
      ],
      "finalCategoryId": 104377,
      "productId": 588
    },
    {
      "path": [
        "Moteur",
        "Système bielle-manivelle",
        "Crankshaft Drive"
      ],
      "categoryIds": [
        100002,
        null,
        100515
      ],
      "finalCategoryId": 100515,
      "productId": 587
    },
    {
      "path": [
        "Moteur",
        "Système bielle-manivelle",
        "Crankshaft Drive"
      ],
      "categoryIds": [
        100002,
        null,
        100515
      ],
      "finalCategoryId": 100515,
      "productId": 588
    },
    {
      "path": [
        "Suspension d'essieu/Guidage des roues/Roues",
        "Fusée d'essieu / kit de réparation",
        "Steering Knuckle/Repair Kit"
      ],
      "categoryIds": [
        100013,
        null,
        100207
      ],
      "finalCategoryId": 100207,
      "productId": 3651
    },
    {
      "path": [
        "Suspension d'essieu/Guidage des roues/Roues",
        "Outils",
        "Tools"
      ],
      "categoryIds": [
        100013,
        null,
        103159
      ],
      "finalCategoryId": 103159,
      "productId": 9351
    },
    {
      "path": [
        "Suspension d'essieu/Guidage des roues/Roues",
        "Support d'essieu / arbre d'essieu / fixation",
        "Axle Cross Member/Axle Beam/Axle Beam Mounting"
      ],
      "categoryIds": [
        100013,
        null,
        100212
      ],
      "finalCategoryId": 100212,
      "productId": 1281
    }
  ],
  "productIdsInArbo": [
    587,
    588,
    1281,
    1502,
    3651,
    4022,
    4139,
    9351,
    60709,
    61008,
    61240
  ],
  "closestProductIds": [
    {
      "productId": 587,
      "productName": "Axe de piston, système bielle-manivelle"
    },
    {
      "productId": 588,
      "productName": "Fusible, axe de piston"
    },
    {
      "productId": 1281,
      "productName": "Kit de réparation, corps de l'essieu"
    },
    {
      "productId": 1502,
      "productName": "Kit d'accessoires, mâchoire de frein"
    },
    {
      "productId": 3651,
      "productName": "Circlip, pivot de fusée d'essieu"
    }
  ]
}