{
  "productName": "Compteur de vitesse",
  "searchText": "Compteur de vitesse",
  "found": true,
  "hasMatch": true,
  "timestamp": "2025-12-02T20:23:36.820Z",
  "productId": 952,
  "arborescence": {
    "Boîte de vitesses": {
      "categoryId": 100238,
      "categoryName": "Boîte de vitesses",
      "level": 1,
      "children": {
        "Boîte de vitesses manuelle": {
          "categoryId": null,
          "categoryName": "Boîte de vitesses manuelle",
          "level": 2,
          "children": {
            "Pignon, compteur de vitesse": {
              "categoryId": 100239,
              "categoryName": "Manual Transmission",
              "level": 2,
              "children": {
                "Carter/composants": {
                  "categoryId": null,
                  "categoryName": "Carter/composants",
                  "level": 4,
                  "children": {
                    "Pignon, compteur de vitesse": {
                      "categoryId": 100774,
                      "categoryName": "Transmission Housing/Parts",
                      "level": 3,
                      "children": [],
                      "productId": 8758
                    }
                  }
                }
              },
              "productId": 8758
            }
          }
        }
      }
    },
    "Système d'information et de communication": {
      "categoryId": 100339,
      "categoryName": "Système d'information et de communication",
      "level": 1,
      "children": {
        "Instruments": {
          "categoryId": null,
          "categoryName": "Instruments",
          "level": 2,
          "children": {
            "Carte de circuit imprimé, tachymètre": {
              "categoryId": 100693,
              "categoryName": "Instruments",
              "level": 2,
              "children": [],
              "productId": 60850
            },
            "Compteur de vitesse": {
              "categoryId": 100693,
              "categoryName": "Instruments",
              "level": 2,
              "children": [],
              "productId": 952
            },
            "Couvercle, tachymètre": {
              "categoryId": 100693,
              "categoryName": "Instruments",
              "level": 2,
              "children": [],
              "productId": 60867
            }
          }
        }
      }
    },
    "Système électrique": {
      "categoryId": 100010,
      "categoryName": "Système électrique",
      "level": 1,
      "children": {
        "Instruments": {
          "categoryId": null,
          "categoryName": "Instruments",
          "level": 2,
          "children": {
            "Bague d'étanchéité système S.P.I, boîte du tachymètre": {
              "categoryId": 100322,
              "categoryName": "Instruments",
              "level": 2,
              "children": {
                "Flexible de compteur de vitesse": {
                  "categoryId": null,
                  "categoryName": "Flexible de compteur de vitesse",
                  "level": 4,
                  "children": {
                    "Bague d'étanchéité système S.P.I, boîte du tachymètre": {
                      "categoryId": 100561,
                      "categoryName": "Speedometer Cable",
                      "level": 3,
                      "children": [],
                      "productId": 3425
                    }
                  }
                }
              },
              "productId": 3425
            },
            "Câble flexible de commande de compteur": {
              "categoryId": 100322,
              "categoryName": "Instruments",
              "level": 2,
              "children": {
                "Flexible de compteur de vitesse": {
                  "categoryId": null,
                  "categoryName": "Flexible de compteur de vitesse",
                  "level": 4,
                  "children": {
                    "Câble flexible de commande de compteur": {
                      "categoryId": 100561,
                      "categoryName": "Speedometer Cable",
                      "level": 3,
                      "children": [],
                      "productId": 1150
                    }
                  }
                }
              },
              "productId": 1150
            },
            "Carte de circuit imprimé, tachymètre": {
              "categoryId": 100322,
              "categoryName": "Instruments",
              "level": 2,
              "children": {
                "Instruments indicateurs": {
                  "categoryId": null,
                  "categoryName": "Instruments indicateurs",
                  "level": 4,
                  "children": {
                    "Carte de circuit imprimé, tachymètre": {
                      "categoryId": 100555,
                      "categoryName": "Gauges",
                      "level": 3,
                      "children": [],
                      "productId": 60850
                    }
                  }
                }
              },
              "productId": 60850
            },
            "Compteur de vitesse": {
              "categoryId": 100322,
              "categoryName": "Instruments",
              "level": 2,
              "children": {
                "Instruments indicateurs": {
                  "categoryId": null,
                  "categoryName": "Instruments indicateurs",
                  "level": 4,
                  "children": {
                    "Compteur de vitesse": {
                      "categoryId": 100555,
                      "categoryName": "Gauges",
                      "level": 3,
                      "children": [],
                      "productId": 952
                    }
                  }
                }
              },
              "productId": 952
            },
            "Couvercle, tachymètre": {
              "categoryId": 100322,
              "categoryName": "Instruments",
              "level": 2,
              "children": {
                "Instruments indicateurs": {
                  "categoryId": null,
                  "categoryName": "Instruments indicateurs",
                  "level": 4,
                  "children": {
                    "Couvercle, tachymètre": {
                      "categoryId": 100555,
                      "categoryName": "Gauges",
                      "level": 3,
                      "children": [],
                      "productId": 60867
                    }
                  }
                }
              },
              "productId": 60867
            },
            "Joint, arbre de tachymètre": {
              "categoryId": 100322,
              "categoryName": "Instruments",
              "level": 2,
              "children": {
                "Flexible de compteur de vitesse": {
                  "categoryId": null,
                  "categoryName": "Flexible de compteur de vitesse",
                  "level": 4,
                  "children": {
                    "Joint, arbre de tachymètre": {
                      "categoryId": 100561,
                      "categoryName": "Speedometer Cable",
                      "level": 3,
                      "children": [],
                      "productId": 60909
                    }
                  }
                }
              },
              "productId": 60909
            },
            "Renvoi d'angle, câble flexible de compteur de vit.": {
              "categoryId": 100322,
              "categoryName": "Instruments",
              "level": 2,
              "children": {
                "Flexible de compteur de vitesse": {
                  "categoryId": null,
                  "categoryName": "Flexible de compteur de vitesse",
                  "level": 4,
                  "children": {
                    "Renvoi d'angle, câble flexible de compteur de vit.": {
                      "categoryId": 100561,
                      "categoryName": "Speedometer Cable",
                      "level": 3,
                      "children": [],
                      "productId": 2202
                    }
                  }
                }
              },
              "productId": 2202
            },
            "Roue motrice, câble flexible de compteur de vitesse": {
              "categoryId": 100322,
              "categoryName": "Instruments",
              "level": 2,
              "children": {
                "Flexible de compteur de vitesse": {
                  "categoryId": null,
                  "categoryName": "Flexible de compteur de vitesse",
                  "level": 4,
                  "children": {
                    "Roue motrice, câble flexible de compteur de vitesse": {
                      "categoryId": 100561,
                      "categoryName": "Speedometer Cable",
                      "level": 3,
                      "children": [],
                      "productId": 60403
                    }
                  }
                }
              },
              "productId": 60403
            }
          }
        }
      }
    }
  },
  "arborescenceText": "├── Boîte de vitesses [ID: 100238] (Niveau 1)\n│   └── Boîte de vitesses manuelle (Niveau 2)\n│       └── Manual Transmission [ID: 100239] (Niveau 2) → ProductId: 8758\n│           └── Carter/composants (Niveau 4)\n│               └── Transmission Housing/Parts [ID: 100774] (Niveau 3) → ProductId: 8758\n\n├── Système d'information et de communication [ID: 100339] (Niveau 1)\n│   └── Instruments (Niveau 2)\n│       ├── Instruments [ID: 100693] (Niveau 2) → ProductId: 60850\n│       ├── Instruments [ID: 100693] (Niveau 2) → ProductId: 952\n│       └── Instruments [ID: 100693] (Niveau 2) → ProductId: 60867\n\n└── Système électrique [ID: 100010] (Niveau 1)\n    └── Instruments (Niveau 2)\n        ├── Instruments [ID: 100322] (Niveau 2) → ProductId: 3425\n        │   └── Flexible de compteur de vitesse (Niveau 4)\n        │       └── Speedometer Cable [ID: 100561] (Niveau 3) → ProductId: 3425\n        ├── Instruments [ID: 100322] (Niveau 2) → ProductId: 1150\n        │   └── Flexible de compteur de vitesse (Niveau 4)\n        │       └── Speedometer Cable [ID: 100561] (Niveau 3) → ProductId: 1150\n        ├── Instruments [ID: 100322] (Niveau 2) → ProductId: 60850\n        │   └── Instruments indicateurs (Niveau 4)\n        │       └── Gauges [ID: 100555] (Niveau 3) → ProductId: 60850\n        ├── Instruments [ID: 100322] (Niveau 2) → ProductId: 952\n        │   └── Instruments indicateurs (Niveau 4)\n        │       └── Gauges [ID: 100555] (Niveau 3) → ProductId: 952\n        ├── Instruments [ID: 100322] (Niveau 2) → ProductId: 60867\n        │   └── Instruments indicateurs (Niveau 4)\n        │       └── Gauges [ID: 100555] (Niveau 3) → ProductId: 60867\n        ├── Instruments [ID: 100322] (Niveau 2) → ProductId: 60909\n        │   └── Flexible de compteur de vitesse (Niveau 4)\n        │       └── Speedometer Cable [ID: 100561] (Niveau 3) → ProductId: 60909\n        ├── Instruments [ID: 100322] (Niveau 2) → ProductId: 2202\n        │   └── Flexible de compteur de vitesse (Niveau 4)\n        │       └── Speedometer Cable [ID: 100561] (Niveau 3) → ProductId: 2202\n        └── Instruments [ID: 100322] (Niveau 2) → ProductId: 60403\n            └── Flexible de compteur de vitesse (Niveau 4)\n                └── Speedometer Cable [ID: 100561] (Niveau 3) → ProductId: 60403",
  "arborescencePaths": [
    {
      "path": [
        "Boîte de vitesses",
        "Boîte de vitesses manuelle",
        "Manual Transmission"
      ],
      "categoryIds": [
        100238,
        null,
        100239
      ],
      "finalCategoryId": 100239,
      "productId": 8758
    },
    {
      "path": [
        "Système d'information et de communication",
        "Instruments",
        "Instruments"
      ],
      "categoryIds": [
        100339,
        null,
        100693
      ],
      "finalCategoryId": 100693,
      "productId": 60850
    },
    {
      "path": [
        "Système d'information et de communication",
        "Instruments",
        "Instruments"
      ],
      "categoryIds": [
        100339,
        null,
        100693
      ],
      "finalCategoryId": 100693,
      "productId": 952
    },
    {
      "path": [
        "Système d'information et de communication",
        "Instruments",
        "Instruments"
      ],
      "categoryIds": [
        100339,
        null,
        100693
      ],
      "finalCategoryId": 100693,
      "productId": 60867
    },
    {
      "path": [
        "Système électrique",
        "Instruments",
        "Instruments"
      ],
      "categoryIds": [
        100010,
        null,
        100322
      ],
      "finalCategoryId": 100322,
      "productId": 3425
    },
    {
      "path": [
        "Système électrique",
        "Instruments",
        "Instruments"
      ],
      "categoryIds": [
        100010,
        null,
        100322
      ],
      "finalCategoryId": 100322,
      "productId": 1150
    },
    {
      "path": [
        "Système électrique",
        "Instruments",
        "Instruments"
      ],
      "categoryIds": [
        100010,
        null,
        100322
      ],
      "finalCategoryId": 100322,
      "productId": 60850
    },
    {
      "path": [
        "Système électrique",
        "Instruments",
        "Instruments"
      ],
      "categoryIds": [
        100010,
        null,
        100322
      ],
      "finalCategoryId": 100322,
      "productId": 952
    },
    {
      "path": [
        "Système électrique",
        "Instruments",
        "Instruments"
      ],
      "categoryIds": [
        100010,
        null,
        100322
      ],
      "finalCategoryId": 100322,
      "productId": 60867
    },
    {
      "path": [
        "Système électrique",
        "Instruments",
        "Instruments"
      ],
      "categoryIds": [
        100010,
        null,
        100322
      ],
      "finalCategoryId": 100322,
      "productId": 60909
    },
    {
      "path": [
        "Système électrique",
        "Instruments",
        "Instruments"
      ],
      "categoryIds": [
        100010,
        null,
        100322
      ],
      "finalCategoryId": 100322,
      "productId": 2202
    },
    {
      "path": [
        "Système électrique",
        "Instruments",
        "Instruments"
      ],
      "categoryIds": [
        100010,
        null,
        100322
      ],
      "finalCategoryId": 100322,
      "productId": 60403
    }
  ],
  "productIdsInArbo": [
    952,
    1150,
    2202,
    3425,
    8758,
    60403,
    60850,
    60867,
    60909
  ],
  "matchedProductIds": [
    952
  ]
}