{
  "productName": "Connecteur",
  "searchText": "Connecteur",
  "found": true,
  "hasMatch": false,
  "timestamp": "2025-12-02T20:24:11.798Z",
  "productId": 3490,
  "arborescence": {
    "Alimentation carburant": {
      "categoryId": 100214,
      "categoryName": "Alimentation carburant",
      "level": 1,
      "children": {
        "Outils": {
          "categoryId": null,
          "categoryName": "Outils",
          "level": 2,
          "children": {
            "Kit d'outils de déverrouillage, conduite de carburant": {
              "categoryId": 103148,
              "categoryName": "Tools",
              "level": 2,
              "children": [],
              "productId": 8169
            }
          }
        }
      }
    },
    "Allumage / préchauffage": {
      "categoryId": 100008,
      "categoryName": "Allumage / préchauffage",
      "level": 1,
      "children": {
        "Outils": {
          "categoryId": null,
          "categoryName": "Outils",
          "level": 2,
          "children": {
            "Pince, Connecteur de bougie de prechauffage": {
              "categoryId": 103139,
              "categoryName": "Tools",
              "level": 2,
              "children": [],
              "productId": 4526
            }
          }
        }
      }
    },
    "Boîte de vitesses": {
      "categoryId": 100238,
      "categoryName": "Boîte de vitesses",
      "level": 1,
      "children": {
        "Boîte de vitesse automatique": {
          "categoryId": null,
          "categoryName": "Boîte de vitesse automatique",
          "level": 2,
          "children": {
            "Boîtier de connecteur, unité de commande boîte automatique": {
              "categoryId": 100240,
              "categoryName": "Automatic Transmission",
              "level": 2,
              "children": {
                "Boîtier/composants": {
                  "categoryId": null,
                  "categoryName": "Boîtier/composants",
                  "level": 4,
                  "children": {
                    "Boîtier de connecteur, unité de commande boîte automatique": {
                      "categoryId": 100775,
                      "categoryName": "Transmission Housing/Parts",
                      "level": 3,
                      "children": [],
                      "productId": 4743
                    }
                  }
                },
                "Contrôle / hydraulique": {
                  "categoryId": null,
                  "categoryName": "Contrôle / hydraulique",
                  "level": 4,
                  "children": {
                    "Boîtier de connecteur, unité de commande boîte automatique": {
                      "categoryId": 100776,
                      "categoryName": "Transmission Control/Hydraulics",
                      "level": 3,
                      "children": [],
                      "productId": 4743
                    }
                  }
                }
              },
              "productId": 4743
            }
          }
        }
      }
    },
    "Carrosserie": {
      "categoryId": 100001,
      "categoryName": "Carrosserie",
      "level": 1,
      "children": {
        "Arrière de la voiture": {
          "categoryId": null,
          "categoryName": "Arrière de la voiture",
          "level": 2,
          "children": {
            "Kit réparation de câble, feu arrière": {
              "categoryId": 101705,
              "categoryName": "Vehicle Rear",
              "level": 2,
              "children": {
                "Feu arrière / composants": {
                  "categoryId": null,
                  "categoryName": "Feu arrière / composants",
                  "level": 4,
                  "children": {
                    "Kit réparation de câble, feu arrière": {
                      "categoryId": 101715,
                      "categoryName": "Tail Light Assembly/Parts",
                      "level": 3,
                      "children": {
                        "Feu arrière": {
                          "categoryId": null,
                          "categoryName": "Feu arrière",
                          "level": 6,
                          "children": {
                            "Kit réparation de câble, feu arrière": {
                              "categoryId": 101716,
                              "categoryName": "Tail Light Assembly",
                              "level": 4,
                              "children": [],
                              "productId": 6346
                            }
                          }
                        }
                      },
                      "productId": 6346
                    }
                  }
                }
              },
              "productId": 6346
            }
          }
        },
        "Feux": {
          "categoryId": null,
          "categoryName": "Feux",
          "level": 2,
          "children": {
            "Kit réparation de câble, feu arrière": {
              "categoryId": 101407,
              "categoryName": "Lights",
              "level": 2,
              "children": {
                "Feu arrière / composants": {
                  "categoryId": null,
                  "categoryName": "Feu arrière / composants",
                  "level": 4,
                  "children": {
                    "Kit réparation de câble, feu arrière": {
                      "categoryId": 101408,
                      "categoryName": "Tail Light Assembly/Parts",
                      "level": 3,
                      "children": {
                        "Feu arrière": {
                          "categoryId": null,
                          "categoryName": "Feu arrière",
                          "level": 6,
                          "children": {
                            "Kit réparation de câble, feu arrière": {
                              "categoryId": 101409,
                              "categoryName": "Tail Light Assembly",
                              "level": 4,
                              "children": [],
                              "productId": 6346
                            }
                          }
                        }
                      },
                      "productId": 6346
                    }
                  }
                }
              },
              "productId": 6346
            }
          }
        }
      }
    },
    "Chauffage / Ventilation": {
      "categoryId": 100241,
      "categoryName": "Chauffage / Ventilation",
      "level": 1,
      "children": {
        "Gaines/tuyaux": {
          "categoryId": null,
          "categoryName": "Gaines/tuyaux",
          "level": 2,
          "children": {
            "Connecteur, canal de chauffage": {
              "categoryId": 100777,
              "categoryName": "Hoses/Pipes",
              "level": 2,
              "children": [],
              "productId": 3757
            }
          }
        }
      }
    },
    "Moteur": {
      "categoryId": 100002,
      "categoryName": "Moteur",
      "level": 1,
      "children": {
        "Outils": {
          "categoryId": null,
          "categoryName": "Outils",
          "level": 2,
          "children": {
            "Kit d'outils de déverrouillage, conduite de carburant": {
              "categoryId": 103129,
              "categoryName": "Tools",
              "level": 2,
              "children": [],
              "productId": 8169
            }
          }
        }
      }
    },
    "Refroidissement": {
      "categoryId": 100007,
      "categoryName": "Refroidissement",
      "level": 1,
      "children": {
        "Tuyauterie et brides": {
          "categoryId": null,
          "categoryName": "Tuyauterie et brides",
          "level": 2,
          "children": {
            "Assortiment, connecteur de tuyau de radiateur": {
              "categoryId": 100099,
              "categoryName": "Hoses/Pipes/Flanges",
              "level": 2,
              "children": {
                "Assortiments": {
                  "categoryId": null,
                  "categoryName": "Assortiments",
                  "level": 4,
                  "children": {
                    "Assortiment, connecteur de tuyau de radiateur": {
                      "categoryId": 706823,
                      "categoryName": "Assortment",
                      "level": 3,
                      "children": [],
                      "productId": 61004
                    }
                  }
                }
              },
              "productId": 61004
            }
          }
        }
      }
    },
    "Système d'information et de communication": {
      "categoryId": 100339,
      "categoryName": "Système d'information et de communication",
      "level": 1,
      "children": {
        "Système audio": {
          "categoryId": null,
          "categoryName": "Système audio",
          "level": 2,
          "children": {
            "Kit réparation de câble, haut-parleur": {
              "categoryId": 100694,
              "categoryName": "Audio System",
              "level": 2,
              "children": [],
              "productId": 9860
            }
          }
        }
      }
    },
    "Système électrique": {
      "categoryId": 100010,
      "categoryName": "Système électrique",
      "level": 1,
      "children": {
        "Feux": {
          "categoryId": null,
          "categoryName": "Feux",
          "level": 2,
          "children": {
            "Kit réparation de câble, feu arrière": {
              "categoryId": 100043,
              "categoryName": "Lights",
              "level": 2,
              "children": {
                "Feu arrière / composants": {
                  "categoryId": null,
                  "categoryName": "Feu arrière / composants",
                  "level": 4,
                  "children": {
                    "Kit réparation de câble, feu arrière": {
                      "categoryId": 100275,
                      "categoryName": "Tail Light Assembly/Parts",
                      "level": 3,
                      "children": {
                        "Composants de feu arrière": {
                          "categoryId": null,
                          "categoryName": "Composants de feu arrière",
                          "level": 6,
                          "children": {
                            "Kit réparation de câble, feu arrière": {
                              "categoryId": 100456,
                              "categoryName": "Tail Light Assembly Parts",
                              "level": 4,
                              "children": [],
                              "productId": 6346
                            }
                          }
                        }
                      },
                      "productId": 6346
                    }
                  }
                }
              },
              "productId": 6346
            },
            "Kit réparation de câble, feu latéral": {
              "categoryId": 100043,
              "categoryName": "Lights",
              "level": 2,
              "children": {
                "Feu de position / d'encombrement / composants": {
                  "categoryId": null,
                  "categoryName": "Feu de position / d'encombrement / composants",
                  "level": 4,
                  "children": {
                    "Kit réparation de câble, feu latéral": {
                      "categoryId": 100290,
                      "categoryName": "Side Marker/End Outline Marker Light/Parts",
                      "level": 3,
                      "children": {
                        "Feux latéraux": {
                          "categoryId": null,
                          "categoryName": "Feux latéraux",
                          "level": 6,
                          "children": {
                            "Kit réparation de câble, feu latéral": {
                              "categoryId": 100753,
                              "categoryName": "Side Marker Lights",
                              "level": 4,
                              "children": [],
                              "productId": 6345
                            }
                          }
                        }
                      },
                      "productId": 6345
                    }
                  }
                }
              },
              "productId": 6345
            }
          }
        },
        "Outils": {
          "categoryId": null,
          "categoryName": "Outils",
          "level": 2,
          "children": {
            "Pince, Connecteur de bougie de prechauffage": {
              "categoryId": 103136,
              "categoryName": "Tools",
              "level": 2,
              "children": [],
              "productId": 4526
            }
          }
        },
        "Projecteurs principaux / composants": {
          "categoryId": null,
          "categoryName": "Projecteurs principaux / composants",
          "level": 2,
          "children": {
            "Kit réparation de câble, projecteur principal": {
              "categoryId": 100143,
              "categoryName": "Headlight/Parts",
              "level": 2,
              "children": {
                "Composants des projecteurs principaux": {
                  "categoryId": null,
                  "categoryName": "Composants des projecteurs principaux",
                  "level": 4,
                  "children": {
                    "Kit réparation de câble, projecteur principal": {
                      "categoryId": 100430,
                      "categoryName": "Headlight Parts",
                      "level": 3,
                      "children": [],
                      "productId": 6347
                    }
                  }
                }
              },
              "productId": 6347
            }
          }
        }
      }
    },
    "Système pneumatique": {
      "categoryId": 103168,
      "categoryName": "Système pneumatique",
      "level": 1,
      "children": {
        "Connecteurs/Câbles": {
          "categoryId": null,
          "categoryName": "Connecteurs/Câbles",
          "level": 2,
          "children": {
            "Connecteur, conduite d'air comprimé": {
              "categoryId": 103197,
              "categoryName": "Hoses/Connector Pipes",
              "level": 2,
              "children": [],
              "productId": 373
            },
            "Flexible de frein, système d'air comprimé": {
              "categoryId": 103197,
              "categoryName": "Hoses/Connector Pipes",
              "level": 2,
              "children": [],
              "productId": 2082
            },
            "Poignée, tuyau spiralé": {
              "categoryId": 103197,
              "categoryName": "Hoses/Connector Pipes",
              "level": 2,
              "children": [],
              "productId": 5164
            },
            "Protection thermique, tuyauterie": {
              "categoryId": 103197,
              "categoryName": "Hoses/Connector Pipes",
              "level": 2,
              "children": [],
              "productId": 5158
            },
            "Roulement, tuyauterie": {
              "categoryId": 103197,
              "categoryName": "Hoses/Connector Pipes",
              "level": 2,
              "children": [],
              "productId": 5134
            },
            "Tuyau spiralé": {
              "categoryId": 103197,
              "categoryName": "Hoses/Connector Pipes",
              "level": 2,
              "children": [],
              "productId": 368
            },
            "Tuyauterie": {
              "categoryId": 103197,
              "categoryName": "Hoses/Connector Pipes",
              "level": 2,
              "children": [],
              "productId": 639
            }
          }
        }
      }
    },
    "Systèmes de confort": {
      "categoryId": 100335,
      "categoryName": "Systèmes de confort",
      "level": 1,
      "children": {
        "Régulateur de vitesse": {
          "categoryId": null,
          "categoryName": "Régulateur de vitesse",
          "level": 2,
          "children": {
            "Connecteur ident., codification d'impulsions": {
              "categoryId": 100615,
              "categoryName": "Cruise Control",
              "level": 2,
              "children": [],
              "productId": 2414
            }
          }
        }
      }
    }
  },
  "arborescenceText": "├── Alimentation carburant [ID: 100214] (Niveau 1)\n│   └── Outils (Niveau 2)\n│       └── Tools [ID: 103148] (Niveau 2) → ProductId: 8169\n\n├── Allumage / préchauffage [ID: 100008] (Niveau 1)\n│   └── Outils (Niveau 2)\n│       └── Tools [ID: 103139] (Niveau 2) → ProductId: 4526\n\n├── Boîte de vitesses [ID: 100238] (Niveau 1)\n│   └── Boîte de vitesse automatique (Niveau 2)\n│       └── Automatic Transmission [ID: 100240] (Niveau 2) → ProductId: 4743\n│           ├── Boîtier/composants (Niveau 4)\n│           │   └── Transmission Housing/Parts [ID: 100775] (Niveau 3) → ProductId: 4743\n│           └── Contrôle / hydraulique (Niveau 4)\n│               └── Transmission Control/Hydraulics [ID: 100776] (Niveau 3) → ProductId: 4743\n\n├── Carrosserie [ID: 100001] (Niveau 1)\n│   ├── Arrière de la voiture (Niveau 2)\n│   │   └── Vehicle Rear [ID: 101705] (Niveau 2) → ProductId: 6346\n│   │       └── Feu arrière / composants (Niveau 4)\n│   │           └── Tail Light Assembly/Parts [ID: 101715] (Niveau 3) → ProductId: 6346\n│   │               └── Feu arrière (Niveau 6)\n│   │                   └── Tail Light Assembly [ID: 101716] (Niveau 4) → ProductId: 6346\n│   └── Feux (Niveau 2)\n│       └── Lights [ID: 101407] (Niveau 2) → ProductId: 6346\n│           └── Feu arrière / composants (Niveau 4)\n│               └── Tail Light Assembly/Parts [ID: 101408] (Niveau 3) → ProductId: 6346\n│                   └── Feu arrière (Niveau 6)\n│                       └── Tail Light Assembly [ID: 101409] (Niveau 4) → ProductId: 6346\n\n├── Chauffage / Ventilation [ID: 100241] (Niveau 1)\n│   └── Gaines/tuyaux (Niveau 2)\n│       └── Hoses/Pipes [ID: 100777] (Niveau 2) → ProductId: 3757\n\n├── Moteur [ID: 100002] (Niveau 1)\n│   └── Outils (Niveau 2)\n│       └── Tools [ID: 103129] (Niveau 2) → ProductId: 8169\n\n├── Refroidissement [ID: 100007] (Niveau 1)\n│   └── Tuyauterie et brides (Niveau 2)\n│       └── Hoses/Pipes/Flanges [ID: 100099] (Niveau 2) → ProductId: 61004\n│           └── Assortiments (Niveau 4)\n│               └── Assortment [ID: 706823] (Niveau 3) → ProductId: 61004\n\n├── Système d'information et de communication [ID: 100339] (Niveau 1)\n│   └── Système audio (Niveau 2)\n│       └── Audio System [ID: 100694] (Niveau 2) → ProductId: 9860\n\n├── Système électrique [ID: 100010] (Niveau 1)\n│   ├── Feux (Niveau 2)\n│   │   ├── Lights [ID: 100043] (Niveau 2) → ProductId: 6346\n│   │   │   └── Feu arrière / composants (Niveau 4)\n│   │   │       └── Tail Light Assembly/Parts [ID: 100275] (Niveau 3) → ProductId: 6346\n│   │   │           └── Composants de feu arrière (Niveau 6)\n│   │   │               └── Tail Light Assembly Parts [ID: 100456] (Niveau 4) → ProductId: 6346\n│   │   └── Lights [ID: 100043] (Niveau 2) → ProductId: 6345\n│   │       └── Feu de position / d'encombrement / composants (Niveau 4)\n│   │           └── Side Marker/End Outline Marker Light/Parts [ID: 100290] (Niveau 3) → ProductId: 6345\n│   │               └── Feux latéraux (Niveau 6)\n│   │                   └── Side Marker Lights [ID: 100753] (Niveau 4) → ProductId: 6345\n│   ├── Outils (Niveau 2)\n│   │   └── Tools [ID: 103136] (Niveau 2) → ProductId: 4526\n│   └── Projecteurs principaux / composants (Niveau 2)\n│       └── Headlight/Parts [ID: 100143] (Niveau 2) → ProductId: 6347\n│           └── Composants des projecteurs principaux (Niveau 4)\n│               └── Headlight Parts [ID: 100430] (Niveau 3) → ProductId: 6347\n\n├── Système pneumatique [ID: 103168] (Niveau 1)\n│   └── Connecteurs/Câbles (Niveau 2)\n│       ├── Hoses/Connector Pipes [ID: 103197] (Niveau 2) → ProductId: 373\n│       ├── Hoses/Connector Pipes [ID: 103197] (Niveau 2) → ProductId: 2082\n│       ├── Hoses/Connector Pipes [ID: 103197] (Niveau 2) → ProductId: 5164\n│       ├── Hoses/Connector Pipes [ID: 103197] (Niveau 2) → ProductId: 5158\n│       ├── Hoses/Connector Pipes [ID: 103197] (Niveau 2) → ProductId: 5134\n│       ├── Hoses/Connector Pipes [ID: 103197] (Niveau 2) → ProductId: 368\n│       └── Hoses/Connector Pipes [ID: 103197] (Niveau 2) → ProductId: 639\n\n└── Systèmes de confort [ID: 100335] (Niveau 1)\n    └── Régulateur de vitesse (Niveau 2)\n        └── Cruise Control [ID: 100615] (Niveau 2) → ProductId: 2414",
  "arborescencePaths": [
    {
      "path": [
        "Alimentation carburant",
        "Outils",
        "Tools"
      ],
      "categoryIds": [
        100214,
        null,
        103148
      ],
      "finalCategoryId": 103148,
      "productId": 8169
    },
    {
      "path": [
        "Allumage / préchauffage",
        "Outils",
        "Tools"
      ],
      "categoryIds": [
        100008,
        null,
        103139
      ],
      "finalCategoryId": 103139,
      "productId": 4526
    },
    {
      "path": [
        "Boîte de vitesses",
        "Boîte de vitesse automatique",
        "Automatic Transmission"
      ],
      "categoryIds": [
        100238,
        null,
        100240
      ],
      "finalCategoryId": 100240,
      "productId": 4743
    },
    {
      "path": [
        "Carrosserie",
        "Arrière de la voiture",
        "Vehicle Rear"
      ],
      "categoryIds": [
        100001,
        null,
        101705
      ],
      "finalCategoryId": 101705,
      "productId": 6346
    },
    {
      "path": [
        "Carrosserie",
        "Feux",
        "Lights"
      ],
      "categoryIds": [
        100001,
        null,
        101407
      ],
      "finalCategoryId": 101407,
      "productId": 6346
    },
    {
      "path": [
        "Chauffage / Ventilation",
        "Gaines/tuyaux",
        "Hoses/Pipes"
      ],
      "categoryIds": [
        100241,
        null,
        100777
      ],
      "finalCategoryId": 100777,
      "productId": 3757
    },
    {
      "path": [
        "Moteur",
        "Outils",
        "Tools"
      ],
      "categoryIds": [
        100002,
        null,
        103129
      ],
      "finalCategoryId": 103129,
      "productId": 8169
    },
    {
      "path": [
        "Refroidissement",
        "Tuyauterie et brides",
        "Hoses/Pipes/Flanges"
      ],
      "categoryIds": [
        100007,
        null,
        100099
      ],
      "finalCategoryId": 100099,
      "productId": 61004
    },
    {
      "path": [
        "Système d'information et de communication",
        "Système audio",
        "Audio System"
      ],
      "categoryIds": [
        100339,
        null,
        100694
      ],
      "finalCategoryId": 100694,
      "productId": 9860
    },
    {
      "path": [
        "Système électrique",
        "Feux",
        "Lights"
      ],
      "categoryIds": [
        100010,
        null,
        100043
      ],
      "finalCategoryId": 100043,
      "productId": 6346
    },
    {
      "path": [
        "Système électrique",
        "Feux",
        "Lights"
      ],
      "categoryIds": [
        100010,
        null,
        100043
      ],
      "finalCategoryId": 100043,
      "productId": 6345
    },
    {
      "path": [
        "Système électrique",
        "Outils",
        "Tools"
      ],
      "categoryIds": [
        100010,
        null,
        103136
      ],
      "finalCategoryId": 103136,
      "productId": 4526
    },
    {
      "path": [
        "Système électrique",
        "Projecteurs principaux / composants",
        "Headlight/Parts"
      ],
      "categoryIds": [
        100010,
        null,
        100143
      ],
      "finalCategoryId": 100143,
      "productId": 6347
    },
    {
      "path": [
        "Système pneumatique",
        "Connecteurs/Câbles",
        "Hoses/Connector Pipes"
      ],
      "categoryIds": [
        103168,
        null,
        103197
      ],
      "finalCategoryId": 103197,
      "productId": 373
    },
    {
      "path": [
        "Système pneumatique",
        "Connecteurs/Câbles",
        "Hoses/Connector Pipes"
      ],
      "categoryIds": [
        103168,
        null,
        103197
      ],
      "finalCategoryId": 103197,
      "productId": 2082
    },
    {
      "path": [
        "Système pneumatique",
        "Connecteurs/Câbles",
        "Hoses/Connector Pipes"
      ],
      "categoryIds": [
        103168,
        null,
        103197
      ],
      "finalCategoryId": 103197,
      "productId": 5164
    },
    {
      "path": [
        "Système pneumatique",
        "Connecteurs/Câbles",
        "Hoses/Connector Pipes"
      ],
      "categoryIds": [
        103168,
        null,
        103197
      ],
      "finalCategoryId": 103197,
      "productId": 5158
    },
    {
      "path": [
        "Système pneumatique",
        "Connecteurs/Câbles",
        "Hoses/Connector Pipes"
      ],
      "categoryIds": [
        103168,
        null,
        103197
      ],
      "finalCategoryId": 103197,
      "productId": 5134
    },
    {
      "path": [
        "Système pneumatique",
        "Connecteurs/Câbles",
        "Hoses/Connector Pipes"
      ],
      "categoryIds": [
        103168,
        null,
        103197
      ],
      "finalCategoryId": 103197,
      "productId": 368
    },
    {
      "path": [
        "Système pneumatique",
        "Connecteurs/Câbles",
        "Hoses/Connector Pipes"
      ],
      "categoryIds": [
        103168,
        null,
        103197
      ],
      "finalCategoryId": 103197,
      "productId": 639
    },
    {
      "path": [
        "Systèmes de confort",
        "Régulateur de vitesse",
        "Cruise Control"
      ],
      "categoryIds": [
        100335,
        null,
        100615
      ],
      "finalCategoryId": 100615,
      "productId": 2414
    }
  ],
  "productIdsInArbo": [
    368,
    373,
    639,
    2082,
    2414,
    3757,
    4526,
    4743,
    5134,
    5158,
    5164,
    6345,
    6346,
    6347,
    8169,
    9860,
    61004
  ],
  "closestProductIds": [
    {
      "productId": 368,
      "productName": "Tuyau spiralé"
    },
    {
      "productId": 373,
      "productName": "Connecteur, conduite d'air comprimé"
    },
    {
      "productId": 639,
      "productName": "Tuyauterie"
    },
    {
      "productId": 2082,
      "productName": "Flexible de frein, système d'air comprimé"
    },
    {
      "productId": 2414,
      "productName": "Connecteur ident., codification d'impulsions"
    }
  ]
}