{
  "productName": "Convertisseur de couple",
  "searchText": "Convertisseur de couple",
  "found": true,
  "hasMatch": true,
  "timestamp": "2025-12-02T20:24:57.342Z",
  "productId": 3068,
  "arborescence": {
    "Boîte de vitesses": {
      "categoryId": 100238,
      "categoryName": "Boîte de vitesses",
      "level": 1,
      "children": {
        "Boîte de vitesse automatique": {
          "categoryId": null,
          "categoryName": "Boîte de vitesse automatique",
          "level": 2,
          "children": {
            "Bague d’étanchéité, convertisseur de couple": {
              "categoryId": 100240,
              "categoryName": "Automatic Transmission",
              "level": 2,
              "children": {
                "Convertisseur de couple": {
                  "categoryId": null,
                  "categoryName": "Convertisseur de couple",
                  "level": 4,
                  "children": {
                    "Bague d’étanchéité, convertisseur de couple": {
                      "categoryId": 101814,
                      "categoryName": "Torque Converter",
                      "level": 3,
                      "children": [],
                      "productId": 8245
                    }
                  }
                }
              },
              "productId": 8245
            },
            "Bouchon fileté, convertisseur de couple": {
              "categoryId": 100240,
              "categoryName": "Automatic Transmission",
              "level": 2,
              "children": {
                "Convertisseur de couple": {
                  "categoryId": null,
                  "categoryName": "Convertisseur de couple",
                  "level": 4,
                  "children": {
                    "Bouchon fileté, convertisseur de couple": {
                      "categoryId": 101814,
                      "categoryName": "Torque Converter",
                      "level": 3,
                      "children": [],
                      "productId": 5878
                    }
                  }
                }
              },
              "productId": 5878
            },
            "Capuchon de protection, unité de bobine d’allumage": {
              "categoryId": 100240,
              "categoryName": "Automatic Transmission",
              "level": 2,
              "children": {
                "Convertisseur de couple": {
                  "categoryId": null,
                  "categoryName": "Convertisseur de couple",
                  "level": 4,
                  "children": {
                    "Capuchon de protection, unité de bobine d’allumage": {
                      "categoryId": 101814,
                      "categoryName": "Torque Converter",
                      "level": 3,
                      "children": [],
                      "productId": 8246
                    }
                  }
                }
              },
              "productId": 8246
            },
            "Convertisseur de couple": {
              "categoryId": 100240,
              "categoryName": "Automatic Transmission",
              "level": 2,
              "children": {
                "Convertisseur de couple": {
                  "categoryId": null,
                  "categoryName": "Convertisseur de couple",
                  "level": 4,
                  "children": {
                    "Convertisseur de couple": {
                      "categoryId": 101814,
                      "categoryName": "Torque Converter",
                      "level": 3,
                      "children": [],
                      "productId": 3068
                    }
                  }
                }
              },
              "productId": 3068
            },
            "Douille de réparation, convertisseur de couple": {
              "categoryId": 100240,
              "categoryName": "Automatic Transmission",
              "level": 2,
              "children": {
                "Convertisseur de couple": {
                  "categoryId": null,
                  "categoryName": "Convertisseur de couple",
                  "level": 4,
                  "children": {
                    "Douille de réparation, convertisseur de couple": {
                      "categoryId": 101814,
                      "categoryName": "Torque Converter",
                      "level": 3,
                      "children": [],
                      "productId": 8239
                    }
                  }
                },
                "Réparation/entretien": {
                  "categoryId": null,
                  "categoryName": "Réparation/entretien",
                  "level": 4,
                  "children": {
                    "Douille de réparation, convertisseur de couple": {
                      "categoryId": 101810,
                      "categoryName": "Repair/Maintenance",
                      "level": 3,
                      "children": [],
                      "productId": 8239
                    }
                  }
                }
              },
              "productId": 8239
            },
            "Roue libre, convertisseur de couple": {
              "categoryId": 100240,
              "categoryName": "Automatic Transmission",
              "level": 2,
              "children": {
                "Convertisseur de couple": {
                  "categoryId": null,
                  "categoryName": "Convertisseur de couple",
                  "level": 4,
                  "children": {
                    "Roue libre, convertisseur de couple": {
                      "categoryId": 101814,
                      "categoryName": "Torque Converter",
                      "level": 3,
                      "children": [],
                      "productId": 60491
                    }
                  }
                }
              },
              "productId": 60491
            }
          }
        }
      }
    }
  },
  "arborescenceText": "└── Boîte de vitesses [ID: 100238] (Niveau 1)\n    └── Boîte de vitesse automatique (Niveau 2)\n        ├── Automatic Transmission [ID: 100240] (Niveau 2) → ProductId: 8245\n        │   └── Convertisseur de couple (Niveau 4)\n        │       └── Torque Converter [ID: 101814] (Niveau 3) → ProductId: 8245\n        ├── Automatic Transmission [ID: 100240] (Niveau 2) → ProductId: 5878\n        │   └── Convertisseur de couple (Niveau 4)\n        │       └── Torque Converter [ID: 101814] (Niveau 3) → ProductId: 5878\n        ├── Automatic Transmission [ID: 100240] (Niveau 2) → ProductId: 8246\n        │   └── Convertisseur de couple (Niveau 4)\n        │       └── Torque Converter [ID: 101814] (Niveau 3) → ProductId: 8246\n        ├── Automatic Transmission [ID: 100240] (Niveau 2) → ProductId: 3068\n        │   └── Convertisseur de couple (Niveau 4)\n        │       └── Torque Converter [ID: 101814] (Niveau 3) → ProductId: 3068\n        ├── Automatic Transmission [ID: 100240] (Niveau 2) → ProductId: 8239\n        │   ├── Convertisseur de couple (Niveau 4)\n        │   │   └── Torque Converter [ID: 101814] (Niveau 3) → ProductId: 8239\n        │   └── Réparation/entretien (Niveau 4)\n        │       └── Repair/Maintenance [ID: 101810] (Niveau 3) → ProductId: 8239\n        └── Automatic Transmission [ID: 100240] (Niveau 2) → ProductId: 60491\n            └── Convertisseur de couple (Niveau 4)\n                └── Torque Converter [ID: 101814] (Niveau 3) → ProductId: 60491",
  "arborescencePaths": [
    {
      "path": [
        "Boîte de vitesses",
        "Boîte de vitesse automatique",
        "Automatic Transmission"
      ],
      "categoryIds": [
        100238,
        null,
        100240
      ],
      "finalCategoryId": 100240,
      "productId": 8245
    },
    {
      "path": [
        "Boîte de vitesses",
        "Boîte de vitesse automatique",
        "Automatic Transmission"
      ],
      "categoryIds": [
        100238,
        null,
        100240
      ],
      "finalCategoryId": 100240,
      "productId": 5878
    },
    {
      "path": [
        "Boîte de vitesses",
        "Boîte de vitesse automatique",
        "Automatic Transmission"
      ],
      "categoryIds": [
        100238,
        null,
        100240
      ],
      "finalCategoryId": 100240,
      "productId": 8246
    },
    {
      "path": [
        "Boîte de vitesses",
        "Boîte de vitesse automatique",
        "Automatic Transmission"
      ],
      "categoryIds": [
        100238,
        null,
        100240
      ],
      "finalCategoryId": 100240,
      "productId": 3068
    },
    {
      "path": [
        "Boîte de vitesses",
        "Boîte de vitesse automatique",
        "Automatic Transmission"
      ],
      "categoryIds": [
        100238,
        null,
        100240
      ],
      "finalCategoryId": 100240,
      "productId": 8239
    },
    {
      "path": [
        "Boîte de vitesses",
        "Boîte de vitesse automatique",
        "Automatic Transmission"
      ],
      "categoryIds": [
        100238,
        null,
        100240
      ],
      "finalCategoryId": 100240,
      "productId": 60491
    }
  ],
  "productIdsInArbo": [
    3068,
    5878,
    8239,
    8245,
    8246,
    60491
  ],
  "matchedProductIds": [
    3068
  ]
}