{
  "productName": "Coussinet de palier, ressort à lames",
  "searchText": "Coussinet de palier, ressort à lames",
  "found": true,
  "hasMatch": true,
  "timestamp": "2025-12-02T20:26:12.883Z",
  "productId": 645,
  "arborescence": {
    "Carrosserie": {
      "categoryId": 100001,
      "categoryName": "Carrosserie",
      "level": 1,
      "children": {
        "Arrière de la voiture": {
          "categoryId": null,
          "categoryName": "Arrière de la voiture",
          "level": 2,
          "children": {
            "Coussinet de palier, ressort à lames pour capot": {
              "categoryId": 101705,
              "categoryName": "Vehicle Rear",
              "level": 2,
              "children": {
                "Capot avant / composants / insonorisation": {
                  "categoryId": null,
                  "categoryName": "Capot avant / composants / insonorisation",
                  "level": 4,
                  "children": {
                    "Coussinet de palier, ressort à lames pour capot": {
                      "categoryId": 101783,
                      "categoryName": "Bonnet/Parts/Noise Insulation",
                      "level": 3,
                      "children": [],
                      "productId": 5012
                    }
                  }
                }
              },
              "productId": 5012
            }
          }
        },
        "Avant du véhicule": {
          "categoryId": null,
          "categoryName": "Avant du véhicule",
          "level": 2,
          "children": {
            "Coussinet de palier, ressort à lames pour capot": {
              "categoryId": 101648,
              "categoryName": "Vehicle Front",
              "level": 2,
              "children": {
                "Capot avant / composants / insonorisation": {
                  "categoryId": null,
                  "categoryName": "Capot avant / composants / insonorisation",
                  "level": 4,
                  "children": {
                    "Coussinet de palier, ressort à lames pour capot": {
                      "categoryId": 101654,
                      "categoryName": "Bonnet/Parts/Noise Insulation",
                      "level": 3,
                      "children": [],
                      "productId": 5012
                    }
                  }
                }
              },
              "productId": 5012
            }
          }
        },
        "Trappes/capots/portes/toit coul./toit panoram./toit pliant": {
          "categoryId": null,
          "categoryName": "Trappes/capots/portes/toit coul./toit panoram./toit pliant",
          "level": 2,
          "children": {
            "Coussinet de palier, ressort à lames pour capot": {
              "categoryId": 100746,
              "categoryName": "Hatches/Bonnets/Doors/Sunroof/Panoramic Roof",
              "level": 2,
              "children": {
                "Capot avant / composants / insonorisation": {
                  "categoryId": null,
                  "categoryName": "Capot avant / composants / insonorisation",
                  "level": 4,
                  "children": {
                    "Coussinet de palier, ressort à lames pour capot": {
                      "categoryId": 100184,
                      "categoryName": "Bonnet/Parts/Noise Insulation",
                      "level": 3,
                      "children": [],
                      "productId": 5012
                    }
                  }
                }
              },
              "productId": 5012
            }
          }
        }
      }
    },
    "Suspension/Amortissement": {
      "categoryId": 100011,
      "categoryName": "Suspension/Amortissement",
      "level": 1,
      "children": {
        "Suspension sur ressorts à lames": {
          "categoryId": null,
          "categoryName": "Suspension sur ressorts à lames",
          "level": 2,
          "children": {
            "Coussinet de palier, ressort à lames": {
              "categoryId": 100810,
              "categoryName": "Leaf Spring Suspension",
              "level": 2,
              "children": [],
              "productId": 645
            }
          }
        }
      }
    }
  },
  "arborescenceText": "├── Carrosserie [ID: 100001] (Niveau 1)\n│   ├── Arrière de la voiture (Niveau 2)\n│   │   └── Vehicle Rear [ID: 101705] (Niveau 2) → ProductId: 5012\n│   │       └── Capot avant / composants / insonorisation (Niveau 4)\n│   │           └── Bonnet/Parts/Noise Insulation [ID: 101783] (Niveau 3) → ProductId: 5012\n│   ├── Avant du véhicule (Niveau 2)\n│   │   └── Vehicle Front [ID: 101648] (Niveau 2) → ProductId: 5012\n│   │       └── Capot avant / composants / insonorisation (Niveau 4)\n│   │           └── Bonnet/Parts/Noise Insulation [ID: 101654] (Niveau 3) → ProductId: 5012\n│   └── Trappes/capots/portes/toit coul./toit panoram./toit pliant (Niveau 2)\n│       └── Hatches/Bonnets/Doors/Sunroof/Panoramic Roof [ID: 100746] (Niveau 2) → ProductId: 5012\n│           └── Capot avant / composants / insonorisation (Niveau 4)\n│               └── Bonnet/Parts/Noise Insulation [ID: 100184] (Niveau 3) → ProductId: 5012\n\n└── Suspension/Amortissement [ID: 100011] (Niveau 1)\n    └── Suspension sur ressorts à lames (Niveau 2)\n        └── Leaf Spring Suspension [ID: 100810] (Niveau 2) → ProductId: 645",
  "arborescencePaths": [
    {
      "path": [
        "Carrosserie",
        "Arrière de la voiture",
        "Vehicle Rear"
      ],
      "categoryIds": [
        100001,
        null,
        101705
      ],
      "finalCategoryId": 101705,
      "productId": 5012
    },
    {
      "path": [
        "Carrosserie",
        "Avant du véhicule",
        "Vehicle Front"
      ],
      "categoryIds": [
        100001,
        null,
        101648
      ],
      "finalCategoryId": 101648,
      "productId": 5012
    },
    {
      "path": [
        "Carrosserie",
        "Trappes/capots/portes/toit coul./toit panoram./toit pliant",
        "Hatches/Bonnets/Doors/Sunroof/Panoramic Roof"
      ],
      "categoryIds": [
        100001,
        null,
        100746
      ],
      "finalCategoryId": 100746,
      "productId": 5012
    },
    {
      "path": [
        "Suspension/Amortissement",
        "Suspension sur ressorts à lames",
        "Leaf Spring Suspension"
      ],
      "categoryIds": [
        100011,
        null,
        100810
      ],
      "finalCategoryId": 100810,
      "productId": 645
    }
  ],
  "productIdsInArbo": [
    645,
    5012
  ],
  "matchedProductIds": [
    645
  ]
}