{
  "productName": "Coussinet de palier",
  "searchText": "Coussinet de palier",
  "found": true,
  "hasMatch": false,
  "timestamp": "2025-12-02T20:26:03.513Z",
  "productId": 3288,
  "arborescence": {
    "Carrosserie": {
      "categoryId": 100001,
      "categoryName": "Carrosserie",
      "level": 1,
      "children": {
        "Arrière de la voiture": {
          "categoryId": null,
          "categoryName": "Arrière de la voiture",
          "level": 2,
          "children": {
            "Coussinet de palier, ressort à lames pour capot": {
              "categoryId": 101705,
              "categoryName": "Vehicle Rear",
              "level": 2,
              "children": {
                "Capot avant / composants / insonorisation": {
                  "categoryId": null,
                  "categoryName": "Capot avant / composants / insonorisation",
                  "level": 4,
                  "children": {
                    "Coussinet de palier, ressort à lames pour capot": {
                      "categoryId": 101783,
                      "categoryName": "Bonnet/Parts/Noise Insulation",
                      "level": 3,
                      "children": [],
                      "productId": 5012
                    }
                  }
                }
              },
              "productId": 5012
            }
          }
        },
        "Avant du véhicule": {
          "categoryId": null,
          "categoryName": "Avant du véhicule",
          "level": 2,
          "children": {
            "Coussinet de palier, ressort à lames pour capot": {
              "categoryId": 101648,
              "categoryName": "Vehicle Front",
              "level": 2,
              "children": {
                "Capot avant / composants / insonorisation": {
                  "categoryId": null,
                  "categoryName": "Capot avant / composants / insonorisation",
                  "level": 4,
                  "children": {
                    "Coussinet de palier, ressort à lames pour capot": {
                      "categoryId": 101654,
                      "categoryName": "Bonnet/Parts/Noise Insulation",
                      "level": 3,
                      "children": [],
                      "productId": 5012
                    }
                  }
                }
              },
              "productId": 5012
            }
          }
        },
        "Trappes/capots/portes/toit coul./toit panoram./toit pliant": {
          "categoryId": null,
          "categoryName": "Trappes/capots/portes/toit coul./toit panoram./toit pliant",
          "level": 2,
          "children": {
            "Coussinet de palier, ressort à lames pour capot": {
              "categoryId": 100746,
              "categoryName": "Hatches/Bonnets/Doors/Sunroof/Panoramic Roof",
              "level": 2,
              "children": {
                "Capot avant / composants / insonorisation": {
                  "categoryId": null,
                  "categoryName": "Capot avant / composants / insonorisation",
                  "level": 4,
                  "children": {
                    "Coussinet de palier, ressort à lames pour capot": {
                      "categoryId": 100184,
                      "categoryName": "Bonnet/Parts/Noise Insulation",
                      "level": 3,
                      "children": [],
                      "productId": 5012
                    }
                  }
                }
              },
              "productId": 5012
            }
          }
        }
      }
    },
    "Moteur": {
      "categoryId": 100002,
      "categoryName": "Moteur",
      "level": 1,
      "children": {
        "Lubrification": {
          "categoryId": null,
          "categoryName": "Lubrification",
          "level": 2,
          "children": {
            "Coussinet de palier, pompe à huile": {
              "categoryId": 100245,
              "categoryName": "Lubrication",
              "level": 2,
              "children": {
                "Pompe à huile et pièces de montage": {
                  "categoryId": null,
                  "categoryName": "Pompe à huile et pièces de montage",
                  "level": 4,
                  "children": {
                    "Coussinet de palier, pompe à huile": {
                      "categoryId": 100476,
                      "categoryName": "Oil Pump/Attachment Parts",
                      "level": 3,
                      "children": {
                        "Pompe à huile": {
                          "categoryId": null,
                          "categoryName": "Pompe à huile",
                          "level": 6,
                          "children": {
                            "Coussinet de palier, pompe à huile": {
                              "categoryId": 100492,
                              "categoryName": "Oil Pump",
                              "level": 4,
                              "children": [],
                              "productId": 4065
                            }
                          }
                        }
                      },
                      "productId": 4065
                    }
                  }
                }
              },
              "productId": 4065
            }
          }
        },
        "Système bielle-manivelle": {
          "categoryId": null,
          "categoryName": "Système bielle-manivelle",
          "level": 2,
          "children": {
            "Coussinet de bielle": {
              "categoryId": 100515,
              "categoryName": "Crankshaft Drive",
              "level": 2,
              "children": {
                "Bielle": {
                  "categoryId": null,
                  "categoryName": "Bielle",
                  "level": 4,
                  "children": {
                    "Coussinet de bielle": {
                      "categoryId": 100519,
                      "categoryName": "Connecting Rod",
                      "level": 3,
                      "children": {
                        "Coussinet de bielle": {
                          "categoryId": null,
                          "categoryName": "Coussinet de bielle",
                          "level": 6,
                          "children": {
                            "Coussinet de bielle": {
                              "categoryId": 100525,
                              "categoryName": "Connecting Rod Bearing",
                              "level": 4,
                              "children": [],
                              "productId": 582
                            }
                          }
                        }
                      },
                      "productId": 582
                    }
                  }
                }
              },
              "productId": 582
            },
            "Coussinet de palier, bielle": {
              "categoryId": 100515,
              "categoryName": "Crankshaft Drive",
              "level": 2,
              "children": {
                "Bielle": {
                  "categoryId": null,
                  "categoryName": "Bielle",
                  "level": 4,
                  "children": {
                    "Coussinet de palier, bielle": {
                      "categoryId": 100519,
                      "categoryName": "Connecting Rod",
                      "level": 3,
                      "children": {
                        "Coussinets de bielle": {
                          "categoryId": null,
                          "categoryName": "Coussinets de bielle",
                          "level": 6,
                          "children": {
                            "Coussinet de palier, bielle": {
                              "categoryId": 100527,
                              "categoryName": "Small End Bushes",
                              "level": 4,
                              "children": [],
                              "productId": 584
                            }
                          }
                        }
                      },
                      "productId": 584
                    }
                  }
                }
              },
              "productId": 584
            },
            "Coussinet de vilebrequin": {
              "categoryId": 100515,
              "categoryName": "Crankshaft Drive",
              "level": 2,
              "children": {
                "Vilebrequin": {
                  "categoryId": null,
                  "categoryName": "Vilebrequin",
                  "level": 4,
                  "children": {
                    "Coussinet de vilebrequin": {
                      "categoryId": 100517,
                      "categoryName": "Crankshaft",
                      "level": 3,
                      "children": {
                        "Coussinet de vilebrequin": {
                          "categoryId": null,
                          "categoryName": "Coussinet de vilebrequin",
                          "level": 6,
                          "children": {
                            "Coussinet de vilebrequin": {
                              "categoryId": 100522,
                              "categoryName": "Crankshaft Bearing",
                              "level": 4,
                              "children": [],
                              "productId": 574
                            }
                          }
                        }
                      },
                      "productId": 574
                    }
                  }
                }
              },
              "productId": 574
            }
          }
        }
      }
    },
    "Suspension d'essieu/Guidage des roues/Roues": {
      "categoryId": 100013,
      "categoryName": "Suspension d'essieu/Guidage des roues/Roues",
      "level": 1,
      "children": {
        "Pièce de stabilisateur / pièces de fixation": {
          "categoryId": null,
          "categoryName": "Pièce de stabilisateur / pièces de fixation",
          "level": 2,
          "children": {
            "Coussinet de palier, stabilisateur": {
              "categoryId": 100210,
              "categoryName": "Stabiliser Bar/Fastening Parts",
              "level": 2,
              "children": {
                "Pièces de fixation": {
                  "categoryId": null,
                  "categoryName": "Pièces de fixation",
                  "level": 4,
                  "children": {
                    "Coussinet de palier, stabilisateur": {
                      "categoryId": 100596,
                      "categoryName": "Fasteners",
                      "level": 3,
                      "children": [],
                      "productId": 331
                    }
                  }
                }
              },
              "productId": 331
            }
          }
        }
      }
    },
    "Suspension/Amortissement": {
      "categoryId": 100011,
      "categoryName": "Suspension/Amortissement",
      "level": 1,
      "children": {
        "Suspension pneumatique": {
          "categoryId": null,
          "categoryName": "Suspension pneumatique",
          "level": 2,
          "children": {
            "Coussinet de palier, porte-soufflet à aire": {
              "categoryId": 101884,
              "categoryName": "Air Suspension",
              "level": 2,
              "children": [],
              "productId": 5932
            }
          }
        },
        "Suspension sur ressorts à lames": {
          "categoryId": null,
          "categoryName": "Suspension sur ressorts à lames",
          "level": 2,
          "children": {
            "Coussinet de palier, jumelle de ressort,-/main de ressort": {
              "categoryId": 100810,
              "categoryName": "Leaf Spring Suspension",
              "level": 2,
              "children": [],
              "productId": 3177
            },
            "Coussinet de palier, ressort à lames": {
              "categoryId": 100810,
              "categoryName": "Leaf Spring Suspension",
              "level": 2,
              "children": [],
              "productId": 645
            }
          }
        }
      }
    }
  },
  "arborescenceText": "├── Carrosserie [ID: 100001] (Niveau 1)\n│   ├── Arrière de la voiture (Niveau 2)\n│   │   └── Vehicle Rear [ID: 101705] (Niveau 2) → ProductId: 5012\n│   │       └── Capot avant / composants / insonorisation (Niveau 4)\n│   │           └── Bonnet/Parts/Noise Insulation [ID: 101783] (Niveau 3) → ProductId: 5012\n│   ├── Avant du véhicule (Niveau 2)\n│   │   └── Vehicle Front [ID: 101648] (Niveau 2) → ProductId: 5012\n│   │       └── Capot avant / composants / insonorisation (Niveau 4)\n│   │           └── Bonnet/Parts/Noise Insulation [ID: 101654] (Niveau 3) → ProductId: 5012\n│   └── Trappes/capots/portes/toit coul./toit panoram./toit pliant (Niveau 2)\n│       └── Hatches/Bonnets/Doors/Sunroof/Panoramic Roof [ID: 100746] (Niveau 2) → ProductId: 5012\n│           └── Capot avant / composants / insonorisation (Niveau 4)\n│               └── Bonnet/Parts/Noise Insulation [ID: 100184] (Niveau 3) → ProductId: 5012\n\n├── Moteur [ID: 100002] (Niveau 1)\n│   ├── Lubrification (Niveau 2)\n│   │   └── Lubrication [ID: 100245] (Niveau 2) → ProductId: 4065\n│   │       └── Pompe à huile et pièces de montage (Niveau 4)\n│   │           └── Oil Pump/Attachment Parts [ID: 100476] (Niveau 3) → ProductId: 4065\n│   │               └── Pompe à huile (Niveau 6)\n│   │                   └── Oil Pump [ID: 100492] (Niveau 4) → ProductId: 4065\n│   └── Système bielle-manivelle (Niveau 2)\n│       ├── Crankshaft Drive [ID: 100515] (Niveau 2) → ProductId: 582\n│       │   └── Bielle (Niveau 4)\n│       │       └── Connecting Rod [ID: 100519] (Niveau 3) → ProductId: 582\n│       │           └── Coussinet de bielle (Niveau 6)\n│       │               └── Connecting Rod Bearing [ID: 100525] (Niveau 4) → ProductId: 582\n│       ├── Crankshaft Drive [ID: 100515] (Niveau 2) → ProductId: 584\n│       │   └── Bielle (Niveau 4)\n│       │       └── Connecting Rod [ID: 100519] (Niveau 3) → ProductId: 584\n│       │           └── Coussinets de bielle (Niveau 6)\n│       │               └── Small End Bushes [ID: 100527] (Niveau 4) → ProductId: 584\n│       └── Crankshaft Drive [ID: 100515] (Niveau 2) → ProductId: 574\n│           └── Vilebrequin (Niveau 4)\n│               └── Crankshaft [ID: 100517] (Niveau 3) → ProductId: 574\n│                   └── Coussinet de vilebrequin (Niveau 6)\n│                       └── Crankshaft Bearing [ID: 100522] (Niveau 4) → ProductId: 574\n\n├── Suspension d'essieu/Guidage des roues/Roues [ID: 100013] (Niveau 1)\n│   └── Pièce de stabilisateur / pièces de fixation (Niveau 2)\n│       └── Stabiliser Bar/Fastening Parts [ID: 100210] (Niveau 2) → ProductId: 331\n│           └── Pièces de fixation (Niveau 4)\n│               └── Fasteners [ID: 100596] (Niveau 3) → ProductId: 331\n\n└── Suspension/Amortissement [ID: 100011] (Niveau 1)\n    ├── Suspension pneumatique (Niveau 2)\n    │   └── Air Suspension [ID: 101884] (Niveau 2) → ProductId: 5932\n    └── Suspension sur ressorts à lames (Niveau 2)\n        ├── Leaf Spring Suspension [ID: 100810] (Niveau 2) → ProductId: 3177\n        └── Leaf Spring Suspension [ID: 100810] (Niveau 2) → ProductId: 645",
  "arborescencePaths": [
    {
      "path": [
        "Carrosserie",
        "Arrière de la voiture",
        "Vehicle Rear"
      ],
      "categoryIds": [
        100001,
        null,
        101705
      ],
      "finalCategoryId": 101705,
      "productId": 5012
    },
    {
      "path": [
        "Carrosserie",
        "Avant du véhicule",
        "Vehicle Front"
      ],
      "categoryIds": [
        100001,
        null,
        101648
      ],
      "finalCategoryId": 101648,
      "productId": 5012
    },
    {
      "path": [
        "Carrosserie",
        "Trappes/capots/portes/toit coul./toit panoram./toit pliant",
        "Hatches/Bonnets/Doors/Sunroof/Panoramic Roof"
      ],
      "categoryIds": [
        100001,
        null,
        100746
      ],
      "finalCategoryId": 100746,
      "productId": 5012
    },
    {
      "path": [
        "Moteur",
        "Lubrification",
        "Lubrication"
      ],
      "categoryIds": [
        100002,
        null,
        100245
      ],
      "finalCategoryId": 100245,
      "productId": 4065
    },
    {
      "path": [
        "Moteur",
        "Système bielle-manivelle",
        "Crankshaft Drive"
      ],
      "categoryIds": [
        100002,
        null,
        100515
      ],
      "finalCategoryId": 100515,
      "productId": 582
    },
    {
      "path": [
        "Moteur",
        "Système bielle-manivelle",
        "Crankshaft Drive"
      ],
      "categoryIds": [
        100002,
        null,
        100515
      ],
      "finalCategoryId": 100515,
      "productId": 584
    },
    {
      "path": [
        "Moteur",
        "Système bielle-manivelle",
        "Crankshaft Drive"
      ],
      "categoryIds": [
        100002,
        null,
        100515
      ],
      "finalCategoryId": 100515,
      "productId": 574
    },
    {
      "path": [
        "Suspension d'essieu/Guidage des roues/Roues",
        "Pièce de stabilisateur / pièces de fixation",
        "Stabiliser Bar/Fastening Parts"
      ],
      "categoryIds": [
        100013,
        null,
        100210
      ],
      "finalCategoryId": 100210,
      "productId": 331
    },
    {
      "path": [
        "Suspension/Amortissement",
        "Suspension pneumatique",
        "Air Suspension"
      ],
      "categoryIds": [
        100011,
        null,
        101884
      ],
      "finalCategoryId": 101884,
      "productId": 5932
    },
    {
      "path": [
        "Suspension/Amortissement",
        "Suspension sur ressorts à lames",
        "Leaf Spring Suspension"
      ],
      "categoryIds": [
        100011,
        null,
        100810
      ],
      "finalCategoryId": 100810,
      "productId": 3177
    },
    {
      "path": [
        "Suspension/Amortissement",
        "Suspension sur ressorts à lames",
        "Leaf Spring Suspension"
      ],
      "categoryIds": [
        100011,
        null,
        100810
      ],
      "finalCategoryId": 100810,
      "productId": 645
    }
  ],
  "productIdsInArbo": [
    331,
    574,
    582,
    584,
    645,
    3177,
    4065,
    5012,
    5932
  ],
  "closestProductIds": [
    {
      "productId": 331,
      "productName": "Coussinet de palier, stabilisateur"
    },
    {
      "productId": 574,
      "productName": "Coussinet de vilebrequin"
    },
    {
      "productId": 582,
      "productName": "Coussinet de bielle"
    },
    {
      "productId": 584,
      "productName": "Coussinet de palier, bielle"
    },
    {
      "productId": 645,
      "productName": "Coussinet de palier, ressort à lames"
    }
  ]
}