{
  "productName": "Couvercle de culasse",
  "searchText": "Couvercle de culasse",
  "found": true,
  "hasMatch": true,
  "timestamp": "2025-12-02T20:26:52.726Z",
  "productId": 977,
  "arborescence": {
    "Moteur": {
      "categoryId": 100002,
      "categoryName": "Moteur",
      "level": 1,
      "children": {
        "Culasse / pieces de montage": {
          "categoryId": null,
          "categoryName": "Culasse / pieces de montage",
          "level": 2,
          "children": {
            "Bague d'étanchéité (couvre-culasse)": {
              "categoryId": 100373,
              "categoryName": "Cylinder Head/Attachment Parts",
              "level": 2,
              "children": {
                "Cache-soupape": {
                  "categoryId": null,
                  "categoryName": "Cache-soupape",
                  "level": 4,
                  "children": {
                    "Bague d'étanchéité (couvre-culasse)": {
                      "categoryId": 100375,
                      "categoryName": "Cylinder Head Cover/-Gasket",
                      "level": 3,
                      "children": [],
                      "productId": 60790
                    }
                  }
                }
              },
              "productId": 60790
            },
            "Bague d'étanchéité, compartiment du gicleur": {
              "categoryId": 100373,
              "categoryName": "Cylinder Head/Attachment Parts",
              "level": 2,
              "children": {
                "Cache-soupape": {
                  "categoryId": null,
                  "categoryName": "Cache-soupape",
                  "level": 4,
                  "children": {
                    "Bague d'étanchéité, compartiment du gicleur": {
                      "categoryId": 100375,
                      "categoryName": "Cylinder Head Cover/-Gasket",
                      "level": 3,
                      "children": [],
                      "productId": 4316
                    }
                  }
                }
              },
              "productId": 4316
            },
            "Bague d'étanchéité, puit de bougie": {
              "categoryId": 100373,
              "categoryName": "Cylinder Head/Attachment Parts",
              "level": 2,
              "children": {
                "Cache-soupape": {
                  "categoryId": null,
                  "categoryName": "Cache-soupape",
                  "level": 4,
                  "children": {
                    "Bague d'étanchéité, puit de bougie": {
                      "categoryId": 100375,
                      "categoryName": "Cylinder Head Cover/-Gasket",
                      "level": 3,
                      "children": [],
                      "productId": 4317
                    }
                  }
                }
              },
              "productId": 4317
            },
            "Bague d'étanchéité, puits de bougie de préchauffage": {
              "categoryId": 100373,
              "categoryName": "Cylinder Head/Attachment Parts",
              "level": 2,
              "children": {
                "Cache-soupape": {
                  "categoryId": null,
                  "categoryName": "Cache-soupape",
                  "level": 4,
                  "children": {
                    "Bague d'étanchéité, puits de bougie de préchauffage": {
                      "categoryId": 100375,
                      "categoryName": "Cylinder Head Cover/-Gasket",
                      "level": 3,
                      "children": [],
                      "productId": 60857
                    }
                  }
                }
              },
              "productId": 60857
            },
            "Couvercle de culasse": {
              "categoryId": 100373,
              "categoryName": "Cylinder Head/Attachment Parts",
              "level": 2,
              "children": {
                "Cache-soupape": {
                  "categoryId": null,
                  "categoryName": "Cache-soupape",
                  "level": 4,
                  "children": {
                    "Couvercle de culasse": {
                      "categoryId": 100375,
                      "categoryName": "Cylinder Head Cover/-Gasket",
                      "level": 3,
                      "children": [],
                      "productId": 977
                    }
                  }
                }
              },
              "productId": 977
            },
            "Douille, couvre-culasse": {
              "categoryId": 100373,
              "categoryName": "Cylinder Head/Attachment Parts",
              "level": 2,
              "children": {
                "Cache-soupape": {
                  "categoryId": null,
                  "categoryName": "Cache-soupape",
                  "level": 4,
                  "children": {
                    "Douille, couvre-culasse": {
                      "categoryId": 100375,
                      "categoryName": "Cylinder Head Cover/-Gasket",
                      "level": 3,
                      "children": [],
                      "productId": 3977
                    }
                  }
                }
              },
              "productId": 3977
            },
            "Flexible, aération de la housse de culasse": {
              "categoryId": 100373,
              "categoryName": "Cylinder Head/Attachment Parts",
              "level": 2,
              "children": {
                "Cache-soupape": {
                  "categoryId": null,
                  "categoryName": "Cache-soupape",
                  "level": 4,
                  "children": {
                    "Flexible, aération de la housse de culasse": {
                      "categoryId": 100375,
                      "categoryName": "Cylinder Head Cover/-Gasket",
                      "level": 3,
                      "children": [],
                      "productId": 3402
                    }
                  }
                }
              },
              "productId": 3402
            },
            "Jeu de joints d'étanchéité, couvercle de culasse": {
              "categoryId": 100373,
              "categoryName": "Cylinder Head/Attachment Parts",
              "level": 2,
              "children": {
                "Cache-soupape": {
                  "categoryId": null,
                  "categoryName": "Cache-soupape",
                  "level": 4,
                  "children": {
                    "Jeu de joints d'étanchéité, couvercle de culasse": {
                      "categoryId": 100375,
                      "categoryName": "Cylinder Head Cover/-Gasket",
                      "level": 3,
                      "children": [],
                      "productId": 979
                    }
                  }
                }
              },
              "productId": 979
            },
            "Joint d'étanchéité, vis de couvercle de culasse": {
              "categoryId": 100373,
              "categoryName": "Cylinder Head/Attachment Parts",
              "level": 2,
              "children": {
                "Cache-soupape": {
                  "categoryId": null,
                  "categoryName": "Cache-soupape",
                  "level": 4,
                  "children": {
                    "Joint d'étanchéité, vis de couvercle de culasse": {
                      "categoryId": 100375,
                      "categoryName": "Cylinder Head Cover/-Gasket",
                      "level": 3,
                      "children": [],
                      "productId": 1102
                    }
                  }
                }
              },
              "productId": 1102
            },
            "Joint de cache culbuteurs": {
              "categoryId": 100373,
              "categoryName": "Cylinder Head/Attachment Parts",
              "level": 2,
              "children": {
                "Cache-soupape": {
                  "categoryId": null,
                  "categoryName": "Cache-soupape",
                  "level": 4,
                  "children": {
                    "Joint de cache culbuteurs": {
                      "categoryId": 100375,
                      "categoryName": "Cylinder Head Cover/-Gasket",
                      "level": 3,
                      "children": [],
                      "productId": 321
                    }
                  }
                }
              },
              "productId": 321
            },
            "Joint, compartiment gicleur": {
              "categoryId": 100373,
              "categoryName": "Cylinder Head/Attachment Parts",
              "level": 2,
              "children": {
                "Cache-soupape": {
                  "categoryId": null,
                  "categoryName": "Cache-soupape",
                  "level": 4,
                  "children": {
                    "Joint, compartiment gicleur": {
                      "categoryId": 100375,
                      "categoryName": "Cylinder Head Cover/-Gasket",
                      "level": 3,
                      "children": [],
                      "productId": 4315
                    }
                  }
                }
              },
              "productId": 4315
            },
            "Kit de vis, couvre-culasse": {
              "categoryId": 100373,
              "categoryName": "Cylinder Head/Attachment Parts",
              "level": 2,
              "children": {
                "Cache-soupape": {
                  "categoryId": null,
                  "categoryName": "Cache-soupape",
                  "level": 4,
                  "children": {
                    "Kit de vis, couvre-culasse": {
                      "categoryId": 100375,
                      "categoryName": "Cylinder Head Cover/-Gasket",
                      "level": 3,
                      "children": [],
                      "productId": 4872
                    }
                  }
                }
              },
              "productId": 4872
            },
            "Pièce de serrage, couvercle de culasse": {
              "categoryId": 100373,
              "categoryName": "Cylinder Head/Attachment Parts",
              "level": 2,
              "children": {
                "Cache-soupape": {
                  "categoryId": null,
                  "categoryName": "Cache-soupape",
                  "level": 4,
                  "children": {
                    "Pièce de serrage, couvercle de culasse": {
                      "categoryId": 100375,
                      "categoryName": "Cylinder Head Cover/-Gasket",
                      "level": 3,
                      "children": [],
                      "productId": 60087
                    }
                  }
                }
              },
              "productId": 60087
            },
            "Support de fixation, couvercle de culasse": {
              "categoryId": 100373,
              "categoryName": "Cylinder Head/Attachment Parts",
              "level": 2,
              "children": {
                "Cache-soupape": {
                  "categoryId": null,
                  "categoryName": "Cache-soupape",
                  "level": 4,
                  "children": {
                    "Support de fixation, couvercle de culasse": {
                      "categoryId": 100375,
                      "categoryName": "Cylinder Head Cover/-Gasket",
                      "level": 3,
                      "children": [],
                      "productId": 5647
                    }
                  }
                }
              },
              "productId": 5647
            },
            "Vis, couvercle de culasse": {
              "categoryId": 100373,
              "categoryName": "Cylinder Head/Attachment Parts",
              "level": 2,
              "children": {
                "Cache-soupape": {
                  "categoryId": null,
                  "categoryName": "Cache-soupape",
                  "level": 4,
                  "children": {
                    "Vis, couvercle de culasse": {
                      "categoryId": 100375,
                      "categoryName": "Cylinder Head Cover/-Gasket",
                      "level": 3,
                      "children": [],
                      "productId": 1639
                    }
                  }
                }
              },
              "productId": 1639
            }
          }
        },
        "Distribution moteur": {
          "categoryId": null,
          "categoryName": "Distribution moteur",
          "level": 2,
          "children": {
            "Couvercle de culasse": {
              "categoryId": 100003,
              "categoryName": "Engine Timing",
              "level": 2,
              "children": {
                "Soupape / réglage de soupape": {
                  "categoryId": null,
                  "categoryName": "Soupape / réglage de soupape",
                  "level": 4,
                  "children": {
                    "Couvercle de culasse": {
                      "categoryId": 100422,
                      "categoryName": "Valve Train",
                      "level": 3,
                      "children": {
                        "Soupapes / accessoires": {
                          "categoryId": null,
                          "categoryName": "Soupapes / accessoires",
                          "level": 6,
                          "children": {
                            "Couvercle de culasse": {
                              "categoryId": 100423,
                              "categoryName": "Valves/Parts",
                              "level": 4,
                              "children": [],
                              "productId": 3976
                            }
                          }
                        }
                      },
                      "productId": 3976
                    }
                  }
                }
              },
              "productId": 3976
            }
          }
        },
        "Joints": {
          "categoryId": null,
          "categoryName": "Joints",
          "level": 2,
          "children": {
            "Jeu de joints d'étanchéité, couvercle de culasse": {
              "categoryId": 100223,
              "categoryName": "Gaskets",
              "level": 2,
              "children": {
                "Cache-soupape": {
                  "categoryId": null,
                  "categoryName": "Cache-soupape",
                  "level": 4,
                  "children": {
                    "Jeu de joints d'étanchéité, couvercle de culasse": {
                      "categoryId": 100227,
                      "categoryName": "Valve Cover Gasket",
                      "level": 3,
                      "children": [],
                      "productId": 979
                    }
                  }
                }
              },
              "productId": 979
            },
            "Joint d'étanchéité, vis de couvercle de culasse": {
              "categoryId": 100223,
              "categoryName": "Gaskets",
              "level": 2,
              "children": {
                "Cache-soupape": {
                  "categoryId": null,
                  "categoryName": "Cache-soupape",
                  "level": 4,
                  "children": {
                    "Joint d'étanchéité, vis de couvercle de culasse": {
                      "categoryId": 100227,
                      "categoryName": "Valve Cover Gasket",
                      "level": 3,
                      "children": [],
                      "productId": 1102
                    }
                  }
                }
              },
              "productId": 1102
            },
            "Joint de cache culbuteurs": {
              "categoryId": 100223,
              "categoryName": "Gaskets",
              "level": 2,
              "children": {
                "Cache-soupape": {
                  "categoryId": null,
                  "categoryName": "Cache-soupape",
                  "level": 4,
                  "children": {
                    "Joint de cache culbuteurs": {
                      "categoryId": 100227,
                      "categoryName": "Valve Cover Gasket",
                      "level": 3,
                      "children": [],
                      "productId": 321
                    }
                  }
                }
              },
              "productId": 321
            }
          }
        }
      }
    },
    "Suspension/Amortissement": {
      "categoryId": 100011,
      "categoryName": "Suspension/Amortissement",
      "level": 1,
      "children": {
        "Suspension pneumatique": {
          "categoryId": null,
          "categoryName": "Suspension pneumatique",
          "level": 2,
          "children": {
            "Joint de couvercle de culasse, compresseur d’air comprimé": {
              "categoryId": 101884,
              "categoryName": "Air Suspension",
              "level": 2,
              "children": [],
              "productId": 60538
            }
          }
        }
      }
    }
  },
  "arborescenceText": "├── Moteur [ID: 100002] (Niveau 1)\n│   ├── Culasse / pieces de montage (Niveau 2)\n│   │   ├── Cylinder Head/Attachment Parts [ID: 100373] (Niveau 2) → ProductId: 60790\n│   │   │   └── Cache-soupape (Niveau 4)\n│   │   │       └── Cylinder Head Cover/-Gasket [ID: 100375] (Niveau 3) → ProductId: 60790\n│   │   ├── Cylinder Head/Attachment Parts [ID: 100373] (Niveau 2) → ProductId: 4316\n│   │   │   └── Cache-soupape (Niveau 4)\n│   │   │       └── Cylinder Head Cover/-Gasket [ID: 100375] (Niveau 3) → ProductId: 4316\n│   │   ├── Cylinder Head/Attachment Parts [ID: 100373] (Niveau 2) → ProductId: 4317\n│   │   │   └── Cache-soupape (Niveau 4)\n│   │   │       └── Cylinder Head Cover/-Gasket [ID: 100375] (Niveau 3) → ProductId: 4317\n│   │   ├── Cylinder Head/Attachment Parts [ID: 100373] (Niveau 2) → ProductId: 60857\n│   │   │   └── Cache-soupape (Niveau 4)\n│   │   │       └── Cylinder Head Cover/-Gasket [ID: 100375] (Niveau 3) → ProductId: 60857\n│   │   ├── Cylinder Head/Attachment Parts [ID: 100373] (Niveau 2) → ProductId: 977\n│   │   │   └── Cache-soupape (Niveau 4)\n│   │   │       └── Cylinder Head Cover/-Gasket [ID: 100375] (Niveau 3) → ProductId: 977\n│   │   ├── Cylinder Head/Attachment Parts [ID: 100373] (Niveau 2) → ProductId: 3977\n│   │   │   └── Cache-soupape (Niveau 4)\n│   │   │       └── Cylinder Head Cover/-Gasket [ID: 100375] (Niveau 3) → ProductId: 3977\n│   │   ├── Cylinder Head/Attachment Parts [ID: 100373] (Niveau 2) → ProductId: 3402\n│   │   │   └── Cache-soupape (Niveau 4)\n│   │   │       └── Cylinder Head Cover/-Gasket [ID: 100375] (Niveau 3) → ProductId: 3402\n│   │   ├── Cylinder Head/Attachment Parts [ID: 100373] (Niveau 2) → ProductId: 979\n│   │   │   └── Cache-soupape (Niveau 4)\n│   │   │       └── Cylinder Head Cover/-Gasket [ID: 100375] (Niveau 3) → ProductId: 979\n│   │   ├── Cylinder Head/Attachment Parts [ID: 100373] (Niveau 2) → ProductId: 1102\n│   │   │   └── Cache-soupape (Niveau 4)\n│   │   │       └── Cylinder Head Cover/-Gasket [ID: 100375] (Niveau 3) → ProductId: 1102\n│   │   ├── Cylinder Head/Attachment Parts [ID: 100373] (Niveau 2) → ProductId: 321\n│   │   │   └── Cache-soupape (Niveau 4)\n│   │   │       └── Cylinder Head Cover/-Gasket [ID: 100375] (Niveau 3) → ProductId: 321\n│   │   ├── Cylinder Head/Attachment Parts [ID: 100373] (Niveau 2) → ProductId: 4315\n│   │   │   └── Cache-soupape (Niveau 4)\n│   │   │       └── Cylinder Head Cover/-Gasket [ID: 100375] (Niveau 3) → ProductId: 4315\n│   │   ├── Cylinder Head/Attachment Parts [ID: 100373] (Niveau 2) → ProductId: 4872\n│   │   │   └── Cache-soupape (Niveau 4)\n│   │   │       └── Cylinder Head Cover/-Gasket [ID: 100375] (Niveau 3) → ProductId: 4872\n│   │   ├── Cylinder Head/Attachment Parts [ID: 100373] (Niveau 2) → ProductId: 60087\n│   │   │   └── Cache-soupape (Niveau 4)\n│   │   │       └── Cylinder Head Cover/-Gasket [ID: 100375] (Niveau 3) → ProductId: 60087\n│   │   ├── Cylinder Head/Attachment Parts [ID: 100373] (Niveau 2) → ProductId: 5647\n│   │   │   └── Cache-soupape (Niveau 4)\n│   │   │       └── Cylinder Head Cover/-Gasket [ID: 100375] (Niveau 3) → ProductId: 5647\n│   │   └── Cylinder Head/Attachment Parts [ID: 100373] (Niveau 2) → ProductId: 1639\n│   │       └── Cache-soupape (Niveau 4)\n│   │           └── Cylinder Head Cover/-Gasket [ID: 100375] (Niveau 3) → ProductId: 1639\n│   ├── Distribution moteur (Niveau 2)\n│   │   └── Engine Timing [ID: 100003] (Niveau 2) → ProductId: 3976\n│   │       └── Soupape / réglage de soupape (Niveau 4)\n│   │           └── Valve Train [ID: 100422] (Niveau 3) → ProductId: 3976\n│   │               └── Soupapes / accessoires (Niveau 6)\n│   │                   └── Valves/Parts [ID: 100423] (Niveau 4) → ProductId: 3976\n│   └── Joints (Niveau 2)\n│       ├── Gaskets [ID: 100223] (Niveau 2) → ProductId: 979\n│       │   └── Cache-soupape (Niveau 4)\n│       │       └── Valve Cover Gasket [ID: 100227] (Niveau 3) → ProductId: 979\n│       ├── Gaskets [ID: 100223] (Niveau 2) → ProductId: 1102\n│       │   └── Cache-soupape (Niveau 4)\n│       │       └── Valve Cover Gasket [ID: 100227] (Niveau 3) → ProductId: 1102\n│       └── Gaskets [ID: 100223] (Niveau 2) → ProductId: 321\n│           └── Cache-soupape (Niveau 4)\n│               └── Valve Cover Gasket [ID: 100227] (Niveau 3) → ProductId: 321\n\n└── Suspension/Amortissement [ID: 100011] (Niveau 1)\n    └── Suspension pneumatique (Niveau 2)\n        └── Air Suspension [ID: 101884] (Niveau 2) → ProductId: 60538",
  "arborescencePaths": [
    {
      "path": [
        "Moteur",
        "Culasse / pieces de montage",
        "Cylinder Head/Attachment Parts"
      ],
      "categoryIds": [
        100002,
        null,
        100373
      ],
      "finalCategoryId": 100373,
      "productId": 60790
    },
    {
      "path": [
        "Moteur",
        "Culasse / pieces de montage",
        "Cylinder Head/Attachment Parts"
      ],
      "categoryIds": [
        100002,
        null,
        100373
      ],
      "finalCategoryId": 100373,
      "productId": 4316
    },
    {
      "path": [
        "Moteur",
        "Culasse / pieces de montage",
        "Cylinder Head/Attachment Parts"
      ],
      "categoryIds": [
        100002,
        null,
        100373
      ],
      "finalCategoryId": 100373,
      "productId": 4317
    },
    {
      "path": [
        "Moteur",
        "Culasse / pieces de montage",
        "Cylinder Head/Attachment Parts"
      ],
      "categoryIds": [
        100002,
        null,
        100373
      ],
      "finalCategoryId": 100373,
      "productId": 60857
    },
    {
      "path": [
        "Moteur",
        "Culasse / pieces de montage",
        "Cylinder Head/Attachment Parts"
      ],
      "categoryIds": [
        100002,
        null,
        100373
      ],
      "finalCategoryId": 100373,
      "productId": 977
    },
    {
      "path": [
        "Moteur",
        "Culasse / pieces de montage",
        "Cylinder Head/Attachment Parts"
      ],
      "categoryIds": [
        100002,
        null,
        100373
      ],
      "finalCategoryId": 100373,
      "productId": 3977
    },
    {
      "path": [
        "Moteur",
        "Culasse / pieces de montage",
        "Cylinder Head/Attachment Parts"
      ],
      "categoryIds": [
        100002,
        null,
        100373
      ],
      "finalCategoryId": 100373,
      "productId": 3402
    },
    {
      "path": [
        "Moteur",
        "Culasse / pieces de montage",
        "Cylinder Head/Attachment Parts"
      ],
      "categoryIds": [
        100002,
        null,
        100373
      ],
      "finalCategoryId": 100373,
      "productId": 979
    },
    {
      "path": [
        "Moteur",
        "Culasse / pieces de montage",
        "Cylinder Head/Attachment Parts"
      ],
      "categoryIds": [
        100002,
        null,
        100373
      ],
      "finalCategoryId": 100373,
      "productId": 1102
    },
    {
      "path": [
        "Moteur",
        "Culasse / pieces de montage",
        "Cylinder Head/Attachment Parts"
      ],
      "categoryIds": [
        100002,
        null,
        100373
      ],
      "finalCategoryId": 100373,
      "productId": 321
    },
    {
      "path": [
        "Moteur",
        "Culasse / pieces de montage",
        "Cylinder Head/Attachment Parts"
      ],
      "categoryIds": [
        100002,
        null,
        100373
      ],
      "finalCategoryId": 100373,
      "productId": 4315
    },
    {
      "path": [
        "Moteur",
        "Culasse / pieces de montage",
        "Cylinder Head/Attachment Parts"
      ],
      "categoryIds": [
        100002,
        null,
        100373
      ],
      "finalCategoryId": 100373,
      "productId": 4872
    },
    {
      "path": [
        "Moteur",
        "Culasse / pieces de montage",
        "Cylinder Head/Attachment Parts"
      ],
      "categoryIds": [
        100002,
        null,
        100373
      ],
      "finalCategoryId": 100373,
      "productId": 60087
    },
    {
      "path": [
        "Moteur",
        "Culasse / pieces de montage",
        "Cylinder Head/Attachment Parts"
      ],
      "categoryIds": [
        100002,
        null,
        100373
      ],
      "finalCategoryId": 100373,
      "productId": 5647
    },
    {
      "path": [
        "Moteur",
        "Culasse / pieces de montage",
        "Cylinder Head/Attachment Parts"
      ],
      "categoryIds": [
        100002,
        null,
        100373
      ],
      "finalCategoryId": 100373,
      "productId": 1639
    },
    {
      "path": [
        "Moteur",
        "Distribution moteur",
        "Engine Timing"
      ],
      "categoryIds": [
        100002,
        null,
        100003
      ],
      "finalCategoryId": 100003,
      "productId": 3976
    },
    {
      "path": [
        "Moteur",
        "Joints",
        "Gaskets"
      ],
      "categoryIds": [
        100002,
        null,
        100223
      ],
      "finalCategoryId": 100223,
      "productId": 979
    },
    {
      "path": [
        "Moteur",
        "Joints",
        "Gaskets"
      ],
      "categoryIds": [
        100002,
        null,
        100223
      ],
      "finalCategoryId": 100223,
      "productId": 1102
    },
    {
      "path": [
        "Moteur",
        "Joints",
        "Gaskets"
      ],
      "categoryIds": [
        100002,
        null,
        100223
      ],
      "finalCategoryId": 100223,
      "productId": 321
    },
    {
      "path": [
        "Suspension/Amortissement",
        "Suspension pneumatique",
        "Air Suspension"
      ],
      "categoryIds": [
        100011,
        null,
        101884
      ],
      "finalCategoryId": 101884,
      "productId": 60538
    }
  ],
  "productIdsInArbo": [
    321,
    977,
    979,
    1102,
    1639,
    3402,
    3976,
    3977,
    4315,
    4316,
    4317,
    4872,
    5647,
    60087,
    60538,
    60790,
    60857
  ],
  "matchedProductIds": [
    977
  ]
}