{
  "productName": "Crochet",
  "searchText": "Crochet",
  "found": true,
  "hasMatch": false,
  "timestamp": "2025-12-02T20:27:42.804Z",
  "productId": 4620,
  "arborescence": {
    "Accessoires": {
      "categoryId": 100733,
      "categoryName": "Accessoires",
      "level": 1,
      "children": {
        "Divers": {
          "categoryId": null,
          "categoryName": "Divers",
          "level": 2,
          "children": {
            "Crochet de remorquage": {
              "categoryId": 706519,
              "categoryName": "Other",
              "level": 2,
              "children": [],
              "productId": 60525
            }
          }
        }
      }
    },
    "Carrosserie": {
      "categoryId": 100001,
      "categoryName": "Carrosserie",
      "level": 1,
      "children": {
        "Arrière de la voiture": {
          "categoryId": null,
          "categoryName": "Arrière de la voiture",
          "level": 2,
          "children": {
            "Capuchon, crochet de remorquage": {
              "categoryId": 101705,
              "categoryName": "Vehicle Rear",
              "level": 2,
              "children": {
                "Composants/suppléments": {
                  "categoryId": null,
                  "categoryName": "Composants/suppléments",
                  "level": 4,
                  "children": {
                    "Capuchon, crochet de remorquage": {
                      "categoryId": 101745,
                      "categoryName": "Parts",
                      "level": 3,
                      "children": {
                        "Recouvrement/Capuchons": {
                          "categoryId": null,
                          "categoryName": "Recouvrement/Capuchons",
                          "level": 6,
                          "children": {
                            "Capuchon, crochet de remorquage": {
                              "categoryId": 101746,
                              "categoryName": "Covers/Caps",
                              "level": 4,
                              "children": [],
                              "productId": 21
                            }
                          }
                        }
                      },
                      "productId": 21
                    }
                  }
                }
              },
              "productId": 21
            }
          }
        },
        "Avant du véhicule": {
          "categoryId": null,
          "categoryName": "Avant du véhicule",
          "level": 2,
          "children": {
            "Capuchon, crochet de remorquage": {
              "categoryId": 101648,
              "categoryName": "Vehicle Front",
              "level": 2,
              "children": {
                "Composants/suppléments": {
                  "categoryId": null,
                  "categoryName": "Composants/suppléments",
                  "level": 4,
                  "children": {
                    "Capuchon, crochet de remorquage": {
                      "categoryId": 101673,
                      "categoryName": "Parts",
                      "level": 3,
                      "children": {
                        "Recouvrement/Capuchons": {
                          "categoryId": null,
                          "categoryName": "Recouvrement/Capuchons",
                          "level": 6,
                          "children": {
                            "Capuchon, crochet de remorquage": {
                              "categoryId": 101674,
                              "categoryName": "Covers/Caps",
                              "level": 4,
                              "children": [],
                              "productId": 21
                            }
                          }
                        }
                      },
                      "productId": 21
                    }
                  }
                }
              },
              "productId": 21
            },
            "Crochet de sécurité serrure de capot moteur": {
              "categoryId": 101648,
              "categoryName": "Vehicle Front",
              "level": 2,
              "children": {
                "Capot avant / composants / insonorisation": {
                  "categoryId": null,
                  "categoryName": "Capot avant / composants / insonorisation",
                  "level": 4,
                  "children": {
                    "Crochet de sécurité serrure de capot moteur": {
                      "categoryId": 101654,
                      "categoryName": "Bonnet/Parts/Noise Insulation",
                      "level": 3,
                      "children": [],
                      "productId": 8109
                    }
                  }
                }
              },
              "productId": 8109
            }
          }
        },
        "Outils": {
          "categoryId": null,
          "categoryName": "Outils",
          "level": 2,
          "children": {
            "Outil à crochet": {
              "categoryId": 103132,
              "categoryName": "Tools",
              "level": 2,
              "children": [],
              "productId": 7127
            }
          }
        },
        "Pièces de carrosserie/ailes/pares-chocs": {
          "categoryId": null,
          "categoryName": "Pièces de carrosserie/ailes/pares-chocs",
          "level": 2,
          "children": {
            "Capuchon, crochet de remorquage": {
              "categoryId": 100743,
              "categoryName": "Body Parts/Wing/Bumper",
              "level": 2,
              "children": {
                "Recouvrement/Capuchons": {
                  "categoryId": null,
                  "categoryName": "Recouvrement/Capuchons",
                  "level": 4,
                  "children": {
                    "Capuchon, crochet de remorquage": {
                      "categoryId": 100699,
                      "categoryName": "Covers/Caps",
                      "level": 3,
                      "children": [],
                      "productId": 21
                    }
                  }
                }
              },
              "productId": 21
            }
          }
        }
      }
    },
    "Moteur": {
      "categoryId": 100002,
      "categoryName": "Moteur",
      "level": 1,
      "children": {
        "Système bielle-manivelle": {
          "categoryId": null,
          "categoryName": "Système bielle-manivelle",
          "level": 2,
          "children": {
            "Outil de mont., bague d’étanchéité/vilebrequin/palier guide": {
              "categoryId": 100515,
              "categoryName": "Crankshaft Drive",
              "level": 2,
              "children": {
                "Outils": {
                  "categoryId": null,
                  "categoryName": "Outils",
                  "level": 4,
                  "children": {
                    "Outil de mont., bague d’étanchéité/vilebrequin/palier guide": {
                      "categoryId": 706358,
                      "categoryName": "Tools",
                      "level": 3,
                      "children": [],
                      "productId": 9408
                    }
                  }
                }
              },
              "productId": 9408
            }
          }
        }
      }
    },
    "Outils spéciaux": {
      "categoryId": 706365,
      "categoryName": "Outils spéciaux",
      "level": 1,
      "children": {
        "Outils spéciaux carrosserie": {
          "categoryId": null,
          "categoryName": "Outils spéciaux carrosserie",
          "level": 2,
          "children": {
            "Outil à crochet": {
              "categoryId": 706366,
              "categoryName": "Body Special Tools",
              "level": 2,
              "children": {
                "Outils de montage généraux": {
                  "categoryId": null,
                  "categoryName": "Outils de montage généraux",
                  "level": 4,
                  "children": {
                    "Outil à crochet": {
                      "categoryId": 706370,
                      "categoryName": "General Mounting Tools",
                      "level": 3,
                      "children": [],
                      "productId": 7127
                    }
                  }
                }
              },
              "productId": 7127
            }
          }
        }
      }
    }
  },
  "arborescenceText": "├── Accessoires [ID: 100733] (Niveau 1)\n│   └── Divers (Niveau 2)\n│       └── Other [ID: 706519] (Niveau 2) → ProductId: 60525\n\n├── Carrosserie [ID: 100001] (Niveau 1)\n│   ├── Arrière de la voiture (Niveau 2)\n│   │   └── Vehicle Rear [ID: 101705] (Niveau 2) → ProductId: 21\n│   │       └── Composants/suppléments (Niveau 4)\n│   │           └── Parts [ID: 101745] (Niveau 3) → ProductId: 21\n│   │               └── Recouvrement/Capuchons (Niveau 6)\n│   │                   └── Covers/Caps [ID: 101746] (Niveau 4) → ProductId: 21\n│   ├── Avant du véhicule (Niveau 2)\n│   │   ├── Vehicle Front [ID: 101648] (Niveau 2) → ProductId: 21\n│   │   │   └── Composants/suppléments (Niveau 4)\n│   │   │       └── Parts [ID: 101673] (Niveau 3) → ProductId: 21\n│   │   │           └── Recouvrement/Capuchons (Niveau 6)\n│   │   │               └── Covers/Caps [ID: 101674] (Niveau 4) → ProductId: 21\n│   │   └── Vehicle Front [ID: 101648] (Niveau 2) → ProductId: 8109\n│   │       └── Capot avant / composants / insonorisation (Niveau 4)\n│   │           └── Bonnet/Parts/Noise Insulation [ID: 101654] (Niveau 3) → ProductId: 8109\n│   ├── Outils (Niveau 2)\n│   │   └── Tools [ID: 103132] (Niveau 2) → ProductId: 7127\n│   └── Pièces de carrosserie/ailes/pares-chocs (Niveau 2)\n│       └── Body Parts/Wing/Bumper [ID: 100743] (Niveau 2) → ProductId: 21\n│           └── Recouvrement/Capuchons (Niveau 4)\n│               └── Covers/Caps [ID: 100699] (Niveau 3) → ProductId: 21\n\n├── Moteur [ID: 100002] (Niveau 1)\n│   └── Système bielle-manivelle (Niveau 2)\n│       └── Crankshaft Drive [ID: 100515] (Niveau 2) → ProductId: 9408\n│           └── Outils (Niveau 4)\n│               └── Tools [ID: 706358] (Niveau 3) → ProductId: 9408\n\n└── Outils spéciaux [ID: 706365] (Niveau 1)\n    └── Outils spéciaux carrosserie (Niveau 2)\n        └── Body Special Tools [ID: 706366] (Niveau 2) → ProductId: 7127\n            └── Outils de montage généraux (Niveau 4)\n                └── General Mounting Tools [ID: 706370] (Niveau 3) → ProductId: 7127",
  "arborescencePaths": [
    {
      "path": [
        "Accessoires",
        "Divers",
        "Other"
      ],
      "categoryIds": [
        100733,
        null,
        706519
      ],
      "finalCategoryId": 706519,
      "productId": 60525
    },
    {
      "path": [
        "Carrosserie",
        "Arrière de la voiture",
        "Vehicle Rear"
      ],
      "categoryIds": [
        100001,
        null,
        101705
      ],
      "finalCategoryId": 101705,
      "productId": 21
    },
    {
      "path": [
        "Carrosserie",
        "Avant du véhicule",
        "Vehicle Front"
      ],
      "categoryIds": [
        100001,
        null,
        101648
      ],
      "finalCategoryId": 101648,
      "productId": 21
    },
    {
      "path": [
        "Carrosserie",
        "Avant du véhicule",
        "Vehicle Front"
      ],
      "categoryIds": [
        100001,
        null,
        101648
      ],
      "finalCategoryId": 101648,
      "productId": 8109
    },
    {
      "path": [
        "Carrosserie",
        "Outils",
        "Tools"
      ],
      "categoryIds": [
        100001,
        null,
        103132
      ],
      "finalCategoryId": 103132,
      "productId": 7127
    },
    {
      "path": [
        "Carrosserie",
        "Pièces de carrosserie/ailes/pares-chocs",
        "Body Parts/Wing/Bumper"
      ],
      "categoryIds": [
        100001,
        null,
        100743
      ],
      "finalCategoryId": 100743,
      "productId": 21
    },
    {
      "path": [
        "Moteur",
        "Système bielle-manivelle",
        "Crankshaft Drive"
      ],
      "categoryIds": [
        100002,
        null,
        100515
      ],
      "finalCategoryId": 100515,
      "productId": 9408
    },
    {
      "path": [
        "Outils spéciaux",
        "Outils spéciaux carrosserie",
        "Body Special Tools"
      ],
      "categoryIds": [
        706365,
        null,
        706366
      ],
      "finalCategoryId": 706366,
      "productId": 7127
    }
  ],
  "productIdsInArbo": [
    21,
    7127,
    8109,
    9408,
    60525
  ],
  "closestProductIds": [
    {
      "productId": 21,
      "productName": "Capuchon, crochet de remorquage"
    },
    {
      "productId": 7127,
      "productName": "Outil à crochet"
    },
    {
      "productId": 8109,
      "productName": "Crochet de sécurité serrure de capot moteur"
    },
    {
      "productId": 9408,
      "productName": "Outil de mont., bague d’étanchéité/vilebrequin/palier guide"
    },
    {
      "productId": 60525,
      "productName": "Crochet de remorquage"
    }
  ]
}