{
  "productName": "Cylindre de frein à diaphragme",
  "searchText": "Cylindre de frein à diaphragme",
  "found": true,
  "hasMatch": true,
  "timestamp": "2025-12-02T20:28:36.023Z",
  "productId": 359,
  "arborescence": {
    "Système pneumatique": {
      "categoryId": 103168,
      "categoryName": "Système pneumatique",
      "level": 1,
      "children": {
        "Cylindres de frein/de travail": {
          "categoryId": null,
          "categoryName": "Cylindres de frein/de travail",
          "level": 2,
          "children": {
            "Cylindre de frein à diaphragme": {
              "categoryId": 103193,
              "categoryName": "Brake/Slave Cylinder",
              "level": 2,
              "children": {
                "Cylindre de frein à diaphragme": {
                  "categoryId": null,
                  "categoryName": "Cylindre de frein à diaphragme",
                  "level": 4,
                  "children": {
                    "Cylindre de frein à diaphragme": {
                      "categoryId": 103195,
                      "categoryName": "Diaphragm Brake Cylinder",
                      "level": 3,
                      "children": [],
                      "productId": 359
                    }
                  }
                }
              },
              "productId": 359
            },
            "Diaphragme, cylindre de frein": {
              "categoryId": 103193,
              "categoryName": "Brake/Slave Cylinder",
              "level": 2,
              "children": {
                "Cylindre de frein à diaphragme": {
                  "categoryId": null,
                  "categoryName": "Cylindre de frein à diaphragme",
                  "level": 4,
                  "children": {
                    "Diaphragme, cylindre de frein": {
                      "categoryId": 103195,
                      "categoryName": "Diaphragm Brake Cylinder",
                      "level": 3,
                      "children": [],
                      "productId": 1736
                    }
                  }
                }
              },
              "productId": 1736
            },
            "Kit de montage, cylindre de frein à diaphragme": {
              "categoryId": 103193,
              "categoryName": "Brake/Slave Cylinder",
              "level": 2,
              "children": {
                "Cylindre de frein à diaphragme": {
                  "categoryId": null,
                  "categoryName": "Cylindre de frein à diaphragme",
                  "level": 4,
                  "children": {
                    "Kit de montage, cylindre de frein à diaphragme": {
                      "categoryId": 103195,
                      "categoryName": "Diaphragm Brake Cylinder",
                      "level": 3,
                      "children": [],
                      "productId": 1666
                    }
                  }
                }
              },
              "productId": 1666
            }
          }
        }
      }
    }
  },
  "arborescenceText": "└── Système pneumatique [ID: 103168] (Niveau 1)\n    └── Cylindres de frein/de travail (Niveau 2)\n        ├── Brake/Slave Cylinder [ID: 103193] (Niveau 2) → ProductId: 359\n        │   └── Cylindre de frein à diaphragme (Niveau 4)\n        │       └── Diaphragm Brake Cylinder [ID: 103195] (Niveau 3) → ProductId: 359\n        ├── Brake/Slave Cylinder [ID: 103193] (Niveau 2) → ProductId: 1736\n        │   └── Cylindre de frein à diaphragme (Niveau 4)\n        │       └── Diaphragm Brake Cylinder [ID: 103195] (Niveau 3) → ProductId: 1736\n        └── Brake/Slave Cylinder [ID: 103193] (Niveau 2) → ProductId: 1666\n            └── Cylindre de frein à diaphragme (Niveau 4)\n                └── Diaphragm Brake Cylinder [ID: 103195] (Niveau 3) → ProductId: 1666",
  "arborescencePaths": [
    {
      "path": [
        "Système pneumatique",
        "Cylindres de frein/de travail",
        "Brake/Slave Cylinder"
      ],
      "categoryIds": [
        103168,
        null,
        103193
      ],
      "finalCategoryId": 103193,
      "productId": 359
    },
    {
      "path": [
        "Système pneumatique",
        "Cylindres de frein/de travail",
        "Brake/Slave Cylinder"
      ],
      "categoryIds": [
        103168,
        null,
        103193
      ],
      "finalCategoryId": 103193,
      "productId": 1736
    },
    {
      "path": [
        "Système pneumatique",
        "Cylindres de frein/de travail",
        "Brake/Slave Cylinder"
      ],
      "categoryIds": [
        103168,
        null,
        103193
      ],
      "finalCategoryId": 103193,
      "productId": 1666
    }
  ],
  "productIdsInArbo": [
    359,
    1666,
    1736
  ],
  "matchedProductIds": [
    359
  ]
}