{
  "productName": "Diaphragme",
  "searchText": "Diaphragme",
  "found": true,
  "hasMatch": false,
  "timestamp": "2025-12-02T20:30:27.929Z",
  "productId": 3289,
  "arborescence": {
    "Alimentation carburant": {
      "categoryId": 100214,
      "categoryName": "Alimentation carburant",
      "level": 1,
      "children": {
        "Pompe / accessoires": {
          "categoryId": null,
          "categoryName": "Pompe / accessoires",
          "level": 2,
          "children": {
            "Diaphragme, pompe à carburant": {
              "categoryId": 100251,
              "categoryName": "Pump/Accessories",
              "level": 2,
              "children": {
                "Accessoires/Composants": {
                  "categoryId": null,
                  "categoryName": "Accessoires/Composants",
                  "level": 4,
                  "children": {
                    "Diaphragme, pompe à carburant": {
                      "categoryId": 100718,
                      "categoryName": "Accessories/Parts",
                      "level": 3,
                      "children": [],
                      "productId": 3928
                    }
                  }
                }
              },
              "productId": 3928
            }
          }
        },
        "Pressostat/manostat": {
          "categoryId": null,
          "categoryName": "Pressostat/manostat",
          "level": 2,
          "children": {
            "Membrane, régulateur de pression du carburant": {
              "categoryId": 100270,
              "categoryName": "Pressure Regulator/Switch",
              "level": 2,
              "children": [],
              "productId": 60416
            }
          }
        }
      }
    },
    "Carburation": {
      "categoryId": 100254,
      "categoryName": "Carburation",
      "level": 1,
      "children": {
        "Carburateurs": {
          "categoryId": null,
          "categoryName": "Carburateurs",
          "level": 2,
          "children": {
            "Couvercle de diaphragme, carburateur": {
              "categoryId": 102903,
              "categoryName": "Carburettor System",
              "level": 2,
              "children": {
                "Composants du carburateur": {
                  "categoryId": null,
                  "categoryName": "Composants du carburateur",
                  "level": 4,
                  "children": {
                    "Couvercle de diaphragme, carburateur": {
                      "categoryId": 102906,
                      "categoryName": "Carburettor Parts",
                      "level": 3,
                      "children": [],
                      "productId": 1952
                    }
                  }
                }
              },
              "productId": 1952
            },
            "Diaphragme pulldown, carburateur": {
              "categoryId": 102903,
              "categoryName": "Carburettor System",
              "level": 2,
              "children": {
                "Composants du carburateur": {
                  "categoryId": null,
                  "categoryName": "Composants du carburateur",
                  "level": 4,
                  "children": {
                    "Diaphragme pulldown, carburateur": {
                      "categoryId": 102906,
                      "categoryName": "Carburettor Parts",
                      "level": 3,
                      "children": [],
                      "productId": 1958
                    }
                  }
                }
              },
              "productId": 1958
            },
            "Diaphragme, carburateur": {
              "categoryId": 102903,
              "categoryName": "Carburettor System",
              "level": 2,
              "children": {
                "Composants du carburateur": {
                  "categoryId": null,
                  "categoryName": "Composants du carburateur",
                  "level": 4,
                  "children": {
                    "Diaphragme, carburateur": {
                      "categoryId": 102906,
                      "categoryName": "Carburettor Parts",
                      "level": 3,
                      "children": [],
                      "productId": 1953
                    }
                  }
                }
              },
              "productId": 1953
            }
          }
        }
      }
    },
    "Dispositif de freinage": {
      "categoryId": 100006,
      "categoryName": "Dispositif de freinage",
      "level": 1,
      "children": {
        "Pompe à vide": {
          "categoryId": null,
          "categoryName": "Pompe à vide",
          "level": 2,
          "children": {
            "Diaphragme, pompe à vide": {
              "categoryId": 100039,
              "categoryName": "Vacuum Pump",
              "level": 2,
              "children": [],
              "productId": 1008
            }
          }
        }
      }
    },
    "Moteur": {
      "categoryId": 100002,
      "categoryName": "Moteur",
      "level": 1,
      "children": {
        "Carter de vilebrequin": {
          "categoryId": null,
          "categoryName": "Carter de vilebrequin",
          "level": 2,
          "children": {
            "Diaphragme, ventilation du carter-moteur": {
              "categoryId": 100514,
              "categoryName": "Crankcase",
              "level": 2,
              "children": {
                "Ventilation": {
                  "categoryId": null,
                  "categoryName": "Ventilation",
                  "level": 4,
                  "children": {
                    "Diaphragme, ventilation du carter-moteur": {
                      "categoryId": 105862,
                      "categoryName": "Breather",
                      "level": 3,
                      "children": [],
                      "productId": 4325
                    }
                  }
                }
              },
              "productId": 4325
            }
          }
        }
      }
    },
    "Système pneumatique": {
      "categoryId": 103168,
      "categoryName": "Système pneumatique",
      "level": 1,
      "children": {
        "Cylindres de frein/de travail": {
          "categoryId": null,
          "categoryName": "Cylindres de frein/de travail",
          "level": 2,
          "children": {
            "Cylindre de frein à diaphragme": {
              "categoryId": 103193,
              "categoryName": "Brake/Slave Cylinder",
              "level": 2,
              "children": {
                "Cylindre de frein à diaphragme": {
                  "categoryId": null,
                  "categoryName": "Cylindre de frein à diaphragme",
                  "level": 4,
                  "children": {
                    "Cylindre de frein à diaphragme": {
                      "categoryId": 103195,
                      "categoryName": "Diaphragm Brake Cylinder",
                      "level": 3,
                      "children": [],
                      "productId": 359
                    }
                  }
                }
              },
              "productId": 359
            },
            "Diaphragme, cylindre de frein": {
              "categoryId": 103193,
              "categoryName": "Brake/Slave Cylinder",
              "level": 2,
              "children": {
                "Cylindre de frein à diaphragme": {
                  "categoryId": null,
                  "categoryName": "Cylindre de frein à diaphragme",
                  "level": 4,
                  "children": {
                    "Diaphragme, cylindre de frein": {
                      "categoryId": 103195,
                      "categoryName": "Diaphragm Brake Cylinder",
                      "level": 3,
                      "children": [],
                      "productId": 1736
                    }
                  }
                }
              },
              "productId": 1736
            },
            "Kit de montage, cylindre de frein à diaphragme": {
              "categoryId": 103193,
              "categoryName": "Brake/Slave Cylinder",
              "level": 2,
              "children": {
                "Cylindre de frein à diaphragme": {
                  "categoryId": null,
                  "categoryName": "Cylindre de frein à diaphragme",
                  "level": 4,
                  "children": {
                    "Kit de montage, cylindre de frein à diaphragme": {
                      "categoryId": 103195,
                      "categoryName": "Diaphragm Brake Cylinder",
                      "level": 3,
                      "children": [],
                      "productId": 1666
                    }
                  }
                }
              },
              "productId": 1666
            }
          }
        }
      }
    }
  },
  "arborescenceText": "├── Alimentation carburant [ID: 100214] (Niveau 1)\n│   ├── Pompe / accessoires (Niveau 2)\n│   │   └── Pump/Accessories [ID: 100251] (Niveau 2) → ProductId: 3928\n│   │       └── Accessoires/Composants (Niveau 4)\n│   │           └── Accessories/Parts [ID: 100718] (Niveau 3) → ProductId: 3928\n│   └── Pressostat/manostat (Niveau 2)\n│       └── Pressure Regulator/Switch [ID: 100270] (Niveau 2) → ProductId: 60416\n\n├── Carburation [ID: 100254] (Niveau 1)\n│   └── Carburateurs (Niveau 2)\n│       ├── Carburettor System [ID: 102903] (Niveau 2) → ProductId: 1952\n│       │   └── Composants du carburateur (Niveau 4)\n│       │       └── Carburettor Parts [ID: 102906] (Niveau 3) → ProductId: 1952\n│       ├── Carburettor System [ID: 102903] (Niveau 2) → ProductId: 1958\n│       │   └── Composants du carburateur (Niveau 4)\n│       │       └── Carburettor Parts [ID: 102906] (Niveau 3) → ProductId: 1958\n│       └── Carburettor System [ID: 102903] (Niveau 2) → ProductId: 1953\n│           └── Composants du carburateur (Niveau 4)\n│               └── Carburettor Parts [ID: 102906] (Niveau 3) → ProductId: 1953\n\n├── Dispositif de freinage [ID: 100006] (Niveau 1)\n│   └── Pompe à vide (Niveau 2)\n│       └── Vacuum Pump [ID: 100039] (Niveau 2) → ProductId: 1008\n\n├── Moteur [ID: 100002] (Niveau 1)\n│   └── Carter de vilebrequin (Niveau 2)\n│       └── Crankcase [ID: 100514] (Niveau 2) → ProductId: 4325\n│           └── Ventilation (Niveau 4)\n│               └── Breather [ID: 105862] (Niveau 3) → ProductId: 4325\n\n└── Système pneumatique [ID: 103168] (Niveau 1)\n    └── Cylindres de frein/de travail (Niveau 2)\n        ├── Brake/Slave Cylinder [ID: 103193] (Niveau 2) → ProductId: 359\n        │   └── Cylindre de frein à diaphragme (Niveau 4)\n        │       └── Diaphragm Brake Cylinder [ID: 103195] (Niveau 3) → ProductId: 359\n        ├── Brake/Slave Cylinder [ID: 103193] (Niveau 2) → ProductId: 1736\n        │   └── Cylindre de frein à diaphragme (Niveau 4)\n        │       └── Diaphragm Brake Cylinder [ID: 103195] (Niveau 3) → ProductId: 1736\n        └── Brake/Slave Cylinder [ID: 103193] (Niveau 2) → ProductId: 1666\n            └── Cylindre de frein à diaphragme (Niveau 4)\n                └── Diaphragm Brake Cylinder [ID: 103195] (Niveau 3) → ProductId: 1666",
  "arborescencePaths": [
    {
      "path": [
        "Alimentation carburant",
        "Pompe / accessoires",
        "Pump/Accessories"
      ],
      "categoryIds": [
        100214,
        null,
        100251
      ],
      "finalCategoryId": 100251,
      "productId": 3928
    },
    {
      "path": [
        "Alimentation carburant",
        "Pressostat/manostat",
        "Pressure Regulator/Switch"
      ],
      "categoryIds": [
        100214,
        null,
        100270
      ],
      "finalCategoryId": 100270,
      "productId": 60416
    },
    {
      "path": [
        "Carburation",
        "Carburateurs",
        "Carburettor System"
      ],
      "categoryIds": [
        100254,
        null,
        102903
      ],
      "finalCategoryId": 102903,
      "productId": 1952
    },
    {
      "path": [
        "Carburation",
        "Carburateurs",
        "Carburettor System"
      ],
      "categoryIds": [
        100254,
        null,
        102903
      ],
      "finalCategoryId": 102903,
      "productId": 1958
    },
    {
      "path": [
        "Carburation",
        "Carburateurs",
        "Carburettor System"
      ],
      "categoryIds": [
        100254,
        null,
        102903
      ],
      "finalCategoryId": 102903,
      "productId": 1953
    },
    {
      "path": [
        "Dispositif de freinage",
        "Pompe à vide",
        "Vacuum Pump"
      ],
      "categoryIds": [
        100006,
        null,
        100039
      ],
      "finalCategoryId": 100039,
      "productId": 1008
    },
    {
      "path": [
        "Moteur",
        "Carter de vilebrequin",
        "Crankcase"
      ],
      "categoryIds": [
        100002,
        null,
        100514
      ],
      "finalCategoryId": 100514,
      "productId": 4325
    },
    {
      "path": [
        "Système pneumatique",
        "Cylindres de frein/de travail",
        "Brake/Slave Cylinder"
      ],
      "categoryIds": [
        103168,
        null,
        103193
      ],
      "finalCategoryId": 103193,
      "productId": 359
    },
    {
      "path": [
        "Système pneumatique",
        "Cylindres de frein/de travail",
        "Brake/Slave Cylinder"
      ],
      "categoryIds": [
        103168,
        null,
        103193
      ],
      "finalCategoryId": 103193,
      "productId": 1736
    },
    {
      "path": [
        "Système pneumatique",
        "Cylindres de frein/de travail",
        "Brake/Slave Cylinder"
      ],
      "categoryIds": [
        103168,
        null,
        103193
      ],
      "finalCategoryId": 103193,
      "productId": 1666
    }
  ],
  "productIdsInArbo": [
    359,
    1008,
    1666,
    1736,
    1952,
    1953,
    1958,
    3928,
    4325,
    60416
  ],
  "closestProductIds": [
    {
      "productId": 359,
      "productName": "Cylindre de frein à diaphragme"
    },
    {
      "productId": 1008,
      "productName": "Diaphragme, pompe à vide"
    },
    {
      "productId": 1666,
      "productName": "Kit de montage, cylindre de frein à diaphragme"
    },
    {
      "productId": 1736,
      "productName": "Diaphragme, cylindre de frein"
    },
    {
      "productId": 1952,
      "productName": "Couvercle de diaphragme, carburateur"
    }
  ]
}