{
  "productName": "Disperseur, feu clignotant",
  "searchText": "Disperseur, feu clignotant",
  "found": true,
  "hasMatch": true,
  "timestamp": "2025-12-02T20:31:06.910Z",
  "productId": 91,
  "arborescence": {
    "Carrosserie": {
      "categoryId": 100001,
      "categoryName": "Carrosserie",
      "level": 1,
      "children": {
        "Arrière de la voiture": {
          "categoryId": null,
          "categoryName": "Arrière de la voiture",
          "level": 2,
          "children": {
            "Disperseur, feu clignotant": {
              "categoryId": 101705,
              "categoryName": "Vehicle Rear",
              "level": 2,
              "children": {
                "Feu clignotant/composants": {
                  "categoryId": null,
                  "categoryName": "Feu clignotant/composants",
                  "level": 4,
                  "children": {
                    "Disperseur, feu clignotant": {
                      "categoryId": 101727,
                      "categoryName": "Direction Indicator/Parts",
                      "level": 3,
                      "children": {
                        "Composants de feu clignotant": {
                          "categoryId": null,
                          "categoryName": "Composants de feu clignotant",
                          "level": 6,
                          "children": {
                            "Disperseur, feu clignotant": {
                              "categoryId": 101729,
                              "categoryName": "Indicator Parts",
                              "level": 4,
                              "children": [],
                              "productId": 91
                            }
                          }
                        }
                      },
                      "productId": 91
                    }
                  }
                }
              },
              "productId": 91
            }
          }
        },
        "Avant du véhicule": {
          "categoryId": null,
          "categoryName": "Avant du véhicule",
          "level": 2,
          "children": {
            "Disperseur, feu clignotant": {
              "categoryId": 101648,
              "categoryName": "Vehicle Front",
              "level": 2,
              "children": {
                "Feu clignotant/composants": {
                  "categoryId": null,
                  "categoryName": "Feu clignotant/composants",
                  "level": 4,
                  "children": {
                    "Disperseur, feu clignotant": {
                      "categoryId": 101669,
                      "categoryName": "Direction Indicator/Parts",
                      "level": 3,
                      "children": {
                        "Composants de feu clignotant": {
                          "categoryId": null,
                          "categoryName": "Composants de feu clignotant",
                          "level": 6,
                          "children": {
                            "Disperseur, feu clignotant": {
                              "categoryId": 101671,
                              "categoryName": "Indicator Parts",
                              "level": 4,
                              "children": [],
                              "productId": 91
                            }
                          }
                        }
                      },
                      "productId": 91
                    }
                  }
                }
              },
              "productId": 91
            }
          }
        },
        "Feux": {
          "categoryId": null,
          "categoryName": "Feux",
          "level": 2,
          "children": {
            "Disperseur, feu clignotant": {
              "categoryId": 101407,
              "categoryName": "Lights",
              "level": 2,
              "children": {
                "Feu clignotant/composants": {
                  "categoryId": null,
                  "categoryName": "Feu clignotant/composants",
                  "level": 4,
                  "children": {
                    "Disperseur, feu clignotant": {
                      "categoryId": 101420,
                      "categoryName": "Direction Indicator/Parts",
                      "level": 3,
                      "children": {
                        "Composants de feu clignotant": {
                          "categoryId": null,
                          "categoryName": "Composants de feu clignotant",
                          "level": 6,
                          "children": {
                            "Disperseur, feu clignotant": {
                              "categoryId": 101422,
                              "categoryName": "Indicator Parts",
                              "level": 4,
                              "children": [],
                              "productId": 91
                            }
                          }
                        }
                      },
                      "productId": 91
                    }
                  }
                }
              },
              "productId": 91
            }
          }
        }
      }
    },
    "Système électrique": {
      "categoryId": 100010,
      "categoryName": "Système électrique",
      "level": 1,
      "children": {
        "Feux": {
          "categoryId": null,
          "categoryName": "Feux",
          "level": 2,
          "children": {
            "Disperseur, feu clignotant": {
              "categoryId": 100043,
              "categoryName": "Lights",
              "level": 2,
              "children": {
                "Feu clignotant/composants": {
                  "categoryId": null,
                  "categoryName": "Feu clignotant/composants",
                  "level": 4,
                  "children": {
                    "Disperseur, feu clignotant": {
                      "categoryId": 100145,
                      "categoryName": "Direction Indicator/Parts",
                      "level": 3,
                      "children": {
                        "Composants de feu clignotant": {
                          "categoryId": null,
                          "categoryName": "Composants de feu clignotant",
                          "level": 6,
                          "children": {
                            "Disperseur, feu clignotant": {
                              "categoryId": 100480,
                              "categoryName": "Indicator Parts",
                              "level": 4,
                              "children": [],
                              "productId": 91
                            }
                          }
                        }
                      },
                      "productId": 91
                    }
                  }
                }
              },
              "productId": 91
            }
          }
        }
      }
    }
  },
  "arborescenceText": "├── Carrosserie [ID: 100001] (Niveau 1)\n│   ├── Arrière de la voiture (Niveau 2)\n│   │   └── Vehicle Rear [ID: 101705] (Niveau 2) → ProductId: 91\n│   │       └── Feu clignotant/composants (Niveau 4)\n│   │           └── Direction Indicator/Parts [ID: 101727] (Niveau 3) → ProductId: 91\n│   │               └── Composants de feu clignotant (Niveau 6)\n│   │                   └── Indicator Parts [ID: 101729] (Niveau 4) → ProductId: 91\n│   ├── Avant du véhicule (Niveau 2)\n│   │   └── Vehicle Front [ID: 101648] (Niveau 2) → ProductId: 91\n│   │       └── Feu clignotant/composants (Niveau 4)\n│   │           └── Direction Indicator/Parts [ID: 101669] (Niveau 3) → ProductId: 91\n│   │               └── Composants de feu clignotant (Niveau 6)\n│   │                   └── Indicator Parts [ID: 101671] (Niveau 4) → ProductId: 91\n│   └── Feux (Niveau 2)\n│       └── Lights [ID: 101407] (Niveau 2) → ProductId: 91\n│           └── Feu clignotant/composants (Niveau 4)\n│               └── Direction Indicator/Parts [ID: 101420] (Niveau 3) → ProductId: 91\n│                   └── Composants de feu clignotant (Niveau 6)\n│                       └── Indicator Parts [ID: 101422] (Niveau 4) → ProductId: 91\n\n└── Système électrique [ID: 100010] (Niveau 1)\n    └── Feux (Niveau 2)\n        └── Lights [ID: 100043] (Niveau 2) → ProductId: 91\n            └── Feu clignotant/composants (Niveau 4)\n                └── Direction Indicator/Parts [ID: 100145] (Niveau 3) → ProductId: 91\n                    └── Composants de feu clignotant (Niveau 6)\n                        └── Indicator Parts [ID: 100480] (Niveau 4) → ProductId: 91",
  "arborescencePaths": [
    {
      "path": [
        "Carrosserie",
        "Arrière de la voiture",
        "Vehicle Rear"
      ],
      "categoryIds": [
        100001,
        null,
        101705
      ],
      "finalCategoryId": 101705,
      "productId": 91
    },
    {
      "path": [
        "Carrosserie",
        "Avant du véhicule",
        "Vehicle Front"
      ],
      "categoryIds": [
        100001,
        null,
        101648
      ],
      "finalCategoryId": 101648,
      "productId": 91
    },
    {
      "path": [
        "Carrosserie",
        "Feux",
        "Lights"
      ],
      "categoryIds": [
        100001,
        null,
        101407
      ],
      "finalCategoryId": 101407,
      "productId": 91
    },
    {
      "path": [
        "Système électrique",
        "Feux",
        "Lights"
      ],
      "categoryIds": [
        100010,
        null,
        100043
      ],
      "finalCategoryId": 100043,
      "productId": 91
    }
  ],
  "productIdsInArbo": [
    91
  ],
  "matchedProductIds": [
    91
  ]
}