{
  "productName": "Disperseur, feu de gabarit",
  "searchText": "Disperseur, feu de gabarit",
  "found": true,
  "hasMatch": true,
  "timestamp": "2025-12-02T20:31:09.371Z",
  "productId": 3458,
  "arborescence": {
    "Carrosserie": {
      "categoryId": 100001,
      "categoryName": "Carrosserie",
      "level": 1,
      "children": {
        "Arrière de la voiture": {
          "categoryId": null,
          "categoryName": "Arrière de la voiture",
          "level": 2,
          "children": {
            "Disperseur, feu de gabarit": {
              "categoryId": 101705,
              "categoryName": "Vehicle Rear",
              "level": 2,
              "children": {
                "Feu de position / d'encombrement / composants": {
                  "categoryId": null,
                  "categoryName": "Feu de position / d'encombrement / composants",
                  "level": 4,
                  "children": {
                    "Disperseur, feu de gabarit": {
                      "categoryId": 101785,
                      "categoryName": "Side Marker/End Outline Marker Light/Parts",
                      "level": 3,
                      "children": {
                        "Feu d'encombrement": {
                          "categoryId": null,
                          "categoryName": "Feu d'encombrement",
                          "level": 6,
                          "children": {
                            "Disperseur, feu de gabarit": {
                              "categoryId": 101787,
                              "categoryName": "End Outline Marker Light",
                              "level": 4,
                              "children": [],
                              "productId": 3458
                            }
                          }
                        }
                      },
                      "productId": 3458
                    }
                  }
                }
              },
              "productId": 3458
            }
          }
        },
        "Avant du véhicule": {
          "categoryId": null,
          "categoryName": "Avant du véhicule",
          "level": 2,
          "children": {
            "Disperseur, feu de gabarit": {
              "categoryId": 101648,
              "categoryName": "Vehicle Front",
              "level": 2,
              "children": {
                "Feu de position / d'encombrement / composants": {
                  "categoryId": null,
                  "categoryName": "Feu de position / d'encombrement / composants",
                  "level": 4,
                  "children": {
                    "Disperseur, feu de gabarit": {
                      "categoryId": 101766,
                      "categoryName": "Side Marker/End Outline Marker Light/Parts",
                      "level": 3,
                      "children": {
                        "Feu d'encombrement": {
                          "categoryId": null,
                          "categoryName": "Feu d'encombrement",
                          "level": 6,
                          "children": {
                            "Disperseur, feu de gabarit": {
                              "categoryId": 101768,
                              "categoryName": "End Outline Marker Light",
                              "level": 4,
                              "children": [],
                              "productId": 3458
                            }
                          }
                        }
                      },
                      "productId": 3458
                    }
                  }
                }
              },
              "productId": 3458
            }
          }
        },
        "Feux": {
          "categoryId": null,
          "categoryName": "Feux",
          "level": 2,
          "children": {
            "Disperseur, feu de gabarit": {
              "categoryId": 101407,
              "categoryName": "Lights",
              "level": 2,
              "children": {
                "Feu de position / d'encombrement / composants": {
                  "categoryId": null,
                  "categoryName": "Feu de position / d'encombrement / composants",
                  "level": 4,
                  "children": {
                    "Disperseur, feu de gabarit": {
                      "categoryId": 101441,
                      "categoryName": "Side Marker/End Outline Marker Light/Parts",
                      "level": 3,
                      "children": {
                        "Feu d'encombrement": {
                          "categoryId": null,
                          "categoryName": "Feu d'encombrement",
                          "level": 6,
                          "children": {
                            "Disperseur, feu de gabarit": {
                              "categoryId": 101443,
                              "categoryName": "End Outline Marker Light",
                              "level": 4,
                              "children": [],
                              "productId": 3458
                            }
                          }
                        }
                      },
                      "productId": 3458
                    }
                  }
                }
              },
              "productId": 3458
            }
          }
        }
      }
    },
    "Système électrique": {
      "categoryId": 100010,
      "categoryName": "Système électrique",
      "level": 1,
      "children": {
        "Feux": {
          "categoryId": null,
          "categoryName": "Feux",
          "level": 2,
          "children": {
            "Disperseur, feu de gabarit": {
              "categoryId": 100043,
              "categoryName": "Lights",
              "level": 2,
              "children": {
                "Feu de position / d'encombrement / composants": {
                  "categoryId": null,
                  "categoryName": "Feu de position / d'encombrement / composants",
                  "level": 4,
                  "children": {
                    "Disperseur, feu de gabarit": {
                      "categoryId": 100290,
                      "categoryName": "Side Marker/End Outline Marker Light/Parts",
                      "level": 3,
                      "children": {
                        "Feu d'encombrement": {
                          "categoryId": null,
                          "categoryName": "Feu d'encombrement",
                          "level": 6,
                          "children": {
                            "Disperseur, feu de gabarit": {
                              "categoryId": 100469,
                              "categoryName": "End Outline Marker Light",
                              "level": 4,
                              "children": [],
                              "productId": 3458
                            }
                          }
                        }
                      },
                      "productId": 3458
                    }
                  }
                }
              },
              "productId": 3458
            }
          }
        }
      }
    }
  },
  "arborescenceText": "├── Carrosserie [ID: 100001] (Niveau 1)\n│   ├── Arrière de la voiture (Niveau 2)\n│   │   └── Vehicle Rear [ID: 101705] (Niveau 2) → ProductId: 3458\n│   │       └── Feu de position / d'encombrement / composants (Niveau 4)\n│   │           └── Side Marker/End Outline Marker Light/Parts [ID: 101785] (Niveau 3) → ProductId: 3458\n│   │               └── Feu d'encombrement (Niveau 6)\n│   │                   └── End Outline Marker Light [ID: 101787] (Niveau 4) → ProductId: 3458\n│   ├── Avant du véhicule (Niveau 2)\n│   │   └── Vehicle Front [ID: 101648] (Niveau 2) → ProductId: 3458\n│   │       └── Feu de position / d'encombrement / composants (Niveau 4)\n│   │           └── Side Marker/End Outline Marker Light/Parts [ID: 101766] (Niveau 3) → ProductId: 3458\n│   │               └── Feu d'encombrement (Niveau 6)\n│   │                   └── End Outline Marker Light [ID: 101768] (Niveau 4) → ProductId: 3458\n│   └── Feux (Niveau 2)\n│       └── Lights [ID: 101407] (Niveau 2) → ProductId: 3458\n│           └── Feu de position / d'encombrement / composants (Niveau 4)\n│               └── Side Marker/End Outline Marker Light/Parts [ID: 101441] (Niveau 3) → ProductId: 3458\n│                   └── Feu d'encombrement (Niveau 6)\n│                       └── End Outline Marker Light [ID: 101443] (Niveau 4) → ProductId: 3458\n\n└── Système électrique [ID: 100010] (Niveau 1)\n    └── Feux (Niveau 2)\n        └── Lights [ID: 100043] (Niveau 2) → ProductId: 3458\n            └── Feu de position / d'encombrement / composants (Niveau 4)\n                └── Side Marker/End Outline Marker Light/Parts [ID: 100290] (Niveau 3) → ProductId: 3458\n                    └── Feu d'encombrement (Niveau 6)\n                        └── End Outline Marker Light [ID: 100469] (Niveau 4) → ProductId: 3458",
  "arborescencePaths": [
    {
      "path": [
        "Carrosserie",
        "Arrière de la voiture",
        "Vehicle Rear"
      ],
      "categoryIds": [
        100001,
        null,
        101705
      ],
      "finalCategoryId": 101705,
      "productId": 3458
    },
    {
      "path": [
        "Carrosserie",
        "Avant du véhicule",
        "Vehicle Front"
      ],
      "categoryIds": [
        100001,
        null,
        101648
      ],
      "finalCategoryId": 101648,
      "productId": 3458
    },
    {
      "path": [
        "Carrosserie",
        "Feux",
        "Lights"
      ],
      "categoryIds": [
        100001,
        null,
        101407
      ],
      "finalCategoryId": 101407,
      "productId": 3458
    },
    {
      "path": [
        "Système électrique",
        "Feux",
        "Lights"
      ],
      "categoryIds": [
        100010,
        null,
        100043
      ],
      "finalCategoryId": 100043,
      "productId": 3458
    }
  ],
  "productIdsInArbo": [
    3458
  ],
  "matchedProductIds": [
    3458
  ]
}