{
  "productName": "Disperseur",
  "searchText": "Disperseur",
  "found": true,
  "hasMatch": false,
  "timestamp": "2025-12-02T20:31:00.219Z",
  "productId": 1469,
  "arborescence": {
    "Carrosserie": {
      "categoryId": 100001,
      "categoryName": "Carrosserie",
      "level": 1,
      "children": {
        "Arrière de la voiture": {
          "categoryId": null,
          "categoryName": "Arrière de la voiture",
          "level": 2,
          "children": {
            "Disperseur, feu antibrouillard arrière": {
              "categoryId": 101705,
              "categoryName": "Vehicle Rear",
              "level": 2,
              "children": {
                "Feu de brouillard arrière/Composants": {
                  "categoryId": null,
                  "categoryName": "Feu de brouillard arrière/Composants",
                  "level": 4,
                  "children": {
                    "Disperseur, feu antibrouillard arrière": {
                      "categoryId": 101735,
                      "categoryName": "Rear Fog Light/Parts",
                      "level": 3,
                      "children": {
                        "Composants de feu de brouillard arrière": {
                          "categoryId": null,
                          "categoryName": "Composants de feu de brouillard arrière",
                          "level": 6,
                          "children": {
                            "Disperseur, feu antibrouillard arrière": {
                              "categoryId": 101737,
                              "categoryName": "Rear Fog Light Individual Parts",
                              "level": 4,
                              "children": [],
                              "productId": 95
                            }
                          }
                        }
                      },
                      "productId": 95
                    }
                  }
                }
              },
              "productId": 95
            },
            "Disperseur, feu arrière": {
              "categoryId": 101705,
              "categoryName": "Vehicle Rear",
              "level": 2,
              "children": {
                "Feu arrière / composants": {
                  "categoryId": null,
                  "categoryName": "Feu arrière / composants",
                  "level": 4,
                  "children": {
                    "Disperseur, feu arrière": {
                      "categoryId": 101715,
                      "categoryName": "Tail Light Assembly/Parts",
                      "level": 3,
                      "children": {
                        "Composants de feu arrière": {
                          "categoryId": null,
                          "categoryName": "Composants de feu arrière",
                          "level": 6,
                          "children": {
                            "Disperseur, feu arrière": {
                              "categoryId": 101717,
                              "categoryName": "Tail Light Assembly Parts",
                              "level": 4,
                              "children": [],
                              "productId": 93
                            }
                          }
                        }
                      },
                      "productId": 93
                    }
                  }
                },
                "Feu arrière/Composants": {
                  "categoryId": null,
                  "categoryName": "Feu arrière/Composants",
                  "level": 4,
                  "children": {
                    "Disperseur, feu arrière": {
                      "categoryId": 101718,
                      "categoryName": "Tail Light/Parts",
                      "level": 3,
                      "children": {
                        "Composants de feu arrière": {
                          "categoryId": null,
                          "categoryName": "Composants de feu arrière",
                          "level": 6,
                          "children": {
                            "Disperseur, feu arrière": {
                              "categoryId": 101720,
                              "categoryName": "Tail Light Individual Parts",
                              "level": 4,
                              "children": [],
                              "productId": 97
                            }
                          }
                        }
                      },
                      "productId": 97
                    }
                  }
                }
              },
              "productId": 97
            },
            "Disperseur, feu clignotant": {
              "categoryId": 101705,
              "categoryName": "Vehicle Rear",
              "level": 2,
              "children": {
                "Feu clignotant/composants": {
                  "categoryId": null,
                  "categoryName": "Feu clignotant/composants",
                  "level": 4,
                  "children": {
                    "Disperseur, feu clignotant": {
                      "categoryId": 101727,
                      "categoryName": "Direction Indicator/Parts",
                      "level": 3,
                      "children": {
                        "Composants de feu clignotant": {
                          "categoryId": null,
                          "categoryName": "Composants de feu clignotant",
                          "level": 6,
                          "children": {
                            "Disperseur, feu clignotant": {
                              "categoryId": 101729,
                              "categoryName": "Indicator Parts",
                              "level": 4,
                              "children": [],
                              "productId": 91
                            }
                          }
                        }
                      },
                      "productId": 91
                    }
                  }
                }
              },
              "productId": 91
            },
            "Disperseur, feu d'encombrement": {
              "categoryId": 101705,
              "categoryName": "Vehicle Rear",
              "level": 2,
              "children": {
                "Feu de position / d'encombrement / composants": {
                  "categoryId": null,
                  "categoryName": "Feu de position / d'encombrement / composants",
                  "level": 4,
                  "children": {
                    "Disperseur, feu d'encombrement": {
                      "categoryId": 101785,
                      "categoryName": "Side Marker/End Outline Marker Light/Parts",
                      "level": 3,
                      "children": {
                        "Composants": {
                          "categoryId": null,
                          "categoryName": "Composants",
                          "level": 6,
                          "children": {
                            "Disperseur, feu d'encombrement": {
                              "categoryId": 101790,
                              "categoryName": "Parts",
                              "level": 4,
                              "children": [],
                              "productId": 1175
                            }
                          }
                        }
                      },
                      "productId": 1175
                    }
                  }
                }
              },
              "productId": 1175
            },
            "Disperseur, feu de gabarit": {
              "categoryId": 101705,
              "categoryName": "Vehicle Rear",
              "level": 2,
              "children": {
                "Feu de position / d'encombrement / composants": {
                  "categoryId": null,
                  "categoryName": "Feu de position / d'encombrement / composants",
                  "level": 4,
                  "children": {
                    "Disperseur, feu de gabarit": {
                      "categoryId": 101785,
                      "categoryName": "Side Marker/End Outline Marker Light/Parts",
                      "level": 3,
                      "children": {
                        "Feu d'encombrement": {
                          "categoryId": null,
                          "categoryName": "Feu d'encombrement",
                          "level": 6,
                          "children": {
                            "Disperseur, feu de gabarit": {
                              "categoryId": 101787,
                              "categoryName": "End Outline Marker Light",
                              "level": 4,
                              "children": [],
                              "productId": 3458
                            }
                          }
                        }
                      },
                      "productId": 3458
                    }
                  }
                }
              },
              "productId": 3458
            },
            "Disperseur, feu de position": {
              "categoryId": 101705,
              "categoryName": "Vehicle Rear",
              "level": 2,
              "children": {
                "Feu de position / d'encombrement / composants": {
                  "categoryId": null,
                  "categoryName": "Feu de position / d'encombrement / composants",
                  "level": 4,
                  "children": {
                    "Disperseur, feu de position": {
                      "categoryId": 101785,
                      "categoryName": "Side Marker/End Outline Marker Light/Parts",
                      "level": 3,
                      "children": {
                        "Composants": {
                          "categoryId": null,
                          "categoryName": "Composants",
                          "level": 6,
                          "children": {
                            "Disperseur, feu de position": {
                              "categoryId": 101790,
                              "categoryName": "Parts",
                              "level": 4,
                              "children": [],
                              "productId": 1174
                            }
                          }
                        }
                      },
                      "productId": 1174
                    }
                  }
                }
              },
              "productId": 1174
            },
            "Disperseur, feu de recul": {
              "categoryId": 101705,
              "categoryName": "Vehicle Rear",
              "level": 2,
              "children": {
                "Feu de recul / composants": {
                  "categoryId": null,
                  "categoryName": "Feu de recul / composants",
                  "level": 4,
                  "children": {
                    "Disperseur, feu de recul": {
                      "categoryId": 101739,
                      "categoryName": "Reverse Light/Parts",
                      "level": 3,
                      "children": {
                        "Composants de feu de recul": {
                          "categoryId": null,
                          "categoryName": "Composants de feu de recul",
                          "level": 6,
                          "children": {
                            "Disperseur, feu de recul": {
                              "categoryId": 101741,
                              "categoryName": "Reverse Light Parts",
                              "level": 4,
                              "children": [],
                              "productId": 96
                            }
                          }
                        }
                      },
                      "productId": 96
                    }
                  }
                }
              },
              "productId": 96
            },
            "Disperseur, feu de stationnement": {
              "categoryId": 101705,
              "categoryName": "Vehicle Rear",
              "level": 2,
              "children": {
                "Feu de position / d'encombrement / composants": {
                  "categoryId": null,
                  "categoryName": "Feu de position / d'encombrement / composants",
                  "level": 4,
                  "children": {
                    "Disperseur, feu de stationnement": {
                      "categoryId": 101785,
                      "categoryName": "Side Marker/End Outline Marker Light/Parts",
                      "level": 3,
                      "children": {
                        "Feu de stationnement/de position": {
                          "categoryId": null,
                          "categoryName": "Feu de stationnement/de position",
                          "level": 6,
                          "children": {
                            "Disperseur, feu de stationnement": {
                              "categoryId": 101786,
                              "categoryName": "Park/Position Light",
                              "level": 4,
                              "children": [],
                              "productId": 2547
                            }
                          }
                        }
                      },
                      "productId": 2547
                    }
                  }
                }
              },
              "productId": 2547
            },
            "Disperseur, feu éclaireur de plaque": {
              "categoryId": 101705,
              "categoryName": "Vehicle Rear",
              "level": 2,
              "children": {
                "Feu éclaireur de plaque/composants": {
                  "categoryId": null,
                  "categoryName": "Feu éclaireur de plaque/composants",
                  "level": 4,
                  "children": {
                    "Disperseur, feu éclaireur de plaque": {
                      "categoryId": 101731,
                      "categoryName": "Licence Plate Light/-Parts",
                      "level": 3,
                      "children": {
                        "Composants du feu éclaireur de plaque": {
                          "categoryId": null,
                          "categoryName": "Composants du feu éclaireur de plaque",
                          "level": 6,
                          "children": {
                            "Disperseur, feu éclaireur de plaque": {
                              "categoryId": 101733,
                              "categoryName": "Licence Plate Light Parts",
                              "level": 4,
                              "children": [],
                              "productId": 94
                            }
                          }
                        }
                      },
                      "productId": 94
                    }
                  }
                }
              },
              "productId": 94
            },
            "Disperseur, feu latéral": {
              "categoryId": 101705,
              "categoryName": "Vehicle Rear",
              "level": 2,
              "children": {
                "Feu de position / d'encombrement / composants": {
                  "categoryId": null,
                  "categoryName": "Feu de position / d'encombrement / composants",
                  "level": 4,
                  "children": {
                    "Disperseur, feu latéral": {
                      "categoryId": 101785,
                      "categoryName": "Side Marker/End Outline Marker Light/Parts",
                      "level": 3,
                      "children": {
                        "Feux latéraux": {
                          "categoryId": null,
                          "categoryName": "Feux latéraux",
                          "level": 6,
                          "children": {
                            "Disperseur, feu latéral": {
                              "categoryId": 101788,
                              "categoryName": "Side Marker Lights",
                              "level": 4,
                              "children": [],
                              "productId": 3451
                            }
                          }
                        }
                      },
                      "productId": 3451
                    }
                  }
                }
              },
              "productId": 3451
            },
            "Disperseur, feu stop": {
              "categoryId": 101705,
              "categoryName": "Vehicle Rear",
              "level": 2,
              "children": {
                "Feu-stop / composants": {
                  "categoryId": null,
                  "categoryName": "Feu-stop / composants",
                  "level": 4,
                  "children": {
                    "Disperseur, feu stop": {
                      "categoryId": 101722,
                      "categoryName": "Stop Light/Parts",
                      "level": 3,
                      "children": {
                        "Composants des feux de stop": {
                          "categoryId": null,
                          "categoryName": "Composants des feux de stop",
                          "level": 6,
                          "children": {
                            "Disperseur, feu stop": {
                              "categoryId": 101725,
                              "categoryName": "Stop Light Parts",
                              "level": 4,
                              "children": [],
                              "productId": 92
                            }
                          }
                        }
                      },
                      "productId": 92
                    }
                  }
                }
              },
              "productId": 92
            }
          }
        },
        "Avant du véhicule": {
          "categoryId": null,
          "categoryName": "Avant du véhicule",
          "level": 2,
          "children": {
            "Disperseur, feu clignotant": {
              "categoryId": 101648,
              "categoryName": "Vehicle Front",
              "level": 2,
              "children": {
                "Feu clignotant/composants": {
                  "categoryId": null,
                  "categoryName": "Feu clignotant/composants",
                  "level": 4,
                  "children": {
                    "Disperseur, feu clignotant": {
                      "categoryId": 101669,
                      "categoryName": "Direction Indicator/Parts",
                      "level": 3,
                      "children": {
                        "Composants de feu clignotant": {
                          "categoryId": null,
                          "categoryName": "Composants de feu clignotant",
                          "level": 6,
                          "children": {
                            "Disperseur, feu clignotant": {
                              "categoryId": 101671,
                              "categoryName": "Indicator Parts",
                              "level": 4,
                              "children": [],
                              "productId": 91
                            }
                          }
                        }
                      },
                      "productId": 91
                    }
                  }
                }
              },
              "productId": 91
            },
            "Disperseur, feu d'encombrement": {
              "categoryId": 101648,
              "categoryName": "Vehicle Front",
              "level": 2,
              "children": {
                "Feu de position / d'encombrement / composants": {
                  "categoryId": null,
                  "categoryName": "Feu de position / d'encombrement / composants",
                  "level": 4,
                  "children": {
                    "Disperseur, feu d'encombrement": {
                      "categoryId": 101766,
                      "categoryName": "Side Marker/End Outline Marker Light/Parts",
                      "level": 3,
                      "children": {
                        "Composants": {
                          "categoryId": null,
                          "categoryName": "Composants",
                          "level": 6,
                          "children": {
                            "Disperseur, feu d'encombrement": {
                              "categoryId": 101771,
                              "categoryName": "Parts",
                              "level": 4,
                              "children": [],
                              "productId": 1175
                            }
                          }
                        }
                      },
                      "productId": 1175
                    }
                  }
                }
              },
              "productId": 1175
            },
            "Disperseur, feu de gabarit": {
              "categoryId": 101648,
              "categoryName": "Vehicle Front",
              "level": 2,
              "children": {
                "Feu de position / d'encombrement / composants": {
                  "categoryId": null,
                  "categoryName": "Feu de position / d'encombrement / composants",
                  "level": 4,
                  "children": {
                    "Disperseur, feu de gabarit": {
                      "categoryId": 101766,
                      "categoryName": "Side Marker/End Outline Marker Light/Parts",
                      "level": 3,
                      "children": {
                        "Feu d'encombrement": {
                          "categoryId": null,
                          "categoryName": "Feu d'encombrement",
                          "level": 6,
                          "children": {
                            "Disperseur, feu de gabarit": {
                              "categoryId": 101768,
                              "categoryName": "End Outline Marker Light",
                              "level": 4,
                              "children": [],
                              "productId": 3458
                            }
                          }
                        }
                      },
                      "productId": 3458
                    }
                  }
                }
              },
              "productId": 3458
            },
            "Disperseur, feu de position": {
              "categoryId": 101648,
              "categoryName": "Vehicle Front",
              "level": 2,
              "children": {
                "Feu de position / d'encombrement / composants": {
                  "categoryId": null,
                  "categoryName": "Feu de position / d'encombrement / composants",
                  "level": 4,
                  "children": {
                    "Disperseur, feu de position": {
                      "categoryId": 101766,
                      "categoryName": "Side Marker/End Outline Marker Light/Parts",
                      "level": 3,
                      "children": {
                        "Composants": {
                          "categoryId": null,
                          "categoryName": "Composants",
                          "level": 6,
                          "children": {
                            "Disperseur, feu de position": {
                              "categoryId": 101771,
                              "categoryName": "Parts",
                              "level": 4,
                              "children": [],
                              "productId": 1174
                            }
                          }
                        }
                      },
                      "productId": 1174
                    }
                  }
                }
              },
              "productId": 1174
            },
            "Disperseur, feu de stationnement": {
              "categoryId": 101648,
              "categoryName": "Vehicle Front",
              "level": 2,
              "children": {
                "Feu de position / d'encombrement / composants": {
                  "categoryId": null,
                  "categoryName": "Feu de position / d'encombrement / composants",
                  "level": 4,
                  "children": {
                    "Disperseur, feu de stationnement": {
                      "categoryId": 101766,
                      "categoryName": "Side Marker/End Outline Marker Light/Parts",
                      "level": 3,
                      "children": {
                        "Feu de stationnement/de position": {
                          "categoryId": null,
                          "categoryName": "Feu de stationnement/de position",
                          "level": 6,
                          "children": {
                            "Disperseur, feu de stationnement": {
                              "categoryId": 101767,
                              "categoryName": "Park/Position Light",
                              "level": 4,
                              "children": [],
                              "productId": 2547
                            }
                          }
                        }
                      },
                      "productId": 2547
                    }
                  }
                }
              },
              "productId": 2547
            },
            "Disperseur, feu latéral": {
              "categoryId": 101648,
              "categoryName": "Vehicle Front",
              "level": 2,
              "children": {
                "Feu de position / d'encombrement / composants": {
                  "categoryId": null,
                  "categoryName": "Feu de position / d'encombrement / composants",
                  "level": 4,
                  "children": {
                    "Disperseur, feu latéral": {
                      "categoryId": 101766,
                      "categoryName": "Side Marker/End Outline Marker Light/Parts",
                      "level": 3,
                      "children": {
                        "Feux latéraux": {
                          "categoryId": null,
                          "categoryName": "Feux latéraux",
                          "level": 6,
                          "children": {
                            "Disperseur, feu latéral": {
                              "categoryId": 101769,
                              "categoryName": "Side Marker Lights",
                              "level": 4,
                              "children": [],
                              "productId": 3451
                            }
                          }
                        }
                      },
                      "productId": 3451
                    }
                  }
                }
              },
              "productId": 3451
            },
            "Disperseur, projecteur antibrouillard": {
              "categoryId": 101648,
              "categoryName": "Vehicle Front",
              "level": 2,
              "children": {
                "Projecteur antibrouillard/ composants": {
                  "categoryId": null,
                  "categoryName": "Projecteur antibrouillard/ composants",
                  "level": 4,
                  "children": {
                    "Disperseur, projecteur antibrouillard": {
                      "categoryId": 101661,
                      "categoryName": "Front Fog Light/Parts",
                      "level": 3,
                      "children": {
                        "Composants pour projecteur antibrouillard": {
                          "categoryId": null,
                          "categoryName": "Composants pour projecteur antibrouillard",
                          "level": 6,
                          "children": {
                            "Disperseur, projecteur antibrouillard": {
                              "categoryId": 101664,
                              "categoryName": "Fog Light Parts",
                              "level": 4,
                              "children": [],
                              "productId": 85
                            }
                          }
                        }
                      },
                      "productId": 85
                    }
                  }
                }
              },
              "productId": 85
            },
            "Disperseur, projecteur longue portée": {
              "categoryId": 101648,
              "categoryName": "Vehicle Front",
              "level": 2,
              "children": {
                "Projecteur longue portée / composants": {
                  "categoryId": null,
                  "categoryName": "Projecteur longue portée / composants",
                  "level": 4,
                  "children": {
                    "Disperseur, projecteur longue portée": {
                      "categoryId": 101665,
                      "categoryName": "Spotlight/Parts",
                      "level": 3,
                      "children": {
                        "Projecteur longue portée / composants": {
                          "categoryId": null,
                          "categoryName": "Projecteur longue portée / composants",
                          "level": 6,
                          "children": {
                            "Disperseur, projecteur longue portée": {
                              "categoryId": 101668,
                              "categoryName": "Spotlight Parts",
                              "level": 4,
                              "children": [],
                              "productId": 16
                            }
                          }
                        }
                      },
                      "productId": 16
                    }
                  }
                }
              },
              "productId": 16
            },
            "Disperseur, projecteur principal": {
              "categoryId": 101648,
              "categoryName": "Vehicle Front",
              "level": 2,
              "children": {
                "Projecteurs principaux / composants": {
                  "categoryId": null,
                  "categoryName": "Projecteurs principaux / composants",
                  "level": 4,
                  "children": {
                    "Disperseur, projecteur principal": {
                      "categoryId": 101656,
                      "categoryName": "Headlight/Parts",
                      "level": 3,
                      "children": {
                        "Composants des projecteurs principaux": {
                          "categoryId": null,
                          "categoryName": "Composants des projecteurs principaux",
                          "level": 6,
                          "children": {
                            "Disperseur, projecteur principal": {
                              "categoryId": 101659,
                              "categoryName": "Headlight Parts",
                              "level": 4,
                              "children": [],
                              "productId": 3499
                            }
                          }
                        }
                      },
                      "productId": 3499
                    }
                  }
                }
              },
              "productId": 3499
            }
          }
        },
        "Feux": {
          "categoryId": null,
          "categoryName": "Feux",
          "level": 2,
          "children": {
            "Disperseur, feu antibrouillard arrière": {
              "categoryId": 101407,
              "categoryName": "Lights",
              "level": 2,
              "children": {
                "Feu de brouillard arrière/Composants": {
                  "categoryId": null,
                  "categoryName": "Feu de brouillard arrière/Composants",
                  "level": 4,
                  "children": {
                    "Disperseur, feu antibrouillard arrière": {
                      "categoryId": 101428,
                      "categoryName": "Rear Fog Light/Parts",
                      "level": 3,
                      "children": {
                        "Composants de feu de brouillard arrière": {
                          "categoryId": null,
                          "categoryName": "Composants de feu de brouillard arrière",
                          "level": 6,
                          "children": {
                            "Disperseur, feu antibrouillard arrière": {
                              "categoryId": 101430,
                              "categoryName": "Rear Fog Light Individual Parts",
                              "level": 4,
                              "children": [],
                              "productId": 95
                            }
                          }
                        }
                      },
                      "productId": 95
                    }
                  }
                }
              },
              "productId": 95
            },
            "Disperseur, feu arrière": {
              "categoryId": 101407,
              "categoryName": "Lights",
              "level": 2,
              "children": {
                "Feu arrière / composants": {
                  "categoryId": null,
                  "categoryName": "Feu arrière / composants",
                  "level": 4,
                  "children": {
                    "Disperseur, feu arrière": {
                      "categoryId": 101408,
                      "categoryName": "Tail Light Assembly/Parts",
                      "level": 3,
                      "children": {
                        "Composants de feu arrière": {
                          "categoryId": null,
                          "categoryName": "Composants de feu arrière",
                          "level": 6,
                          "children": {
                            "Disperseur, feu arrière": {
                              "categoryId": 101410,
                              "categoryName": "Tail Light Assembly Parts",
                              "level": 4,
                              "children": [],
                              "productId": 93
                            }
                          }
                        }
                      },
                      "productId": 93
                    }
                  }
                },
                "Feu arrière/Composants": {
                  "categoryId": null,
                  "categoryName": "Feu arrière/Composants",
                  "level": 4,
                  "children": {
                    "Disperseur, feu arrière": {
                      "categoryId": 101411,
                      "categoryName": "Tail Light/Parts",
                      "level": 3,
                      "children": {
                        "Composants de feu arrière": {
                          "categoryId": null,
                          "categoryName": "Composants de feu arrière",
                          "level": 6,
                          "children": {
                            "Disperseur, feu arrière": {
                              "categoryId": 101413,
                              "categoryName": "Tail Light Individual Parts",
                              "level": 4,
                              "children": [],
                              "productId": 97
                            }
                          }
                        }
                      },
                      "productId": 97
                    }
                  }
                }
              },
              "productId": 97
            },
            "Disperseur, feu clignotant": {
              "categoryId": 101407,
              "categoryName": "Lights",
              "level": 2,
              "children": {
                "Feu clignotant/composants": {
                  "categoryId": null,
                  "categoryName": "Feu clignotant/composants",
                  "level": 4,
                  "children": {
                    "Disperseur, feu clignotant": {
                      "categoryId": 101420,
                      "categoryName": "Direction Indicator/Parts",
                      "level": 3,
                      "children": {
                        "Composants de feu clignotant": {
                          "categoryId": null,
                          "categoryName": "Composants de feu clignotant",
                          "level": 6,
                          "children": {
                            "Disperseur, feu clignotant": {
                              "categoryId": 101422,
                              "categoryName": "Indicator Parts",
                              "level": 4,
                              "children": [],
                              "productId": 91
                            }
                          }
                        }
                      },
                      "productId": 91
                    }
                  }
                }
              },
              "productId": 91
            },
            "Disperseur, feu d'encombrement": {
              "categoryId": 101407,
              "categoryName": "Lights",
              "level": 2,
              "children": {
                "Feu de position / d'encombrement / composants": {
                  "categoryId": null,
                  "categoryName": "Feu de position / d'encombrement / composants",
                  "level": 4,
                  "children": {
                    "Disperseur, feu d'encombrement": {
                      "categoryId": 101441,
                      "categoryName": "Side Marker/End Outline Marker Light/Parts",
                      "level": 3,
                      "children": {
                        "Composants": {
                          "categoryId": null,
                          "categoryName": "Composants",
                          "level": 6,
                          "children": {
                            "Disperseur, feu d'encombrement": {
                              "categoryId": 101446,
                              "categoryName": "Parts",
                              "level": 4,
                              "children": [],
                              "productId": 1175
                            }
                          }
                        }
                      },
                      "productId": 1175
                    }
                  }
                }
              },
              "productId": 1175
            },
            "Disperseur, feu de gabarit": {
              "categoryId": 101407,
              "categoryName": "Lights",
              "level": 2,
              "children": {
                "Feu de position / d'encombrement / composants": {
                  "categoryId": null,
                  "categoryName": "Feu de position / d'encombrement / composants",
                  "level": 4,
                  "children": {
                    "Disperseur, feu de gabarit": {
                      "categoryId": 101441,
                      "categoryName": "Side Marker/End Outline Marker Light/Parts",
                      "level": 3,
                      "children": {
                        "Feu d'encombrement": {
                          "categoryId": null,
                          "categoryName": "Feu d'encombrement",
                          "level": 6,
                          "children": {
                            "Disperseur, feu de gabarit": {
                              "categoryId": 101443,
                              "categoryName": "End Outline Marker Light",
                              "level": 4,
                              "children": [],
                              "productId": 3458
                            }
                          }
                        }
                      },
                      "productId": 3458
                    }
                  }
                }
              },
              "productId": 3458
            },
            "Disperseur, feu de position": {
              "categoryId": 101407,
              "categoryName": "Lights",
              "level": 2,
              "children": {
                "Feu de position / d'encombrement / composants": {
                  "categoryId": null,
                  "categoryName": "Feu de position / d'encombrement / composants",
                  "level": 4,
                  "children": {
                    "Disperseur, feu de position": {
                      "categoryId": 101441,
                      "categoryName": "Side Marker/End Outline Marker Light/Parts",
                      "level": 3,
                      "children": {
                        "Composants": {
                          "categoryId": null,
                          "categoryName": "Composants",
                          "level": 6,
                          "children": {
                            "Disperseur, feu de position": {
                              "categoryId": 101446,
                              "categoryName": "Parts",
                              "level": 4,
                              "children": [],
                              "productId": 1174
                            }
                          }
                        }
                      },
                      "productId": 1174
                    }
                  }
                }
              },
              "productId": 1174
            },
            "Disperseur, feu de recul": {
              "categoryId": 101407,
              "categoryName": "Lights",
              "level": 2,
              "children": {
                "Feu de recul / composants": {
                  "categoryId": null,
                  "categoryName": "Feu de recul / composants",
                  "level": 4,
                  "children": {
                    "Disperseur, feu de recul": {
                      "categoryId": 101432,
                      "categoryName": "Reverse Light/Parts",
                      "level": 3,
                      "children": {
                        "Composants de feu de recul": {
                          "categoryId": null,
                          "categoryName": "Composants de feu de recul",
                          "level": 6,
                          "children": {
                            "Disperseur, feu de recul": {
                              "categoryId": 101434,
                              "categoryName": "Reverse Light Parts",
                              "level": 4,
                              "children": [],
                              "productId": 96
                            }
                          }
                        }
                      },
                      "productId": 96
                    }
                  }
                }
              },
              "productId": 96
            },
            "Disperseur, feu de stationnement": {
              "categoryId": 101407,
              "categoryName": "Lights",
              "level": 2,
              "children": {
                "Feu de position / d'encombrement / composants": {
                  "categoryId": null,
                  "categoryName": "Feu de position / d'encombrement / composants",
                  "level": 4,
                  "children": {
                    "Disperseur, feu de stationnement": {
                      "categoryId": 101441,
                      "categoryName": "Side Marker/End Outline Marker Light/Parts",
                      "level": 3,
                      "children": {
                        "Feu de stationnement/de position": {
                          "categoryId": null,
                          "categoryName": "Feu de stationnement/de position",
                          "level": 6,
                          "children": {
                            "Disperseur, feu de stationnement": {
                              "categoryId": 101442,
                              "categoryName": "Park/Position Light",
                              "level": 4,
                              "children": [],
                              "productId": 2547
                            }
                          }
                        }
                      },
                      "productId": 2547
                    }
                  }
                }
              },
              "productId": 2547
            },
            "Disperseur, feu éclaireur de plaque": {
              "categoryId": 101407,
              "categoryName": "Lights",
              "level": 2,
              "children": {
                "Feu éclaireur de plaque/composants": {
                  "categoryId": null,
                  "categoryName": "Feu éclaireur de plaque/composants",
                  "level": 4,
                  "children": {
                    "Disperseur, feu éclaireur de plaque": {
                      "categoryId": 101424,
                      "categoryName": "Licence Plate Light/-Parts",
                      "level": 3,
                      "children": {
                        "Composants du feu éclaireur de plaque": {
                          "categoryId": null,
                          "categoryName": "Composants du feu éclaireur de plaque",
                          "level": 6,
                          "children": {
                            "Disperseur, feu éclaireur de plaque": {
                              "categoryId": 101426,
                              "categoryName": "Licence Plate Light Parts",
                              "level": 4,
                              "children": [],
                              "productId": 94
                            }
                          }
                        }
                      },
                      "productId": 94
                    }
                  }
                }
              },
              "productId": 94
            },
            "Disperseur, feu latéral": {
              "categoryId": 101407,
              "categoryName": "Lights",
              "level": 2,
              "children": {
                "Feu de position / d'encombrement / composants": {
                  "categoryId": null,
                  "categoryName": "Feu de position / d'encombrement / composants",
                  "level": 4,
                  "children": {
                    "Disperseur, feu latéral": {
                      "categoryId": 101441,
                      "categoryName": "Side Marker/End Outline Marker Light/Parts",
                      "level": 3,
                      "children": {
                        "Feux latéraux": {
                          "categoryId": null,
                          "categoryName": "Feux latéraux",
                          "level": 6,
                          "children": {
                            "Disperseur, feu latéral": {
                              "categoryId": 101444,
                              "categoryName": "Side Marker Lights",
                              "level": 4,
                              "children": [],
                              "productId": 3451
                            }
                          }
                        }
                      },
                      "productId": 3451
                    }
                  }
                }
              },
              "productId": 3451
            },
            "Disperseur, feu stop": {
              "categoryId": 101407,
              "categoryName": "Lights",
              "level": 2,
              "children": {
                "Feu-stop / composants": {
                  "categoryId": null,
                  "categoryName": "Feu-stop / composants",
                  "level": 4,
                  "children": {
                    "Disperseur, feu stop": {
                      "categoryId": 101415,
                      "categoryName": "Stop Light/Parts",
                      "level": 3,
                      "children": {
                        "Composants des feux de stop": {
                          "categoryId": null,
                          "categoryName": "Composants des feux de stop",
                          "level": 6,
                          "children": {
                            "Disperseur, feu stop": {
                              "categoryId": 101418,
                              "categoryName": "Stop Light Parts",
                              "level": 4,
                              "children": [],
                              "productId": 92
                            }
                          }
                        }
                      },
                      "productId": 92
                    }
                  }
                }
              },
              "productId": 92
            }
          }
        },
        "Phares supplémentaires/composants": {
          "categoryId": null,
          "categoryName": "Phares supplémentaires/composants",
          "level": 2,
          "children": {
            "Disperseur, phare chercheur": {
              "categoryId": 101340,
              "categoryName": "Additional Headlight/Parts",
              "level": 2,
              "children": {
                "Phare chercheur / composants": {
                  "categoryId": null,
                  "categoryName": "Phare chercheur / composants",
                  "level": 4,
                  "children": {
                    "Disperseur, phare chercheur": {
                      "categoryId": 101353,
                      "categoryName": "Searchlight/Parts",
                      "level": 3,
                      "children": {
                        "Composants phare chercheur": {
                          "categoryId": null,
                          "categoryName": "Composants phare chercheur",
                          "level": 6,
                          "children": {
                            "Disperseur, phare chercheur": {
                              "categoryId": 101356,
                              "categoryName": "Searchlight Parts",
                              "level": 4,
                              "children": [],
                              "productId": 15
                            }
                          }
                        }
                      },
                      "productId": 15
                    }
                  }
                }
              },
              "productId": 15
            },
            "Disperseur, projecteur antibrouillard": {
              "categoryId": 101340,
              "categoryName": "Additional Headlight/Parts",
              "level": 2,
              "children": {
                "Projecteur antibrouillard/ composants": {
                  "categoryId": null,
                  "categoryName": "Projecteur antibrouillard/ composants",
                  "level": 4,
                  "children": {
                    "Disperseur, projecteur antibrouillard": {
                      "categoryId": 101341,
                      "categoryName": "Front Fog Light/Parts",
                      "level": 3,
                      "children": {
                        "Composants pour projecteur antibrouillard": {
                          "categoryId": null,
                          "categoryName": "Composants pour projecteur antibrouillard",
                          "level": 6,
                          "children": {
                            "Disperseur, projecteur antibrouillard": {
                              "categoryId": 101344,
                              "categoryName": "Fog Light Parts",
                              "level": 4,
                              "children": [],
                              "productId": 85
                            }
                          }
                        }
                      },
                      "productId": 85
                    }
                  }
                }
              },
              "productId": 85
            },
            "Disperseur, projecteur de travail": {
              "categoryId": 101340,
              "categoryName": "Additional Headlight/Parts",
              "level": 2,
              "children": {
                "Projecteur de travail, composants": {
                  "categoryId": null,
                  "categoryName": "Projecteur de travail, composants",
                  "level": 4,
                  "children": {
                    "Disperseur, projecteur de travail": {
                      "categoryId": 101349,
                      "categoryName": "Worklight/Parts",
                      "level": 3,
                      "children": {
                        "Projecteur de travail, composants": {
                          "categoryId": null,
                          "categoryName": "Projecteur de travail, composants",
                          "level": 6,
                          "children": {
                            "Disperseur, projecteur de travail": {
                              "categoryId": 101352,
                              "categoryName": "Worklight Parts",
                              "level": 4,
                              "children": [],
                              "productId": 84
                            }
                          }
                        }
                      },
                      "productId": 84
                    }
                  }
                }
              },
              "productId": 84
            },
            "Disperseur, projecteur longue portée": {
              "categoryId": 101340,
              "categoryName": "Additional Headlight/Parts",
              "level": 2,
              "children": {
                "Projecteur longue portée / composants": {
                  "categoryId": null,
                  "categoryName": "Projecteur longue portée / composants",
                  "level": 4,
                  "children": {
                    "Disperseur, projecteur longue portée": {
                      "categoryId": 101345,
                      "categoryName": "Spotlight/Parts",
                      "level": 3,
                      "children": {
                        "Projecteur longue portée / composants": {
                          "categoryId": null,
                          "categoryName": "Projecteur longue portée / composants",
                          "level": 6,
                          "children": {
                            "Disperseur, projecteur longue portée": {
                              "categoryId": 101348,
                              "categoryName": "Spotlight Parts",
                              "level": 4,
                              "children": [],
                              "productId": 16
                            }
                          }
                        }
                      },
                      "productId": 16
                    }
                  }
                }
              },
              "productId": 16
            }
          }
        },
        "Projecteurs principaux / composants": {
          "categoryId": null,
          "categoryName": "Projecteurs principaux / composants",
          "level": 2,
          "children": {
            "Disperseur, projecteur principal": {
              "categoryId": 101465,
              "categoryName": "Headlight/Parts",
              "level": 2,
              "children": {
                "Composants des projecteurs principaux": {
                  "categoryId": null,
                  "categoryName": "Composants des projecteurs principaux",
                  "level": 4,
                  "children": {
                    "Disperseur, projecteur principal": {
                      "categoryId": 101468,
                      "categoryName": "Headlight Parts",
                      "level": 3,
                      "children": [],
                      "productId": 3499
                    }
                  }
                }
              },
              "productId": 3499
            }
          }
        }
      }
    },
    "Système électrique": {
      "categoryId": 100010,
      "categoryName": "Système électrique",
      "level": 1,
      "children": {
        "Feux": {
          "categoryId": null,
          "categoryName": "Feux",
          "level": 2,
          "children": {
            "Cabochon, gyrophare": {
              "categoryId": 100043,
              "categoryName": "Lights",
              "level": 2,
              "children": {
                "Gyrophare / composants": {
                  "categoryId": null,
                  "categoryName": "Gyrophare / composants",
                  "level": 4,
                  "children": {
                    "Cabochon, gyrophare": {
                      "categoryId": 100289,
                      "categoryName": "Rotating Beacon/Parts",
                      "level": 3,
                      "children": {
                        "Composants du gyrophare": {
                          "categoryId": null,
                          "categoryName": "Composants du gyrophare",
                          "level": 6,
                          "children": {
                            "Cabochon, gyrophare": {
                              "categoryId": 100487,
                              "categoryName": "Rotating Beacon Parts",
                              "level": 4,
                              "children": [],
                              "productId": 98
                            }
                          }
                        }
                      },
                      "productId": 98
                    }
                  }
                }
              },
              "productId": 98
            },
            "Disperseur, feu antibrouillard arrière": {
              "categoryId": 100043,
              "categoryName": "Lights",
              "level": 2,
              "children": {
                "Feu de brouillard arrière/Composants": {
                  "categoryId": null,
                  "categoryName": "Feu de brouillard arrière/Composants",
                  "level": 4,
                  "children": {
                    "Disperseur, feu antibrouillard arrière": {
                      "categoryId": 100285,
                      "categoryName": "Rear Fog Light/Parts",
                      "level": 3,
                      "children": {
                        "Composants de feu de brouillard arrière": {
                          "categoryId": null,
                          "categoryName": "Composants de feu de brouillard arrière",
                          "level": 6,
                          "children": {
                            "Disperseur, feu antibrouillard arrière": {
                              "categoryId": 100484,
                              "categoryName": "Rear Fog Light Individual Parts",
                              "level": 4,
                              "children": [],
                              "productId": 95
                            }
                          }
                        }
                      },
                      "productId": 95
                    }
                  }
                }
              },
              "productId": 95
            },
            "Disperseur, feu arrière": {
              "categoryId": 100043,
              "categoryName": "Lights",
              "level": 2,
              "children": {
                "Feu arrière / composants": {
                  "categoryId": null,
                  "categoryName": "Feu arrière / composants",
                  "level": 4,
                  "children": {
                    "Disperseur, feu arrière": {
                      "categoryId": 100275,
                      "categoryName": "Tail Light Assembly/Parts",
                      "level": 3,
                      "children": {
                        "Composants de feu arrière": {
                          "categoryId": null,
                          "categoryName": "Composants de feu arrière",
                          "level": 6,
                          "children": {
                            "Disperseur, feu arrière": {
                              "categoryId": 100456,
                              "categoryName": "Tail Light Assembly Parts",
                              "level": 4,
                              "children": [],
                              "productId": 97
                            }
                          }
                        }
                      },
                      "productId": 97
                    }
                  }
                }
              },
              "productId": 97
            },
            "Disperseur, feu clignotant": {
              "categoryId": 100043,
              "categoryName": "Lights",
              "level": 2,
              "children": {
                "Feu clignotant/composants": {
                  "categoryId": null,
                  "categoryName": "Feu clignotant/composants",
                  "level": 4,
                  "children": {
                    "Disperseur, feu clignotant": {
                      "categoryId": 100145,
                      "categoryName": "Direction Indicator/Parts",
                      "level": 3,
                      "children": {
                        "Composants de feu clignotant": {
                          "categoryId": null,
                          "categoryName": "Composants de feu clignotant",
                          "level": 6,
                          "children": {
                            "Disperseur, feu clignotant": {
                              "categoryId": 100480,
                              "categoryName": "Indicator Parts",
                              "level": 4,
                              "children": [],
                              "productId": 91
                            }
                          }
                        }
                      },
                      "productId": 91
                    }
                  }
                }
              },
              "productId": 91
            },
            "Disperseur, feu d'encombrement": {
              "categoryId": 100043,
              "categoryName": "Lights",
              "level": 2,
              "children": {
                "Feu de position / d'encombrement / composants": {
                  "categoryId": null,
                  "categoryName": "Feu de position / d'encombrement / composants",
                  "level": 4,
                  "children": {
                    "Disperseur, feu d'encombrement": {
                      "categoryId": 100290,
                      "categoryName": "Side Marker/End Outline Marker Light/Parts",
                      "level": 3,
                      "children": {
                        "Composants": {
                          "categoryId": null,
                          "categoryName": "Composants",
                          "level": 6,
                          "children": {
                            "Disperseur, feu d'encombrement": {
                              "categoryId": 100495,
                              "categoryName": "Parts",
                              "level": 4,
                              "children": [],
                              "productId": 1175
                            }
                          }
                        }
                      },
                      "productId": 1175
                    }
                  }
                }
              },
              "productId": 1175
            },
            "Disperseur, feu de gabarit": {
              "categoryId": 100043,
              "categoryName": "Lights",
              "level": 2,
              "children": {
                "Feu de position / d'encombrement / composants": {
                  "categoryId": null,
                  "categoryName": "Feu de position / d'encombrement / composants",
                  "level": 4,
                  "children": {
                    "Disperseur, feu de gabarit": {
                      "categoryId": 100290,
                      "categoryName": "Side Marker/End Outline Marker Light/Parts",
                      "level": 3,
                      "children": {
                        "Feu d'encombrement": {
                          "categoryId": null,
                          "categoryName": "Feu d'encombrement",
                          "level": 6,
                          "children": {
                            "Disperseur, feu de gabarit": {
                              "categoryId": 100469,
                              "categoryName": "End Outline Marker Light",
                              "level": 4,
                              "children": [],
                              "productId": 3458
                            }
                          }
                        }
                      },
                      "productId": 3458
                    }
                  }
                }
              },
              "productId": 3458
            },
            "Disperseur, feu de position": {
              "categoryId": 100043,
              "categoryName": "Lights",
              "level": 2,
              "children": {
                "Feu de position / d'encombrement / composants": {
                  "categoryId": null,
                  "categoryName": "Feu de position / d'encombrement / composants",
                  "level": 4,
                  "children": {
                    "Disperseur, feu de position": {
                      "categoryId": 100290,
                      "categoryName": "Side Marker/End Outline Marker Light/Parts",
                      "level": 3,
                      "children": {
                        "Composants": {
                          "categoryId": null,
                          "categoryName": "Composants",
                          "level": 6,
                          "children": {
                            "Disperseur, feu de position": {
                              "categoryId": 100495,
                              "categoryName": "Parts",
                              "level": 4,
                              "children": [],
                              "productId": 1174
                            }
                          }
                        }
                      },
                      "productId": 1174
                    }
                  }
                }
              },
              "productId": 1174
            },
            "Disperseur, feu de recul": {
              "categoryId": 100043,
              "categoryName": "Lights",
              "level": 2,
              "children": {
                "Feu de recul / composants": {
                  "categoryId": null,
                  "categoryName": "Feu de recul / composants",
                  "level": 4,
                  "children": {
                    "Disperseur, feu de recul": {
                      "categoryId": 100287,
                      "categoryName": "Reverse Light/Parts",
                      "level": 3,
                      "children": {
                        "Composants de feu de recul": {
                          "categoryId": null,
                          "categoryName": "Composants de feu de recul",
                          "level": 6,
                          "children": {
                            "Disperseur, feu de recul": {
                              "categoryId": 100486,
                              "categoryName": "Reverse Light Parts",
                              "level": 4,
                              "children": [],
                              "productId": 96
                            }
                          }
                        }
                      },
                      "productId": 96
                    }
                  }
                }
              },
              "productId": 96
            },
            "Disperseur, feu de stationnement": {
              "categoryId": 100043,
              "categoryName": "Lights",
              "level": 2,
              "children": {
                "Feu de position / d'encombrement / composants": {
                  "categoryId": null,
                  "categoryName": "Feu de position / d'encombrement / composants",
                  "level": 4,
                  "children": {
                    "Disperseur, feu de stationnement": {
                      "categoryId": 100290,
                      "categoryName": "Side Marker/End Outline Marker Light/Parts",
                      "level": 3,
                      "children": {
                        "Feu de stationnement/de position": {
                          "categoryId": null,
                          "categoryName": "Feu de stationnement/de position",
                          "level": 6,
                          "children": {
                            "Disperseur, feu de stationnement": {
                              "categoryId": 100468,
                              "categoryName": "Park/Position Light",
                              "level": 4,
                              "children": [],
                              "productId": 2547
                            }
                          }
                        }
                      },
                      "productId": 2547
                    }
                  }
                }
              },
              "productId": 2547
            },
            "Disperseur, feu éclaireur de plaque": {
              "categoryId": 100043,
              "categoryName": "Lights",
              "level": 2,
              "children": {
                "Feu éclaireur de plaque/composants": {
                  "categoryId": null,
                  "categoryName": "Feu éclaireur de plaque/composants",
                  "level": 4,
                  "children": {
                    "Disperseur, feu éclaireur de plaque": {
                      "categoryId": 100147,
                      "categoryName": "Licence Plate Light/-Parts",
                      "level": 3,
                      "children": {
                        "Composants du feu éclaireur de plaque": {
                          "categoryId": null,
                          "categoryName": "Composants du feu éclaireur de plaque",
                          "level": 6,
                          "children": {
                            "Disperseur, feu éclaireur de plaque": {
                              "categoryId": 100482,
                              "categoryName": "Licence Plate Light Parts",
                              "level": 4,
                              "children": [],
                              "productId": 94
                            }
                          }
                        }
                      },
                      "productId": 94
                    }
                  }
                }
              },
              "productId": 94
            },
            "Disperseur, feu latéral": {
              "categoryId": 100043,
              "categoryName": "Lights",
              "level": 2,
              "children": {
                "Feu de position / d'encombrement / composants": {
                  "categoryId": null,
                  "categoryName": "Feu de position / d'encombrement / composants",
                  "level": 4,
                  "children": {
                    "Disperseur, feu latéral": {
                      "categoryId": 100290,
                      "categoryName": "Side Marker/End Outline Marker Light/Parts",
                      "level": 3,
                      "children": {
                        "Feux latéraux": {
                          "categoryId": null,
                          "categoryName": "Feux latéraux",
                          "level": 6,
                          "children": {
                            "Disperseur, feu latéral": {
                              "categoryId": 100753,
                              "categoryName": "Side Marker Lights",
                              "level": 4,
                              "children": [],
                              "productId": 3451
                            }
                          }
                        }
                      },
                      "productId": 3451
                    }
                  }
                }
              },
              "productId": 3451
            },
            "Disperseur, feu stop": {
              "categoryId": 100043,
              "categoryName": "Lights",
              "level": 2,
              "children": {
                "Feu-stop / composants": {
                  "categoryId": null,
                  "categoryName": "Feu-stop / composants",
                  "level": 4,
                  "children": {
                    "Disperseur, feu stop": {
                      "categoryId": 100284,
                      "categoryName": "Stop Light/Parts",
                      "level": 3,
                      "children": {
                        "Composants des feux de stop": {
                          "categoryId": null,
                          "categoryName": "Composants des feux de stop",
                          "level": 6,
                          "children": {
                            "Disperseur, feu stop": {
                              "categoryId": 100471,
                              "categoryName": "Stop Light Parts",
                              "level": 4,
                              "children": [],
                              "productId": 92
                            }
                          }
                        }
                      },
                      "productId": 92
                    }
                  }
                }
              },
              "productId": 92
            }
          }
        },
        "Instruments": {
          "categoryId": null,
          "categoryName": "Instruments",
          "level": 2,
          "children": {
            "Voyant, témoin-ABS": {
              "categoryId": 100322,
              "categoryName": "Instruments",
              "level": 2,
              "children": {
                "Instruments indicateurs": {
                  "categoryId": null,
                  "categoryName": "Instruments indicateurs",
                  "level": 4,
                  "children": {
                    "Voyant, témoin-ABS": {
                      "categoryId": 100555,
                      "categoryName": "Gauges",
                      "level": 3,
                      "children": [],
                      "productId": 4312
                    }
                  }
                }
              },
              "productId": 4312
            }
          }
        },
        "Phares supplémentaires/composants": {
          "categoryId": null,
          "categoryName": "Phares supplémentaires/composants",
          "level": 2,
          "children": {
            "Disperseur, phare chercheur": {
              "categoryId": 100787,
              "categoryName": "Additional Headlight/Parts",
              "level": 2,
              "children": {
                "Phare chercheur / composants": {
                  "categoryId": null,
                  "categoryName": "Phare chercheur / composants",
                  "level": 4,
                  "children": {
                    "Disperseur, phare chercheur": {
                      "categoryId": 100281,
                      "categoryName": "Searchlight/Parts",
                      "level": 3,
                      "children": {
                        "Composants phare chercheur": {
                          "categoryId": null,
                          "categoryName": "Composants phare chercheur",
                          "level": 6,
                          "children": {
                            "Disperseur, phare chercheur": {
                              "categoryId": 100446,
                              "categoryName": "Searchlight Parts",
                              "level": 4,
                              "children": [],
                              "productId": 15
                            }
                          }
                        }
                      },
                      "productId": 15
                    }
                  }
                }
              },
              "productId": 15
            },
            "Disperseur, projecteur antibrouillard": {
              "categoryId": 100787,
              "categoryName": "Additional Headlight/Parts",
              "level": 2,
              "children": {
                "Projecteur antibrouillard/ composants": {
                  "categoryId": null,
                  "categoryName": "Projecteur antibrouillard/ composants",
                  "level": 4,
                  "children": {
                    "Disperseur, projecteur antibrouillard": {
                      "categoryId": 100277,
                      "categoryName": "Front Fog Light/Parts",
                      "level": 3,
                      "children": {
                        "Composants pour projecteur antibrouillard": {
                          "categoryId": null,
                          "categoryName": "Composants pour projecteur antibrouillard",
                          "level": 6,
                          "children": {
                            "Disperseur, projecteur antibrouillard": {
                              "categoryId": 100444,
                              "categoryName": "Fog Light Parts",
                              "level": 4,
                              "children": [],
                              "productId": 85
                            }
                          }
                        }
                      },
                      "productId": 85
                    }
                  }
                }
              },
              "productId": 85
            },
            "Disperseur, projecteur de travail": {
              "categoryId": 100787,
              "categoryName": "Additional Headlight/Parts",
              "level": 2,
              "children": {
                "Projecteur de travail, composants": {
                  "categoryId": null,
                  "categoryName": "Projecteur de travail, composants",
                  "level": 4,
                  "children": {
                    "Disperseur, projecteur de travail": {
                      "categoryId": 100280,
                      "categoryName": "Worklight/Parts",
                      "level": 3,
                      "children": {
                        "Projecteur de travail, composants": {
                          "categoryId": null,
                          "categoryName": "Projecteur de travail, composants",
                          "level": 6,
                          "children": {
                            "Disperseur, projecteur de travail": {
                              "categoryId": 100445,
                              "categoryName": "Worklight Parts",
                              "level": 4,
                              "children": [],
                              "productId": 84
                            }
                          }
                        }
                      },
                      "productId": 84
                    }
                  }
                }
              },
              "productId": 84
            },
            "Disperseur, projecteur longue portée": {
              "categoryId": 100787,
              "categoryName": "Additional Headlight/Parts",
              "level": 2,
              "children": {
                "Projecteur longue portée / composants": {
                  "categoryId": null,
                  "categoryName": "Projecteur longue portée / composants",
                  "level": 4,
                  "children": {
                    "Disperseur, projecteur longue portée": {
                      "categoryId": 100276,
                      "categoryName": "Spotlight/Parts",
                      "level": 3,
                      "children": {
                        "Projecteur longue portée / composants": {
                          "categoryId": null,
                          "categoryName": "Projecteur longue portée / composants",
                          "level": 6,
                          "children": {
                            "Disperseur, projecteur longue portée": {
                              "categoryId": 100443,
                              "categoryName": "Spotlight Parts",
                              "level": 4,
                              "children": [],
                              "productId": 16
                            }
                          }
                        }
                      },
                      "productId": 16
                    }
                  }
                }
              },
              "productId": 16
            }
          }
        },
        "Projecteurs principaux / composants": {
          "categoryId": null,
          "categoryName": "Projecteurs principaux / composants",
          "level": 2,
          "children": {
            "Disperseur, projecteur principal": {
              "categoryId": 100143,
              "categoryName": "Headlight/Parts",
              "level": 2,
              "children": {
                "Composants des projecteurs principaux": {
                  "categoryId": null,
                  "categoryName": "Composants des projecteurs principaux",
                  "level": 4,
                  "children": {
                    "Disperseur, projecteur principal": {
                      "categoryId": 100430,
                      "categoryName": "Headlight Parts",
                      "level": 3,
                      "children": [],
                      "productId": 3499
                    }
                  }
                }
              },
              "productId": 3499
            }
          }
        }
      }
    }
  },
  "arborescenceText": "├── Carrosserie [ID: 100001] (Niveau 1)\n│   ├── Arrière de la voiture (Niveau 2)\n│   │   ├── Vehicle Rear [ID: 101705] (Niveau 2) → ProductId: 95\n│   │   │   └── Feu de brouillard arrière/Composants (Niveau 4)\n│   │   │       └── Rear Fog Light/Parts [ID: 101735] (Niveau 3) → ProductId: 95\n│   │   │           └── Composants de feu de brouillard arrière (Niveau 6)\n│   │   │               └── Rear Fog Light Individual Parts [ID: 101737] (Niveau 4) → ProductId: 95\n│   │   ├── Vehicle Rear [ID: 101705] (Niveau 2) → ProductId: 97\n│   │   │   ├── Feu arrière / composants (Niveau 4)\n│   │   │   │   └── Tail Light Assembly/Parts [ID: 101715] (Niveau 3) → ProductId: 93\n│   │   │   │       └── Composants de feu arrière (Niveau 6)\n│   │   │   │           └── Tail Light Assembly Parts [ID: 101717] (Niveau 4) → ProductId: 93\n│   │   │   └── Feu arrière/Composants (Niveau 4)\n│   │   │       └── Tail Light/Parts [ID: 101718] (Niveau 3) → ProductId: 97\n│   │   │           └── Composants de feu arrière (Niveau 6)\n│   │   │               └── Tail Light Individual Parts [ID: 101720] (Niveau 4) → ProductId: 97\n│   │   ├── Vehicle Rear [ID: 101705] (Niveau 2) → ProductId: 91\n│   │   │   └── Feu clignotant/composants (Niveau 4)\n│   │   │       └── Direction Indicator/Parts [ID: 101727] (Niveau 3) → ProductId: 91\n│   │   │           └── Composants de feu clignotant (Niveau 6)\n│   │   │               └── Indicator Parts [ID: 101729] (Niveau 4) → ProductId: 91\n│   │   ├── Vehicle Rear [ID: 101705] (Niveau 2) → ProductId: 1175\n│   │   │   └── Feu de position / d'encombrement / composants (Niveau 4)\n│   │   │       └── Side Marker/End Outline Marker Light/Parts [ID: 101785] (Niveau 3) → ProductId: 1175\n│   │   │           └── Composants (Niveau 6)\n│   │   │               └── Parts [ID: 101790] (Niveau 4) → ProductId: 1175\n│   │   ├── Vehicle Rear [ID: 101705] (Niveau 2) → ProductId: 3458\n│   │   │   └── Feu de position / d'encombrement / composants (Niveau 4)\n│   │   │       └── Side Marker/End Outline Marker Light/Parts [ID: 101785] (Niveau 3) → ProductId: 3458\n│   │   │           └── Feu d'encombrement (Niveau 6)\n│   │   │               └── End Outline Marker Light [ID: 101787] (Niveau 4) → ProductId: 3458\n│   │   ├── Vehicle Rear [ID: 101705] (Niveau 2) → ProductId: 1174\n│   │   │   └── Feu de position / d'encombrement / composants (Niveau 4)\n│   │   │       └── Side Marker/End Outline Marker Light/Parts [ID: 101785] (Niveau 3) → ProductId: 1174\n│   │   │           └── Composants (Niveau 6)\n│   │   │               └── Parts [ID: 101790] (Niveau 4) → ProductId: 1174\n│   │   ├── Vehicle Rear [ID: 101705] (Niveau 2) → ProductId: 96\n│   │   │   └── Feu de recul / composants (Niveau 4)\n│   │   │       └── Reverse Light/Parts [ID: 101739] (Niveau 3) → ProductId: 96\n│   │   │           └── Composants de feu de recul (Niveau 6)\n│   │   │               └── Reverse Light Parts [ID: 101741] (Niveau 4) → ProductId: 96\n│   │   ├── Vehicle Rear [ID: 101705] (Niveau 2) → ProductId: 2547\n│   │   │   └── Feu de position / d'encombrement / composants (Niveau 4)\n│   │   │       └── Side Marker/End Outline Marker Light/Parts [ID: 101785] (Niveau 3) → ProductId: 2547\n│   │   │           └── Feu de stationnement/de position (Niveau 6)\n│   │   │               └── Park/Position Light [ID: 101786] (Niveau 4) → ProductId: 2547\n│   │   ├── Vehicle Rear [ID: 101705] (Niveau 2) → ProductId: 94\n│   │   │   └── Feu éclaireur de plaque/composants (Niveau 4)\n│   │   │       └── Licence Plate Light/-Parts [ID: 101731] (Niveau 3) → ProductId: 94\n│   │   │           └── Composants du feu éclaireur de plaque (Niveau 6)\n│   │   │               └── Licence Plate Light Parts [ID: 101733] (Niveau 4) → ProductId: 94\n│   │   ├── Vehicle Rear [ID: 101705] (Niveau 2) → ProductId: 3451\n│   │   │   └── Feu de position / d'encombrement / composants (Niveau 4)\n│   │   │       └── Side Marker/End Outline Marker Light/Parts [ID: 101785] (Niveau 3) → ProductId: 3451\n│   │   │           └── Feux latéraux (Niveau 6)\n│   │   │               └── Side Marker Lights [ID: 101788] (Niveau 4) → ProductId: 3451\n│   │   └── Vehicle Rear [ID: 101705] (Niveau 2) → ProductId: 92\n│   │       └── Feu-stop / composants (Niveau 4)\n│   │           └── Stop Light/Parts [ID: 101722] (Niveau 3) → ProductId: 92\n│   │               └── Composants des feux de stop (Niveau 6)\n│   │                   └── Stop Light Parts [ID: 101725] (Niveau 4) → ProductId: 92\n│   ├── Avant du véhicule (Niveau 2)\n│   │   ├── Vehicle Front [ID: 101648] (Niveau 2) → ProductId: 91\n│   │   │   └── Feu clignotant/composants (Niveau 4)\n│   │   │       └── Direction Indicator/Parts [ID: 101669] (Niveau 3) → ProductId: 91\n│   │   │           └── Composants de feu clignotant (Niveau 6)\n│   │   │               └── Indicator Parts [ID: 101671] (Niveau 4) → ProductId: 91\n│   │   ├── Vehicle Front [ID: 101648] (Niveau 2) → ProductId: 1175\n│   │   │   └── Feu de position / d'encombrement / composants (Niveau 4)\n│   │   │       └── Side Marker/End Outline Marker Light/Parts [ID: 101766] (Niveau 3) → ProductId: 1175\n│   │   │           └── Composants (Niveau 6)\n│   │   │               └── Parts [ID: 101771] (Niveau 4) → ProductId: 1175\n│   │   ├── Vehicle Front [ID: 101648] (Niveau 2) → ProductId: 3458\n│   │   │   └── Feu de position / d'encombrement / composants (Niveau 4)\n│   │   │       └── Side Marker/End Outline Marker Light/Parts [ID: 101766] (Niveau 3) → ProductId: 3458\n│   │   │           └── Feu d'encombrement (Niveau 6)\n│   │   │               └── End Outline Marker Light [ID: 101768] (Niveau 4) → ProductId: 3458\n│   │   ├── Vehicle Front [ID: 101648] (Niveau 2) → ProductId: 1174\n│   │   │   └── Feu de position / d'encombrement / composants (Niveau 4)\n│   │   │       └── Side Marker/End Outline Marker Light/Parts [ID: 101766] (Niveau 3) → ProductId: 1174\n│   │   │           └── Composants (Niveau 6)\n│   │   │               └── Parts [ID: 101771] (Niveau 4) → ProductId: 1174\n│   │   ├── Vehicle Front [ID: 101648] (Niveau 2) → ProductId: 2547\n│   │   │   └── Feu de position / d'encombrement / composants (Niveau 4)\n│   │   │       └── Side Marker/End Outline Marker Light/Parts [ID: 101766] (Niveau 3) → ProductId: 2547\n│   │   │           └── Feu de stationnement/de position (Niveau 6)\n│   │   │               └── Park/Position Light [ID: 101767] (Niveau 4) → ProductId: 2547\n│   │   ├── Vehicle Front [ID: 101648] (Niveau 2) → ProductId: 3451\n│   │   │   └── Feu de position / d'encombrement / composants (Niveau 4)\n│   │   │       └── Side Marker/End Outline Marker Light/Parts [ID: 101766] (Niveau 3) → ProductId: 3451\n│   │   │           └── Feux latéraux (Niveau 6)\n│   │   │               └── Side Marker Lights [ID: 101769] (Niveau 4) → ProductId: 3451\n│   │   ├── Vehicle Front [ID: 101648] (Niveau 2) → ProductId: 85\n│   │   │   └── Projecteur antibrouillard/ composants (Niveau 4)\n│   │   │       └── Front Fog Light/Parts [ID: 101661] (Niveau 3) → ProductId: 85\n│   │   │           └── Composants pour projecteur antibrouillard (Niveau 6)\n│   │   │               └── Fog Light Parts [ID: 101664] (Niveau 4) → ProductId: 85\n│   │   ├── Vehicle Front [ID: 101648] (Niveau 2) → ProductId: 16\n│   │   │   └── Projecteur longue portée / composants (Niveau 4)\n│   │   │       └── Spotlight/Parts [ID: 101665] (Niveau 3) → ProductId: 16\n│   │   │           └── Projecteur longue portée / composants (Niveau 6)\n│   │   │               └── Spotlight Parts [ID: 101668] (Niveau 4) → ProductId: 16\n│   │   └── Vehicle Front [ID: 101648] (Niveau 2) → ProductId: 3499\n│   │       └── Projecteurs principaux / composants (Niveau 4)\n│   │           └── Headlight/Parts [ID: 101656] (Niveau 3) → ProductId: 3499\n│   │               └── Composants des projecteurs principaux (Niveau 6)\n│   │                   └── Headlight Parts [ID: 101659] (Niveau 4) → ProductId: 3499\n│   ├── Feux (Niveau 2)\n│   │   ├── Lights [ID: 101407] (Niveau 2) → ProductId: 95\n│   │   │   └── Feu de brouillard arrière/Composants (Niveau 4)\n│   │   │       └── Rear Fog Light/Parts [ID: 101428] (Niveau 3) → ProductId: 95\n│   │   │           └── Composants de feu de brouillard arrière (Niveau 6)\n│   │   │               └── Rear Fog Light Individual Parts [ID: 101430] (Niveau 4) → ProductId: 95\n│   │   ├── Lights [ID: 101407] (Niveau 2) → ProductId: 97\n│   │   │   ├── Feu arrière / composants (Niveau 4)\n│   │   │   │   └── Tail Light Assembly/Parts [ID: 101408] (Niveau 3) → ProductId: 93\n│   │   │   │       └── Composants de feu arrière (Niveau 6)\n│   │   │   │           └── Tail Light Assembly Parts [ID: 101410] (Niveau 4) → ProductId: 93\n│   │   │   └── Feu arrière/Composants (Niveau 4)\n│   │   │       └── Tail Light/Parts [ID: 101411] (Niveau 3) → ProductId: 97\n│   │   │           └── Composants de feu arrière (Niveau 6)\n│   │   │               └── Tail Light Individual Parts [ID: 101413] (Niveau 4) → ProductId: 97\n│   │   ├── Lights [ID: 101407] (Niveau 2) → ProductId: 91\n│   │   │   └── Feu clignotant/composants (Niveau 4)\n│   │   │       └── Direction Indicator/Parts [ID: 101420] (Niveau 3) → ProductId: 91\n│   │   │           └── Composants de feu clignotant (Niveau 6)\n│   │   │               └── Indicator Parts [ID: 101422] (Niveau 4) → ProductId: 91\n│   │   ├── Lights [ID: 101407] (Niveau 2) → ProductId: 1175\n│   │   │   └── Feu de position / d'encombrement / composants (Niveau 4)\n│   │   │       └── Side Marker/End Outline Marker Light/Parts [ID: 101441] (Niveau 3) → ProductId: 1175\n│   │   │           └── Composants (Niveau 6)\n│   │   │               └── Parts [ID: 101446] (Niveau 4) → ProductId: 1175\n│   │   ├── Lights [ID: 101407] (Niveau 2) → ProductId: 3458\n│   │   │   └── Feu de position / d'encombrement / composants (Niveau 4)\n│   │   │       └── Side Marker/End Outline Marker Light/Parts [ID: 101441] (Niveau 3) → ProductId: 3458\n│   │   │           └── Feu d'encombrement (Niveau 6)\n│   │   │               └── End Outline Marker Light [ID: 101443] (Niveau 4) → ProductId: 3458\n│   │   ├── Lights [ID: 101407] (Niveau 2) → ProductId: 1174\n│   │   │   └── Feu de position / d'encombrement / composants (Niveau 4)\n│   │   │       └── Side Marker/End Outline Marker Light/Parts [ID: 101441] (Niveau 3) → ProductId: 1174\n│   │   │           └── Composants (Niveau 6)\n│   │   │               └── Parts [ID: 101446] (Niveau 4) → ProductId: 1174\n│   │   ├── Lights [ID: 101407] (Niveau 2) → ProductId: 96\n│   │   │   └── Feu de recul / composants (Niveau 4)\n│   │   │       └── Reverse Light/Parts [ID: 101432] (Niveau 3) → ProductId: 96\n│   │   │           └── Composants de feu de recul (Niveau 6)\n│   │   │               └── Reverse Light Parts [ID: 101434] (Niveau 4) → ProductId: 96\n│   │   ├── Lights [ID: 101407] (Niveau 2) → ProductId: 2547\n│   │   │   └── Feu de position / d'encombrement / composants (Niveau 4)\n│   │   │       └── Side Marker/End Outline Marker Light/Parts [ID: 101441] (Niveau 3) → ProductId: 2547\n│   │   │           └── Feu de stationnement/de position (Niveau 6)\n│   │   │               └── Park/Position Light [ID: 101442] (Niveau 4) → ProductId: 2547\n│   │   ├── Lights [ID: 101407] (Niveau 2) → ProductId: 94\n│   │   │   └── Feu éclaireur de plaque/composants (Niveau 4)\n│   │   │       └── Licence Plate Light/-Parts [ID: 101424] (Niveau 3) → ProductId: 94\n│   │   │           └── Composants du feu éclaireur de plaque (Niveau 6)\n│   │   │               └── Licence Plate Light Parts [ID: 101426] (Niveau 4) → ProductId: 94\n│   │   ├── Lights [ID: 101407] (Niveau 2) → ProductId: 3451\n│   │   │   └── Feu de position / d'encombrement / composants (Niveau 4)\n│   │   │       └── Side Marker/End Outline Marker Light/Parts [ID: 101441] (Niveau 3) → ProductId: 3451\n│   │   │           └── Feux latéraux (Niveau 6)\n│   │   │               └── Side Marker Lights [ID: 101444] (Niveau 4) → ProductId: 3451\n│   │   └── Lights [ID: 101407] (Niveau 2) → ProductId: 92\n│   │       └── Feu-stop / composants (Niveau 4)\n│   │           └── Stop Light/Parts [ID: 101415] (Niveau 3) → ProductId: 92\n│   │               └── Composants des feux de stop (Niveau 6)\n│   │                   └── Stop Light Parts [ID: 101418] (Niveau 4) → ProductId: 92\n│   ├── Phares supplémentaires/composants (Niveau 2)\n│   │   ├── Additional Headlight/Parts [ID: 101340] (Niveau 2) → ProductId: 15\n│   │   │   └── Phare chercheur / composants (Niveau 4)\n│   │   │       └── Searchlight/Parts [ID: 101353] (Niveau 3) → ProductId: 15\n│   │   │           └── Composants phare chercheur (Niveau 6)\n│   │   │               └── Searchlight Parts [ID: 101356] (Niveau 4) → ProductId: 15\n│   │   ├── Additional Headlight/Parts [ID: 101340] (Niveau 2) → ProductId: 85\n│   │   │   └── Projecteur antibrouillard/ composants (Niveau 4)\n│   │   │       └── Front Fog Light/Parts [ID: 101341] (Niveau 3) → ProductId: 85\n│   │   │           └── Composants pour projecteur antibrouillard (Niveau 6)\n│   │   │               └── Fog Light Parts [ID: 101344] (Niveau 4) → ProductId: 85\n│   │   ├── Additional Headlight/Parts [ID: 101340] (Niveau 2) → ProductId: 84\n│   │   │   └── Projecteur de travail, composants (Niveau 4)\n│   │   │       └── Worklight/Parts [ID: 101349] (Niveau 3) → ProductId: 84\n│   │   │           └── Projecteur de travail, composants (Niveau 6)\n│   │   │               └── Worklight Parts [ID: 101352] (Niveau 4) → ProductId: 84\n│   │   └── Additional Headlight/Parts [ID: 101340] (Niveau 2) → ProductId: 16\n│   │       └── Projecteur longue portée / composants (Niveau 4)\n│   │           └── Spotlight/Parts [ID: 101345] (Niveau 3) → ProductId: 16\n│   │               └── Projecteur longue portée / composants (Niveau 6)\n│   │                   └── Spotlight Parts [ID: 101348] (Niveau 4) → ProductId: 16\n│   └── Projecteurs principaux / composants (Niveau 2)\n│       └── Headlight/Parts [ID: 101465] (Niveau 2) → ProductId: 3499\n│           └── Composants des projecteurs principaux (Niveau 4)\n│               └── Headlight Parts [ID: 101468] (Niveau 3) → ProductId: 3499\n\n└── Système électrique [ID: 100010] (Niveau 1)\n    ├── Feux (Niveau 2)\n    │   ├── Lights [ID: 100043] (Niveau 2) → ProductId: 98\n    │   │   └── Gyrophare / composants (Niveau 4)\n    │   │       └── Rotating Beacon/Parts [ID: 100289] (Niveau 3) → ProductId: 98\n    │   │           └── Composants du gyrophare (Niveau 6)\n    │   │               └── Rotating Beacon Parts [ID: 100487] (Niveau 4) → ProductId: 98\n    │   ├── Lights [ID: 100043] (Niveau 2) → ProductId: 95\n    │   │   └── Feu de brouillard arrière/Composants (Niveau 4)\n    │   │       └── Rear Fog Light/Parts [ID: 100285] (Niveau 3) → ProductId: 95\n    │   │           └── Composants de feu de brouillard arrière (Niveau 6)\n    │   │               └── Rear Fog Light Individual Parts [ID: 100484] (Niveau 4) → ProductId: 95\n    │   ├── Lights [ID: 100043] (Niveau 2) → ProductId: 97\n    │   │   └── Feu arrière / composants (Niveau 4)\n    │   │       └── Tail Light Assembly/Parts [ID: 100275] (Niveau 3) → ProductId: 97\n    │   │           └── Composants de feu arrière (Niveau 6)\n    │   │               └── Tail Light Assembly Parts [ID: 100456] (Niveau 4) → ProductId: 97\n    │   ├── Lights [ID: 100043] (Niveau 2) → ProductId: 91\n    │   │   └── Feu clignotant/composants (Niveau 4)\n    │   │       └── Direction Indicator/Parts [ID: 100145] (Niveau 3) → ProductId: 91\n    │   │           └── Composants de feu clignotant (Niveau 6)\n    │   │               └── Indicator Parts [ID: 100480] (Niveau 4) → ProductId: 91\n    │   ├── Lights [ID: 100043] (Niveau 2) → ProductId: 1175\n    │   │   └── Feu de position / d'encombrement / composants (Niveau 4)\n    │   │       └── Side Marker/End Outline Marker Light/Parts [ID: 100290] (Niveau 3) → ProductId: 1175\n    │   │           └── Composants (Niveau 6)\n    │   │               └── Parts [ID: 100495] (Niveau 4) → ProductId: 1175\n    │   ├── Lights [ID: 100043] (Niveau 2) → ProductId: 3458\n    │   │   └── Feu de position / d'encombrement / composants (Niveau 4)\n    │   │       └── Side Marker/End Outline Marker Light/Parts [ID: 100290] (Niveau 3) → ProductId: 3458\n    │   │           └── Feu d'encombrement (Niveau 6)\n    │   │               └── End Outline Marker Light [ID: 100469] (Niveau 4) → ProductId: 3458\n    │   ├── Lights [ID: 100043] (Niveau 2) → ProductId: 1174\n    │   │   └── Feu de position / d'encombrement / composants (Niveau 4)\n    │   │       └── Side Marker/End Outline Marker Light/Parts [ID: 100290] (Niveau 3) → ProductId: 1174\n    │   │           └── Composants (Niveau 6)\n    │   │               └── Parts [ID: 100495] (Niveau 4) → ProductId: 1174\n    │   ├── Lights [ID: 100043] (Niveau 2) → ProductId: 96\n    │   │   └── Feu de recul / composants (Niveau 4)\n    │   │       └── Reverse Light/Parts [ID: 100287] (Niveau 3) → ProductId: 96\n    │   │           └── Composants de feu de recul (Niveau 6)\n    │   │               └── Reverse Light Parts [ID: 100486] (Niveau 4) → ProductId: 96\n    │   ├── Lights [ID: 100043] (Niveau 2) → ProductId: 2547\n    │   │   └── Feu de position / d'encombrement / composants (Niveau 4)\n    │   │       └── Side Marker/End Outline Marker Light/Parts [ID: 100290] (Niveau 3) → ProductId: 2547\n    │   │           └── Feu de stationnement/de position (Niveau 6)\n    │   │               └── Park/Position Light [ID: 100468] (Niveau 4) → ProductId: 2547\n    │   ├── Lights [ID: 100043] (Niveau 2) → ProductId: 94\n    │   │   └── Feu éclaireur de plaque/composants (Niveau 4)\n    │   │       └── Licence Plate Light/-Parts [ID: 100147] (Niveau 3) → ProductId: 94\n    │   │           └── Composants du feu éclaireur de plaque (Niveau 6)\n    │   │               └── Licence Plate Light Parts [ID: 100482] (Niveau 4) → ProductId: 94\n    │   ├── Lights [ID: 100043] (Niveau 2) → ProductId: 3451\n    │   │   └── Feu de position / d'encombrement / composants (Niveau 4)\n    │   │       └── Side Marker/End Outline Marker Light/Parts [ID: 100290] (Niveau 3) → ProductId: 3451\n    │   │           └── Feux latéraux (Niveau 6)\n    │   │               └── Side Marker Lights [ID: 100753] (Niveau 4) → ProductId: 3451\n    │   └── Lights [ID: 100043] (Niveau 2) → ProductId: 92\n    │       └── Feu-stop / composants (Niveau 4)\n    │           └── Stop Light/Parts [ID: 100284] (Niveau 3) → ProductId: 92\n    │               └── Composants des feux de stop (Niveau 6)\n    │                   └── Stop Light Parts [ID: 100471] (Niveau 4) → ProductId: 92\n    ├── Instruments (Niveau 2)\n    │   └── Instruments [ID: 100322] (Niveau 2) → ProductId: 4312\n    │       └── Instruments indicateurs (Niveau 4)\n    │           └── Gauges [ID: 100555] (Niveau 3) → ProductId: 4312\n    ├── Phares supplémentaires/composants (Niveau 2)\n    │   ├── Additional Headlight/Parts [ID: 100787] (Niveau 2) → ProductId: 15\n    │   │   └── Phare chercheur / composants (Niveau 4)\n    │   │       └── Searchlight/Parts [ID: 100281] (Niveau 3) → ProductId: 15\n    │   │           └── Composants phare chercheur (Niveau 6)\n    │   │               └── Searchlight Parts [ID: 100446] (Niveau 4) → ProductId: 15\n    │   ├── Additional Headlight/Parts [ID: 100787] (Niveau 2) → ProductId: 85\n    │   │   └── Projecteur antibrouillard/ composants (Niveau 4)\n    │   │       └── Front Fog Light/Parts [ID: 100277] (Niveau 3) → ProductId: 85\n    │   │           └── Composants pour projecteur antibrouillard (Niveau 6)\n    │   │               └── Fog Light Parts [ID: 100444] (Niveau 4) → ProductId: 85\n    │   ├── Additional Headlight/Parts [ID: 100787] (Niveau 2) → ProductId: 84\n    │   │   └── Projecteur de travail, composants (Niveau 4)\n    │   │       └── Worklight/Parts [ID: 100280] (Niveau 3) → ProductId: 84\n    │   │           └── Projecteur de travail, composants (Niveau 6)\n    │   │               └── Worklight Parts [ID: 100445] (Niveau 4) → ProductId: 84\n    │   └── Additional Headlight/Parts [ID: 100787] (Niveau 2) → ProductId: 16\n    │       └── Projecteur longue portée / composants (Niveau 4)\n    │           └── Spotlight/Parts [ID: 100276] (Niveau 3) → ProductId: 16\n    │               └── Projecteur longue portée / composants (Niveau 6)\n    │                   └── Spotlight Parts [ID: 100443] (Niveau 4) → ProductId: 16\n    └── Projecteurs principaux / composants (Niveau 2)\n        └── Headlight/Parts [ID: 100143] (Niveau 2) → ProductId: 3499\n            └── Composants des projecteurs principaux (Niveau 4)\n                └── Headlight Parts [ID: 100430] (Niveau 3) → ProductId: 3499",
  "arborescencePaths": [
    {
      "path": [
        "Carrosserie",
        "Arrière de la voiture",
        "Vehicle Rear"
      ],
      "categoryIds": [
        100001,
        null,
        101705
      ],
      "finalCategoryId": 101705,
      "productId": 95
    },
    {
      "path": [
        "Carrosserie",
        "Arrière de la voiture",
        "Vehicle Rear"
      ],
      "categoryIds": [
        100001,
        null,
        101705
      ],
      "finalCategoryId": 101705,
      "productId": 97
    },
    {
      "path": [
        "Carrosserie",
        "Arrière de la voiture",
        "Vehicle Rear"
      ],
      "categoryIds": [
        100001,
        null,
        101705
      ],
      "finalCategoryId": 101705,
      "productId": 91
    },
    {
      "path": [
        "Carrosserie",
        "Arrière de la voiture",
        "Vehicle Rear"
      ],
      "categoryIds": [
        100001,
        null,
        101705
      ],
      "finalCategoryId": 101705,
      "productId": 1175
    },
    {
      "path": [
        "Carrosserie",
        "Arrière de la voiture",
        "Vehicle Rear"
      ],
      "categoryIds": [
        100001,
        null,
        101705
      ],
      "finalCategoryId": 101705,
      "productId": 3458
    },
    {
      "path": [
        "Carrosserie",
        "Arrière de la voiture",
        "Vehicle Rear"
      ],
      "categoryIds": [
        100001,
        null,
        101705
      ],
      "finalCategoryId": 101705,
      "productId": 1174
    },
    {
      "path": [
        "Carrosserie",
        "Arrière de la voiture",
        "Vehicle Rear"
      ],
      "categoryIds": [
        100001,
        null,
        101705
      ],
      "finalCategoryId": 101705,
      "productId": 96
    },
    {
      "path": [
        "Carrosserie",
        "Arrière de la voiture",
        "Vehicle Rear"
      ],
      "categoryIds": [
        100001,
        null,
        101705
      ],
      "finalCategoryId": 101705,
      "productId": 2547
    },
    {
      "path": [
        "Carrosserie",
        "Arrière de la voiture",
        "Vehicle Rear"
      ],
      "categoryIds": [
        100001,
        null,
        101705
      ],
      "finalCategoryId": 101705,
      "productId": 94
    },
    {
      "path": [
        "Carrosserie",
        "Arrière de la voiture",
        "Vehicle Rear"
      ],
      "categoryIds": [
        100001,
        null,
        101705
      ],
      "finalCategoryId": 101705,
      "productId": 3451
    },
    {
      "path": [
        "Carrosserie",
        "Arrière de la voiture",
        "Vehicle Rear"
      ],
      "categoryIds": [
        100001,
        null,
        101705
      ],
      "finalCategoryId": 101705,
      "productId": 92
    },
    {
      "path": [
        "Carrosserie",
        "Avant du véhicule",
        "Vehicle Front"
      ],
      "categoryIds": [
        100001,
        null,
        101648
      ],
      "finalCategoryId": 101648,
      "productId": 91
    },
    {
      "path": [
        "Carrosserie",
        "Avant du véhicule",
        "Vehicle Front"
      ],
      "categoryIds": [
        100001,
        null,
        101648
      ],
      "finalCategoryId": 101648,
      "productId": 1175
    },
    {
      "path": [
        "Carrosserie",
        "Avant du véhicule",
        "Vehicle Front"
      ],
      "categoryIds": [
        100001,
        null,
        101648
      ],
      "finalCategoryId": 101648,
      "productId": 3458
    },
    {
      "path": [
        "Carrosserie",
        "Avant du véhicule",
        "Vehicle Front"
      ],
      "categoryIds": [
        100001,
        null,
        101648
      ],
      "finalCategoryId": 101648,
      "productId": 1174
    },
    {
      "path": [
        "Carrosserie",
        "Avant du véhicule",
        "Vehicle Front"
      ],
      "categoryIds": [
        100001,
        null,
        101648
      ],
      "finalCategoryId": 101648,
      "productId": 2547
    },
    {
      "path": [
        "Carrosserie",
        "Avant du véhicule",
        "Vehicle Front"
      ],
      "categoryIds": [
        100001,
        null,
        101648
      ],
      "finalCategoryId": 101648,
      "productId": 3451
    },
    {
      "path": [
        "Carrosserie",
        "Avant du véhicule",
        "Vehicle Front"
      ],
      "categoryIds": [
        100001,
        null,
        101648
      ],
      "finalCategoryId": 101648,
      "productId": 85
    },
    {
      "path": [
        "Carrosserie",
        "Avant du véhicule",
        "Vehicle Front"
      ],
      "categoryIds": [
        100001,
        null,
        101648
      ],
      "finalCategoryId": 101648,
      "productId": 16
    },
    {
      "path": [
        "Carrosserie",
        "Avant du véhicule",
        "Vehicle Front"
      ],
      "categoryIds": [
        100001,
        null,
        101648
      ],
      "finalCategoryId": 101648,
      "productId": 3499
    },
    {
      "path": [
        "Carrosserie",
        "Feux",
        "Lights"
      ],
      "categoryIds": [
        100001,
        null,
        101407
      ],
      "finalCategoryId": 101407,
      "productId": 95
    },
    {
      "path": [
        "Carrosserie",
        "Feux",
        "Lights"
      ],
      "categoryIds": [
        100001,
        null,
        101407
      ],
      "finalCategoryId": 101407,
      "productId": 97
    },
    {
      "path": [
        "Carrosserie",
        "Feux",
        "Lights"
      ],
      "categoryIds": [
        100001,
        null,
        101407
      ],
      "finalCategoryId": 101407,
      "productId": 91
    },
    {
      "path": [
        "Carrosserie",
        "Feux",
        "Lights"
      ],
      "categoryIds": [
        100001,
        null,
        101407
      ],
      "finalCategoryId": 101407,
      "productId": 1175
    },
    {
      "path": [
        "Carrosserie",
        "Feux",
        "Lights"
      ],
      "categoryIds": [
        100001,
        null,
        101407
      ],
      "finalCategoryId": 101407,
      "productId": 3458
    },
    {
      "path": [
        "Carrosserie",
        "Feux",
        "Lights"
      ],
      "categoryIds": [
        100001,
        null,
        101407
      ],
      "finalCategoryId": 101407,
      "productId": 1174
    },
    {
      "path": [
        "Carrosserie",
        "Feux",
        "Lights"
      ],
      "categoryIds": [
        100001,
        null,
        101407
      ],
      "finalCategoryId": 101407,
      "productId": 96
    },
    {
      "path": [
        "Carrosserie",
        "Feux",
        "Lights"
      ],
      "categoryIds": [
        100001,
        null,
        101407
      ],
      "finalCategoryId": 101407,
      "productId": 2547
    },
    {
      "path": [
        "Carrosserie",
        "Feux",
        "Lights"
      ],
      "categoryIds": [
        100001,
        null,
        101407
      ],
      "finalCategoryId": 101407,
      "productId": 94
    },
    {
      "path": [
        "Carrosserie",
        "Feux",
        "Lights"
      ],
      "categoryIds": [
        100001,
        null,
        101407
      ],
      "finalCategoryId": 101407,
      "productId": 3451
    },
    {
      "path": [
        "Carrosserie",
        "Feux",
        "Lights"
      ],
      "categoryIds": [
        100001,
        null,
        101407
      ],
      "finalCategoryId": 101407,
      "productId": 92
    },
    {
      "path": [
        "Carrosserie",
        "Phares supplémentaires/composants",
        "Additional Headlight/Parts"
      ],
      "categoryIds": [
        100001,
        null,
        101340
      ],
      "finalCategoryId": 101340,
      "productId": 15
    },
    {
      "path": [
        "Carrosserie",
        "Phares supplémentaires/composants",
        "Additional Headlight/Parts"
      ],
      "categoryIds": [
        100001,
        null,
        101340
      ],
      "finalCategoryId": 101340,
      "productId": 85
    },
    {
      "path": [
        "Carrosserie",
        "Phares supplémentaires/composants",
        "Additional Headlight/Parts"
      ],
      "categoryIds": [
        100001,
        null,
        101340
      ],
      "finalCategoryId": 101340,
      "productId": 84
    },
    {
      "path": [
        "Carrosserie",
        "Phares supplémentaires/composants",
        "Additional Headlight/Parts"
      ],
      "categoryIds": [
        100001,
        null,
        101340
      ],
      "finalCategoryId": 101340,
      "productId": 16
    },
    {
      "path": [
        "Carrosserie",
        "Projecteurs principaux / composants",
        "Headlight/Parts"
      ],
      "categoryIds": [
        100001,
        null,
        101465
      ],
      "finalCategoryId": 101465,
      "productId": 3499
    },
    {
      "path": [
        "Système électrique",
        "Feux",
        "Lights"
      ],
      "categoryIds": [
        100010,
        null,
        100043
      ],
      "finalCategoryId": 100043,
      "productId": 98
    },
    {
      "path": [
        "Système électrique",
        "Feux",
        "Lights"
      ],
      "categoryIds": [
        100010,
        null,
        100043
      ],
      "finalCategoryId": 100043,
      "productId": 95
    },
    {
      "path": [
        "Système électrique",
        "Feux",
        "Lights"
      ],
      "categoryIds": [
        100010,
        null,
        100043
      ],
      "finalCategoryId": 100043,
      "productId": 97
    },
    {
      "path": [
        "Système électrique",
        "Feux",
        "Lights"
      ],
      "categoryIds": [
        100010,
        null,
        100043
      ],
      "finalCategoryId": 100043,
      "productId": 91
    },
    {
      "path": [
        "Système électrique",
        "Feux",
        "Lights"
      ],
      "categoryIds": [
        100010,
        null,
        100043
      ],
      "finalCategoryId": 100043,
      "productId": 1175
    },
    {
      "path": [
        "Système électrique",
        "Feux",
        "Lights"
      ],
      "categoryIds": [
        100010,
        null,
        100043
      ],
      "finalCategoryId": 100043,
      "productId": 3458
    },
    {
      "path": [
        "Système électrique",
        "Feux",
        "Lights"
      ],
      "categoryIds": [
        100010,
        null,
        100043
      ],
      "finalCategoryId": 100043,
      "productId": 1174
    },
    {
      "path": [
        "Système électrique",
        "Feux",
        "Lights"
      ],
      "categoryIds": [
        100010,
        null,
        100043
      ],
      "finalCategoryId": 100043,
      "productId": 96
    },
    {
      "path": [
        "Système électrique",
        "Feux",
        "Lights"
      ],
      "categoryIds": [
        100010,
        null,
        100043
      ],
      "finalCategoryId": 100043,
      "productId": 2547
    },
    {
      "path": [
        "Système électrique",
        "Feux",
        "Lights"
      ],
      "categoryIds": [
        100010,
        null,
        100043
      ],
      "finalCategoryId": 100043,
      "productId": 94
    },
    {
      "path": [
        "Système électrique",
        "Feux",
        "Lights"
      ],
      "categoryIds": [
        100010,
        null,
        100043
      ],
      "finalCategoryId": 100043,
      "productId": 3451
    },
    {
      "path": [
        "Système électrique",
        "Feux",
        "Lights"
      ],
      "categoryIds": [
        100010,
        null,
        100043
      ],
      "finalCategoryId": 100043,
      "productId": 92
    },
    {
      "path": [
        "Système électrique",
        "Instruments",
        "Instruments"
      ],
      "categoryIds": [
        100010,
        null,
        100322
      ],
      "finalCategoryId": 100322,
      "productId": 4312
    },
    {
      "path": [
        "Système électrique",
        "Phares supplémentaires/composants",
        "Additional Headlight/Parts"
      ],
      "categoryIds": [
        100010,
        null,
        100787
      ],
      "finalCategoryId": 100787,
      "productId": 15
    },
    {
      "path": [
        "Système électrique",
        "Phares supplémentaires/composants",
        "Additional Headlight/Parts"
      ],
      "categoryIds": [
        100010,
        null,
        100787
      ],
      "finalCategoryId": 100787,
      "productId": 85
    },
    {
      "path": [
        "Système électrique",
        "Phares supplémentaires/composants",
        "Additional Headlight/Parts"
      ],
      "categoryIds": [
        100010,
        null,
        100787
      ],
      "finalCategoryId": 100787,
      "productId": 84
    },
    {
      "path": [
        "Système électrique",
        "Phares supplémentaires/composants",
        "Additional Headlight/Parts"
      ],
      "categoryIds": [
        100010,
        null,
        100787
      ],
      "finalCategoryId": 100787,
      "productId": 16
    },
    {
      "path": [
        "Système électrique",
        "Projecteurs principaux / composants",
        "Headlight/Parts"
      ],
      "categoryIds": [
        100010,
        null,
        100143
      ],
      "finalCategoryId": 100143,
      "productId": 3499
    }
  ],
  "productIdsInArbo": [
    15,
    16,
    84,
    85,
    91,
    92,
    93,
    94,
    95,
    96,
    97,
    98,
    1174,
    1175,
    2547,
    3451,
    3458,
    3499,
    4312
  ],
  "closestProductIds": [
    {
      "productId": 15,
      "productName": "Disperseur, phare chercheur"
    },
    {
      "productId": 16,
      "productName": "Disperseur, projecteur longue portée"
    },
    {
      "productId": 84,
      "productName": "Disperseur, projecteur de travail"
    },
    {
      "productId": 85,
      "productName": "Disperseur, projecteur antibrouillard"
    },
    {
      "productId": 91,
      "productName": "Disperseur, feu clignotant"
    }
  ]
}