{
  "productName": "Disque de frein",
  "searchText": "Disque de frein",
  "found": true,
  "hasMatch": true,
  "timestamp": "2025-12-02T20:31:59.607Z",
  "productId": 82,
  "arborescence": {
    "Dispositif de freinage": {
      "categoryId": 100006,
      "categoryName": "Dispositif de freinage",
      "level": 1,
      "children": {
        "Frein à disque": {
          "categoryId": null,
          "categoryName": "Frein à disque",
          "level": 2,
          "children": {
            "Bague de friction (disque de frein)": {
              "categoryId": 100626,
              "categoryName": "Disc Brake",
              "level": 2,
              "children": {
                "Disque de frein": {
                  "categoryId": null,
                  "categoryName": "Disque de frein",
                  "level": 4,
                  "children": {
                    "Bague de friction (disque de frein)": {
                      "categoryId": 100032,
                      "categoryName": "Brake Disc",
                      "level": 3,
                      "children": [],
                      "productId": 61449
                    }
                  }
                }
              },
              "productId": 61449
            },
            "Déflecteur, disque de frein": {
              "categoryId": 100626,
              "categoryName": "Disc Brake",
              "level": 2,
              "children": {
                "Accessoires / composants": {
                  "categoryId": null,
                  "categoryName": "Accessoires / composants",
                  "level": 4,
                  "children": {
                    "Déflecteur, disque de frein": {
                      "categoryId": 100630,
                      "categoryName": "Accessories/Parts",
                      "level": 3,
                      "children": [],
                      "productId": 1330
                    }
                  }
                }
              },
              "productId": 1330
            },
            "Disque de frein": {
              "categoryId": 100626,
              "categoryName": "Disc Brake",
              "level": 2,
              "children": {
                "Disque de frein": {
                  "categoryId": null,
                  "categoryName": "Disque de frein",
                  "level": 4,
                  "children": {
                    "Disque de frein": {
                      "categoryId": 100032,
                      "categoryName": "Brake Disc",
                      "level": 3,
                      "children": [],
                      "productId": 82
                    }
                  }
                }
              },
              "productId": 82
            },
            "Kit d'acc., kit plaquettes de frein, disque frein/stationnem": {
              "categoryId": 100626,
              "categoryName": "Disc Brake",
              "level": 2,
              "children": {
                "Accessoires / composants": {
                  "categoryId": null,
                  "categoryName": "Accessoires / composants",
                  "level": 4,
                  "children": {
                    "Kit d'acc., kit plaquettes de frein, disque frein/stationnem": {
                      "categoryId": 100630,
                      "categoryName": "Accessories/Parts",
                      "level": 3,
                      "children": [],
                      "productId": 4623
                    }
                  }
                }
              },
              "productId": 4623
            },
            "Kit de vis, disque de frein": {
              "categoryId": 100626,
              "categoryName": "Disc Brake",
              "level": 2,
              "children": {
                "Accessoires / composants": {
                  "categoryId": null,
                  "categoryName": "Accessoires / composants",
                  "level": 4,
                  "children": {
                    "Kit de vis, disque de frein": {
                      "categoryId": 100630,
                      "categoryName": "Accessories/Parts",
                      "level": 3,
                      "children": [],
                      "productId": 5314
                    }
                  }
                }
              },
              "productId": 5314
            },
            "Vis, déflecteur (disque de frein)": {
              "categoryId": 100626,
              "categoryName": "Disc Brake",
              "level": 2,
              "children": {
                "Accessoires / composants": {
                  "categoryId": null,
                  "categoryName": "Accessoires / composants",
                  "level": 4,
                  "children": {
                    "Vis, déflecteur (disque de frein)": {
                      "categoryId": 100630,
                      "categoryName": "Accessories/Parts",
                      "level": 3,
                      "children": [],
                      "productId": 60905
                    }
                  }
                }
              },
              "productId": 60905
            },
            "Vis, disque de frein": {
              "categoryId": 100626,
              "categoryName": "Disc Brake",
              "level": 2,
              "children": {
                "Accessoires / composants": {
                  "categoryId": null,
                  "categoryName": "Accessoires / composants",
                  "level": 4,
                  "children": {
                    "Vis, disque de frein": {
                      "categoryId": 100630,
                      "categoryName": "Accessories/Parts",
                      "level": 3,
                      "children": [],
                      "productId": 54
                    }
                  }
                }
              },
              "productId": 54
            }
          }
        },
        "Frein à tambour": {
          "categoryId": null,
          "categoryName": "Frein à tambour",
          "level": 2,
          "children": {
            "Kit de plaquettes de frein, disque de frein de stationnement": {
              "categoryId": 100627,
              "categoryName": "Drum Brake",
              "level": 2,
              "children": {
                "Freins de stationnement": {
                  "categoryId": null,
                  "categoryName": "Freins de stationnement",
                  "level": 4,
                  "children": {
                    "Kit de plaquettes de frein, disque de frein de stationnement": {
                      "categoryId": 102964,
                      "categoryName": "Handbrake",
                      "level": 3,
                      "children": [],
                      "productId": 1336
                    }
                  }
                }
              },
              "productId": 1336
            }
          }
        },
        "Frein de haute performance": {
          "categoryId": null,
          "categoryName": "Frein de haute performance",
          "level": 2,
          "children": {
            "Disque de freins de haute performance": {
              "categoryId": 102224,
              "categoryName": "High Performance Brakes",
              "level": 2,
              "children": {
                "Disque de freins de haute performance": {
                  "categoryId": null,
                  "categoryName": "Disque de freins de haute performance",
                  "level": 4,
                  "children": {
                    "Disque de freins de haute performance": {
                      "categoryId": 102226,
                      "categoryName": "High Performance Brake Disc",
                      "level": 3,
                      "children": [],
                      "productId": 3369
                    }
                  }
                }
              },
              "productId": 3369
            }
          }
        },
        "Freins de stationnement": {
          "categoryId": null,
          "categoryName": "Freins de stationnement",
          "level": 2,
          "children": {
            "Kit d'acc., kit plaquettes de frein, disque frein/stationnem": {
              "categoryId": 100034,
              "categoryName": "Handbrake",
              "level": 2,
              "children": [],
              "productId": 4623
            },
            "Kit de plaquettes de frein, disque de frein de stationnement": {
              "categoryId": 100034,
              "categoryName": "Handbrake",
              "level": 2,
              "children": [],
              "productId": 1336
            }
          }
        },
        "Outils": {
          "categoryId": null,
          "categoryName": "Outils",
          "level": 2,
          "children": {
            "Douille de force, disque de frein": {
              "categoryId": 103154,
              "categoryName": "Tools",
              "level": 2,
              "children": [],
              "productId": 7243
            }
          }
        }
      }
    },
    "Suspension d'essieu/Guidage des roues/Roues": {
      "categoryId": 100013,
      "categoryName": "Suspension d'essieu/Guidage des roues/Roues",
      "level": 1,
      "children": {
        "Moyeu de roue / fixation": {
          "categoryId": null,
          "categoryName": "Moyeu de roue / fixation",
          "level": 2,
          "children": {
            "Disque de frein": {
              "categoryId": 100206,
              "categoryName": "Wheel Hub/Mounting",
              "level": 2,
              "children": {
                "Roulement de roue": {
                  "categoryId": null,
                  "categoryName": "Roulement de roue",
                  "level": 4,
                  "children": {
                    "Disque de frein": {
                      "categoryId": 100579,
                      "categoryName": "Wheel Bearing",
                      "level": 3,
                      "children": [],
                      "productId": 82
                    }
                  }
                }
              },
              "productId": 82
            }
          }
        }
      }
    }
  },
  "arborescenceText": "├── Dispositif de freinage [ID: 100006] (Niveau 1)\n│   ├── Frein à disque (Niveau 2)\n│   │   ├── Disc Brake [ID: 100626] (Niveau 2) → ProductId: 61449\n│   │   │   └── Disque de frein (Niveau 4)\n│   │   │       └── Brake Disc [ID: 100032] (Niveau 3) → ProductId: 61449\n│   │   ├── Disc Brake [ID: 100626] (Niveau 2) → ProductId: 1330\n│   │   │   └── Accessoires / composants (Niveau 4)\n│   │   │       └── Accessories/Parts [ID: 100630] (Niveau 3) → ProductId: 1330\n│   │   ├── Disc Brake [ID: 100626] (Niveau 2) → ProductId: 82\n│   │   │   └── Disque de frein (Niveau 4)\n│   │   │       └── Brake Disc [ID: 100032] (Niveau 3) → ProductId: 82\n│   │   ├── Disc Brake [ID: 100626] (Niveau 2) → ProductId: 4623\n│   │   │   └── Accessoires / composants (Niveau 4)\n│   │   │       └── Accessories/Parts [ID: 100630] (Niveau 3) → ProductId: 4623\n│   │   ├── Disc Brake [ID: 100626] (Niveau 2) → ProductId: 5314\n│   │   │   └── Accessoires / composants (Niveau 4)\n│   │   │       └── Accessories/Parts [ID: 100630] (Niveau 3) → ProductId: 5314\n│   │   ├── Disc Brake [ID: 100626] (Niveau 2) → ProductId: 60905\n│   │   │   └── Accessoires / composants (Niveau 4)\n│   │   │       └── Accessories/Parts [ID: 100630] (Niveau 3) → ProductId: 60905\n│   │   └── Disc Brake [ID: 100626] (Niveau 2) → ProductId: 54\n│   │       └── Accessoires / composants (Niveau 4)\n│   │           └── Accessories/Parts [ID: 100630] (Niveau 3) → ProductId: 54\n│   ├── Frein à tambour (Niveau 2)\n│   │   └── Drum Brake [ID: 100627] (Niveau 2) → ProductId: 1336\n│   │       └── Freins de stationnement (Niveau 4)\n│   │           └── Handbrake [ID: 102964] (Niveau 3) → ProductId: 1336\n│   ├── Frein de haute performance (Niveau 2)\n│   │   └── High Performance Brakes [ID: 102224] (Niveau 2) → ProductId: 3369\n│   │       └── Disque de freins de haute performance (Niveau 4)\n│   │           └── High Performance Brake Disc [ID: 102226] (Niveau 3) → ProductId: 3369\n│   ├── Freins de stationnement (Niveau 2)\n│   │   ├── Handbrake [ID: 100034] (Niveau 2) → ProductId: 4623\n│   │   └── Handbrake [ID: 100034] (Niveau 2) → ProductId: 1336\n│   └── Outils (Niveau 2)\n│       └── Tools [ID: 103154] (Niveau 2) → ProductId: 7243\n\n└── Suspension d'essieu/Guidage des roues/Roues [ID: 100013] (Niveau 1)\n    └── Moyeu de roue / fixation (Niveau 2)\n        └── Wheel Hub/Mounting [ID: 100206] (Niveau 2) → ProductId: 82\n            └── Roulement de roue (Niveau 4)\n                └── Wheel Bearing [ID: 100579] (Niveau 3) → ProductId: 82",
  "arborescencePaths": [
    {
      "path": [
        "Dispositif de freinage",
        "Frein à disque",
        "Disc Brake"
      ],
      "categoryIds": [
        100006,
        null,
        100626
      ],
      "finalCategoryId": 100626,
      "productId": 61449
    },
    {
      "path": [
        "Dispositif de freinage",
        "Frein à disque",
        "Disc Brake"
      ],
      "categoryIds": [
        100006,
        null,
        100626
      ],
      "finalCategoryId": 100626,
      "productId": 1330
    },
    {
      "path": [
        "Dispositif de freinage",
        "Frein à disque",
        "Disc Brake"
      ],
      "categoryIds": [
        100006,
        null,
        100626
      ],
      "finalCategoryId": 100626,
      "productId": 82
    },
    {
      "path": [
        "Dispositif de freinage",
        "Frein à disque",
        "Disc Brake"
      ],
      "categoryIds": [
        100006,
        null,
        100626
      ],
      "finalCategoryId": 100626,
      "productId": 4623
    },
    {
      "path": [
        "Dispositif de freinage",
        "Frein à disque",
        "Disc Brake"
      ],
      "categoryIds": [
        100006,
        null,
        100626
      ],
      "finalCategoryId": 100626,
      "productId": 5314
    },
    {
      "path": [
        "Dispositif de freinage",
        "Frein à disque",
        "Disc Brake"
      ],
      "categoryIds": [
        100006,
        null,
        100626
      ],
      "finalCategoryId": 100626,
      "productId": 60905
    },
    {
      "path": [
        "Dispositif de freinage",
        "Frein à disque",
        "Disc Brake"
      ],
      "categoryIds": [
        100006,
        null,
        100626
      ],
      "finalCategoryId": 100626,
      "productId": 54
    },
    {
      "path": [
        "Dispositif de freinage",
        "Frein à tambour",
        "Drum Brake"
      ],
      "categoryIds": [
        100006,
        null,
        100627
      ],
      "finalCategoryId": 100627,
      "productId": 1336
    },
    {
      "path": [
        "Dispositif de freinage",
        "Frein de haute performance",
        "High Performance Brakes"
      ],
      "categoryIds": [
        100006,
        null,
        102224
      ],
      "finalCategoryId": 102224,
      "productId": 3369
    },
    {
      "path": [
        "Dispositif de freinage",
        "Freins de stationnement",
        "Handbrake"
      ],
      "categoryIds": [
        100006,
        null,
        100034
      ],
      "finalCategoryId": 100034,
      "productId": 4623
    },
    {
      "path": [
        "Dispositif de freinage",
        "Freins de stationnement",
        "Handbrake"
      ],
      "categoryIds": [
        100006,
        null,
        100034
      ],
      "finalCategoryId": 100034,
      "productId": 1336
    },
    {
      "path": [
        "Dispositif de freinage",
        "Outils",
        "Tools"
      ],
      "categoryIds": [
        100006,
        null,
        103154
      ],
      "finalCategoryId": 103154,
      "productId": 7243
    },
    {
      "path": [
        "Suspension d'essieu/Guidage des roues/Roues",
        "Moyeu de roue / fixation",
        "Wheel Hub/Mounting"
      ],
      "categoryIds": [
        100013,
        null,
        100206
      ],
      "finalCategoryId": 100206,
      "productId": 82
    }
  ],
  "productIdsInArbo": [
    54,
    82,
    1330,
    1336,
    3369,
    4623,
    5314,
    7243,
    60905,
    61449
  ],
  "matchedProductIds": [
    82
  ]
}