{
  "productName": "Douille de lampe",
  "searchText": "Douille de lampe",
  "found": true,
  "hasMatch": false,
  "timestamp": "2025-12-02T20:33:04.872Z",
  "productId": 1465,
  "arborescence": {
    "Carrosserie": {
      "categoryId": 100001,
      "categoryName": "Carrosserie",
      "level": 1,
      "children": {
        "Arrière de la voiture": {
          "categoryId": null,
          "categoryName": "Arrière de la voiture",
          "level": 2,
          "children": {
            "Douille de lampe, feu latéral": {
              "categoryId": 101705,
              "categoryName": "Vehicle Rear",
              "level": 2,
              "children": {
                "Feu de position / d'encombrement / composants": {
                  "categoryId": null,
                  "categoryName": "Feu de position / d'encombrement / composants",
                  "level": 4,
                  "children": {
                    "Douille de lampe, feu latéral": {
                      "categoryId": 101785,
                      "categoryName": "Side Marker/End Outline Marker Light/Parts",
                      "level": 3,
                      "children": {
                        "Feux latéraux": {
                          "categoryId": null,
                          "categoryName": "Feux latéraux",
                          "level": 6,
                          "children": {
                            "Douille de lampe, feu latéral": {
                              "categoryId": 101788,
                              "categoryName": "Side Marker Lights",
                              "level": 4,
                              "children": [],
                              "productId": 9035
                            }
                          }
                        }
                      },
                      "productId": 9035
                    }
                  }
                }
              },
              "productId": 9035
            }
          }
        },
        "Avant du véhicule": {
          "categoryId": null,
          "categoryName": "Avant du véhicule",
          "level": 2,
          "children": {
            "Douille de lampe, feu latéral": {
              "categoryId": 101648,
              "categoryName": "Vehicle Front",
              "level": 2,
              "children": {
                "Feu de position / d'encombrement / composants": {
                  "categoryId": null,
                  "categoryName": "Feu de position / d'encombrement / composants",
                  "level": 4,
                  "children": {
                    "Douille de lampe, feu latéral": {
                      "categoryId": 101766,
                      "categoryName": "Side Marker/End Outline Marker Light/Parts",
                      "level": 3,
                      "children": {
                        "Feux latéraux": {
                          "categoryId": null,
                          "categoryName": "Feux latéraux",
                          "level": 6,
                          "children": {
                            "Douille de lampe, feu latéral": {
                              "categoryId": 101769,
                              "categoryName": "Side Marker Lights",
                              "level": 4,
                              "children": [],
                              "productId": 9035
                            }
                          }
                        }
                      },
                      "productId": 9035
                    }
                  }
                }
              },
              "productId": 9035
            },
            "Douille de lampe, projecteur antibrouillard": {
              "categoryId": 101648,
              "categoryName": "Vehicle Front",
              "level": 2,
              "children": {
                "Projecteur antibrouillard/ composants": {
                  "categoryId": null,
                  "categoryName": "Projecteur antibrouillard/ composants",
                  "level": 4,
                  "children": {
                    "Douille de lampe, projecteur antibrouillard": {
                      "categoryId": 101661,
                      "categoryName": "Front Fog Light/Parts",
                      "level": 3,
                      "children": {
                        "Composants pour projecteur antibrouillard": {
                          "categoryId": null,
                          "categoryName": "Composants pour projecteur antibrouillard",
                          "level": 6,
                          "children": {
                            "Douille de lampe, projecteur antibrouillard": {
                              "categoryId": 101664,
                              "categoryName": "Fog Light Parts",
                              "level": 4,
                              "children": [],
                              "productId": 490
                            }
                          }
                        }
                      },
                      "productId": 490
                    }
                  }
                }
              },
              "productId": 490
            },
            "Douille de lampe, projecteur longue portée": {
              "categoryId": 101648,
              "categoryName": "Vehicle Front",
              "level": 2,
              "children": {
                "Projecteur longue portée / composants": {
                  "categoryId": null,
                  "categoryName": "Projecteur longue portée / composants",
                  "level": 4,
                  "children": {
                    "Douille de lampe, projecteur longue portée": {
                      "categoryId": 101665,
                      "categoryName": "Spotlight/Parts",
                      "level": 3,
                      "children": {
                        "Projecteur longue portée / composants": {
                          "categoryId": null,
                          "categoryName": "Projecteur longue portée / composants",
                          "level": 6,
                          "children": {
                            "Douille de lampe, projecteur longue portée": {
                              "categoryId": 101668,
                              "categoryName": "Spotlight Parts",
                              "level": 4,
                              "children": [],
                              "productId": 488
                            }
                          }
                        }
                      },
                      "productId": 488
                    }
                  }
                }
              },
              "productId": 488
            },
            "Douille de lampe, projecteur principal": {
              "categoryId": 101648,
              "categoryName": "Vehicle Front",
              "level": 2,
              "children": {
                "Projecteurs principaux / composants": {
                  "categoryId": null,
                  "categoryName": "Projecteurs principaux / composants",
                  "level": 4,
                  "children": {
                    "Douille de lampe, projecteur principal": {
                      "categoryId": 101656,
                      "categoryName": "Headlight/Parts",
                      "level": 3,
                      "children": {
                        "Composants des projecteurs principaux": {
                          "categoryId": null,
                          "categoryName": "Composants des projecteurs principaux",
                          "level": 6,
                          "children": {
                            "Douille de lampe, projecteur principal": {
                              "categoryId": 101659,
                              "categoryName": "Headlight Parts",
                              "level": 4,
                              "children": [],
                              "productId": 489
                            }
                          }
                        }
                      },
                      "productId": 489
                    }
                  }
                }
              },
              "productId": 489
            }
          }
        },
        "Feux": {
          "categoryId": null,
          "categoryName": "Feux",
          "level": 2,
          "children": {
            "Douille de lampe, feu latéral": {
              "categoryId": 101407,
              "categoryName": "Lights",
              "level": 2,
              "children": {
                "Feu de position / d'encombrement / composants": {
                  "categoryId": null,
                  "categoryName": "Feu de position / d'encombrement / composants",
                  "level": 4,
                  "children": {
                    "Douille de lampe, feu latéral": {
                      "categoryId": 101441,
                      "categoryName": "Side Marker/End Outline Marker Light/Parts",
                      "level": 3,
                      "children": {
                        "Feux latéraux": {
                          "categoryId": null,
                          "categoryName": "Feux latéraux",
                          "level": 6,
                          "children": {
                            "Douille de lampe, feu latéral": {
                              "categoryId": 101444,
                              "categoryName": "Side Marker Lights",
                              "level": 4,
                              "children": [],
                              "productId": 9035
                            }
                          }
                        }
                      },
                      "productId": 9035
                    }
                  }
                }
              },
              "productId": 9035
            }
          }
        },
        "Phares supplémentaires/composants": {
          "categoryId": null,
          "categoryName": "Phares supplémentaires/composants",
          "level": 2,
          "children": {
            "Douille de lampe, phare chercheur": {
              "categoryId": 101340,
              "categoryName": "Additional Headlight/Parts",
              "level": 2,
              "children": {
                "Phare chercheur / composants": {
                  "categoryId": null,
                  "categoryName": "Phare chercheur / composants",
                  "level": 4,
                  "children": {
                    "Douille de lampe, phare chercheur": {
                      "categoryId": 101353,
                      "categoryName": "Searchlight/Parts",
                      "level": 3,
                      "children": {
                        "Composants phare chercheur": {
                          "categoryId": null,
                          "categoryName": "Composants phare chercheur",
                          "level": 6,
                          "children": {
                            "Douille de lampe, phare chercheur": {
                              "categoryId": 101356,
                              "categoryName": "Searchlight Parts",
                              "level": 4,
                              "children": [],
                              "productId": 486
                            }
                          }
                        }
                      },
                      "productId": 486
                    }
                  }
                }
              },
              "productId": 486
            },
            "Douille de lampe, projecteur antibrouillard": {
              "categoryId": 101340,
              "categoryName": "Additional Headlight/Parts",
              "level": 2,
              "children": {
                "Projecteur antibrouillard/ composants": {
                  "categoryId": null,
                  "categoryName": "Projecteur antibrouillard/ composants",
                  "level": 4,
                  "children": {
                    "Douille de lampe, projecteur antibrouillard": {
                      "categoryId": 101341,
                      "categoryName": "Front Fog Light/Parts",
                      "level": 3,
                      "children": {
                        "Composants pour projecteur antibrouillard": {
                          "categoryId": null,
                          "categoryName": "Composants pour projecteur antibrouillard",
                          "level": 6,
                          "children": {
                            "Douille de lampe, projecteur antibrouillard": {
                              "categoryId": 101344,
                              "categoryName": "Fog Light Parts",
                              "level": 4,
                              "children": [],
                              "productId": 490
                            }
                          }
                        }
                      },
                      "productId": 490
                    }
                  }
                }
              },
              "productId": 490
            },
            "Douille de lampe, projecteur de travail": {
              "categoryId": 101340,
              "categoryName": "Additional Headlight/Parts",
              "level": 2,
              "children": {
                "Projecteur de travail, composants": {
                  "categoryId": null,
                  "categoryName": "Projecteur de travail, composants",
                  "level": 4,
                  "children": {
                    "Douille de lampe, projecteur de travail": {
                      "categoryId": 101349,
                      "categoryName": "Worklight/Parts",
                      "level": 3,
                      "children": {
                        "Projecteur de travail, composants": {
                          "categoryId": null,
                          "categoryName": "Projecteur de travail, composants",
                          "level": 6,
                          "children": {
                            "Douille de lampe, projecteur de travail": {
                              "categoryId": 101352,
                              "categoryName": "Worklight Parts",
                              "level": 4,
                              "children": [],
                              "productId": 487
                            }
                          }
                        }
                      },
                      "productId": 487
                    }
                  }
                }
              },
              "productId": 487
            },
            "Douille de lampe, projecteur longue portée": {
              "categoryId": 101340,
              "categoryName": "Additional Headlight/Parts",
              "level": 2,
              "children": {
                "Projecteur longue portée / composants": {
                  "categoryId": null,
                  "categoryName": "Projecteur longue portée / composants",
                  "level": 4,
                  "children": {
                    "Douille de lampe, projecteur longue portée": {
                      "categoryId": 101345,
                      "categoryName": "Spotlight/Parts",
                      "level": 3,
                      "children": {
                        "Projecteur longue portée / composants": {
                          "categoryId": null,
                          "categoryName": "Projecteur longue portée / composants",
                          "level": 6,
                          "children": {
                            "Douille de lampe, projecteur longue portée": {
                              "categoryId": 101348,
                              "categoryName": "Spotlight Parts",
                              "level": 4,
                              "children": [],
                              "productId": 488
                            }
                          }
                        }
                      },
                      "productId": 488
                    }
                  }
                }
              },
              "productId": 488
            }
          }
        },
        "Projecteurs principaux / composants": {
          "categoryId": null,
          "categoryName": "Projecteurs principaux / composants",
          "level": 2,
          "children": {
            "Douille de lampe, projecteur principal": {
              "categoryId": 101465,
              "categoryName": "Headlight/Parts",
              "level": 2,
              "children": {
                "Composants des projecteurs principaux": {
                  "categoryId": null,
                  "categoryName": "Composants des projecteurs principaux",
                  "level": 4,
                  "children": {
                    "Douille de lampe, projecteur principal": {
                      "categoryId": 101468,
                      "categoryName": "Headlight Parts",
                      "level": 3,
                      "children": [],
                      "productId": 489
                    }
                  }
                }
              },
              "productId": 489
            }
          }
        }
      }
    },
    "Équipement intérieur": {
      "categoryId": 100341,
      "categoryName": "Équipement intérieur",
      "level": 1,
      "children": {
        "Tableau de bord": {
          "categoryId": null,
          "categoryName": "Tableau de bord",
          "level": 2,
          "children": {
            "Douille de lampe, instrument d’indication": {
              "categoryId": 102998,
              "categoryName": "Dashboard",
              "level": 2,
              "children": [],
              "productId": 8259
            }
          }
        }
      }
    },
    "Système électrique": {
      "categoryId": 100010,
      "categoryName": "Système électrique",
      "level": 1,
      "children": {
        "Feux": {
          "categoryId": null,
          "categoryName": "Feux",
          "level": 2,
          "children": {
            "Douille de lampe, feu de stationnement/de position": {
              "categoryId": 100043,
              "categoryName": "Lights",
              "level": 2,
              "children": {
                "Feu de position / d'encombrement / composants": {
                  "categoryId": null,
                  "categoryName": "Feu de position / d'encombrement / composants",
                  "level": 4,
                  "children": {
                    "Douille de lampe, feu de stationnement/de position": {
                      "categoryId": 100290,
                      "categoryName": "Side Marker/End Outline Marker Light/Parts",
                      "level": 3,
                      "children": {
                        "Feu de stationnement/de position": {
                          "categoryId": null,
                          "categoryName": "Feu de stationnement/de position",
                          "level": 6,
                          "children": {
                            "Douille de lampe, feu de stationnement/de position": {
                              "categoryId": 100468,
                              "categoryName": "Park/Position Light",
                              "level": 4,
                              "children": [],
                              "productId": 8261
                            }
                          }
                        }
                      },
                      "productId": 8261
                    }
                  }
                }
              },
              "productId": 8261
            },
            "Douille de lampe, feu latéral": {
              "categoryId": 100043,
              "categoryName": "Lights",
              "level": 2,
              "children": {
                "Feu de position / d'encombrement / composants": {
                  "categoryId": null,
                  "categoryName": "Feu de position / d'encombrement / composants",
                  "level": 4,
                  "children": {
                    "Douille de lampe, feu latéral": {
                      "categoryId": 100290,
                      "categoryName": "Side Marker/End Outline Marker Light/Parts",
                      "level": 3,
                      "children": {
                        "Feux latéraux": {
                          "categoryId": null,
                          "categoryName": "Feux latéraux",
                          "level": 6,
                          "children": {
                            "Douille de lampe, feu latéral": {
                              "categoryId": 100753,
                              "categoryName": "Side Marker Lights",
                              "level": 4,
                              "children": [],
                              "productId": 9035
                            }
                          }
                        }
                      },
                      "productId": 9035
                    }
                  }
                }
              },
              "productId": 9035
            },
            "Support de lampe, feu clignotant": {
              "categoryId": 100043,
              "categoryName": "Lights",
              "level": 2,
              "children": {
                "Feu clignotant/composants": {
                  "categoryId": null,
                  "categoryName": "Feu clignotant/composants",
                  "level": 4,
                  "children": {
                    "Support de lampe, feu clignotant": {
                      "categoryId": 100145,
                      "categoryName": "Direction Indicator/Parts",
                      "level": 3,
                      "children": {
                        "Composants de feu clignotant": {
                          "categoryId": null,
                          "categoryName": "Composants de feu clignotant",
                          "level": 6,
                          "children": {
                            "Support de lampe, feu clignotant": {
                              "categoryId": 100480,
                              "categoryName": "Indicator Parts",
                              "level": 4,
                              "children": [],
                              "productId": 6146
                            }
                          }
                        }
                      },
                      "productId": 6146
                    }
                  }
                }
              },
              "productId": 6146
            }
          }
        },
        "Instruments": {
          "categoryId": null,
          "categoryName": "Instruments",
          "level": 2,
          "children": {
            "Douille de lampe, instrument d’indication": {
              "categoryId": 100322,
              "categoryName": "Instruments",
              "level": 2,
              "children": {
                "Instruments indicateurs": {
                  "categoryId": null,
                  "categoryName": "Instruments indicateurs",
                  "level": 4,
                  "children": {
                    "Douille de lampe, instrument d’indication": {
                      "categoryId": 100555,
                      "categoryName": "Gauges",
                      "level": 3,
                      "children": [],
                      "productId": 8259
                    }
                  }
                }
              },
              "productId": 8259
            }
          }
        },
        "Phares supplémentaires/composants": {
          "categoryId": null,
          "categoryName": "Phares supplémentaires/composants",
          "level": 2,
          "children": {
            "Douille de lampe, phare chercheur": {
              "categoryId": 100787,
              "categoryName": "Additional Headlight/Parts",
              "level": 2,
              "children": {
                "Phare chercheur / composants": {
                  "categoryId": null,
                  "categoryName": "Phare chercheur / composants",
                  "level": 4,
                  "children": {
                    "Douille de lampe, phare chercheur": {
                      "categoryId": 100281,
                      "categoryName": "Searchlight/Parts",
                      "level": 3,
                      "children": {
                        "Composants phare chercheur": {
                          "categoryId": null,
                          "categoryName": "Composants phare chercheur",
                          "level": 6,
                          "children": {
                            "Douille de lampe, phare chercheur": {
                              "categoryId": 100446,
                              "categoryName": "Searchlight Parts",
                              "level": 4,
                              "children": [],
                              "productId": 486
                            }
                          }
                        }
                      },
                      "productId": 486
                    }
                  }
                }
              },
              "productId": 486
            },
            "Douille de lampe, projecteur antibrouillard": {
              "categoryId": 100787,
              "categoryName": "Additional Headlight/Parts",
              "level": 2,
              "children": {
                "Projecteur antibrouillard/ composants": {
                  "categoryId": null,
                  "categoryName": "Projecteur antibrouillard/ composants",
                  "level": 4,
                  "children": {
                    "Douille de lampe, projecteur antibrouillard": {
                      "categoryId": 100277,
                      "categoryName": "Front Fog Light/Parts",
                      "level": 3,
                      "children": {
                        "Composants pour projecteur antibrouillard": {
                          "categoryId": null,
                          "categoryName": "Composants pour projecteur antibrouillard",
                          "level": 6,
                          "children": {
                            "Douille de lampe, projecteur antibrouillard": {
                              "categoryId": 100444,
                              "categoryName": "Fog Light Parts",
                              "level": 4,
                              "children": [],
                              "productId": 490
                            }
                          }
                        }
                      },
                      "productId": 490
                    }
                  }
                }
              },
              "productId": 490
            },
            "Douille de lampe, projecteur de travail": {
              "categoryId": 100787,
              "categoryName": "Additional Headlight/Parts",
              "level": 2,
              "children": {
                "Projecteur de travail, composants": {
                  "categoryId": null,
                  "categoryName": "Projecteur de travail, composants",
                  "level": 4,
                  "children": {
                    "Douille de lampe, projecteur de travail": {
                      "categoryId": 100280,
                      "categoryName": "Worklight/Parts",
                      "level": 3,
                      "children": {
                        "Projecteur de travail, composants": {
                          "categoryId": null,
                          "categoryName": "Projecteur de travail, composants",
                          "level": 6,
                          "children": {
                            "Douille de lampe, projecteur de travail": {
                              "categoryId": 100445,
                              "categoryName": "Worklight Parts",
                              "level": 4,
                              "children": [],
                              "productId": 487
                            }
                          }
                        }
                      },
                      "productId": 487
                    }
                  }
                }
              },
              "productId": 487
            },
            "Douille de lampe, projecteur longue portée": {
              "categoryId": 100787,
              "categoryName": "Additional Headlight/Parts",
              "level": 2,
              "children": {
                "Projecteur longue portée / composants": {
                  "categoryId": null,
                  "categoryName": "Projecteur longue portée / composants",
                  "level": 4,
                  "children": {
                    "Douille de lampe, projecteur longue portée": {
                      "categoryId": 100276,
                      "categoryName": "Spotlight/Parts",
                      "level": 3,
                      "children": {
                        "Projecteur longue portée / composants": {
                          "categoryId": null,
                          "categoryName": "Projecteur longue portée / composants",
                          "level": 6,
                          "children": {
                            "Douille de lampe, projecteur longue portée": {
                              "categoryId": 100443,
                              "categoryName": "Spotlight Parts",
                              "level": 4,
                              "children": [],
                              "productId": 488
                            }
                          }
                        }
                      },
                      "productId": 488
                    }
                  }
                }
              },
              "productId": 488
            }
          }
        },
        "Projecteurs principaux / composants": {
          "categoryId": null,
          "categoryName": "Projecteurs principaux / composants",
          "level": 2,
          "children": {
            "Douille de lampe, projecteur principal": {
              "categoryId": 100143,
              "categoryName": "Headlight/Parts",
              "level": 2,
              "children": {
                "Composants des projecteurs principaux": {
                  "categoryId": null,
                  "categoryName": "Composants des projecteurs principaux",
                  "level": 4,
                  "children": {
                    "Douille de lampe, projecteur principal": {
                      "categoryId": 100430,
                      "categoryName": "Headlight Parts",
                      "level": 3,
                      "children": [],
                      "productId": 489
                    }
                  }
                }
              },
              "productId": 489
            }
          }
        }
      }
    }
  },
  "arborescenceText": "├── Carrosserie [ID: 100001] (Niveau 1)\n│   ├── Arrière de la voiture (Niveau 2)\n│   │   └── Vehicle Rear [ID: 101705] (Niveau 2) → ProductId: 9035\n│   │       └── Feu de position / d'encombrement / composants (Niveau 4)\n│   │           └── Side Marker/End Outline Marker Light/Parts [ID: 101785] (Niveau 3) → ProductId: 9035\n│   │               └── Feux latéraux (Niveau 6)\n│   │                   └── Side Marker Lights [ID: 101788] (Niveau 4) → ProductId: 9035\n│   ├── Avant du véhicule (Niveau 2)\n│   │   ├── Vehicle Front [ID: 101648] (Niveau 2) → ProductId: 9035\n│   │   │   └── Feu de position / d'encombrement / composants (Niveau 4)\n│   │   │       └── Side Marker/End Outline Marker Light/Parts [ID: 101766] (Niveau 3) → ProductId: 9035\n│   │   │           └── Feux latéraux (Niveau 6)\n│   │   │               └── Side Marker Lights [ID: 101769] (Niveau 4) → ProductId: 9035\n│   │   ├── Vehicle Front [ID: 101648] (Niveau 2) → ProductId: 490\n│   │   │   └── Projecteur antibrouillard/ composants (Niveau 4)\n│   │   │       └── Front Fog Light/Parts [ID: 101661] (Niveau 3) → ProductId: 490\n│   │   │           └── Composants pour projecteur antibrouillard (Niveau 6)\n│   │   │               └── Fog Light Parts [ID: 101664] (Niveau 4) → ProductId: 490\n│   │   ├── Vehicle Front [ID: 101648] (Niveau 2) → ProductId: 488\n│   │   │   └── Projecteur longue portée / composants (Niveau 4)\n│   │   │       └── Spotlight/Parts [ID: 101665] (Niveau 3) → ProductId: 488\n│   │   │           └── Projecteur longue portée / composants (Niveau 6)\n│   │   │               └── Spotlight Parts [ID: 101668] (Niveau 4) → ProductId: 488\n│   │   └── Vehicle Front [ID: 101648] (Niveau 2) → ProductId: 489\n│   │       └── Projecteurs principaux / composants (Niveau 4)\n│   │           └── Headlight/Parts [ID: 101656] (Niveau 3) → ProductId: 489\n│   │               └── Composants des projecteurs principaux (Niveau 6)\n│   │                   └── Headlight Parts [ID: 101659] (Niveau 4) → ProductId: 489\n│   ├── Feux (Niveau 2)\n│   │   └── Lights [ID: 101407] (Niveau 2) → ProductId: 9035\n│   │       └── Feu de position / d'encombrement / composants (Niveau 4)\n│   │           └── Side Marker/End Outline Marker Light/Parts [ID: 101441] (Niveau 3) → ProductId: 9035\n│   │               └── Feux latéraux (Niveau 6)\n│   │                   └── Side Marker Lights [ID: 101444] (Niveau 4) → ProductId: 9035\n│   ├── Phares supplémentaires/composants (Niveau 2)\n│   │   ├── Additional Headlight/Parts [ID: 101340] (Niveau 2) → ProductId: 486\n│   │   │   └── Phare chercheur / composants (Niveau 4)\n│   │   │       └── Searchlight/Parts [ID: 101353] (Niveau 3) → ProductId: 486\n│   │   │           └── Composants phare chercheur (Niveau 6)\n│   │   │               └── Searchlight Parts [ID: 101356] (Niveau 4) → ProductId: 486\n│   │   ├── Additional Headlight/Parts [ID: 101340] (Niveau 2) → ProductId: 490\n│   │   │   └── Projecteur antibrouillard/ composants (Niveau 4)\n│   │   │       └── Front Fog Light/Parts [ID: 101341] (Niveau 3) → ProductId: 490\n│   │   │           └── Composants pour projecteur antibrouillard (Niveau 6)\n│   │   │               └── Fog Light Parts [ID: 101344] (Niveau 4) → ProductId: 490\n│   │   ├── Additional Headlight/Parts [ID: 101340] (Niveau 2) → ProductId: 487\n│   │   │   └── Projecteur de travail, composants (Niveau 4)\n│   │   │       └── Worklight/Parts [ID: 101349] (Niveau 3) → ProductId: 487\n│   │   │           └── Projecteur de travail, composants (Niveau 6)\n│   │   │               └── Worklight Parts [ID: 101352] (Niveau 4) → ProductId: 487\n│   │   └── Additional Headlight/Parts [ID: 101340] (Niveau 2) → ProductId: 488\n│   │       └── Projecteur longue portée / composants (Niveau 4)\n│   │           └── Spotlight/Parts [ID: 101345] (Niveau 3) → ProductId: 488\n│   │               └── Projecteur longue portée / composants (Niveau 6)\n│   │                   └── Spotlight Parts [ID: 101348] (Niveau 4) → ProductId: 488\n│   └── Projecteurs principaux / composants (Niveau 2)\n│       └── Headlight/Parts [ID: 101465] (Niveau 2) → ProductId: 489\n│           └── Composants des projecteurs principaux (Niveau 4)\n│               └── Headlight Parts [ID: 101468] (Niveau 3) → ProductId: 489\n\n├── Équipement intérieur [ID: 100341] (Niveau 1)\n│   └── Tableau de bord (Niveau 2)\n│       └── Dashboard [ID: 102998] (Niveau 2) → ProductId: 8259\n\n└── Système électrique [ID: 100010] (Niveau 1)\n    ├── Feux (Niveau 2)\n    │   ├── Lights [ID: 100043] (Niveau 2) → ProductId: 8261\n    │   │   └── Feu de position / d'encombrement / composants (Niveau 4)\n    │   │       └── Side Marker/End Outline Marker Light/Parts [ID: 100290] (Niveau 3) → ProductId: 8261\n    │   │           └── Feu de stationnement/de position (Niveau 6)\n    │   │               └── Park/Position Light [ID: 100468] (Niveau 4) → ProductId: 8261\n    │   ├── Lights [ID: 100043] (Niveau 2) → ProductId: 9035\n    │   │   └── Feu de position / d'encombrement / composants (Niveau 4)\n    │   │       └── Side Marker/End Outline Marker Light/Parts [ID: 100290] (Niveau 3) → ProductId: 9035\n    │   │           └── Feux latéraux (Niveau 6)\n    │   │               └── Side Marker Lights [ID: 100753] (Niveau 4) → ProductId: 9035\n    │   └── Lights [ID: 100043] (Niveau 2) → ProductId: 6146\n    │       └── Feu clignotant/composants (Niveau 4)\n    │           └── Direction Indicator/Parts [ID: 100145] (Niveau 3) → ProductId: 6146\n    │               └── Composants de feu clignotant (Niveau 6)\n    │                   └── Indicator Parts [ID: 100480] (Niveau 4) → ProductId: 6146\n    ├── Instruments (Niveau 2)\n    │   └── Instruments [ID: 100322] (Niveau 2) → ProductId: 8259\n    │       └── Instruments indicateurs (Niveau 4)\n    │           └── Gauges [ID: 100555] (Niveau 3) → ProductId: 8259\n    ├── Phares supplémentaires/composants (Niveau 2)\n    │   ├── Additional Headlight/Parts [ID: 100787] (Niveau 2) → ProductId: 486\n    │   │   └── Phare chercheur / composants (Niveau 4)\n    │   │       └── Searchlight/Parts [ID: 100281] (Niveau 3) → ProductId: 486\n    │   │           └── Composants phare chercheur (Niveau 6)\n    │   │               └── Searchlight Parts [ID: 100446] (Niveau 4) → ProductId: 486\n    │   ├── Additional Headlight/Parts [ID: 100787] (Niveau 2) → ProductId: 490\n    │   │   └── Projecteur antibrouillard/ composants (Niveau 4)\n    │   │       └── Front Fog Light/Parts [ID: 100277] (Niveau 3) → ProductId: 490\n    │   │           └── Composants pour projecteur antibrouillard (Niveau 6)\n    │   │               └── Fog Light Parts [ID: 100444] (Niveau 4) → ProductId: 490\n    │   ├── Additional Headlight/Parts [ID: 100787] (Niveau 2) → ProductId: 487\n    │   │   └── Projecteur de travail, composants (Niveau 4)\n    │   │       └── Worklight/Parts [ID: 100280] (Niveau 3) → ProductId: 487\n    │   │           └── Projecteur de travail, composants (Niveau 6)\n    │   │               └── Worklight Parts [ID: 100445] (Niveau 4) → ProductId: 487\n    │   └── Additional Headlight/Parts [ID: 100787] (Niveau 2) → ProductId: 488\n    │       └── Projecteur longue portée / composants (Niveau 4)\n    │           └── Spotlight/Parts [ID: 100276] (Niveau 3) → ProductId: 488\n    │               └── Projecteur longue portée / composants (Niveau 6)\n    │                   └── Spotlight Parts [ID: 100443] (Niveau 4) → ProductId: 488\n    └── Projecteurs principaux / composants (Niveau 2)\n        └── Headlight/Parts [ID: 100143] (Niveau 2) → ProductId: 489\n            └── Composants des projecteurs principaux (Niveau 4)\n                └── Headlight Parts [ID: 100430] (Niveau 3) → ProductId: 489",
  "arborescencePaths": [
    {
      "path": [
        "Carrosserie",
        "Arrière de la voiture",
        "Vehicle Rear"
      ],
      "categoryIds": [
        100001,
        null,
        101705
      ],
      "finalCategoryId": 101705,
      "productId": 9035
    },
    {
      "path": [
        "Carrosserie",
        "Avant du véhicule",
        "Vehicle Front"
      ],
      "categoryIds": [
        100001,
        null,
        101648
      ],
      "finalCategoryId": 101648,
      "productId": 9035
    },
    {
      "path": [
        "Carrosserie",
        "Avant du véhicule",
        "Vehicle Front"
      ],
      "categoryIds": [
        100001,
        null,
        101648
      ],
      "finalCategoryId": 101648,
      "productId": 490
    },
    {
      "path": [
        "Carrosserie",
        "Avant du véhicule",
        "Vehicle Front"
      ],
      "categoryIds": [
        100001,
        null,
        101648
      ],
      "finalCategoryId": 101648,
      "productId": 488
    },
    {
      "path": [
        "Carrosserie",
        "Avant du véhicule",
        "Vehicle Front"
      ],
      "categoryIds": [
        100001,
        null,
        101648
      ],
      "finalCategoryId": 101648,
      "productId": 489
    },
    {
      "path": [
        "Carrosserie",
        "Feux",
        "Lights"
      ],
      "categoryIds": [
        100001,
        null,
        101407
      ],
      "finalCategoryId": 101407,
      "productId": 9035
    },
    {
      "path": [
        "Carrosserie",
        "Phares supplémentaires/composants",
        "Additional Headlight/Parts"
      ],
      "categoryIds": [
        100001,
        null,
        101340
      ],
      "finalCategoryId": 101340,
      "productId": 486
    },
    {
      "path": [
        "Carrosserie",
        "Phares supplémentaires/composants",
        "Additional Headlight/Parts"
      ],
      "categoryIds": [
        100001,
        null,
        101340
      ],
      "finalCategoryId": 101340,
      "productId": 490
    },
    {
      "path": [
        "Carrosserie",
        "Phares supplémentaires/composants",
        "Additional Headlight/Parts"
      ],
      "categoryIds": [
        100001,
        null,
        101340
      ],
      "finalCategoryId": 101340,
      "productId": 487
    },
    {
      "path": [
        "Carrosserie",
        "Phares supplémentaires/composants",
        "Additional Headlight/Parts"
      ],
      "categoryIds": [
        100001,
        null,
        101340
      ],
      "finalCategoryId": 101340,
      "productId": 488
    },
    {
      "path": [
        "Carrosserie",
        "Projecteurs principaux / composants",
        "Headlight/Parts"
      ],
      "categoryIds": [
        100001,
        null,
        101465
      ],
      "finalCategoryId": 101465,
      "productId": 489
    },
    {
      "path": [
        "Équipement intérieur",
        "Tableau de bord",
        "Dashboard"
      ],
      "categoryIds": [
        100341,
        null,
        102998
      ],
      "finalCategoryId": 102998,
      "productId": 8259
    },
    {
      "path": [
        "Système électrique",
        "Feux",
        "Lights"
      ],
      "categoryIds": [
        100010,
        null,
        100043
      ],
      "finalCategoryId": 100043,
      "productId": 8261
    },
    {
      "path": [
        "Système électrique",
        "Feux",
        "Lights"
      ],
      "categoryIds": [
        100010,
        null,
        100043
      ],
      "finalCategoryId": 100043,
      "productId": 9035
    },
    {
      "path": [
        "Système électrique",
        "Feux",
        "Lights"
      ],
      "categoryIds": [
        100010,
        null,
        100043
      ],
      "finalCategoryId": 100043,
      "productId": 6146
    },
    {
      "path": [
        "Système électrique",
        "Instruments",
        "Instruments"
      ],
      "categoryIds": [
        100010,
        null,
        100322
      ],
      "finalCategoryId": 100322,
      "productId": 8259
    },
    {
      "path": [
        "Système électrique",
        "Phares supplémentaires/composants",
        "Additional Headlight/Parts"
      ],
      "categoryIds": [
        100010,
        null,
        100787
      ],
      "finalCategoryId": 100787,
      "productId": 486
    },
    {
      "path": [
        "Système électrique",
        "Phares supplémentaires/composants",
        "Additional Headlight/Parts"
      ],
      "categoryIds": [
        100010,
        null,
        100787
      ],
      "finalCategoryId": 100787,
      "productId": 490
    },
    {
      "path": [
        "Système électrique",
        "Phares supplémentaires/composants",
        "Additional Headlight/Parts"
      ],
      "categoryIds": [
        100010,
        null,
        100787
      ],
      "finalCategoryId": 100787,
      "productId": 487
    },
    {
      "path": [
        "Système électrique",
        "Phares supplémentaires/composants",
        "Additional Headlight/Parts"
      ],
      "categoryIds": [
        100010,
        null,
        100787
      ],
      "finalCategoryId": 100787,
      "productId": 488
    },
    {
      "path": [
        "Système électrique",
        "Projecteurs principaux / composants",
        "Headlight/Parts"
      ],
      "categoryIds": [
        100010,
        null,
        100143
      ],
      "finalCategoryId": 100143,
      "productId": 489
    }
  ],
  "productIdsInArbo": [
    486,
    487,
    488,
    489,
    490,
    6146,
    8259,
    8261,
    9035
  ],
  "closestProductIds": [
    {
      "productId": 486,
      "productName": "Douille de lampe, phare chercheur"
    },
    {
      "productId": 487,
      "productName": "Douille de lampe, projecteur de travail"
    },
    {
      "productId": 488,
      "productName": "Douille de lampe, projecteur longue portée"
    },
    {
      "productId": 489,
      "productName": "Douille de lampe, projecteur principal"
    },
    {
      "productId": 490,
      "productName": "Douille de lampe, projecteur antibrouillard"
    }
  ]
}