{
  "productName": "Durite de radiateur",
  "searchText": "Durite de radiateur",
  "found": true,
  "hasMatch": true,
  "timestamp": "2025-12-02T20:34:49.838Z",
  "productId": 475,
  "arborescence": {
    "Boîte de vitesses": {
      "categoryId": 100238,
      "categoryName": "Boîte de vitesses",
      "level": 1,
      "children": {
        "Boîte de vitesse automatique": {
          "categoryId": null,
          "categoryName": "Boîte de vitesse automatique",
          "level": 2,
          "children": {
            "Élément de liaison, durite rad. huile (boîte vitesses auto.)": {
              "categoryId": 100240,
              "categoryName": "Automatic Transmission",
              "level": 2,
              "children": {
                "Contrôle / hydraulique": {
                  "categoryId": null,
                  "categoryName": "Contrôle / hydraulique",
                  "level": 4,
                  "children": {
                    "Élément de liaison, durite rad. huile (boîte vitesses auto.)": {
                      "categoryId": 100776,
                      "categoryName": "Transmission Control/Hydraulics",
                      "level": 3,
                      "children": [],
                      "productId": 8233
                    }
                  }
                }
              },
              "productId": 8233
            }
          }
        }
      }
    },
    "Refroidissement": {
      "categoryId": 100007,
      "categoryName": "Refroidissement",
      "level": 1,
      "children": {
        "Tuyauterie et brides": {
          "categoryId": null,
          "categoryName": "Tuyauterie et brides",
          "level": 2,
          "children": {
            "Assortiment, tuyau de radiateur": {
              "categoryId": 100099,
              "categoryName": "Hoses/Pipes/Flanges",
              "level": 2,
              "children": {
                "Assortiments": {
                  "categoryId": null,
                  "categoryName": "Assortiments",
                  "level": 4,
                  "children": {
                    "Assortiment, tuyau de radiateur": {
                      "categoryId": 706823,
                      "categoryName": "Assortment",
                      "level": 3,
                      "children": [],
                      "productId": 61003
                    }
                  }
                }
              },
              "productId": 61003
            },
            "Durite de radiateur": {
              "categoryId": 100099,
              "categoryName": "Hoses/Pipes/Flanges",
              "level": 2,
              "children": {
                "Durite de refroidissement/conduite": {
                  "categoryId": null,
                  "categoryName": "Durite de refroidissement/conduite",
                  "level": 4,
                  "children": {
                    "Durite de radiateur": {
                      "categoryId": 100100,
                      "categoryName": "Radiator Hoses",
                      "level": 3,
                      "children": [],
                      "productId": 475
                    }
                  }
                }
              },
              "productId": 475
            },
            "Raccord de tuyau, durite de radiateur": {
              "categoryId": 100099,
              "categoryName": "Hoses/Pipes/Flanges",
              "level": 2,
              "children": {
                "Durite de refroidissement/conduite": {
                  "categoryId": null,
                  "categoryName": "Durite de refroidissement/conduite",
                  "level": 4,
                  "children": {
                    "Raccord de tuyau, durite de radiateur": {
                      "categoryId": 100100,
                      "categoryName": "Radiator Hoses",
                      "level": 3,
                      "children": [],
                      "productId": 9589
                    }
                  }
                }
              },
              "productId": 9589
            }
          }
        }
      }
    }
  },
  "arborescenceText": "├── Boîte de vitesses [ID: 100238] (Niveau 1)\n│   └── Boîte de vitesse automatique (Niveau 2)\n│       └── Automatic Transmission [ID: 100240] (Niveau 2) → ProductId: 8233\n│           └── Contrôle / hydraulique (Niveau 4)\n│               └── Transmission Control/Hydraulics [ID: 100776] (Niveau 3) → ProductId: 8233\n\n└── Refroidissement [ID: 100007] (Niveau 1)\n    └── Tuyauterie et brides (Niveau 2)\n        ├── Hoses/Pipes/Flanges [ID: 100099] (Niveau 2) → ProductId: 61003\n        │   └── Assortiments (Niveau 4)\n        │       └── Assortment [ID: 706823] (Niveau 3) → ProductId: 61003\n        ├── Hoses/Pipes/Flanges [ID: 100099] (Niveau 2) → ProductId: 475\n        │   └── Durite de refroidissement/conduite (Niveau 4)\n        │       └── Radiator Hoses [ID: 100100] (Niveau 3) → ProductId: 475\n        └── Hoses/Pipes/Flanges [ID: 100099] (Niveau 2) → ProductId: 9589\n            └── Durite de refroidissement/conduite (Niveau 4)\n                └── Radiator Hoses [ID: 100100] (Niveau 3) → ProductId: 9589",
  "arborescencePaths": [
    {
      "path": [
        "Boîte de vitesses",
        "Boîte de vitesse automatique",
        "Automatic Transmission"
      ],
      "categoryIds": [
        100238,
        null,
        100240
      ],
      "finalCategoryId": 100240,
      "productId": 8233
    },
    {
      "path": [
        "Refroidissement",
        "Tuyauterie et brides",
        "Hoses/Pipes/Flanges"
      ],
      "categoryIds": [
        100007,
        null,
        100099
      ],
      "finalCategoryId": 100099,
      "productId": 61003
    },
    {
      "path": [
        "Refroidissement",
        "Tuyauterie et brides",
        "Hoses/Pipes/Flanges"
      ],
      "categoryIds": [
        100007,
        null,
        100099
      ],
      "finalCategoryId": 100099,
      "productId": 475
    },
    {
      "path": [
        "Refroidissement",
        "Tuyauterie et brides",
        "Hoses/Pipes/Flanges"
      ],
      "categoryIds": [
        100007,
        null,
        100099
      ],
      "finalCategoryId": 100099,
      "productId": 9589
    }
  ],
  "productIdsInArbo": [
    475,
    8233,
    9589,
    61003
  ],
  "matchedProductIds": [
    475
  ]
}