{
  "productName": "Entretoise",
  "searchText": "Entretoise",
  "found": true,
  "hasMatch": false,
  "timestamp": "2025-12-02T20:36:53.330Z",
  "productId": 2123,
  "arborescence": {
    "Boîte de vitesses": {
      "categoryId": 100238,
      "categoryName": "Boîte de vitesses",
      "level": 1,
      "children": {
        "Boîte de vitesses manuelle": {
          "categoryId": null,
          "categoryName": "Boîte de vitesses manuelle",
          "level": 2,
          "children": {
            "Entretoise, arbre d'entraînement": {
              "categoryId": 100239,
              "categoryName": "Manual Transmission",
              "level": 2,
              "children": {
                "Carter/composants": {
                  "categoryId": null,
                  "categoryName": "Carter/composants",
                  "level": 4,
                  "children": {
                    "Entretoise, arbre d'entraînement": {
                      "categoryId": 100774,
                      "categoryName": "Transmission Housing/Parts",
                      "level": 3,
                      "children": [],
                      "productId": 4138
                    }
                  }
                }
              },
              "productId": 4138
            }
          }
        },
        "Boîte de vitesses manuelle robotisée (BVR)": {
          "categoryId": null,
          "categoryName": "Boîte de vitesses manuelle robotisée (BVR)",
          "level": 2,
          "children": {
            "Bague d’espacement, arbre de boîte de vitesses (BVR)": {
              "categoryId": 706584,
              "categoryName": "Automated manual transmission (AMT)",
              "level": 2,
              "children": {
                "Carter/composants": {
                  "categoryId": null,
                  "categoryName": "Carter/composants",
                  "level": 4,
                  "children": {
                    "Bague d’espacement, arbre de boîte de vitesses (BVR)": {
                      "categoryId": 706586,
                      "categoryName": "Transmission Housing/Parts",
                      "level": 3,
                      "children": [],
                      "productId": 60241
                    }
                  }
                }
              },
              "productId": 60241
            }
          }
        },
        "Transmission à double embrayage": {
          "categoryId": null,
          "categoryName": "Transmission à double embrayage",
          "level": 2,
          "children": {
            "Bague d'espacement, arbre d'entrée de boîte de vitesses": {
              "categoryId": 706835,
              "categoryName": "Dual-Clutch Transmission",
              "level": 2,
              "children": {
                "Carter/composants": {
                  "categoryId": null,
                  "categoryName": "Carter/composants",
                  "level": 4,
                  "children": {
                    "Bague d'espacement, arbre d'entrée de boîte de vitesses": {
                      "categoryId": 706846,
                      "categoryName": "Transmission Housing/Parts",
                      "level": 3,
                      "children": [],
                      "productId": 61219
                    }
                  }
                }
              },
              "productId": 61219
            }
          }
        }
      }
    },
    "Carrosserie": {
      "categoryId": 100001,
      "categoryName": "Carrosserie",
      "level": 1,
      "children": {
        "Vitrages/Miroirs": {
          "categoryId": null,
          "categoryName": "Vitrages/Miroirs",
          "level": 2,
          "children": {
            "Entretoise, montage de vitres": {
              "categoryId": 100744,
              "categoryName": "Glazing/Mirrors",
              "level": 2,
              "children": {
                "Vitrage": {
                  "categoryId": null,
                  "categoryName": "Vitrage",
                  "level": 4,
                  "children": {
                    "Entretoise, montage de vitres": {
                      "categoryId": 100745,
                      "categoryName": "Glazing",
                      "level": 3,
                      "children": {
                        "Pièces de montage": {
                          "categoryId": null,
                          "categoryName": "Pièces de montage",
                          "level": 6,
                          "children": {
                            "Entretoise, montage de vitres": {
                              "categoryId": 100569,
                              "categoryName": "Assembly Parts",
                              "level": 4,
                              "children": [],
                              "productId": 4846
                            }
                          }
                        }
                      },
                      "productId": 4846
                    }
                  }
                }
              },
              "productId": 4846
            }
          }
        }
      }
    },
    "Direction": {
      "categoryId": 100012,
      "categoryName": "Direction",
      "level": 1,
      "children": {
        "Outils": {
          "categoryId": null,
          "categoryName": "Outils",
          "level": 2,
          "children": {
            "Extracteur, volant - entretoise": {
              "categoryId": 103158,
              "categoryName": "Tools",
              "level": 2,
              "children": [],
              "productId": 4549
            }
          }
        },
        "Soufflet / joint": {
          "categoryId": null,
          "categoryName": "Soufflet / joint",
          "level": 2,
          "children": {
            "Entretoise, joint-soufflet-direction": {
              "categoryId": 100201,
              "categoryName": "Bellow/Seal",
              "level": 2,
              "children": [],
              "productId": 4258
            }
          }
        }
      }
    },
    "Échappement": {
      "categoryId": 100004,
      "categoryName": "Échappement",
      "level": 1,
      "children": {
        "Pièces de montage": {
          "categoryId": null,
          "categoryName": "Pièces de montage",
          "level": 2,
          "children": {
            "Entretoise, échappement": {
              "categoryId": 100222,
              "categoryName": "Assembly Parts",
              "level": 2,
              "children": {
                "Pièces détachées de montage": {
                  "categoryId": null,
                  "categoryName": "Pièces détachées de montage",
                  "level": 4,
                  "children": {
                    "Entretoise, échappement": {
                      "categoryId": 100317,
                      "categoryName": "Individual Assembly Parts",
                      "level": 3,
                      "children": {
                        "Entretoise": {
                          "categoryId": null,
                          "categoryName": "Entretoise",
                          "level": 6,
                          "children": {
                            "Entretoise, échappement": {
                              "categoryId": 103111,
                              "categoryName": "Spacer Sleeve",
                              "level": 4,
                              "children": [],
                              "productId": 4412
                            }
                          }
                        }
                      },
                      "productId": 4412
                    }
                  }
                }
              },
              "productId": 4412
            }
          }
        }
      }
    },
    "Entraînement des roues": {
      "categoryId": 100014,
      "categoryName": "Entraînement des roues",
      "level": 1,
      "children": {
        "Arbre de transmission": {
          "categoryId": null,
          "categoryName": "Arbre de transmission",
          "level": 2,
          "children": {
            "Douille entretoise, arbre de transmission à cardans": {
              "categoryId": 100062,
              "categoryName": "Drive Shaft",
              "level": 2,
              "children": [],
              "productId": 5037
            }
          }
        }
      }
    },
    "Moteur": {
      "categoryId": 100002,
      "categoryName": "Moteur",
      "level": 1,
      "children": {
        "Culasse / pieces de montage": {
          "categoryId": null,
          "categoryName": "Culasse / pieces de montage",
          "level": 2,
          "children": {
            "Plaque entretoise, culasse": {
              "categoryId": 100373,
              "categoryName": "Cylinder Head/Attachment Parts",
              "level": 2,
              "children": {
                "Culasse": {
                  "categoryId": null,
                  "categoryName": "Culasse",
                  "level": 4,
                  "children": {
                    "Plaque entretoise, culasse": {
                      "categoryId": 100380,
                      "categoryName": "Cylinder Head",
                      "level": 3,
                      "children": [],
                      "productId": 2995
                    }
                  }
                }
              },
              "productId": 2995
            }
          }
        },
        "Outils": {
          "categoryId": null,
          "categoryName": "Outils",
          "level": 2,
          "children": {
            "Entretoise, outil d'arrêt (épure de distribution)": {
              "categoryId": 103129,
              "categoryName": "Tools",
              "level": 2,
              "children": [],
              "productId": 7073
            }
          }
        }
      }
    },
    "Outils spéciaux": {
      "categoryId": 706365,
      "categoryName": "Outils spéciaux",
      "level": 1,
      "children": {
        "Outils spéciaux suspension d’essieu/guidage des roues/roues": {
          "categoryId": null,
          "categoryName": "Outils spéciaux suspension d’essieu/guidage des roues/roues",
          "level": 2,
          "children": {
            "Embout de clé à douille, fusée d'essieu (entretoise)": {
              "categoryId": 706380,
              "categoryName": "Special Tools, axle mounting/steering/wheels",
              "level": 2,
              "children": {
                "Fusée d'essieu": {
                  "categoryId": null,
                  "categoryName": "Fusée d'essieu",
                  "level": 4,
                  "children": {
                    "Embout de clé à douille, fusée d'essieu (entretoise)": {
                      "categoryId": 706389,
                      "categoryName": "Steering Knuckle",
                      "level": 3,
                      "children": [],
                      "productId": 8764
                    }
                  }
                }
              },
              "productId": 8764
            },
            "Entretoise, fixation suspension articulée/rotule de suspens.": {
              "categoryId": 706380,
              "categoryName": "Special Tools, axle mounting/steering/wheels",
              "level": 2,
              "children": {
                "Rotules": {
                  "categoryId": null,
                  "categoryName": "Rotules",
                  "level": 4,
                  "children": {
                    "Entretoise, fixation suspension articulée/rotule de suspens.": {
                      "categoryId": 706383,
                      "categoryName": "Joints",
                      "level": 3,
                      "children": [],
                      "productId": 8472
                    }
                  }
                }
              },
              "productId": 8472
            },
            "Kit d’expansion, entretoise (fixat. susp. art./rotule susp.)": {
              "categoryId": 706380,
              "categoryName": "Special Tools, axle mounting/steering/wheels",
              "level": 2,
              "children": {
                "Rotules": {
                  "categoryId": null,
                  "categoryName": "Rotules",
                  "level": 4,
                  "children": {
                    "Kit d’expansion, entretoise (fixat. susp. art./rotule susp.)": {
                      "categoryId": 706383,
                      "categoryName": "Joints",
                      "level": 3,
                      "children": [],
                      "productId": 8471
                    }
                  }
                }
              },
              "productId": 8471
            },
            "Vis de pression, entretoise (fixat. susp. art./rotule susp.)": {
              "categoryId": 706380,
              "categoryName": "Special Tools, axle mounting/steering/wheels",
              "level": 2,
              "children": {
                "Rotules": {
                  "categoryId": null,
                  "categoryName": "Rotules",
                  "level": 4,
                  "children": {
                    "Vis de pression, entretoise (fixat. susp. art./rotule susp.)": {
                      "categoryId": 706383,
                      "categoryName": "Joints",
                      "level": 3,
                      "children": [],
                      "productId": 8473
                    }
                  }
                }
              },
              "productId": 8473
            }
          }
        },
        "Outils spéciaux suspension/amortissement": {
          "categoryId": null,
          "categoryName": "Outils spéciaux suspension/amortissement",
          "level": 2,
          "children": {
            "Entretoise, tendeur de ressort de plaque de pression": {
              "categoryId": 706386,
              "categoryName": "Suspension/Damping Special Tools",
              "level": 2,
              "children": {
                "Compresseur de ressort hélicoïdal": {
                  "categoryId": null,
                  "categoryName": "Compresseur de ressort hélicoïdal",
                  "level": 4,
                  "children": {
                    "Entretoise, tendeur de ressort de plaque de pression": {
                      "categoryId": 706387,
                      "categoryName": "Spring Compressor",
                      "level": 3,
                      "children": [],
                      "productId": 7118
                    }
                  }
                }
              },
              "productId": 7118
            }
          }
        }
      }
    },
    "Suspension d'essieu/Guidage des roues/Roues": {
      "categoryId": 100013,
      "categoryName": "Suspension d'essieu/Guidage des roues/Roues",
      "level": 1,
      "children": {
        "Écartement des roues élargi": {
          "categoryId": null,
          "categoryName": "Écartement des roues élargi",
          "level": 2,
          "children": {
            "Écartement des roues élargi": {
              "categoryId": 102733,
              "categoryName": "Track Widening",
              "level": 2,
              "children": [],
              "productId": 3792
            }
          }
        },
        "Fixation jambe de force / suspension": {
          "categoryId": null,
          "categoryName": "Fixation jambe de force / suspension",
          "level": 2,
          "children": {
            "Entretoise, coupelle de suspension": {
              "categoryId": 100735,
              "categoryName": "Mounting, suspension strut",
              "level": 2,
              "children": [],
              "productId": 5004
            }
          }
        },
        "Fusée d'essieu / kit de réparation": {
          "categoryId": null,
          "categoryName": "Fusée d'essieu / kit de réparation",
          "level": 2,
          "children": {
            "Entretoise, pivot de fusée d'essieu": {
              "categoryId": 100207,
              "categoryName": "Steering Knuckle/Repair Kit",
              "level": 2,
              "children": {
                "Pivot de fusée d'essieu": {
                  "categoryId": null,
                  "categoryName": "Pivot de fusée d'essieu",
                  "level": 4,
                  "children": {
                    "Entretoise, pivot de fusée d'essieu": {
                      "categoryId": 100588,
                      "categoryName": "Kingpin",
                      "level": 3,
                      "children": [],
                      "productId": 3514
                    }
                  }
                }
              },
              "productId": 3514
            }
          }
        },
        "Jambes de force / barres": {
          "categoryId": null,
          "categoryName": "Jambes de force / barres",
          "level": 2,
          "children": {
            "Biellette de barre stabilisatrice": {
              "categoryId": 100209,
              "categoryName": "Struts/Rods",
              "level": 2,
              "children": [],
              "productId": 3230
            }
          }
        },
        "Moyeu de roue / fixation": {
          "categoryId": null,
          "categoryName": "Moyeu de roue / fixation",
          "level": 2,
          "children": {
            "Entretoise, roulement de roue": {
              "categoryId": 100206,
              "categoryName": "Wheel Hub/Mounting",
              "level": 2,
              "children": {
                "Roulement de roue": {
                  "categoryId": null,
                  "categoryName": "Roulement de roue",
                  "level": 4,
                  "children": {
                    "Entretoise, roulement de roue": {
                      "categoryId": 100579,
                      "categoryName": "Wheel Bearing",
                      "level": 3,
                      "children": [],
                      "productId": 4999
                    }
                  }
                }
              },
              "productId": 4999
            }
          }
        },
        "Outils": {
          "categoryId": null,
          "categoryName": "Outils",
          "level": 2,
          "children": {
            "Embout de clé à douille, fusée d'essieu (entretoise)": {
              "categoryId": 103159,
              "categoryName": "Tools",
              "level": 2,
              "children": [],
              "productId": 8764
            },
            "Entretoise, fixation suspension articulée/rotule de suspens.": {
              "categoryId": 103159,
              "categoryName": "Tools",
              "level": 2,
              "children": [],
              "productId": 8472
            },
            "Kit d’expansion, entretoise (fixat. susp. art./rotule susp.)": {
              "categoryId": 103159,
              "categoryName": "Tools",
              "level": 2,
              "children": [],
              "productId": 8471
            },
            "Vis de pression, entretoise (fixat. susp. art./rotule susp.)": {
              "categoryId": 103159,
              "categoryName": "Tools",
              "level": 2,
              "children": [],
              "productId": 8473
            }
          }
        },
        "Pièce de stabilisateur / pièces de fixation": {
          "categoryId": null,
          "categoryName": "Pièce de stabilisateur / pièces de fixation",
          "level": 2,
          "children": {
            "Biellette de barre stabilisatrice": {
              "categoryId": 100210,
              "categoryName": "Stabiliser Bar/Fastening Parts",
              "level": 2,
              "children": {
                "Barre de suspension": {
                  "categoryId": null,
                  "categoryName": "Barre de suspension",
                  "level": 4,
                  "children": {
                    "Biellette de barre stabilisatrice": {
                      "categoryId": 100577,
                      "categoryName": "Coupling Rod",
                      "level": 3,
                      "children": [],
                      "productId": 3230
                    }
                  }
                }
              },
              "productId": 3230
            },
            "Entretoise/tige, stabilisateur": {
              "categoryId": 100210,
              "categoryName": "Stabiliser Bar/Fastening Parts",
              "level": 2,
              "children": {
                "Barre de suspension": {
                  "categoryId": null,
                  "categoryName": "Barre de suspension",
                  "level": 4,
                  "children": {
                    "Entretoise/tige, stabilisateur": {
                      "categoryId": 100577,
                      "categoryName": "Coupling Rod",
                      "level": 3,
                      "children": [],
                      "productId": 3229
                    }
                  }
                },
                "Support du balancier": {
                  "categoryId": null,
                  "categoryName": "Support du balancier",
                  "level": 4,
                  "children": {
                    "Entretoise/tige, stabilisateur": {
                      "categoryId": 100590,
                      "categoryName": "Self-Aligning Support",
                      "level": 3,
                      "children": [],
                      "productId": 3229
                    }
                  }
                }
              },
              "productId": 3229
            }
          }
        }
      }
    },
    "Suspension/Amortissement": {
      "categoryId": 100011,
      "categoryName": "Suspension/Amortissement",
      "level": 1,
      "children": {
        "Coupelle de suspension/d'amortisseur": {
          "categoryId": null,
          "categoryName": "Coupelle de suspension/d'amortisseur",
          "level": 2,
          "children": {
            "Entretoise, coupelle de suspension": {
              "categoryId": 100371,
              "categoryName": "Suspension Strut/Shock Absorber Mount",
              "level": 2,
              "children": [],
              "productId": 5004
            }
          }
        },
        "Outils": {
          "categoryId": null,
          "categoryName": "Outils",
          "level": 2,
          "children": {
            "Entretoise, tendeur de ressort de plaque de pression": {
              "categoryId": 104406,
              "categoryName": "Tools",
              "level": 2,
              "children": [],
              "productId": 7118
            },
            "Kit d’expansion, entretoise (fixat. susp. art./rotule susp.)": {
              "categoryId": 104406,
              "categoryName": "Tools",
              "level": 2,
              "children": [],
              "productId": 8471
            },
            "Vis de pression, entretoise (fixat. susp. art./rotule susp.)": {
              "categoryId": 104406,
              "categoryName": "Tools",
              "level": 2,
              "children": [],
              "productId": 8473
            }
          }
        }
      }
    }
  },
  "arborescenceText": "├── Boîte de vitesses [ID: 100238] (Niveau 1)\n│   ├── Boîte de vitesses manuelle (Niveau 2)\n│   │   └── Manual Transmission [ID: 100239] (Niveau 2) → ProductId: 4138\n│   │       └── Carter/composants (Niveau 4)\n│   │           └── Transmission Housing/Parts [ID: 100774] (Niveau 3) → ProductId: 4138\n│   ├── Boîte de vitesses manuelle robotisée (BVR) (Niveau 2)\n│   │   └── Automated manual transmission (AMT) [ID: 706584] (Niveau 2) → ProductId: 60241\n│   │       └── Carter/composants (Niveau 4)\n│   │           └── Transmission Housing/Parts [ID: 706586] (Niveau 3) → ProductId: 60241\n│   └── Transmission à double embrayage (Niveau 2)\n│       └── Dual-Clutch Transmission [ID: 706835] (Niveau 2) → ProductId: 61219\n│           └── Carter/composants (Niveau 4)\n│               └── Transmission Housing/Parts [ID: 706846] (Niveau 3) → ProductId: 61219\n\n├── Carrosserie [ID: 100001] (Niveau 1)\n│   └── Vitrages/Miroirs (Niveau 2)\n│       └── Glazing/Mirrors [ID: 100744] (Niveau 2) → ProductId: 4846\n│           └── Vitrage (Niveau 4)\n│               └── Glazing [ID: 100745] (Niveau 3) → ProductId: 4846\n│                   └── Pièces de montage (Niveau 6)\n│                       └── Assembly Parts [ID: 100569] (Niveau 4) → ProductId: 4846\n\n├── Direction [ID: 100012] (Niveau 1)\n│   ├── Outils (Niveau 2)\n│   │   └── Tools [ID: 103158] (Niveau 2) → ProductId: 4549\n│   └── Soufflet / joint (Niveau 2)\n│       └── Bellow/Seal [ID: 100201] (Niveau 2) → ProductId: 4258\n\n├── Échappement [ID: 100004] (Niveau 1)\n│   └── Pièces de montage (Niveau 2)\n│       └── Assembly Parts [ID: 100222] (Niveau 2) → ProductId: 4412\n│           └── Pièces détachées de montage (Niveau 4)\n│               └── Individual Assembly Parts [ID: 100317] (Niveau 3) → ProductId: 4412\n│                   └── Entretoise (Niveau 6)\n│                       └── Spacer Sleeve [ID: 103111] (Niveau 4) → ProductId: 4412\n\n├── Entraînement des roues [ID: 100014] (Niveau 1)\n│   └── Arbre de transmission (Niveau 2)\n│       └── Drive Shaft [ID: 100062] (Niveau 2) → ProductId: 5037\n\n├── Moteur [ID: 100002] (Niveau 1)\n│   ├── Culasse / pieces de montage (Niveau 2)\n│   │   └── Cylinder Head/Attachment Parts [ID: 100373] (Niveau 2) → ProductId: 2995\n│   │       └── Culasse (Niveau 4)\n│   │           └── Cylinder Head [ID: 100380] (Niveau 3) → ProductId: 2995\n│   └── Outils (Niveau 2)\n│       └── Tools [ID: 103129] (Niveau 2) → ProductId: 7073\n\n├── Outils spéciaux [ID: 706365] (Niveau 1)\n│   ├── Outils spéciaux suspension d’essieu/guidage des roues/roues (Niveau 2)\n│   │   ├── Special Tools, axle mounting/steering/wheels [ID: 706380] (Niveau 2) → ProductId: 8764\n│   │   │   └── Fusée d'essieu (Niveau 4)\n│   │   │       └── Steering Knuckle [ID: 706389] (Niveau 3) → ProductId: 8764\n│   │   ├── Special Tools, axle mounting/steering/wheels [ID: 706380] (Niveau 2) → ProductId: 8472\n│   │   │   └── Rotules (Niveau 4)\n│   │   │       └── Joints [ID: 706383] (Niveau 3) → ProductId: 8472\n│   │   ├── Special Tools, axle mounting/steering/wheels [ID: 706380] (Niveau 2) → ProductId: 8471\n│   │   │   └── Rotules (Niveau 4)\n│   │   │       └── Joints [ID: 706383] (Niveau 3) → ProductId: 8471\n│   │   └── Special Tools, axle mounting/steering/wheels [ID: 706380] (Niveau 2) → ProductId: 8473\n│   │       └── Rotules (Niveau 4)\n│   │           └── Joints [ID: 706383] (Niveau 3) → ProductId: 8473\n│   └── Outils spéciaux suspension/amortissement (Niveau 2)\n│       └── Suspension/Damping Special Tools [ID: 706386] (Niveau 2) → ProductId: 7118\n│           └── Compresseur de ressort hélicoïdal (Niveau 4)\n│               └── Spring Compressor [ID: 706387] (Niveau 3) → ProductId: 7118\n\n├── Suspension d'essieu/Guidage des roues/Roues [ID: 100013] (Niveau 1)\n│   ├── Écartement des roues élargi (Niveau 2)\n│   │   └── Track Widening [ID: 102733] (Niveau 2) → ProductId: 3792\n│   ├── Fixation jambe de force / suspension (Niveau 2)\n│   │   └── Mounting, suspension strut [ID: 100735] (Niveau 2) → ProductId: 5004\n│   ├── Fusée d'essieu / kit de réparation (Niveau 2)\n│   │   └── Steering Knuckle/Repair Kit [ID: 100207] (Niveau 2) → ProductId: 3514\n│   │       └── Pivot de fusée d'essieu (Niveau 4)\n│   │           └── Kingpin [ID: 100588] (Niveau 3) → ProductId: 3514\n│   ├── Jambes de force / barres (Niveau 2)\n│   │   └── Struts/Rods [ID: 100209] (Niveau 2) → ProductId: 3230\n│   ├── Moyeu de roue / fixation (Niveau 2)\n│   │   └── Wheel Hub/Mounting [ID: 100206] (Niveau 2) → ProductId: 4999\n│   │       └── Roulement de roue (Niveau 4)\n│   │           └── Wheel Bearing [ID: 100579] (Niveau 3) → ProductId: 4999\n│   ├── Outils (Niveau 2)\n│   │   ├── Tools [ID: 103159] (Niveau 2) → ProductId: 8764\n│   │   ├── Tools [ID: 103159] (Niveau 2) → ProductId: 8472\n│   │   ├── Tools [ID: 103159] (Niveau 2) → ProductId: 8471\n│   │   └── Tools [ID: 103159] (Niveau 2) → ProductId: 8473\n│   └── Pièce de stabilisateur / pièces de fixation (Niveau 2)\n│       ├── Stabiliser Bar/Fastening Parts [ID: 100210] (Niveau 2) → ProductId: 3230\n│       │   └── Barre de suspension (Niveau 4)\n│       │       └── Coupling Rod [ID: 100577] (Niveau 3) → ProductId: 3230\n│       └── Stabiliser Bar/Fastening Parts [ID: 100210] (Niveau 2) → ProductId: 3229\n│           ├── Barre de suspension (Niveau 4)\n│           │   └── Coupling Rod [ID: 100577] (Niveau 3) → ProductId: 3229\n│           └── Support du balancier (Niveau 4)\n│               └── Self-Aligning Support [ID: 100590] (Niveau 3) → ProductId: 3229\n\n└── Suspension/Amortissement [ID: 100011] (Niveau 1)\n    ├── Coupelle de suspension/d'amortisseur (Niveau 2)\n    │   └── Suspension Strut/Shock Absorber Mount [ID: 100371] (Niveau 2) → ProductId: 5004\n    └── Outils (Niveau 2)\n        ├── Tools [ID: 104406] (Niveau 2) → ProductId: 7118\n        ├── Tools [ID: 104406] (Niveau 2) → ProductId: 8471\n        └── Tools [ID: 104406] (Niveau 2) → ProductId: 8473",
  "arborescencePaths": [
    {
      "path": [
        "Boîte de vitesses",
        "Boîte de vitesses manuelle",
        "Manual Transmission"
      ],
      "categoryIds": [
        100238,
        null,
        100239
      ],
      "finalCategoryId": 100239,
      "productId": 4138
    },
    {
      "path": [
        "Boîte de vitesses",
        "Boîte de vitesses manuelle robotisée (BVR)",
        "Automated manual transmission (AMT)"
      ],
      "categoryIds": [
        100238,
        null,
        706584
      ],
      "finalCategoryId": 706584,
      "productId": 60241
    },
    {
      "path": [
        "Boîte de vitesses",
        "Transmission à double embrayage",
        "Dual-Clutch Transmission"
      ],
      "categoryIds": [
        100238,
        null,
        706835
      ],
      "finalCategoryId": 706835,
      "productId": 61219
    },
    {
      "path": [
        "Carrosserie",
        "Vitrages/Miroirs",
        "Glazing/Mirrors"
      ],
      "categoryIds": [
        100001,
        null,
        100744
      ],
      "finalCategoryId": 100744,
      "productId": 4846
    },
    {
      "path": [
        "Direction",
        "Outils",
        "Tools"
      ],
      "categoryIds": [
        100012,
        null,
        103158
      ],
      "finalCategoryId": 103158,
      "productId": 4549
    },
    {
      "path": [
        "Direction",
        "Soufflet / joint",
        "Bellow/Seal"
      ],
      "categoryIds": [
        100012,
        null,
        100201
      ],
      "finalCategoryId": 100201,
      "productId": 4258
    },
    {
      "path": [
        "Échappement",
        "Pièces de montage",
        "Assembly Parts"
      ],
      "categoryIds": [
        100004,
        null,
        100222
      ],
      "finalCategoryId": 100222,
      "productId": 4412
    },
    {
      "path": [
        "Entraînement des roues",
        "Arbre de transmission",
        "Drive Shaft"
      ],
      "categoryIds": [
        100014,
        null,
        100062
      ],
      "finalCategoryId": 100062,
      "productId": 5037
    },
    {
      "path": [
        "Moteur",
        "Culasse / pieces de montage",
        "Cylinder Head/Attachment Parts"
      ],
      "categoryIds": [
        100002,
        null,
        100373
      ],
      "finalCategoryId": 100373,
      "productId": 2995
    },
    {
      "path": [
        "Moteur",
        "Outils",
        "Tools"
      ],
      "categoryIds": [
        100002,
        null,
        103129
      ],
      "finalCategoryId": 103129,
      "productId": 7073
    },
    {
      "path": [
        "Outils spéciaux",
        "Outils spéciaux suspension d’essieu/guidage des roues/roues",
        "Special Tools, axle mounting/steering/wheels"
      ],
      "categoryIds": [
        706365,
        null,
        706380
      ],
      "finalCategoryId": 706380,
      "productId": 8764
    },
    {
      "path": [
        "Outils spéciaux",
        "Outils spéciaux suspension d’essieu/guidage des roues/roues",
        "Special Tools, axle mounting/steering/wheels"
      ],
      "categoryIds": [
        706365,
        null,
        706380
      ],
      "finalCategoryId": 706380,
      "productId": 8472
    },
    {
      "path": [
        "Outils spéciaux",
        "Outils spéciaux suspension d’essieu/guidage des roues/roues",
        "Special Tools, axle mounting/steering/wheels"
      ],
      "categoryIds": [
        706365,
        null,
        706380
      ],
      "finalCategoryId": 706380,
      "productId": 8471
    },
    {
      "path": [
        "Outils spéciaux",
        "Outils spéciaux suspension d’essieu/guidage des roues/roues",
        "Special Tools, axle mounting/steering/wheels"
      ],
      "categoryIds": [
        706365,
        null,
        706380
      ],
      "finalCategoryId": 706380,
      "productId": 8473
    },
    {
      "path": [
        "Outils spéciaux",
        "Outils spéciaux suspension/amortissement",
        "Suspension/Damping Special Tools"
      ],
      "categoryIds": [
        706365,
        null,
        706386
      ],
      "finalCategoryId": 706386,
      "productId": 7118
    },
    {
      "path": [
        "Suspension d'essieu/Guidage des roues/Roues",
        "Écartement des roues élargi",
        "Track Widening"
      ],
      "categoryIds": [
        100013,
        null,
        102733
      ],
      "finalCategoryId": 102733,
      "productId": 3792
    },
    {
      "path": [
        "Suspension d'essieu/Guidage des roues/Roues",
        "Fixation jambe de force / suspension",
        "Mounting, suspension strut"
      ],
      "categoryIds": [
        100013,
        null,
        100735
      ],
      "finalCategoryId": 100735,
      "productId": 5004
    },
    {
      "path": [
        "Suspension d'essieu/Guidage des roues/Roues",
        "Fusée d'essieu / kit de réparation",
        "Steering Knuckle/Repair Kit"
      ],
      "categoryIds": [
        100013,
        null,
        100207
      ],
      "finalCategoryId": 100207,
      "productId": 3514
    },
    {
      "path": [
        "Suspension d'essieu/Guidage des roues/Roues",
        "Jambes de force / barres",
        "Struts/Rods"
      ],
      "categoryIds": [
        100013,
        null,
        100209
      ],
      "finalCategoryId": 100209,
      "productId": 3230
    },
    {
      "path": [
        "Suspension d'essieu/Guidage des roues/Roues",
        "Moyeu de roue / fixation",
        "Wheel Hub/Mounting"
      ],
      "categoryIds": [
        100013,
        null,
        100206
      ],
      "finalCategoryId": 100206,
      "productId": 4999
    },
    {
      "path": [
        "Suspension d'essieu/Guidage des roues/Roues",
        "Outils",
        "Tools"
      ],
      "categoryIds": [
        100013,
        null,
        103159
      ],
      "finalCategoryId": 103159,
      "productId": 8764
    },
    {
      "path": [
        "Suspension d'essieu/Guidage des roues/Roues",
        "Outils",
        "Tools"
      ],
      "categoryIds": [
        100013,
        null,
        103159
      ],
      "finalCategoryId": 103159,
      "productId": 8472
    },
    {
      "path": [
        "Suspension d'essieu/Guidage des roues/Roues",
        "Outils",
        "Tools"
      ],
      "categoryIds": [
        100013,
        null,
        103159
      ],
      "finalCategoryId": 103159,
      "productId": 8471
    },
    {
      "path": [
        "Suspension d'essieu/Guidage des roues/Roues",
        "Outils",
        "Tools"
      ],
      "categoryIds": [
        100013,
        null,
        103159
      ],
      "finalCategoryId": 103159,
      "productId": 8473
    },
    {
      "path": [
        "Suspension d'essieu/Guidage des roues/Roues",
        "Pièce de stabilisateur / pièces de fixation",
        "Stabiliser Bar/Fastening Parts"
      ],
      "categoryIds": [
        100013,
        null,
        100210
      ],
      "finalCategoryId": 100210,
      "productId": 3230
    },
    {
      "path": [
        "Suspension d'essieu/Guidage des roues/Roues",
        "Pièce de stabilisateur / pièces de fixation",
        "Stabiliser Bar/Fastening Parts"
      ],
      "categoryIds": [
        100013,
        null,
        100210
      ],
      "finalCategoryId": 100210,
      "productId": 3229
    },
    {
      "path": [
        "Suspension/Amortissement",
        "Coupelle de suspension/d'amortisseur",
        "Suspension Strut/Shock Absorber Mount"
      ],
      "categoryIds": [
        100011,
        null,
        100371
      ],
      "finalCategoryId": 100371,
      "productId": 5004
    },
    {
      "path": [
        "Suspension/Amortissement",
        "Outils",
        "Tools"
      ],
      "categoryIds": [
        100011,
        null,
        104406
      ],
      "finalCategoryId": 104406,
      "productId": 7118
    },
    {
      "path": [
        "Suspension/Amortissement",
        "Outils",
        "Tools"
      ],
      "categoryIds": [
        100011,
        null,
        104406
      ],
      "finalCategoryId": 104406,
      "productId": 8471
    },
    {
      "path": [
        "Suspension/Amortissement",
        "Outils",
        "Tools"
      ],
      "categoryIds": [
        100011,
        null,
        104406
      ],
      "finalCategoryId": 104406,
      "productId": 8473
    }
  ],
  "productIdsInArbo": [
    2995,
    3229,
    3230,
    3514,
    3792,
    4138,
    4258,
    4412,
    4549,
    4846,
    4999,
    5004,
    5037,
    7073,
    7118,
    8471,
    8472,
    8473,
    8764,
    60241,
    61219
  ],
  "closestProductIds": [
    {
      "productId": 2995,
      "productName": "Plaque entretoise, culasse"
    },
    {
      "productId": 3229,
      "productName": "Entretoise/tige, stabilisateur"
    },
    {
      "productId": 3230,
      "productName": "Biellette de barre stabilisatrice"
    },
    {
      "productId": 3514,
      "productName": "Entretoise, pivot de fusée d'essieu"
    },
    {
      "productId": 3792,
      "productName": "Écartement des roues élargi"
    }
  ]
}