{
  "productName": "Feu éclaireur de plaque",
  "searchText": "Feu éclaireur de plaque",
  "found": true,
  "hasMatch": true,
  "timestamp": "2025-12-02T20:38:52.257Z",
  "productId": 293,
  "arborescence": {
    "Carrosserie": {
      "categoryId": 100001,
      "categoryName": "Carrosserie",
      "level": 1,
      "children": {
        "Arrière de la voiture": {
          "categoryId": null,
          "categoryName": "Arrière de la voiture",
          "level": 2,
          "children": {
            "Ampoule, feu éclaireur de plaque": {
              "categoryId": 101705,
              "categoryName": "Vehicle Rear",
              "level": 2,
              "children": {
                "Feu éclaireur de plaque/composants": {
                  "categoryId": null,
                  "categoryName": "Feu éclaireur de plaque/composants",
                  "level": 4,
                  "children": {
                    "Ampoule, feu éclaireur de plaque": {
                      "categoryId": 101731,
                      "categoryName": "Licence Plate Light/-Parts",
                      "level": 3,
                      "children": {
                        "Ampoule du feu éclaireur de plaque": {
                          "categoryId": null,
                          "categoryName": "Ampoule du feu éclaireur de plaque",
                          "level": 6,
                          "children": {
                            "Ampoule, feu éclaireur de plaque": {
                              "categoryId": 101734,
                              "categoryName": "Licence Plate Light Bulb",
                              "level": 4,
                              "children": [],
                              "productId": 112
                            }
                          }
                        }
                      },
                      "productId": 112
                    }
                  }
                }
              },
              "productId": 112
            },
            "Boîtier, feu éclaireur de plaque": {
              "categoryId": 101705,
              "categoryName": "Vehicle Rear",
              "level": 2,
              "children": {
                "Feu éclaireur de plaque/composants": {
                  "categoryId": null,
                  "categoryName": "Feu éclaireur de plaque/composants",
                  "level": 4,
                  "children": {
                    "Boîtier, feu éclaireur de plaque": {
                      "categoryId": 101731,
                      "categoryName": "Licence Plate Light/-Parts",
                      "level": 3,
                      "children": {
                        "Composants du feu éclaireur de plaque": {
                          "categoryId": null,
                          "categoryName": "Composants du feu éclaireur de plaque",
                          "level": 6,
                          "children": {
                            "Boîtier, feu éclaireur de plaque": {
                              "categoryId": 101733,
                              "categoryName": "Licence Plate Light Parts",
                              "level": 4,
                              "children": [],
                              "productId": 431
                            }
                          }
                        }
                      },
                      "productId": 431
                    }
                  }
                }
              },
              "productId": 431
            },
            "Disperseur, feu éclaireur de plaque": {
              "categoryId": 101705,
              "categoryName": "Vehicle Rear",
              "level": 2,
              "children": {
                "Feu éclaireur de plaque/composants": {
                  "categoryId": null,
                  "categoryName": "Feu éclaireur de plaque/composants",
                  "level": 4,
                  "children": {
                    "Disperseur, feu éclaireur de plaque": {
                      "categoryId": 101731,
                      "categoryName": "Licence Plate Light/-Parts",
                      "level": 3,
                      "children": {
                        "Composants du feu éclaireur de plaque": {
                          "categoryId": null,
                          "categoryName": "Composants du feu éclaireur de plaque",
                          "level": 6,
                          "children": {
                            "Disperseur, feu éclaireur de plaque": {
                              "categoryId": 101733,
                              "categoryName": "Licence Plate Light Parts",
                              "level": 4,
                              "children": [],
                              "productId": 94
                            }
                          }
                        }
                      },
                      "productId": 94
                    }
                  }
                }
              },
              "productId": 94
            },
            "Feu éclaireur de plaque": {
              "categoryId": 101705,
              "categoryName": "Vehicle Rear",
              "level": 2,
              "children": {
                "Feu éclaireur de plaque/composants": {
                  "categoryId": null,
                  "categoryName": "Feu éclaireur de plaque/composants",
                  "level": 4,
                  "children": {
                    "Feu éclaireur de plaque": {
                      "categoryId": 101731,
                      "categoryName": "Licence Plate Light/-Parts",
                      "level": 3,
                      "children": {
                        "Feu éclaireur de plaque": {
                          "categoryId": null,
                          "categoryName": "Feu éclaireur de plaque",
                          "level": 6,
                          "children": {
                            "Feu éclaireur de plaque": {
                              "categoryId": 101732,
                              "categoryName": "Licence Plate Light",
                              "level": 4,
                              "children": [],
                              "productId": 293
                            }
                          }
                        }
                      },
                      "productId": 293
                    }
                  }
                }
              },
              "productId": 293
            },
            "Joint, feu éclaireur de plaque": {
              "categoryId": 101705,
              "categoryName": "Vehicle Rear",
              "level": 2,
              "children": {
                "Feu éclaireur de plaque/composants": {
                  "categoryId": null,
                  "categoryName": "Feu éclaireur de plaque/composants",
                  "level": 4,
                  "children": {
                    "Joint, feu éclaireur de plaque": {
                      "categoryId": 101731,
                      "categoryName": "Licence Plate Light/-Parts",
                      "level": 3,
                      "children": {
                        "Composants du feu éclaireur de plaque": {
                          "categoryId": null,
                          "categoryName": "Composants du feu éclaireur de plaque",
                          "level": 6,
                          "children": {
                            "Joint, feu éclaireur de plaque": {
                              "categoryId": 101733,
                              "categoryName": "Licence Plate Light Parts",
                              "level": 4,
                              "children": [],
                              "productId": 3113
                            }
                          }
                        }
                      },
                      "productId": 3113
                    }
                  }
                }
              },
              "productId": 3113
            },
            "Support de lampe, feu éclaireur de plaque": {
              "categoryId": 101705,
              "categoryName": "Vehicle Rear",
              "level": 2,
              "children": {
                "Feu éclaireur de plaque/composants": {
                  "categoryId": null,
                  "categoryName": "Feu éclaireur de plaque/composants",
                  "level": 4,
                  "children": {
                    "Support de lampe, feu éclaireur de plaque": {
                      "categoryId": 101731,
                      "categoryName": "Licence Plate Light/-Parts",
                      "level": 3,
                      "children": {
                        "Composants du feu éclaireur de plaque": {
                          "categoryId": null,
                          "categoryName": "Composants du feu éclaireur de plaque",
                          "level": 6,
                          "children": {
                            "Support de lampe, feu éclaireur de plaque": {
                              "categoryId": 101733,
                              "categoryName": "Licence Plate Light Parts",
                              "level": 4,
                              "children": [],
                              "productId": 498
                            }
                          }
                        }
                      },
                      "productId": 498
                    }
                  }
                }
              },
              "productId": 498
            }
          }
        },
        "Feux": {
          "categoryId": null,
          "categoryName": "Feux",
          "level": 2,
          "children": {
            "Ampoule, feu éclaireur de plaque": {
              "categoryId": 101407,
              "categoryName": "Lights",
              "level": 2,
              "children": {
                "Feu éclaireur de plaque/composants": {
                  "categoryId": null,
                  "categoryName": "Feu éclaireur de plaque/composants",
                  "level": 4,
                  "children": {
                    "Ampoule, feu éclaireur de plaque": {
                      "categoryId": 101424,
                      "categoryName": "Licence Plate Light/-Parts",
                      "level": 3,
                      "children": {
                        "Ampoule du feu éclaireur de plaque": {
                          "categoryId": null,
                          "categoryName": "Ampoule du feu éclaireur de plaque",
                          "level": 6,
                          "children": {
                            "Ampoule, feu éclaireur de plaque": {
                              "categoryId": 101427,
                              "categoryName": "Licence Plate Light Bulb",
                              "level": 4,
                              "children": [],
                              "productId": 112
                            }
                          }
                        }
                      },
                      "productId": 112
                    }
                  }
                }
              },
              "productId": 112
            },
            "Boîtier, feu éclaireur de plaque": {
              "categoryId": 101407,
              "categoryName": "Lights",
              "level": 2,
              "children": {
                "Feu éclaireur de plaque/composants": {
                  "categoryId": null,
                  "categoryName": "Feu éclaireur de plaque/composants",
                  "level": 4,
                  "children": {
                    "Boîtier, feu éclaireur de plaque": {
                      "categoryId": 101424,
                      "categoryName": "Licence Plate Light/-Parts",
                      "level": 3,
                      "children": {
                        "Composants du feu éclaireur de plaque": {
                          "categoryId": null,
                          "categoryName": "Composants du feu éclaireur de plaque",
                          "level": 6,
                          "children": {
                            "Boîtier, feu éclaireur de plaque": {
                              "categoryId": 101426,
                              "categoryName": "Licence Plate Light Parts",
                              "level": 4,
                              "children": [],
                              "productId": 431
                            }
                          }
                        }
                      },
                      "productId": 431
                    }
                  }
                }
              },
              "productId": 431
            },
            "Disperseur, feu éclaireur de plaque": {
              "categoryId": 101407,
              "categoryName": "Lights",
              "level": 2,
              "children": {
                "Feu éclaireur de plaque/composants": {
                  "categoryId": null,
                  "categoryName": "Feu éclaireur de plaque/composants",
                  "level": 4,
                  "children": {
                    "Disperseur, feu éclaireur de plaque": {
                      "categoryId": 101424,
                      "categoryName": "Licence Plate Light/-Parts",
                      "level": 3,
                      "children": {
                        "Composants du feu éclaireur de plaque": {
                          "categoryId": null,
                          "categoryName": "Composants du feu éclaireur de plaque",
                          "level": 6,
                          "children": {
                            "Disperseur, feu éclaireur de plaque": {
                              "categoryId": 101426,
                              "categoryName": "Licence Plate Light Parts",
                              "level": 4,
                              "children": [],
                              "productId": 94
                            }
                          }
                        }
                      },
                      "productId": 94
                    }
                  }
                }
              },
              "productId": 94
            },
            "Feu éclaireur de plaque": {
              "categoryId": 101407,
              "categoryName": "Lights",
              "level": 2,
              "children": {
                "Feu éclaireur de plaque/composants": {
                  "categoryId": null,
                  "categoryName": "Feu éclaireur de plaque/composants",
                  "level": 4,
                  "children": {
                    "Feu éclaireur de plaque": {
                      "categoryId": 101424,
                      "categoryName": "Licence Plate Light/-Parts",
                      "level": 3,
                      "children": {
                        "Feu éclaireur de plaque": {
                          "categoryId": null,
                          "categoryName": "Feu éclaireur de plaque",
                          "level": 6,
                          "children": {
                            "Feu éclaireur de plaque": {
                              "categoryId": 101425,
                              "categoryName": "Licence Plate Light",
                              "level": 4,
                              "children": [],
                              "productId": 293
                            }
                          }
                        }
                      },
                      "productId": 293
                    }
                  }
                }
              },
              "productId": 293
            },
            "Joint, feu éclaireur de plaque": {
              "categoryId": 101407,
              "categoryName": "Lights",
              "level": 2,
              "children": {
                "Feu éclaireur de plaque/composants": {
                  "categoryId": null,
                  "categoryName": "Feu éclaireur de plaque/composants",
                  "level": 4,
                  "children": {
                    "Joint, feu éclaireur de plaque": {
                      "categoryId": 101424,
                      "categoryName": "Licence Plate Light/-Parts",
                      "level": 3,
                      "children": {
                        "Composants du feu éclaireur de plaque": {
                          "categoryId": null,
                          "categoryName": "Composants du feu éclaireur de plaque",
                          "level": 6,
                          "children": {
                            "Joint, feu éclaireur de plaque": {
                              "categoryId": 101426,
                              "categoryName": "Licence Plate Light Parts",
                              "level": 4,
                              "children": [],
                              "productId": 3113
                            }
                          }
                        }
                      },
                      "productId": 3113
                    }
                  }
                }
              },
              "productId": 3113
            },
            "Support de lampe, feu éclaireur de plaque": {
              "categoryId": 101407,
              "categoryName": "Lights",
              "level": 2,
              "children": {
                "Feu éclaireur de plaque/composants": {
                  "categoryId": null,
                  "categoryName": "Feu éclaireur de plaque/composants",
                  "level": 4,
                  "children": {
                    "Support de lampe, feu éclaireur de plaque": {
                      "categoryId": 101424,
                      "categoryName": "Licence Plate Light/-Parts",
                      "level": 3,
                      "children": {
                        "Composants du feu éclaireur de plaque": {
                          "categoryId": null,
                          "categoryName": "Composants du feu éclaireur de plaque",
                          "level": 6,
                          "children": {
                            "Support de lampe, feu éclaireur de plaque": {
                              "categoryId": 101426,
                              "categoryName": "Licence Plate Light Parts",
                              "level": 4,
                              "children": [],
                              "productId": 498
                            }
                          }
                        }
                      },
                      "productId": 498
                    }
                  }
                }
              },
              "productId": 498
            }
          }
        }
      }
    },
    "Dispositif d'attelage/accessoires": {
      "categoryId": 100015,
      "categoryName": "Dispositif d'attelage/accessoires",
      "level": 1,
      "children": {
        "Pièces du système électrique": {
          "categoryId": null,
          "categoryName": "Pièces du système électrique",
          "level": 2,
          "children": {
            "Feu éclaireur de plaque, dispositif d'attelage": {
              "categoryId": 100608,
              "categoryName": "Electric Parts",
              "level": 2,
              "children": [],
              "productId": 1198
            }
          }
        }
      }
    },
    "Système électrique": {
      "categoryId": 100010,
      "categoryName": "Système électrique",
      "level": 1,
      "children": {
        "Feux": {
          "categoryId": null,
          "categoryName": "Feux",
          "level": 2,
          "children": {
            "Ampoule, feu éclaireur de plaque": {
              "categoryId": 100043,
              "categoryName": "Lights",
              "level": 2,
              "children": {
                "Feu éclaireur de plaque/composants": {
                  "categoryId": null,
                  "categoryName": "Feu éclaireur de plaque/composants",
                  "level": 4,
                  "children": {
                    "Ampoule, feu éclaireur de plaque": {
                      "categoryId": 100147,
                      "categoryName": "Licence Plate Light/-Parts",
                      "level": 3,
                      "children": {
                        "Ampoule du feu éclaireur de plaque": {
                          "categoryId": null,
                          "categoryName": "Ampoule du feu éclaireur de plaque",
                          "level": 6,
                          "children": {
                            "Ampoule, feu éclaireur de plaque": {
                              "categoryId": 100499,
                              "categoryName": "Licence Plate Light Bulb",
                              "level": 4,
                              "children": [],
                              "productId": 112
                            }
                          }
                        }
                      },
                      "productId": 112
                    }
                  }
                }
              },
              "productId": 112
            },
            "Boîtier, feu éclaireur de plaque": {
              "categoryId": 100043,
              "categoryName": "Lights",
              "level": 2,
              "children": {
                "Feu éclaireur de plaque/composants": {
                  "categoryId": null,
                  "categoryName": "Feu éclaireur de plaque/composants",
                  "level": 4,
                  "children": {
                    "Boîtier, feu éclaireur de plaque": {
                      "categoryId": 100147,
                      "categoryName": "Licence Plate Light/-Parts",
                      "level": 3,
                      "children": {
                        "Composants du feu éclaireur de plaque": {
                          "categoryId": null,
                          "categoryName": "Composants du feu éclaireur de plaque",
                          "level": 6,
                          "children": {
                            "Boîtier, feu éclaireur de plaque": {
                              "categoryId": 100482,
                              "categoryName": "Licence Plate Light Parts",
                              "level": 4,
                              "children": [],
                              "productId": 431
                            }
                          }
                        }
                      },
                      "productId": 431
                    }
                  }
                }
              },
              "productId": 431
            },
            "Disperseur, feu éclaireur de plaque": {
              "categoryId": 100043,
              "categoryName": "Lights",
              "level": 2,
              "children": {
                "Feu éclaireur de plaque/composants": {
                  "categoryId": null,
                  "categoryName": "Feu éclaireur de plaque/composants",
                  "level": 4,
                  "children": {
                    "Disperseur, feu éclaireur de plaque": {
                      "categoryId": 100147,
                      "categoryName": "Licence Plate Light/-Parts",
                      "level": 3,
                      "children": {
                        "Composants du feu éclaireur de plaque": {
                          "categoryId": null,
                          "categoryName": "Composants du feu éclaireur de plaque",
                          "level": 6,
                          "children": {
                            "Disperseur, feu éclaireur de plaque": {
                              "categoryId": 100482,
                              "categoryName": "Licence Plate Light Parts",
                              "level": 4,
                              "children": [],
                              "productId": 94
                            }
                          }
                        }
                      },
                      "productId": 94
                    }
                  }
                }
              },
              "productId": 94
            },
            "Feu éclaireur de plaque": {
              "categoryId": 100043,
              "categoryName": "Lights",
              "level": 2,
              "children": {
                "Feu éclaireur de plaque/composants": {
                  "categoryId": null,
                  "categoryName": "Feu éclaireur de plaque/composants",
                  "level": 4,
                  "children": {
                    "Feu éclaireur de plaque": {
                      "categoryId": 100147,
                      "categoryName": "Licence Plate Light/-Parts",
                      "level": 3,
                      "children": {
                        "Feu éclaireur de plaque": {
                          "categoryId": null,
                          "categoryName": "Feu éclaireur de plaque",
                          "level": 6,
                          "children": {
                            "Feu éclaireur de plaque": {
                              "categoryId": 100464,
                              "categoryName": "Licence Plate Light",
                              "level": 4,
                              "children": [],
                              "productId": 293
                            }
                          }
                        }
                      },
                      "productId": 293
                    }
                  }
                }
              },
              "productId": 293
            },
            "Joint, feu éclaireur de plaque": {
              "categoryId": 100043,
              "categoryName": "Lights",
              "level": 2,
              "children": {
                "Feu éclaireur de plaque/composants": {
                  "categoryId": null,
                  "categoryName": "Feu éclaireur de plaque/composants",
                  "level": 4,
                  "children": {
                    "Joint, feu éclaireur de plaque": {
                      "categoryId": 100147,
                      "categoryName": "Licence Plate Light/-Parts",
                      "level": 3,
                      "children": {
                        "Composants du feu éclaireur de plaque": {
                          "categoryId": null,
                          "categoryName": "Composants du feu éclaireur de plaque",
                          "level": 6,
                          "children": {
                            "Joint, feu éclaireur de plaque": {
                              "categoryId": 100482,
                              "categoryName": "Licence Plate Light Parts",
                              "level": 4,
                              "children": [],
                              "productId": 3113
                            }
                          }
                        }
                      },
                      "productId": 3113
                    }
                  }
                }
              },
              "productId": 3113
            },
            "Kit réparation de câble, feu de plaque d'immatriculation": {
              "categoryId": 100043,
              "categoryName": "Lights",
              "level": 2,
              "children": {
                "Feu éclaireur de plaque/composants": {
                  "categoryId": null,
                  "categoryName": "Feu éclaireur de plaque/composants",
                  "level": 4,
                  "children": {
                    "Kit réparation de câble, feu de plaque d'immatriculation": {
                      "categoryId": 100147,
                      "categoryName": "Licence Plate Light/-Parts",
                      "level": 3,
                      "children": {
                        "Composants du feu éclaireur de plaque": {
                          "categoryId": null,
                          "categoryName": "Composants du feu éclaireur de plaque",
                          "level": 6,
                          "children": {
                            "Kit réparation de câble, feu de plaque d'immatriculation": {
                              "categoryId": 100482,
                              "categoryName": "Licence Plate Light Parts",
                              "level": 4,
                              "children": [],
                              "productId": 7286
                            }
                          }
                        }
                      },
                      "productId": 7286
                    }
                  }
                }
              },
              "productId": 7286
            },
            "Support de lampe, feu éclaireur de plaque": {
              "categoryId": 100043,
              "categoryName": "Lights",
              "level": 2,
              "children": {
                "Feu éclaireur de plaque/composants": {
                  "categoryId": null,
                  "categoryName": "Feu éclaireur de plaque/composants",
                  "level": 4,
                  "children": {
                    "Support de lampe, feu éclaireur de plaque": {
                      "categoryId": 100147,
                      "categoryName": "Licence Plate Light/-Parts",
                      "level": 3,
                      "children": {
                        "Composants du feu éclaireur de plaque": {
                          "categoryId": null,
                          "categoryName": "Composants du feu éclaireur de plaque",
                          "level": 6,
                          "children": {
                            "Support de lampe, feu éclaireur de plaque": {
                              "categoryId": 100482,
                              "categoryName": "Licence Plate Light Parts",
                              "level": 4,
                              "children": [],
                              "productId": 498
                            }
                          }
                        }
                      },
                      "productId": 498
                    }
                  }
                }
              },
              "productId": 498
            }
          }
        }
      }
    }
  },
  "arborescenceText": "├── Carrosserie [ID: 100001] (Niveau 1)\n│   ├── Arrière de la voiture (Niveau 2)\n│   │   ├── Vehicle Rear [ID: 101705] (Niveau 2) → ProductId: 112\n│   │   │   └── Feu éclaireur de plaque/composants (Niveau 4)\n│   │   │       └── Licence Plate Light/-Parts [ID: 101731] (Niveau 3) → ProductId: 112\n│   │   │           └── Ampoule du feu éclaireur de plaque (Niveau 6)\n│   │   │               └── Licence Plate Light Bulb [ID: 101734] (Niveau 4) → ProductId: 112\n│   │   ├── Vehicle Rear [ID: 101705] (Niveau 2) → ProductId: 431\n│   │   │   └── Feu éclaireur de plaque/composants (Niveau 4)\n│   │   │       └── Licence Plate Light/-Parts [ID: 101731] (Niveau 3) → ProductId: 431\n│   │   │           └── Composants du feu éclaireur de plaque (Niveau 6)\n│   │   │               └── Licence Plate Light Parts [ID: 101733] (Niveau 4) → ProductId: 431\n│   │   ├── Vehicle Rear [ID: 101705] (Niveau 2) → ProductId: 94\n│   │   │   └── Feu éclaireur de plaque/composants (Niveau 4)\n│   │   │       └── Licence Plate Light/-Parts [ID: 101731] (Niveau 3) → ProductId: 94\n│   │   │           └── Composants du feu éclaireur de plaque (Niveau 6)\n│   │   │               └── Licence Plate Light Parts [ID: 101733] (Niveau 4) → ProductId: 94\n│   │   ├── Vehicle Rear [ID: 101705] (Niveau 2) → ProductId: 293\n│   │   │   └── Feu éclaireur de plaque/composants (Niveau 4)\n│   │   │       └── Licence Plate Light/-Parts [ID: 101731] (Niveau 3) → ProductId: 293\n│   │   │           └── Feu éclaireur de plaque (Niveau 6)\n│   │   │               └── Licence Plate Light [ID: 101732] (Niveau 4) → ProductId: 293\n│   │   ├── Vehicle Rear [ID: 101705] (Niveau 2) → ProductId: 3113\n│   │   │   └── Feu éclaireur de plaque/composants (Niveau 4)\n│   │   │       └── Licence Plate Light/-Parts [ID: 101731] (Niveau 3) → ProductId: 3113\n│   │   │           └── Composants du feu éclaireur de plaque (Niveau 6)\n│   │   │               └── Licence Plate Light Parts [ID: 101733] (Niveau 4) → ProductId: 3113\n│   │   └── Vehicle Rear [ID: 101705] (Niveau 2) → ProductId: 498\n│   │       └── Feu éclaireur de plaque/composants (Niveau 4)\n│   │           └── Licence Plate Light/-Parts [ID: 101731] (Niveau 3) → ProductId: 498\n│   │               └── Composants du feu éclaireur de plaque (Niveau 6)\n│   │                   └── Licence Plate Light Parts [ID: 101733] (Niveau 4) → ProductId: 498\n│   └── Feux (Niveau 2)\n│       ├── Lights [ID: 101407] (Niveau 2) → ProductId: 112\n│       │   └── Feu éclaireur de plaque/composants (Niveau 4)\n│       │       └── Licence Plate Light/-Parts [ID: 101424] (Niveau 3) → ProductId: 112\n│       │           └── Ampoule du feu éclaireur de plaque (Niveau 6)\n│       │               └── Licence Plate Light Bulb [ID: 101427] (Niveau 4) → ProductId: 112\n│       ├── Lights [ID: 101407] (Niveau 2) → ProductId: 431\n│       │   └── Feu éclaireur de plaque/composants (Niveau 4)\n│       │       └── Licence Plate Light/-Parts [ID: 101424] (Niveau 3) → ProductId: 431\n│       │           └── Composants du feu éclaireur de plaque (Niveau 6)\n│       │               └── Licence Plate Light Parts [ID: 101426] (Niveau 4) → ProductId: 431\n│       ├── Lights [ID: 101407] (Niveau 2) → ProductId: 94\n│       │   └── Feu éclaireur de plaque/composants (Niveau 4)\n│       │       └── Licence Plate Light/-Parts [ID: 101424] (Niveau 3) → ProductId: 94\n│       │           └── Composants du feu éclaireur de plaque (Niveau 6)\n│       │               └── Licence Plate Light Parts [ID: 101426] (Niveau 4) → ProductId: 94\n│       ├── Lights [ID: 101407] (Niveau 2) → ProductId: 293\n│       │   └── Feu éclaireur de plaque/composants (Niveau 4)\n│       │       └── Licence Plate Light/-Parts [ID: 101424] (Niveau 3) → ProductId: 293\n│       │           └── Feu éclaireur de plaque (Niveau 6)\n│       │               └── Licence Plate Light [ID: 101425] (Niveau 4) → ProductId: 293\n│       ├── Lights [ID: 101407] (Niveau 2) → ProductId: 3113\n│       │   └── Feu éclaireur de plaque/composants (Niveau 4)\n│       │       └── Licence Plate Light/-Parts [ID: 101424] (Niveau 3) → ProductId: 3113\n│       │           └── Composants du feu éclaireur de plaque (Niveau 6)\n│       │               └── Licence Plate Light Parts [ID: 101426] (Niveau 4) → ProductId: 3113\n│       └── Lights [ID: 101407] (Niveau 2) → ProductId: 498\n│           └── Feu éclaireur de plaque/composants (Niveau 4)\n│               └── Licence Plate Light/-Parts [ID: 101424] (Niveau 3) → ProductId: 498\n│                   └── Composants du feu éclaireur de plaque (Niveau 6)\n│                       └── Licence Plate Light Parts [ID: 101426] (Niveau 4) → ProductId: 498\n\n├── Dispositif d'attelage/accessoires [ID: 100015] (Niveau 1)\n│   └── Pièces du système électrique (Niveau 2)\n│       └── Electric Parts [ID: 100608] (Niveau 2) → ProductId: 1198\n\n└── Système électrique [ID: 100010] (Niveau 1)\n    └── Feux (Niveau 2)\n        ├── Lights [ID: 100043] (Niveau 2) → ProductId: 112\n        │   └── Feu éclaireur de plaque/composants (Niveau 4)\n        │       └── Licence Plate Light/-Parts [ID: 100147] (Niveau 3) → ProductId: 112\n        │           └── Ampoule du feu éclaireur de plaque (Niveau 6)\n        │               └── Licence Plate Light Bulb [ID: 100499] (Niveau 4) → ProductId: 112\n        ├── Lights [ID: 100043] (Niveau 2) → ProductId: 431\n        │   └── Feu éclaireur de plaque/composants (Niveau 4)\n        │       └── Licence Plate Light/-Parts [ID: 100147] (Niveau 3) → ProductId: 431\n        │           └── Composants du feu éclaireur de plaque (Niveau 6)\n        │               └── Licence Plate Light Parts [ID: 100482] (Niveau 4) → ProductId: 431\n        ├── Lights [ID: 100043] (Niveau 2) → ProductId: 94\n        │   └── Feu éclaireur de plaque/composants (Niveau 4)\n        │       └── Licence Plate Light/-Parts [ID: 100147] (Niveau 3) → ProductId: 94\n        │           └── Composants du feu éclaireur de plaque (Niveau 6)\n        │               └── Licence Plate Light Parts [ID: 100482] (Niveau 4) → ProductId: 94\n        ├── Lights [ID: 100043] (Niveau 2) → ProductId: 293\n        │   └── Feu éclaireur de plaque/composants (Niveau 4)\n        │       └── Licence Plate Light/-Parts [ID: 100147] (Niveau 3) → ProductId: 293\n        │           └── Feu éclaireur de plaque (Niveau 6)\n        │               └── Licence Plate Light [ID: 100464] (Niveau 4) → ProductId: 293\n        ├── Lights [ID: 100043] (Niveau 2) → ProductId: 3113\n        │   └── Feu éclaireur de plaque/composants (Niveau 4)\n        │       └── Licence Plate Light/-Parts [ID: 100147] (Niveau 3) → ProductId: 3113\n        │           └── Composants du feu éclaireur de plaque (Niveau 6)\n        │               └── Licence Plate Light Parts [ID: 100482] (Niveau 4) → ProductId: 3113\n        ├── Lights [ID: 100043] (Niveau 2) → ProductId: 7286\n        │   └── Feu éclaireur de plaque/composants (Niveau 4)\n        │       └── Licence Plate Light/-Parts [ID: 100147] (Niveau 3) → ProductId: 7286\n        │           └── Composants du feu éclaireur de plaque (Niveau 6)\n        │               └── Licence Plate Light Parts [ID: 100482] (Niveau 4) → ProductId: 7286\n        └── Lights [ID: 100043] (Niveau 2) → ProductId: 498\n            └── Feu éclaireur de plaque/composants (Niveau 4)\n                └── Licence Plate Light/-Parts [ID: 100147] (Niveau 3) → ProductId: 498\n                    └── Composants du feu éclaireur de plaque (Niveau 6)\n                        └── Licence Plate Light Parts [ID: 100482] (Niveau 4) → ProductId: 498",
  "arborescencePaths": [
    {
      "path": [
        "Carrosserie",
        "Arrière de la voiture",
        "Vehicle Rear"
      ],
      "categoryIds": [
        100001,
        null,
        101705
      ],
      "finalCategoryId": 101705,
      "productId": 112
    },
    {
      "path": [
        "Carrosserie",
        "Arrière de la voiture",
        "Vehicle Rear"
      ],
      "categoryIds": [
        100001,
        null,
        101705
      ],
      "finalCategoryId": 101705,
      "productId": 431
    },
    {
      "path": [
        "Carrosserie",
        "Arrière de la voiture",
        "Vehicle Rear"
      ],
      "categoryIds": [
        100001,
        null,
        101705
      ],
      "finalCategoryId": 101705,
      "productId": 94
    },
    {
      "path": [
        "Carrosserie",
        "Arrière de la voiture",
        "Vehicle Rear"
      ],
      "categoryIds": [
        100001,
        null,
        101705
      ],
      "finalCategoryId": 101705,
      "productId": 293
    },
    {
      "path": [
        "Carrosserie",
        "Arrière de la voiture",
        "Vehicle Rear"
      ],
      "categoryIds": [
        100001,
        null,
        101705
      ],
      "finalCategoryId": 101705,
      "productId": 3113
    },
    {
      "path": [
        "Carrosserie",
        "Arrière de la voiture",
        "Vehicle Rear"
      ],
      "categoryIds": [
        100001,
        null,
        101705
      ],
      "finalCategoryId": 101705,
      "productId": 498
    },
    {
      "path": [
        "Carrosserie",
        "Feux",
        "Lights"
      ],
      "categoryIds": [
        100001,
        null,
        101407
      ],
      "finalCategoryId": 101407,
      "productId": 112
    },
    {
      "path": [
        "Carrosserie",
        "Feux",
        "Lights"
      ],
      "categoryIds": [
        100001,
        null,
        101407
      ],
      "finalCategoryId": 101407,
      "productId": 431
    },
    {
      "path": [
        "Carrosserie",
        "Feux",
        "Lights"
      ],
      "categoryIds": [
        100001,
        null,
        101407
      ],
      "finalCategoryId": 101407,
      "productId": 94
    },
    {
      "path": [
        "Carrosserie",
        "Feux",
        "Lights"
      ],
      "categoryIds": [
        100001,
        null,
        101407
      ],
      "finalCategoryId": 101407,
      "productId": 293
    },
    {
      "path": [
        "Carrosserie",
        "Feux",
        "Lights"
      ],
      "categoryIds": [
        100001,
        null,
        101407
      ],
      "finalCategoryId": 101407,
      "productId": 3113
    },
    {
      "path": [
        "Carrosserie",
        "Feux",
        "Lights"
      ],
      "categoryIds": [
        100001,
        null,
        101407
      ],
      "finalCategoryId": 101407,
      "productId": 498
    },
    {
      "path": [
        "Dispositif d'attelage/accessoires",
        "Pièces du système électrique",
        "Electric Parts"
      ],
      "categoryIds": [
        100015,
        null,
        100608
      ],
      "finalCategoryId": 100608,
      "productId": 1198
    },
    {
      "path": [
        "Système électrique",
        "Feux",
        "Lights"
      ],
      "categoryIds": [
        100010,
        null,
        100043
      ],
      "finalCategoryId": 100043,
      "productId": 112
    },
    {
      "path": [
        "Système électrique",
        "Feux",
        "Lights"
      ],
      "categoryIds": [
        100010,
        null,
        100043
      ],
      "finalCategoryId": 100043,
      "productId": 431
    },
    {
      "path": [
        "Système électrique",
        "Feux",
        "Lights"
      ],
      "categoryIds": [
        100010,
        null,
        100043
      ],
      "finalCategoryId": 100043,
      "productId": 94
    },
    {
      "path": [
        "Système électrique",
        "Feux",
        "Lights"
      ],
      "categoryIds": [
        100010,
        null,
        100043
      ],
      "finalCategoryId": 100043,
      "productId": 293
    },
    {
      "path": [
        "Système électrique",
        "Feux",
        "Lights"
      ],
      "categoryIds": [
        100010,
        null,
        100043
      ],
      "finalCategoryId": 100043,
      "productId": 3113
    },
    {
      "path": [
        "Système électrique",
        "Feux",
        "Lights"
      ],
      "categoryIds": [
        100010,
        null,
        100043
      ],
      "finalCategoryId": 100043,
      "productId": 7286
    },
    {
      "path": [
        "Système électrique",
        "Feux",
        "Lights"
      ],
      "categoryIds": [
        100010,
        null,
        100043
      ],
      "finalCategoryId": 100043,
      "productId": 498
    }
  ],
  "productIdsInArbo": [
    94,
    112,
    293,
    431,
    498,
    1198,
    3113,
    7286
  ],
  "matchedProductIds": [
    293
  ]
}