{
  "productName": "Feu antibrouillard arrière",
  "searchText": "Feu antibrouillard arrière",
  "found": true,
  "hasMatch": true,
  "timestamp": "2025-12-02T20:38:17.559Z",
  "productId": 291,
  "arborescence": {
    "Carrosserie": {
      "categoryId": 100001,
      "categoryName": "Carrosserie",
      "level": 1,
      "children": {
        "Arrière de la voiture": {
          "categoryId": null,
          "categoryName": "Arrière de la voiture",
          "level": 2,
          "children": {
            "Ampoule, feu de brouillard arrière": {
              "categoryId": 101705,
              "categoryName": "Vehicle Rear",
              "level": 2,
              "children": {
                "Feu de brouillard arrière/Composants": {
                  "categoryId": null,
                  "categoryName": "Feu de brouillard arrière/Composants",
                  "level": 4,
                  "children": {
                    "Ampoule, feu de brouillard arrière": {
                      "categoryId": 101735,
                      "categoryName": "Rear Fog Light/Parts",
                      "level": 3,
                      "children": {
                        "Ampoules de feu de brouillard arrière": {
                          "categoryId": null,
                          "categoryName": "Ampoules de feu de brouillard arrière",
                          "level": 6,
                          "children": {
                            "Ampoule, feu de brouillard arrière": {
                              "categoryId": 101738,
                              "categoryName": "Rear Fog Light Bulb",
                              "level": 4,
                              "children": [],
                              "productId": 113
                            }
                          }
                        }
                      },
                      "productId": 113
                    }
                  }
                }
              },
              "productId": 113
            },
            "Boîtier, feu antibrouillard arrière": {
              "categoryId": 101705,
              "categoryName": "Vehicle Rear",
              "level": 2,
              "children": {
                "Feu de brouillard arrière/Composants": {
                  "categoryId": null,
                  "categoryName": "Feu de brouillard arrière/Composants",
                  "level": 4,
                  "children": {
                    "Boîtier, feu antibrouillard arrière": {
                      "categoryId": 101735,
                      "categoryName": "Rear Fog Light/Parts",
                      "level": 3,
                      "children": {
                        "Composants de feu de brouillard arrière": {
                          "categoryId": null,
                          "categoryName": "Composants de feu de brouillard arrière",
                          "level": 6,
                          "children": {
                            "Boîtier, feu antibrouillard arrière": {
                              "categoryId": 101737,
                              "categoryName": "Rear Fog Light Individual Parts",
                              "level": 4,
                              "children": [],
                              "productId": 744
                            }
                          }
                        }
                      },
                      "productId": 744
                    }
                  }
                }
              },
              "productId": 744
            },
            "Disperseur, feu antibrouillard arrière": {
              "categoryId": 101705,
              "categoryName": "Vehicle Rear",
              "level": 2,
              "children": {
                "Feu de brouillard arrière/Composants": {
                  "categoryId": null,
                  "categoryName": "Feu de brouillard arrière/Composants",
                  "level": 4,
                  "children": {
                    "Disperseur, feu antibrouillard arrière": {
                      "categoryId": 101735,
                      "categoryName": "Rear Fog Light/Parts",
                      "level": 3,
                      "children": {
                        "Composants de feu de brouillard arrière": {
                          "categoryId": null,
                          "categoryName": "Composants de feu de brouillard arrière",
                          "level": 6,
                          "children": {
                            "Disperseur, feu antibrouillard arrière": {
                              "categoryId": 101737,
                              "categoryName": "Rear Fog Light Individual Parts",
                              "level": 4,
                              "children": [],
                              "productId": 95
                            }
                          }
                        }
                      },
                      "productId": 95
                    }
                  }
                }
              },
              "productId": 95
            },
            "Enjoliveur, feu antibrouillard arrière": {
              "categoryId": 101705,
              "categoryName": "Vehicle Rear",
              "level": 2,
              "children": {
                "Feu de brouillard arrière/Composants": {
                  "categoryId": null,
                  "categoryName": "Feu de brouillard arrière/Composants",
                  "level": 4,
                  "children": {
                    "Enjoliveur, feu antibrouillard arrière": {
                      "categoryId": 101735,
                      "categoryName": "Rear Fog Light/Parts",
                      "level": 3,
                      "children": {
                        "Feu antibrouillard arrière": {
                          "categoryId": null,
                          "categoryName": "Feu antibrouillard arrière",
                          "level": 6,
                          "children": {
                            "Enjoliveur, feu antibrouillard arrière": {
                              "categoryId": 101736,
                              "categoryName": "Rear Fog Light",
                              "level": 4,
                              "children": [],
                              "productId": 3453
                            }
                          }
                        }
                      },
                      "productId": 3453
                    }
                  }
                }
              },
              "productId": 3453
            },
            "Feu antibrouillard arrière": {
              "categoryId": 101705,
              "categoryName": "Vehicle Rear",
              "level": 2,
              "children": {
                "Feu de brouillard arrière/Composants": {
                  "categoryId": null,
                  "categoryName": "Feu de brouillard arrière/Composants",
                  "level": 4,
                  "children": {
                    "Feu antibrouillard arrière": {
                      "categoryId": 101735,
                      "categoryName": "Rear Fog Light/Parts",
                      "level": 3,
                      "children": {
                        "Feu antibrouillard arrière": {
                          "categoryId": null,
                          "categoryName": "Feu antibrouillard arrière",
                          "level": 6,
                          "children": {
                            "Feu antibrouillard arrière": {
                              "categoryId": 101736,
                              "categoryName": "Rear Fog Light",
                              "level": 4,
                              "children": [],
                              "productId": 291
                            }
                          }
                        }
                      },
                      "productId": 291
                    }
                  }
                }
              },
              "productId": 291
            },
            "Joint, feu antibrouillard arrière": {
              "categoryId": 101705,
              "categoryName": "Vehicle Rear",
              "level": 2,
              "children": {
                "Feu de brouillard arrière/Composants": {
                  "categoryId": null,
                  "categoryName": "Feu de brouillard arrière/Composants",
                  "level": 4,
                  "children": {
                    "Joint, feu antibrouillard arrière": {
                      "categoryId": 101735,
                      "categoryName": "Rear Fog Light/Parts",
                      "level": 3,
                      "children": {
                        "Composants de feu de brouillard arrière": {
                          "categoryId": null,
                          "categoryName": "Composants de feu de brouillard arrière",
                          "level": 6,
                          "children": {
                            "Joint, feu antibrouillard arrière": {
                              "categoryId": 101737,
                              "categoryName": "Rear Fog Light Individual Parts",
                              "level": 4,
                              "children": [],
                              "productId": 3111
                            }
                          }
                        }
                      },
                      "productId": 3111
                    }
                  }
                }
              },
              "productId": 3111
            },
            "Support de lampe, feu antibrouillard arrière": {
              "categoryId": 101705,
              "categoryName": "Vehicle Rear",
              "level": 2,
              "children": {
                "Feu de brouillard arrière/Composants": {
                  "categoryId": null,
                  "categoryName": "Feu de brouillard arrière/Composants",
                  "level": 4,
                  "children": {
                    "Support de lampe, feu antibrouillard arrière": {
                      "categoryId": 101735,
                      "categoryName": "Rear Fog Light/Parts",
                      "level": 3,
                      "children": {
                        "Composants de feu de brouillard arrière": {
                          "categoryId": null,
                          "categoryName": "Composants de feu de brouillard arrière",
                          "level": 6,
                          "children": {
                            "Support de lampe, feu antibrouillard arrière": {
                              "categoryId": 101737,
                              "categoryName": "Rear Fog Light Individual Parts",
                              "level": 4,
                              "children": [],
                              "productId": 499
                            }
                          }
                        }
                      },
                      "productId": 499
                    }
                  }
                }
              },
              "productId": 499
            },
            "Support de lampe, feu de recul": {
              "categoryId": 101705,
              "categoryName": "Vehicle Rear",
              "level": 2,
              "children": {
                "Feu de brouillard arrière/Composants": {
                  "categoryId": null,
                  "categoryName": "Feu de brouillard arrière/Composants",
                  "level": 4,
                  "children": {
                    "Support de lampe, feu de recul": {
                      "categoryId": 101735,
                      "categoryName": "Rear Fog Light/Parts",
                      "level": 3,
                      "children": {
                        "Feu antibrouillard arrière": {
                          "categoryId": null,
                          "categoryName": "Feu antibrouillard arrière",
                          "level": 6,
                          "children": {
                            "Support de lampe, feu de recul": {
                              "categoryId": 101736,
                              "categoryName": "Rear Fog Light",
                              "level": 4,
                              "children": [],
                              "productId": 500
                            }
                          }
                        }
                      },
                      "productId": 500
                    }
                  }
                },
                "Feu de recul / composants": {
                  "categoryId": null,
                  "categoryName": "Feu de recul / composants",
                  "level": 4,
                  "children": {
                    "Support de lampe, feu de recul": {
                      "categoryId": 101739,
                      "categoryName": "Reverse Light/Parts",
                      "level": 3,
                      "children": {
                        "Composants de feu de recul": {
                          "categoryId": null,
                          "categoryName": "Composants de feu de recul",
                          "level": 6,
                          "children": {
                            "Support de lampe, feu de recul": {
                              "categoryId": 101741,
                              "categoryName": "Reverse Light Parts",
                              "level": 4,
                              "children": [],
                              "productId": 500
                            }
                          }
                        }
                      },
                      "productId": 500
                    }
                  }
                }
              },
              "productId": 500
            },
            "Support, feu antibrouillard arrière": {
              "categoryId": 101705,
              "categoryName": "Vehicle Rear",
              "level": 2,
              "children": {
                "Feu de brouillard arrière/Composants": {
                  "categoryId": null,
                  "categoryName": "Feu de brouillard arrière/Composants",
                  "level": 4,
                  "children": {
                    "Support, feu antibrouillard arrière": {
                      "categoryId": 101735,
                      "categoryName": "Rear Fog Light/Parts",
                      "level": 3,
                      "children": {
                        "Composants de feu de brouillard arrière": {
                          "categoryId": null,
                          "categoryName": "Composants de feu de brouillard arrière",
                          "level": 6,
                          "children": {
                            "Support, feu antibrouillard arrière": {
                              "categoryId": 101737,
                              "categoryName": "Rear Fog Light Individual Parts",
                              "level": 4,
                              "children": [],
                              "productId": 785
                            }
                          }
                        }
                      },
                      "productId": 785
                    }
                  }
                }
              },
              "productId": 785
            }
          }
        },
        "Feux": {
          "categoryId": null,
          "categoryName": "Feux",
          "level": 2,
          "children": {
            "Ampoule, feu de brouillard arrière": {
              "categoryId": 101407,
              "categoryName": "Lights",
              "level": 2,
              "children": {
                "Feu de brouillard arrière/Composants": {
                  "categoryId": null,
                  "categoryName": "Feu de brouillard arrière/Composants",
                  "level": 4,
                  "children": {
                    "Ampoule, feu de brouillard arrière": {
                      "categoryId": 101428,
                      "categoryName": "Rear Fog Light/Parts",
                      "level": 3,
                      "children": {
                        "Ampoules de feu de brouillard arrière": {
                          "categoryId": null,
                          "categoryName": "Ampoules de feu de brouillard arrière",
                          "level": 6,
                          "children": {
                            "Ampoule, feu de brouillard arrière": {
                              "categoryId": 101431,
                              "categoryName": "Rear Fog Light Bulb",
                              "level": 4,
                              "children": [],
                              "productId": 113
                            }
                          }
                        }
                      },
                      "productId": 113
                    }
                  }
                }
              },
              "productId": 113
            },
            "Boîtier, feu antibrouillard arrière": {
              "categoryId": 101407,
              "categoryName": "Lights",
              "level": 2,
              "children": {
                "Feu de brouillard arrière/Composants": {
                  "categoryId": null,
                  "categoryName": "Feu de brouillard arrière/Composants",
                  "level": 4,
                  "children": {
                    "Boîtier, feu antibrouillard arrière": {
                      "categoryId": 101428,
                      "categoryName": "Rear Fog Light/Parts",
                      "level": 3,
                      "children": {
                        "Composants de feu de brouillard arrière": {
                          "categoryId": null,
                          "categoryName": "Composants de feu de brouillard arrière",
                          "level": 6,
                          "children": {
                            "Boîtier, feu antibrouillard arrière": {
                              "categoryId": 101430,
                              "categoryName": "Rear Fog Light Individual Parts",
                              "level": 4,
                              "children": [],
                              "productId": 744
                            }
                          }
                        }
                      },
                      "productId": 744
                    }
                  }
                }
              },
              "productId": 744
            },
            "Disperseur, feu antibrouillard arrière": {
              "categoryId": 101407,
              "categoryName": "Lights",
              "level": 2,
              "children": {
                "Feu de brouillard arrière/Composants": {
                  "categoryId": null,
                  "categoryName": "Feu de brouillard arrière/Composants",
                  "level": 4,
                  "children": {
                    "Disperseur, feu antibrouillard arrière": {
                      "categoryId": 101428,
                      "categoryName": "Rear Fog Light/Parts",
                      "level": 3,
                      "children": {
                        "Composants de feu de brouillard arrière": {
                          "categoryId": null,
                          "categoryName": "Composants de feu de brouillard arrière",
                          "level": 6,
                          "children": {
                            "Disperseur, feu antibrouillard arrière": {
                              "categoryId": 101430,
                              "categoryName": "Rear Fog Light Individual Parts",
                              "level": 4,
                              "children": [],
                              "productId": 95
                            }
                          }
                        }
                      },
                      "productId": 95
                    }
                  }
                }
              },
              "productId": 95
            },
            "Enjoliveur, feu antibrouillard arrière": {
              "categoryId": 101407,
              "categoryName": "Lights",
              "level": 2,
              "children": {
                "Feu de brouillard arrière/Composants": {
                  "categoryId": null,
                  "categoryName": "Feu de brouillard arrière/Composants",
                  "level": 4,
                  "children": {
                    "Enjoliveur, feu antibrouillard arrière": {
                      "categoryId": 101428,
                      "categoryName": "Rear Fog Light/Parts",
                      "level": 3,
                      "children": {
                        "Feu antibrouillard arrière": {
                          "categoryId": null,
                          "categoryName": "Feu antibrouillard arrière",
                          "level": 6,
                          "children": {
                            "Enjoliveur, feu antibrouillard arrière": {
                              "categoryId": 101429,
                              "categoryName": "Rear Fog Light",
                              "level": 4,
                              "children": [],
                              "productId": 3453
                            }
                          }
                        }
                      },
                      "productId": 3453
                    }
                  }
                }
              },
              "productId": 3453
            },
            "Feu antibrouillard arrière": {
              "categoryId": 101407,
              "categoryName": "Lights",
              "level": 2,
              "children": {
                "Feu de brouillard arrière/Composants": {
                  "categoryId": null,
                  "categoryName": "Feu de brouillard arrière/Composants",
                  "level": 4,
                  "children": {
                    "Feu antibrouillard arrière": {
                      "categoryId": 101428,
                      "categoryName": "Rear Fog Light/Parts",
                      "level": 3,
                      "children": {
                        "Feu antibrouillard arrière": {
                          "categoryId": null,
                          "categoryName": "Feu antibrouillard arrière",
                          "level": 6,
                          "children": {
                            "Feu antibrouillard arrière": {
                              "categoryId": 101429,
                              "categoryName": "Rear Fog Light",
                              "level": 4,
                              "children": [],
                              "productId": 291
                            }
                          }
                        }
                      },
                      "productId": 291
                    }
                  }
                }
              },
              "productId": 291
            },
            "Joint, feu antibrouillard arrière": {
              "categoryId": 101407,
              "categoryName": "Lights",
              "level": 2,
              "children": {
                "Feu de brouillard arrière/Composants": {
                  "categoryId": null,
                  "categoryName": "Feu de brouillard arrière/Composants",
                  "level": 4,
                  "children": {
                    "Joint, feu antibrouillard arrière": {
                      "categoryId": 101428,
                      "categoryName": "Rear Fog Light/Parts",
                      "level": 3,
                      "children": {
                        "Composants de feu de brouillard arrière": {
                          "categoryId": null,
                          "categoryName": "Composants de feu de brouillard arrière",
                          "level": 6,
                          "children": {
                            "Joint, feu antibrouillard arrière": {
                              "categoryId": 101430,
                              "categoryName": "Rear Fog Light Individual Parts",
                              "level": 4,
                              "children": [],
                              "productId": 3111
                            }
                          }
                        }
                      },
                      "productId": 3111
                    }
                  }
                }
              },
              "productId": 3111
            },
            "Support de lampe, feu antibrouillard arrière": {
              "categoryId": 101407,
              "categoryName": "Lights",
              "level": 2,
              "children": {
                "Feu de brouillard arrière/Composants": {
                  "categoryId": null,
                  "categoryName": "Feu de brouillard arrière/Composants",
                  "level": 4,
                  "children": {
                    "Support de lampe, feu antibrouillard arrière": {
                      "categoryId": 101428,
                      "categoryName": "Rear Fog Light/Parts",
                      "level": 3,
                      "children": {
                        "Composants de feu de brouillard arrière": {
                          "categoryId": null,
                          "categoryName": "Composants de feu de brouillard arrière",
                          "level": 6,
                          "children": {
                            "Support de lampe, feu antibrouillard arrière": {
                              "categoryId": 101430,
                              "categoryName": "Rear Fog Light Individual Parts",
                              "level": 4,
                              "children": [],
                              "productId": 499
                            }
                          }
                        }
                      },
                      "productId": 499
                    }
                  }
                }
              },
              "productId": 499
            },
            "Support de lampe, feu de recul": {
              "categoryId": 101407,
              "categoryName": "Lights",
              "level": 2,
              "children": {
                "Feu de brouillard arrière/Composants": {
                  "categoryId": null,
                  "categoryName": "Feu de brouillard arrière/Composants",
                  "level": 4,
                  "children": {
                    "Support de lampe, feu de recul": {
                      "categoryId": 101428,
                      "categoryName": "Rear Fog Light/Parts",
                      "level": 3,
                      "children": {
                        "Feu antibrouillard arrière": {
                          "categoryId": null,
                          "categoryName": "Feu antibrouillard arrière",
                          "level": 6,
                          "children": {
                            "Support de lampe, feu de recul": {
                              "categoryId": 101429,
                              "categoryName": "Rear Fog Light",
                              "level": 4,
                              "children": [],
                              "productId": 500
                            }
                          }
                        }
                      },
                      "productId": 500
                    }
                  }
                },
                "Feu de recul / composants": {
                  "categoryId": null,
                  "categoryName": "Feu de recul / composants",
                  "level": 4,
                  "children": {
                    "Support de lampe, feu de recul": {
                      "categoryId": 101432,
                      "categoryName": "Reverse Light/Parts",
                      "level": 3,
                      "children": {
                        "Composants de feu de recul": {
                          "categoryId": null,
                          "categoryName": "Composants de feu de recul",
                          "level": 6,
                          "children": {
                            "Support de lampe, feu de recul": {
                              "categoryId": 101434,
                              "categoryName": "Reverse Light Parts",
                              "level": 4,
                              "children": [],
                              "productId": 500
                            }
                          }
                        }
                      },
                      "productId": 500
                    }
                  }
                }
              },
              "productId": 500
            },
            "Support, feu antibrouillard arrière": {
              "categoryId": 101407,
              "categoryName": "Lights",
              "level": 2,
              "children": {
                "Feu de brouillard arrière/Composants": {
                  "categoryId": null,
                  "categoryName": "Feu de brouillard arrière/Composants",
                  "level": 4,
                  "children": {
                    "Support, feu antibrouillard arrière": {
                      "categoryId": 101428,
                      "categoryName": "Rear Fog Light/Parts",
                      "level": 3,
                      "children": {
                        "Composants de feu de brouillard arrière": {
                          "categoryId": null,
                          "categoryName": "Composants de feu de brouillard arrière",
                          "level": 6,
                          "children": {
                            "Support, feu antibrouillard arrière": {
                              "categoryId": 101430,
                              "categoryName": "Rear Fog Light Individual Parts",
                              "level": 4,
                              "children": [],
                              "productId": 785
                            }
                          }
                        }
                      },
                      "productId": 785
                    }
                  }
                }
              },
              "productId": 785
            }
          }
        }
      }
    },
    "Dispositif d'attelage/accessoires": {
      "categoryId": 100015,
      "categoryName": "Dispositif d'attelage/accessoires",
      "level": 1,
      "children": {
        "Pièces du système électrique": {
          "categoryId": null,
          "categoryName": "Pièces du système électrique",
          "level": 2,
          "children": {
            "Jeu de relais, feu antibrouillard arrière": {
              "categoryId": 100608,
              "categoryName": "Electric Parts",
              "level": 2,
              "children": [],
              "productId": 2243
            }
          }
        }
      }
    },
    "Système électrique": {
      "categoryId": 100010,
      "categoryName": "Système électrique",
      "level": 1,
      "children": {
        "Feux": {
          "categoryId": null,
          "categoryName": "Feux",
          "level": 2,
          "children": {
            "Ampoule, feu de brouillard arrière": {
              "categoryId": 100043,
              "categoryName": "Lights",
              "level": 2,
              "children": {
                "Feu arrière / composants": {
                  "categoryId": null,
                  "categoryName": "Feu arrière / composants",
                  "level": 4,
                  "children": {
                    "Ampoule, feu de brouillard arrière": {
                      "categoryId": 100275,
                      "categoryName": "Tail Light Assembly/Parts",
                      "level": 3,
                      "children": {
                        "Ampoule pour feux arrières": {
                          "categoryId": null,
                          "categoryName": "Ampoule pour feux arrières",
                          "level": 6,
                          "children": {
                            "Ampoule, feu de brouillard arrière": {
                              "categoryId": 101495,
                              "categoryName": "Tail Light Assembly Bulb",
                              "level": 4,
                              "children": [],
                              "productId": 113
                            }
                          }
                        }
                      },
                      "productId": 113
                    }
                  }
                },
                "Feu de brouillard arrière/Composants": {
                  "categoryId": null,
                  "categoryName": "Feu de brouillard arrière/Composants",
                  "level": 4,
                  "children": {
                    "Ampoule, feu de brouillard arrière": {
                      "categoryId": 100285,
                      "categoryName": "Rear Fog Light/Parts",
                      "level": 3,
                      "children": {
                        "Ampoules de feu de brouillard arrière": {
                          "categoryId": null,
                          "categoryName": "Ampoules de feu de brouillard arrière",
                          "level": 6,
                          "children": {
                            "Ampoule, feu de brouillard arrière": {
                              "categoryId": 100500,
                              "categoryName": "Rear Fog Light Bulb",
                              "level": 4,
                              "children": [],
                              "productId": 113
                            }
                          }
                        }
                      },
                      "productId": 113
                    }
                  }
                }
              },
              "productId": 113
            },
            "Boîtier, feu antibrouillard arrière": {
              "categoryId": 100043,
              "categoryName": "Lights",
              "level": 2,
              "children": {
                "Feu de brouillard arrière/Composants": {
                  "categoryId": null,
                  "categoryName": "Feu de brouillard arrière/Composants",
                  "level": 4,
                  "children": {
                    "Boîtier, feu antibrouillard arrière": {
                      "categoryId": 100285,
                      "categoryName": "Rear Fog Light/Parts",
                      "level": 3,
                      "children": {
                        "Composants de feu de brouillard arrière": {
                          "categoryId": null,
                          "categoryName": "Composants de feu de brouillard arrière",
                          "level": 6,
                          "children": {
                            "Boîtier, feu antibrouillard arrière": {
                              "categoryId": 100484,
                              "categoryName": "Rear Fog Light Individual Parts",
                              "level": 4,
                              "children": [],
                              "productId": 744
                            }
                          }
                        }
                      },
                      "productId": 744
                    }
                  }
                }
              },
              "productId": 744
            },
            "Disperseur, feu antibrouillard arrière": {
              "categoryId": 100043,
              "categoryName": "Lights",
              "level": 2,
              "children": {
                "Feu de brouillard arrière/Composants": {
                  "categoryId": null,
                  "categoryName": "Feu de brouillard arrière/Composants",
                  "level": 4,
                  "children": {
                    "Disperseur, feu antibrouillard arrière": {
                      "categoryId": 100285,
                      "categoryName": "Rear Fog Light/Parts",
                      "level": 3,
                      "children": {
                        "Composants de feu de brouillard arrière": {
                          "categoryId": null,
                          "categoryName": "Composants de feu de brouillard arrière",
                          "level": 6,
                          "children": {
                            "Disperseur, feu antibrouillard arrière": {
                              "categoryId": 100484,
                              "categoryName": "Rear Fog Light Individual Parts",
                              "level": 4,
                              "children": [],
                              "productId": 95
                            }
                          }
                        }
                      },
                      "productId": 95
                    }
                  }
                }
              },
              "productId": 95
            },
            "Élément, feu antibrouillard arrière": {
              "categoryId": 100043,
              "categoryName": "Lights",
              "level": 2,
              "children": {
                "Feu de brouillard arrière/Composants": {
                  "categoryId": null,
                  "categoryName": "Feu de brouillard arrière/Composants",
                  "level": 4,
                  "children": {
                    "Élément, feu antibrouillard arrière": {
                      "categoryId": 100285,
                      "categoryName": "Rear Fog Light/Parts",
                      "level": 3,
                      "children": {
                        "Composants de feu de brouillard arrière": {
                          "categoryId": null,
                          "categoryName": "Composants de feu de brouillard arrière",
                          "level": 6,
                          "children": {
                            "Élément, feu antibrouillard arrière": {
                              "categoryId": 100484,
                              "categoryName": "Rear Fog Light Individual Parts",
                              "level": 4,
                              "children": [],
                              "productId": 5492
                            }
                          }
                        }
                      },
                      "productId": 5492
                    }
                  }
                }
              },
              "productId": 5492
            },
            "Enjoliveur, feu antibrouillard arrière": {
              "categoryId": 100043,
              "categoryName": "Lights",
              "level": 2,
              "children": {
                "Feu de brouillard arrière/Composants": {
                  "categoryId": null,
                  "categoryName": "Feu de brouillard arrière/Composants",
                  "level": 4,
                  "children": {
                    "Enjoliveur, feu antibrouillard arrière": {
                      "categoryId": 100285,
                      "categoryName": "Rear Fog Light/Parts",
                      "level": 3,
                      "children": {
                        "Feu antibrouillard arrière": {
                          "categoryId": null,
                          "categoryName": "Feu antibrouillard arrière",
                          "level": 6,
                          "children": {
                            "Enjoliveur, feu antibrouillard arrière": {
                              "categoryId": 100465,
                              "categoryName": "Rear Fog Light",
                              "level": 4,
                              "children": [],
                              "productId": 3453
                            }
                          }
                        }
                      },
                      "productId": 3453
                    }
                  }
                }
              },
              "productId": 3453
            },
            "Feu antibrouillard arrière": {
              "categoryId": 100043,
              "categoryName": "Lights",
              "level": 2,
              "children": {
                "Feu de brouillard arrière/Composants": {
                  "categoryId": null,
                  "categoryName": "Feu de brouillard arrière/Composants",
                  "level": 4,
                  "children": {
                    "Feu antibrouillard arrière": {
                      "categoryId": 100285,
                      "categoryName": "Rear Fog Light/Parts",
                      "level": 3,
                      "children": {
                        "Feu antibrouillard arrière": {
                          "categoryId": null,
                          "categoryName": "Feu antibrouillard arrière",
                          "level": 6,
                          "children": {
                            "Feu antibrouillard arrière": {
                              "categoryId": 100465,
                              "categoryName": "Rear Fog Light",
                              "level": 4,
                              "children": [],
                              "productId": 291
                            }
                          }
                        }
                      },
                      "productId": 291
                    }
                  }
                }
              },
              "productId": 291
            },
            "Joint, feu antibrouillard arrière": {
              "categoryId": 100043,
              "categoryName": "Lights",
              "level": 2,
              "children": {
                "Feu de brouillard arrière/Composants": {
                  "categoryId": null,
                  "categoryName": "Feu de brouillard arrière/Composants",
                  "level": 4,
                  "children": {
                    "Joint, feu antibrouillard arrière": {
                      "categoryId": 100285,
                      "categoryName": "Rear Fog Light/Parts",
                      "level": 3,
                      "children": {
                        "Composants de feu de brouillard arrière": {
                          "categoryId": null,
                          "categoryName": "Composants de feu de brouillard arrière",
                          "level": 6,
                          "children": {
                            "Joint, feu antibrouillard arrière": {
                              "categoryId": 100484,
                              "categoryName": "Rear Fog Light Individual Parts",
                              "level": 4,
                              "children": [],
                              "productId": 3111
                            }
                          }
                        }
                      },
                      "productId": 3111
                    }
                  }
                }
              },
              "productId": 3111
            },
            "Kit réparation de câble, feu de brouillard arrière": {
              "categoryId": 100043,
              "categoryName": "Lights",
              "level": 2,
              "children": {
                "Feu de brouillard arrière/Composants": {
                  "categoryId": null,
                  "categoryName": "Feu de brouillard arrière/Composants",
                  "level": 4,
                  "children": {
                    "Kit réparation de câble, feu de brouillard arrière": {
                      "categoryId": 100285,
                      "categoryName": "Rear Fog Light/Parts",
                      "level": 3,
                      "children": {
                        "Composants de feu de brouillard arrière": {
                          "categoryId": null,
                          "categoryName": "Composants de feu de brouillard arrière",
                          "level": 6,
                          "children": {
                            "Kit réparation de câble, feu de brouillard arrière": {
                              "categoryId": 100484,
                              "categoryName": "Rear Fog Light Individual Parts",
                              "level": 4,
                              "children": [],
                              "productId": 8952
                            }
                          }
                        }
                      },
                      "productId": 8952
                    }
                  }
                }
              },
              "productId": 8952
            },
            "Support de lampe, feu antibrouillard arrière": {
              "categoryId": 100043,
              "categoryName": "Lights",
              "level": 2,
              "children": {
                "Feu de brouillard arrière/Composants": {
                  "categoryId": null,
                  "categoryName": "Feu de brouillard arrière/Composants",
                  "level": 4,
                  "children": {
                    "Support de lampe, feu antibrouillard arrière": {
                      "categoryId": 100285,
                      "categoryName": "Rear Fog Light/Parts",
                      "level": 3,
                      "children": {
                        "Composants de feu de brouillard arrière": {
                          "categoryId": null,
                          "categoryName": "Composants de feu de brouillard arrière",
                          "level": 6,
                          "children": {
                            "Support de lampe, feu antibrouillard arrière": {
                              "categoryId": 100484,
                              "categoryName": "Rear Fog Light Individual Parts",
                              "level": 4,
                              "children": [],
                              "productId": 499
                            }
                          }
                        }
                      },
                      "productId": 499
                    }
                  }
                }
              },
              "productId": 499
            },
            "Support de lampe, feu de recul": {
              "categoryId": 100043,
              "categoryName": "Lights",
              "level": 2,
              "children": {
                "Feu de brouillard arrière/Composants": {
                  "categoryId": null,
                  "categoryName": "Feu de brouillard arrière/Composants",
                  "level": 4,
                  "children": {
                    "Support de lampe, feu de recul": {
                      "categoryId": 100285,
                      "categoryName": "Rear Fog Light/Parts",
                      "level": 3,
                      "children": {
                        "Feu antibrouillard arrière": {
                          "categoryId": null,
                          "categoryName": "Feu antibrouillard arrière",
                          "level": 6,
                          "children": {
                            "Support de lampe, feu de recul": {
                              "categoryId": 100465,
                              "categoryName": "Rear Fog Light",
                              "level": 4,
                              "children": [],
                              "productId": 500
                            }
                          }
                        }
                      },
                      "productId": 500
                    }
                  }
                },
                "Feu de recul / composants": {
                  "categoryId": null,
                  "categoryName": "Feu de recul / composants",
                  "level": 4,
                  "children": {
                    "Support de lampe, feu de recul": {
                      "categoryId": 100287,
                      "categoryName": "Reverse Light/Parts",
                      "level": 3,
                      "children": {
                        "Composants de feu de recul": {
                          "categoryId": null,
                          "categoryName": "Composants de feu de recul",
                          "level": 6,
                          "children": {
                            "Support de lampe, feu de recul": {
                              "categoryId": 100486,
                              "categoryName": "Reverse Light Parts",
                              "level": 4,
                              "children": [],
                              "productId": 500
                            }
                          }
                        }
                      },
                      "productId": 500
                    }
                  }
                }
              },
              "productId": 500
            },
            "Support, feu antibrouillard arrière": {
              "categoryId": 100043,
              "categoryName": "Lights",
              "level": 2,
              "children": {
                "Feu de brouillard arrière/Composants": {
                  "categoryId": null,
                  "categoryName": "Feu de brouillard arrière/Composants",
                  "level": 4,
                  "children": {
                    "Support, feu antibrouillard arrière": {
                      "categoryId": 100285,
                      "categoryName": "Rear Fog Light/Parts",
                      "level": 3,
                      "children": {
                        "Composants de feu de brouillard arrière": {
                          "categoryId": null,
                          "categoryName": "Composants de feu de brouillard arrière",
                          "level": 6,
                          "children": {
                            "Support, feu antibrouillard arrière": {
                              "categoryId": 100484,
                              "categoryName": "Rear Fog Light Individual Parts",
                              "level": 4,
                              "children": [],
                              "productId": 785
                            }
                          }
                        }
                      },
                      "productId": 785
                    }
                  }
                }
              },
              "productId": 785
            }
          }
        },
        "Interrupteur/Relais/Contrôle clignotant/Appareil d.commande": {
          "categoryId": null,
          "categoryName": "Interrupteur/Relais/Contrôle clignotant/Appareil d.commande",
          "level": 2,
          "children": {
            "Interrupteur, feu antibrouillard arrière": {
              "categoryId": 100307,
              "categoryName": "Light Switches/Relays/Controls",
              "level": 2,
              "children": {
                "Interrupteur / régulateur": {
                  "categoryId": null,
                  "categoryName": "Interrupteur / régulateur",
                  "level": 4,
                  "children": {
                    "Interrupteur, feu antibrouillard arrière": {
                      "categoryId": 100509,
                      "categoryName": "Light Switch/ Lever",
                      "level": 3,
                      "children": [],
                      "productId": 3430
                    }
                  }
                }
              },
              "productId": 3430
            },
            "Relais, feu antibrouillard arrière": {
              "categoryId": 100307,
              "categoryName": "Light Switches/Relays/Controls",
              "level": 2,
              "children": {
                "Relais": {
                  "categoryId": null,
                  "categoryName": "Relais",
                  "level": 4,
                  "children": {
                    "Relais, feu antibrouillard arrière": {
                      "categoryId": 100510,
                      "categoryName": "Relay",
                      "level": 3,
                      "children": [],
                      "productId": 1286
                    }
                  }
                }
              },
              "productId": 1286
            }
          }
        },
        "Relais": {
          "categoryId": null,
          "categoryName": "Relais",
          "level": 2,
          "children": {
            "Relais, feu antibrouillard arrière": {
              "categoryId": 100785,
              "categoryName": "Relay",
              "level": 2,
              "children": [],
              "productId": 1286
            }
          }
        }
      }
    }
  },
  "arborescenceText": "├── Carrosserie [ID: 100001] (Niveau 1)\n│   ├── Arrière de la voiture (Niveau 2)\n│   │   ├── Vehicle Rear [ID: 101705] (Niveau 2) → ProductId: 113\n│   │   │   └── Feu de brouillard arrière/Composants (Niveau 4)\n│   │   │       └── Rear Fog Light/Parts [ID: 101735] (Niveau 3) → ProductId: 113\n│   │   │           └── Ampoules de feu de brouillard arrière (Niveau 6)\n│   │   │               └── Rear Fog Light Bulb [ID: 101738] (Niveau 4) → ProductId: 113\n│   │   ├── Vehicle Rear [ID: 101705] (Niveau 2) → ProductId: 744\n│   │   │   └── Feu de brouillard arrière/Composants (Niveau 4)\n│   │   │       └── Rear Fog Light/Parts [ID: 101735] (Niveau 3) → ProductId: 744\n│   │   │           └── Composants de feu de brouillard arrière (Niveau 6)\n│   │   │               └── Rear Fog Light Individual Parts [ID: 101737] (Niveau 4) → ProductId: 744\n│   │   ├── Vehicle Rear [ID: 101705] (Niveau 2) → ProductId: 95\n│   │   │   └── Feu de brouillard arrière/Composants (Niveau 4)\n│   │   │       └── Rear Fog Light/Parts [ID: 101735] (Niveau 3) → ProductId: 95\n│   │   │           └── Composants de feu de brouillard arrière (Niveau 6)\n│   │   │               └── Rear Fog Light Individual Parts [ID: 101737] (Niveau 4) → ProductId: 95\n│   │   ├── Vehicle Rear [ID: 101705] (Niveau 2) → ProductId: 3453\n│   │   │   └── Feu de brouillard arrière/Composants (Niveau 4)\n│   │   │       └── Rear Fog Light/Parts [ID: 101735] (Niveau 3) → ProductId: 3453\n│   │   │           └── Feu antibrouillard arrière (Niveau 6)\n│   │   │               └── Rear Fog Light [ID: 101736] (Niveau 4) → ProductId: 3453\n│   │   ├── Vehicle Rear [ID: 101705] (Niveau 2) → ProductId: 291\n│   │   │   └── Feu de brouillard arrière/Composants (Niveau 4)\n│   │   │       └── Rear Fog Light/Parts [ID: 101735] (Niveau 3) → ProductId: 291\n│   │   │           └── Feu antibrouillard arrière (Niveau 6)\n│   │   │               └── Rear Fog Light [ID: 101736] (Niveau 4) → ProductId: 291\n│   │   ├── Vehicle Rear [ID: 101705] (Niveau 2) → ProductId: 3111\n│   │   │   └── Feu de brouillard arrière/Composants (Niveau 4)\n│   │   │       └── Rear Fog Light/Parts [ID: 101735] (Niveau 3) → ProductId: 3111\n│   │   │           └── Composants de feu de brouillard arrière (Niveau 6)\n│   │   │               └── Rear Fog Light Individual Parts [ID: 101737] (Niveau 4) → ProductId: 3111\n│   │   ├── Vehicle Rear [ID: 101705] (Niveau 2) → ProductId: 499\n│   │   │   └── Feu de brouillard arrière/Composants (Niveau 4)\n│   │   │       └── Rear Fog Light/Parts [ID: 101735] (Niveau 3) → ProductId: 499\n│   │   │           └── Composants de feu de brouillard arrière (Niveau 6)\n│   │   │               └── Rear Fog Light Individual Parts [ID: 101737] (Niveau 4) → ProductId: 499\n│   │   ├── Vehicle Rear [ID: 101705] (Niveau 2) → ProductId: 500\n│   │   │   ├── Feu de brouillard arrière/Composants (Niveau 4)\n│   │   │   │   └── Rear Fog Light/Parts [ID: 101735] (Niveau 3) → ProductId: 500\n│   │   │   │       └── Feu antibrouillard arrière (Niveau 6)\n│   │   │   │           └── Rear Fog Light [ID: 101736] (Niveau 4) → ProductId: 500\n│   │   │   └── Feu de recul / composants (Niveau 4)\n│   │   │       └── Reverse Light/Parts [ID: 101739] (Niveau 3) → ProductId: 500\n│   │   │           └── Composants de feu de recul (Niveau 6)\n│   │   │               └── Reverse Light Parts [ID: 101741] (Niveau 4) → ProductId: 500\n│   │   └── Vehicle Rear [ID: 101705] (Niveau 2) → ProductId: 785\n│   │       └── Feu de brouillard arrière/Composants (Niveau 4)\n│   │           └── Rear Fog Light/Parts [ID: 101735] (Niveau 3) → ProductId: 785\n│   │               └── Composants de feu de brouillard arrière (Niveau 6)\n│   │                   └── Rear Fog Light Individual Parts [ID: 101737] (Niveau 4) → ProductId: 785\n│   └── Feux (Niveau 2)\n│       ├── Lights [ID: 101407] (Niveau 2) → ProductId: 113\n│       │   └── Feu de brouillard arrière/Composants (Niveau 4)\n│       │       └── Rear Fog Light/Parts [ID: 101428] (Niveau 3) → ProductId: 113\n│       │           └── Ampoules de feu de brouillard arrière (Niveau 6)\n│       │               └── Rear Fog Light Bulb [ID: 101431] (Niveau 4) → ProductId: 113\n│       ├── Lights [ID: 101407] (Niveau 2) → ProductId: 744\n│       │   └── Feu de brouillard arrière/Composants (Niveau 4)\n│       │       └── Rear Fog Light/Parts [ID: 101428] (Niveau 3) → ProductId: 744\n│       │           └── Composants de feu de brouillard arrière (Niveau 6)\n│       │               └── Rear Fog Light Individual Parts [ID: 101430] (Niveau 4) → ProductId: 744\n│       ├── Lights [ID: 101407] (Niveau 2) → ProductId: 95\n│       │   └── Feu de brouillard arrière/Composants (Niveau 4)\n│       │       └── Rear Fog Light/Parts [ID: 101428] (Niveau 3) → ProductId: 95\n│       │           └── Composants de feu de brouillard arrière (Niveau 6)\n│       │               └── Rear Fog Light Individual Parts [ID: 101430] (Niveau 4) → ProductId: 95\n│       ├── Lights [ID: 101407] (Niveau 2) → ProductId: 3453\n│       │   └── Feu de brouillard arrière/Composants (Niveau 4)\n│       │       └── Rear Fog Light/Parts [ID: 101428] (Niveau 3) → ProductId: 3453\n│       │           └── Feu antibrouillard arrière (Niveau 6)\n│       │               └── Rear Fog Light [ID: 101429] (Niveau 4) → ProductId: 3453\n│       ├── Lights [ID: 101407] (Niveau 2) → ProductId: 291\n│       │   └── Feu de brouillard arrière/Composants (Niveau 4)\n│       │       └── Rear Fog Light/Parts [ID: 101428] (Niveau 3) → ProductId: 291\n│       │           └── Feu antibrouillard arrière (Niveau 6)\n│       │               └── Rear Fog Light [ID: 101429] (Niveau 4) → ProductId: 291\n│       ├── Lights [ID: 101407] (Niveau 2) → ProductId: 3111\n│       │   └── Feu de brouillard arrière/Composants (Niveau 4)\n│       │       └── Rear Fog Light/Parts [ID: 101428] (Niveau 3) → ProductId: 3111\n│       │           └── Composants de feu de brouillard arrière (Niveau 6)\n│       │               └── Rear Fog Light Individual Parts [ID: 101430] (Niveau 4) → ProductId: 3111\n│       ├── Lights [ID: 101407] (Niveau 2) → ProductId: 499\n│       │   └── Feu de brouillard arrière/Composants (Niveau 4)\n│       │       └── Rear Fog Light/Parts [ID: 101428] (Niveau 3) → ProductId: 499\n│       │           └── Composants de feu de brouillard arrière (Niveau 6)\n│       │               └── Rear Fog Light Individual Parts [ID: 101430] (Niveau 4) → ProductId: 499\n│       ├── Lights [ID: 101407] (Niveau 2) → ProductId: 500\n│       │   ├── Feu de brouillard arrière/Composants (Niveau 4)\n│       │   │   └── Rear Fog Light/Parts [ID: 101428] (Niveau 3) → ProductId: 500\n│       │   │       └── Feu antibrouillard arrière (Niveau 6)\n│       │   │           └── Rear Fog Light [ID: 101429] (Niveau 4) → ProductId: 500\n│       │   └── Feu de recul / composants (Niveau 4)\n│       │       └── Reverse Light/Parts [ID: 101432] (Niveau 3) → ProductId: 500\n│       │           └── Composants de feu de recul (Niveau 6)\n│       │               └── Reverse Light Parts [ID: 101434] (Niveau 4) → ProductId: 500\n│       └── Lights [ID: 101407] (Niveau 2) → ProductId: 785\n│           └── Feu de brouillard arrière/Composants (Niveau 4)\n│               └── Rear Fog Light/Parts [ID: 101428] (Niveau 3) → ProductId: 785\n│                   └── Composants de feu de brouillard arrière (Niveau 6)\n│                       └── Rear Fog Light Individual Parts [ID: 101430] (Niveau 4) → ProductId: 785\n\n├── Dispositif d'attelage/accessoires [ID: 100015] (Niveau 1)\n│   └── Pièces du système électrique (Niveau 2)\n│       └── Electric Parts [ID: 100608] (Niveau 2) → ProductId: 2243\n\n└── Système électrique [ID: 100010] (Niveau 1)\n    ├── Feux (Niveau 2)\n    │   ├── Lights [ID: 100043] (Niveau 2) → ProductId: 113\n    │   │   ├── Feu arrière / composants (Niveau 4)\n    │   │   │   └── Tail Light Assembly/Parts [ID: 100275] (Niveau 3) → ProductId: 113\n    │   │   │       └── Ampoule pour feux arrières (Niveau 6)\n    │   │   │           └── Tail Light Assembly Bulb [ID: 101495] (Niveau 4) → ProductId: 113\n    │   │   └── Feu de brouillard arrière/Composants (Niveau 4)\n    │   │       └── Rear Fog Light/Parts [ID: 100285] (Niveau 3) → ProductId: 113\n    │   │           └── Ampoules de feu de brouillard arrière (Niveau 6)\n    │   │               └── Rear Fog Light Bulb [ID: 100500] (Niveau 4) → ProductId: 113\n    │   ├── Lights [ID: 100043] (Niveau 2) → ProductId: 744\n    │   │   └── Feu de brouillard arrière/Composants (Niveau 4)\n    │   │       └── Rear Fog Light/Parts [ID: 100285] (Niveau 3) → ProductId: 744\n    │   │           └── Composants de feu de brouillard arrière (Niveau 6)\n    │   │               └── Rear Fog Light Individual Parts [ID: 100484] (Niveau 4) → ProductId: 744\n    │   ├── Lights [ID: 100043] (Niveau 2) → ProductId: 95\n    │   │   └── Feu de brouillard arrière/Composants (Niveau 4)\n    │   │       └── Rear Fog Light/Parts [ID: 100285] (Niveau 3) → ProductId: 95\n    │   │           └── Composants de feu de brouillard arrière (Niveau 6)\n    │   │               └── Rear Fog Light Individual Parts [ID: 100484] (Niveau 4) → ProductId: 95\n    │   ├── Lights [ID: 100043] (Niveau 2) → ProductId: 5492\n    │   │   └── Feu de brouillard arrière/Composants (Niveau 4)\n    │   │       └── Rear Fog Light/Parts [ID: 100285] (Niveau 3) → ProductId: 5492\n    │   │           └── Composants de feu de brouillard arrière (Niveau 6)\n    │   │               └── Rear Fog Light Individual Parts [ID: 100484] (Niveau 4) → ProductId: 5492\n    │   ├── Lights [ID: 100043] (Niveau 2) → ProductId: 3453\n    │   │   └── Feu de brouillard arrière/Composants (Niveau 4)\n    │   │       └── Rear Fog Light/Parts [ID: 100285] (Niveau 3) → ProductId: 3453\n    │   │           └── Feu antibrouillard arrière (Niveau 6)\n    │   │               └── Rear Fog Light [ID: 100465] (Niveau 4) → ProductId: 3453\n    │   ├── Lights [ID: 100043] (Niveau 2) → ProductId: 291\n    │   │   └── Feu de brouillard arrière/Composants (Niveau 4)\n    │   │       └── Rear Fog Light/Parts [ID: 100285] (Niveau 3) → ProductId: 291\n    │   │           └── Feu antibrouillard arrière (Niveau 6)\n    │   │               └── Rear Fog Light [ID: 100465] (Niveau 4) → ProductId: 291\n    │   ├── Lights [ID: 100043] (Niveau 2) → ProductId: 3111\n    │   │   └── Feu de brouillard arrière/Composants (Niveau 4)\n    │   │       └── Rear Fog Light/Parts [ID: 100285] (Niveau 3) → ProductId: 3111\n    │   │           └── Composants de feu de brouillard arrière (Niveau 6)\n    │   │               └── Rear Fog Light Individual Parts [ID: 100484] (Niveau 4) → ProductId: 3111\n    │   ├── Lights [ID: 100043] (Niveau 2) → ProductId: 8952\n    │   │   └── Feu de brouillard arrière/Composants (Niveau 4)\n    │   │       └── Rear Fog Light/Parts [ID: 100285] (Niveau 3) → ProductId: 8952\n    │   │           └── Composants de feu de brouillard arrière (Niveau 6)\n    │   │               └── Rear Fog Light Individual Parts [ID: 100484] (Niveau 4) → ProductId: 8952\n    │   ├── Lights [ID: 100043] (Niveau 2) → ProductId: 499\n    │   │   └── Feu de brouillard arrière/Composants (Niveau 4)\n    │   │       └── Rear Fog Light/Parts [ID: 100285] (Niveau 3) → ProductId: 499\n    │   │           └── Composants de feu de brouillard arrière (Niveau 6)\n    │   │               └── Rear Fog Light Individual Parts [ID: 100484] (Niveau 4) → ProductId: 499\n    │   ├── Lights [ID: 100043] (Niveau 2) → ProductId: 500\n    │   │   ├── Feu de brouillard arrière/Composants (Niveau 4)\n    │   │   │   └── Rear Fog Light/Parts [ID: 100285] (Niveau 3) → ProductId: 500\n    │   │   │       └── Feu antibrouillard arrière (Niveau 6)\n    │   │   │           └── Rear Fog Light [ID: 100465] (Niveau 4) → ProductId: 500\n    │   │   └── Feu de recul / composants (Niveau 4)\n    │   │       └── Reverse Light/Parts [ID: 100287] (Niveau 3) → ProductId: 500\n    │   │           └── Composants de feu de recul (Niveau 6)\n    │   │               └── Reverse Light Parts [ID: 100486] (Niveau 4) → ProductId: 500\n    │   └── Lights [ID: 100043] (Niveau 2) → ProductId: 785\n    │       └── Feu de brouillard arrière/Composants (Niveau 4)\n    │           └── Rear Fog Light/Parts [ID: 100285] (Niveau 3) → ProductId: 785\n    │               └── Composants de feu de brouillard arrière (Niveau 6)\n    │                   └── Rear Fog Light Individual Parts [ID: 100484] (Niveau 4) → ProductId: 785\n    ├── Interrupteur/Relais/Contrôle clignotant/Appareil d.commande (Niveau 2)\n    │   ├── Light Switches/Relays/Controls [ID: 100307] (Niveau 2) → ProductId: 3430\n    │   │   └── Interrupteur / régulateur (Niveau 4)\n    │   │       └── Light Switch/ Lever [ID: 100509] (Niveau 3) → ProductId: 3430\n    │   └── Light Switches/Relays/Controls [ID: 100307] (Niveau 2) → ProductId: 1286\n    │       └── Relais (Niveau 4)\n    │           └── Relay [ID: 100510] (Niveau 3) → ProductId: 1286\n    └── Relais (Niveau 2)\n        └── Relay [ID: 100785] (Niveau 2) → ProductId: 1286",
  "arborescencePaths": [
    {
      "path": [
        "Carrosserie",
        "Arrière de la voiture",
        "Vehicle Rear"
      ],
      "categoryIds": [
        100001,
        null,
        101705
      ],
      "finalCategoryId": 101705,
      "productId": 113
    },
    {
      "path": [
        "Carrosserie",
        "Arrière de la voiture",
        "Vehicle Rear"
      ],
      "categoryIds": [
        100001,
        null,
        101705
      ],
      "finalCategoryId": 101705,
      "productId": 744
    },
    {
      "path": [
        "Carrosserie",
        "Arrière de la voiture",
        "Vehicle Rear"
      ],
      "categoryIds": [
        100001,
        null,
        101705
      ],
      "finalCategoryId": 101705,
      "productId": 95
    },
    {
      "path": [
        "Carrosserie",
        "Arrière de la voiture",
        "Vehicle Rear"
      ],
      "categoryIds": [
        100001,
        null,
        101705
      ],
      "finalCategoryId": 101705,
      "productId": 3453
    },
    {
      "path": [
        "Carrosserie",
        "Arrière de la voiture",
        "Vehicle Rear"
      ],
      "categoryIds": [
        100001,
        null,
        101705
      ],
      "finalCategoryId": 101705,
      "productId": 291
    },
    {
      "path": [
        "Carrosserie",
        "Arrière de la voiture",
        "Vehicle Rear"
      ],
      "categoryIds": [
        100001,
        null,
        101705
      ],
      "finalCategoryId": 101705,
      "productId": 3111
    },
    {
      "path": [
        "Carrosserie",
        "Arrière de la voiture",
        "Vehicle Rear"
      ],
      "categoryIds": [
        100001,
        null,
        101705
      ],
      "finalCategoryId": 101705,
      "productId": 499
    },
    {
      "path": [
        "Carrosserie",
        "Arrière de la voiture",
        "Vehicle Rear"
      ],
      "categoryIds": [
        100001,
        null,
        101705
      ],
      "finalCategoryId": 101705,
      "productId": 500
    },
    {
      "path": [
        "Carrosserie",
        "Arrière de la voiture",
        "Vehicle Rear"
      ],
      "categoryIds": [
        100001,
        null,
        101705
      ],
      "finalCategoryId": 101705,
      "productId": 785
    },
    {
      "path": [
        "Carrosserie",
        "Feux",
        "Lights"
      ],
      "categoryIds": [
        100001,
        null,
        101407
      ],
      "finalCategoryId": 101407,
      "productId": 113
    },
    {
      "path": [
        "Carrosserie",
        "Feux",
        "Lights"
      ],
      "categoryIds": [
        100001,
        null,
        101407
      ],
      "finalCategoryId": 101407,
      "productId": 744
    },
    {
      "path": [
        "Carrosserie",
        "Feux",
        "Lights"
      ],
      "categoryIds": [
        100001,
        null,
        101407
      ],
      "finalCategoryId": 101407,
      "productId": 95
    },
    {
      "path": [
        "Carrosserie",
        "Feux",
        "Lights"
      ],
      "categoryIds": [
        100001,
        null,
        101407
      ],
      "finalCategoryId": 101407,
      "productId": 3453
    },
    {
      "path": [
        "Carrosserie",
        "Feux",
        "Lights"
      ],
      "categoryIds": [
        100001,
        null,
        101407
      ],
      "finalCategoryId": 101407,
      "productId": 291
    },
    {
      "path": [
        "Carrosserie",
        "Feux",
        "Lights"
      ],
      "categoryIds": [
        100001,
        null,
        101407
      ],
      "finalCategoryId": 101407,
      "productId": 3111
    },
    {
      "path": [
        "Carrosserie",
        "Feux",
        "Lights"
      ],
      "categoryIds": [
        100001,
        null,
        101407
      ],
      "finalCategoryId": 101407,
      "productId": 499
    },
    {
      "path": [
        "Carrosserie",
        "Feux",
        "Lights"
      ],
      "categoryIds": [
        100001,
        null,
        101407
      ],
      "finalCategoryId": 101407,
      "productId": 500
    },
    {
      "path": [
        "Carrosserie",
        "Feux",
        "Lights"
      ],
      "categoryIds": [
        100001,
        null,
        101407
      ],
      "finalCategoryId": 101407,
      "productId": 785
    },
    {
      "path": [
        "Dispositif d'attelage/accessoires",
        "Pièces du système électrique",
        "Electric Parts"
      ],
      "categoryIds": [
        100015,
        null,
        100608
      ],
      "finalCategoryId": 100608,
      "productId": 2243
    },
    {
      "path": [
        "Système électrique",
        "Feux",
        "Lights"
      ],
      "categoryIds": [
        100010,
        null,
        100043
      ],
      "finalCategoryId": 100043,
      "productId": 113
    },
    {
      "path": [
        "Système électrique",
        "Feux",
        "Lights"
      ],
      "categoryIds": [
        100010,
        null,
        100043
      ],
      "finalCategoryId": 100043,
      "productId": 744
    },
    {
      "path": [
        "Système électrique",
        "Feux",
        "Lights"
      ],
      "categoryIds": [
        100010,
        null,
        100043
      ],
      "finalCategoryId": 100043,
      "productId": 95
    },
    {
      "path": [
        "Système électrique",
        "Feux",
        "Lights"
      ],
      "categoryIds": [
        100010,
        null,
        100043
      ],
      "finalCategoryId": 100043,
      "productId": 5492
    },
    {
      "path": [
        "Système électrique",
        "Feux",
        "Lights"
      ],
      "categoryIds": [
        100010,
        null,
        100043
      ],
      "finalCategoryId": 100043,
      "productId": 3453
    },
    {
      "path": [
        "Système électrique",
        "Feux",
        "Lights"
      ],
      "categoryIds": [
        100010,
        null,
        100043
      ],
      "finalCategoryId": 100043,
      "productId": 291
    },
    {
      "path": [
        "Système électrique",
        "Feux",
        "Lights"
      ],
      "categoryIds": [
        100010,
        null,
        100043
      ],
      "finalCategoryId": 100043,
      "productId": 3111
    },
    {
      "path": [
        "Système électrique",
        "Feux",
        "Lights"
      ],
      "categoryIds": [
        100010,
        null,
        100043
      ],
      "finalCategoryId": 100043,
      "productId": 8952
    },
    {
      "path": [
        "Système électrique",
        "Feux",
        "Lights"
      ],
      "categoryIds": [
        100010,
        null,
        100043
      ],
      "finalCategoryId": 100043,
      "productId": 499
    },
    {
      "path": [
        "Système électrique",
        "Feux",
        "Lights"
      ],
      "categoryIds": [
        100010,
        null,
        100043
      ],
      "finalCategoryId": 100043,
      "productId": 500
    },
    {
      "path": [
        "Système électrique",
        "Feux",
        "Lights"
      ],
      "categoryIds": [
        100010,
        null,
        100043
      ],
      "finalCategoryId": 100043,
      "productId": 785
    },
    {
      "path": [
        "Système électrique",
        "Interrupteur/Relais/Contrôle clignotant/Appareil d.commande",
        "Light Switches/Relays/Controls"
      ],
      "categoryIds": [
        100010,
        null,
        100307
      ],
      "finalCategoryId": 100307,
      "productId": 3430
    },
    {
      "path": [
        "Système électrique",
        "Interrupteur/Relais/Contrôle clignotant/Appareil d.commande",
        "Light Switches/Relays/Controls"
      ],
      "categoryIds": [
        100010,
        null,
        100307
      ],
      "finalCategoryId": 100307,
      "productId": 1286
    },
    {
      "path": [
        "Système électrique",
        "Relais",
        "Relay"
      ],
      "categoryIds": [
        100010,
        null,
        100785
      ],
      "finalCategoryId": 100785,
      "productId": 1286
    }
  ],
  "productIdsInArbo": [
    95,
    113,
    291,
    499,
    500,
    744,
    785,
    1286,
    2243,
    3111,
    3430,
    3453,
    5492,
    8952
  ],
  "matchedProductIds": [
    291
  ]
}