{
  "productName": "Feu de stationnement",
  "searchText": "Feu de stationnement",
  "found": true,
  "hasMatch": true,
  "timestamp": "2025-12-02T20:38:33.733Z",
  "productId": 1173,
  "arborescence": {
    "Carrosserie": {
      "categoryId": 100001,
      "categoryName": "Carrosserie",
      "level": 1,
      "children": {
        "Arrière de la voiture": {
          "categoryId": null,
          "categoryName": "Arrière de la voiture",
          "level": 2,
          "children": {
            "Ampoule, feu clignotant/feu-position avant": {
              "categoryId": 101705,
              "categoryName": "Vehicle Rear",
              "level": 2,
              "children": {
                "Feu clignotant/composants": {
                  "categoryId": null,
                  "categoryName": "Feu clignotant/composants",
                  "level": 4,
                  "children": {
                    "Ampoule, feu clignotant/feu-position avant": {
                      "categoryId": 101727,
                      "categoryName": "Direction Indicator/Parts",
                      "level": 3,
                      "children": {
                        "Feu clignotant": {
                          "categoryId": null,
                          "categoryName": "Feu clignotant",
                          "level": 6,
                          "children": {
                            "Ampoule, feu clignotant/feu-position avant": {
                              "categoryId": 101728,
                              "categoryName": "Direction Indicator",
                              "level": 4,
                              "children": [],
                              "productId": 3193
                            }
                          }
                        }
                      },
                      "productId": 3193
                    }
                  }
                },
                "Feu de position / d'encombrement / composants": {
                  "categoryId": null,
                  "categoryName": "Feu de position / d'encombrement / composants",
                  "level": 4,
                  "children": {
                    "Ampoule, feu clignotant/feu-position avant": {
                      "categoryId": 101785,
                      "categoryName": "Side Marker/End Outline Marker Light/Parts",
                      "level": 3,
                      "children": {
                        "Feu d'encombrement": {
                          "categoryId": null,
                          "categoryName": "Feu d'encombrement",
                          "level": 6,
                          "children": {
                            "Ampoule, feu clignotant/feu-position avant": {
                              "categoryId": 101787,
                              "categoryName": "End Outline Marker Light",
                              "level": 4,
                              "children": [],
                              "productId": 3193
                            }
                          }
                        }
                      },
                      "productId": 3193
                    }
                  }
                }
              },
              "productId": 3193
            },
            "Ampoule, feu d'encombrement/de position": {
              "categoryId": 101705,
              "categoryName": "Vehicle Rear",
              "level": 2,
              "children": {
                "Feu de position / d'encombrement / composants": {
                  "categoryId": null,
                  "categoryName": "Feu de position / d'encombrement / composants",
                  "level": 4,
                  "children": {
                    "Ampoule, feu d'encombrement/de position": {
                      "categoryId": 101785,
                      "categoryName": "Side Marker/End Outline Marker Light/Parts",
                      "level": 3,
                      "children": {
                        "Ampoule": {
                          "categoryId": null,
                          "categoryName": "Ampoule",
                          "level": 6,
                          "children": {
                            "Ampoule, feu d'encombrement/de position": {
                              "categoryId": 101789,
                              "categoryName": "Bulb",
                              "level": 4,
                              "children": [],
                              "productId": 1172
                            }
                          }
                        }
                      },
                      "productId": 1172
                    }
                  }
                }
              },
              "productId": 1172
            },
            "Ampoule, feu de position latéral": {
              "categoryId": 101705,
              "categoryName": "Vehicle Rear",
              "level": 2,
              "children": {
                "Feu de position / d'encombrement / composants": {
                  "categoryId": null,
                  "categoryName": "Feu de position / d'encombrement / composants",
                  "level": 4,
                  "children": {
                    "Ampoule, feu de position latéral": {
                      "categoryId": 101785,
                      "categoryName": "Side Marker/End Outline Marker Light/Parts",
                      "level": 3,
                      "children": {
                        "Feux latéraux": {
                          "categoryId": null,
                          "categoryName": "Feux latéraux",
                          "level": 6,
                          "children": {
                            "Ampoule, feu de position latéral": {
                              "categoryId": 101788,
                              "categoryName": "Side Marker Lights",
                              "level": 4,
                              "children": [],
                              "productId": 60090
                            }
                          }
                        }
                      },
                      "productId": 60090
                    }
                  }
                }
              },
              "productId": 60090
            },
            "Ampoule, feu de position/d'encombrement": {
              "categoryId": 101705,
              "categoryName": "Vehicle Rear",
              "level": 2,
              "children": {
                "Feu de position / d'encombrement / composants": {
                  "categoryId": null,
                  "categoryName": "Feu de position / d'encombrement / composants",
                  "level": 4,
                  "children": {
                    "Ampoule, feu de position/d'encombrement": {
                      "categoryId": 101785,
                      "categoryName": "Side Marker/End Outline Marker Light/Parts",
                      "level": 3,
                      "children": {
                        "Feu d'encombrement": {
                          "categoryId": null,
                          "categoryName": "Feu d'encombrement",
                          "level": 6,
                          "children": {
                            "Ampoule, feu de position/d'encombrement": {
                              "categoryId": 101787,
                              "categoryName": "End Outline Marker Light",
                              "level": 4,
                              "children": [],
                              "productId": 2126
                            }
                          }
                        },
                        "Feu de stationnement/de position": {
                          "categoryId": null,
                          "categoryName": "Feu de stationnement/de position",
                          "level": 6,
                          "children": {
                            "Ampoule, feu de position/d'encombrement": {
                              "categoryId": 101786,
                              "categoryName": "Park/Position Light",
                              "level": 4,
                              "children": [],
                              "productId": 2126
                            }
                          }
                        }
                      },
                      "productId": 2126
                    }
                  }
                }
              },
              "productId": 2126
            },
            "Boitier, feu de position": {
              "categoryId": 101705,
              "categoryName": "Vehicle Rear",
              "level": 2,
              "children": {
                "Feu de position / d'encombrement / composants": {
                  "categoryId": null,
                  "categoryName": "Feu de position / d'encombrement / composants",
                  "level": 4,
                  "children": {
                    "Boitier, feu de position": {
                      "categoryId": 101785,
                      "categoryName": "Side Marker/End Outline Marker Light/Parts",
                      "level": 3,
                      "children": {
                        "Feu d'encombrement": {
                          "categoryId": null,
                          "categoryName": "Feu d'encombrement",
                          "level": 6,
                          "children": {
                            "Boitier, feu de position": {
                              "categoryId": 101787,
                              "categoryName": "End Outline Marker Light",
                              "level": 4,
                              "children": [],
                              "productId": 3828
                            }
                          }
                        }
                      },
                      "productId": 3828
                    }
                  }
                }
              },
              "productId": 3828
            },
            "Boîtier, feu latéral": {
              "categoryId": 101705,
              "categoryName": "Vehicle Rear",
              "level": 2,
              "children": {
                "Feu de position / d'encombrement / composants": {
                  "categoryId": null,
                  "categoryName": "Feu de position / d'encombrement / composants",
                  "level": 4,
                  "children": {
                    "Boîtier, feu latéral": {
                      "categoryId": 101785,
                      "categoryName": "Side Marker/End Outline Marker Light/Parts",
                      "level": 3,
                      "children": {
                        "Feux latéraux": {
                          "categoryId": null,
                          "categoryName": "Feux latéraux",
                          "level": 6,
                          "children": {
                            "Boîtier, feu latéral": {
                              "categoryId": 101788,
                              "categoryName": "Side Marker Lights",
                              "level": 4,
                              "children": [],
                              "productId": 4726
                            }
                          }
                        }
                      },
                      "productId": 4726
                    }
                  }
                }
              },
              "productId": 4726
            },
            "Disperseur, feu d'encombrement": {
              "categoryId": 101705,
              "categoryName": "Vehicle Rear",
              "level": 2,
              "children": {
                "Feu de position / d'encombrement / composants": {
                  "categoryId": null,
                  "categoryName": "Feu de position / d'encombrement / composants",
                  "level": 4,
                  "children": {
                    "Disperseur, feu d'encombrement": {
                      "categoryId": 101785,
                      "categoryName": "Side Marker/End Outline Marker Light/Parts",
                      "level": 3,
                      "children": {
                        "Composants": {
                          "categoryId": null,
                          "categoryName": "Composants",
                          "level": 6,
                          "children": {
                            "Disperseur, feu d'encombrement": {
                              "categoryId": 101790,
                              "categoryName": "Parts",
                              "level": 4,
                              "children": [],
                              "productId": 1175
                            }
                          }
                        }
                      },
                      "productId": 1175
                    }
                  }
                }
              },
              "productId": 1175
            },
            "Disperseur, feu de gabarit": {
              "categoryId": 101705,
              "categoryName": "Vehicle Rear",
              "level": 2,
              "children": {
                "Feu de position / d'encombrement / composants": {
                  "categoryId": null,
                  "categoryName": "Feu de position / d'encombrement / composants",
                  "level": 4,
                  "children": {
                    "Disperseur, feu de gabarit": {
                      "categoryId": 101785,
                      "categoryName": "Side Marker/End Outline Marker Light/Parts",
                      "level": 3,
                      "children": {
                        "Feu d'encombrement": {
                          "categoryId": null,
                          "categoryName": "Feu d'encombrement",
                          "level": 6,
                          "children": {
                            "Disperseur, feu de gabarit": {
                              "categoryId": 101787,
                              "categoryName": "End Outline Marker Light",
                              "level": 4,
                              "children": [],
                              "productId": 3458
                            }
                          }
                        }
                      },
                      "productId": 3458
                    }
                  }
                }
              },
              "productId": 3458
            },
            "Disperseur, feu de position": {
              "categoryId": 101705,
              "categoryName": "Vehicle Rear",
              "level": 2,
              "children": {
                "Feu de position / d'encombrement / composants": {
                  "categoryId": null,
                  "categoryName": "Feu de position / d'encombrement / composants",
                  "level": 4,
                  "children": {
                    "Disperseur, feu de position": {
                      "categoryId": 101785,
                      "categoryName": "Side Marker/End Outline Marker Light/Parts",
                      "level": 3,
                      "children": {
                        "Composants": {
                          "categoryId": null,
                          "categoryName": "Composants",
                          "level": 6,
                          "children": {
                            "Disperseur, feu de position": {
                              "categoryId": 101790,
                              "categoryName": "Parts",
                              "level": 4,
                              "children": [],
                              "productId": 1174
                            }
                          }
                        }
                      },
                      "productId": 1174
                    }
                  }
                }
              },
              "productId": 1174
            },
            "Disperseur, feu de stationnement": {
              "categoryId": 101705,
              "categoryName": "Vehicle Rear",
              "level": 2,
              "children": {
                "Feu de position / d'encombrement / composants": {
                  "categoryId": null,
                  "categoryName": "Feu de position / d'encombrement / composants",
                  "level": 4,
                  "children": {
                    "Disperseur, feu de stationnement": {
                      "categoryId": 101785,
                      "categoryName": "Side Marker/End Outline Marker Light/Parts",
                      "level": 3,
                      "children": {
                        "Feu de stationnement/de position": {
                          "categoryId": null,
                          "categoryName": "Feu de stationnement/de position",
                          "level": 6,
                          "children": {
                            "Disperseur, feu de stationnement": {
                              "categoryId": 101786,
                              "categoryName": "Park/Position Light",
                              "level": 4,
                              "children": [],
                              "productId": 2547
                            }
                          }
                        }
                      },
                      "productId": 2547
                    }
                  }
                }
              },
              "productId": 2547
            },
            "Disperseur, feu latéral": {
              "categoryId": 101705,
              "categoryName": "Vehicle Rear",
              "level": 2,
              "children": {
                "Feu de position / d'encombrement / composants": {
                  "categoryId": null,
                  "categoryName": "Feu de position / d'encombrement / composants",
                  "level": 4,
                  "children": {
                    "Disperseur, feu latéral": {
                      "categoryId": 101785,
                      "categoryName": "Side Marker/End Outline Marker Light/Parts",
                      "level": 3,
                      "children": {
                        "Feux latéraux": {
                          "categoryId": null,
                          "categoryName": "Feux latéraux",
                          "level": 6,
                          "children": {
                            "Disperseur, feu latéral": {
                              "categoryId": 101788,
                              "categoryName": "Side Marker Lights",
                              "level": 4,
                              "children": [],
                              "productId": 3451
                            }
                          }
                        }
                      },
                      "productId": 3451
                    }
                  }
                }
              },
              "productId": 3451
            },
            "Feu d'encombrement": {
              "categoryId": 101705,
              "categoryName": "Vehicle Rear",
              "level": 2,
              "children": {
                "Feu de position / d'encombrement / composants": {
                  "categoryId": null,
                  "categoryName": "Feu de position / d'encombrement / composants",
                  "level": 4,
                  "children": {
                    "Feu d'encombrement": {
                      "categoryId": 101785,
                      "categoryName": "Side Marker/End Outline Marker Light/Parts",
                      "level": 3,
                      "children": {
                        "Feu d'encombrement": {
                          "categoryId": null,
                          "categoryName": "Feu d'encombrement",
                          "level": 6,
                          "children": {
                            "Feu d'encombrement": {
                              "categoryId": 101787,
                              "categoryName": "End Outline Marker Light",
                              "level": 4,
                              "children": [],
                              "productId": 1350
                            }
                          }
                        }
                      },
                      "productId": 1350
                    }
                  }
                }
              },
              "productId": 1350
            },
            "Feu de position": {
              "categoryId": 101705,
              "categoryName": "Vehicle Rear",
              "level": 2,
              "children": {
                "Feu de position / d'encombrement / composants": {
                  "categoryId": null,
                  "categoryName": "Feu de position / d'encombrement / composants",
                  "level": 4,
                  "children": {
                    "Feu de position": {
                      "categoryId": 101785,
                      "categoryName": "Side Marker/End Outline Marker Light/Parts",
                      "level": 3,
                      "children": {
                        "Feu d'encombrement": {
                          "categoryId": null,
                          "categoryName": "Feu d'encombrement",
                          "level": 6,
                          "children": {
                            "Feu de position": {
                              "categoryId": 101787,
                              "categoryName": "End Outline Marker Light",
                              "level": 4,
                              "children": [],
                              "productId": 294
                            }
                          }
                        },
                        "Feu de stationnement/de position": {
                          "categoryId": null,
                          "categoryName": "Feu de stationnement/de position",
                          "level": 6,
                          "children": {
                            "Feu de position": {
                              "categoryId": 101786,
                              "categoryName": "Park/Position Light",
                              "level": 4,
                              "children": [],
                              "productId": 4858
                            }
                          }
                        }
                      },
                      "productId": 4858
                    }
                  }
                }
              },
              "productId": 4858
            },
            "Feu de stationnement": {
              "categoryId": 101705,
              "categoryName": "Vehicle Rear",
              "level": 2,
              "children": {
                "Feu de position / d'encombrement / composants": {
                  "categoryId": null,
                  "categoryName": "Feu de position / d'encombrement / composants",
                  "level": 4,
                  "children": {
                    "Feu de stationnement": {
                      "categoryId": 101785,
                      "categoryName": "Side Marker/End Outline Marker Light/Parts",
                      "level": 3,
                      "children": {
                        "Feu de stationnement/de position": {
                          "categoryId": null,
                          "categoryName": "Feu de stationnement/de position",
                          "level": 6,
                          "children": {
                            "Feu de stationnement": {
                              "categoryId": 101786,
                              "categoryName": "Park/Position Light",
                              "level": 4,
                              "children": [],
                              "productId": 1173
                            }
                          }
                        }
                      },
                      "productId": 1173
                    }
                  }
                }
              },
              "productId": 1173
            },
            "Feu latéral": {
              "categoryId": 101705,
              "categoryName": "Vehicle Rear",
              "level": 2,
              "children": {
                "Feu de position / d'encombrement / composants": {
                  "categoryId": null,
                  "categoryName": "Feu de position / d'encombrement / composants",
                  "level": 4,
                  "children": {
                    "Feu latéral": {
                      "categoryId": 101785,
                      "categoryName": "Side Marker/End Outline Marker Light/Parts",
                      "level": 3,
                      "children": {
                        "Feux latéraux": {
                          "categoryId": null,
                          "categoryName": "Feux latéraux",
                          "level": 6,
                          "children": {
                            "Feu latéral": {
                              "categoryId": 101788,
                              "categoryName": "Side Marker Lights",
                              "level": 4,
                              "children": [],
                              "productId": 900
                            }
                          }
                        }
                      },
                      "productId": 900
                    }
                  }
                }
              },
              "productId": 900
            },
            "Joint, feu d'encombrement": {
              "categoryId": 101705,
              "categoryName": "Vehicle Rear",
              "level": 2,
              "children": {
                "Feu de position / d'encombrement / composants": {
                  "categoryId": null,
                  "categoryName": "Feu de position / d'encombrement / composants",
                  "level": 4,
                  "children": {
                    "Joint, feu d'encombrement": {
                      "categoryId": 101785,
                      "categoryName": "Side Marker/End Outline Marker Light/Parts",
                      "level": 3,
                      "children": {
                        "Composants": {
                          "categoryId": null,
                          "categoryName": "Composants",
                          "level": 6,
                          "children": {
                            "Joint, feu d'encombrement": {
                              "categoryId": 101790,
                              "categoryName": "Parts",
                              "level": 4,
                              "children": [],
                              "productId": 3122
                            }
                          }
                        }
                      },
                      "productId": 3122
                    }
                  }
                }
              },
              "productId": 3122
            },
            "Joint, feu de stationnement": {
              "categoryId": 101705,
              "categoryName": "Vehicle Rear",
              "level": 2,
              "children": {
                "Feu de position / d'encombrement / composants": {
                  "categoryId": null,
                  "categoryName": "Feu de position / d'encombrement / composants",
                  "level": 4,
                  "children": {
                    "Joint, feu de stationnement": {
                      "categoryId": 101785,
                      "categoryName": "Side Marker/End Outline Marker Light/Parts",
                      "level": 3,
                      "children": {
                        "Composants": {
                          "categoryId": null,
                          "categoryName": "Composants",
                          "level": 6,
                          "children": {
                            "Joint, feu de stationnement": {
                              "categoryId": 101790,
                              "categoryName": "Parts",
                              "level": 4,
                              "children": [],
                              "productId": 3120
                            }
                          }
                        }
                      },
                      "productId": 3120
                    }
                  }
                }
              },
              "productId": 3120
            },
            "Kit raccords, feu latéral": {
              "categoryId": 101705,
              "categoryName": "Vehicle Rear",
              "level": 2,
              "children": {
                "Feu de position / d'encombrement / composants": {
                  "categoryId": null,
                  "categoryName": "Feu de position / d'encombrement / composants",
                  "level": 4,
                  "children": {
                    "Kit raccords, feu latéral": {
                      "categoryId": 101785,
                      "categoryName": "Side Marker/End Outline Marker Light/Parts",
                      "level": 3,
                      "children": {
                        "Composants": {
                          "categoryId": null,
                          "categoryName": "Composants",
                          "level": 6,
                          "children": {
                            "Kit raccords, feu latéral": {
                              "categoryId": 101790,
                              "categoryName": "Parts",
                              "level": 4,
                              "children": [],
                              "productId": 4677
                            }
                          }
                        }
                      },
                      "productId": 4677
                    }
                  }
                }
              },
              "productId": 4677
            },
            "Kit réparation de câble, feu de position": {
              "categoryId": 101705,
              "categoryName": "Vehicle Rear",
              "level": 2,
              "children": {
                "Feu de position / d'encombrement / composants": {
                  "categoryId": null,
                  "categoryName": "Feu de position / d'encombrement / composants",
                  "level": 4,
                  "children": {
                    "Kit réparation de câble, feu de position": {
                      "categoryId": 101785,
                      "categoryName": "Side Marker/End Outline Marker Light/Parts",
                      "level": 3,
                      "children": {
                        "Feu d'encombrement": {
                          "categoryId": null,
                          "categoryName": "Feu d'encombrement",
                          "level": 6,
                          "children": {
                            "Kit réparation de câble, feu de position": {
                              "categoryId": 101787,
                              "categoryName": "End Outline Marker Light",
                              "level": 4,
                              "children": [],
                              "productId": 6352
                            }
                          }
                        }
                      },
                      "productId": 6352
                    }
                  }
                }
              },
              "productId": 6352
            },
            "Ligne de rattachement, feu latéral": {
              "categoryId": 101705,
              "categoryName": "Vehicle Rear",
              "level": 2,
              "children": {
                "Feu de position / d'encombrement / composants": {
                  "categoryId": null,
                  "categoryName": "Feu de position / d'encombrement / composants",
                  "level": 4,
                  "children": {
                    "Ligne de rattachement, feu latéral": {
                      "categoryId": 101785,
                      "categoryName": "Side Marker/End Outline Marker Light/Parts",
                      "level": 3,
                      "children": {
                        "Composants": {
                          "categoryId": null,
                          "categoryName": "Composants",
                          "level": 6,
                          "children": {
                            "Ligne de rattachement, feu latéral": {
                              "categoryId": 101790,
                              "categoryName": "Parts",
                              "level": 4,
                              "children": [],
                              "productId": 4676
                            }
                          }
                        }
                      },
                      "productId": 4676
                    }
                  }
                }
              },
              "productId": 4676
            },
            "Porte-lampe, feu de gabarit": {
              "categoryId": 101705,
              "categoryName": "Vehicle Rear",
              "level": 2,
              "children": {
                "Feu de position / d'encombrement / composants": {
                  "categoryId": null,
                  "categoryName": "Feu de position / d'encombrement / composants",
                  "level": 4,
                  "children": {
                    "Porte-lampe, feu de gabarit": {
                      "categoryId": 101785,
                      "categoryName": "Side Marker/End Outline Marker Light/Parts",
                      "level": 3,
                      "children": {
                        "Feu d'encombrement": {
                          "categoryId": null,
                          "categoryName": "Feu d'encombrement",
                          "level": 6,
                          "children": {
                            "Porte-lampe, feu de gabarit": {
                              "categoryId": 101787,
                              "categoryName": "End Outline Marker Light",
                              "level": 4,
                              "children": [],
                              "productId": 4158
                            }
                          }
                        }
                      },
                      "productId": 4158
                    }
                  }
                }
              },
              "productId": 4158
            },
            "Support de lampe, feu d'encombrement": {
              "categoryId": 101705,
              "categoryName": "Vehicle Rear",
              "level": 2,
              "children": {
                "Feu de position / d'encombrement / composants": {
                  "categoryId": null,
                  "categoryName": "Feu de position / d'encombrement / composants",
                  "level": 4,
                  "children": {
                    "Support de lampe, feu d'encombrement": {
                      "categoryId": 101785,
                      "categoryName": "Side Marker/End Outline Marker Light/Parts",
                      "level": 3,
                      "children": {
                        "Feu d'encombrement": {
                          "categoryId": null,
                          "categoryName": "Feu d'encombrement",
                          "level": 6,
                          "children": {
                            "Support de lampe, feu d'encombrement": {
                              "categoryId": 101787,
                              "categoryName": "End Outline Marker Light",
                              "level": 4,
                              "children": [],
                              "productId": 2086
                            }
                          }
                        }
                      },
                      "productId": 2086
                    }
                  }
                }
              },
              "productId": 2086
            }
          }
        },
        "Avant du véhicule": {
          "categoryId": null,
          "categoryName": "Avant du véhicule",
          "level": 2,
          "children": {
            "Ampoule, feu clignotant/feu-position avant": {
              "categoryId": 101648,
              "categoryName": "Vehicle Front",
              "level": 2,
              "children": {
                "Feu clignotant/composants": {
                  "categoryId": null,
                  "categoryName": "Feu clignotant/composants",
                  "level": 4,
                  "children": {
                    "Ampoule, feu clignotant/feu-position avant": {
                      "categoryId": 101669,
                      "categoryName": "Direction Indicator/Parts",
                      "level": 3,
                      "children": {
                        "Feu clignotant": {
                          "categoryId": null,
                          "categoryName": "Feu clignotant",
                          "level": 6,
                          "children": {
                            "Ampoule, feu clignotant/feu-position avant": {
                              "categoryId": 101670,
                              "categoryName": "Direction Indicator",
                              "level": 4,
                              "children": [],
                              "productId": 3193
                            }
                          }
                        }
                      },
                      "productId": 3193
                    }
                  }
                },
                "Feu de position / d'encombrement / composants": {
                  "categoryId": null,
                  "categoryName": "Feu de position / d'encombrement / composants",
                  "level": 4,
                  "children": {
                    "Ampoule, feu clignotant/feu-position avant": {
                      "categoryId": 101766,
                      "categoryName": "Side Marker/End Outline Marker Light/Parts",
                      "level": 3,
                      "children": {
                        "Feu d'encombrement": {
                          "categoryId": null,
                          "categoryName": "Feu d'encombrement",
                          "level": 6,
                          "children": {
                            "Ampoule, feu clignotant/feu-position avant": {
                              "categoryId": 101768,
                              "categoryName": "End Outline Marker Light",
                              "level": 4,
                              "children": [],
                              "productId": 3193
                            }
                          }
                        }
                      },
                      "productId": 3193
                    }
                  }
                }
              },
              "productId": 3193
            },
            "Ampoule, feu d'encombrement/de position": {
              "categoryId": 101648,
              "categoryName": "Vehicle Front",
              "level": 2,
              "children": {
                "Feu de position / d'encombrement / composants": {
                  "categoryId": null,
                  "categoryName": "Feu de position / d'encombrement / composants",
                  "level": 4,
                  "children": {
                    "Ampoule, feu d'encombrement/de position": {
                      "categoryId": 101766,
                      "categoryName": "Side Marker/End Outline Marker Light/Parts",
                      "level": 3,
                      "children": {
                        "Ampoule": {
                          "categoryId": null,
                          "categoryName": "Ampoule",
                          "level": 6,
                          "children": {
                            "Ampoule, feu d'encombrement/de position": {
                              "categoryId": 101770,
                              "categoryName": "Bulb",
                              "level": 4,
                              "children": [],
                              "productId": 1172
                            }
                          }
                        }
                      },
                      "productId": 1172
                    }
                  }
                }
              },
              "productId": 1172
            },
            "Ampoule, feu de position latéral": {
              "categoryId": 101648,
              "categoryName": "Vehicle Front",
              "level": 2,
              "children": {
                "Feu de position / d'encombrement / composants": {
                  "categoryId": null,
                  "categoryName": "Feu de position / d'encombrement / composants",
                  "level": 4,
                  "children": {
                    "Ampoule, feu de position latéral": {
                      "categoryId": 101766,
                      "categoryName": "Side Marker/End Outline Marker Light/Parts",
                      "level": 3,
                      "children": {
                        "Feux latéraux": {
                          "categoryId": null,
                          "categoryName": "Feux latéraux",
                          "level": 6,
                          "children": {
                            "Ampoule, feu de position latéral": {
                              "categoryId": 101769,
                              "categoryName": "Side Marker Lights",
                              "level": 4,
                              "children": [],
                              "productId": 60090
                            }
                          }
                        }
                      },
                      "productId": 60090
                    }
                  }
                }
              },
              "productId": 60090
            },
            "Ampoule, feu de position/d'encombrement": {
              "categoryId": 101648,
              "categoryName": "Vehicle Front",
              "level": 2,
              "children": {
                "Feu de position / d'encombrement / composants": {
                  "categoryId": null,
                  "categoryName": "Feu de position / d'encombrement / composants",
                  "level": 4,
                  "children": {
                    "Ampoule, feu de position/d'encombrement": {
                      "categoryId": 101766,
                      "categoryName": "Side Marker/End Outline Marker Light/Parts",
                      "level": 3,
                      "children": {
                        "Feu d'encombrement": {
                          "categoryId": null,
                          "categoryName": "Feu d'encombrement",
                          "level": 6,
                          "children": {
                            "Ampoule, feu de position/d'encombrement": {
                              "categoryId": 101768,
                              "categoryName": "End Outline Marker Light",
                              "level": 4,
                              "children": [],
                              "productId": 2126
                            }
                          }
                        },
                        "Feu de stationnement/de position": {
                          "categoryId": null,
                          "categoryName": "Feu de stationnement/de position",
                          "level": 6,
                          "children": {
                            "Ampoule, feu de position/d'encombrement": {
                              "categoryId": 101767,
                              "categoryName": "Park/Position Light",
                              "level": 4,
                              "children": [],
                              "productId": 2126
                            }
                          }
                        }
                      },
                      "productId": 2126
                    }
                  }
                }
              },
              "productId": 2126
            },
            "Ampoule, feu de stationnement/de position": {
              "categoryId": 101648,
              "categoryName": "Vehicle Front",
              "level": 2,
              "children": {
                "Projecteurs principaux / composants": {
                  "categoryId": null,
                  "categoryName": "Projecteurs principaux / composants",
                  "level": 4,
                  "children": {
                    "Ampoule, feu de stationnement/de position": {
                      "categoryId": 101656,
                      "categoryName": "Headlight/Parts",
                      "level": 3,
                      "children": {
                        "Ampoule pour projecteur principal": {
                          "categoryId": null,
                          "categoryName": "Ampoule pour projecteur principal",
                          "level": 6,
                          "children": {
                            "Ampoule, feu de stationnement/de position": {
                              "categoryId": 101658,
                              "categoryName": "Headlight Bulb",
                              "level": 4,
                              "children": [],
                              "productId": 1092
                            }
                          }
                        }
                      },
                      "productId": 1092
                    }
                  }
                }
              },
              "productId": 1092
            },
            "Boitier, feu de position": {
              "categoryId": 101648,
              "categoryName": "Vehicle Front",
              "level": 2,
              "children": {
                "Feu de position / d'encombrement / composants": {
                  "categoryId": null,
                  "categoryName": "Feu de position / d'encombrement / composants",
                  "level": 4,
                  "children": {
                    "Boitier, feu de position": {
                      "categoryId": 101766,
                      "categoryName": "Side Marker/End Outline Marker Light/Parts",
                      "level": 3,
                      "children": {
                        "Feu d'encombrement": {
                          "categoryId": null,
                          "categoryName": "Feu d'encombrement",
                          "level": 6,
                          "children": {
                            "Boitier, feu de position": {
                              "categoryId": 101768,
                              "categoryName": "End Outline Marker Light",
                              "level": 4,
                              "children": [],
                              "productId": 3828
                            }
                          }
                        }
                      },
                      "productId": 3828
                    }
                  }
                }
              },
              "productId": 3828
            },
            "Boîtier, feu latéral": {
              "categoryId": 101648,
              "categoryName": "Vehicle Front",
              "level": 2,
              "children": {
                "Feu de position / d'encombrement / composants": {
                  "categoryId": null,
                  "categoryName": "Feu de position / d'encombrement / composants",
                  "level": 4,
                  "children": {
                    "Boîtier, feu latéral": {
                      "categoryId": 101766,
                      "categoryName": "Side Marker/End Outline Marker Light/Parts",
                      "level": 3,
                      "children": {
                        "Feux latéraux": {
                          "categoryId": null,
                          "categoryName": "Feux latéraux",
                          "level": 6,
                          "children": {
                            "Boîtier, feu latéral": {
                              "categoryId": 101769,
                              "categoryName": "Side Marker Lights",
                              "level": 4,
                              "children": [],
                              "productId": 4726
                            }
                          }
                        }
                      },
                      "productId": 4726
                    }
                  }
                }
              },
              "productId": 4726
            },
            "Disperseur, feu d'encombrement": {
              "categoryId": 101648,
              "categoryName": "Vehicle Front",
              "level": 2,
              "children": {
                "Feu de position / d'encombrement / composants": {
                  "categoryId": null,
                  "categoryName": "Feu de position / d'encombrement / composants",
                  "level": 4,
                  "children": {
                    "Disperseur, feu d'encombrement": {
                      "categoryId": 101766,
                      "categoryName": "Side Marker/End Outline Marker Light/Parts",
                      "level": 3,
                      "children": {
                        "Composants": {
                          "categoryId": null,
                          "categoryName": "Composants",
                          "level": 6,
                          "children": {
                            "Disperseur, feu d'encombrement": {
                              "categoryId": 101771,
                              "categoryName": "Parts",
                              "level": 4,
                              "children": [],
                              "productId": 1175
                            }
                          }
                        }
                      },
                      "productId": 1175
                    }
                  }
                }
              },
              "productId": 1175
            },
            "Disperseur, feu de gabarit": {
              "categoryId": 101648,
              "categoryName": "Vehicle Front",
              "level": 2,
              "children": {
                "Feu de position / d'encombrement / composants": {
                  "categoryId": null,
                  "categoryName": "Feu de position / d'encombrement / composants",
                  "level": 4,
                  "children": {
                    "Disperseur, feu de gabarit": {
                      "categoryId": 101766,
                      "categoryName": "Side Marker/End Outline Marker Light/Parts",
                      "level": 3,
                      "children": {
                        "Feu d'encombrement": {
                          "categoryId": null,
                          "categoryName": "Feu d'encombrement",
                          "level": 6,
                          "children": {
                            "Disperseur, feu de gabarit": {
                              "categoryId": 101768,
                              "categoryName": "End Outline Marker Light",
                              "level": 4,
                              "children": [],
                              "productId": 3458
                            }
                          }
                        }
                      },
                      "productId": 3458
                    }
                  }
                }
              },
              "productId": 3458
            },
            "Disperseur, feu de position": {
              "categoryId": 101648,
              "categoryName": "Vehicle Front",
              "level": 2,
              "children": {
                "Feu de position / d'encombrement / composants": {
                  "categoryId": null,
                  "categoryName": "Feu de position / d'encombrement / composants",
                  "level": 4,
                  "children": {
                    "Disperseur, feu de position": {
                      "categoryId": 101766,
                      "categoryName": "Side Marker/End Outline Marker Light/Parts",
                      "level": 3,
                      "children": {
                        "Composants": {
                          "categoryId": null,
                          "categoryName": "Composants",
                          "level": 6,
                          "children": {
                            "Disperseur, feu de position": {
                              "categoryId": 101771,
                              "categoryName": "Parts",
                              "level": 4,
                              "children": [],
                              "productId": 1174
                            }
                          }
                        }
                      },
                      "productId": 1174
                    }
                  }
                }
              },
              "productId": 1174
            },
            "Disperseur, feu de stationnement": {
              "categoryId": 101648,
              "categoryName": "Vehicle Front",
              "level": 2,
              "children": {
                "Feu de position / d'encombrement / composants": {
                  "categoryId": null,
                  "categoryName": "Feu de position / d'encombrement / composants",
                  "level": 4,
                  "children": {
                    "Disperseur, feu de stationnement": {
                      "categoryId": 101766,
                      "categoryName": "Side Marker/End Outline Marker Light/Parts",
                      "level": 3,
                      "children": {
                        "Feu de stationnement/de position": {
                          "categoryId": null,
                          "categoryName": "Feu de stationnement/de position",
                          "level": 6,
                          "children": {
                            "Disperseur, feu de stationnement": {
                              "categoryId": 101767,
                              "categoryName": "Park/Position Light",
                              "level": 4,
                              "children": [],
                              "productId": 2547
                            }
                          }
                        }
                      },
                      "productId": 2547
                    }
                  }
                }
              },
              "productId": 2547
            },
            "Disperseur, feu latéral": {
              "categoryId": 101648,
              "categoryName": "Vehicle Front",
              "level": 2,
              "children": {
                "Feu de position / d'encombrement / composants": {
                  "categoryId": null,
                  "categoryName": "Feu de position / d'encombrement / composants",
                  "level": 4,
                  "children": {
                    "Disperseur, feu latéral": {
                      "categoryId": 101766,
                      "categoryName": "Side Marker/End Outline Marker Light/Parts",
                      "level": 3,
                      "children": {
                        "Feux latéraux": {
                          "categoryId": null,
                          "categoryName": "Feux latéraux",
                          "level": 6,
                          "children": {
                            "Disperseur, feu latéral": {
                              "categoryId": 101769,
                              "categoryName": "Side Marker Lights",
                              "level": 4,
                              "children": [],
                              "productId": 3451
                            }
                          }
                        }
                      },
                      "productId": 3451
                    }
                  }
                }
              },
              "productId": 3451
            },
            "Feu d'encombrement": {
              "categoryId": 101648,
              "categoryName": "Vehicle Front",
              "level": 2,
              "children": {
                "Feu de position / d'encombrement / composants": {
                  "categoryId": null,
                  "categoryName": "Feu de position / d'encombrement / composants",
                  "level": 4,
                  "children": {
                    "Feu d'encombrement": {
                      "categoryId": 101766,
                      "categoryName": "Side Marker/End Outline Marker Light/Parts",
                      "level": 3,
                      "children": {
                        "Feu d'encombrement": {
                          "categoryId": null,
                          "categoryName": "Feu d'encombrement",
                          "level": 6,
                          "children": {
                            "Feu d'encombrement": {
                              "categoryId": 101768,
                              "categoryName": "End Outline Marker Light",
                              "level": 4,
                              "children": [],
                              "productId": 1350
                            }
                          }
                        }
                      },
                      "productId": 1350
                    }
                  }
                }
              },
              "productId": 1350
            },
            "Feu de position": {
              "categoryId": 101648,
              "categoryName": "Vehicle Front",
              "level": 2,
              "children": {
                "Feu de position / d'encombrement / composants": {
                  "categoryId": null,
                  "categoryName": "Feu de position / d'encombrement / composants",
                  "level": 4,
                  "children": {
                    "Feu de position": {
                      "categoryId": 101766,
                      "categoryName": "Side Marker/End Outline Marker Light/Parts",
                      "level": 3,
                      "children": {
                        "Feu d'encombrement": {
                          "categoryId": null,
                          "categoryName": "Feu d'encombrement",
                          "level": 6,
                          "children": {
                            "Feu de position": {
                              "categoryId": 101768,
                              "categoryName": "End Outline Marker Light",
                              "level": 4,
                              "children": [],
                              "productId": 294
                            }
                          }
                        },
                        "Feu de stationnement/de position": {
                          "categoryId": null,
                          "categoryName": "Feu de stationnement/de position",
                          "level": 6,
                          "children": {
                            "Feu de position": {
                              "categoryId": 101767,
                              "categoryName": "Park/Position Light",
                              "level": 4,
                              "children": [],
                              "productId": 4858
                            }
                          }
                        }
                      },
                      "productId": 4858
                    }
                  }
                }
              },
              "productId": 4858
            },
            "Feu de stationnement": {
              "categoryId": 101648,
              "categoryName": "Vehicle Front",
              "level": 2,
              "children": {
                "Feu de position / d'encombrement / composants": {
                  "categoryId": null,
                  "categoryName": "Feu de position / d'encombrement / composants",
                  "level": 4,
                  "children": {
                    "Feu de stationnement": {
                      "categoryId": 101766,
                      "categoryName": "Side Marker/End Outline Marker Light/Parts",
                      "level": 3,
                      "children": {
                        "Feu de stationnement/de position": {
                          "categoryId": null,
                          "categoryName": "Feu de stationnement/de position",
                          "level": 6,
                          "children": {
                            "Feu de stationnement": {
                              "categoryId": 101767,
                              "categoryName": "Park/Position Light",
                              "level": 4,
                              "children": [],
                              "productId": 1173
                            }
                          }
                        }
                      },
                      "productId": 1173
                    }
                  }
                }
              },
              "productId": 1173
            },
            "Feu latéral": {
              "categoryId": 101648,
              "categoryName": "Vehicle Front",
              "level": 2,
              "children": {
                "Feu de position / d'encombrement / composants": {
                  "categoryId": null,
                  "categoryName": "Feu de position / d'encombrement / composants",
                  "level": 4,
                  "children": {
                    "Feu latéral": {
                      "categoryId": 101766,
                      "categoryName": "Side Marker/End Outline Marker Light/Parts",
                      "level": 3,
                      "children": {
                        "Feux latéraux": {
                          "categoryId": null,
                          "categoryName": "Feux latéraux",
                          "level": 6,
                          "children": {
                            "Feu latéral": {
                              "categoryId": 101769,
                              "categoryName": "Side Marker Lights",
                              "level": 4,
                              "children": [],
                              "productId": 900
                            }
                          }
                        }
                      },
                      "productId": 900
                    }
                  }
                }
              },
              "productId": 900
            },
            "Joint, feu d'encombrement": {
              "categoryId": 101648,
              "categoryName": "Vehicle Front",
              "level": 2,
              "children": {
                "Feu de position / d'encombrement / composants": {
                  "categoryId": null,
                  "categoryName": "Feu de position / d'encombrement / composants",
                  "level": 4,
                  "children": {
                    "Joint, feu d'encombrement": {
                      "categoryId": 101766,
                      "categoryName": "Side Marker/End Outline Marker Light/Parts",
                      "level": 3,
                      "children": {
                        "Composants": {
                          "categoryId": null,
                          "categoryName": "Composants",
                          "level": 6,
                          "children": {
                            "Joint, feu d'encombrement": {
                              "categoryId": 101771,
                              "categoryName": "Parts",
                              "level": 4,
                              "children": [],
                              "productId": 3122
                            }
                          }
                        }
                      },
                      "productId": 3122
                    }
                  }
                }
              },
              "productId": 3122
            },
            "Joint, feu de stationnement": {
              "categoryId": 101648,
              "categoryName": "Vehicle Front",
              "level": 2,
              "children": {
                "Feu de position / d'encombrement / composants": {
                  "categoryId": null,
                  "categoryName": "Feu de position / d'encombrement / composants",
                  "level": 4,
                  "children": {
                    "Joint, feu de stationnement": {
                      "categoryId": 101766,
                      "categoryName": "Side Marker/End Outline Marker Light/Parts",
                      "level": 3,
                      "children": {
                        "Composants": {
                          "categoryId": null,
                          "categoryName": "Composants",
                          "level": 6,
                          "children": {
                            "Joint, feu de stationnement": {
                              "categoryId": 101771,
                              "categoryName": "Parts",
                              "level": 4,
                              "children": [],
                              "productId": 3120
                            }
                          }
                        }
                      },
                      "productId": 3120
                    }
                  }
                }
              },
              "productId": 3120
            },
            "Kit raccords, feu latéral": {
              "categoryId": 101648,
              "categoryName": "Vehicle Front",
              "level": 2,
              "children": {
                "Feu de position / d'encombrement / composants": {
                  "categoryId": null,
                  "categoryName": "Feu de position / d'encombrement / composants",
                  "level": 4,
                  "children": {
                    "Kit raccords, feu latéral": {
                      "categoryId": 101766,
                      "categoryName": "Side Marker/End Outline Marker Light/Parts",
                      "level": 3,
                      "children": {
                        "Composants": {
                          "categoryId": null,
                          "categoryName": "Composants",
                          "level": 6,
                          "children": {
                            "Kit raccords, feu latéral": {
                              "categoryId": 101771,
                              "categoryName": "Parts",
                              "level": 4,
                              "children": [],
                              "productId": 4677
                            }
                          }
                        }
                      },
                      "productId": 4677
                    }
                  }
                }
              },
              "productId": 4677
            },
            "Kit réparation de câble, feu de position": {
              "categoryId": 101648,
              "categoryName": "Vehicle Front",
              "level": 2,
              "children": {
                "Feu de position / d'encombrement / composants": {
                  "categoryId": null,
                  "categoryName": "Feu de position / d'encombrement / composants",
                  "level": 4,
                  "children": {
                    "Kit réparation de câble, feu de position": {
                      "categoryId": 101766,
                      "categoryName": "Side Marker/End Outline Marker Light/Parts",
                      "level": 3,
                      "children": {
                        "Feu d'encombrement": {
                          "categoryId": null,
                          "categoryName": "Feu d'encombrement",
                          "level": 6,
                          "children": {
                            "Kit réparation de câble, feu de position": {
                              "categoryId": 101768,
                              "categoryName": "End Outline Marker Light",
                              "level": 4,
                              "children": [],
                              "productId": 6352
                            }
                          }
                        }
                      },
                      "productId": 6352
                    }
                  }
                }
              },
              "productId": 6352
            },
            "Ligne de rattachement, feu latéral": {
              "categoryId": 101648,
              "categoryName": "Vehicle Front",
              "level": 2,
              "children": {
                "Feu de position / d'encombrement / composants": {
                  "categoryId": null,
                  "categoryName": "Feu de position / d'encombrement / composants",
                  "level": 4,
                  "children": {
                    "Ligne de rattachement, feu latéral": {
                      "categoryId": 101766,
                      "categoryName": "Side Marker/End Outline Marker Light/Parts",
                      "level": 3,
                      "children": {
                        "Composants": {
                          "categoryId": null,
                          "categoryName": "Composants",
                          "level": 6,
                          "children": {
                            "Ligne de rattachement, feu latéral": {
                              "categoryId": 101771,
                              "categoryName": "Parts",
                              "level": 4,
                              "children": [],
                              "productId": 4676
                            }
                          }
                        }
                      },
                      "productId": 4676
                    }
                  }
                }
              },
              "productId": 4676
            },
            "Porte-lampe, feu de gabarit": {
              "categoryId": 101648,
              "categoryName": "Vehicle Front",
              "level": 2,
              "children": {
                "Feu de position / d'encombrement / composants": {
                  "categoryId": null,
                  "categoryName": "Feu de position / d'encombrement / composants",
                  "level": 4,
                  "children": {
                    "Porte-lampe, feu de gabarit": {
                      "categoryId": 101766,
                      "categoryName": "Side Marker/End Outline Marker Light/Parts",
                      "level": 3,
                      "children": {
                        "Feu d'encombrement": {
                          "categoryId": null,
                          "categoryName": "Feu d'encombrement",
                          "level": 6,
                          "children": {
                            "Porte-lampe, feu de gabarit": {
                              "categoryId": 101768,
                              "categoryName": "End Outline Marker Light",
                              "level": 4,
                              "children": [],
                              "productId": 4158
                            }
                          }
                        }
                      },
                      "productId": 4158
                    }
                  }
                }
              },
              "productId": 4158
            },
            "Support de lampe, feu d'encombrement": {
              "categoryId": 101648,
              "categoryName": "Vehicle Front",
              "level": 2,
              "children": {
                "Feu de position / d'encombrement / composants": {
                  "categoryId": null,
                  "categoryName": "Feu de position / d'encombrement / composants",
                  "level": 4,
                  "children": {
                    "Support de lampe, feu d'encombrement": {
                      "categoryId": 101766,
                      "categoryName": "Side Marker/End Outline Marker Light/Parts",
                      "level": 3,
                      "children": {
                        "Feu d'encombrement": {
                          "categoryId": null,
                          "categoryName": "Feu d'encombrement",
                          "level": 6,
                          "children": {
                            "Support de lampe, feu d'encombrement": {
                              "categoryId": 101768,
                              "categoryName": "End Outline Marker Light",
                              "level": 4,
                              "children": [],
                              "productId": 2086
                            }
                          }
                        }
                      },
                      "productId": 2086
                    }
                  }
                }
              },
              "productId": 2086
            }
          }
        },
        "Feux": {
          "categoryId": null,
          "categoryName": "Feux",
          "level": 2,
          "children": {
            "Ampoule, feu clignotant/feu-position avant": {
              "categoryId": 101407,
              "categoryName": "Lights",
              "level": 2,
              "children": {
                "Feu clignotant/composants": {
                  "categoryId": null,
                  "categoryName": "Feu clignotant/composants",
                  "level": 4,
                  "children": {
                    "Ampoule, feu clignotant/feu-position avant": {
                      "categoryId": 101420,
                      "categoryName": "Direction Indicator/Parts",
                      "level": 3,
                      "children": {
                        "Feu clignotant": {
                          "categoryId": null,
                          "categoryName": "Feu clignotant",
                          "level": 6,
                          "children": {
                            "Ampoule, feu clignotant/feu-position avant": {
                              "categoryId": 101421,
                              "categoryName": "Direction Indicator",
                              "level": 4,
                              "children": [],
                              "productId": 3193
                            }
                          }
                        }
                      },
                      "productId": 3193
                    }
                  }
                },
                "Feu de position / d'encombrement / composants": {
                  "categoryId": null,
                  "categoryName": "Feu de position / d'encombrement / composants",
                  "level": 4,
                  "children": {
                    "Ampoule, feu clignotant/feu-position avant": {
                      "categoryId": 101441,
                      "categoryName": "Side Marker/End Outline Marker Light/Parts",
                      "level": 3,
                      "children": {
                        "Feu d'encombrement": {
                          "categoryId": null,
                          "categoryName": "Feu d'encombrement",
                          "level": 6,
                          "children": {
                            "Ampoule, feu clignotant/feu-position avant": {
                              "categoryId": 101443,
                              "categoryName": "End Outline Marker Light",
                              "level": 4,
                              "children": [],
                              "productId": 3193
                            }
                          }
                        }
                      },
                      "productId": 3193
                    }
                  }
                }
              },
              "productId": 3193
            },
            "Ampoule, feu d'encombrement/de position": {
              "categoryId": 101407,
              "categoryName": "Lights",
              "level": 2,
              "children": {
                "Feu de position / d'encombrement / composants": {
                  "categoryId": null,
                  "categoryName": "Feu de position / d'encombrement / composants",
                  "level": 4,
                  "children": {
                    "Ampoule, feu d'encombrement/de position": {
                      "categoryId": 101441,
                      "categoryName": "Side Marker/End Outline Marker Light/Parts",
                      "level": 3,
                      "children": {
                        "Ampoule": {
                          "categoryId": null,
                          "categoryName": "Ampoule",
                          "level": 6,
                          "children": {
                            "Ampoule, feu d'encombrement/de position": {
                              "categoryId": 101445,
                              "categoryName": "Bulb",
                              "level": 4,
                              "children": [],
                              "productId": 1172
                            }
                          }
                        }
                      },
                      "productId": 1172
                    }
                  }
                }
              },
              "productId": 1172
            },
            "Ampoule, feu de position latéral": {
              "categoryId": 101407,
              "categoryName": "Lights",
              "level": 2,
              "children": {
                "Feu de position / d'encombrement / composants": {
                  "categoryId": null,
                  "categoryName": "Feu de position / d'encombrement / composants",
                  "level": 4,
                  "children": {
                    "Ampoule, feu de position latéral": {
                      "categoryId": 101441,
                      "categoryName": "Side Marker/End Outline Marker Light/Parts",
                      "level": 3,
                      "children": {
                        "Feux latéraux": {
                          "categoryId": null,
                          "categoryName": "Feux latéraux",
                          "level": 6,
                          "children": {
                            "Ampoule, feu de position latéral": {
                              "categoryId": 101444,
                              "categoryName": "Side Marker Lights",
                              "level": 4,
                              "children": [],
                              "productId": 60090
                            }
                          }
                        }
                      },
                      "productId": 60090
                    }
                  }
                }
              },
              "productId": 60090
            },
            "Ampoule, feu de position/d'encombrement": {
              "categoryId": 101407,
              "categoryName": "Lights",
              "level": 2,
              "children": {
                "Feu de position / d'encombrement / composants": {
                  "categoryId": null,
                  "categoryName": "Feu de position / d'encombrement / composants",
                  "level": 4,
                  "children": {
                    "Ampoule, feu de position/d'encombrement": {
                      "categoryId": 101441,
                      "categoryName": "Side Marker/End Outline Marker Light/Parts",
                      "level": 3,
                      "children": {
                        "Feu d'encombrement": {
                          "categoryId": null,
                          "categoryName": "Feu d'encombrement",
                          "level": 6,
                          "children": {
                            "Ampoule, feu de position/d'encombrement": {
                              "categoryId": 101443,
                              "categoryName": "End Outline Marker Light",
                              "level": 4,
                              "children": [],
                              "productId": 2126
                            }
                          }
                        },
                        "Feu de stationnement/de position": {
                          "categoryId": null,
                          "categoryName": "Feu de stationnement/de position",
                          "level": 6,
                          "children": {
                            "Ampoule, feu de position/d'encombrement": {
                              "categoryId": 101442,
                              "categoryName": "Park/Position Light",
                              "level": 4,
                              "children": [],
                              "productId": 2126
                            }
                          }
                        }
                      },
                      "productId": 2126
                    }
                  }
                }
              },
              "productId": 2126
            },
            "Boitier, feu de position": {
              "categoryId": 101407,
              "categoryName": "Lights",
              "level": 2,
              "children": {
                "Feu de position / d'encombrement / composants": {
                  "categoryId": null,
                  "categoryName": "Feu de position / d'encombrement / composants",
                  "level": 4,
                  "children": {
                    "Boitier, feu de position": {
                      "categoryId": 101441,
                      "categoryName": "Side Marker/End Outline Marker Light/Parts",
                      "level": 3,
                      "children": {
                        "Feu d'encombrement": {
                          "categoryId": null,
                          "categoryName": "Feu d'encombrement",
                          "level": 6,
                          "children": {
                            "Boitier, feu de position": {
                              "categoryId": 101443,
                              "categoryName": "End Outline Marker Light",
                              "level": 4,
                              "children": [],
                              "productId": 3828
                            }
                          }
                        }
                      },
                      "productId": 3828
                    }
                  }
                }
              },
              "productId": 3828
            },
            "Boîtier, feu latéral": {
              "categoryId": 101407,
              "categoryName": "Lights",
              "level": 2,
              "children": {
                "Feu de position / d'encombrement / composants": {
                  "categoryId": null,
                  "categoryName": "Feu de position / d'encombrement / composants",
                  "level": 4,
                  "children": {
                    "Boîtier, feu latéral": {
                      "categoryId": 101441,
                      "categoryName": "Side Marker/End Outline Marker Light/Parts",
                      "level": 3,
                      "children": {
                        "Feux latéraux": {
                          "categoryId": null,
                          "categoryName": "Feux latéraux",
                          "level": 6,
                          "children": {
                            "Boîtier, feu latéral": {
                              "categoryId": 101444,
                              "categoryName": "Side Marker Lights",
                              "level": 4,
                              "children": [],
                              "productId": 4726
                            }
                          }
                        }
                      },
                      "productId": 4726
                    }
                  }
                }
              },
              "productId": 4726
            },
            "Disperseur, feu d'encombrement": {
              "categoryId": 101407,
              "categoryName": "Lights",
              "level": 2,
              "children": {
                "Feu de position / d'encombrement / composants": {
                  "categoryId": null,
                  "categoryName": "Feu de position / d'encombrement / composants",
                  "level": 4,
                  "children": {
                    "Disperseur, feu d'encombrement": {
                      "categoryId": 101441,
                      "categoryName": "Side Marker/End Outline Marker Light/Parts",
                      "level": 3,
                      "children": {
                        "Composants": {
                          "categoryId": null,
                          "categoryName": "Composants",
                          "level": 6,
                          "children": {
                            "Disperseur, feu d'encombrement": {
                              "categoryId": 101446,
                              "categoryName": "Parts",
                              "level": 4,
                              "children": [],
                              "productId": 1175
                            }
                          }
                        }
                      },
                      "productId": 1175
                    }
                  }
                }
              },
              "productId": 1175
            },
            "Disperseur, feu de gabarit": {
              "categoryId": 101407,
              "categoryName": "Lights",
              "level": 2,
              "children": {
                "Feu de position / d'encombrement / composants": {
                  "categoryId": null,
                  "categoryName": "Feu de position / d'encombrement / composants",
                  "level": 4,
                  "children": {
                    "Disperseur, feu de gabarit": {
                      "categoryId": 101441,
                      "categoryName": "Side Marker/End Outline Marker Light/Parts",
                      "level": 3,
                      "children": {
                        "Feu d'encombrement": {
                          "categoryId": null,
                          "categoryName": "Feu d'encombrement",
                          "level": 6,
                          "children": {
                            "Disperseur, feu de gabarit": {
                              "categoryId": 101443,
                              "categoryName": "End Outline Marker Light",
                              "level": 4,
                              "children": [],
                              "productId": 3458
                            }
                          }
                        }
                      },
                      "productId": 3458
                    }
                  }
                }
              },
              "productId": 3458
            },
            "Disperseur, feu de position": {
              "categoryId": 101407,
              "categoryName": "Lights",
              "level": 2,
              "children": {
                "Feu de position / d'encombrement / composants": {
                  "categoryId": null,
                  "categoryName": "Feu de position / d'encombrement / composants",
                  "level": 4,
                  "children": {
                    "Disperseur, feu de position": {
                      "categoryId": 101441,
                      "categoryName": "Side Marker/End Outline Marker Light/Parts",
                      "level": 3,
                      "children": {
                        "Composants": {
                          "categoryId": null,
                          "categoryName": "Composants",
                          "level": 6,
                          "children": {
                            "Disperseur, feu de position": {
                              "categoryId": 101446,
                              "categoryName": "Parts",
                              "level": 4,
                              "children": [],
                              "productId": 1174
                            }
                          }
                        }
                      },
                      "productId": 1174
                    }
                  }
                }
              },
              "productId": 1174
            },
            "Disperseur, feu de stationnement": {
              "categoryId": 101407,
              "categoryName": "Lights",
              "level": 2,
              "children": {
                "Feu de position / d'encombrement / composants": {
                  "categoryId": null,
                  "categoryName": "Feu de position / d'encombrement / composants",
                  "level": 4,
                  "children": {
                    "Disperseur, feu de stationnement": {
                      "categoryId": 101441,
                      "categoryName": "Side Marker/End Outline Marker Light/Parts",
                      "level": 3,
                      "children": {
                        "Feu de stationnement/de position": {
                          "categoryId": null,
                          "categoryName": "Feu de stationnement/de position",
                          "level": 6,
                          "children": {
                            "Disperseur, feu de stationnement": {
                              "categoryId": 101442,
                              "categoryName": "Park/Position Light",
                              "level": 4,
                              "children": [],
                              "productId": 2547
                            }
                          }
                        }
                      },
                      "productId": 2547
                    }
                  }
                }
              },
              "productId": 2547
            },
            "Disperseur, feu latéral": {
              "categoryId": 101407,
              "categoryName": "Lights",
              "level": 2,
              "children": {
                "Feu de position / d'encombrement / composants": {
                  "categoryId": null,
                  "categoryName": "Feu de position / d'encombrement / composants",
                  "level": 4,
                  "children": {
                    "Disperseur, feu latéral": {
                      "categoryId": 101441,
                      "categoryName": "Side Marker/End Outline Marker Light/Parts",
                      "level": 3,
                      "children": {
                        "Feux latéraux": {
                          "categoryId": null,
                          "categoryName": "Feux latéraux",
                          "level": 6,
                          "children": {
                            "Disperseur, feu latéral": {
                              "categoryId": 101444,
                              "categoryName": "Side Marker Lights",
                              "level": 4,
                              "children": [],
                              "productId": 3451
                            }
                          }
                        }
                      },
                      "productId": 3451
                    }
                  }
                }
              },
              "productId": 3451
            },
            "Feu d'encombrement": {
              "categoryId": 101407,
              "categoryName": "Lights",
              "level": 2,
              "children": {
                "Feu de position / d'encombrement / composants": {
                  "categoryId": null,
                  "categoryName": "Feu de position / d'encombrement / composants",
                  "level": 4,
                  "children": {
                    "Feu d'encombrement": {
                      "categoryId": 101441,
                      "categoryName": "Side Marker/End Outline Marker Light/Parts",
                      "level": 3,
                      "children": {
                        "Feu d'encombrement": {
                          "categoryId": null,
                          "categoryName": "Feu d'encombrement",
                          "level": 6,
                          "children": {
                            "Feu d'encombrement": {
                              "categoryId": 101443,
                              "categoryName": "End Outline Marker Light",
                              "level": 4,
                              "children": [],
                              "productId": 1350
                            }
                          }
                        }
                      },
                      "productId": 1350
                    }
                  }
                }
              },
              "productId": 1350
            },
            "Feu de position": {
              "categoryId": 101407,
              "categoryName": "Lights",
              "level": 2,
              "children": {
                "Feu de position / d'encombrement / composants": {
                  "categoryId": null,
                  "categoryName": "Feu de position / d'encombrement / composants",
                  "level": 4,
                  "children": {
                    "Feu de position": {
                      "categoryId": 101441,
                      "categoryName": "Side Marker/End Outline Marker Light/Parts",
                      "level": 3,
                      "children": {
                        "Feu d'encombrement": {
                          "categoryId": null,
                          "categoryName": "Feu d'encombrement",
                          "level": 6,
                          "children": {
                            "Feu de position": {
                              "categoryId": 101443,
                              "categoryName": "End Outline Marker Light",
                              "level": 4,
                              "children": [],
                              "productId": 294
                            }
                          }
                        },
                        "Feu de stationnement/de position": {
                          "categoryId": null,
                          "categoryName": "Feu de stationnement/de position",
                          "level": 6,
                          "children": {
                            "Feu de position": {
                              "categoryId": 101442,
                              "categoryName": "Park/Position Light",
                              "level": 4,
                              "children": [],
                              "productId": 4858
                            }
                          }
                        }
                      },
                      "productId": 4858
                    }
                  }
                }
              },
              "productId": 4858
            },
            "Feu de stationnement": {
              "categoryId": 101407,
              "categoryName": "Lights",
              "level": 2,
              "children": {
                "Feu de position / d'encombrement / composants": {
                  "categoryId": null,
                  "categoryName": "Feu de position / d'encombrement / composants",
                  "level": 4,
                  "children": {
                    "Feu de stationnement": {
                      "categoryId": 101441,
                      "categoryName": "Side Marker/End Outline Marker Light/Parts",
                      "level": 3,
                      "children": {
                        "Feu de stationnement/de position": {
                          "categoryId": null,
                          "categoryName": "Feu de stationnement/de position",
                          "level": 6,
                          "children": {
                            "Feu de stationnement": {
                              "categoryId": 101442,
                              "categoryName": "Park/Position Light",
                              "level": 4,
                              "children": [],
                              "productId": 1173
                            }
                          }
                        }
                      },
                      "productId": 1173
                    }
                  }
                }
              },
              "productId": 1173
            },
            "Feu latéral": {
              "categoryId": 101407,
              "categoryName": "Lights",
              "level": 2,
              "children": {
                "Feu de position / d'encombrement / composants": {
                  "categoryId": null,
                  "categoryName": "Feu de position / d'encombrement / composants",
                  "level": 4,
                  "children": {
                    "Feu latéral": {
                      "categoryId": 101441,
                      "categoryName": "Side Marker/End Outline Marker Light/Parts",
                      "level": 3,
                      "children": {
                        "Feux latéraux": {
                          "categoryId": null,
                          "categoryName": "Feux latéraux",
                          "level": 6,
                          "children": {
                            "Feu latéral": {
                              "categoryId": 101444,
                              "categoryName": "Side Marker Lights",
                              "level": 4,
                              "children": [],
                              "productId": 900
                            }
                          }
                        }
                      },
                      "productId": 900
                    }
                  }
                }
              },
              "productId": 900
            },
            "Joint, feu d'encombrement": {
              "categoryId": 101407,
              "categoryName": "Lights",
              "level": 2,
              "children": {
                "Feu de position / d'encombrement / composants": {
                  "categoryId": null,
                  "categoryName": "Feu de position / d'encombrement / composants",
                  "level": 4,
                  "children": {
                    "Joint, feu d'encombrement": {
                      "categoryId": 101441,
                      "categoryName": "Side Marker/End Outline Marker Light/Parts",
                      "level": 3,
                      "children": {
                        "Composants": {
                          "categoryId": null,
                          "categoryName": "Composants",
                          "level": 6,
                          "children": {
                            "Joint, feu d'encombrement": {
                              "categoryId": 101446,
                              "categoryName": "Parts",
                              "level": 4,
                              "children": [],
                              "productId": 3122
                            }
                          }
                        }
                      },
                      "productId": 3122
                    }
                  }
                }
              },
              "productId": 3122
            },
            "Joint, feu de stationnement": {
              "categoryId": 101407,
              "categoryName": "Lights",
              "level": 2,
              "children": {
                "Feu de position / d'encombrement / composants": {
                  "categoryId": null,
                  "categoryName": "Feu de position / d'encombrement / composants",
                  "level": 4,
                  "children": {
                    "Joint, feu de stationnement": {
                      "categoryId": 101441,
                      "categoryName": "Side Marker/End Outline Marker Light/Parts",
                      "level": 3,
                      "children": {
                        "Composants": {
                          "categoryId": null,
                          "categoryName": "Composants",
                          "level": 6,
                          "children": {
                            "Joint, feu de stationnement": {
                              "categoryId": 101446,
                              "categoryName": "Parts",
                              "level": 4,
                              "children": [],
                              "productId": 3120
                            }
                          }
                        }
                      },
                      "productId": 3120
                    }
                  }
                }
              },
              "productId": 3120
            },
            "Kit raccords, feu latéral": {
              "categoryId": 101407,
              "categoryName": "Lights",
              "level": 2,
              "children": {
                "Feu de position / d'encombrement / composants": {
                  "categoryId": null,
                  "categoryName": "Feu de position / d'encombrement / composants",
                  "level": 4,
                  "children": {
                    "Kit raccords, feu latéral": {
                      "categoryId": 101441,
                      "categoryName": "Side Marker/End Outline Marker Light/Parts",
                      "level": 3,
                      "children": {
                        "Composants": {
                          "categoryId": null,
                          "categoryName": "Composants",
                          "level": 6,
                          "children": {
                            "Kit raccords, feu latéral": {
                              "categoryId": 101446,
                              "categoryName": "Parts",
                              "level": 4,
                              "children": [],
                              "productId": 4677
                            }
                          }
                        }
                      },
                      "productId": 4677
                    }
                  }
                }
              },
              "productId": 4677
            },
            "Kit réparation de câble, feu de position": {
              "categoryId": 101407,
              "categoryName": "Lights",
              "level": 2,
              "children": {
                "Feu de position / d'encombrement / composants": {
                  "categoryId": null,
                  "categoryName": "Feu de position / d'encombrement / composants",
                  "level": 4,
                  "children": {
                    "Kit réparation de câble, feu de position": {
                      "categoryId": 101441,
                      "categoryName": "Side Marker/End Outline Marker Light/Parts",
                      "level": 3,
                      "children": {
                        "Feu d'encombrement": {
                          "categoryId": null,
                          "categoryName": "Feu d'encombrement",
                          "level": 6,
                          "children": {
                            "Kit réparation de câble, feu de position": {
                              "categoryId": 101443,
                              "categoryName": "End Outline Marker Light",
                              "level": 4,
                              "children": [],
                              "productId": 6352
                            }
                          }
                        }
                      },
                      "productId": 6352
                    }
                  }
                }
              },
              "productId": 6352
            },
            "Ligne de rattachement, feu latéral": {
              "categoryId": 101407,
              "categoryName": "Lights",
              "level": 2,
              "children": {
                "Feu de position / d'encombrement / composants": {
                  "categoryId": null,
                  "categoryName": "Feu de position / d'encombrement / composants",
                  "level": 4,
                  "children": {
                    "Ligne de rattachement, feu latéral": {
                      "categoryId": 101441,
                      "categoryName": "Side Marker/End Outline Marker Light/Parts",
                      "level": 3,
                      "children": {
                        "Composants": {
                          "categoryId": null,
                          "categoryName": "Composants",
                          "level": 6,
                          "children": {
                            "Ligne de rattachement, feu latéral": {
                              "categoryId": 101446,
                              "categoryName": "Parts",
                              "level": 4,
                              "children": [],
                              "productId": 4676
                            }
                          }
                        }
                      },
                      "productId": 4676
                    }
                  }
                }
              },
              "productId": 4676
            },
            "Porte-lampe, feu de gabarit": {
              "categoryId": 101407,
              "categoryName": "Lights",
              "level": 2,
              "children": {
                "Feu de position / d'encombrement / composants": {
                  "categoryId": null,
                  "categoryName": "Feu de position / d'encombrement / composants",
                  "level": 4,
                  "children": {
                    "Porte-lampe, feu de gabarit": {
                      "categoryId": 101441,
                      "categoryName": "Side Marker/End Outline Marker Light/Parts",
                      "level": 3,
                      "children": {
                        "Feu d'encombrement": {
                          "categoryId": null,
                          "categoryName": "Feu d'encombrement",
                          "level": 6,
                          "children": {
                            "Porte-lampe, feu de gabarit": {
                              "categoryId": 101443,
                              "categoryName": "End Outline Marker Light",
                              "level": 4,
                              "children": [],
                              "productId": 4158
                            }
                          }
                        }
                      },
                      "productId": 4158
                    }
                  }
                }
              },
              "productId": 4158
            },
            "Support de lampe, feu d'encombrement": {
              "categoryId": 101407,
              "categoryName": "Lights",
              "level": 2,
              "children": {
                "Feu de position / d'encombrement / composants": {
                  "categoryId": null,
                  "categoryName": "Feu de position / d'encombrement / composants",
                  "level": 4,
                  "children": {
                    "Support de lampe, feu d'encombrement": {
                      "categoryId": 101441,
                      "categoryName": "Side Marker/End Outline Marker Light/Parts",
                      "level": 3,
                      "children": {
                        "Feu d'encombrement": {
                          "categoryId": null,
                          "categoryName": "Feu d'encombrement",
                          "level": 6,
                          "children": {
                            "Support de lampe, feu d'encombrement": {
                              "categoryId": 101443,
                              "categoryName": "End Outline Marker Light",
                              "level": 4,
                              "children": [],
                              "productId": 2086
                            }
                          }
                        }
                      },
                      "productId": 2086
                    }
                  }
                }
              },
              "productId": 2086
            }
          }
        },
        "Projecteurs principaux / composants": {
          "categoryId": null,
          "categoryName": "Projecteurs principaux / composants",
          "level": 2,
          "children": {
            "Ampoule, feu de stationnement/de position": {
              "categoryId": 101465,
              "categoryName": "Headlight/Parts",
              "level": 2,
              "children": {
                "Ampoule pour projecteur principal": {
                  "categoryId": null,
                  "categoryName": "Ampoule pour projecteur principal",
                  "level": 4,
                  "children": {
                    "Ampoule, feu de stationnement/de position": {
                      "categoryId": 101467,
                      "categoryName": "Headlight Bulb",
                      "level": 3,
                      "children": [],
                      "productId": 1092
                    }
                  }
                }
              },
              "productId": 1092
            }
          }
        }
      }
    },
    "Système électrique": {
      "categoryId": 100010,
      "categoryName": "Système électrique",
      "level": 1,
      "children": {
        "Feux": {
          "categoryId": null,
          "categoryName": "Feux",
          "level": 2,
          "children": {
            "Ampoule, feu clignotant/feu-position avant": {
              "categoryId": 100043,
              "categoryName": "Lights",
              "level": 2,
              "children": {
                "Feu clignotant/composants": {
                  "categoryId": null,
                  "categoryName": "Feu clignotant/composants",
                  "level": 4,
                  "children": {
                    "Ampoule, feu clignotant/feu-position avant": {
                      "categoryId": 100145,
                      "categoryName": "Direction Indicator/Parts",
                      "level": 3,
                      "children": {
                        "Feu clignotant": {
                          "categoryId": null,
                          "categoryName": "Feu clignotant",
                          "level": 6,
                          "children": {
                            "Ampoule, feu clignotant/feu-position avant": {
                              "categoryId": 100463,
                              "categoryName": "Direction Indicator",
                              "level": 4,
                              "children": [],
                              "productId": 3193
                            }
                          }
                        }
                      },
                      "productId": 3193
                    }
                  }
                },
                "Feu de position / d'encombrement / composants": {
                  "categoryId": null,
                  "categoryName": "Feu de position / d'encombrement / composants",
                  "level": 4,
                  "children": {
                    "Ampoule, feu clignotant/feu-position avant": {
                      "categoryId": 100290,
                      "categoryName": "Side Marker/End Outline Marker Light/Parts",
                      "level": 3,
                      "children": {
                        "Feu d'encombrement": {
                          "categoryId": null,
                          "categoryName": "Feu d'encombrement",
                          "level": 6,
                          "children": {
                            "Ampoule, feu clignotant/feu-position avant": {
                              "categoryId": 100469,
                              "categoryName": "End Outline Marker Light",
                              "level": 4,
                              "children": [],
                              "productId": 3193
                            }
                          }
                        }
                      },
                      "productId": 3193
                    }
                  }
                }
              },
              "productId": 3193
            },
            "Ampoule, feu d'encombrement/de position": {
              "categoryId": 100043,
              "categoryName": "Lights",
              "level": 2,
              "children": {
                "Feu de position / d'encombrement / composants": {
                  "categoryId": null,
                  "categoryName": "Feu de position / d'encombrement / composants",
                  "level": 4,
                  "children": {
                    "Ampoule, feu d'encombrement/de position": {
                      "categoryId": 100290,
                      "categoryName": "Side Marker/End Outline Marker Light/Parts",
                      "level": 3,
                      "children": {
                        "Ampoule": {
                          "categoryId": null,
                          "categoryName": "Ampoule",
                          "level": 6,
                          "children": {
                            "Ampoule, feu d'encombrement/de position": {
                              "categoryId": 100503,
                              "categoryName": "Bulb",
                              "level": 4,
                              "children": [],
                              "productId": 1172
                            }
                          }
                        }
                      },
                      "productId": 1172
                    }
                  }
                }
              },
              "productId": 1172
            },
            "Ampoule, feu de position latéral": {
              "categoryId": 100043,
              "categoryName": "Lights",
              "level": 2,
              "children": {
                "Feu de position / d'encombrement / composants": {
                  "categoryId": null,
                  "categoryName": "Feu de position / d'encombrement / composants",
                  "level": 4,
                  "children": {
                    "Ampoule, feu de position latéral": {
                      "categoryId": 100290,
                      "categoryName": "Side Marker/End Outline Marker Light/Parts",
                      "level": 3,
                      "children": {
                        "Feux latéraux": {
                          "categoryId": null,
                          "categoryName": "Feux latéraux",
                          "level": 6,
                          "children": {
                            "Ampoule, feu de position latéral": {
                              "categoryId": 100753,
                              "categoryName": "Side Marker Lights",
                              "level": 4,
                              "children": [],
                              "productId": 60090
                            }
                          }
                        }
                      },
                      "productId": 60090
                    }
                  }
                }
              },
              "productId": 60090
            },
            "Ampoule, feu de position/d'encombrement": {
              "categoryId": 100043,
              "categoryName": "Lights",
              "level": 2,
              "children": {
                "Feu de position / d'encombrement / composants": {
                  "categoryId": null,
                  "categoryName": "Feu de position / d'encombrement / composants",
                  "level": 4,
                  "children": {
                    "Ampoule, feu de position/d'encombrement": {
                      "categoryId": 100290,
                      "categoryName": "Side Marker/End Outline Marker Light/Parts",
                      "level": 3,
                      "children": {
                        "Feu d'encombrement": {
                          "categoryId": null,
                          "categoryName": "Feu d'encombrement",
                          "level": 6,
                          "children": {
                            "Ampoule, feu de position/d'encombrement": {
                              "categoryId": 100469,
                              "categoryName": "End Outline Marker Light",
                              "level": 4,
                              "children": [],
                              "productId": 2126
                            }
                          }
                        },
                        "Feu de stationnement/de position": {
                          "categoryId": null,
                          "categoryName": "Feu de stationnement/de position",
                          "level": 6,
                          "children": {
                            "Ampoule, feu de position/d'encombrement": {
                              "categoryId": 100468,
                              "categoryName": "Park/Position Light",
                              "level": 4,
                              "children": [],
                              "productId": 2126
                            }
                          }
                        }
                      },
                      "productId": 2126
                    }
                  }
                }
              },
              "productId": 2126
            },
            "Boitier, feu de position": {
              "categoryId": 100043,
              "categoryName": "Lights",
              "level": 2,
              "children": {
                "Feu de position / d'encombrement / composants": {
                  "categoryId": null,
                  "categoryName": "Feu de position / d'encombrement / composants",
                  "level": 4,
                  "children": {
                    "Boitier, feu de position": {
                      "categoryId": 100290,
                      "categoryName": "Side Marker/End Outline Marker Light/Parts",
                      "level": 3,
                      "children": {
                        "Feu d'encombrement": {
                          "categoryId": null,
                          "categoryName": "Feu d'encombrement",
                          "level": 6,
                          "children": {
                            "Boitier, feu de position": {
                              "categoryId": 100469,
                              "categoryName": "End Outline Marker Light",
                              "level": 4,
                              "children": [],
                              "productId": 3828
                            }
                          }
                        }
                      },
                      "productId": 3828
                    }
                  }
                }
              },
              "productId": 3828
            },
            "Boîtier, feu latéral": {
              "categoryId": 100043,
              "categoryName": "Lights",
              "level": 2,
              "children": {
                "Feu de position / d'encombrement / composants": {
                  "categoryId": null,
                  "categoryName": "Feu de position / d'encombrement / composants",
                  "level": 4,
                  "children": {
                    "Boîtier, feu latéral": {
                      "categoryId": 100290,
                      "categoryName": "Side Marker/End Outline Marker Light/Parts",
                      "level": 3,
                      "children": {
                        "Feux latéraux": {
                          "categoryId": null,
                          "categoryName": "Feux latéraux",
                          "level": 6,
                          "children": {
                            "Boîtier, feu latéral": {
                              "categoryId": 100753,
                              "categoryName": "Side Marker Lights",
                              "level": 4,
                              "children": [],
                              "productId": 4726
                            }
                          }
                        }
                      },
                      "productId": 4726
                    }
                  }
                }
              },
              "productId": 4726
            },
            "Disperseur, feu d'encombrement": {
              "categoryId": 100043,
              "categoryName": "Lights",
              "level": 2,
              "children": {
                "Feu de position / d'encombrement / composants": {
                  "categoryId": null,
                  "categoryName": "Feu de position / d'encombrement / composants",
                  "level": 4,
                  "children": {
                    "Disperseur, feu d'encombrement": {
                      "categoryId": 100290,
                      "categoryName": "Side Marker/End Outline Marker Light/Parts",
                      "level": 3,
                      "children": {
                        "Composants": {
                          "categoryId": null,
                          "categoryName": "Composants",
                          "level": 6,
                          "children": {
                            "Disperseur, feu d'encombrement": {
                              "categoryId": 100495,
                              "categoryName": "Parts",
                              "level": 4,
                              "children": [],
                              "productId": 1175
                            }
                          }
                        }
                      },
                      "productId": 1175
                    }
                  }
                }
              },
              "productId": 1175
            },
            "Disperseur, feu de gabarit": {
              "categoryId": 100043,
              "categoryName": "Lights",
              "level": 2,
              "children": {
                "Feu de position / d'encombrement / composants": {
                  "categoryId": null,
                  "categoryName": "Feu de position / d'encombrement / composants",
                  "level": 4,
                  "children": {
                    "Disperseur, feu de gabarit": {
                      "categoryId": 100290,
                      "categoryName": "Side Marker/End Outline Marker Light/Parts",
                      "level": 3,
                      "children": {
                        "Feu d'encombrement": {
                          "categoryId": null,
                          "categoryName": "Feu d'encombrement",
                          "level": 6,
                          "children": {
                            "Disperseur, feu de gabarit": {
                              "categoryId": 100469,
                              "categoryName": "End Outline Marker Light",
                              "level": 4,
                              "children": [],
                              "productId": 3458
                            }
                          }
                        }
                      },
                      "productId": 3458
                    }
                  }
                }
              },
              "productId": 3458
            },
            "Disperseur, feu de position": {
              "categoryId": 100043,
              "categoryName": "Lights",
              "level": 2,
              "children": {
                "Feu de position / d'encombrement / composants": {
                  "categoryId": null,
                  "categoryName": "Feu de position / d'encombrement / composants",
                  "level": 4,
                  "children": {
                    "Disperseur, feu de position": {
                      "categoryId": 100290,
                      "categoryName": "Side Marker/End Outline Marker Light/Parts",
                      "level": 3,
                      "children": {
                        "Composants": {
                          "categoryId": null,
                          "categoryName": "Composants",
                          "level": 6,
                          "children": {
                            "Disperseur, feu de position": {
                              "categoryId": 100495,
                              "categoryName": "Parts",
                              "level": 4,
                              "children": [],
                              "productId": 1174
                            }
                          }
                        }
                      },
                      "productId": 1174
                    }
                  }
                }
              },
              "productId": 1174
            },
            "Disperseur, feu de stationnement": {
              "categoryId": 100043,
              "categoryName": "Lights",
              "level": 2,
              "children": {
                "Feu de position / d'encombrement / composants": {
                  "categoryId": null,
                  "categoryName": "Feu de position / d'encombrement / composants",
                  "level": 4,
                  "children": {
                    "Disperseur, feu de stationnement": {
                      "categoryId": 100290,
                      "categoryName": "Side Marker/End Outline Marker Light/Parts",
                      "level": 3,
                      "children": {
                        "Feu de stationnement/de position": {
                          "categoryId": null,
                          "categoryName": "Feu de stationnement/de position",
                          "level": 6,
                          "children": {
                            "Disperseur, feu de stationnement": {
                              "categoryId": 100468,
                              "categoryName": "Park/Position Light",
                              "level": 4,
                              "children": [],
                              "productId": 2547
                            }
                          }
                        }
                      },
                      "productId": 2547
                    }
                  }
                }
              },
              "productId": 2547
            },
            "Disperseur, feu latéral": {
              "categoryId": 100043,
              "categoryName": "Lights",
              "level": 2,
              "children": {
                "Feu de position / d'encombrement / composants": {
                  "categoryId": null,
                  "categoryName": "Feu de position / d'encombrement / composants",
                  "level": 4,
                  "children": {
                    "Disperseur, feu latéral": {
                      "categoryId": 100290,
                      "categoryName": "Side Marker/End Outline Marker Light/Parts",
                      "level": 3,
                      "children": {
                        "Feux latéraux": {
                          "categoryId": null,
                          "categoryName": "Feux latéraux",
                          "level": 6,
                          "children": {
                            "Disperseur, feu latéral": {
                              "categoryId": 100753,
                              "categoryName": "Side Marker Lights",
                              "level": 4,
                              "children": [],
                              "productId": 3451
                            }
                          }
                        }
                      },
                      "productId": 3451
                    }
                  }
                }
              },
              "productId": 3451
            },
            "Douille de lampe, feu de stationnement/de position": {
              "categoryId": 100043,
              "categoryName": "Lights",
              "level": 2,
              "children": {
                "Feu de position / d'encombrement / composants": {
                  "categoryId": null,
                  "categoryName": "Feu de position / d'encombrement / composants",
                  "level": 4,
                  "children": {
                    "Douille de lampe, feu de stationnement/de position": {
                      "categoryId": 100290,
                      "categoryName": "Side Marker/End Outline Marker Light/Parts",
                      "level": 3,
                      "children": {
                        "Feu de stationnement/de position": {
                          "categoryId": null,
                          "categoryName": "Feu de stationnement/de position",
                          "level": 6,
                          "children": {
                            "Douille de lampe, feu de stationnement/de position": {
                              "categoryId": 100468,
                              "categoryName": "Park/Position Light",
                              "level": 4,
                              "children": [],
                              "productId": 8261
                            }
                          }
                        }
                      },
                      "productId": 8261
                    }
                  }
                }
              },
              "productId": 8261
            },
            "Élément, feu de position / de stationnement": {
              "categoryId": 100043,
              "categoryName": "Lights",
              "level": 2,
              "children": {
                "Feu de position / d'encombrement / composants": {
                  "categoryId": null,
                  "categoryName": "Feu de position / d'encombrement / composants",
                  "level": 4,
                  "children": {
                    "Élément, feu de position / de stationnement": {
                      "categoryId": 100290,
                      "categoryName": "Side Marker/End Outline Marker Light/Parts",
                      "level": 3,
                      "children": {
                        "Feu de stationnement/de position": {
                          "categoryId": null,
                          "categoryName": "Feu de stationnement/de position",
                          "level": 6,
                          "children": {
                            "Élément, feu de position / de stationnement": {
                              "categoryId": 100468,
                              "categoryName": "Park/Position Light",
                              "level": 4,
                              "children": [],
                              "productId": 5491
                            }
                          }
                        }
                      },
                      "productId": 5491
                    }
                  }
                }
              },
              "productId": 5491
            },
            "Feu d'encombrement": {
              "categoryId": 100043,
              "categoryName": "Lights",
              "level": 2,
              "children": {
                "Feu de position / d'encombrement / composants": {
                  "categoryId": null,
                  "categoryName": "Feu de position / d'encombrement / composants",
                  "level": 4,
                  "children": {
                    "Feu d'encombrement": {
                      "categoryId": 100290,
                      "categoryName": "Side Marker/End Outline Marker Light/Parts",
                      "level": 3,
                      "children": {
                        "Feu d'encombrement": {
                          "categoryId": null,
                          "categoryName": "Feu d'encombrement",
                          "level": 6,
                          "children": {
                            "Feu d'encombrement": {
                              "categoryId": 100469,
                              "categoryName": "End Outline Marker Light",
                              "level": 4,
                              "children": [],
                              "productId": 1350
                            }
                          }
                        }
                      },
                      "productId": 1350
                    }
                  }
                }
              },
              "productId": 1350
            },
            "Feu de position": {
              "categoryId": 100043,
              "categoryName": "Lights",
              "level": 2,
              "children": {
                "Feu de position / d'encombrement / composants": {
                  "categoryId": null,
                  "categoryName": "Feu de position / d'encombrement / composants",
                  "level": 4,
                  "children": {
                    "Feu de position": {
                      "categoryId": 100290,
                      "categoryName": "Side Marker/End Outline Marker Light/Parts",
                      "level": 3,
                      "children": {
                        "Feu d'encombrement": {
                          "categoryId": null,
                          "categoryName": "Feu d'encombrement",
                          "level": 6,
                          "children": {
                            "Feu de position": {
                              "categoryId": 100469,
                              "categoryName": "End Outline Marker Light",
                              "level": 4,
                              "children": [],
                              "productId": 294
                            }
                          }
                        },
                        "Feu de stationnement/de position": {
                          "categoryId": null,
                          "categoryName": "Feu de stationnement/de position",
                          "level": 6,
                          "children": {
                            "Feu de position": {
                              "categoryId": 100468,
                              "categoryName": "Park/Position Light",
                              "level": 4,
                              "children": [],
                              "productId": 4858
                            }
                          }
                        }
                      },
                      "productId": 4858
                    }
                  }
                }
              },
              "productId": 4858
            },
            "Feu de stationnement": {
              "categoryId": 100043,
              "categoryName": "Lights",
              "level": 2,
              "children": {
                "Feu de position / d'encombrement / composants": {
                  "categoryId": null,
                  "categoryName": "Feu de position / d'encombrement / composants",
                  "level": 4,
                  "children": {
                    "Feu de stationnement": {
                      "categoryId": 100290,
                      "categoryName": "Side Marker/End Outline Marker Light/Parts",
                      "level": 3,
                      "children": {
                        "Feu de stationnement/de position": {
                          "categoryId": null,
                          "categoryName": "Feu de stationnement/de position",
                          "level": 6,
                          "children": {
                            "Feu de stationnement": {
                              "categoryId": 100468,
                              "categoryName": "Park/Position Light",
                              "level": 4,
                              "children": [],
                              "productId": 1173
                            }
                          }
                        }
                      },
                      "productId": 1173
                    }
                  }
                }
              },
              "productId": 1173
            },
            "Feu latéral": {
              "categoryId": 100043,
              "categoryName": "Lights",
              "level": 2,
              "children": {
                "Feu de position / d'encombrement / composants": {
                  "categoryId": null,
                  "categoryName": "Feu de position / d'encombrement / composants",
                  "level": 4,
                  "children": {
                    "Feu latéral": {
                      "categoryId": 100290,
                      "categoryName": "Side Marker/End Outline Marker Light/Parts",
                      "level": 3,
                      "children": {
                        "Feux latéraux": {
                          "categoryId": null,
                          "categoryName": "Feux latéraux",
                          "level": 6,
                          "children": {
                            "Feu latéral": {
                              "categoryId": 100753,
                              "categoryName": "Side Marker Lights",
                              "level": 4,
                              "children": [],
                              "productId": 900
                            }
                          }
                        }
                      },
                      "productId": 900
                    }
                  }
                }
              },
              "productId": 900
            },
            "Joint, feu d'encombrement": {
              "categoryId": 100043,
              "categoryName": "Lights",
              "level": 2,
              "children": {
                "Feu de position / d'encombrement / composants": {
                  "categoryId": null,
                  "categoryName": "Feu de position / d'encombrement / composants",
                  "level": 4,
                  "children": {
                    "Joint, feu d'encombrement": {
                      "categoryId": 100290,
                      "categoryName": "Side Marker/End Outline Marker Light/Parts",
                      "level": 3,
                      "children": {
                        "Composants": {
                          "categoryId": null,
                          "categoryName": "Composants",
                          "level": 6,
                          "children": {
                            "Joint, feu d'encombrement": {
                              "categoryId": 100495,
                              "categoryName": "Parts",
                              "level": 4,
                              "children": [],
                              "productId": 3122
                            }
                          }
                        }
                      },
                      "productId": 3122
                    }
                  }
                }
              },
              "productId": 3122
            },
            "Joint, feu de stationnement": {
              "categoryId": 100043,
              "categoryName": "Lights",
              "level": 2,
              "children": {
                "Feu de position / d'encombrement / composants": {
                  "categoryId": null,
                  "categoryName": "Feu de position / d'encombrement / composants",
                  "level": 4,
                  "children": {
                    "Joint, feu de stationnement": {
                      "categoryId": 100290,
                      "categoryName": "Side Marker/End Outline Marker Light/Parts",
                      "level": 3,
                      "children": {
                        "Composants": {
                          "categoryId": null,
                          "categoryName": "Composants",
                          "level": 6,
                          "children": {
                            "Joint, feu de stationnement": {
                              "categoryId": 100495,
                              "categoryName": "Parts",
                              "level": 4,
                              "children": [],
                              "productId": 3120
                            }
                          }
                        }
                      },
                      "productId": 3120
                    }
                  }
                }
              },
              "productId": 3120
            },
            "Kit raccords, feu latéral": {
              "categoryId": 100043,
              "categoryName": "Lights",
              "level": 2,
              "children": {
                "Feu de position / d'encombrement / composants": {
                  "categoryId": null,
                  "categoryName": "Feu de position / d'encombrement / composants",
                  "level": 4,
                  "children": {
                    "Kit raccords, feu latéral": {
                      "categoryId": 100290,
                      "categoryName": "Side Marker/End Outline Marker Light/Parts",
                      "level": 3,
                      "children": {
                        "Composants": {
                          "categoryId": null,
                          "categoryName": "Composants",
                          "level": 6,
                          "children": {
                            "Kit raccords, feu latéral": {
                              "categoryId": 100495,
                              "categoryName": "Parts",
                              "level": 4,
                              "children": [],
                              "productId": 4677
                            }
                          }
                        }
                      },
                      "productId": 4677
                    }
                  }
                }
              },
              "productId": 4677
            },
            "Kit réparation de câble, feu de position": {
              "categoryId": 100043,
              "categoryName": "Lights",
              "level": 2,
              "children": {
                "Feu de position / d'encombrement / composants": {
                  "categoryId": null,
                  "categoryName": "Feu de position / d'encombrement / composants",
                  "level": 4,
                  "children": {
                    "Kit réparation de câble, feu de position": {
                      "categoryId": 100290,
                      "categoryName": "Side Marker/End Outline Marker Light/Parts",
                      "level": 3,
                      "children": {
                        "Feu d'encombrement": {
                          "categoryId": null,
                          "categoryName": "Feu d'encombrement",
                          "level": 6,
                          "children": {
                            "Kit réparation de câble, feu de position": {
                              "categoryId": 100469,
                              "categoryName": "End Outline Marker Light",
                              "level": 4,
                              "children": [],
                              "productId": 6352
                            }
                          }
                        }
                      },
                      "productId": 6352
                    }
                  }
                }
              },
              "productId": 6352
            },
            "Kit réparation de câble, feu latéral": {
              "categoryId": 100043,
              "categoryName": "Lights",
              "level": 2,
              "children": {
                "Feu de position / d'encombrement / composants": {
                  "categoryId": null,
                  "categoryName": "Feu de position / d'encombrement / composants",
                  "level": 4,
                  "children": {
                    "Kit réparation de câble, feu latéral": {
                      "categoryId": 100290,
                      "categoryName": "Side Marker/End Outline Marker Light/Parts",
                      "level": 3,
                      "children": {
                        "Feux latéraux": {
                          "categoryId": null,
                          "categoryName": "Feux latéraux",
                          "level": 6,
                          "children": {
                            "Kit réparation de câble, feu latéral": {
                              "categoryId": 100753,
                              "categoryName": "Side Marker Lights",
                              "level": 4,
                              "children": [],
                              "productId": 6345
                            }
                          }
                        }
                      },
                      "productId": 6345
                    }
                  }
                }
              },
              "productId": 6345
            },
            "Ligne de rattachement, feu latéral": {
              "categoryId": 100043,
              "categoryName": "Lights",
              "level": 2,
              "children": {
                "Feu de position / d'encombrement / composants": {
                  "categoryId": null,
                  "categoryName": "Feu de position / d'encombrement / composants",
                  "level": 4,
                  "children": {
                    "Ligne de rattachement, feu latéral": {
                      "categoryId": 100290,
                      "categoryName": "Side Marker/End Outline Marker Light/Parts",
                      "level": 3,
                      "children": {
                        "Composants": {
                          "categoryId": null,
                          "categoryName": "Composants",
                          "level": 6,
                          "children": {
                            "Ligne de rattachement, feu latéral": {
                              "categoryId": 100495,
                              "categoryName": "Parts",
                              "level": 4,
                              "children": [],
                              "productId": 4676
                            }
                          }
                        }
                      },
                      "productId": 4676
                    }
                  }
                }
              },
              "productId": 4676
            },
            "Porte-lampe, feu de gabarit": {
              "categoryId": 100043,
              "categoryName": "Lights",
              "level": 2,
              "children": {
                "Feu de position / d'encombrement / composants": {
                  "categoryId": null,
                  "categoryName": "Feu de position / d'encombrement / composants",
                  "level": 4,
                  "children": {
                    "Porte-lampe, feu de gabarit": {
                      "categoryId": 100290,
                      "categoryName": "Side Marker/End Outline Marker Light/Parts",
                      "level": 3,
                      "children": {
                        "Feu d'encombrement": {
                          "categoryId": null,
                          "categoryName": "Feu d'encombrement",
                          "level": 6,
                          "children": {
                            "Porte-lampe, feu de gabarit": {
                              "categoryId": 100469,
                              "categoryName": "End Outline Marker Light",
                              "level": 4,
                              "children": [],
                              "productId": 4158
                            }
                          }
                        }
                      },
                      "productId": 4158
                    }
                  }
                }
              },
              "productId": 4158
            },
            "Porte-lampe, feu latéral": {
              "categoryId": 100043,
              "categoryName": "Lights",
              "level": 2,
              "children": {
                "Feu de position / d'encombrement / composants": {
                  "categoryId": null,
                  "categoryName": "Feu de position / d'encombrement / composants",
                  "level": 4,
                  "children": {
                    "Porte-lampe, feu latéral": {
                      "categoryId": 100290,
                      "categoryName": "Side Marker/End Outline Marker Light/Parts",
                      "level": 3,
                      "children": {
                        "Feux latéraux": {
                          "categoryId": null,
                          "categoryName": "Feux latéraux",
                          "level": 6,
                          "children": {
                            "Porte-lampe, feu latéral": {
                              "categoryId": 100753,
                              "categoryName": "Side Marker Lights",
                              "level": 4,
                              "children": [],
                              "productId": 4154
                            }
                          }
                        }
                      },
                      "productId": 4154
                    }
                  }
                }
              },
              "productId": 4154
            },
            "Relais, feu de stationnement": {
              "categoryId": 100043,
              "categoryName": "Lights",
              "level": 2,
              "children": {
                "Feu de position / d'encombrement / composants": {
                  "categoryId": null,
                  "categoryName": "Feu de position / d'encombrement / composants",
                  "level": 4,
                  "children": {
                    "Relais, feu de stationnement": {
                      "categoryId": 100290,
                      "categoryName": "Side Marker/End Outline Marker Light/Parts",
                      "level": 3,
                      "children": {
                        "Composants": {
                          "categoryId": null,
                          "categoryName": "Composants",
                          "level": 6,
                          "children": {
                            "Relais, feu de stationnement": {
                              "categoryId": 100495,
                              "categoryName": "Parts",
                              "level": 4,
                              "children": [],
                              "productId": 8993
                            }
                          }
                        },
                        "Feu de stationnement/de position": {
                          "categoryId": null,
                          "categoryName": "Feu de stationnement/de position",
                          "level": 6,
                          "children": {
                            "Relais, feu de stationnement": {
                              "categoryId": 100468,
                              "categoryName": "Park/Position Light",
                              "level": 4,
                              "children": [],
                              "productId": 8993
                            }
                          }
                        }
                      },
                      "productId": 8993
                    }
                  }
                }
              },
              "productId": 8993
            },
            "Support de lampe, feu d'encombrement": {
              "categoryId": 100043,
              "categoryName": "Lights",
              "level": 2,
              "children": {
                "Feu de position / d'encombrement / composants": {
                  "categoryId": null,
                  "categoryName": "Feu de position / d'encombrement / composants",
                  "level": 4,
                  "children": {
                    "Support de lampe, feu d'encombrement": {
                      "categoryId": 100290,
                      "categoryName": "Side Marker/End Outline Marker Light/Parts",
                      "level": 3,
                      "children": {
                        "Feu d'encombrement": {
                          "categoryId": null,
                          "categoryName": "Feu d'encombrement",
                          "level": 6,
                          "children": {
                            "Support de lampe, feu d'encombrement": {
                              "categoryId": 100469,
                              "categoryName": "End Outline Marker Light",
                              "level": 4,
                              "children": [],
                              "productId": 2086
                            }
                          }
                        }
                      },
                      "productId": 2086
                    }
                  }
                }
              },
              "productId": 2086
            },
            "Support, feu latéral": {
              "categoryId": 100043,
              "categoryName": "Lights",
              "level": 2,
              "children": {
                "Feu de position / d'encombrement / composants": {
                  "categoryId": null,
                  "categoryName": "Feu de position / d'encombrement / composants",
                  "level": 4,
                  "children": {
                    "Support, feu latéral": {
                      "categoryId": 100290,
                      "categoryName": "Side Marker/End Outline Marker Light/Parts",
                      "level": 3,
                      "children": {
                        "Composants": {
                          "categoryId": null,
                          "categoryName": "Composants",
                          "level": 6,
                          "children": {
                            "Support, feu latéral": {
                              "categoryId": 100495,
                              "categoryName": "Parts",
                              "level": 4,
                              "children": [],
                              "productId": 7995
                            }
                          }
                        }
                      },
                      "productId": 7995
                    }
                  }
                }
              },
              "productId": 7995
            }
          }
        },
        "Projecteurs principaux / composants": {
          "categoryId": null,
          "categoryName": "Projecteurs principaux / composants",
          "level": 2,
          "children": {
            "Ampoule, feu de stationnement/de position": {
              "categoryId": 100143,
              "categoryName": "Headlight/Parts",
              "level": 2,
              "children": {
                "Ampoule pour projecteur principal": {
                  "categoryId": null,
                  "categoryName": "Ampoule pour projecteur principal",
                  "level": 4,
                  "children": {
                    "Ampoule, feu de stationnement/de position": {
                      "categoryId": 100427,
                      "categoryName": "Headlight Bulb",
                      "level": 3,
                      "children": [],
                      "productId": 1092
                    }
                  }
                }
              },
              "productId": 1092
            }
          }
        },
        "Relais": {
          "categoryId": null,
          "categoryName": "Relais",
          "level": 2,
          "children": {
            "Relais, feu de stationnement": {
              "categoryId": 100785,
              "categoryName": "Relay",
              "level": 2,
              "children": [],
              "productId": 8993
            }
          }
        }
      }
    }
  },
  "arborescenceText": "├── Carrosserie [ID: 100001] (Niveau 1)\n│   ├── Arrière de la voiture (Niveau 2)\n│   │   ├── Vehicle Rear [ID: 101705] (Niveau 2) → ProductId: 3193\n│   │   │   ├── Feu clignotant/composants (Niveau 4)\n│   │   │   │   └── Direction Indicator/Parts [ID: 101727] (Niveau 3) → ProductId: 3193\n│   │   │   │       └── Feu clignotant (Niveau 6)\n│   │   │   │           └── Direction Indicator [ID: 101728] (Niveau 4) → ProductId: 3193\n│   │   │   └── Feu de position / d'encombrement / composants (Niveau 4)\n│   │   │       └── Side Marker/End Outline Marker Light/Parts [ID: 101785] (Niveau 3) → ProductId: 3193\n│   │   │           └── Feu d'encombrement (Niveau 6)\n│   │   │               └── End Outline Marker Light [ID: 101787] (Niveau 4) → ProductId: 3193\n│   │   ├── Vehicle Rear [ID: 101705] (Niveau 2) → ProductId: 1172\n│   │   │   └── Feu de position / d'encombrement / composants (Niveau 4)\n│   │   │       └── Side Marker/End Outline Marker Light/Parts [ID: 101785] (Niveau 3) → ProductId: 1172\n│   │   │           └── Ampoule (Niveau 6)\n│   │   │               └── Bulb [ID: 101789] (Niveau 4) → ProductId: 1172\n│   │   ├── Vehicle Rear [ID: 101705] (Niveau 2) → ProductId: 60090\n│   │   │   └── Feu de position / d'encombrement / composants (Niveau 4)\n│   │   │       └── Side Marker/End Outline Marker Light/Parts [ID: 101785] (Niveau 3) → ProductId: 60090\n│   │   │           └── Feux latéraux (Niveau 6)\n│   │   │               └── Side Marker Lights [ID: 101788] (Niveau 4) → ProductId: 60090\n│   │   ├── Vehicle Rear [ID: 101705] (Niveau 2) → ProductId: 2126\n│   │   │   └── Feu de position / d'encombrement / composants (Niveau 4)\n│   │   │       └── Side Marker/End Outline Marker Light/Parts [ID: 101785] (Niveau 3) → ProductId: 2126\n│   │   │           ├── Feu d'encombrement (Niveau 6)\n│   │   │           │   └── End Outline Marker Light [ID: 101787] (Niveau 4) → ProductId: 2126\n│   │   │           └── Feu de stationnement/de position (Niveau 6)\n│   │   │               └── Park/Position Light [ID: 101786] (Niveau 4) → ProductId: 2126\n│   │   ├── Vehicle Rear [ID: 101705] (Niveau 2) → ProductId: 3828\n│   │   │   └── Feu de position / d'encombrement / composants (Niveau 4)\n│   │   │       └── Side Marker/End Outline Marker Light/Parts [ID: 101785] (Niveau 3) → ProductId: 3828\n│   │   │           └── Feu d'encombrement (Niveau 6)\n│   │   │               └── End Outline Marker Light [ID: 101787] (Niveau 4) → ProductId: 3828\n│   │   ├── Vehicle Rear [ID: 101705] (Niveau 2) → ProductId: 4726\n│   │   │   └── Feu de position / d'encombrement / composants (Niveau 4)\n│   │   │       └── Side Marker/End Outline Marker Light/Parts [ID: 101785] (Niveau 3) → ProductId: 4726\n│   │   │           └── Feux latéraux (Niveau 6)\n│   │   │               └── Side Marker Lights [ID: 101788] (Niveau 4) → ProductId: 4726\n│   │   ├── Vehicle Rear [ID: 101705] (Niveau 2) → ProductId: 1175\n│   │   │   └── Feu de position / d'encombrement / composants (Niveau 4)\n│   │   │       └── Side Marker/End Outline Marker Light/Parts [ID: 101785] (Niveau 3) → ProductId: 1175\n│   │   │           └── Composants (Niveau 6)\n│   │   │               └── Parts [ID: 101790] (Niveau 4) → ProductId: 1175\n│   │   ├── Vehicle Rear [ID: 101705] (Niveau 2) → ProductId: 3458\n│   │   │   └── Feu de position / d'encombrement / composants (Niveau 4)\n│   │   │       └── Side Marker/End Outline Marker Light/Parts [ID: 101785] (Niveau 3) → ProductId: 3458\n│   │   │           └── Feu d'encombrement (Niveau 6)\n│   │   │               └── End Outline Marker Light [ID: 101787] (Niveau 4) → ProductId: 3458\n│   │   ├── Vehicle Rear [ID: 101705] (Niveau 2) → ProductId: 1174\n│   │   │   └── Feu de position / d'encombrement / composants (Niveau 4)\n│   │   │       └── Side Marker/End Outline Marker Light/Parts [ID: 101785] (Niveau 3) → ProductId: 1174\n│   │   │           └── Composants (Niveau 6)\n│   │   │               └── Parts [ID: 101790] (Niveau 4) → ProductId: 1174\n│   │   ├── Vehicle Rear [ID: 101705] (Niveau 2) → ProductId: 2547\n│   │   │   └── Feu de position / d'encombrement / composants (Niveau 4)\n│   │   │       └── Side Marker/End Outline Marker Light/Parts [ID: 101785] (Niveau 3) → ProductId: 2547\n│   │   │           └── Feu de stationnement/de position (Niveau 6)\n│   │   │               └── Park/Position Light [ID: 101786] (Niveau 4) → ProductId: 2547\n│   │   ├── Vehicle Rear [ID: 101705] (Niveau 2) → ProductId: 3451\n│   │   │   └── Feu de position / d'encombrement / composants (Niveau 4)\n│   │   │       └── Side Marker/End Outline Marker Light/Parts [ID: 101785] (Niveau 3) → ProductId: 3451\n│   │   │           └── Feux latéraux (Niveau 6)\n│   │   │               └── Side Marker Lights [ID: 101788] (Niveau 4) → ProductId: 3451\n│   │   ├── Vehicle Rear [ID: 101705] (Niveau 2) → ProductId: 1350\n│   │   │   └── Feu de position / d'encombrement / composants (Niveau 4)\n│   │   │       └── Side Marker/End Outline Marker Light/Parts [ID: 101785] (Niveau 3) → ProductId: 1350\n│   │   │           └── Feu d'encombrement (Niveau 6)\n│   │   │               └── End Outline Marker Light [ID: 101787] (Niveau 4) → ProductId: 1350\n│   │   ├── Vehicle Rear [ID: 101705] (Niveau 2) → ProductId: 4858\n│   │   │   └── Feu de position / d'encombrement / composants (Niveau 4)\n│   │   │       └── Side Marker/End Outline Marker Light/Parts [ID: 101785] (Niveau 3) → ProductId: 4858\n│   │   │           ├── Feu d'encombrement (Niveau 6)\n│   │   │           │   └── End Outline Marker Light [ID: 101787] (Niveau 4) → ProductId: 294\n│   │   │           └── Feu de stationnement/de position (Niveau 6)\n│   │   │               └── Park/Position Light [ID: 101786] (Niveau 4) → ProductId: 4858\n│   │   ├── Vehicle Rear [ID: 101705] (Niveau 2) → ProductId: 1173\n│   │   │   └── Feu de position / d'encombrement / composants (Niveau 4)\n│   │   │       └── Side Marker/End Outline Marker Light/Parts [ID: 101785] (Niveau 3) → ProductId: 1173\n│   │   │           └── Feu de stationnement/de position (Niveau 6)\n│   │   │               └── Park/Position Light [ID: 101786] (Niveau 4) → ProductId: 1173\n│   │   ├── Vehicle Rear [ID: 101705] (Niveau 2) → ProductId: 900\n│   │   │   └── Feu de position / d'encombrement / composants (Niveau 4)\n│   │   │       └── Side Marker/End Outline Marker Light/Parts [ID: 101785] (Niveau 3) → ProductId: 900\n│   │   │           └── Feux latéraux (Niveau 6)\n│   │   │               └── Side Marker Lights [ID: 101788] (Niveau 4) → ProductId: 900\n│   │   ├── Vehicle Rear [ID: 101705] (Niveau 2) → ProductId: 3122\n│   │   │   └── Feu de position / d'encombrement / composants (Niveau 4)\n│   │   │       └── Side Marker/End Outline Marker Light/Parts [ID: 101785] (Niveau 3) → ProductId: 3122\n│   │   │           └── Composants (Niveau 6)\n│   │   │               └── Parts [ID: 101790] (Niveau 4) → ProductId: 3122\n│   │   ├── Vehicle Rear [ID: 101705] (Niveau 2) → ProductId: 3120\n│   │   │   └── Feu de position / d'encombrement / composants (Niveau 4)\n│   │   │       └── Side Marker/End Outline Marker Light/Parts [ID: 101785] (Niveau 3) → ProductId: 3120\n│   │   │           └── Composants (Niveau 6)\n│   │   │               └── Parts [ID: 101790] (Niveau 4) → ProductId: 3120\n│   │   ├── Vehicle Rear [ID: 101705] (Niveau 2) → ProductId: 4677\n│   │   │   └── Feu de position / d'encombrement / composants (Niveau 4)\n│   │   │       └── Side Marker/End Outline Marker Light/Parts [ID: 101785] (Niveau 3) → ProductId: 4677\n│   │   │           └── Composants (Niveau 6)\n│   │   │               └── Parts [ID: 101790] (Niveau 4) → ProductId: 4677\n│   │   ├── Vehicle Rear [ID: 101705] (Niveau 2) → ProductId: 6352\n│   │   │   └── Feu de position / d'encombrement / composants (Niveau 4)\n│   │   │       └── Side Marker/End Outline Marker Light/Parts [ID: 101785] (Niveau 3) → ProductId: 6352\n│   │   │           └── Feu d'encombrement (Niveau 6)\n│   │   │               └── End Outline Marker Light [ID: 101787] (Niveau 4) → ProductId: 6352\n│   │   ├── Vehicle Rear [ID: 101705] (Niveau 2) → ProductId: 4676\n│   │   │   └── Feu de position / d'encombrement / composants (Niveau 4)\n│   │   │       └── Side Marker/End Outline Marker Light/Parts [ID: 101785] (Niveau 3) → ProductId: 4676\n│   │   │           └── Composants (Niveau 6)\n│   │   │               └── Parts [ID: 101790] (Niveau 4) → ProductId: 4676\n│   │   ├── Vehicle Rear [ID: 101705] (Niveau 2) → ProductId: 4158\n│   │   │   └── Feu de position / d'encombrement / composants (Niveau 4)\n│   │   │       └── Side Marker/End Outline Marker Light/Parts [ID: 101785] (Niveau 3) → ProductId: 4158\n│   │   │           └── Feu d'encombrement (Niveau 6)\n│   │   │               └── End Outline Marker Light [ID: 101787] (Niveau 4) → ProductId: 4158\n│   │   └── Vehicle Rear [ID: 101705] (Niveau 2) → ProductId: 2086\n│   │       └── Feu de position / d'encombrement / composants (Niveau 4)\n│   │           └── Side Marker/End Outline Marker Light/Parts [ID: 101785] (Niveau 3) → ProductId: 2086\n│   │               └── Feu d'encombrement (Niveau 6)\n│   │                   └── End Outline Marker Light [ID: 101787] (Niveau 4) → ProductId: 2086\n│   ├── Avant du véhicule (Niveau 2)\n│   │   ├── Vehicle Front [ID: 101648] (Niveau 2) → ProductId: 3193\n│   │   │   ├── Feu clignotant/composants (Niveau 4)\n│   │   │   │   └── Direction Indicator/Parts [ID: 101669] (Niveau 3) → ProductId: 3193\n│   │   │   │       └── Feu clignotant (Niveau 6)\n│   │   │   │           └── Direction Indicator [ID: 101670] (Niveau 4) → ProductId: 3193\n│   │   │   └── Feu de position / d'encombrement / composants (Niveau 4)\n│   │   │       └── Side Marker/End Outline Marker Light/Parts [ID: 101766] (Niveau 3) → ProductId: 3193\n│   │   │           └── Feu d'encombrement (Niveau 6)\n│   │   │               └── End Outline Marker Light [ID: 101768] (Niveau 4) → ProductId: 3193\n│   │   ├── Vehicle Front [ID: 101648] (Niveau 2) → ProductId: 1172\n│   │   │   └── Feu de position / d'encombrement / composants (Niveau 4)\n│   │   │       └── Side Marker/End Outline Marker Light/Parts [ID: 101766] (Niveau 3) → ProductId: 1172\n│   │   │           └── Ampoule (Niveau 6)\n│   │   │               └── Bulb [ID: 101770] (Niveau 4) → ProductId: 1172\n│   │   ├── Vehicle Front [ID: 101648] (Niveau 2) → ProductId: 60090\n│   │   │   └── Feu de position / d'encombrement / composants (Niveau 4)\n│   │   │       └── Side Marker/End Outline Marker Light/Parts [ID: 101766] (Niveau 3) → ProductId: 60090\n│   │   │           └── Feux latéraux (Niveau 6)\n│   │   │               └── Side Marker Lights [ID: 101769] (Niveau 4) → ProductId: 60090\n│   │   ├── Vehicle Front [ID: 101648] (Niveau 2) → ProductId: 2126\n│   │   │   └── Feu de position / d'encombrement / composants (Niveau 4)\n│   │   │       └── Side Marker/End Outline Marker Light/Parts [ID: 101766] (Niveau 3) → ProductId: 2126\n│   │   │           ├── Feu d'encombrement (Niveau 6)\n│   │   │           │   └── End Outline Marker Light [ID: 101768] (Niveau 4) → ProductId: 2126\n│   │   │           └── Feu de stationnement/de position (Niveau 6)\n│   │   │               └── Park/Position Light [ID: 101767] (Niveau 4) → ProductId: 2126\n│   │   ├── Vehicle Front [ID: 101648] (Niveau 2) → ProductId: 1092\n│   │   │   └── Projecteurs principaux / composants (Niveau 4)\n│   │   │       └── Headlight/Parts [ID: 101656] (Niveau 3) → ProductId: 1092\n│   │   │           └── Ampoule pour projecteur principal (Niveau 6)\n│   │   │               └── Headlight Bulb [ID: 101658] (Niveau 4) → ProductId: 1092\n│   │   ├── Vehicle Front [ID: 101648] (Niveau 2) → ProductId: 3828\n│   │   │   └── Feu de position / d'encombrement / composants (Niveau 4)\n│   │   │       └── Side Marker/End Outline Marker Light/Parts [ID: 101766] (Niveau 3) → ProductId: 3828\n│   │   │           └── Feu d'encombrement (Niveau 6)\n│   │   │               └── End Outline Marker Light [ID: 101768] (Niveau 4) → ProductId: 3828\n│   │   ├── Vehicle Front [ID: 101648] (Niveau 2) → ProductId: 4726\n│   │   │   └── Feu de position / d'encombrement / composants (Niveau 4)\n│   │   │       └── Side Marker/End Outline Marker Light/Parts [ID: 101766] (Niveau 3) → ProductId: 4726\n│   │   │           └── Feux latéraux (Niveau 6)\n│   │   │               └── Side Marker Lights [ID: 101769] (Niveau 4) → ProductId: 4726\n│   │   ├── Vehicle Front [ID: 101648] (Niveau 2) → ProductId: 1175\n│   │   │   └── Feu de position / d'encombrement / composants (Niveau 4)\n│   │   │       └── Side Marker/End Outline Marker Light/Parts [ID: 101766] (Niveau 3) → ProductId: 1175\n│   │   │           └── Composants (Niveau 6)\n│   │   │               └── Parts [ID: 101771] (Niveau 4) → ProductId: 1175\n│   │   ├── Vehicle Front [ID: 101648] (Niveau 2) → ProductId: 3458\n│   │   │   └── Feu de position / d'encombrement / composants (Niveau 4)\n│   │   │       └── Side Marker/End Outline Marker Light/Parts [ID: 101766] (Niveau 3) → ProductId: 3458\n│   │   │           └── Feu d'encombrement (Niveau 6)\n│   │   │               └── End Outline Marker Light [ID: 101768] (Niveau 4) → ProductId: 3458\n│   │   ├── Vehicle Front [ID: 101648] (Niveau 2) → ProductId: 1174\n│   │   │   └── Feu de position / d'encombrement / composants (Niveau 4)\n│   │   │       └── Side Marker/End Outline Marker Light/Parts [ID: 101766] (Niveau 3) → ProductId: 1174\n│   │   │           └── Composants (Niveau 6)\n│   │   │               └── Parts [ID: 101771] (Niveau 4) → ProductId: 1174\n│   │   ├── Vehicle Front [ID: 101648] (Niveau 2) → ProductId: 2547\n│   │   │   └── Feu de position / d'encombrement / composants (Niveau 4)\n│   │   │       └── Side Marker/End Outline Marker Light/Parts [ID: 101766] (Niveau 3) → ProductId: 2547\n│   │   │           └── Feu de stationnement/de position (Niveau 6)\n│   │   │               └── Park/Position Light [ID: 101767] (Niveau 4) → ProductId: 2547\n│   │   ├── Vehicle Front [ID: 101648] (Niveau 2) → ProductId: 3451\n│   │   │   └── Feu de position / d'encombrement / composants (Niveau 4)\n│   │   │       └── Side Marker/End Outline Marker Light/Parts [ID: 101766] (Niveau 3) → ProductId: 3451\n│   │   │           └── Feux latéraux (Niveau 6)\n│   │   │               └── Side Marker Lights [ID: 101769] (Niveau 4) → ProductId: 3451\n│   │   ├── Vehicle Front [ID: 101648] (Niveau 2) → ProductId: 1350\n│   │   │   └── Feu de position / d'encombrement / composants (Niveau 4)\n│   │   │       └── Side Marker/End Outline Marker Light/Parts [ID: 101766] (Niveau 3) → ProductId: 1350\n│   │   │           └── Feu d'encombrement (Niveau 6)\n│   │   │               └── End Outline Marker Light [ID: 101768] (Niveau 4) → ProductId: 1350\n│   │   ├── Vehicle Front [ID: 101648] (Niveau 2) → ProductId: 4858\n│   │   │   └── Feu de position / d'encombrement / composants (Niveau 4)\n│   │   │       └── Side Marker/End Outline Marker Light/Parts [ID: 101766] (Niveau 3) → ProductId: 4858\n│   │   │           ├── Feu d'encombrement (Niveau 6)\n│   │   │           │   └── End Outline Marker Light [ID: 101768] (Niveau 4) → ProductId: 294\n│   │   │           └── Feu de stationnement/de position (Niveau 6)\n│   │   │               └── Park/Position Light [ID: 101767] (Niveau 4) → ProductId: 4858\n│   │   ├── Vehicle Front [ID: 101648] (Niveau 2) → ProductId: 1173\n│   │   │   └── Feu de position / d'encombrement / composants (Niveau 4)\n│   │   │       └── Side Marker/End Outline Marker Light/Parts [ID: 101766] (Niveau 3) → ProductId: 1173\n│   │   │           └── Feu de stationnement/de position (Niveau 6)\n│   │   │               └── Park/Position Light [ID: 101767] (Niveau 4) → ProductId: 1173\n│   │   ├── Vehicle Front [ID: 101648] (Niveau 2) → ProductId: 900\n│   │   │   └── Feu de position / d'encombrement / composants (Niveau 4)\n│   │   │       └── Side Marker/End Outline Marker Light/Parts [ID: 101766] (Niveau 3) → ProductId: 900\n│   │   │           └── Feux latéraux (Niveau 6)\n│   │   │               └── Side Marker Lights [ID: 101769] (Niveau 4) → ProductId: 900\n│   │   ├── Vehicle Front [ID: 101648] (Niveau 2) → ProductId: 3122\n│   │   │   └── Feu de position / d'encombrement / composants (Niveau 4)\n│   │   │       └── Side Marker/End Outline Marker Light/Parts [ID: 101766] (Niveau 3) → ProductId: 3122\n│   │   │           └── Composants (Niveau 6)\n│   │   │               └── Parts [ID: 101771] (Niveau 4) → ProductId: 3122\n│   │   ├── Vehicle Front [ID: 101648] (Niveau 2) → ProductId: 3120\n│   │   │   └── Feu de position / d'encombrement / composants (Niveau 4)\n│   │   │       └── Side Marker/End Outline Marker Light/Parts [ID: 101766] (Niveau 3) → ProductId: 3120\n│   │   │           └── Composants (Niveau 6)\n│   │   │               └── Parts [ID: 101771] (Niveau 4) → ProductId: 3120\n│   │   ├── Vehicle Front [ID: 101648] (Niveau 2) → ProductId: 4677\n│   │   │   └── Feu de position / d'encombrement / composants (Niveau 4)\n│   │   │       └── Side Marker/End Outline Marker Light/Parts [ID: 101766] (Niveau 3) → ProductId: 4677\n│   │   │           └── Composants (Niveau 6)\n│   │   │               └── Parts [ID: 101771] (Niveau 4) → ProductId: 4677\n│   │   ├── Vehicle Front [ID: 101648] (Niveau 2) → ProductId: 6352\n│   │   │   └── Feu de position / d'encombrement / composants (Niveau 4)\n│   │   │       └── Side Marker/End Outline Marker Light/Parts [ID: 101766] (Niveau 3) → ProductId: 6352\n│   │   │           └── Feu d'encombrement (Niveau 6)\n│   │   │               └── End Outline Marker Light [ID: 101768] (Niveau 4) → ProductId: 6352\n│   │   ├── Vehicle Front [ID: 101648] (Niveau 2) → ProductId: 4676\n│   │   │   └── Feu de position / d'encombrement / composants (Niveau 4)\n│   │   │       └── Side Marker/End Outline Marker Light/Parts [ID: 101766] (Niveau 3) → ProductId: 4676\n│   │   │           └── Composants (Niveau 6)\n│   │   │               └── Parts [ID: 101771] (Niveau 4) → ProductId: 4676\n│   │   ├── Vehicle Front [ID: 101648] (Niveau 2) → ProductId: 4158\n│   │   │   └── Feu de position / d'encombrement / composants (Niveau 4)\n│   │   │       └── Side Marker/End Outline Marker Light/Parts [ID: 101766] (Niveau 3) → ProductId: 4158\n│   │   │           └── Feu d'encombrement (Niveau 6)\n│   │   │               └── End Outline Marker Light [ID: 101768] (Niveau 4) → ProductId: 4158\n│   │   └── Vehicle Front [ID: 101648] (Niveau 2) → ProductId: 2086\n│   │       └── Feu de position / d'encombrement / composants (Niveau 4)\n│   │           └── Side Marker/End Outline Marker Light/Parts [ID: 101766] (Niveau 3) → ProductId: 2086\n│   │               └── Feu d'encombrement (Niveau 6)\n│   │                   └── End Outline Marker Light [ID: 101768] (Niveau 4) → ProductId: 2086\n│   ├── Feux (Niveau 2)\n│   │   ├── Lights [ID: 101407] (Niveau 2) → ProductId: 3193\n│   │   │   ├── Feu clignotant/composants (Niveau 4)\n│   │   │   │   └── Direction Indicator/Parts [ID: 101420] (Niveau 3) → ProductId: 3193\n│   │   │   │       └── Feu clignotant (Niveau 6)\n│   │   │   │           └── Direction Indicator [ID: 101421] (Niveau 4) → ProductId: 3193\n│   │   │   └── Feu de position / d'encombrement / composants (Niveau 4)\n│   │   │       └── Side Marker/End Outline Marker Light/Parts [ID: 101441] (Niveau 3) → ProductId: 3193\n│   │   │           └── Feu d'encombrement (Niveau 6)\n│   │   │               └── End Outline Marker Light [ID: 101443] (Niveau 4) → ProductId: 3193\n│   │   ├── Lights [ID: 101407] (Niveau 2) → ProductId: 1172\n│   │   │   └── Feu de position / d'encombrement / composants (Niveau 4)\n│   │   │       └── Side Marker/End Outline Marker Light/Parts [ID: 101441] (Niveau 3) → ProductId: 1172\n│   │   │           └── Ampoule (Niveau 6)\n│   │   │               └── Bulb [ID: 101445] (Niveau 4) → ProductId: 1172\n│   │   ├── Lights [ID: 101407] (Niveau 2) → ProductId: 60090\n│   │   │   └── Feu de position / d'encombrement / composants (Niveau 4)\n│   │   │       └── Side Marker/End Outline Marker Light/Parts [ID: 101441] (Niveau 3) → ProductId: 60090\n│   │   │           └── Feux latéraux (Niveau 6)\n│   │   │               └── Side Marker Lights [ID: 101444] (Niveau 4) → ProductId: 60090\n│   │   ├── Lights [ID: 101407] (Niveau 2) → ProductId: 2126\n│   │   │   └── Feu de position / d'encombrement / composants (Niveau 4)\n│   │   │       └── Side Marker/End Outline Marker Light/Parts [ID: 101441] (Niveau 3) → ProductId: 2126\n│   │   │           ├── Feu d'encombrement (Niveau 6)\n│   │   │           │   └── End Outline Marker Light [ID: 101443] (Niveau 4) → ProductId: 2126\n│   │   │           └── Feu de stationnement/de position (Niveau 6)\n│   │   │               └── Park/Position Light [ID: 101442] (Niveau 4) → ProductId: 2126\n│   │   ├── Lights [ID: 101407] (Niveau 2) → ProductId: 3828\n│   │   │   └── Feu de position / d'encombrement / composants (Niveau 4)\n│   │   │       └── Side Marker/End Outline Marker Light/Parts [ID: 101441] (Niveau 3) → ProductId: 3828\n│   │   │           └── Feu d'encombrement (Niveau 6)\n│   │   │               └── End Outline Marker Light [ID: 101443] (Niveau 4) → ProductId: 3828\n│   │   ├── Lights [ID: 101407] (Niveau 2) → ProductId: 4726\n│   │   │   └── Feu de position / d'encombrement / composants (Niveau 4)\n│   │   │       └── Side Marker/End Outline Marker Light/Parts [ID: 101441] (Niveau 3) → ProductId: 4726\n│   │   │           └── Feux latéraux (Niveau 6)\n│   │   │               └── Side Marker Lights [ID: 101444] (Niveau 4) → ProductId: 4726\n│   │   ├── Lights [ID: 101407] (Niveau 2) → ProductId: 1175\n│   │   │   └── Feu de position / d'encombrement / composants (Niveau 4)\n│   │   │       └── Side Marker/End Outline Marker Light/Parts [ID: 101441] (Niveau 3) → ProductId: 1175\n│   │   │           └── Composants (Niveau 6)\n│   │   │               └── Parts [ID: 101446] (Niveau 4) → ProductId: 1175\n│   │   ├── Lights [ID: 101407] (Niveau 2) → ProductId: 3458\n│   │   │   └── Feu de position / d'encombrement / composants (Niveau 4)\n│   │   │       └── Side Marker/End Outline Marker Light/Parts [ID: 101441] (Niveau 3) → ProductId: 3458\n│   │   │           └── Feu d'encombrement (Niveau 6)\n│   │   │               └── End Outline Marker Light [ID: 101443] (Niveau 4) → ProductId: 3458\n│   │   ├── Lights [ID: 101407] (Niveau 2) → ProductId: 1174\n│   │   │   └── Feu de position / d'encombrement / composants (Niveau 4)\n│   │   │       └── Side Marker/End Outline Marker Light/Parts [ID: 101441] (Niveau 3) → ProductId: 1174\n│   │   │           └── Composants (Niveau 6)\n│   │   │               └── Parts [ID: 101446] (Niveau 4) → ProductId: 1174\n│   │   ├── Lights [ID: 101407] (Niveau 2) → ProductId: 2547\n│   │   │   └── Feu de position / d'encombrement / composants (Niveau 4)\n│   │   │       └── Side Marker/End Outline Marker Light/Parts [ID: 101441] (Niveau 3) → ProductId: 2547\n│   │   │           └── Feu de stationnement/de position (Niveau 6)\n│   │   │               └── Park/Position Light [ID: 101442] (Niveau 4) → ProductId: 2547\n│   │   ├── Lights [ID: 101407] (Niveau 2) → ProductId: 3451\n│   │   │   └── Feu de position / d'encombrement / composants (Niveau 4)\n│   │   │       └── Side Marker/End Outline Marker Light/Parts [ID: 101441] (Niveau 3) → ProductId: 3451\n│   │   │           └── Feux latéraux (Niveau 6)\n│   │   │               └── Side Marker Lights [ID: 101444] (Niveau 4) → ProductId: 3451\n│   │   ├── Lights [ID: 101407] (Niveau 2) → ProductId: 1350\n│   │   │   └── Feu de position / d'encombrement / composants (Niveau 4)\n│   │   │       └── Side Marker/End Outline Marker Light/Parts [ID: 101441] (Niveau 3) → ProductId: 1350\n│   │   │           └── Feu d'encombrement (Niveau 6)\n│   │   │               └── End Outline Marker Light [ID: 101443] (Niveau 4) → ProductId: 1350\n│   │   ├── Lights [ID: 101407] (Niveau 2) → ProductId: 4858\n│   │   │   └── Feu de position / d'encombrement / composants (Niveau 4)\n│   │   │       └── Side Marker/End Outline Marker Light/Parts [ID: 101441] (Niveau 3) → ProductId: 4858\n│   │   │           ├── Feu d'encombrement (Niveau 6)\n│   │   │           │   └── End Outline Marker Light [ID: 101443] (Niveau 4) → ProductId: 294\n│   │   │           └── Feu de stationnement/de position (Niveau 6)\n│   │   │               └── Park/Position Light [ID: 101442] (Niveau 4) → ProductId: 4858\n│   │   ├── Lights [ID: 101407] (Niveau 2) → ProductId: 1173\n│   │   │   └── Feu de position / d'encombrement / composants (Niveau 4)\n│   │   │       └── Side Marker/End Outline Marker Light/Parts [ID: 101441] (Niveau 3) → ProductId: 1173\n│   │   │           └── Feu de stationnement/de position (Niveau 6)\n│   │   │               └── Park/Position Light [ID: 101442] (Niveau 4) → ProductId: 1173\n│   │   ├── Lights [ID: 101407] (Niveau 2) → ProductId: 900\n│   │   │   └── Feu de position / d'encombrement / composants (Niveau 4)\n│   │   │       └── Side Marker/End Outline Marker Light/Parts [ID: 101441] (Niveau 3) → ProductId: 900\n│   │   │           └── Feux latéraux (Niveau 6)\n│   │   │               └── Side Marker Lights [ID: 101444] (Niveau 4) → ProductId: 900\n│   │   ├── Lights [ID: 101407] (Niveau 2) → ProductId: 3122\n│   │   │   └── Feu de position / d'encombrement / composants (Niveau 4)\n│   │   │       └── Side Marker/End Outline Marker Light/Parts [ID: 101441] (Niveau 3) → ProductId: 3122\n│   │   │           └── Composants (Niveau 6)\n│   │   │               └── Parts [ID: 101446] (Niveau 4) → ProductId: 3122\n│   │   ├── Lights [ID: 101407] (Niveau 2) → ProductId: 3120\n│   │   │   └── Feu de position / d'encombrement / composants (Niveau 4)\n│   │   │       └── Side Marker/End Outline Marker Light/Parts [ID: 101441] (Niveau 3) → ProductId: 3120\n│   │   │           └── Composants (Niveau 6)\n│   │   │               └── Parts [ID: 101446] (Niveau 4) → ProductId: 3120\n│   │   ├── Lights [ID: 101407] (Niveau 2) → ProductId: 4677\n│   │   │   └── Feu de position / d'encombrement / composants (Niveau 4)\n│   │   │       └── Side Marker/End Outline Marker Light/Parts [ID: 101441] (Niveau 3) → ProductId: 4677\n│   │   │           └── Composants (Niveau 6)\n│   │   │               └── Parts [ID: 101446] (Niveau 4) → ProductId: 4677\n│   │   ├── Lights [ID: 101407] (Niveau 2) → ProductId: 6352\n│   │   │   └── Feu de position / d'encombrement / composants (Niveau 4)\n│   │   │       └── Side Marker/End Outline Marker Light/Parts [ID: 101441] (Niveau 3) → ProductId: 6352\n│   │   │           └── Feu d'encombrement (Niveau 6)\n│   │   │               └── End Outline Marker Light [ID: 101443] (Niveau 4) → ProductId: 6352\n│   │   ├── Lights [ID: 101407] (Niveau 2) → ProductId: 4676\n│   │   │   └── Feu de position / d'encombrement / composants (Niveau 4)\n│   │   │       └── Side Marker/End Outline Marker Light/Parts [ID: 101441] (Niveau 3) → ProductId: 4676\n│   │   │           └── Composants (Niveau 6)\n│   │   │               └── Parts [ID: 101446] (Niveau 4) → ProductId: 4676\n│   │   ├── Lights [ID: 101407] (Niveau 2) → ProductId: 4158\n│   │   │   └── Feu de position / d'encombrement / composants (Niveau 4)\n│   │   │       └── Side Marker/End Outline Marker Light/Parts [ID: 101441] (Niveau 3) → ProductId: 4158\n│   │   │           └── Feu d'encombrement (Niveau 6)\n│   │   │               └── End Outline Marker Light [ID: 101443] (Niveau 4) → ProductId: 4158\n│   │   └── Lights [ID: 101407] (Niveau 2) → ProductId: 2086\n│   │       └── Feu de position / d'encombrement / composants (Niveau 4)\n│   │           └── Side Marker/End Outline Marker Light/Parts [ID: 101441] (Niveau 3) → ProductId: 2086\n│   │               └── Feu d'encombrement (Niveau 6)\n│   │                   └── End Outline Marker Light [ID: 101443] (Niveau 4) → ProductId: 2086\n│   └── Projecteurs principaux / composants (Niveau 2)\n│       └── Headlight/Parts [ID: 101465] (Niveau 2) → ProductId: 1092\n│           └── Ampoule pour projecteur principal (Niveau 4)\n│               └── Headlight Bulb [ID: 101467] (Niveau 3) → ProductId: 1092\n\n└── Système électrique [ID: 100010] (Niveau 1)\n    ├── Feux (Niveau 2)\n    │   ├── Lights [ID: 100043] (Niveau 2) → ProductId: 3193\n    │   │   ├── Feu clignotant/composants (Niveau 4)\n    │   │   │   └── Direction Indicator/Parts [ID: 100145] (Niveau 3) → ProductId: 3193\n    │   │   │       └── Feu clignotant (Niveau 6)\n    │   │   │           └── Direction Indicator [ID: 100463] (Niveau 4) → ProductId: 3193\n    │   │   └── Feu de position / d'encombrement / composants (Niveau 4)\n    │   │       └── Side Marker/End Outline Marker Light/Parts [ID: 100290] (Niveau 3) → ProductId: 3193\n    │   │           └── Feu d'encombrement (Niveau 6)\n    │   │               └── End Outline Marker Light [ID: 100469] (Niveau 4) → ProductId: 3193\n    │   ├── Lights [ID: 100043] (Niveau 2) → ProductId: 1172\n    │   │   └── Feu de position / d'encombrement / composants (Niveau 4)\n    │   │       └── Side Marker/End Outline Marker Light/Parts [ID: 100290] (Niveau 3) → ProductId: 1172\n    │   │           └── Ampoule (Niveau 6)\n    │   │               └── Bulb [ID: 100503] (Niveau 4) → ProductId: 1172\n    │   ├── Lights [ID: 100043] (Niveau 2) → ProductId: 60090\n    │   │   └── Feu de position / d'encombrement / composants (Niveau 4)\n    │   │       └── Side Marker/End Outline Marker Light/Parts [ID: 100290] (Niveau 3) → ProductId: 60090\n    │   │           └── Feux latéraux (Niveau 6)\n    │   │               └── Side Marker Lights [ID: 100753] (Niveau 4) → ProductId: 60090\n    │   ├── Lights [ID: 100043] (Niveau 2) → ProductId: 2126\n    │   │   └── Feu de position / d'encombrement / composants (Niveau 4)\n    │   │       └── Side Marker/End Outline Marker Light/Parts [ID: 100290] (Niveau 3) → ProductId: 2126\n    │   │           ├── Feu d'encombrement (Niveau 6)\n    │   │           │   └── End Outline Marker Light [ID: 100469] (Niveau 4) → ProductId: 2126\n    │   │           └── Feu de stationnement/de position (Niveau 6)\n    │   │               └── Park/Position Light [ID: 100468] (Niveau 4) → ProductId: 2126\n    │   ├── Lights [ID: 100043] (Niveau 2) → ProductId: 3828\n    │   │   └── Feu de position / d'encombrement / composants (Niveau 4)\n    │   │       └── Side Marker/End Outline Marker Light/Parts [ID: 100290] (Niveau 3) → ProductId: 3828\n    │   │           └── Feu d'encombrement (Niveau 6)\n    │   │               └── End Outline Marker Light [ID: 100469] (Niveau 4) → ProductId: 3828\n    │   ├── Lights [ID: 100043] (Niveau 2) → ProductId: 4726\n    │   │   └── Feu de position / d'encombrement / composants (Niveau 4)\n    │   │       └── Side Marker/End Outline Marker Light/Parts [ID: 100290] (Niveau 3) → ProductId: 4726\n    │   │           └── Feux latéraux (Niveau 6)\n    │   │               └── Side Marker Lights [ID: 100753] (Niveau 4) → ProductId: 4726\n    │   ├── Lights [ID: 100043] (Niveau 2) → ProductId: 1175\n    │   │   └── Feu de position / d'encombrement / composants (Niveau 4)\n    │   │       └── Side Marker/End Outline Marker Light/Parts [ID: 100290] (Niveau 3) → ProductId: 1175\n    │   │           └── Composants (Niveau 6)\n    │   │               └── Parts [ID: 100495] (Niveau 4) → ProductId: 1175\n    │   ├── Lights [ID: 100043] (Niveau 2) → ProductId: 3458\n    │   │   └── Feu de position / d'encombrement / composants (Niveau 4)\n    │   │       └── Side Marker/End Outline Marker Light/Parts [ID: 100290] (Niveau 3) → ProductId: 3458\n    │   │           └── Feu d'encombrement (Niveau 6)\n    │   │               └── End Outline Marker Light [ID: 100469] (Niveau 4) → ProductId: 3458\n    │   ├── Lights [ID: 100043] (Niveau 2) → ProductId: 1174\n    │   │   └── Feu de position / d'encombrement / composants (Niveau 4)\n    │   │       └── Side Marker/End Outline Marker Light/Parts [ID: 100290] (Niveau 3) → ProductId: 1174\n    │   │           └── Composants (Niveau 6)\n    │   │               └── Parts [ID: 100495] (Niveau 4) → ProductId: 1174\n    │   ├── Lights [ID: 100043] (Niveau 2) → ProductId: 2547\n    │   │   └── Feu de position / d'encombrement / composants (Niveau 4)\n    │   │       └── Side Marker/End Outline Marker Light/Parts [ID: 100290] (Niveau 3) → ProductId: 2547\n    │   │           └── Feu de stationnement/de position (Niveau 6)\n    │   │               └── Park/Position Light [ID: 100468] (Niveau 4) → ProductId: 2547\n    │   ├── Lights [ID: 100043] (Niveau 2) → ProductId: 3451\n    │   │   └── Feu de position / d'encombrement / composants (Niveau 4)\n    │   │       └── Side Marker/End Outline Marker Light/Parts [ID: 100290] (Niveau 3) → ProductId: 3451\n    │   │           └── Feux latéraux (Niveau 6)\n    │   │               └── Side Marker Lights [ID: 100753] (Niveau 4) → ProductId: 3451\n    │   ├── Lights [ID: 100043] (Niveau 2) → ProductId: 8261\n    │   │   └── Feu de position / d'encombrement / composants (Niveau 4)\n    │   │       └── Side Marker/End Outline Marker Light/Parts [ID: 100290] (Niveau 3) → ProductId: 8261\n    │   │           └── Feu de stationnement/de position (Niveau 6)\n    │   │               └── Park/Position Light [ID: 100468] (Niveau 4) → ProductId: 8261\n    │   ├── Lights [ID: 100043] (Niveau 2) → ProductId: 5491\n    │   │   └── Feu de position / d'encombrement / composants (Niveau 4)\n    │   │       └── Side Marker/End Outline Marker Light/Parts [ID: 100290] (Niveau 3) → ProductId: 5491\n    │   │           └── Feu de stationnement/de position (Niveau 6)\n    │   │               └── Park/Position Light [ID: 100468] (Niveau 4) → ProductId: 5491\n    │   ├── Lights [ID: 100043] (Niveau 2) → ProductId: 1350\n    │   │   └── Feu de position / d'encombrement / composants (Niveau 4)\n    │   │       └── Side Marker/End Outline Marker Light/Parts [ID: 100290] (Niveau 3) → ProductId: 1350\n    │   │           └── Feu d'encombrement (Niveau 6)\n    │   │               └── End Outline Marker Light [ID: 100469] (Niveau 4) → ProductId: 1350\n    │   ├── Lights [ID: 100043] (Niveau 2) → ProductId: 4858\n    │   │   └── Feu de position / d'encombrement / composants (Niveau 4)\n    │   │       └── Side Marker/End Outline Marker Light/Parts [ID: 100290] (Niveau 3) → ProductId: 4858\n    │   │           ├── Feu d'encombrement (Niveau 6)\n    │   │           │   └── End Outline Marker Light [ID: 100469] (Niveau 4) → ProductId: 294\n    │   │           └── Feu de stationnement/de position (Niveau 6)\n    │   │               └── Park/Position Light [ID: 100468] (Niveau 4) → ProductId: 4858\n    │   ├── Lights [ID: 100043] (Niveau 2) → ProductId: 1173\n    │   │   └── Feu de position / d'encombrement / composants (Niveau 4)\n    │   │       └── Side Marker/End Outline Marker Light/Parts [ID: 100290] (Niveau 3) → ProductId: 1173\n    │   │           └── Feu de stationnement/de position (Niveau 6)\n    │   │               └── Park/Position Light [ID: 100468] (Niveau 4) → ProductId: 1173\n    │   ├── Lights [ID: 100043] (Niveau 2) → ProductId: 900\n    │   │   └── Feu de position / d'encombrement / composants (Niveau 4)\n    │   │       └── Side Marker/End Outline Marker Light/Parts [ID: 100290] (Niveau 3) → ProductId: 900\n    │   │           └── Feux latéraux (Niveau 6)\n    │   │               └── Side Marker Lights [ID: 100753] (Niveau 4) → ProductId: 900\n    │   ├── Lights [ID: 100043] (Niveau 2) → ProductId: 3122\n    │   │   └── Feu de position / d'encombrement / composants (Niveau 4)\n    │   │       └── Side Marker/End Outline Marker Light/Parts [ID: 100290] (Niveau 3) → ProductId: 3122\n    │   │           └── Composants (Niveau 6)\n    │   │               └── Parts [ID: 100495] (Niveau 4) → ProductId: 3122\n    │   ├── Lights [ID: 100043] (Niveau 2) → ProductId: 3120\n    │   │   └── Feu de position / d'encombrement / composants (Niveau 4)\n    │   │       └── Side Marker/End Outline Marker Light/Parts [ID: 100290] (Niveau 3) → ProductId: 3120\n    │   │           └── Composants (Niveau 6)\n    │   │               └── Parts [ID: 100495] (Niveau 4) → ProductId: 3120\n    │   ├── Lights [ID: 100043] (Niveau 2) → ProductId: 4677\n    │   │   └── Feu de position / d'encombrement / composants (Niveau 4)\n    │   │       └── Side Marker/End Outline Marker Light/Parts [ID: 100290] (Niveau 3) → ProductId: 4677\n    │   │           └── Composants (Niveau 6)\n    │   │               └── Parts [ID: 100495] (Niveau 4) → ProductId: 4677\n    │   ├── Lights [ID: 100043] (Niveau 2) → ProductId: 6352\n    │   │   └── Feu de position / d'encombrement / composants (Niveau 4)\n    │   │       └── Side Marker/End Outline Marker Light/Parts [ID: 100290] (Niveau 3) → ProductId: 6352\n    │   │           └── Feu d'encombrement (Niveau 6)\n    │   │               └── End Outline Marker Light [ID: 100469] (Niveau 4) → ProductId: 6352\n    │   ├── Lights [ID: 100043] (Niveau 2) → ProductId: 6345\n    │   │   └── Feu de position / d'encombrement / composants (Niveau 4)\n    │   │       └── Side Marker/End Outline Marker Light/Parts [ID: 100290] (Niveau 3) → ProductId: 6345\n    │   │           └── Feux latéraux (Niveau 6)\n    │   │               └── Side Marker Lights [ID: 100753] (Niveau 4) → ProductId: 6345\n    │   ├── Lights [ID: 100043] (Niveau 2) → ProductId: 4676\n    │   │   └── Feu de position / d'encombrement / composants (Niveau 4)\n    │   │       └── Side Marker/End Outline Marker Light/Parts [ID: 100290] (Niveau 3) → ProductId: 4676\n    │   │           └── Composants (Niveau 6)\n    │   │               └── Parts [ID: 100495] (Niveau 4) → ProductId: 4676\n    │   ├── Lights [ID: 100043] (Niveau 2) → ProductId: 4158\n    │   │   └── Feu de position / d'encombrement / composants (Niveau 4)\n    │   │       └── Side Marker/End Outline Marker Light/Parts [ID: 100290] (Niveau 3) → ProductId: 4158\n    │   │           └── Feu d'encombrement (Niveau 6)\n    │   │               └── End Outline Marker Light [ID: 100469] (Niveau 4) → ProductId: 4158\n    │   ├── Lights [ID: 100043] (Niveau 2) → ProductId: 4154\n    │   │   └── Feu de position / d'encombrement / composants (Niveau 4)\n    │   │       └── Side Marker/End Outline Marker Light/Parts [ID: 100290] (Niveau 3) → ProductId: 4154\n    │   │           └── Feux latéraux (Niveau 6)\n    │   │               └── Side Marker Lights [ID: 100753] (Niveau 4) → ProductId: 4154\n    │   ├── Lights [ID: 100043] (Niveau 2) → ProductId: 8993\n    │   │   └── Feu de position / d'encombrement / composants (Niveau 4)\n    │   │       └── Side Marker/End Outline Marker Light/Parts [ID: 100290] (Niveau 3) → ProductId: 8993\n    │   │           ├── Composants (Niveau 6)\n    │   │           │   └── Parts [ID: 100495] (Niveau 4) → ProductId: 8993\n    │   │           └── Feu de stationnement/de position (Niveau 6)\n    │   │               └── Park/Position Light [ID: 100468] (Niveau 4) → ProductId: 8993\n    │   ├── Lights [ID: 100043] (Niveau 2) → ProductId: 2086\n    │   │   └── Feu de position / d'encombrement / composants (Niveau 4)\n    │   │       └── Side Marker/End Outline Marker Light/Parts [ID: 100290] (Niveau 3) → ProductId: 2086\n    │   │           └── Feu d'encombrement (Niveau 6)\n    │   │               └── End Outline Marker Light [ID: 100469] (Niveau 4) → ProductId: 2086\n    │   └── Lights [ID: 100043] (Niveau 2) → ProductId: 7995\n    │       └── Feu de position / d'encombrement / composants (Niveau 4)\n    │           └── Side Marker/End Outline Marker Light/Parts [ID: 100290] (Niveau 3) → ProductId: 7995\n    │               └── Composants (Niveau 6)\n    │                   └── Parts [ID: 100495] (Niveau 4) → ProductId: 7995\n    ├── Projecteurs principaux / composants (Niveau 2)\n    │   └── Headlight/Parts [ID: 100143] (Niveau 2) → ProductId: 1092\n    │       └── Ampoule pour projecteur principal (Niveau 4)\n    │           └── Headlight Bulb [ID: 100427] (Niveau 3) → ProductId: 1092\n    └── Relais (Niveau 2)\n        └── Relay [ID: 100785] (Niveau 2) → ProductId: 8993",
  "arborescencePaths": [
    {
      "path": [
        "Carrosserie",
        "Arrière de la voiture",
        "Vehicle Rear"
      ],
      "categoryIds": [
        100001,
        null,
        101705
      ],
      "finalCategoryId": 101705,
      "productId": 3193
    },
    {
      "path": [
        "Carrosserie",
        "Arrière de la voiture",
        "Vehicle Rear"
      ],
      "categoryIds": [
        100001,
        null,
        101705
      ],
      "finalCategoryId": 101705,
      "productId": 1172
    },
    {
      "path": [
        "Carrosserie",
        "Arrière de la voiture",
        "Vehicle Rear"
      ],
      "categoryIds": [
        100001,
        null,
        101705
      ],
      "finalCategoryId": 101705,
      "productId": 60090
    },
    {
      "path": [
        "Carrosserie",
        "Arrière de la voiture",
        "Vehicle Rear"
      ],
      "categoryIds": [
        100001,
        null,
        101705
      ],
      "finalCategoryId": 101705,
      "productId": 2126
    },
    {
      "path": [
        "Carrosserie",
        "Arrière de la voiture",
        "Vehicle Rear"
      ],
      "categoryIds": [
        100001,
        null,
        101705
      ],
      "finalCategoryId": 101705,
      "productId": 3828
    },
    {
      "path": [
        "Carrosserie",
        "Arrière de la voiture",
        "Vehicle Rear"
      ],
      "categoryIds": [
        100001,
        null,
        101705
      ],
      "finalCategoryId": 101705,
      "productId": 4726
    },
    {
      "path": [
        "Carrosserie",
        "Arrière de la voiture",
        "Vehicle Rear"
      ],
      "categoryIds": [
        100001,
        null,
        101705
      ],
      "finalCategoryId": 101705,
      "productId": 1175
    },
    {
      "path": [
        "Carrosserie",
        "Arrière de la voiture",
        "Vehicle Rear"
      ],
      "categoryIds": [
        100001,
        null,
        101705
      ],
      "finalCategoryId": 101705,
      "productId": 3458
    },
    {
      "path": [
        "Carrosserie",
        "Arrière de la voiture",
        "Vehicle Rear"
      ],
      "categoryIds": [
        100001,
        null,
        101705
      ],
      "finalCategoryId": 101705,
      "productId": 1174
    },
    {
      "path": [
        "Carrosserie",
        "Arrière de la voiture",
        "Vehicle Rear"
      ],
      "categoryIds": [
        100001,
        null,
        101705
      ],
      "finalCategoryId": 101705,
      "productId": 2547
    },
    {
      "path": [
        "Carrosserie",
        "Arrière de la voiture",
        "Vehicle Rear"
      ],
      "categoryIds": [
        100001,
        null,
        101705
      ],
      "finalCategoryId": 101705,
      "productId": 3451
    },
    {
      "path": [
        "Carrosserie",
        "Arrière de la voiture",
        "Vehicle Rear"
      ],
      "categoryIds": [
        100001,
        null,
        101705
      ],
      "finalCategoryId": 101705,
      "productId": 1350
    },
    {
      "path": [
        "Carrosserie",
        "Arrière de la voiture",
        "Vehicle Rear"
      ],
      "categoryIds": [
        100001,
        null,
        101705
      ],
      "finalCategoryId": 101705,
      "productId": 4858
    },
    {
      "path": [
        "Carrosserie",
        "Arrière de la voiture",
        "Vehicle Rear"
      ],
      "categoryIds": [
        100001,
        null,
        101705
      ],
      "finalCategoryId": 101705,
      "productId": 1173
    },
    {
      "path": [
        "Carrosserie",
        "Arrière de la voiture",
        "Vehicle Rear"
      ],
      "categoryIds": [
        100001,
        null,
        101705
      ],
      "finalCategoryId": 101705,
      "productId": 900
    },
    {
      "path": [
        "Carrosserie",
        "Arrière de la voiture",
        "Vehicle Rear"
      ],
      "categoryIds": [
        100001,
        null,
        101705
      ],
      "finalCategoryId": 101705,
      "productId": 3122
    },
    {
      "path": [
        "Carrosserie",
        "Arrière de la voiture",
        "Vehicle Rear"
      ],
      "categoryIds": [
        100001,
        null,
        101705
      ],
      "finalCategoryId": 101705,
      "productId": 3120
    },
    {
      "path": [
        "Carrosserie",
        "Arrière de la voiture",
        "Vehicle Rear"
      ],
      "categoryIds": [
        100001,
        null,
        101705
      ],
      "finalCategoryId": 101705,
      "productId": 4677
    },
    {
      "path": [
        "Carrosserie",
        "Arrière de la voiture",
        "Vehicle Rear"
      ],
      "categoryIds": [
        100001,
        null,
        101705
      ],
      "finalCategoryId": 101705,
      "productId": 6352
    },
    {
      "path": [
        "Carrosserie",
        "Arrière de la voiture",
        "Vehicle Rear"
      ],
      "categoryIds": [
        100001,
        null,
        101705
      ],
      "finalCategoryId": 101705,
      "productId": 4676
    },
    {
      "path": [
        "Carrosserie",
        "Arrière de la voiture",
        "Vehicle Rear"
      ],
      "categoryIds": [
        100001,
        null,
        101705
      ],
      "finalCategoryId": 101705,
      "productId": 4158
    },
    {
      "path": [
        "Carrosserie",
        "Arrière de la voiture",
        "Vehicle Rear"
      ],
      "categoryIds": [
        100001,
        null,
        101705
      ],
      "finalCategoryId": 101705,
      "productId": 2086
    },
    {
      "path": [
        "Carrosserie",
        "Avant du véhicule",
        "Vehicle Front"
      ],
      "categoryIds": [
        100001,
        null,
        101648
      ],
      "finalCategoryId": 101648,
      "productId": 3193
    },
    {
      "path": [
        "Carrosserie",
        "Avant du véhicule",
        "Vehicle Front"
      ],
      "categoryIds": [
        100001,
        null,
        101648
      ],
      "finalCategoryId": 101648,
      "productId": 1172
    },
    {
      "path": [
        "Carrosserie",
        "Avant du véhicule",
        "Vehicle Front"
      ],
      "categoryIds": [
        100001,
        null,
        101648
      ],
      "finalCategoryId": 101648,
      "productId": 60090
    },
    {
      "path": [
        "Carrosserie",
        "Avant du véhicule",
        "Vehicle Front"
      ],
      "categoryIds": [
        100001,
        null,
        101648
      ],
      "finalCategoryId": 101648,
      "productId": 2126
    },
    {
      "path": [
        "Carrosserie",
        "Avant du véhicule",
        "Vehicle Front"
      ],
      "categoryIds": [
        100001,
        null,
        101648
      ],
      "finalCategoryId": 101648,
      "productId": 1092
    },
    {
      "path": [
        "Carrosserie",
        "Avant du véhicule",
        "Vehicle Front"
      ],
      "categoryIds": [
        100001,
        null,
        101648
      ],
      "finalCategoryId": 101648,
      "productId": 3828
    },
    {
      "path": [
        "Carrosserie",
        "Avant du véhicule",
        "Vehicle Front"
      ],
      "categoryIds": [
        100001,
        null,
        101648
      ],
      "finalCategoryId": 101648,
      "productId": 4726
    },
    {
      "path": [
        "Carrosserie",
        "Avant du véhicule",
        "Vehicle Front"
      ],
      "categoryIds": [
        100001,
        null,
        101648
      ],
      "finalCategoryId": 101648,
      "productId": 1175
    },
    {
      "path": [
        "Carrosserie",
        "Avant du véhicule",
        "Vehicle Front"
      ],
      "categoryIds": [
        100001,
        null,
        101648
      ],
      "finalCategoryId": 101648,
      "productId": 3458
    },
    {
      "path": [
        "Carrosserie",
        "Avant du véhicule",
        "Vehicle Front"
      ],
      "categoryIds": [
        100001,
        null,
        101648
      ],
      "finalCategoryId": 101648,
      "productId": 1174
    },
    {
      "path": [
        "Carrosserie",
        "Avant du véhicule",
        "Vehicle Front"
      ],
      "categoryIds": [
        100001,
        null,
        101648
      ],
      "finalCategoryId": 101648,
      "productId": 2547
    },
    {
      "path": [
        "Carrosserie",
        "Avant du véhicule",
        "Vehicle Front"
      ],
      "categoryIds": [
        100001,
        null,
        101648
      ],
      "finalCategoryId": 101648,
      "productId": 3451
    },
    {
      "path": [
        "Carrosserie",
        "Avant du véhicule",
        "Vehicle Front"
      ],
      "categoryIds": [
        100001,
        null,
        101648
      ],
      "finalCategoryId": 101648,
      "productId": 1350
    },
    {
      "path": [
        "Carrosserie",
        "Avant du véhicule",
        "Vehicle Front"
      ],
      "categoryIds": [
        100001,
        null,
        101648
      ],
      "finalCategoryId": 101648,
      "productId": 4858
    },
    {
      "path": [
        "Carrosserie",
        "Avant du véhicule",
        "Vehicle Front"
      ],
      "categoryIds": [
        100001,
        null,
        101648
      ],
      "finalCategoryId": 101648,
      "productId": 1173
    },
    {
      "path": [
        "Carrosserie",
        "Avant du véhicule",
        "Vehicle Front"
      ],
      "categoryIds": [
        100001,
        null,
        101648
      ],
      "finalCategoryId": 101648,
      "productId": 900
    },
    {
      "path": [
        "Carrosserie",
        "Avant du véhicule",
        "Vehicle Front"
      ],
      "categoryIds": [
        100001,
        null,
        101648
      ],
      "finalCategoryId": 101648,
      "productId": 3122
    },
    {
      "path": [
        "Carrosserie",
        "Avant du véhicule",
        "Vehicle Front"
      ],
      "categoryIds": [
        100001,
        null,
        101648
      ],
      "finalCategoryId": 101648,
      "productId": 3120
    },
    {
      "path": [
        "Carrosserie",
        "Avant du véhicule",
        "Vehicle Front"
      ],
      "categoryIds": [
        100001,
        null,
        101648
      ],
      "finalCategoryId": 101648,
      "productId": 4677
    },
    {
      "path": [
        "Carrosserie",
        "Avant du véhicule",
        "Vehicle Front"
      ],
      "categoryIds": [
        100001,
        null,
        101648
      ],
      "finalCategoryId": 101648,
      "productId": 6352
    },
    {
      "path": [
        "Carrosserie",
        "Avant du véhicule",
        "Vehicle Front"
      ],
      "categoryIds": [
        100001,
        null,
        101648
      ],
      "finalCategoryId": 101648,
      "productId": 4676
    },
    {
      "path": [
        "Carrosserie",
        "Avant du véhicule",
        "Vehicle Front"
      ],
      "categoryIds": [
        100001,
        null,
        101648
      ],
      "finalCategoryId": 101648,
      "productId": 4158
    },
    {
      "path": [
        "Carrosserie",
        "Avant du véhicule",
        "Vehicle Front"
      ],
      "categoryIds": [
        100001,
        null,
        101648
      ],
      "finalCategoryId": 101648,
      "productId": 2086
    },
    {
      "path": [
        "Carrosserie",
        "Feux",
        "Lights"
      ],
      "categoryIds": [
        100001,
        null,
        101407
      ],
      "finalCategoryId": 101407,
      "productId": 3193
    },
    {
      "path": [
        "Carrosserie",
        "Feux",
        "Lights"
      ],
      "categoryIds": [
        100001,
        null,
        101407
      ],
      "finalCategoryId": 101407,
      "productId": 1172
    },
    {
      "path": [
        "Carrosserie",
        "Feux",
        "Lights"
      ],
      "categoryIds": [
        100001,
        null,
        101407
      ],
      "finalCategoryId": 101407,
      "productId": 60090
    },
    {
      "path": [
        "Carrosserie",
        "Feux",
        "Lights"
      ],
      "categoryIds": [
        100001,
        null,
        101407
      ],
      "finalCategoryId": 101407,
      "productId": 2126
    },
    {
      "path": [
        "Carrosserie",
        "Feux",
        "Lights"
      ],
      "categoryIds": [
        100001,
        null,
        101407
      ],
      "finalCategoryId": 101407,
      "productId": 3828
    },
    {
      "path": [
        "Carrosserie",
        "Feux",
        "Lights"
      ],
      "categoryIds": [
        100001,
        null,
        101407
      ],
      "finalCategoryId": 101407,
      "productId": 4726
    },
    {
      "path": [
        "Carrosserie",
        "Feux",
        "Lights"
      ],
      "categoryIds": [
        100001,
        null,
        101407
      ],
      "finalCategoryId": 101407,
      "productId": 1175
    },
    {
      "path": [
        "Carrosserie",
        "Feux",
        "Lights"
      ],
      "categoryIds": [
        100001,
        null,
        101407
      ],
      "finalCategoryId": 101407,
      "productId": 3458
    },
    {
      "path": [
        "Carrosserie",
        "Feux",
        "Lights"
      ],
      "categoryIds": [
        100001,
        null,
        101407
      ],
      "finalCategoryId": 101407,
      "productId": 1174
    },
    {
      "path": [
        "Carrosserie",
        "Feux",
        "Lights"
      ],
      "categoryIds": [
        100001,
        null,
        101407
      ],
      "finalCategoryId": 101407,
      "productId": 2547
    },
    {
      "path": [
        "Carrosserie",
        "Feux",
        "Lights"
      ],
      "categoryIds": [
        100001,
        null,
        101407
      ],
      "finalCategoryId": 101407,
      "productId": 3451
    },
    {
      "path": [
        "Carrosserie",
        "Feux",
        "Lights"
      ],
      "categoryIds": [
        100001,
        null,
        101407
      ],
      "finalCategoryId": 101407,
      "productId": 1350
    },
    {
      "path": [
        "Carrosserie",
        "Feux",
        "Lights"
      ],
      "categoryIds": [
        100001,
        null,
        101407
      ],
      "finalCategoryId": 101407,
      "productId": 4858
    },
    {
      "path": [
        "Carrosserie",
        "Feux",
        "Lights"
      ],
      "categoryIds": [
        100001,
        null,
        101407
      ],
      "finalCategoryId": 101407,
      "productId": 1173
    },
    {
      "path": [
        "Carrosserie",
        "Feux",
        "Lights"
      ],
      "categoryIds": [
        100001,
        null,
        101407
      ],
      "finalCategoryId": 101407,
      "productId": 900
    },
    {
      "path": [
        "Carrosserie",
        "Feux",
        "Lights"
      ],
      "categoryIds": [
        100001,
        null,
        101407
      ],
      "finalCategoryId": 101407,
      "productId": 3122
    },
    {
      "path": [
        "Carrosserie",
        "Feux",
        "Lights"
      ],
      "categoryIds": [
        100001,
        null,
        101407
      ],
      "finalCategoryId": 101407,
      "productId": 3120
    },
    {
      "path": [
        "Carrosserie",
        "Feux",
        "Lights"
      ],
      "categoryIds": [
        100001,
        null,
        101407
      ],
      "finalCategoryId": 101407,
      "productId": 4677
    },
    {
      "path": [
        "Carrosserie",
        "Feux",
        "Lights"
      ],
      "categoryIds": [
        100001,
        null,
        101407
      ],
      "finalCategoryId": 101407,
      "productId": 6352
    },
    {
      "path": [
        "Carrosserie",
        "Feux",
        "Lights"
      ],
      "categoryIds": [
        100001,
        null,
        101407
      ],
      "finalCategoryId": 101407,
      "productId": 4676
    },
    {
      "path": [
        "Carrosserie",
        "Feux",
        "Lights"
      ],
      "categoryIds": [
        100001,
        null,
        101407
      ],
      "finalCategoryId": 101407,
      "productId": 4158
    },
    {
      "path": [
        "Carrosserie",
        "Feux",
        "Lights"
      ],
      "categoryIds": [
        100001,
        null,
        101407
      ],
      "finalCategoryId": 101407,
      "productId": 2086
    },
    {
      "path": [
        "Carrosserie",
        "Projecteurs principaux / composants",
        "Headlight/Parts"
      ],
      "categoryIds": [
        100001,
        null,
        101465
      ],
      "finalCategoryId": 101465,
      "productId": 1092
    },
    {
      "path": [
        "Système électrique",
        "Feux",
        "Lights"
      ],
      "categoryIds": [
        100010,
        null,
        100043
      ],
      "finalCategoryId": 100043,
      "productId": 3193
    },
    {
      "path": [
        "Système électrique",
        "Feux",
        "Lights"
      ],
      "categoryIds": [
        100010,
        null,
        100043
      ],
      "finalCategoryId": 100043,
      "productId": 1172
    },
    {
      "path": [
        "Système électrique",
        "Feux",
        "Lights"
      ],
      "categoryIds": [
        100010,
        null,
        100043
      ],
      "finalCategoryId": 100043,
      "productId": 60090
    },
    {
      "path": [
        "Système électrique",
        "Feux",
        "Lights"
      ],
      "categoryIds": [
        100010,
        null,
        100043
      ],
      "finalCategoryId": 100043,
      "productId": 2126
    },
    {
      "path": [
        "Système électrique",
        "Feux",
        "Lights"
      ],
      "categoryIds": [
        100010,
        null,
        100043
      ],
      "finalCategoryId": 100043,
      "productId": 3828
    },
    {
      "path": [
        "Système électrique",
        "Feux",
        "Lights"
      ],
      "categoryIds": [
        100010,
        null,
        100043
      ],
      "finalCategoryId": 100043,
      "productId": 4726
    },
    {
      "path": [
        "Système électrique",
        "Feux",
        "Lights"
      ],
      "categoryIds": [
        100010,
        null,
        100043
      ],
      "finalCategoryId": 100043,
      "productId": 1175
    },
    {
      "path": [
        "Système électrique",
        "Feux",
        "Lights"
      ],
      "categoryIds": [
        100010,
        null,
        100043
      ],
      "finalCategoryId": 100043,
      "productId": 3458
    },
    {
      "path": [
        "Système électrique",
        "Feux",
        "Lights"
      ],
      "categoryIds": [
        100010,
        null,
        100043
      ],
      "finalCategoryId": 100043,
      "productId": 1174
    },
    {
      "path": [
        "Système électrique",
        "Feux",
        "Lights"
      ],
      "categoryIds": [
        100010,
        null,
        100043
      ],
      "finalCategoryId": 100043,
      "productId": 2547
    },
    {
      "path": [
        "Système électrique",
        "Feux",
        "Lights"
      ],
      "categoryIds": [
        100010,
        null,
        100043
      ],
      "finalCategoryId": 100043,
      "productId": 3451
    },
    {
      "path": [
        "Système électrique",
        "Feux",
        "Lights"
      ],
      "categoryIds": [
        100010,
        null,
        100043
      ],
      "finalCategoryId": 100043,
      "productId": 8261
    },
    {
      "path": [
        "Système électrique",
        "Feux",
        "Lights"
      ],
      "categoryIds": [
        100010,
        null,
        100043
      ],
      "finalCategoryId": 100043,
      "productId": 5491
    },
    {
      "path": [
        "Système électrique",
        "Feux",
        "Lights"
      ],
      "categoryIds": [
        100010,
        null,
        100043
      ],
      "finalCategoryId": 100043,
      "productId": 1350
    },
    {
      "path": [
        "Système électrique",
        "Feux",
        "Lights"
      ],
      "categoryIds": [
        100010,
        null,
        100043
      ],
      "finalCategoryId": 100043,
      "productId": 4858
    },
    {
      "path": [
        "Système électrique",
        "Feux",
        "Lights"
      ],
      "categoryIds": [
        100010,
        null,
        100043
      ],
      "finalCategoryId": 100043,
      "productId": 1173
    },
    {
      "path": [
        "Système électrique",
        "Feux",
        "Lights"
      ],
      "categoryIds": [
        100010,
        null,
        100043
      ],
      "finalCategoryId": 100043,
      "productId": 900
    },
    {
      "path": [
        "Système électrique",
        "Feux",
        "Lights"
      ],
      "categoryIds": [
        100010,
        null,
        100043
      ],
      "finalCategoryId": 100043,
      "productId": 3122
    },
    {
      "path": [
        "Système électrique",
        "Feux",
        "Lights"
      ],
      "categoryIds": [
        100010,
        null,
        100043
      ],
      "finalCategoryId": 100043,
      "productId": 3120
    },
    {
      "path": [
        "Système électrique",
        "Feux",
        "Lights"
      ],
      "categoryIds": [
        100010,
        null,
        100043
      ],
      "finalCategoryId": 100043,
      "productId": 4677
    },
    {
      "path": [
        "Système électrique",
        "Feux",
        "Lights"
      ],
      "categoryIds": [
        100010,
        null,
        100043
      ],
      "finalCategoryId": 100043,
      "productId": 6352
    },
    {
      "path": [
        "Système électrique",
        "Feux",
        "Lights"
      ],
      "categoryIds": [
        100010,
        null,
        100043
      ],
      "finalCategoryId": 100043,
      "productId": 6345
    },
    {
      "path": [
        "Système électrique",
        "Feux",
        "Lights"
      ],
      "categoryIds": [
        100010,
        null,
        100043
      ],
      "finalCategoryId": 100043,
      "productId": 4676
    },
    {
      "path": [
        "Système électrique",
        "Feux",
        "Lights"
      ],
      "categoryIds": [
        100010,
        null,
        100043
      ],
      "finalCategoryId": 100043,
      "productId": 4158
    },
    {
      "path": [
        "Système électrique",
        "Feux",
        "Lights"
      ],
      "categoryIds": [
        100010,
        null,
        100043
      ],
      "finalCategoryId": 100043,
      "productId": 4154
    },
    {
      "path": [
        "Système électrique",
        "Feux",
        "Lights"
      ],
      "categoryIds": [
        100010,
        null,
        100043
      ],
      "finalCategoryId": 100043,
      "productId": 8993
    },
    {
      "path": [
        "Système électrique",
        "Feux",
        "Lights"
      ],
      "categoryIds": [
        100010,
        null,
        100043
      ],
      "finalCategoryId": 100043,
      "productId": 2086
    },
    {
      "path": [
        "Système électrique",
        "Feux",
        "Lights"
      ],
      "categoryIds": [
        100010,
        null,
        100043
      ],
      "finalCategoryId": 100043,
      "productId": 7995
    },
    {
      "path": [
        "Système électrique",
        "Projecteurs principaux / composants",
        "Headlight/Parts"
      ],
      "categoryIds": [
        100010,
        null,
        100143
      ],
      "finalCategoryId": 100143,
      "productId": 1092
    },
    {
      "path": [
        "Système électrique",
        "Relais",
        "Relay"
      ],
      "categoryIds": [
        100010,
        null,
        100785
      ],
      "finalCategoryId": 100785,
      "productId": 8993
    }
  ],
  "productIdsInArbo": [
    294,
    900,
    1092,
    1172,
    1173,
    1174,
    1175,
    1350,
    2086,
    2126,
    2547,
    3120,
    3122,
    3193,
    3451,
    3458,
    3828,
    4154,
    4158,
    4676,
    4677,
    4726,
    4858,
    5491,
    6345,
    6352,
    7995,
    8261,
    8993,
    60090
  ],
  "matchedProductIds": [
    1173
  ]
}