{
  "productName": "Feu d'encombrement",
  "searchText": "Feu d'encombrement",
  "found": true,
  "hasMatch": true,
  "timestamp": "2025-12-02T20:38:38.150Z",
  "productId": 1350,
  "arborescence": {
    "Carrosserie": {
      "categoryId": 100001,
      "categoryName": "Carrosserie",
      "level": 1,
      "children": {
        "Arrière de la voiture": {
          "categoryId": null,
          "categoryName": "Arrière de la voiture",
          "level": 2,
          "children": {
            "Ampoule, feu clignotant/feu-position avant": {
              "categoryId": 101705,
              "categoryName": "Vehicle Rear",
              "level": 2,
              "children": {
                "Feu clignotant/composants": {
                  "categoryId": null,
                  "categoryName": "Feu clignotant/composants",
                  "level": 4,
                  "children": {
                    "Ampoule, feu clignotant/feu-position avant": {
                      "categoryId": 101727,
                      "categoryName": "Direction Indicator/Parts",
                      "level": 3,
                      "children": {
                        "Feu clignotant": {
                          "categoryId": null,
                          "categoryName": "Feu clignotant",
                          "level": 6,
                          "children": {
                            "Ampoule, feu clignotant/feu-position avant": {
                              "categoryId": 101728,
                              "categoryName": "Direction Indicator",
                              "level": 4,
                              "children": [],
                              "productId": 3193
                            }
                          }
                        }
                      },
                      "productId": 3193
                    }
                  }
                },
                "Feu de position / d'encombrement / composants": {
                  "categoryId": null,
                  "categoryName": "Feu de position / d'encombrement / composants",
                  "level": 4,
                  "children": {
                    "Ampoule, feu clignotant/feu-position avant": {
                      "categoryId": 101785,
                      "categoryName": "Side Marker/End Outline Marker Light/Parts",
                      "level": 3,
                      "children": {
                        "Feu d'encombrement": {
                          "categoryId": null,
                          "categoryName": "Feu d'encombrement",
                          "level": 6,
                          "children": {
                            "Ampoule, feu clignotant/feu-position avant": {
                              "categoryId": 101787,
                              "categoryName": "End Outline Marker Light",
                              "level": 4,
                              "children": [],
                              "productId": 3193
                            }
                          }
                        }
                      },
                      "productId": 3193
                    }
                  }
                }
              },
              "productId": 3193
            },
            "Ampoule, feu d'encombrement/de position": {
              "categoryId": 101705,
              "categoryName": "Vehicle Rear",
              "level": 2,
              "children": {
                "Feu de position / d'encombrement / composants": {
                  "categoryId": null,
                  "categoryName": "Feu de position / d'encombrement / composants",
                  "level": 4,
                  "children": {
                    "Ampoule, feu d'encombrement/de position": {
                      "categoryId": 101785,
                      "categoryName": "Side Marker/End Outline Marker Light/Parts",
                      "level": 3,
                      "children": {
                        "Ampoule": {
                          "categoryId": null,
                          "categoryName": "Ampoule",
                          "level": 6,
                          "children": {
                            "Ampoule, feu d'encombrement/de position": {
                              "categoryId": 101789,
                              "categoryName": "Bulb",
                              "level": 4,
                              "children": [],
                              "productId": 1172
                            }
                          }
                        }
                      },
                      "productId": 1172
                    }
                  }
                }
              },
              "productId": 1172
            },
            "Ampoule, feu de position/d'encombrement": {
              "categoryId": 101705,
              "categoryName": "Vehicle Rear",
              "level": 2,
              "children": {
                "Feu de position / d'encombrement / composants": {
                  "categoryId": null,
                  "categoryName": "Feu de position / d'encombrement / composants",
                  "level": 4,
                  "children": {
                    "Ampoule, feu de position/d'encombrement": {
                      "categoryId": 101785,
                      "categoryName": "Side Marker/End Outline Marker Light/Parts",
                      "level": 3,
                      "children": {
                        "Feu d'encombrement": {
                          "categoryId": null,
                          "categoryName": "Feu d'encombrement",
                          "level": 6,
                          "children": {
                            "Ampoule, feu de position/d'encombrement": {
                              "categoryId": 101787,
                              "categoryName": "End Outline Marker Light",
                              "level": 4,
                              "children": [],
                              "productId": 2126
                            }
                          }
                        },
                        "Feu de stationnement/de position": {
                          "categoryId": null,
                          "categoryName": "Feu de stationnement/de position",
                          "level": 6,
                          "children": {
                            "Ampoule, feu de position/d'encombrement": {
                              "categoryId": 101786,
                              "categoryName": "Park/Position Light",
                              "level": 4,
                              "children": [],
                              "productId": 2126
                            }
                          }
                        }
                      },
                      "productId": 2126
                    }
                  }
                }
              },
              "productId": 2126
            },
            "Boitier, feu de position": {
              "categoryId": 101705,
              "categoryName": "Vehicle Rear",
              "level": 2,
              "children": {
                "Feu de position / d'encombrement / composants": {
                  "categoryId": null,
                  "categoryName": "Feu de position / d'encombrement / composants",
                  "level": 4,
                  "children": {
                    "Boitier, feu de position": {
                      "categoryId": 101785,
                      "categoryName": "Side Marker/End Outline Marker Light/Parts",
                      "level": 3,
                      "children": {
                        "Feu d'encombrement": {
                          "categoryId": null,
                          "categoryName": "Feu d'encombrement",
                          "level": 6,
                          "children": {
                            "Boitier, feu de position": {
                              "categoryId": 101787,
                              "categoryName": "End Outline Marker Light",
                              "level": 4,
                              "children": [],
                              "productId": 3828
                            }
                          }
                        }
                      },
                      "productId": 3828
                    }
                  }
                }
              },
              "productId": 3828
            },
            "Disperseur, feu d'encombrement": {
              "categoryId": 101705,
              "categoryName": "Vehicle Rear",
              "level": 2,
              "children": {
                "Feu de position / d'encombrement / composants": {
                  "categoryId": null,
                  "categoryName": "Feu de position / d'encombrement / composants",
                  "level": 4,
                  "children": {
                    "Disperseur, feu d'encombrement": {
                      "categoryId": 101785,
                      "categoryName": "Side Marker/End Outline Marker Light/Parts",
                      "level": 3,
                      "children": {
                        "Composants": {
                          "categoryId": null,
                          "categoryName": "Composants",
                          "level": 6,
                          "children": {
                            "Disperseur, feu d'encombrement": {
                              "categoryId": 101790,
                              "categoryName": "Parts",
                              "level": 4,
                              "children": [],
                              "productId": 1175
                            }
                          }
                        }
                      },
                      "productId": 1175
                    }
                  }
                }
              },
              "productId": 1175
            },
            "Disperseur, feu de gabarit": {
              "categoryId": 101705,
              "categoryName": "Vehicle Rear",
              "level": 2,
              "children": {
                "Feu de position / d'encombrement / composants": {
                  "categoryId": null,
                  "categoryName": "Feu de position / d'encombrement / composants",
                  "level": 4,
                  "children": {
                    "Disperseur, feu de gabarit": {
                      "categoryId": 101785,
                      "categoryName": "Side Marker/End Outline Marker Light/Parts",
                      "level": 3,
                      "children": {
                        "Feu d'encombrement": {
                          "categoryId": null,
                          "categoryName": "Feu d'encombrement",
                          "level": 6,
                          "children": {
                            "Disperseur, feu de gabarit": {
                              "categoryId": 101787,
                              "categoryName": "End Outline Marker Light",
                              "level": 4,
                              "children": [],
                              "productId": 3458
                            }
                          }
                        }
                      },
                      "productId": 3458
                    }
                  }
                }
              },
              "productId": 3458
            },
            "Feu d'encombrement": {
              "categoryId": 101705,
              "categoryName": "Vehicle Rear",
              "level": 2,
              "children": {
                "Feu de position / d'encombrement / composants": {
                  "categoryId": null,
                  "categoryName": "Feu de position / d'encombrement / composants",
                  "level": 4,
                  "children": {
                    "Feu d'encombrement": {
                      "categoryId": 101785,
                      "categoryName": "Side Marker/End Outline Marker Light/Parts",
                      "level": 3,
                      "children": {
                        "Feu d'encombrement": {
                          "categoryId": null,
                          "categoryName": "Feu d'encombrement",
                          "level": 6,
                          "children": {
                            "Feu d'encombrement": {
                              "categoryId": 101787,
                              "categoryName": "End Outline Marker Light",
                              "level": 4,
                              "children": [],
                              "productId": 1350
                            }
                          }
                        }
                      },
                      "productId": 1350
                    }
                  }
                }
              },
              "productId": 1350
            },
            "Feu de position": {
              "categoryId": 101705,
              "categoryName": "Vehicle Rear",
              "level": 2,
              "children": {
                "Feu de position / d'encombrement / composants": {
                  "categoryId": null,
                  "categoryName": "Feu de position / d'encombrement / composants",
                  "level": 4,
                  "children": {
                    "Feu de position": {
                      "categoryId": 101785,
                      "categoryName": "Side Marker/End Outline Marker Light/Parts",
                      "level": 3,
                      "children": {
                        "Feu d'encombrement": {
                          "categoryId": null,
                          "categoryName": "Feu d'encombrement",
                          "level": 6,
                          "children": {
                            "Feu de position": {
                              "categoryId": 101787,
                              "categoryName": "End Outline Marker Light",
                              "level": 4,
                              "children": [],
                              "productId": 294
                            }
                          }
                        }
                      },
                      "productId": 294
                    }
                  }
                }
              },
              "productId": 294
            },
            "Joint d'étanchéité, feu de position": {
              "categoryId": 101705,
              "categoryName": "Vehicle Rear",
              "level": 2,
              "children": {
                "Feu de position / d'encombrement / composants": {
                  "categoryId": null,
                  "categoryName": "Feu de position / d'encombrement / composants",
                  "level": 4,
                  "children": {
                    "Joint d'étanchéité, feu de position": {
                      "categoryId": 101785,
                      "categoryName": "Side Marker/End Outline Marker Light/Parts",
                      "level": 3,
                      "children": {
                        "Feu d'encombrement": {
                          "categoryId": null,
                          "categoryName": "Feu d'encombrement",
                          "level": 6,
                          "children": {
                            "Joint d'étanchéité, feu de position": {
                              "categoryId": 101787,
                              "categoryName": "End Outline Marker Light",
                              "level": 4,
                              "children": [],
                              "productId": 2207
                            }
                          }
                        }
                      },
                      "productId": 2207
                    }
                  }
                }
              },
              "productId": 2207
            },
            "Joint, feu d'encombrement": {
              "categoryId": 101705,
              "categoryName": "Vehicle Rear",
              "level": 2,
              "children": {
                "Feu de position / d'encombrement / composants": {
                  "categoryId": null,
                  "categoryName": "Feu de position / d'encombrement / composants",
                  "level": 4,
                  "children": {
                    "Joint, feu d'encombrement": {
                      "categoryId": 101785,
                      "categoryName": "Side Marker/End Outline Marker Light/Parts",
                      "level": 3,
                      "children": {
                        "Composants": {
                          "categoryId": null,
                          "categoryName": "Composants",
                          "level": 6,
                          "children": {
                            "Joint, feu d'encombrement": {
                              "categoryId": 101790,
                              "categoryName": "Parts",
                              "level": 4,
                              "children": [],
                              "productId": 3122
                            }
                          }
                        }
                      },
                      "productId": 3122
                    }
                  }
                }
              },
              "productId": 3122
            },
            "Kit réparation de câble, feu de position": {
              "categoryId": 101705,
              "categoryName": "Vehicle Rear",
              "level": 2,
              "children": {
                "Feu de position / d'encombrement / composants": {
                  "categoryId": null,
                  "categoryName": "Feu de position / d'encombrement / composants",
                  "level": 4,
                  "children": {
                    "Kit réparation de câble, feu de position": {
                      "categoryId": 101785,
                      "categoryName": "Side Marker/End Outline Marker Light/Parts",
                      "level": 3,
                      "children": {
                        "Feu d'encombrement": {
                          "categoryId": null,
                          "categoryName": "Feu d'encombrement",
                          "level": 6,
                          "children": {
                            "Kit réparation de câble, feu de position": {
                              "categoryId": 101787,
                              "categoryName": "End Outline Marker Light",
                              "level": 4,
                              "children": [],
                              "productId": 6352
                            }
                          }
                        }
                      },
                      "productId": 6352
                    }
                  }
                }
              },
              "productId": 6352
            },
            "Porte-lampe, feu de gabarit": {
              "categoryId": 101705,
              "categoryName": "Vehicle Rear",
              "level": 2,
              "children": {
                "Feu de position / d'encombrement / composants": {
                  "categoryId": null,
                  "categoryName": "Feu de position / d'encombrement / composants",
                  "level": 4,
                  "children": {
                    "Porte-lampe, feu de gabarit": {
                      "categoryId": 101785,
                      "categoryName": "Side Marker/End Outline Marker Light/Parts",
                      "level": 3,
                      "children": {
                        "Feu d'encombrement": {
                          "categoryId": null,
                          "categoryName": "Feu d'encombrement",
                          "level": 6,
                          "children": {
                            "Porte-lampe, feu de gabarit": {
                              "categoryId": 101787,
                              "categoryName": "End Outline Marker Light",
                              "level": 4,
                              "children": [],
                              "productId": 4158
                            }
                          }
                        }
                      },
                      "productId": 4158
                    }
                  }
                }
              },
              "productId": 4158
            },
            "Réflecteur, feu de position/d'encombrement": {
              "categoryId": 101705,
              "categoryName": "Vehicle Rear",
              "level": 2,
              "children": {
                "Feu de position / d'encombrement / composants": {
                  "categoryId": null,
                  "categoryName": "Feu de position / d'encombrement / composants",
                  "level": 4,
                  "children": {
                    "Réflecteur, feu de position/d'encombrement": {
                      "categoryId": 101785,
                      "categoryName": "Side Marker/End Outline Marker Light/Parts",
                      "level": 3,
                      "children": {
                        "Feu d'encombrement": {
                          "categoryId": null,
                          "categoryName": "Feu d'encombrement",
                          "level": 6,
                          "children": {
                            "Réflecteur, feu de position/d'encombrement": {
                              "categoryId": 101787,
                              "categoryName": "End Outline Marker Light",
                              "level": 4,
                              "children": [],
                              "productId": 2180
                            }
                          }
                        }
                      },
                      "productId": 2180
                    }
                  }
                }
              },
              "productId": 2180
            },
            "Support de lampe, feu d'encombrement": {
              "categoryId": 101705,
              "categoryName": "Vehicle Rear",
              "level": 2,
              "children": {
                "Feu de position / d'encombrement / composants": {
                  "categoryId": null,
                  "categoryName": "Feu de position / d'encombrement / composants",
                  "level": 4,
                  "children": {
                    "Support de lampe, feu d'encombrement": {
                      "categoryId": 101785,
                      "categoryName": "Side Marker/End Outline Marker Light/Parts",
                      "level": 3,
                      "children": {
                        "Feu d'encombrement": {
                          "categoryId": null,
                          "categoryName": "Feu d'encombrement",
                          "level": 6,
                          "children": {
                            "Support de lampe, feu d'encombrement": {
                              "categoryId": 101787,
                              "categoryName": "End Outline Marker Light",
                              "level": 4,
                              "children": [],
                              "productId": 2086
                            }
                          }
                        }
                      },
                      "productId": 2086
                    }
                  }
                }
              },
              "productId": 2086
            }
          }
        },
        "Avant du véhicule": {
          "categoryId": null,
          "categoryName": "Avant du véhicule",
          "level": 2,
          "children": {
            "Ampoule, feu clignotant/feu-position avant": {
              "categoryId": 101648,
              "categoryName": "Vehicle Front",
              "level": 2,
              "children": {
                "Feu clignotant/composants": {
                  "categoryId": null,
                  "categoryName": "Feu clignotant/composants",
                  "level": 4,
                  "children": {
                    "Ampoule, feu clignotant/feu-position avant": {
                      "categoryId": 101669,
                      "categoryName": "Direction Indicator/Parts",
                      "level": 3,
                      "children": {
                        "Feu clignotant": {
                          "categoryId": null,
                          "categoryName": "Feu clignotant",
                          "level": 6,
                          "children": {
                            "Ampoule, feu clignotant/feu-position avant": {
                              "categoryId": 101670,
                              "categoryName": "Direction Indicator",
                              "level": 4,
                              "children": [],
                              "productId": 3193
                            }
                          }
                        }
                      },
                      "productId": 3193
                    }
                  }
                },
                "Feu de position / d'encombrement / composants": {
                  "categoryId": null,
                  "categoryName": "Feu de position / d'encombrement / composants",
                  "level": 4,
                  "children": {
                    "Ampoule, feu clignotant/feu-position avant": {
                      "categoryId": 101766,
                      "categoryName": "Side Marker/End Outline Marker Light/Parts",
                      "level": 3,
                      "children": {
                        "Feu d'encombrement": {
                          "categoryId": null,
                          "categoryName": "Feu d'encombrement",
                          "level": 6,
                          "children": {
                            "Ampoule, feu clignotant/feu-position avant": {
                              "categoryId": 101768,
                              "categoryName": "End Outline Marker Light",
                              "level": 4,
                              "children": [],
                              "productId": 3193
                            }
                          }
                        }
                      },
                      "productId": 3193
                    }
                  }
                }
              },
              "productId": 3193
            },
            "Ampoule, feu d'encombrement/de position": {
              "categoryId": 101648,
              "categoryName": "Vehicle Front",
              "level": 2,
              "children": {
                "Feu de position / d'encombrement / composants": {
                  "categoryId": null,
                  "categoryName": "Feu de position / d'encombrement / composants",
                  "level": 4,
                  "children": {
                    "Ampoule, feu d'encombrement/de position": {
                      "categoryId": 101766,
                      "categoryName": "Side Marker/End Outline Marker Light/Parts",
                      "level": 3,
                      "children": {
                        "Ampoule": {
                          "categoryId": null,
                          "categoryName": "Ampoule",
                          "level": 6,
                          "children": {
                            "Ampoule, feu d'encombrement/de position": {
                              "categoryId": 101770,
                              "categoryName": "Bulb",
                              "level": 4,
                              "children": [],
                              "productId": 1172
                            }
                          }
                        }
                      },
                      "productId": 1172
                    }
                  }
                }
              },
              "productId": 1172
            },
            "Ampoule, feu de position/d'encombrement": {
              "categoryId": 101648,
              "categoryName": "Vehicle Front",
              "level": 2,
              "children": {
                "Feu de position / d'encombrement / composants": {
                  "categoryId": null,
                  "categoryName": "Feu de position / d'encombrement / composants",
                  "level": 4,
                  "children": {
                    "Ampoule, feu de position/d'encombrement": {
                      "categoryId": 101766,
                      "categoryName": "Side Marker/End Outline Marker Light/Parts",
                      "level": 3,
                      "children": {
                        "Feu d'encombrement": {
                          "categoryId": null,
                          "categoryName": "Feu d'encombrement",
                          "level": 6,
                          "children": {
                            "Ampoule, feu de position/d'encombrement": {
                              "categoryId": 101768,
                              "categoryName": "End Outline Marker Light",
                              "level": 4,
                              "children": [],
                              "productId": 2126
                            }
                          }
                        },
                        "Feu de stationnement/de position": {
                          "categoryId": null,
                          "categoryName": "Feu de stationnement/de position",
                          "level": 6,
                          "children": {
                            "Ampoule, feu de position/d'encombrement": {
                              "categoryId": 101767,
                              "categoryName": "Park/Position Light",
                              "level": 4,
                              "children": [],
                              "productId": 2126
                            }
                          }
                        }
                      },
                      "productId": 2126
                    }
                  }
                }
              },
              "productId": 2126
            },
            "Boitier, feu de position": {
              "categoryId": 101648,
              "categoryName": "Vehicle Front",
              "level": 2,
              "children": {
                "Feu de position / d'encombrement / composants": {
                  "categoryId": null,
                  "categoryName": "Feu de position / d'encombrement / composants",
                  "level": 4,
                  "children": {
                    "Boitier, feu de position": {
                      "categoryId": 101766,
                      "categoryName": "Side Marker/End Outline Marker Light/Parts",
                      "level": 3,
                      "children": {
                        "Feu d'encombrement": {
                          "categoryId": null,
                          "categoryName": "Feu d'encombrement",
                          "level": 6,
                          "children": {
                            "Boitier, feu de position": {
                              "categoryId": 101768,
                              "categoryName": "End Outline Marker Light",
                              "level": 4,
                              "children": [],
                              "productId": 3828
                            }
                          }
                        }
                      },
                      "productId": 3828
                    }
                  }
                }
              },
              "productId": 3828
            },
            "Disperseur, feu d'encombrement": {
              "categoryId": 101648,
              "categoryName": "Vehicle Front",
              "level": 2,
              "children": {
                "Feu de position / d'encombrement / composants": {
                  "categoryId": null,
                  "categoryName": "Feu de position / d'encombrement / composants",
                  "level": 4,
                  "children": {
                    "Disperseur, feu d'encombrement": {
                      "categoryId": 101766,
                      "categoryName": "Side Marker/End Outline Marker Light/Parts",
                      "level": 3,
                      "children": {
                        "Composants": {
                          "categoryId": null,
                          "categoryName": "Composants",
                          "level": 6,
                          "children": {
                            "Disperseur, feu d'encombrement": {
                              "categoryId": 101771,
                              "categoryName": "Parts",
                              "level": 4,
                              "children": [],
                              "productId": 1175
                            }
                          }
                        }
                      },
                      "productId": 1175
                    }
                  }
                }
              },
              "productId": 1175
            },
            "Disperseur, feu de gabarit": {
              "categoryId": 101648,
              "categoryName": "Vehicle Front",
              "level": 2,
              "children": {
                "Feu de position / d'encombrement / composants": {
                  "categoryId": null,
                  "categoryName": "Feu de position / d'encombrement / composants",
                  "level": 4,
                  "children": {
                    "Disperseur, feu de gabarit": {
                      "categoryId": 101766,
                      "categoryName": "Side Marker/End Outline Marker Light/Parts",
                      "level": 3,
                      "children": {
                        "Feu d'encombrement": {
                          "categoryId": null,
                          "categoryName": "Feu d'encombrement",
                          "level": 6,
                          "children": {
                            "Disperseur, feu de gabarit": {
                              "categoryId": 101768,
                              "categoryName": "End Outline Marker Light",
                              "level": 4,
                              "children": [],
                              "productId": 3458
                            }
                          }
                        }
                      },
                      "productId": 3458
                    }
                  }
                }
              },
              "productId": 3458
            },
            "Feu d'encombrement": {
              "categoryId": 101648,
              "categoryName": "Vehicle Front",
              "level": 2,
              "children": {
                "Feu de position / d'encombrement / composants": {
                  "categoryId": null,
                  "categoryName": "Feu de position / d'encombrement / composants",
                  "level": 4,
                  "children": {
                    "Feu d'encombrement": {
                      "categoryId": 101766,
                      "categoryName": "Side Marker/End Outline Marker Light/Parts",
                      "level": 3,
                      "children": {
                        "Feu d'encombrement": {
                          "categoryId": null,
                          "categoryName": "Feu d'encombrement",
                          "level": 6,
                          "children": {
                            "Feu d'encombrement": {
                              "categoryId": 101768,
                              "categoryName": "End Outline Marker Light",
                              "level": 4,
                              "children": [],
                              "productId": 1350
                            }
                          }
                        }
                      },
                      "productId": 1350
                    }
                  }
                }
              },
              "productId": 1350
            },
            "Feu de position": {
              "categoryId": 101648,
              "categoryName": "Vehicle Front",
              "level": 2,
              "children": {
                "Feu de position / d'encombrement / composants": {
                  "categoryId": null,
                  "categoryName": "Feu de position / d'encombrement / composants",
                  "level": 4,
                  "children": {
                    "Feu de position": {
                      "categoryId": 101766,
                      "categoryName": "Side Marker/End Outline Marker Light/Parts",
                      "level": 3,
                      "children": {
                        "Feu d'encombrement": {
                          "categoryId": null,
                          "categoryName": "Feu d'encombrement",
                          "level": 6,
                          "children": {
                            "Feu de position": {
                              "categoryId": 101768,
                              "categoryName": "End Outline Marker Light",
                              "level": 4,
                              "children": [],
                              "productId": 294
                            }
                          }
                        }
                      },
                      "productId": 294
                    }
                  }
                }
              },
              "productId": 294
            },
            "Joint d'étanchéité, feu de position": {
              "categoryId": 101648,
              "categoryName": "Vehicle Front",
              "level": 2,
              "children": {
                "Feu de position / d'encombrement / composants": {
                  "categoryId": null,
                  "categoryName": "Feu de position / d'encombrement / composants",
                  "level": 4,
                  "children": {
                    "Joint d'étanchéité, feu de position": {
                      "categoryId": 101766,
                      "categoryName": "Side Marker/End Outline Marker Light/Parts",
                      "level": 3,
                      "children": {
                        "Feu d'encombrement": {
                          "categoryId": null,
                          "categoryName": "Feu d'encombrement",
                          "level": 6,
                          "children": {
                            "Joint d'étanchéité, feu de position": {
                              "categoryId": 101768,
                              "categoryName": "End Outline Marker Light",
                              "level": 4,
                              "children": [],
                              "productId": 2207
                            }
                          }
                        }
                      },
                      "productId": 2207
                    }
                  }
                }
              },
              "productId": 2207
            },
            "Joint, feu d'encombrement": {
              "categoryId": 101648,
              "categoryName": "Vehicle Front",
              "level": 2,
              "children": {
                "Feu de position / d'encombrement / composants": {
                  "categoryId": null,
                  "categoryName": "Feu de position / d'encombrement / composants",
                  "level": 4,
                  "children": {
                    "Joint, feu d'encombrement": {
                      "categoryId": 101766,
                      "categoryName": "Side Marker/End Outline Marker Light/Parts",
                      "level": 3,
                      "children": {
                        "Composants": {
                          "categoryId": null,
                          "categoryName": "Composants",
                          "level": 6,
                          "children": {
                            "Joint, feu d'encombrement": {
                              "categoryId": 101771,
                              "categoryName": "Parts",
                              "level": 4,
                              "children": [],
                              "productId": 3122
                            }
                          }
                        }
                      },
                      "productId": 3122
                    }
                  }
                }
              },
              "productId": 3122
            },
            "Kit réparation de câble, feu de position": {
              "categoryId": 101648,
              "categoryName": "Vehicle Front",
              "level": 2,
              "children": {
                "Feu de position / d'encombrement / composants": {
                  "categoryId": null,
                  "categoryName": "Feu de position / d'encombrement / composants",
                  "level": 4,
                  "children": {
                    "Kit réparation de câble, feu de position": {
                      "categoryId": 101766,
                      "categoryName": "Side Marker/End Outline Marker Light/Parts",
                      "level": 3,
                      "children": {
                        "Feu d'encombrement": {
                          "categoryId": null,
                          "categoryName": "Feu d'encombrement",
                          "level": 6,
                          "children": {
                            "Kit réparation de câble, feu de position": {
                              "categoryId": 101768,
                              "categoryName": "End Outline Marker Light",
                              "level": 4,
                              "children": [],
                              "productId": 6352
                            }
                          }
                        }
                      },
                      "productId": 6352
                    }
                  }
                }
              },
              "productId": 6352
            },
            "Porte-lampe, feu de gabarit": {
              "categoryId": 101648,
              "categoryName": "Vehicle Front",
              "level": 2,
              "children": {
                "Feu de position / d'encombrement / composants": {
                  "categoryId": null,
                  "categoryName": "Feu de position / d'encombrement / composants",
                  "level": 4,
                  "children": {
                    "Porte-lampe, feu de gabarit": {
                      "categoryId": 101766,
                      "categoryName": "Side Marker/End Outline Marker Light/Parts",
                      "level": 3,
                      "children": {
                        "Feu d'encombrement": {
                          "categoryId": null,
                          "categoryName": "Feu d'encombrement",
                          "level": 6,
                          "children": {
                            "Porte-lampe, feu de gabarit": {
                              "categoryId": 101768,
                              "categoryName": "End Outline Marker Light",
                              "level": 4,
                              "children": [],
                              "productId": 4158
                            }
                          }
                        }
                      },
                      "productId": 4158
                    }
                  }
                }
              },
              "productId": 4158
            },
            "Réflecteur, feu de position/d'encombrement": {
              "categoryId": 101648,
              "categoryName": "Vehicle Front",
              "level": 2,
              "children": {
                "Feu de position / d'encombrement / composants": {
                  "categoryId": null,
                  "categoryName": "Feu de position / d'encombrement / composants",
                  "level": 4,
                  "children": {
                    "Réflecteur, feu de position/d'encombrement": {
                      "categoryId": 101766,
                      "categoryName": "Side Marker/End Outline Marker Light/Parts",
                      "level": 3,
                      "children": {
                        "Feu d'encombrement": {
                          "categoryId": null,
                          "categoryName": "Feu d'encombrement",
                          "level": 6,
                          "children": {
                            "Réflecteur, feu de position/d'encombrement": {
                              "categoryId": 101768,
                              "categoryName": "End Outline Marker Light",
                              "level": 4,
                              "children": [],
                              "productId": 2180
                            }
                          }
                        }
                      },
                      "productId": 2180
                    }
                  }
                }
              },
              "productId": 2180
            },
            "Support de lampe, feu d'encombrement": {
              "categoryId": 101648,
              "categoryName": "Vehicle Front",
              "level": 2,
              "children": {
                "Feu de position / d'encombrement / composants": {
                  "categoryId": null,
                  "categoryName": "Feu de position / d'encombrement / composants",
                  "level": 4,
                  "children": {
                    "Support de lampe, feu d'encombrement": {
                      "categoryId": 101766,
                      "categoryName": "Side Marker/End Outline Marker Light/Parts",
                      "level": 3,
                      "children": {
                        "Feu d'encombrement": {
                          "categoryId": null,
                          "categoryName": "Feu d'encombrement",
                          "level": 6,
                          "children": {
                            "Support de lampe, feu d'encombrement": {
                              "categoryId": 101768,
                              "categoryName": "End Outline Marker Light",
                              "level": 4,
                              "children": [],
                              "productId": 2086
                            }
                          }
                        }
                      },
                      "productId": 2086
                    }
                  }
                }
              },
              "productId": 2086
            }
          }
        },
        "Feux": {
          "categoryId": null,
          "categoryName": "Feux",
          "level": 2,
          "children": {
            "Ampoule, feu clignotant/feu-position avant": {
              "categoryId": 101407,
              "categoryName": "Lights",
              "level": 2,
              "children": {
                "Feu clignotant/composants": {
                  "categoryId": null,
                  "categoryName": "Feu clignotant/composants",
                  "level": 4,
                  "children": {
                    "Ampoule, feu clignotant/feu-position avant": {
                      "categoryId": 101420,
                      "categoryName": "Direction Indicator/Parts",
                      "level": 3,
                      "children": {
                        "Feu clignotant": {
                          "categoryId": null,
                          "categoryName": "Feu clignotant",
                          "level": 6,
                          "children": {
                            "Ampoule, feu clignotant/feu-position avant": {
                              "categoryId": 101421,
                              "categoryName": "Direction Indicator",
                              "level": 4,
                              "children": [],
                              "productId": 3193
                            }
                          }
                        }
                      },
                      "productId": 3193
                    }
                  }
                },
                "Feu de position / d'encombrement / composants": {
                  "categoryId": null,
                  "categoryName": "Feu de position / d'encombrement / composants",
                  "level": 4,
                  "children": {
                    "Ampoule, feu clignotant/feu-position avant": {
                      "categoryId": 101441,
                      "categoryName": "Side Marker/End Outline Marker Light/Parts",
                      "level": 3,
                      "children": {
                        "Feu d'encombrement": {
                          "categoryId": null,
                          "categoryName": "Feu d'encombrement",
                          "level": 6,
                          "children": {
                            "Ampoule, feu clignotant/feu-position avant": {
                              "categoryId": 101443,
                              "categoryName": "End Outline Marker Light",
                              "level": 4,
                              "children": [],
                              "productId": 3193
                            }
                          }
                        }
                      },
                      "productId": 3193
                    }
                  }
                }
              },
              "productId": 3193
            },
            "Ampoule, feu d'encombrement/de position": {
              "categoryId": 101407,
              "categoryName": "Lights",
              "level": 2,
              "children": {
                "Feu de position / d'encombrement / composants": {
                  "categoryId": null,
                  "categoryName": "Feu de position / d'encombrement / composants",
                  "level": 4,
                  "children": {
                    "Ampoule, feu d'encombrement/de position": {
                      "categoryId": 101441,
                      "categoryName": "Side Marker/End Outline Marker Light/Parts",
                      "level": 3,
                      "children": {
                        "Ampoule": {
                          "categoryId": null,
                          "categoryName": "Ampoule",
                          "level": 6,
                          "children": {
                            "Ampoule, feu d'encombrement/de position": {
                              "categoryId": 101445,
                              "categoryName": "Bulb",
                              "level": 4,
                              "children": [],
                              "productId": 1172
                            }
                          }
                        }
                      },
                      "productId": 1172
                    }
                  }
                }
              },
              "productId": 1172
            },
            "Ampoule, feu de position/d'encombrement": {
              "categoryId": 101407,
              "categoryName": "Lights",
              "level": 2,
              "children": {
                "Feu de position / d'encombrement / composants": {
                  "categoryId": null,
                  "categoryName": "Feu de position / d'encombrement / composants",
                  "level": 4,
                  "children": {
                    "Ampoule, feu de position/d'encombrement": {
                      "categoryId": 101441,
                      "categoryName": "Side Marker/End Outline Marker Light/Parts",
                      "level": 3,
                      "children": {
                        "Feu d'encombrement": {
                          "categoryId": null,
                          "categoryName": "Feu d'encombrement",
                          "level": 6,
                          "children": {
                            "Ampoule, feu de position/d'encombrement": {
                              "categoryId": 101443,
                              "categoryName": "End Outline Marker Light",
                              "level": 4,
                              "children": [],
                              "productId": 2126
                            }
                          }
                        },
                        "Feu de stationnement/de position": {
                          "categoryId": null,
                          "categoryName": "Feu de stationnement/de position",
                          "level": 6,
                          "children": {
                            "Ampoule, feu de position/d'encombrement": {
                              "categoryId": 101442,
                              "categoryName": "Park/Position Light",
                              "level": 4,
                              "children": [],
                              "productId": 2126
                            }
                          }
                        }
                      },
                      "productId": 2126
                    }
                  }
                }
              },
              "productId": 2126
            },
            "Boitier, feu de position": {
              "categoryId": 101407,
              "categoryName": "Lights",
              "level": 2,
              "children": {
                "Feu de position / d'encombrement / composants": {
                  "categoryId": null,
                  "categoryName": "Feu de position / d'encombrement / composants",
                  "level": 4,
                  "children": {
                    "Boitier, feu de position": {
                      "categoryId": 101441,
                      "categoryName": "Side Marker/End Outline Marker Light/Parts",
                      "level": 3,
                      "children": {
                        "Feu d'encombrement": {
                          "categoryId": null,
                          "categoryName": "Feu d'encombrement",
                          "level": 6,
                          "children": {
                            "Boitier, feu de position": {
                              "categoryId": 101443,
                              "categoryName": "End Outline Marker Light",
                              "level": 4,
                              "children": [],
                              "productId": 3828
                            }
                          }
                        }
                      },
                      "productId": 3828
                    }
                  }
                }
              },
              "productId": 3828
            },
            "Disperseur, feu d'encombrement": {
              "categoryId": 101407,
              "categoryName": "Lights",
              "level": 2,
              "children": {
                "Feu de position / d'encombrement / composants": {
                  "categoryId": null,
                  "categoryName": "Feu de position / d'encombrement / composants",
                  "level": 4,
                  "children": {
                    "Disperseur, feu d'encombrement": {
                      "categoryId": 101441,
                      "categoryName": "Side Marker/End Outline Marker Light/Parts",
                      "level": 3,
                      "children": {
                        "Composants": {
                          "categoryId": null,
                          "categoryName": "Composants",
                          "level": 6,
                          "children": {
                            "Disperseur, feu d'encombrement": {
                              "categoryId": 101446,
                              "categoryName": "Parts",
                              "level": 4,
                              "children": [],
                              "productId": 1175
                            }
                          }
                        }
                      },
                      "productId": 1175
                    }
                  }
                }
              },
              "productId": 1175
            },
            "Disperseur, feu de gabarit": {
              "categoryId": 101407,
              "categoryName": "Lights",
              "level": 2,
              "children": {
                "Feu de position / d'encombrement / composants": {
                  "categoryId": null,
                  "categoryName": "Feu de position / d'encombrement / composants",
                  "level": 4,
                  "children": {
                    "Disperseur, feu de gabarit": {
                      "categoryId": 101441,
                      "categoryName": "Side Marker/End Outline Marker Light/Parts",
                      "level": 3,
                      "children": {
                        "Feu d'encombrement": {
                          "categoryId": null,
                          "categoryName": "Feu d'encombrement",
                          "level": 6,
                          "children": {
                            "Disperseur, feu de gabarit": {
                              "categoryId": 101443,
                              "categoryName": "End Outline Marker Light",
                              "level": 4,
                              "children": [],
                              "productId": 3458
                            }
                          }
                        }
                      },
                      "productId": 3458
                    }
                  }
                }
              },
              "productId": 3458
            },
            "Feu d'encombrement": {
              "categoryId": 101407,
              "categoryName": "Lights",
              "level": 2,
              "children": {
                "Feu de position / d'encombrement / composants": {
                  "categoryId": null,
                  "categoryName": "Feu de position / d'encombrement / composants",
                  "level": 4,
                  "children": {
                    "Feu d'encombrement": {
                      "categoryId": 101441,
                      "categoryName": "Side Marker/End Outline Marker Light/Parts",
                      "level": 3,
                      "children": {
                        "Feu d'encombrement": {
                          "categoryId": null,
                          "categoryName": "Feu d'encombrement",
                          "level": 6,
                          "children": {
                            "Feu d'encombrement": {
                              "categoryId": 101443,
                              "categoryName": "End Outline Marker Light",
                              "level": 4,
                              "children": [],
                              "productId": 1350
                            }
                          }
                        }
                      },
                      "productId": 1350
                    }
                  }
                }
              },
              "productId": 1350
            },
            "Feu de position": {
              "categoryId": 101407,
              "categoryName": "Lights",
              "level": 2,
              "children": {
                "Feu de position / d'encombrement / composants": {
                  "categoryId": null,
                  "categoryName": "Feu de position / d'encombrement / composants",
                  "level": 4,
                  "children": {
                    "Feu de position": {
                      "categoryId": 101441,
                      "categoryName": "Side Marker/End Outline Marker Light/Parts",
                      "level": 3,
                      "children": {
                        "Feu d'encombrement": {
                          "categoryId": null,
                          "categoryName": "Feu d'encombrement",
                          "level": 6,
                          "children": {
                            "Feu de position": {
                              "categoryId": 101443,
                              "categoryName": "End Outline Marker Light",
                              "level": 4,
                              "children": [],
                              "productId": 294
                            }
                          }
                        }
                      },
                      "productId": 294
                    }
                  }
                }
              },
              "productId": 294
            },
            "Joint d'étanchéité, feu de position": {
              "categoryId": 101407,
              "categoryName": "Lights",
              "level": 2,
              "children": {
                "Feu de position / d'encombrement / composants": {
                  "categoryId": null,
                  "categoryName": "Feu de position / d'encombrement / composants",
                  "level": 4,
                  "children": {
                    "Joint d'étanchéité, feu de position": {
                      "categoryId": 101441,
                      "categoryName": "Side Marker/End Outline Marker Light/Parts",
                      "level": 3,
                      "children": {
                        "Feu d'encombrement": {
                          "categoryId": null,
                          "categoryName": "Feu d'encombrement",
                          "level": 6,
                          "children": {
                            "Joint d'étanchéité, feu de position": {
                              "categoryId": 101443,
                              "categoryName": "End Outline Marker Light",
                              "level": 4,
                              "children": [],
                              "productId": 2207
                            }
                          }
                        }
                      },
                      "productId": 2207
                    }
                  }
                }
              },
              "productId": 2207
            },
            "Joint, feu d'encombrement": {
              "categoryId": 101407,
              "categoryName": "Lights",
              "level": 2,
              "children": {
                "Feu de position / d'encombrement / composants": {
                  "categoryId": null,
                  "categoryName": "Feu de position / d'encombrement / composants",
                  "level": 4,
                  "children": {
                    "Joint, feu d'encombrement": {
                      "categoryId": 101441,
                      "categoryName": "Side Marker/End Outline Marker Light/Parts",
                      "level": 3,
                      "children": {
                        "Composants": {
                          "categoryId": null,
                          "categoryName": "Composants",
                          "level": 6,
                          "children": {
                            "Joint, feu d'encombrement": {
                              "categoryId": 101446,
                              "categoryName": "Parts",
                              "level": 4,
                              "children": [],
                              "productId": 3122
                            }
                          }
                        }
                      },
                      "productId": 3122
                    }
                  }
                }
              },
              "productId": 3122
            },
            "Kit réparation de câble, feu de position": {
              "categoryId": 101407,
              "categoryName": "Lights",
              "level": 2,
              "children": {
                "Feu de position / d'encombrement / composants": {
                  "categoryId": null,
                  "categoryName": "Feu de position / d'encombrement / composants",
                  "level": 4,
                  "children": {
                    "Kit réparation de câble, feu de position": {
                      "categoryId": 101441,
                      "categoryName": "Side Marker/End Outline Marker Light/Parts",
                      "level": 3,
                      "children": {
                        "Feu d'encombrement": {
                          "categoryId": null,
                          "categoryName": "Feu d'encombrement",
                          "level": 6,
                          "children": {
                            "Kit réparation de câble, feu de position": {
                              "categoryId": 101443,
                              "categoryName": "End Outline Marker Light",
                              "level": 4,
                              "children": [],
                              "productId": 6352
                            }
                          }
                        }
                      },
                      "productId": 6352
                    }
                  }
                }
              },
              "productId": 6352
            },
            "Porte-lampe, feu de gabarit": {
              "categoryId": 101407,
              "categoryName": "Lights",
              "level": 2,
              "children": {
                "Feu de position / d'encombrement / composants": {
                  "categoryId": null,
                  "categoryName": "Feu de position / d'encombrement / composants",
                  "level": 4,
                  "children": {
                    "Porte-lampe, feu de gabarit": {
                      "categoryId": 101441,
                      "categoryName": "Side Marker/End Outline Marker Light/Parts",
                      "level": 3,
                      "children": {
                        "Feu d'encombrement": {
                          "categoryId": null,
                          "categoryName": "Feu d'encombrement",
                          "level": 6,
                          "children": {
                            "Porte-lampe, feu de gabarit": {
                              "categoryId": 101443,
                              "categoryName": "End Outline Marker Light",
                              "level": 4,
                              "children": [],
                              "productId": 4158
                            }
                          }
                        }
                      },
                      "productId": 4158
                    }
                  }
                }
              },
              "productId": 4158
            },
            "Réflecteur, feu de position/d'encombrement": {
              "categoryId": 101407,
              "categoryName": "Lights",
              "level": 2,
              "children": {
                "Feu de position / d'encombrement / composants": {
                  "categoryId": null,
                  "categoryName": "Feu de position / d'encombrement / composants",
                  "level": 4,
                  "children": {
                    "Réflecteur, feu de position/d'encombrement": {
                      "categoryId": 101441,
                      "categoryName": "Side Marker/End Outline Marker Light/Parts",
                      "level": 3,
                      "children": {
                        "Feu d'encombrement": {
                          "categoryId": null,
                          "categoryName": "Feu d'encombrement",
                          "level": 6,
                          "children": {
                            "Réflecteur, feu de position/d'encombrement": {
                              "categoryId": 101443,
                              "categoryName": "End Outline Marker Light",
                              "level": 4,
                              "children": [],
                              "productId": 2180
                            }
                          }
                        }
                      },
                      "productId": 2180
                    }
                  }
                }
              },
              "productId": 2180
            },
            "Support de lampe, feu d'encombrement": {
              "categoryId": 101407,
              "categoryName": "Lights",
              "level": 2,
              "children": {
                "Feu de position / d'encombrement / composants": {
                  "categoryId": null,
                  "categoryName": "Feu de position / d'encombrement / composants",
                  "level": 4,
                  "children": {
                    "Support de lampe, feu d'encombrement": {
                      "categoryId": 101441,
                      "categoryName": "Side Marker/End Outline Marker Light/Parts",
                      "level": 3,
                      "children": {
                        "Feu d'encombrement": {
                          "categoryId": null,
                          "categoryName": "Feu d'encombrement",
                          "level": 6,
                          "children": {
                            "Support de lampe, feu d'encombrement": {
                              "categoryId": 101443,
                              "categoryName": "End Outline Marker Light",
                              "level": 4,
                              "children": [],
                              "productId": 2086
                            }
                          }
                        }
                      },
                      "productId": 2086
                    }
                  }
                }
              },
              "productId": 2086
            }
          }
        }
      }
    },
    "Système électrique": {
      "categoryId": 100010,
      "categoryName": "Système électrique",
      "level": 1,
      "children": {
        "Feux": {
          "categoryId": null,
          "categoryName": "Feux",
          "level": 2,
          "children": {
            "Ampoule, feu clignotant/feu-position avant": {
              "categoryId": 100043,
              "categoryName": "Lights",
              "level": 2,
              "children": {
                "Feu clignotant/composants": {
                  "categoryId": null,
                  "categoryName": "Feu clignotant/composants",
                  "level": 4,
                  "children": {
                    "Ampoule, feu clignotant/feu-position avant": {
                      "categoryId": 100145,
                      "categoryName": "Direction Indicator/Parts",
                      "level": 3,
                      "children": {
                        "Feu clignotant": {
                          "categoryId": null,
                          "categoryName": "Feu clignotant",
                          "level": 6,
                          "children": {
                            "Ampoule, feu clignotant/feu-position avant": {
                              "categoryId": 100463,
                              "categoryName": "Direction Indicator",
                              "level": 4,
                              "children": [],
                              "productId": 3193
                            }
                          }
                        }
                      },
                      "productId": 3193
                    }
                  }
                },
                "Feu de position / d'encombrement / composants": {
                  "categoryId": null,
                  "categoryName": "Feu de position / d'encombrement / composants",
                  "level": 4,
                  "children": {
                    "Ampoule, feu clignotant/feu-position avant": {
                      "categoryId": 100290,
                      "categoryName": "Side Marker/End Outline Marker Light/Parts",
                      "level": 3,
                      "children": {
                        "Feu d'encombrement": {
                          "categoryId": null,
                          "categoryName": "Feu d'encombrement",
                          "level": 6,
                          "children": {
                            "Ampoule, feu clignotant/feu-position avant": {
                              "categoryId": 100469,
                              "categoryName": "End Outline Marker Light",
                              "level": 4,
                              "children": [],
                              "productId": 3193
                            }
                          }
                        }
                      },
                      "productId": 3193
                    }
                  }
                }
              },
              "productId": 3193
            },
            "Ampoule, feu d'encombrement/de position": {
              "categoryId": 100043,
              "categoryName": "Lights",
              "level": 2,
              "children": {
                "Feu de position / d'encombrement / composants": {
                  "categoryId": null,
                  "categoryName": "Feu de position / d'encombrement / composants",
                  "level": 4,
                  "children": {
                    "Ampoule, feu d'encombrement/de position": {
                      "categoryId": 100290,
                      "categoryName": "Side Marker/End Outline Marker Light/Parts",
                      "level": 3,
                      "children": {
                        "Ampoule": {
                          "categoryId": null,
                          "categoryName": "Ampoule",
                          "level": 6,
                          "children": {
                            "Ampoule, feu d'encombrement/de position": {
                              "categoryId": 100503,
                              "categoryName": "Bulb",
                              "level": 4,
                              "children": [],
                              "productId": 1172
                            }
                          }
                        }
                      },
                      "productId": 1172
                    }
                  }
                }
              },
              "productId": 1172
            },
            "Ampoule, feu de position/d'encombrement": {
              "categoryId": 100043,
              "categoryName": "Lights",
              "level": 2,
              "children": {
                "Feu de position / d'encombrement / composants": {
                  "categoryId": null,
                  "categoryName": "Feu de position / d'encombrement / composants",
                  "level": 4,
                  "children": {
                    "Ampoule, feu de position/d'encombrement": {
                      "categoryId": 100290,
                      "categoryName": "Side Marker/End Outline Marker Light/Parts",
                      "level": 3,
                      "children": {
                        "Feu d'encombrement": {
                          "categoryId": null,
                          "categoryName": "Feu d'encombrement",
                          "level": 6,
                          "children": {
                            "Ampoule, feu de position/d'encombrement": {
                              "categoryId": 100469,
                              "categoryName": "End Outline Marker Light",
                              "level": 4,
                              "children": [],
                              "productId": 2126
                            }
                          }
                        },
                        "Feu de stationnement/de position": {
                          "categoryId": null,
                          "categoryName": "Feu de stationnement/de position",
                          "level": 6,
                          "children": {
                            "Ampoule, feu de position/d'encombrement": {
                              "categoryId": 100468,
                              "categoryName": "Park/Position Light",
                              "level": 4,
                              "children": [],
                              "productId": 2126
                            }
                          }
                        }
                      },
                      "productId": 2126
                    }
                  }
                }
              },
              "productId": 2126
            },
            "Boitier, feu de position": {
              "categoryId": 100043,
              "categoryName": "Lights",
              "level": 2,
              "children": {
                "Feu de position / d'encombrement / composants": {
                  "categoryId": null,
                  "categoryName": "Feu de position / d'encombrement / composants",
                  "level": 4,
                  "children": {
                    "Boitier, feu de position": {
                      "categoryId": 100290,
                      "categoryName": "Side Marker/End Outline Marker Light/Parts",
                      "level": 3,
                      "children": {
                        "Feu d'encombrement": {
                          "categoryId": null,
                          "categoryName": "Feu d'encombrement",
                          "level": 6,
                          "children": {
                            "Boitier, feu de position": {
                              "categoryId": 100469,
                              "categoryName": "End Outline Marker Light",
                              "level": 4,
                              "children": [],
                              "productId": 3828
                            }
                          }
                        }
                      },
                      "productId": 3828
                    }
                  }
                }
              },
              "productId": 3828
            },
            "Disperseur, feu d'encombrement": {
              "categoryId": 100043,
              "categoryName": "Lights",
              "level": 2,
              "children": {
                "Feu de position / d'encombrement / composants": {
                  "categoryId": null,
                  "categoryName": "Feu de position / d'encombrement / composants",
                  "level": 4,
                  "children": {
                    "Disperseur, feu d'encombrement": {
                      "categoryId": 100290,
                      "categoryName": "Side Marker/End Outline Marker Light/Parts",
                      "level": 3,
                      "children": {
                        "Composants": {
                          "categoryId": null,
                          "categoryName": "Composants",
                          "level": 6,
                          "children": {
                            "Disperseur, feu d'encombrement": {
                              "categoryId": 100495,
                              "categoryName": "Parts",
                              "level": 4,
                              "children": [],
                              "productId": 1175
                            }
                          }
                        }
                      },
                      "productId": 1175
                    }
                  }
                }
              },
              "productId": 1175
            },
            "Disperseur, feu de gabarit": {
              "categoryId": 100043,
              "categoryName": "Lights",
              "level": 2,
              "children": {
                "Feu de position / d'encombrement / composants": {
                  "categoryId": null,
                  "categoryName": "Feu de position / d'encombrement / composants",
                  "level": 4,
                  "children": {
                    "Disperseur, feu de gabarit": {
                      "categoryId": 100290,
                      "categoryName": "Side Marker/End Outline Marker Light/Parts",
                      "level": 3,
                      "children": {
                        "Feu d'encombrement": {
                          "categoryId": null,
                          "categoryName": "Feu d'encombrement",
                          "level": 6,
                          "children": {
                            "Disperseur, feu de gabarit": {
                              "categoryId": 100469,
                              "categoryName": "End Outline Marker Light",
                              "level": 4,
                              "children": [],
                              "productId": 3458
                            }
                          }
                        }
                      },
                      "productId": 3458
                    }
                  }
                }
              },
              "productId": 3458
            },
            "Feu d'encombrement": {
              "categoryId": 100043,
              "categoryName": "Lights",
              "level": 2,
              "children": {
                "Feu de position / d'encombrement / composants": {
                  "categoryId": null,
                  "categoryName": "Feu de position / d'encombrement / composants",
                  "level": 4,
                  "children": {
                    "Feu d'encombrement": {
                      "categoryId": 100290,
                      "categoryName": "Side Marker/End Outline Marker Light/Parts",
                      "level": 3,
                      "children": {
                        "Feu d'encombrement": {
                          "categoryId": null,
                          "categoryName": "Feu d'encombrement",
                          "level": 6,
                          "children": {
                            "Feu d'encombrement": {
                              "categoryId": 100469,
                              "categoryName": "End Outline Marker Light",
                              "level": 4,
                              "children": [],
                              "productId": 1350
                            }
                          }
                        }
                      },
                      "productId": 1350
                    }
                  }
                }
              },
              "productId": 1350
            },
            "Feu de position": {
              "categoryId": 100043,
              "categoryName": "Lights",
              "level": 2,
              "children": {
                "Feu de position / d'encombrement / composants": {
                  "categoryId": null,
                  "categoryName": "Feu de position / d'encombrement / composants",
                  "level": 4,
                  "children": {
                    "Feu de position": {
                      "categoryId": 100290,
                      "categoryName": "Side Marker/End Outline Marker Light/Parts",
                      "level": 3,
                      "children": {
                        "Feu d'encombrement": {
                          "categoryId": null,
                          "categoryName": "Feu d'encombrement",
                          "level": 6,
                          "children": {
                            "Feu de position": {
                              "categoryId": 100469,
                              "categoryName": "End Outline Marker Light",
                              "level": 4,
                              "children": [],
                              "productId": 294
                            }
                          }
                        }
                      },
                      "productId": 294
                    }
                  }
                }
              },
              "productId": 294
            },
            "Joint d'étanchéité, feu de position": {
              "categoryId": 100043,
              "categoryName": "Lights",
              "level": 2,
              "children": {
                "Feu de position / d'encombrement / composants": {
                  "categoryId": null,
                  "categoryName": "Feu de position / d'encombrement / composants",
                  "level": 4,
                  "children": {
                    "Joint d'étanchéité, feu de position": {
                      "categoryId": 100290,
                      "categoryName": "Side Marker/End Outline Marker Light/Parts",
                      "level": 3,
                      "children": {
                        "Feu d'encombrement": {
                          "categoryId": null,
                          "categoryName": "Feu d'encombrement",
                          "level": 6,
                          "children": {
                            "Joint d'étanchéité, feu de position": {
                              "categoryId": 100469,
                              "categoryName": "End Outline Marker Light",
                              "level": 4,
                              "children": [],
                              "productId": 2207
                            }
                          }
                        }
                      },
                      "productId": 2207
                    }
                  }
                }
              },
              "productId": 2207
            },
            "Joint, feu d'encombrement": {
              "categoryId": 100043,
              "categoryName": "Lights",
              "level": 2,
              "children": {
                "Feu de position / d'encombrement / composants": {
                  "categoryId": null,
                  "categoryName": "Feu de position / d'encombrement / composants",
                  "level": 4,
                  "children": {
                    "Joint, feu d'encombrement": {
                      "categoryId": 100290,
                      "categoryName": "Side Marker/End Outline Marker Light/Parts",
                      "level": 3,
                      "children": {
                        "Composants": {
                          "categoryId": null,
                          "categoryName": "Composants",
                          "level": 6,
                          "children": {
                            "Joint, feu d'encombrement": {
                              "categoryId": 100495,
                              "categoryName": "Parts",
                              "level": 4,
                              "children": [],
                              "productId": 3122
                            }
                          }
                        }
                      },
                      "productId": 3122
                    }
                  }
                }
              },
              "productId": 3122
            },
            "Kit réparation de câble, feu de position": {
              "categoryId": 100043,
              "categoryName": "Lights",
              "level": 2,
              "children": {
                "Feu de position / d'encombrement / composants": {
                  "categoryId": null,
                  "categoryName": "Feu de position / d'encombrement / composants",
                  "level": 4,
                  "children": {
                    "Kit réparation de câble, feu de position": {
                      "categoryId": 100290,
                      "categoryName": "Side Marker/End Outline Marker Light/Parts",
                      "level": 3,
                      "children": {
                        "Feu d'encombrement": {
                          "categoryId": null,
                          "categoryName": "Feu d'encombrement",
                          "level": 6,
                          "children": {
                            "Kit réparation de câble, feu de position": {
                              "categoryId": 100469,
                              "categoryName": "End Outline Marker Light",
                              "level": 4,
                              "children": [],
                              "productId": 6352
                            }
                          }
                        }
                      },
                      "productId": 6352
                    }
                  }
                }
              },
              "productId": 6352
            },
            "Porte-lampe, feu de gabarit": {
              "categoryId": 100043,
              "categoryName": "Lights",
              "level": 2,
              "children": {
                "Feu de position / d'encombrement / composants": {
                  "categoryId": null,
                  "categoryName": "Feu de position / d'encombrement / composants",
                  "level": 4,
                  "children": {
                    "Porte-lampe, feu de gabarit": {
                      "categoryId": 100290,
                      "categoryName": "Side Marker/End Outline Marker Light/Parts",
                      "level": 3,
                      "children": {
                        "Feu d'encombrement": {
                          "categoryId": null,
                          "categoryName": "Feu d'encombrement",
                          "level": 6,
                          "children": {
                            "Porte-lampe, feu de gabarit": {
                              "categoryId": 100469,
                              "categoryName": "End Outline Marker Light",
                              "level": 4,
                              "children": [],
                              "productId": 4158
                            }
                          }
                        }
                      },
                      "productId": 4158
                    }
                  }
                }
              },
              "productId": 4158
            },
            "Réflecteur, feu de position/d'encombrement": {
              "categoryId": 100043,
              "categoryName": "Lights",
              "level": 2,
              "children": {
                "Feu de position / d'encombrement / composants": {
                  "categoryId": null,
                  "categoryName": "Feu de position / d'encombrement / composants",
                  "level": 4,
                  "children": {
                    "Réflecteur, feu de position/d'encombrement": {
                      "categoryId": 100290,
                      "categoryName": "Side Marker/End Outline Marker Light/Parts",
                      "level": 3,
                      "children": {
                        "Feu d'encombrement": {
                          "categoryId": null,
                          "categoryName": "Feu d'encombrement",
                          "level": 6,
                          "children": {
                            "Réflecteur, feu de position/d'encombrement": {
                              "categoryId": 100469,
                              "categoryName": "End Outline Marker Light",
                              "level": 4,
                              "children": [],
                              "productId": 2180
                            }
                          }
                        }
                      },
                      "productId": 2180
                    }
                  }
                }
              },
              "productId": 2180
            },
            "Support de lampe, feu d'encombrement": {
              "categoryId": 100043,
              "categoryName": "Lights",
              "level": 2,
              "children": {
                "Feu de position / d'encombrement / composants": {
                  "categoryId": null,
                  "categoryName": "Feu de position / d'encombrement / composants",
                  "level": 4,
                  "children": {
                    "Support de lampe, feu d'encombrement": {
                      "categoryId": 100290,
                      "categoryName": "Side Marker/End Outline Marker Light/Parts",
                      "level": 3,
                      "children": {
                        "Feu d'encombrement": {
                          "categoryId": null,
                          "categoryName": "Feu d'encombrement",
                          "level": 6,
                          "children": {
                            "Support de lampe, feu d'encombrement": {
                              "categoryId": 100469,
                              "categoryName": "End Outline Marker Light",
                              "level": 4,
                              "children": [],
                              "productId": 2086
                            }
                          }
                        }
                      },
                      "productId": 2086
                    }
                  }
                }
              },
              "productId": 2086
            }
          }
        }
      }
    }
  },
  "arborescenceText": "├── Carrosserie [ID: 100001] (Niveau 1)\n│   ├── Arrière de la voiture (Niveau 2)\n│   │   ├── Vehicle Rear [ID: 101705] (Niveau 2) → ProductId: 3193\n│   │   │   ├── Feu clignotant/composants (Niveau 4)\n│   │   │   │   └── Direction Indicator/Parts [ID: 101727] (Niveau 3) → ProductId: 3193\n│   │   │   │       └── Feu clignotant (Niveau 6)\n│   │   │   │           └── Direction Indicator [ID: 101728] (Niveau 4) → ProductId: 3193\n│   │   │   └── Feu de position / d'encombrement / composants (Niveau 4)\n│   │   │       └── Side Marker/End Outline Marker Light/Parts [ID: 101785] (Niveau 3) → ProductId: 3193\n│   │   │           └── Feu d'encombrement (Niveau 6)\n│   │   │               └── End Outline Marker Light [ID: 101787] (Niveau 4) → ProductId: 3193\n│   │   ├── Vehicle Rear [ID: 101705] (Niveau 2) → ProductId: 1172\n│   │   │   └── Feu de position / d'encombrement / composants (Niveau 4)\n│   │   │       └── Side Marker/End Outline Marker Light/Parts [ID: 101785] (Niveau 3) → ProductId: 1172\n│   │   │           └── Ampoule (Niveau 6)\n│   │   │               └── Bulb [ID: 101789] (Niveau 4) → ProductId: 1172\n│   │   ├── Vehicle Rear [ID: 101705] (Niveau 2) → ProductId: 2126\n│   │   │   └── Feu de position / d'encombrement / composants (Niveau 4)\n│   │   │       └── Side Marker/End Outline Marker Light/Parts [ID: 101785] (Niveau 3) → ProductId: 2126\n│   │   │           ├── Feu d'encombrement (Niveau 6)\n│   │   │           │   └── End Outline Marker Light [ID: 101787] (Niveau 4) → ProductId: 2126\n│   │   │           └── Feu de stationnement/de position (Niveau 6)\n│   │   │               └── Park/Position Light [ID: 101786] (Niveau 4) → ProductId: 2126\n│   │   ├── Vehicle Rear [ID: 101705] (Niveau 2) → ProductId: 3828\n│   │   │   └── Feu de position / d'encombrement / composants (Niveau 4)\n│   │   │       └── Side Marker/End Outline Marker Light/Parts [ID: 101785] (Niveau 3) → ProductId: 3828\n│   │   │           └── Feu d'encombrement (Niveau 6)\n│   │   │               └── End Outline Marker Light [ID: 101787] (Niveau 4) → ProductId: 3828\n│   │   ├── Vehicle Rear [ID: 101705] (Niveau 2) → ProductId: 1175\n│   │   │   └── Feu de position / d'encombrement / composants (Niveau 4)\n│   │   │       └── Side Marker/End Outline Marker Light/Parts [ID: 101785] (Niveau 3) → ProductId: 1175\n│   │   │           └── Composants (Niveau 6)\n│   │   │               └── Parts [ID: 101790] (Niveau 4) → ProductId: 1175\n│   │   ├── Vehicle Rear [ID: 101705] (Niveau 2) → ProductId: 3458\n│   │   │   └── Feu de position / d'encombrement / composants (Niveau 4)\n│   │   │       └── Side Marker/End Outline Marker Light/Parts [ID: 101785] (Niveau 3) → ProductId: 3458\n│   │   │           └── Feu d'encombrement (Niveau 6)\n│   │   │               └── End Outline Marker Light [ID: 101787] (Niveau 4) → ProductId: 3458\n│   │   ├── Vehicle Rear [ID: 101705] (Niveau 2) → ProductId: 1350\n│   │   │   └── Feu de position / d'encombrement / composants (Niveau 4)\n│   │   │       └── Side Marker/End Outline Marker Light/Parts [ID: 101785] (Niveau 3) → ProductId: 1350\n│   │   │           └── Feu d'encombrement (Niveau 6)\n│   │   │               └── End Outline Marker Light [ID: 101787] (Niveau 4) → ProductId: 1350\n│   │   ├── Vehicle Rear [ID: 101705] (Niveau 2) → ProductId: 294\n│   │   │   └── Feu de position / d'encombrement / composants (Niveau 4)\n│   │   │       └── Side Marker/End Outline Marker Light/Parts [ID: 101785] (Niveau 3) → ProductId: 294\n│   │   │           └── Feu d'encombrement (Niveau 6)\n│   │   │               └── End Outline Marker Light [ID: 101787] (Niveau 4) → ProductId: 294\n│   │   ├── Vehicle Rear [ID: 101705] (Niveau 2) → ProductId: 2207\n│   │   │   └── Feu de position / d'encombrement / composants (Niveau 4)\n│   │   │       └── Side Marker/End Outline Marker Light/Parts [ID: 101785] (Niveau 3) → ProductId: 2207\n│   │   │           └── Feu d'encombrement (Niveau 6)\n│   │   │               └── End Outline Marker Light [ID: 101787] (Niveau 4) → ProductId: 2207\n│   │   ├── Vehicle Rear [ID: 101705] (Niveau 2) → ProductId: 3122\n│   │   │   └── Feu de position / d'encombrement / composants (Niveau 4)\n│   │   │       └── Side Marker/End Outline Marker Light/Parts [ID: 101785] (Niveau 3) → ProductId: 3122\n│   │   │           └── Composants (Niveau 6)\n│   │   │               └── Parts [ID: 101790] (Niveau 4) → ProductId: 3122\n│   │   ├── Vehicle Rear [ID: 101705] (Niveau 2) → ProductId: 6352\n│   │   │   └── Feu de position / d'encombrement / composants (Niveau 4)\n│   │   │       └── Side Marker/End Outline Marker Light/Parts [ID: 101785] (Niveau 3) → ProductId: 6352\n│   │   │           └── Feu d'encombrement (Niveau 6)\n│   │   │               └── End Outline Marker Light [ID: 101787] (Niveau 4) → ProductId: 6352\n│   │   ├── Vehicle Rear [ID: 101705] (Niveau 2) → ProductId: 4158\n│   │   │   └── Feu de position / d'encombrement / composants (Niveau 4)\n│   │   │       └── Side Marker/End Outline Marker Light/Parts [ID: 101785] (Niveau 3) → ProductId: 4158\n│   │   │           └── Feu d'encombrement (Niveau 6)\n│   │   │               └── End Outline Marker Light [ID: 101787] (Niveau 4) → ProductId: 4158\n│   │   ├── Vehicle Rear [ID: 101705] (Niveau 2) → ProductId: 2180\n│   │   │   └── Feu de position / d'encombrement / composants (Niveau 4)\n│   │   │       └── Side Marker/End Outline Marker Light/Parts [ID: 101785] (Niveau 3) → ProductId: 2180\n│   │   │           └── Feu d'encombrement (Niveau 6)\n│   │   │               └── End Outline Marker Light [ID: 101787] (Niveau 4) → ProductId: 2180\n│   │   └── Vehicle Rear [ID: 101705] (Niveau 2) → ProductId: 2086\n│   │       └── Feu de position / d'encombrement / composants (Niveau 4)\n│   │           └── Side Marker/End Outline Marker Light/Parts [ID: 101785] (Niveau 3) → ProductId: 2086\n│   │               └── Feu d'encombrement (Niveau 6)\n│   │                   └── End Outline Marker Light [ID: 101787] (Niveau 4) → ProductId: 2086\n│   ├── Avant du véhicule (Niveau 2)\n│   │   ├── Vehicle Front [ID: 101648] (Niveau 2) → ProductId: 3193\n│   │   │   ├── Feu clignotant/composants (Niveau 4)\n│   │   │   │   └── Direction Indicator/Parts [ID: 101669] (Niveau 3) → ProductId: 3193\n│   │   │   │       └── Feu clignotant (Niveau 6)\n│   │   │   │           └── Direction Indicator [ID: 101670] (Niveau 4) → ProductId: 3193\n│   │   │   └── Feu de position / d'encombrement / composants (Niveau 4)\n│   │   │       └── Side Marker/End Outline Marker Light/Parts [ID: 101766] (Niveau 3) → ProductId: 3193\n│   │   │           └── Feu d'encombrement (Niveau 6)\n│   │   │               └── End Outline Marker Light [ID: 101768] (Niveau 4) → ProductId: 3193\n│   │   ├── Vehicle Front [ID: 101648] (Niveau 2) → ProductId: 1172\n│   │   │   └── Feu de position / d'encombrement / composants (Niveau 4)\n│   │   │       └── Side Marker/End Outline Marker Light/Parts [ID: 101766] (Niveau 3) → ProductId: 1172\n│   │   │           └── Ampoule (Niveau 6)\n│   │   │               └── Bulb [ID: 101770] (Niveau 4) → ProductId: 1172\n│   │   ├── Vehicle Front [ID: 101648] (Niveau 2) → ProductId: 2126\n│   │   │   └── Feu de position / d'encombrement / composants (Niveau 4)\n│   │   │       └── Side Marker/End Outline Marker Light/Parts [ID: 101766] (Niveau 3) → ProductId: 2126\n│   │   │           ├── Feu d'encombrement (Niveau 6)\n│   │   │           │   └── End Outline Marker Light [ID: 101768] (Niveau 4) → ProductId: 2126\n│   │   │           └── Feu de stationnement/de position (Niveau 6)\n│   │   │               └── Park/Position Light [ID: 101767] (Niveau 4) → ProductId: 2126\n│   │   ├── Vehicle Front [ID: 101648] (Niveau 2) → ProductId: 3828\n│   │   │   └── Feu de position / d'encombrement / composants (Niveau 4)\n│   │   │       └── Side Marker/End Outline Marker Light/Parts [ID: 101766] (Niveau 3) → ProductId: 3828\n│   │   │           └── Feu d'encombrement (Niveau 6)\n│   │   │               └── End Outline Marker Light [ID: 101768] (Niveau 4) → ProductId: 3828\n│   │   ├── Vehicle Front [ID: 101648] (Niveau 2) → ProductId: 1175\n│   │   │   └── Feu de position / d'encombrement / composants (Niveau 4)\n│   │   │       └── Side Marker/End Outline Marker Light/Parts [ID: 101766] (Niveau 3) → ProductId: 1175\n│   │   │           └── Composants (Niveau 6)\n│   │   │               └── Parts [ID: 101771] (Niveau 4) → ProductId: 1175\n│   │   ├── Vehicle Front [ID: 101648] (Niveau 2) → ProductId: 3458\n│   │   │   └── Feu de position / d'encombrement / composants (Niveau 4)\n│   │   │       └── Side Marker/End Outline Marker Light/Parts [ID: 101766] (Niveau 3) → ProductId: 3458\n│   │   │           └── Feu d'encombrement (Niveau 6)\n│   │   │               └── End Outline Marker Light [ID: 101768] (Niveau 4) → ProductId: 3458\n│   │   ├── Vehicle Front [ID: 101648] (Niveau 2) → ProductId: 1350\n│   │   │   └── Feu de position / d'encombrement / composants (Niveau 4)\n│   │   │       └── Side Marker/End Outline Marker Light/Parts [ID: 101766] (Niveau 3) → ProductId: 1350\n│   │   │           └── Feu d'encombrement (Niveau 6)\n│   │   │               └── End Outline Marker Light [ID: 101768] (Niveau 4) → ProductId: 1350\n│   │   ├── Vehicle Front [ID: 101648] (Niveau 2) → ProductId: 294\n│   │   │   └── Feu de position / d'encombrement / composants (Niveau 4)\n│   │   │       └── Side Marker/End Outline Marker Light/Parts [ID: 101766] (Niveau 3) → ProductId: 294\n│   │   │           └── Feu d'encombrement (Niveau 6)\n│   │   │               └── End Outline Marker Light [ID: 101768] (Niveau 4) → ProductId: 294\n│   │   ├── Vehicle Front [ID: 101648] (Niveau 2) → ProductId: 2207\n│   │   │   └── Feu de position / d'encombrement / composants (Niveau 4)\n│   │   │       └── Side Marker/End Outline Marker Light/Parts [ID: 101766] (Niveau 3) → ProductId: 2207\n│   │   │           └── Feu d'encombrement (Niveau 6)\n│   │   │               └── End Outline Marker Light [ID: 101768] (Niveau 4) → ProductId: 2207\n│   │   ├── Vehicle Front [ID: 101648] (Niveau 2) → ProductId: 3122\n│   │   │   └── Feu de position / d'encombrement / composants (Niveau 4)\n│   │   │       └── Side Marker/End Outline Marker Light/Parts [ID: 101766] (Niveau 3) → ProductId: 3122\n│   │   │           └── Composants (Niveau 6)\n│   │   │               └── Parts [ID: 101771] (Niveau 4) → ProductId: 3122\n│   │   ├── Vehicle Front [ID: 101648] (Niveau 2) → ProductId: 6352\n│   │   │   └── Feu de position / d'encombrement / composants (Niveau 4)\n│   │   │       └── Side Marker/End Outline Marker Light/Parts [ID: 101766] (Niveau 3) → ProductId: 6352\n│   │   │           └── Feu d'encombrement (Niveau 6)\n│   │   │               └── End Outline Marker Light [ID: 101768] (Niveau 4) → ProductId: 6352\n│   │   ├── Vehicle Front [ID: 101648] (Niveau 2) → ProductId: 4158\n│   │   │   └── Feu de position / d'encombrement / composants (Niveau 4)\n│   │   │       └── Side Marker/End Outline Marker Light/Parts [ID: 101766] (Niveau 3) → ProductId: 4158\n│   │   │           └── Feu d'encombrement (Niveau 6)\n│   │   │               └── End Outline Marker Light [ID: 101768] (Niveau 4) → ProductId: 4158\n│   │   ├── Vehicle Front [ID: 101648] (Niveau 2) → ProductId: 2180\n│   │   │   └── Feu de position / d'encombrement / composants (Niveau 4)\n│   │   │       └── Side Marker/End Outline Marker Light/Parts [ID: 101766] (Niveau 3) → ProductId: 2180\n│   │   │           └── Feu d'encombrement (Niveau 6)\n│   │   │               └── End Outline Marker Light [ID: 101768] (Niveau 4) → ProductId: 2180\n│   │   └── Vehicle Front [ID: 101648] (Niveau 2) → ProductId: 2086\n│   │       └── Feu de position / d'encombrement / composants (Niveau 4)\n│   │           └── Side Marker/End Outline Marker Light/Parts [ID: 101766] (Niveau 3) → ProductId: 2086\n│   │               └── Feu d'encombrement (Niveau 6)\n│   │                   └── End Outline Marker Light [ID: 101768] (Niveau 4) → ProductId: 2086\n│   └── Feux (Niveau 2)\n│       ├── Lights [ID: 101407] (Niveau 2) → ProductId: 3193\n│       │   ├── Feu clignotant/composants (Niveau 4)\n│       │   │   └── Direction Indicator/Parts [ID: 101420] (Niveau 3) → ProductId: 3193\n│       │   │       └── Feu clignotant (Niveau 6)\n│       │   │           └── Direction Indicator [ID: 101421] (Niveau 4) → ProductId: 3193\n│       │   └── Feu de position / d'encombrement / composants (Niveau 4)\n│       │       └── Side Marker/End Outline Marker Light/Parts [ID: 101441] (Niveau 3) → ProductId: 3193\n│       │           └── Feu d'encombrement (Niveau 6)\n│       │               └── End Outline Marker Light [ID: 101443] (Niveau 4) → ProductId: 3193\n│       ├── Lights [ID: 101407] (Niveau 2) → ProductId: 1172\n│       │   └── Feu de position / d'encombrement / composants (Niveau 4)\n│       │       └── Side Marker/End Outline Marker Light/Parts [ID: 101441] (Niveau 3) → ProductId: 1172\n│       │           └── Ampoule (Niveau 6)\n│       │               └── Bulb [ID: 101445] (Niveau 4) → ProductId: 1172\n│       ├── Lights [ID: 101407] (Niveau 2) → ProductId: 2126\n│       │   └── Feu de position / d'encombrement / composants (Niveau 4)\n│       │       └── Side Marker/End Outline Marker Light/Parts [ID: 101441] (Niveau 3) → ProductId: 2126\n│       │           ├── Feu d'encombrement (Niveau 6)\n│       │           │   └── End Outline Marker Light [ID: 101443] (Niveau 4) → ProductId: 2126\n│       │           └── Feu de stationnement/de position (Niveau 6)\n│       │               └── Park/Position Light [ID: 101442] (Niveau 4) → ProductId: 2126\n│       ├── Lights [ID: 101407] (Niveau 2) → ProductId: 3828\n│       │   └── Feu de position / d'encombrement / composants (Niveau 4)\n│       │       └── Side Marker/End Outline Marker Light/Parts [ID: 101441] (Niveau 3) → ProductId: 3828\n│       │           └── Feu d'encombrement (Niveau 6)\n│       │               └── End Outline Marker Light [ID: 101443] (Niveau 4) → ProductId: 3828\n│       ├── Lights [ID: 101407] (Niveau 2) → ProductId: 1175\n│       │   └── Feu de position / d'encombrement / composants (Niveau 4)\n│       │       └── Side Marker/End Outline Marker Light/Parts [ID: 101441] (Niveau 3) → ProductId: 1175\n│       │           └── Composants (Niveau 6)\n│       │               └── Parts [ID: 101446] (Niveau 4) → ProductId: 1175\n│       ├── Lights [ID: 101407] (Niveau 2) → ProductId: 3458\n│       │   └── Feu de position / d'encombrement / composants (Niveau 4)\n│       │       └── Side Marker/End Outline Marker Light/Parts [ID: 101441] (Niveau 3) → ProductId: 3458\n│       │           └── Feu d'encombrement (Niveau 6)\n│       │               └── End Outline Marker Light [ID: 101443] (Niveau 4) → ProductId: 3458\n│       ├── Lights [ID: 101407] (Niveau 2) → ProductId: 1350\n│       │   └── Feu de position / d'encombrement / composants (Niveau 4)\n│       │       └── Side Marker/End Outline Marker Light/Parts [ID: 101441] (Niveau 3) → ProductId: 1350\n│       │           └── Feu d'encombrement (Niveau 6)\n│       │               └── End Outline Marker Light [ID: 101443] (Niveau 4) → ProductId: 1350\n│       ├── Lights [ID: 101407] (Niveau 2) → ProductId: 294\n│       │   └── Feu de position / d'encombrement / composants (Niveau 4)\n│       │       └── Side Marker/End Outline Marker Light/Parts [ID: 101441] (Niveau 3) → ProductId: 294\n│       │           └── Feu d'encombrement (Niveau 6)\n│       │               └── End Outline Marker Light [ID: 101443] (Niveau 4) → ProductId: 294\n│       ├── Lights [ID: 101407] (Niveau 2) → ProductId: 2207\n│       │   └── Feu de position / d'encombrement / composants (Niveau 4)\n│       │       └── Side Marker/End Outline Marker Light/Parts [ID: 101441] (Niveau 3) → ProductId: 2207\n│       │           └── Feu d'encombrement (Niveau 6)\n│       │               └── End Outline Marker Light [ID: 101443] (Niveau 4) → ProductId: 2207\n│       ├── Lights [ID: 101407] (Niveau 2) → ProductId: 3122\n│       │   └── Feu de position / d'encombrement / composants (Niveau 4)\n│       │       └── Side Marker/End Outline Marker Light/Parts [ID: 101441] (Niveau 3) → ProductId: 3122\n│       │           └── Composants (Niveau 6)\n│       │               └── Parts [ID: 101446] (Niveau 4) → ProductId: 3122\n│       ├── Lights [ID: 101407] (Niveau 2) → ProductId: 6352\n│       │   └── Feu de position / d'encombrement / composants (Niveau 4)\n│       │       └── Side Marker/End Outline Marker Light/Parts [ID: 101441] (Niveau 3) → ProductId: 6352\n│       │           └── Feu d'encombrement (Niveau 6)\n│       │               └── End Outline Marker Light [ID: 101443] (Niveau 4) → ProductId: 6352\n│       ├── Lights [ID: 101407] (Niveau 2) → ProductId: 4158\n│       │   └── Feu de position / d'encombrement / composants (Niveau 4)\n│       │       └── Side Marker/End Outline Marker Light/Parts [ID: 101441] (Niveau 3) → ProductId: 4158\n│       │           └── Feu d'encombrement (Niveau 6)\n│       │               └── End Outline Marker Light [ID: 101443] (Niveau 4) → ProductId: 4158\n│       ├── Lights [ID: 101407] (Niveau 2) → ProductId: 2180\n│       │   └── Feu de position / d'encombrement / composants (Niveau 4)\n│       │       └── Side Marker/End Outline Marker Light/Parts [ID: 101441] (Niveau 3) → ProductId: 2180\n│       │           └── Feu d'encombrement (Niveau 6)\n│       │               └── End Outline Marker Light [ID: 101443] (Niveau 4) → ProductId: 2180\n│       └── Lights [ID: 101407] (Niveau 2) → ProductId: 2086\n│           └── Feu de position / d'encombrement / composants (Niveau 4)\n│               └── Side Marker/End Outline Marker Light/Parts [ID: 101441] (Niveau 3) → ProductId: 2086\n│                   └── Feu d'encombrement (Niveau 6)\n│                       └── End Outline Marker Light [ID: 101443] (Niveau 4) → ProductId: 2086\n\n└── Système électrique [ID: 100010] (Niveau 1)\n    └── Feux (Niveau 2)\n        ├── Lights [ID: 100043] (Niveau 2) → ProductId: 3193\n        │   ├── Feu clignotant/composants (Niveau 4)\n        │   │   └── Direction Indicator/Parts [ID: 100145] (Niveau 3) → ProductId: 3193\n        │   │       └── Feu clignotant (Niveau 6)\n        │   │           └── Direction Indicator [ID: 100463] (Niveau 4) → ProductId: 3193\n        │   └── Feu de position / d'encombrement / composants (Niveau 4)\n        │       └── Side Marker/End Outline Marker Light/Parts [ID: 100290] (Niveau 3) → ProductId: 3193\n        │           └── Feu d'encombrement (Niveau 6)\n        │               └── End Outline Marker Light [ID: 100469] (Niveau 4) → ProductId: 3193\n        ├── Lights [ID: 100043] (Niveau 2) → ProductId: 1172\n        │   └── Feu de position / d'encombrement / composants (Niveau 4)\n        │       └── Side Marker/End Outline Marker Light/Parts [ID: 100290] (Niveau 3) → ProductId: 1172\n        │           └── Ampoule (Niveau 6)\n        │               └── Bulb [ID: 100503] (Niveau 4) → ProductId: 1172\n        ├── Lights [ID: 100043] (Niveau 2) → ProductId: 2126\n        │   └── Feu de position / d'encombrement / composants (Niveau 4)\n        │       └── Side Marker/End Outline Marker Light/Parts [ID: 100290] (Niveau 3) → ProductId: 2126\n        │           ├── Feu d'encombrement (Niveau 6)\n        │           │   └── End Outline Marker Light [ID: 100469] (Niveau 4) → ProductId: 2126\n        │           └── Feu de stationnement/de position (Niveau 6)\n        │               └── Park/Position Light [ID: 100468] (Niveau 4) → ProductId: 2126\n        ├── Lights [ID: 100043] (Niveau 2) → ProductId: 3828\n        │   └── Feu de position / d'encombrement / composants (Niveau 4)\n        │       └── Side Marker/End Outline Marker Light/Parts [ID: 100290] (Niveau 3) → ProductId: 3828\n        │           └── Feu d'encombrement (Niveau 6)\n        │               └── End Outline Marker Light [ID: 100469] (Niveau 4) → ProductId: 3828\n        ├── Lights [ID: 100043] (Niveau 2) → ProductId: 1175\n        │   └── Feu de position / d'encombrement / composants (Niveau 4)\n        │       └── Side Marker/End Outline Marker Light/Parts [ID: 100290] (Niveau 3) → ProductId: 1175\n        │           └── Composants (Niveau 6)\n        │               └── Parts [ID: 100495] (Niveau 4) → ProductId: 1175\n        ├── Lights [ID: 100043] (Niveau 2) → ProductId: 3458\n        │   └── Feu de position / d'encombrement / composants (Niveau 4)\n        │       └── Side Marker/End Outline Marker Light/Parts [ID: 100290] (Niveau 3) → ProductId: 3458\n        │           └── Feu d'encombrement (Niveau 6)\n        │               └── End Outline Marker Light [ID: 100469] (Niveau 4) → ProductId: 3458\n        ├── Lights [ID: 100043] (Niveau 2) → ProductId: 1350\n        │   └── Feu de position / d'encombrement / composants (Niveau 4)\n        │       └── Side Marker/End Outline Marker Light/Parts [ID: 100290] (Niveau 3) → ProductId: 1350\n        │           └── Feu d'encombrement (Niveau 6)\n        │               └── End Outline Marker Light [ID: 100469] (Niveau 4) → ProductId: 1350\n        ├── Lights [ID: 100043] (Niveau 2) → ProductId: 294\n        │   └── Feu de position / d'encombrement / composants (Niveau 4)\n        │       └── Side Marker/End Outline Marker Light/Parts [ID: 100290] (Niveau 3) → ProductId: 294\n        │           └── Feu d'encombrement (Niveau 6)\n        │               └── End Outline Marker Light [ID: 100469] (Niveau 4) → ProductId: 294\n        ├── Lights [ID: 100043] (Niveau 2) → ProductId: 2207\n        │   └── Feu de position / d'encombrement / composants (Niveau 4)\n        │       └── Side Marker/End Outline Marker Light/Parts [ID: 100290] (Niveau 3) → ProductId: 2207\n        │           └── Feu d'encombrement (Niveau 6)\n        │               └── End Outline Marker Light [ID: 100469] (Niveau 4) → ProductId: 2207\n        ├── Lights [ID: 100043] (Niveau 2) → ProductId: 3122\n        │   └── Feu de position / d'encombrement / composants (Niveau 4)\n        │       └── Side Marker/End Outline Marker Light/Parts [ID: 100290] (Niveau 3) → ProductId: 3122\n        │           └── Composants (Niveau 6)\n        │               └── Parts [ID: 100495] (Niveau 4) → ProductId: 3122\n        ├── Lights [ID: 100043] (Niveau 2) → ProductId: 6352\n        │   └── Feu de position / d'encombrement / composants (Niveau 4)\n        │       └── Side Marker/End Outline Marker Light/Parts [ID: 100290] (Niveau 3) → ProductId: 6352\n        │           └── Feu d'encombrement (Niveau 6)\n        │               └── End Outline Marker Light [ID: 100469] (Niveau 4) → ProductId: 6352\n        ├── Lights [ID: 100043] (Niveau 2) → ProductId: 4158\n        │   └── Feu de position / d'encombrement / composants (Niveau 4)\n        │       └── Side Marker/End Outline Marker Light/Parts [ID: 100290] (Niveau 3) → ProductId: 4158\n        │           └── Feu d'encombrement (Niveau 6)\n        │               └── End Outline Marker Light [ID: 100469] (Niveau 4) → ProductId: 4158\n        ├── Lights [ID: 100043] (Niveau 2) → ProductId: 2180\n        │   └── Feu de position / d'encombrement / composants (Niveau 4)\n        │       └── Side Marker/End Outline Marker Light/Parts [ID: 100290] (Niveau 3) → ProductId: 2180\n        │           └── Feu d'encombrement (Niveau 6)\n        │               └── End Outline Marker Light [ID: 100469] (Niveau 4) → ProductId: 2180\n        └── Lights [ID: 100043] (Niveau 2) → ProductId: 2086\n            └── Feu de position / d'encombrement / composants (Niveau 4)\n                └── Side Marker/End Outline Marker Light/Parts [ID: 100290] (Niveau 3) → ProductId: 2086\n                    └── Feu d'encombrement (Niveau 6)\n                        └── End Outline Marker Light [ID: 100469] (Niveau 4) → ProductId: 2086",
  "arborescencePaths": [
    {
      "path": [
        "Carrosserie",
        "Arrière de la voiture",
        "Vehicle Rear"
      ],
      "categoryIds": [
        100001,
        null,
        101705
      ],
      "finalCategoryId": 101705,
      "productId": 3193
    },
    {
      "path": [
        "Carrosserie",
        "Arrière de la voiture",
        "Vehicle Rear"
      ],
      "categoryIds": [
        100001,
        null,
        101705
      ],
      "finalCategoryId": 101705,
      "productId": 1172
    },
    {
      "path": [
        "Carrosserie",
        "Arrière de la voiture",
        "Vehicle Rear"
      ],
      "categoryIds": [
        100001,
        null,
        101705
      ],
      "finalCategoryId": 101705,
      "productId": 2126
    },
    {
      "path": [
        "Carrosserie",
        "Arrière de la voiture",
        "Vehicle Rear"
      ],
      "categoryIds": [
        100001,
        null,
        101705
      ],
      "finalCategoryId": 101705,
      "productId": 3828
    },
    {
      "path": [
        "Carrosserie",
        "Arrière de la voiture",
        "Vehicle Rear"
      ],
      "categoryIds": [
        100001,
        null,
        101705
      ],
      "finalCategoryId": 101705,
      "productId": 1175
    },
    {
      "path": [
        "Carrosserie",
        "Arrière de la voiture",
        "Vehicle Rear"
      ],
      "categoryIds": [
        100001,
        null,
        101705
      ],
      "finalCategoryId": 101705,
      "productId": 3458
    },
    {
      "path": [
        "Carrosserie",
        "Arrière de la voiture",
        "Vehicle Rear"
      ],
      "categoryIds": [
        100001,
        null,
        101705
      ],
      "finalCategoryId": 101705,
      "productId": 1350
    },
    {
      "path": [
        "Carrosserie",
        "Arrière de la voiture",
        "Vehicle Rear"
      ],
      "categoryIds": [
        100001,
        null,
        101705
      ],
      "finalCategoryId": 101705,
      "productId": 294
    },
    {
      "path": [
        "Carrosserie",
        "Arrière de la voiture",
        "Vehicle Rear"
      ],
      "categoryIds": [
        100001,
        null,
        101705
      ],
      "finalCategoryId": 101705,
      "productId": 2207
    },
    {
      "path": [
        "Carrosserie",
        "Arrière de la voiture",
        "Vehicle Rear"
      ],
      "categoryIds": [
        100001,
        null,
        101705
      ],
      "finalCategoryId": 101705,
      "productId": 3122
    },
    {
      "path": [
        "Carrosserie",
        "Arrière de la voiture",
        "Vehicle Rear"
      ],
      "categoryIds": [
        100001,
        null,
        101705
      ],
      "finalCategoryId": 101705,
      "productId": 6352
    },
    {
      "path": [
        "Carrosserie",
        "Arrière de la voiture",
        "Vehicle Rear"
      ],
      "categoryIds": [
        100001,
        null,
        101705
      ],
      "finalCategoryId": 101705,
      "productId": 4158
    },
    {
      "path": [
        "Carrosserie",
        "Arrière de la voiture",
        "Vehicle Rear"
      ],
      "categoryIds": [
        100001,
        null,
        101705
      ],
      "finalCategoryId": 101705,
      "productId": 2180
    },
    {
      "path": [
        "Carrosserie",
        "Arrière de la voiture",
        "Vehicle Rear"
      ],
      "categoryIds": [
        100001,
        null,
        101705
      ],
      "finalCategoryId": 101705,
      "productId": 2086
    },
    {
      "path": [
        "Carrosserie",
        "Avant du véhicule",
        "Vehicle Front"
      ],
      "categoryIds": [
        100001,
        null,
        101648
      ],
      "finalCategoryId": 101648,
      "productId": 3193
    },
    {
      "path": [
        "Carrosserie",
        "Avant du véhicule",
        "Vehicle Front"
      ],
      "categoryIds": [
        100001,
        null,
        101648
      ],
      "finalCategoryId": 101648,
      "productId": 1172
    },
    {
      "path": [
        "Carrosserie",
        "Avant du véhicule",
        "Vehicle Front"
      ],
      "categoryIds": [
        100001,
        null,
        101648
      ],
      "finalCategoryId": 101648,
      "productId": 2126
    },
    {
      "path": [
        "Carrosserie",
        "Avant du véhicule",
        "Vehicle Front"
      ],
      "categoryIds": [
        100001,
        null,
        101648
      ],
      "finalCategoryId": 101648,
      "productId": 3828
    },
    {
      "path": [
        "Carrosserie",
        "Avant du véhicule",
        "Vehicle Front"
      ],
      "categoryIds": [
        100001,
        null,
        101648
      ],
      "finalCategoryId": 101648,
      "productId": 1175
    },
    {
      "path": [
        "Carrosserie",
        "Avant du véhicule",
        "Vehicle Front"
      ],
      "categoryIds": [
        100001,
        null,
        101648
      ],
      "finalCategoryId": 101648,
      "productId": 3458
    },
    {
      "path": [
        "Carrosserie",
        "Avant du véhicule",
        "Vehicle Front"
      ],
      "categoryIds": [
        100001,
        null,
        101648
      ],
      "finalCategoryId": 101648,
      "productId": 1350
    },
    {
      "path": [
        "Carrosserie",
        "Avant du véhicule",
        "Vehicle Front"
      ],
      "categoryIds": [
        100001,
        null,
        101648
      ],
      "finalCategoryId": 101648,
      "productId": 294
    },
    {
      "path": [
        "Carrosserie",
        "Avant du véhicule",
        "Vehicle Front"
      ],
      "categoryIds": [
        100001,
        null,
        101648
      ],
      "finalCategoryId": 101648,
      "productId": 2207
    },
    {
      "path": [
        "Carrosserie",
        "Avant du véhicule",
        "Vehicle Front"
      ],
      "categoryIds": [
        100001,
        null,
        101648
      ],
      "finalCategoryId": 101648,
      "productId": 3122
    },
    {
      "path": [
        "Carrosserie",
        "Avant du véhicule",
        "Vehicle Front"
      ],
      "categoryIds": [
        100001,
        null,
        101648
      ],
      "finalCategoryId": 101648,
      "productId": 6352
    },
    {
      "path": [
        "Carrosserie",
        "Avant du véhicule",
        "Vehicle Front"
      ],
      "categoryIds": [
        100001,
        null,
        101648
      ],
      "finalCategoryId": 101648,
      "productId": 4158
    },
    {
      "path": [
        "Carrosserie",
        "Avant du véhicule",
        "Vehicle Front"
      ],
      "categoryIds": [
        100001,
        null,
        101648
      ],
      "finalCategoryId": 101648,
      "productId": 2180
    },
    {
      "path": [
        "Carrosserie",
        "Avant du véhicule",
        "Vehicle Front"
      ],
      "categoryIds": [
        100001,
        null,
        101648
      ],
      "finalCategoryId": 101648,
      "productId": 2086
    },
    {
      "path": [
        "Carrosserie",
        "Feux",
        "Lights"
      ],
      "categoryIds": [
        100001,
        null,
        101407
      ],
      "finalCategoryId": 101407,
      "productId": 3193
    },
    {
      "path": [
        "Carrosserie",
        "Feux",
        "Lights"
      ],
      "categoryIds": [
        100001,
        null,
        101407
      ],
      "finalCategoryId": 101407,
      "productId": 1172
    },
    {
      "path": [
        "Carrosserie",
        "Feux",
        "Lights"
      ],
      "categoryIds": [
        100001,
        null,
        101407
      ],
      "finalCategoryId": 101407,
      "productId": 2126
    },
    {
      "path": [
        "Carrosserie",
        "Feux",
        "Lights"
      ],
      "categoryIds": [
        100001,
        null,
        101407
      ],
      "finalCategoryId": 101407,
      "productId": 3828
    },
    {
      "path": [
        "Carrosserie",
        "Feux",
        "Lights"
      ],
      "categoryIds": [
        100001,
        null,
        101407
      ],
      "finalCategoryId": 101407,
      "productId": 1175
    },
    {
      "path": [
        "Carrosserie",
        "Feux",
        "Lights"
      ],
      "categoryIds": [
        100001,
        null,
        101407
      ],
      "finalCategoryId": 101407,
      "productId": 3458
    },
    {
      "path": [
        "Carrosserie",
        "Feux",
        "Lights"
      ],
      "categoryIds": [
        100001,
        null,
        101407
      ],
      "finalCategoryId": 101407,
      "productId": 1350
    },
    {
      "path": [
        "Carrosserie",
        "Feux",
        "Lights"
      ],
      "categoryIds": [
        100001,
        null,
        101407
      ],
      "finalCategoryId": 101407,
      "productId": 294
    },
    {
      "path": [
        "Carrosserie",
        "Feux",
        "Lights"
      ],
      "categoryIds": [
        100001,
        null,
        101407
      ],
      "finalCategoryId": 101407,
      "productId": 2207
    },
    {
      "path": [
        "Carrosserie",
        "Feux",
        "Lights"
      ],
      "categoryIds": [
        100001,
        null,
        101407
      ],
      "finalCategoryId": 101407,
      "productId": 3122
    },
    {
      "path": [
        "Carrosserie",
        "Feux",
        "Lights"
      ],
      "categoryIds": [
        100001,
        null,
        101407
      ],
      "finalCategoryId": 101407,
      "productId": 6352
    },
    {
      "path": [
        "Carrosserie",
        "Feux",
        "Lights"
      ],
      "categoryIds": [
        100001,
        null,
        101407
      ],
      "finalCategoryId": 101407,
      "productId": 4158
    },
    {
      "path": [
        "Carrosserie",
        "Feux",
        "Lights"
      ],
      "categoryIds": [
        100001,
        null,
        101407
      ],
      "finalCategoryId": 101407,
      "productId": 2180
    },
    {
      "path": [
        "Carrosserie",
        "Feux",
        "Lights"
      ],
      "categoryIds": [
        100001,
        null,
        101407
      ],
      "finalCategoryId": 101407,
      "productId": 2086
    },
    {
      "path": [
        "Système électrique",
        "Feux",
        "Lights"
      ],
      "categoryIds": [
        100010,
        null,
        100043
      ],
      "finalCategoryId": 100043,
      "productId": 3193
    },
    {
      "path": [
        "Système électrique",
        "Feux",
        "Lights"
      ],
      "categoryIds": [
        100010,
        null,
        100043
      ],
      "finalCategoryId": 100043,
      "productId": 1172
    },
    {
      "path": [
        "Système électrique",
        "Feux",
        "Lights"
      ],
      "categoryIds": [
        100010,
        null,
        100043
      ],
      "finalCategoryId": 100043,
      "productId": 2126
    },
    {
      "path": [
        "Système électrique",
        "Feux",
        "Lights"
      ],
      "categoryIds": [
        100010,
        null,
        100043
      ],
      "finalCategoryId": 100043,
      "productId": 3828
    },
    {
      "path": [
        "Système électrique",
        "Feux",
        "Lights"
      ],
      "categoryIds": [
        100010,
        null,
        100043
      ],
      "finalCategoryId": 100043,
      "productId": 1175
    },
    {
      "path": [
        "Système électrique",
        "Feux",
        "Lights"
      ],
      "categoryIds": [
        100010,
        null,
        100043
      ],
      "finalCategoryId": 100043,
      "productId": 3458
    },
    {
      "path": [
        "Système électrique",
        "Feux",
        "Lights"
      ],
      "categoryIds": [
        100010,
        null,
        100043
      ],
      "finalCategoryId": 100043,
      "productId": 1350
    },
    {
      "path": [
        "Système électrique",
        "Feux",
        "Lights"
      ],
      "categoryIds": [
        100010,
        null,
        100043
      ],
      "finalCategoryId": 100043,
      "productId": 294
    },
    {
      "path": [
        "Système électrique",
        "Feux",
        "Lights"
      ],
      "categoryIds": [
        100010,
        null,
        100043
      ],
      "finalCategoryId": 100043,
      "productId": 2207
    },
    {
      "path": [
        "Système électrique",
        "Feux",
        "Lights"
      ],
      "categoryIds": [
        100010,
        null,
        100043
      ],
      "finalCategoryId": 100043,
      "productId": 3122
    },
    {
      "path": [
        "Système électrique",
        "Feux",
        "Lights"
      ],
      "categoryIds": [
        100010,
        null,
        100043
      ],
      "finalCategoryId": 100043,
      "productId": 6352
    },
    {
      "path": [
        "Système électrique",
        "Feux",
        "Lights"
      ],
      "categoryIds": [
        100010,
        null,
        100043
      ],
      "finalCategoryId": 100043,
      "productId": 4158
    },
    {
      "path": [
        "Système électrique",
        "Feux",
        "Lights"
      ],
      "categoryIds": [
        100010,
        null,
        100043
      ],
      "finalCategoryId": 100043,
      "productId": 2180
    },
    {
      "path": [
        "Système électrique",
        "Feux",
        "Lights"
      ],
      "categoryIds": [
        100010,
        null,
        100043
      ],
      "finalCategoryId": 100043,
      "productId": 2086
    }
  ],
  "productIdsInArbo": [
    294,
    1172,
    1175,
    1350,
    2086,
    2126,
    2180,
    2207,
    3122,
    3193,
    3458,
    3828,
    4158,
    6352
  ],
  "matchedProductIds": [
    1350
  ]
}