{
  "productName": "Flasque chauffante, préchauffement d'air d'admission",
  "searchText": "Flasque chauffante, préchauffement d'air d'admission",
  "found": true,
  "hasMatch": true,
  "timestamp": "2025-12-02T20:40:54.837Z",
  "productId": 3915,
  "arborescence": {
    "Carburation": {
      "categoryId": 100254,
      "categoryName": "Carburation",
      "level": 1,
      "children": {
        "Mélange air-carburant": {
          "categoryId": null,
          "categoryName": "Mélange air-carburant",
          "level": 2,
          "children": {
            "Flasque chauffante, préchauffement d'air d'admission": {
              "categoryId": 102793,
              "categoryName": "Mixture Formation",
              "level": 2,
              "children": {
                "Composants de porte-injecteur / Injecteur": {
                  "categoryId": null,
                  "categoryName": "Composants de porte-injecteur / Injecteur",
                  "level": 4,
                  "children": {
                    "Flasque chauffante, préchauffement d'air d'admission": {
                      "categoryId": 102800,
                      "categoryName": "Nozzle and Holder Assembly/Nozzle Parts",
                      "level": 3,
                      "children": [],
                      "productId": 3915
                    }
                  }
                }
              },
              "productId": 3915
            }
          }
        }
      }
    },
    "Moteur": {
      "categoryId": 100002,
      "categoryName": "Moteur",
      "level": 1,
      "children": {
        "Alimentation en air": {
          "categoryId": null,
          "categoryName": "Alimentation en air",
          "level": 2,
          "children": {
            "Flasque chauffante, préchauffement d'air d'admission": {
              "categoryId": 100383,
              "categoryName": "Air Supply",
              "level": 2,
              "children": {
                "Préchauffement de l'air d'admission": {
                  "categoryId": null,
                  "categoryName": "Préchauffement de l'air d'admission",
                  "level": 4,
                  "children": {
                    "Flasque chauffante, préchauffement d'air d'admission": {
                      "categoryId": 102872,
                      "categoryName": "Intake-Air Preheating",
                      "level": 3,
                      "children": [],
                      "productId": 3915
                    }
                  }
                }
              },
              "productId": 3915
            }
          }
        }
      }
    }
  },
  "arborescenceText": "├── Carburation [ID: 100254] (Niveau 1)\n│   └── Mélange air-carburant (Niveau 2)\n│       └── Mixture Formation [ID: 102793] (Niveau 2) → ProductId: 3915\n│           └── Composants de porte-injecteur / Injecteur (Niveau 4)\n│               └── Nozzle and Holder Assembly/Nozzle Parts [ID: 102800] (Niveau 3) → ProductId: 3915\n\n└── Moteur [ID: 100002] (Niveau 1)\n    └── Alimentation en air (Niveau 2)\n        └── Air Supply [ID: 100383] (Niveau 2) → ProductId: 3915\n            └── Préchauffement de l'air d'admission (Niveau 4)\n                └── Intake-Air Preheating [ID: 102872] (Niveau 3) → ProductId: 3915",
  "arborescencePaths": [
    {
      "path": [
        "Carburation",
        "Mélange air-carburant",
        "Mixture Formation"
      ],
      "categoryIds": [
        100254,
        null,
        102793
      ],
      "finalCategoryId": 102793,
      "productId": 3915
    },
    {
      "path": [
        "Moteur",
        "Alimentation en air",
        "Air Supply"
      ],
      "categoryIds": [
        100002,
        null,
        100383
      ],
      "finalCategoryId": 100383,
      "productId": 3915
    }
  ],
  "productIdsInArbo": [
    3915
  ],
  "matchedProductIds": [
    3915
  ]
}