{
  "productName": "Fourchette de débrayage",
  "searchText": "Fourchette de débrayage",
  "found": true,
  "hasMatch": false,
  "timestamp": "2025-12-02T20:41:34.751Z",
  "productId": 3263,
  "arborescence": {
    "Embrayage / composants": {
      "categoryId": 100050,
      "categoryName": "Embrayage / composants",
      "level": 1,
      "children": {
        "Butée d’embrayage/butée hydraulique": {
          "categoryId": null,
          "categoryName": "Butée d’embrayage/butée hydraulique",
          "level": 2,
          "children": {
            "Boulon, fourchette de débrayage": {
              "categoryId": 100054,
              "categoryName": "Clutch Release Bearing/Central Slave Cylinder",
              "level": 2,
              "children": {
                "Fourchette de débrayage": {
                  "categoryId": null,
                  "categoryName": "Fourchette de débrayage",
                  "level": 4,
                  "children": {
                    "Boulon, fourchette de débrayage": {
                      "categoryId": 102080,
                      "categoryName": "Release Fork",
                      "level": 3,
                      "children": [],
                      "productId": 3180
                    }
                  }
                }
              },
              "productId": 3180
            },
            "Butée, commande d'embrayage": {
              "categoryId": 100054,
              "categoryName": "Clutch Release Bearing/Central Slave Cylinder",
              "level": 2,
              "children": {
                "Butée de débrayage": {
                  "categoryId": null,
                  "categoryName": "Butée de débrayage",
                  "level": 4,
                  "children": {
                    "Butée, commande d'embrayage": {
                      "categoryId": 100055,
                      "categoryName": "Clutch Release Bearing",
                      "level": 3,
                      "children": [],
                      "productId": 4117
                    }
                  }
                },
                "Fourchette de débrayage": {
                  "categoryId": null,
                  "categoryName": "Fourchette de débrayage",
                  "level": 4,
                  "children": {
                    "Butée, commande d'embrayage": {
                      "categoryId": 102080,
                      "categoryName": "Release Fork",
                      "level": 3,
                      "children": [],
                      "productId": 4117
                    }
                  }
                }
              },
              "productId": 4117
            },
            "Douille de serrage, fourchette de débrayage": {
              "categoryId": 100054,
              "categoryName": "Clutch Release Bearing/Central Slave Cylinder",
              "level": 2,
              "children": {
                "Fourchette de débrayage": {
                  "categoryId": null,
                  "categoryName": "Fourchette de débrayage",
                  "level": 4,
                  "children": {
                    "Douille de serrage, fourchette de débrayage": {
                      "categoryId": 102080,
                      "categoryName": "Release Fork",
                      "level": 3,
                      "children": [],
                      "productId": 4739
                    }
                  }
                }
              },
              "productId": 4739
            },
            "Fourchette de débrayage, embrayage": {
              "categoryId": 100054,
              "categoryName": "Clutch Release Bearing/Central Slave Cylinder",
              "level": 2,
              "children": {
                "Fourchette de débrayage": {
                  "categoryId": null,
                  "categoryName": "Fourchette de débrayage",
                  "level": 4,
                  "children": {
                    "Fourchette de débrayage, embrayage": {
                      "categoryId": 102080,
                      "categoryName": "Release Fork",
                      "level": 3,
                      "children": [],
                      "productId": 3419
                    }
                  }
                }
              },
              "productId": 3419
            },
            "Jeu d'accessoires, fourchette d’embrayage": {
              "categoryId": 100054,
              "categoryName": "Clutch Release Bearing/Central Slave Cylinder",
              "level": 2,
              "children": {
                "Fourchette de débrayage": {
                  "categoryId": null,
                  "categoryName": "Fourchette de débrayage",
                  "level": 4,
                  "children": {
                    "Jeu d'accessoires, fourchette d’embrayage": {
                      "categoryId": 102080,
                      "categoryName": "Release Fork",
                      "level": 3,
                      "children": [],
                      "productId": 60883
                    }
                  }
                }
              },
              "productId": 60883
            },
            "Rouleau de pression, fourchette de débrayage": {
              "categoryId": 100054,
              "categoryName": "Clutch Release Bearing/Central Slave Cylinder",
              "level": 2,
              "children": {
                "Fourchette de débrayage": {
                  "categoryId": null,
                  "categoryName": "Fourchette de débrayage",
                  "level": 4,
                  "children": {
                    "Rouleau de pression, fourchette de débrayage": {
                      "categoryId": 102080,
                      "categoryName": "Release Fork",
                      "level": 3,
                      "children": [],
                      "productId": 4738
                    }
                  }
                }
              },
              "productId": 4738
            },
            "Support de palier, Fourchette de débrayage": {
              "categoryId": 100054,
              "categoryName": "Clutch Release Bearing/Central Slave Cylinder",
              "level": 2,
              "children": {
                "Fourchette de débrayage": {
                  "categoryId": null,
                  "categoryName": "Fourchette de débrayage",
                  "level": 4,
                  "children": {
                    "Support de palier, Fourchette de débrayage": {
                      "categoryId": 102080,
                      "categoryName": "Release Fork",
                      "level": 3,
                      "children": [],
                      "productId": 4825
                    }
                  }
                }
              },
              "productId": 4825
            }
          }
        }
      }
    }
  },
  "arborescenceText": "└── Embrayage / composants [ID: 100050] (Niveau 1)\n    └── Butée d’embrayage/butée hydraulique (Niveau 2)\n        ├── Clutch Release Bearing/Central Slave Cylinder [ID: 100054] (Niveau 2) → ProductId: 3180\n        │   └── Fourchette de débrayage (Niveau 4)\n        │       └── Release Fork [ID: 102080] (Niveau 3) → ProductId: 3180\n        ├── Clutch Release Bearing/Central Slave Cylinder [ID: 100054] (Niveau 2) → ProductId: 4117\n        │   ├── Butée de débrayage (Niveau 4)\n        │   │   └── Clutch Release Bearing [ID: 100055] (Niveau 3) → ProductId: 4117\n        │   └── Fourchette de débrayage (Niveau 4)\n        │       └── Release Fork [ID: 102080] (Niveau 3) → ProductId: 4117\n        ├── Clutch Release Bearing/Central Slave Cylinder [ID: 100054] (Niveau 2) → ProductId: 4739\n        │   └── Fourchette de débrayage (Niveau 4)\n        │       └── Release Fork [ID: 102080] (Niveau 3) → ProductId: 4739\n        ├── Clutch Release Bearing/Central Slave Cylinder [ID: 100054] (Niveau 2) → ProductId: 3419\n        │   └── Fourchette de débrayage (Niveau 4)\n        │       └── Release Fork [ID: 102080] (Niveau 3) → ProductId: 3419\n        ├── Clutch Release Bearing/Central Slave Cylinder [ID: 100054] (Niveau 2) → ProductId: 60883\n        │   └── Fourchette de débrayage (Niveau 4)\n        │       └── Release Fork [ID: 102080] (Niveau 3) → ProductId: 60883\n        ├── Clutch Release Bearing/Central Slave Cylinder [ID: 100054] (Niveau 2) → ProductId: 4738\n        │   └── Fourchette de débrayage (Niveau 4)\n        │       └── Release Fork [ID: 102080] (Niveau 3) → ProductId: 4738\n        └── Clutch Release Bearing/Central Slave Cylinder [ID: 100054] (Niveau 2) → ProductId: 4825\n            └── Fourchette de débrayage (Niveau 4)\n                └── Release Fork [ID: 102080] (Niveau 3) → ProductId: 4825",
  "arborescencePaths": [
    {
      "path": [
        "Embrayage / composants",
        "Butée d’embrayage/butée hydraulique",
        "Clutch Release Bearing/Central Slave Cylinder"
      ],
      "categoryIds": [
        100050,
        null,
        100054
      ],
      "finalCategoryId": 100054,
      "productId": 3180
    },
    {
      "path": [
        "Embrayage / composants",
        "Butée d’embrayage/butée hydraulique",
        "Clutch Release Bearing/Central Slave Cylinder"
      ],
      "categoryIds": [
        100050,
        null,
        100054
      ],
      "finalCategoryId": 100054,
      "productId": 4117
    },
    {
      "path": [
        "Embrayage / composants",
        "Butée d’embrayage/butée hydraulique",
        "Clutch Release Bearing/Central Slave Cylinder"
      ],
      "categoryIds": [
        100050,
        null,
        100054
      ],
      "finalCategoryId": 100054,
      "productId": 4739
    },
    {
      "path": [
        "Embrayage / composants",
        "Butée d’embrayage/butée hydraulique",
        "Clutch Release Bearing/Central Slave Cylinder"
      ],
      "categoryIds": [
        100050,
        null,
        100054
      ],
      "finalCategoryId": 100054,
      "productId": 3419
    },
    {
      "path": [
        "Embrayage / composants",
        "Butée d’embrayage/butée hydraulique",
        "Clutch Release Bearing/Central Slave Cylinder"
      ],
      "categoryIds": [
        100050,
        null,
        100054
      ],
      "finalCategoryId": 100054,
      "productId": 60883
    },
    {
      "path": [
        "Embrayage / composants",
        "Butée d’embrayage/butée hydraulique",
        "Clutch Release Bearing/Central Slave Cylinder"
      ],
      "categoryIds": [
        100050,
        null,
        100054
      ],
      "finalCategoryId": 100054,
      "productId": 4738
    },
    {
      "path": [
        "Embrayage / composants",
        "Butée d’embrayage/butée hydraulique",
        "Clutch Release Bearing/Central Slave Cylinder"
      ],
      "categoryIds": [
        100050,
        null,
        100054
      ],
      "finalCategoryId": 100054,
      "productId": 4825
    }
  ],
  "productIdsInArbo": [
    3180,
    3419,
    4117,
    4738,
    4739,
    4825,
    60883
  ],
  "closestProductIds": [
    {
      "productId": 3180,
      "productName": "Boulon, fourchette de débrayage"
    },
    {
      "productId": 3419,
      "productName": "Fourchette de débrayage, embrayage"
    },
    {
      "productId": 4117,
      "productName": "Butée, commande d'embrayage"
    },
    {
      "productId": 4738,
      "productName": "Rouleau de pression, fourchette de débrayage"
    },
    {
      "productId": 4739,
      "productName": "Douille de serrage, fourchette de débrayage"
    }
  ]
}