{
  "productName": "Galet tendeur, courroie crantée",
  "searchText": "Galet tendeur, courroie crantée",
  "found": true,
  "hasMatch": true,
  "timestamp": "2025-12-02T20:42:23.099Z",
  "productId": 545,
  "arborescence": {
    "Commande à courroie": {
      "categoryId": 100016,
      "categoryName": "Commande à courroie",
      "level": 1,
      "children": {
        "Courroie crantée/kit de courroie crantée": {
          "categoryId": null,
          "categoryName": "Courroie crantée/kit de courroie crantée",
          "level": 2,
          "children": {
            "Galet tendeur, courroie crantée": {
              "categoryId": 100085,
              "categoryName": "Timing Belt/Set",
              "level": 2,
              "children": {
                "Tendeurs de courroies": {
                  "categoryId": null,
                  "categoryName": "Tendeurs de courroies",
                  "level": 4,
                  "children": {
                    "Galet tendeur, courroie crantée": {
                      "categoryId": 100461,
                      "categoryName": "Belt Tensioner (Tensioner Unit)",
                      "level": 3,
                      "children": [],
                      "productId": 545
                    }
                  }
                }
              },
              "productId": 545
            }
          }
        }
      }
    },
    "Moteur": {
      "categoryId": 100002,
      "categoryName": "Moteur",
      "level": 1,
      "children": {
        "Commande à courroie": {
          "categoryId": null,
          "categoryName": "Commande à courroie",
          "level": 2,
          "children": {
            "Galet tendeur, courroie crantée": {
              "categoryId": 104302,
              "categoryName": "Belt Drive",
              "level": 2,
              "children": {
                "Courroie crantée/kit de courroie crantée": {
                  "categoryId": null,
                  "categoryName": "Courroie crantée/kit de courroie crantée",
                  "level": 4,
                  "children": {
                    "Galet tendeur, courroie crantée": {
                      "categoryId": 104317,
                      "categoryName": "Timing Belt/Set",
                      "level": 3,
                      "children": {
                        "Tendeurs de courroies": {
                          "categoryId": null,
                          "categoryName": "Tendeurs de courroies",
                          "level": 6,
                          "children": {
                            "Galet tendeur, courroie crantée": {
                              "categoryId": 104323,
                              "categoryName": "Belt Tensioner (Tensioner Unit)",
                              "level": 4,
                              "children": [],
                              "productId": 545
                            }
                          }
                        }
                      },
                      "productId": 545
                    }
                  }
                }
              },
              "productId": 545
            }
          }
        },
        "Distribution moteur": {
          "categoryId": null,
          "categoryName": "Distribution moteur",
          "level": 2,
          "children": {
            "Galet tendeur, courroie crantée": {
              "categoryId": 100003,
              "categoryName": "Engine Timing",
              "level": 2,
              "children": {
                "Courroie crantée/tension/guidage": {
                  "categoryId": null,
                  "categoryName": "Courroie crantée/tension/guidage",
                  "level": 4,
                  "children": {
                    "Galet tendeur, courroie crantée": {
                      "categoryId": 100396,
                      "categoryName": "Timing Belt/Tensioner/Guide",
                      "level": 3,
                      "children": {
                        "Tendeurs de courroies": {
                          "categoryId": null,
                          "categoryName": "Tendeurs de courroies",
                          "level": 6,
                          "children": {
                            "Galet tendeur, courroie crantée": {
                              "categoryId": 100410,
                              "categoryName": "Belt Tensioner (Tensioner Unit)",
                              "level": 4,
                              "children": [],
                              "productId": 545
                            }
                          }
                        }
                      },
                      "productId": 545
                    }
                  }
                }
              },
              "productId": 545
            }
          }
        }
      }
    }
  },
  "arborescenceText": "├── Commande à courroie [ID: 100016] (Niveau 1)\n│   └── Courroie crantée/kit de courroie crantée (Niveau 2)\n│       └── Timing Belt/Set [ID: 100085] (Niveau 2) → ProductId: 545\n│           └── Tendeurs de courroies (Niveau 4)\n│               └── Belt Tensioner (Tensioner Unit) [ID: 100461] (Niveau 3) → ProductId: 545\n\n└── Moteur [ID: 100002] (Niveau 1)\n    ├── Commande à courroie (Niveau 2)\n    │   └── Belt Drive [ID: 104302] (Niveau 2) → ProductId: 545\n    │       └── Courroie crantée/kit de courroie crantée (Niveau 4)\n    │           └── Timing Belt/Set [ID: 104317] (Niveau 3) → ProductId: 545\n    │               └── Tendeurs de courroies (Niveau 6)\n    │                   └── Belt Tensioner (Tensioner Unit) [ID: 104323] (Niveau 4) → ProductId: 545\n    └── Distribution moteur (Niveau 2)\n        └── Engine Timing [ID: 100003] (Niveau 2) → ProductId: 545\n            └── Courroie crantée/tension/guidage (Niveau 4)\n                └── Timing Belt/Tensioner/Guide [ID: 100396] (Niveau 3) → ProductId: 545\n                    └── Tendeurs de courroies (Niveau 6)\n                        └── Belt Tensioner (Tensioner Unit) [ID: 100410] (Niveau 4) → ProductId: 545",
  "arborescencePaths": [
    {
      "path": [
        "Commande à courroie",
        "Courroie crantée/kit de courroie crantée",
        "Timing Belt/Set"
      ],
      "categoryIds": [
        100016,
        null,
        100085
      ],
      "finalCategoryId": 100085,
      "productId": 545
    },
    {
      "path": [
        "Moteur",
        "Commande à courroie",
        "Belt Drive"
      ],
      "categoryIds": [
        100002,
        null,
        104302
      ],
      "finalCategoryId": 104302,
      "productId": 545
    },
    {
      "path": [
        "Moteur",
        "Distribution moteur",
        "Engine Timing"
      ],
      "categoryIds": [
        100002,
        null,
        100003
      ],
      "finalCategoryId": 100003,
      "productId": 545
    }
  ],
  "productIdsInArbo": [
    545
  ],
  "matchedProductIds": [
    545
  ]
}