{
  "productName": "Goujon",
  "searchText": "Goujon",
  "found": true,
  "hasMatch": false,
  "timestamp": "2025-12-02T20:43:13.869Z",
  "productId": 5971,
  "arborescence": {
    "Commande à courroie": {
      "categoryId": 100016,
      "categoryName": "Commande à courroie",
      "level": 1,
      "children": {
        "Jeu/ courroies trapézoïdales à nervures": {
          "categoryId": null,
          "categoryName": "Jeu/ courroies trapézoïdales à nervures",
          "level": 2,
          "children": {
            "Goujon fileté, poulie de renvoi": {
              "categoryId": 100082,
              "categoryName": "V-Ribbed Belt/Set",
              "level": 2,
              "children": {
                "Poulie de renvoi/poulie de guidage": {
                  "categoryId": null,
                  "categoryName": "Poulie de renvoi/poulie de guidage",
                  "level": 4,
                  "children": {
                    "Goujon fileté, poulie de renvoi": {
                      "categoryId": 100435,
                      "categoryName": "Deflection Pulley/Guide Pulley",
                      "level": 3,
                      "children": [],
                      "productId": 3710
                    }
                  }
                }
              },
              "productId": 3710
            },
            "Goujon fileté, poulie de tension": {
              "categoryId": 100082,
              "categoryName": "V-Ribbed Belt/Set",
              "level": 2,
              "children": {
                "Poulie de tension": {
                  "categoryId": null,
                  "categoryName": "Poulie de tension",
                  "level": 4,
                  "children": {
                    "Goujon fileté, poulie de tension": {
                      "categoryId": 100434,
                      "categoryName": "Tensioner Pulley",
                      "level": 3,
                      "children": [],
                      "productId": 3709
                    }
                  }
                }
              },
              "productId": 3709
            }
          }
        }
      }
    },
    "Direction": {
      "categoryId": 100012,
      "categoryName": "Direction",
      "level": 1,
      "children": {
        "Outils": {
          "categoryId": null,
          "categoryName": "Outils",
          "level": 2,
          "children": {
            "Jeu de jauges, barre de connexion": {
              "categoryId": 103158,
              "categoryName": "Tools",
              "level": 2,
              "children": [],
              "productId": 9061
            }
          }
        }
      }
    },
    "Dispositif de freinage": {
      "categoryId": 100006,
      "categoryName": "Dispositif de freinage",
      "level": 1,
      "children": {
        "Frein à tambour": {
          "categoryId": null,
          "categoryName": "Frein à tambour",
          "level": 2,
          "children": {
            "Goupille du ressort, mâchoire de frein": {
              "categoryId": 100627,
              "categoryName": "Drum Brake",
              "level": 2,
              "children": {
                "Accessoires / composants": {
                  "categoryId": null,
                  "categoryName": "Accessoires / composants",
                  "level": 4,
                  "children": {
                    "Goupille du ressort, mâchoire de frein": {
                      "categoryId": 100634,
                      "categoryName": "Accessories/Parts",
                      "level": 3,
                      "children": [],
                      "productId": 2715
                    }
                  }
                }
              },
              "productId": 2715
            }
          }
        }
      }
    },
    "Embrayage / composants": {
      "categoryId": 100050,
      "categoryName": "Embrayage / composants",
      "level": 1,
      "children": {
        "Commande d'embrayage": {
          "categoryId": null,
          "categoryName": "Commande d'embrayage",
          "level": 2,
          "children": {
            "Goupille cannelée, actionneur levier (double embrayage)": {
              "categoryId": 100079,
              "categoryName": "Clutch Control",
              "level": 2,
              "children": {
                "Leviers/pièces de transmission": {
                  "categoryId": null,
                  "categoryName": "Leviers/pièces de transmission",
                  "level": 4,
                  "children": {
                    "Goupille cannelée, actionneur levier (double embrayage)": {
                      "categoryId": 100780,
                      "categoryName": "Clutch Levers/Linkage",
                      "level": 3,
                      "children": [],
                      "productId": 61273
                    }
                  }
                }
              },
              "productId": 61273
            }
          }
        }
      }
    },
    "Moteur": {
      "categoryId": 100002,
      "categoryName": "Moteur",
      "level": 1,
      "children": {
        "Commande à courroie": {
          "categoryId": null,
          "categoryName": "Commande à courroie",
          "level": 2,
          "children": {
            "Goujon fileté, poulie de renvoi": {
              "categoryId": 104302,
              "categoryName": "Belt Drive",
              "level": 2,
              "children": {
                "Jeu/ courroies trapézoïdales à nervures": {
                  "categoryId": null,
                  "categoryName": "Jeu/ courroies trapézoïdales à nervures",
                  "level": 4,
                  "children": {
                    "Goujon fileté, poulie de renvoi": {
                      "categoryId": 104308,
                      "categoryName": "V-Ribbed Belt/Set",
                      "level": 3,
                      "children": {
                        "Poulie de renvoi/poulie de guidage": {
                          "categoryId": null,
                          "categoryName": "Poulie de renvoi/poulie de guidage",
                          "level": 6,
                          "children": {
                            "Goujon fileté, poulie de renvoi": {
                              "categoryId": 104312,
                              "categoryName": "Deflection Pulley/Guide Pulley",
                              "level": 4,
                              "children": [],
                              "productId": 3710
                            }
                          }
                        }
                      },
                      "productId": 3710
                    }
                  }
                }
              },
              "productId": 3710
            },
            "Goujon fileté, poulie de tension": {
              "categoryId": 104302,
              "categoryName": "Belt Drive",
              "level": 2,
              "children": {
                "Jeu/ courroies trapézoïdales à nervures": {
                  "categoryId": null,
                  "categoryName": "Jeu/ courroies trapézoïdales à nervures",
                  "level": 4,
                  "children": {
                    "Goujon fileté, poulie de tension": {
                      "categoryId": 104308,
                      "categoryName": "V-Ribbed Belt/Set",
                      "level": 3,
                      "children": {
                        "Poulie de tension": {
                          "categoryId": null,
                          "categoryName": "Poulie de tension",
                          "level": 6,
                          "children": {
                            "Goujon fileté, poulie de tension": {
                              "categoryId": 104311,
                              "categoryName": "Tensioner Pulley",
                              "level": 4,
                              "children": [],
                              "productId": 3709
                            }
                          }
                        }
                      },
                      "productId": 3709
                    }
                  }
                }
              },
              "productId": 3709
            }
          }
        },
        "Distribution moteur": {
          "categoryId": null,
          "categoryName": "Distribution moteur",
          "level": 2,
          "children": {
            "Goupille, outil sépar./rivetage de chaîne de distribution": {
              "categoryId": 100003,
              "categoryName": "Engine Timing",
              "level": 2,
              "children": {
                "Outils": {
                  "categoryId": null,
                  "categoryName": "Outils",
                  "level": 4,
                  "children": {
                    "Goupille, outil sépar./rivetage de chaîne de distribution": {
                      "categoryId": 706307,
                      "categoryName": "Tools",
                      "level": 3,
                      "children": [],
                      "productId": 60633
                    }
                  }
                }
              },
              "productId": 60633
            }
          }
        },
        "Outils": {
          "categoryId": null,
          "categoryName": "Outils",
          "level": 2,
          "children": {
            "Dégoujonneuse, roue dentée d'arbres à came": {
              "categoryId": 103129,
              "categoryName": "Tools",
              "level": 2,
              "children": [],
              "productId": 5788
            }
          }
        }
      }
    },
    "Suspension/Amortissement": {
      "categoryId": 100011,
      "categoryName": "Suspension/Amortissement",
      "level": 1,
      "children": {
        "Suspension": {
          "categoryId": null,
          "categoryName": "Suspension",
          "level": 2,
          "children": {
            "Goujon fileté, barre de torsion": {
              "categoryId": 100113,
              "categoryName": "Coil Springs",
              "level": 2,
              "children": [],
              "productId": 5744
            }
          }
        }
      }
    },
    "Système électrique": {
      "categoryId": 100010,
      "categoryName": "Système électrique",
      "level": 1,
      "children": {
        "Interrupteur/Relais/Contrôle clignotant/Appareil d.commande": {
          "categoryId": null,
          "categoryName": "Interrupteur/Relais/Contrôle clignotant/Appareil d.commande",
          "level": 2,
          "children": {
            "Goupille d'actionnement, interrupteur de feu de recul": {
              "categoryId": 100307,
              "categoryName": "Light Switches/Relays/Controls",
              "level": 2,
              "children": {
                "Interrupteur / régulateur": {
                  "categoryId": null,
                  "categoryName": "Interrupteur / régulateur",
                  "level": 4,
                  "children": {
                    "Goupille d'actionnement, interrupteur de feu de recul": {
                      "categoryId": 100509,
                      "categoryName": "Light Switch/ Lever",
                      "level": 3,
                      "children": [],
                      "productId": 60918
                    }
                  }
                }
              },
              "productId": 60918
            }
          }
        }
      }
    }
  },
  "arborescenceText": "├── Commande à courroie [ID: 100016] (Niveau 1)\n│   └── Jeu/ courroies trapézoïdales à nervures (Niveau 2)\n│       ├── V-Ribbed Belt/Set [ID: 100082] (Niveau 2) → ProductId: 3710\n│       │   └── Poulie de renvoi/poulie de guidage (Niveau 4)\n│       │       └── Deflection Pulley/Guide Pulley [ID: 100435] (Niveau 3) → ProductId: 3710\n│       └── V-Ribbed Belt/Set [ID: 100082] (Niveau 2) → ProductId: 3709\n│           └── Poulie de tension (Niveau 4)\n│               └── Tensioner Pulley [ID: 100434] (Niveau 3) → ProductId: 3709\n\n├── Direction [ID: 100012] (Niveau 1)\n│   └── Outils (Niveau 2)\n│       └── Tools [ID: 103158] (Niveau 2) → ProductId: 9061\n\n├── Dispositif de freinage [ID: 100006] (Niveau 1)\n│   └── Frein à tambour (Niveau 2)\n│       └── Drum Brake [ID: 100627] (Niveau 2) → ProductId: 2715\n│           └── Accessoires / composants (Niveau 4)\n│               └── Accessories/Parts [ID: 100634] (Niveau 3) → ProductId: 2715\n\n├── Embrayage / composants [ID: 100050] (Niveau 1)\n│   └── Commande d'embrayage (Niveau 2)\n│       └── Clutch Control [ID: 100079] (Niveau 2) → ProductId: 61273\n│           └── Leviers/pièces de transmission (Niveau 4)\n│               └── Clutch Levers/Linkage [ID: 100780] (Niveau 3) → ProductId: 61273\n\n├── Moteur [ID: 100002] (Niveau 1)\n│   ├── Commande à courroie (Niveau 2)\n│   │   ├── Belt Drive [ID: 104302] (Niveau 2) → ProductId: 3710\n│   │   │   └── Jeu/ courroies trapézoïdales à nervures (Niveau 4)\n│   │   │       └── V-Ribbed Belt/Set [ID: 104308] (Niveau 3) → ProductId: 3710\n│   │   │           └── Poulie de renvoi/poulie de guidage (Niveau 6)\n│   │   │               └── Deflection Pulley/Guide Pulley [ID: 104312] (Niveau 4) → ProductId: 3710\n│   │   └── Belt Drive [ID: 104302] (Niveau 2) → ProductId: 3709\n│   │       └── Jeu/ courroies trapézoïdales à nervures (Niveau 4)\n│   │           └── V-Ribbed Belt/Set [ID: 104308] (Niveau 3) → ProductId: 3709\n│   │               └── Poulie de tension (Niveau 6)\n│   │                   └── Tensioner Pulley [ID: 104311] (Niveau 4) → ProductId: 3709\n│   ├── Distribution moteur (Niveau 2)\n│   │   └── Engine Timing [ID: 100003] (Niveau 2) → ProductId: 60633\n│   │       └── Outils (Niveau 4)\n│   │           └── Tools [ID: 706307] (Niveau 3) → ProductId: 60633\n│   └── Outils (Niveau 2)\n│       └── Tools [ID: 103129] (Niveau 2) → ProductId: 5788\n\n├── Suspension/Amortissement [ID: 100011] (Niveau 1)\n│   └── Suspension (Niveau 2)\n│       └── Coil Springs [ID: 100113] (Niveau 2) → ProductId: 5744\n\n└── Système électrique [ID: 100010] (Niveau 1)\n    └── Interrupteur/Relais/Contrôle clignotant/Appareil d.commande (Niveau 2)\n        └── Light Switches/Relays/Controls [ID: 100307] (Niveau 2) → ProductId: 60918\n            └── Interrupteur / régulateur (Niveau 4)\n                └── Light Switch/ Lever [ID: 100509] (Niveau 3) → ProductId: 60918",
  "arborescencePaths": [
    {
      "path": [
        "Commande à courroie",
        "Jeu/ courroies trapézoïdales à nervures",
        "V-Ribbed Belt/Set"
      ],
      "categoryIds": [
        100016,
        null,
        100082
      ],
      "finalCategoryId": 100082,
      "productId": 3710
    },
    {
      "path": [
        "Commande à courroie",
        "Jeu/ courroies trapézoïdales à nervures",
        "V-Ribbed Belt/Set"
      ],
      "categoryIds": [
        100016,
        null,
        100082
      ],
      "finalCategoryId": 100082,
      "productId": 3709
    },
    {
      "path": [
        "Direction",
        "Outils",
        "Tools"
      ],
      "categoryIds": [
        100012,
        null,
        103158
      ],
      "finalCategoryId": 103158,
      "productId": 9061
    },
    {
      "path": [
        "Dispositif de freinage",
        "Frein à tambour",
        "Drum Brake"
      ],
      "categoryIds": [
        100006,
        null,
        100627
      ],
      "finalCategoryId": 100627,
      "productId": 2715
    },
    {
      "path": [
        "Embrayage / composants",
        "Commande d'embrayage",
        "Clutch Control"
      ],
      "categoryIds": [
        100050,
        null,
        100079
      ],
      "finalCategoryId": 100079,
      "productId": 61273
    },
    {
      "path": [
        "Moteur",
        "Commande à courroie",
        "Belt Drive"
      ],
      "categoryIds": [
        100002,
        null,
        104302
      ],
      "finalCategoryId": 104302,
      "productId": 3710
    },
    {
      "path": [
        "Moteur",
        "Commande à courroie",
        "Belt Drive"
      ],
      "categoryIds": [
        100002,
        null,
        104302
      ],
      "finalCategoryId": 104302,
      "productId": 3709
    },
    {
      "path": [
        "Moteur",
        "Distribution moteur",
        "Engine Timing"
      ],
      "categoryIds": [
        100002,
        null,
        100003
      ],
      "finalCategoryId": 100003,
      "productId": 60633
    },
    {
      "path": [
        "Moteur",
        "Outils",
        "Tools"
      ],
      "categoryIds": [
        100002,
        null,
        103129
      ],
      "finalCategoryId": 103129,
      "productId": 5788
    },
    {
      "path": [
        "Suspension/Amortissement",
        "Suspension",
        "Coil Springs"
      ],
      "categoryIds": [
        100011,
        null,
        100113
      ],
      "finalCategoryId": 100113,
      "productId": 5744
    },
    {
      "path": [
        "Système électrique",
        "Interrupteur/Relais/Contrôle clignotant/Appareil d.commande",
        "Light Switches/Relays/Controls"
      ],
      "categoryIds": [
        100010,
        null,
        100307
      ],
      "finalCategoryId": 100307,
      "productId": 60918
    }
  ],
  "productIdsInArbo": [
    2715,
    3709,
    3710,
    5744,
    5788,
    9061,
    60633,
    60918,
    61273
  ],
  "closestProductIds": [
    {
      "productId": 2715,
      "productName": "Goupille du ressort, mâchoire de frein"
    },
    {
      "productId": 3709,
      "productName": "Goujon fileté, poulie de tension"
    },
    {
      "productId": 3710,
      "productName": "Goujon fileté, poulie de renvoi"
    },
    {
      "productId": 5744,
      "productName": "Goujon fileté, barre de torsion"
    },
    {
      "productId": 5788,
      "productName": "Dégoujonneuse, roue dentée d'arbres à came"
    }
  ]
}