{
  "productName": "Goujon fileté",
  "searchText": "Goujon fileté",
  "found": true,
  "hasMatch": false,
  "timestamp": "2025-12-02T20:43:16.024Z",
  "productId": 3712,
  "arborescence": {
    "Commande à courroie": {
      "categoryId": 100016,
      "categoryName": "Commande à courroie",
      "level": 1,
      "children": {
        "Jeu/ courroies trapézoïdales à nervures": {
          "categoryId": null,
          "categoryName": "Jeu/ courroies trapézoïdales à nervures",
          "level": 2,
          "children": {
            "Goujon fileté, poulie de renvoi": {
              "categoryId": 100082,
              "categoryName": "V-Ribbed Belt/Set",
              "level": 2,
              "children": {
                "Poulie de renvoi/poulie de guidage": {
                  "categoryId": null,
                  "categoryName": "Poulie de renvoi/poulie de guidage",
                  "level": 4,
                  "children": {
                    "Goujon fileté, poulie de renvoi": {
                      "categoryId": 100435,
                      "categoryName": "Deflection Pulley/Guide Pulley",
                      "level": 3,
                      "children": [],
                      "productId": 3710
                    }
                  }
                }
              },
              "productId": 3710
            },
            "Goujon fileté, poulie de tension": {
              "categoryId": 100082,
              "categoryName": "V-Ribbed Belt/Set",
              "level": 2,
              "children": {
                "Poulie de tension": {
                  "categoryId": null,
                  "categoryName": "Poulie de tension",
                  "level": 4,
                  "children": {
                    "Goujon fileté, poulie de tension": {
                      "categoryId": 100434,
                      "categoryName": "Tensioner Pulley",
                      "level": 3,
                      "children": [],
                      "productId": 3709
                    }
                  }
                }
              },
              "productId": 3709
            }
          }
        }
      }
    },
    "Moteur": {
      "categoryId": 100002,
      "categoryName": "Moteur",
      "level": 1,
      "children": {
        "Commande à courroie": {
          "categoryId": null,
          "categoryName": "Commande à courroie",
          "level": 2,
          "children": {
            "Goujon fileté, poulie de renvoi": {
              "categoryId": 104302,
              "categoryName": "Belt Drive",
              "level": 2,
              "children": {
                "Jeu/ courroies trapézoïdales à nervures": {
                  "categoryId": null,
                  "categoryName": "Jeu/ courroies trapézoïdales à nervures",
                  "level": 4,
                  "children": {
                    "Goujon fileté, poulie de renvoi": {
                      "categoryId": 104308,
                      "categoryName": "V-Ribbed Belt/Set",
                      "level": 3,
                      "children": {
                        "Poulie de renvoi/poulie de guidage": {
                          "categoryId": null,
                          "categoryName": "Poulie de renvoi/poulie de guidage",
                          "level": 6,
                          "children": {
                            "Goujon fileté, poulie de renvoi": {
                              "categoryId": 104312,
                              "categoryName": "Deflection Pulley/Guide Pulley",
                              "level": 4,
                              "children": [],
                              "productId": 3710
                            }
                          }
                        }
                      },
                      "productId": 3710
                    }
                  }
                }
              },
              "productId": 3710
            },
            "Goujon fileté, poulie de tension": {
              "categoryId": 104302,
              "categoryName": "Belt Drive",
              "level": 2,
              "children": {
                "Jeu/ courroies trapézoïdales à nervures": {
                  "categoryId": null,
                  "categoryName": "Jeu/ courroies trapézoïdales à nervures",
                  "level": 4,
                  "children": {
                    "Goujon fileté, poulie de tension": {
                      "categoryId": 104308,
                      "categoryName": "V-Ribbed Belt/Set",
                      "level": 3,
                      "children": {
                        "Poulie de tension": {
                          "categoryId": null,
                          "categoryName": "Poulie de tension",
                          "level": 6,
                          "children": {
                            "Goujon fileté, poulie de tension": {
                              "categoryId": 104311,
                              "categoryName": "Tensioner Pulley",
                              "level": 4,
                              "children": [],
                              "productId": 3709
                            }
                          }
                        }
                      },
                      "productId": 3709
                    }
                  }
                }
              },
              "productId": 3709
            }
          }
        }
      }
    },
    "Suspension/Amortissement": {
      "categoryId": 100011,
      "categoryName": "Suspension/Amortissement",
      "level": 1,
      "children": {
        "Suspension": {
          "categoryId": null,
          "categoryName": "Suspension",
          "level": 2,
          "children": {
            "Goujon fileté, barre de torsion": {
              "categoryId": 100113,
              "categoryName": "Coil Springs",
              "level": 2,
              "children": [],
              "productId": 5744
            }
          }
        }
      }
    }
  },
  "arborescenceText": "├── Commande à courroie [ID: 100016] (Niveau 1)\n│   └── Jeu/ courroies trapézoïdales à nervures (Niveau 2)\n│       ├── V-Ribbed Belt/Set [ID: 100082] (Niveau 2) → ProductId: 3710\n│       │   └── Poulie de renvoi/poulie de guidage (Niveau 4)\n│       │       └── Deflection Pulley/Guide Pulley [ID: 100435] (Niveau 3) → ProductId: 3710\n│       └── V-Ribbed Belt/Set [ID: 100082] (Niveau 2) → ProductId: 3709\n│           └── Poulie de tension (Niveau 4)\n│               └── Tensioner Pulley [ID: 100434] (Niveau 3) → ProductId: 3709\n\n├── Moteur [ID: 100002] (Niveau 1)\n│   └── Commande à courroie (Niveau 2)\n│       ├── Belt Drive [ID: 104302] (Niveau 2) → ProductId: 3710\n│       │   └── Jeu/ courroies trapézoïdales à nervures (Niveau 4)\n│       │       └── V-Ribbed Belt/Set [ID: 104308] (Niveau 3) → ProductId: 3710\n│       │           └── Poulie de renvoi/poulie de guidage (Niveau 6)\n│       │               └── Deflection Pulley/Guide Pulley [ID: 104312] (Niveau 4) → ProductId: 3710\n│       └── Belt Drive [ID: 104302] (Niveau 2) → ProductId: 3709\n│           └── Jeu/ courroies trapézoïdales à nervures (Niveau 4)\n│               └── V-Ribbed Belt/Set [ID: 104308] (Niveau 3) → ProductId: 3709\n│                   └── Poulie de tension (Niveau 6)\n│                       └── Tensioner Pulley [ID: 104311] (Niveau 4) → ProductId: 3709\n\n└── Suspension/Amortissement [ID: 100011] (Niveau 1)\n    └── Suspension (Niveau 2)\n        └── Coil Springs [ID: 100113] (Niveau 2) → ProductId: 5744",
  "arborescencePaths": [
    {
      "path": [
        "Commande à courroie",
        "Jeu/ courroies trapézoïdales à nervures",
        "V-Ribbed Belt/Set"
      ],
      "categoryIds": [
        100016,
        null,
        100082
      ],
      "finalCategoryId": 100082,
      "productId": 3710
    },
    {
      "path": [
        "Commande à courroie",
        "Jeu/ courroies trapézoïdales à nervures",
        "V-Ribbed Belt/Set"
      ],
      "categoryIds": [
        100016,
        null,
        100082
      ],
      "finalCategoryId": 100082,
      "productId": 3709
    },
    {
      "path": [
        "Moteur",
        "Commande à courroie",
        "Belt Drive"
      ],
      "categoryIds": [
        100002,
        null,
        104302
      ],
      "finalCategoryId": 104302,
      "productId": 3710
    },
    {
      "path": [
        "Moteur",
        "Commande à courroie",
        "Belt Drive"
      ],
      "categoryIds": [
        100002,
        null,
        104302
      ],
      "finalCategoryId": 104302,
      "productId": 3709
    },
    {
      "path": [
        "Suspension/Amortissement",
        "Suspension",
        "Coil Springs"
      ],
      "categoryIds": [
        100011,
        null,
        100113
      ],
      "finalCategoryId": 100113,
      "productId": 5744
    }
  ],
  "productIdsInArbo": [
    3709,
    3710,
    5744
  ],
  "closestProductIds": [
    {
      "productId": 3709,
      "productName": "Goujon fileté, poulie de tension"
    },
    {
      "productId": 3710,
      "productName": "Goujon fileté, poulie de renvoi"
    },
    {
      "productId": 5744,
      "productName": "Goujon fileté, barre de torsion"
    }
  ]
}