{
  "productName": "Guide de soupape",
  "searchText": "Guide de soupape",
  "found": true,
  "hasMatch": true,
  "timestamp": "2025-12-02T20:44:15.895Z",
  "productId": 1644,
  "arborescence": {
    "Moteur": {
      "categoryId": 100002,
      "categoryName": "Moteur",
      "level": 1,
      "children": {
        "Culasse / pieces de montage": {
          "categoryId": null,
          "categoryName": "Culasse / pieces de montage",
          "level": 2,
          "children": {
            "Assortiment, câle latérale - jeu des soupapes": {
              "categoryId": 100373,
              "categoryName": "Cylinder Head/Attachment Parts",
              "level": 2,
              "children": {
                "Guide de soupape / joint / réglage": {
                  "categoryId": null,
                  "categoryName": "Guide de soupape / joint / réglage",
                  "level": 4,
                  "children": {
                    "Assortiment, câle latérale - jeu des soupapes": {
                      "categoryId": 100377,
                      "categoryName": "Valve Guide/Stem Seal/Parts",
                      "level": 3,
                      "children": [],
                      "productId": 4167
                    }
                  }
                }
              },
              "productId": 4167
            },
            "Bague d'étanchéité, tige de soupape": {
              "categoryId": 100373,
              "categoryName": "Cylinder Head/Attachment Parts",
              "level": 2,
              "children": {
                "Guide de soupape / joint / réglage": {
                  "categoryId": null,
                  "categoryName": "Guide de soupape / joint / réglage",
                  "level": 4,
                  "children": {
                    "Bague d'étanchéité, tige de soupape": {
                      "categoryId": 100377,
                      "categoryName": "Valve Guide/Stem Seal/Parts",
                      "level": 3,
                      "children": [],
                      "productId": 322
                    }
                  }
                }
              },
              "productId": 322
            },
            "Contre-écrou, vis de réglage de soupape": {
              "categoryId": 100373,
              "categoryName": "Cylinder Head/Attachment Parts",
              "level": 2,
              "children": {
                "Guide de soupape / joint / réglage": {
                  "categoryId": null,
                  "categoryName": "Guide de soupape / joint / réglage",
                  "level": 4,
                  "children": {
                    "Contre-écrou, vis de réglage de soupape": {
                      "categoryId": 100377,
                      "categoryName": "Valve Guide/Stem Seal/Parts",
                      "level": 3,
                      "children": [],
                      "productId": 1625
                    }
                  }
                }
              },
              "productId": 1625
            },
            "Guide de soupape": {
              "categoryId": 100373,
              "categoryName": "Cylinder Head/Attachment Parts",
              "level": 2,
              "children": {
                "Guide de soupape / joint / réglage": {
                  "categoryId": null,
                  "categoryName": "Guide de soupape / joint / réglage",
                  "level": 4,
                  "children": {
                    "Guide de soupape": {
                      "categoryId": 100377,
                      "categoryName": "Valve Guide/Stem Seal/Parts",
                      "level": 3,
                      "children": [],
                      "productId": 1644
                    }
                  }
                }
              },
              "productId": 1644
            },
            "Jeu de joints d'étanchéité, tige de soupape": {
              "categoryId": 100373,
              "categoryName": "Cylinder Head/Attachment Parts",
              "level": 2,
              "children": {
                "Guide de soupape / joint / réglage": {
                  "categoryId": null,
                  "categoryName": "Guide de soupape / joint / réglage",
                  "level": 4,
                  "children": {
                    "Jeu de joints d'étanchéité, tige de soupape": {
                      "categoryId": 100377,
                      "categoryName": "Valve Guide/Stem Seal/Parts",
                      "level": 3,
                      "children": [],
                      "productId": 323
                    }
                  }
                }
              },
              "productId": 323
            },
            "Rondelle de compensation, jeu des soupapes": {
              "categoryId": 100373,
              "categoryName": "Cylinder Head/Attachment Parts",
              "level": 2,
              "children": {
                "Guide de soupape / joint / réglage": {
                  "categoryId": null,
                  "categoryName": "Guide de soupape / joint / réglage",
                  "level": 4,
                  "children": {
                    "Rondelle de compensation, jeu des soupapes": {
                      "categoryId": 100377,
                      "categoryName": "Valve Guide/Stem Seal/Parts",
                      "level": 3,
                      "children": [],
                      "productId": 1521
                    }
                  }
                }
              },
              "productId": 1521
            },
            "Siège rapporté de soupape": {
              "categoryId": 100373,
              "categoryName": "Cylinder Head/Attachment Parts",
              "level": 2,
              "children": {
                "Guide de soupape / joint / réglage": {
                  "categoryId": null,
                  "categoryName": "Guide de soupape / joint / réglage",
                  "level": 4,
                  "children": {
                    "Siège rapporté de soupape": {
                      "categoryId": 100377,
                      "categoryName": "Valve Guide/Stem Seal/Parts",
                      "level": 3,
                      "children": [],
                      "productId": 1274
                    }
                  }
                }
              },
              "productId": 1274
            },
            "Vis de réglage du jeu de soupape": {
              "categoryId": 100373,
              "categoryName": "Cylinder Head/Attachment Parts",
              "level": 2,
              "children": {
                "Guide de soupape / joint / réglage": {
                  "categoryId": null,
                  "categoryName": "Guide de soupape / joint / réglage",
                  "level": 4,
                  "children": {
                    "Vis de réglage du jeu de soupape": {
                      "categoryId": 100377,
                      "categoryName": "Valve Guide/Stem Seal/Parts",
                      "level": 3,
                      "children": [],
                      "productId": 1645
                    }
                  }
                }
              },
              "productId": 1645
            }
          }
        },
        "Distribution moteur": {
          "categoryId": null,
          "categoryName": "Distribution moteur",
          "level": 2,
          "children": {
            "Assortiment, câle latérale - jeu des soupapes": {
              "categoryId": 100003,
              "categoryName": "Engine Timing",
              "level": 2,
              "children": {
                "Soupape / réglage de soupape": {
                  "categoryId": null,
                  "categoryName": "Soupape / réglage de soupape",
                  "level": 4,
                  "children": {
                    "Assortiment, câle latérale - jeu des soupapes": {
                      "categoryId": 100422,
                      "categoryName": "Valve Train",
                      "level": 3,
                      "children": {
                        "Réglage de soupape": {
                          "categoryId": null,
                          "categoryName": "Réglage de soupape",
                          "level": 6,
                          "children": {
                            "Assortiment, câle latérale - jeu des soupapes": {
                              "categoryId": 100424,
                              "categoryName": "Valve Actuation",
                              "level": 4,
                              "children": [],
                              "productId": 4167
                            }
                          }
                        }
                      },
                      "productId": 4167
                    }
                  }
                }
              },
              "productId": 4167
            },
            "Contre-écrou, vis de réglage de soupape": {
              "categoryId": 100003,
              "categoryName": "Engine Timing",
              "level": 2,
              "children": {
                "Soupape / réglage de soupape": {
                  "categoryId": null,
                  "categoryName": "Soupape / réglage de soupape",
                  "level": 4,
                  "children": {
                    "Contre-écrou, vis de réglage de soupape": {
                      "categoryId": 100422,
                      "categoryName": "Valve Train",
                      "level": 3,
                      "children": {
                        "Réglage de soupape": {
                          "categoryId": null,
                          "categoryName": "Réglage de soupape",
                          "level": 6,
                          "children": {
                            "Contre-écrou, vis de réglage de soupape": {
                              "categoryId": 100424,
                              "categoryName": "Valve Actuation",
                              "level": 4,
                              "children": [],
                              "productId": 1625
                            }
                          }
                        }
                      },
                      "productId": 1625
                    }
                  }
                }
              },
              "productId": 1625
            },
            "Rondelle de compensation, jeu des soupapes": {
              "categoryId": 100003,
              "categoryName": "Engine Timing",
              "level": 2,
              "children": {
                "Soupape / réglage de soupape": {
                  "categoryId": null,
                  "categoryName": "Soupape / réglage de soupape",
                  "level": 4,
                  "children": {
                    "Rondelle de compensation, jeu des soupapes": {
                      "categoryId": 100422,
                      "categoryName": "Valve Train",
                      "level": 3,
                      "children": {
                        "Réglage de soupape": {
                          "categoryId": null,
                          "categoryName": "Réglage de soupape",
                          "level": 6,
                          "children": {
                            "Rondelle de compensation, jeu des soupapes": {
                              "categoryId": 100424,
                              "categoryName": "Valve Actuation",
                              "level": 4,
                              "children": [],
                              "productId": 1521
                            }
                          }
                        }
                      },
                      "productId": 1521
                    }
                  }
                }
              },
              "productId": 1521
            },
            "Vis de réglage du jeu de soupape": {
              "categoryId": 100003,
              "categoryName": "Engine Timing",
              "level": 2,
              "children": {
                "Soupape / réglage de soupape": {
                  "categoryId": null,
                  "categoryName": "Soupape / réglage de soupape",
                  "level": 4,
                  "children": {
                    "Vis de réglage du jeu de soupape": {
                      "categoryId": 100422,
                      "categoryName": "Valve Train",
                      "level": 3,
                      "children": {
                        "Réglage de soupape": {
                          "categoryId": null,
                          "categoryName": "Réglage de soupape",
                          "level": 6,
                          "children": {
                            "Vis de réglage du jeu de soupape": {
                              "categoryId": 100424,
                              "categoryName": "Valve Actuation",
                              "level": 4,
                              "children": [],
                              "productId": 1645
                            }
                          }
                        }
                      },
                      "productId": 1645
                    }
                  }
                }
              },
              "productId": 1645
            }
          }
        },
        "Joints": {
          "categoryId": null,
          "categoryName": "Joints",
          "level": 2,
          "children": {
            "Bague d'étanchéité, tige de soupape": {
              "categoryId": 100223,
              "categoryName": "Gaskets",
              "level": 2,
              "children": {
                "Joint de tige de soupape": {
                  "categoryId": null,
                  "categoryName": "Joint de tige de soupape",
                  "level": 4,
                  "children": {
                    "Bague d'étanchéité, tige de soupape": {
                      "categoryId": 100228,
                      "categoryName": "Valve Stem Seal",
                      "level": 3,
                      "children": [],
                      "productId": 322
                    }
                  }
                }
              },
              "productId": 322
            },
            "Jeu de joints d'étanchéité, tige de soupape": {
              "categoryId": 100223,
              "categoryName": "Gaskets",
              "level": 2,
              "children": {
                "Joint de tige de soupape": {
                  "categoryId": null,
                  "categoryName": "Joint de tige de soupape",
                  "level": 4,
                  "children": {
                    "Jeu de joints d'étanchéité, tige de soupape": {
                      "categoryId": 100228,
                      "categoryName": "Valve Stem Seal",
                      "level": 3,
                      "children": [],
                      "productId": 323
                    }
                  }
                }
              },
              "productId": 323
            }
          }
        }
      }
    }
  },
  "arborescenceText": "└── Moteur [ID: 100002] (Niveau 1)\n    ├── Culasse / pieces de montage (Niveau 2)\n    │   ├── Cylinder Head/Attachment Parts [ID: 100373] (Niveau 2) → ProductId: 4167\n    │   │   └── Guide de soupape / joint / réglage (Niveau 4)\n    │   │       └── Valve Guide/Stem Seal/Parts [ID: 100377] (Niveau 3) → ProductId: 4167\n    │   ├── Cylinder Head/Attachment Parts [ID: 100373] (Niveau 2) → ProductId: 322\n    │   │   └── Guide de soupape / joint / réglage (Niveau 4)\n    │   │       └── Valve Guide/Stem Seal/Parts [ID: 100377] (Niveau 3) → ProductId: 322\n    │   ├── Cylinder Head/Attachment Parts [ID: 100373] (Niveau 2) → ProductId: 1625\n    │   │   └── Guide de soupape / joint / réglage (Niveau 4)\n    │   │       └── Valve Guide/Stem Seal/Parts [ID: 100377] (Niveau 3) → ProductId: 1625\n    │   ├── Cylinder Head/Attachment Parts [ID: 100373] (Niveau 2) → ProductId: 1644\n    │   │   └── Guide de soupape / joint / réglage (Niveau 4)\n    │   │       └── Valve Guide/Stem Seal/Parts [ID: 100377] (Niveau 3) → ProductId: 1644\n    │   ├── Cylinder Head/Attachment Parts [ID: 100373] (Niveau 2) → ProductId: 323\n    │   │   └── Guide de soupape / joint / réglage (Niveau 4)\n    │   │       └── Valve Guide/Stem Seal/Parts [ID: 100377] (Niveau 3) → ProductId: 323\n    │   ├── Cylinder Head/Attachment Parts [ID: 100373] (Niveau 2) → ProductId: 1521\n    │   │   └── Guide de soupape / joint / réglage (Niveau 4)\n    │   │       └── Valve Guide/Stem Seal/Parts [ID: 100377] (Niveau 3) → ProductId: 1521\n    │   ├── Cylinder Head/Attachment Parts [ID: 100373] (Niveau 2) → ProductId: 1274\n    │   │   └── Guide de soupape / joint / réglage (Niveau 4)\n    │   │       └── Valve Guide/Stem Seal/Parts [ID: 100377] (Niveau 3) → ProductId: 1274\n    │   └── Cylinder Head/Attachment Parts [ID: 100373] (Niveau 2) → ProductId: 1645\n    │       └── Guide de soupape / joint / réglage (Niveau 4)\n    │           └── Valve Guide/Stem Seal/Parts [ID: 100377] (Niveau 3) → ProductId: 1645\n    ├── Distribution moteur (Niveau 2)\n    │   ├── Engine Timing [ID: 100003] (Niveau 2) → ProductId: 4167\n    │   │   └── Soupape / réglage de soupape (Niveau 4)\n    │   │       └── Valve Train [ID: 100422] (Niveau 3) → ProductId: 4167\n    │   │           └── Réglage de soupape (Niveau 6)\n    │   │               └── Valve Actuation [ID: 100424] (Niveau 4) → ProductId: 4167\n    │   ├── Engine Timing [ID: 100003] (Niveau 2) → ProductId: 1625\n    │   │   └── Soupape / réglage de soupape (Niveau 4)\n    │   │       └── Valve Train [ID: 100422] (Niveau 3) → ProductId: 1625\n    │   │           └── Réglage de soupape (Niveau 6)\n    │   │               └── Valve Actuation [ID: 100424] (Niveau 4) → ProductId: 1625\n    │   ├── Engine Timing [ID: 100003] (Niveau 2) → ProductId: 1521\n    │   │   └── Soupape / réglage de soupape (Niveau 4)\n    │   │       └── Valve Train [ID: 100422] (Niveau 3) → ProductId: 1521\n    │   │           └── Réglage de soupape (Niveau 6)\n    │   │               └── Valve Actuation [ID: 100424] (Niveau 4) → ProductId: 1521\n    │   └── Engine Timing [ID: 100003] (Niveau 2) → ProductId: 1645\n    │       └── Soupape / réglage de soupape (Niveau 4)\n    │           └── Valve Train [ID: 100422] (Niveau 3) → ProductId: 1645\n    │               └── Réglage de soupape (Niveau 6)\n    │                   └── Valve Actuation [ID: 100424] (Niveau 4) → ProductId: 1645\n    └── Joints (Niveau 2)\n        ├── Gaskets [ID: 100223] (Niveau 2) → ProductId: 322\n        │   └── Joint de tige de soupape (Niveau 4)\n        │       └── Valve Stem Seal [ID: 100228] (Niveau 3) → ProductId: 322\n        └── Gaskets [ID: 100223] (Niveau 2) → ProductId: 323\n            └── Joint de tige de soupape (Niveau 4)\n                └── Valve Stem Seal [ID: 100228] (Niveau 3) → ProductId: 323",
  "arborescencePaths": [
    {
      "path": [
        "Moteur",
        "Culasse / pieces de montage",
        "Cylinder Head/Attachment Parts"
      ],
      "categoryIds": [
        100002,
        null,
        100373
      ],
      "finalCategoryId": 100373,
      "productId": 4167
    },
    {
      "path": [
        "Moteur",
        "Culasse / pieces de montage",
        "Cylinder Head/Attachment Parts"
      ],
      "categoryIds": [
        100002,
        null,
        100373
      ],
      "finalCategoryId": 100373,
      "productId": 322
    },
    {
      "path": [
        "Moteur",
        "Culasse / pieces de montage",
        "Cylinder Head/Attachment Parts"
      ],
      "categoryIds": [
        100002,
        null,
        100373
      ],
      "finalCategoryId": 100373,
      "productId": 1625
    },
    {
      "path": [
        "Moteur",
        "Culasse / pieces de montage",
        "Cylinder Head/Attachment Parts"
      ],
      "categoryIds": [
        100002,
        null,
        100373
      ],
      "finalCategoryId": 100373,
      "productId": 1644
    },
    {
      "path": [
        "Moteur",
        "Culasse / pieces de montage",
        "Cylinder Head/Attachment Parts"
      ],
      "categoryIds": [
        100002,
        null,
        100373
      ],
      "finalCategoryId": 100373,
      "productId": 323
    },
    {
      "path": [
        "Moteur",
        "Culasse / pieces de montage",
        "Cylinder Head/Attachment Parts"
      ],
      "categoryIds": [
        100002,
        null,
        100373
      ],
      "finalCategoryId": 100373,
      "productId": 1521
    },
    {
      "path": [
        "Moteur",
        "Culasse / pieces de montage",
        "Cylinder Head/Attachment Parts"
      ],
      "categoryIds": [
        100002,
        null,
        100373
      ],
      "finalCategoryId": 100373,
      "productId": 1274
    },
    {
      "path": [
        "Moteur",
        "Culasse / pieces de montage",
        "Cylinder Head/Attachment Parts"
      ],
      "categoryIds": [
        100002,
        null,
        100373
      ],
      "finalCategoryId": 100373,
      "productId": 1645
    },
    {
      "path": [
        "Moteur",
        "Distribution moteur",
        "Engine Timing"
      ],
      "categoryIds": [
        100002,
        null,
        100003
      ],
      "finalCategoryId": 100003,
      "productId": 4167
    },
    {
      "path": [
        "Moteur",
        "Distribution moteur",
        "Engine Timing"
      ],
      "categoryIds": [
        100002,
        null,
        100003
      ],
      "finalCategoryId": 100003,
      "productId": 1625
    },
    {
      "path": [
        "Moteur",
        "Distribution moteur",
        "Engine Timing"
      ],
      "categoryIds": [
        100002,
        null,
        100003
      ],
      "finalCategoryId": 100003,
      "productId": 1521
    },
    {
      "path": [
        "Moteur",
        "Distribution moteur",
        "Engine Timing"
      ],
      "categoryIds": [
        100002,
        null,
        100003
      ],
      "finalCategoryId": 100003,
      "productId": 1645
    },
    {
      "path": [
        "Moteur",
        "Joints",
        "Gaskets"
      ],
      "categoryIds": [
        100002,
        null,
        100223
      ],
      "finalCategoryId": 100223,
      "productId": 322
    },
    {
      "path": [
        "Moteur",
        "Joints",
        "Gaskets"
      ],
      "categoryIds": [
        100002,
        null,
        100223
      ],
      "finalCategoryId": 100223,
      "productId": 323
    }
  ],
  "productIdsInArbo": [
    322,
    323,
    1274,
    1521,
    1625,
    1644,
    1645,
    4167
  ],
  "matchedProductIds": [
    1644
  ]
}