{
  "productName": "Indicateur de pression d'huile",
  "searchText": "Indicateur de pression d'huile",
  "found": true,
  "hasMatch": true,
  "timestamp": "2025-12-02T20:45:16.522Z",
  "productId": 805,
  "arborescence": {
    "Boîte de vitesses": {
      "categoryId": 100238,
      "categoryName": "Boîte de vitesses",
      "level": 1,
      "children": {
        "Boîte de vitesse automatique": {
          "categoryId": null,
          "categoryName": "Boîte de vitesse automatique",
          "level": 2,
          "children": {
            "Indicateur de pression d'huile, boîte automatique": {
              "categoryId": 100240,
              "categoryName": "Automatic Transmission",
              "level": 2,
              "children": {
                "Boîtier/composants": {
                  "categoryId": null,
                  "categoryName": "Boîtier/composants",
                  "level": 4,
                  "children": {
                    "Indicateur de pression d'huile, boîte automatique": {
                      "categoryId": 100775,
                      "categoryName": "Transmission Housing/Parts",
                      "level": 3,
                      "children": [],
                      "productId": 1743
                    }
                  }
                },
                "Contrôle / hydraulique": {
                  "categoryId": null,
                  "categoryName": "Contrôle / hydraulique",
                  "level": 4,
                  "children": {
                    "Indicateur de pression d'huile, boîte automatique": {
                      "categoryId": 100776,
                      "categoryName": "Transmission Control/Hydraulics",
                      "level": 3,
                      "children": [],
                      "productId": 1743
                    }
                  }
                }
              },
              "productId": 1743
            }
          }
        }
      }
    },
    "Direction": {
      "categoryId": 100012,
      "categoryName": "Direction",
      "level": 1,
      "children": {
        "Indicateur de pression d'huile": {
          "categoryId": null,
          "categoryName": "Indicateur de pression d'huile",
          "level": 2,
          "children": {
            "Interrupteur à pression d'huile, direction assistée": {
              "categoryId": 102766,
              "categoryName": "Oil Pressure Switch",
              "level": 2,
              "children": [],
              "productId": 3860
            }
          }
        }
      }
    },
    "Moteur": {
      "categoryId": 100002,
      "categoryName": "Moteur",
      "level": 1,
      "children": {
        "Circuit électrique du moteur": {
          "categoryId": null,
          "categoryName": "Circuit électrique du moteur",
          "level": 2,
          "children": {
            "Adaptateur, indicateur de pression d'huile": {
              "categoryId": 100754,
              "categoryName": "Engine Electrics",
              "level": 2,
              "children": [],
              "productId": 5015
            },
            "Câble de raccordement, commutateur de pression d’huile": {
              "categoryId": 100754,
              "categoryName": "Engine Electrics",
              "level": 2,
              "children": [],
              "productId": 9385
            },
            "Capteur, pression d'huile": {
              "categoryId": 100754,
              "categoryName": "Engine Electrics",
              "level": 2,
              "children": [],
              "productId": 162
            },
            "Capteur, pression et température d'huile": {
              "categoryId": 100754,
              "categoryName": "Engine Electrics",
              "level": 2,
              "children": [],
              "productId": 4175
            },
            "Capteur, température d'huile": {
              "categoryId": 100754,
              "categoryName": "Engine Electrics",
              "level": 2,
              "children": [],
              "productId": 829
            },
            "Indicateur de pression d'huile": {
              "categoryId": 100754,
              "categoryName": "Engine Electrics",
              "level": 2,
              "children": [],
              "productId": 805
            },
            "Kit réparation de câble, capteur de température d'huile": {
              "categoryId": 100754,
              "categoryName": "Engine Electrics",
              "level": 2,
              "children": [],
              "productId": 60396
            }
          }
        },
        "Lubrification": {
          "categoryId": null,
          "categoryName": "Lubrification",
          "level": 2,
          "children": {
            "Adaptateur, indicateur de pression d'huile": {
              "categoryId": 100245,
              "categoryName": "Lubrication",
              "level": 2,
              "children": {
                "Indicateur de pression d'huile / capteur / soupape": {
                  "categoryId": null,
                  "categoryName": "Indicateur de pression d'huile / capteur / soupape",
                  "level": 4,
                  "children": {
                    "Adaptateur, indicateur de pression d'huile": {
                      "categoryId": 100478,
                      "categoryName": "Oil Pressure Switch/Sensor/Valve",
                      "level": 3,
                      "children": [],
                      "productId": 5015
                    }
                  }
                }
              },
              "productId": 5015
            },
            "Bague d'étanchéité, indicateur de pression d'huile": {
              "categoryId": 100245,
              "categoryName": "Lubrication",
              "level": 2,
              "children": {
                "Indicateur de pression d'huile / capteur / soupape": {
                  "categoryId": null,
                  "categoryName": "Indicateur de pression d'huile / capteur / soupape",
                  "level": 4,
                  "children": {
                    "Bague d'étanchéité, indicateur de pression d'huile": {
                      "categoryId": 100478,
                      "categoryName": "Oil Pressure Switch/Sensor/Valve",
                      "level": 3,
                      "children": [],
                      "productId": 136
                    }
                  }
                }
              },
              "productId": 136
            },
            "Câble de raccordement, commutateur de pression d’huile": {
              "categoryId": 100245,
              "categoryName": "Lubrication",
              "level": 2,
              "children": {
                "Indicateur de pression d'huile / capteur / soupape": {
                  "categoryId": null,
                  "categoryName": "Indicateur de pression d'huile / capteur / soupape",
                  "level": 4,
                  "children": {
                    "Câble de raccordement, commutateur de pression d’huile": {
                      "categoryId": 100478,
                      "categoryName": "Oil Pressure Switch/Sensor/Valve",
                      "level": 3,
                      "children": [],
                      "productId": 9385
                    }
                  }
                }
              },
              "productId": 9385
            },
            "Capteur, niveau d'huile moteur": {
              "categoryId": 100245,
              "categoryName": "Lubrication",
              "level": 2,
              "children": {
                "Indicateur de pression d'huile / capteur / soupape": {
                  "categoryId": null,
                  "categoryName": "Indicateur de pression d'huile / capteur / soupape",
                  "level": 4,
                  "children": {
                    "Capteur, niveau d'huile moteur": {
                      "categoryId": 100478,
                      "categoryName": "Oil Pressure Switch/Sensor/Valve",
                      "level": 3,
                      "children": [],
                      "productId": 1289
                    }
                  }
                }
              },
              "productId": 1289
            },
            "Capteur, pression d'huile": {
              "categoryId": 100245,
              "categoryName": "Lubrication",
              "level": 2,
              "children": {
                "Indicateur de pression d'huile / capteur / soupape": {
                  "categoryId": null,
                  "categoryName": "Indicateur de pression d'huile / capteur / soupape",
                  "level": 4,
                  "children": {
                    "Capteur, pression d'huile": {
                      "categoryId": 100478,
                      "categoryName": "Oil Pressure Switch/Sensor/Valve",
                      "level": 3,
                      "children": [],
                      "productId": 162
                    }
                  }
                }
              },
              "productId": 162
            },
            "Capteur, température d'huile": {
              "categoryId": 100245,
              "categoryName": "Lubrication",
              "level": 2,
              "children": {
                "Indicateur de pression d'huile / capteur / soupape": {
                  "categoryId": null,
                  "categoryName": "Indicateur de pression d'huile / capteur / soupape",
                  "level": 4,
                  "children": {
                    "Capteur, température d'huile": {
                      "categoryId": 100478,
                      "categoryName": "Oil Pressure Switch/Sensor/Valve",
                      "level": 3,
                      "children": [],
                      "productId": 829
                    }
                  }
                }
              },
              "productId": 829
            },
            "Commutateur de niveau, niveau d'huile moteur": {
              "categoryId": 100245,
              "categoryName": "Lubrication",
              "level": 2,
              "children": {
                "Indicateur de pression d'huile / capteur / soupape": {
                  "categoryId": null,
                  "categoryName": "Indicateur de pression d'huile / capteur / soupape",
                  "level": 4,
                  "children": {
                    "Commutateur de niveau, niveau d'huile moteur": {
                      "categoryId": 100478,
                      "categoryName": "Oil Pressure Switch/Sensor/Valve",
                      "level": 3,
                      "children": [],
                      "productId": 1383
                    }
                  }
                }
              },
              "productId": 1383
            },
            "Indicateur de pression d'huile": {
              "categoryId": 100245,
              "categoryName": "Lubrication",
              "level": 2,
              "children": {
                "Indicateur de pression d'huile / capteur / soupape": {
                  "categoryId": null,
                  "categoryName": "Indicateur de pression d'huile / capteur / soupape",
                  "level": 4,
                  "children": {
                    "Indicateur de pression d'huile": {
                      "categoryId": 100478,
                      "categoryName": "Oil Pressure Switch/Sensor/Valve",
                      "level": 3,
                      "children": [],
                      "productId": 805
                    }
                  }
                }
              },
              "productId": 805
            },
            "Joint, capteur du niveau d'huile": {
              "categoryId": 100245,
              "categoryName": "Lubrication",
              "level": 2,
              "children": {
                "Indicateur de pression d'huile / capteur / soupape": {
                  "categoryId": null,
                  "categoryName": "Indicateur de pression d'huile / capteur / soupape",
                  "level": 4,
                  "children": {
                    "Joint, capteur du niveau d'huile": {
                      "categoryId": 100478,
                      "categoryName": "Oil Pressure Switch/Sensor/Valve",
                      "level": 3,
                      "children": [],
                      "productId": 4176
                    }
                  }
                }
              },
              "productId": 4176
            },
            "Joint, soupape de maintien de pression d'huile": {
              "categoryId": 100245,
              "categoryName": "Lubrication",
              "level": 2,
              "children": {
                "Indicateur de pression d'huile / capteur / soupape": {
                  "categoryId": null,
                  "categoryName": "Indicateur de pression d'huile / capteur / soupape",
                  "level": 4,
                  "children": {
                    "Joint, soupape de maintien de pression d'huile": {
                      "categoryId": 100478,
                      "categoryName": "Oil Pressure Switch/Sensor/Valve",
                      "level": 3,
                      "children": [],
                      "productId": 5036
                    }
                  }
                }
              },
              "productId": 5036
            },
            "Kit adaptateur, régulateur de pression d’huile": {
              "categoryId": 100245,
              "categoryName": "Lubrication",
              "level": 2,
              "children": {
                "Indicateur de pression d'huile / capteur / soupape": {
                  "categoryId": null,
                  "categoryName": "Indicateur de pression d'huile / capteur / soupape",
                  "level": 4,
                  "children": {
                    "Kit adaptateur, régulateur de pression d’huile": {
                      "categoryId": 100478,
                      "categoryName": "Oil Pressure Switch/Sensor/Valve",
                      "level": 3,
                      "children": [],
                      "productId": 60410
                    }
                  }
                }
              },
              "productId": 60410
            },
            "Kit réparation de câble, capteur de niveau d’huile": {
              "categoryId": 100245,
              "categoryName": "Lubrication",
              "level": 2,
              "children": {
                "Indicateur de pression d'huile / capteur / soupape": {
                  "categoryId": null,
                  "categoryName": "Indicateur de pression d'huile / capteur / soupape",
                  "level": 4,
                  "children": {
                    "Kit réparation de câble, capteur de niveau d’huile": {
                      "categoryId": 100478,
                      "categoryName": "Oil Pressure Switch/Sensor/Valve",
                      "level": 3,
                      "children": [],
                      "productId": 9590
                    }
                  }
                }
              },
              "productId": 9590
            },
            "Kit réparation de câble, capteur de température d'huile": {
              "categoryId": 100245,
              "categoryName": "Lubrication",
              "level": 2,
              "children": {
                "Indicateur de pression d'huile / capteur / soupape": {
                  "categoryId": null,
                  "categoryName": "Indicateur de pression d'huile / capteur / soupape",
                  "level": 4,
                  "children": {
                    "Kit réparation de câble, capteur de température d'huile": {
                      "categoryId": 100478,
                      "categoryName": "Oil Pressure Switch/Sensor/Valve",
                      "level": 3,
                      "children": [],
                      "productId": 60396
                    }
                  }
                }
              },
              "productId": 60396
            },
            "Kit réparation de câble, commutateur de pression d’huile": {
              "categoryId": 100245,
              "categoryName": "Lubrication",
              "level": 2,
              "children": {
                "Indicateur de pression d'huile / capteur / soupape": {
                  "categoryId": null,
                  "categoryName": "Indicateur de pression d'huile / capteur / soupape",
                  "level": 4,
                  "children": {
                    "Kit réparation de câble, commutateur de pression d’huile": {
                      "categoryId": 100478,
                      "categoryName": "Oil Pressure Switch/Sensor/Valve",
                      "level": 3,
                      "children": [],
                      "productId": 60020
                    }
                  }
                }
              },
              "productId": 60020
            },
            "Ressort, valve de pression d'huile-pompe à huile": {
              "categoryId": 100245,
              "categoryName": "Lubrication",
              "level": 2,
              "children": {
                "Indicateur de pression d'huile / capteur / soupape": {
                  "categoryId": null,
                  "categoryName": "Indicateur de pression d'huile / capteur / soupape",
                  "level": 4,
                  "children": {
                    "Ressort, valve de pression d'huile-pompe à huile": {
                      "categoryId": 100478,
                      "categoryName": "Oil Pressure Switch/Sensor/Valve",
                      "level": 3,
                      "children": [],
                      "productId": 4037
                    }
                  }
                }
              },
              "productId": 4037
            },
            "Soupape de maintien de pression d'huile": {
              "categoryId": 100245,
              "categoryName": "Lubrication",
              "level": 2,
              "children": {
                "Indicateur de pression d'huile / capteur / soupape": {
                  "categoryId": null,
                  "categoryName": "Indicateur de pression d'huile / capteur / soupape",
                  "level": 4,
                  "children": {
                    "Soupape de maintien de pression d'huile": {
                      "categoryId": 100478,
                      "categoryName": "Oil Pressure Switch/Sensor/Valve",
                      "level": 3,
                      "children": [],
                      "productId": 163
                    }
                  }
                }
              },
              "productId": 163
            },
            "Valve de pression d'huile": {
              "categoryId": 100245,
              "categoryName": "Lubrication",
              "level": 2,
              "children": {
                "Indicateur de pression d'huile / capteur / soupape": {
                  "categoryId": null,
                  "categoryName": "Indicateur de pression d'huile / capteur / soupape",
                  "level": 4,
                  "children": {
                    "Valve de pression d'huile": {
                      "categoryId": 100478,
                      "categoryName": "Oil Pressure Switch/Sensor/Valve",
                      "level": 3,
                      "children": [],
                      "productId": 1105
                    }
                  }
                }
              },
              "productId": 1105
            }
          }
        }
      }
    },
    "Refroidissement": {
      "categoryId": 100007,
      "categoryName": "Refroidissement",
      "level": 1,
      "children": {
        "Interrupteur / capteur": {
          "categoryId": null,
          "categoryName": "Interrupteur / capteur",
          "level": 2,
          "children": {
            "Capteur, température d'huile": {
              "categoryId": 100334,
              "categoryName": "Switch/Sensor",
              "level": 2,
              "children": [],
              "productId": 829
            },
            "Kit réparation de câble, capteur de température d'huile": {
              "categoryId": 100334,
              "categoryName": "Switch/Sensor",
              "level": 2,
              "children": [],
              "productId": 60396
            }
          }
        }
      }
    },
    "Système électrique": {
      "categoryId": 100010,
      "categoryName": "Système électrique",
      "level": 1,
      "children": {
        "Capteurs": {
          "categoryId": null,
          "categoryName": "Capteurs",
          "level": 2,
          "children": {
            "Capteur, niveau d'huile moteur": {
              "categoryId": 102747,
              "categoryName": "Sensors",
              "level": 2,
              "children": [],
              "productId": 1289
            },
            "Capteur, pression d'huile": {
              "categoryId": 102747,
              "categoryName": "Sensors",
              "level": 2,
              "children": [],
              "productId": 162
            },
            "Capteur, pression et température d'huile": {
              "categoryId": 102747,
              "categoryName": "Sensors",
              "level": 2,
              "children": [],
              "productId": 4175
            },
            "Capteur, température d'huile": {
              "categoryId": 102747,
              "categoryName": "Sensors",
              "level": 2,
              "children": [],
              "productId": 829
            },
            "Kit réparation de câble, capteur de niveau d’huile": {
              "categoryId": 102747,
              "categoryName": "Sensors",
              "level": 2,
              "children": [],
              "productId": 9590
            },
            "Kit réparation de câble, capteur de température d'huile": {
              "categoryId": 102747,
              "categoryName": "Sensors",
              "level": 2,
              "children": [],
              "productId": 60396
            }
          }
        },
        "Instruments": {
          "categoryId": null,
          "categoryName": "Instruments",
          "level": 2,
          "children": {
            "Capteur, niveau d'huile moteur": {
              "categoryId": 100322,
              "categoryName": "Instruments",
              "level": 2,
              "children": {
                "Capteurs/Conatct": {
                  "categoryId": null,
                  "categoryName": "Capteurs/Conatct",
                  "level": 4,
                  "children": {
                    "Capteur, niveau d'huile moteur": {
                      "categoryId": 100553,
                      "categoryName": "Sensors/Switches",
                      "level": 3,
                      "children": [],
                      "productId": 1289
                    }
                  }
                }
              },
              "productId": 1289
            },
            "Capteur, pression d'huile": {
              "categoryId": 100322,
              "categoryName": "Instruments",
              "level": 2,
              "children": {
                "Capteurs/Conatct": {
                  "categoryId": null,
                  "categoryName": "Capteurs/Conatct",
                  "level": 4,
                  "children": {
                    "Capteur, pression d'huile": {
                      "categoryId": 100553,
                      "categoryName": "Sensors/Switches",
                      "level": 3,
                      "children": [],
                      "productId": 162
                    }
                  }
                }
              },
              "productId": 162
            },
            "Capteur, pression et température d'huile": {
              "categoryId": 100322,
              "categoryName": "Instruments",
              "level": 2,
              "children": {
                "Capteurs/Conatct": {
                  "categoryId": null,
                  "categoryName": "Capteurs/Conatct",
                  "level": 4,
                  "children": {
                    "Capteur, pression et température d'huile": {
                      "categoryId": 100553,
                      "categoryName": "Sensors/Switches",
                      "level": 3,
                      "children": [],
                      "productId": 4175
                    }
                  }
                }
              },
              "productId": 4175
            },
            "Capteur, température d'huile": {
              "categoryId": 100322,
              "categoryName": "Instruments",
              "level": 2,
              "children": {
                "Capteurs/Conatct": {
                  "categoryId": null,
                  "categoryName": "Capteurs/Conatct",
                  "level": 4,
                  "children": {
                    "Capteur, température d'huile": {
                      "categoryId": 100553,
                      "categoryName": "Sensors/Switches",
                      "level": 3,
                      "children": [],
                      "productId": 829
                    }
                  }
                }
              },
              "productId": 829
            },
            "Kit réparation de câble, capteur de niveau d’huile": {
              "categoryId": 100322,
              "categoryName": "Instruments",
              "level": 2,
              "children": {
                "Capteurs/Conatct": {
                  "categoryId": null,
                  "categoryName": "Capteurs/Conatct",
                  "level": 4,
                  "children": {
                    "Kit réparation de câble, capteur de niveau d’huile": {
                      "categoryId": 100553,
                      "categoryName": "Sensors/Switches",
                      "level": 3,
                      "children": [],
                      "productId": 9590
                    }
                  }
                }
              },
              "productId": 9590
            },
            "Kit réparation de câble, capteur de température d'huile": {
              "categoryId": 100322,
              "categoryName": "Instruments",
              "level": 2,
              "children": {
                "Capteurs/Conatct": {
                  "categoryId": null,
                  "categoryName": "Capteurs/Conatct",
                  "level": 4,
                  "children": {
                    "Kit réparation de câble, capteur de température d'huile": {
                      "categoryId": 100553,
                      "categoryName": "Sensors/Switches",
                      "level": 3,
                      "children": [],
                      "productId": 60396
                    }
                  }
                }
              },
              "productId": 60396
            }
          }
        }
      }
    }
  },
  "arborescenceText": "├── Boîte de vitesses [ID: 100238] (Niveau 1)\n│   └── Boîte de vitesse automatique (Niveau 2)\n│       └── Automatic Transmission [ID: 100240] (Niveau 2) → ProductId: 1743\n│           ├── Boîtier/composants (Niveau 4)\n│           │   └── Transmission Housing/Parts [ID: 100775] (Niveau 3) → ProductId: 1743\n│           └── Contrôle / hydraulique (Niveau 4)\n│               └── Transmission Control/Hydraulics [ID: 100776] (Niveau 3) → ProductId: 1743\n\n├── Direction [ID: 100012] (Niveau 1)\n│   └── Indicateur de pression d'huile (Niveau 2)\n│       └── Oil Pressure Switch [ID: 102766] (Niveau 2) → ProductId: 3860\n\n├── Moteur [ID: 100002] (Niveau 1)\n│   ├── Circuit électrique du moteur (Niveau 2)\n│   │   ├── Engine Electrics [ID: 100754] (Niveau 2) → ProductId: 5015\n│   │   ├── Engine Electrics [ID: 100754] (Niveau 2) → ProductId: 9385\n│   │   ├── Engine Electrics [ID: 100754] (Niveau 2) → ProductId: 162\n│   │   ├── Engine Electrics [ID: 100754] (Niveau 2) → ProductId: 4175\n│   │   ├── Engine Electrics [ID: 100754] (Niveau 2) → ProductId: 829\n│   │   ├── Engine Electrics [ID: 100754] (Niveau 2) → ProductId: 805\n│   │   └── Engine Electrics [ID: 100754] (Niveau 2) → ProductId: 60396\n│   └── Lubrification (Niveau 2)\n│       ├── Lubrication [ID: 100245] (Niveau 2) → ProductId: 5015\n│       │   └── Indicateur de pression d'huile / capteur / soupape (Niveau 4)\n│       │       └── Oil Pressure Switch/Sensor/Valve [ID: 100478] (Niveau 3) → ProductId: 5015\n│       ├── Lubrication [ID: 100245] (Niveau 2) → ProductId: 136\n│       │   └── Indicateur de pression d'huile / capteur / soupape (Niveau 4)\n│       │       └── Oil Pressure Switch/Sensor/Valve [ID: 100478] (Niveau 3) → ProductId: 136\n│       ├── Lubrication [ID: 100245] (Niveau 2) → ProductId: 9385\n│       │   └── Indicateur de pression d'huile / capteur / soupape (Niveau 4)\n│       │       └── Oil Pressure Switch/Sensor/Valve [ID: 100478] (Niveau 3) → ProductId: 9385\n│       ├── Lubrication [ID: 100245] (Niveau 2) → ProductId: 1289\n│       │   └── Indicateur de pression d'huile / capteur / soupape (Niveau 4)\n│       │       └── Oil Pressure Switch/Sensor/Valve [ID: 100478] (Niveau 3) → ProductId: 1289\n│       ├── Lubrication [ID: 100245] (Niveau 2) → ProductId: 162\n│       │   └── Indicateur de pression d'huile / capteur / soupape (Niveau 4)\n│       │       └── Oil Pressure Switch/Sensor/Valve [ID: 100478] (Niveau 3) → ProductId: 162\n│       ├── Lubrication [ID: 100245] (Niveau 2) → ProductId: 829\n│       │   └── Indicateur de pression d'huile / capteur / soupape (Niveau 4)\n│       │       └── Oil Pressure Switch/Sensor/Valve [ID: 100478] (Niveau 3) → ProductId: 829\n│       ├── Lubrication [ID: 100245] (Niveau 2) → ProductId: 1383\n│       │   └── Indicateur de pression d'huile / capteur / soupape (Niveau 4)\n│       │       └── Oil Pressure Switch/Sensor/Valve [ID: 100478] (Niveau 3) → ProductId: 1383\n│       ├── Lubrication [ID: 100245] (Niveau 2) → ProductId: 805\n│       │   └── Indicateur de pression d'huile / capteur / soupape (Niveau 4)\n│       │       └── Oil Pressure Switch/Sensor/Valve [ID: 100478] (Niveau 3) → ProductId: 805\n│       ├── Lubrication [ID: 100245] (Niveau 2) → ProductId: 4176\n│       │   └── Indicateur de pression d'huile / capteur / soupape (Niveau 4)\n│       │       └── Oil Pressure Switch/Sensor/Valve [ID: 100478] (Niveau 3) → ProductId: 4176\n│       ├── Lubrication [ID: 100245] (Niveau 2) → ProductId: 5036\n│       │   └── Indicateur de pression d'huile / capteur / soupape (Niveau 4)\n│       │       └── Oil Pressure Switch/Sensor/Valve [ID: 100478] (Niveau 3) → ProductId: 5036\n│       ├── Lubrication [ID: 100245] (Niveau 2) → ProductId: 60410\n│       │   └── Indicateur de pression d'huile / capteur / soupape (Niveau 4)\n│       │       └── Oil Pressure Switch/Sensor/Valve [ID: 100478] (Niveau 3) → ProductId: 60410\n│       ├── Lubrication [ID: 100245] (Niveau 2) → ProductId: 9590\n│       │   └── Indicateur de pression d'huile / capteur / soupape (Niveau 4)\n│       │       └── Oil Pressure Switch/Sensor/Valve [ID: 100478] (Niveau 3) → ProductId: 9590\n│       ├── Lubrication [ID: 100245] (Niveau 2) → ProductId: 60396\n│       │   └── Indicateur de pression d'huile / capteur / soupape (Niveau 4)\n│       │       └── Oil Pressure Switch/Sensor/Valve [ID: 100478] (Niveau 3) → ProductId: 60396\n│       ├── Lubrication [ID: 100245] (Niveau 2) → ProductId: 60020\n│       │   └── Indicateur de pression d'huile / capteur / soupape (Niveau 4)\n│       │       └── Oil Pressure Switch/Sensor/Valve [ID: 100478] (Niveau 3) → ProductId: 60020\n│       ├── Lubrication [ID: 100245] (Niveau 2) → ProductId: 4037\n│       │   └── Indicateur de pression d'huile / capteur / soupape (Niveau 4)\n│       │       └── Oil Pressure Switch/Sensor/Valve [ID: 100478] (Niveau 3) → ProductId: 4037\n│       ├── Lubrication [ID: 100245] (Niveau 2) → ProductId: 163\n│       │   └── Indicateur de pression d'huile / capteur / soupape (Niveau 4)\n│       │       └── Oil Pressure Switch/Sensor/Valve [ID: 100478] (Niveau 3) → ProductId: 163\n│       └── Lubrication [ID: 100245] (Niveau 2) → ProductId: 1105\n│           └── Indicateur de pression d'huile / capteur / soupape (Niveau 4)\n│               └── Oil Pressure Switch/Sensor/Valve [ID: 100478] (Niveau 3) → ProductId: 1105\n\n├── Refroidissement [ID: 100007] (Niveau 1)\n│   └── Interrupteur / capteur (Niveau 2)\n│       ├── Switch/Sensor [ID: 100334] (Niveau 2) → ProductId: 829\n│       └── Switch/Sensor [ID: 100334] (Niveau 2) → ProductId: 60396\n\n└── Système électrique [ID: 100010] (Niveau 1)\n    ├── Capteurs (Niveau 2)\n    │   ├── Sensors [ID: 102747] (Niveau 2) → ProductId: 1289\n    │   ├── Sensors [ID: 102747] (Niveau 2) → ProductId: 162\n    │   ├── Sensors [ID: 102747] (Niveau 2) → ProductId: 4175\n    │   ├── Sensors [ID: 102747] (Niveau 2) → ProductId: 829\n    │   ├── Sensors [ID: 102747] (Niveau 2) → ProductId: 9590\n    │   └── Sensors [ID: 102747] (Niveau 2) → ProductId: 60396\n    └── Instruments (Niveau 2)\n        ├── Instruments [ID: 100322] (Niveau 2) → ProductId: 1289\n        │   └── Capteurs/Conatct (Niveau 4)\n        │       └── Sensors/Switches [ID: 100553] (Niveau 3) → ProductId: 1289\n        ├── Instruments [ID: 100322] (Niveau 2) → ProductId: 162\n        │   └── Capteurs/Conatct (Niveau 4)\n        │       └── Sensors/Switches [ID: 100553] (Niveau 3) → ProductId: 162\n        ├── Instruments [ID: 100322] (Niveau 2) → ProductId: 4175\n        │   └── Capteurs/Conatct (Niveau 4)\n        │       └── Sensors/Switches [ID: 100553] (Niveau 3) → ProductId: 4175\n        ├── Instruments [ID: 100322] (Niveau 2) → ProductId: 829\n        │   └── Capteurs/Conatct (Niveau 4)\n        │       └── Sensors/Switches [ID: 100553] (Niveau 3) → ProductId: 829\n        ├── Instruments [ID: 100322] (Niveau 2) → ProductId: 9590\n        │   └── Capteurs/Conatct (Niveau 4)\n        │       └── Sensors/Switches [ID: 100553] (Niveau 3) → ProductId: 9590\n        └── Instruments [ID: 100322] (Niveau 2) → ProductId: 60396\n            └── Capteurs/Conatct (Niveau 4)\n                └── Sensors/Switches [ID: 100553] (Niveau 3) → ProductId: 60396",
  "arborescencePaths": [
    {
      "path": [
        "Boîte de vitesses",
        "Boîte de vitesse automatique",
        "Automatic Transmission"
      ],
      "categoryIds": [
        100238,
        null,
        100240
      ],
      "finalCategoryId": 100240,
      "productId": 1743
    },
    {
      "path": [
        "Direction",
        "Indicateur de pression d'huile",
        "Oil Pressure Switch"
      ],
      "categoryIds": [
        100012,
        null,
        102766
      ],
      "finalCategoryId": 102766,
      "productId": 3860
    },
    {
      "path": [
        "Moteur",
        "Circuit électrique du moteur",
        "Engine Electrics"
      ],
      "categoryIds": [
        100002,
        null,
        100754
      ],
      "finalCategoryId": 100754,
      "productId": 5015
    },
    {
      "path": [
        "Moteur",
        "Circuit électrique du moteur",
        "Engine Electrics"
      ],
      "categoryIds": [
        100002,
        null,
        100754
      ],
      "finalCategoryId": 100754,
      "productId": 9385
    },
    {
      "path": [
        "Moteur",
        "Circuit électrique du moteur",
        "Engine Electrics"
      ],
      "categoryIds": [
        100002,
        null,
        100754
      ],
      "finalCategoryId": 100754,
      "productId": 162
    },
    {
      "path": [
        "Moteur",
        "Circuit électrique du moteur",
        "Engine Electrics"
      ],
      "categoryIds": [
        100002,
        null,
        100754
      ],
      "finalCategoryId": 100754,
      "productId": 4175
    },
    {
      "path": [
        "Moteur",
        "Circuit électrique du moteur",
        "Engine Electrics"
      ],
      "categoryIds": [
        100002,
        null,
        100754
      ],
      "finalCategoryId": 100754,
      "productId": 829
    },
    {
      "path": [
        "Moteur",
        "Circuit électrique du moteur",
        "Engine Electrics"
      ],
      "categoryIds": [
        100002,
        null,
        100754
      ],
      "finalCategoryId": 100754,
      "productId": 805
    },
    {
      "path": [
        "Moteur",
        "Circuit électrique du moteur",
        "Engine Electrics"
      ],
      "categoryIds": [
        100002,
        null,
        100754
      ],
      "finalCategoryId": 100754,
      "productId": 60396
    },
    {
      "path": [
        "Moteur",
        "Lubrification",
        "Lubrication"
      ],
      "categoryIds": [
        100002,
        null,
        100245
      ],
      "finalCategoryId": 100245,
      "productId": 5015
    },
    {
      "path": [
        "Moteur",
        "Lubrification",
        "Lubrication"
      ],
      "categoryIds": [
        100002,
        null,
        100245
      ],
      "finalCategoryId": 100245,
      "productId": 136
    },
    {
      "path": [
        "Moteur",
        "Lubrification",
        "Lubrication"
      ],
      "categoryIds": [
        100002,
        null,
        100245
      ],
      "finalCategoryId": 100245,
      "productId": 9385
    },
    {
      "path": [
        "Moteur",
        "Lubrification",
        "Lubrication"
      ],
      "categoryIds": [
        100002,
        null,
        100245
      ],
      "finalCategoryId": 100245,
      "productId": 1289
    },
    {
      "path": [
        "Moteur",
        "Lubrification",
        "Lubrication"
      ],
      "categoryIds": [
        100002,
        null,
        100245
      ],
      "finalCategoryId": 100245,
      "productId": 162
    },
    {
      "path": [
        "Moteur",
        "Lubrification",
        "Lubrication"
      ],
      "categoryIds": [
        100002,
        null,
        100245
      ],
      "finalCategoryId": 100245,
      "productId": 829
    },
    {
      "path": [
        "Moteur",
        "Lubrification",
        "Lubrication"
      ],
      "categoryIds": [
        100002,
        null,
        100245
      ],
      "finalCategoryId": 100245,
      "productId": 1383
    },
    {
      "path": [
        "Moteur",
        "Lubrification",
        "Lubrication"
      ],
      "categoryIds": [
        100002,
        null,
        100245
      ],
      "finalCategoryId": 100245,
      "productId": 805
    },
    {
      "path": [
        "Moteur",
        "Lubrification",
        "Lubrication"
      ],
      "categoryIds": [
        100002,
        null,
        100245
      ],
      "finalCategoryId": 100245,
      "productId": 4176
    },
    {
      "path": [
        "Moteur",
        "Lubrification",
        "Lubrication"
      ],
      "categoryIds": [
        100002,
        null,
        100245
      ],
      "finalCategoryId": 100245,
      "productId": 5036
    },
    {
      "path": [
        "Moteur",
        "Lubrification",
        "Lubrication"
      ],
      "categoryIds": [
        100002,
        null,
        100245
      ],
      "finalCategoryId": 100245,
      "productId": 60410
    },
    {
      "path": [
        "Moteur",
        "Lubrification",
        "Lubrication"
      ],
      "categoryIds": [
        100002,
        null,
        100245
      ],
      "finalCategoryId": 100245,
      "productId": 9590
    },
    {
      "path": [
        "Moteur",
        "Lubrification",
        "Lubrication"
      ],
      "categoryIds": [
        100002,
        null,
        100245
      ],
      "finalCategoryId": 100245,
      "productId": 60396
    },
    {
      "path": [
        "Moteur",
        "Lubrification",
        "Lubrication"
      ],
      "categoryIds": [
        100002,
        null,
        100245
      ],
      "finalCategoryId": 100245,
      "productId": 60020
    },
    {
      "path": [
        "Moteur",
        "Lubrification",
        "Lubrication"
      ],
      "categoryIds": [
        100002,
        null,
        100245
      ],
      "finalCategoryId": 100245,
      "productId": 4037
    },
    {
      "path": [
        "Moteur",
        "Lubrification",
        "Lubrication"
      ],
      "categoryIds": [
        100002,
        null,
        100245
      ],
      "finalCategoryId": 100245,
      "productId": 163
    },
    {
      "path": [
        "Moteur",
        "Lubrification",
        "Lubrication"
      ],
      "categoryIds": [
        100002,
        null,
        100245
      ],
      "finalCategoryId": 100245,
      "productId": 1105
    },
    {
      "path": [
        "Refroidissement",
        "Interrupteur / capteur",
        "Switch/Sensor"
      ],
      "categoryIds": [
        100007,
        null,
        100334
      ],
      "finalCategoryId": 100334,
      "productId": 829
    },
    {
      "path": [
        "Refroidissement",
        "Interrupteur / capteur",
        "Switch/Sensor"
      ],
      "categoryIds": [
        100007,
        null,
        100334
      ],
      "finalCategoryId": 100334,
      "productId": 60396
    },
    {
      "path": [
        "Système électrique",
        "Capteurs",
        "Sensors"
      ],
      "categoryIds": [
        100010,
        null,
        102747
      ],
      "finalCategoryId": 102747,
      "productId": 1289
    },
    {
      "path": [
        "Système électrique",
        "Capteurs",
        "Sensors"
      ],
      "categoryIds": [
        100010,
        null,
        102747
      ],
      "finalCategoryId": 102747,
      "productId": 162
    },
    {
      "path": [
        "Système électrique",
        "Capteurs",
        "Sensors"
      ],
      "categoryIds": [
        100010,
        null,
        102747
      ],
      "finalCategoryId": 102747,
      "productId": 4175
    },
    {
      "path": [
        "Système électrique",
        "Capteurs",
        "Sensors"
      ],
      "categoryIds": [
        100010,
        null,
        102747
      ],
      "finalCategoryId": 102747,
      "productId": 829
    },
    {
      "path": [
        "Système électrique",
        "Capteurs",
        "Sensors"
      ],
      "categoryIds": [
        100010,
        null,
        102747
      ],
      "finalCategoryId": 102747,
      "productId": 9590
    },
    {
      "path": [
        "Système électrique",
        "Capteurs",
        "Sensors"
      ],
      "categoryIds": [
        100010,
        null,
        102747
      ],
      "finalCategoryId": 102747,
      "productId": 60396
    },
    {
      "path": [
        "Système électrique",
        "Instruments",
        "Instruments"
      ],
      "categoryIds": [
        100010,
        null,
        100322
      ],
      "finalCategoryId": 100322,
      "productId": 1289
    },
    {
      "path": [
        "Système électrique",
        "Instruments",
        "Instruments"
      ],
      "categoryIds": [
        100010,
        null,
        100322
      ],
      "finalCategoryId": 100322,
      "productId": 162
    },
    {
      "path": [
        "Système électrique",
        "Instruments",
        "Instruments"
      ],
      "categoryIds": [
        100010,
        null,
        100322
      ],
      "finalCategoryId": 100322,
      "productId": 4175
    },
    {
      "path": [
        "Système électrique",
        "Instruments",
        "Instruments"
      ],
      "categoryIds": [
        100010,
        null,
        100322
      ],
      "finalCategoryId": 100322,
      "productId": 829
    },
    {
      "path": [
        "Système électrique",
        "Instruments",
        "Instruments"
      ],
      "categoryIds": [
        100010,
        null,
        100322
      ],
      "finalCategoryId": 100322,
      "productId": 9590
    },
    {
      "path": [
        "Système électrique",
        "Instruments",
        "Instruments"
      ],
      "categoryIds": [
        100010,
        null,
        100322
      ],
      "finalCategoryId": 100322,
      "productId": 60396
    }
  ],
  "productIdsInArbo": [
    136,
    162,
    163,
    805,
    829,
    1105,
    1289,
    1383,
    1743,
    3860,
    4037,
    4175,
    4176,
    5015,
    5036,
    9385,
    9590,
    60020,
    60396,
    60410
  ],
  "matchedProductIds": [
    805
  ]
}