{
  "productName": "Injecteur",
  "searchText": "Injecteur",
  "found": true,
  "hasMatch": false,
  "timestamp": "2025-12-02T20:45:45.809Z",
  "productId": 3902,
  "arborescence": {
    "Carburation": {
      "categoryId": 100254,
      "categoryName": "Carburation",
      "level": 1,
      "children": {
        "Carburateurs": {
          "categoryId": null,
          "categoryName": "Carburateurs",
          "level": 2,
          "children": {
            "Manchon d'injecteur, carburateur": {
              "categoryId": 102903,
              "categoryName": "Carburettor System",
              "level": 2,
              "children": {
                "Composants du carburateur": {
                  "categoryId": null,
                  "categoryName": "Composants du carburateur",
                  "level": 4,
                  "children": {
                    "Manchon d'injecteur, carburateur": {
                      "categoryId": 102906,
                      "categoryName": "Carburettor Parts",
                      "level": 3,
                      "children": [],
                      "productId": 1931
                    }
                  }
                }
              },
              "productId": 1931
            }
          }
        },
        "Mélange air-carburant": {
          "categoryId": null,
          "categoryName": "Mélange air-carburant",
          "level": 2,
          "children": {
            "Adaptateur, extracteur par impact (injecteur Common-Rail)": {
              "categoryId": 102793,
              "categoryName": "Mixture Formation",
              "level": 2,
              "children": {
                "Outils": {
                  "categoryId": null,
                  "categoryName": "Outils",
                  "level": 4,
                  "children": {
                    "Adaptateur, extracteur par impact (injecteur Common-Rail)": {
                      "categoryId": 103150,
                      "categoryName": "Tools",
                      "level": 3,
                      "children": [],
                      "productId": 8781
                    }
                  }
                }
              },
              "productId": 8781
            },
            "Adaptateur, outil de démontage (Injecteur Common Rail)": {
              "categoryId": 102793,
              "categoryName": "Mixture Formation",
              "level": 2,
              "children": {
                "Outils": {
                  "categoryId": null,
                  "categoryName": "Outils",
                  "level": 4,
                  "children": {
                    "Adaptateur, outil de démontage (Injecteur Common Rail)": {
                      "categoryId": 103150,
                      "categoryName": "Tools",
                      "level": 3,
                      "children": [],
                      "productId": 4520
                    }
                  }
                }
              },
              "productId": 4520
            },
            "Aiguille d'injecteur": {
              "categoryId": 102793,
              "categoryName": "Mixture Formation",
              "level": 2,
              "children": {
                "Composants de porte-injecteur / Injecteur": {
                  "categoryId": null,
                  "categoryName": "Composants de porte-injecteur / Injecteur",
                  "level": 4,
                  "children": {
                    "Aiguille d'injecteur": {
                      "categoryId": 102800,
                      "categoryName": "Nozzle and Holder Assembly/Nozzle Parts",
                      "level": 3,
                      "children": [],
                      "productId": 3900
                    }
                  }
                }
              },
              "productId": 3900
            },
            "Assortiment de bagues d'étanchéité, Injecteur": {
              "categoryId": 102793,
              "categoryName": "Mixture Formation",
              "level": 2,
              "children": {
                "Joint": {
                  "categoryId": null,
                  "categoryName": "Joint",
                  "level": 4,
                  "children": {
                    "Assortiment de bagues d'étanchéité, Injecteur": {
                      "categoryId": 102795,
                      "categoryName": "Seal",
                      "level": 3,
                      "children": [],
                      "productId": 4886
                    }
                  }
                }
              },
              "productId": 4886
            },
            "Bague d'étanchéité, injecteur": {
              "categoryId": 102793,
              "categoryName": "Mixture Formation",
              "level": 2,
              "children": {
                "Joint": {
                  "categoryId": null,
                  "categoryName": "Joint",
                  "level": 4,
                  "children": {
                    "Bague d'étanchéité, injecteur": {
                      "categoryId": 102795,
                      "categoryName": "Seal",
                      "level": 3,
                      "children": [],
                      "productId": 3891
                    }
                  }
                }
              },
              "productId": 3891
            },
            "Bague d'étanchéité, porte-injecteur": {
              "categoryId": 102793,
              "categoryName": "Mixture Formation",
              "level": 2,
              "children": {
                "Composants de porte-injecteur / Injecteur": {
                  "categoryId": null,
                  "categoryName": "Composants de porte-injecteur / Injecteur",
                  "level": 4,
                  "children": {
                    "Bague d'étanchéité, porte-injecteur": {
                      "categoryId": 102800,
                      "categoryName": "Nozzle and Holder Assembly/Nozzle Parts",
                      "level": 3,
                      "children": [],
                      "productId": 4051
                    }
                  }
                },
                "Joint": {
                  "categoryId": null,
                  "categoryName": "Joint",
                  "level": 4,
                  "children": {
                    "Bague d'étanchéité, porte-injecteur": {
                      "categoryId": 102795,
                      "categoryName": "Seal",
                      "level": 3,
                      "children": [],
                      "productId": 4051
                    }
                  }
                }
              },
              "productId": 4051
            },
            "Bouchon, carburant de fuite": {
              "categoryId": 102793,
              "categoryName": "Mixture Formation",
              "level": 2,
              "children": {
                "Composants de porte-injecteur / Injecteur": {
                  "categoryId": null,
                  "categoryName": "Composants de porte-injecteur / Injecteur",
                  "level": 4,
                  "children": {
                    "Bouchon, carburant de fuite": {
                      "categoryId": 102800,
                      "categoryName": "Nozzle and Holder Assembly/Nozzle Parts",
                      "level": 3,
                      "children": [],
                      "productId": 3963
                    }
                  }
                },
                "Conduite de carburant / répartition du carburant": {
                  "categoryId": null,
                  "categoryName": "Conduite de carburant / répartition du carburant",
                  "level": 4,
                  "children": {
                    "Bouchon, carburant de fuite": {
                      "categoryId": 102804,
                      "categoryName": "Fuel Line/Distribution/Allocation",
                      "level": 3,
                      "children": [],
                      "productId": 3963
                    }
                  }
                }
              },
              "productId": 3963
            },
            "Cache, injecteur": {
              "categoryId": 102793,
              "categoryName": "Mixture Formation",
              "level": 2,
              "children": {
                "Composants de porte-injecteur / Injecteur": {
                  "categoryId": null,
                  "categoryName": "Composants de porte-injecteur / Injecteur",
                  "level": 4,
                  "children": {
                    "Cache, injecteur": {
                      "categoryId": 102800,
                      "categoryName": "Nozzle and Holder Assembly/Nozzle Parts",
                      "level": 3,
                      "children": [],
                      "productId": 3889
                    }
                  }
                }
              },
              "productId": 3889
            },
            "Clé à douille, boulon de fixation de l'injecteur": {
              "categoryId": 102793,
              "categoryName": "Mixture Formation",
              "level": 2,
              "children": {
                "Outils": {
                  "categoryId": null,
                  "categoryName": "Outils",
                  "level": 4,
                  "children": {
                    "Clé à douille, boulon de fixation de l'injecteur": {
                      "categoryId": 103150,
                      "categoryName": "Tools",
                      "level": 3,
                      "children": [],
                      "productId": 4518
                    }
                  }
                }
              },
              "productId": 4518
            },
            "Clé à douille, Injecteur": {
              "categoryId": 102793,
              "categoryName": "Mixture Formation",
              "level": 2,
              "children": {
                "Outils": {
                  "categoryId": null,
                  "categoryName": "Outils",
                  "level": 4,
                  "children": {
                    "Clé à douille, Injecteur": {
                      "categoryId": 103150,
                      "categoryName": "Tools",
                      "level": 3,
                      "children": [],
                      "productId": 4524
                    }
                  }
                }
              },
              "productId": 4524
            },
            "Clé à douille, Injecteur Common Rail": {
              "categoryId": 102793,
              "categoryName": "Mixture Formation",
              "level": 2,
              "children": {
                "Outils": {
                  "categoryId": null,
                  "categoryName": "Outils",
                  "level": 4,
                  "children": {
                    "Clé à douille, Injecteur Common Rail": {
                      "categoryId": 103150,
                      "categoryName": "Tools",
                      "level": 3,
                      "children": [],
                      "productId": 4522
                    }
                  }
                }
              },
              "productId": 4522
            },
            "Corps d'injecteur": {
              "categoryId": 102793,
              "categoryName": "Mixture Formation",
              "level": 2,
              "children": {
                "Composants de porte-injecteur / Injecteur": {
                  "categoryId": null,
                  "categoryName": "Composants de porte-injecteur / Injecteur",
                  "level": 4,
                  "children": {
                    "Corps d'injecteur": {
                      "categoryId": 102800,
                      "categoryName": "Nozzle and Holder Assembly/Nozzle Parts",
                      "level": 3,
                      "children": [],
                      "productId": 3899
                    }
                  }
                }
              },
              "productId": 3899
            },
            "Écran absorbant la chaleur, injection": {
              "categoryId": 102793,
              "categoryName": "Mixture Formation",
              "level": 2,
              "children": {
                "Composants de porte-injecteur / Injecteur": {
                  "categoryId": null,
                  "categoryName": "Composants de porte-injecteur / Injecteur",
                  "level": 4,
                  "children": {
                    "Écran absorbant la chaleur, injection": {
                      "categoryId": 102800,
                      "categoryName": "Nozzle and Holder Assembly/Nozzle Parts",
                      "level": 3,
                      "children": [],
                      "productId": 3966
                    }
                  }
                }
              },
              "productId": 3966
            },
            "Écrou tendeur, porte-injecteur": {
              "categoryId": 102793,
              "categoryName": "Mixture Formation",
              "level": 2,
              "children": {
                "Composants de porte-injecteur / Injecteur": {
                  "categoryId": null,
                  "categoryName": "Composants de porte-injecteur / Injecteur",
                  "level": 4,
                  "children": {
                    "Écrou tendeur, porte-injecteur": {
                      "categoryId": 102800,
                      "categoryName": "Nozzle and Holder Assembly/Nozzle Parts",
                      "level": 3,
                      "children": [],
                      "productId": 3948
                    }
                  }
                }
              },
              "productId": 3948
            },
            "Extracteur, Unité pompe-injecteur": {
              "categoryId": 102793,
              "categoryName": "Mixture Formation",
              "level": 2,
              "children": {
                "Outils": {
                  "categoryId": null,
                  "categoryName": "Outils",
                  "level": 4,
                  "children": {
                    "Extracteur, Unité pompe-injecteur": {
                      "categoryId": 103150,
                      "categoryName": "Tools",
                      "level": 3,
                      "children": [],
                      "productId": 4515
                    }
                  }
                }
              },
              "productId": 4515
            },
            "Fiche, injecteur": {
              "categoryId": 102793,
              "categoryName": "Mixture Formation",
              "level": 2,
              "children": {
                "Injecteur/porte-injecteur/UPI": {
                  "categoryId": null,
                  "categoryName": "Injecteur/porte-injecteur/UPI",
                  "level": 4,
                  "children": {
                    "Fiche, injecteur": {
                      "categoryId": 102799,
                      "categoryName": "Injector/Nozzle/Nozzle and Holder Assembly/UI",
                      "level": 3,
                      "children": [],
                      "productId": 3949
                    }
                  }
                }
              },
              "productId": 3949
            },
            "Flasque chauffante, préchauffement d'air d'admission": {
              "categoryId": 102793,
              "categoryName": "Mixture Formation",
              "level": 2,
              "children": {
                "Composants de porte-injecteur / Injecteur": {
                  "categoryId": null,
                  "categoryName": "Composants de porte-injecteur / Injecteur",
                  "level": 4,
                  "children": {
                    "Flasque chauffante, préchauffement d'air d'admission": {
                      "categoryId": 102800,
                      "categoryName": "Nozzle and Holder Assembly/Nozzle Parts",
                      "level": 3,
                      "children": [],
                      "productId": 3915
                    }
                  }
                }
              },
              "productId": 3915
            },
            "Fraise à siège d’étanchéité, injecteur": {
              "categoryId": 102793,
              "categoryName": "Mixture Formation",
              "level": 2,
              "children": {
                "Outils": {
                  "categoryId": null,
                  "categoryName": "Outils",
                  "level": 4,
                  "children": {
                    "Fraise à siège d’étanchéité, injecteur": {
                      "categoryId": 103150,
                      "categoryName": "Tools",
                      "level": 3,
                      "children": [],
                      "productId": 8998
                    }
                  }
                }
              },
              "productId": 8998
            },
            "Injecteur": {
              "categoryId": 102793,
              "categoryName": "Mixture Formation",
              "level": 2,
              "children": {
                "Injecteur/porte-injecteur/UPI": {
                  "categoryId": null,
                  "categoryName": "Injecteur/porte-injecteur/UPI",
                  "level": 4,
                  "children": {
                    "Injecteur": {
                      "categoryId": 102799,
                      "categoryName": "Injector/Nozzle/Nozzle and Holder Assembly/UI",
                      "level": 3,
                      "children": [],
                      "productId": 3905
                    }
                  }
                }
              },
              "productId": 3905
            },
            "Injecteur auxiliaire de démarrage": {
              "categoryId": 102793,
              "categoryName": "Mixture Formation",
              "level": 2,
              "children": {
                "Réglage du ralenti/réglage de mise en température": {
                  "categoryId": null,
                  "categoryName": "Réglage du ralenti/réglage de mise en température",
                  "level": 4,
                  "children": {
                    "Injecteur auxiliaire de démarrage": {
                      "categoryId": 102805,
                      "categoryName": "Idle Control",
                      "level": 3,
                      "children": [],
                      "productId": 3920
                    }
                  }
                }
              },
              "productId": 3920
            },
            "Injecteur Common Rail": {
              "categoryId": 102793,
              "categoryName": "Mixture Formation",
              "level": 2,
              "children": {
                "Injecteur/porte-injecteur/UPI": {
                  "categoryId": null,
                  "categoryName": "Injecteur/porte-injecteur/UPI",
                  "level": 4,
                  "children": {
                    "Injecteur Common Rail": {
                      "categoryId": 102799,
                      "categoryName": "Injector/Nozzle/Nozzle and Holder Assembly/UI",
                      "level": 3,
                      "children": [],
                      "productId": 61353
                    }
                  }
                }
              },
              "productId": 61353
            },
            "Jeux de bagues d'etanchéité, injecteur": {
              "categoryId": 102793,
              "categoryName": "Mixture Formation",
              "level": 2,
              "children": {
                "Joint": {
                  "categoryId": null,
                  "categoryName": "Joint",
                  "level": 4,
                  "children": {
                    "Jeux de bagues d'etanchéité, injecteur": {
                      "categoryId": 102795,
                      "categoryName": "Seal",
                      "level": 3,
                      "children": [],
                      "productId": 4948
                    }
                  }
                }
              },
              "productId": 4948
            },
            "Joint d'étanchéité, porte-injecteur": {
              "categoryId": 102793,
              "categoryName": "Mixture Formation",
              "level": 2,
              "children": {
                "Composants de porte-injecteur / Injecteur": {
                  "categoryId": null,
                  "categoryName": "Composants de porte-injecteur / Injecteur",
                  "level": 4,
                  "children": {
                    "Joint d'étanchéité, porte-injecteur": {
                      "categoryId": 102800,
                      "categoryName": "Nozzle and Holder Assembly/Nozzle Parts",
                      "level": 3,
                      "children": [],
                      "productId": 3892
                    }
                  }
                },
                "Joint": {
                  "categoryId": null,
                  "categoryName": "Joint",
                  "level": 4,
                  "children": {
                    "Joint d'étanchéité, porte-injecteur": {
                      "categoryId": 102795,
                      "categoryName": "Seal",
                      "level": 3,
                      "children": [],
                      "productId": 3892
                    }
                  }
                }
              },
              "productId": 3892
            },
            "Joint, flasque chauffante-préchauffage de l'air d'admission": {
              "categoryId": 102793,
              "categoryName": "Mixture Formation",
              "level": 2,
              "children": {
                "Composants de porte-injecteur / Injecteur": {
                  "categoryId": null,
                  "categoryName": "Composants de porte-injecteur / Injecteur",
                  "level": 4,
                  "children": {
                    "Joint, flasque chauffante-préchauffage de l'air d'admission": {
                      "categoryId": 102800,
                      "categoryName": "Nozzle and Holder Assembly/Nozzle Parts",
                      "level": 3,
                      "children": [],
                      "productId": 4105
                    }
                  }
                }
              },
              "productId": 4105
            },
            "Kit d'alésage, injecteur-vis de maintien": {
              "categoryId": 102793,
              "categoryName": "Mixture Formation",
              "level": 2,
              "children": {
                "Outils": {
                  "categoryId": null,
                  "categoryName": "Outils",
                  "level": 4,
                  "children": {
                    "Kit d'alésage, injecteur-vis de maintien": {
                      "categoryId": 103150,
                      "categoryName": "Tools",
                      "level": 3,
                      "children": [],
                      "productId": 4867
                    }
                  }
                }
              },
              "productId": 4867
            },
            "Kit d'outils de démontage, Injecteur Common Rail": {
              "categoryId": 102793,
              "categoryName": "Mixture Formation",
              "level": 2,
              "children": {
                "Outils": {
                  "categoryId": null,
                  "categoryName": "Outils",
                  "level": 4,
                  "children": {
                    "Kit d'outils de démontage, Injecteur Common Rail": {
                      "categoryId": 103150,
                      "categoryName": "Tools",
                      "level": 3,
                      "children": [],
                      "productId": 4519
                    }
                  }
                }
              },
              "productId": 4519
            },
            "Kit de douilles, écrou tendeur de porte-injecteur": {
              "categoryId": 102793,
              "categoryName": "Mixture Formation",
              "level": 2,
              "children": {
                "Outils": {
                  "categoryId": null,
                  "categoryName": "Outils",
                  "level": 4,
                  "children": {
                    "Kit de douilles, écrou tendeur de porte-injecteur": {
                      "categoryId": 103150,
                      "categoryName": "Tools",
                      "level": 3,
                      "children": [],
                      "productId": 9645
                    }
                  }
                }
              },
              "productId": 9645
            },
            "Kit de joints, injecteur": {
              "categoryId": 102793,
              "categoryName": "Mixture Formation",
              "level": 2,
              "children": {
                "Injecteur/porte-injecteur/UPI": {
                  "categoryId": null,
                  "categoryName": "Injecteur/porte-injecteur/UPI",
                  "level": 4,
                  "children": {
                    "Kit de joints, injecteur": {
                      "categoryId": 102799,
                      "categoryName": "Injector/Nozzle/Nozzle and Holder Assembly/UI",
                      "level": 3,
                      "children": [],
                      "productId": 3894
                    }
                  }
                }
              },
              "productId": 3894
            },
            "Kit de ligne flexible, fuite de carburant": {
              "categoryId": 102793,
              "categoryName": "Mixture Formation",
              "level": 2,
              "children": {
                "Composants de porte-injecteur / Injecteur": {
                  "categoryId": null,
                  "categoryName": "Composants de porte-injecteur / Injecteur",
                  "level": 4,
                  "children": {
                    "Kit de ligne flexible, fuite de carburant": {
                      "categoryId": 102800,
                      "categoryName": "Nozzle and Holder Assembly/Nozzle Parts",
                      "level": 3,
                      "children": [],
                      "productId": 8090
                    }
                  }
                },
                "Conduite de carburant / répartition du carburant": {
                  "categoryId": null,
                  "categoryName": "Conduite de carburant / répartition du carburant",
                  "level": 4,
                  "children": {
                    "Kit de ligne flexible, fuite de carburant": {
                      "categoryId": 102804,
                      "categoryName": "Fuel Line/Distribution/Allocation",
                      "level": 3,
                      "children": [],
                      "productId": 8090
                    }
                  }
                }
              },
              "productId": 8090
            },
            "Kit de montage, soupape d’admission": {
              "categoryId": 102793,
              "categoryName": "Mixture Formation",
              "level": 2,
              "children": {
                "Injecteur/porte-injecteur/UPI": {
                  "categoryId": null,
                  "categoryName": "Injecteur/porte-injecteur/UPI",
                  "level": 4,
                  "children": {
                    "Kit de montage, soupape d’admission": {
                      "categoryId": 102799,
                      "categoryName": "Injector/Nozzle/Nozzle and Holder Assembly/UI",
                      "level": 3,
                      "children": [],
                      "productId": 60201
                    }
                  }
                }
              },
              "productId": 60201
            },
            "Kit de montage, Unité pompe-injecteur": {
              "categoryId": 102793,
              "categoryName": "Mixture Formation",
              "level": 2,
              "children": {
                "Outils": {
                  "categoryId": null,
                  "categoryName": "Outils",
                  "level": 4,
                  "children": {
                    "Kit de montage, Unité pompe-injecteur": {
                      "categoryId": 103150,
                      "categoryName": "Tools",
                      "level": 3,
                      "children": [],
                      "productId": 4516
                    }
                  }
                }
              },
              "productId": 4516
            },
            "Kit de montage, unité pompe-injecteur": {
              "categoryId": 102793,
              "categoryName": "Mixture Formation",
              "level": 2,
              "children": {
                "Outils": {
                  "categoryId": null,
                  "categoryName": "Outils",
                  "level": 4,
                  "children": {
                    "Kit de montage, unité pompe-injecteur": {
                      "categoryId": 103150,
                      "categoryName": "Tools",
                      "level": 3,
                      "children": [],
                      "productId": 9412
                    }
                  }
                }
              },
              "productId": 9412
            },
            "Kit de réparation, injecteur": {
              "categoryId": 102793,
              "categoryName": "Mixture Formation",
              "level": 2,
              "children": {
                "Kit de réparation/Kit complet": {
                  "categoryId": null,
                  "categoryName": "Kit de réparation/Kit complet",
                  "level": 4,
                  "children": {
                    "Kit de réparation, injecteur": {
                      "categoryId": 102807,
                      "categoryName": "Repair Kit",
                      "level": 3,
                      "children": [],
                      "productId": 3933
                    }
                  }
                }
              },
              "productId": 3933
            },
            "Kit de réparation, porte-injecteur": {
              "categoryId": 102793,
              "categoryName": "Mixture Formation",
              "level": 2,
              "children": {
                "Composants de porte-injecteur / Injecteur": {
                  "categoryId": null,
                  "categoryName": "Composants de porte-injecteur / Injecteur",
                  "level": 4,
                  "children": {
                    "Kit de réparation, porte-injecteur": {
                      "categoryId": 102800,
                      "categoryName": "Nozzle and Holder Assembly/Nozzle Parts",
                      "level": 3,
                      "children": [],
                      "productId": 4049
                    }
                  }
                }
              },
              "productId": 4049
            },
            "Kit de réparation, unité pompe-injecteur": {
              "categoryId": 102793,
              "categoryName": "Mixture Formation",
              "level": 2,
              "children": {
                "Kit de réparation/Kit complet": {
                  "categoryId": null,
                  "categoryName": "Kit de réparation/Kit complet",
                  "level": 4,
                  "children": {
                    "Kit de réparation, unité pompe-injecteur": {
                      "categoryId": 102807,
                      "categoryName": "Repair Kit",
                      "level": 3,
                      "children": [],
                      "productId": 3934
                    }
                  }
                }
              },
              "productId": 3934
            },
            "Kit rectificateur et de nettoyage, buse d'injection CR": {
              "categoryId": 102793,
              "categoryName": "Mixture Formation",
              "level": 2,
              "children": {
                "Outils": {
                  "categoryId": null,
                  "categoryName": "Outils",
                  "level": 4,
                  "children": {
                    "Kit rectificateur et de nettoyage, buse d'injection CR": {
                      "categoryId": 103150,
                      "categoryName": "Tools",
                      "level": 3,
                      "children": [],
                      "productId": 4523
                    }
                  }
                }
              },
              "productId": 4523
            },
            "Kit réparation de câble, injecteur": {
              "categoryId": 102793,
              "categoryName": "Mixture Formation",
              "level": 2,
              "children": {
                "Injecteur/porte-injecteur/UPI": {
                  "categoryId": null,
                  "categoryName": "Injecteur/porte-injecteur/UPI",
                  "level": 4,
                  "children": {
                    "Kit réparation de câble, injecteur": {
                      "categoryId": 102799,
                      "categoryName": "Injector/Nozzle/Nozzle and Holder Assembly/UI",
                      "level": 3,
                      "children": [],
                      "productId": 6350
                    }
                  }
                }
              },
              "productId": 6350
            },
            "Kit réparation de câble, injecteur auxiliaire de démarrage": {
              "categoryId": 102793,
              "categoryName": "Mixture Formation",
              "level": 2,
              "children": {
                "Réglage du ralenti/réglage de mise en température": {
                  "categoryId": null,
                  "categoryName": "Réglage du ralenti/réglage de mise en température",
                  "level": 4,
                  "children": {
                    "Kit réparation de câble, injecteur auxiliaire de démarrage": {
                      "categoryId": 102805,
                      "categoryName": "Idle Control",
                      "level": 3,
                      "children": [],
                      "productId": 60026
                    }
                  }
                }
              },
              "productId": 60026
            },
            "Manchon, porte-injecteur": {
              "categoryId": 102793,
              "categoryName": "Mixture Formation",
              "level": 2,
              "children": {
                "Composants de porte-injecteur / Injecteur": {
                  "categoryId": null,
                  "categoryName": "Composants de porte-injecteur / Injecteur",
                  "level": 4,
                  "children": {
                    "Manchon, porte-injecteur": {
                      "categoryId": 102800,
                      "categoryName": "Nozzle and Holder Assembly/Nozzle Parts",
                      "level": 3,
                      "children": [],
                      "productId": 4050
                    }
                  }
                }
              },
              "productId": 4050
            },
            "Outil d'ajustement, Injecteur Common Rail": {
              "categoryId": 102793,
              "categoryName": "Mixture Formation",
              "level": 2,
              "children": {
                "Outils": {
                  "categoryId": null,
                  "categoryName": "Outils",
                  "level": 4,
                  "children": {
                    "Outil d'ajustement, Injecteur Common Rail": {
                      "categoryId": 103150,
                      "categoryName": "Tools",
                      "level": 3,
                      "children": [],
                      "productId": 4521
                    }
                  }
                }
              },
              "productId": 4521
            },
            "Outil de démontage, injecteur": {
              "categoryId": 102793,
              "categoryName": "Mixture Formation",
              "level": 2,
              "children": {
                "Outils": {
                  "categoryId": null,
                  "categoryName": "Outils",
                  "level": 4,
                  "children": {
                    "Outil de démontage, injecteur": {
                      "categoryId": 103150,
                      "categoryName": "Tools",
                      "level": 3,
                      "children": [],
                      "productId": 6227
                    }
                  }
                }
              },
              "productId": 6227
            },
            "Outil de démontage, Injecteur Common Rail": {
              "categoryId": 102793,
              "categoryName": "Mixture Formation",
              "level": 2,
              "children": {
                "Outils": {
                  "categoryId": null,
                  "categoryName": "Outils",
                  "level": 4,
                  "children": {
                    "Outil de démontage, Injecteur Common Rail": {
                      "categoryId": 103150,
                      "categoryName": "Tools",
                      "level": 3,
                      "children": [],
                      "productId": 4517
                    }
                  }
                }
              },
              "productId": 4517
            },
            "Outil de montage/démontage, injecteur": {
              "categoryId": 102793,
              "categoryName": "Mixture Formation",
              "level": 2,
              "children": {
                "Outils": {
                  "categoryId": null,
                  "categoryName": "Outils",
                  "level": 4,
                  "children": {
                    "Outil de montage/démontage, injecteur": {
                      "categoryId": 103150,
                      "categoryName": "Tools",
                      "level": 3,
                      "children": [],
                      "productId": 9654
                    }
                  }
                }
              },
              "productId": 9654
            },
            "Outil de réglage, injecteur": {
              "categoryId": 102793,
              "categoryName": "Mixture Formation",
              "level": 2,
              "children": {
                "Outils": {
                  "categoryId": null,
                  "categoryName": "Outils",
                  "level": 4,
                  "children": {
                    "Outil de réglage, injecteur": {
                      "categoryId": 103150,
                      "categoryName": "Tools",
                      "level": 3,
                      "children": [],
                      "productId": 9655
                    }
                  }
                }
              },
              "productId": 9655
            },
            "Outillage de montage, injecteur": {
              "categoryId": 102793,
              "categoryName": "Mixture Formation",
              "level": 2,
              "children": {
                "Outils": {
                  "categoryId": null,
                  "categoryName": "Outils",
                  "level": 4,
                  "children": {
                    "Outillage de montage, injecteur": {
                      "categoryId": 103150,
                      "categoryName": "Tools",
                      "level": 3,
                      "children": [],
                      "productId": 61318
                    }
                  }
                }
              },
              "productId": 61318
            },
            "Pâte de montage, injecteur diesel/bougie de préchauffage": {
              "categoryId": 102793,
              "categoryName": "Mixture Formation",
              "level": 2,
              "children": {
                "Injecteur/porte-injecteur/UPI": {
                  "categoryId": null,
                  "categoryName": "Injecteur/porte-injecteur/UPI",
                  "level": 4,
                  "children": {
                    "Pâte de montage, injecteur diesel/bougie de préchauffage": {
                      "categoryId": 102799,
                      "categoryName": "Injector/Nozzle/Nozzle and Holder Assembly/UI",
                      "level": 3,
                      "children": [],
                      "productId": 60094
                    }
                  }
                }
              },
              "productId": 60094
            },
            "Pince de desserrage, joint d’injecteur": {
              "categoryId": 102793,
              "categoryName": "Mixture Formation",
              "level": 2,
              "children": {
                "Outils": {
                  "categoryId": null,
                  "categoryName": "Outils",
                  "level": 4,
                  "children": {
                    "Pince de desserrage, joint d’injecteur": {
                      "categoryId": 103150,
                      "categoryName": "Tools",
                      "level": 3,
                      "children": [],
                      "productId": 9804
                    }
                  }
                }
              },
              "productId": 9804
            },
            "Porte-injecteur": {
              "categoryId": 102793,
              "categoryName": "Mixture Formation",
              "level": 2,
              "children": {
                "Injecteur/porte-injecteur/UPI": {
                  "categoryId": null,
                  "categoryName": "Injecteur/porte-injecteur/UPI",
                  "level": 4,
                  "children": {
                    "Porte-injecteur": {
                      "categoryId": 102799,
                      "categoryName": "Injector/Nozzle/Nozzle and Holder Assembly/UI",
                      "level": 3,
                      "children": [],
                      "productId": 3901
                    }
                  }
                }
              },
              "productId": 3901
            },
            "Raccord de tube de pression, injecteur": {
              "categoryId": 102793,
              "categoryName": "Mixture Formation",
              "level": 2,
              "children": {
                "Injecteur/porte-injecteur/UPI": {
                  "categoryId": null,
                  "categoryName": "Injecteur/porte-injecteur/UPI",
                  "level": 4,
                  "children": {
                    "Raccord de tube de pression, injecteur": {
                      "categoryId": 102799,
                      "categoryName": "Injector/Nozzle/Nozzle and Holder Assembly/UI",
                      "level": 3,
                      "children": [],
                      "productId": 9724
                    }
                  }
                }
              },
              "productId": 9724
            },
            "Raccord, injecteur": {
              "categoryId": 102793,
              "categoryName": "Mixture Formation",
              "level": 2,
              "children": {
                "Injecteur/porte-injecteur/UPI": {
                  "categoryId": null,
                  "categoryName": "Injecteur/porte-injecteur/UPI",
                  "level": 4,
                  "children": {
                    "Raccord, injecteur": {
                      "categoryId": 102799,
                      "categoryName": "Injector/Nozzle/Nozzle and Holder Assembly/UI",
                      "level": 3,
                      "children": [],
                      "productId": 4900
                    }
                  }
                }
              },
              "productId": 4900
            },
            "Régulateur de tension, soupape d’admission": {
              "categoryId": 102793,
              "categoryName": "Mixture Formation",
              "level": 2,
              "children": {
                "Injecteur/porte-injecteur/UPI": {
                  "categoryId": null,
                  "categoryName": "Injecteur/porte-injecteur/UPI",
                  "level": 4,
                  "children": {
                    "Régulateur de tension, soupape d’admission": {
                      "categoryId": 102799,
                      "categoryName": "Injector/Nozzle/Nozzle and Holder Assembly/UI",
                      "level": 3,
                      "children": [],
                      "productId": 60469
                    }
                  }
                }
              },
              "productId": 60469
            },
            "Résistance de série, injecteur": {
              "categoryId": 102793,
              "categoryName": "Mixture Formation",
              "level": 2,
              "children": {
                "Injecteur/porte-injecteur/UPI": {
                  "categoryId": null,
                  "categoryName": "Injecteur/porte-injecteur/UPI",
                  "level": 4,
                  "children": {
                    "Résistance de série, injecteur": {
                      "categoryId": 102799,
                      "categoryName": "Injector/Nozzle/Nozzle and Holder Assembly/UI",
                      "level": 3,
                      "children": [],
                      "productId": 3965
                    }
                  }
                }
              },
              "productId": 3965
            },
            "Support, injecteur": {
              "categoryId": 102793,
              "categoryName": "Mixture Formation",
              "level": 2,
              "children": {
                "Injecteur/porte-injecteur/UPI": {
                  "categoryId": null,
                  "categoryName": "Injecteur/porte-injecteur/UPI",
                  "level": 4,
                  "children": {
                    "Support, injecteur": {
                      "categoryId": 102799,
                      "categoryName": "Injector/Nozzle/Nozzle and Holder Assembly/UI",
                      "level": 3,
                      "children": [],
                      "productId": 60640
                    }
                  }
                }
              },
              "productId": 60640
            },
            "Tuyau, carburant de fuite": {
              "categoryId": 102793,
              "categoryName": "Mixture Formation",
              "level": 2,
              "children": {
                "Composants de porte-injecteur / Injecteur": {
                  "categoryId": null,
                  "categoryName": "Composants de porte-injecteur / Injecteur",
                  "level": 4,
                  "children": {
                    "Tuyau, carburant de fuite": {
                      "categoryId": 102800,
                      "categoryName": "Nozzle and Holder Assembly/Nozzle Parts",
                      "level": 3,
                      "children": [],
                      "productId": 3937
                    }
                  }
                },
                "Conduite de carburant / répartition du carburant": {
                  "categoryId": null,
                  "categoryName": "Conduite de carburant / répartition du carburant",
                  "level": 4,
                  "children": {
                    "Tuyau, carburant de fuite": {
                      "categoryId": 102804,
                      "categoryName": "Fuel Line/Distribution/Allocation",
                      "level": 3,
                      "children": [],
                      "productId": 3937
                    }
                  }
                }
              },
              "productId": 3937
            },
            "Unité pompe-injecteur": {
              "categoryId": 102793,
              "categoryName": "Mixture Formation",
              "level": 2,
              "children": {
                "Injecteur/porte-injecteur/UPI": {
                  "categoryId": null,
                  "categoryName": "Injecteur/porte-injecteur/UPI",
                  "level": 4,
                  "children": {
                    "Unité pompe-injecteur": {
                      "categoryId": 102799,
                      "categoryName": "Injector/Nozzle/Nozzle and Holder Assembly/UI",
                      "level": 3,
                      "children": [],
                      "productId": 3930
                    }
                  }
                }
              },
              "productId": 3930
            },
            "Vis à tenon carré, Pompe à injection": {
              "categoryId": 102793,
              "categoryName": "Mixture Formation",
              "level": 2,
              "children": {
                "Injecteur/porte-injecteur/UPI": {
                  "categoryId": null,
                  "categoryName": "Injecteur/porte-injecteur/UPI",
                  "level": 4,
                  "children": {
                    "Vis à tenon carré, Pompe à injection": {
                      "categoryId": 102799,
                      "categoryName": "Injector/Nozzle/Nozzle and Holder Assembly/UI",
                      "level": 3,
                      "children": [],
                      "productId": 4513
                    }
                  }
                }
              },
              "productId": 4513
            },
            "Vis de raccord, raccord tube de pression injecteur": {
              "categoryId": 102793,
              "categoryName": "Mixture Formation",
              "level": 2,
              "children": {
                "Injecteur/porte-injecteur/UPI": {
                  "categoryId": null,
                  "categoryName": "Injecteur/porte-injecteur/UPI",
                  "level": 4,
                  "children": {
                    "Vis de raccord, raccord tube de pression injecteur": {
                      "categoryId": 102799,
                      "categoryName": "Injector/Nozzle/Nozzle and Holder Assembly/UI",
                      "level": 3,
                      "children": [],
                      "productId": 9725
                    }
                  }
                }
              },
              "productId": 9725
            },
            "Vis, porte-injecteur": {
              "categoryId": 102793,
              "categoryName": "Mixture Formation",
              "level": 2,
              "children": {
                "Injecteur/porte-injecteur/UPI": {
                  "categoryId": null,
                  "categoryName": "Injecteur/porte-injecteur/UPI",
                  "level": 4,
                  "children": {
                    "Vis, porte-injecteur": {
                      "categoryId": 102799,
                      "categoryName": "Injector/Nozzle/Nozzle and Holder Assembly/UI",
                      "level": 3,
                      "children": [],
                      "productId": 6597
                    }
                  }
                }
              },
              "productId": 6597
            },
            "Vis, support pour contrôleur d'injecteurs": {
              "categoryId": 102793,
              "categoryName": "Mixture Formation",
              "level": 2,
              "children": {
                "Injecteur/porte-injecteur/UPI": {
                  "categoryId": null,
                  "categoryName": "Injecteur/porte-injecteur/UPI",
                  "level": 4,
                  "children": {
                    "Vis, support pour contrôleur d'injecteurs": {
                      "categoryId": 102799,
                      "categoryName": "Injector/Nozzle/Nozzle and Holder Assembly/UI",
                      "level": 3,
                      "children": [],
                      "productId": 5001
                    }
                  }
                }
              },
              "productId": 5001
            }
          }
        }
      }
    },
    "Échappement": {
      "categoryId": 100004,
      "categoryName": "Échappement",
      "level": 1,
      "children": {
        "Injection d'urée": {
          "categoryId": null,
          "categoryName": "Injection d'urée",
          "level": 2,
          "children": {
            "Bague d’étanchéité, soupape d’injection (injection d’urée)": {
              "categoryId": 103019,
              "categoryName": "Urea Injection",
              "level": 2,
              "children": {
                "Injecteur": {
                  "categoryId": null,
                  "categoryName": "Injecteur",
                  "level": 4,
                  "children": {
                    "Bague d’étanchéité, soupape d’injection (injection d’urée)": {
                      "categoryId": 103021,
                      "categoryName": "Injector",
                      "level": 3,
                      "children": [],
                      "productId": 60140
                    }
                  }
                }
              },
              "productId": 60140
            },
            "Injecteur, injection d'urée": {
              "categoryId": 103019,
              "categoryName": "Urea Injection",
              "level": 2,
              "children": {
                "Injecteur": {
                  "categoryId": null,
                  "categoryName": "Injecteur",
                  "level": 4,
                  "children": {
                    "Injecteur, injection d'urée": {
                      "categoryId": 103021,
                      "categoryName": "Injector",
                      "level": 3,
                      "children": [],
                      "productId": 4253
                    }
                  }
                }
              },
              "productId": 4253
            },
            "Kit rép. de câble, soupape d’injection (injection d’urée)": {
              "categoryId": 103019,
              "categoryName": "Urea Injection",
              "level": 2,
              "children": {
                "Injecteur": {
                  "categoryId": null,
                  "categoryName": "Injecteur",
                  "level": 4,
                  "children": {
                    "Kit rép. de câble, soupape d’injection (injection d’urée)": {
                      "categoryId": 103021,
                      "categoryName": "Injector",
                      "level": 3,
                      "children": [],
                      "productId": 60389
                    }
                  }
                }
              },
              "productId": 60389
            }
          }
        }
      }
    },
    "Moteur": {
      "categoryId": 100002,
      "categoryName": "Moteur",
      "level": 1,
      "children": {
        "Alimentation en air": {
          "categoryId": null,
          "categoryName": "Alimentation en air",
          "level": 2,
          "children": {
            "Flasque chauffante, préchauffement d'air d'admission": {
              "categoryId": 100383,
              "categoryName": "Air Supply",
              "level": 2,
              "children": {
                "Préchauffement de l'air d'admission": {
                  "categoryId": null,
                  "categoryName": "Préchauffement de l'air d'admission",
                  "level": 4,
                  "children": {
                    "Flasque chauffante, préchauffement d'air d'admission": {
                      "categoryId": 102872,
                      "categoryName": "Intake-Air Preheating",
                      "level": 3,
                      "children": [],
                      "productId": 3915
                    }
                  }
                }
              },
              "productId": 3915
            },
            "Joint, flasque chauffante-préchauffage de l'air d'admission": {
              "categoryId": 100383,
              "categoryName": "Air Supply",
              "level": 2,
              "children": {
                "Préchauffement de l'air d'admission": {
                  "categoryId": null,
                  "categoryName": "Préchauffement de l'air d'admission",
                  "level": 4,
                  "children": {
                    "Joint, flasque chauffante-préchauffage de l'air d'admission": {
                      "categoryId": 102872,
                      "categoryName": "Intake-Air Preheating",
                      "level": 3,
                      "children": [],
                      "productId": 4105
                    }
                  }
                }
              },
              "productId": 4105
            }
          }
        },
        "Joints": {
          "categoryId": null,
          "categoryName": "Joints",
          "level": 2,
          "children": {
            "Assortiment de bagues d'étanchéité, Injecteur": {
              "categoryId": 100223,
              "categoryName": "Gaskets",
              "level": 2,
              "children": {
                "Joint de carburant": {
                  "categoryId": null,
                  "categoryName": "Joint de carburant",
                  "level": 4,
                  "children": {
                    "Assortiment de bagues d'étanchéité, Injecteur": {
                      "categoryId": 100682,
                      "categoryName": "Fuel Circuit Seals",
                      "level": 3,
                      "children": [],
                      "productId": 4886
                    }
                  }
                }
              },
              "productId": 4886
            },
            "Bague d'étanchéité, injecteur": {
              "categoryId": 100223,
              "categoryName": "Gaskets",
              "level": 2,
              "children": {
                "Joint de carburant": {
                  "categoryId": null,
                  "categoryName": "Joint de carburant",
                  "level": 4,
                  "children": {
                    "Bague d'étanchéité, injecteur": {
                      "categoryId": 100682,
                      "categoryName": "Fuel Circuit Seals",
                      "level": 3,
                      "children": [],
                      "productId": 3891
                    }
                  }
                }
              },
              "productId": 3891
            },
            "Jeux de bagues d'etanchéité, injecteur": {
              "categoryId": 100223,
              "categoryName": "Gaskets",
              "level": 2,
              "children": {
                "Joint de carburant": {
                  "categoryId": null,
                  "categoryName": "Joint de carburant",
                  "level": 4,
                  "children": {
                    "Jeux de bagues d'etanchéité, injecteur": {
                      "categoryId": 100682,
                      "categoryName": "Fuel Circuit Seals",
                      "level": 3,
                      "children": [],
                      "productId": 4948
                    }
                  }
                }
              },
              "productId": 4948
            }
          }
        },
        "Outils": {
          "categoryId": null,
          "categoryName": "Outils",
          "level": 2,
          "children": {
            "Adaptateur à air comprimé, alésage d’injecteur": {
              "categoryId": 103129,
              "categoryName": "Tools",
              "level": 2,
              "children": [],
              "productId": 8171
            },
            "Douille, écrou tendeur de porte-injecteur": {
              "categoryId": 103129,
              "categoryName": "Tools",
              "level": 2,
              "children": [],
              "productId": 7261
            },
            "Extracteur par impact, injecteur Common-Rail": {
              "categoryId": 103129,
              "categoryName": "Tools",
              "level": 2,
              "children": [],
              "productId": 8157
            },
            "Kit d'extracteurs, injecteur": {
              "categoryId": 103129,
              "categoryName": "Tools",
              "level": 2,
              "children": [],
              "productId": 8153
            },
            "Kit d’expansion, extracteur d’injecteurs": {
              "categoryId": 103129,
              "categoryName": "Tools",
              "level": 2,
              "children": [],
              "productId": 8154
            },
            "Outil de nettoyage/fraisage, Buse d'injection CR": {
              "categoryId": 103129,
              "categoryName": "Tools",
              "level": 2,
              "children": [],
              "productId": 8160
            }
          }
        }
      }
    }
  },
  "arborescenceText": "├── Carburation [ID: 100254] (Niveau 1)\n│   ├── Carburateurs (Niveau 2)\n│   │   └── Carburettor System [ID: 102903] (Niveau 2) → ProductId: 1931\n│   │       └── Composants du carburateur (Niveau 4)\n│   │           └── Carburettor Parts [ID: 102906] (Niveau 3) → ProductId: 1931\n│   └── Mélange air-carburant (Niveau 2)\n│       ├── Mixture Formation [ID: 102793] (Niveau 2) → ProductId: 8781\n│       │   └── Outils (Niveau 4)\n│       │       └── Tools [ID: 103150] (Niveau 3) → ProductId: 8781\n│       ├── Mixture Formation [ID: 102793] (Niveau 2) → ProductId: 4520\n│       │   └── Outils (Niveau 4)\n│       │       └── Tools [ID: 103150] (Niveau 3) → ProductId: 4520\n│       ├── Mixture Formation [ID: 102793] (Niveau 2) → ProductId: 3900\n│       │   └── Composants de porte-injecteur / Injecteur (Niveau 4)\n│       │       └── Nozzle and Holder Assembly/Nozzle Parts [ID: 102800] (Niveau 3) → ProductId: 3900\n│       ├── Mixture Formation [ID: 102793] (Niveau 2) → ProductId: 4886\n│       │   └── Joint (Niveau 4)\n│       │       └── Seal [ID: 102795] (Niveau 3) → ProductId: 4886\n│       ├── Mixture Formation [ID: 102793] (Niveau 2) → ProductId: 3891\n│       │   └── Joint (Niveau 4)\n│       │       └── Seal [ID: 102795] (Niveau 3) → ProductId: 3891\n│       ├── Mixture Formation [ID: 102793] (Niveau 2) → ProductId: 4051\n│       │   ├── Composants de porte-injecteur / Injecteur (Niveau 4)\n│       │   │   └── Nozzle and Holder Assembly/Nozzle Parts [ID: 102800] (Niveau 3) → ProductId: 4051\n│       │   └── Joint (Niveau 4)\n│       │       └── Seal [ID: 102795] (Niveau 3) → ProductId: 4051\n│       ├── Mixture Formation [ID: 102793] (Niveau 2) → ProductId: 3963\n│       │   ├── Composants de porte-injecteur / Injecteur (Niveau 4)\n│       │   │   └── Nozzle and Holder Assembly/Nozzle Parts [ID: 102800] (Niveau 3) → ProductId: 3963\n│       │   └── Conduite de carburant / répartition du carburant (Niveau 4)\n│       │       └── Fuel Line/Distribution/Allocation [ID: 102804] (Niveau 3) → ProductId: 3963\n│       ├── Mixture Formation [ID: 102793] (Niveau 2) → ProductId: 3889\n│       │   └── Composants de porte-injecteur / Injecteur (Niveau 4)\n│       │       └── Nozzle and Holder Assembly/Nozzle Parts [ID: 102800] (Niveau 3) → ProductId: 3889\n│       ├── Mixture Formation [ID: 102793] (Niveau 2) → ProductId: 4518\n│       │   └── Outils (Niveau 4)\n│       │       └── Tools [ID: 103150] (Niveau 3) → ProductId: 4518\n│       ├── Mixture Formation [ID: 102793] (Niveau 2) → ProductId: 4524\n│       │   └── Outils (Niveau 4)\n│       │       └── Tools [ID: 103150] (Niveau 3) → ProductId: 4524\n│       ├── Mixture Formation [ID: 102793] (Niveau 2) → ProductId: 4522\n│       │   └── Outils (Niveau 4)\n│       │       └── Tools [ID: 103150] (Niveau 3) → ProductId: 4522\n│       ├── Mixture Formation [ID: 102793] (Niveau 2) → ProductId: 3899\n│       │   └── Composants de porte-injecteur / Injecteur (Niveau 4)\n│       │       └── Nozzle and Holder Assembly/Nozzle Parts [ID: 102800] (Niveau 3) → ProductId: 3899\n│       ├── Mixture Formation [ID: 102793] (Niveau 2) → ProductId: 3966\n│       │   └── Composants de porte-injecteur / Injecteur (Niveau 4)\n│       │       └── Nozzle and Holder Assembly/Nozzle Parts [ID: 102800] (Niveau 3) → ProductId: 3966\n│       ├── Mixture Formation [ID: 102793] (Niveau 2) → ProductId: 3948\n│       │   └── Composants de porte-injecteur / Injecteur (Niveau 4)\n│       │       └── Nozzle and Holder Assembly/Nozzle Parts [ID: 102800] (Niveau 3) → ProductId: 3948\n│       ├── Mixture Formation [ID: 102793] (Niveau 2) → ProductId: 4515\n│       │   └── Outils (Niveau 4)\n│       │       └── Tools [ID: 103150] (Niveau 3) → ProductId: 4515\n│       ├── Mixture Formation [ID: 102793] (Niveau 2) → ProductId: 3949\n│       │   └── Injecteur/porte-injecteur/UPI (Niveau 4)\n│       │       └── Injector/Nozzle/Nozzle and Holder Assembly/UI [ID: 102799] (Niveau 3) → ProductId: 3949\n│       ├── Mixture Formation [ID: 102793] (Niveau 2) → ProductId: 3915\n│       │   └── Composants de porte-injecteur / Injecteur (Niveau 4)\n│       │       └── Nozzle and Holder Assembly/Nozzle Parts [ID: 102800] (Niveau 3) → ProductId: 3915\n│       ├── Mixture Formation [ID: 102793] (Niveau 2) → ProductId: 8998\n│       │   └── Outils (Niveau 4)\n│       │       └── Tools [ID: 103150] (Niveau 3) → ProductId: 8998\n│       ├── Mixture Formation [ID: 102793] (Niveau 2) → ProductId: 3905\n│       │   └── Injecteur/porte-injecteur/UPI (Niveau 4)\n│       │       └── Injector/Nozzle/Nozzle and Holder Assembly/UI [ID: 102799] (Niveau 3) → ProductId: 3905\n│       ├── Mixture Formation [ID: 102793] (Niveau 2) → ProductId: 3920\n│       │   └── Réglage du ralenti/réglage de mise en température (Niveau 4)\n│       │       └── Idle Control [ID: 102805] (Niveau 3) → ProductId: 3920\n│       ├── Mixture Formation [ID: 102793] (Niveau 2) → ProductId: 61353\n│       │   └── Injecteur/porte-injecteur/UPI (Niveau 4)\n│       │       └── Injector/Nozzle/Nozzle and Holder Assembly/UI [ID: 102799] (Niveau 3) → ProductId: 61353\n│       ├── Mixture Formation [ID: 102793] (Niveau 2) → ProductId: 4948\n│       │   └── Joint (Niveau 4)\n│       │       └── Seal [ID: 102795] (Niveau 3) → ProductId: 4948\n│       ├── Mixture Formation [ID: 102793] (Niveau 2) → ProductId: 3892\n│       │   ├── Composants de porte-injecteur / Injecteur (Niveau 4)\n│       │   │   └── Nozzle and Holder Assembly/Nozzle Parts [ID: 102800] (Niveau 3) → ProductId: 3892\n│       │   └── Joint (Niveau 4)\n│       │       └── Seal [ID: 102795] (Niveau 3) → ProductId: 3892\n│       ├── Mixture Formation [ID: 102793] (Niveau 2) → ProductId: 4105\n│       │   └── Composants de porte-injecteur / Injecteur (Niveau 4)\n│       │       └── Nozzle and Holder Assembly/Nozzle Parts [ID: 102800] (Niveau 3) → ProductId: 4105\n│       ├── Mixture Formation [ID: 102793] (Niveau 2) → ProductId: 4867\n│       │   └── Outils (Niveau 4)\n│       │       └── Tools [ID: 103150] (Niveau 3) → ProductId: 4867\n│       ├── Mixture Formation [ID: 102793] (Niveau 2) → ProductId: 4519\n│       │   └── Outils (Niveau 4)\n│       │       └── Tools [ID: 103150] (Niveau 3) → ProductId: 4519\n│       ├── Mixture Formation [ID: 102793] (Niveau 2) → ProductId: 9645\n│       │   └── Outils (Niveau 4)\n│       │       └── Tools [ID: 103150] (Niveau 3) → ProductId: 9645\n│       ├── Mixture Formation [ID: 102793] (Niveau 2) → ProductId: 3894\n│       │   └── Injecteur/porte-injecteur/UPI (Niveau 4)\n│       │       └── Injector/Nozzle/Nozzle and Holder Assembly/UI [ID: 102799] (Niveau 3) → ProductId: 3894\n│       ├── Mixture Formation [ID: 102793] (Niveau 2) → ProductId: 8090\n│       │   ├── Composants de porte-injecteur / Injecteur (Niveau 4)\n│       │   │   └── Nozzle and Holder Assembly/Nozzle Parts [ID: 102800] (Niveau 3) → ProductId: 8090\n│       │   └── Conduite de carburant / répartition du carburant (Niveau 4)\n│       │       └── Fuel Line/Distribution/Allocation [ID: 102804] (Niveau 3) → ProductId: 8090\n│       ├── Mixture Formation [ID: 102793] (Niveau 2) → ProductId: 60201\n│       │   └── Injecteur/porte-injecteur/UPI (Niveau 4)\n│       │       └── Injector/Nozzle/Nozzle and Holder Assembly/UI [ID: 102799] (Niveau 3) → ProductId: 60201\n│       ├── Mixture Formation [ID: 102793] (Niveau 2) → ProductId: 4516\n│       │   └── Outils (Niveau 4)\n│       │       └── Tools [ID: 103150] (Niveau 3) → ProductId: 4516\n│       ├── Mixture Formation [ID: 102793] (Niveau 2) → ProductId: 9412\n│       │   └── Outils (Niveau 4)\n│       │       └── Tools [ID: 103150] (Niveau 3) → ProductId: 9412\n│       ├── Mixture Formation [ID: 102793] (Niveau 2) → ProductId: 3933\n│       │   └── Kit de réparation/Kit complet (Niveau 4)\n│       │       └── Repair Kit [ID: 102807] (Niveau 3) → ProductId: 3933\n│       ├── Mixture Formation [ID: 102793] (Niveau 2) → ProductId: 4049\n│       │   └── Composants de porte-injecteur / Injecteur (Niveau 4)\n│       │       └── Nozzle and Holder Assembly/Nozzle Parts [ID: 102800] (Niveau 3) → ProductId: 4049\n│       ├── Mixture Formation [ID: 102793] (Niveau 2) → ProductId: 3934\n│       │   └── Kit de réparation/Kit complet (Niveau 4)\n│       │       └── Repair Kit [ID: 102807] (Niveau 3) → ProductId: 3934\n│       ├── Mixture Formation [ID: 102793] (Niveau 2) → ProductId: 4523\n│       │   └── Outils (Niveau 4)\n│       │       └── Tools [ID: 103150] (Niveau 3) → ProductId: 4523\n│       ├── Mixture Formation [ID: 102793] (Niveau 2) → ProductId: 6350\n│       │   └── Injecteur/porte-injecteur/UPI (Niveau 4)\n│       │       └── Injector/Nozzle/Nozzle and Holder Assembly/UI [ID: 102799] (Niveau 3) → ProductId: 6350\n│       ├── Mixture Formation [ID: 102793] (Niveau 2) → ProductId: 60026\n│       │   └── Réglage du ralenti/réglage de mise en température (Niveau 4)\n│       │       └── Idle Control [ID: 102805] (Niveau 3) → ProductId: 60026\n│       ├── Mixture Formation [ID: 102793] (Niveau 2) → ProductId: 4050\n│       │   └── Composants de porte-injecteur / Injecteur (Niveau 4)\n│       │       └── Nozzle and Holder Assembly/Nozzle Parts [ID: 102800] (Niveau 3) → ProductId: 4050\n│       ├── Mixture Formation [ID: 102793] (Niveau 2) → ProductId: 4521\n│       │   └── Outils (Niveau 4)\n│       │       └── Tools [ID: 103150] (Niveau 3) → ProductId: 4521\n│       ├── Mixture Formation [ID: 102793] (Niveau 2) → ProductId: 6227\n│       │   └── Outils (Niveau 4)\n│       │       └── Tools [ID: 103150] (Niveau 3) → ProductId: 6227\n│       ├── Mixture Formation [ID: 102793] (Niveau 2) → ProductId: 4517\n│       │   └── Outils (Niveau 4)\n│       │       └── Tools [ID: 103150] (Niveau 3) → ProductId: 4517\n│       ├── Mixture Formation [ID: 102793] (Niveau 2) → ProductId: 9654\n│       │   └── Outils (Niveau 4)\n│       │       └── Tools [ID: 103150] (Niveau 3) → ProductId: 9654\n│       ├── Mixture Formation [ID: 102793] (Niveau 2) → ProductId: 9655\n│       │   └── Outils (Niveau 4)\n│       │       └── Tools [ID: 103150] (Niveau 3) → ProductId: 9655\n│       ├── Mixture Formation [ID: 102793] (Niveau 2) → ProductId: 61318\n│       │   └── Outils (Niveau 4)\n│       │       └── Tools [ID: 103150] (Niveau 3) → ProductId: 61318\n│       ├── Mixture Formation [ID: 102793] (Niveau 2) → ProductId: 60094\n│       │   └── Injecteur/porte-injecteur/UPI (Niveau 4)\n│       │       └── Injector/Nozzle/Nozzle and Holder Assembly/UI [ID: 102799] (Niveau 3) → ProductId: 60094\n│       ├── Mixture Formation [ID: 102793] (Niveau 2) → ProductId: 9804\n│       │   └── Outils (Niveau 4)\n│       │       └── Tools [ID: 103150] (Niveau 3) → ProductId: 9804\n│       ├── Mixture Formation [ID: 102793] (Niveau 2) → ProductId: 3901\n│       │   └── Injecteur/porte-injecteur/UPI (Niveau 4)\n│       │       └── Injector/Nozzle/Nozzle and Holder Assembly/UI [ID: 102799] (Niveau 3) → ProductId: 3901\n│       ├── Mixture Formation [ID: 102793] (Niveau 2) → ProductId: 9724\n│       │   └── Injecteur/porte-injecteur/UPI (Niveau 4)\n│       │       └── Injector/Nozzle/Nozzle and Holder Assembly/UI [ID: 102799] (Niveau 3) → ProductId: 9724\n│       ├── Mixture Formation [ID: 102793] (Niveau 2) → ProductId: 4900\n│       │   └── Injecteur/porte-injecteur/UPI (Niveau 4)\n│       │       └── Injector/Nozzle/Nozzle and Holder Assembly/UI [ID: 102799] (Niveau 3) → ProductId: 4900\n│       ├── Mixture Formation [ID: 102793] (Niveau 2) → ProductId: 60469\n│       │   └── Injecteur/porte-injecteur/UPI (Niveau 4)\n│       │       └── Injector/Nozzle/Nozzle and Holder Assembly/UI [ID: 102799] (Niveau 3) → ProductId: 60469\n│       ├── Mixture Formation [ID: 102793] (Niveau 2) → ProductId: 3965\n│       │   └── Injecteur/porte-injecteur/UPI (Niveau 4)\n│       │       └── Injector/Nozzle/Nozzle and Holder Assembly/UI [ID: 102799] (Niveau 3) → ProductId: 3965\n│       ├── Mixture Formation [ID: 102793] (Niveau 2) → ProductId: 60640\n│       │   └── Injecteur/porte-injecteur/UPI (Niveau 4)\n│       │       └── Injector/Nozzle/Nozzle and Holder Assembly/UI [ID: 102799] (Niveau 3) → ProductId: 60640\n│       ├── Mixture Formation [ID: 102793] (Niveau 2) → ProductId: 3937\n│       │   ├── Composants de porte-injecteur / Injecteur (Niveau 4)\n│       │   │   └── Nozzle and Holder Assembly/Nozzle Parts [ID: 102800] (Niveau 3) → ProductId: 3937\n│       │   └── Conduite de carburant / répartition du carburant (Niveau 4)\n│       │       └── Fuel Line/Distribution/Allocation [ID: 102804] (Niveau 3) → ProductId: 3937\n│       ├── Mixture Formation [ID: 102793] (Niveau 2) → ProductId: 3930\n│       │   └── Injecteur/porte-injecteur/UPI (Niveau 4)\n│       │       └── Injector/Nozzle/Nozzle and Holder Assembly/UI [ID: 102799] (Niveau 3) → ProductId: 3930\n│       ├── Mixture Formation [ID: 102793] (Niveau 2) → ProductId: 4513\n│       │   └── Injecteur/porte-injecteur/UPI (Niveau 4)\n│       │       └── Injector/Nozzle/Nozzle and Holder Assembly/UI [ID: 102799] (Niveau 3) → ProductId: 4513\n│       ├── Mixture Formation [ID: 102793] (Niveau 2) → ProductId: 9725\n│       │   └── Injecteur/porte-injecteur/UPI (Niveau 4)\n│       │       └── Injector/Nozzle/Nozzle and Holder Assembly/UI [ID: 102799] (Niveau 3) → ProductId: 9725\n│       ├── Mixture Formation [ID: 102793] (Niveau 2) → ProductId: 6597\n│       │   └── Injecteur/porte-injecteur/UPI (Niveau 4)\n│       │       └── Injector/Nozzle/Nozzle and Holder Assembly/UI [ID: 102799] (Niveau 3) → ProductId: 6597\n│       └── Mixture Formation [ID: 102793] (Niveau 2) → ProductId: 5001\n│           └── Injecteur/porte-injecteur/UPI (Niveau 4)\n│               └── Injector/Nozzle/Nozzle and Holder Assembly/UI [ID: 102799] (Niveau 3) → ProductId: 5001\n\n├── Échappement [ID: 100004] (Niveau 1)\n│   └── Injection d'urée (Niveau 2)\n│       ├── Urea Injection [ID: 103019] (Niveau 2) → ProductId: 60140\n│       │   └── Injecteur (Niveau 4)\n│       │       └── Injector [ID: 103021] (Niveau 3) → ProductId: 60140\n│       ├── Urea Injection [ID: 103019] (Niveau 2) → ProductId: 4253\n│       │   └── Injecteur (Niveau 4)\n│       │       └── Injector [ID: 103021] (Niveau 3) → ProductId: 4253\n│       └── Urea Injection [ID: 103019] (Niveau 2) → ProductId: 60389\n│           └── Injecteur (Niveau 4)\n│               └── Injector [ID: 103021] (Niveau 3) → ProductId: 60389\n\n└── Moteur [ID: 100002] (Niveau 1)\n    ├── Alimentation en air (Niveau 2)\n    │   ├── Air Supply [ID: 100383] (Niveau 2) → ProductId: 3915\n    │   │   └── Préchauffement de l'air d'admission (Niveau 4)\n    │   │       └── Intake-Air Preheating [ID: 102872] (Niveau 3) → ProductId: 3915\n    │   └── Air Supply [ID: 100383] (Niveau 2) → ProductId: 4105\n    │       └── Préchauffement de l'air d'admission (Niveau 4)\n    │           └── Intake-Air Preheating [ID: 102872] (Niveau 3) → ProductId: 4105\n    ├── Joints (Niveau 2)\n    │   ├── Gaskets [ID: 100223] (Niveau 2) → ProductId: 4886\n    │   │   └── Joint de carburant (Niveau 4)\n    │   │       └── Fuel Circuit Seals [ID: 100682] (Niveau 3) → ProductId: 4886\n    │   ├── Gaskets [ID: 100223] (Niveau 2) → ProductId: 3891\n    │   │   └── Joint de carburant (Niveau 4)\n    │   │       └── Fuel Circuit Seals [ID: 100682] (Niveau 3) → ProductId: 3891\n    │   └── Gaskets [ID: 100223] (Niveau 2) → ProductId: 4948\n    │       └── Joint de carburant (Niveau 4)\n    │           └── Fuel Circuit Seals [ID: 100682] (Niveau 3) → ProductId: 4948\n    └── Outils (Niveau 2)\n        ├── Tools [ID: 103129] (Niveau 2) → ProductId: 8171\n        ├── Tools [ID: 103129] (Niveau 2) → ProductId: 7261\n        ├── Tools [ID: 103129] (Niveau 2) → ProductId: 8157\n        ├── Tools [ID: 103129] (Niveau 2) → ProductId: 8153\n        ├── Tools [ID: 103129] (Niveau 2) → ProductId: 8154\n        └── Tools [ID: 103129] (Niveau 2) → ProductId: 8160",
  "arborescencePaths": [
    {
      "path": [
        "Carburation",
        "Carburateurs",
        "Carburettor System"
      ],
      "categoryIds": [
        100254,
        null,
        102903
      ],
      "finalCategoryId": 102903,
      "productId": 1931
    },
    {
      "path": [
        "Carburation",
        "Mélange air-carburant",
        "Mixture Formation"
      ],
      "categoryIds": [
        100254,
        null,
        102793
      ],
      "finalCategoryId": 102793,
      "productId": 8781
    },
    {
      "path": [
        "Carburation",
        "Mélange air-carburant",
        "Mixture Formation"
      ],
      "categoryIds": [
        100254,
        null,
        102793
      ],
      "finalCategoryId": 102793,
      "productId": 4520
    },
    {
      "path": [
        "Carburation",
        "Mélange air-carburant",
        "Mixture Formation"
      ],
      "categoryIds": [
        100254,
        null,
        102793
      ],
      "finalCategoryId": 102793,
      "productId": 3900
    },
    {
      "path": [
        "Carburation",
        "Mélange air-carburant",
        "Mixture Formation"
      ],
      "categoryIds": [
        100254,
        null,
        102793
      ],
      "finalCategoryId": 102793,
      "productId": 4886
    },
    {
      "path": [
        "Carburation",
        "Mélange air-carburant",
        "Mixture Formation"
      ],
      "categoryIds": [
        100254,
        null,
        102793
      ],
      "finalCategoryId": 102793,
      "productId": 3891
    },
    {
      "path": [
        "Carburation",
        "Mélange air-carburant",
        "Mixture Formation"
      ],
      "categoryIds": [
        100254,
        null,
        102793
      ],
      "finalCategoryId": 102793,
      "productId": 4051
    },
    {
      "path": [
        "Carburation",
        "Mélange air-carburant",
        "Mixture Formation"
      ],
      "categoryIds": [
        100254,
        null,
        102793
      ],
      "finalCategoryId": 102793,
      "productId": 3963
    },
    {
      "path": [
        "Carburation",
        "Mélange air-carburant",
        "Mixture Formation"
      ],
      "categoryIds": [
        100254,
        null,
        102793
      ],
      "finalCategoryId": 102793,
      "productId": 3889
    },
    {
      "path": [
        "Carburation",
        "Mélange air-carburant",
        "Mixture Formation"
      ],
      "categoryIds": [
        100254,
        null,
        102793
      ],
      "finalCategoryId": 102793,
      "productId": 4518
    },
    {
      "path": [
        "Carburation",
        "Mélange air-carburant",
        "Mixture Formation"
      ],
      "categoryIds": [
        100254,
        null,
        102793
      ],
      "finalCategoryId": 102793,
      "productId": 4524
    },
    {
      "path": [
        "Carburation",
        "Mélange air-carburant",
        "Mixture Formation"
      ],
      "categoryIds": [
        100254,
        null,
        102793
      ],
      "finalCategoryId": 102793,
      "productId": 4522
    },
    {
      "path": [
        "Carburation",
        "Mélange air-carburant",
        "Mixture Formation"
      ],
      "categoryIds": [
        100254,
        null,
        102793
      ],
      "finalCategoryId": 102793,
      "productId": 3899
    },
    {
      "path": [
        "Carburation",
        "Mélange air-carburant",
        "Mixture Formation"
      ],
      "categoryIds": [
        100254,
        null,
        102793
      ],
      "finalCategoryId": 102793,
      "productId": 3966
    },
    {
      "path": [
        "Carburation",
        "Mélange air-carburant",
        "Mixture Formation"
      ],
      "categoryIds": [
        100254,
        null,
        102793
      ],
      "finalCategoryId": 102793,
      "productId": 3948
    },
    {
      "path": [
        "Carburation",
        "Mélange air-carburant",
        "Mixture Formation"
      ],
      "categoryIds": [
        100254,
        null,
        102793
      ],
      "finalCategoryId": 102793,
      "productId": 4515
    },
    {
      "path": [
        "Carburation",
        "Mélange air-carburant",
        "Mixture Formation"
      ],
      "categoryIds": [
        100254,
        null,
        102793
      ],
      "finalCategoryId": 102793,
      "productId": 3949
    },
    {
      "path": [
        "Carburation",
        "Mélange air-carburant",
        "Mixture Formation"
      ],
      "categoryIds": [
        100254,
        null,
        102793
      ],
      "finalCategoryId": 102793,
      "productId": 3915
    },
    {
      "path": [
        "Carburation",
        "Mélange air-carburant",
        "Mixture Formation"
      ],
      "categoryIds": [
        100254,
        null,
        102793
      ],
      "finalCategoryId": 102793,
      "productId": 8998
    },
    {
      "path": [
        "Carburation",
        "Mélange air-carburant",
        "Mixture Formation"
      ],
      "categoryIds": [
        100254,
        null,
        102793
      ],
      "finalCategoryId": 102793,
      "productId": 3905
    },
    {
      "path": [
        "Carburation",
        "Mélange air-carburant",
        "Mixture Formation"
      ],
      "categoryIds": [
        100254,
        null,
        102793
      ],
      "finalCategoryId": 102793,
      "productId": 3920
    },
    {
      "path": [
        "Carburation",
        "Mélange air-carburant",
        "Mixture Formation"
      ],
      "categoryIds": [
        100254,
        null,
        102793
      ],
      "finalCategoryId": 102793,
      "productId": 61353
    },
    {
      "path": [
        "Carburation",
        "Mélange air-carburant",
        "Mixture Formation"
      ],
      "categoryIds": [
        100254,
        null,
        102793
      ],
      "finalCategoryId": 102793,
      "productId": 4948
    },
    {
      "path": [
        "Carburation",
        "Mélange air-carburant",
        "Mixture Formation"
      ],
      "categoryIds": [
        100254,
        null,
        102793
      ],
      "finalCategoryId": 102793,
      "productId": 3892
    },
    {
      "path": [
        "Carburation",
        "Mélange air-carburant",
        "Mixture Formation"
      ],
      "categoryIds": [
        100254,
        null,
        102793
      ],
      "finalCategoryId": 102793,
      "productId": 4105
    },
    {
      "path": [
        "Carburation",
        "Mélange air-carburant",
        "Mixture Formation"
      ],
      "categoryIds": [
        100254,
        null,
        102793
      ],
      "finalCategoryId": 102793,
      "productId": 4867
    },
    {
      "path": [
        "Carburation",
        "Mélange air-carburant",
        "Mixture Formation"
      ],
      "categoryIds": [
        100254,
        null,
        102793
      ],
      "finalCategoryId": 102793,
      "productId": 4519
    },
    {
      "path": [
        "Carburation",
        "Mélange air-carburant",
        "Mixture Formation"
      ],
      "categoryIds": [
        100254,
        null,
        102793
      ],
      "finalCategoryId": 102793,
      "productId": 9645
    },
    {
      "path": [
        "Carburation",
        "Mélange air-carburant",
        "Mixture Formation"
      ],
      "categoryIds": [
        100254,
        null,
        102793
      ],
      "finalCategoryId": 102793,
      "productId": 3894
    },
    {
      "path": [
        "Carburation",
        "Mélange air-carburant",
        "Mixture Formation"
      ],
      "categoryIds": [
        100254,
        null,
        102793
      ],
      "finalCategoryId": 102793,
      "productId": 8090
    },
    {
      "path": [
        "Carburation",
        "Mélange air-carburant",
        "Mixture Formation"
      ],
      "categoryIds": [
        100254,
        null,
        102793
      ],
      "finalCategoryId": 102793,
      "productId": 60201
    },
    {
      "path": [
        "Carburation",
        "Mélange air-carburant",
        "Mixture Formation"
      ],
      "categoryIds": [
        100254,
        null,
        102793
      ],
      "finalCategoryId": 102793,
      "productId": 4516
    },
    {
      "path": [
        "Carburation",
        "Mélange air-carburant",
        "Mixture Formation"
      ],
      "categoryIds": [
        100254,
        null,
        102793
      ],
      "finalCategoryId": 102793,
      "productId": 9412
    },
    {
      "path": [
        "Carburation",
        "Mélange air-carburant",
        "Mixture Formation"
      ],
      "categoryIds": [
        100254,
        null,
        102793
      ],
      "finalCategoryId": 102793,
      "productId": 3933
    },
    {
      "path": [
        "Carburation",
        "Mélange air-carburant",
        "Mixture Formation"
      ],
      "categoryIds": [
        100254,
        null,
        102793
      ],
      "finalCategoryId": 102793,
      "productId": 4049
    },
    {
      "path": [
        "Carburation",
        "Mélange air-carburant",
        "Mixture Formation"
      ],
      "categoryIds": [
        100254,
        null,
        102793
      ],
      "finalCategoryId": 102793,
      "productId": 3934
    },
    {
      "path": [
        "Carburation",
        "Mélange air-carburant",
        "Mixture Formation"
      ],
      "categoryIds": [
        100254,
        null,
        102793
      ],
      "finalCategoryId": 102793,
      "productId": 4523
    },
    {
      "path": [
        "Carburation",
        "Mélange air-carburant",
        "Mixture Formation"
      ],
      "categoryIds": [
        100254,
        null,
        102793
      ],
      "finalCategoryId": 102793,
      "productId": 6350
    },
    {
      "path": [
        "Carburation",
        "Mélange air-carburant",
        "Mixture Formation"
      ],
      "categoryIds": [
        100254,
        null,
        102793
      ],
      "finalCategoryId": 102793,
      "productId": 60026
    },
    {
      "path": [
        "Carburation",
        "Mélange air-carburant",
        "Mixture Formation"
      ],
      "categoryIds": [
        100254,
        null,
        102793
      ],
      "finalCategoryId": 102793,
      "productId": 4050
    },
    {
      "path": [
        "Carburation",
        "Mélange air-carburant",
        "Mixture Formation"
      ],
      "categoryIds": [
        100254,
        null,
        102793
      ],
      "finalCategoryId": 102793,
      "productId": 4521
    },
    {
      "path": [
        "Carburation",
        "Mélange air-carburant",
        "Mixture Formation"
      ],
      "categoryIds": [
        100254,
        null,
        102793
      ],
      "finalCategoryId": 102793,
      "productId": 6227
    },
    {
      "path": [
        "Carburation",
        "Mélange air-carburant",
        "Mixture Formation"
      ],
      "categoryIds": [
        100254,
        null,
        102793
      ],
      "finalCategoryId": 102793,
      "productId": 4517
    },
    {
      "path": [
        "Carburation",
        "Mélange air-carburant",
        "Mixture Formation"
      ],
      "categoryIds": [
        100254,
        null,
        102793
      ],
      "finalCategoryId": 102793,
      "productId": 9654
    },
    {
      "path": [
        "Carburation",
        "Mélange air-carburant",
        "Mixture Formation"
      ],
      "categoryIds": [
        100254,
        null,
        102793
      ],
      "finalCategoryId": 102793,
      "productId": 9655
    },
    {
      "path": [
        "Carburation",
        "Mélange air-carburant",
        "Mixture Formation"
      ],
      "categoryIds": [
        100254,
        null,
        102793
      ],
      "finalCategoryId": 102793,
      "productId": 61318
    },
    {
      "path": [
        "Carburation",
        "Mélange air-carburant",
        "Mixture Formation"
      ],
      "categoryIds": [
        100254,
        null,
        102793
      ],
      "finalCategoryId": 102793,
      "productId": 60094
    },
    {
      "path": [
        "Carburation",
        "Mélange air-carburant",
        "Mixture Formation"
      ],
      "categoryIds": [
        100254,
        null,
        102793
      ],
      "finalCategoryId": 102793,
      "productId": 9804
    },
    {
      "path": [
        "Carburation",
        "Mélange air-carburant",
        "Mixture Formation"
      ],
      "categoryIds": [
        100254,
        null,
        102793
      ],
      "finalCategoryId": 102793,
      "productId": 3901
    },
    {
      "path": [
        "Carburation",
        "Mélange air-carburant",
        "Mixture Formation"
      ],
      "categoryIds": [
        100254,
        null,
        102793
      ],
      "finalCategoryId": 102793,
      "productId": 9724
    },
    {
      "path": [
        "Carburation",
        "Mélange air-carburant",
        "Mixture Formation"
      ],
      "categoryIds": [
        100254,
        null,
        102793
      ],
      "finalCategoryId": 102793,
      "productId": 4900
    },
    {
      "path": [
        "Carburation",
        "Mélange air-carburant",
        "Mixture Formation"
      ],
      "categoryIds": [
        100254,
        null,
        102793
      ],
      "finalCategoryId": 102793,
      "productId": 60469
    },
    {
      "path": [
        "Carburation",
        "Mélange air-carburant",
        "Mixture Formation"
      ],
      "categoryIds": [
        100254,
        null,
        102793
      ],
      "finalCategoryId": 102793,
      "productId": 3965
    },
    {
      "path": [
        "Carburation",
        "Mélange air-carburant",
        "Mixture Formation"
      ],
      "categoryIds": [
        100254,
        null,
        102793
      ],
      "finalCategoryId": 102793,
      "productId": 60640
    },
    {
      "path": [
        "Carburation",
        "Mélange air-carburant",
        "Mixture Formation"
      ],
      "categoryIds": [
        100254,
        null,
        102793
      ],
      "finalCategoryId": 102793,
      "productId": 3937
    },
    {
      "path": [
        "Carburation",
        "Mélange air-carburant",
        "Mixture Formation"
      ],
      "categoryIds": [
        100254,
        null,
        102793
      ],
      "finalCategoryId": 102793,
      "productId": 3930
    },
    {
      "path": [
        "Carburation",
        "Mélange air-carburant",
        "Mixture Formation"
      ],
      "categoryIds": [
        100254,
        null,
        102793
      ],
      "finalCategoryId": 102793,
      "productId": 4513
    },
    {
      "path": [
        "Carburation",
        "Mélange air-carburant",
        "Mixture Formation"
      ],
      "categoryIds": [
        100254,
        null,
        102793
      ],
      "finalCategoryId": 102793,
      "productId": 9725
    },
    {
      "path": [
        "Carburation",
        "Mélange air-carburant",
        "Mixture Formation"
      ],
      "categoryIds": [
        100254,
        null,
        102793
      ],
      "finalCategoryId": 102793,
      "productId": 6597
    },
    {
      "path": [
        "Carburation",
        "Mélange air-carburant",
        "Mixture Formation"
      ],
      "categoryIds": [
        100254,
        null,
        102793
      ],
      "finalCategoryId": 102793,
      "productId": 5001
    },
    {
      "path": [
        "Échappement",
        "Injection d'urée",
        "Urea Injection"
      ],
      "categoryIds": [
        100004,
        null,
        103019
      ],
      "finalCategoryId": 103019,
      "productId": 60140
    },
    {
      "path": [
        "Échappement",
        "Injection d'urée",
        "Urea Injection"
      ],
      "categoryIds": [
        100004,
        null,
        103019
      ],
      "finalCategoryId": 103019,
      "productId": 4253
    },
    {
      "path": [
        "Échappement",
        "Injection d'urée",
        "Urea Injection"
      ],
      "categoryIds": [
        100004,
        null,
        103019
      ],
      "finalCategoryId": 103019,
      "productId": 60389
    },
    {
      "path": [
        "Moteur",
        "Alimentation en air",
        "Air Supply"
      ],
      "categoryIds": [
        100002,
        null,
        100383
      ],
      "finalCategoryId": 100383,
      "productId": 3915
    },
    {
      "path": [
        "Moteur",
        "Alimentation en air",
        "Air Supply"
      ],
      "categoryIds": [
        100002,
        null,
        100383
      ],
      "finalCategoryId": 100383,
      "productId": 4105
    },
    {
      "path": [
        "Moteur",
        "Joints",
        "Gaskets"
      ],
      "categoryIds": [
        100002,
        null,
        100223
      ],
      "finalCategoryId": 100223,
      "productId": 4886
    },
    {
      "path": [
        "Moteur",
        "Joints",
        "Gaskets"
      ],
      "categoryIds": [
        100002,
        null,
        100223
      ],
      "finalCategoryId": 100223,
      "productId": 3891
    },
    {
      "path": [
        "Moteur",
        "Joints",
        "Gaskets"
      ],
      "categoryIds": [
        100002,
        null,
        100223
      ],
      "finalCategoryId": 100223,
      "productId": 4948
    },
    {
      "path": [
        "Moteur",
        "Outils",
        "Tools"
      ],
      "categoryIds": [
        100002,
        null,
        103129
      ],
      "finalCategoryId": 103129,
      "productId": 8171
    },
    {
      "path": [
        "Moteur",
        "Outils",
        "Tools"
      ],
      "categoryIds": [
        100002,
        null,
        103129
      ],
      "finalCategoryId": 103129,
      "productId": 7261
    },
    {
      "path": [
        "Moteur",
        "Outils",
        "Tools"
      ],
      "categoryIds": [
        100002,
        null,
        103129
      ],
      "finalCategoryId": 103129,
      "productId": 8157
    },
    {
      "path": [
        "Moteur",
        "Outils",
        "Tools"
      ],
      "categoryIds": [
        100002,
        null,
        103129
      ],
      "finalCategoryId": 103129,
      "productId": 8153
    },
    {
      "path": [
        "Moteur",
        "Outils",
        "Tools"
      ],
      "categoryIds": [
        100002,
        null,
        103129
      ],
      "finalCategoryId": 103129,
      "productId": 8154
    },
    {
      "path": [
        "Moteur",
        "Outils",
        "Tools"
      ],
      "categoryIds": [
        100002,
        null,
        103129
      ],
      "finalCategoryId": 103129,
      "productId": 8160
    }
  ],
  "productIdsInArbo": [
    1931,
    3889,
    3891,
    3892,
    3894,
    3899,
    3900,
    3901,
    3905,
    3915,
    3920,
    3930,
    3933,
    3934,
    3937,
    3948,
    3949,
    3963,
    3965,
    3966,
    4049,
    4050,
    4051,
    4105,
    4253,
    4513,
    4515,
    4516,
    4517,
    4518,
    4519,
    4520,
    4521,
    4522,
    4523,
    4524,
    4867,
    4886,
    4900,
    4948,
    5001,
    6227,
    6350,
    6597,
    7261,
    8090,
    8153,
    8154,
    8157,
    8160,
    8171,
    8781,
    8998,
    9412,
    9645,
    9654,
    9655,
    9724,
    9725,
    9804,
    60026,
    60094,
    60140,
    60201,
    60389,
    60469,
    60640,
    61318,
    61353
  ],
  "closestProductIds": [
    {
      "productId": 1931,
      "productName": "Manchon d'injecteur, carburateur"
    },
    {
      "productId": 3889,
      "productName": "Cache, injecteur"
    },
    {
      "productId": 3891,
      "productName": "Bague d'étanchéité, injecteur"
    },
    {
      "productId": 3892,
      "productName": "Joint d'étanchéité, porte-injecteur"
    },
    {
      "productId": 3894,
      "productName": "Kit de joints, injecteur"
    }
  ]
}