{
  "productName": "Jeu de courroies trapézoïdales à nervures",
  "searchText": "Jeu de courroies trapézoïdales à nervures",
  "found": true,
  "hasMatch": true,
  "timestamp": "2025-12-02T20:49:05.369Z",
  "productId": 542,
  "arborescence": {
    "Commande à courroie": {
      "categoryId": 100016,
      "categoryName": "Commande à courroie",
      "level": 1,
      "children": {
        "Jeu/ courroies trapézoïdales à nervures": {
          "categoryId": null,
          "categoryName": "Jeu/ courroies trapézoïdales à nervures",
          "level": 2,
          "children": {
            "Jeu de courroies trapézoïdales à nervures": {
              "categoryId": 100082,
              "categoryName": "V-Ribbed Belt/Set",
              "level": 2,
              "children": {
                "Jeu de courroie trapézoïdale à nervures": {
                  "categoryId": null,
                  "categoryName": "Jeu de courroie trapézoïdale à nervures",
                  "level": 4,
                  "children": {
                    "Jeu de courroies trapézoïdales à nervures": {
                      "categoryId": 100432,
                      "categoryName": "V-Ribbed Belt Set",
                      "level": 3,
                      "children": [],
                      "productId": 542
                    }
                  }
                }
              },
              "productId": 542
            }
          }
        },
        "Poulie": {
          "categoryId": null,
          "categoryName": "Poulie",
          "level": 2,
          "children": {
            "Jeu de courroies trapézoïdales à nervures": {
              "categoryId": 101971,
              "categoryName": "Belt Pulley",
              "level": 2,
              "children": [],
              "productId": 542
            }
          }
        }
      }
    },
    "Moteur": {
      "categoryId": 100002,
      "categoryName": "Moteur",
      "level": 1,
      "children": {
        "Commande à courroie": {
          "categoryId": null,
          "categoryName": "Commande à courroie",
          "level": 2,
          "children": {
            "Jeu de courroies trapézoïdales à nervures": {
              "categoryId": 104302,
              "categoryName": "Belt Drive",
              "level": 2,
              "children": {
                "Jeu/ courroies trapézoïdales à nervures": {
                  "categoryId": null,
                  "categoryName": "Jeu/ courroies trapézoïdales à nervures",
                  "level": 4,
                  "children": {
                    "Jeu de courroies trapézoïdales à nervures": {
                      "categoryId": 104308,
                      "categoryName": "V-Ribbed Belt/Set",
                      "level": 3,
                      "children": {
                        "Jeu de courroie trapézoïdale à nervures": {
                          "categoryId": null,
                          "categoryName": "Jeu de courroie trapézoïdale à nervures",
                          "level": 6,
                          "children": {
                            "Jeu de courroies trapézoïdales à nervures": {
                              "categoryId": 104310,
                              "categoryName": "V-Ribbed Belt Set",
                              "level": 4,
                              "children": [],
                              "productId": 542
                            }
                          }
                        }
                      },
                      "productId": 542
                    }
                  }
                },
                "Poulie": {
                  "categoryId": null,
                  "categoryName": "Poulie",
                  "level": 4,
                  "children": {
                    "Jeu de courroies trapézoïdales à nervures": {
                      "categoryId": 104329,
                      "categoryName": "Belt Pulley",
                      "level": 3,
                      "children": [],
                      "productId": 542
                    }
                  }
                }
              },
              "productId": 542
            }
          }
        }
      }
    },
    "Pièces de maintenance": {
      "categoryId": 100019,
      "categoryName": "Pièces de maintenance",
      "level": 1,
      "children": {
        "Intervalle": {
          "categoryId": null,
          "categoryName": "Intervalle",
          "level": 2,
          "children": {
            "Jeu de courroies trapézoïdales à nervures": {
              "categoryId": 100597,
              "categoryName": "Service Intervals",
              "level": 2,
              "children": [],
              "productId": 542
            }
          }
        }
      }
    }
  },
  "arborescenceText": "├── Commande à courroie [ID: 100016] (Niveau 1)\n│   ├── Jeu/ courroies trapézoïdales à nervures (Niveau 2)\n│   │   └── V-Ribbed Belt/Set [ID: 100082] (Niveau 2) → ProductId: 542\n│   │       └── Jeu de courroie trapézoïdale à nervures (Niveau 4)\n│   │           └── V-Ribbed Belt Set [ID: 100432] (Niveau 3) → ProductId: 542\n│   └── Poulie (Niveau 2)\n│       └── Belt Pulley [ID: 101971] (Niveau 2) → ProductId: 542\n\n├── Moteur [ID: 100002] (Niveau 1)\n│   └── Commande à courroie (Niveau 2)\n│       └── Belt Drive [ID: 104302] (Niveau 2) → ProductId: 542\n│           ├── Jeu/ courroies trapézoïdales à nervures (Niveau 4)\n│           │   └── V-Ribbed Belt/Set [ID: 104308] (Niveau 3) → ProductId: 542\n│           │       └── Jeu de courroie trapézoïdale à nervures (Niveau 6)\n│           │           └── V-Ribbed Belt Set [ID: 104310] (Niveau 4) → ProductId: 542\n│           └── Poulie (Niveau 4)\n│               └── Belt Pulley [ID: 104329] (Niveau 3) → ProductId: 542\n\n└── Pièces de maintenance [ID: 100019] (Niveau 1)\n    └── Intervalle (Niveau 2)\n        └── Service Intervals [ID: 100597] (Niveau 2) → ProductId: 542",
  "arborescencePaths": [
    {
      "path": [
        "Commande à courroie",
        "Jeu/ courroies trapézoïdales à nervures",
        "V-Ribbed Belt/Set"
      ],
      "categoryIds": [
        100016,
        null,
        100082
      ],
      "finalCategoryId": 100082,
      "productId": 542
    },
    {
      "path": [
        "Commande à courroie",
        "Poulie",
        "Belt Pulley"
      ],
      "categoryIds": [
        100016,
        null,
        101971
      ],
      "finalCategoryId": 101971,
      "productId": 542
    },
    {
      "path": [
        "Moteur",
        "Commande à courroie",
        "Belt Drive"
      ],
      "categoryIds": [
        100002,
        null,
        104302
      ],
      "finalCategoryId": 104302,
      "productId": 542
    },
    {
      "path": [
        "Pièces de maintenance",
        "Intervalle",
        "Service Intervals"
      ],
      "categoryIds": [
        100019,
        null,
        100597
      ],
      "finalCategoryId": 100597,
      "productId": 542
    }
  ],
  "productIdsInArbo": [
    542
  ],
  "matchedProductIds": [
    542
  ]
}