{
  "productName": "Joint, compresseur",
  "searchText": "Joint, compresseur",
  "found": true,
  "hasMatch": true,
  "timestamp": "2025-12-02T20:55:12.232Z",
  "productId": 141,
  "arborescence": {
    "Climatisation": {
      "categoryId": 100243,
      "categoryName": "Climatisation",
      "level": 1,
      "children": {
        "Compresseur / composants": {
          "categoryId": null,
          "categoryName": "Compresseur / composants",
          "level": 2,
          "children": {
            "Joint, compresseur de climatisation": {
              "categoryId": 100354,
              "categoryName": "Compressor/Parts",
              "level": 2,
              "children": [],
              "productId": 8467
            }
          }
        }
      }
    },
    "Échappement": {
      "categoryId": 100004,
      "categoryName": "Échappement",
      "level": 1,
      "children": {
        "Turbocompresseur": {
          "categoryId": null,
          "categoryName": "Turbocompresseur",
          "level": 2,
          "children": {
            "Joint, compresseur": {
              "categoryId": 100872,
              "categoryName": "Charger",
              "level": 2,
              "children": [],
              "productId": 141
            }
          }
        }
      }
    },
    "Moteur": {
      "categoryId": 100002,
      "categoryName": "Moteur",
      "level": 1,
      "children": {
        "Alimentation en air": {
          "categoryId": null,
          "categoryName": "Alimentation en air",
          "level": 2,
          "children": {
            "Joint, compresseur": {
              "categoryId": 100383,
              "categoryName": "Air Supply",
              "level": 2,
              "children": {
                "Suralimentation": {
                  "categoryId": null,
                  "categoryName": "Suralimentation",
                  "level": 4,
                  "children": {
                    "Joint, compresseur": {
                      "categoryId": 100390,
                      "categoryName": "Charging (supercharged/turbocharged)",
                      "level": 3,
                      "children": {
                        "Compresseur/composants": {
                          "categoryId": null,
                          "categoryName": "Compresseur/composants",
                          "level": 6,
                          "children": {
                            "Joint, compresseur": {
                              "categoryId": 100391,
                              "categoryName": "Charger/-parts",
                              "level": 4,
                              "children": [],
                              "productId": 141
                            }
                          }
                        },
                        "Joint de turbocompresseur": {
                          "categoryId": null,
                          "categoryName": "Joint de turbocompresseur",
                          "level": 6,
                          "children": {
                            "Joint, compresseur": {
                              "categoryId": 100392,
                              "categoryName": "Charger Gasket",
                              "level": 4,
                              "children": [],
                              "productId": 3743
                            }
                          }
                        }
                      },
                      "productId": 3743
                    }
                  }
                }
              },
              "productId": 3743
            }
          }
        },
        "Joints": {
          "categoryId": null,
          "categoryName": "Joints",
          "level": 2,
          "children": {
            "Joint, compresseur": {
              "categoryId": 100223,
              "categoryName": "Gaskets",
              "level": 2,
              "children": {
                "Joint de turbocompresseur": {
                  "categoryId": null,
                  "categoryName": "Joint de turbocompresseur",
                  "level": 4,
                  "children": {
                    "Joint, compresseur": {
                      "categoryId": 100244,
                      "categoryName": "Turbocharger Gasket",
                      "level": 3,
                      "children": [],
                      "productId": 3743
                    }
                  }
                }
              },
              "productId": 3743
            }
          }
        }
      }
    }
  },
  "arborescenceText": "├── Climatisation [ID: 100243] (Niveau 1)\n│   └── Compresseur / composants (Niveau 2)\n│       └── Compressor/Parts [ID: 100354] (Niveau 2) → ProductId: 8467\n\n├── Échappement [ID: 100004] (Niveau 1)\n│   └── Turbocompresseur (Niveau 2)\n│       └── Charger [ID: 100872] (Niveau 2) → ProductId: 141\n\n└── Moteur [ID: 100002] (Niveau 1)\n    ├── Alimentation en air (Niveau 2)\n    │   └── Air Supply [ID: 100383] (Niveau 2) → ProductId: 3743\n    │       └── Suralimentation (Niveau 4)\n    │           └── Charging (supercharged/turbocharged) [ID: 100390] (Niveau 3) → ProductId: 3743\n    │               ├── Compresseur/composants (Niveau 6)\n    │               │   └── Charger/-parts [ID: 100391] (Niveau 4) → ProductId: 141\n    │               └── Joint de turbocompresseur (Niveau 6)\n    │                   └── Charger Gasket [ID: 100392] (Niveau 4) → ProductId: 3743\n    └── Joints (Niveau 2)\n        └── Gaskets [ID: 100223] (Niveau 2) → ProductId: 3743\n            └── Joint de turbocompresseur (Niveau 4)\n                └── Turbocharger Gasket [ID: 100244] (Niveau 3) → ProductId: 3743",
  "arborescencePaths": [
    {
      "path": [
        "Climatisation",
        "Compresseur / composants",
        "Compressor/Parts"
      ],
      "categoryIds": [
        100243,
        null,
        100354
      ],
      "finalCategoryId": 100354,
      "productId": 8467
    },
    {
      "path": [
        "Échappement",
        "Turbocompresseur",
        "Charger"
      ],
      "categoryIds": [
        100004,
        null,
        100872
      ],
      "finalCategoryId": 100872,
      "productId": 141
    },
    {
      "path": [
        "Moteur",
        "Alimentation en air",
        "Air Supply"
      ],
      "categoryIds": [
        100002,
        null,
        100383
      ],
      "finalCategoryId": 100383,
      "productId": 3743
    },
    {
      "path": [
        "Moteur",
        "Joints",
        "Gaskets"
      ],
      "categoryIds": [
        100002,
        null,
        100223
      ],
      "finalCategoryId": 100223,
      "productId": 3743
    }
  ],
  "productIdsInArbo": [
    141,
    3743,
    8467
  ],
  "matchedProductIds": [
    141
  ]
}