{
  "productName": "Joint d'étanchéité, tamis d'huile",
  "searchText": "Joint d'étanchéité, tamis d'huile",
  "found": true,
  "hasMatch": true,
  "timestamp": "2025-12-02T20:53:31.897Z",
  "productId": 134,
  "arborescence": {
    "Boîte de vitesses": {
      "categoryId": 100238,
      "categoryName": "Boîte de vitesses",
      "level": 1,
      "children": {
        "Boîte de vitesse automatique": {
          "categoryId": null,
          "categoryName": "Boîte de vitesse automatique",
          "level": 2,
          "children": {
            "Joint d'étanchéité, tamis d'huile": {
              "categoryId": 100240,
              "categoryName": "Automatic Transmission",
              "level": 2,
              "children": {
                "Joints": {
                  "categoryId": null,
                  "categoryName": "Joints",
                  "level": 4,
                  "children": {
                    "Joint d'étanchéité, tamis d'huile": {
                      "categoryId": 100770,
                      "categoryName": "Gaskets/Seals",
                      "level": 3,
                      "children": [],
                      "productId": 3560
                    }
                  }
                }
              },
              "productId": 3560
            }
          }
        }
      }
    },
    "Moteur": {
      "categoryId": 100002,
      "categoryName": "Moteur",
      "level": 1,
      "children": {
        "Joints": {
          "categoryId": null,
          "categoryName": "Joints",
          "level": 2,
          "children": {
            "Joint d'étanchéité, tamis d'huile": {
              "categoryId": 100223,
              "categoryName": "Gaskets",
              "level": 2,
              "children": {
                "Joint de circuit d'huile": {
                  "categoryId": null,
                  "categoryName": "Joint de circuit d'huile",
                  "level": 4,
                  "children": {
                    "Joint d'étanchéité, tamis d'huile": {
                      "categoryId": 100684,
                      "categoryName": "Oil Circuit Seals",
                      "level": 3,
                      "children": [],
                      "productId": 134
                    }
                  }
                }
              },
              "productId": 134
            }
          }
        },
        "Lubrification": {
          "categoryId": null,
          "categoryName": "Lubrification",
          "level": 2,
          "children": {
            "Joint d'étanchéité, tamis d'huile": {
              "categoryId": 100245,
              "categoryName": "Lubrication",
              "level": 2,
              "children": {
                "Tamis d'huile / joint": {
                  "categoryId": null,
                  "categoryName": "Tamis d'huile / joint",
                  "level": 4,
                  "children": {
                    "Joint d'étanchéité, tamis d'huile": {
                      "categoryId": 100477,
                      "categoryName": "Oil Strainer/Gasket",
                      "level": 3,
                      "children": [],
                      "productId": 134
                    }
                  }
                }
              },
              "productId": 134
            }
          }
        }
      }
    },
    "Pièces de maintenance": {
      "categoryId": 100019,
      "categoryName": "Pièces de maintenance",
      "level": 1,
      "children": {
        "Intervalle": {
          "categoryId": null,
          "categoryName": "Intervalle",
          "level": 2,
          "children": {
            "Joint d'étanchéité, tamis d'huile": {
              "categoryId": 100597,
              "categoryName": "Service Intervals",
              "level": 2,
              "children": [],
              "productId": 134
            }
          }
        }
      }
    }
  },
  "arborescenceText": "├── Boîte de vitesses [ID: 100238] (Niveau 1)\n│   └── Boîte de vitesse automatique (Niveau 2)\n│       └── Automatic Transmission [ID: 100240] (Niveau 2) → ProductId: 3560\n│           └── Joints (Niveau 4)\n│               └── Gaskets/Seals [ID: 100770] (Niveau 3) → ProductId: 3560\n\n├── Moteur [ID: 100002] (Niveau 1)\n│   ├── Joints (Niveau 2)\n│   │   └── Gaskets [ID: 100223] (Niveau 2) → ProductId: 134\n│   │       └── Joint de circuit d'huile (Niveau 4)\n│   │           └── Oil Circuit Seals [ID: 100684] (Niveau 3) → ProductId: 134\n│   └── Lubrification (Niveau 2)\n│       └── Lubrication [ID: 100245] (Niveau 2) → ProductId: 134\n│           └── Tamis d'huile / joint (Niveau 4)\n│               └── Oil Strainer/Gasket [ID: 100477] (Niveau 3) → ProductId: 134\n\n└── Pièces de maintenance [ID: 100019] (Niveau 1)\n    └── Intervalle (Niveau 2)\n        └── Service Intervals [ID: 100597] (Niveau 2) → ProductId: 134",
  "arborescencePaths": [
    {
      "path": [
        "Boîte de vitesses",
        "Boîte de vitesse automatique",
        "Automatic Transmission"
      ],
      "categoryIds": [
        100238,
        null,
        100240
      ],
      "finalCategoryId": 100240,
      "productId": 3560
    },
    {
      "path": [
        "Moteur",
        "Joints",
        "Gaskets"
      ],
      "categoryIds": [
        100002,
        null,
        100223
      ],
      "finalCategoryId": 100223,
      "productId": 134
    },
    {
      "path": [
        "Moteur",
        "Lubrification",
        "Lubrication"
      ],
      "categoryIds": [
        100002,
        null,
        100245
      ],
      "finalCategoryId": 100245,
      "productId": 134
    },
    {
      "path": [
        "Pièces de maintenance",
        "Intervalle",
        "Service Intervals"
      ],
      "categoryIds": [
        100019,
        null,
        100597
      ],
      "finalCategoryId": 100597,
      "productId": 134
    }
  ],
  "productIdsInArbo": [
    134,
    3560
  ],
  "matchedProductIds": [
    134
  ]
}