{
  "productName": "Joint, couvercle de la soute à bagages",
  "searchText": "Joint, couvercle de la soute à bagages",
  "found": true,
  "hasMatch": true,
  "timestamp": "2025-12-02T20:55:26.315Z",
  "productId": 1714,
  "arborescence": {
    "Carrosserie": {
      "categoryId": 100001,
      "categoryName": "Carrosserie",
      "level": 1,
      "children": {
        "Arrière de la voiture": {
          "categoryId": null,
          "categoryName": "Arrière de la voiture",
          "level": 2,
          "children": {
            "Joint, couvercle de la soute à bagages": {
              "categoryId": 101705,
              "categoryName": "Vehicle Rear",
              "level": 2,
              "children": {
                "Clapet/couvercle de hayon/de coffre": {
                  "categoryId": null,
                  "categoryName": "Clapet/couvercle de hayon/de coffre",
                  "level": 4,
                  "children": {
                    "Joint, couvercle de la soute à bagages": {
                      "categoryId": 101782,
                      "categoryName": "Tailgate/Cargo Bay Hatch & Boot Lid/Cargo Bay Cover",
                      "level": 3,
                      "children": [],
                      "productId": 1714
                    }
                  }
                }
              },
              "productId": 1714
            }
          }
        },
        "Trappes/capots/portes/toit coul./toit panoram./toit pliant": {
          "categoryId": null,
          "categoryName": "Trappes/capots/portes/toit coul./toit panoram./toit pliant",
          "level": 2,
          "children": {
            "Joint, couvercle de la soute à bagages": {
              "categoryId": 100746,
              "categoryName": "Hatches/Bonnets/Doors/Sunroof/Panoramic Roof",
              "level": 2,
              "children": {
                "Clapet/couvercle de hayon/de coffre": {
                  "categoryId": null,
                  "categoryName": "Clapet/couvercle de hayon/de coffre",
                  "level": 4,
                  "children": {
                    "Joint, couvercle de la soute à bagages": {
                      "categoryId": 100192,
                      "categoryName": "Tailgate/Cargo Bay Hatch & Boot Lid/Cargo Bay Cover",
                      "level": 3,
                      "children": [],
                      "productId": 1714
                    }
                  }
                }
              },
              "productId": 1714
            }
          }
        }
      }
    }
  },
  "arborescenceText": "└── Carrosserie [ID: 100001] (Niveau 1)\n    ├── Arrière de la voiture (Niveau 2)\n    │   └── Vehicle Rear [ID: 101705] (Niveau 2) → ProductId: 1714\n    │       └── Clapet/couvercle de hayon/de coffre (Niveau 4)\n    │           └── Tailgate/Cargo Bay Hatch & Boot Lid/Cargo Bay Cover [ID: 101782] (Niveau 3) → ProductId: 1714\n    └── Trappes/capots/portes/toit coul./toit panoram./toit pliant (Niveau 2)\n        └── Hatches/Bonnets/Doors/Sunroof/Panoramic Roof [ID: 100746] (Niveau 2) → ProductId: 1714\n            └── Clapet/couvercle de hayon/de coffre (Niveau 4)\n                └── Tailgate/Cargo Bay Hatch & Boot Lid/Cargo Bay Cover [ID: 100192] (Niveau 3) → ProductId: 1714",
  "arborescencePaths": [
    {
      "path": [
        "Carrosserie",
        "Arrière de la voiture",
        "Vehicle Rear"
      ],
      "categoryIds": [
        100001,
        null,
        101705
      ],
      "finalCategoryId": 101705,
      "productId": 1714
    },
    {
      "path": [
        "Carrosserie",
        "Trappes/capots/portes/toit coul./toit panoram./toit pliant",
        "Hatches/Bonnets/Doors/Sunroof/Panoramic Roof"
      ],
      "categoryIds": [
        100001,
        null,
        100746
      ],
      "finalCategoryId": 100746,
      "productId": 1714
    }
  ],
  "productIdsInArbo": [
    1714
  ],
  "matchedProductIds": [
    1714
  ]
}