{
  "productName": "Kit de réparation, pompe à huile",
  "searchText": "Kit de réparation, pompe à huile",
  "found": true,
  "hasMatch": true,
  "timestamp": "2025-12-02T21:05:51.811Z",
  "productId": 8254,
  "arborescence": {
    "Boîte de vitesses": {
      "categoryId": 100238,
      "categoryName": "Boîte de vitesses",
      "level": 1,
      "children": {
        "Boîte de vitesse automatique": {
          "categoryId": null,
          "categoryName": "Boîte de vitesse automatique",
          "level": 2,
          "children": {
            "Kit de réparation, pompe à huile (boîte automatique)": {
              "categoryId": 100240,
              "categoryName": "Automatic Transmission",
              "level": 2,
              "children": {
                "Pompe à huile": {
                  "categoryId": null,
                  "categoryName": "Pompe à huile",
                  "level": 4,
                  "children": {
                    "Kit de réparation, pompe à huile (boîte automatique)": {
                      "categoryId": 105494,
                      "categoryName": "Oil Pump",
                      "level": 3,
                      "children": [],
                      "productId": 60478
                    }
                  }
                }
              },
              "productId": 60478
            }
          }
        },
        "Boîte de vitesses manuelle": {
          "categoryId": null,
          "categoryName": "Boîte de vitesses manuelle",
          "level": 2,
          "children": {
            "Kit de réparation, pompe à huile (BM)": {
              "categoryId": 100239,
              "categoryName": "Manual Transmission",
              "level": 2,
              "children": {
                "Réparation/entretien": {
                  "categoryId": null,
                  "categoryName": "Réparation/entretien",
                  "level": 4,
                  "children": {
                    "Kit de réparation, pompe à huile (BM)": {
                      "categoryId": 101809,
                      "categoryName": "Repair/Maintenance",
                      "level": 3,
                      "children": [],
                      "productId": 60458
                    }
                  }
                }
              },
              "productId": 60458
            }
          }
        },
        "Boîte de vitesses manuelle robotisée (BVR)": {
          "categoryId": null,
          "categoryName": "Boîte de vitesses manuelle robotisée (BVR)",
          "level": 2,
          "children": {
            "Kit de réparation, pompe à huile (BVR)": {
              "categoryId": 706584,
              "categoryName": "Automated manual transmission (AMT)",
              "level": 2,
              "children": {
                "Pompe à huile": {
                  "categoryId": null,
                  "categoryName": "Pompe à huile",
                  "level": 4,
                  "children": {
                    "Kit de réparation, pompe à huile (BVR)": {
                      "categoryId": 706633,
                      "categoryName": "Oil Pump",
                      "level": 3,
                      "children": [],
                      "productId": 60464
                    }
                  }
                },
                "Réparation/entretien": {
                  "categoryId": null,
                  "categoryName": "Réparation/entretien",
                  "level": 4,
                  "children": {
                    "Kit de réparation, pompe à huile (BVR)": {
                      "categoryId": 706603,
                      "categoryName": "Repair/Maintenance",
                      "level": 3,
                      "children": [],
                      "productId": 60464
                    }
                  }
                }
              },
              "productId": 60464
            }
          }
        }
      }
    },
    "Moteur": {
      "categoryId": 100002,
      "categoryName": "Moteur",
      "level": 1,
      "children": {
        "Lubrification": {
          "categoryId": null,
          "categoryName": "Lubrification",
          "level": 2,
          "children": {
            "Kit de réparation, pompe à huile": {
              "categoryId": 100245,
              "categoryName": "Lubrication",
              "level": 2,
              "children": {
                "Pompe à huile et pièces de montage": {
                  "categoryId": null,
                  "categoryName": "Pompe à huile et pièces de montage",
                  "level": 4,
                  "children": {
                    "Kit de réparation, pompe à huile": {
                      "categoryId": 100476,
                      "categoryName": "Oil Pump/Attachment Parts",
                      "level": 3,
                      "children": {
                        "Pompe à huile": {
                          "categoryId": null,
                          "categoryName": "Pompe à huile",
                          "level": 6,
                          "children": {
                            "Kit de réparation, pompe à huile": {
                              "categoryId": 100492,
                              "categoryName": "Oil Pump",
                              "level": 4,
                              "children": [],
                              "productId": 8254
                            }
                          }
                        }
                      },
                      "productId": 8254
                    }
                  }
                }
              },
              "productId": 8254
            }
          }
        }
      }
    }
  },
  "arborescenceText": "├── Boîte de vitesses [ID: 100238] (Niveau 1)\n│   ├── Boîte de vitesse automatique (Niveau 2)\n│   │   └── Automatic Transmission [ID: 100240] (Niveau 2) → ProductId: 60478\n│   │       └── Pompe à huile (Niveau 4)\n│   │           └── Oil Pump [ID: 105494] (Niveau 3) → ProductId: 60478\n│   ├── Boîte de vitesses manuelle (Niveau 2)\n│   │   └── Manual Transmission [ID: 100239] (Niveau 2) → ProductId: 60458\n│   │       └── Réparation/entretien (Niveau 4)\n│   │           └── Repair/Maintenance [ID: 101809] (Niveau 3) → ProductId: 60458\n│   └── Boîte de vitesses manuelle robotisée (BVR) (Niveau 2)\n│       └── Automated manual transmission (AMT) [ID: 706584] (Niveau 2) → ProductId: 60464\n│           ├── Pompe à huile (Niveau 4)\n│           │   └── Oil Pump [ID: 706633] (Niveau 3) → ProductId: 60464\n│           └── Réparation/entretien (Niveau 4)\n│               └── Repair/Maintenance [ID: 706603] (Niveau 3) → ProductId: 60464\n\n└── Moteur [ID: 100002] (Niveau 1)\n    └── Lubrification (Niveau 2)\n        └── Lubrication [ID: 100245] (Niveau 2) → ProductId: 8254\n            └── Pompe à huile et pièces de montage (Niveau 4)\n                └── Oil Pump/Attachment Parts [ID: 100476] (Niveau 3) → ProductId: 8254\n                    └── Pompe à huile (Niveau 6)\n                        └── Oil Pump [ID: 100492] (Niveau 4) → ProductId: 8254",
  "arborescencePaths": [
    {
      "path": [
        "Boîte de vitesses",
        "Boîte de vitesse automatique",
        "Automatic Transmission"
      ],
      "categoryIds": [
        100238,
        null,
        100240
      ],
      "finalCategoryId": 100240,
      "productId": 60478
    },
    {
      "path": [
        "Boîte de vitesses",
        "Boîte de vitesses manuelle",
        "Manual Transmission"
      ],
      "categoryIds": [
        100238,
        null,
        100239
      ],
      "finalCategoryId": 100239,
      "productId": 60458
    },
    {
      "path": [
        "Boîte de vitesses",
        "Boîte de vitesses manuelle robotisée (BVR)",
        "Automated manual transmission (AMT)"
      ],
      "categoryIds": [
        100238,
        null,
        706584
      ],
      "finalCategoryId": 706584,
      "productId": 60464
    },
    {
      "path": [
        "Moteur",
        "Lubrification",
        "Lubrication"
      ],
      "categoryIds": [
        100002,
        null,
        100245
      ],
      "finalCategoryId": 100245,
      "productId": 8254
    }
  ],
  "productIdsInArbo": [
    8254,
    60458,
    60464,
    60478
  ],
  "matchedProductIds": [
    8254
  ]
}