{
  "productName": "Kit de projecteurs principaux",
  "searchText": "Kit de projecteurs principaux",
  "found": true,
  "hasMatch": true,
  "timestamp": "2025-12-02T21:02:24.517Z",
  "productId": 3175,
  "arborescence": {
    "Carrosserie": {
      "categoryId": 100001,
      "categoryName": "Carrosserie",
      "level": 1,
      "children": {
        "Avant du véhicule": {
          "categoryId": null,
          "categoryName": "Avant du véhicule",
          "level": 2,
          "children": {
            "Kit de projecteurs principaux": {
              "categoryId": 101648,
              "categoryName": "Vehicle Front",
              "level": 2,
              "children": {
                "Projecteurs principaux / composants": {
                  "categoryId": null,
                  "categoryName": "Projecteurs principaux / composants",
                  "level": 4,
                  "children": {
                    "Kit de projecteurs principaux": {
                      "categoryId": 101656,
                      "categoryName": "Headlight/Parts",
                      "level": 3,
                      "children": {
                        "Projecteurs principaux / à insérer": {
                          "categoryId": null,
                          "categoryName": "Projecteurs principaux / à insérer",
                          "level": 6,
                          "children": {
                            "Kit de projecteurs principaux": {
                              "categoryId": 101657,
                              "categoryName": "Headlight/Insert",
                              "level": 4,
                              "children": [],
                              "productId": 3175
                            }
                          }
                        }
                      },
                      "productId": 3175
                    }
                  }
                }
              },
              "productId": 3175
            }
          }
        },
        "Projecteurs principaux / composants": {
          "categoryId": null,
          "categoryName": "Projecteurs principaux / composants",
          "level": 2,
          "children": {
            "Kit de projecteurs principaux": {
              "categoryId": 101465,
              "categoryName": "Headlight/Parts",
              "level": 2,
              "children": {
                "Projecteurs principaux / à insérer": {
                  "categoryId": null,
                  "categoryName": "Projecteurs principaux / à insérer",
                  "level": 4,
                  "children": {
                    "Kit de projecteurs principaux": {
                      "categoryId": 101466,
                      "categoryName": "Headlight/Insert",
                      "level": 3,
                      "children": [],
                      "productId": 3175
                    }
                  }
                }
              },
              "productId": 3175
            }
          }
        }
      }
    },
    "Système électrique": {
      "categoryId": 100010,
      "categoryName": "Système électrique",
      "level": 1,
      "children": {
        "Projecteurs principaux / composants": {
          "categoryId": null,
          "categoryName": "Projecteurs principaux / composants",
          "level": 2,
          "children": {
            "Kit de projecteurs principaux": {
              "categoryId": 100143,
              "categoryName": "Headlight/Parts",
              "level": 2,
              "children": {
                "Projecteurs principaux / à insérer": {
                  "categoryId": null,
                  "categoryName": "Projecteurs principaux / à insérer",
                  "level": 4,
                  "children": {
                    "Kit de projecteurs principaux": {
                      "categoryId": 100433,
                      "categoryName": "Headlight/Insert",
                      "level": 3,
                      "children": [],
                      "productId": 3175
                    }
                  }
                }
              },
              "productId": 3175
            }
          }
        }
      }
    }
  },
  "arborescenceText": "├── Carrosserie [ID: 100001] (Niveau 1)\n│   ├── Avant du véhicule (Niveau 2)\n│   │   └── Vehicle Front [ID: 101648] (Niveau 2) → ProductId: 3175\n│   │       └── Projecteurs principaux / composants (Niveau 4)\n│   │           └── Headlight/Parts [ID: 101656] (Niveau 3) → ProductId: 3175\n│   │               └── Projecteurs principaux / à insérer (Niveau 6)\n│   │                   └── Headlight/Insert [ID: 101657] (Niveau 4) → ProductId: 3175\n│   └── Projecteurs principaux / composants (Niveau 2)\n│       └── Headlight/Parts [ID: 101465] (Niveau 2) → ProductId: 3175\n│           └── Projecteurs principaux / à insérer (Niveau 4)\n│               └── Headlight/Insert [ID: 101466] (Niveau 3) → ProductId: 3175\n\n└── Système électrique [ID: 100010] (Niveau 1)\n    └── Projecteurs principaux / composants (Niveau 2)\n        └── Headlight/Parts [ID: 100143] (Niveau 2) → ProductId: 3175\n            └── Projecteurs principaux / à insérer (Niveau 4)\n                └── Headlight/Insert [ID: 100433] (Niveau 3) → ProductId: 3175",
  "arborescencePaths": [
    {
      "path": [
        "Carrosserie",
        "Avant du véhicule",
        "Vehicle Front"
      ],
      "categoryIds": [
        100001,
        null,
        101648
      ],
      "finalCategoryId": 101648,
      "productId": 3175
    },
    {
      "path": [
        "Carrosserie",
        "Projecteurs principaux / composants",
        "Headlight/Parts"
      ],
      "categoryIds": [
        100001,
        null,
        101465
      ],
      "finalCategoryId": 101465,
      "productId": 3175
    },
    {
      "path": [
        "Système électrique",
        "Projecteurs principaux / composants",
        "Headlight/Parts"
      ],
      "categoryIds": [
        100010,
        null,
        100143
      ],
      "finalCategoryId": 100143,
      "productId": 3175
    }
  ],
  "productIdsInArbo": [
    3175
  ],
  "matchedProductIds": [
    3175
  ]
}