{
  "productName": "Kit de bagues d'étanchéité, moteur",
  "searchText": "Kit de bagues d'étanchéité, moteur",
  "found": true,
  "hasMatch": true,
  "timestamp": "2025-12-02T20:58:41.465Z",
  "productId": 3874,
  "arborescence": {
    "Moteur": {
      "categoryId": 100002,
      "categoryName": "Moteur",
      "level": 1,
      "children": {
        "Culasse / pieces de montage": {
          "categoryId": null,
          "categoryName": "Culasse / pieces de montage",
          "level": 2,
          "children": {
            "Kit de bagues d'étanchéité, moteur": {
              "categoryId": 100373,
              "categoryName": "Cylinder Head/Attachment Parts",
              "level": 2,
              "children": {
                "Joints toriques": {
                  "categoryId": null,
                  "categoryName": "Joints toriques",
                  "level": 4,
                  "children": {
                    "Kit de bagues d'étanchéité, moteur": {
                      "categoryId": 102778,
                      "categoryName": "Shaft Seal Rings",
                      "level": 3,
                      "children": [],
                      "productId": 3874
                    }
                  }
                }
              },
              "productId": 3874
            }
          }
        },
        "Joints": {
          "categoryId": null,
          "categoryName": "Joints",
          "level": 2,
          "children": {
            "Kit de bagues d'étanchéité, moteur": {
              "categoryId": 100223,
              "categoryName": "Gaskets",
              "level": 2,
              "children": {
                "Kit-/bagues d'étanchéité": {
                  "categoryId": null,
                  "categoryName": "Kit-/bagues d'étanchéité",
                  "level": 4,
                  "children": {
                    "Kit de bagues d'étanchéité, moteur": {
                      "categoryId": 100789,
                      "categoryName": "Shaft Seal/Set",
                      "level": 3,
                      "children": [],
                      "productId": 3874
                    }
                  }
                }
              },
              "productId": 3874
            }
          }
        },
        "Système bielle-manivelle": {
          "categoryId": null,
          "categoryName": "Système bielle-manivelle",
          "level": 2,
          "children": {
            "Kit de bagues d'étanchéité, moteur": {
              "categoryId": 100515,
              "categoryName": "Crankshaft Drive",
              "level": 2,
              "children": {
                "Kit-/bague d'étanchéité d'arbre radial": {
                  "categoryId": null,
                  "categoryName": "Kit-/bague d'étanchéité d'arbre radial",
                  "level": 4,
                  "children": {
                    "Kit de bagues d'étanchéité, moteur": {
                      "categoryId": 100521,
                      "categoryName": "Radial Shaft Seal/Set",
                      "level": 3,
                      "children": [],
                      "productId": 3874
                    }
                  }
                }
              },
              "productId": 3874
            }
          }
        }
      }
    }
  },
  "arborescenceText": "└── Moteur [ID: 100002] (Niveau 1)\n    ├── Culasse / pieces de montage (Niveau 2)\n    │   └── Cylinder Head/Attachment Parts [ID: 100373] (Niveau 2) → ProductId: 3874\n    │       └── Joints toriques (Niveau 4)\n    │           └── Shaft Seal Rings [ID: 102778] (Niveau 3) → ProductId: 3874\n    ├── Joints (Niveau 2)\n    │   └── Gaskets [ID: 100223] (Niveau 2) → ProductId: 3874\n    │       └── Kit-/bagues d'étanchéité (Niveau 4)\n    │           └── Shaft Seal/Set [ID: 100789] (Niveau 3) → ProductId: 3874\n    └── Système bielle-manivelle (Niveau 2)\n        └── Crankshaft Drive [ID: 100515] (Niveau 2) → ProductId: 3874\n            └── Kit-/bague d'étanchéité d'arbre radial (Niveau 4)\n                └── Radial Shaft Seal/Set [ID: 100521] (Niveau 3) → ProductId: 3874",
  "arborescencePaths": [
    {
      "path": [
        "Moteur",
        "Culasse / pieces de montage",
        "Cylinder Head/Attachment Parts"
      ],
      "categoryIds": [
        100002,
        null,
        100373
      ],
      "finalCategoryId": 100373,
      "productId": 3874
    },
    {
      "path": [
        "Moteur",
        "Joints",
        "Gaskets"
      ],
      "categoryIds": [
        100002,
        null,
        100223
      ],
      "finalCategoryId": 100223,
      "productId": 3874
    },
    {
      "path": [
        "Moteur",
        "Système bielle-manivelle",
        "Crankshaft Drive"
      ],
      "categoryIds": [
        100002,
        null,
        100515
      ],
      "finalCategoryId": 100515,
      "productId": 3874
    }
  ],
  "productIdsInArbo": [
    3874
  ],
  "matchedProductIds": [
    3874
  ]
}