{
  "productName": "Kit de réparation, compresseur",
  "searchText": "Kit de réparation, compresseur",
  "found": true,
  "hasMatch": true,
  "timestamp": "2025-12-02T21:04:09.905Z",
  "productId": 4974,
  "arborescence": {
    "Échappement": {
      "categoryId": 100004,
      "categoryName": "Échappement",
      "level": 1,
      "children": {
        "Turbocompresseur": {
          "categoryId": null,
          "categoryName": "Turbocompresseur",
          "level": 2,
          "children": {
            "Kit de réparation, compresseur": {
              "categoryId": 100872,
              "categoryName": "Charger",
              "level": 2,
              "children": [],
              "productId": 4974
            }
          }
        }
      }
    },
    "Moteur": {
      "categoryId": 100002,
      "categoryName": "Moteur",
      "level": 1,
      "children": {
        "Alimentation en air": {
          "categoryId": null,
          "categoryName": "Alimentation en air",
          "level": 2,
          "children": {
            "Kit de réparation, compresseur": {
              "categoryId": 100383,
              "categoryName": "Air Supply",
              "level": 2,
              "children": {
                "Suralimentation": {
                  "categoryId": null,
                  "categoryName": "Suralimentation",
                  "level": 4,
                  "children": {
                    "Kit de réparation, compresseur": {
                      "categoryId": 100390,
                      "categoryName": "Charging (supercharged/turbocharged)",
                      "level": 3,
                      "children": {
                        "Compresseur/composants": {
                          "categoryId": null,
                          "categoryName": "Compresseur/composants",
                          "level": 6,
                          "children": {
                            "Kit de réparation, compresseur": {
                              "categoryId": 100391,
                              "categoryName": "Charger/-parts",
                              "level": 4,
                              "children": [],
                              "productId": 4974
                            }
                          }
                        }
                      },
                      "productId": 4974
                    }
                  }
                }
              },
              "productId": 4974
            }
          }
        }
      }
    },
    "Suspension/Amortissement": {
      "categoryId": 100011,
      "categoryName": "Suspension/Amortissement",
      "level": 1,
      "children": {
        "Suspension pneumatique": {
          "categoryId": null,
          "categoryName": "Suspension pneumatique",
          "level": 2,
          "children": {
            "Kit de réparation, compresseur d'air comprimé": {
              "categoryId": 101884,
              "categoryName": "Air Suspension",
              "level": 2,
              "children": [],
              "productId": 334
            }
          }
        }
      }
    }
  },
  "arborescenceText": "├── Échappement [ID: 100004] (Niveau 1)\n│   └── Turbocompresseur (Niveau 2)\n│       └── Charger [ID: 100872] (Niveau 2) → ProductId: 4974\n\n├── Moteur [ID: 100002] (Niveau 1)\n│   └── Alimentation en air (Niveau 2)\n│       └── Air Supply [ID: 100383] (Niveau 2) → ProductId: 4974\n│           └── Suralimentation (Niveau 4)\n│               └── Charging (supercharged/turbocharged) [ID: 100390] (Niveau 3) → ProductId: 4974\n│                   └── Compresseur/composants (Niveau 6)\n│                       └── Charger/-parts [ID: 100391] (Niveau 4) → ProductId: 4974\n\n└── Suspension/Amortissement [ID: 100011] (Niveau 1)\n    └── Suspension pneumatique (Niveau 2)\n        └── Air Suspension [ID: 101884] (Niveau 2) → ProductId: 334",
  "arborescencePaths": [
    {
      "path": [
        "Échappement",
        "Turbocompresseur",
        "Charger"
      ],
      "categoryIds": [
        100004,
        null,
        100872
      ],
      "finalCategoryId": 100872,
      "productId": 4974
    },
    {
      "path": [
        "Moteur",
        "Alimentation en air",
        "Air Supply"
      ],
      "categoryIds": [
        100002,
        null,
        100383
      ],
      "finalCategoryId": 100383,
      "productId": 4974
    },
    {
      "path": [
        "Suspension/Amortissement",
        "Suspension pneumatique",
        "Air Suspension"
      ],
      "categoryIds": [
        100011,
        null,
        101884
      ],
      "finalCategoryId": 101884,
      "productId": 334
    }
  ],
  "productIdsInArbo": [
    334,
    4974
  ],
  "matchedProductIds": [
    4974
  ]
}