{
  "productName": "Kit d'accessoires",
  "searchText": "Kit d'accessoires",
  "found": true,
  "hasMatch": false,
  "timestamp": "2025-12-02T20:57:21.742Z",
  "productId": 4385,
  "arborescence": {
    "Direction": {
      "categoryId": 100012,
      "categoryName": "Direction",
      "level": 1,
      "children": {
        "Crémaillère de direction/pompe": {
          "categoryId": null,
          "categoryName": "Crémaillère de direction/pompe",
          "level": 2,
          "children": {
            "Kit supplémentaire, crémaillière de distribution": {
              "categoryId": 100199,
              "categoryName": "Steering Gear/Pump",
              "level": 2,
              "children": [],
              "productId": 3081
            }
          }
        }
      }
    },
    "Dispositif de freinage": {
      "categoryId": 100006,
      "categoryName": "Dispositif de freinage",
      "level": 1,
      "children": {
        "Étrier de frein": {
          "categoryId": null,
          "categoryName": "Étrier de frein",
          "level": 2,
          "children": {
            "Kit d'accessoires, étrier de frein": {
              "categoryId": 100027,
              "categoryName": "Brake Caliper",
              "level": 2,
              "children": {
                "Composants": {
                  "categoryId": null,
                  "categoryName": "Composants",
                  "level": 4,
                  "children": {
                    "Kit d'accessoires, étrier de frein": {
                      "categoryId": 100806,
                      "categoryName": "Brake Caliper Parts",
                      "level": 3,
                      "children": [],
                      "productId": 2513
                    }
                  }
                }
              },
              "productId": 2513
            }
          }
        },
        "Frein à disque": {
          "categoryId": null,
          "categoryName": "Frein à disque",
          "level": 2,
          "children": {
            "Kit d'acc., kit plaquettes de frein, disque frein/stationnem": {
              "categoryId": 100626,
              "categoryName": "Disc Brake",
              "level": 2,
              "children": {
                "Accessoires / composants": {
                  "categoryId": null,
                  "categoryName": "Accessoires / composants",
                  "level": 4,
                  "children": {
                    "Kit d'acc., kit plaquettes de frein, disque frein/stationnem": {
                      "categoryId": 100630,
                      "categoryName": "Accessories/Parts",
                      "level": 3,
                      "children": [],
                      "productId": 4623
                    }
                  }
                }
              },
              "productId": 4623
            },
            "Kit d'accessoires, plaquette de frein à disque": {
              "categoryId": 100626,
              "categoryName": "Disc Brake",
              "level": 2,
              "children": {
                "Accessoires / composants": {
                  "categoryId": null,
                  "categoryName": "Accessoires / composants",
                  "level": 4,
                  "children": {
                    "Kit d'accessoires, plaquette de frein à disque": {
                      "categoryId": 100630,
                      "categoryName": "Accessories/Parts",
                      "level": 3,
                      "children": [],
                      "productId": 1164
                    }
                  }
                }
              },
              "productId": 1164
            }
          }
        },
        "Frein à tambour": {
          "categoryId": null,
          "categoryName": "Frein à tambour",
          "level": 2,
          "children": {
            "Kit d'accessoires, mâchoire de frein": {
              "categoryId": 100627,
              "categoryName": "Drum Brake",
              "level": 2,
              "children": {
                "Accessoires / composants": {
                  "categoryId": null,
                  "categoryName": "Accessoires / composants",
                  "level": 4,
                  "children": {
                    "Kit d'accessoires, mâchoire de frein": {
                      "categoryId": 100634,
                      "categoryName": "Accessories/Parts",
                      "level": 3,
                      "children": [],
                      "productId": 1502
                    }
                  }
                }
              },
              "productId": 1502
            },
            "Kit d'accessoires, mâchoires de frein de stationnement": {
              "categoryId": 100627,
              "categoryName": "Drum Brake",
              "level": 2,
              "children": {
                "Freins de stationnement": {
                  "categoryId": null,
                  "categoryName": "Freins de stationnement",
                  "level": 4,
                  "children": {
                    "Kit d'accessoires, mâchoires de frein de stationnement": {
                      "categoryId": 102964,
                      "categoryName": "Handbrake",
                      "level": 3,
                      "children": [],
                      "productId": 1337
                    }
                  }
                }
              },
              "productId": 1337
            },
            "Kit d'accessoires, plaquette de frein": {
              "categoryId": 100627,
              "categoryName": "Drum Brake",
              "level": 2,
              "children": {
                "Accessoires / composants": {
                  "categoryId": null,
                  "categoryName": "Accessoires / composants",
                  "level": 4,
                  "children": {
                    "Kit d'accessoires, plaquette de frein": {
                      "categoryId": 100634,
                      "categoryName": "Accessories/Parts",
                      "level": 3,
                      "children": [],
                      "productId": 2529
                    }
                  }
                }
              },
              "productId": 2529
            }
          }
        },
        "Freins de stationnement": {
          "categoryId": null,
          "categoryName": "Freins de stationnement",
          "level": 2,
          "children": {
            "Kit d'acc., kit plaquettes de frein, disque frein/stationnem": {
              "categoryId": 100034,
              "categoryName": "Handbrake",
              "level": 2,
              "children": [],
              "productId": 4623
            },
            "Kit d'accessoires, mâchoires de frein de stationnement": {
              "categoryId": 100034,
              "categoryName": "Handbrake",
              "level": 2,
              "children": [],
              "productId": 1337
            }
          }
        }
      }
    },
    "Embrayage / composants": {
      "categoryId": 100050,
      "categoryName": "Embrayage / composants",
      "level": 1,
      "children": {
        "Butée d’embrayage/butée hydraulique": {
          "categoryId": null,
          "categoryName": "Butée d’embrayage/butée hydraulique",
          "level": 2,
          "children": {
            "Jeu d'accessoires, fourchette d’embrayage": {
              "categoryId": 100054,
              "categoryName": "Clutch Release Bearing/Central Slave Cylinder",
              "level": 2,
              "children": {
                "Fourchette de débrayage": {
                  "categoryId": null,
                  "categoryName": "Fourchette de débrayage",
                  "level": 4,
                  "children": {
                    "Jeu d'accessoires, fourchette d’embrayage": {
                      "categoryId": 102080,
                      "categoryName": "Release Fork",
                      "level": 3,
                      "children": [],
                      "productId": 60883
                    }
                  }
                }
              },
              "productId": 60883
            }
          }
        }
      }
    },
    "Moteur": {
      "categoryId": 100002,
      "categoryName": "Moteur",
      "level": 1,
      "children": {
        "Distribution moteur": {
          "categoryId": null,
          "categoryName": "Distribution moteur",
          "level": 2,
          "children": {
            "Jeu d'accessoires, chaîne de distribution": {
              "categoryId": 100003,
              "categoryName": "Engine Timing",
              "level": 2,
              "children": {
                "Chaîne de distribution/tension/guidage": {
                  "categoryId": null,
                  "categoryName": "Chaîne de distribution/tension/guidage",
                  "level": 4,
                  "children": {
                    "Jeu d'accessoires, chaîne de distribution": {
                      "categoryId": 100403,
                      "categoryName": "Timing Chain/Tensioner/Guide",
                      "level": 3,
                      "children": {
                        "Chaîne de distribution": {
                          "categoryId": null,
                          "categoryName": "Chaîne de distribution",
                          "level": 6,
                          "children": {
                            "Jeu d'accessoires, chaîne de distribution": {
                              "categoryId": 100411,
                              "categoryName": "Timing Chain",
                              "level": 4,
                              "children": [],
                              "productId": 61333
                            }
                          }
                        }
                      },
                      "productId": 61333
                    }
                  }
                }
              },
              "productId": 61333
            },
            "Kit d'accessoires, culbuteur": {
              "categoryId": 100003,
              "categoryName": "Engine Timing",
              "level": 2,
              "children": {
                "Culbuteur/Levier oscillant": {
                  "categoryId": null,
                  "categoryName": "Culbuteur/Levier oscillant",
                  "level": 4,
                  "children": {
                    "Kit d'accessoires, culbuteur": {
                      "categoryId": 100398,
                      "categoryName": "Rocker Arm/Finger Follower",
                      "level": 3,
                      "children": [],
                      "productId": 2115
                    }
                  }
                },
                "Soupape / réglage de soupape": {
                  "categoryId": null,
                  "categoryName": "Soupape / réglage de soupape",
                  "level": 4,
                  "children": {
                    "Kit d'accessoires, culbuteur": {
                      "categoryId": 100422,
                      "categoryName": "Valve Train",
                      "level": 3,
                      "children": {
                        "Réglage de soupape": {
                          "categoryId": null,
                          "categoryName": "Réglage de soupape",
                          "level": 6,
                          "children": {
                            "Kit d'accessoires, culbuteur": {
                              "categoryId": 100424,
                              "categoryName": "Valve Actuation",
                              "level": 4,
                              "children": [],
                              "productId": 2115
                            }
                          }
                        }
                      },
                      "productId": 2115
                    }
                  }
                }
              },
              "productId": 2115
            },
            "Kit d'accessoires, levier oscillant": {
              "categoryId": 100003,
              "categoryName": "Engine Timing",
              "level": 2,
              "children": {
                "Culbuteur/Levier oscillant": {
                  "categoryId": null,
                  "categoryName": "Culbuteur/Levier oscillant",
                  "level": 4,
                  "children": {
                    "Kit d'accessoires, levier oscillant": {
                      "categoryId": 100398,
                      "categoryName": "Rocker Arm/Finger Follower",
                      "level": 3,
                      "children": [],
                      "productId": 3320
                    }
                  }
                },
                "Soupape / réglage de soupape": {
                  "categoryId": null,
                  "categoryName": "Soupape / réglage de soupape",
                  "level": 4,
                  "children": {
                    "Kit d'accessoires, levier oscillant": {
                      "categoryId": 100422,
                      "categoryName": "Valve Train",
                      "level": 3,
                      "children": {
                        "Réglage de soupape": {
                          "categoryId": null,
                          "categoryName": "Réglage de soupape",
                          "level": 6,
                          "children": {
                            "Kit d'accessoires, levier oscillant": {
                              "categoryId": 100424,
                              "categoryName": "Valve Actuation",
                              "level": 4,
                              "children": [],
                              "productId": 3320
                            }
                          }
                        }
                      },
                      "productId": 3320
                    }
                  }
                }
              },
              "productId": 3320
            }
          }
        }
      }
    },
    "Suspension/Amortissement": {
      "categoryId": 100011,
      "categoryName": "Suspension/Amortissement",
      "level": 1,
      "children": {
        "Outils": {
          "categoryId": null,
          "categoryName": "Outils",
          "level": 2,
          "children": {
            "Kit d'accessoires, tendeur de ressort": {
              "categoryId": 104406,
              "categoryName": "Tools",
              "level": 2,
              "children": [],
              "productId": 9347
            }
          }
        }
      }
    }
  },
  "arborescenceText": "├── Direction [ID: 100012] (Niveau 1)\n│   └── Crémaillère de direction/pompe (Niveau 2)\n│       └── Steering Gear/Pump [ID: 100199] (Niveau 2) → ProductId: 3081\n\n├── Dispositif de freinage [ID: 100006] (Niveau 1)\n│   ├── Étrier de frein (Niveau 2)\n│   │   └── Brake Caliper [ID: 100027] (Niveau 2) → ProductId: 2513\n│   │       └── Composants (Niveau 4)\n│   │           └── Brake Caliper Parts [ID: 100806] (Niveau 3) → ProductId: 2513\n│   ├── Frein à disque (Niveau 2)\n│   │   ├── Disc Brake [ID: 100626] (Niveau 2) → ProductId: 4623\n│   │   │   └── Accessoires / composants (Niveau 4)\n│   │   │       └── Accessories/Parts [ID: 100630] (Niveau 3) → ProductId: 4623\n│   │   └── Disc Brake [ID: 100626] (Niveau 2) → ProductId: 1164\n│   │       └── Accessoires / composants (Niveau 4)\n│   │           └── Accessories/Parts [ID: 100630] (Niveau 3) → ProductId: 1164\n│   ├── Frein à tambour (Niveau 2)\n│   │   ├── Drum Brake [ID: 100627] (Niveau 2) → ProductId: 1502\n│   │   │   └── Accessoires / composants (Niveau 4)\n│   │   │       └── Accessories/Parts [ID: 100634] (Niveau 3) → ProductId: 1502\n│   │   ├── Drum Brake [ID: 100627] (Niveau 2) → ProductId: 1337\n│   │   │   └── Freins de stationnement (Niveau 4)\n│   │   │       └── Handbrake [ID: 102964] (Niveau 3) → ProductId: 1337\n│   │   └── Drum Brake [ID: 100627] (Niveau 2) → ProductId: 2529\n│   │       └── Accessoires / composants (Niveau 4)\n│   │           └── Accessories/Parts [ID: 100634] (Niveau 3) → ProductId: 2529\n│   └── Freins de stationnement (Niveau 2)\n│       ├── Handbrake [ID: 100034] (Niveau 2) → ProductId: 4623\n│       └── Handbrake [ID: 100034] (Niveau 2) → ProductId: 1337\n\n├── Embrayage / composants [ID: 100050] (Niveau 1)\n│   └── Butée d’embrayage/butée hydraulique (Niveau 2)\n│       └── Clutch Release Bearing/Central Slave Cylinder [ID: 100054] (Niveau 2) → ProductId: 60883\n│           └── Fourchette de débrayage (Niveau 4)\n│               └── Release Fork [ID: 102080] (Niveau 3) → ProductId: 60883\n\n├── Moteur [ID: 100002] (Niveau 1)\n│   └── Distribution moteur (Niveau 2)\n│       ├── Engine Timing [ID: 100003] (Niveau 2) → ProductId: 61333\n│       │   └── Chaîne de distribution/tension/guidage (Niveau 4)\n│       │       └── Timing Chain/Tensioner/Guide [ID: 100403] (Niveau 3) → ProductId: 61333\n│       │           └── Chaîne de distribution (Niveau 6)\n│       │               └── Timing Chain [ID: 100411] (Niveau 4) → ProductId: 61333\n│       ├── Engine Timing [ID: 100003] (Niveau 2) → ProductId: 2115\n│       │   ├── Culbuteur/Levier oscillant (Niveau 4)\n│       │   │   └── Rocker Arm/Finger Follower [ID: 100398] (Niveau 3) → ProductId: 2115\n│       │   └── Soupape / réglage de soupape (Niveau 4)\n│       │       └── Valve Train [ID: 100422] (Niveau 3) → ProductId: 2115\n│       │           └── Réglage de soupape (Niveau 6)\n│       │               └── Valve Actuation [ID: 100424] (Niveau 4) → ProductId: 2115\n│       └── Engine Timing [ID: 100003] (Niveau 2) → ProductId: 3320\n│           ├── Culbuteur/Levier oscillant (Niveau 4)\n│           │   └── Rocker Arm/Finger Follower [ID: 100398] (Niveau 3) → ProductId: 3320\n│           └── Soupape / réglage de soupape (Niveau 4)\n│               └── Valve Train [ID: 100422] (Niveau 3) → ProductId: 3320\n│                   └── Réglage de soupape (Niveau 6)\n│                       └── Valve Actuation [ID: 100424] (Niveau 4) → ProductId: 3320\n\n└── Suspension/Amortissement [ID: 100011] (Niveau 1)\n    └── Outils (Niveau 2)\n        └── Tools [ID: 104406] (Niveau 2) → ProductId: 9347",
  "arborescencePaths": [
    {
      "path": [
        "Direction",
        "Crémaillère de direction/pompe",
        "Steering Gear/Pump"
      ],
      "categoryIds": [
        100012,
        null,
        100199
      ],
      "finalCategoryId": 100199,
      "productId": 3081
    },
    {
      "path": [
        "Dispositif de freinage",
        "Étrier de frein",
        "Brake Caliper"
      ],
      "categoryIds": [
        100006,
        null,
        100027
      ],
      "finalCategoryId": 100027,
      "productId": 2513
    },
    {
      "path": [
        "Dispositif de freinage",
        "Frein à disque",
        "Disc Brake"
      ],
      "categoryIds": [
        100006,
        null,
        100626
      ],
      "finalCategoryId": 100626,
      "productId": 4623
    },
    {
      "path": [
        "Dispositif de freinage",
        "Frein à disque",
        "Disc Brake"
      ],
      "categoryIds": [
        100006,
        null,
        100626
      ],
      "finalCategoryId": 100626,
      "productId": 1164
    },
    {
      "path": [
        "Dispositif de freinage",
        "Frein à tambour",
        "Drum Brake"
      ],
      "categoryIds": [
        100006,
        null,
        100627
      ],
      "finalCategoryId": 100627,
      "productId": 1502
    },
    {
      "path": [
        "Dispositif de freinage",
        "Frein à tambour",
        "Drum Brake"
      ],
      "categoryIds": [
        100006,
        null,
        100627
      ],
      "finalCategoryId": 100627,
      "productId": 1337
    },
    {
      "path": [
        "Dispositif de freinage",
        "Frein à tambour",
        "Drum Brake"
      ],
      "categoryIds": [
        100006,
        null,
        100627
      ],
      "finalCategoryId": 100627,
      "productId": 2529
    },
    {
      "path": [
        "Dispositif de freinage",
        "Freins de stationnement",
        "Handbrake"
      ],
      "categoryIds": [
        100006,
        null,
        100034
      ],
      "finalCategoryId": 100034,
      "productId": 4623
    },
    {
      "path": [
        "Dispositif de freinage",
        "Freins de stationnement",
        "Handbrake"
      ],
      "categoryIds": [
        100006,
        null,
        100034
      ],
      "finalCategoryId": 100034,
      "productId": 1337
    },
    {
      "path": [
        "Embrayage / composants",
        "Butée d’embrayage/butée hydraulique",
        "Clutch Release Bearing/Central Slave Cylinder"
      ],
      "categoryIds": [
        100050,
        null,
        100054
      ],
      "finalCategoryId": 100054,
      "productId": 60883
    },
    {
      "path": [
        "Moteur",
        "Distribution moteur",
        "Engine Timing"
      ],
      "categoryIds": [
        100002,
        null,
        100003
      ],
      "finalCategoryId": 100003,
      "productId": 61333
    },
    {
      "path": [
        "Moteur",
        "Distribution moteur",
        "Engine Timing"
      ],
      "categoryIds": [
        100002,
        null,
        100003
      ],
      "finalCategoryId": 100003,
      "productId": 2115
    },
    {
      "path": [
        "Moteur",
        "Distribution moteur",
        "Engine Timing"
      ],
      "categoryIds": [
        100002,
        null,
        100003
      ],
      "finalCategoryId": 100003,
      "productId": 3320
    },
    {
      "path": [
        "Suspension/Amortissement",
        "Outils",
        "Tools"
      ],
      "categoryIds": [
        100011,
        null,
        104406
      ],
      "finalCategoryId": 104406,
      "productId": 9347
    }
  ],
  "productIdsInArbo": [
    1164,
    1337,
    1502,
    2115,
    2513,
    2529,
    3081,
    3320,
    4623,
    9347,
    60883,
    61333
  ],
  "closestProductIds": [
    {
      "productId": 1164,
      "productName": "Kit d'accessoires, plaquette de frein à disque"
    },
    {
      "productId": 1337,
      "productName": "Kit d'accessoires, mâchoires de frein de stationnement"
    },
    {
      "productId": 1502,
      "productName": "Kit d'accessoires, mâchoire de frein"
    },
    {
      "productId": 2115,
      "productName": "Kit d'accessoires, culbuteur"
    },
    {
      "productId": 2513,
      "productName": "Kit d'accessoires, étrier de frein"
    }
  ]
}