{
  "productName": "Levier de vitesse",
  "searchText": "Levier de vitesse",
  "found": true,
  "hasMatch": true,
  "timestamp": "2025-12-02T21:11:46.421Z",
  "productId": 1650,
  "arborescence": {
    "Boîte de vitesses": {
      "categoryId": 100238,
      "categoryName": "Boîte de vitesses",
      "level": 1,
      "children": {
        "Boîte de vitesse automatique": {
          "categoryId": null,
          "categoryName": "Boîte de vitesse automatique",
          "level": 2,
          "children": {
            "Douille de réparation, levier de vitesse (BV automatique)": {
              "categoryId": 100240,
              "categoryName": "Automatic Transmission",
              "level": 2,
              "children": {
                "Réparation/entretien": {
                  "categoryId": null,
                  "categoryName": "Réparation/entretien",
                  "level": 4,
                  "children": {
                    "Douille de réparation, levier de vitesse (BV automatique)": {
                      "categoryId": 101810,
                      "categoryName": "Repair/Maintenance",
                      "level": 3,
                      "children": [],
                      "productId": 8270
                    }
                  }
                }
              },
              "productId": 8270
            },
            "Douille, levier de vitesse": {
              "categoryId": 100240,
              "categoryName": "Automatic Transmission",
              "level": 2,
              "children": {
                "Boîtier/composants": {
                  "categoryId": null,
                  "categoryName": "Boîtier/composants",
                  "level": 4,
                  "children": {
                    "Douille, levier de vitesse": {
                      "categoryId": 100775,
                      "categoryName": "Transmission Housing/Parts",
                      "level": 3,
                      "children": [],
                      "productId": 3558
                    }
                  }
                }
              },
              "productId": 3558
            }
          }
        },
        "Boîte de vitesses manuelle": {
          "categoryId": null,
          "categoryName": "Boîte de vitesses manuelle",
          "level": 2,
          "children": {
            "Cadre, garniture de levier de vitesse": {
              "categoryId": 100239,
              "categoryName": "Manual Transmission",
              "level": 2,
              "children": {
                "Commande de boîte de vitesses": {
                  "categoryId": null,
                  "categoryName": "Commande de boîte de vitesses",
                  "level": 4,
                  "children": {
                    "Cadre, garniture de levier de vitesse": {
                      "categoryId": 101808,
                      "categoryName": "Transmission Control",
                      "level": 3,
                      "children": [],
                      "productId": 5640
                    }
                  }
                }
              },
              "productId": 5640
            },
            "Douille de réparation, levier de vitesse (boîte manuelle)": {
              "categoryId": 100239,
              "categoryName": "Manual Transmission",
              "level": 2,
              "children": {
                "Réparation/entretien": {
                  "categoryId": null,
                  "categoryName": "Réparation/entretien",
                  "level": 4,
                  "children": {
                    "Douille de réparation, levier de vitesse (boîte manuelle)": {
                      "categoryId": 101809,
                      "categoryName": "Repair/Maintenance",
                      "level": 3,
                      "children": [],
                      "productId": 8945
                    }
                  }
                }
              },
              "productId": 8945
            },
            "Douille, levier de vitesse": {
              "categoryId": 100239,
              "categoryName": "Manual Transmission",
              "level": 2,
              "children": {
                "Commande de boîte de vitesses": {
                  "categoryId": null,
                  "categoryName": "Commande de boîte de vitesses",
                  "level": 4,
                  "children": {
                    "Douille, levier de vitesse": {
                      "categoryId": 101808,
                      "categoryName": "Transmission Control",
                      "level": 3,
                      "children": [],
                      "productId": 1776
                    }
                  }
                }
              },
              "productId": 1776
            },
            "Guidage, levier de vitesse": {
              "categoryId": 100239,
              "categoryName": "Manual Transmission",
              "level": 2,
              "children": {
                "Commande de boîte de vitesses": {
                  "categoryId": null,
                  "categoryName": "Commande de boîte de vitesses",
                  "level": 4,
                  "children": {
                    "Guidage, levier de vitesse": {
                      "categoryId": 101808,
                      "categoryName": "Transmission Control",
                      "level": 3,
                      "children": [],
                      "productId": 5746
                    }
                  }
                }
              },
              "productId": 5746
            },
            "Guide, levier de vitesses": {
              "categoryId": 100239,
              "categoryName": "Manual Transmission",
              "level": 2,
              "children": {
                "Commande de boîte de vitesses": {
                  "categoryId": null,
                  "categoryName": "Commande de boîte de vitesses",
                  "level": 4,
                  "children": {
                    "Guide, levier de vitesses": {
                      "categoryId": 101808,
                      "categoryName": "Transmission Control",
                      "level": 3,
                      "children": [],
                      "productId": 5752
                    }
                  }
                }
              },
              "productId": 5752
            },
            "Levier de vitesse": {
              "categoryId": 100239,
              "categoryName": "Manual Transmission",
              "level": 2,
              "children": {
                "Commande de boîte de vitesses": {
                  "categoryId": null,
                  "categoryName": "Commande de boîte de vitesses",
                  "level": 4,
                  "children": {
                    "Levier de vitesse": {
                      "categoryId": 101808,
                      "categoryName": "Transmission Control",
                      "level": 3,
                      "children": [],
                      "productId": 1650
                    }
                  }
                }
              },
              "productId": 1650
            },
            "Rotule de direction, levier de vitesse": {
              "categoryId": 100239,
              "categoryName": "Manual Transmission",
              "level": 2,
              "children": {
                "Commande de boîte de vitesses": {
                  "categoryId": null,
                  "categoryName": "Commande de boîte de vitesses",
                  "level": 4,
                  "children": {
                    "Rotule de direction, levier de vitesse": {
                      "categoryId": 101808,
                      "categoryName": "Transmission Control",
                      "level": 3,
                      "children": [],
                      "productId": 4148
                    }
                  }
                }
              },
              "productId": 4148
            },
            "Soufflet, goupille/sécurité - levier de vitesse": {
              "categoryId": 100239,
              "categoryName": "Manual Transmission",
              "level": 2,
              "children": {
                "Commande de boîte de vitesses": {
                  "categoryId": null,
                  "categoryName": "Commande de boîte de vitesses",
                  "level": 4,
                  "children": {
                    "Soufflet, goupille/sécurité - levier de vitesse": {
                      "categoryId": 101808,
                      "categoryName": "Transmission Control",
                      "level": 3,
                      "children": [],
                      "productId": 3998
                    }
                  }
                }
              },
              "productId": 3998
            },
            "Soufflet, levier de vitesse": {
              "categoryId": 100239,
              "categoryName": "Manual Transmission",
              "level": 2,
              "children": {
                "Commande de boîte de vitesses": {
                  "categoryId": null,
                  "categoryName": "Commande de boîte de vitesses",
                  "level": 4,
                  "children": {
                    "Soufflet, levier de vitesse": {
                      "categoryId": 101808,
                      "categoryName": "Transmission Control",
                      "level": 3,
                      "children": [],
                      "productId": 5747
                    }
                  }
                }
              },
              "productId": 5747
            },
            "Suspension, levier de vitesse": {
              "categoryId": 100239,
              "categoryName": "Manual Transmission",
              "level": 2,
              "children": {
                "Commande de boîte de vitesses": {
                  "categoryId": null,
                  "categoryName": "Commande de boîte de vitesses",
                  "level": 4,
                  "children": {
                    "Suspension, levier de vitesse": {
                      "categoryId": 101808,
                      "categoryName": "Transmission Control",
                      "level": 3,
                      "children": [],
                      "productId": 4095
                    }
                  }
                }
              },
              "productId": 4095
            }
          }
        },
        "Outils": {
          "categoryId": null,
          "categoryName": "Outils",
          "level": 2,
          "children": {
            "Levier de montage, transmission": {
              "categoryId": 103157,
              "categoryName": "Tools",
              "level": 2,
              "children": [],
              "productId": 9134
            }
          }
        }
      }
    },
    "Moteur": {
      "categoryId": 100002,
      "categoryName": "Moteur",
      "level": 1,
      "children": {
        "Lubrification": {
          "categoryId": null,
          "categoryName": "Lubrification",
          "level": 2,
          "children": {
            "Bague d’étanchéité, timonerie de la boîte de vitesses": {
              "categoryId": 100245,
              "categoryName": "Lubrication",
              "level": 2,
              "children": {
                "Pompe à huile et pièces de montage": {
                  "categoryId": null,
                  "categoryName": "Pompe à huile et pièces de montage",
                  "level": 4,
                  "children": {
                    "Bague d’étanchéité, timonerie de la boîte de vitesses": {
                      "categoryId": 100476,
                      "categoryName": "Oil Pump/Attachment Parts",
                      "level": 3,
                      "children": {
                        "Pompe à huile": {
                          "categoryId": null,
                          "categoryName": "Pompe à huile",
                          "level": 6,
                          "children": {
                            "Bague d’étanchéité, timonerie de la boîte de vitesses": {
                              "categoryId": 100492,
                              "categoryName": "Oil Pump",
                              "level": 4,
                              "children": [],
                              "productId": 8255
                            }
                          }
                        }
                      },
                      "productId": 8255
                    }
                  }
                }
              },
              "productId": 8255
            }
          }
        }
      }
    }
  },
  "arborescenceText": "├── Boîte de vitesses [ID: 100238] (Niveau 1)\n│   ├── Boîte de vitesse automatique (Niveau 2)\n│   │   ├── Automatic Transmission [ID: 100240] (Niveau 2) → ProductId: 8270\n│   │   │   └── Réparation/entretien (Niveau 4)\n│   │   │       └── Repair/Maintenance [ID: 101810] (Niveau 3) → ProductId: 8270\n│   │   └── Automatic Transmission [ID: 100240] (Niveau 2) → ProductId: 3558\n│   │       └── Boîtier/composants (Niveau 4)\n│   │           └── Transmission Housing/Parts [ID: 100775] (Niveau 3) → ProductId: 3558\n│   ├── Boîte de vitesses manuelle (Niveau 2)\n│   │   ├── Manual Transmission [ID: 100239] (Niveau 2) → ProductId: 5640\n│   │   │   └── Commande de boîte de vitesses (Niveau 4)\n│   │   │       └── Transmission Control [ID: 101808] (Niveau 3) → ProductId: 5640\n│   │   ├── Manual Transmission [ID: 100239] (Niveau 2) → ProductId: 8945\n│   │   │   └── Réparation/entretien (Niveau 4)\n│   │   │       └── Repair/Maintenance [ID: 101809] (Niveau 3) → ProductId: 8945\n│   │   ├── Manual Transmission [ID: 100239] (Niveau 2) → ProductId: 1776\n│   │   │   └── Commande de boîte de vitesses (Niveau 4)\n│   │   │       └── Transmission Control [ID: 101808] (Niveau 3) → ProductId: 1776\n│   │   ├── Manual Transmission [ID: 100239] (Niveau 2) → ProductId: 5746\n│   │   │   └── Commande de boîte de vitesses (Niveau 4)\n│   │   │       └── Transmission Control [ID: 101808] (Niveau 3) → ProductId: 5746\n│   │   ├── Manual Transmission [ID: 100239] (Niveau 2) → ProductId: 5752\n│   │   │   └── Commande de boîte de vitesses (Niveau 4)\n│   │   │       └── Transmission Control [ID: 101808] (Niveau 3) → ProductId: 5752\n│   │   ├── Manual Transmission [ID: 100239] (Niveau 2) → ProductId: 1650\n│   │   │   └── Commande de boîte de vitesses (Niveau 4)\n│   │   │       └── Transmission Control [ID: 101808] (Niveau 3) → ProductId: 1650\n│   │   ├── Manual Transmission [ID: 100239] (Niveau 2) → ProductId: 4148\n│   │   │   └── Commande de boîte de vitesses (Niveau 4)\n│   │   │       └── Transmission Control [ID: 101808] (Niveau 3) → ProductId: 4148\n│   │   ├── Manual Transmission [ID: 100239] (Niveau 2) → ProductId: 3998\n│   │   │   └── Commande de boîte de vitesses (Niveau 4)\n│   │   │       └── Transmission Control [ID: 101808] (Niveau 3) → ProductId: 3998\n│   │   ├── Manual Transmission [ID: 100239] (Niveau 2) → ProductId: 5747\n│   │   │   └── Commande de boîte de vitesses (Niveau 4)\n│   │   │       └── Transmission Control [ID: 101808] (Niveau 3) → ProductId: 5747\n│   │   └── Manual Transmission [ID: 100239] (Niveau 2) → ProductId: 4095\n│   │       └── Commande de boîte de vitesses (Niveau 4)\n│   │           └── Transmission Control [ID: 101808] (Niveau 3) → ProductId: 4095\n│   └── Outils (Niveau 2)\n│       └── Tools [ID: 103157] (Niveau 2) → ProductId: 9134\n\n└── Moteur [ID: 100002] (Niveau 1)\n    └── Lubrification (Niveau 2)\n        └── Lubrication [ID: 100245] (Niveau 2) → ProductId: 8255\n            └── Pompe à huile et pièces de montage (Niveau 4)\n                └── Oil Pump/Attachment Parts [ID: 100476] (Niveau 3) → ProductId: 8255\n                    └── Pompe à huile (Niveau 6)\n                        └── Oil Pump [ID: 100492] (Niveau 4) → ProductId: 8255",
  "arborescencePaths": [
    {
      "path": [
        "Boîte de vitesses",
        "Boîte de vitesse automatique",
        "Automatic Transmission"
      ],
      "categoryIds": [
        100238,
        null,
        100240
      ],
      "finalCategoryId": 100240,
      "productId": 8270
    },
    {
      "path": [
        "Boîte de vitesses",
        "Boîte de vitesse automatique",
        "Automatic Transmission"
      ],
      "categoryIds": [
        100238,
        null,
        100240
      ],
      "finalCategoryId": 100240,
      "productId": 3558
    },
    {
      "path": [
        "Boîte de vitesses",
        "Boîte de vitesses manuelle",
        "Manual Transmission"
      ],
      "categoryIds": [
        100238,
        null,
        100239
      ],
      "finalCategoryId": 100239,
      "productId": 5640
    },
    {
      "path": [
        "Boîte de vitesses",
        "Boîte de vitesses manuelle",
        "Manual Transmission"
      ],
      "categoryIds": [
        100238,
        null,
        100239
      ],
      "finalCategoryId": 100239,
      "productId": 8945
    },
    {
      "path": [
        "Boîte de vitesses",
        "Boîte de vitesses manuelle",
        "Manual Transmission"
      ],
      "categoryIds": [
        100238,
        null,
        100239
      ],
      "finalCategoryId": 100239,
      "productId": 1776
    },
    {
      "path": [
        "Boîte de vitesses",
        "Boîte de vitesses manuelle",
        "Manual Transmission"
      ],
      "categoryIds": [
        100238,
        null,
        100239
      ],
      "finalCategoryId": 100239,
      "productId": 5746
    },
    {
      "path": [
        "Boîte de vitesses",
        "Boîte de vitesses manuelle",
        "Manual Transmission"
      ],
      "categoryIds": [
        100238,
        null,
        100239
      ],
      "finalCategoryId": 100239,
      "productId": 5752
    },
    {
      "path": [
        "Boîte de vitesses",
        "Boîte de vitesses manuelle",
        "Manual Transmission"
      ],
      "categoryIds": [
        100238,
        null,
        100239
      ],
      "finalCategoryId": 100239,
      "productId": 1650
    },
    {
      "path": [
        "Boîte de vitesses",
        "Boîte de vitesses manuelle",
        "Manual Transmission"
      ],
      "categoryIds": [
        100238,
        null,
        100239
      ],
      "finalCategoryId": 100239,
      "productId": 4148
    },
    {
      "path": [
        "Boîte de vitesses",
        "Boîte de vitesses manuelle",
        "Manual Transmission"
      ],
      "categoryIds": [
        100238,
        null,
        100239
      ],
      "finalCategoryId": 100239,
      "productId": 3998
    },
    {
      "path": [
        "Boîte de vitesses",
        "Boîte de vitesses manuelle",
        "Manual Transmission"
      ],
      "categoryIds": [
        100238,
        null,
        100239
      ],
      "finalCategoryId": 100239,
      "productId": 5747
    },
    {
      "path": [
        "Boîte de vitesses",
        "Boîte de vitesses manuelle",
        "Manual Transmission"
      ],
      "categoryIds": [
        100238,
        null,
        100239
      ],
      "finalCategoryId": 100239,
      "productId": 4095
    },
    {
      "path": [
        "Boîte de vitesses",
        "Outils",
        "Tools"
      ],
      "categoryIds": [
        100238,
        null,
        103157
      ],
      "finalCategoryId": 103157,
      "productId": 9134
    },
    {
      "path": [
        "Moteur",
        "Lubrification",
        "Lubrication"
      ],
      "categoryIds": [
        100002,
        null,
        100245
      ],
      "finalCategoryId": 100245,
      "productId": 8255
    }
  ],
  "productIdsInArbo": [
    1650,
    1776,
    3558,
    3998,
    4095,
    4148,
    5640,
    5746,
    5747,
    5752,
    8255,
    8270,
    8945,
    9134
  ],
  "matchedProductIds": [
    1650
  ]
}