{
  "productName": "Levier de changement de vitesse",
  "searchText": "Levier de changement de vitesse",
  "found": true,
  "hasMatch": true,
  "timestamp": "2025-12-02T21:11:23.043Z",
  "productId": 5061,
  "arborescence": {
    "Boîte de vitesses": {
      "categoryId": 100238,
      "categoryName": "Boîte de vitesses",
      "level": 1,
      "children": {
        "Boîte de vitesses manuelle": {
          "categoryId": null,
          "categoryName": "Boîte de vitesses manuelle",
          "level": 2,
          "children": {
            "Cadre, garniture de levier de vitesse": {
              "categoryId": 100239,
              "categoryName": "Manual Transmission",
              "level": 2,
              "children": {
                "Commande de boîte de vitesses": {
                  "categoryId": null,
                  "categoryName": "Commande de boîte de vitesses",
                  "level": 4,
                  "children": {
                    "Cadre, garniture de levier de vitesse": {
                      "categoryId": 101808,
                      "categoryName": "Transmission Control",
                      "level": 3,
                      "children": [],
                      "productId": 5640
                    }
                  }
                }
              },
              "productId": 5640
            },
            "Garnissage de levier de changement de vitesse": {
              "categoryId": 100239,
              "categoryName": "Manual Transmission",
              "level": 2,
              "children": {
                "Commande de boîte de vitesses": {
                  "categoryId": null,
                  "categoryName": "Commande de boîte de vitesses",
                  "level": 4,
                  "children": {
                    "Garnissage de levier de changement de vitesse": {
                      "categoryId": 101808,
                      "categoryName": "Transmission Control",
                      "level": 3,
                      "children": [],
                      "productId": 1775
                    }
                  }
                }
              },
              "productId": 1775
            },
            "Guide, levier de vitesses": {
              "categoryId": 100239,
              "categoryName": "Manual Transmission",
              "level": 2,
              "children": {
                "Commande de boîte de vitesses": {
                  "categoryId": null,
                  "categoryName": "Commande de boîte de vitesses",
                  "level": 4,
                  "children": {
                    "Guide, levier de vitesses": {
                      "categoryId": 101808,
                      "categoryName": "Transmission Control",
                      "level": 3,
                      "children": [],
                      "productId": 5752
                    }
                  }
                }
              },
              "productId": 5752
            },
            "Kit de réparation, levier de changement de vitesse": {
              "categoryId": 100239,
              "categoryName": "Manual Transmission",
              "level": 2,
              "children": {
                "Réparation/entretien": {
                  "categoryId": null,
                  "categoryName": "Réparation/entretien",
                  "level": 4,
                  "children": {
                    "Kit de réparation, levier de changement de vitesse": {
                      "categoryId": 101809,
                      "categoryName": "Repair/Maintenance",
                      "level": 3,
                      "children": [],
                      "productId": 1633
                    }
                  }
                }
              },
              "productId": 1633
            },
            "Levier de changement de vitesse": {
              "categoryId": 100239,
              "categoryName": "Manual Transmission",
              "level": 2,
              "children": {
                "Commande de boîte de vitesses": {
                  "categoryId": null,
                  "categoryName": "Commande de boîte de vitesses",
                  "level": 4,
                  "children": {
                    "Levier de changement de vitesse": {
                      "categoryId": 101808,
                      "categoryName": "Transmission Control",
                      "level": 3,
                      "children": [],
                      "productId": 5061
                    }
                  }
                }
              },
              "productId": 5061
            },
            "Ressort de traction, levier de changement de vitesse": {
              "categoryId": 100239,
              "categoryName": "Manual Transmission",
              "level": 2,
              "children": {
                "Commande de boîte de vitesses": {
                  "categoryId": null,
                  "categoryName": "Commande de boîte de vitesses",
                  "level": 4,
                  "children": {
                    "Ressort de traction, levier de changement de vitesse": {
                      "categoryId": 101808,
                      "categoryName": "Transmission Control",
                      "level": 3,
                      "children": [],
                      "productId": 4036
                    }
                  }
                }
              },
              "productId": 4036
            },
            "Soupape, levier de changement de vitesse": {
              "categoryId": 100239,
              "categoryName": "Manual Transmission",
              "level": 2,
              "children": {
                "Commande de boîte de vitesses": {
                  "categoryId": null,
                  "categoryName": "Commande de boîte de vitesses",
                  "level": 4,
                  "children": {
                    "Soupape, levier de changement de vitesse": {
                      "categoryId": 101808,
                      "categoryName": "Transmission Control",
                      "level": 3,
                      "children": [],
                      "productId": 4342
                    }
                  }
                }
              },
              "productId": 4342
            }
          }
        }
      }
    }
  },
  "arborescenceText": "└── Boîte de vitesses [ID: 100238] (Niveau 1)\n    └── Boîte de vitesses manuelle (Niveau 2)\n        ├── Manual Transmission [ID: 100239] (Niveau 2) → ProductId: 5640\n        │   └── Commande de boîte de vitesses (Niveau 4)\n        │       └── Transmission Control [ID: 101808] (Niveau 3) → ProductId: 5640\n        ├── Manual Transmission [ID: 100239] (Niveau 2) → ProductId: 1775\n        │   └── Commande de boîte de vitesses (Niveau 4)\n        │       └── Transmission Control [ID: 101808] (Niveau 3) → ProductId: 1775\n        ├── Manual Transmission [ID: 100239] (Niveau 2) → ProductId: 5752\n        │   └── Commande de boîte de vitesses (Niveau 4)\n        │       └── Transmission Control [ID: 101808] (Niveau 3) → ProductId: 5752\n        ├── Manual Transmission [ID: 100239] (Niveau 2) → ProductId: 1633\n        │   └── Réparation/entretien (Niveau 4)\n        │       └── Repair/Maintenance [ID: 101809] (Niveau 3) → ProductId: 1633\n        ├── Manual Transmission [ID: 100239] (Niveau 2) → ProductId: 5061\n        │   └── Commande de boîte de vitesses (Niveau 4)\n        │       └── Transmission Control [ID: 101808] (Niveau 3) → ProductId: 5061\n        ├── Manual Transmission [ID: 100239] (Niveau 2) → ProductId: 4036\n        │   └── Commande de boîte de vitesses (Niveau 4)\n        │       └── Transmission Control [ID: 101808] (Niveau 3) → ProductId: 4036\n        └── Manual Transmission [ID: 100239] (Niveau 2) → ProductId: 4342\n            └── Commande de boîte de vitesses (Niveau 4)\n                └── Transmission Control [ID: 101808] (Niveau 3) → ProductId: 4342",
  "arborescencePaths": [
    {
      "path": [
        "Boîte de vitesses",
        "Boîte de vitesses manuelle",
        "Manual Transmission"
      ],
      "categoryIds": [
        100238,
        null,
        100239
      ],
      "finalCategoryId": 100239,
      "productId": 5640
    },
    {
      "path": [
        "Boîte de vitesses",
        "Boîte de vitesses manuelle",
        "Manual Transmission"
      ],
      "categoryIds": [
        100238,
        null,
        100239
      ],
      "finalCategoryId": 100239,
      "productId": 1775
    },
    {
      "path": [
        "Boîte de vitesses",
        "Boîte de vitesses manuelle",
        "Manual Transmission"
      ],
      "categoryIds": [
        100238,
        null,
        100239
      ],
      "finalCategoryId": 100239,
      "productId": 5752
    },
    {
      "path": [
        "Boîte de vitesses",
        "Boîte de vitesses manuelle",
        "Manual Transmission"
      ],
      "categoryIds": [
        100238,
        null,
        100239
      ],
      "finalCategoryId": 100239,
      "productId": 1633
    },
    {
      "path": [
        "Boîte de vitesses",
        "Boîte de vitesses manuelle",
        "Manual Transmission"
      ],
      "categoryIds": [
        100238,
        null,
        100239
      ],
      "finalCategoryId": 100239,
      "productId": 5061
    },
    {
      "path": [
        "Boîte de vitesses",
        "Boîte de vitesses manuelle",
        "Manual Transmission"
      ],
      "categoryIds": [
        100238,
        null,
        100239
      ],
      "finalCategoryId": 100239,
      "productId": 4036
    },
    {
      "path": [
        "Boîte de vitesses",
        "Boîte de vitesses manuelle",
        "Manual Transmission"
      ],
      "categoryIds": [
        100238,
        null,
        100239
      ],
      "finalCategoryId": 100239,
      "productId": 4342
    }
  ],
  "productIdsInArbo": [
    1633,
    1775,
    4036,
    4342,
    5061,
    5640,
    5752
  ],
  "matchedProductIds": [
    5061
  ]
}