{
  "productName": "Lightbar",
  "searchText": "Lightbar",
  "found": true,
  "hasMatch": false,
  "timestamp": "2025-12-02T21:12:11.595Z",
  "productId": 61033,
  "arborescence": {
    "Carrosserie": {
      "categoryId": 100001,
      "categoryName": "Carrosserie",
      "level": 1,
      "children": {
        "Avant du véhicule": {
          "categoryId": null,
          "categoryName": "Avant du véhicule",
          "level": 2,
          "children": {
            "Projecteur longue portée": {
              "categoryId": 101648,
              "categoryName": "Vehicle Front",
              "level": 2,
              "children": {
                "Projecteur longue portée / composants": {
                  "categoryId": null,
                  "categoryName": "Projecteur longue portée / composants",
                  "level": 4,
                  "children": {
                    "Projecteur longue portée": {
                      "categoryId": 101665,
                      "categoryName": "Spotlight/Parts",
                      "level": 3,
                      "children": {
                        "Projecteur longue portée/ optique": {
                          "categoryId": null,
                          "categoryName": "Projecteur longue portée/ optique",
                          "level": 6,
                          "children": {
                            "Projecteur longue portée": {
                              "categoryId": 101666,
                              "categoryName": "Spotlight/Insert",
                              "level": 4,
                              "children": [],
                              "productId": 202
                            }
                          }
                        }
                      },
                      "productId": 202
                    }
                  }
                }
              },
              "productId": 202
            }
          }
        },
        "Phares supplémentaires/composants": {
          "categoryId": null,
          "categoryName": "Phares supplémentaires/composants",
          "level": 2,
          "children": {
            "Projecteur de travail": {
              "categoryId": 101340,
              "categoryName": "Additional Headlight/Parts",
              "level": 2,
              "children": {
                "Projecteur de travail, composants": {
                  "categoryId": null,
                  "categoryName": "Projecteur de travail, composants",
                  "level": 4,
                  "children": {
                    "Projecteur de travail": {
                      "categoryId": 101349,
                      "categoryName": "Worklight/Parts",
                      "level": 3,
                      "children": {
                        "Projecteur de travail / Optique": {
                          "categoryId": null,
                          "categoryName": "Projecteur de travail / Optique",
                          "level": 6,
                          "children": {
                            "Projecteur de travail": {
                              "categoryId": 101350,
                              "categoryName": "Worklight/Insert",
                              "level": 4,
                              "children": [],
                              "productId": 724
                            }
                          }
                        }
                      },
                      "productId": 724
                    }
                  }
                }
              },
              "productId": 724
            },
            "Projecteur longue portée": {
              "categoryId": 101340,
              "categoryName": "Additional Headlight/Parts",
              "level": 2,
              "children": {
                "Projecteur longue portée / composants": {
                  "categoryId": null,
                  "categoryName": "Projecteur longue portée / composants",
                  "level": 4,
                  "children": {
                    "Projecteur longue portée": {
                      "categoryId": 101345,
                      "categoryName": "Spotlight/Parts",
                      "level": 3,
                      "children": {
                        "Projecteur longue portée/ optique": {
                          "categoryId": null,
                          "categoryName": "Projecteur longue portée/ optique",
                          "level": 6,
                          "children": {
                            "Projecteur longue portée": {
                              "categoryId": 101346,
                              "categoryName": "Spotlight/Insert",
                              "level": 4,
                              "children": [],
                              "productId": 202
                            }
                          }
                        }
                      },
                      "productId": 202
                    }
                  }
                }
              },
              "productId": 202
            }
          }
        }
      }
    },
    "Système électrique": {
      "categoryId": 100010,
      "categoryName": "Système électrique",
      "level": 1,
      "children": {
        "Phares supplémentaires/composants": {
          "categoryId": null,
          "categoryName": "Phares supplémentaires/composants",
          "level": 2,
          "children": {
            "Projecteur de travail": {
              "categoryId": 100787,
              "categoryName": "Additional Headlight/Parts",
              "level": 2,
              "children": {
                "Projecteur de travail, composants": {
                  "categoryId": null,
                  "categoryName": "Projecteur de travail, composants",
                  "level": 4,
                  "children": {
                    "Projecteur de travail": {
                      "categoryId": 100280,
                      "categoryName": "Worklight/Parts",
                      "level": 3,
                      "children": {
                        "Projecteur de travail / Optique": {
                          "categoryId": null,
                          "categoryName": "Projecteur de travail / Optique",
                          "level": 6,
                          "children": {
                            "Projecteur de travail": {
                              "categoryId": 100426,
                              "categoryName": "Worklight/Insert",
                              "level": 4,
                              "children": [],
                              "productId": 724
                            }
                          }
                        }
                      },
                      "productId": 724
                    }
                  }
                }
              },
              "productId": 724
            },
            "Projecteur longue portée": {
              "categoryId": 100787,
              "categoryName": "Additional Headlight/Parts",
              "level": 2,
              "children": {
                "Projecteur longue portée / composants": {
                  "categoryId": null,
                  "categoryName": "Projecteur longue portée / composants",
                  "level": 4,
                  "children": {
                    "Projecteur longue portée": {
                      "categoryId": 100276,
                      "categoryName": "Spotlight/Parts",
                      "level": 3,
                      "children": {
                        "Projecteur longue portée/ optique": {
                          "categoryId": null,
                          "categoryName": "Projecteur longue portée/ optique",
                          "level": 6,
                          "children": {
                            "Projecteur longue portée": {
                              "categoryId": 100439,
                              "categoryName": "Spotlight/Insert",
                              "level": 4,
                              "children": [],
                              "productId": 202
                            }
                          }
                        }
                      },
                      "productId": 202
                    }
                  }
                }
              },
              "productId": 202
            }
          }
        }
      }
    }
  },
  "arborescenceText": "├── Carrosserie [ID: 100001] (Niveau 1)\n│   ├── Avant du véhicule (Niveau 2)\n│   │   └── Vehicle Front [ID: 101648] (Niveau 2) → ProductId: 202\n│   │       └── Projecteur longue portée / composants (Niveau 4)\n│   │           └── Spotlight/Parts [ID: 101665] (Niveau 3) → ProductId: 202\n│   │               └── Projecteur longue portée/ optique (Niveau 6)\n│   │                   └── Spotlight/Insert [ID: 101666] (Niveau 4) → ProductId: 202\n│   └── Phares supplémentaires/composants (Niveau 2)\n│       ├── Additional Headlight/Parts [ID: 101340] (Niveau 2) → ProductId: 724\n│       │   └── Projecteur de travail, composants (Niveau 4)\n│       │       └── Worklight/Parts [ID: 101349] (Niveau 3) → ProductId: 724\n│       │           └── Projecteur de travail / Optique (Niveau 6)\n│       │               └── Worklight/Insert [ID: 101350] (Niveau 4) → ProductId: 724\n│       └── Additional Headlight/Parts [ID: 101340] (Niveau 2) → ProductId: 202\n│           └── Projecteur longue portée / composants (Niveau 4)\n│               └── Spotlight/Parts [ID: 101345] (Niveau 3) → ProductId: 202\n│                   └── Projecteur longue portée/ optique (Niveau 6)\n│                       └── Spotlight/Insert [ID: 101346] (Niveau 4) → ProductId: 202\n\n└── Système électrique [ID: 100010] (Niveau 1)\n    └── Phares supplémentaires/composants (Niveau 2)\n        ├── Additional Headlight/Parts [ID: 100787] (Niveau 2) → ProductId: 724\n        │   └── Projecteur de travail, composants (Niveau 4)\n        │       └── Worklight/Parts [ID: 100280] (Niveau 3) → ProductId: 724\n        │           └── Projecteur de travail / Optique (Niveau 6)\n        │               └── Worklight/Insert [ID: 100426] (Niveau 4) → ProductId: 724\n        └── Additional Headlight/Parts [ID: 100787] (Niveau 2) → ProductId: 202\n            └── Projecteur longue portée / composants (Niveau 4)\n                └── Spotlight/Parts [ID: 100276] (Niveau 3) → ProductId: 202\n                    └── Projecteur longue portée/ optique (Niveau 6)\n                        └── Spotlight/Insert [ID: 100439] (Niveau 4) → ProductId: 202",
  "arborescencePaths": [
    {
      "path": [
        "Carrosserie",
        "Avant du véhicule",
        "Vehicle Front"
      ],
      "categoryIds": [
        100001,
        null,
        101648
      ],
      "finalCategoryId": 101648,
      "productId": 202
    },
    {
      "path": [
        "Carrosserie",
        "Phares supplémentaires/composants",
        "Additional Headlight/Parts"
      ],
      "categoryIds": [
        100001,
        null,
        101340
      ],
      "finalCategoryId": 101340,
      "productId": 724
    },
    {
      "path": [
        "Carrosserie",
        "Phares supplémentaires/composants",
        "Additional Headlight/Parts"
      ],
      "categoryIds": [
        100001,
        null,
        101340
      ],
      "finalCategoryId": 101340,
      "productId": 202
    },
    {
      "path": [
        "Système électrique",
        "Phares supplémentaires/composants",
        "Additional Headlight/Parts"
      ],
      "categoryIds": [
        100010,
        null,
        100787
      ],
      "finalCategoryId": 100787,
      "productId": 724
    },
    {
      "path": [
        "Système électrique",
        "Phares supplémentaires/composants",
        "Additional Headlight/Parts"
      ],
      "categoryIds": [
        100010,
        null,
        100787
      ],
      "finalCategoryId": 100787,
      "productId": 202
    }
  ],
  "productIdsInArbo": [
    202,
    724
  ],
  "closestProductIds": [
    {
      "productId": 202,
      "productName": "Projecteur longue portée"
    },
    {
      "productId": 724,
      "productName": "Projecteur de travail"
    }
  ]
}