{
  "productName": "Marchepied",
  "searchText": "Marchepied",
  "found": true,
  "hasMatch": true,
  "timestamp": "2025-12-02T21:14:13.100Z",
  "productId": 1510,
  "arborescence": {
    "Carrosserie": {
      "categoryId": 100001,
      "categoryName": "Carrosserie",
      "level": 1,
      "children": {
        "Habitacle": {
          "categoryId": null,
          "categoryName": "Habitacle",
          "level": 2,
          "children": {
            "Fixation, cric": {
              "categoryId": 101690,
              "categoryName": "Passenger Cabin",
              "level": 2,
              "children": {
                "Marchepied / montant de porte": {
                  "categoryId": null,
                  "categoryName": "Marchepied / montant de porte",
                  "level": 4,
                  "children": {
                    "Fixation, cric": {
                      "categoryId": 101692,
                      "categoryName": "Footboard/Door Pillar",
                      "level": 3,
                      "children": [],
                      "productId": 990
                    }
                  }
                }
              },
              "productId": 990
            },
            "Garniture, marchepied": {
              "categoryId": 101690,
              "categoryName": "Passenger Cabin",
              "level": 2,
              "children": {
                "Marchepied / montant de porte": {
                  "categoryId": null,
                  "categoryName": "Marchepied / montant de porte",
                  "level": 4,
                  "children": {
                    "Garniture, marchepied": {
                      "categoryId": 101692,
                      "categoryName": "Footboard/Door Pillar",
                      "level": 3,
                      "children": [],
                      "productId": 5049
                    }
                  }
                }
              },
              "productId": 5049
            },
            "Kit de supports, cric": {
              "categoryId": 101690,
              "categoryName": "Passenger Cabin",
              "level": 2,
              "children": {
                "Marchepied / montant de porte": {
                  "categoryId": null,
                  "categoryName": "Marchepied / montant de porte",
                  "level": 4,
                  "children": {
                    "Kit de supports, cric": {
                      "categoryId": 101692,
                      "categoryName": "Footboard/Door Pillar",
                      "level": 3,
                      "children": [],
                      "productId": 9285
                    }
                  }
                }
              },
              "productId": 9285
            },
            "Marchepied": {
              "categoryId": 101690,
              "categoryName": "Passenger Cabin",
              "level": 2,
              "children": {
                "Marchepied / montant de porte": {
                  "categoryId": null,
                  "categoryName": "Marchepied / montant de porte",
                  "level": 4,
                  "children": {
                    "Marchepied": {
                      "categoryId": 101692,
                      "categoryName": "Footboard/Door Pillar",
                      "level": 3,
                      "children": [],
                      "productId": 1510
                    }
                  }
                }
              },
              "productId": 1510
            },
            "Plaque de seuil": {
              "categoryId": 101690,
              "categoryName": "Passenger Cabin",
              "level": 2,
              "children": {
                "Marchepied / montant de porte": {
                  "categoryId": null,
                  "categoryName": "Marchepied / montant de porte",
                  "level": 4,
                  "children": {
                    "Plaque de seuil": {
                      "categoryId": 101692,
                      "categoryName": "Footboard/Door Pillar",
                      "level": 3,
                      "children": [],
                      "productId": 177
                    }
                  }
                }
              },
              "productId": 177
            },
            "Revêtement de bas de marche": {
              "categoryId": 101690,
              "categoryName": "Passenger Cabin",
              "level": 2,
              "children": {
                "Marchepied / montant de porte": {
                  "categoryId": null,
                  "categoryName": "Marchepied / montant de porte",
                  "level": 4,
                  "children": {
                    "Revêtement de bas de marche": {
                      "categoryId": 101692,
                      "categoryName": "Footboard/Door Pillar",
                      "level": 3,
                      "children": [],
                      "productId": 1345
                    }
                  }
                }
              },
              "productId": 1345
            },
            "Support, marchepied": {
              "categoryId": 101690,
              "categoryName": "Passenger Cabin",
              "level": 2,
              "children": {
                "Marchepied / montant de porte": {
                  "categoryId": null,
                  "categoryName": "Marchepied / montant de porte",
                  "level": 4,
                  "children": {
                    "Support, marchepied": {
                      "categoryId": 101692,
                      "categoryName": "Footboard/Door Pillar",
                      "level": 3,
                      "children": [],
                      "productId": 5048
                    }
                  }
                }
              },
              "productId": 5048
            }
          }
        },
        "Pièces de carrosserie/ailes/pares-chocs": {
          "categoryId": null,
          "categoryName": "Pièces de carrosserie/ailes/pares-chocs",
          "level": 2,
          "children": {
            "couvercle, logement du cric": {
              "categoryId": 100743,
              "categoryName": "Body Parts/Wing/Bumper",
              "level": 2,
              "children": {
                "Marchepied / montant de porte": {
                  "categoryId": null,
                  "categoryName": "Marchepied / montant de porte",
                  "level": 4,
                  "children": {
                    "couvercle, logement du cric": {
                      "categoryId": 100169,
                      "categoryName": "Footboard/Door Pillar",
                      "level": 3,
                      "children": [],
                      "productId": 61090
                    }
                  }
                },
                "Recouvrement/Capuchons": {
                  "categoryId": null,
                  "categoryName": "Recouvrement/Capuchons",
                  "level": 4,
                  "children": {
                    "couvercle, logement du cric": {
                      "categoryId": 100699,
                      "categoryName": "Covers/Caps",
                      "level": 3,
                      "children": [],
                      "productId": 61090
                    }
                  }
                }
              },
              "productId": 61090
            },
            "Fixation, cric": {
              "categoryId": 100743,
              "categoryName": "Body Parts/Wing/Bumper",
              "level": 2,
              "children": {
                "Marchepied / montant de porte": {
                  "categoryId": null,
                  "categoryName": "Marchepied / montant de porte",
                  "level": 4,
                  "children": {
                    "Fixation, cric": {
                      "categoryId": 100169,
                      "categoryName": "Footboard/Door Pillar",
                      "level": 3,
                      "children": [],
                      "productId": 990
                    }
                  }
                }
              },
              "productId": 990
            },
            "Garniture, marchepied": {
              "categoryId": 100743,
              "categoryName": "Body Parts/Wing/Bumper",
              "level": 2,
              "children": {
                "Marchepied / montant de porte": {
                  "categoryId": null,
                  "categoryName": "Marchepied / montant de porte",
                  "level": 4,
                  "children": {
                    "Garniture, marchepied": {
                      "categoryId": 100169,
                      "categoryName": "Footboard/Door Pillar",
                      "level": 3,
                      "children": [],
                      "productId": 5049
                    }
                  }
                }
              },
              "productId": 5049
            },
            "Kit de supports, cric": {
              "categoryId": 100743,
              "categoryName": "Body Parts/Wing/Bumper",
              "level": 2,
              "children": {
                "Marchepied / montant de porte": {
                  "categoryId": null,
                  "categoryName": "Marchepied / montant de porte",
                  "level": 4,
                  "children": {
                    "Kit de supports, cric": {
                      "categoryId": 100169,
                      "categoryName": "Footboard/Door Pillar",
                      "level": 3,
                      "children": [],
                      "productId": 9285
                    }
                  }
                }
              },
              "productId": 9285
            },
            "Marchepied": {
              "categoryId": 100743,
              "categoryName": "Body Parts/Wing/Bumper",
              "level": 2,
              "children": {
                "Marchepied / montant de porte": {
                  "categoryId": null,
                  "categoryName": "Marchepied / montant de porte",
                  "level": 4,
                  "children": {
                    "Marchepied": {
                      "categoryId": 100169,
                      "categoryName": "Footboard/Door Pillar",
                      "level": 3,
                      "children": [],
                      "productId": 1510
                    }
                  }
                }
              },
              "productId": 1510
            },
            "Plaque de seuil": {
              "categoryId": 100743,
              "categoryName": "Body Parts/Wing/Bumper",
              "level": 2,
              "children": {
                "Barre latérale / transversale": {
                  "categoryId": null,
                  "categoryName": "Barre latérale / transversale",
                  "level": 4,
                  "children": {
                    "Plaque de seuil": {
                      "categoryId": 100155,
                      "categoryName": "Side/Cross Member",
                      "level": 3,
                      "children": [],
                      "productId": 177
                    }
                  }
                },
                "Marchepied / montant de porte": {
                  "categoryId": null,
                  "categoryName": "Marchepied / montant de porte",
                  "level": 4,
                  "children": {
                    "Plaque de seuil": {
                      "categoryId": 100169,
                      "categoryName": "Footboard/Door Pillar",
                      "level": 3,
                      "children": [],
                      "productId": 177
                    }
                  }
                }
              },
              "productId": 177
            },
            "Revêtement de bas de marche": {
              "categoryId": 100743,
              "categoryName": "Body Parts/Wing/Bumper",
              "level": 2,
              "children": {
                "Marchepied / montant de porte": {
                  "categoryId": null,
                  "categoryName": "Marchepied / montant de porte",
                  "level": 4,
                  "children": {
                    "Revêtement de bas de marche": {
                      "categoryId": 100169,
                      "categoryName": "Footboard/Door Pillar",
                      "level": 3,
                      "children": [],
                      "productId": 1345
                    }
                  }
                }
              },
              "productId": 1345
            },
            "Support, marchepied": {
              "categoryId": 100743,
              "categoryName": "Body Parts/Wing/Bumper",
              "level": 2,
              "children": {
                "Marchepied / montant de porte": {
                  "categoryId": null,
                  "categoryName": "Marchepied / montant de porte",
                  "level": 4,
                  "children": {
                    "Support, marchepied": {
                      "categoryId": 100169,
                      "categoryName": "Footboard/Door Pillar",
                      "level": 3,
                      "children": [],
                      "productId": 5048
                    }
                  }
                }
              },
              "productId": 5048
            }
          }
        }
      }
    },
    "Dispositif d'attelage/accessoires": {
      "categoryId": 100015,
      "categoryName": "Dispositif d'attelage/accessoires",
      "level": 1,
      "children": {
        "Composants / pièces de montage": {
          "categoryId": null,
          "categoryName": "Composants / pièces de montage",
          "level": 2,
          "children": {
            "Marchepied, dispositif d'attelage": {
              "categoryId": 100609,
              "categoryName": "Parts",
              "level": 2,
              "children": [],
              "productId": 969
            }
          }
        }
      }
    }
  },
  "arborescenceText": "├── Carrosserie [ID: 100001] (Niveau 1)\n│   ├── Habitacle (Niveau 2)\n│   │   ├── Passenger Cabin [ID: 101690] (Niveau 2) → ProductId: 990\n│   │   │   └── Marchepied / montant de porte (Niveau 4)\n│   │   │       └── Footboard/Door Pillar [ID: 101692] (Niveau 3) → ProductId: 990\n│   │   ├── Passenger Cabin [ID: 101690] (Niveau 2) → ProductId: 5049\n│   │   │   └── Marchepied / montant de porte (Niveau 4)\n│   │   │       └── Footboard/Door Pillar [ID: 101692] (Niveau 3) → ProductId: 5049\n│   │   ├── Passenger Cabin [ID: 101690] (Niveau 2) → ProductId: 9285\n│   │   │   └── Marchepied / montant de porte (Niveau 4)\n│   │   │       └── Footboard/Door Pillar [ID: 101692] (Niveau 3) → ProductId: 9285\n│   │   ├── Passenger Cabin [ID: 101690] (Niveau 2) → ProductId: 1510\n│   │   │   └── Marchepied / montant de porte (Niveau 4)\n│   │   │       └── Footboard/Door Pillar [ID: 101692] (Niveau 3) → ProductId: 1510\n│   │   ├── Passenger Cabin [ID: 101690] (Niveau 2) → ProductId: 177\n│   │   │   └── Marchepied / montant de porte (Niveau 4)\n│   │   │       └── Footboard/Door Pillar [ID: 101692] (Niveau 3) → ProductId: 177\n│   │   ├── Passenger Cabin [ID: 101690] (Niveau 2) → ProductId: 1345\n│   │   │   └── Marchepied / montant de porte (Niveau 4)\n│   │   │       └── Footboard/Door Pillar [ID: 101692] (Niveau 3) → ProductId: 1345\n│   │   └── Passenger Cabin [ID: 101690] (Niveau 2) → ProductId: 5048\n│   │       └── Marchepied / montant de porte (Niveau 4)\n│   │           └── Footboard/Door Pillar [ID: 101692] (Niveau 3) → ProductId: 5048\n│   └── Pièces de carrosserie/ailes/pares-chocs (Niveau 2)\n│       ├── Body Parts/Wing/Bumper [ID: 100743] (Niveau 2) → ProductId: 61090\n│       │   ├── Marchepied / montant de porte (Niveau 4)\n│       │   │   └── Footboard/Door Pillar [ID: 100169] (Niveau 3) → ProductId: 61090\n│       │   └── Recouvrement/Capuchons (Niveau 4)\n│       │       └── Covers/Caps [ID: 100699] (Niveau 3) → ProductId: 61090\n│       ├── Body Parts/Wing/Bumper [ID: 100743] (Niveau 2) → ProductId: 990\n│       │   └── Marchepied / montant de porte (Niveau 4)\n│       │       └── Footboard/Door Pillar [ID: 100169] (Niveau 3) → ProductId: 990\n│       ├── Body Parts/Wing/Bumper [ID: 100743] (Niveau 2) → ProductId: 5049\n│       │   └── Marchepied / montant de porte (Niveau 4)\n│       │       └── Footboard/Door Pillar [ID: 100169] (Niveau 3) → ProductId: 5049\n│       ├── Body Parts/Wing/Bumper [ID: 100743] (Niveau 2) → ProductId: 9285\n│       │   └── Marchepied / montant de porte (Niveau 4)\n│       │       └── Footboard/Door Pillar [ID: 100169] (Niveau 3) → ProductId: 9285\n│       ├── Body Parts/Wing/Bumper [ID: 100743] (Niveau 2) → ProductId: 1510\n│       │   └── Marchepied / montant de porte (Niveau 4)\n│       │       └── Footboard/Door Pillar [ID: 100169] (Niveau 3) → ProductId: 1510\n│       ├── Body Parts/Wing/Bumper [ID: 100743] (Niveau 2) → ProductId: 177\n│       │   ├── Barre latérale / transversale (Niveau 4)\n│       │   │   └── Side/Cross Member [ID: 100155] (Niveau 3) → ProductId: 177\n│       │   └── Marchepied / montant de porte (Niveau 4)\n│       │       └── Footboard/Door Pillar [ID: 100169] (Niveau 3) → ProductId: 177\n│       ├── Body Parts/Wing/Bumper [ID: 100743] (Niveau 2) → ProductId: 1345\n│       │   └── Marchepied / montant de porte (Niveau 4)\n│       │       └── Footboard/Door Pillar [ID: 100169] (Niveau 3) → ProductId: 1345\n│       └── Body Parts/Wing/Bumper [ID: 100743] (Niveau 2) → ProductId: 5048\n│           └── Marchepied / montant de porte (Niveau 4)\n│               └── Footboard/Door Pillar [ID: 100169] (Niveau 3) → ProductId: 5048\n\n└── Dispositif d'attelage/accessoires [ID: 100015] (Niveau 1)\n    └── Composants / pièces de montage (Niveau 2)\n        └── Parts [ID: 100609] (Niveau 2) → ProductId: 969",
  "arborescencePaths": [
    {
      "path": [
        "Carrosserie",
        "Habitacle",
        "Passenger Cabin"
      ],
      "categoryIds": [
        100001,
        null,
        101690
      ],
      "finalCategoryId": 101690,
      "productId": 990
    },
    {
      "path": [
        "Carrosserie",
        "Habitacle",
        "Passenger Cabin"
      ],
      "categoryIds": [
        100001,
        null,
        101690
      ],
      "finalCategoryId": 101690,
      "productId": 5049
    },
    {
      "path": [
        "Carrosserie",
        "Habitacle",
        "Passenger Cabin"
      ],
      "categoryIds": [
        100001,
        null,
        101690
      ],
      "finalCategoryId": 101690,
      "productId": 9285
    },
    {
      "path": [
        "Carrosserie",
        "Habitacle",
        "Passenger Cabin"
      ],
      "categoryIds": [
        100001,
        null,
        101690
      ],
      "finalCategoryId": 101690,
      "productId": 1510
    },
    {
      "path": [
        "Carrosserie",
        "Habitacle",
        "Passenger Cabin"
      ],
      "categoryIds": [
        100001,
        null,
        101690
      ],
      "finalCategoryId": 101690,
      "productId": 177
    },
    {
      "path": [
        "Carrosserie",
        "Habitacle",
        "Passenger Cabin"
      ],
      "categoryIds": [
        100001,
        null,
        101690
      ],
      "finalCategoryId": 101690,
      "productId": 1345
    },
    {
      "path": [
        "Carrosserie",
        "Habitacle",
        "Passenger Cabin"
      ],
      "categoryIds": [
        100001,
        null,
        101690
      ],
      "finalCategoryId": 101690,
      "productId": 5048
    },
    {
      "path": [
        "Carrosserie",
        "Pièces de carrosserie/ailes/pares-chocs",
        "Body Parts/Wing/Bumper"
      ],
      "categoryIds": [
        100001,
        null,
        100743
      ],
      "finalCategoryId": 100743,
      "productId": 61090
    },
    {
      "path": [
        "Carrosserie",
        "Pièces de carrosserie/ailes/pares-chocs",
        "Body Parts/Wing/Bumper"
      ],
      "categoryIds": [
        100001,
        null,
        100743
      ],
      "finalCategoryId": 100743,
      "productId": 990
    },
    {
      "path": [
        "Carrosserie",
        "Pièces de carrosserie/ailes/pares-chocs",
        "Body Parts/Wing/Bumper"
      ],
      "categoryIds": [
        100001,
        null,
        100743
      ],
      "finalCategoryId": 100743,
      "productId": 5049
    },
    {
      "path": [
        "Carrosserie",
        "Pièces de carrosserie/ailes/pares-chocs",
        "Body Parts/Wing/Bumper"
      ],
      "categoryIds": [
        100001,
        null,
        100743
      ],
      "finalCategoryId": 100743,
      "productId": 9285
    },
    {
      "path": [
        "Carrosserie",
        "Pièces de carrosserie/ailes/pares-chocs",
        "Body Parts/Wing/Bumper"
      ],
      "categoryIds": [
        100001,
        null,
        100743
      ],
      "finalCategoryId": 100743,
      "productId": 1510
    },
    {
      "path": [
        "Carrosserie",
        "Pièces de carrosserie/ailes/pares-chocs",
        "Body Parts/Wing/Bumper"
      ],
      "categoryIds": [
        100001,
        null,
        100743
      ],
      "finalCategoryId": 100743,
      "productId": 177
    },
    {
      "path": [
        "Carrosserie",
        "Pièces de carrosserie/ailes/pares-chocs",
        "Body Parts/Wing/Bumper"
      ],
      "categoryIds": [
        100001,
        null,
        100743
      ],
      "finalCategoryId": 100743,
      "productId": 1345
    },
    {
      "path": [
        "Carrosserie",
        "Pièces de carrosserie/ailes/pares-chocs",
        "Body Parts/Wing/Bumper"
      ],
      "categoryIds": [
        100001,
        null,
        100743
      ],
      "finalCategoryId": 100743,
      "productId": 5048
    },
    {
      "path": [
        "Dispositif d'attelage/accessoires",
        "Composants / pièces de montage",
        "Parts"
      ],
      "categoryIds": [
        100015,
        null,
        100609
      ],
      "finalCategoryId": 100609,
      "productId": 969
    }
  ],
  "productIdsInArbo": [
    177,
    969,
    990,
    1345,
    1510,
    5048,
    5049,
    9285,
    61090
  ],
  "matchedProductIds": [
    1510
  ]
}