{
  "productName": "Mastic",
  "searchText": "Mastic",
  "found": true,
  "hasMatch": false,
  "timestamp": "2025-12-02T21:14:32.236Z",
  "productId": 1867,
  "arborescence": {
    "Boîte de vitesses": {
      "categoryId": 100238,
      "categoryName": "Boîte de vitesses",
      "level": 1,
      "children": {
        "Boîte de vitesse automatique": {
          "categoryId": null,
          "categoryName": "Boîte de vitesse automatique",
          "level": 2,
          "children": {
            "Joint d'étanchéité, boîte automatique": {
              "categoryId": 100240,
              "categoryName": "Automatic Transmission",
              "level": 2,
              "children": {
                "Joints": {
                  "categoryId": null,
                  "categoryName": "Joints",
                  "level": 4,
                  "children": {
                    "Joint d'étanchéité, boîte automatique": {
                      "categoryId": 100770,
                      "categoryName": "Gaskets/Seals",
                      "level": 3,
                      "children": [],
                      "productId": 147
                    }
                  }
                }
              },
              "productId": 147
            },
            "Joint, carter d'huile-boîte automatique": {
              "categoryId": 100240,
              "categoryName": "Automatic Transmission",
              "level": 2,
              "children": {
                "Carter d'huile et pièces de montage": {
                  "categoryId": null,
                  "categoryName": "Carter d'huile et pièces de montage",
                  "level": 4,
                  "children": {
                    "Joint, carter d'huile-boîte automatique": {
                      "categoryId": 101853,
                      "categoryName": "Oil Sump/Attachment Parts",
                      "level": 3,
                      "children": {
                        "Joint": {
                          "categoryId": null,
                          "categoryName": "Joint",
                          "level": 6,
                          "children": {
                            "Joint, carter d'huile-boîte automatique": {
                              "categoryId": 101855,
                              "categoryName": "Seal",
                              "level": 4,
                              "children": [],
                              "productId": 3106
                            }
                          }
                        }
                      },
                      "productId": 3106
                    }
                  }
                }
              },
              "productId": 3106
            }
          }
        },
        "Boîte de vitesses manuelle": {
          "categoryId": null,
          "categoryName": "Boîte de vitesses manuelle",
          "level": 2,
          "children": {
            "Joint, boîtier de commande-boite de vitesse": {
              "categoryId": 100239,
              "categoryName": "Manual Transmission",
              "level": 2,
              "children": {
                "Joints": {
                  "categoryId": null,
                  "categoryName": "Joints",
                  "level": 4,
                  "children": {
                    "Joint, boîtier de commande-boite de vitesse": {
                      "categoryId": 100769,
                      "categoryName": "Gaskets/Seals",
                      "level": 3,
                      "children": [],
                      "productId": 3990
                    }
                  }
                }
              },
              "productId": 3990
            }
          }
        }
      }
    },
    "Entraînement des essieux": {
      "categoryId": 100400,
      "categoryName": "Entraînement des essieux",
      "level": 1,
      "children": {
        "Différentiel": {
          "categoryId": null,
          "categoryName": "Différentiel",
          "level": 2,
          "children": {
            "Joint d'étanchéité, différentiel": {
              "categoryId": 100415,
              "categoryName": "Differential",
              "level": 2,
              "children": [],
              "productId": 628
            },
            "Joint, couvercle de carter de différentiel": {
              "categoryId": 100415,
              "categoryName": "Differential",
              "level": 2,
              "children": [],
              "productId": 9051
            }
          }
        }
      }
    },
    "Moteur": {
      "categoryId": 100002,
      "categoryName": "Moteur",
      "level": 1,
      "children": {
        "Carter de vilebrequin": {
          "categoryId": null,
          "categoryName": "Carter de vilebrequin",
          "level": 2,
          "children": {
            "Joint, couvercle de carter (carter de vilebrequin)": {
              "categoryId": 100514,
              "categoryName": "Crankcase",
              "level": 2,
              "children": {
                "Carter de vilebrequin": {
                  "categoryId": null,
                  "categoryName": "Carter de vilebrequin",
                  "level": 4,
                  "children": {
                    "Joint, couvercle de carter (carter de vilebrequin)": {
                      "categoryId": 100533,
                      "categoryName": "Crankcase",
                      "level": 3,
                      "children": [],
                      "productId": 3815
                    }
                  }
                }
              },
              "productId": 3815
            }
          }
        },
        "Culasse / pieces de montage": {
          "categoryId": null,
          "categoryName": "Culasse / pieces de montage",
          "level": 2,
          "children": {
            "Joint d'étanchéité, collecteur d'admission": {
              "categoryId": 100373,
              "categoryName": "Cylinder Head/Attachment Parts",
              "level": 2,
              "children": {
                "Joint de collecteur d'admission/des gaz d'échappement": {
                  "categoryId": null,
                  "categoryName": "Joint de collecteur d'admission/des gaz d'échappement",
                  "level": 4,
                  "children": {
                    "Joint d'étanchéité, collecteur d'admission": {
                      "categoryId": 100376,
                      "categoryName": "Intake-/Exhaust Manifold Gasket/-seal ring",
                      "level": 3,
                      "children": [],
                      "productId": 42
                    }
                  }
                }
              },
              "productId": 42
            },
            "Joint d'étanchéité, culasse": {
              "categoryId": 100373,
              "categoryName": "Cylinder Head/Attachment Parts",
              "level": 2,
              "children": {
                "Joint de culasse": {
                  "categoryId": null,
                  "categoryName": "Joint de culasse",
                  "level": 4,
                  "children": {
                    "Joint d'étanchéité, culasse": {
                      "categoryId": 100374,
                      "categoryName": "Cylinder Head Gasket",
                      "level": 3,
                      "children": [],
                      "productId": 318
                    }
                  }
                }
              },
              "productId": 318
            },
            "Joint de cache culbuteurs": {
              "categoryId": 100373,
              "categoryName": "Cylinder Head/Attachment Parts",
              "level": 2,
              "children": {
                "Cache-soupape": {
                  "categoryId": null,
                  "categoryName": "Cache-soupape",
                  "level": 4,
                  "children": {
                    "Joint de cache culbuteurs": {
                      "categoryId": 100375,
                      "categoryName": "Cylinder Head Cover/-Gasket",
                      "level": 3,
                      "children": [],
                      "productId": 321
                    }
                  }
                }
              },
              "productId": 321
            }
          }
        },
        "Distribution moteur": {
          "categoryId": null,
          "categoryName": "Distribution moteur",
          "level": 2,
          "children": {
            "Joint d'étanchéité, carter de distribution": {
              "categoryId": 100003,
              "categoryName": "Engine Timing",
              "level": 2,
              "children": {
                "Carter de distribution / joint": {
                  "categoryId": null,
                  "categoryName": "Carter de distribution / joint",
                  "level": 4,
                  "children": {
                    "Joint d'étanchéité, carter de distribution": {
                      "categoryId": 100401,
                      "categoryName": "Timing Case/Gasket",
                      "level": 3,
                      "children": [],
                      "productId": 568
                    }
                  }
                }
              },
              "productId": 568
            },
            "Joint d'étanchéité, couvercle de carter de distribution": {
              "categoryId": 100003,
              "categoryName": "Engine Timing",
              "level": 2,
              "children": {
                "Carter de distribution / joint": {
                  "categoryId": null,
                  "categoryName": "Carter de distribution / joint",
                  "level": 4,
                  "children": {
                    "Joint d'étanchéité, couvercle de carter de distribution": {
                      "categoryId": 100401,
                      "categoryName": "Timing Case/Gasket",
                      "level": 3,
                      "children": [],
                      "productId": 569
                    }
                  }
                }
              },
              "productId": 569
            }
          }
        },
        "Joints": {
          "categoryId": null,
          "categoryName": "Joints",
          "level": 2,
          "children": {
            "Joint d'étanchéité, carter d'huile": {
              "categoryId": 100223,
              "categoryName": "Gaskets",
              "level": 2,
              "children": {
                "Joint de circuit d'huile": {
                  "categoryId": null,
                  "categoryName": "Joint de circuit d'huile",
                  "level": 4,
                  "children": {
                    "Joint d'étanchéité, carter d'huile": {
                      "categoryId": 100684,
                      "categoryName": "Oil Circuit Seals",
                      "level": 3,
                      "children": [],
                      "productId": 455
                    }
                  }
                },
                "Joint du réservoir d'huile": {
                  "categoryId": null,
                  "categoryName": "Joint du réservoir d'huile",
                  "level": 4,
                  "children": {
                    "Joint d'étanchéité, carter d'huile": {
                      "categoryId": 100234,
                      "categoryName": "Oil Sump Gasket",
                      "level": 3,
                      "children": [],
                      "productId": 455
                    }
                  }
                }
              },
              "productId": 455
            },
            "Joint d'étanchéité, carter de distribution": {
              "categoryId": 100223,
              "categoryName": "Gaskets",
              "level": 2,
              "children": {
                "Joint de carter de distribution": {
                  "categoryId": null,
                  "categoryName": "Joint de carter de distribution",
                  "level": 4,
                  "children": {
                    "Joint d'étanchéité, carter de distribution": {
                      "categoryId": 100235,
                      "categoryName": "Timing Case Gasket",
                      "level": 3,
                      "children": [],
                      "productId": 568
                    }
                  }
                }
              },
              "productId": 568
            },
            "Joint d'étanchéité, collecteur d'admission": {
              "categoryId": 100223,
              "categoryName": "Gaskets",
              "level": 2,
              "children": {
                "Joint de collecteur d'admission": {
                  "categoryId": null,
                  "categoryName": "Joint de collecteur d'admission",
                  "level": 4,
                  "children": {
                    "Joint d'étanchéité, collecteur d'admission": {
                      "categoryId": 100229,
                      "categoryName": "Intake Manifold Gasket",
                      "level": 3,
                      "children": [],
                      "productId": 42
                    }
                  }
                }
              },
              "productId": 42
            },
            "Joint d'étanchéité, couvercle de carter de distribution": {
              "categoryId": 100223,
              "categoryName": "Gaskets",
              "level": 2,
              "children": {
                "Joint de carter de distribution": {
                  "categoryId": null,
                  "categoryName": "Joint de carter de distribution",
                  "level": 4,
                  "children": {
                    "Joint d'étanchéité, couvercle de carter de distribution": {
                      "categoryId": 100235,
                      "categoryName": "Timing Case Gasket",
                      "level": 3,
                      "children": [],
                      "productId": 569
                    }
                  }
                }
              },
              "productId": 569
            },
            "Joint d'étanchéité, culasse": {
              "categoryId": 100223,
              "categoryName": "Gaskets",
              "level": 2,
              "children": {
                "Joint de culasse": {
                  "categoryId": null,
                  "categoryName": "Joint de culasse",
                  "level": 4,
                  "children": {
                    "Joint d'étanchéité, culasse": {
                      "categoryId": 100225,
                      "categoryName": "Cylinder Head Gasket",
                      "level": 3,
                      "children": [],
                      "productId": 318
                    }
                  }
                }
              },
              "productId": 318
            },
            "Joint d'étanchéité, pompe à eau": {
              "categoryId": 100223,
              "categoryName": "Gaskets",
              "level": 2,
              "children": {
                "Joint d'eau de refroidissement": {
                  "categoryId": null,
                  "categoryName": "Joint d'eau de refroidissement",
                  "level": 4,
                  "children": {
                    "Joint d'étanchéité, pompe à eau": {
                      "categoryId": 100683,
                      "categoryName": "Coolant Circuit Seals",
                      "level": 3,
                      "children": [],
                      "productId": 314
                    }
                  }
                }
              },
              "productId": 314
            },
            "Joint de cache culbuteurs": {
              "categoryId": 100223,
              "categoryName": "Gaskets",
              "level": 2,
              "children": {
                "Cache-soupape": {
                  "categoryId": null,
                  "categoryName": "Cache-soupape",
                  "level": 4,
                  "children": {
                    "Joint de cache culbuteurs": {
                      "categoryId": 100227,
                      "categoryName": "Valve Cover Gasket",
                      "level": 3,
                      "children": [],
                      "productId": 321
                    }
                  }
                }
              },
              "productId": 321
            }
          }
        },
        "Lubrification": {
          "categoryId": null,
          "categoryName": "Lubrification",
          "level": 2,
          "children": {
            "Joint d'étanchéité, carter d'huile": {
              "categoryId": 100245,
              "categoryName": "Lubrication",
              "level": 2,
              "children": {
                "Carter d'huile et pièces de montage": {
                  "categoryId": null,
                  "categoryName": "Carter d'huile et pièces de montage",
                  "level": 4,
                  "children": {
                    "Joint d'étanchéité, carter d'huile": {
                      "categoryId": 100475,
                      "categoryName": "Oil Sump/Attachment Parts",
                      "level": 3,
                      "children": {
                        "Joint": {
                          "categoryId": null,
                          "categoryName": "Joint",
                          "level": 6,
                          "children": {
                            "Joint d'étanchéité, carter d'huile": {
                              "categoryId": 100490,
                              "categoryName": "Seal",
                              "level": 4,
                              "children": [],
                              "productId": 455
                            }
                          }
                        }
                      },
                      "productId": 455
                    }
                  }
                }
              },
              "productId": 455
            }
          }
        }
      }
    },
    "Nettoyage des vitres": {
      "categoryId": 100018,
      "categoryName": "Nettoyage des vitres",
      "level": 1,
      "children": {
        "Pompe-à-eau / essuie-glaces": {
          "categoryId": null,
          "categoryName": "Pompe-à-eau / essuie-glaces",
          "level": 2,
          "children": {
            "Joint, réservoir/pompe de l'eau d'essuyage": {
              "categoryId": 100135,
              "categoryName": "Washer Fluid Pump",
              "level": 2,
              "children": [],
              "productId": 3108
            }
          }
        },
        "Réservoir d'eau de lavage / conduite": {
          "categoryId": null,
          "categoryName": "Réservoir d'eau de lavage / conduite",
          "level": 2,
          "children": {
            "Joint, réservoir/pompe de l'eau d'essuyage": {
              "categoryId": 100610,
              "categoryName": "Water Tank/ Pipe, windscreen",
              "level": 2,
              "children": [],
              "productId": 3108
            }
          }
        }
      }
    },
    "Pièces de maintenance": {
      "categoryId": 100019,
      "categoryName": "Pièces de maintenance",
      "level": 1,
      "children": {
        "Intervalle": {
          "categoryId": null,
          "categoryName": "Intervalle",
          "level": 2,
          "children": {
            "Joint, carter d'huile-boîte automatique": {
              "categoryId": 100597,
              "categoryName": "Service Intervals",
              "level": 2,
              "children": [],
              "productId": 3106
            }
          }
        }
      }
    },
    "Refroidissement": {
      "categoryId": 100007,
      "categoryName": "Refroidissement",
      "level": 1,
      "children": {
        "Pompe à eau / joint": {
          "categoryId": null,
          "categoryName": "Pompe à eau / joint",
          "level": 2,
          "children": {
            "Joint d'étanchéité, pompe à eau": {
              "categoryId": 100088,
              "categoryName": "Water Pump/Gasket",
              "level": 2,
              "children": {
                "Joint": {
                  "categoryId": null,
                  "categoryName": "Joint",
                  "level": 4,
                  "children": {
                    "Joint d'étanchéité, pompe à eau": {
                      "categoryId": 100089,
                      "categoryName": "Seal",
                      "level": 3,
                      "children": [],
                      "productId": 314
                    }
                  }
                }
              },
              "productId": 314
            }
          }
        }
      }
    }
  },
  "arborescenceText": "├── Boîte de vitesses [ID: 100238] (Niveau 1)\n│   ├── Boîte de vitesse automatique (Niveau 2)\n│   │   ├── Automatic Transmission [ID: 100240] (Niveau 2) → ProductId: 147\n│   │   │   └── Joints (Niveau 4)\n│   │   │       └── Gaskets/Seals [ID: 100770] (Niveau 3) → ProductId: 147\n│   │   └── Automatic Transmission [ID: 100240] (Niveau 2) → ProductId: 3106\n│   │       └── Carter d'huile et pièces de montage (Niveau 4)\n│   │           └── Oil Sump/Attachment Parts [ID: 101853] (Niveau 3) → ProductId: 3106\n│   │               └── Joint (Niveau 6)\n│   │                   └── Seal [ID: 101855] (Niveau 4) → ProductId: 3106\n│   └── Boîte de vitesses manuelle (Niveau 2)\n│       └── Manual Transmission [ID: 100239] (Niveau 2) → ProductId: 3990\n│           └── Joints (Niveau 4)\n│               └── Gaskets/Seals [ID: 100769] (Niveau 3) → ProductId: 3990\n\n├── Entraînement des essieux [ID: 100400] (Niveau 1)\n│   └── Différentiel (Niveau 2)\n│       ├── Differential [ID: 100415] (Niveau 2) → ProductId: 628\n│       └── Differential [ID: 100415] (Niveau 2) → ProductId: 9051\n\n├── Moteur [ID: 100002] (Niveau 1)\n│   ├── Carter de vilebrequin (Niveau 2)\n│   │   └── Crankcase [ID: 100514] (Niveau 2) → ProductId: 3815\n│   │       └── Carter de vilebrequin (Niveau 4)\n│   │           └── Crankcase [ID: 100533] (Niveau 3) → ProductId: 3815\n│   ├── Culasse / pieces de montage (Niveau 2)\n│   │   ├── Cylinder Head/Attachment Parts [ID: 100373] (Niveau 2) → ProductId: 42\n│   │   │   └── Joint de collecteur d'admission/des gaz d'échappement (Niveau 4)\n│   │   │       └── Intake-/Exhaust Manifold Gasket/-seal ring [ID: 100376] (Niveau 3) → ProductId: 42\n│   │   ├── Cylinder Head/Attachment Parts [ID: 100373] (Niveau 2) → ProductId: 318\n│   │   │   └── Joint de culasse (Niveau 4)\n│   │   │       └── Cylinder Head Gasket [ID: 100374] (Niveau 3) → ProductId: 318\n│   │   └── Cylinder Head/Attachment Parts [ID: 100373] (Niveau 2) → ProductId: 321\n│   │       └── Cache-soupape (Niveau 4)\n│   │           └── Cylinder Head Cover/-Gasket [ID: 100375] (Niveau 3) → ProductId: 321\n│   ├── Distribution moteur (Niveau 2)\n│   │   ├── Engine Timing [ID: 100003] (Niveau 2) → ProductId: 568\n│   │   │   └── Carter de distribution / joint (Niveau 4)\n│   │   │       └── Timing Case/Gasket [ID: 100401] (Niveau 3) → ProductId: 568\n│   │   └── Engine Timing [ID: 100003] (Niveau 2) → ProductId: 569\n│   │       └── Carter de distribution / joint (Niveau 4)\n│   │           └── Timing Case/Gasket [ID: 100401] (Niveau 3) → ProductId: 569\n│   ├── Joints (Niveau 2)\n│   │   ├── Gaskets [ID: 100223] (Niveau 2) → ProductId: 455\n│   │   │   ├── Joint de circuit d'huile (Niveau 4)\n│   │   │   │   └── Oil Circuit Seals [ID: 100684] (Niveau 3) → ProductId: 455\n│   │   │   └── Joint du réservoir d'huile (Niveau 4)\n│   │   │       └── Oil Sump Gasket [ID: 100234] (Niveau 3) → ProductId: 455\n│   │   ├── Gaskets [ID: 100223] (Niveau 2) → ProductId: 568\n│   │   │   └── Joint de carter de distribution (Niveau 4)\n│   │   │       └── Timing Case Gasket [ID: 100235] (Niveau 3) → ProductId: 568\n│   │   ├── Gaskets [ID: 100223] (Niveau 2) → ProductId: 42\n│   │   │   └── Joint de collecteur d'admission (Niveau 4)\n│   │   │       └── Intake Manifold Gasket [ID: 100229] (Niveau 3) → ProductId: 42\n│   │   ├── Gaskets [ID: 100223] (Niveau 2) → ProductId: 569\n│   │   │   └── Joint de carter de distribution (Niveau 4)\n│   │   │       └── Timing Case Gasket [ID: 100235] (Niveau 3) → ProductId: 569\n│   │   ├── Gaskets [ID: 100223] (Niveau 2) → ProductId: 318\n│   │   │   └── Joint de culasse (Niveau 4)\n│   │   │       └── Cylinder Head Gasket [ID: 100225] (Niveau 3) → ProductId: 318\n│   │   ├── Gaskets [ID: 100223] (Niveau 2) → ProductId: 314\n│   │   │   └── Joint d'eau de refroidissement (Niveau 4)\n│   │   │       └── Coolant Circuit Seals [ID: 100683] (Niveau 3) → ProductId: 314\n│   │   └── Gaskets [ID: 100223] (Niveau 2) → ProductId: 321\n│   │       └── Cache-soupape (Niveau 4)\n│   │           └── Valve Cover Gasket [ID: 100227] (Niveau 3) → ProductId: 321\n│   └── Lubrification (Niveau 2)\n│       └── Lubrication [ID: 100245] (Niveau 2) → ProductId: 455\n│           └── Carter d'huile et pièces de montage (Niveau 4)\n│               └── Oil Sump/Attachment Parts [ID: 100475] (Niveau 3) → ProductId: 455\n│                   └── Joint (Niveau 6)\n│                       └── Seal [ID: 100490] (Niveau 4) → ProductId: 455\n\n├── Nettoyage des vitres [ID: 100018] (Niveau 1)\n│   ├── Pompe-à-eau / essuie-glaces (Niveau 2)\n│   │   └── Washer Fluid Pump [ID: 100135] (Niveau 2) → ProductId: 3108\n│   └── Réservoir d'eau de lavage / conduite (Niveau 2)\n│       └── Water Tank/ Pipe, windscreen [ID: 100610] (Niveau 2) → ProductId: 3108\n\n├── Pièces de maintenance [ID: 100019] (Niveau 1)\n│   └── Intervalle (Niveau 2)\n│       └── Service Intervals [ID: 100597] (Niveau 2) → ProductId: 3106\n\n└── Refroidissement [ID: 100007] (Niveau 1)\n    └── Pompe à eau / joint (Niveau 2)\n        └── Water Pump/Gasket [ID: 100088] (Niveau 2) → ProductId: 314\n            └── Joint (Niveau 4)\n                └── Seal [ID: 100089] (Niveau 3) → ProductId: 314",
  "arborescencePaths": [
    {
      "path": [
        "Boîte de vitesses",
        "Boîte de vitesse automatique",
        "Automatic Transmission"
      ],
      "categoryIds": [
        100238,
        null,
        100240
      ],
      "finalCategoryId": 100240,
      "productId": 147
    },
    {
      "path": [
        "Boîte de vitesses",
        "Boîte de vitesse automatique",
        "Automatic Transmission"
      ],
      "categoryIds": [
        100238,
        null,
        100240
      ],
      "finalCategoryId": 100240,
      "productId": 3106
    },
    {
      "path": [
        "Boîte de vitesses",
        "Boîte de vitesses manuelle",
        "Manual Transmission"
      ],
      "categoryIds": [
        100238,
        null,
        100239
      ],
      "finalCategoryId": 100239,
      "productId": 3990
    },
    {
      "path": [
        "Entraînement des essieux",
        "Différentiel",
        "Differential"
      ],
      "categoryIds": [
        100400,
        null,
        100415
      ],
      "finalCategoryId": 100415,
      "productId": 628
    },
    {
      "path": [
        "Entraînement des essieux",
        "Différentiel",
        "Differential"
      ],
      "categoryIds": [
        100400,
        null,
        100415
      ],
      "finalCategoryId": 100415,
      "productId": 9051
    },
    {
      "path": [
        "Moteur",
        "Carter de vilebrequin",
        "Crankcase"
      ],
      "categoryIds": [
        100002,
        null,
        100514
      ],
      "finalCategoryId": 100514,
      "productId": 3815
    },
    {
      "path": [
        "Moteur",
        "Culasse / pieces de montage",
        "Cylinder Head/Attachment Parts"
      ],
      "categoryIds": [
        100002,
        null,
        100373
      ],
      "finalCategoryId": 100373,
      "productId": 42
    },
    {
      "path": [
        "Moteur",
        "Culasse / pieces de montage",
        "Cylinder Head/Attachment Parts"
      ],
      "categoryIds": [
        100002,
        null,
        100373
      ],
      "finalCategoryId": 100373,
      "productId": 318
    },
    {
      "path": [
        "Moteur",
        "Culasse / pieces de montage",
        "Cylinder Head/Attachment Parts"
      ],
      "categoryIds": [
        100002,
        null,
        100373
      ],
      "finalCategoryId": 100373,
      "productId": 321
    },
    {
      "path": [
        "Moteur",
        "Distribution moteur",
        "Engine Timing"
      ],
      "categoryIds": [
        100002,
        null,
        100003
      ],
      "finalCategoryId": 100003,
      "productId": 568
    },
    {
      "path": [
        "Moteur",
        "Distribution moteur",
        "Engine Timing"
      ],
      "categoryIds": [
        100002,
        null,
        100003
      ],
      "finalCategoryId": 100003,
      "productId": 569
    },
    {
      "path": [
        "Moteur",
        "Joints",
        "Gaskets"
      ],
      "categoryIds": [
        100002,
        null,
        100223
      ],
      "finalCategoryId": 100223,
      "productId": 455
    },
    {
      "path": [
        "Moteur",
        "Joints",
        "Gaskets"
      ],
      "categoryIds": [
        100002,
        null,
        100223
      ],
      "finalCategoryId": 100223,
      "productId": 568
    },
    {
      "path": [
        "Moteur",
        "Joints",
        "Gaskets"
      ],
      "categoryIds": [
        100002,
        null,
        100223
      ],
      "finalCategoryId": 100223,
      "productId": 42
    },
    {
      "path": [
        "Moteur",
        "Joints",
        "Gaskets"
      ],
      "categoryIds": [
        100002,
        null,
        100223
      ],
      "finalCategoryId": 100223,
      "productId": 569
    },
    {
      "path": [
        "Moteur",
        "Joints",
        "Gaskets"
      ],
      "categoryIds": [
        100002,
        null,
        100223
      ],
      "finalCategoryId": 100223,
      "productId": 318
    },
    {
      "path": [
        "Moteur",
        "Joints",
        "Gaskets"
      ],
      "categoryIds": [
        100002,
        null,
        100223
      ],
      "finalCategoryId": 100223,
      "productId": 314
    },
    {
      "path": [
        "Moteur",
        "Joints",
        "Gaskets"
      ],
      "categoryIds": [
        100002,
        null,
        100223
      ],
      "finalCategoryId": 100223,
      "productId": 321
    },
    {
      "path": [
        "Moteur",
        "Lubrification",
        "Lubrication"
      ],
      "categoryIds": [
        100002,
        null,
        100245
      ],
      "finalCategoryId": 100245,
      "productId": 455
    },
    {
      "path": [
        "Nettoyage des vitres",
        "Pompe-à-eau / essuie-glaces",
        "Washer Fluid Pump"
      ],
      "categoryIds": [
        100018,
        null,
        100135
      ],
      "finalCategoryId": 100135,
      "productId": 3108
    },
    {
      "path": [
        "Nettoyage des vitres",
        "Réservoir d'eau de lavage / conduite",
        "Water Tank/ Pipe, windscreen"
      ],
      "categoryIds": [
        100018,
        null,
        100610
      ],
      "finalCategoryId": 100610,
      "productId": 3108
    },
    {
      "path": [
        "Pièces de maintenance",
        "Intervalle",
        "Service Intervals"
      ],
      "categoryIds": [
        100019,
        null,
        100597
      ],
      "finalCategoryId": 100597,
      "productId": 3106
    },
    {
      "path": [
        "Refroidissement",
        "Pompe à eau / joint",
        "Water Pump/Gasket"
      ],
      "categoryIds": [
        100007,
        null,
        100088
      ],
      "finalCategoryId": 100088,
      "productId": 314
    }
  ],
  "productIdsInArbo": [
    42,
    147,
    314,
    318,
    321,
    455,
    568,
    569,
    628,
    3106,
    3108,
    3815,
    3990,
    9051
  ],
  "closestProductIds": [
    {
      "productId": 42,
      "productName": "Joint d'étanchéité, collecteur d'admission"
    },
    {
      "productId": 147,
      "productName": "Joint d'étanchéité, boîte automatique"
    },
    {
      "productId": 314,
      "productName": "Joint d'étanchéité, pompe à eau"
    },
    {
      "productId": 318,
      "productName": "Joint d'étanchéité, culasse"
    },
    {
      "productId": 321,
      "productName": "Joint de cache culbuteurs"
    }
  ]
}