{
  "productName": "Nez à souder, sonde Lamba",
  "searchText": "Nez à souder, sonde Lamba",
  "found": true,
  "hasMatch": true,
  "timestamp": "2025-12-02T21:17:06.245Z",
  "productId": 4282,
  "arborescence": {
    "Carburation": {
      "categoryId": 100254,
      "categoryName": "Carburation",
      "level": 1,
      "children": {
        "Épuration des gaz d'échappement": {
          "categoryId": null,
          "categoryName": "Épuration des gaz d'échappement",
          "level": 2,
          "children": {
            "Nez à souder, sonde Lamba": {
              "categoryId": 100790,
              "categoryName": "Exhaust Emission Control",
              "level": 2,
              "children": {
                "Régulation lambda": {
                  "categoryId": null,
                  "categoryName": "Régulation lambda",
                  "level": 4,
                  "children": {
                    "Nez à souder, sonde Lamba": {
                      "categoryId": 100793,
                      "categoryName": "Lambda Control",
                      "level": 3,
                      "children": [],
                      "productId": 4282
                    }
                  }
                }
              },
              "productId": 4282
            }
          }
        }
      }
    },
    "Échappement": {
      "categoryId": 100004,
      "categoryName": "Échappement",
      "level": 1,
      "children": {
        "Capteur lambda": {
          "categoryId": null,
          "categoryName": "Capteur lambda",
          "level": 2,
          "children": {
            "Nez à souder, sonde Lamba": {
              "categoryId": 100048,
              "categoryName": "Oxygen Sensor",
              "level": 2,
              "children": [],
              "productId": 4282
            }
          }
        }
      }
    },
    "Moteur": {
      "categoryId": 100002,
      "categoryName": "Moteur",
      "level": 1,
      "children": {
        "Épuration des gaz d'échappement": {
          "categoryId": null,
          "categoryName": "Épuration des gaz d'échappement",
          "level": 2,
          "children": {
            "Nez à souder, sonde Lamba": {
              "categoryId": 100541,
              "categoryName": "Exhaust Emission Control",
              "level": 2,
              "children": {
                "Régulation lambda": {
                  "categoryId": null,
                  "categoryName": "Régulation lambda",
                  "level": 4,
                  "children": {
                    "Nez à souder, sonde Lamba": {
                      "categoryId": 100729,
                      "categoryName": "Lambda Control",
                      "level": 3,
                      "children": [],
                      "productId": 4282
                    }
                  }
                }
              },
              "productId": 4282
            }
          }
        }
      }
    }
  },
  "arborescenceText": "├── Carburation [ID: 100254] (Niveau 1)\n│   └── Épuration des gaz d'échappement (Niveau 2)\n│       └── Exhaust Emission Control [ID: 100790] (Niveau 2) → ProductId: 4282\n│           └── Régulation lambda (Niveau 4)\n│               └── Lambda Control [ID: 100793] (Niveau 3) → ProductId: 4282\n\n├── Échappement [ID: 100004] (Niveau 1)\n│   └── Capteur lambda (Niveau 2)\n│       └── Oxygen Sensor [ID: 100048] (Niveau 2) → ProductId: 4282\n\n└── Moteur [ID: 100002] (Niveau 1)\n    └── Épuration des gaz d'échappement (Niveau 2)\n        └── Exhaust Emission Control [ID: 100541] (Niveau 2) → ProductId: 4282\n            └── Régulation lambda (Niveau 4)\n                └── Lambda Control [ID: 100729] (Niveau 3) → ProductId: 4282",
  "arborescencePaths": [
    {
      "path": [
        "Carburation",
        "Épuration des gaz d'échappement",
        "Exhaust Emission Control"
      ],
      "categoryIds": [
        100254,
        null,
        100790
      ],
      "finalCategoryId": 100790,
      "productId": 4282
    },
    {
      "path": [
        "Échappement",
        "Capteur lambda",
        "Oxygen Sensor"
      ],
      "categoryIds": [
        100004,
        null,
        100048
      ],
      "finalCategoryId": 100048,
      "productId": 4282
    },
    {
      "path": [
        "Moteur",
        "Épuration des gaz d'échappement",
        "Exhaust Emission Control"
      ],
      "categoryIds": [
        100002,
        null,
        100541
      ],
      "finalCategoryId": 100541,
      "productId": 4282
    }
  ],
  "productIdsInArbo": [
    4282
  ],
  "matchedProductIds": [
    4282
  ]
}