{
  "productName": "Panneau",
  "searchText": "Panneau",
  "found": true,
  "hasMatch": false,
  "timestamp": "2025-12-02T21:18:51.759Z",
  "productId": 1480,
  "arborescence": {
    "Carrosserie": {
      "categoryId": 100001,
      "categoryName": "Carrosserie",
      "level": 1,
      "children": {
        "Arrière de la voiture": {
          "categoryId": null,
          "categoryName": "Arrière de la voiture",
          "level": 2,
          "children": {
            "Baguette et bande protectrice, panneau latérale": {
              "categoryId": 101705,
              "categoryName": "Vehicle Rear",
              "level": 2,
              "children": {
                "Composants/suppléments": {
                  "categoryId": null,
                  "categoryName": "Composants/suppléments",
                  "level": 4,
                  "children": {
                    "Baguette et bande protectrice, panneau latérale": {
                      "categoryId": 101745,
                      "categoryName": "Parts",
                      "level": 3,
                      "children": {
                        "Enjoliveur/bande protectrice": {
                          "categoryId": null,
                          "categoryName": "Enjoliveur/bande protectrice",
                          "level": 6,
                          "children": {
                            "Baguette et bande protectrice, panneau latérale": {
                              "categoryId": 101750,
                              "categoryName": "Trim/Protection Strips",
                              "level": 4,
                              "children": [],
                              "productId": 1003
                            }
                          }
                        }
                      },
                      "productId": 1003
                    }
                  }
                }
              },
              "productId": 1003
            },
            "Insonoristaion du compartiment moteur": {
              "categoryId": 101705,
              "categoryName": "Vehicle Rear",
              "level": 2,
              "children": {
                "Capot avant / composants / insonorisation": {
                  "categoryId": null,
                  "categoryName": "Capot avant / composants / insonorisation",
                  "level": 4,
                  "children": {
                    "Insonoristaion du compartiment moteur": {
                      "categoryId": 101783,
                      "categoryName": "Bonnet/Parts/Noise Insulation",
                      "level": 3,
                      "children": [],
                      "productId": 1353
                    }
                  }
                }
              },
              "productId": 1353
            },
            "Panneau arrière": {
              "categoryId": 101705,
              "categoryName": "Vehicle Rear",
              "level": 2,
              "children": {
                "Recouvrement": {
                  "categoryId": null,
                  "categoryName": "Recouvrement",
                  "level": 4,
                  "children": {
                    "Panneau arrière": {
                      "categoryId": 101708,
                      "categoryName": "Panelling",
                      "level": 3,
                      "children": [],
                      "productId": 389
                    }
                  }
                }
              },
              "productId": 389
            },
            "Panneau latéral": {
              "categoryId": 101705,
              "categoryName": "Vehicle Rear",
              "level": 2,
              "children": {
                "Panneau latéral": {
                  "categoryId": null,
                  "categoryName": "Panneau latéral",
                  "level": 4,
                  "children": {
                    "Panneau latéral": {
                      "categoryId": 101780,
                      "categoryName": "Quarter Panel",
                      "level": 3,
                      "children": [],
                      "productId": 901
                    }
                  }
                },
                "Réservoir de carburant/composants": {
                  "categoryId": null,
                  "categoryName": "Réservoir de carburant/composants",
                  "level": 4,
                  "children": {
                    "Panneau latéral": {
                      "categoryId": 101763,
                      "categoryName": "Fuel Tank/Parts",
                      "level": 3,
                      "children": [],
                      "productId": 901
                    }
                  }
                }
              },
              "productId": 901
            }
          }
        },
        "Avant du véhicule": {
          "categoryId": null,
          "categoryName": "Avant du véhicule",
          "level": 2,
          "children": {
            "Insonoristaion du compartiment moteur": {
              "categoryId": 101648,
              "categoryName": "Vehicle Front",
              "level": 2,
              "children": {
                "Capot avant / composants / insonorisation": {
                  "categoryId": null,
                  "categoryName": "Capot avant / composants / insonorisation",
                  "level": 4,
                  "children": {
                    "Insonoristaion du compartiment moteur": {
                      "categoryId": 101654,
                      "categoryName": "Bonnet/Parts/Noise Insulation",
                      "level": 3,
                      "children": [],
                      "productId": 1353
                    }
                  }
                }
              },
              "productId": 1353
            }
          }
        },
        "Grilles décoratives, logos, anti-éclaboussures": {
          "categoryId": null,
          "categoryName": "Grilles décoratives, logos, anti-éclaboussures",
          "level": 2,
          "children": {
            "Baguette et bande protectrice, panneau latérale": {
              "categoryId": 100219,
              "categoryName": "Trim/Protection/Decorative Strips/Emblems",
              "level": 2,
              "children": {
                "Enjoliveur/bande protectrice": {
                  "categoryId": null,
                  "categoryName": "Enjoliveur/bande protectrice",
                  "level": 4,
                  "children": {
                    "Baguette et bande protectrice, panneau latérale": {
                      "categoryId": 100740,
                      "categoryName": "Trim/Protection Strips",
                      "level": 3,
                      "children": [],
                      "productId": 1003
                    }
                  }
                }
              },
              "productId": 1003
            }
          }
        },
        "Habitacle": {
          "categoryId": null,
          "categoryName": "Habitacle",
          "level": 2,
          "children": {
            "Baguette et bande protectrice, panneau latérale": {
              "categoryId": 101690,
              "categoryName": "Passenger Cabin",
              "level": 2,
              "children": {
                "Composants/suppléments": {
                  "categoryId": null,
                  "categoryName": "Composants/suppléments",
                  "level": 4,
                  "children": {
                    "Baguette et bande protectrice, panneau latérale": {
                      "categoryId": 101700,
                      "categoryName": "Parts",
                      "level": 3,
                      "children": {
                        "Enjoliveur/bande protectrice": {
                          "categoryId": null,
                          "categoryName": "Enjoliveur/bande protectrice",
                          "level": 6,
                          "children": {
                            "Baguette et bande protectrice, panneau latérale": {
                              "categoryId": 101702,
                              "categoryName": "Trim/Protection Strips",
                              "level": 4,
                              "children": [],
                              "productId": 1003
                            }
                          }
                        }
                      },
                      "productId": 1003
                    }
                  }
                }
              },
              "productId": 1003
            },
            "Panneau latéral": {
              "categoryId": 101690,
              "categoryName": "Passenger Cabin",
              "level": 2,
              "children": {
                "Panneau latéral": {
                  "categoryId": null,
                  "categoryName": "Panneau latéral",
                  "level": 4,
                  "children": {
                    "Panneau latéral": {
                      "categoryId": 101696,
                      "categoryName": "Quarter Panel",
                      "level": 3,
                      "children": [],
                      "productId": 901
                    }
                  }
                },
                "Réservoir de carburant/composants": {
                  "categoryId": null,
                  "categoryName": "Réservoir de carburant/composants",
                  "level": 4,
                  "children": {
                    "Panneau latéral": {
                      "categoryId": 101760,
                      "categoryName": "Fuel Tank/Parts",
                      "level": 3,
                      "children": [],
                      "productId": 901
                    }
                  }
                }
              },
              "productId": 901
            }
          }
        },
        "Pièces de carrosserie/ailes/pares-chocs": {
          "categoryId": null,
          "categoryName": "Pièces de carrosserie/ailes/pares-chocs",
          "level": 2,
          "children": {
            "Panneau arrière": {
              "categoryId": 100743,
              "categoryName": "Body Parts/Wing/Bumper",
              "level": 2,
              "children": {
                "Revêtement arrière": {
                  "categoryId": null,
                  "categoryName": "Revêtement arrière",
                  "level": 4,
                  "children": {
                    "Panneau arrière": {
                      "categoryId": 100739,
                      "categoryName": "Rear-End Cowling",
                      "level": 3,
                      "children": [],
                      "productId": 389
                    }
                  }
                }
              },
              "productId": 389
            },
            "Panneau latéral": {
              "categoryId": 100743,
              "categoryName": "Body Parts/Wing/Bumper",
              "level": 2,
              "children": {
                "Panneau latéral": {
                  "categoryId": null,
                  "categoryName": "Panneau latéral",
                  "level": 4,
                  "children": {
                    "Panneau latéral": {
                      "categoryId": 100181,
                      "categoryName": "Quarter Panel",
                      "level": 3,
                      "children": [],
                      "productId": 901
                    }
                  }
                },
                "Passage de roue": {
                  "categoryId": null,
                  "categoryName": "Passage de roue",
                  "level": 4,
                  "children": {
                    "Panneau latéral": {
                      "categoryId": 100165,
                      "categoryName": "Wheelhouse",
                      "level": 3,
                      "children": [],
                      "productId": 901
                    }
                  }
                }
              },
              "productId": 901
            }
          }
        },
        "Réservoir de carburant/composants": {
          "categoryId": null,
          "categoryName": "Réservoir de carburant/composants",
          "level": 2,
          "children": {
            "Panneau latéral": {
              "categoryId": 100216,
              "categoryName": "Fuel Tank/Parts",
              "level": 2,
              "children": [],
              "productId": 901
            }
          }
        },
        "Trappes/capots/portes/toit coul./toit panoram./toit pliant": {
          "categoryId": null,
          "categoryName": "Trappes/capots/portes/toit coul./toit panoram./toit pliant",
          "level": 2,
          "children": {
            "Insonoristaion du compartiment moteur": {
              "categoryId": 100746,
              "categoryName": "Hatches/Bonnets/Doors/Sunroof/Panoramic Roof",
              "level": 2,
              "children": {
                "Capot avant / composants / insonorisation": {
                  "categoryId": null,
                  "categoryName": "Capot avant / composants / insonorisation",
                  "level": 4,
                  "children": {
                    "Insonoristaion du compartiment moteur": {
                      "categoryId": 100184,
                      "categoryName": "Bonnet/Parts/Noise Insulation",
                      "level": 3,
                      "children": [],
                      "productId": 1353
                    }
                  }
                }
              },
              "productId": 1353
            }
          }
        }
      }
    },
    "Dispositif d'attelage/accessoires": {
      "categoryId": 100015,
      "categoryName": "Dispositif d'attelage/accessoires",
      "level": 1,
      "children": {
        "Composants / pièces de montage": {
          "categoryId": null,
          "categoryName": "Composants / pièces de montage",
          "level": 2,
          "children": {
            "Plaque à visser, dispositif d'attelage": {
              "categoryId": 100609,
              "categoryName": "Parts",
              "level": 2,
              "children": [],
              "productId": 45
            }
          }
        }
      }
    },
    "Dispositif de freinage": {
      "categoryId": 100006,
      "categoryName": "Dispositif de freinage",
      "level": 1,
      "children": {
        "Frein à disque": {
          "categoryId": null,
          "categoryName": "Frein à disque",
          "level": 2,
          "children": {
            "Transparent anti-bruit, plaquette de frein (panneau dorsal)": {
              "categoryId": 100626,
              "categoryName": "Disc Brake",
              "level": 2,
              "children": {
                "Accessoires / composants": {
                  "categoryId": null,
                  "categoryName": "Accessoires / composants",
                  "level": 4,
                  "children": {
                    "Transparent anti-bruit, plaquette de frein (panneau dorsal)": {
                      "categoryId": 100630,
                      "categoryName": "Accessories/Parts",
                      "level": 3,
                      "children": [],
                      "productId": 5297
                    }
                  }
                }
              },
              "productId": 5297
            }
          }
        }
      }
    }
  },
  "arborescenceText": "├── Carrosserie [ID: 100001] (Niveau 1)\n│   ├── Arrière de la voiture (Niveau 2)\n│   │   ├── Vehicle Rear [ID: 101705] (Niveau 2) → ProductId: 1003\n│   │   │   └── Composants/suppléments (Niveau 4)\n│   │   │       └── Parts [ID: 101745] (Niveau 3) → ProductId: 1003\n│   │   │           └── Enjoliveur/bande protectrice (Niveau 6)\n│   │   │               └── Trim/Protection Strips [ID: 101750] (Niveau 4) → ProductId: 1003\n│   │   ├── Vehicle Rear [ID: 101705] (Niveau 2) → ProductId: 1353\n│   │   │   └── Capot avant / composants / insonorisation (Niveau 4)\n│   │   │       └── Bonnet/Parts/Noise Insulation [ID: 101783] (Niveau 3) → ProductId: 1353\n│   │   ├── Vehicle Rear [ID: 101705] (Niveau 2) → ProductId: 389\n│   │   │   └── Recouvrement (Niveau 4)\n│   │   │       └── Panelling [ID: 101708] (Niveau 3) → ProductId: 389\n│   │   └── Vehicle Rear [ID: 101705] (Niveau 2) → ProductId: 901\n│   │       ├── Panneau latéral (Niveau 4)\n│   │       │   └── Quarter Panel [ID: 101780] (Niveau 3) → ProductId: 901\n│   │       └── Réservoir de carburant/composants (Niveau 4)\n│   │           └── Fuel Tank/Parts [ID: 101763] (Niveau 3) → ProductId: 901\n│   ├── Avant du véhicule (Niveau 2)\n│   │   └── Vehicle Front [ID: 101648] (Niveau 2) → ProductId: 1353\n│   │       └── Capot avant / composants / insonorisation (Niveau 4)\n│   │           └── Bonnet/Parts/Noise Insulation [ID: 101654] (Niveau 3) → ProductId: 1353\n│   ├── Grilles décoratives, logos, anti-éclaboussures (Niveau 2)\n│   │   └── Trim/Protection/Decorative Strips/Emblems [ID: 100219] (Niveau 2) → ProductId: 1003\n│   │       └── Enjoliveur/bande protectrice (Niveau 4)\n│   │           └── Trim/Protection Strips [ID: 100740] (Niveau 3) → ProductId: 1003\n│   ├── Habitacle (Niveau 2)\n│   │   ├── Passenger Cabin [ID: 101690] (Niveau 2) → ProductId: 1003\n│   │   │   └── Composants/suppléments (Niveau 4)\n│   │   │       └── Parts [ID: 101700] (Niveau 3) → ProductId: 1003\n│   │   │           └── Enjoliveur/bande protectrice (Niveau 6)\n│   │   │               └── Trim/Protection Strips [ID: 101702] (Niveau 4) → ProductId: 1003\n│   │   └── Passenger Cabin [ID: 101690] (Niveau 2) → ProductId: 901\n│   │       ├── Panneau latéral (Niveau 4)\n│   │       │   └── Quarter Panel [ID: 101696] (Niveau 3) → ProductId: 901\n│   │       └── Réservoir de carburant/composants (Niveau 4)\n│   │           └── Fuel Tank/Parts [ID: 101760] (Niveau 3) → ProductId: 901\n│   ├── Pièces de carrosserie/ailes/pares-chocs (Niveau 2)\n│   │   ├── Body Parts/Wing/Bumper [ID: 100743] (Niveau 2) → ProductId: 389\n│   │   │   └── Revêtement arrière (Niveau 4)\n│   │   │       └── Rear-End Cowling [ID: 100739] (Niveau 3) → ProductId: 389\n│   │   └── Body Parts/Wing/Bumper [ID: 100743] (Niveau 2) → ProductId: 901\n│   │       ├── Panneau latéral (Niveau 4)\n│   │       │   └── Quarter Panel [ID: 100181] (Niveau 3) → ProductId: 901\n│   │       └── Passage de roue (Niveau 4)\n│   │           └── Wheelhouse [ID: 100165] (Niveau 3) → ProductId: 901\n│   ├── Réservoir de carburant/composants (Niveau 2)\n│   │   └── Fuel Tank/Parts [ID: 100216] (Niveau 2) → ProductId: 901\n│   └── Trappes/capots/portes/toit coul./toit panoram./toit pliant (Niveau 2)\n│       └── Hatches/Bonnets/Doors/Sunroof/Panoramic Roof [ID: 100746] (Niveau 2) → ProductId: 1353\n│           └── Capot avant / composants / insonorisation (Niveau 4)\n│               └── Bonnet/Parts/Noise Insulation [ID: 100184] (Niveau 3) → ProductId: 1353\n\n├── Dispositif d'attelage/accessoires [ID: 100015] (Niveau 1)\n│   └── Composants / pièces de montage (Niveau 2)\n│       └── Parts [ID: 100609] (Niveau 2) → ProductId: 45\n\n└── Dispositif de freinage [ID: 100006] (Niveau 1)\n    └── Frein à disque (Niveau 2)\n        └── Disc Brake [ID: 100626] (Niveau 2) → ProductId: 5297\n            └── Accessoires / composants (Niveau 4)\n                └── Accessories/Parts [ID: 100630] (Niveau 3) → ProductId: 5297",
  "arborescencePaths": [
    {
      "path": [
        "Carrosserie",
        "Arrière de la voiture",
        "Vehicle Rear"
      ],
      "categoryIds": [
        100001,
        null,
        101705
      ],
      "finalCategoryId": 101705,
      "productId": 1003
    },
    {
      "path": [
        "Carrosserie",
        "Arrière de la voiture",
        "Vehicle Rear"
      ],
      "categoryIds": [
        100001,
        null,
        101705
      ],
      "finalCategoryId": 101705,
      "productId": 1353
    },
    {
      "path": [
        "Carrosserie",
        "Arrière de la voiture",
        "Vehicle Rear"
      ],
      "categoryIds": [
        100001,
        null,
        101705
      ],
      "finalCategoryId": 101705,
      "productId": 389
    },
    {
      "path": [
        "Carrosserie",
        "Arrière de la voiture",
        "Vehicle Rear"
      ],
      "categoryIds": [
        100001,
        null,
        101705
      ],
      "finalCategoryId": 101705,
      "productId": 901
    },
    {
      "path": [
        "Carrosserie",
        "Avant du véhicule",
        "Vehicle Front"
      ],
      "categoryIds": [
        100001,
        null,
        101648
      ],
      "finalCategoryId": 101648,
      "productId": 1353
    },
    {
      "path": [
        "Carrosserie",
        "Grilles décoratives, logos, anti-éclaboussures",
        "Trim/Protection/Decorative Strips/Emblems"
      ],
      "categoryIds": [
        100001,
        null,
        100219
      ],
      "finalCategoryId": 100219,
      "productId": 1003
    },
    {
      "path": [
        "Carrosserie",
        "Habitacle",
        "Passenger Cabin"
      ],
      "categoryIds": [
        100001,
        null,
        101690
      ],
      "finalCategoryId": 101690,
      "productId": 1003
    },
    {
      "path": [
        "Carrosserie",
        "Habitacle",
        "Passenger Cabin"
      ],
      "categoryIds": [
        100001,
        null,
        101690
      ],
      "finalCategoryId": 101690,
      "productId": 901
    },
    {
      "path": [
        "Carrosserie",
        "Pièces de carrosserie/ailes/pares-chocs",
        "Body Parts/Wing/Bumper"
      ],
      "categoryIds": [
        100001,
        null,
        100743
      ],
      "finalCategoryId": 100743,
      "productId": 389
    },
    {
      "path": [
        "Carrosserie",
        "Pièces de carrosserie/ailes/pares-chocs",
        "Body Parts/Wing/Bumper"
      ],
      "categoryIds": [
        100001,
        null,
        100743
      ],
      "finalCategoryId": 100743,
      "productId": 901
    },
    {
      "path": [
        "Carrosserie",
        "Réservoir de carburant/composants",
        "Fuel Tank/Parts"
      ],
      "categoryIds": [
        100001,
        null,
        100216
      ],
      "finalCategoryId": 100216,
      "productId": 901
    },
    {
      "path": [
        "Carrosserie",
        "Trappes/capots/portes/toit coul./toit panoram./toit pliant",
        "Hatches/Bonnets/Doors/Sunroof/Panoramic Roof"
      ],
      "categoryIds": [
        100001,
        null,
        100746
      ],
      "finalCategoryId": 100746,
      "productId": 1353
    },
    {
      "path": [
        "Dispositif d'attelage/accessoires",
        "Composants / pièces de montage",
        "Parts"
      ],
      "categoryIds": [
        100015,
        null,
        100609
      ],
      "finalCategoryId": 100609,
      "productId": 45
    },
    {
      "path": [
        "Dispositif de freinage",
        "Frein à disque",
        "Disc Brake"
      ],
      "categoryIds": [
        100006,
        null,
        100626
      ],
      "finalCategoryId": 100626,
      "productId": 5297
    }
  ],
  "productIdsInArbo": [
    45,
    389,
    901,
    1003,
    1353,
    5297
  ],
  "closestProductIds": [
    {
      "productId": 45,
      "productName": "Plaque à visser, dispositif d'attelage"
    },
    {
      "productId": 389,
      "productName": "Panneau arrière"
    },
    {
      "productId": 901,
      "productName": "Panneau latéral"
    },
    {
      "productId": 1003,
      "productName": "Baguette et bande protectrice, panneau latérale"
    },
    {
      "productId": 1353,
      "productName": "Insonoristaion du compartiment moteur"
    }
  ]
}