{
  "productName": "Panneau latéral",
  "searchText": "Panneau latéral",
  "found": true,
  "hasMatch": true,
  "timestamp": "2025-12-02T21:18:58.790Z",
  "productId": 901,
  "arborescence": {
    "Carrosserie": {
      "categoryId": 100001,
      "categoryName": "Carrosserie",
      "level": 1,
      "children": {
        "Arrière de la voiture": {
          "categoryId": null,
          "categoryName": "Arrière de la voiture",
          "level": 2,
          "children": {
            "Baguette et bande protectrice, panneau latérale": {
              "categoryId": 101705,
              "categoryName": "Vehicle Rear",
              "level": 2,
              "children": {
                "Composants/suppléments": {
                  "categoryId": null,
                  "categoryName": "Composants/suppléments",
                  "level": 4,
                  "children": {
                    "Baguette et bande protectrice, panneau latérale": {
                      "categoryId": 101745,
                      "categoryName": "Parts",
                      "level": 3,
                      "children": {
                        "Enjoliveur/bande protectrice": {
                          "categoryId": null,
                          "categoryName": "Enjoliveur/bande protectrice",
                          "level": 6,
                          "children": {
                            "Baguette et bande protectrice, panneau latérale": {
                              "categoryId": 101750,
                              "categoryName": "Trim/Protection Strips",
                              "level": 4,
                              "children": [],
                              "productId": 1003
                            }
                          }
                        }
                      },
                      "productId": 1003
                    }
                  }
                }
              },
              "productId": 1003
            },
            "Panneau latéral": {
              "categoryId": 101705,
              "categoryName": "Vehicle Rear",
              "level": 2,
              "children": {
                "Panneau latéral": {
                  "categoryId": null,
                  "categoryName": "Panneau latéral",
                  "level": 4,
                  "children": {
                    "Panneau latéral": {
                      "categoryId": 101780,
                      "categoryName": "Quarter Panel",
                      "level": 3,
                      "children": [],
                      "productId": 901
                    }
                  }
                },
                "Réservoir de carburant/composants": {
                  "categoryId": null,
                  "categoryName": "Réservoir de carburant/composants",
                  "level": 4,
                  "children": {
                    "Panneau latéral": {
                      "categoryId": 101763,
                      "categoryName": "Fuel Tank/Parts",
                      "level": 3,
                      "children": [],
                      "productId": 901
                    }
                  }
                }
              },
              "productId": 901
            }
          }
        },
        "Grilles décoratives, logos, anti-éclaboussures": {
          "categoryId": null,
          "categoryName": "Grilles décoratives, logos, anti-éclaboussures",
          "level": 2,
          "children": {
            "Baguette et bande protectrice, panneau latérale": {
              "categoryId": 100219,
              "categoryName": "Trim/Protection/Decorative Strips/Emblems",
              "level": 2,
              "children": {
                "Enjoliveur/bande protectrice": {
                  "categoryId": null,
                  "categoryName": "Enjoliveur/bande protectrice",
                  "level": 4,
                  "children": {
                    "Baguette et bande protectrice, panneau latérale": {
                      "categoryId": 100740,
                      "categoryName": "Trim/Protection Strips",
                      "level": 3,
                      "children": [],
                      "productId": 1003
                    }
                  }
                }
              },
              "productId": 1003
            }
          }
        },
        "Habitacle": {
          "categoryId": null,
          "categoryName": "Habitacle",
          "level": 2,
          "children": {
            "Baguette et bande protectrice, panneau latérale": {
              "categoryId": 101690,
              "categoryName": "Passenger Cabin",
              "level": 2,
              "children": {
                "Composants/suppléments": {
                  "categoryId": null,
                  "categoryName": "Composants/suppléments",
                  "level": 4,
                  "children": {
                    "Baguette et bande protectrice, panneau latérale": {
                      "categoryId": 101700,
                      "categoryName": "Parts",
                      "level": 3,
                      "children": {
                        "Enjoliveur/bande protectrice": {
                          "categoryId": null,
                          "categoryName": "Enjoliveur/bande protectrice",
                          "level": 6,
                          "children": {
                            "Baguette et bande protectrice, panneau latérale": {
                              "categoryId": 101702,
                              "categoryName": "Trim/Protection Strips",
                              "level": 4,
                              "children": [],
                              "productId": 1003
                            }
                          }
                        }
                      },
                      "productId": 1003
                    }
                  }
                }
              },
              "productId": 1003
            },
            "Panneau latéral": {
              "categoryId": 101690,
              "categoryName": "Passenger Cabin",
              "level": 2,
              "children": {
                "Panneau latéral": {
                  "categoryId": null,
                  "categoryName": "Panneau latéral",
                  "level": 4,
                  "children": {
                    "Panneau latéral": {
                      "categoryId": 101696,
                      "categoryName": "Quarter Panel",
                      "level": 3,
                      "children": [],
                      "productId": 901
                    }
                  }
                },
                "Réservoir de carburant/composants": {
                  "categoryId": null,
                  "categoryName": "Réservoir de carburant/composants",
                  "level": 4,
                  "children": {
                    "Panneau latéral": {
                      "categoryId": 101760,
                      "categoryName": "Fuel Tank/Parts",
                      "level": 3,
                      "children": [],
                      "productId": 901
                    }
                  }
                }
              },
              "productId": 901
            }
          }
        },
        "Pièces de carrosserie/ailes/pares-chocs": {
          "categoryId": null,
          "categoryName": "Pièces de carrosserie/ailes/pares-chocs",
          "level": 2,
          "children": {
            "Panneau latéral": {
              "categoryId": 100743,
              "categoryName": "Body Parts/Wing/Bumper",
              "level": 2,
              "children": {
                "Panneau latéral": {
                  "categoryId": null,
                  "categoryName": "Panneau latéral",
                  "level": 4,
                  "children": {
                    "Panneau latéral": {
                      "categoryId": 100181,
                      "categoryName": "Quarter Panel",
                      "level": 3,
                      "children": [],
                      "productId": 901
                    }
                  }
                },
                "Passage de roue": {
                  "categoryId": null,
                  "categoryName": "Passage de roue",
                  "level": 4,
                  "children": {
                    "Panneau latéral": {
                      "categoryId": 100165,
                      "categoryName": "Wheelhouse",
                      "level": 3,
                      "children": [],
                      "productId": 901
                    }
                  }
                }
              },
              "productId": 901
            }
          }
        },
        "Réservoir de carburant/composants": {
          "categoryId": null,
          "categoryName": "Réservoir de carburant/composants",
          "level": 2,
          "children": {
            "Panneau latéral": {
              "categoryId": 100216,
              "categoryName": "Fuel Tank/Parts",
              "level": 2,
              "children": [],
              "productId": 901
            }
          }
        }
      }
    }
  },
  "arborescenceText": "└── Carrosserie [ID: 100001] (Niveau 1)\n    ├── Arrière de la voiture (Niveau 2)\n    │   ├── Vehicle Rear [ID: 101705] (Niveau 2) → ProductId: 1003\n    │   │   └── Composants/suppléments (Niveau 4)\n    │   │       └── Parts [ID: 101745] (Niveau 3) → ProductId: 1003\n    │   │           └── Enjoliveur/bande protectrice (Niveau 6)\n    │   │               └── Trim/Protection Strips [ID: 101750] (Niveau 4) → ProductId: 1003\n    │   └── Vehicle Rear [ID: 101705] (Niveau 2) → ProductId: 901\n    │       ├── Panneau latéral (Niveau 4)\n    │       │   └── Quarter Panel [ID: 101780] (Niveau 3) → ProductId: 901\n    │       └── Réservoir de carburant/composants (Niveau 4)\n    │           └── Fuel Tank/Parts [ID: 101763] (Niveau 3) → ProductId: 901\n    ├── Grilles décoratives, logos, anti-éclaboussures (Niveau 2)\n    │   └── Trim/Protection/Decorative Strips/Emblems [ID: 100219] (Niveau 2) → ProductId: 1003\n    │       └── Enjoliveur/bande protectrice (Niveau 4)\n    │           └── Trim/Protection Strips [ID: 100740] (Niveau 3) → ProductId: 1003\n    ├── Habitacle (Niveau 2)\n    │   ├── Passenger Cabin [ID: 101690] (Niveau 2) → ProductId: 1003\n    │   │   └── Composants/suppléments (Niveau 4)\n    │   │       └── Parts [ID: 101700] (Niveau 3) → ProductId: 1003\n    │   │           └── Enjoliveur/bande protectrice (Niveau 6)\n    │   │               └── Trim/Protection Strips [ID: 101702] (Niveau 4) → ProductId: 1003\n    │   └── Passenger Cabin [ID: 101690] (Niveau 2) → ProductId: 901\n    │       ├── Panneau latéral (Niveau 4)\n    │       │   └── Quarter Panel [ID: 101696] (Niveau 3) → ProductId: 901\n    │       └── Réservoir de carburant/composants (Niveau 4)\n    │           └── Fuel Tank/Parts [ID: 101760] (Niveau 3) → ProductId: 901\n    ├── Pièces de carrosserie/ailes/pares-chocs (Niveau 2)\n    │   └── Body Parts/Wing/Bumper [ID: 100743] (Niveau 2) → ProductId: 901\n    │       ├── Panneau latéral (Niveau 4)\n    │       │   └── Quarter Panel [ID: 100181] (Niveau 3) → ProductId: 901\n    │       └── Passage de roue (Niveau 4)\n    │           └── Wheelhouse [ID: 100165] (Niveau 3) → ProductId: 901\n    └── Réservoir de carburant/composants (Niveau 2)\n        └── Fuel Tank/Parts [ID: 100216] (Niveau 2) → ProductId: 901",
  "arborescencePaths": [
    {
      "path": [
        "Carrosserie",
        "Arrière de la voiture",
        "Vehicle Rear"
      ],
      "categoryIds": [
        100001,
        null,
        101705
      ],
      "finalCategoryId": 101705,
      "productId": 1003
    },
    {
      "path": [
        "Carrosserie",
        "Arrière de la voiture",
        "Vehicle Rear"
      ],
      "categoryIds": [
        100001,
        null,
        101705
      ],
      "finalCategoryId": 101705,
      "productId": 901
    },
    {
      "path": [
        "Carrosserie",
        "Grilles décoratives, logos, anti-éclaboussures",
        "Trim/Protection/Decorative Strips/Emblems"
      ],
      "categoryIds": [
        100001,
        null,
        100219
      ],
      "finalCategoryId": 100219,
      "productId": 1003
    },
    {
      "path": [
        "Carrosserie",
        "Habitacle",
        "Passenger Cabin"
      ],
      "categoryIds": [
        100001,
        null,
        101690
      ],
      "finalCategoryId": 101690,
      "productId": 1003
    },
    {
      "path": [
        "Carrosserie",
        "Habitacle",
        "Passenger Cabin"
      ],
      "categoryIds": [
        100001,
        null,
        101690
      ],
      "finalCategoryId": 101690,
      "productId": 901
    },
    {
      "path": [
        "Carrosserie",
        "Pièces de carrosserie/ailes/pares-chocs",
        "Body Parts/Wing/Bumper"
      ],
      "categoryIds": [
        100001,
        null,
        100743
      ],
      "finalCategoryId": 100743,
      "productId": 901
    },
    {
      "path": [
        "Carrosserie",
        "Réservoir de carburant/composants",
        "Fuel Tank/Parts"
      ],
      "categoryIds": [
        100001,
        null,
        100216
      ],
      "finalCategoryId": 100216,
      "productId": 901
    }
  ],
  "productIdsInArbo": [
    901,
    1003
  ],
  "matchedProductIds": [
    901
  ]
}