{
  "productName": "Patin de butée",
  "searchText": "Patin de butée",
  "found": true,
  "hasMatch": false,
  "timestamp": "2025-12-02T21:19:19.419Z",
  "productId": 3275,
  "arborescence": {
    "Boîte de vitesses": {
      "categoryId": 100238,
      "categoryName": "Boîte de vitesses",
      "level": 1,
      "children": {
        "Boîte de vitesses manuelle": {
          "categoryId": null,
          "categoryName": "Boîte de vitesses manuelle",
          "level": 2,
          "children": {
            "Pièce de pression, corps synchrone": {
              "categoryId": 100239,
              "categoryName": "Manual Transmission",
              "level": 2,
              "children": {
                "Carter/composants": {
                  "categoryId": null,
                  "categoryName": "Carter/composants",
                  "level": 4,
                  "children": {
                    "Pièce de pression, corps synchrone": {
                      "categoryId": 100774,
                      "categoryName": "Transmission Housing/Parts",
                      "level": 3,
                      "children": [],
                      "productId": 60917
                    }
                  }
                }
              },
              "productId": 60917
            }
          }
        },
        "Outils": {
          "categoryId": null,
          "categoryName": "Outils",
          "level": 2,
          "children": {
            "Patin de butée, outil pour double embrayage": {
              "categoryId": 103157,
              "categoryName": "Tools",
              "level": 2,
              "children": [],
              "productId": 8890
            }
          }
        }
      }
    },
    "Dispositif de freinage": {
      "categoryId": 100006,
      "categoryName": "Dispositif de freinage",
      "level": 1,
      "children": {
        "Frein à disque": {
          "categoryId": null,
          "categoryName": "Frein à disque",
          "level": 2,
          "children": {
            "Patin de butée, plaquette de frein à disque": {
              "categoryId": 100626,
              "categoryName": "Disc Brake",
              "level": 2,
              "children": {
                "Accessoires / composants": {
                  "categoryId": null,
                  "categoryName": "Accessoires / composants",
                  "level": 4,
                  "children": {
                    "Patin de butée, plaquette de frein à disque": {
                      "categoryId": 100630,
                      "categoryName": "Accessories/Parts",
                      "level": 3,
                      "children": [],
                      "productId": 400
                    }
                  }
                }
              },
              "productId": 400
            }
          }
        }
      }
    },
    "Moteur": {
      "categoryId": 100002,
      "categoryName": "Moteur",
      "level": 1,
      "children": {
        "Distribution moteur": {
          "categoryId": null,
          "categoryName": "Distribution moteur",
          "level": 2,
          "children": {
            "Patin de butée, soupapes d'admission/d'émission": {
              "categoryId": 100003,
              "categoryName": "Engine Timing",
              "level": 2,
              "children": {
                "Soupape / réglage de soupape": {
                  "categoryId": null,
                  "categoryName": "Soupape / réglage de soupape",
                  "level": 4,
                  "children": {
                    "Patin de butée, soupapes d'admission/d'émission": {
                      "categoryId": 100422,
                      "categoryName": "Valve Train",
                      "level": 3,
                      "children": {
                        "Réglage de soupape": {
                          "categoryId": null,
                          "categoryName": "Réglage de soupape",
                          "level": 6,
                          "children": {
                            "Patin de butée, soupapes d'admission/d'émission": {
                              "categoryId": 100424,
                              "categoryName": "Valve Actuation",
                              "level": 4,
                              "children": [],
                              "productId": 2945
                            }
                          }
                        }
                      },
                      "productId": 2945
                    }
                  }
                }
              },
              "productId": 2945
            }
          }
        },
        "Outils": {
          "categoryId": null,
          "categoryName": "Outils",
          "level": 2,
          "children": {
            "Patin de butée, outil de montage de ressort de soupape": {
              "categoryId": 103129,
              "categoryName": "Tools",
              "level": 2,
              "children": [],
              "productId": 8435
            }
          }
        }
      }
    },
    "Nettoyage des vitres": {
      "categoryId": 100018,
      "categoryName": "Nettoyage des vitres",
      "level": 1,
      "children": {
        "Outils": {
          "categoryId": null,
          "categoryName": "Outils",
          "level": 2,
          "children": {
            "Patin de butée, bras d’essuie-glace": {
              "categoryId": 103410,
              "categoryName": "Tools",
              "level": 2,
              "children": [],
              "productId": 9137
            }
          }
        }
      }
    },
    "Outils spéciaux": {
      "categoryId": 706365,
      "categoryName": "Outils spéciaux",
      "level": 1,
      "children": {
        "Outil d’injection/d’extraction/accessoires": {
          "categoryId": null,
          "categoryName": "Outil d’injection/d’extraction/accessoires",
          "level": 2,
          "children": {
            "Patin de butée, outil d'insertion/d'extraction": {
              "categoryId": 706390,
              "categoryName": "Press-in/Extraction Tools/Accessories",
              "level": 2,
              "children": {
                "Outil d’injection/d’extraction": {
                  "categoryId": null,
                  "categoryName": "Outil d’injection/d’extraction",
                  "level": 4,
                  "children": {
                    "Patin de butée, outil d'insertion/d'extraction": {
                      "categoryId": 706391,
                      "categoryName": "Press-in/Extraction Tools",
                      "level": 3,
                      "children": [],
                      "productId": 8799
                    }
                  }
                }
              },
              "productId": 8799
            }
          }
        }
      }
    },
    "Suspension d'essieu/Guidage des roues/Roues": {
      "categoryId": 100013,
      "categoryName": "Suspension d'essieu/Guidage des roues/Roues",
      "level": 1,
      "children": {
        "Fusée d'essieu / kit de réparation": {
          "categoryId": null,
          "categoryName": "Fusée d'essieu / kit de réparation",
          "level": 2,
          "children": {
            "Patin de butée, pivot de fusée d'essieu": {
              "categoryId": 100207,
              "categoryName": "Steering Knuckle/Repair Kit",
              "level": 2,
              "children": {
                "Pivot de fusée d'essieu": {
                  "categoryId": null,
                  "categoryName": "Pivot de fusée d'essieu",
                  "level": 4,
                  "children": {
                    "Patin de butée, pivot de fusée d'essieu": {
                      "categoryId": 100588,
                      "categoryName": "Kingpin",
                      "level": 3,
                      "children": [],
                      "productId": 4260
                    }
                  }
                }
              },
              "productId": 4260
            }
          }
        },
        "Outils": {
          "categoryId": null,
          "categoryName": "Outils",
          "level": 2,
          "children": {
            "Patin de butée, outil d'insertion/d'extraction": {
              "categoryId": 103159,
              "categoryName": "Tools",
              "level": 2,
              "children": [],
              "productId": 8799
            }
          }
        }
      }
    }
  },
  "arborescenceText": "├── Boîte de vitesses [ID: 100238] (Niveau 1)\n│   ├── Boîte de vitesses manuelle (Niveau 2)\n│   │   └── Manual Transmission [ID: 100239] (Niveau 2) → ProductId: 60917\n│   │       └── Carter/composants (Niveau 4)\n│   │           └── Transmission Housing/Parts [ID: 100774] (Niveau 3) → ProductId: 60917\n│   └── Outils (Niveau 2)\n│       └── Tools [ID: 103157] (Niveau 2) → ProductId: 8890\n\n├── Dispositif de freinage [ID: 100006] (Niveau 1)\n│   └── Frein à disque (Niveau 2)\n│       └── Disc Brake [ID: 100626] (Niveau 2) → ProductId: 400\n│           └── Accessoires / composants (Niveau 4)\n│               └── Accessories/Parts [ID: 100630] (Niveau 3) → ProductId: 400\n\n├── Moteur [ID: 100002] (Niveau 1)\n│   ├── Distribution moteur (Niveau 2)\n│   │   └── Engine Timing [ID: 100003] (Niveau 2) → ProductId: 2945\n│   │       └── Soupape / réglage de soupape (Niveau 4)\n│   │           └── Valve Train [ID: 100422] (Niveau 3) → ProductId: 2945\n│   │               └── Réglage de soupape (Niveau 6)\n│   │                   └── Valve Actuation [ID: 100424] (Niveau 4) → ProductId: 2945\n│   └── Outils (Niveau 2)\n│       └── Tools [ID: 103129] (Niveau 2) → ProductId: 8435\n\n├── Nettoyage des vitres [ID: 100018] (Niveau 1)\n│   └── Outils (Niveau 2)\n│       └── Tools [ID: 103410] (Niveau 2) → ProductId: 9137\n\n├── Outils spéciaux [ID: 706365] (Niveau 1)\n│   └── Outil d’injection/d’extraction/accessoires (Niveau 2)\n│       └── Press-in/Extraction Tools/Accessories [ID: 706390] (Niveau 2) → ProductId: 8799\n│           └── Outil d’injection/d’extraction (Niveau 4)\n│               └── Press-in/Extraction Tools [ID: 706391] (Niveau 3) → ProductId: 8799\n\n└── Suspension d'essieu/Guidage des roues/Roues [ID: 100013] (Niveau 1)\n    ├── Fusée d'essieu / kit de réparation (Niveau 2)\n    │   └── Steering Knuckle/Repair Kit [ID: 100207] (Niveau 2) → ProductId: 4260\n    │       └── Pivot de fusée d'essieu (Niveau 4)\n    │           └── Kingpin [ID: 100588] (Niveau 3) → ProductId: 4260\n    └── Outils (Niveau 2)\n        └── Tools [ID: 103159] (Niveau 2) → ProductId: 8799",
  "arborescencePaths": [
    {
      "path": [
        "Boîte de vitesses",
        "Boîte de vitesses manuelle",
        "Manual Transmission"
      ],
      "categoryIds": [
        100238,
        null,
        100239
      ],
      "finalCategoryId": 100239,
      "productId": 60917
    },
    {
      "path": [
        "Boîte de vitesses",
        "Outils",
        "Tools"
      ],
      "categoryIds": [
        100238,
        null,
        103157
      ],
      "finalCategoryId": 103157,
      "productId": 8890
    },
    {
      "path": [
        "Dispositif de freinage",
        "Frein à disque",
        "Disc Brake"
      ],
      "categoryIds": [
        100006,
        null,
        100626
      ],
      "finalCategoryId": 100626,
      "productId": 400
    },
    {
      "path": [
        "Moteur",
        "Distribution moteur",
        "Engine Timing"
      ],
      "categoryIds": [
        100002,
        null,
        100003
      ],
      "finalCategoryId": 100003,
      "productId": 2945
    },
    {
      "path": [
        "Moteur",
        "Outils",
        "Tools"
      ],
      "categoryIds": [
        100002,
        null,
        103129
      ],
      "finalCategoryId": 103129,
      "productId": 8435
    },
    {
      "path": [
        "Nettoyage des vitres",
        "Outils",
        "Tools"
      ],
      "categoryIds": [
        100018,
        null,
        103410
      ],
      "finalCategoryId": 103410,
      "productId": 9137
    },
    {
      "path": [
        "Outils spéciaux",
        "Outil d’injection/d’extraction/accessoires",
        "Press-in/Extraction Tools/Accessories"
      ],
      "categoryIds": [
        706365,
        null,
        706390
      ],
      "finalCategoryId": 706390,
      "productId": 8799
    },
    {
      "path": [
        "Suspension d'essieu/Guidage des roues/Roues",
        "Fusée d'essieu / kit de réparation",
        "Steering Knuckle/Repair Kit"
      ],
      "categoryIds": [
        100013,
        null,
        100207
      ],
      "finalCategoryId": 100207,
      "productId": 4260
    },
    {
      "path": [
        "Suspension d'essieu/Guidage des roues/Roues",
        "Outils",
        "Tools"
      ],
      "categoryIds": [
        100013,
        null,
        103159
      ],
      "finalCategoryId": 103159,
      "productId": 8799
    }
  ],
  "productIdsInArbo": [
    400,
    2945,
    4260,
    8435,
    8799,
    8890,
    9137,
    60917
  ],
  "closestProductIds": [
    {
      "productId": 400,
      "productName": "Patin de butée, plaquette de frein à disque"
    },
    {
      "productId": 2945,
      "productName": "Patin de butée, soupapes d'admission/d'émission"
    },
    {
      "productId": 4260,
      "productName": "Patin de butée, pivot de fusée d'essieu"
    },
    {
      "productId": 8435,
      "productName": "Patin de butée, outil de montage de ressort de soupape"
    },
    {
      "productId": 8799,
      "productName": "Patin de butée, outil d'insertion/d'extraction"
    }
  ]
}