{
  "productName": "Patte métallique",
  "searchText": "Patte métallique",
  "found": true,
  "hasMatch": false,
  "timestamp": "2025-12-02T21:19:35.751Z",
  "productId": 3767,
  "arborescence": {
    "Chauffage / Ventilation": {
      "categoryId": 100241,
      "categoryName": "Chauffage / Ventilation",
      "level": 1,
      "children": {
        "Gaines/tuyaux": {
          "categoryId": null,
          "categoryName": "Gaines/tuyaux",
          "level": 2,
          "children": {
            "Clip de maintien, gaine de chauffage": {
              "categoryId": 100777,
              "categoryName": "Hoses/Pipes",
              "level": 2,
              "children": [],
              "productId": 6319
            }
          }
        }
      }
    },
    "Dispositif de freinage": {
      "categoryId": 100006,
      "categoryName": "Dispositif de freinage",
      "level": 1,
      "children": {
        "Frein à tambour": {
          "categoryId": null,
          "categoryName": "Frein à tambour",
          "level": 2,
          "children": {
            "Clip de fixation, tige de frein à main": {
              "categoryId": 100627,
              "categoryName": "Drum Brake",
              "level": 2,
              "children": {
                "Accessoires / composants": {
                  "categoryId": null,
                  "categoryName": "Accessoires / composants",
                  "level": 4,
                  "children": {
                    "Clip de fixation, tige de frein à main": {
                      "categoryId": 100634,
                      "categoryName": "Accessories/Parts",
                      "level": 3,
                      "children": [],
                      "productId": 5972
                    }
                  }
                }
              },
              "productId": 5972
            }
          }
        },
        "Levier / câble / tirette": {
          "categoryId": null,
          "categoryName": "Levier / câble / tirette",
          "level": 2,
          "children": {
            "Agrafe de retenue, câble (frein de stationnement)": {
              "categoryId": 100635,
              "categoryName": "Control Levers/Cables",
              "level": 2,
              "children": [],
              "productId": 60439
            }
          }
        }
      }
    },
    "Échappement": {
      "categoryId": 100004,
      "categoryName": "Échappement",
      "level": 1,
      "children": {
        "Turbocompresseur": {
          "categoryId": null,
          "categoryName": "Turbocompresseur",
          "level": 2,
          "children": {
            "Pince de maintien, tuyau d'air de suralimentation": {
              "categoryId": 100872,
              "categoryName": "Charger",
              "level": 2,
              "children": [],
              "productId": 61066
            }
          }
        }
      }
    },
    "Moteur": {
      "categoryId": 100002,
      "categoryName": "Moteur",
      "level": 1,
      "children": {
        "Alimentation en air": {
          "categoryId": null,
          "categoryName": "Alimentation en air",
          "level": 2,
          "children": {
            "Pince de maintien, tuyau d'air de suralimentation": {
              "categoryId": 100383,
              "categoryName": "Air Supply",
              "level": 2,
              "children": {
                "Suralimentation": {
                  "categoryId": null,
                  "categoryName": "Suralimentation",
                  "level": 4,
                  "children": {
                    "Pince de maintien, tuyau d'air de suralimentation": {
                      "categoryId": 100390,
                      "categoryName": "Charging (supercharged/turbocharged)",
                      "level": 3,
                      "children": {
                        "Compresseur/composants": {
                          "categoryId": null,
                          "categoryName": "Compresseur/composants",
                          "level": 6,
                          "children": {
                            "Pince de maintien, tuyau d'air de suralimentation": {
                              "categoryId": 100391,
                              "categoryName": "Charger/-parts",
                              "level": 4,
                              "children": [],
                              "productId": 61066
                            }
                          }
                        }
                      },
                      "productId": 61066
                    }
                  }
                }
              },
              "productId": 61066
            }
          }
        },
        "Lubrification": {
          "categoryId": null,
          "categoryName": "Lubrification",
          "level": 2,
          "children": {
            "Clip de maintien, gicleur": {
              "categoryId": 100245,
              "categoryName": "Lubrication",
              "level": 2,
              "children": {
                "Gicleur": {
                  "categoryId": null,
                  "categoryName": "Gicleur",
                  "level": 4,
                  "children": {
                    "Clip de maintien, gicleur": {
                      "categoryId": 103072,
                      "categoryName": "Oil Jet",
                      "level": 3,
                      "children": [],
                      "productId": 4344
                    }
                  }
                }
              },
              "productId": 4344
            }
          }
        }
      }
    },
    "Suspension d'essieu/Guidage des roues/Roues": {
      "categoryId": 100013,
      "categoryName": "Suspension d'essieu/Guidage des roues/Roues",
      "level": 1,
      "children": {
        "Fusée d'essieu / kit de réparation": {
          "categoryId": null,
          "categoryName": "Fusée d'essieu / kit de réparation",
          "level": 2,
          "children": {
            "Patte, butée (fusée d'essieu)": {
              "categoryId": 100207,
              "categoryName": "Steering Knuckle/Repair Kit",
              "level": 2,
              "children": {
                "Fusée d'essieu": {
                  "categoryId": null,
                  "categoryName": "Fusée d'essieu",
                  "level": 4,
                  "children": {
                    "Patte, butée (fusée d'essieu)": {
                      "categoryId": 100587,
                      "categoryName": "Steering Knuckle",
                      "level": 3,
                      "children": [],
                      "productId": 3760
                    }
                  }
                }
              },
              "productId": 3760
            }
          }
        },
        "Support d'essieu / arbre d'essieu / fixation": {
          "categoryId": null,
          "categoryName": "Support d'essieu / arbre d'essieu / fixation",
          "level": 2,
          "children": {
            "Clip de maintien, butée (corps d'essieu)": {
              "categoryId": 100212,
              "categoryName": "Axle Cross Member/Axle Beam/Axle Beam Mounting",
              "level": 2,
              "children": {
                "Corps de l'essieu": {
                  "categoryId": null,
                  "categoryName": "Corps de l'essieu",
                  "level": 4,
                  "children": {
                    "Clip de maintien, butée (corps d'essieu)": {
                      "categoryId": 100585,
                      "categoryName": "Axle Beam",
                      "level": 3,
                      "children": [],
                      "productId": 5754
                    }
                  }
                }
              },
              "productId": 5754
            },
            "Clip de maintien, rondelle de butée - support de palier": {
              "categoryId": 100212,
              "categoryName": "Axle Cross Member/Axle Beam/Axle Beam Mounting",
              "level": 2,
              "children": {
                "Fixation": {
                  "categoryId": null,
                  "categoryName": "Fixation",
                  "level": 4,
                  "children": {
                    "Clip de maintien, rondelle de butée - support de palier": {
                      "categoryId": 100586,
                      "categoryName": "Axle Mounting",
                      "level": 3,
                      "children": [],
                      "productId": 4340
                    }
                  }
                }
              },
              "productId": 4340
            }
          }
        }
      }
    }
  },
  "arborescenceText": "├── Chauffage / Ventilation [ID: 100241] (Niveau 1)\n│   └── Gaines/tuyaux (Niveau 2)\n│       └── Hoses/Pipes [ID: 100777] (Niveau 2) → ProductId: 6319\n\n├── Dispositif de freinage [ID: 100006] (Niveau 1)\n│   ├── Frein à tambour (Niveau 2)\n│   │   └── Drum Brake [ID: 100627] (Niveau 2) → ProductId: 5972\n│   │       └── Accessoires / composants (Niveau 4)\n│   │           └── Accessories/Parts [ID: 100634] (Niveau 3) → ProductId: 5972\n│   └── Levier / câble / tirette (Niveau 2)\n│       └── Control Levers/Cables [ID: 100635] (Niveau 2) → ProductId: 60439\n\n├── Échappement [ID: 100004] (Niveau 1)\n│   └── Turbocompresseur (Niveau 2)\n│       └── Charger [ID: 100872] (Niveau 2) → ProductId: 61066\n\n├── Moteur [ID: 100002] (Niveau 1)\n│   ├── Alimentation en air (Niveau 2)\n│   │   └── Air Supply [ID: 100383] (Niveau 2) → ProductId: 61066\n│   │       └── Suralimentation (Niveau 4)\n│   │           └── Charging (supercharged/turbocharged) [ID: 100390] (Niveau 3) → ProductId: 61066\n│   │               └── Compresseur/composants (Niveau 6)\n│   │                   └── Charger/-parts [ID: 100391] (Niveau 4) → ProductId: 61066\n│   └── Lubrification (Niveau 2)\n│       └── Lubrication [ID: 100245] (Niveau 2) → ProductId: 4344\n│           └── Gicleur (Niveau 4)\n│               └── Oil Jet [ID: 103072] (Niveau 3) → ProductId: 4344\n\n└── Suspension d'essieu/Guidage des roues/Roues [ID: 100013] (Niveau 1)\n    ├── Fusée d'essieu / kit de réparation (Niveau 2)\n    │   └── Steering Knuckle/Repair Kit [ID: 100207] (Niveau 2) → ProductId: 3760\n    │       └── Fusée d'essieu (Niveau 4)\n    │           └── Steering Knuckle [ID: 100587] (Niveau 3) → ProductId: 3760\n    └── Support d'essieu / arbre d'essieu / fixation (Niveau 2)\n        ├── Axle Cross Member/Axle Beam/Axle Beam Mounting [ID: 100212] (Niveau 2) → ProductId: 5754\n        │   └── Corps de l'essieu (Niveau 4)\n        │       └── Axle Beam [ID: 100585] (Niveau 3) → ProductId: 5754\n        └── Axle Cross Member/Axle Beam/Axle Beam Mounting [ID: 100212] (Niveau 2) → ProductId: 4340\n            └── Fixation (Niveau 4)\n                └── Axle Mounting [ID: 100586] (Niveau 3) → ProductId: 4340",
  "arborescencePaths": [
    {
      "path": [
        "Chauffage / Ventilation",
        "Gaines/tuyaux",
        "Hoses/Pipes"
      ],
      "categoryIds": [
        100241,
        null,
        100777
      ],
      "finalCategoryId": 100777,
      "productId": 6319
    },
    {
      "path": [
        "Dispositif de freinage",
        "Frein à tambour",
        "Drum Brake"
      ],
      "categoryIds": [
        100006,
        null,
        100627
      ],
      "finalCategoryId": 100627,
      "productId": 5972
    },
    {
      "path": [
        "Dispositif de freinage",
        "Levier / câble / tirette",
        "Control Levers/Cables"
      ],
      "categoryIds": [
        100006,
        null,
        100635
      ],
      "finalCategoryId": 100635,
      "productId": 60439
    },
    {
      "path": [
        "Échappement",
        "Turbocompresseur",
        "Charger"
      ],
      "categoryIds": [
        100004,
        null,
        100872
      ],
      "finalCategoryId": 100872,
      "productId": 61066
    },
    {
      "path": [
        "Moteur",
        "Alimentation en air",
        "Air Supply"
      ],
      "categoryIds": [
        100002,
        null,
        100383
      ],
      "finalCategoryId": 100383,
      "productId": 61066
    },
    {
      "path": [
        "Moteur",
        "Lubrification",
        "Lubrication"
      ],
      "categoryIds": [
        100002,
        null,
        100245
      ],
      "finalCategoryId": 100245,
      "productId": 4344
    },
    {
      "path": [
        "Suspension d'essieu/Guidage des roues/Roues",
        "Fusée d'essieu / kit de réparation",
        "Steering Knuckle/Repair Kit"
      ],
      "categoryIds": [
        100013,
        null,
        100207
      ],
      "finalCategoryId": 100207,
      "productId": 3760
    },
    {
      "path": [
        "Suspension d'essieu/Guidage des roues/Roues",
        "Support d'essieu / arbre d'essieu / fixation",
        "Axle Cross Member/Axle Beam/Axle Beam Mounting"
      ],
      "categoryIds": [
        100013,
        null,
        100212
      ],
      "finalCategoryId": 100212,
      "productId": 5754
    },
    {
      "path": [
        "Suspension d'essieu/Guidage des roues/Roues",
        "Support d'essieu / arbre d'essieu / fixation",
        "Axle Cross Member/Axle Beam/Axle Beam Mounting"
      ],
      "categoryIds": [
        100013,
        null,
        100212
      ],
      "finalCategoryId": 100212,
      "productId": 4340
    }
  ],
  "productIdsInArbo": [
    3760,
    4340,
    4344,
    5754,
    5972,
    6319,
    60439,
    61066
  ],
  "closestProductIds": [
    {
      "productId": 3760,
      "productName": "Patte, butée (fusée d'essieu)"
    },
    {
      "productId": 4340,
      "productName": "Clip de maintien, rondelle de butée - support de palier"
    },
    {
      "productId": 4344,
      "productName": "Clip de maintien, gicleur"
    },
    {
      "productId": 5754,
      "productName": "Clip de maintien, butée (corps d'essieu)"
    },
    {
      "productId": 5972,
      "productName": "Clip de fixation, tige de frein à main"
    }
  ]
}