{
  "productName": "Phare chercheur",
  "searchText": "Phare chercheur",
  "found": true,
  "hasMatch": true,
  "timestamp": "2025-12-02T21:19:42.299Z",
  "productId": 717,
  "arborescence": {
    "Carrosserie": {
      "categoryId": 100001,
      "categoryName": "Carrosserie",
      "level": 1,
      "children": {
        "Fixation/Support/collerette": {
          "categoryId": null,
          "categoryName": "Fixation/Support/collerette",
          "level": 2,
          "children": {
            "Cadre, phare chercheur": {
              "categoryId": 101454,
              "categoryName": "Racks/Carriers/Frames",
              "level": 2,
              "children": [],
              "productId": 720
            }
          }
        },
        "Phares supplémentaires/composants": {
          "categoryId": null,
          "categoryName": "Phares supplémentaires/composants",
          "level": 2,
          "children": {
            "Ampoule, phare chercheur": {
              "categoryId": 101340,
              "categoryName": "Additional Headlight/Parts",
              "level": 2,
              "children": {
                "Phare chercheur / composants": {
                  "categoryId": null,
                  "categoryName": "Phare chercheur / composants",
                  "level": 4,
                  "children": {
                    "Ampoule, phare chercheur": {
                      "categoryId": 101353,
                      "categoryName": "Searchlight/Parts",
                      "level": 3,
                      "children": {
                        "Ampoule pour phare chercheur": {
                          "categoryId": null,
                          "categoryName": "Ampoule pour phare chercheur",
                          "level": 6,
                          "children": {
                            "Ampoule, phare chercheur": {
                              "categoryId": 101355,
                              "categoryName": "Searchlight Bulb",
                              "level": 4,
                              "children": [],
                              "productId": 109
                            }
                          }
                        }
                      },
                      "productId": 109
                    }
                  }
                }
              },
              "productId": 109
            },
            "Boîtier, phare chercheur": {
              "categoryId": 101340,
              "categoryName": "Additional Headlight/Parts",
              "level": 2,
              "children": {
                "Phare chercheur / composants": {
                  "categoryId": null,
                  "categoryName": "Phare chercheur / composants",
                  "level": 4,
                  "children": {
                    "Boîtier, phare chercheur": {
                      "categoryId": 101353,
                      "categoryName": "Searchlight/Parts",
                      "level": 3,
                      "children": {
                        "Composants phare chercheur": {
                          "categoryId": null,
                          "categoryName": "Composants phare chercheur",
                          "level": 6,
                          "children": {
                            "Boîtier, phare chercheur": {
                              "categoryId": 101356,
                              "categoryName": "Searchlight Parts",
                              "level": 4,
                              "children": [],
                              "productId": 723
                            }
                          }
                        }
                      },
                      "productId": 723
                    }
                  }
                }
              },
              "productId": 723
            },
            "Cadre, phare chercheur": {
              "categoryId": 101340,
              "categoryName": "Additional Headlight/Parts",
              "level": 2,
              "children": {
                "Phare chercheur / composants": {
                  "categoryId": null,
                  "categoryName": "Phare chercheur / composants",
                  "level": 4,
                  "children": {
                    "Cadre, phare chercheur": {
                      "categoryId": 101353,
                      "categoryName": "Searchlight/Parts",
                      "level": 3,
                      "children": {
                        "Composants phare chercheur": {
                          "categoryId": null,
                          "categoryName": "Composants phare chercheur",
                          "level": 6,
                          "children": {
                            "Cadre, phare chercheur": {
                              "categoryId": 101356,
                              "categoryName": "Searchlight Parts",
                              "level": 4,
                              "children": [],
                              "productId": 720
                            }
                          }
                        }
                      },
                      "productId": 720
                    }
                  }
                }
              },
              "productId": 720
            },
            "Capuchon, phare chercheur": {
              "categoryId": 101340,
              "categoryName": "Additional Headlight/Parts",
              "level": 2,
              "children": {
                "Phare chercheur / composants": {
                  "categoryId": null,
                  "categoryName": "Phare chercheur / composants",
                  "level": 4,
                  "children": {
                    "Capuchon, phare chercheur": {
                      "categoryId": 101353,
                      "categoryName": "Searchlight/Parts",
                      "level": 3,
                      "children": {
                        "Composants phare chercheur": {
                          "categoryId": null,
                          "categoryName": "Composants phare chercheur",
                          "level": 6,
                          "children": {
                            "Capuchon, phare chercheur": {
                              "categoryId": 101356,
                              "categoryName": "Searchlight Parts",
                              "level": 4,
                              "children": [],
                              "productId": 1078
                            }
                          }
                        }
                      },
                      "productId": 1078
                    }
                  }
                }
              },
              "productId": 1078
            },
            "Disperseur, phare chercheur": {
              "categoryId": 101340,
              "categoryName": "Additional Headlight/Parts",
              "level": 2,
              "children": {
                "Phare chercheur / composants": {
                  "categoryId": null,
                  "categoryName": "Phare chercheur / composants",
                  "level": 4,
                  "children": {
                    "Disperseur, phare chercheur": {
                      "categoryId": 101353,
                      "categoryName": "Searchlight/Parts",
                      "level": 3,
                      "children": {
                        "Composants phare chercheur": {
                          "categoryId": null,
                          "categoryName": "Composants phare chercheur",
                          "level": 6,
                          "children": {
                            "Disperseur, phare chercheur": {
                              "categoryId": 101356,
                              "categoryName": "Searchlight Parts",
                              "level": 4,
                              "children": [],
                              "productId": 15
                            }
                          }
                        }
                      },
                      "productId": 15
                    }
                  }
                }
              },
              "productId": 15
            },
            "Douille de lampe, phare chercheur": {
              "categoryId": 101340,
              "categoryName": "Additional Headlight/Parts",
              "level": 2,
              "children": {
                "Phare chercheur / composants": {
                  "categoryId": null,
                  "categoryName": "Phare chercheur / composants",
                  "level": 4,
                  "children": {
                    "Douille de lampe, phare chercheur": {
                      "categoryId": 101353,
                      "categoryName": "Searchlight/Parts",
                      "level": 3,
                      "children": {
                        "Composants phare chercheur": {
                          "categoryId": null,
                          "categoryName": "Composants phare chercheur",
                          "level": 6,
                          "children": {
                            "Douille de lampe, phare chercheur": {
                              "categoryId": 101356,
                              "categoryName": "Searchlight Parts",
                              "level": 4,
                              "children": [],
                              "productId": 486
                            }
                          }
                        }
                      },
                      "productId": 486
                    }
                  }
                }
              },
              "productId": 486
            },
            "Enjoliveur, phare chercheur": {
              "categoryId": 101340,
              "categoryName": "Additional Headlight/Parts",
              "level": 2,
              "children": {
                "Phare chercheur / composants": {
                  "categoryId": null,
                  "categoryName": "Phare chercheur / composants",
                  "level": 4,
                  "children": {
                    "Enjoliveur, phare chercheur": {
                      "categoryId": 101353,
                      "categoryName": "Searchlight/Parts",
                      "level": 3,
                      "children": {
                        "Composants phare chercheur": {
                          "categoryId": null,
                          "categoryName": "Composants phare chercheur",
                          "level": 6,
                          "children": {
                            "Enjoliveur, phare chercheur": {
                              "categoryId": 101356,
                              "categoryName": "Searchlight Parts",
                              "level": 4,
                              "children": [],
                              "productId": 722
                            }
                          }
                        }
                      },
                      "productId": 722
                    }
                  }
                }
              },
              "productId": 722
            },
            "Kit de câbles, phare chercheur": {
              "categoryId": 101340,
              "categoryName": "Additional Headlight/Parts",
              "level": 2,
              "children": {
                "Phare chercheur / composants": {
                  "categoryId": null,
                  "categoryName": "Phare chercheur / composants",
                  "level": 4,
                  "children": {
                    "Kit de câbles, phare chercheur": {
                      "categoryId": 101353,
                      "categoryName": "Searchlight/Parts",
                      "level": 3,
                      "children": {
                        "Composants phare chercheur": {
                          "categoryId": null,
                          "categoryName": "Composants phare chercheur",
                          "level": 6,
                          "children": {
                            "Kit de câbles, phare chercheur": {
                              "categoryId": 101356,
                              "categoryName": "Searchlight Parts",
                              "level": 4,
                              "children": [],
                              "productId": 721
                            }
                          }
                        }
                      },
                      "productId": 721
                    }
                  }
                }
              },
              "productId": 721
            },
            "Optique, phare chercheur": {
              "categoryId": 101340,
              "categoryName": "Additional Headlight/Parts",
              "level": 2,
              "children": {
                "Phare chercheur / composants": {
                  "categoryId": null,
                  "categoryName": "Phare chercheur / composants",
                  "level": 4,
                  "children": {
                    "Optique, phare chercheur": {
                      "categoryId": 101353,
                      "categoryName": "Searchlight/Parts",
                      "level": 3,
                      "children": {
                        "Phare chercheur / optique": {
                          "categoryId": null,
                          "categoryName": "Phare chercheur / optique",
                          "level": 6,
                          "children": {
                            "Optique, phare chercheur": {
                              "categoryId": 101354,
                              "categoryName": "Searchlight/Insert",
                              "level": 4,
                              "children": [],
                              "productId": 90
                            }
                          }
                        }
                      },
                      "productId": 90
                    }
                  }
                }
              },
              "productId": 90
            },
            "Phare chercheur": {
              "categoryId": 101340,
              "categoryName": "Additional Headlight/Parts",
              "level": 2,
              "children": {
                "Phare chercheur / composants": {
                  "categoryId": null,
                  "categoryName": "Phare chercheur / composants",
                  "level": 4,
                  "children": {
                    "Phare chercheur": {
                      "categoryId": 101353,
                      "categoryName": "Searchlight/Parts",
                      "level": 3,
                      "children": {
                        "Phare chercheur / optique": {
                          "categoryId": null,
                          "categoryName": "Phare chercheur / optique",
                          "level": 6,
                          "children": {
                            "Phare chercheur": {
                              "categoryId": 101354,
                              "categoryName": "Searchlight/Insert",
                              "level": 4,
                              "children": [],
                              "productId": 717
                            }
                          }
                        }
                      },
                      "productId": 717
                    }
                  }
                }
              },
              "productId": 717
            },
            "Réflecteur, phare chercheur": {
              "categoryId": 101340,
              "categoryName": "Additional Headlight/Parts",
              "level": 2,
              "children": {
                "Phare chercheur / composants": {
                  "categoryId": null,
                  "categoryName": "Phare chercheur / composants",
                  "level": 4,
                  "children": {
                    "Réflecteur, phare chercheur": {
                      "categoryId": 101353,
                      "categoryName": "Searchlight/Parts",
                      "level": 3,
                      "children": {
                        "Composants phare chercheur": {
                          "categoryId": null,
                          "categoryName": "Composants phare chercheur",
                          "level": 6,
                          "children": {
                            "Réflecteur, phare chercheur": {
                              "categoryId": 101356,
                              "categoryName": "Searchlight Parts",
                              "level": 4,
                              "children": [],
                              "productId": 718
                            }
                          }
                        }
                      },
                      "productId": 718
                    }
                  }
                }
              },
              "productId": 718
            },
            "Support, phare chercheur": {
              "categoryId": 101340,
              "categoryName": "Additional Headlight/Parts",
              "level": 2,
              "children": {
                "Phare chercheur / composants": {
                  "categoryId": null,
                  "categoryName": "Phare chercheur / composants",
                  "level": 4,
                  "children": {
                    "Support, phare chercheur": {
                      "categoryId": 101353,
                      "categoryName": "Searchlight/Parts",
                      "level": 3,
                      "children": {
                        "Composants phare chercheur": {
                          "categoryId": null,
                          "categoryName": "Composants phare chercheur",
                          "level": 6,
                          "children": {
                            "Support, phare chercheur": {
                              "categoryId": 101356,
                              "categoryName": "Searchlight Parts",
                              "level": 4,
                              "children": [],
                              "productId": 103
                            }
                          }
                        }
                      },
                      "productId": 103
                    }
                  }
                }
              },
              "productId": 103
            }
          }
        }
      }
    },
    "Système électrique": {
      "categoryId": 100010,
      "categoryName": "Système électrique",
      "level": 1,
      "children": {
        "Kit/pièces de câble": {
          "categoryId": null,
          "categoryName": "Kit/pièces de câble",
          "level": 2,
          "children": {
            "Kit de câbles, phare chercheur": {
              "categoryId": 103066,
              "categoryName": "Cable Set/individual parts",
              "level": 2,
              "children": [],
              "productId": 721
            }
          }
        },
        "Phares supplémentaires/composants": {
          "categoryId": null,
          "categoryName": "Phares supplémentaires/composants",
          "level": 2,
          "children": {
            "Ampoule, phare chercheur": {
              "categoryId": 100787,
              "categoryName": "Additional Headlight/Parts",
              "level": 2,
              "children": {
                "Phare chercheur / composants": {
                  "categoryId": null,
                  "categoryName": "Phare chercheur / composants",
                  "level": 4,
                  "children": {
                    "Ampoule, phare chercheur": {
                      "categoryId": 100281,
                      "categoryName": "Searchlight/Parts",
                      "level": 3,
                      "children": {
                        "Ampoule pour phare chercheur": {
                          "categoryId": null,
                          "categoryName": "Ampoule pour phare chercheur",
                          "level": 6,
                          "children": {
                            "Ampoule, phare chercheur": {
                              "categoryId": 100449,
                              "categoryName": "Searchlight Bulb",
                              "level": 4,
                              "children": [],
                              "productId": 109
                            }
                          }
                        }
                      },
                      "productId": 109
                    }
                  }
                }
              },
              "productId": 109
            },
            "Boîtier, phare chercheur": {
              "categoryId": 100787,
              "categoryName": "Additional Headlight/Parts",
              "level": 2,
              "children": {
                "Phare chercheur / composants": {
                  "categoryId": null,
                  "categoryName": "Phare chercheur / composants",
                  "level": 4,
                  "children": {
                    "Boîtier, phare chercheur": {
                      "categoryId": 100281,
                      "categoryName": "Searchlight/Parts",
                      "level": 3,
                      "children": {
                        "Composants phare chercheur": {
                          "categoryId": null,
                          "categoryName": "Composants phare chercheur",
                          "level": 6,
                          "children": {
                            "Boîtier, phare chercheur": {
                              "categoryId": 100446,
                              "categoryName": "Searchlight Parts",
                              "level": 4,
                              "children": [],
                              "productId": 723
                            }
                          }
                        }
                      },
                      "productId": 723
                    }
                  }
                }
              },
              "productId": 723
            },
            "Cadre, phare chercheur": {
              "categoryId": 100787,
              "categoryName": "Additional Headlight/Parts",
              "level": 2,
              "children": {
                "Phare chercheur / composants": {
                  "categoryId": null,
                  "categoryName": "Phare chercheur / composants",
                  "level": 4,
                  "children": {
                    "Cadre, phare chercheur": {
                      "categoryId": 100281,
                      "categoryName": "Searchlight/Parts",
                      "level": 3,
                      "children": {
                        "Composants phare chercheur": {
                          "categoryId": null,
                          "categoryName": "Composants phare chercheur",
                          "level": 6,
                          "children": {
                            "Cadre, phare chercheur": {
                              "categoryId": 100446,
                              "categoryName": "Searchlight Parts",
                              "level": 4,
                              "children": [],
                              "productId": 720
                            }
                          }
                        }
                      },
                      "productId": 720
                    }
                  }
                }
              },
              "productId": 720
            },
            "Capuchon, phare chercheur": {
              "categoryId": 100787,
              "categoryName": "Additional Headlight/Parts",
              "level": 2,
              "children": {
                "Phare chercheur / composants": {
                  "categoryId": null,
                  "categoryName": "Phare chercheur / composants",
                  "level": 4,
                  "children": {
                    "Capuchon, phare chercheur": {
                      "categoryId": 100281,
                      "categoryName": "Searchlight/Parts",
                      "level": 3,
                      "children": {
                        "Composants phare chercheur": {
                          "categoryId": null,
                          "categoryName": "Composants phare chercheur",
                          "level": 6,
                          "children": {
                            "Capuchon, phare chercheur": {
                              "categoryId": 100446,
                              "categoryName": "Searchlight Parts",
                              "level": 4,
                              "children": [],
                              "productId": 1078
                            }
                          }
                        }
                      },
                      "productId": 1078
                    }
                  }
                }
              },
              "productId": 1078
            },
            "Disperseur, phare chercheur": {
              "categoryId": 100787,
              "categoryName": "Additional Headlight/Parts",
              "level": 2,
              "children": {
                "Phare chercheur / composants": {
                  "categoryId": null,
                  "categoryName": "Phare chercheur / composants",
                  "level": 4,
                  "children": {
                    "Disperseur, phare chercheur": {
                      "categoryId": 100281,
                      "categoryName": "Searchlight/Parts",
                      "level": 3,
                      "children": {
                        "Composants phare chercheur": {
                          "categoryId": null,
                          "categoryName": "Composants phare chercheur",
                          "level": 6,
                          "children": {
                            "Disperseur, phare chercheur": {
                              "categoryId": 100446,
                              "categoryName": "Searchlight Parts",
                              "level": 4,
                              "children": [],
                              "productId": 15
                            }
                          }
                        }
                      },
                      "productId": 15
                    }
                  }
                }
              },
              "productId": 15
            },
            "Douille de lampe, phare chercheur": {
              "categoryId": 100787,
              "categoryName": "Additional Headlight/Parts",
              "level": 2,
              "children": {
                "Phare chercheur / composants": {
                  "categoryId": null,
                  "categoryName": "Phare chercheur / composants",
                  "level": 4,
                  "children": {
                    "Douille de lampe, phare chercheur": {
                      "categoryId": 100281,
                      "categoryName": "Searchlight/Parts",
                      "level": 3,
                      "children": {
                        "Composants phare chercheur": {
                          "categoryId": null,
                          "categoryName": "Composants phare chercheur",
                          "level": 6,
                          "children": {
                            "Douille de lampe, phare chercheur": {
                              "categoryId": 100446,
                              "categoryName": "Searchlight Parts",
                              "level": 4,
                              "children": [],
                              "productId": 486
                            }
                          }
                        }
                      },
                      "productId": 486
                    }
                  }
                }
              },
              "productId": 486
            },
            "Enjoliveur, phare chercheur": {
              "categoryId": 100787,
              "categoryName": "Additional Headlight/Parts",
              "level": 2,
              "children": {
                "Phare chercheur / composants": {
                  "categoryId": null,
                  "categoryName": "Phare chercheur / composants",
                  "level": 4,
                  "children": {
                    "Enjoliveur, phare chercheur": {
                      "categoryId": 100281,
                      "categoryName": "Searchlight/Parts",
                      "level": 3,
                      "children": {
                        "Composants phare chercheur": {
                          "categoryId": null,
                          "categoryName": "Composants phare chercheur",
                          "level": 6,
                          "children": {
                            "Enjoliveur, phare chercheur": {
                              "categoryId": 100446,
                              "categoryName": "Searchlight Parts",
                              "level": 4,
                              "children": [],
                              "productId": 722
                            }
                          }
                        }
                      },
                      "productId": 722
                    }
                  }
                }
              },
              "productId": 722
            },
            "Jeu de supports, phare supplémentaire": {
              "categoryId": 100787,
              "categoryName": "Additional Headlight/Parts",
              "level": 2,
              "children": {
                "Phare chercheur / composants": {
                  "categoryId": null,
                  "categoryName": "Phare chercheur / composants",
                  "level": 4,
                  "children": {
                    "Jeu de supports, phare supplémentaire": {
                      "categoryId": 100281,
                      "categoryName": "Searchlight/Parts",
                      "level": 3,
                      "children": {
                        "Composants phare chercheur": {
                          "categoryId": null,
                          "categoryName": "Composants phare chercheur",
                          "level": 6,
                          "children": {
                            "Jeu de supports, phare supplémentaire": {
                              "categoryId": 100446,
                              "categoryName": "Searchlight Parts",
                              "level": 4,
                              "children": [],
                              "productId": 2977
                            }
                          }
                        }
                      },
                      "productId": 2977
                    }
                  }
                },
                "Projecteur antibrouillard/ composants": {
                  "categoryId": null,
                  "categoryName": "Projecteur antibrouillard/ composants",
                  "level": 4,
                  "children": {
                    "Jeu de supports, phare supplémentaire": {
                      "categoryId": 100277,
                      "categoryName": "Front Fog Light/Parts",
                      "level": 3,
                      "children": {
                        "Composants pour projecteur antibrouillard": {
                          "categoryId": null,
                          "categoryName": "Composants pour projecteur antibrouillard",
                          "level": 6,
                          "children": {
                            "Jeu de supports, phare supplémentaire": {
                              "categoryId": 100444,
                              "categoryName": "Fog Light Parts",
                              "level": 4,
                              "children": [],
                              "productId": 2977
                            }
                          }
                        }
                      },
                      "productId": 2977
                    }
                  }
                },
                "Projecteur de travail, composants": {
                  "categoryId": null,
                  "categoryName": "Projecteur de travail, composants",
                  "level": 4,
                  "children": {
                    "Jeu de supports, phare supplémentaire": {
                      "categoryId": 100280,
                      "categoryName": "Worklight/Parts",
                      "level": 3,
                      "children": {
                        "Projecteur de travail, composants": {
                          "categoryId": null,
                          "categoryName": "Projecteur de travail, composants",
                          "level": 6,
                          "children": {
                            "Jeu de supports, phare supplémentaire": {
                              "categoryId": 100445,
                              "categoryName": "Worklight Parts",
                              "level": 4,
                              "children": [],
                              "productId": 2977
                            }
                          }
                        }
                      },
                      "productId": 2977
                    }
                  }
                },
                "Projecteur longue portée / composants": {
                  "categoryId": null,
                  "categoryName": "Projecteur longue portée / composants",
                  "level": 4,
                  "children": {
                    "Jeu de supports, phare supplémentaire": {
                      "categoryId": 100276,
                      "categoryName": "Spotlight/Parts",
                      "level": 3,
                      "children": {
                        "Projecteur longue portée / composants": {
                          "categoryId": null,
                          "categoryName": "Projecteur longue portée / composants",
                          "level": 6,
                          "children": {
                            "Jeu de supports, phare supplémentaire": {
                              "categoryId": 100443,
                              "categoryName": "Spotlight Parts",
                              "level": 4,
                              "children": [],
                              "productId": 2977
                            }
                          }
                        }
                      },
                      "productId": 2977
                    }
                  }
                }
              },
              "productId": 2977
            },
            "Kit de câbles, phare chercheur": {
              "categoryId": 100787,
              "categoryName": "Additional Headlight/Parts",
              "level": 2,
              "children": {
                "Phare chercheur / composants": {
                  "categoryId": null,
                  "categoryName": "Phare chercheur / composants",
                  "level": 4,
                  "children": {
                    "Kit de câbles, phare chercheur": {
                      "categoryId": 100281,
                      "categoryName": "Searchlight/Parts",
                      "level": 3,
                      "children": {
                        "Composants phare chercheur": {
                          "categoryId": null,
                          "categoryName": "Composants phare chercheur",
                          "level": 6,
                          "children": {
                            "Kit de câbles, phare chercheur": {
                              "categoryId": 100446,
                              "categoryName": "Searchlight Parts",
                              "level": 4,
                              "children": [],
                              "productId": 721
                            }
                          }
                        }
                      },
                      "productId": 721
                    }
                  }
                }
              },
              "productId": 721
            },
            "Optique, phare chercheur": {
              "categoryId": 100787,
              "categoryName": "Additional Headlight/Parts",
              "level": 2,
              "children": {
                "Phare chercheur / composants": {
                  "categoryId": null,
                  "categoryName": "Phare chercheur / composants",
                  "level": 4,
                  "children": {
                    "Optique, phare chercheur": {
                      "categoryId": 100281,
                      "categoryName": "Searchlight/Parts",
                      "level": 3,
                      "children": {
                        "Phare chercheur / optique": {
                          "categoryId": null,
                          "categoryName": "Phare chercheur / optique",
                          "level": 6,
                          "children": {
                            "Optique, phare chercheur": {
                              "categoryId": 100437,
                              "categoryName": "Searchlight/Insert",
                              "level": 4,
                              "children": [],
                              "productId": 90
                            }
                          }
                        }
                      },
                      "productId": 90
                    }
                  }
                }
              },
              "productId": 90
            },
            "Phare chercheur": {
              "categoryId": 100787,
              "categoryName": "Additional Headlight/Parts",
              "level": 2,
              "children": {
                "Phare chercheur / composants": {
                  "categoryId": null,
                  "categoryName": "Phare chercheur / composants",
                  "level": 4,
                  "children": {
                    "Phare chercheur": {
                      "categoryId": 100281,
                      "categoryName": "Searchlight/Parts",
                      "level": 3,
                      "children": {
                        "Phare chercheur / optique": {
                          "categoryId": null,
                          "categoryName": "Phare chercheur / optique",
                          "level": 6,
                          "children": {
                            "Phare chercheur": {
                              "categoryId": 100437,
                              "categoryName": "Searchlight/Insert",
                              "level": 4,
                              "children": [],
                              "productId": 717
                            }
                          }
                        }
                      },
                      "productId": 717
                    }
                  }
                }
              },
              "productId": 717
            },
            "Réflecteur, phare chercheur": {
              "categoryId": 100787,
              "categoryName": "Additional Headlight/Parts",
              "level": 2,
              "children": {
                "Phare chercheur / composants": {
                  "categoryId": null,
                  "categoryName": "Phare chercheur / composants",
                  "level": 4,
                  "children": {
                    "Réflecteur, phare chercheur": {
                      "categoryId": 100281,
                      "categoryName": "Searchlight/Parts",
                      "level": 3,
                      "children": {
                        "Composants phare chercheur": {
                          "categoryId": null,
                          "categoryName": "Composants phare chercheur",
                          "level": 6,
                          "children": {
                            "Réflecteur, phare chercheur": {
                              "categoryId": 100446,
                              "categoryName": "Searchlight Parts",
                              "level": 4,
                              "children": [],
                              "productId": 718
                            }
                          }
                        }
                      },
                      "productId": 718
                    }
                  }
                }
              },
              "productId": 718
            },
            "Support, phare chercheur": {
              "categoryId": 100787,
              "categoryName": "Additional Headlight/Parts",
              "level": 2,
              "children": {
                "Phare chercheur / composants": {
                  "categoryId": null,
                  "categoryName": "Phare chercheur / composants",
                  "level": 4,
                  "children": {
                    "Support, phare chercheur": {
                      "categoryId": 100281,
                      "categoryName": "Searchlight/Parts",
                      "level": 3,
                      "children": {
                        "Composants phare chercheur": {
                          "categoryId": null,
                          "categoryName": "Composants phare chercheur",
                          "level": 6,
                          "children": {
                            "Support, phare chercheur": {
                              "categoryId": 100446,
                              "categoryName": "Searchlight Parts",
                              "level": 4,
                              "children": [],
                              "productId": 103
                            }
                          }
                        }
                      },
                      "productId": 103
                    }
                  }
                }
              },
              "productId": 103
            },
            "Support, phare supplémentaire": {
              "categoryId": 100787,
              "categoryName": "Additional Headlight/Parts",
              "level": 2,
              "children": {
                "Phare chercheur / composants": {
                  "categoryId": null,
                  "categoryName": "Phare chercheur / composants",
                  "level": 4,
                  "children": {
                    "Support, phare supplémentaire": {
                      "categoryId": 100281,
                      "categoryName": "Searchlight/Parts",
                      "level": 3,
                      "children": {
                        "Composants phare chercheur": {
                          "categoryId": null,
                          "categoryName": "Composants phare chercheur",
                          "level": 6,
                          "children": {
                            "Support, phare supplémentaire": {
                              "categoryId": 100446,
                              "categoryName": "Searchlight Parts",
                              "level": 4,
                              "children": [],
                              "productId": 2976
                            }
                          }
                        }
                      },
                      "productId": 2976
                    }
                  }
                },
                "Projecteur antibrouillard/ composants": {
                  "categoryId": null,
                  "categoryName": "Projecteur antibrouillard/ composants",
                  "level": 4,
                  "children": {
                    "Support, phare supplémentaire": {
                      "categoryId": 100277,
                      "categoryName": "Front Fog Light/Parts",
                      "level": 3,
                      "children": {
                        "Composants pour projecteur antibrouillard": {
                          "categoryId": null,
                          "categoryName": "Composants pour projecteur antibrouillard",
                          "level": 6,
                          "children": {
                            "Support, phare supplémentaire": {
                              "categoryId": 100444,
                              "categoryName": "Fog Light Parts",
                              "level": 4,
                              "children": [],
                              "productId": 2976
                            }
                          }
                        }
                      },
                      "productId": 2976
                    }
                  }
                },
                "Projecteur de travail, composants": {
                  "categoryId": null,
                  "categoryName": "Projecteur de travail, composants",
                  "level": 4,
                  "children": {
                    "Support, phare supplémentaire": {
                      "categoryId": 100280,
                      "categoryName": "Worklight/Parts",
                      "level": 3,
                      "children": {
                        "Projecteur de travail, composants": {
                          "categoryId": null,
                          "categoryName": "Projecteur de travail, composants",
                          "level": 6,
                          "children": {
                            "Support, phare supplémentaire": {
                              "categoryId": 100445,
                              "categoryName": "Worklight Parts",
                              "level": 4,
                              "children": [],
                              "productId": 2976
                            }
                          }
                        }
                      },
                      "productId": 2976
                    }
                  }
                },
                "Projecteur longue portée / composants": {
                  "categoryId": null,
                  "categoryName": "Projecteur longue portée / composants",
                  "level": 4,
                  "children": {
                    "Support, phare supplémentaire": {
                      "categoryId": 100276,
                      "categoryName": "Spotlight/Parts",
                      "level": 3,
                      "children": {
                        "Projecteur longue portée / composants": {
                          "categoryId": null,
                          "categoryName": "Projecteur longue portée / composants",
                          "level": 6,
                          "children": {
                            "Support, phare supplémentaire": {
                              "categoryId": 100443,
                              "categoryName": "Spotlight Parts",
                              "level": 4,
                              "children": [],
                              "productId": 2976
                            }
                          }
                        }
                      },
                      "productId": 2976
                    }
                  }
                }
              },
              "productId": 2976
            }
          }
        }
      }
    }
  },
  "arborescenceText": "├── Carrosserie [ID: 100001] (Niveau 1)\n│   ├── Fixation/Support/collerette (Niveau 2)\n│   │   └── Racks/Carriers/Frames [ID: 101454] (Niveau 2) → ProductId: 720\n│   └── Phares supplémentaires/composants (Niveau 2)\n│       ├── Additional Headlight/Parts [ID: 101340] (Niveau 2) → ProductId: 109\n│       │   └── Phare chercheur / composants (Niveau 4)\n│       │       └── Searchlight/Parts [ID: 101353] (Niveau 3) → ProductId: 109\n│       │           └── Ampoule pour phare chercheur (Niveau 6)\n│       │               └── Searchlight Bulb [ID: 101355] (Niveau 4) → ProductId: 109\n│       ├── Additional Headlight/Parts [ID: 101340] (Niveau 2) → ProductId: 723\n│       │   └── Phare chercheur / composants (Niveau 4)\n│       │       └── Searchlight/Parts [ID: 101353] (Niveau 3) → ProductId: 723\n│       │           └── Composants phare chercheur (Niveau 6)\n│       │               └── Searchlight Parts [ID: 101356] (Niveau 4) → ProductId: 723\n│       ├── Additional Headlight/Parts [ID: 101340] (Niveau 2) → ProductId: 720\n│       │   └── Phare chercheur / composants (Niveau 4)\n│       │       └── Searchlight/Parts [ID: 101353] (Niveau 3) → ProductId: 720\n│       │           └── Composants phare chercheur (Niveau 6)\n│       │               └── Searchlight Parts [ID: 101356] (Niveau 4) → ProductId: 720\n│       ├── Additional Headlight/Parts [ID: 101340] (Niveau 2) → ProductId: 1078\n│       │   └── Phare chercheur / composants (Niveau 4)\n│       │       └── Searchlight/Parts [ID: 101353] (Niveau 3) → ProductId: 1078\n│       │           └── Composants phare chercheur (Niveau 6)\n│       │               └── Searchlight Parts [ID: 101356] (Niveau 4) → ProductId: 1078\n│       ├── Additional Headlight/Parts [ID: 101340] (Niveau 2) → ProductId: 15\n│       │   └── Phare chercheur / composants (Niveau 4)\n│       │       └── Searchlight/Parts [ID: 101353] (Niveau 3) → ProductId: 15\n│       │           └── Composants phare chercheur (Niveau 6)\n│       │               └── Searchlight Parts [ID: 101356] (Niveau 4) → ProductId: 15\n│       ├── Additional Headlight/Parts [ID: 101340] (Niveau 2) → ProductId: 486\n│       │   └── Phare chercheur / composants (Niveau 4)\n│       │       └── Searchlight/Parts [ID: 101353] (Niveau 3) → ProductId: 486\n│       │           └── Composants phare chercheur (Niveau 6)\n│       │               └── Searchlight Parts [ID: 101356] (Niveau 4) → ProductId: 486\n│       ├── Additional Headlight/Parts [ID: 101340] (Niveau 2) → ProductId: 722\n│       │   └── Phare chercheur / composants (Niveau 4)\n│       │       └── Searchlight/Parts [ID: 101353] (Niveau 3) → ProductId: 722\n│       │           └── Composants phare chercheur (Niveau 6)\n│       │               └── Searchlight Parts [ID: 101356] (Niveau 4) → ProductId: 722\n│       ├── Additional Headlight/Parts [ID: 101340] (Niveau 2) → ProductId: 721\n│       │   └── Phare chercheur / composants (Niveau 4)\n│       │       └── Searchlight/Parts [ID: 101353] (Niveau 3) → ProductId: 721\n│       │           └── Composants phare chercheur (Niveau 6)\n│       │               └── Searchlight Parts [ID: 101356] (Niveau 4) → ProductId: 721\n│       ├── Additional Headlight/Parts [ID: 101340] (Niveau 2) → ProductId: 90\n│       │   └── Phare chercheur / composants (Niveau 4)\n│       │       └── Searchlight/Parts [ID: 101353] (Niveau 3) → ProductId: 90\n│       │           └── Phare chercheur / optique (Niveau 6)\n│       │               └── Searchlight/Insert [ID: 101354] (Niveau 4) → ProductId: 90\n│       ├── Additional Headlight/Parts [ID: 101340] (Niveau 2) → ProductId: 717\n│       │   └── Phare chercheur / composants (Niveau 4)\n│       │       └── Searchlight/Parts [ID: 101353] (Niveau 3) → ProductId: 717\n│       │           └── Phare chercheur / optique (Niveau 6)\n│       │               └── Searchlight/Insert [ID: 101354] (Niveau 4) → ProductId: 717\n│       ├── Additional Headlight/Parts [ID: 101340] (Niveau 2) → ProductId: 718\n│       │   └── Phare chercheur / composants (Niveau 4)\n│       │       └── Searchlight/Parts [ID: 101353] (Niveau 3) → ProductId: 718\n│       │           └── Composants phare chercheur (Niveau 6)\n│       │               └── Searchlight Parts [ID: 101356] (Niveau 4) → ProductId: 718\n│       └── Additional Headlight/Parts [ID: 101340] (Niveau 2) → ProductId: 103\n│           └── Phare chercheur / composants (Niveau 4)\n│               └── Searchlight/Parts [ID: 101353] (Niveau 3) → ProductId: 103\n│                   └── Composants phare chercheur (Niveau 6)\n│                       └── Searchlight Parts [ID: 101356] (Niveau 4) → ProductId: 103\n\n└── Système électrique [ID: 100010] (Niveau 1)\n    ├── Kit/pièces de câble (Niveau 2)\n    │   └── Cable Set/individual parts [ID: 103066] (Niveau 2) → ProductId: 721\n    └── Phares supplémentaires/composants (Niveau 2)\n        ├── Additional Headlight/Parts [ID: 100787] (Niveau 2) → ProductId: 109\n        │   └── Phare chercheur / composants (Niveau 4)\n        │       └── Searchlight/Parts [ID: 100281] (Niveau 3) → ProductId: 109\n        │           └── Ampoule pour phare chercheur (Niveau 6)\n        │               └── Searchlight Bulb [ID: 100449] (Niveau 4) → ProductId: 109\n        ├── Additional Headlight/Parts [ID: 100787] (Niveau 2) → ProductId: 723\n        │   └── Phare chercheur / composants (Niveau 4)\n        │       └── Searchlight/Parts [ID: 100281] (Niveau 3) → ProductId: 723\n        │           └── Composants phare chercheur (Niveau 6)\n        │               └── Searchlight Parts [ID: 100446] (Niveau 4) → ProductId: 723\n        ├── Additional Headlight/Parts [ID: 100787] (Niveau 2) → ProductId: 720\n        │   └── Phare chercheur / composants (Niveau 4)\n        │       └── Searchlight/Parts [ID: 100281] (Niveau 3) → ProductId: 720\n        │           └── Composants phare chercheur (Niveau 6)\n        │               └── Searchlight Parts [ID: 100446] (Niveau 4) → ProductId: 720\n        ├── Additional Headlight/Parts [ID: 100787] (Niveau 2) → ProductId: 1078\n        │   └── Phare chercheur / composants (Niveau 4)\n        │       └── Searchlight/Parts [ID: 100281] (Niveau 3) → ProductId: 1078\n        │           └── Composants phare chercheur (Niveau 6)\n        │               └── Searchlight Parts [ID: 100446] (Niveau 4) → ProductId: 1078\n        ├── Additional Headlight/Parts [ID: 100787] (Niveau 2) → ProductId: 15\n        │   └── Phare chercheur / composants (Niveau 4)\n        │       └── Searchlight/Parts [ID: 100281] (Niveau 3) → ProductId: 15\n        │           └── Composants phare chercheur (Niveau 6)\n        │               └── Searchlight Parts [ID: 100446] (Niveau 4) → ProductId: 15\n        ├── Additional Headlight/Parts [ID: 100787] (Niveau 2) → ProductId: 486\n        │   └── Phare chercheur / composants (Niveau 4)\n        │       └── Searchlight/Parts [ID: 100281] (Niveau 3) → ProductId: 486\n        │           └── Composants phare chercheur (Niveau 6)\n        │               └── Searchlight Parts [ID: 100446] (Niveau 4) → ProductId: 486\n        ├── Additional Headlight/Parts [ID: 100787] (Niveau 2) → ProductId: 722\n        │   └── Phare chercheur / composants (Niveau 4)\n        │       └── Searchlight/Parts [ID: 100281] (Niveau 3) → ProductId: 722\n        │           └── Composants phare chercheur (Niveau 6)\n        │               └── Searchlight Parts [ID: 100446] (Niveau 4) → ProductId: 722\n        ├── Additional Headlight/Parts [ID: 100787] (Niveau 2) → ProductId: 2977\n        │   ├── Phare chercheur / composants (Niveau 4)\n        │   │   └── Searchlight/Parts [ID: 100281] (Niveau 3) → ProductId: 2977\n        │   │       └── Composants phare chercheur (Niveau 6)\n        │   │           └── Searchlight Parts [ID: 100446] (Niveau 4) → ProductId: 2977\n        │   ├── Projecteur antibrouillard/ composants (Niveau 4)\n        │   │   └── Front Fog Light/Parts [ID: 100277] (Niveau 3) → ProductId: 2977\n        │   │       └── Composants pour projecteur antibrouillard (Niveau 6)\n        │   │           └── Fog Light Parts [ID: 100444] (Niveau 4) → ProductId: 2977\n        │   ├── Projecteur de travail, composants (Niveau 4)\n        │   │   └── Worklight/Parts [ID: 100280] (Niveau 3) → ProductId: 2977\n        │   │       └── Projecteur de travail, composants (Niveau 6)\n        │   │           └── Worklight Parts [ID: 100445] (Niveau 4) → ProductId: 2977\n        │   └── Projecteur longue portée / composants (Niveau 4)\n        │       └── Spotlight/Parts [ID: 100276] (Niveau 3) → ProductId: 2977\n        │           └── Projecteur longue portée / composants (Niveau 6)\n        │               └── Spotlight Parts [ID: 100443] (Niveau 4) → ProductId: 2977\n        ├── Additional Headlight/Parts [ID: 100787] (Niveau 2) → ProductId: 721\n        │   └── Phare chercheur / composants (Niveau 4)\n        │       └── Searchlight/Parts [ID: 100281] (Niveau 3) → ProductId: 721\n        │           └── Composants phare chercheur (Niveau 6)\n        │               └── Searchlight Parts [ID: 100446] (Niveau 4) → ProductId: 721\n        ├── Additional Headlight/Parts [ID: 100787] (Niveau 2) → ProductId: 90\n        │   └── Phare chercheur / composants (Niveau 4)\n        │       └── Searchlight/Parts [ID: 100281] (Niveau 3) → ProductId: 90\n        │           └── Phare chercheur / optique (Niveau 6)\n        │               └── Searchlight/Insert [ID: 100437] (Niveau 4) → ProductId: 90\n        ├── Additional Headlight/Parts [ID: 100787] (Niveau 2) → ProductId: 717\n        │   └── Phare chercheur / composants (Niveau 4)\n        │       └── Searchlight/Parts [ID: 100281] (Niveau 3) → ProductId: 717\n        │           └── Phare chercheur / optique (Niveau 6)\n        │               └── Searchlight/Insert [ID: 100437] (Niveau 4) → ProductId: 717\n        ├── Additional Headlight/Parts [ID: 100787] (Niveau 2) → ProductId: 718\n        │   └── Phare chercheur / composants (Niveau 4)\n        │       └── Searchlight/Parts [ID: 100281] (Niveau 3) → ProductId: 718\n        │           └── Composants phare chercheur (Niveau 6)\n        │               └── Searchlight Parts [ID: 100446] (Niveau 4) → ProductId: 718\n        ├── Additional Headlight/Parts [ID: 100787] (Niveau 2) → ProductId: 103\n        │   └── Phare chercheur / composants (Niveau 4)\n        │       └── Searchlight/Parts [ID: 100281] (Niveau 3) → ProductId: 103\n        │           └── Composants phare chercheur (Niveau 6)\n        │               └── Searchlight Parts [ID: 100446] (Niveau 4) → ProductId: 103\n        └── Additional Headlight/Parts [ID: 100787] (Niveau 2) → ProductId: 2976\n            ├── Phare chercheur / composants (Niveau 4)\n            │   └── Searchlight/Parts [ID: 100281] (Niveau 3) → ProductId: 2976\n            │       └── Composants phare chercheur (Niveau 6)\n            │           └── Searchlight Parts [ID: 100446] (Niveau 4) → ProductId: 2976\n            ├── Projecteur antibrouillard/ composants (Niveau 4)\n            │   └── Front Fog Light/Parts [ID: 100277] (Niveau 3) → ProductId: 2976\n            │       └── Composants pour projecteur antibrouillard (Niveau 6)\n            │           └── Fog Light Parts [ID: 100444] (Niveau 4) → ProductId: 2976\n            ├── Projecteur de travail, composants (Niveau 4)\n            │   └── Worklight/Parts [ID: 100280] (Niveau 3) → ProductId: 2976\n            │       └── Projecteur de travail, composants (Niveau 6)\n            │           └── Worklight Parts [ID: 100445] (Niveau 4) → ProductId: 2976\n            └── Projecteur longue portée / composants (Niveau 4)\n                └── Spotlight/Parts [ID: 100276] (Niveau 3) → ProductId: 2976\n                    └── Projecteur longue portée / composants (Niveau 6)\n                        └── Spotlight Parts [ID: 100443] (Niveau 4) → ProductId: 2976",
  "arborescencePaths": [
    {
      "path": [
        "Carrosserie",
        "Fixation/Support/collerette",
        "Racks/Carriers/Frames"
      ],
      "categoryIds": [
        100001,
        null,
        101454
      ],
      "finalCategoryId": 101454,
      "productId": 720
    },
    {
      "path": [
        "Carrosserie",
        "Phares supplémentaires/composants",
        "Additional Headlight/Parts"
      ],
      "categoryIds": [
        100001,
        null,
        101340
      ],
      "finalCategoryId": 101340,
      "productId": 109
    },
    {
      "path": [
        "Carrosserie",
        "Phares supplémentaires/composants",
        "Additional Headlight/Parts"
      ],
      "categoryIds": [
        100001,
        null,
        101340
      ],
      "finalCategoryId": 101340,
      "productId": 723
    },
    {
      "path": [
        "Carrosserie",
        "Phares supplémentaires/composants",
        "Additional Headlight/Parts"
      ],
      "categoryIds": [
        100001,
        null,
        101340
      ],
      "finalCategoryId": 101340,
      "productId": 720
    },
    {
      "path": [
        "Carrosserie",
        "Phares supplémentaires/composants",
        "Additional Headlight/Parts"
      ],
      "categoryIds": [
        100001,
        null,
        101340
      ],
      "finalCategoryId": 101340,
      "productId": 1078
    },
    {
      "path": [
        "Carrosserie",
        "Phares supplémentaires/composants",
        "Additional Headlight/Parts"
      ],
      "categoryIds": [
        100001,
        null,
        101340
      ],
      "finalCategoryId": 101340,
      "productId": 15
    },
    {
      "path": [
        "Carrosserie",
        "Phares supplémentaires/composants",
        "Additional Headlight/Parts"
      ],
      "categoryIds": [
        100001,
        null,
        101340
      ],
      "finalCategoryId": 101340,
      "productId": 486
    },
    {
      "path": [
        "Carrosserie",
        "Phares supplémentaires/composants",
        "Additional Headlight/Parts"
      ],
      "categoryIds": [
        100001,
        null,
        101340
      ],
      "finalCategoryId": 101340,
      "productId": 722
    },
    {
      "path": [
        "Carrosserie",
        "Phares supplémentaires/composants",
        "Additional Headlight/Parts"
      ],
      "categoryIds": [
        100001,
        null,
        101340
      ],
      "finalCategoryId": 101340,
      "productId": 721
    },
    {
      "path": [
        "Carrosserie",
        "Phares supplémentaires/composants",
        "Additional Headlight/Parts"
      ],
      "categoryIds": [
        100001,
        null,
        101340
      ],
      "finalCategoryId": 101340,
      "productId": 90
    },
    {
      "path": [
        "Carrosserie",
        "Phares supplémentaires/composants",
        "Additional Headlight/Parts"
      ],
      "categoryIds": [
        100001,
        null,
        101340
      ],
      "finalCategoryId": 101340,
      "productId": 717
    },
    {
      "path": [
        "Carrosserie",
        "Phares supplémentaires/composants",
        "Additional Headlight/Parts"
      ],
      "categoryIds": [
        100001,
        null,
        101340
      ],
      "finalCategoryId": 101340,
      "productId": 718
    },
    {
      "path": [
        "Carrosserie",
        "Phares supplémentaires/composants",
        "Additional Headlight/Parts"
      ],
      "categoryIds": [
        100001,
        null,
        101340
      ],
      "finalCategoryId": 101340,
      "productId": 103
    },
    {
      "path": [
        "Système électrique",
        "Kit/pièces de câble",
        "Cable Set/individual parts"
      ],
      "categoryIds": [
        100010,
        null,
        103066
      ],
      "finalCategoryId": 103066,
      "productId": 721
    },
    {
      "path": [
        "Système électrique",
        "Phares supplémentaires/composants",
        "Additional Headlight/Parts"
      ],
      "categoryIds": [
        100010,
        null,
        100787
      ],
      "finalCategoryId": 100787,
      "productId": 109
    },
    {
      "path": [
        "Système électrique",
        "Phares supplémentaires/composants",
        "Additional Headlight/Parts"
      ],
      "categoryIds": [
        100010,
        null,
        100787
      ],
      "finalCategoryId": 100787,
      "productId": 723
    },
    {
      "path": [
        "Système électrique",
        "Phares supplémentaires/composants",
        "Additional Headlight/Parts"
      ],
      "categoryIds": [
        100010,
        null,
        100787
      ],
      "finalCategoryId": 100787,
      "productId": 720
    },
    {
      "path": [
        "Système électrique",
        "Phares supplémentaires/composants",
        "Additional Headlight/Parts"
      ],
      "categoryIds": [
        100010,
        null,
        100787
      ],
      "finalCategoryId": 100787,
      "productId": 1078
    },
    {
      "path": [
        "Système électrique",
        "Phares supplémentaires/composants",
        "Additional Headlight/Parts"
      ],
      "categoryIds": [
        100010,
        null,
        100787
      ],
      "finalCategoryId": 100787,
      "productId": 15
    },
    {
      "path": [
        "Système électrique",
        "Phares supplémentaires/composants",
        "Additional Headlight/Parts"
      ],
      "categoryIds": [
        100010,
        null,
        100787
      ],
      "finalCategoryId": 100787,
      "productId": 486
    },
    {
      "path": [
        "Système électrique",
        "Phares supplémentaires/composants",
        "Additional Headlight/Parts"
      ],
      "categoryIds": [
        100010,
        null,
        100787
      ],
      "finalCategoryId": 100787,
      "productId": 722
    },
    {
      "path": [
        "Système électrique",
        "Phares supplémentaires/composants",
        "Additional Headlight/Parts"
      ],
      "categoryIds": [
        100010,
        null,
        100787
      ],
      "finalCategoryId": 100787,
      "productId": 2977
    },
    {
      "path": [
        "Système électrique",
        "Phares supplémentaires/composants",
        "Additional Headlight/Parts"
      ],
      "categoryIds": [
        100010,
        null,
        100787
      ],
      "finalCategoryId": 100787,
      "productId": 721
    },
    {
      "path": [
        "Système électrique",
        "Phares supplémentaires/composants",
        "Additional Headlight/Parts"
      ],
      "categoryIds": [
        100010,
        null,
        100787
      ],
      "finalCategoryId": 100787,
      "productId": 90
    },
    {
      "path": [
        "Système électrique",
        "Phares supplémentaires/composants",
        "Additional Headlight/Parts"
      ],
      "categoryIds": [
        100010,
        null,
        100787
      ],
      "finalCategoryId": 100787,
      "productId": 717
    },
    {
      "path": [
        "Système électrique",
        "Phares supplémentaires/composants",
        "Additional Headlight/Parts"
      ],
      "categoryIds": [
        100010,
        null,
        100787
      ],
      "finalCategoryId": 100787,
      "productId": 718
    },
    {
      "path": [
        "Système électrique",
        "Phares supplémentaires/composants",
        "Additional Headlight/Parts"
      ],
      "categoryIds": [
        100010,
        null,
        100787
      ],
      "finalCategoryId": 100787,
      "productId": 103
    },
    {
      "path": [
        "Système électrique",
        "Phares supplémentaires/composants",
        "Additional Headlight/Parts"
      ],
      "categoryIds": [
        100010,
        null,
        100787
      ],
      "finalCategoryId": 100787,
      "productId": 2976
    }
  ],
  "productIdsInArbo": [
    15,
    90,
    103,
    109,
    486,
    717,
    718,
    720,
    721,
    722,
    723,
    1078,
    2976,
    2977
  ],
  "matchedProductIds": [
    717
  ]
}