{
  "productName": "Pivot de fusée d'essieu",
  "searchText": "Pivot de fusée d'essieu",
  "found": true,
  "hasMatch": true,
  "timestamp": "2025-12-02T21:21:39.320Z",
  "productId": 34,
  "arborescence": {
    "Suspension d'essieu/Guidage des roues/Roues": {
      "categoryId": 100013,
      "categoryName": "Suspension d'essieu/Guidage des roues/Roues",
      "level": 1,
      "children": {
        "Fusée d'essieu / kit de réparation": {
          "categoryId": null,
          "categoryName": "Fusée d'essieu / kit de réparation",
          "level": 2,
          "children": {
            "Circlip, pivot de fusée d'essieu": {
              "categoryId": 100207,
              "categoryName": "Steering Knuckle/Repair Kit",
              "level": 2,
              "children": {
                "Pivot de fusée d'essieu": {
                  "categoryId": null,
                  "categoryName": "Pivot de fusée d'essieu",
                  "level": 4,
                  "children": {
                    "Circlip, pivot de fusée d'essieu": {
                      "categoryId": 100588,
                      "categoryName": "Kingpin",
                      "level": 3,
                      "children": [],
                      "productId": 3651
                    }
                  }
                }
              },
              "productId": 3651
            },
            "Douille, pivot de fusée d'essieu": {
              "categoryId": 100207,
              "categoryName": "Steering Knuckle/Repair Kit",
              "level": 2,
              "children": {
                "Pivot de fusée d'essieu": {
                  "categoryId": null,
                  "categoryName": "Pivot de fusée d'essieu",
                  "level": 4,
                  "children": {
                    "Douille, pivot de fusée d'essieu": {
                      "categoryId": 100588,
                      "categoryName": "Kingpin",
                      "level": 3,
                      "children": [],
                      "productId": 3360
                    }
                  }
                }
              },
              "productId": 3360
            },
            "Entretoise, pivot de fusée d'essieu": {
              "categoryId": 100207,
              "categoryName": "Steering Knuckle/Repair Kit",
              "level": 2,
              "children": {
                "Pivot de fusée d'essieu": {
                  "categoryId": null,
                  "categoryName": "Pivot de fusée d'essieu",
                  "level": 4,
                  "children": {
                    "Entretoise, pivot de fusée d'essieu": {
                      "categoryId": 100588,
                      "categoryName": "Kingpin",
                      "level": 3,
                      "children": [],
                      "productId": 3514
                    }
                  }
                }
              },
              "productId": 3514
            },
            "Kit d'assemblage, pivot de fusée d'essieu": {
              "categoryId": 100207,
              "categoryName": "Steering Knuckle/Repair Kit",
              "level": 2,
              "children": {
                "Kit de réparation": {
                  "categoryId": null,
                  "categoryName": "Kit de réparation",
                  "level": 4,
                  "children": {
                    "Kit d'assemblage, pivot de fusée d'essieu": {
                      "categoryId": 100589,
                      "categoryName": "Repair Kit",
                      "level": 3,
                      "children": [],
                      "productId": 652
                    }
                  }
                }
              },
              "productId": 652
            },
            "Kit de boulons de fusée d’essieu": {
              "categoryId": 100207,
              "categoryName": "Steering Knuckle/Repair Kit",
              "level": 2,
              "children": {
                "Pivot de fusée d'essieu": {
                  "categoryId": null,
                  "categoryName": "Pivot de fusée d'essieu",
                  "level": 4,
                  "children": {
                    "Kit de boulons de fusée d’essieu": {
                      "categoryId": 100588,
                      "categoryName": "Kingpin",
                      "level": 3,
                      "children": [],
                      "productId": 8944
                    }
                  }
                }
              },
              "productId": 8944
            },
            "Patin de butée, pivot de fusée d'essieu": {
              "categoryId": 100207,
              "categoryName": "Steering Knuckle/Repair Kit",
              "level": 2,
              "children": {
                "Pivot de fusée d'essieu": {
                  "categoryId": null,
                  "categoryName": "Pivot de fusée d'essieu",
                  "level": 4,
                  "children": {
                    "Patin de butée, pivot de fusée d'essieu": {
                      "categoryId": 100588,
                      "categoryName": "Kingpin",
                      "level": 3,
                      "children": [],
                      "productId": 4260
                    }
                  }
                }
              },
              "productId": 4260
            },
            "Pivot de fusée d'essieu": {
              "categoryId": 100207,
              "categoryName": "Steering Knuckle/Repair Kit",
              "level": 2,
              "children": {
                "Pivot de fusée d'essieu": {
                  "categoryId": null,
                  "categoryName": "Pivot de fusée d'essieu",
                  "level": 4,
                  "children": {
                    "Pivot de fusée d'essieu": {
                      "categoryId": 100588,
                      "categoryName": "Kingpin",
                      "level": 3,
                      "children": [],
                      "productId": 34
                    }
                  }
                }
              },
              "productId": 34
            }
          }
        }
      }
    },
    "Suspension/Amortissement": {
      "categoryId": 100011,
      "categoryName": "Suspension/Amortissement",
      "level": 1,
      "children": {
        "Suspension sur ressorts à lames": {
          "categoryId": null,
          "categoryName": "Suspension sur ressorts à lames",
          "level": 2,
          "children": {
            "Écrou, pivot de fusée d'essieu (main de suspension)": {
              "categoryId": 100810,
              "categoryName": "Leaf Spring Suspension",
              "level": 2,
              "children": [],
              "productId": 5117
            }
          }
        }
      }
    }
  },
  "arborescenceText": "├── Suspension d'essieu/Guidage des roues/Roues [ID: 100013] (Niveau 1)\n│   └── Fusée d'essieu / kit de réparation (Niveau 2)\n│       ├── Steering Knuckle/Repair Kit [ID: 100207] (Niveau 2) → ProductId: 3651\n│       │   └── Pivot de fusée d'essieu (Niveau 4)\n│       │       └── Kingpin [ID: 100588] (Niveau 3) → ProductId: 3651\n│       ├── Steering Knuckle/Repair Kit [ID: 100207] (Niveau 2) → ProductId: 3360\n│       │   └── Pivot de fusée d'essieu (Niveau 4)\n│       │       └── Kingpin [ID: 100588] (Niveau 3) → ProductId: 3360\n│       ├── Steering Knuckle/Repair Kit [ID: 100207] (Niveau 2) → ProductId: 3514\n│       │   └── Pivot de fusée d'essieu (Niveau 4)\n│       │       └── Kingpin [ID: 100588] (Niveau 3) → ProductId: 3514\n│       ├── Steering Knuckle/Repair Kit [ID: 100207] (Niveau 2) → ProductId: 652\n│       │   └── Kit de réparation (Niveau 4)\n│       │       └── Repair Kit [ID: 100589] (Niveau 3) → ProductId: 652\n│       ├── Steering Knuckle/Repair Kit [ID: 100207] (Niveau 2) → ProductId: 8944\n│       │   └── Pivot de fusée d'essieu (Niveau 4)\n│       │       └── Kingpin [ID: 100588] (Niveau 3) → ProductId: 8944\n│       ├── Steering Knuckle/Repair Kit [ID: 100207] (Niveau 2) → ProductId: 4260\n│       │   └── Pivot de fusée d'essieu (Niveau 4)\n│       │       └── Kingpin [ID: 100588] (Niveau 3) → ProductId: 4260\n│       └── Steering Knuckle/Repair Kit [ID: 100207] (Niveau 2) → ProductId: 34\n│           └── Pivot de fusée d'essieu (Niveau 4)\n│               └── Kingpin [ID: 100588] (Niveau 3) → ProductId: 34\n\n└── Suspension/Amortissement [ID: 100011] (Niveau 1)\n    └── Suspension sur ressorts à lames (Niveau 2)\n        └── Leaf Spring Suspension [ID: 100810] (Niveau 2) → ProductId: 5117",
  "arborescencePaths": [
    {
      "path": [
        "Suspension d'essieu/Guidage des roues/Roues",
        "Fusée d'essieu / kit de réparation",
        "Steering Knuckle/Repair Kit"
      ],
      "categoryIds": [
        100013,
        null,
        100207
      ],
      "finalCategoryId": 100207,
      "productId": 3651
    },
    {
      "path": [
        "Suspension d'essieu/Guidage des roues/Roues",
        "Fusée d'essieu / kit de réparation",
        "Steering Knuckle/Repair Kit"
      ],
      "categoryIds": [
        100013,
        null,
        100207
      ],
      "finalCategoryId": 100207,
      "productId": 3360
    },
    {
      "path": [
        "Suspension d'essieu/Guidage des roues/Roues",
        "Fusée d'essieu / kit de réparation",
        "Steering Knuckle/Repair Kit"
      ],
      "categoryIds": [
        100013,
        null,
        100207
      ],
      "finalCategoryId": 100207,
      "productId": 3514
    },
    {
      "path": [
        "Suspension d'essieu/Guidage des roues/Roues",
        "Fusée d'essieu / kit de réparation",
        "Steering Knuckle/Repair Kit"
      ],
      "categoryIds": [
        100013,
        null,
        100207
      ],
      "finalCategoryId": 100207,
      "productId": 652
    },
    {
      "path": [
        "Suspension d'essieu/Guidage des roues/Roues",
        "Fusée d'essieu / kit de réparation",
        "Steering Knuckle/Repair Kit"
      ],
      "categoryIds": [
        100013,
        null,
        100207
      ],
      "finalCategoryId": 100207,
      "productId": 8944
    },
    {
      "path": [
        "Suspension d'essieu/Guidage des roues/Roues",
        "Fusée d'essieu / kit de réparation",
        "Steering Knuckle/Repair Kit"
      ],
      "categoryIds": [
        100013,
        null,
        100207
      ],
      "finalCategoryId": 100207,
      "productId": 4260
    },
    {
      "path": [
        "Suspension d'essieu/Guidage des roues/Roues",
        "Fusée d'essieu / kit de réparation",
        "Steering Knuckle/Repair Kit"
      ],
      "categoryIds": [
        100013,
        null,
        100207
      ],
      "finalCategoryId": 100207,
      "productId": 34
    },
    {
      "path": [
        "Suspension/Amortissement",
        "Suspension sur ressorts à lames",
        "Leaf Spring Suspension"
      ],
      "categoryIds": [
        100011,
        null,
        100810
      ],
      "finalCategoryId": 100810,
      "productId": 5117
    }
  ],
  "productIdsInArbo": [
    34,
    652,
    3360,
    3514,
    3651,
    4260,
    5117,
    8944
  ],
  "matchedProductIds": [
    34
  ]
}