{
  "productName": "Pièce de serrage",
  "searchText": "Pièce de serrage",
  "found": true,
  "hasMatch": false,
  "timestamp": "2025-12-02T21:21:44.926Z",
  "productId": 3835,
  "arborescence": {
    "Commande à courroie": {
      "categoryId": 100016,
      "categoryName": "Commande à courroie",
      "level": 1,
      "children": {
        "Jeu/ courroies trapézoïdales à nervures": {
          "categoryId": null,
          "categoryName": "Jeu/ courroies trapézoïdales à nervures",
          "level": 2,
          "children": {
            "Pièce de serrage, tendeur de courroie trapézoïdale": {
              "categoryId": 100082,
              "categoryName": "V-Ribbed Belt/Set",
              "level": 2,
              "children": {
                "Bras tendeur": {
                  "categoryId": null,
                  "categoryName": "Bras tendeur",
                  "level": 4,
                  "children": {
                    "Pièce de serrage, tendeur de courroie trapézoïdale": {
                      "categoryId": 100438,
                      "categoryName": "Tensioner",
                      "level": 3,
                      "children": [],
                      "productId": 2758
                    }
                  }
                }
              },
              "productId": 2758
            }
          }
        }
      }
    },
    "Direction": {
      "categoryId": 100012,
      "categoryName": "Direction",
      "level": 1,
      "children": {
        "Barre de connexion / composants": {
          "categoryId": null,
          "categoryName": "Barre de connexion / composants",
          "level": 2,
          "children": {
            "Pièce de serrage, barre d'accouplement": {
              "categoryId": 100601,
              "categoryName": "Tie Rod Assembly/ Parts",
              "level": 2,
              "children": {
                "Barre de connexion": {
                  "categoryId": null,
                  "categoryName": "Barre de connexion",
                  "level": 4,
                  "children": {
                    "Pièce de serrage, barre d'accouplement": {
                      "categoryId": 100197,
                      "categoryName": "Tie Rod Assembly",
                      "level": 3,
                      "children": [],
                      "productId": 60780
                    }
                  }
                }
              },
              "productId": 60780
            }
          }
        }
      }
    },
    "Échappement": {
      "categoryId": 100004,
      "categoryName": "Échappement",
      "level": 1,
      "children": {
        "Pièces de montage": {
          "categoryId": null,
          "categoryName": "Pièces de montage",
          "level": 2,
          "children": {
            "Jeu de pièces de serrage, système d'échappement": {
              "categoryId": 100222,
              "categoryName": "Assembly Parts",
              "level": 2,
              "children": {
                "Pièces détachées de montage": {
                  "categoryId": null,
                  "categoryName": "Pièces détachées de montage",
                  "level": 4,
                  "children": {
                    "Jeu de pièces de serrage, système d'échappement": {
                      "categoryId": 100317,
                      "categoryName": "Individual Assembly Parts",
                      "level": 3,
                      "children": {
                        "Pièce de serrage": {
                          "categoryId": null,
                          "categoryName": "Pièce de serrage",
                          "level": 6,
                          "children": {
                            "Jeu de pièces de serrage, système d'échappement": {
                              "categoryId": 100329,
                              "categoryName": "Clamping Piece",
                              "level": 4,
                              "children": [],
                              "productId": 1393
                            }
                          }
                        }
                      },
                      "productId": 1393
                    }
                  }
                }
              },
              "productId": 1393
            },
            "Pièce de serrage, échappement": {
              "categoryId": 100222,
              "categoryName": "Assembly Parts",
              "level": 2,
              "children": {
                "Pièces détachées de montage": {
                  "categoryId": null,
                  "categoryName": "Pièces détachées de montage",
                  "level": 4,
                  "children": {
                    "Pièce de serrage, échappement": {
                      "categoryId": 100317,
                      "categoryName": "Individual Assembly Parts",
                      "level": 3,
                      "children": {
                        "Pièce de serrage": {
                          "categoryId": null,
                          "categoryName": "Pièce de serrage",
                          "level": 6,
                          "children": {
                            "Pièce de serrage, échappement": {
                              "categoryId": 100329,
                              "categoryName": "Clamping Piece",
                              "level": 4,
                              "children": [],
                              "productId": 1056
                            }
                          }
                        }
                      },
                      "productId": 1056
                    }
                  }
                }
              },
              "productId": 1056
            }
          }
        }
      }
    },
    "Moteur": {
      "categoryId": 100002,
      "categoryName": "Moteur",
      "level": 1,
      "children": {
        "Commande à courroie": {
          "categoryId": null,
          "categoryName": "Commande à courroie",
          "level": 2,
          "children": {
            "Pièce de serrage, tendeur de courroie trapézoïdale": {
              "categoryId": 104302,
              "categoryName": "Belt Drive",
              "level": 2,
              "children": {
                "Jeu/ courroies trapézoïdales à nervures": {
                  "categoryId": null,
                  "categoryName": "Jeu/ courroies trapézoïdales à nervures",
                  "level": 4,
                  "children": {
                    "Pièce de serrage, tendeur de courroie trapézoïdale": {
                      "categoryId": 104308,
                      "categoryName": "V-Ribbed Belt/Set",
                      "level": 3,
                      "children": {
                        "Bras tendeur": {
                          "categoryId": null,
                          "categoryName": "Bras tendeur",
                          "level": 6,
                          "children": {
                            "Pièce de serrage, tendeur de courroie trapézoïdale": {
                              "categoryId": 104313,
                              "categoryName": "Tensioner",
                              "level": 4,
                              "children": [],
                              "productId": 2758
                            }
                          }
                        }
                      },
                      "productId": 2758
                    }
                  }
                }
              },
              "productId": 2758
            }
          }
        },
        "Culasse / pieces de montage": {
          "categoryId": null,
          "categoryName": "Culasse / pieces de montage",
          "level": 2,
          "children": {
            "Pièce de serrage, couvercle de culasse": {
              "categoryId": 100373,
              "categoryName": "Cylinder Head/Attachment Parts",
              "level": 2,
              "children": {
                "Cache-soupape": {
                  "categoryId": null,
                  "categoryName": "Cache-soupape",
                  "level": 4,
                  "children": {
                    "Pièce de serrage, couvercle de culasse": {
                      "categoryId": 100375,
                      "categoryName": "Cylinder Head Cover/-Gasket",
                      "level": 3,
                      "children": [],
                      "productId": 60087
                    }
                  }
                }
              },
              "productId": 60087
            }
          }
        }
      }
    }
  },
  "arborescenceText": "├── Commande à courroie [ID: 100016] (Niveau 1)\n│   └── Jeu/ courroies trapézoïdales à nervures (Niveau 2)\n│       └── V-Ribbed Belt/Set [ID: 100082] (Niveau 2) → ProductId: 2758\n│           └── Bras tendeur (Niveau 4)\n│               └── Tensioner [ID: 100438] (Niveau 3) → ProductId: 2758\n\n├── Direction [ID: 100012] (Niveau 1)\n│   └── Barre de connexion / composants (Niveau 2)\n│       └── Tie Rod Assembly/ Parts [ID: 100601] (Niveau 2) → ProductId: 60780\n│           └── Barre de connexion (Niveau 4)\n│               └── Tie Rod Assembly [ID: 100197] (Niveau 3) → ProductId: 60780\n\n├── Échappement [ID: 100004] (Niveau 1)\n│   └── Pièces de montage (Niveau 2)\n│       ├── Assembly Parts [ID: 100222] (Niveau 2) → ProductId: 1393\n│       │   └── Pièces détachées de montage (Niveau 4)\n│       │       └── Individual Assembly Parts [ID: 100317] (Niveau 3) → ProductId: 1393\n│       │           └── Pièce de serrage (Niveau 6)\n│       │               └── Clamping Piece [ID: 100329] (Niveau 4) → ProductId: 1393\n│       └── Assembly Parts [ID: 100222] (Niveau 2) → ProductId: 1056\n│           └── Pièces détachées de montage (Niveau 4)\n│               └── Individual Assembly Parts [ID: 100317] (Niveau 3) → ProductId: 1056\n│                   └── Pièce de serrage (Niveau 6)\n│                       └── Clamping Piece [ID: 100329] (Niveau 4) → ProductId: 1056\n\n└── Moteur [ID: 100002] (Niveau 1)\n    ├── Commande à courroie (Niveau 2)\n    │   └── Belt Drive [ID: 104302] (Niveau 2) → ProductId: 2758\n    │       └── Jeu/ courroies trapézoïdales à nervures (Niveau 4)\n    │           └── V-Ribbed Belt/Set [ID: 104308] (Niveau 3) → ProductId: 2758\n    │               └── Bras tendeur (Niveau 6)\n    │                   └── Tensioner [ID: 104313] (Niveau 4) → ProductId: 2758\n    └── Culasse / pieces de montage (Niveau 2)\n        └── Cylinder Head/Attachment Parts [ID: 100373] (Niveau 2) → ProductId: 60087\n            └── Cache-soupape (Niveau 4)\n                └── Cylinder Head Cover/-Gasket [ID: 100375] (Niveau 3) → ProductId: 60087",
  "arborescencePaths": [
    {
      "path": [
        "Commande à courroie",
        "Jeu/ courroies trapézoïdales à nervures",
        "V-Ribbed Belt/Set"
      ],
      "categoryIds": [
        100016,
        null,
        100082
      ],
      "finalCategoryId": 100082,
      "productId": 2758
    },
    {
      "path": [
        "Direction",
        "Barre de connexion / composants",
        "Tie Rod Assembly/ Parts"
      ],
      "categoryIds": [
        100012,
        null,
        100601
      ],
      "finalCategoryId": 100601,
      "productId": 60780
    },
    {
      "path": [
        "Échappement",
        "Pièces de montage",
        "Assembly Parts"
      ],
      "categoryIds": [
        100004,
        null,
        100222
      ],
      "finalCategoryId": 100222,
      "productId": 1393
    },
    {
      "path": [
        "Échappement",
        "Pièces de montage",
        "Assembly Parts"
      ],
      "categoryIds": [
        100004,
        null,
        100222
      ],
      "finalCategoryId": 100222,
      "productId": 1056
    },
    {
      "path": [
        "Moteur",
        "Commande à courroie",
        "Belt Drive"
      ],
      "categoryIds": [
        100002,
        null,
        104302
      ],
      "finalCategoryId": 104302,
      "productId": 2758
    },
    {
      "path": [
        "Moteur",
        "Culasse / pieces de montage",
        "Cylinder Head/Attachment Parts"
      ],
      "categoryIds": [
        100002,
        null,
        100373
      ],
      "finalCategoryId": 100373,
      "productId": 60087
    }
  ],
  "productIdsInArbo": [
    1056,
    1393,
    2758,
    60087,
    60780
  ],
  "closestProductIds": [
    {
      "productId": 1056,
      "productName": "Pièce de serrage, échappement"
    },
    {
      "productId": 1393,
      "productName": "Jeu de pièces de serrage, système d'échappement"
    },
    {
      "productId": 2758,
      "productName": "Pièce de serrage, tendeur de courroie trapézoïdale"
    },
    {
      "productId": 60087,
      "productName": "Pièce de serrage, couvercle de culasse"
    },
    {
      "productId": 60780,
      "productName": "Pièce de serrage, barre d'accouplement"
    }
  ]
}