{
  "productName": "Plateau de frein",
  "searchText": "Plateau de frein",
  "found": true,
  "hasMatch": true,
  "timestamp": "2025-12-02T21:22:29.344Z",
  "productId": 3619,
  "arborescence": {
    "Dispositif de freinage": {
      "categoryId": 100006,
      "categoryName": "Dispositif de freinage",
      "level": 1,
      "children": {
        "Frein à tambour": {
          "categoryId": null,
          "categoryName": "Frein à tambour",
          "level": 2,
          "children": {
            "Bouchon caoutchouc, plâteau de frein": {
              "categoryId": 100627,
              "categoryName": "Drum Brake",
              "level": 2,
              "children": {
                "Accessoires / composants": {
                  "categoryId": null,
                  "categoryName": "Accessoires / composants",
                  "level": 4,
                  "children": {
                    "Bouchon caoutchouc, plâteau de frein": {
                      "categoryId": 100634,
                      "categoryName": "Accessories/Parts",
                      "level": 3,
                      "children": [],
                      "productId": 5979
                    }
                  }
                }
              },
              "productId": 5979
            },
            "Kit de réparation, plateau de frein": {
              "categoryId": 100627,
              "categoryName": "Drum Brake",
              "level": 2,
              "children": {
                "Accessoires / composants": {
                  "categoryId": null,
                  "categoryName": "Accessoires / composants",
                  "level": 4,
                  "children": {
                    "Kit de réparation, plateau de frein": {
                      "categoryId": 100634,
                      "categoryName": "Accessories/Parts",
                      "level": 3,
                      "children": [],
                      "productId": 3292
                    }
                  }
                }
              },
              "productId": 3292
            },
            "Plateau de frein": {
              "categoryId": 100627,
              "categoryName": "Drum Brake",
              "level": 2,
              "children": {
                "Accessoires / composants": {
                  "categoryId": null,
                  "categoryName": "Accessoires / composants",
                  "level": 4,
                  "children": {
                    "Plateau de frein": {
                      "categoryId": 100634,
                      "categoryName": "Accessories/Parts",
                      "level": 3,
                      "children": [],
                      "productId": 3619
                    }
                  }
                }
              },
              "productId": 3619
            }
          }
        }
      }
    }
  },
  "arborescenceText": "└── Dispositif de freinage [ID: 100006] (Niveau 1)\n    └── Frein à tambour (Niveau 2)\n        ├── Drum Brake [ID: 100627] (Niveau 2) → ProductId: 5979\n        │   └── Accessoires / composants (Niveau 4)\n        │       └── Accessories/Parts [ID: 100634] (Niveau 3) → ProductId: 5979\n        ├── Drum Brake [ID: 100627] (Niveau 2) → ProductId: 3292\n        │   └── Accessoires / composants (Niveau 4)\n        │       └── Accessories/Parts [ID: 100634] (Niveau 3) → ProductId: 3292\n        └── Drum Brake [ID: 100627] (Niveau 2) → ProductId: 3619\n            └── Accessoires / composants (Niveau 4)\n                └── Accessories/Parts [ID: 100634] (Niveau 3) → ProductId: 3619",
  "arborescencePaths": [
    {
      "path": [
        "Dispositif de freinage",
        "Frein à tambour",
        "Drum Brake"
      ],
      "categoryIds": [
        100006,
        null,
        100627
      ],
      "finalCategoryId": 100627,
      "productId": 5979
    },
    {
      "path": [
        "Dispositif de freinage",
        "Frein à tambour",
        "Drum Brake"
      ],
      "categoryIds": [
        100006,
        null,
        100627
      ],
      "finalCategoryId": 100627,
      "productId": 3292
    },
    {
      "path": [
        "Dispositif de freinage",
        "Frein à tambour",
        "Drum Brake"
      ],
      "categoryIds": [
        100006,
        null,
        100627
      ],
      "finalCategoryId": 100627,
      "productId": 3619
    }
  ],
  "productIdsInArbo": [
    3292,
    3619,
    5979
  ],
  "matchedProductIds": [
    3619
  ]
}