{
  "productName": "Pompe à eau+Jeu de courroie trapézoïdale à nervures",
  "searchText": "Pompe à eau+Jeu de courroie trapézoïdale à nervures",
  "found": true,
  "hasMatch": true,
  "timestamp": "2025-12-03T07:01:45.307Z",
  "productId": 4172,
  "arborescence": {
    "Commande à courroie": {
      "categoryId": 100016,
      "categoryName": "Commande à courroie",
      "level": 1,
      "children": {
        "Jeu/ courroies trapézoïdales à nervures": {
          "categoryId": null,
          "categoryName": "Jeu/ courroies trapézoïdales à nervures",
          "level": 2,
          "children": {
            "Pompe à eau+Jeu de courroie trapézoïdale à nervures": {
              "categoryId": 100082,
              "categoryName": "V-Ribbed Belt/Set",
              "level": 2,
              "children": {
                "Jeu de courroie trapézoïdale à nervures": {
                  "categoryId": null,
                  "categoryName": "Jeu de courroie trapézoïdale à nervures",
                  "level": 4,
                  "children": {
                    "Pompe à eau+Jeu de courroie trapézoïdale à nervures": {
                      "categoryId": 100432,
                      "categoryName": "V-Ribbed Belt Set",
                      "level": 3,
                      "children": [],
                      "productId": 4172
                    }
                  }
                }
              },
              "productId": 4172
            }
          }
        },
        "Poulie": {
          "categoryId": null,
          "categoryName": "Poulie",
          "level": 2,
          "children": {
            "Pompe à eau+Jeu de courroie trapézoïdale à nervures": {
              "categoryId": 101971,
              "categoryName": "Belt Pulley",
              "level": 2,
              "children": [],
              "productId": 4172
            }
          }
        }
      }
    },
    "Moteur": {
      "categoryId": 100002,
      "categoryName": "Moteur",
      "level": 1,
      "children": {
        "Commande à courroie": {
          "categoryId": null,
          "categoryName": "Commande à courroie",
          "level": 2,
          "children": {
            "Pompe à eau+Jeu de courroie trapézoïdale à nervures": {
              "categoryId": 104302,
              "categoryName": "Belt Drive",
              "level": 2,
              "children": {
                "Jeu/ courroies trapézoïdales à nervures": {
                  "categoryId": null,
                  "categoryName": "Jeu/ courroies trapézoïdales à nervures",
                  "level": 4,
                  "children": {
                    "Pompe à eau+Jeu de courroie trapézoïdale à nervures": {
                      "categoryId": 104308,
                      "categoryName": "V-Ribbed Belt/Set",
                      "level": 3,
                      "children": {
                        "Jeu de courroie trapézoïdale à nervures": {
                          "categoryId": null,
                          "categoryName": "Jeu de courroie trapézoïdale à nervures",
                          "level": 6,
                          "children": {
                            "Pompe à eau+Jeu de courroie trapézoïdale à nervures": {
                              "categoryId": 104310,
                              "categoryName": "V-Ribbed Belt Set",
                              "level": 4,
                              "children": [],
                              "productId": 4172
                            }
                          }
                        }
                      },
                      "productId": 4172
                    }
                  }
                },
                "Poulie": {
                  "categoryId": null,
                  "categoryName": "Poulie",
                  "level": 4,
                  "children": {
                    "Pompe à eau+Jeu de courroie trapézoïdale à nervures": {
                      "categoryId": 104329,
                      "categoryName": "Belt Pulley",
                      "level": 3,
                      "children": [],
                      "productId": 4172
                    }
                  }
                }
              },
              "productId": 4172
            }
          }
        }
      }
    },
    "Refroidissement": {
      "categoryId": 100007,
      "categoryName": "Refroidissement",
      "level": 1,
      "children": {
        "Pompe à eau / joint": {
          "categoryId": null,
          "categoryName": "Pompe à eau / joint",
          "level": 2,
          "children": {
            "Pompe à eau+Jeu de courroie trapézoïdale à nervures": {
              "categoryId": 100088,
              "categoryName": "Water Pump/Gasket",
              "level": 2,
              "children": {
                "Pompe à eau": {
                  "categoryId": null,
                  "categoryName": "Pompe à eau",
                  "level": 4,
                  "children": {
                    "Pompe à eau+Jeu de courroie trapézoïdale à nervures": {
                      "categoryId": 100091,
                      "categoryName": "Water Pump",
                      "level": 3,
                      "children": [],
                      "productId": 4172
                    }
                  }
                }
              },
              "productId": 4172
            }
          }
        }
      }
    }
  },
  "arborescenceText": "├── Commande à courroie [ID: 100016] (Niveau 1)\n│   ├── Jeu/ courroies trapézoïdales à nervures (Niveau 2)\n│   │   └── V-Ribbed Belt/Set [ID: 100082] (Niveau 2) → ProductId: 4172\n│   │       └── Jeu de courroie trapézoïdale à nervures (Niveau 4)\n│   │           └── V-Ribbed Belt Set [ID: 100432] (Niveau 3) → ProductId: 4172\n│   └── Poulie (Niveau 2)\n│       └── Belt Pulley [ID: 101971] (Niveau 2) → ProductId: 4172\n\n├── Moteur [ID: 100002] (Niveau 1)\n│   └── Commande à courroie (Niveau 2)\n│       └── Belt Drive [ID: 104302] (Niveau 2) → ProductId: 4172\n│           ├── Jeu/ courroies trapézoïdales à nervures (Niveau 4)\n│           │   └── V-Ribbed Belt/Set [ID: 104308] (Niveau 3) → ProductId: 4172\n│           │       └── Jeu de courroie trapézoïdale à nervures (Niveau 6)\n│           │           └── V-Ribbed Belt Set [ID: 104310] (Niveau 4) → ProductId: 4172\n│           └── Poulie (Niveau 4)\n│               └── Belt Pulley [ID: 104329] (Niveau 3) → ProductId: 4172\n\n└── Refroidissement [ID: 100007] (Niveau 1)\n    └── Pompe à eau / joint (Niveau 2)\n        └── Water Pump/Gasket [ID: 100088] (Niveau 2) → ProductId: 4172\n            └── Pompe à eau (Niveau 4)\n                └── Water Pump [ID: 100091] (Niveau 3) → ProductId: 4172",
  "arborescencePaths": [
    {
      "path": [
        "Commande à courroie",
        "Jeu/ courroies trapézoïdales à nervures",
        "V-Ribbed Belt/Set"
      ],
      "categoryIds": [
        100016,
        null,
        100082
      ],
      "finalCategoryId": 100082,
      "productId": 4172
    },
    {
      "path": [
        "Commande à courroie",
        "Poulie",
        "Belt Pulley"
      ],
      "categoryIds": [
        100016,
        null,
        101971
      ],
      "finalCategoryId": 101971,
      "productId": 4172
    },
    {
      "path": [
        "Moteur",
        "Commande à courroie",
        "Belt Drive"
      ],
      "categoryIds": [
        100002,
        null,
        104302
      ],
      "finalCategoryId": 104302,
      "productId": 4172
    },
    {
      "path": [
        "Refroidissement",
        "Pompe à eau / joint",
        "Water Pump/Gasket"
      ],
      "categoryIds": [
        100007,
        null,
        100088
      ],
      "finalCategoryId": 100088,
      "productId": 4172
    }
  ],
  "productIdsInArbo": [
    4172
  ],
  "matchedProductIds": [
    4172
  ]
}