{
  "productName": "Pompe à haute pression",
  "searchText": "Pompe à haute pression",
  "found": true,
  "hasMatch": true,
  "timestamp": "2025-12-03T07:02:02.786Z",
  "productId": 3918,
  "arborescence": {
    "Alimentation carburant": {
      "categoryId": 100214,
      "categoryName": "Alimentation carburant",
      "level": 1,
      "children": {
        "Pompe / accessoires": {
          "categoryId": null,
          "categoryName": "Pompe / accessoires",
          "level": 2,
          "children": {
            "Câble adaptateur, pompe haute pression": {
              "categoryId": 100251,
              "categoryName": "Pump/Accessories",
              "level": 2,
              "children": {
                "Pompe d'alimentation": {
                  "categoryId": null,
                  "categoryName": "Pompe d'alimentation",
                  "level": 4,
                  "children": {
                    "Câble adaptateur, pompe haute pression": {
                      "categoryId": 100717,
                      "categoryName": "Fuel Pump",
                      "level": 3,
                      "children": [],
                      "productId": 60481
                    }
                  }
                }
              },
              "productId": 60481
            },
            "Pilon, Pompe à haute pression": {
              "categoryId": 100251,
              "categoryName": "Pump/Accessories",
              "level": 2,
              "children": {
                "Accessoires/Composants": {
                  "categoryId": null,
                  "categoryName": "Accessoires/Composants",
                  "level": 4,
                  "children": {
                    "Pilon, Pompe à haute pression": {
                      "categoryId": 100718,
                      "categoryName": "Accessories/Parts",
                      "level": 3,
                      "children": [],
                      "productId": 4662
                    }
                  }
                }
              },
              "productId": 4662
            },
            "Pompe à haute pression": {
              "categoryId": 100251,
              "categoryName": "Pump/Accessories",
              "level": 2,
              "children": {
                "Pompe d'alimentation": {
                  "categoryId": null,
                  "categoryName": "Pompe d'alimentation",
                  "level": 4,
                  "children": {
                    "Pompe à haute pression": {
                      "categoryId": 100717,
                      "categoryName": "Fuel Pump",
                      "level": 3,
                      "children": [],
                      "productId": 3918
                    }
                  }
                }
              },
              "productId": 3918
            },
            "Raccord, pompe à haute pressio": {
              "categoryId": 100251,
              "categoryName": "Pump/Accessories",
              "level": 2,
              "children": {
                "Accessoires/Composants": {
                  "categoryId": null,
                  "categoryName": "Accessoires/Composants",
                  "level": 4,
                  "children": {
                    "Raccord, pompe à haute pressio": {
                      "categoryId": 100718,
                      "categoryName": "Accessories/Parts",
                      "level": 3,
                      "children": [],
                      "productId": 4899
                    }
                  }
                }
              },
              "productId": 4899
            }
          }
        }
      }
    },
    "Carburation": {
      "categoryId": 100254,
      "categoryName": "Carburation",
      "level": 1,
      "children": {
        "Mélange air-carburant": {
          "categoryId": null,
          "categoryName": "Mélange air-carburant",
          "level": 2,
          "children": {
            "Ajusteur d’injection, pompe à injection": {
              "categoryId": 102793,
              "categoryName": "Mixture Formation",
              "level": 2,
              "children": {
                "Pompe à injection/pompe à haute pression": {
                  "categoryId": null,
                  "categoryName": "Pompe à injection/pompe à haute pression",
                  "level": 4,
                  "children": {
                    "Ajusteur d’injection, pompe à injection": {
                      "categoryId": 102803,
                      "categoryName": "Fuel Injection Pump/High Pressure Pump",
                      "level": 3,
                      "children": [],
                      "productId": 60446
                    }
                  }
                }
              },
              "productId": 60446
            },
            "Câble adaptateur, pompe haute pression": {
              "categoryId": 102793,
              "categoryName": "Mixture Formation",
              "level": 2,
              "children": {
                "Pompe à injection/pompe à haute pression": {
                  "categoryId": null,
                  "categoryName": "Pompe à injection/pompe à haute pression",
                  "level": 4,
                  "children": {
                    "Câble adaptateur, pompe haute pression": {
                      "categoryId": 102803,
                      "categoryName": "Fuel Injection Pump/High Pressure Pump",
                      "level": 3,
                      "children": [],
                      "productId": 60481
                    }
                  }
                }
              },
              "productId": 60481
            },
            "Capteur d’angle de rotation, pompe à injection": {
              "categoryId": 102793,
              "categoryName": "Mixture Formation",
              "level": 2,
              "children": {
                "Capteur/sonde lambda": {
                  "categoryId": null,
                  "categoryName": "Capteur/sonde lambda",
                  "level": 4,
                  "children": {
                    "Capteur d’angle de rotation, pompe à injection": {
                      "categoryId": 102809,
                      "categoryName": "Sensor/Probe",
                      "level": 3,
                      "children": [],
                      "productId": 60465
                    }
                  }
                },
                "Pompe à injection/pompe à haute pression": {
                  "categoryId": null,
                  "categoryName": "Pompe à injection/pompe à haute pression",
                  "level": 4,
                  "children": {
                    "Capteur d’angle de rotation, pompe à injection": {
                      "categoryId": 102803,
                      "categoryName": "Fuel Injection Pump/High Pressure Pump",
                      "level": 3,
                      "children": [],
                      "productId": 60465
                    }
                  }
                }
              },
              "productId": 60465
            },
            "Capteur de régime moteur, pompe à injection": {
              "categoryId": 102793,
              "categoryName": "Mixture Formation",
              "level": 2,
              "children": {
                "Pompe à injection/pompe à haute pression": {
                  "categoryId": null,
                  "categoryName": "Pompe à injection/pompe à haute pression",
                  "level": 4,
                  "children": {
                    "Capteur de régime moteur, pompe à injection": {
                      "categoryId": 102803,
                      "categoryName": "Fuel Injection Pump/High Pressure Pump",
                      "level": 3,
                      "children": [],
                      "productId": 60443
                    }
                  }
                }
              },
              "productId": 60443
            },
            "Disque entr., dispositif d'entraînement (pompe d'injection)": {
              "categoryId": 102793,
              "categoryName": "Mixture Formation",
              "level": 2,
              "children": {
                "Pompe à injection/pompe à haute pression": {
                  "categoryId": null,
                  "categoryName": "Pompe à injection/pompe à haute pression",
                  "level": 4,
                  "children": {
                    "Disque entr., dispositif d'entraînement (pompe d'injection)": {
                      "categoryId": 102803,
                      "categoryName": "Fuel Injection Pump/High Pressure Pump",
                      "level": 3,
                      "children": [],
                      "productId": 3992
                    }
                  }
                }
              },
              "productId": 3992
            },
            "Écrou, bride - pompe d'injection": {
              "categoryId": 102793,
              "categoryName": "Mixture Formation",
              "level": 2,
              "children": {
                "Pompe à injection/pompe à haute pression": {
                  "categoryId": null,
                  "categoryName": "Pompe à injection/pompe à haute pression",
                  "level": 4,
                  "children": {
                    "Écrou, bride - pompe d'injection": {
                      "categoryId": 102803,
                      "categoryName": "Fuel Injection Pump/High Pressure Pump",
                      "level": 3,
                      "children": [],
                      "productId": 3994
                    }
                  }
                }
              },
              "productId": 3994
            },
            "Elément d'ajustage, pompe d'injection": {
              "categoryId": 102793,
              "categoryName": "Mixture Formation",
              "level": 2,
              "children": {
                "Pompe à injection/pompe à haute pression": {
                  "categoryId": null,
                  "categoryName": "Pompe à injection/pompe à haute pression",
                  "level": 4,
                  "children": {
                    "Elément d'ajustage, pompe d'injection": {
                      "categoryId": 102803,
                      "categoryName": "Fuel Injection Pump/High Pressure Pump",
                      "level": 3,
                      "children": [],
                      "productId": 3951
                    }
                  }
                }
              },
              "productId": 3951
            },
            "Kit de commandes, pompe d'injection": {
              "categoryId": 102793,
              "categoryName": "Mixture Formation",
              "level": 2,
              "children": {
                "Pompe à injection/pompe à haute pression": {
                  "categoryId": null,
                  "categoryName": "Pompe à injection/pompe à haute pression",
                  "level": 4,
                  "children": {
                    "Kit de commandes, pompe d'injection": {
                      "categoryId": 102803,
                      "categoryName": "Fuel Injection Pump/High Pressure Pump",
                      "level": 3,
                      "children": [],
                      "productId": 6402
                    }
                  }
                }
              },
              "productId": 6402
            },
            "Kit de réparation (pompe à haute pression)": {
              "categoryId": 102793,
              "categoryName": "Mixture Formation",
              "level": 2,
              "children": {
                "Pompe à injection/pompe à haute pression": {
                  "categoryId": null,
                  "categoryName": "Pompe à injection/pompe à haute pression",
                  "level": 4,
                  "children": {
                    "Kit de réparation (pompe à haute pression)": {
                      "categoryId": 102803,
                      "categoryName": "Fuel Injection Pump/High Pressure Pump",
                      "level": 3,
                      "children": [],
                      "productId": 60669
                    }
                  }
                }
              },
              "productId": 60669
            },
            "Kit rép. de câble, capteur vitesse rotat. pompe à injection": {
              "categoryId": 102793,
              "categoryName": "Mixture Formation",
              "level": 2,
              "children": {
                "Pompe à injection/pompe à haute pression": {
                  "categoryId": null,
                  "categoryName": "Pompe à injection/pompe à haute pression",
                  "level": 4,
                  "children": {
                    "Kit rép. de câble, capteur vitesse rotat. pompe à injection": {
                      "categoryId": 102803,
                      "categoryName": "Fuel Injection Pump/High Pressure Pump",
                      "level": 3,
                      "children": [],
                      "productId": 60024
                    }
                  }
                }
              },
              "productId": 60024
            },
            "Kit rép. de câble, vanne de régulat. (quantité de carburant)": {
              "categoryId": 102793,
              "categoryName": "Mixture Formation",
              "level": 2,
              "children": {
                "Pompe à injection/pompe à haute pression": {
                  "categoryId": null,
                  "categoryName": "Pompe à injection/pompe à haute pression",
                  "level": 4,
                  "children": {
                    "Kit rép. de câble, vanne de régulat. (quantité de carburant)": {
                      "categoryId": 102803,
                      "categoryName": "Fuel Injection Pump/High Pressure Pump",
                      "level": 3,
                      "children": [],
                      "productId": 60105
                    }
                  }
                },
                "Soupapes/Bloc de soupapes": {
                  "categoryId": null,
                  "categoryName": "Soupapes/Bloc de soupapes",
                  "level": 4,
                  "children": {
                    "Kit rép. de câble, vanne de régulat. (quantité de carburant)": {
                      "categoryId": 102811,
                      "categoryName": "Valves/Valve Unit",
                      "level": 3,
                      "children": [],
                      "productId": 60105
                    }
                  }
                }
              },
              "productId": 60105
            },
            "Kit réparation de câble, pompe à injection": {
              "categoryId": 102793,
              "categoryName": "Mixture Formation",
              "level": 2,
              "children": {
                "Pompe à injection/pompe à haute pression": {
                  "categoryId": null,
                  "categoryName": "Pompe à injection/pompe à haute pression",
                  "level": 4,
                  "children": {
                    "Kit réparation de câble, pompe à injection": {
                      "categoryId": 102803,
                      "categoryName": "Fuel Injection Pump/High Pressure Pump",
                      "level": 3,
                      "children": [],
                      "productId": 60050
                    }
                  }
                }
              },
              "productId": 60050
            },
            "Kit réparation de câble, soupape d'arrêt pompe à injection": {
              "categoryId": 102793,
              "categoryName": "Mixture Formation",
              "level": 2,
              "children": {
                "Pompe à injection/pompe à haute pression": {
                  "categoryId": null,
                  "categoryName": "Pompe à injection/pompe à haute pression",
                  "level": 4,
                  "children": {
                    "Kit réparation de câble, soupape d'arrêt pompe à injection": {
                      "categoryId": 102803,
                      "categoryName": "Fuel Injection Pump/High Pressure Pump",
                      "level": 3,
                      "children": [],
                      "productId": 8020
                    }
                  }
                }
              },
              "productId": 8020
            },
            "Manchon, dispositif de propulsion-pompe d'injection": {
              "categoryId": 102793,
              "categoryName": "Mixture Formation",
              "level": 2,
              "children": {
                "Pompe à injection/pompe à haute pression": {
                  "categoryId": null,
                  "categoryName": "Pompe à injection/pompe à haute pression",
                  "level": 4,
                  "children": {
                    "Manchon, dispositif de propulsion-pompe d'injection": {
                      "categoryId": 102803,
                      "categoryName": "Fuel Injection Pump/High Pressure Pump",
                      "level": 3,
                      "children": [],
                      "productId": 3993
                    }
                  }
                }
              },
              "productId": 3993
            },
            "Pignon, pompe d'injection": {
              "categoryId": 102793,
              "categoryName": "Mixture Formation",
              "level": 2,
              "children": {
                "Pompe à injection/pompe à haute pression": {
                  "categoryId": null,
                  "categoryName": "Pompe à injection/pompe à haute pression",
                  "level": 4,
                  "children": {
                    "Pignon, pompe d'injection": {
                      "categoryId": 102803,
                      "categoryName": "Fuel Injection Pump/High Pressure Pump",
                      "level": 3,
                      "children": [],
                      "productId": 4200
                    }
                  }
                }
              },
              "productId": 4200
            },
            "Pilon, Pompe à haute pression": {
              "categoryId": 102793,
              "categoryName": "Mixture Formation",
              "level": 2,
              "children": {
                "Pompe à injection/pompe à haute pression": {
                  "categoryId": null,
                  "categoryName": "Pompe à injection/pompe à haute pression",
                  "level": 4,
                  "children": {
                    "Pilon, Pompe à haute pression": {
                      "categoryId": 102803,
                      "categoryName": "Fuel Injection Pump/High Pressure Pump",
                      "level": 3,
                      "children": [],
                      "productId": 4662
                    }
                  }
                }
              },
              "productId": 4662
            },
            "Pompe à haute pression": {
              "categoryId": 102793,
              "categoryName": "Mixture Formation",
              "level": 2,
              "children": {
                "Pompe à injection/pompe à haute pression": {
                  "categoryId": null,
                  "categoryName": "Pompe à injection/pompe à haute pression",
                  "level": 4,
                  "children": {
                    "Pompe à haute pression": {
                      "categoryId": 102803,
                      "categoryName": "Fuel Injection Pump/High Pressure Pump",
                      "level": 3,
                      "children": [],
                      "productId": 3918
                    }
                  }
                }
              },
              "productId": 3918
            },
            "Pompe à injection": {
              "categoryId": 102793,
              "categoryName": "Mixture Formation",
              "level": 2,
              "children": {
                "Pompe à injection/pompe à haute pression": {
                  "categoryId": null,
                  "categoryName": "Pompe à injection/pompe à haute pression",
                  "level": 4,
                  "children": {
                    "Pompe à injection": {
                      "categoryId": 102803,
                      "categoryName": "Fuel Injection Pump/High Pressure Pump",
                      "level": 3,
                      "children": [],
                      "productId": 3904
                    }
                  }
                }
              },
              "productId": 3904
            },
            "Raccord, pompe à haute pressio": {
              "categoryId": 102793,
              "categoryName": "Mixture Formation",
              "level": 2,
              "children": {
                "Pompe à injection/pompe à haute pression": {
                  "categoryId": null,
                  "categoryName": "Pompe à injection/pompe à haute pression",
                  "level": 4,
                  "children": {
                    "Raccord, pompe à haute pressio": {
                      "categoryId": 102803,
                      "categoryName": "Fuel Injection Pump/High Pressure Pump",
                      "level": 3,
                      "children": [],
                      "productId": 4899
                    }
                  }
                }
              },
              "productId": 4899
            },
            "Régulateur, quantité de carburant (système à rampe commune)": {
              "categoryId": 102793,
              "categoryName": "Mixture Formation",
              "level": 2,
              "children": {
                "Pompe à injection/pompe à haute pression": {
                  "categoryId": null,
                  "categoryName": "Pompe à injection/pompe à haute pression",
                  "level": 4,
                  "children": {
                    "Régulateur, quantité de carburant (système à rampe commune)": {
                      "categoryId": 102803,
                      "categoryName": "Fuel Injection Pump/High Pressure Pump",
                      "level": 3,
                      "children": [],
                      "productId": 5655
                    }
                  }
                },
                "Soupapes/Bloc de soupapes": {
                  "categoryId": null,
                  "categoryName": "Soupapes/Bloc de soupapes",
                  "level": 4,
                  "children": {
                    "Régulateur, quantité de carburant (système à rampe commune)": {
                      "categoryId": 102811,
                      "categoryName": "Valves/Valve Unit",
                      "level": 3,
                      "children": [],
                      "productId": 5655
                    }
                  }
                }
              },
              "productId": 5655
            },
            "Rotule, tringlerie- pompe à injection": {
              "categoryId": 102793,
              "categoryName": "Mixture Formation",
              "level": 2,
              "children": {
                "Pompe à injection/pompe à haute pression": {
                  "categoryId": null,
                  "categoryName": "Pompe à injection/pompe à haute pression",
                  "level": 4,
                  "children": {
                    "Rotule, tringlerie- pompe à injection": {
                      "categoryId": 102803,
                      "categoryName": "Fuel Injection Pump/High Pressure Pump",
                      "level": 3,
                      "children": [],
                      "productId": 5159
                    }
                  }
                }
              },
              "productId": 5159
            },
            "Soupape de pression, pompe d’injection": {
              "categoryId": 102793,
              "categoryName": "Mixture Formation",
              "level": 2,
              "children": {
                "Pompe à injection/pompe à haute pression": {
                  "categoryId": null,
                  "categoryName": "Pompe à injection/pompe à haute pression",
                  "level": 4,
                  "children": {
                    "Soupape de pression, pompe d’injection": {
                      "categoryId": 102803,
                      "categoryName": "Fuel Injection Pump/High Pressure Pump",
                      "level": 3,
                      "children": [],
                      "productId": 8760
                    }
                  }
                }
              },
              "productId": 8760
            },
            "Soupape de surpression, système à rampe commune": {
              "categoryId": 102793,
              "categoryName": "Mixture Formation",
              "level": 2,
              "children": {
                "Pompe à injection/pompe à haute pression": {
                  "categoryId": null,
                  "categoryName": "Pompe à injection/pompe à haute pression",
                  "level": 4,
                  "children": {
                    "Soupape de surpression, système à rampe commune": {
                      "categoryId": 102803,
                      "categoryName": "Fuel Injection Pump/High Pressure Pump",
                      "level": 3,
                      "children": [],
                      "productId": 5656
                    }
                  }
                },
                "Soupapes/Bloc de soupapes": {
                  "categoryId": null,
                  "categoryName": "Soupapes/Bloc de soupapes",
                  "level": 4,
                  "children": {
                    "Soupape de surpression, système à rampe commune": {
                      "categoryId": 102811,
                      "categoryName": "Valves/Valve Unit",
                      "level": 3,
                      "children": [],
                      "productId": 5656
                    }
                  }
                }
              },
              "productId": 5656
            }
          }
        }
      }
    }
  },
  "arborescenceText": "├── Alimentation carburant [ID: 100214] (Niveau 1)\n│   └── Pompe / accessoires (Niveau 2)\n│       ├── Pump/Accessories [ID: 100251] (Niveau 2) → ProductId: 60481\n│       │   └── Pompe d'alimentation (Niveau 4)\n│       │       └── Fuel Pump [ID: 100717] (Niveau 3) → ProductId: 60481\n│       ├── Pump/Accessories [ID: 100251] (Niveau 2) → ProductId: 4662\n│       │   └── Accessoires/Composants (Niveau 4)\n│       │       └── Accessories/Parts [ID: 100718] (Niveau 3) → ProductId: 4662\n│       ├── Pump/Accessories [ID: 100251] (Niveau 2) → ProductId: 3918\n│       │   └── Pompe d'alimentation (Niveau 4)\n│       │       └── Fuel Pump [ID: 100717] (Niveau 3) → ProductId: 3918\n│       └── Pump/Accessories [ID: 100251] (Niveau 2) → ProductId: 4899\n│           └── Accessoires/Composants (Niveau 4)\n│               └── Accessories/Parts [ID: 100718] (Niveau 3) → ProductId: 4899\n\n└── Carburation [ID: 100254] (Niveau 1)\n    └── Mélange air-carburant (Niveau 2)\n        ├── Mixture Formation [ID: 102793] (Niveau 2) → ProductId: 60446\n        │   └── Pompe à injection/pompe à haute pression (Niveau 4)\n        │       └── Fuel Injection Pump/High Pressure Pump [ID: 102803] (Niveau 3) → ProductId: 60446\n        ├── Mixture Formation [ID: 102793] (Niveau 2) → ProductId: 60481\n        │   └── Pompe à injection/pompe à haute pression (Niveau 4)\n        │       └── Fuel Injection Pump/High Pressure Pump [ID: 102803] (Niveau 3) → ProductId: 60481\n        ├── Mixture Formation [ID: 102793] (Niveau 2) → ProductId: 60465\n        │   ├── Capteur/sonde lambda (Niveau 4)\n        │   │   └── Sensor/Probe [ID: 102809] (Niveau 3) → ProductId: 60465\n        │   └── Pompe à injection/pompe à haute pression (Niveau 4)\n        │       └── Fuel Injection Pump/High Pressure Pump [ID: 102803] (Niveau 3) → ProductId: 60465\n        ├── Mixture Formation [ID: 102793] (Niveau 2) → ProductId: 60443\n        │   └── Pompe à injection/pompe à haute pression (Niveau 4)\n        │       └── Fuel Injection Pump/High Pressure Pump [ID: 102803] (Niveau 3) → ProductId: 60443\n        ├── Mixture Formation [ID: 102793] (Niveau 2) → ProductId: 3992\n        │   └── Pompe à injection/pompe à haute pression (Niveau 4)\n        │       └── Fuel Injection Pump/High Pressure Pump [ID: 102803] (Niveau 3) → ProductId: 3992\n        ├── Mixture Formation [ID: 102793] (Niveau 2) → ProductId: 3994\n        │   └── Pompe à injection/pompe à haute pression (Niveau 4)\n        │       └── Fuel Injection Pump/High Pressure Pump [ID: 102803] (Niveau 3) → ProductId: 3994\n        ├── Mixture Formation [ID: 102793] (Niveau 2) → ProductId: 3951\n        │   └── Pompe à injection/pompe à haute pression (Niveau 4)\n        │       └── Fuel Injection Pump/High Pressure Pump [ID: 102803] (Niveau 3) → ProductId: 3951\n        ├── Mixture Formation [ID: 102793] (Niveau 2) → ProductId: 6402\n        │   └── Pompe à injection/pompe à haute pression (Niveau 4)\n        │       └── Fuel Injection Pump/High Pressure Pump [ID: 102803] (Niveau 3) → ProductId: 6402\n        ├── Mixture Formation [ID: 102793] (Niveau 2) → ProductId: 60669\n        │   └── Pompe à injection/pompe à haute pression (Niveau 4)\n        │       └── Fuel Injection Pump/High Pressure Pump [ID: 102803] (Niveau 3) → ProductId: 60669\n        ├── Mixture Formation [ID: 102793] (Niveau 2) → ProductId: 60024\n        │   └── Pompe à injection/pompe à haute pression (Niveau 4)\n        │       └── Fuel Injection Pump/High Pressure Pump [ID: 102803] (Niveau 3) → ProductId: 60024\n        ├── Mixture Formation [ID: 102793] (Niveau 2) → ProductId: 60105\n        │   ├── Pompe à injection/pompe à haute pression (Niveau 4)\n        │   │   └── Fuel Injection Pump/High Pressure Pump [ID: 102803] (Niveau 3) → ProductId: 60105\n        │   └── Soupapes/Bloc de soupapes (Niveau 4)\n        │       └── Valves/Valve Unit [ID: 102811] (Niveau 3) → ProductId: 60105\n        ├── Mixture Formation [ID: 102793] (Niveau 2) → ProductId: 60050\n        │   └── Pompe à injection/pompe à haute pression (Niveau 4)\n        │       └── Fuel Injection Pump/High Pressure Pump [ID: 102803] (Niveau 3) → ProductId: 60050\n        ├── Mixture Formation [ID: 102793] (Niveau 2) → ProductId: 8020\n        │   └── Pompe à injection/pompe à haute pression (Niveau 4)\n        │       └── Fuel Injection Pump/High Pressure Pump [ID: 102803] (Niveau 3) → ProductId: 8020\n        ├── Mixture Formation [ID: 102793] (Niveau 2) → ProductId: 3993\n        │   └── Pompe à injection/pompe à haute pression (Niveau 4)\n        │       └── Fuel Injection Pump/High Pressure Pump [ID: 102803] (Niveau 3) → ProductId: 3993\n        ├── Mixture Formation [ID: 102793] (Niveau 2) → ProductId: 4200\n        │   └── Pompe à injection/pompe à haute pression (Niveau 4)\n        │       └── Fuel Injection Pump/High Pressure Pump [ID: 102803] (Niveau 3) → ProductId: 4200\n        ├── Mixture Formation [ID: 102793] (Niveau 2) → ProductId: 4662\n        │   └── Pompe à injection/pompe à haute pression (Niveau 4)\n        │       └── Fuel Injection Pump/High Pressure Pump [ID: 102803] (Niveau 3) → ProductId: 4662\n        ├── Mixture Formation [ID: 102793] (Niveau 2) → ProductId: 3918\n        │   └── Pompe à injection/pompe à haute pression (Niveau 4)\n        │       └── Fuel Injection Pump/High Pressure Pump [ID: 102803] (Niveau 3) → ProductId: 3918\n        ├── Mixture Formation [ID: 102793] (Niveau 2) → ProductId: 3904\n        │   └── Pompe à injection/pompe à haute pression (Niveau 4)\n        │       └── Fuel Injection Pump/High Pressure Pump [ID: 102803] (Niveau 3) → ProductId: 3904\n        ├── Mixture Formation [ID: 102793] (Niveau 2) → ProductId: 4899\n        │   └── Pompe à injection/pompe à haute pression (Niveau 4)\n        │       └── Fuel Injection Pump/High Pressure Pump [ID: 102803] (Niveau 3) → ProductId: 4899\n        ├── Mixture Formation [ID: 102793] (Niveau 2) → ProductId: 5655\n        │   ├── Pompe à injection/pompe à haute pression (Niveau 4)\n        │   │   └── Fuel Injection Pump/High Pressure Pump [ID: 102803] (Niveau 3) → ProductId: 5655\n        │   └── Soupapes/Bloc de soupapes (Niveau 4)\n        │       └── Valves/Valve Unit [ID: 102811] (Niveau 3) → ProductId: 5655\n        ├── Mixture Formation [ID: 102793] (Niveau 2) → ProductId: 5159\n        │   └── Pompe à injection/pompe à haute pression (Niveau 4)\n        │       └── Fuel Injection Pump/High Pressure Pump [ID: 102803] (Niveau 3) → ProductId: 5159\n        ├── Mixture Formation [ID: 102793] (Niveau 2) → ProductId: 8760\n        │   └── Pompe à injection/pompe à haute pression (Niveau 4)\n        │       └── Fuel Injection Pump/High Pressure Pump [ID: 102803] (Niveau 3) → ProductId: 8760\n        └── Mixture Formation [ID: 102793] (Niveau 2) → ProductId: 5656\n            ├── Pompe à injection/pompe à haute pression (Niveau 4)\n            │   └── Fuel Injection Pump/High Pressure Pump [ID: 102803] (Niveau 3) → ProductId: 5656\n            └── Soupapes/Bloc de soupapes (Niveau 4)\n                └── Valves/Valve Unit [ID: 102811] (Niveau 3) → ProductId: 5656",
  "arborescencePaths": [
    {
      "path": [
        "Alimentation carburant",
        "Pompe / accessoires",
        "Pump/Accessories"
      ],
      "categoryIds": [
        100214,
        null,
        100251
      ],
      "finalCategoryId": 100251,
      "productId": 60481
    },
    {
      "path": [
        "Alimentation carburant",
        "Pompe / accessoires",
        "Pump/Accessories"
      ],
      "categoryIds": [
        100214,
        null,
        100251
      ],
      "finalCategoryId": 100251,
      "productId": 4662
    },
    {
      "path": [
        "Alimentation carburant",
        "Pompe / accessoires",
        "Pump/Accessories"
      ],
      "categoryIds": [
        100214,
        null,
        100251
      ],
      "finalCategoryId": 100251,
      "productId": 3918
    },
    {
      "path": [
        "Alimentation carburant",
        "Pompe / accessoires",
        "Pump/Accessories"
      ],
      "categoryIds": [
        100214,
        null,
        100251
      ],
      "finalCategoryId": 100251,
      "productId": 4899
    },
    {
      "path": [
        "Carburation",
        "Mélange air-carburant",
        "Mixture Formation"
      ],
      "categoryIds": [
        100254,
        null,
        102793
      ],
      "finalCategoryId": 102793,
      "productId": 60446
    },
    {
      "path": [
        "Carburation",
        "Mélange air-carburant",
        "Mixture Formation"
      ],
      "categoryIds": [
        100254,
        null,
        102793
      ],
      "finalCategoryId": 102793,
      "productId": 60481
    },
    {
      "path": [
        "Carburation",
        "Mélange air-carburant",
        "Mixture Formation"
      ],
      "categoryIds": [
        100254,
        null,
        102793
      ],
      "finalCategoryId": 102793,
      "productId": 60465
    },
    {
      "path": [
        "Carburation",
        "Mélange air-carburant",
        "Mixture Formation"
      ],
      "categoryIds": [
        100254,
        null,
        102793
      ],
      "finalCategoryId": 102793,
      "productId": 60443
    },
    {
      "path": [
        "Carburation",
        "Mélange air-carburant",
        "Mixture Formation"
      ],
      "categoryIds": [
        100254,
        null,
        102793
      ],
      "finalCategoryId": 102793,
      "productId": 3992
    },
    {
      "path": [
        "Carburation",
        "Mélange air-carburant",
        "Mixture Formation"
      ],
      "categoryIds": [
        100254,
        null,
        102793
      ],
      "finalCategoryId": 102793,
      "productId": 3994
    },
    {
      "path": [
        "Carburation",
        "Mélange air-carburant",
        "Mixture Formation"
      ],
      "categoryIds": [
        100254,
        null,
        102793
      ],
      "finalCategoryId": 102793,
      "productId": 3951
    },
    {
      "path": [
        "Carburation",
        "Mélange air-carburant",
        "Mixture Formation"
      ],
      "categoryIds": [
        100254,
        null,
        102793
      ],
      "finalCategoryId": 102793,
      "productId": 6402
    },
    {
      "path": [
        "Carburation",
        "Mélange air-carburant",
        "Mixture Formation"
      ],
      "categoryIds": [
        100254,
        null,
        102793
      ],
      "finalCategoryId": 102793,
      "productId": 60669
    },
    {
      "path": [
        "Carburation",
        "Mélange air-carburant",
        "Mixture Formation"
      ],
      "categoryIds": [
        100254,
        null,
        102793
      ],
      "finalCategoryId": 102793,
      "productId": 60024
    },
    {
      "path": [
        "Carburation",
        "Mélange air-carburant",
        "Mixture Formation"
      ],
      "categoryIds": [
        100254,
        null,
        102793
      ],
      "finalCategoryId": 102793,
      "productId": 60105
    },
    {
      "path": [
        "Carburation",
        "Mélange air-carburant",
        "Mixture Formation"
      ],
      "categoryIds": [
        100254,
        null,
        102793
      ],
      "finalCategoryId": 102793,
      "productId": 60050
    },
    {
      "path": [
        "Carburation",
        "Mélange air-carburant",
        "Mixture Formation"
      ],
      "categoryIds": [
        100254,
        null,
        102793
      ],
      "finalCategoryId": 102793,
      "productId": 8020
    },
    {
      "path": [
        "Carburation",
        "Mélange air-carburant",
        "Mixture Formation"
      ],
      "categoryIds": [
        100254,
        null,
        102793
      ],
      "finalCategoryId": 102793,
      "productId": 3993
    },
    {
      "path": [
        "Carburation",
        "Mélange air-carburant",
        "Mixture Formation"
      ],
      "categoryIds": [
        100254,
        null,
        102793
      ],
      "finalCategoryId": 102793,
      "productId": 4200
    },
    {
      "path": [
        "Carburation",
        "Mélange air-carburant",
        "Mixture Formation"
      ],
      "categoryIds": [
        100254,
        null,
        102793
      ],
      "finalCategoryId": 102793,
      "productId": 4662
    },
    {
      "path": [
        "Carburation",
        "Mélange air-carburant",
        "Mixture Formation"
      ],
      "categoryIds": [
        100254,
        null,
        102793
      ],
      "finalCategoryId": 102793,
      "productId": 3918
    },
    {
      "path": [
        "Carburation",
        "Mélange air-carburant",
        "Mixture Formation"
      ],
      "categoryIds": [
        100254,
        null,
        102793
      ],
      "finalCategoryId": 102793,
      "productId": 3904
    },
    {
      "path": [
        "Carburation",
        "Mélange air-carburant",
        "Mixture Formation"
      ],
      "categoryIds": [
        100254,
        null,
        102793
      ],
      "finalCategoryId": 102793,
      "productId": 4899
    },
    {
      "path": [
        "Carburation",
        "Mélange air-carburant",
        "Mixture Formation"
      ],
      "categoryIds": [
        100254,
        null,
        102793
      ],
      "finalCategoryId": 102793,
      "productId": 5655
    },
    {
      "path": [
        "Carburation",
        "Mélange air-carburant",
        "Mixture Formation"
      ],
      "categoryIds": [
        100254,
        null,
        102793
      ],
      "finalCategoryId": 102793,
      "productId": 5159
    },
    {
      "path": [
        "Carburation",
        "Mélange air-carburant",
        "Mixture Formation"
      ],
      "categoryIds": [
        100254,
        null,
        102793
      ],
      "finalCategoryId": 102793,
      "productId": 8760
    },
    {
      "path": [
        "Carburation",
        "Mélange air-carburant",
        "Mixture Formation"
      ],
      "categoryIds": [
        100254,
        null,
        102793
      ],
      "finalCategoryId": 102793,
      "productId": 5656
    }
  ],
  "productIdsInArbo": [
    3904,
    3918,
    3951,
    3992,
    3993,
    3994,
    4200,
    4662,
    4899,
    5159,
    5655,
    5656,
    6402,
    8020,
    8760,
    60024,
    60050,
    60105,
    60443,
    60446,
    60465,
    60481,
    60669
  ],
  "matchedProductIds": [
    3918
  ]
}