{
  "productName": "Pompe à carburant",
  "searchText": "Pompe à carburant",
  "found": true,
  "hasMatch": true,
  "timestamp": "2025-12-03T07:01:27.758Z",
  "productId": 458,
  "arborescence": {
    "Alimentation carburant": {
      "categoryId": 100214,
      "categoryName": "Alimentation carburant",
      "level": 1,
      "children": {
        "Pompe / accessoires": {
          "categoryId": null,
          "categoryName": "Pompe / accessoires",
          "level": 2,
          "children": {
            "Accumulateur de pression, pression de carburant": {
              "categoryId": 100251,
              "categoryName": "Pump/Accessories",
              "level": 2,
              "children": {
                "Accessoires/Composants": {
                  "categoryId": null,
                  "categoryName": "Accessoires/Composants",
                  "level": 4,
                  "children": {
                    "Accumulateur de pression, pression de carburant": {
                      "categoryId": 100718,
                      "categoryName": "Accessories/Parts",
                      "level": 3,
                      "children": [],
                      "productId": 1303
                    }
                  }
                }
              },
              "productId": 1303
            },
            "Amortisseur de pot de stabilisation": {
              "categoryId": 100251,
              "categoryName": "Pump/Accessories",
              "level": 2,
              "children": {
                "Accessoires/Composants": {
                  "categoryId": null,
                  "categoryName": "Accessoires/Composants",
                  "level": 4,
                  "children": {
                    "Amortisseur de pot de stabilisation": {
                      "categoryId": 100718,
                      "categoryName": "Accessories/Parts",
                      "level": 3,
                      "children": [],
                      "productId": 1407
                    }
                  }
                }
              },
              "productId": 1407
            },
            "Bague d'étanchéité, pompe à carburant": {
              "categoryId": 100251,
              "categoryName": "Pump/Accessories",
              "level": 2,
              "children": {
                "Accessoires/Composants": {
                  "categoryId": null,
                  "categoryName": "Accessoires/Composants",
                  "level": 4,
                  "children": {
                    "Bague d'étanchéité, pompe à carburant": {
                      "categoryId": 100718,
                      "categoryName": "Accessories/Parts",
                      "level": 3,
                      "children": [],
                      "productId": 60680
                    }
                  }
                }
              },
              "productId": 60680
            },
            "Bague de fermeture, pompe à carburant": {
              "categoryId": 100251,
              "categoryName": "Pump/Accessories",
              "level": 2,
              "children": {
                "Accessoires/Composants": {
                  "categoryId": null,
                  "categoryName": "Accessoires/Composants",
                  "level": 4,
                  "children": {
                    "Bague de fermeture, pompe à carburant": {
                      "categoryId": 100718,
                      "categoryName": "Accessories/Parts",
                      "level": 3,
                      "children": [],
                      "productId": 8267
                    }
                  }
                }
              },
              "productId": 8267
            },
            "Câble adaptateur, pompe haute pression": {
              "categoryId": 100251,
              "categoryName": "Pump/Accessories",
              "level": 2,
              "children": {
                "Pompe d'alimentation": {
                  "categoryId": null,
                  "categoryName": "Pompe d'alimentation",
                  "level": 4,
                  "children": {
                    "Câble adaptateur, pompe haute pression": {
                      "categoryId": 100717,
                      "categoryName": "Fuel Pump",
                      "level": 3,
                      "children": [],
                      "productId": 60481
                    }
                  }
                }
              },
              "productId": 60481
            },
            "Commutateur de sécurité, pompe à carburant": {
              "categoryId": 100251,
              "categoryName": "Pump/Accessories",
              "level": 2,
              "children": {
                "Accessoires/Composants": {
                  "categoryId": null,
                  "categoryName": "Accessoires/Composants",
                  "level": 4,
                  "children": {
                    "Commutateur de sécurité, pompe à carburant": {
                      "categoryId": 100718,
                      "categoryName": "Accessories/Parts",
                      "level": 3,
                      "children": [],
                      "productId": 8256
                    }
                  }
                }
              },
              "productId": 8256
            },
            "Diaphragme, pompe à carburant": {
              "categoryId": 100251,
              "categoryName": "Pump/Accessories",
              "level": 2,
              "children": {
                "Accessoires/Composants": {
                  "categoryId": null,
                  "categoryName": "Accessoires/Composants",
                  "level": 4,
                  "children": {
                    "Diaphragme, pompe à carburant": {
                      "categoryId": 100718,
                      "categoryName": "Accessories/Parts",
                      "level": 3,
                      "children": [],
                      "productId": 3928
                    }
                  }
                }
              },
              "productId": 3928
            },
            "Dispositif de contrôle, pompe à carburant": {
              "categoryId": 100251,
              "categoryName": "Pump/Accessories",
              "level": 2,
              "children": {
                "Accessoires/Composants": {
                  "categoryId": null,
                  "categoryName": "Accessoires/Composants",
                  "level": 4,
                  "children": {
                    "Dispositif de contrôle, pompe à carburant": {
                      "categoryId": 100718,
                      "categoryName": "Accessories/Parts",
                      "level": 3,
                      "children": [],
                      "productId": 5763
                    }
                  }
                }
              },
              "productId": 5763
            },
            "Élément oscillant, pompe à carburant": {
              "categoryId": 100251,
              "categoryName": "Pump/Accessories",
              "level": 2,
              "children": {
                "Accessoires/Composants": {
                  "categoryId": null,
                  "categoryName": "Accessoires/Composants",
                  "level": 4,
                  "children": {
                    "Élément oscillant, pompe à carburant": {
                      "categoryId": 100718,
                      "categoryName": "Accessories/Parts",
                      "level": 3,
                      "children": [],
                      "productId": 1410
                    }
                  }
                },
                "Pompe d'alimentation": {
                  "categoryId": null,
                  "categoryName": "Pompe d'alimentation",
                  "level": 4,
                  "children": {
                    "Élément oscillant, pompe à carburant": {
                      "categoryId": 100717,
                      "categoryName": "Fuel Pump",
                      "level": 3,
                      "children": [],
                      "productId": 1410
                    }
                  }
                }
              },
              "productId": 1410
            },
            "Flasque, unité d'alimentation de carburant": {
              "categoryId": 100251,
              "categoryName": "Pump/Accessories",
              "level": 2,
              "children": {
                "Accessoires/Composants": {
                  "categoryId": null,
                  "categoryName": "Accessoires/Composants",
                  "level": 4,
                  "children": {
                    "Flasque, unité d'alimentation de carburant": {
                      "categoryId": 100718,
                      "categoryName": "Accessories/Parts",
                      "level": 3,
                      "children": [],
                      "productId": 1309
                    }
                  }
                }
              },
              "productId": 1309
            },
            "Joint d'étanchéité, pompe à carburant": {
              "categoryId": 100251,
              "categoryName": "Pump/Accessories",
              "level": 2,
              "children": {
                "Accessoires/Composants": {
                  "categoryId": null,
                  "categoryName": "Accessoires/Composants",
                  "level": 4,
                  "children": {
                    "Joint d'étanchéité, pompe à carburant": {
                      "categoryId": 100718,
                      "categoryName": "Accessories/Parts",
                      "level": 3,
                      "children": [],
                      "productId": 143
                    }
                  }
                }
              },
              "productId": 143
            },
            "Kit d'assemblage, pompe à carburant": {
              "categoryId": 100251,
              "categoryName": "Pump/Accessories",
              "level": 2,
              "children": {
                "Réparation": {
                  "categoryId": null,
                  "categoryName": "Réparation",
                  "level": 4,
                  "children": {
                    "Kit d'assemblage, pompe à carburant": {
                      "categoryId": 100719,
                      "categoryName": "Repair Kit",
                      "level": 3,
                      "children": [],
                      "productId": 613
                    }
                  }
                }
              },
              "productId": 613
            },
            "Kit d'assemblage, pompe d'alimentation manuelle": {
              "categoryId": 100251,
              "categoryName": "Pump/Accessories",
              "level": 2,
              "children": {
                "Pompe à main / accessoires": {
                  "categoryId": null,
                  "categoryName": "Pompe à main / accessoires",
                  "level": 4,
                  "children": {
                    "Kit d'assemblage, pompe d'alimentation manuelle": {
                      "categoryId": 706438,
                      "categoryName": "Hand Feed Pump/ Parts",
                      "level": 3,
                      "children": [],
                      "productId": 615
                    }
                  }
                },
                "Réparation": {
                  "categoryId": null,
                  "categoryName": "Réparation",
                  "level": 4,
                  "children": {
                    "Kit d'assemblage, pompe d'alimentation manuelle": {
                      "categoryId": 100719,
                      "categoryName": "Repair Kit",
                      "level": 3,
                      "children": [],
                      "productId": 615
                    }
                  }
                }
              },
              "productId": 615
            },
            "Kit de montage, palpeur de réservoir/pompe à carburant": {
              "categoryId": 100251,
              "categoryName": "Pump/Accessories",
              "level": 2,
              "children": {
                "Pompe d'alimentation": {
                  "categoryId": null,
                  "categoryName": "Pompe d'alimentation",
                  "level": 4,
                  "children": {
                    "Kit de montage, palpeur de réservoir/pompe à carburant": {
                      "categoryId": 100717,
                      "categoryName": "Fuel Pump",
                      "level": 3,
                      "children": [],
                      "productId": 8263
                    }
                  }
                }
              },
              "productId": 8263
            },
            "Kit rép. de câble, relais de pompe à carburant": {
              "categoryId": 100251,
              "categoryName": "Pump/Accessories",
              "level": 2,
              "children": {
                "Accessoires/Composants": {
                  "categoryId": null,
                  "categoryName": "Accessoires/Composants",
                  "level": 4,
                  "children": {
                    "Kit rép. de câble, relais de pompe à carburant": {
                      "categoryId": 100718,
                      "categoryName": "Accessories/Parts",
                      "level": 3,
                      "children": [],
                      "productId": 8963
                    }
                  }
                }
              },
              "productId": 8963
            },
            "Kit réparation de câble, calculateur pompe à carburant": {
              "categoryId": 100251,
              "categoryName": "Pump/Accessories",
              "level": 2,
              "children": {
                "Accessoires/Composants": {
                  "categoryId": null,
                  "categoryName": "Accessoires/Composants",
                  "level": 4,
                  "children": {
                    "Kit réparation de câble, calculateur pompe à carburant": {
                      "categoryId": 100718,
                      "categoryName": "Accessories/Parts",
                      "level": 3,
                      "children": [],
                      "productId": 9600
                    }
                  }
                }
              },
              "productId": 9600
            },
            "Kit réparation de câble, pompe à carburant": {
              "categoryId": 100251,
              "categoryName": "Pump/Accessories",
              "level": 2,
              "children": {
                "Réparation": {
                  "categoryId": null,
                  "categoryName": "Réparation",
                  "level": 4,
                  "children": {
                    "Kit réparation de câble, pompe à carburant": {
                      "categoryId": 100719,
                      "categoryName": "Repair Kit",
                      "level": 3,
                      "children": [],
                      "productId": 7314
                    }
                  }
                }
              },
              "productId": 7314
            },
            "Module d'alimentation en carburant": {
              "categoryId": 100251,
              "categoryName": "Pump/Accessories",
              "level": 2,
              "children": {
                "Pompe d'alimentation": {
                  "categoryId": null,
                  "categoryName": "Pompe d'alimentation",
                  "level": 4,
                  "children": {
                    "Module d'alimentation en carburant": {
                      "categoryId": 100717,
                      "categoryName": "Fuel Pump",
                      "level": 3,
                      "children": [],
                      "productId": 454
                    }
                  }
                }
              },
              "productId": 454
            },
            "Pilon, Pompe à haute pression": {
              "categoryId": 100251,
              "categoryName": "Pump/Accessories",
              "level": 2,
              "children": {
                "Accessoires/Composants": {
                  "categoryId": null,
                  "categoryName": "Accessoires/Composants",
                  "level": 4,
                  "children": {
                    "Pilon, Pompe à haute pression": {
                      "categoryId": 100718,
                      "categoryName": "Accessories/Parts",
                      "level": 3,
                      "children": [],
                      "productId": 4662
                    }
                  }
                }
              },
              "productId": 4662
            },
            "Pompe à carburant": {
              "categoryId": 100251,
              "categoryName": "Pump/Accessories",
              "level": 2,
              "children": {
                "Pompe d'alimentation": {
                  "categoryId": null,
                  "categoryName": "Pompe d'alimentation",
                  "level": 4,
                  "children": {
                    "Pompe à carburant": {
                      "categoryId": 100717,
                      "categoryName": "Fuel Pump",
                      "level": 3,
                      "children": [],
                      "productId": 458
                    }
                  }
                }
              },
              "productId": 458
            },
            "Pompe à haute pression": {
              "categoryId": 100251,
              "categoryName": "Pump/Accessories",
              "level": 2,
              "children": {
                "Pompe d'alimentation": {
                  "categoryId": null,
                  "categoryName": "Pompe d'alimentation",
                  "level": 4,
                  "children": {
                    "Pompe à haute pression": {
                      "categoryId": 100717,
                      "categoryName": "Fuel Pump",
                      "level": 3,
                      "children": [],
                      "productId": 3918
                    }
                  }
                }
              },
              "productId": 3918
            },
            "Pompe d'alimentation manuelle": {
              "categoryId": 100251,
              "categoryName": "Pump/Accessories",
              "level": 2,
              "children": {
                "Pompe à main / accessoires": {
                  "categoryId": null,
                  "categoryName": "Pompe à main / accessoires",
                  "level": 4,
                  "children": {
                    "Pompe d'alimentation manuelle": {
                      "categoryId": 706438,
                      "categoryName": "Hand Feed Pump/ Parts",
                      "level": 3,
                      "children": [],
                      "productId": 4228
                    }
                  }
                }
              },
              "productId": 4228
            },
            "Pompe, préalimentation de carburant": {
              "categoryId": 100251,
              "categoryName": "Pump/Accessories",
              "level": 2,
              "children": {
                "Pompe d'alimentation": {
                  "categoryId": null,
                  "categoryName": "Pompe d'alimentation",
                  "level": 4,
                  "children": {
                    "Pompe, préalimentation de carburant": {
                      "categoryId": 100717,
                      "categoryName": "Fuel Pump",
                      "level": 3,
                      "children": [],
                      "productId": 460
                    }
                  }
                }
              },
              "productId": 460
            },
            "Pot de stabilisation, pompe à carburant": {
              "categoryId": 100251,
              "categoryName": "Pump/Accessories",
              "level": 2,
              "children": {
                "Pompe d'alimentation": {
                  "categoryId": null,
                  "categoryName": "Pompe d'alimentation",
                  "level": 4,
                  "children": {
                    "Pot de stabilisation, pompe à carburant": {
                      "categoryId": 100717,
                      "categoryName": "Fuel Pump",
                      "level": 3,
                      "children": [],
                      "productId": 887
                    }
                  }
                }
              },
              "productId": 887
            },
            "Raccord, pompe à haute pressio": {
              "categoryId": 100251,
              "categoryName": "Pump/Accessories",
              "level": 2,
              "children": {
                "Accessoires/Composants": {
                  "categoryId": null,
                  "categoryName": "Accessoires/Composants",
                  "level": 4,
                  "children": {
                    "Raccord, pompe à haute pressio": {
                      "categoryId": 100718,
                      "categoryName": "Accessories/Parts",
                      "level": 3,
                      "children": [],
                      "productId": 4899
                    }
                  }
                }
              },
              "productId": 4899
            },
            "Relais, pompe à carburant": {
              "categoryId": 100251,
              "categoryName": "Pump/Accessories",
              "level": 2,
              "children": {
                "Accessoires/Composants": {
                  "categoryId": null,
                  "categoryName": "Accessoires/Composants",
                  "level": 4,
                  "children": {
                    "Relais, pompe à carburant": {
                      "categoryId": 100718,
                      "categoryName": "Accessories/Parts",
                      "level": 3,
                      "children": [],
                      "productId": 1111
                    }
                  }
                }
              },
              "productId": 1111
            },
            "Résistance de série, pompe à carburant": {
              "categoryId": 100251,
              "categoryName": "Pump/Accessories",
              "level": 2,
              "children": {
                "Accessoires/Composants": {
                  "categoryId": null,
                  "categoryName": "Accessoires/Composants",
                  "level": 4,
                  "children": {
                    "Résistance de série, pompe à carburant": {
                      "categoryId": 100718,
                      "categoryName": "Accessories/Parts",
                      "level": 3,
                      "children": [],
                      "productId": 2151
                    }
                  }
                }
              },
              "productId": 2151
            },
            "Support, amortisseur de pot de stabilisation": {
              "categoryId": 100251,
              "categoryName": "Pump/Accessories",
              "level": 2,
              "children": {
                "Accessoires/Composants": {
                  "categoryId": null,
                  "categoryName": "Accessoires/Composants",
                  "level": 4,
                  "children": {
                    "Support, amortisseur de pot de stabilisation": {
                      "categoryId": 100718,
                      "categoryName": "Accessories/Parts",
                      "level": 3,
                      "children": [],
                      "productId": 1408
                    }
                  }
                }
              },
              "productId": 1408
            },
            "Support, pompe à carburant": {
              "categoryId": 100251,
              "categoryName": "Pump/Accessories",
              "level": 2,
              "children": {
                "Accessoires/Composants": {
                  "categoryId": null,
                  "categoryName": "Accessoires/Composants",
                  "level": 4,
                  "children": {
                    "Support, pompe à carburant": {
                      "categoryId": 100718,
                      "categoryName": "Accessories/Parts",
                      "level": 3,
                      "children": [],
                      "productId": 1126
                    }
                  }
                }
              },
              "productId": 1126
            },
            "Tamis, pompe à carburant": {
              "categoryId": 100251,
              "categoryName": "Pump/Accessories",
              "level": 2,
              "children": {
                "Accessoires/Composants": {
                  "categoryId": null,
                  "categoryName": "Accessoires/Composants",
                  "level": 4,
                  "children": {
                    "Tamis, pompe à carburant": {
                      "categoryId": 100718,
                      "categoryName": "Accessories/Parts",
                      "level": 3,
                      "children": [],
                      "productId": 8310
                    }
                  }
                }
              },
              "productId": 8310
            },
            "Tige poussoir, pompe à essence": {
              "categoryId": 100251,
              "categoryName": "Pump/Accessories",
              "level": 2,
              "children": {
                "Accessoires/Composants": {
                  "categoryId": null,
                  "categoryName": "Accessoires/Composants",
                  "level": 4,
                  "children": {
                    "Tige poussoir, pompe à essence": {
                      "categoryId": 100718,
                      "categoryName": "Accessories/Parts",
                      "level": 3,
                      "children": [],
                      "productId": 5985
                    }
                  }
                }
              },
              "productId": 5985
            },
            "Voyant, pompe d'alimentation manuelle": {
              "categoryId": 100251,
              "categoryName": "Pump/Accessories",
              "level": 2,
              "children": {
                "Pompe à main / accessoires": {
                  "categoryId": null,
                  "categoryName": "Pompe à main / accessoires",
                  "level": 4,
                  "children": {
                    "Voyant, pompe d'alimentation manuelle": {
                      "categoryId": 706438,
                      "categoryName": "Hand Feed Pump/ Parts",
                      "level": 3,
                      "children": [],
                      "productId": 616
                    }
                  }
                }
              },
              "productId": 616
            }
          }
        },
        "Pressostat/manostat": {
          "categoryId": null,
          "categoryName": "Pressostat/manostat",
          "level": 2,
          "children": {
            "Régulateur de pression, pompe à carburant": {
              "categoryId": 100270,
              "categoryName": "Pressure Regulator/Switch",
              "level": 2,
              "children": [],
              "productId": 1125
            }
          }
        },
        "Réservoir de carburant / accessoires": {
          "categoryId": null,
          "categoryName": "Réservoir de carburant / accessoires",
          "level": 2,
          "children": {
            "Pot de stabilisation, pompe à carburant": {
              "categoryId": 100250,
              "categoryName": "Fuel Tank/Accessories",
              "level": 2,
              "children": [],
              "productId": 887
            }
          }
        },
        "Soupapes": {
          "categoryId": null,
          "categoryName": "Soupapes",
          "level": 2,
          "children": {
            "Soupape, pompe à carburant": {
              "categoryId": 100252,
              "categoryName": "Valves",
              "level": 2,
              "children": [],
              "productId": 862
            }
          }
        },
        "Unité d'alimentation complète": {
          "categoryId": null,
          "categoryName": "Unité d'alimentation complète",
          "level": 2,
          "children": {
            "Flasque, unité d'alimentation de carburant": {
              "categoryId": 100267,
              "categoryName": "Fuel Delivery Unit Complete",
              "level": 2,
              "children": [],
              "productId": 1309
            }
          }
        }
      }
    },
    "Carburation": {
      "categoryId": 100254,
      "categoryName": "Carburation",
      "level": 1,
      "children": {
        "Mélange air-carburant": {
          "categoryId": null,
          "categoryName": "Mélange air-carburant",
          "level": 2,
          "children": {
            "Câble adaptateur, pompe haute pression": {
              "categoryId": 102793,
              "categoryName": "Mixture Formation",
              "level": 2,
              "children": {
                "Pompe à injection/pompe à haute pression": {
                  "categoryId": null,
                  "categoryName": "Pompe à injection/pompe à haute pression",
                  "level": 4,
                  "children": {
                    "Câble adaptateur, pompe haute pression": {
                      "categoryId": 102803,
                      "categoryName": "Fuel Injection Pump/High Pressure Pump",
                      "level": 3,
                      "children": [],
                      "productId": 60481
                    }
                  }
                }
              },
              "productId": 60481
            },
            "Pilon, Pompe à haute pression": {
              "categoryId": 102793,
              "categoryName": "Mixture Formation",
              "level": 2,
              "children": {
                "Pompe à injection/pompe à haute pression": {
                  "categoryId": null,
                  "categoryName": "Pompe à injection/pompe à haute pression",
                  "level": 4,
                  "children": {
                    "Pilon, Pompe à haute pression": {
                      "categoryId": 102803,
                      "categoryName": "Fuel Injection Pump/High Pressure Pump",
                      "level": 3,
                      "children": [],
                      "productId": 4662
                    }
                  }
                }
              },
              "productId": 4662
            },
            "Pompe à haute pression": {
              "categoryId": 102793,
              "categoryName": "Mixture Formation",
              "level": 2,
              "children": {
                "Pompe à injection/pompe à haute pression": {
                  "categoryId": null,
                  "categoryName": "Pompe à injection/pompe à haute pression",
                  "level": 4,
                  "children": {
                    "Pompe à haute pression": {
                      "categoryId": 102803,
                      "categoryName": "Fuel Injection Pump/High Pressure Pump",
                      "level": 3,
                      "children": [],
                      "productId": 3918
                    }
                  }
                }
              },
              "productId": 3918
            },
            "Raccord, pompe à haute pressio": {
              "categoryId": 102793,
              "categoryName": "Mixture Formation",
              "level": 2,
              "children": {
                "Pompe à injection/pompe à haute pression": {
                  "categoryId": null,
                  "categoryName": "Pompe à injection/pompe à haute pression",
                  "level": 4,
                  "children": {
                    "Raccord, pompe à haute pressio": {
                      "categoryId": 102803,
                      "categoryName": "Fuel Injection Pump/High Pressure Pump",
                      "level": 3,
                      "children": [],
                      "productId": 4899
                    }
                  }
                }
              },
              "productId": 4899
            }
          }
        }
      }
    },
    "Moteur": {
      "categoryId": 100002,
      "categoryName": "Moteur",
      "level": 1,
      "children": {
        "Culasse / pieces de montage": {
          "categoryId": null,
          "categoryName": "Culasse / pieces de montage",
          "level": 2,
          "children": {
            "Pompe à carburant": {
              "categoryId": 100373,
              "categoryName": "Cylinder Head/Attachment Parts",
              "level": 2,
              "children": {
                "Pompe à vide": {
                  "categoryId": null,
                  "categoryName": "Pompe à vide",
                  "level": 4,
                  "children": {
                    "Pompe à carburant": {
                      "categoryId": 102450,
                      "categoryName": "Vacuum Pump",
                      "level": 3,
                      "children": [],
                      "productId": 458
                    }
                  }
                }
              },
              "productId": 458
            }
          }
        }
      }
    },
    "Système électrique": {
      "categoryId": 100010,
      "categoryName": "Système électrique",
      "level": 1,
      "children": {
        "Appareils de commande": {
          "categoryId": null,
          "categoryName": "Appareils de commande",
          "level": 2,
          "children": {
            "Dispositif de contrôle, pompe à carburant": {
              "categoryId": 100727,
              "categoryName": "Control Units",
              "level": 2,
              "children": [],
              "productId": 5763
            }
          }
        },
        "Relais": {
          "categoryId": null,
          "categoryName": "Relais",
          "level": 2,
          "children": {
            "Kit rép. de câble, relais de pompe à carburant": {
              "categoryId": 100785,
              "categoryName": "Relay",
              "level": 2,
              "children": [],
              "productId": 8963
            },
            "Relais, pompe à carburant": {
              "categoryId": 100785,
              "categoryName": "Relay",
              "level": 2,
              "children": [],
              "productId": 1111
            }
          }
        }
      }
    }
  },
  "arborescenceText": "├── Alimentation carburant [ID: 100214] (Niveau 1)\n│   ├── Pompe / accessoires (Niveau 2)\n│   │   ├── Pump/Accessories [ID: 100251] (Niveau 2) → ProductId: 1303\n│   │   │   └── Accessoires/Composants (Niveau 4)\n│   │   │       └── Accessories/Parts [ID: 100718] (Niveau 3) → ProductId: 1303\n│   │   ├── Pump/Accessories [ID: 100251] (Niveau 2) → ProductId: 1407\n│   │   │   └── Accessoires/Composants (Niveau 4)\n│   │   │       └── Accessories/Parts [ID: 100718] (Niveau 3) → ProductId: 1407\n│   │   ├── Pump/Accessories [ID: 100251] (Niveau 2) → ProductId: 60680\n│   │   │   └── Accessoires/Composants (Niveau 4)\n│   │   │       └── Accessories/Parts [ID: 100718] (Niveau 3) → ProductId: 60680\n│   │   ├── Pump/Accessories [ID: 100251] (Niveau 2) → ProductId: 8267\n│   │   │   └── Accessoires/Composants (Niveau 4)\n│   │   │       └── Accessories/Parts [ID: 100718] (Niveau 3) → ProductId: 8267\n│   │   ├── Pump/Accessories [ID: 100251] (Niveau 2) → ProductId: 60481\n│   │   │   └── Pompe d'alimentation (Niveau 4)\n│   │   │       └── Fuel Pump [ID: 100717] (Niveau 3) → ProductId: 60481\n│   │   ├── Pump/Accessories [ID: 100251] (Niveau 2) → ProductId: 8256\n│   │   │   └── Accessoires/Composants (Niveau 4)\n│   │   │       └── Accessories/Parts [ID: 100718] (Niveau 3) → ProductId: 8256\n│   │   ├── Pump/Accessories [ID: 100251] (Niveau 2) → ProductId: 3928\n│   │   │   └── Accessoires/Composants (Niveau 4)\n│   │   │       └── Accessories/Parts [ID: 100718] (Niveau 3) → ProductId: 3928\n│   │   ├── Pump/Accessories [ID: 100251] (Niveau 2) → ProductId: 5763\n│   │   │   └── Accessoires/Composants (Niveau 4)\n│   │   │       └── Accessories/Parts [ID: 100718] (Niveau 3) → ProductId: 5763\n│   │   ├── Pump/Accessories [ID: 100251] (Niveau 2) → ProductId: 1410\n│   │   │   ├── Accessoires/Composants (Niveau 4)\n│   │   │   │   └── Accessories/Parts [ID: 100718] (Niveau 3) → ProductId: 1410\n│   │   │   └── Pompe d'alimentation (Niveau 4)\n│   │   │       └── Fuel Pump [ID: 100717] (Niveau 3) → ProductId: 1410\n│   │   ├── Pump/Accessories [ID: 100251] (Niveau 2) → ProductId: 1309\n│   │   │   └── Accessoires/Composants (Niveau 4)\n│   │   │       └── Accessories/Parts [ID: 100718] (Niveau 3) → ProductId: 1309\n│   │   ├── Pump/Accessories [ID: 100251] (Niveau 2) → ProductId: 143\n│   │   │   └── Accessoires/Composants (Niveau 4)\n│   │   │       └── Accessories/Parts [ID: 100718] (Niveau 3) → ProductId: 143\n│   │   ├── Pump/Accessories [ID: 100251] (Niveau 2) → ProductId: 613\n│   │   │   └── Réparation (Niveau 4)\n│   │   │       └── Repair Kit [ID: 100719] (Niveau 3) → ProductId: 613\n│   │   ├── Pump/Accessories [ID: 100251] (Niveau 2) → ProductId: 615\n│   │   │   ├── Pompe à main / accessoires (Niveau 4)\n│   │   │   │   └── Hand Feed Pump/ Parts [ID: 706438] (Niveau 3) → ProductId: 615\n│   │   │   └── Réparation (Niveau 4)\n│   │   │       └── Repair Kit [ID: 100719] (Niveau 3) → ProductId: 615\n│   │   ├── Pump/Accessories [ID: 100251] (Niveau 2) → ProductId: 8263\n│   │   │   └── Pompe d'alimentation (Niveau 4)\n│   │   │       └── Fuel Pump [ID: 100717] (Niveau 3) → ProductId: 8263\n│   │   ├── Pump/Accessories [ID: 100251] (Niveau 2) → ProductId: 8963\n│   │   │   └── Accessoires/Composants (Niveau 4)\n│   │   │       └── Accessories/Parts [ID: 100718] (Niveau 3) → ProductId: 8963\n│   │   ├── Pump/Accessories [ID: 100251] (Niveau 2) → ProductId: 9600\n│   │   │   └── Accessoires/Composants (Niveau 4)\n│   │   │       └── Accessories/Parts [ID: 100718] (Niveau 3) → ProductId: 9600\n│   │   ├── Pump/Accessories [ID: 100251] (Niveau 2) → ProductId: 7314\n│   │   │   └── Réparation (Niveau 4)\n│   │   │       └── Repair Kit [ID: 100719] (Niveau 3) → ProductId: 7314\n│   │   ├── Pump/Accessories [ID: 100251] (Niveau 2) → ProductId: 454\n│   │   │   └── Pompe d'alimentation (Niveau 4)\n│   │   │       └── Fuel Pump [ID: 100717] (Niveau 3) → ProductId: 454\n│   │   ├── Pump/Accessories [ID: 100251] (Niveau 2) → ProductId: 4662\n│   │   │   └── Accessoires/Composants (Niveau 4)\n│   │   │       └── Accessories/Parts [ID: 100718] (Niveau 3) → ProductId: 4662\n│   │   ├── Pump/Accessories [ID: 100251] (Niveau 2) → ProductId: 458\n│   │   │   └── Pompe d'alimentation (Niveau 4)\n│   │   │       └── Fuel Pump [ID: 100717] (Niveau 3) → ProductId: 458\n│   │   ├── Pump/Accessories [ID: 100251] (Niveau 2) → ProductId: 3918\n│   │   │   └── Pompe d'alimentation (Niveau 4)\n│   │   │       └── Fuel Pump [ID: 100717] (Niveau 3) → ProductId: 3918\n│   │   ├── Pump/Accessories [ID: 100251] (Niveau 2) → ProductId: 4228\n│   │   │   └── Pompe à main / accessoires (Niveau 4)\n│   │   │       └── Hand Feed Pump/ Parts [ID: 706438] (Niveau 3) → ProductId: 4228\n│   │   ├── Pump/Accessories [ID: 100251] (Niveau 2) → ProductId: 460\n│   │   │   └── Pompe d'alimentation (Niveau 4)\n│   │   │       └── Fuel Pump [ID: 100717] (Niveau 3) → ProductId: 460\n│   │   ├── Pump/Accessories [ID: 100251] (Niveau 2) → ProductId: 887\n│   │   │   └── Pompe d'alimentation (Niveau 4)\n│   │   │       └── Fuel Pump [ID: 100717] (Niveau 3) → ProductId: 887\n│   │   ├── Pump/Accessories [ID: 100251] (Niveau 2) → ProductId: 4899\n│   │   │   └── Accessoires/Composants (Niveau 4)\n│   │   │       └── Accessories/Parts [ID: 100718] (Niveau 3) → ProductId: 4899\n│   │   ├── Pump/Accessories [ID: 100251] (Niveau 2) → ProductId: 1111\n│   │   │   └── Accessoires/Composants (Niveau 4)\n│   │   │       └── Accessories/Parts [ID: 100718] (Niveau 3) → ProductId: 1111\n│   │   ├── Pump/Accessories [ID: 100251] (Niveau 2) → ProductId: 2151\n│   │   │   └── Accessoires/Composants (Niveau 4)\n│   │   │       └── Accessories/Parts [ID: 100718] (Niveau 3) → ProductId: 2151\n│   │   ├── Pump/Accessories [ID: 100251] (Niveau 2) → ProductId: 1408\n│   │   │   └── Accessoires/Composants (Niveau 4)\n│   │   │       └── Accessories/Parts [ID: 100718] (Niveau 3) → ProductId: 1408\n│   │   ├── Pump/Accessories [ID: 100251] (Niveau 2) → ProductId: 1126\n│   │   │   └── Accessoires/Composants (Niveau 4)\n│   │   │       └── Accessories/Parts [ID: 100718] (Niveau 3) → ProductId: 1126\n│   │   ├── Pump/Accessories [ID: 100251] (Niveau 2) → ProductId: 8310\n│   │   │   └── Accessoires/Composants (Niveau 4)\n│   │   │       └── Accessories/Parts [ID: 100718] (Niveau 3) → ProductId: 8310\n│   │   ├── Pump/Accessories [ID: 100251] (Niveau 2) → ProductId: 5985\n│   │   │   └── Accessoires/Composants (Niveau 4)\n│   │   │       └── Accessories/Parts [ID: 100718] (Niveau 3) → ProductId: 5985\n│   │   └── Pump/Accessories [ID: 100251] (Niveau 2) → ProductId: 616\n│   │       └── Pompe à main / accessoires (Niveau 4)\n│   │           └── Hand Feed Pump/ Parts [ID: 706438] (Niveau 3) → ProductId: 616\n│   ├── Pressostat/manostat (Niveau 2)\n│   │   └── Pressure Regulator/Switch [ID: 100270] (Niveau 2) → ProductId: 1125\n│   ├── Réservoir de carburant / accessoires (Niveau 2)\n│   │   └── Fuel Tank/Accessories [ID: 100250] (Niveau 2) → ProductId: 887\n│   ├── Soupapes (Niveau 2)\n│   │   └── Valves [ID: 100252] (Niveau 2) → ProductId: 862\n│   └── Unité d'alimentation complète (Niveau 2)\n│       └── Fuel Delivery Unit Complete [ID: 100267] (Niveau 2) → ProductId: 1309\n\n├── Carburation [ID: 100254] (Niveau 1)\n│   └── Mélange air-carburant (Niveau 2)\n│       ├── Mixture Formation [ID: 102793] (Niveau 2) → ProductId: 60481\n│       │   └── Pompe à injection/pompe à haute pression (Niveau 4)\n│       │       └── Fuel Injection Pump/High Pressure Pump [ID: 102803] (Niveau 3) → ProductId: 60481\n│       ├── Mixture Formation [ID: 102793] (Niveau 2) → ProductId: 4662\n│       │   └── Pompe à injection/pompe à haute pression (Niveau 4)\n│       │       └── Fuel Injection Pump/High Pressure Pump [ID: 102803] (Niveau 3) → ProductId: 4662\n│       ├── Mixture Formation [ID: 102793] (Niveau 2) → ProductId: 3918\n│       │   └── Pompe à injection/pompe à haute pression (Niveau 4)\n│       │       └── Fuel Injection Pump/High Pressure Pump [ID: 102803] (Niveau 3) → ProductId: 3918\n│       └── Mixture Formation [ID: 102793] (Niveau 2) → ProductId: 4899\n│           └── Pompe à injection/pompe à haute pression (Niveau 4)\n│               └── Fuel Injection Pump/High Pressure Pump [ID: 102803] (Niveau 3) → ProductId: 4899\n\n├── Moteur [ID: 100002] (Niveau 1)\n│   └── Culasse / pieces de montage (Niveau 2)\n│       └── Cylinder Head/Attachment Parts [ID: 100373] (Niveau 2) → ProductId: 458\n│           └── Pompe à vide (Niveau 4)\n│               └── Vacuum Pump [ID: 102450] (Niveau 3) → ProductId: 458\n\n└── Système électrique [ID: 100010] (Niveau 1)\n    ├── Appareils de commande (Niveau 2)\n    │   └── Control Units [ID: 100727] (Niveau 2) → ProductId: 5763\n    └── Relais (Niveau 2)\n        ├── Relay [ID: 100785] (Niveau 2) → ProductId: 8963\n        └── Relay [ID: 100785] (Niveau 2) → ProductId: 1111",
  "arborescencePaths": [
    {
      "path": [
        "Alimentation carburant",
        "Pompe / accessoires",
        "Pump/Accessories"
      ],
      "categoryIds": [
        100214,
        null,
        100251
      ],
      "finalCategoryId": 100251,
      "productId": 1303
    },
    {
      "path": [
        "Alimentation carburant",
        "Pompe / accessoires",
        "Pump/Accessories"
      ],
      "categoryIds": [
        100214,
        null,
        100251
      ],
      "finalCategoryId": 100251,
      "productId": 1407
    },
    {
      "path": [
        "Alimentation carburant",
        "Pompe / accessoires",
        "Pump/Accessories"
      ],
      "categoryIds": [
        100214,
        null,
        100251
      ],
      "finalCategoryId": 100251,
      "productId": 60680
    },
    {
      "path": [
        "Alimentation carburant",
        "Pompe / accessoires",
        "Pump/Accessories"
      ],
      "categoryIds": [
        100214,
        null,
        100251
      ],
      "finalCategoryId": 100251,
      "productId": 8267
    },
    {
      "path": [
        "Alimentation carburant",
        "Pompe / accessoires",
        "Pump/Accessories"
      ],
      "categoryIds": [
        100214,
        null,
        100251
      ],
      "finalCategoryId": 100251,
      "productId": 60481
    },
    {
      "path": [
        "Alimentation carburant",
        "Pompe / accessoires",
        "Pump/Accessories"
      ],
      "categoryIds": [
        100214,
        null,
        100251
      ],
      "finalCategoryId": 100251,
      "productId": 8256
    },
    {
      "path": [
        "Alimentation carburant",
        "Pompe / accessoires",
        "Pump/Accessories"
      ],
      "categoryIds": [
        100214,
        null,
        100251
      ],
      "finalCategoryId": 100251,
      "productId": 3928
    },
    {
      "path": [
        "Alimentation carburant",
        "Pompe / accessoires",
        "Pump/Accessories"
      ],
      "categoryIds": [
        100214,
        null,
        100251
      ],
      "finalCategoryId": 100251,
      "productId": 5763
    },
    {
      "path": [
        "Alimentation carburant",
        "Pompe / accessoires",
        "Pump/Accessories"
      ],
      "categoryIds": [
        100214,
        null,
        100251
      ],
      "finalCategoryId": 100251,
      "productId": 1410
    },
    {
      "path": [
        "Alimentation carburant",
        "Pompe / accessoires",
        "Pump/Accessories"
      ],
      "categoryIds": [
        100214,
        null,
        100251
      ],
      "finalCategoryId": 100251,
      "productId": 1309
    },
    {
      "path": [
        "Alimentation carburant",
        "Pompe / accessoires",
        "Pump/Accessories"
      ],
      "categoryIds": [
        100214,
        null,
        100251
      ],
      "finalCategoryId": 100251,
      "productId": 143
    },
    {
      "path": [
        "Alimentation carburant",
        "Pompe / accessoires",
        "Pump/Accessories"
      ],
      "categoryIds": [
        100214,
        null,
        100251
      ],
      "finalCategoryId": 100251,
      "productId": 613
    },
    {
      "path": [
        "Alimentation carburant",
        "Pompe / accessoires",
        "Pump/Accessories"
      ],
      "categoryIds": [
        100214,
        null,
        100251
      ],
      "finalCategoryId": 100251,
      "productId": 615
    },
    {
      "path": [
        "Alimentation carburant",
        "Pompe / accessoires",
        "Pump/Accessories"
      ],
      "categoryIds": [
        100214,
        null,
        100251
      ],
      "finalCategoryId": 100251,
      "productId": 8263
    },
    {
      "path": [
        "Alimentation carburant",
        "Pompe / accessoires",
        "Pump/Accessories"
      ],
      "categoryIds": [
        100214,
        null,
        100251
      ],
      "finalCategoryId": 100251,
      "productId": 8963
    },
    {
      "path": [
        "Alimentation carburant",
        "Pompe / accessoires",
        "Pump/Accessories"
      ],
      "categoryIds": [
        100214,
        null,
        100251
      ],
      "finalCategoryId": 100251,
      "productId": 9600
    },
    {
      "path": [
        "Alimentation carburant",
        "Pompe / accessoires",
        "Pump/Accessories"
      ],
      "categoryIds": [
        100214,
        null,
        100251
      ],
      "finalCategoryId": 100251,
      "productId": 7314
    },
    {
      "path": [
        "Alimentation carburant",
        "Pompe / accessoires",
        "Pump/Accessories"
      ],
      "categoryIds": [
        100214,
        null,
        100251
      ],
      "finalCategoryId": 100251,
      "productId": 454
    },
    {
      "path": [
        "Alimentation carburant",
        "Pompe / accessoires",
        "Pump/Accessories"
      ],
      "categoryIds": [
        100214,
        null,
        100251
      ],
      "finalCategoryId": 100251,
      "productId": 4662
    },
    {
      "path": [
        "Alimentation carburant",
        "Pompe / accessoires",
        "Pump/Accessories"
      ],
      "categoryIds": [
        100214,
        null,
        100251
      ],
      "finalCategoryId": 100251,
      "productId": 458
    },
    {
      "path": [
        "Alimentation carburant",
        "Pompe / accessoires",
        "Pump/Accessories"
      ],
      "categoryIds": [
        100214,
        null,
        100251
      ],
      "finalCategoryId": 100251,
      "productId": 3918
    },
    {
      "path": [
        "Alimentation carburant",
        "Pompe / accessoires",
        "Pump/Accessories"
      ],
      "categoryIds": [
        100214,
        null,
        100251
      ],
      "finalCategoryId": 100251,
      "productId": 4228
    },
    {
      "path": [
        "Alimentation carburant",
        "Pompe / accessoires",
        "Pump/Accessories"
      ],
      "categoryIds": [
        100214,
        null,
        100251
      ],
      "finalCategoryId": 100251,
      "productId": 460
    },
    {
      "path": [
        "Alimentation carburant",
        "Pompe / accessoires",
        "Pump/Accessories"
      ],
      "categoryIds": [
        100214,
        null,
        100251
      ],
      "finalCategoryId": 100251,
      "productId": 887
    },
    {
      "path": [
        "Alimentation carburant",
        "Pompe / accessoires",
        "Pump/Accessories"
      ],
      "categoryIds": [
        100214,
        null,
        100251
      ],
      "finalCategoryId": 100251,
      "productId": 4899
    },
    {
      "path": [
        "Alimentation carburant",
        "Pompe / accessoires",
        "Pump/Accessories"
      ],
      "categoryIds": [
        100214,
        null,
        100251
      ],
      "finalCategoryId": 100251,
      "productId": 1111
    },
    {
      "path": [
        "Alimentation carburant",
        "Pompe / accessoires",
        "Pump/Accessories"
      ],
      "categoryIds": [
        100214,
        null,
        100251
      ],
      "finalCategoryId": 100251,
      "productId": 2151
    },
    {
      "path": [
        "Alimentation carburant",
        "Pompe / accessoires",
        "Pump/Accessories"
      ],
      "categoryIds": [
        100214,
        null,
        100251
      ],
      "finalCategoryId": 100251,
      "productId": 1408
    },
    {
      "path": [
        "Alimentation carburant",
        "Pompe / accessoires",
        "Pump/Accessories"
      ],
      "categoryIds": [
        100214,
        null,
        100251
      ],
      "finalCategoryId": 100251,
      "productId": 1126
    },
    {
      "path": [
        "Alimentation carburant",
        "Pompe / accessoires",
        "Pump/Accessories"
      ],
      "categoryIds": [
        100214,
        null,
        100251
      ],
      "finalCategoryId": 100251,
      "productId": 8310
    },
    {
      "path": [
        "Alimentation carburant",
        "Pompe / accessoires",
        "Pump/Accessories"
      ],
      "categoryIds": [
        100214,
        null,
        100251
      ],
      "finalCategoryId": 100251,
      "productId": 5985
    },
    {
      "path": [
        "Alimentation carburant",
        "Pompe / accessoires",
        "Pump/Accessories"
      ],
      "categoryIds": [
        100214,
        null,
        100251
      ],
      "finalCategoryId": 100251,
      "productId": 616
    },
    {
      "path": [
        "Alimentation carburant",
        "Pressostat/manostat",
        "Pressure Regulator/Switch"
      ],
      "categoryIds": [
        100214,
        null,
        100270
      ],
      "finalCategoryId": 100270,
      "productId": 1125
    },
    {
      "path": [
        "Alimentation carburant",
        "Réservoir de carburant / accessoires",
        "Fuel Tank/Accessories"
      ],
      "categoryIds": [
        100214,
        null,
        100250
      ],
      "finalCategoryId": 100250,
      "productId": 887
    },
    {
      "path": [
        "Alimentation carburant",
        "Soupapes",
        "Valves"
      ],
      "categoryIds": [
        100214,
        null,
        100252
      ],
      "finalCategoryId": 100252,
      "productId": 862
    },
    {
      "path": [
        "Alimentation carburant",
        "Unité d'alimentation complète",
        "Fuel Delivery Unit Complete"
      ],
      "categoryIds": [
        100214,
        null,
        100267
      ],
      "finalCategoryId": 100267,
      "productId": 1309
    },
    {
      "path": [
        "Carburation",
        "Mélange air-carburant",
        "Mixture Formation"
      ],
      "categoryIds": [
        100254,
        null,
        102793
      ],
      "finalCategoryId": 102793,
      "productId": 60481
    },
    {
      "path": [
        "Carburation",
        "Mélange air-carburant",
        "Mixture Formation"
      ],
      "categoryIds": [
        100254,
        null,
        102793
      ],
      "finalCategoryId": 102793,
      "productId": 4662
    },
    {
      "path": [
        "Carburation",
        "Mélange air-carburant",
        "Mixture Formation"
      ],
      "categoryIds": [
        100254,
        null,
        102793
      ],
      "finalCategoryId": 102793,
      "productId": 3918
    },
    {
      "path": [
        "Carburation",
        "Mélange air-carburant",
        "Mixture Formation"
      ],
      "categoryIds": [
        100254,
        null,
        102793
      ],
      "finalCategoryId": 102793,
      "productId": 4899
    },
    {
      "path": [
        "Moteur",
        "Culasse / pieces de montage",
        "Cylinder Head/Attachment Parts"
      ],
      "categoryIds": [
        100002,
        null,
        100373
      ],
      "finalCategoryId": 100373,
      "productId": 458
    },
    {
      "path": [
        "Système électrique",
        "Appareils de commande",
        "Control Units"
      ],
      "categoryIds": [
        100010,
        null,
        100727
      ],
      "finalCategoryId": 100727,
      "productId": 5763
    },
    {
      "path": [
        "Système électrique",
        "Relais",
        "Relay"
      ],
      "categoryIds": [
        100010,
        null,
        100785
      ],
      "finalCategoryId": 100785,
      "productId": 8963
    },
    {
      "path": [
        "Système électrique",
        "Relais",
        "Relay"
      ],
      "categoryIds": [
        100010,
        null,
        100785
      ],
      "finalCategoryId": 100785,
      "productId": 1111
    }
  ],
  "productIdsInArbo": [
    143,
    454,
    458,
    460,
    613,
    615,
    616,
    862,
    887,
    1111,
    1125,
    1126,
    1303,
    1309,
    1407,
    1408,
    1410,
    2151,
    3918,
    3928,
    4228,
    4662,
    4899,
    5763,
    5985,
    7314,
    8256,
    8263,
    8267,
    8310,
    8963,
    9600,
    60481,
    60680
  ],
  "matchedProductIds": [
    458
  ]
}