{
  "productName": "Porte-injecteur",
  "searchText": "Porte-injecteur",
  "found": true,
  "hasMatch": false,
  "timestamp": "2025-12-03T07:03:08.899Z",
  "productId": 3898,
  "arborescence": {
    "Carburation": {
      "categoryId": 100254,
      "categoryName": "Carburation",
      "level": 1,
      "children": {
        "Mélange air-carburant": {
          "categoryId": null,
          "categoryName": "Mélange air-carburant",
          "level": 2,
          "children": {
            "Aiguille d'injecteur": {
              "categoryId": 102793,
              "categoryName": "Mixture Formation",
              "level": 2,
              "children": {
                "Composants de porte-injecteur / Injecteur": {
                  "categoryId": null,
                  "categoryName": "Composants de porte-injecteur / Injecteur",
                  "level": 4,
                  "children": {
                    "Aiguille d'injecteur": {
                      "categoryId": 102800,
                      "categoryName": "Nozzle and Holder Assembly/Nozzle Parts",
                      "level": 3,
                      "children": [],
                      "productId": 3900
                    }
                  }
                }
              },
              "productId": 3900
            },
            "Bague d'étanchéité, porte-injecteur": {
              "categoryId": 102793,
              "categoryName": "Mixture Formation",
              "level": 2,
              "children": {
                "Composants de porte-injecteur / Injecteur": {
                  "categoryId": null,
                  "categoryName": "Composants de porte-injecteur / Injecteur",
                  "level": 4,
                  "children": {
                    "Bague d'étanchéité, porte-injecteur": {
                      "categoryId": 102800,
                      "categoryName": "Nozzle and Holder Assembly/Nozzle Parts",
                      "level": 3,
                      "children": [],
                      "productId": 4051
                    }
                  }
                },
                "Joint": {
                  "categoryId": null,
                  "categoryName": "Joint",
                  "level": 4,
                  "children": {
                    "Bague d'étanchéité, porte-injecteur": {
                      "categoryId": 102795,
                      "categoryName": "Seal",
                      "level": 3,
                      "children": [],
                      "productId": 4051
                    }
                  }
                }
              },
              "productId": 4051
            },
            "Bouchon, carburant de fuite": {
              "categoryId": 102793,
              "categoryName": "Mixture Formation",
              "level": 2,
              "children": {
                "Composants de porte-injecteur / Injecteur": {
                  "categoryId": null,
                  "categoryName": "Composants de porte-injecteur / Injecteur",
                  "level": 4,
                  "children": {
                    "Bouchon, carburant de fuite": {
                      "categoryId": 102800,
                      "categoryName": "Nozzle and Holder Assembly/Nozzle Parts",
                      "level": 3,
                      "children": [],
                      "productId": 3963
                    }
                  }
                },
                "Conduite de carburant / répartition du carburant": {
                  "categoryId": null,
                  "categoryName": "Conduite de carburant / répartition du carburant",
                  "level": 4,
                  "children": {
                    "Bouchon, carburant de fuite": {
                      "categoryId": 102804,
                      "categoryName": "Fuel Line/Distribution/Allocation",
                      "level": 3,
                      "children": [],
                      "productId": 3963
                    }
                  }
                }
              },
              "productId": 3963
            },
            "Cache, injecteur": {
              "categoryId": 102793,
              "categoryName": "Mixture Formation",
              "level": 2,
              "children": {
                "Composants de porte-injecteur / Injecteur": {
                  "categoryId": null,
                  "categoryName": "Composants de porte-injecteur / Injecteur",
                  "level": 4,
                  "children": {
                    "Cache, injecteur": {
                      "categoryId": 102800,
                      "categoryName": "Nozzle and Holder Assembly/Nozzle Parts",
                      "level": 3,
                      "children": [],
                      "productId": 3889
                    }
                  }
                }
              },
              "productId": 3889
            },
            "Corps d'injecteur": {
              "categoryId": 102793,
              "categoryName": "Mixture Formation",
              "level": 2,
              "children": {
                "Composants de porte-injecteur / Injecteur": {
                  "categoryId": null,
                  "categoryName": "Composants de porte-injecteur / Injecteur",
                  "level": 4,
                  "children": {
                    "Corps d'injecteur": {
                      "categoryId": 102800,
                      "categoryName": "Nozzle and Holder Assembly/Nozzle Parts",
                      "level": 3,
                      "children": [],
                      "productId": 3899
                    }
                  }
                }
              },
              "productId": 3899
            },
            "Écran absorbant la chaleur, injection": {
              "categoryId": 102793,
              "categoryName": "Mixture Formation",
              "level": 2,
              "children": {
                "Composants de porte-injecteur / Injecteur": {
                  "categoryId": null,
                  "categoryName": "Composants de porte-injecteur / Injecteur",
                  "level": 4,
                  "children": {
                    "Écran absorbant la chaleur, injection": {
                      "categoryId": 102800,
                      "categoryName": "Nozzle and Holder Assembly/Nozzle Parts",
                      "level": 3,
                      "children": [],
                      "productId": 3966
                    }
                  }
                }
              },
              "productId": 3966
            },
            "Écrou tendeur, porte-injecteur": {
              "categoryId": 102793,
              "categoryName": "Mixture Formation",
              "level": 2,
              "children": {
                "Composants de porte-injecteur / Injecteur": {
                  "categoryId": null,
                  "categoryName": "Composants de porte-injecteur / Injecteur",
                  "level": 4,
                  "children": {
                    "Écrou tendeur, porte-injecteur": {
                      "categoryId": 102800,
                      "categoryName": "Nozzle and Holder Assembly/Nozzle Parts",
                      "level": 3,
                      "children": [],
                      "productId": 3948
                    }
                  }
                }
              },
              "productId": 3948
            },
            "Fiche, injecteur": {
              "categoryId": 102793,
              "categoryName": "Mixture Formation",
              "level": 2,
              "children": {
                "Injecteur/porte-injecteur/UPI": {
                  "categoryId": null,
                  "categoryName": "Injecteur/porte-injecteur/UPI",
                  "level": 4,
                  "children": {
                    "Fiche, injecteur": {
                      "categoryId": 102799,
                      "categoryName": "Injector/Nozzle/Nozzle and Holder Assembly/UI",
                      "level": 3,
                      "children": [],
                      "productId": 3949
                    }
                  }
                }
              },
              "productId": 3949
            },
            "Flasque chauffante, préchauffement d'air d'admission": {
              "categoryId": 102793,
              "categoryName": "Mixture Formation",
              "level": 2,
              "children": {
                "Composants de porte-injecteur / Injecteur": {
                  "categoryId": null,
                  "categoryName": "Composants de porte-injecteur / Injecteur",
                  "level": 4,
                  "children": {
                    "Flasque chauffante, préchauffement d'air d'admission": {
                      "categoryId": 102800,
                      "categoryName": "Nozzle and Holder Assembly/Nozzle Parts",
                      "level": 3,
                      "children": [],
                      "productId": 3915
                    }
                  }
                }
              },
              "productId": 3915
            },
            "Injecteur": {
              "categoryId": 102793,
              "categoryName": "Mixture Formation",
              "level": 2,
              "children": {
                "Injecteur/porte-injecteur/UPI": {
                  "categoryId": null,
                  "categoryName": "Injecteur/porte-injecteur/UPI",
                  "level": 4,
                  "children": {
                    "Injecteur": {
                      "categoryId": 102799,
                      "categoryName": "Injector/Nozzle/Nozzle and Holder Assembly/UI",
                      "level": 3,
                      "children": [],
                      "productId": 3905
                    }
                  }
                }
              },
              "productId": 3905
            },
            "Injecteur Common Rail": {
              "categoryId": 102793,
              "categoryName": "Mixture Formation",
              "level": 2,
              "children": {
                "Injecteur/porte-injecteur/UPI": {
                  "categoryId": null,
                  "categoryName": "Injecteur/porte-injecteur/UPI",
                  "level": 4,
                  "children": {
                    "Injecteur Common Rail": {
                      "categoryId": 102799,
                      "categoryName": "Injector/Nozzle/Nozzle and Holder Assembly/UI",
                      "level": 3,
                      "children": [],
                      "productId": 61353
                    }
                  }
                }
              },
              "productId": 61353
            },
            "Joint d'étanchéité, porte-injecteur": {
              "categoryId": 102793,
              "categoryName": "Mixture Formation",
              "level": 2,
              "children": {
                "Composants de porte-injecteur / Injecteur": {
                  "categoryId": null,
                  "categoryName": "Composants de porte-injecteur / Injecteur",
                  "level": 4,
                  "children": {
                    "Joint d'étanchéité, porte-injecteur": {
                      "categoryId": 102800,
                      "categoryName": "Nozzle and Holder Assembly/Nozzle Parts",
                      "level": 3,
                      "children": [],
                      "productId": 3892
                    }
                  }
                },
                "Joint": {
                  "categoryId": null,
                  "categoryName": "Joint",
                  "level": 4,
                  "children": {
                    "Joint d'étanchéité, porte-injecteur": {
                      "categoryId": 102795,
                      "categoryName": "Seal",
                      "level": 3,
                      "children": [],
                      "productId": 3892
                    }
                  }
                }
              },
              "productId": 3892
            },
            "Joint, flasque chauffante-préchauffage de l'air d'admission": {
              "categoryId": 102793,
              "categoryName": "Mixture Formation",
              "level": 2,
              "children": {
                "Composants de porte-injecteur / Injecteur": {
                  "categoryId": null,
                  "categoryName": "Composants de porte-injecteur / Injecteur",
                  "level": 4,
                  "children": {
                    "Joint, flasque chauffante-préchauffage de l'air d'admission": {
                      "categoryId": 102800,
                      "categoryName": "Nozzle and Holder Assembly/Nozzle Parts",
                      "level": 3,
                      "children": [],
                      "productId": 4105
                    }
                  }
                }
              },
              "productId": 4105
            },
            "Kit de douilles, écrou tendeur de porte-injecteur": {
              "categoryId": 102793,
              "categoryName": "Mixture Formation",
              "level": 2,
              "children": {
                "Outils": {
                  "categoryId": null,
                  "categoryName": "Outils",
                  "level": 4,
                  "children": {
                    "Kit de douilles, écrou tendeur de porte-injecteur": {
                      "categoryId": 103150,
                      "categoryName": "Tools",
                      "level": 3,
                      "children": [],
                      "productId": 9645
                    }
                  }
                }
              },
              "productId": 9645
            },
            "Kit de joints, injecteur": {
              "categoryId": 102793,
              "categoryName": "Mixture Formation",
              "level": 2,
              "children": {
                "Injecteur/porte-injecteur/UPI": {
                  "categoryId": null,
                  "categoryName": "Injecteur/porte-injecteur/UPI",
                  "level": 4,
                  "children": {
                    "Kit de joints, injecteur": {
                      "categoryId": 102799,
                      "categoryName": "Injector/Nozzle/Nozzle and Holder Assembly/UI",
                      "level": 3,
                      "children": [],
                      "productId": 3894
                    }
                  }
                }
              },
              "productId": 3894
            },
            "Kit de ligne flexible, fuite de carburant": {
              "categoryId": 102793,
              "categoryName": "Mixture Formation",
              "level": 2,
              "children": {
                "Composants de porte-injecteur / Injecteur": {
                  "categoryId": null,
                  "categoryName": "Composants de porte-injecteur / Injecteur",
                  "level": 4,
                  "children": {
                    "Kit de ligne flexible, fuite de carburant": {
                      "categoryId": 102800,
                      "categoryName": "Nozzle and Holder Assembly/Nozzle Parts",
                      "level": 3,
                      "children": [],
                      "productId": 8090
                    }
                  }
                },
                "Conduite de carburant / répartition du carburant": {
                  "categoryId": null,
                  "categoryName": "Conduite de carburant / répartition du carburant",
                  "level": 4,
                  "children": {
                    "Kit de ligne flexible, fuite de carburant": {
                      "categoryId": 102804,
                      "categoryName": "Fuel Line/Distribution/Allocation",
                      "level": 3,
                      "children": [],
                      "productId": 8090
                    }
                  }
                }
              },
              "productId": 8090
            },
            "Kit de montage, soupape d’admission": {
              "categoryId": 102793,
              "categoryName": "Mixture Formation",
              "level": 2,
              "children": {
                "Injecteur/porte-injecteur/UPI": {
                  "categoryId": null,
                  "categoryName": "Injecteur/porte-injecteur/UPI",
                  "level": 4,
                  "children": {
                    "Kit de montage, soupape d’admission": {
                      "categoryId": 102799,
                      "categoryName": "Injector/Nozzle/Nozzle and Holder Assembly/UI",
                      "level": 3,
                      "children": [],
                      "productId": 60201
                    }
                  }
                }
              },
              "productId": 60201
            },
            "Kit de réparation, porte-injecteur": {
              "categoryId": 102793,
              "categoryName": "Mixture Formation",
              "level": 2,
              "children": {
                "Composants de porte-injecteur / Injecteur": {
                  "categoryId": null,
                  "categoryName": "Composants de porte-injecteur / Injecteur",
                  "level": 4,
                  "children": {
                    "Kit de réparation, porte-injecteur": {
                      "categoryId": 102800,
                      "categoryName": "Nozzle and Holder Assembly/Nozzle Parts",
                      "level": 3,
                      "children": [],
                      "productId": 4049
                    }
                  }
                }
              },
              "productId": 4049
            },
            "Kit réparation de câble, injecteur": {
              "categoryId": 102793,
              "categoryName": "Mixture Formation",
              "level": 2,
              "children": {
                "Injecteur/porte-injecteur/UPI": {
                  "categoryId": null,
                  "categoryName": "Injecteur/porte-injecteur/UPI",
                  "level": 4,
                  "children": {
                    "Kit réparation de câble, injecteur": {
                      "categoryId": 102799,
                      "categoryName": "Injector/Nozzle/Nozzle and Holder Assembly/UI",
                      "level": 3,
                      "children": [],
                      "productId": 6350
                    }
                  }
                }
              },
              "productId": 6350
            },
            "Manchon, porte-injecteur": {
              "categoryId": 102793,
              "categoryName": "Mixture Formation",
              "level": 2,
              "children": {
                "Composants de porte-injecteur / Injecteur": {
                  "categoryId": null,
                  "categoryName": "Composants de porte-injecteur / Injecteur",
                  "level": 4,
                  "children": {
                    "Manchon, porte-injecteur": {
                      "categoryId": 102800,
                      "categoryName": "Nozzle and Holder Assembly/Nozzle Parts",
                      "level": 3,
                      "children": [],
                      "productId": 4050
                    }
                  }
                }
              },
              "productId": 4050
            },
            "Pâte de montage, injecteur diesel/bougie de préchauffage": {
              "categoryId": 102793,
              "categoryName": "Mixture Formation",
              "level": 2,
              "children": {
                "Injecteur/porte-injecteur/UPI": {
                  "categoryId": null,
                  "categoryName": "Injecteur/porte-injecteur/UPI",
                  "level": 4,
                  "children": {
                    "Pâte de montage, injecteur diesel/bougie de préchauffage": {
                      "categoryId": 102799,
                      "categoryName": "Injector/Nozzle/Nozzle and Holder Assembly/UI",
                      "level": 3,
                      "children": [],
                      "productId": 60094
                    }
                  }
                }
              },
              "productId": 60094
            },
            "Porte-injecteur": {
              "categoryId": 102793,
              "categoryName": "Mixture Formation",
              "level": 2,
              "children": {
                "Injecteur/porte-injecteur/UPI": {
                  "categoryId": null,
                  "categoryName": "Injecteur/porte-injecteur/UPI",
                  "level": 4,
                  "children": {
                    "Porte-injecteur": {
                      "categoryId": 102799,
                      "categoryName": "Injector/Nozzle/Nozzle and Holder Assembly/UI",
                      "level": 3,
                      "children": [],
                      "productId": 3901
                    }
                  }
                }
              },
              "productId": 3901
            },
            "Raccord de tube de pression, injecteur": {
              "categoryId": 102793,
              "categoryName": "Mixture Formation",
              "level": 2,
              "children": {
                "Injecteur/porte-injecteur/UPI": {
                  "categoryId": null,
                  "categoryName": "Injecteur/porte-injecteur/UPI",
                  "level": 4,
                  "children": {
                    "Raccord de tube de pression, injecteur": {
                      "categoryId": 102799,
                      "categoryName": "Injector/Nozzle/Nozzle and Holder Assembly/UI",
                      "level": 3,
                      "children": [],
                      "productId": 9724
                    }
                  }
                }
              },
              "productId": 9724
            },
            "Raccord, injecteur": {
              "categoryId": 102793,
              "categoryName": "Mixture Formation",
              "level": 2,
              "children": {
                "Injecteur/porte-injecteur/UPI": {
                  "categoryId": null,
                  "categoryName": "Injecteur/porte-injecteur/UPI",
                  "level": 4,
                  "children": {
                    "Raccord, injecteur": {
                      "categoryId": 102799,
                      "categoryName": "Injector/Nozzle/Nozzle and Holder Assembly/UI",
                      "level": 3,
                      "children": [],
                      "productId": 4900
                    }
                  }
                }
              },
              "productId": 4900
            },
            "Régulateur de tension, soupape d’admission": {
              "categoryId": 102793,
              "categoryName": "Mixture Formation",
              "level": 2,
              "children": {
                "Injecteur/porte-injecteur/UPI": {
                  "categoryId": null,
                  "categoryName": "Injecteur/porte-injecteur/UPI",
                  "level": 4,
                  "children": {
                    "Régulateur de tension, soupape d’admission": {
                      "categoryId": 102799,
                      "categoryName": "Injector/Nozzle/Nozzle and Holder Assembly/UI",
                      "level": 3,
                      "children": [],
                      "productId": 60469
                    }
                  }
                }
              },
              "productId": 60469
            },
            "Résistance de série, injecteur": {
              "categoryId": 102793,
              "categoryName": "Mixture Formation",
              "level": 2,
              "children": {
                "Injecteur/porte-injecteur/UPI": {
                  "categoryId": null,
                  "categoryName": "Injecteur/porte-injecteur/UPI",
                  "level": 4,
                  "children": {
                    "Résistance de série, injecteur": {
                      "categoryId": 102799,
                      "categoryName": "Injector/Nozzle/Nozzle and Holder Assembly/UI",
                      "level": 3,
                      "children": [],
                      "productId": 3965
                    }
                  }
                }
              },
              "productId": 3965
            },
            "Support, injecteur": {
              "categoryId": 102793,
              "categoryName": "Mixture Formation",
              "level": 2,
              "children": {
                "Injecteur/porte-injecteur/UPI": {
                  "categoryId": null,
                  "categoryName": "Injecteur/porte-injecteur/UPI",
                  "level": 4,
                  "children": {
                    "Support, injecteur": {
                      "categoryId": 102799,
                      "categoryName": "Injector/Nozzle/Nozzle and Holder Assembly/UI",
                      "level": 3,
                      "children": [],
                      "productId": 60640
                    }
                  }
                }
              },
              "productId": 60640
            },
            "Tuyau, carburant de fuite": {
              "categoryId": 102793,
              "categoryName": "Mixture Formation",
              "level": 2,
              "children": {
                "Composants de porte-injecteur / Injecteur": {
                  "categoryId": null,
                  "categoryName": "Composants de porte-injecteur / Injecteur",
                  "level": 4,
                  "children": {
                    "Tuyau, carburant de fuite": {
                      "categoryId": 102800,
                      "categoryName": "Nozzle and Holder Assembly/Nozzle Parts",
                      "level": 3,
                      "children": [],
                      "productId": 3937
                    }
                  }
                },
                "Conduite de carburant / répartition du carburant": {
                  "categoryId": null,
                  "categoryName": "Conduite de carburant / répartition du carburant",
                  "level": 4,
                  "children": {
                    "Tuyau, carburant de fuite": {
                      "categoryId": 102804,
                      "categoryName": "Fuel Line/Distribution/Allocation",
                      "level": 3,
                      "children": [],
                      "productId": 3937
                    }
                  }
                }
              },
              "productId": 3937
            },
            "Unité pompe-injecteur": {
              "categoryId": 102793,
              "categoryName": "Mixture Formation",
              "level": 2,
              "children": {
                "Injecteur/porte-injecteur/UPI": {
                  "categoryId": null,
                  "categoryName": "Injecteur/porte-injecteur/UPI",
                  "level": 4,
                  "children": {
                    "Unité pompe-injecteur": {
                      "categoryId": 102799,
                      "categoryName": "Injector/Nozzle/Nozzle and Holder Assembly/UI",
                      "level": 3,
                      "children": [],
                      "productId": 3930
                    }
                  }
                }
              },
              "productId": 3930
            },
            "Vis à tenon carré, Pompe à injection": {
              "categoryId": 102793,
              "categoryName": "Mixture Formation",
              "level": 2,
              "children": {
                "Injecteur/porte-injecteur/UPI": {
                  "categoryId": null,
                  "categoryName": "Injecteur/porte-injecteur/UPI",
                  "level": 4,
                  "children": {
                    "Vis à tenon carré, Pompe à injection": {
                      "categoryId": 102799,
                      "categoryName": "Injector/Nozzle/Nozzle and Holder Assembly/UI",
                      "level": 3,
                      "children": [],
                      "productId": 4513
                    }
                  }
                }
              },
              "productId": 4513
            },
            "Vis de raccord, raccord tube de pression injecteur": {
              "categoryId": 102793,
              "categoryName": "Mixture Formation",
              "level": 2,
              "children": {
                "Injecteur/porte-injecteur/UPI": {
                  "categoryId": null,
                  "categoryName": "Injecteur/porte-injecteur/UPI",
                  "level": 4,
                  "children": {
                    "Vis de raccord, raccord tube de pression injecteur": {
                      "categoryId": 102799,
                      "categoryName": "Injector/Nozzle/Nozzle and Holder Assembly/UI",
                      "level": 3,
                      "children": [],
                      "productId": 9725
                    }
                  }
                }
              },
              "productId": 9725
            },
            "Vis, porte-injecteur": {
              "categoryId": 102793,
              "categoryName": "Mixture Formation",
              "level": 2,
              "children": {
                "Injecteur/porte-injecteur/UPI": {
                  "categoryId": null,
                  "categoryName": "Injecteur/porte-injecteur/UPI",
                  "level": 4,
                  "children": {
                    "Vis, porte-injecteur": {
                      "categoryId": 102799,
                      "categoryName": "Injector/Nozzle/Nozzle and Holder Assembly/UI",
                      "level": 3,
                      "children": [],
                      "productId": 6597
                    }
                  }
                }
              },
              "productId": 6597
            },
            "Vis, support pour contrôleur d'injecteurs": {
              "categoryId": 102793,
              "categoryName": "Mixture Formation",
              "level": 2,
              "children": {
                "Injecteur/porte-injecteur/UPI": {
                  "categoryId": null,
                  "categoryName": "Injecteur/porte-injecteur/UPI",
                  "level": 4,
                  "children": {
                    "Vis, support pour contrôleur d'injecteurs": {
                      "categoryId": 102799,
                      "categoryName": "Injector/Nozzle/Nozzle and Holder Assembly/UI",
                      "level": 3,
                      "children": [],
                      "productId": 5001
                    }
                  }
                }
              },
              "productId": 5001
            }
          }
        }
      }
    },
    "Moteur": {
      "categoryId": 100002,
      "categoryName": "Moteur",
      "level": 1,
      "children": {
        "Alimentation en air": {
          "categoryId": null,
          "categoryName": "Alimentation en air",
          "level": 2,
          "children": {
            "Flasque chauffante, préchauffement d'air d'admission": {
              "categoryId": 100383,
              "categoryName": "Air Supply",
              "level": 2,
              "children": {
                "Préchauffement de l'air d'admission": {
                  "categoryId": null,
                  "categoryName": "Préchauffement de l'air d'admission",
                  "level": 4,
                  "children": {
                    "Flasque chauffante, préchauffement d'air d'admission": {
                      "categoryId": 102872,
                      "categoryName": "Intake-Air Preheating",
                      "level": 3,
                      "children": [],
                      "productId": 3915
                    }
                  }
                }
              },
              "productId": 3915
            },
            "Joint, flasque chauffante-préchauffage de l'air d'admission": {
              "categoryId": 100383,
              "categoryName": "Air Supply",
              "level": 2,
              "children": {
                "Préchauffement de l'air d'admission": {
                  "categoryId": null,
                  "categoryName": "Préchauffement de l'air d'admission",
                  "level": 4,
                  "children": {
                    "Joint, flasque chauffante-préchauffage de l'air d'admission": {
                      "categoryId": 102872,
                      "categoryName": "Intake-Air Preheating",
                      "level": 3,
                      "children": [],
                      "productId": 4105
                    }
                  }
                }
              },
              "productId": 4105
            }
          }
        },
        "Outils": {
          "categoryId": null,
          "categoryName": "Outils",
          "level": 2,
          "children": {
            "Douille, écrou tendeur de porte-injecteur": {
              "categoryId": 103129,
              "categoryName": "Tools",
              "level": 2,
              "children": [],
              "productId": 7261
            }
          }
        }
      }
    }
  },
  "arborescenceText": "├── Carburation [ID: 100254] (Niveau 1)\n│   └── Mélange air-carburant (Niveau 2)\n│       ├── Mixture Formation [ID: 102793] (Niveau 2) → ProductId: 3900\n│       │   └── Composants de porte-injecteur / Injecteur (Niveau 4)\n│       │       └── Nozzle and Holder Assembly/Nozzle Parts [ID: 102800] (Niveau 3) → ProductId: 3900\n│       ├── Mixture Formation [ID: 102793] (Niveau 2) → ProductId: 4051\n│       │   ├── Composants de porte-injecteur / Injecteur (Niveau 4)\n│       │   │   └── Nozzle and Holder Assembly/Nozzle Parts [ID: 102800] (Niveau 3) → ProductId: 4051\n│       │   └── Joint (Niveau 4)\n│       │       └── Seal [ID: 102795] (Niveau 3) → ProductId: 4051\n│       ├── Mixture Formation [ID: 102793] (Niveau 2) → ProductId: 3963\n│       │   ├── Composants de porte-injecteur / Injecteur (Niveau 4)\n│       │   │   └── Nozzle and Holder Assembly/Nozzle Parts [ID: 102800] (Niveau 3) → ProductId: 3963\n│       │   └── Conduite de carburant / répartition du carburant (Niveau 4)\n│       │       └── Fuel Line/Distribution/Allocation [ID: 102804] (Niveau 3) → ProductId: 3963\n│       ├── Mixture Formation [ID: 102793] (Niveau 2) → ProductId: 3889\n│       │   └── Composants de porte-injecteur / Injecteur (Niveau 4)\n│       │       └── Nozzle and Holder Assembly/Nozzle Parts [ID: 102800] (Niveau 3) → ProductId: 3889\n│       ├── Mixture Formation [ID: 102793] (Niveau 2) → ProductId: 3899\n│       │   └── Composants de porte-injecteur / Injecteur (Niveau 4)\n│       │       └── Nozzle and Holder Assembly/Nozzle Parts [ID: 102800] (Niveau 3) → ProductId: 3899\n│       ├── Mixture Formation [ID: 102793] (Niveau 2) → ProductId: 3966\n│       │   └── Composants de porte-injecteur / Injecteur (Niveau 4)\n│       │       └── Nozzle and Holder Assembly/Nozzle Parts [ID: 102800] (Niveau 3) → ProductId: 3966\n│       ├── Mixture Formation [ID: 102793] (Niveau 2) → ProductId: 3948\n│       │   └── Composants de porte-injecteur / Injecteur (Niveau 4)\n│       │       └── Nozzle and Holder Assembly/Nozzle Parts [ID: 102800] (Niveau 3) → ProductId: 3948\n│       ├── Mixture Formation [ID: 102793] (Niveau 2) → ProductId: 3949\n│       │   └── Injecteur/porte-injecteur/UPI (Niveau 4)\n│       │       └── Injector/Nozzle/Nozzle and Holder Assembly/UI [ID: 102799] (Niveau 3) → ProductId: 3949\n│       ├── Mixture Formation [ID: 102793] (Niveau 2) → ProductId: 3915\n│       │   └── Composants de porte-injecteur / Injecteur (Niveau 4)\n│       │       └── Nozzle and Holder Assembly/Nozzle Parts [ID: 102800] (Niveau 3) → ProductId: 3915\n│       ├── Mixture Formation [ID: 102793] (Niveau 2) → ProductId: 3905\n│       │   └── Injecteur/porte-injecteur/UPI (Niveau 4)\n│       │       └── Injector/Nozzle/Nozzle and Holder Assembly/UI [ID: 102799] (Niveau 3) → ProductId: 3905\n│       ├── Mixture Formation [ID: 102793] (Niveau 2) → ProductId: 61353\n│       │   └── Injecteur/porte-injecteur/UPI (Niveau 4)\n│       │       └── Injector/Nozzle/Nozzle and Holder Assembly/UI [ID: 102799] (Niveau 3) → ProductId: 61353\n│       ├── Mixture Formation [ID: 102793] (Niveau 2) → ProductId: 3892\n│       │   ├── Composants de porte-injecteur / Injecteur (Niveau 4)\n│       │   │   └── Nozzle and Holder Assembly/Nozzle Parts [ID: 102800] (Niveau 3) → ProductId: 3892\n│       │   └── Joint (Niveau 4)\n│       │       └── Seal [ID: 102795] (Niveau 3) → ProductId: 3892\n│       ├── Mixture Formation [ID: 102793] (Niveau 2) → ProductId: 4105\n│       │   └── Composants de porte-injecteur / Injecteur (Niveau 4)\n│       │       └── Nozzle and Holder Assembly/Nozzle Parts [ID: 102800] (Niveau 3) → ProductId: 4105\n│       ├── Mixture Formation [ID: 102793] (Niveau 2) → ProductId: 9645\n│       │   └── Outils (Niveau 4)\n│       │       └── Tools [ID: 103150] (Niveau 3) → ProductId: 9645\n│       ├── Mixture Formation [ID: 102793] (Niveau 2) → ProductId: 3894\n│       │   └── Injecteur/porte-injecteur/UPI (Niveau 4)\n│       │       └── Injector/Nozzle/Nozzle and Holder Assembly/UI [ID: 102799] (Niveau 3) → ProductId: 3894\n│       ├── Mixture Formation [ID: 102793] (Niveau 2) → ProductId: 8090\n│       │   ├── Composants de porte-injecteur / Injecteur (Niveau 4)\n│       │   │   └── Nozzle and Holder Assembly/Nozzle Parts [ID: 102800] (Niveau 3) → ProductId: 8090\n│       │   └── Conduite de carburant / répartition du carburant (Niveau 4)\n│       │       └── Fuel Line/Distribution/Allocation [ID: 102804] (Niveau 3) → ProductId: 8090\n│       ├── Mixture Formation [ID: 102793] (Niveau 2) → ProductId: 60201\n│       │   └── Injecteur/porte-injecteur/UPI (Niveau 4)\n│       │       └── Injector/Nozzle/Nozzle and Holder Assembly/UI [ID: 102799] (Niveau 3) → ProductId: 60201\n│       ├── Mixture Formation [ID: 102793] (Niveau 2) → ProductId: 4049\n│       │   └── Composants de porte-injecteur / Injecteur (Niveau 4)\n│       │       └── Nozzle and Holder Assembly/Nozzle Parts [ID: 102800] (Niveau 3) → ProductId: 4049\n│       ├── Mixture Formation [ID: 102793] (Niveau 2) → ProductId: 6350\n│       │   └── Injecteur/porte-injecteur/UPI (Niveau 4)\n│       │       └── Injector/Nozzle/Nozzle and Holder Assembly/UI [ID: 102799] (Niveau 3) → ProductId: 6350\n│       ├── Mixture Formation [ID: 102793] (Niveau 2) → ProductId: 4050\n│       │   └── Composants de porte-injecteur / Injecteur (Niveau 4)\n│       │       └── Nozzle and Holder Assembly/Nozzle Parts [ID: 102800] (Niveau 3) → ProductId: 4050\n│       ├── Mixture Formation [ID: 102793] (Niveau 2) → ProductId: 60094\n│       │   └── Injecteur/porte-injecteur/UPI (Niveau 4)\n│       │       └── Injector/Nozzle/Nozzle and Holder Assembly/UI [ID: 102799] (Niveau 3) → ProductId: 60094\n│       ├── Mixture Formation [ID: 102793] (Niveau 2) → ProductId: 3901\n│       │   └── Injecteur/porte-injecteur/UPI (Niveau 4)\n│       │       └── Injector/Nozzle/Nozzle and Holder Assembly/UI [ID: 102799] (Niveau 3) → ProductId: 3901\n│       ├── Mixture Formation [ID: 102793] (Niveau 2) → ProductId: 9724\n│       │   └── Injecteur/porte-injecteur/UPI (Niveau 4)\n│       │       └── Injector/Nozzle/Nozzle and Holder Assembly/UI [ID: 102799] (Niveau 3) → ProductId: 9724\n│       ├── Mixture Formation [ID: 102793] (Niveau 2) → ProductId: 4900\n│       │   └── Injecteur/porte-injecteur/UPI (Niveau 4)\n│       │       └── Injector/Nozzle/Nozzle and Holder Assembly/UI [ID: 102799] (Niveau 3) → ProductId: 4900\n│       ├── Mixture Formation [ID: 102793] (Niveau 2) → ProductId: 60469\n│       │   └── Injecteur/porte-injecteur/UPI (Niveau 4)\n│       │       └── Injector/Nozzle/Nozzle and Holder Assembly/UI [ID: 102799] (Niveau 3) → ProductId: 60469\n│       ├── Mixture Formation [ID: 102793] (Niveau 2) → ProductId: 3965\n│       │   └── Injecteur/porte-injecteur/UPI (Niveau 4)\n│       │       └── Injector/Nozzle/Nozzle and Holder Assembly/UI [ID: 102799] (Niveau 3) → ProductId: 3965\n│       ├── Mixture Formation [ID: 102793] (Niveau 2) → ProductId: 60640\n│       │   └── Injecteur/porte-injecteur/UPI (Niveau 4)\n│       │       └── Injector/Nozzle/Nozzle and Holder Assembly/UI [ID: 102799] (Niveau 3) → ProductId: 60640\n│       ├── Mixture Formation [ID: 102793] (Niveau 2) → ProductId: 3937\n│       │   ├── Composants de porte-injecteur / Injecteur (Niveau 4)\n│       │   │   └── Nozzle and Holder Assembly/Nozzle Parts [ID: 102800] (Niveau 3) → ProductId: 3937\n│       │   └── Conduite de carburant / répartition du carburant (Niveau 4)\n│       │       └── Fuel Line/Distribution/Allocation [ID: 102804] (Niveau 3) → ProductId: 3937\n│       ├── Mixture Formation [ID: 102793] (Niveau 2) → ProductId: 3930\n│       │   └── Injecteur/porte-injecteur/UPI (Niveau 4)\n│       │       └── Injector/Nozzle/Nozzle and Holder Assembly/UI [ID: 102799] (Niveau 3) → ProductId: 3930\n│       ├── Mixture Formation [ID: 102793] (Niveau 2) → ProductId: 4513\n│       │   └── Injecteur/porte-injecteur/UPI (Niveau 4)\n│       │       └── Injector/Nozzle/Nozzle and Holder Assembly/UI [ID: 102799] (Niveau 3) → ProductId: 4513\n│       ├── Mixture Formation [ID: 102793] (Niveau 2) → ProductId: 9725\n│       │   └── Injecteur/porte-injecteur/UPI (Niveau 4)\n│       │       └── Injector/Nozzle/Nozzle and Holder Assembly/UI [ID: 102799] (Niveau 3) → ProductId: 9725\n│       ├── Mixture Formation [ID: 102793] (Niveau 2) → ProductId: 6597\n│       │   └── Injecteur/porte-injecteur/UPI (Niveau 4)\n│       │       └── Injector/Nozzle/Nozzle and Holder Assembly/UI [ID: 102799] (Niveau 3) → ProductId: 6597\n│       └── Mixture Formation [ID: 102793] (Niveau 2) → ProductId: 5001\n│           └── Injecteur/porte-injecteur/UPI (Niveau 4)\n│               └── Injector/Nozzle/Nozzle and Holder Assembly/UI [ID: 102799] (Niveau 3) → ProductId: 5001\n\n└── Moteur [ID: 100002] (Niveau 1)\n    ├── Alimentation en air (Niveau 2)\n    │   ├── Air Supply [ID: 100383] (Niveau 2) → ProductId: 3915\n    │   │   └── Préchauffement de l'air d'admission (Niveau 4)\n    │   │       └── Intake-Air Preheating [ID: 102872] (Niveau 3) → ProductId: 3915\n    │   └── Air Supply [ID: 100383] (Niveau 2) → ProductId: 4105\n    │       └── Préchauffement de l'air d'admission (Niveau 4)\n    │           └── Intake-Air Preheating [ID: 102872] (Niveau 3) → ProductId: 4105\n    └── Outils (Niveau 2)\n        └── Tools [ID: 103129] (Niveau 2) → ProductId: 7261",
  "arborescencePaths": [
    {
      "path": [
        "Carburation",
        "Mélange air-carburant",
        "Mixture Formation"
      ],
      "categoryIds": [
        100254,
        null,
        102793
      ],
      "finalCategoryId": 102793,
      "productId": 3900
    },
    {
      "path": [
        "Carburation",
        "Mélange air-carburant",
        "Mixture Formation"
      ],
      "categoryIds": [
        100254,
        null,
        102793
      ],
      "finalCategoryId": 102793,
      "productId": 4051
    },
    {
      "path": [
        "Carburation",
        "Mélange air-carburant",
        "Mixture Formation"
      ],
      "categoryIds": [
        100254,
        null,
        102793
      ],
      "finalCategoryId": 102793,
      "productId": 3963
    },
    {
      "path": [
        "Carburation",
        "Mélange air-carburant",
        "Mixture Formation"
      ],
      "categoryIds": [
        100254,
        null,
        102793
      ],
      "finalCategoryId": 102793,
      "productId": 3889
    },
    {
      "path": [
        "Carburation",
        "Mélange air-carburant",
        "Mixture Formation"
      ],
      "categoryIds": [
        100254,
        null,
        102793
      ],
      "finalCategoryId": 102793,
      "productId": 3899
    },
    {
      "path": [
        "Carburation",
        "Mélange air-carburant",
        "Mixture Formation"
      ],
      "categoryIds": [
        100254,
        null,
        102793
      ],
      "finalCategoryId": 102793,
      "productId": 3966
    },
    {
      "path": [
        "Carburation",
        "Mélange air-carburant",
        "Mixture Formation"
      ],
      "categoryIds": [
        100254,
        null,
        102793
      ],
      "finalCategoryId": 102793,
      "productId": 3948
    },
    {
      "path": [
        "Carburation",
        "Mélange air-carburant",
        "Mixture Formation"
      ],
      "categoryIds": [
        100254,
        null,
        102793
      ],
      "finalCategoryId": 102793,
      "productId": 3949
    },
    {
      "path": [
        "Carburation",
        "Mélange air-carburant",
        "Mixture Formation"
      ],
      "categoryIds": [
        100254,
        null,
        102793
      ],
      "finalCategoryId": 102793,
      "productId": 3915
    },
    {
      "path": [
        "Carburation",
        "Mélange air-carburant",
        "Mixture Formation"
      ],
      "categoryIds": [
        100254,
        null,
        102793
      ],
      "finalCategoryId": 102793,
      "productId": 3905
    },
    {
      "path": [
        "Carburation",
        "Mélange air-carburant",
        "Mixture Formation"
      ],
      "categoryIds": [
        100254,
        null,
        102793
      ],
      "finalCategoryId": 102793,
      "productId": 61353
    },
    {
      "path": [
        "Carburation",
        "Mélange air-carburant",
        "Mixture Formation"
      ],
      "categoryIds": [
        100254,
        null,
        102793
      ],
      "finalCategoryId": 102793,
      "productId": 3892
    },
    {
      "path": [
        "Carburation",
        "Mélange air-carburant",
        "Mixture Formation"
      ],
      "categoryIds": [
        100254,
        null,
        102793
      ],
      "finalCategoryId": 102793,
      "productId": 4105
    },
    {
      "path": [
        "Carburation",
        "Mélange air-carburant",
        "Mixture Formation"
      ],
      "categoryIds": [
        100254,
        null,
        102793
      ],
      "finalCategoryId": 102793,
      "productId": 9645
    },
    {
      "path": [
        "Carburation",
        "Mélange air-carburant",
        "Mixture Formation"
      ],
      "categoryIds": [
        100254,
        null,
        102793
      ],
      "finalCategoryId": 102793,
      "productId": 3894
    },
    {
      "path": [
        "Carburation",
        "Mélange air-carburant",
        "Mixture Formation"
      ],
      "categoryIds": [
        100254,
        null,
        102793
      ],
      "finalCategoryId": 102793,
      "productId": 8090
    },
    {
      "path": [
        "Carburation",
        "Mélange air-carburant",
        "Mixture Formation"
      ],
      "categoryIds": [
        100254,
        null,
        102793
      ],
      "finalCategoryId": 102793,
      "productId": 60201
    },
    {
      "path": [
        "Carburation",
        "Mélange air-carburant",
        "Mixture Formation"
      ],
      "categoryIds": [
        100254,
        null,
        102793
      ],
      "finalCategoryId": 102793,
      "productId": 4049
    },
    {
      "path": [
        "Carburation",
        "Mélange air-carburant",
        "Mixture Formation"
      ],
      "categoryIds": [
        100254,
        null,
        102793
      ],
      "finalCategoryId": 102793,
      "productId": 6350
    },
    {
      "path": [
        "Carburation",
        "Mélange air-carburant",
        "Mixture Formation"
      ],
      "categoryIds": [
        100254,
        null,
        102793
      ],
      "finalCategoryId": 102793,
      "productId": 4050
    },
    {
      "path": [
        "Carburation",
        "Mélange air-carburant",
        "Mixture Formation"
      ],
      "categoryIds": [
        100254,
        null,
        102793
      ],
      "finalCategoryId": 102793,
      "productId": 60094
    },
    {
      "path": [
        "Carburation",
        "Mélange air-carburant",
        "Mixture Formation"
      ],
      "categoryIds": [
        100254,
        null,
        102793
      ],
      "finalCategoryId": 102793,
      "productId": 3901
    },
    {
      "path": [
        "Carburation",
        "Mélange air-carburant",
        "Mixture Formation"
      ],
      "categoryIds": [
        100254,
        null,
        102793
      ],
      "finalCategoryId": 102793,
      "productId": 9724
    },
    {
      "path": [
        "Carburation",
        "Mélange air-carburant",
        "Mixture Formation"
      ],
      "categoryIds": [
        100254,
        null,
        102793
      ],
      "finalCategoryId": 102793,
      "productId": 4900
    },
    {
      "path": [
        "Carburation",
        "Mélange air-carburant",
        "Mixture Formation"
      ],
      "categoryIds": [
        100254,
        null,
        102793
      ],
      "finalCategoryId": 102793,
      "productId": 60469
    },
    {
      "path": [
        "Carburation",
        "Mélange air-carburant",
        "Mixture Formation"
      ],
      "categoryIds": [
        100254,
        null,
        102793
      ],
      "finalCategoryId": 102793,
      "productId": 3965
    },
    {
      "path": [
        "Carburation",
        "Mélange air-carburant",
        "Mixture Formation"
      ],
      "categoryIds": [
        100254,
        null,
        102793
      ],
      "finalCategoryId": 102793,
      "productId": 60640
    },
    {
      "path": [
        "Carburation",
        "Mélange air-carburant",
        "Mixture Formation"
      ],
      "categoryIds": [
        100254,
        null,
        102793
      ],
      "finalCategoryId": 102793,
      "productId": 3937
    },
    {
      "path": [
        "Carburation",
        "Mélange air-carburant",
        "Mixture Formation"
      ],
      "categoryIds": [
        100254,
        null,
        102793
      ],
      "finalCategoryId": 102793,
      "productId": 3930
    },
    {
      "path": [
        "Carburation",
        "Mélange air-carburant",
        "Mixture Formation"
      ],
      "categoryIds": [
        100254,
        null,
        102793
      ],
      "finalCategoryId": 102793,
      "productId": 4513
    },
    {
      "path": [
        "Carburation",
        "Mélange air-carburant",
        "Mixture Formation"
      ],
      "categoryIds": [
        100254,
        null,
        102793
      ],
      "finalCategoryId": 102793,
      "productId": 9725
    },
    {
      "path": [
        "Carburation",
        "Mélange air-carburant",
        "Mixture Formation"
      ],
      "categoryIds": [
        100254,
        null,
        102793
      ],
      "finalCategoryId": 102793,
      "productId": 6597
    },
    {
      "path": [
        "Carburation",
        "Mélange air-carburant",
        "Mixture Formation"
      ],
      "categoryIds": [
        100254,
        null,
        102793
      ],
      "finalCategoryId": 102793,
      "productId": 5001
    },
    {
      "path": [
        "Moteur",
        "Alimentation en air",
        "Air Supply"
      ],
      "categoryIds": [
        100002,
        null,
        100383
      ],
      "finalCategoryId": 100383,
      "productId": 3915
    },
    {
      "path": [
        "Moteur",
        "Alimentation en air",
        "Air Supply"
      ],
      "categoryIds": [
        100002,
        null,
        100383
      ],
      "finalCategoryId": 100383,
      "productId": 4105
    },
    {
      "path": [
        "Moteur",
        "Outils",
        "Tools"
      ],
      "categoryIds": [
        100002,
        null,
        103129
      ],
      "finalCategoryId": 103129,
      "productId": 7261
    }
  ],
  "productIdsInArbo": [
    3889,
    3892,
    3894,
    3899,
    3900,
    3901,
    3905,
    3915,
    3930,
    3937,
    3948,
    3949,
    3963,
    3965,
    3966,
    4049,
    4050,
    4051,
    4105,
    4513,
    4900,
    5001,
    6350,
    6597,
    7261,
    8090,
    9645,
    9724,
    9725,
    60094,
    60201,
    60469,
    60640,
    61353
  ],
  "closestProductIds": [
    {
      "productId": 3889,
      "productName": "Cache, injecteur"
    },
    {
      "productId": 3892,
      "productName": "Joint d'étanchéité, porte-injecteur"
    },
    {
      "productId": 3894,
      "productName": "Kit de joints, injecteur"
    },
    {
      "productId": 3899,
      "productName": "Corps d'injecteur"
    },
    {
      "productId": 3900,
      "productName": "Aiguille d'injecteur"
    }
  ]
}