{
  "productName": "Poulie de tension, courroie trapézoïdale à nervures",
  "searchText": "Poulie de tension, courroie trapézoïdale à nervures",
  "found": true,
  "hasMatch": true,
  "timestamp": "2025-12-03T07:03:28.450Z",
  "productId": 310,
  "arborescence": {
    "Commande à courroie": {
      "categoryId": 100016,
      "categoryName": "Commande à courroie",
      "level": 1,
      "children": {
        "Jeu/ courroies trapézoïdales à nervures": {
          "categoryId": null,
          "categoryName": "Jeu/ courroies trapézoïdales à nervures",
          "level": 2,
          "children": {
            "Poulie de tension, courroie trapézoïdale à nervures": {
              "categoryId": 100082,
              "categoryName": "V-Ribbed Belt/Set",
              "level": 2,
              "children": {
                "Poulie de tension": {
                  "categoryId": null,
                  "categoryName": "Poulie de tension",
                  "level": 4,
                  "children": {
                    "Poulie de tension, courroie trapézoïdale à nervures": {
                      "categoryId": 100434,
                      "categoryName": "Tensioner Pulley",
                      "level": 3,
                      "children": [],
                      "productId": 310
                    }
                  }
                }
              },
              "productId": 310
            }
          }
        }
      }
    },
    "Moteur": {
      "categoryId": 100002,
      "categoryName": "Moteur",
      "level": 1,
      "children": {
        "Commande à courroie": {
          "categoryId": null,
          "categoryName": "Commande à courroie",
          "level": 2,
          "children": {
            "Poulie de tension, courroie trapézoïdale à nervures": {
              "categoryId": 104302,
              "categoryName": "Belt Drive",
              "level": 2,
              "children": {
                "Jeu/ courroies trapézoïdales à nervures": {
                  "categoryId": null,
                  "categoryName": "Jeu/ courroies trapézoïdales à nervures",
                  "level": 4,
                  "children": {
                    "Poulie de tension, courroie trapézoïdale à nervures": {
                      "categoryId": 104308,
                      "categoryName": "V-Ribbed Belt/Set",
                      "level": 3,
                      "children": {
                        "Poulie de tension": {
                          "categoryId": null,
                          "categoryName": "Poulie de tension",
                          "level": 6,
                          "children": {
                            "Poulie de tension, courroie trapézoïdale à nervures": {
                              "categoryId": 104311,
                              "categoryName": "Tensioner Pulley",
                              "level": 4,
                              "children": [],
                              "productId": 310
                            }
                          }
                        }
                      },
                      "productId": 310
                    }
                  }
                }
              },
              "productId": 310
            }
          }
        }
      }
    }
  },
  "arborescenceText": "├── Commande à courroie [ID: 100016] (Niveau 1)\n│   └── Jeu/ courroies trapézoïdales à nervures (Niveau 2)\n│       └── V-Ribbed Belt/Set [ID: 100082] (Niveau 2) → ProductId: 310\n│           └── Poulie de tension (Niveau 4)\n│               └── Tensioner Pulley [ID: 100434] (Niveau 3) → ProductId: 310\n\n└── Moteur [ID: 100002] (Niveau 1)\n    └── Commande à courroie (Niveau 2)\n        └── Belt Drive [ID: 104302] (Niveau 2) → ProductId: 310\n            └── Jeu/ courroies trapézoïdales à nervures (Niveau 4)\n                └── V-Ribbed Belt/Set [ID: 104308] (Niveau 3) → ProductId: 310\n                    └── Poulie de tension (Niveau 6)\n                        └── Tensioner Pulley [ID: 104311] (Niveau 4) → ProductId: 310",
  "arborescencePaths": [
    {
      "path": [
        "Commande à courroie",
        "Jeu/ courroies trapézoïdales à nervures",
        "V-Ribbed Belt/Set"
      ],
      "categoryIds": [
        100016,
        null,
        100082
      ],
      "finalCategoryId": 100082,
      "productId": 310
    },
    {
      "path": [
        "Moteur",
        "Commande à courroie",
        "Belt Drive"
      ],
      "categoryIds": [
        100002,
        null,
        104302
      ],
      "finalCategoryId": 104302,
      "productId": 310
    }
  ],
  "productIdsInArbo": [
    310
  ],
  "matchedProductIds": [
    310
  ]
}