{
  "productName": "Projecteur de travail",
  "searchText": "Projecteur de travail",
  "found": true,
  "hasMatch": true,
  "timestamp": "2025-12-03T07:04:42.803Z",
  "productId": 724,
  "arborescence": {
    "Carrosserie": {
      "categoryId": 100001,
      "categoryName": "Carrosserie",
      "level": 1,
      "children": {
        "Fixation/Support/collerette": {
          "categoryId": null,
          "categoryName": "Fixation/Support/collerette",
          "level": 2,
          "children": {
            "Cadre, projecteur de travail": {
              "categoryId": 101454,
              "categoryName": "Racks/Carriers/Frames",
              "level": 2,
              "children": [],
              "productId": 727
            }
          }
        },
        "Phares supplémentaires/composants": {
          "categoryId": null,
          "categoryName": "Phares supplémentaires/composants",
          "level": 2,
          "children": {
            "Ampoule, projecteur de travail": {
              "categoryId": 101340,
              "categoryName": "Additional Headlight/Parts",
              "level": 2,
              "children": {
                "Projecteur de travail, composants": {
                  "categoryId": null,
                  "categoryName": "Projecteur de travail, composants",
                  "level": 4,
                  "children": {
                    "Ampoule, projecteur de travail": {
                      "categoryId": 101349,
                      "categoryName": "Worklight/Parts",
                      "level": 3,
                      "children": {
                        "Ampoule, projecteurs de travail": {
                          "categoryId": null,
                          "categoryName": "Ampoule, projecteurs de travail",
                          "level": 6,
                          "children": {
                            "Ampoule, projecteur de travail": {
                              "categoryId": 101351,
                              "categoryName": "Worklight Bulb",
                              "level": 4,
                              "children": [],
                              "productId": 104
                            }
                          }
                        }
                      },
                      "productId": 104
                    }
                  }
                }
              },
              "productId": 104
            },
            "Boîtier, projecteur de travail": {
              "categoryId": 101340,
              "categoryName": "Additional Headlight/Parts",
              "level": 2,
              "children": {
                "Projecteur de travail, composants": {
                  "categoryId": null,
                  "categoryName": "Projecteur de travail, composants",
                  "level": 4,
                  "children": {
                    "Boîtier, projecteur de travail": {
                      "categoryId": 101349,
                      "categoryName": "Worklight/Parts",
                      "level": 3,
                      "children": {
                        "Projecteur de travail, composants": {
                          "categoryId": null,
                          "categoryName": "Projecteur de travail, composants",
                          "level": 6,
                          "children": {
                            "Boîtier, projecteur de travail": {
                              "categoryId": 101352,
                              "categoryName": "Worklight Parts",
                              "level": 4,
                              "children": [],
                              "productId": 730
                            }
                          }
                        }
                      },
                      "productId": 730
                    }
                  }
                }
              },
              "productId": 730
            },
            "Bonnette, projecteur de travail": {
              "categoryId": 101340,
              "categoryName": "Additional Headlight/Parts",
              "level": 2,
              "children": {
                "Projecteur de travail, composants": {
                  "categoryId": null,
                  "categoryName": "Projecteur de travail, composants",
                  "level": 4,
                  "children": {
                    "Bonnette, projecteur de travail": {
                      "categoryId": 101349,
                      "categoryName": "Worklight/Parts",
                      "level": 3,
                      "children": {
                        "Projecteur de travail, composants": {
                          "categoryId": null,
                          "categoryName": "Projecteur de travail, composants",
                          "level": 6,
                          "children": {
                            "Bonnette, projecteur de travail": {
                              "categoryId": 101352,
                              "categoryName": "Worklight Parts",
                              "level": 4,
                              "children": [],
                              "productId": 1079
                            }
                          }
                        }
                      },
                      "productId": 1079
                    }
                  }
                }
              },
              "productId": 1079
            },
            "Cadre, projecteur de travail": {
              "categoryId": 101340,
              "categoryName": "Additional Headlight/Parts",
              "level": 2,
              "children": {
                "Projecteur de travail, composants": {
                  "categoryId": null,
                  "categoryName": "Projecteur de travail, composants",
                  "level": 4,
                  "children": {
                    "Cadre, projecteur de travail": {
                      "categoryId": 101349,
                      "categoryName": "Worklight/Parts",
                      "level": 3,
                      "children": {
                        "Projecteur de travail, composants": {
                          "categoryId": null,
                          "categoryName": "Projecteur de travail, composants",
                          "level": 6,
                          "children": {
                            "Cadre, projecteur de travail": {
                              "categoryId": 101352,
                              "categoryName": "Worklight Parts",
                              "level": 4,
                              "children": [],
                              "productId": 727
                            }
                          }
                        }
                      },
                      "productId": 727
                    }
                  }
                }
              },
              "productId": 727
            },
            "Disperseur, projecteur de travail": {
              "categoryId": 101340,
              "categoryName": "Additional Headlight/Parts",
              "level": 2,
              "children": {
                "Projecteur de travail, composants": {
                  "categoryId": null,
                  "categoryName": "Projecteur de travail, composants",
                  "level": 4,
                  "children": {
                    "Disperseur, projecteur de travail": {
                      "categoryId": 101349,
                      "categoryName": "Worklight/Parts",
                      "level": 3,
                      "children": {
                        "Projecteur de travail, composants": {
                          "categoryId": null,
                          "categoryName": "Projecteur de travail, composants",
                          "level": 6,
                          "children": {
                            "Disperseur, projecteur de travail": {
                              "categoryId": 101352,
                              "categoryName": "Worklight Parts",
                              "level": 4,
                              "children": [],
                              "productId": 84
                            }
                          }
                        }
                      },
                      "productId": 84
                    }
                  }
                }
              },
              "productId": 84
            },
            "Douille de lampe, projecteur de travail": {
              "categoryId": 101340,
              "categoryName": "Additional Headlight/Parts",
              "level": 2,
              "children": {
                "Projecteur de travail, composants": {
                  "categoryId": null,
                  "categoryName": "Projecteur de travail, composants",
                  "level": 4,
                  "children": {
                    "Douille de lampe, projecteur de travail": {
                      "categoryId": 101349,
                      "categoryName": "Worklight/Parts",
                      "level": 3,
                      "children": {
                        "Projecteur de travail, composants": {
                          "categoryId": null,
                          "categoryName": "Projecteur de travail, composants",
                          "level": 6,
                          "children": {
                            "Douille de lampe, projecteur de travail": {
                              "categoryId": 101352,
                              "categoryName": "Worklight Parts",
                              "level": 4,
                              "children": [],
                              "productId": 487
                            }
                          }
                        }
                      },
                      "productId": 487
                    }
                  }
                }
              },
              "productId": 487
            },
            "Enjoliveur, projecteur de travail": {
              "categoryId": 101340,
              "categoryName": "Additional Headlight/Parts",
              "level": 2,
              "children": {
                "Projecteur de travail, composants": {
                  "categoryId": null,
                  "categoryName": "Projecteur de travail, composants",
                  "level": 4,
                  "children": {
                    "Enjoliveur, projecteur de travail": {
                      "categoryId": 101349,
                      "categoryName": "Worklight/Parts",
                      "level": 3,
                      "children": {
                        "Projecteur de travail, composants": {
                          "categoryId": null,
                          "categoryName": "Projecteur de travail, composants",
                          "level": 6,
                          "children": {
                            "Enjoliveur, projecteur de travail": {
                              "categoryId": 101352,
                              "categoryName": "Worklight Parts",
                              "level": 4,
                              "children": [],
                              "productId": 729
                            }
                          }
                        }
                      },
                      "productId": 729
                    }
                  }
                }
              },
              "productId": 729
            },
            "Kit de câbles, projecteur de travail": {
              "categoryId": 101340,
              "categoryName": "Additional Headlight/Parts",
              "level": 2,
              "children": {
                "Projecteur de travail, composants": {
                  "categoryId": null,
                  "categoryName": "Projecteur de travail, composants",
                  "level": 4,
                  "children": {
                    "Kit de câbles, projecteur de travail": {
                      "categoryId": 101349,
                      "categoryName": "Worklight/Parts",
                      "level": 3,
                      "children": {
                        "Projecteur de travail, composants": {
                          "categoryId": null,
                          "categoryName": "Projecteur de travail, composants",
                          "level": 6,
                          "children": {
                            "Kit de câbles, projecteur de travail": {
                              "categoryId": 101352,
                              "categoryName": "Worklight Parts",
                              "level": 4,
                              "children": [],
                              "productId": 728
                            }
                          }
                        }
                      },
                      "productId": 728
                    }
                  }
                }
              },
              "productId": 728
            },
            "Projecteur de travail": {
              "categoryId": 101340,
              "categoryName": "Additional Headlight/Parts",
              "level": 2,
              "children": {
                "Projecteur de travail, composants": {
                  "categoryId": null,
                  "categoryName": "Projecteur de travail, composants",
                  "level": 4,
                  "children": {
                    "Projecteur de travail": {
                      "categoryId": 101349,
                      "categoryName": "Worklight/Parts",
                      "level": 3,
                      "children": {
                        "Projecteur de travail / Optique": {
                          "categoryId": null,
                          "categoryName": "Projecteur de travail / Optique",
                          "level": 6,
                          "children": {
                            "Projecteur de travail": {
                              "categoryId": 101350,
                              "categoryName": "Worklight/Insert",
                              "level": 4,
                              "children": [],
                              "productId": 724
                            }
                          }
                        }
                      },
                      "productId": 724
                    }
                  }
                }
              },
              "productId": 724
            },
            "Réflecteur, projecteur de travail": {
              "categoryId": 101340,
              "categoryName": "Additional Headlight/Parts",
              "level": 2,
              "children": {
                "Projecteur de travail, composants": {
                  "categoryId": null,
                  "categoryName": "Projecteur de travail, composants",
                  "level": 4,
                  "children": {
                    "Réflecteur, projecteur de travail": {
                      "categoryId": 101349,
                      "categoryName": "Worklight/Parts",
                      "level": 3,
                      "children": {
                        "Projecteur de travail, composants": {
                          "categoryId": null,
                          "categoryName": "Projecteur de travail, composants",
                          "level": 6,
                          "children": {
                            "Réflecteur, projecteur de travail": {
                              "categoryId": 101352,
                              "categoryName": "Worklight Parts",
                              "level": 4,
                              "children": [],
                              "productId": 725
                            }
                          }
                        }
                      },
                      "productId": 725
                    }
                  }
                }
              },
              "productId": 725
            },
            "Set de projecteurs de travail": {
              "categoryId": 101340,
              "categoryName": "Additional Headlight/Parts",
              "level": 2,
              "children": {
                "Projecteur de travail, composants": {
                  "categoryId": null,
                  "categoryName": "Projecteur de travail, composants",
                  "level": 4,
                  "children": {
                    "Set de projecteurs de travail": {
                      "categoryId": 101349,
                      "categoryName": "Worklight/Parts",
                      "level": 3,
                      "children": {
                        "Projecteur de travail / Optique": {
                          "categoryId": null,
                          "categoryName": "Projecteur de travail / Optique",
                          "level": 6,
                          "children": {
                            "Set de projecteurs de travail": {
                              "categoryId": 101350,
                              "categoryName": "Worklight/Insert",
                              "level": 4,
                              "children": [],
                              "productId": 86
                            }
                          }
                        }
                      },
                      "productId": 86
                    }
                  }
                }
              },
              "productId": 86
            },
            "Support, projecteur de travail": {
              "categoryId": 101340,
              "categoryName": "Additional Headlight/Parts",
              "level": 2,
              "children": {
                "Projecteur de travail, composants": {
                  "categoryId": null,
                  "categoryName": "Projecteur de travail, composants",
                  "level": 4,
                  "children": {
                    "Support, projecteur de travail": {
                      "categoryId": 101349,
                      "categoryName": "Worklight/Parts",
                      "level": 3,
                      "children": {
                        "Projecteur de travail, composants": {
                          "categoryId": null,
                          "categoryName": "Projecteur de travail, composants",
                          "level": 6,
                          "children": {
                            "Support, projecteur de travail": {
                              "categoryId": 101352,
                              "categoryName": "Worklight Parts",
                              "level": 4,
                              "children": [],
                              "productId": 99
                            }
                          }
                        }
                      },
                      "productId": 99
                    }
                  }
                }
              },
              "productId": 99
            }
          }
        }
      }
    },
    "Système électrique": {
      "categoryId": 100010,
      "categoryName": "Système électrique",
      "level": 1,
      "children": {
        "Kit/pièces de câble": {
          "categoryId": null,
          "categoryName": "Kit/pièces de câble",
          "level": 2,
          "children": {
            "Kit de câbles, projecteur de travail": {
              "categoryId": 103066,
              "categoryName": "Cable Set/individual parts",
              "level": 2,
              "children": [],
              "productId": 728
            }
          }
        },
        "Phares supplémentaires/composants": {
          "categoryId": null,
          "categoryName": "Phares supplémentaires/composants",
          "level": 2,
          "children": {
            "Ampoule, projecteur de travail": {
              "categoryId": 100787,
              "categoryName": "Additional Headlight/Parts",
              "level": 2,
              "children": {
                "Projecteur de travail, composants": {
                  "categoryId": null,
                  "categoryName": "Projecteur de travail, composants",
                  "level": 4,
                  "children": {
                    "Ampoule, projecteur de travail": {
                      "categoryId": 100280,
                      "categoryName": "Worklight/Parts",
                      "level": 3,
                      "children": {
                        "Ampoule, projecteurs de travail": {
                          "categoryId": null,
                          "categoryName": "Ampoule, projecteurs de travail",
                          "level": 6,
                          "children": {
                            "Ampoule, projecteur de travail": {
                              "categoryId": 100448,
                              "categoryName": "Worklight Bulb",
                              "level": 4,
                              "children": [],
                              "productId": 104
                            }
                          }
                        }
                      },
                      "productId": 104
                    }
                  }
                }
              },
              "productId": 104
            },
            "Boîtier, projecteur de travail": {
              "categoryId": 100787,
              "categoryName": "Additional Headlight/Parts",
              "level": 2,
              "children": {
                "Projecteur de travail, composants": {
                  "categoryId": null,
                  "categoryName": "Projecteur de travail, composants",
                  "level": 4,
                  "children": {
                    "Boîtier, projecteur de travail": {
                      "categoryId": 100280,
                      "categoryName": "Worklight/Parts",
                      "level": 3,
                      "children": {
                        "Projecteur de travail, composants": {
                          "categoryId": null,
                          "categoryName": "Projecteur de travail, composants",
                          "level": 6,
                          "children": {
                            "Boîtier, projecteur de travail": {
                              "categoryId": 100445,
                              "categoryName": "Worklight Parts",
                              "level": 4,
                              "children": [],
                              "productId": 730
                            }
                          }
                        }
                      },
                      "productId": 730
                    }
                  }
                }
              },
              "productId": 730
            },
            "Bonnette, projecteur de travail": {
              "categoryId": 100787,
              "categoryName": "Additional Headlight/Parts",
              "level": 2,
              "children": {
                "Projecteur de travail, composants": {
                  "categoryId": null,
                  "categoryName": "Projecteur de travail, composants",
                  "level": 4,
                  "children": {
                    "Bonnette, projecteur de travail": {
                      "categoryId": 100280,
                      "categoryName": "Worklight/Parts",
                      "level": 3,
                      "children": {
                        "Projecteur de travail, composants": {
                          "categoryId": null,
                          "categoryName": "Projecteur de travail, composants",
                          "level": 6,
                          "children": {
                            "Bonnette, projecteur de travail": {
                              "categoryId": 100445,
                              "categoryName": "Worklight Parts",
                              "level": 4,
                              "children": [],
                              "productId": 1079
                            }
                          }
                        }
                      },
                      "productId": 1079
                    }
                  }
                }
              },
              "productId": 1079
            },
            "Cadre, projecteur de travail": {
              "categoryId": 100787,
              "categoryName": "Additional Headlight/Parts",
              "level": 2,
              "children": {
                "Projecteur de travail, composants": {
                  "categoryId": null,
                  "categoryName": "Projecteur de travail, composants",
                  "level": 4,
                  "children": {
                    "Cadre, projecteur de travail": {
                      "categoryId": 100280,
                      "categoryName": "Worklight/Parts",
                      "level": 3,
                      "children": {
                        "Projecteur de travail, composants": {
                          "categoryId": null,
                          "categoryName": "Projecteur de travail, composants",
                          "level": 6,
                          "children": {
                            "Cadre, projecteur de travail": {
                              "categoryId": 100445,
                              "categoryName": "Worklight Parts",
                              "level": 4,
                              "children": [],
                              "productId": 727
                            }
                          }
                        }
                      },
                      "productId": 727
                    }
                  }
                }
              },
              "productId": 727
            },
            "Disperseur, projecteur de travail": {
              "categoryId": 100787,
              "categoryName": "Additional Headlight/Parts",
              "level": 2,
              "children": {
                "Projecteur de travail, composants": {
                  "categoryId": null,
                  "categoryName": "Projecteur de travail, composants",
                  "level": 4,
                  "children": {
                    "Disperseur, projecteur de travail": {
                      "categoryId": 100280,
                      "categoryName": "Worklight/Parts",
                      "level": 3,
                      "children": {
                        "Projecteur de travail, composants": {
                          "categoryId": null,
                          "categoryName": "Projecteur de travail, composants",
                          "level": 6,
                          "children": {
                            "Disperseur, projecteur de travail": {
                              "categoryId": 100445,
                              "categoryName": "Worklight Parts",
                              "level": 4,
                              "children": [],
                              "productId": 84
                            }
                          }
                        }
                      },
                      "productId": 84
                    }
                  }
                }
              },
              "productId": 84
            },
            "Douille de lampe, projecteur de travail": {
              "categoryId": 100787,
              "categoryName": "Additional Headlight/Parts",
              "level": 2,
              "children": {
                "Projecteur de travail, composants": {
                  "categoryId": null,
                  "categoryName": "Projecteur de travail, composants",
                  "level": 4,
                  "children": {
                    "Douille de lampe, projecteur de travail": {
                      "categoryId": 100280,
                      "categoryName": "Worklight/Parts",
                      "level": 3,
                      "children": {
                        "Projecteur de travail, composants": {
                          "categoryId": null,
                          "categoryName": "Projecteur de travail, composants",
                          "level": 6,
                          "children": {
                            "Douille de lampe, projecteur de travail": {
                              "categoryId": 100445,
                              "categoryName": "Worklight Parts",
                              "level": 4,
                              "children": [],
                              "productId": 487
                            }
                          }
                        }
                      },
                      "productId": 487
                    }
                  }
                }
              },
              "productId": 487
            },
            "Enjoliveur, projecteur de travail": {
              "categoryId": 100787,
              "categoryName": "Additional Headlight/Parts",
              "level": 2,
              "children": {
                "Projecteur de travail, composants": {
                  "categoryId": null,
                  "categoryName": "Projecteur de travail, composants",
                  "level": 4,
                  "children": {
                    "Enjoliveur, projecteur de travail": {
                      "categoryId": 100280,
                      "categoryName": "Worklight/Parts",
                      "level": 3,
                      "children": {
                        "Projecteur de travail, composants": {
                          "categoryId": null,
                          "categoryName": "Projecteur de travail, composants",
                          "level": 6,
                          "children": {
                            "Enjoliveur, projecteur de travail": {
                              "categoryId": 100445,
                              "categoryName": "Worklight Parts",
                              "level": 4,
                              "children": [],
                              "productId": 729
                            }
                          }
                        }
                      },
                      "productId": 729
                    }
                  }
                }
              },
              "productId": 729
            },
            "Jeu de supports, phare supplémentaire": {
              "categoryId": 100787,
              "categoryName": "Additional Headlight/Parts",
              "level": 2,
              "children": {
                "Phare chercheur / composants": {
                  "categoryId": null,
                  "categoryName": "Phare chercheur / composants",
                  "level": 4,
                  "children": {
                    "Jeu de supports, phare supplémentaire": {
                      "categoryId": 100281,
                      "categoryName": "Searchlight/Parts",
                      "level": 3,
                      "children": {
                        "Composants phare chercheur": {
                          "categoryId": null,
                          "categoryName": "Composants phare chercheur",
                          "level": 6,
                          "children": {
                            "Jeu de supports, phare supplémentaire": {
                              "categoryId": 100446,
                              "categoryName": "Searchlight Parts",
                              "level": 4,
                              "children": [],
                              "productId": 2977
                            }
                          }
                        }
                      },
                      "productId": 2977
                    }
                  }
                },
                "Projecteur antibrouillard/ composants": {
                  "categoryId": null,
                  "categoryName": "Projecteur antibrouillard/ composants",
                  "level": 4,
                  "children": {
                    "Jeu de supports, phare supplémentaire": {
                      "categoryId": 100277,
                      "categoryName": "Front Fog Light/Parts",
                      "level": 3,
                      "children": {
                        "Composants pour projecteur antibrouillard": {
                          "categoryId": null,
                          "categoryName": "Composants pour projecteur antibrouillard",
                          "level": 6,
                          "children": {
                            "Jeu de supports, phare supplémentaire": {
                              "categoryId": 100444,
                              "categoryName": "Fog Light Parts",
                              "level": 4,
                              "children": [],
                              "productId": 2977
                            }
                          }
                        }
                      },
                      "productId": 2977
                    }
                  }
                },
                "Projecteur de travail, composants": {
                  "categoryId": null,
                  "categoryName": "Projecteur de travail, composants",
                  "level": 4,
                  "children": {
                    "Jeu de supports, phare supplémentaire": {
                      "categoryId": 100280,
                      "categoryName": "Worklight/Parts",
                      "level": 3,
                      "children": {
                        "Projecteur de travail, composants": {
                          "categoryId": null,
                          "categoryName": "Projecteur de travail, composants",
                          "level": 6,
                          "children": {
                            "Jeu de supports, phare supplémentaire": {
                              "categoryId": 100445,
                              "categoryName": "Worklight Parts",
                              "level": 4,
                              "children": [],
                              "productId": 2977
                            }
                          }
                        }
                      },
                      "productId": 2977
                    }
                  }
                },
                "Projecteur longue portée / composants": {
                  "categoryId": null,
                  "categoryName": "Projecteur longue portée / composants",
                  "level": 4,
                  "children": {
                    "Jeu de supports, phare supplémentaire": {
                      "categoryId": 100276,
                      "categoryName": "Spotlight/Parts",
                      "level": 3,
                      "children": {
                        "Projecteur longue portée / composants": {
                          "categoryId": null,
                          "categoryName": "Projecteur longue portée / composants",
                          "level": 6,
                          "children": {
                            "Jeu de supports, phare supplémentaire": {
                              "categoryId": 100443,
                              "categoryName": "Spotlight Parts",
                              "level": 4,
                              "children": [],
                              "productId": 2977
                            }
                          }
                        }
                      },
                      "productId": 2977
                    }
                  }
                }
              },
              "productId": 2977
            },
            "Kit de câbles, projecteur de travail": {
              "categoryId": 100787,
              "categoryName": "Additional Headlight/Parts",
              "level": 2,
              "children": {
                "Projecteur de travail, composants": {
                  "categoryId": null,
                  "categoryName": "Projecteur de travail, composants",
                  "level": 4,
                  "children": {
                    "Kit de câbles, projecteur de travail": {
                      "categoryId": 100280,
                      "categoryName": "Worklight/Parts",
                      "level": 3,
                      "children": {
                        "Projecteur de travail, composants": {
                          "categoryId": null,
                          "categoryName": "Projecteur de travail, composants",
                          "level": 6,
                          "children": {
                            "Kit de câbles, projecteur de travail": {
                              "categoryId": 100445,
                              "categoryName": "Worklight Parts",
                              "level": 4,
                              "children": [],
                              "productId": 728
                            }
                          }
                        }
                      },
                      "productId": 728
                    }
                  }
                }
              },
              "productId": 728
            },
            "Projecteur de travail": {
              "categoryId": 100787,
              "categoryName": "Additional Headlight/Parts",
              "level": 2,
              "children": {
                "Projecteur de travail, composants": {
                  "categoryId": null,
                  "categoryName": "Projecteur de travail, composants",
                  "level": 4,
                  "children": {
                    "Projecteur de travail": {
                      "categoryId": 100280,
                      "categoryName": "Worklight/Parts",
                      "level": 3,
                      "children": {
                        "Projecteur de travail / Optique": {
                          "categoryId": null,
                          "categoryName": "Projecteur de travail / Optique",
                          "level": 6,
                          "children": {
                            "Projecteur de travail": {
                              "categoryId": 100426,
                              "categoryName": "Worklight/Insert",
                              "level": 4,
                              "children": [],
                              "productId": 724
                            }
                          }
                        }
                      },
                      "productId": 724
                    }
                  }
                }
              },
              "productId": 724
            },
            "Réflecteur, projecteur de travail": {
              "categoryId": 100787,
              "categoryName": "Additional Headlight/Parts",
              "level": 2,
              "children": {
                "Projecteur de travail, composants": {
                  "categoryId": null,
                  "categoryName": "Projecteur de travail, composants",
                  "level": 4,
                  "children": {
                    "Réflecteur, projecteur de travail": {
                      "categoryId": 100280,
                      "categoryName": "Worklight/Parts",
                      "level": 3,
                      "children": {
                        "Projecteur de travail, composants": {
                          "categoryId": null,
                          "categoryName": "Projecteur de travail, composants",
                          "level": 6,
                          "children": {
                            "Réflecteur, projecteur de travail": {
                              "categoryId": 100445,
                              "categoryName": "Worklight Parts",
                              "level": 4,
                              "children": [],
                              "productId": 725
                            }
                          }
                        }
                      },
                      "productId": 725
                    }
                  }
                }
              },
              "productId": 725
            },
            "Set de projecteurs de travail": {
              "categoryId": 100787,
              "categoryName": "Additional Headlight/Parts",
              "level": 2,
              "children": {
                "Projecteur de travail, composants": {
                  "categoryId": null,
                  "categoryName": "Projecteur de travail, composants",
                  "level": 4,
                  "children": {
                    "Set de projecteurs de travail": {
                      "categoryId": 100280,
                      "categoryName": "Worklight/Parts",
                      "level": 3,
                      "children": {
                        "Projecteur de travail / Optique": {
                          "categoryId": null,
                          "categoryName": "Projecteur de travail / Optique",
                          "level": 6,
                          "children": {
                            "Set de projecteurs de travail": {
                              "categoryId": 100426,
                              "categoryName": "Worklight/Insert",
                              "level": 4,
                              "children": [],
                              "productId": 86
                            }
                          }
                        }
                      },
                      "productId": 86
                    }
                  }
                }
              },
              "productId": 86
            },
            "Support, phare supplémentaire": {
              "categoryId": 100787,
              "categoryName": "Additional Headlight/Parts",
              "level": 2,
              "children": {
                "Phare chercheur / composants": {
                  "categoryId": null,
                  "categoryName": "Phare chercheur / composants",
                  "level": 4,
                  "children": {
                    "Support, phare supplémentaire": {
                      "categoryId": 100281,
                      "categoryName": "Searchlight/Parts",
                      "level": 3,
                      "children": {
                        "Composants phare chercheur": {
                          "categoryId": null,
                          "categoryName": "Composants phare chercheur",
                          "level": 6,
                          "children": {
                            "Support, phare supplémentaire": {
                              "categoryId": 100446,
                              "categoryName": "Searchlight Parts",
                              "level": 4,
                              "children": [],
                              "productId": 2976
                            }
                          }
                        }
                      },
                      "productId": 2976
                    }
                  }
                },
                "Projecteur antibrouillard/ composants": {
                  "categoryId": null,
                  "categoryName": "Projecteur antibrouillard/ composants",
                  "level": 4,
                  "children": {
                    "Support, phare supplémentaire": {
                      "categoryId": 100277,
                      "categoryName": "Front Fog Light/Parts",
                      "level": 3,
                      "children": {
                        "Composants pour projecteur antibrouillard": {
                          "categoryId": null,
                          "categoryName": "Composants pour projecteur antibrouillard",
                          "level": 6,
                          "children": {
                            "Support, phare supplémentaire": {
                              "categoryId": 100444,
                              "categoryName": "Fog Light Parts",
                              "level": 4,
                              "children": [],
                              "productId": 2976
                            }
                          }
                        }
                      },
                      "productId": 2976
                    }
                  }
                },
                "Projecteur de travail, composants": {
                  "categoryId": null,
                  "categoryName": "Projecteur de travail, composants",
                  "level": 4,
                  "children": {
                    "Support, phare supplémentaire": {
                      "categoryId": 100280,
                      "categoryName": "Worklight/Parts",
                      "level": 3,
                      "children": {
                        "Projecteur de travail, composants": {
                          "categoryId": null,
                          "categoryName": "Projecteur de travail, composants",
                          "level": 6,
                          "children": {
                            "Support, phare supplémentaire": {
                              "categoryId": 100445,
                              "categoryName": "Worklight Parts",
                              "level": 4,
                              "children": [],
                              "productId": 2976
                            }
                          }
                        }
                      },
                      "productId": 2976
                    }
                  }
                },
                "Projecteur longue portée / composants": {
                  "categoryId": null,
                  "categoryName": "Projecteur longue portée / composants",
                  "level": 4,
                  "children": {
                    "Support, phare supplémentaire": {
                      "categoryId": 100276,
                      "categoryName": "Spotlight/Parts",
                      "level": 3,
                      "children": {
                        "Projecteur longue portée / composants": {
                          "categoryId": null,
                          "categoryName": "Projecteur longue portée / composants",
                          "level": 6,
                          "children": {
                            "Support, phare supplémentaire": {
                              "categoryId": 100443,
                              "categoryName": "Spotlight Parts",
                              "level": 4,
                              "children": [],
                              "productId": 2976
                            }
                          }
                        }
                      },
                      "productId": 2976
                    }
                  }
                }
              },
              "productId": 2976
            },
            "Support, projecteur de travail": {
              "categoryId": 100787,
              "categoryName": "Additional Headlight/Parts",
              "level": 2,
              "children": {
                "Projecteur de travail, composants": {
                  "categoryId": null,
                  "categoryName": "Projecteur de travail, composants",
                  "level": 4,
                  "children": {
                    "Support, projecteur de travail": {
                      "categoryId": 100280,
                      "categoryName": "Worklight/Parts",
                      "level": 3,
                      "children": {
                        "Projecteur de travail, composants": {
                          "categoryId": null,
                          "categoryName": "Projecteur de travail, composants",
                          "level": 6,
                          "children": {
                            "Support, projecteur de travail": {
                              "categoryId": 100445,
                              "categoryName": "Worklight Parts",
                              "level": 4,
                              "children": [],
                              "productId": 99
                            }
                          }
                        }
                      },
                      "productId": 99
                    }
                  }
                }
              },
              "productId": 99
            }
          }
        }
      }
    }
  },
  "arborescenceText": "├── Carrosserie [ID: 100001] (Niveau 1)\n│   ├── Fixation/Support/collerette (Niveau 2)\n│   │   └── Racks/Carriers/Frames [ID: 101454] (Niveau 2) → ProductId: 727\n│   └── Phares supplémentaires/composants (Niveau 2)\n│       ├── Additional Headlight/Parts [ID: 101340] (Niveau 2) → ProductId: 104\n│       │   └── Projecteur de travail, composants (Niveau 4)\n│       │       └── Worklight/Parts [ID: 101349] (Niveau 3) → ProductId: 104\n│       │           └── Ampoule, projecteurs de travail (Niveau 6)\n│       │               └── Worklight Bulb [ID: 101351] (Niveau 4) → ProductId: 104\n│       ├── Additional Headlight/Parts [ID: 101340] (Niveau 2) → ProductId: 730\n│       │   └── Projecteur de travail, composants (Niveau 4)\n│       │       └── Worklight/Parts [ID: 101349] (Niveau 3) → ProductId: 730\n│       │           └── Projecteur de travail, composants (Niveau 6)\n│       │               └── Worklight Parts [ID: 101352] (Niveau 4) → ProductId: 730\n│       ├── Additional Headlight/Parts [ID: 101340] (Niveau 2) → ProductId: 1079\n│       │   └── Projecteur de travail, composants (Niveau 4)\n│       │       └── Worklight/Parts [ID: 101349] (Niveau 3) → ProductId: 1079\n│       │           └── Projecteur de travail, composants (Niveau 6)\n│       │               └── Worklight Parts [ID: 101352] (Niveau 4) → ProductId: 1079\n│       ├── Additional Headlight/Parts [ID: 101340] (Niveau 2) → ProductId: 727\n│       │   └── Projecteur de travail, composants (Niveau 4)\n│       │       └── Worklight/Parts [ID: 101349] (Niveau 3) → ProductId: 727\n│       │           └── Projecteur de travail, composants (Niveau 6)\n│       │               └── Worklight Parts [ID: 101352] (Niveau 4) → ProductId: 727\n│       ├── Additional Headlight/Parts [ID: 101340] (Niveau 2) → ProductId: 84\n│       │   └── Projecteur de travail, composants (Niveau 4)\n│       │       └── Worklight/Parts [ID: 101349] (Niveau 3) → ProductId: 84\n│       │           └── Projecteur de travail, composants (Niveau 6)\n│       │               └── Worklight Parts [ID: 101352] (Niveau 4) → ProductId: 84\n│       ├── Additional Headlight/Parts [ID: 101340] (Niveau 2) → ProductId: 487\n│       │   └── Projecteur de travail, composants (Niveau 4)\n│       │       └── Worklight/Parts [ID: 101349] (Niveau 3) → ProductId: 487\n│       │           └── Projecteur de travail, composants (Niveau 6)\n│       │               └── Worklight Parts [ID: 101352] (Niveau 4) → ProductId: 487\n│       ├── Additional Headlight/Parts [ID: 101340] (Niveau 2) → ProductId: 729\n│       │   └── Projecteur de travail, composants (Niveau 4)\n│       │       └── Worklight/Parts [ID: 101349] (Niveau 3) → ProductId: 729\n│       │           └── Projecteur de travail, composants (Niveau 6)\n│       │               └── Worklight Parts [ID: 101352] (Niveau 4) → ProductId: 729\n│       ├── Additional Headlight/Parts [ID: 101340] (Niveau 2) → ProductId: 728\n│       │   └── Projecteur de travail, composants (Niveau 4)\n│       │       └── Worklight/Parts [ID: 101349] (Niveau 3) → ProductId: 728\n│       │           └── Projecteur de travail, composants (Niveau 6)\n│       │               └── Worklight Parts [ID: 101352] (Niveau 4) → ProductId: 728\n│       ├── Additional Headlight/Parts [ID: 101340] (Niveau 2) → ProductId: 724\n│       │   └── Projecteur de travail, composants (Niveau 4)\n│       │       └── Worklight/Parts [ID: 101349] (Niveau 3) → ProductId: 724\n│       │           └── Projecteur de travail / Optique (Niveau 6)\n│       │               └── Worklight/Insert [ID: 101350] (Niveau 4) → ProductId: 724\n│       ├── Additional Headlight/Parts [ID: 101340] (Niveau 2) → ProductId: 725\n│       │   └── Projecteur de travail, composants (Niveau 4)\n│       │       └── Worklight/Parts [ID: 101349] (Niveau 3) → ProductId: 725\n│       │           └── Projecteur de travail, composants (Niveau 6)\n│       │               └── Worklight Parts [ID: 101352] (Niveau 4) → ProductId: 725\n│       ├── Additional Headlight/Parts [ID: 101340] (Niveau 2) → ProductId: 86\n│       │   └── Projecteur de travail, composants (Niveau 4)\n│       │       └── Worklight/Parts [ID: 101349] (Niveau 3) → ProductId: 86\n│       │           └── Projecteur de travail / Optique (Niveau 6)\n│       │               └── Worklight/Insert [ID: 101350] (Niveau 4) → ProductId: 86\n│       └── Additional Headlight/Parts [ID: 101340] (Niveau 2) → ProductId: 99\n│           └── Projecteur de travail, composants (Niveau 4)\n│               └── Worklight/Parts [ID: 101349] (Niveau 3) → ProductId: 99\n│                   └── Projecteur de travail, composants (Niveau 6)\n│                       └── Worklight Parts [ID: 101352] (Niveau 4) → ProductId: 99\n\n└── Système électrique [ID: 100010] (Niveau 1)\n    ├── Kit/pièces de câble (Niveau 2)\n    │   └── Cable Set/individual parts [ID: 103066] (Niveau 2) → ProductId: 728\n    └── Phares supplémentaires/composants (Niveau 2)\n        ├── Additional Headlight/Parts [ID: 100787] (Niveau 2) → ProductId: 104\n        │   └── Projecteur de travail, composants (Niveau 4)\n        │       └── Worklight/Parts [ID: 100280] (Niveau 3) → ProductId: 104\n        │           └── Ampoule, projecteurs de travail (Niveau 6)\n        │               └── Worklight Bulb [ID: 100448] (Niveau 4) → ProductId: 104\n        ├── Additional Headlight/Parts [ID: 100787] (Niveau 2) → ProductId: 730\n        │   └── Projecteur de travail, composants (Niveau 4)\n        │       └── Worklight/Parts [ID: 100280] (Niveau 3) → ProductId: 730\n        │           └── Projecteur de travail, composants (Niveau 6)\n        │               └── Worklight Parts [ID: 100445] (Niveau 4) → ProductId: 730\n        ├── Additional Headlight/Parts [ID: 100787] (Niveau 2) → ProductId: 1079\n        │   └── Projecteur de travail, composants (Niveau 4)\n        │       └── Worklight/Parts [ID: 100280] (Niveau 3) → ProductId: 1079\n        │           └── Projecteur de travail, composants (Niveau 6)\n        │               └── Worklight Parts [ID: 100445] (Niveau 4) → ProductId: 1079\n        ├── Additional Headlight/Parts [ID: 100787] (Niveau 2) → ProductId: 727\n        │   └── Projecteur de travail, composants (Niveau 4)\n        │       └── Worklight/Parts [ID: 100280] (Niveau 3) → ProductId: 727\n        │           └── Projecteur de travail, composants (Niveau 6)\n        │               └── Worklight Parts [ID: 100445] (Niveau 4) → ProductId: 727\n        ├── Additional Headlight/Parts [ID: 100787] (Niveau 2) → ProductId: 84\n        │   └── Projecteur de travail, composants (Niveau 4)\n        │       └── Worklight/Parts [ID: 100280] (Niveau 3) → ProductId: 84\n        │           └── Projecteur de travail, composants (Niveau 6)\n        │               └── Worklight Parts [ID: 100445] (Niveau 4) → ProductId: 84\n        ├── Additional Headlight/Parts [ID: 100787] (Niveau 2) → ProductId: 487\n        │   └── Projecteur de travail, composants (Niveau 4)\n        │       └── Worklight/Parts [ID: 100280] (Niveau 3) → ProductId: 487\n        │           └── Projecteur de travail, composants (Niveau 6)\n        │               └── Worklight Parts [ID: 100445] (Niveau 4) → ProductId: 487\n        ├── Additional Headlight/Parts [ID: 100787] (Niveau 2) → ProductId: 729\n        │   └── Projecteur de travail, composants (Niveau 4)\n        │       └── Worklight/Parts [ID: 100280] (Niveau 3) → ProductId: 729\n        │           └── Projecteur de travail, composants (Niveau 6)\n        │               └── Worklight Parts [ID: 100445] (Niveau 4) → ProductId: 729\n        ├── Additional Headlight/Parts [ID: 100787] (Niveau 2) → ProductId: 2977\n        │   ├── Phare chercheur / composants (Niveau 4)\n        │   │   └── Searchlight/Parts [ID: 100281] (Niveau 3) → ProductId: 2977\n        │   │       └── Composants phare chercheur (Niveau 6)\n        │   │           └── Searchlight Parts [ID: 100446] (Niveau 4) → ProductId: 2977\n        │   ├── Projecteur antibrouillard/ composants (Niveau 4)\n        │   │   └── Front Fog Light/Parts [ID: 100277] (Niveau 3) → ProductId: 2977\n        │   │       └── Composants pour projecteur antibrouillard (Niveau 6)\n        │   │           └── Fog Light Parts [ID: 100444] (Niveau 4) → ProductId: 2977\n        │   ├── Projecteur de travail, composants (Niveau 4)\n        │   │   └── Worklight/Parts [ID: 100280] (Niveau 3) → ProductId: 2977\n        │   │       └── Projecteur de travail, composants (Niveau 6)\n        │   │           └── Worklight Parts [ID: 100445] (Niveau 4) → ProductId: 2977\n        │   └── Projecteur longue portée / composants (Niveau 4)\n        │       └── Spotlight/Parts [ID: 100276] (Niveau 3) → ProductId: 2977\n        │           └── Projecteur longue portée / composants (Niveau 6)\n        │               └── Spotlight Parts [ID: 100443] (Niveau 4) → ProductId: 2977\n        ├── Additional Headlight/Parts [ID: 100787] (Niveau 2) → ProductId: 728\n        │   └── Projecteur de travail, composants (Niveau 4)\n        │       └── Worklight/Parts [ID: 100280] (Niveau 3) → ProductId: 728\n        │           └── Projecteur de travail, composants (Niveau 6)\n        │               └── Worklight Parts [ID: 100445] (Niveau 4) → ProductId: 728\n        ├── Additional Headlight/Parts [ID: 100787] (Niveau 2) → ProductId: 724\n        │   └── Projecteur de travail, composants (Niveau 4)\n        │       └── Worklight/Parts [ID: 100280] (Niveau 3) → ProductId: 724\n        │           └── Projecteur de travail / Optique (Niveau 6)\n        │               └── Worklight/Insert [ID: 100426] (Niveau 4) → ProductId: 724\n        ├── Additional Headlight/Parts [ID: 100787] (Niveau 2) → ProductId: 725\n        │   └── Projecteur de travail, composants (Niveau 4)\n        │       └── Worklight/Parts [ID: 100280] (Niveau 3) → ProductId: 725\n        │           └── Projecteur de travail, composants (Niveau 6)\n        │               └── Worklight Parts [ID: 100445] (Niveau 4) → ProductId: 725\n        ├── Additional Headlight/Parts [ID: 100787] (Niveau 2) → ProductId: 86\n        │   └── Projecteur de travail, composants (Niveau 4)\n        │       └── Worklight/Parts [ID: 100280] (Niveau 3) → ProductId: 86\n        │           └── Projecteur de travail / Optique (Niveau 6)\n        │               └── Worklight/Insert [ID: 100426] (Niveau 4) → ProductId: 86\n        ├── Additional Headlight/Parts [ID: 100787] (Niveau 2) → ProductId: 2976\n        │   ├── Phare chercheur / composants (Niveau 4)\n        │   │   └── Searchlight/Parts [ID: 100281] (Niveau 3) → ProductId: 2976\n        │   │       └── Composants phare chercheur (Niveau 6)\n        │   │           └── Searchlight Parts [ID: 100446] (Niveau 4) → ProductId: 2976\n        │   ├── Projecteur antibrouillard/ composants (Niveau 4)\n        │   │   └── Front Fog Light/Parts [ID: 100277] (Niveau 3) → ProductId: 2976\n        │   │       └── Composants pour projecteur antibrouillard (Niveau 6)\n        │   │           └── Fog Light Parts [ID: 100444] (Niveau 4) → ProductId: 2976\n        │   ├── Projecteur de travail, composants (Niveau 4)\n        │   │   └── Worklight/Parts [ID: 100280] (Niveau 3) → ProductId: 2976\n        │   │       └── Projecteur de travail, composants (Niveau 6)\n        │   │           └── Worklight Parts [ID: 100445] (Niveau 4) → ProductId: 2976\n        │   └── Projecteur longue portée / composants (Niveau 4)\n        │       └── Spotlight/Parts [ID: 100276] (Niveau 3) → ProductId: 2976\n        │           └── Projecteur longue portée / composants (Niveau 6)\n        │               └── Spotlight Parts [ID: 100443] (Niveau 4) → ProductId: 2976\n        └── Additional Headlight/Parts [ID: 100787] (Niveau 2) → ProductId: 99\n            └── Projecteur de travail, composants (Niveau 4)\n                └── Worklight/Parts [ID: 100280] (Niveau 3) → ProductId: 99\n                    └── Projecteur de travail, composants (Niveau 6)\n                        └── Worklight Parts [ID: 100445] (Niveau 4) → ProductId: 99",
  "arborescencePaths": [
    {
      "path": [
        "Carrosserie",
        "Fixation/Support/collerette",
        "Racks/Carriers/Frames"
      ],
      "categoryIds": [
        100001,
        null,
        101454
      ],
      "finalCategoryId": 101454,
      "productId": 727
    },
    {
      "path": [
        "Carrosserie",
        "Phares supplémentaires/composants",
        "Additional Headlight/Parts"
      ],
      "categoryIds": [
        100001,
        null,
        101340
      ],
      "finalCategoryId": 101340,
      "productId": 104
    },
    {
      "path": [
        "Carrosserie",
        "Phares supplémentaires/composants",
        "Additional Headlight/Parts"
      ],
      "categoryIds": [
        100001,
        null,
        101340
      ],
      "finalCategoryId": 101340,
      "productId": 730
    },
    {
      "path": [
        "Carrosserie",
        "Phares supplémentaires/composants",
        "Additional Headlight/Parts"
      ],
      "categoryIds": [
        100001,
        null,
        101340
      ],
      "finalCategoryId": 101340,
      "productId": 1079
    },
    {
      "path": [
        "Carrosserie",
        "Phares supplémentaires/composants",
        "Additional Headlight/Parts"
      ],
      "categoryIds": [
        100001,
        null,
        101340
      ],
      "finalCategoryId": 101340,
      "productId": 727
    },
    {
      "path": [
        "Carrosserie",
        "Phares supplémentaires/composants",
        "Additional Headlight/Parts"
      ],
      "categoryIds": [
        100001,
        null,
        101340
      ],
      "finalCategoryId": 101340,
      "productId": 84
    },
    {
      "path": [
        "Carrosserie",
        "Phares supplémentaires/composants",
        "Additional Headlight/Parts"
      ],
      "categoryIds": [
        100001,
        null,
        101340
      ],
      "finalCategoryId": 101340,
      "productId": 487
    },
    {
      "path": [
        "Carrosserie",
        "Phares supplémentaires/composants",
        "Additional Headlight/Parts"
      ],
      "categoryIds": [
        100001,
        null,
        101340
      ],
      "finalCategoryId": 101340,
      "productId": 729
    },
    {
      "path": [
        "Carrosserie",
        "Phares supplémentaires/composants",
        "Additional Headlight/Parts"
      ],
      "categoryIds": [
        100001,
        null,
        101340
      ],
      "finalCategoryId": 101340,
      "productId": 728
    },
    {
      "path": [
        "Carrosserie",
        "Phares supplémentaires/composants",
        "Additional Headlight/Parts"
      ],
      "categoryIds": [
        100001,
        null,
        101340
      ],
      "finalCategoryId": 101340,
      "productId": 724
    },
    {
      "path": [
        "Carrosserie",
        "Phares supplémentaires/composants",
        "Additional Headlight/Parts"
      ],
      "categoryIds": [
        100001,
        null,
        101340
      ],
      "finalCategoryId": 101340,
      "productId": 725
    },
    {
      "path": [
        "Carrosserie",
        "Phares supplémentaires/composants",
        "Additional Headlight/Parts"
      ],
      "categoryIds": [
        100001,
        null,
        101340
      ],
      "finalCategoryId": 101340,
      "productId": 86
    },
    {
      "path": [
        "Carrosserie",
        "Phares supplémentaires/composants",
        "Additional Headlight/Parts"
      ],
      "categoryIds": [
        100001,
        null,
        101340
      ],
      "finalCategoryId": 101340,
      "productId": 99
    },
    {
      "path": [
        "Système électrique",
        "Kit/pièces de câble",
        "Cable Set/individual parts"
      ],
      "categoryIds": [
        100010,
        null,
        103066
      ],
      "finalCategoryId": 103066,
      "productId": 728
    },
    {
      "path": [
        "Système électrique",
        "Phares supplémentaires/composants",
        "Additional Headlight/Parts"
      ],
      "categoryIds": [
        100010,
        null,
        100787
      ],
      "finalCategoryId": 100787,
      "productId": 104
    },
    {
      "path": [
        "Système électrique",
        "Phares supplémentaires/composants",
        "Additional Headlight/Parts"
      ],
      "categoryIds": [
        100010,
        null,
        100787
      ],
      "finalCategoryId": 100787,
      "productId": 730
    },
    {
      "path": [
        "Système électrique",
        "Phares supplémentaires/composants",
        "Additional Headlight/Parts"
      ],
      "categoryIds": [
        100010,
        null,
        100787
      ],
      "finalCategoryId": 100787,
      "productId": 1079
    },
    {
      "path": [
        "Système électrique",
        "Phares supplémentaires/composants",
        "Additional Headlight/Parts"
      ],
      "categoryIds": [
        100010,
        null,
        100787
      ],
      "finalCategoryId": 100787,
      "productId": 727
    },
    {
      "path": [
        "Système électrique",
        "Phares supplémentaires/composants",
        "Additional Headlight/Parts"
      ],
      "categoryIds": [
        100010,
        null,
        100787
      ],
      "finalCategoryId": 100787,
      "productId": 84
    },
    {
      "path": [
        "Système électrique",
        "Phares supplémentaires/composants",
        "Additional Headlight/Parts"
      ],
      "categoryIds": [
        100010,
        null,
        100787
      ],
      "finalCategoryId": 100787,
      "productId": 487
    },
    {
      "path": [
        "Système électrique",
        "Phares supplémentaires/composants",
        "Additional Headlight/Parts"
      ],
      "categoryIds": [
        100010,
        null,
        100787
      ],
      "finalCategoryId": 100787,
      "productId": 729
    },
    {
      "path": [
        "Système électrique",
        "Phares supplémentaires/composants",
        "Additional Headlight/Parts"
      ],
      "categoryIds": [
        100010,
        null,
        100787
      ],
      "finalCategoryId": 100787,
      "productId": 2977
    },
    {
      "path": [
        "Système électrique",
        "Phares supplémentaires/composants",
        "Additional Headlight/Parts"
      ],
      "categoryIds": [
        100010,
        null,
        100787
      ],
      "finalCategoryId": 100787,
      "productId": 728
    },
    {
      "path": [
        "Système électrique",
        "Phares supplémentaires/composants",
        "Additional Headlight/Parts"
      ],
      "categoryIds": [
        100010,
        null,
        100787
      ],
      "finalCategoryId": 100787,
      "productId": 724
    },
    {
      "path": [
        "Système électrique",
        "Phares supplémentaires/composants",
        "Additional Headlight/Parts"
      ],
      "categoryIds": [
        100010,
        null,
        100787
      ],
      "finalCategoryId": 100787,
      "productId": 725
    },
    {
      "path": [
        "Système électrique",
        "Phares supplémentaires/composants",
        "Additional Headlight/Parts"
      ],
      "categoryIds": [
        100010,
        null,
        100787
      ],
      "finalCategoryId": 100787,
      "productId": 86
    },
    {
      "path": [
        "Système électrique",
        "Phares supplémentaires/composants",
        "Additional Headlight/Parts"
      ],
      "categoryIds": [
        100010,
        null,
        100787
      ],
      "finalCategoryId": 100787,
      "productId": 2976
    },
    {
      "path": [
        "Système électrique",
        "Phares supplémentaires/composants",
        "Additional Headlight/Parts"
      ],
      "categoryIds": [
        100010,
        null,
        100787
      ],
      "finalCategoryId": 100787,
      "productId": 99
    }
  ],
  "productIdsInArbo": [
    84,
    86,
    99,
    104,
    487,
    724,
    725,
    727,
    728,
    729,
    730,
    1079,
    2976,
    2977
  ],
  "matchedProductIds": [
    724
  ]
}