{
  "productName": "Projecteur principal",
  "searchText": "Projecteur principal",
  "found": true,
  "hasMatch": true,
  "timestamp": "2025-12-03T07:04:47.819Z",
  "productId": 259,
  "arborescence": {
    "Carrosserie": {
      "categoryId": 100001,
      "categoryName": "Carrosserie",
      "level": 1,
      "children": {
        "Avant du véhicule": {
          "categoryId": null,
          "categoryName": "Avant du véhicule",
          "level": 2,
          "children": {
            "Ampoule, feu de stationnement/de position": {
              "categoryId": 101648,
              "categoryName": "Vehicle Front",
              "level": 2,
              "children": {
                "Projecteurs principaux / composants": {
                  "categoryId": null,
                  "categoryName": "Projecteurs principaux / composants",
                  "level": 4,
                  "children": {
                    "Ampoule, feu de stationnement/de position": {
                      "categoryId": 101656,
                      "categoryName": "Headlight/Parts",
                      "level": 3,
                      "children": {
                        "Ampoule pour projecteur principal": {
                          "categoryId": null,
                          "categoryName": "Ampoule pour projecteur principal",
                          "level": 6,
                          "children": {
                            "Ampoule, feu de stationnement/de position": {
                              "categoryId": 101658,
                              "categoryName": "Headlight Bulb",
                              "level": 4,
                              "children": [],
                              "productId": 1092
                            }
                          }
                        }
                      },
                      "productId": 1092
                    }
                  }
                }
              },
              "productId": 1092
            },
            "Ampoule, projecteur longue portée": {
              "categoryId": 101648,
              "categoryName": "Vehicle Front",
              "level": 2,
              "children": {
                "Projecteur longue portée / composants": {
                  "categoryId": null,
                  "categoryName": "Projecteur longue portée / composants",
                  "level": 4,
                  "children": {
                    "Ampoule, projecteur longue portée": {
                      "categoryId": 101665,
                      "categoryName": "Spotlight/Parts",
                      "level": 3,
                      "children": {
                        "Ampoule /projecteur longue portée": {
                          "categoryId": null,
                          "categoryName": "Ampoule /projecteur longue portée",
                          "level": 6,
                          "children": {
                            "Ampoule, projecteur longue portée": {
                              "categoryId": 101667,
                              "categoryName": "Spotlight Bulb",
                              "level": 4,
                              "children": [],
                              "productId": 106
                            }
                          }
                        }
                      },
                      "productId": 106
                    }
                  }
                }
              },
              "productId": 106
            },
            "Ampoule, projecteur principal": {
              "categoryId": 101648,
              "categoryName": "Vehicle Front",
              "level": 2,
              "children": {
                "Projecteurs principaux / composants": {
                  "categoryId": null,
                  "categoryName": "Projecteurs principaux / composants",
                  "level": 4,
                  "children": {
                    "Ampoule, projecteur principal": {
                      "categoryId": 101656,
                      "categoryName": "Headlight/Parts",
                      "level": 3,
                      "children": {
                        "Ampoule pour projecteur principal": {
                          "categoryId": null,
                          "categoryName": "Ampoule pour projecteur principal",
                          "level": 6,
                          "children": {
                            "Ampoule, projecteur principal": {
                              "categoryId": 101658,
                              "categoryName": "Headlight Bulb",
                              "level": 4,
                              "children": [],
                              "productId": 107
                            }
                          }
                        }
                      },
                      "productId": 107
                    }
                  }
                }
              },
              "productId": 107
            },
            "Boîtier, projecteur principal": {
              "categoryId": 101648,
              "categoryName": "Vehicle Front",
              "level": 2,
              "children": {
                "Projecteurs principaux / composants": {
                  "categoryId": null,
                  "categoryName": "Projecteurs principaux / composants",
                  "level": 4,
                  "children": {
                    "Boîtier, projecteur principal": {
                      "categoryId": 101656,
                      "categoryName": "Headlight/Parts",
                      "level": 3,
                      "children": {
                        "Composants des projecteurs principaux": {
                          "categoryId": null,
                          "categoryName": "Composants des projecteurs principaux",
                          "level": 6,
                          "children": {
                            "Boîtier, projecteur principal": {
                              "categoryId": 101659,
                              "categoryName": "Headlight Parts",
                              "level": 4,
                              "children": [],
                              "productId": 705
                            }
                          }
                        }
                      },
                      "productId": 705
                    }
                  }
                }
              },
              "productId": 705
            },
            "Bonnette, projecteur principal": {
              "categoryId": 101648,
              "categoryName": "Vehicle Front",
              "level": 2,
              "children": {
                "Projecteurs principaux / composants": {
                  "categoryId": null,
                  "categoryName": "Projecteurs principaux / composants",
                  "level": 4,
                  "children": {
                    "Bonnette, projecteur principal": {
                      "categoryId": 101656,
                      "categoryName": "Headlight/Parts",
                      "level": 3,
                      "children": {
                        "Composants des projecteurs principaux": {
                          "categoryId": null,
                          "categoryName": "Composants des projecteurs principaux",
                          "level": 6,
                          "children": {
                            "Bonnette, projecteur principal": {
                              "categoryId": 101659,
                              "categoryName": "Headlight Parts",
                              "level": 4,
                              "children": [],
                              "productId": 25
                            }
                          }
                        }
                      },
                      "productId": 25
                    }
                  }
                }
              },
              "productId": 25
            },
            "Cadre, projecteur principal": {
              "categoryId": 101648,
              "categoryName": "Vehicle Front",
              "level": 2,
              "children": {
                "Composants/suppléments": {
                  "categoryId": null,
                  "categoryName": "Composants/suppléments",
                  "level": 4,
                  "children": {
                    "Cadre, projecteur principal": {
                      "categoryId": 101673,
                      "categoryName": "Parts",
                      "level": 3,
                      "children": {
                        "Fixation/Support/collerette": {
                          "categoryId": null,
                          "categoryName": "Fixation/Support/collerette",
                          "level": 6,
                          "children": {
                            "Cadre, projecteur principal": {
                              "categoryId": 101773,
                              "categoryName": "Racks/Carriers/Frames",
                              "level": 4,
                              "children": [],
                              "productId": 703
                            }
                          }
                        }
                      },
                      "productId": 703
                    }
                  }
                },
                "Projecteurs principaux / composants": {
                  "categoryId": null,
                  "categoryName": "Projecteurs principaux / composants",
                  "level": 4,
                  "children": {
                    "Cadre, projecteur principal": {
                      "categoryId": 101656,
                      "categoryName": "Headlight/Parts",
                      "level": 3,
                      "children": {
                        "Composants des projecteurs principaux": {
                          "categoryId": null,
                          "categoryName": "Composants des projecteurs principaux",
                          "level": 6,
                          "children": {
                            "Cadre, projecteur principal": {
                              "categoryId": 101659,
                              "categoryName": "Headlight Parts",
                              "level": 4,
                              "children": [],
                              "productId": 703
                            }
                          }
                        }
                      },
                      "productId": 703
                    }
                  }
                }
              },
              "productId": 703
            },
            "Cuvelage, projecteur principal": {
              "categoryId": 101648,
              "categoryName": "Vehicle Front",
              "level": 2,
              "children": {
                "Projecteurs principaux / composants": {
                  "categoryId": null,
                  "categoryName": "Projecteurs principaux / composants",
                  "level": 4,
                  "children": {
                    "Cuvelage, projecteur principal": {
                      "categoryId": 101656,
                      "categoryName": "Headlight/Parts",
                      "level": 3,
                      "children": {
                        "Composants des projecteurs principaux": {
                          "categoryId": null,
                          "categoryName": "Composants des projecteurs principaux",
                          "level": 6,
                          "children": {
                            "Cuvelage, projecteur principal": {
                              "categoryId": 101659,
                              "categoryName": "Headlight Parts",
                              "level": 4,
                              "children": [],
                              "productId": 101
                            }
                          }
                        }
                      },
                      "productId": 101
                    }
                  }
                }
              },
              "productId": 101
            },
            "Disperseur, projecteur principal": {
              "categoryId": 101648,
              "categoryName": "Vehicle Front",
              "level": 2,
              "children": {
                "Projecteurs principaux / composants": {
                  "categoryId": null,
                  "categoryName": "Projecteurs principaux / composants",
                  "level": 4,
                  "children": {
                    "Disperseur, projecteur principal": {
                      "categoryId": 101656,
                      "categoryName": "Headlight/Parts",
                      "level": 3,
                      "children": {
                        "Composants des projecteurs principaux": {
                          "categoryId": null,
                          "categoryName": "Composants des projecteurs principaux",
                          "level": 6,
                          "children": {
                            "Disperseur, projecteur principal": {
                              "categoryId": 101659,
                              "categoryName": "Headlight Parts",
                              "level": 4,
                              "children": [],
                              "productId": 3499
                            }
                          }
                        }
                      },
                      "productId": 3499
                    }
                  }
                }
              },
              "productId": 3499
            },
            "Douille de lampe, projecteur principal": {
              "categoryId": 101648,
              "categoryName": "Vehicle Front",
              "level": 2,
              "children": {
                "Projecteurs principaux / composants": {
                  "categoryId": null,
                  "categoryName": "Projecteurs principaux / composants",
                  "level": 4,
                  "children": {
                    "Douille de lampe, projecteur principal": {
                      "categoryId": 101656,
                      "categoryName": "Headlight/Parts",
                      "level": 3,
                      "children": {
                        "Composants des projecteurs principaux": {
                          "categoryId": null,
                          "categoryName": "Composants des projecteurs principaux",
                          "level": 6,
                          "children": {
                            "Douille de lampe, projecteur principal": {
                              "categoryId": 101659,
                              "categoryName": "Headlight Parts",
                              "level": 4,
                              "children": [],
                              "productId": 489
                            }
                          }
                        }
                      },
                      "productId": 489
                    }
                  }
                }
              },
              "productId": 489
            },
            "Enjoliveur, projecteur principal": {
              "categoryId": 101648,
              "categoryName": "Vehicle Front",
              "level": 2,
              "children": {
                "Composants/suppléments": {
                  "categoryId": null,
                  "categoryName": "Composants/suppléments",
                  "level": 4,
                  "children": {
                    "Enjoliveur, projecteur principal": {
                      "categoryId": 101673,
                      "categoryName": "Parts",
                      "level": 3,
                      "children": {
                        "Fixation/Support/collerette": {
                          "categoryId": null,
                          "categoryName": "Fixation/Support/collerette",
                          "level": 6,
                          "children": {
                            "Enjoliveur, projecteur principal": {
                              "categoryId": 101773,
                              "categoryName": "Racks/Carriers/Frames",
                              "level": 4,
                              "children": [],
                              "productId": 60
                            }
                          }
                        }
                      },
                      "productId": 60
                    }
                  }
                },
                "Projecteurs principaux / composants": {
                  "categoryId": null,
                  "categoryName": "Projecteurs principaux / composants",
                  "level": 4,
                  "children": {
                    "Enjoliveur, projecteur principal": {
                      "categoryId": 101656,
                      "categoryName": "Headlight/Parts",
                      "level": 3,
                      "children": {
                        "Composants des projecteurs principaux": {
                          "categoryId": null,
                          "categoryName": "Composants des projecteurs principaux",
                          "level": 6,
                          "children": {
                            "Enjoliveur, projecteur principal": {
                              "categoryId": 101659,
                              "categoryName": "Headlight Parts",
                              "level": 4,
                              "children": [],
                              "productId": 60
                            }
                          }
                        }
                      },
                      "productId": 60
                    }
                  }
                }
              },
              "productId": 60
            },
            "Fixation de phare, éclairage": {
              "categoryId": 101648,
              "categoryName": "Vehicle Front",
              "level": 2,
              "children": {
                "Composants/suppléments": {
                  "categoryId": null,
                  "categoryName": "Composants/suppléments",
                  "level": 4,
                  "children": {
                    "Fixation de phare, éclairage": {
                      "categoryId": 101673,
                      "categoryName": "Parts",
                      "level": 3,
                      "children": {
                        "Fixation/Support/collerette": {
                          "categoryId": null,
                          "categoryName": "Fixation/Support/collerette",
                          "level": 6,
                          "children": {
                            "Fixation de phare, éclairage": {
                              "categoryId": 101773,
                              "categoryName": "Racks/Carriers/Frames",
                              "level": 4,
                              "children": [],
                              "productId": 2089
                            }
                          }
                        }
                      },
                      "productId": 2089
                    }
                  }
                },
                "Projecteurs principaux / composants": {
                  "categoryId": null,
                  "categoryName": "Projecteurs principaux / composants",
                  "level": 4,
                  "children": {
                    "Fixation de phare, éclairage": {
                      "categoryId": 101656,
                      "categoryName": "Headlight/Parts",
                      "level": 3,
                      "children": {
                        "Composants des projecteurs principaux": {
                          "categoryId": null,
                          "categoryName": "Composants des projecteurs principaux",
                          "level": 6,
                          "children": {
                            "Fixation de phare, éclairage": {
                              "categoryId": 101659,
                              "categoryName": "Headlight Parts",
                              "level": 4,
                              "children": [],
                              "productId": 2089
                            }
                          }
                        }
                      },
                      "productId": 2089
                    }
                  }
                }
              },
              "productId": 2089
            },
            "Jeu de câbles, projecteur principal": {
              "categoryId": 101648,
              "categoryName": "Vehicle Front",
              "level": 2,
              "children": {
                "Projecteurs principaux / composants": {
                  "categoryId": null,
                  "categoryName": "Projecteurs principaux / composants",
                  "level": 4,
                  "children": {
                    "Jeu de câbles, projecteur principal": {
                      "categoryId": 101656,
                      "categoryName": "Headlight/Parts",
                      "level": 3,
                      "children": {
                        "Composants des projecteurs principaux": {
                          "categoryId": null,
                          "categoryName": "Composants des projecteurs principaux",
                          "level": 6,
                          "children": {
                            "Jeu de câbles, projecteur principal": {
                              "categoryId": 101659,
                              "categoryName": "Headlight Parts",
                              "level": 4,
                              "children": [],
                              "productId": 704
                            }
                          }
                        }
                      },
                      "productId": 704
                    }
                  }
                }
              },
              "productId": 704
            },
            "Joint d'étanchéité, projecteur principal": {
              "categoryId": 101648,
              "categoryName": "Vehicle Front",
              "level": 2,
              "children": {
                "Projecteurs principaux / composants": {
                  "categoryId": null,
                  "categoryName": "Projecteurs principaux / composants",
                  "level": 4,
                  "children": {
                    "Joint d'étanchéité, projecteur principal": {
                      "categoryId": 101656,
                      "categoryName": "Headlight/Parts",
                      "level": 3,
                      "children": {
                        "Composants des projecteurs principaux": {
                          "categoryId": null,
                          "categoryName": "Composants des projecteurs principaux",
                          "level": 6,
                          "children": {
                            "Joint d'étanchéité, projecteur principal": {
                              "categoryId": 101659,
                              "categoryName": "Headlight Parts",
                              "level": 4,
                              "children": [],
                              "productId": 1099
                            }
                          }
                        }
                      },
                      "productId": 1099
                    }
                  }
                }
              },
              "productId": 1099
            },
            "Joint, bonnette projecteur principal": {
              "categoryId": 101648,
              "categoryName": "Vehicle Front",
              "level": 2,
              "children": {
                "Projecteurs principaux / composants": {
                  "categoryId": null,
                  "categoryName": "Projecteurs principaux / composants",
                  "level": 4,
                  "children": {
                    "Joint, bonnette projecteur principal": {
                      "categoryId": 101656,
                      "categoryName": "Headlight/Parts",
                      "level": 3,
                      "children": {
                        "Composants des projecteurs principaux": {
                          "categoryId": null,
                          "categoryName": "Composants des projecteurs principaux",
                          "level": 6,
                          "children": {
                            "Joint, bonnette projecteur principal": {
                              "categoryId": 101659,
                              "categoryName": "Headlight Parts",
                              "level": 4,
                              "children": [],
                              "productId": 4264
                            }
                          }
                        }
                      },
                      "productId": 4264
                    }
                  }
                }
              },
              "productId": 4264
            },
            "Joint, enjoliveur du projecteur principal": {
              "categoryId": 101648,
              "categoryName": "Vehicle Front",
              "level": 2,
              "children": {
                "Projecteurs principaux / composants": {
                  "categoryId": null,
                  "categoryName": "Projecteurs principaux / composants",
                  "level": 4,
                  "children": {
                    "Joint, enjoliveur du projecteur principal": {
                      "categoryId": 101656,
                      "categoryName": "Headlight/Parts",
                      "level": 3,
                      "children": {
                        "Composants des projecteurs principaux": {
                          "categoryId": null,
                          "categoryName": "Composants des projecteurs principaux",
                          "level": 6,
                          "children": {
                            "Joint, enjoliveur du projecteur principal": {
                              "categoryId": 101659,
                              "categoryName": "Headlight Parts",
                              "level": 4,
                              "children": [],
                              "productId": 2206
                            }
                          }
                        }
                      },
                      "productId": 2206
                    }
                  }
                }
              },
              "productId": 2206
            },
            "Kit de cache-projecteurs": {
              "categoryId": 101648,
              "categoryName": "Vehicle Front",
              "level": 2,
              "children": {
                "Projecteurs principaux / composants": {
                  "categoryId": null,
                  "categoryName": "Projecteurs principaux / composants",
                  "level": 4,
                  "children": {
                    "Kit de cache-projecteurs": {
                      "categoryId": 101656,
                      "categoryName": "Headlight/Parts",
                      "level": 3,
                      "children": {
                        "Projecteurs principaux / à insérer": {
                          "categoryId": null,
                          "categoryName": "Projecteurs principaux / à insérer",
                          "level": 6,
                          "children": {
                            "Kit de cache-projecteurs": {
                              "categoryId": 101657,
                              "categoryName": "Headlight/Insert",
                              "level": 4,
                              "children": [],
                              "productId": 4075
                            }
                          }
                        }
                      },
                      "productId": 4075
                    }
                  }
                }
              },
              "productId": 4075
            },
            "Kit de projecteurs principaux": {
              "categoryId": 101648,
              "categoryName": "Vehicle Front",
              "level": 2,
              "children": {
                "Projecteurs principaux / composants": {
                  "categoryId": null,
                  "categoryName": "Projecteurs principaux / composants",
                  "level": 4,
                  "children": {
                    "Kit de projecteurs principaux": {
                      "categoryId": 101656,
                      "categoryName": "Headlight/Parts",
                      "level": 3,
                      "children": {
                        "Projecteurs principaux / à insérer": {
                          "categoryId": null,
                          "categoryName": "Projecteurs principaux / à insérer",
                          "level": 6,
                          "children": {
                            "Kit de projecteurs principaux": {
                              "categoryId": 101657,
                              "categoryName": "Headlight/Insert",
                              "level": 4,
                              "children": [],
                              "productId": 3175
                            }
                          }
                        }
                      },
                      "productId": 3175
                    }
                  }
                }
              },
              "productId": 3175
            },
            "Optique, projecteur principal": {
              "categoryId": 101648,
              "categoryName": "Vehicle Front",
              "level": 2,
              "children": {
                "Projecteurs principaux / composants": {
                  "categoryId": null,
                  "categoryName": "Projecteurs principaux / composants",
                  "level": 4,
                  "children": {
                    "Optique, projecteur principal": {
                      "categoryId": 101656,
                      "categoryName": "Headlight/Parts",
                      "level": 3,
                      "children": {
                        "Projecteurs principaux / à insérer": {
                          "categoryId": null,
                          "categoryName": "Projecteurs principaux / à insérer",
                          "level": 6,
                          "children": {
                            "Optique, projecteur principal": {
                              "categoryId": 101657,
                              "categoryName": "Headlight/Insert",
                              "level": 4,
                              "children": [],
                              "productId": 88
                            }
                          }
                        }
                      },
                      "productId": 88
                    }
                  }
                }
              },
              "productId": 88
            },
            "Projecteur principal": {
              "categoryId": 101648,
              "categoryName": "Vehicle Front",
              "level": 2,
              "children": {
                "Projecteurs principaux / composants": {
                  "categoryId": null,
                  "categoryName": "Projecteurs principaux / composants",
                  "level": 4,
                  "children": {
                    "Projecteur principal": {
                      "categoryId": 101656,
                      "categoryName": "Headlight/Parts",
                      "level": 3,
                      "children": {
                        "Projecteurs principaux / à insérer": {
                          "categoryId": null,
                          "categoryName": "Projecteurs principaux / à insérer",
                          "level": 6,
                          "children": {
                            "Projecteur principal": {
                              "categoryId": 101657,
                              "categoryName": "Headlight/Insert",
                              "level": 4,
                              "children": [],
                              "productId": 259
                            }
                          }
                        }
                      },
                      "productId": 259
                    }
                  }
                }
              },
              "productId": 259
            },
            "Réflecteur, projecteur principal": {
              "categoryId": 101648,
              "categoryName": "Vehicle Front",
              "level": 2,
              "children": {
                "Projecteurs principaux / composants": {
                  "categoryId": null,
                  "categoryName": "Projecteurs principaux / composants",
                  "level": 4,
                  "children": {
                    "Réflecteur, projecteur principal": {
                      "categoryId": 101656,
                      "categoryName": "Headlight/Parts",
                      "level": 3,
                      "children": {
                        "Composants des projecteurs principaux": {
                          "categoryId": null,
                          "categoryName": "Composants des projecteurs principaux",
                          "level": 6,
                          "children": {
                            "Réflecteur, projecteur principal": {
                              "categoryId": 101659,
                              "categoryName": "Headlight Parts",
                              "level": 4,
                              "children": [],
                              "productId": 702
                            }
                          }
                        }
                      },
                      "productId": 702
                    }
                  }
                }
              },
              "productId": 702
            }
          }
        },
        "Fixation/Support/collerette": {
          "categoryId": null,
          "categoryName": "Fixation/Support/collerette",
          "level": 2,
          "children": {
            "Cadre, projecteur principal": {
              "categoryId": 101454,
              "categoryName": "Racks/Carriers/Frames",
              "level": 2,
              "children": [],
              "productId": 703
            },
            "Enjoliveur, projecteur principal": {
              "categoryId": 101454,
              "categoryName": "Racks/Carriers/Frames",
              "level": 2,
              "children": [],
              "productId": 60
            },
            "Fixation de phare, éclairage": {
              "categoryId": 101454,
              "categoryName": "Racks/Carriers/Frames",
              "level": 2,
              "children": [],
              "productId": 2089
            }
          }
        },
        "Phares supplémentaires/composants": {
          "categoryId": null,
          "categoryName": "Phares supplémentaires/composants",
          "level": 2,
          "children": {
            "Ampoule, projecteur longue portée": {
              "categoryId": 101340,
              "categoryName": "Additional Headlight/Parts",
              "level": 2,
              "children": {
                "Projecteur longue portée / composants": {
                  "categoryId": null,
                  "categoryName": "Projecteur longue portée / composants",
                  "level": 4,
                  "children": {
                    "Ampoule, projecteur longue portée": {
                      "categoryId": 101345,
                      "categoryName": "Spotlight/Parts",
                      "level": 3,
                      "children": {
                        "Ampoule /projecteur longue portée": {
                          "categoryId": null,
                          "categoryName": "Ampoule /projecteur longue portée",
                          "level": 6,
                          "children": {
                            "Ampoule, projecteur longue portée": {
                              "categoryId": 101347,
                              "categoryName": "Spotlight Bulb",
                              "level": 4,
                              "children": [],
                              "productId": 106
                            }
                          }
                        }
                      },
                      "productId": 106
                    }
                  }
                }
              },
              "productId": 106
            }
          }
        },
        "Projecteurs principaux / composants": {
          "categoryId": null,
          "categoryName": "Projecteurs principaux / composants",
          "level": 2,
          "children": {
            "Ampoule, feu de stationnement/de position": {
              "categoryId": 101465,
              "categoryName": "Headlight/Parts",
              "level": 2,
              "children": {
                "Ampoule pour projecteur principal": {
                  "categoryId": null,
                  "categoryName": "Ampoule pour projecteur principal",
                  "level": 4,
                  "children": {
                    "Ampoule, feu de stationnement/de position": {
                      "categoryId": 101467,
                      "categoryName": "Headlight Bulb",
                      "level": 3,
                      "children": [],
                      "productId": 1092
                    }
                  }
                }
              },
              "productId": 1092
            },
            "Ampoule, projecteur principal": {
              "categoryId": 101465,
              "categoryName": "Headlight/Parts",
              "level": 2,
              "children": {
                "Ampoule pour projecteur principal": {
                  "categoryId": null,
                  "categoryName": "Ampoule pour projecteur principal",
                  "level": 4,
                  "children": {
                    "Ampoule, projecteur principal": {
                      "categoryId": 101467,
                      "categoryName": "Headlight Bulb",
                      "level": 3,
                      "children": [],
                      "productId": 107
                    }
                  }
                }
              },
              "productId": 107
            },
            "Boîtier, projecteur principal": {
              "categoryId": 101465,
              "categoryName": "Headlight/Parts",
              "level": 2,
              "children": {
                "Composants des projecteurs principaux": {
                  "categoryId": null,
                  "categoryName": "Composants des projecteurs principaux",
                  "level": 4,
                  "children": {
                    "Boîtier, projecteur principal": {
                      "categoryId": 101468,
                      "categoryName": "Headlight Parts",
                      "level": 3,
                      "children": [],
                      "productId": 705
                    }
                  }
                }
              },
              "productId": 705
            },
            "Bonnette, projecteur principal": {
              "categoryId": 101465,
              "categoryName": "Headlight/Parts",
              "level": 2,
              "children": {
                "Composants des projecteurs principaux": {
                  "categoryId": null,
                  "categoryName": "Composants des projecteurs principaux",
                  "level": 4,
                  "children": {
                    "Bonnette, projecteur principal": {
                      "categoryId": 101468,
                      "categoryName": "Headlight Parts",
                      "level": 3,
                      "children": [],
                      "productId": 25
                    }
                  }
                }
              },
              "productId": 25
            },
            "Cadre, projecteur principal": {
              "categoryId": 101465,
              "categoryName": "Headlight/Parts",
              "level": 2,
              "children": {
                "Composants des projecteurs principaux": {
                  "categoryId": null,
                  "categoryName": "Composants des projecteurs principaux",
                  "level": 4,
                  "children": {
                    "Cadre, projecteur principal": {
                      "categoryId": 101468,
                      "categoryName": "Headlight Parts",
                      "level": 3,
                      "children": [],
                      "productId": 703
                    }
                  }
                }
              },
              "productId": 703
            },
            "Cuvelage, projecteur principal": {
              "categoryId": 101465,
              "categoryName": "Headlight/Parts",
              "level": 2,
              "children": {
                "Composants des projecteurs principaux": {
                  "categoryId": null,
                  "categoryName": "Composants des projecteurs principaux",
                  "level": 4,
                  "children": {
                    "Cuvelage, projecteur principal": {
                      "categoryId": 101468,
                      "categoryName": "Headlight Parts",
                      "level": 3,
                      "children": [],
                      "productId": 101
                    }
                  }
                }
              },
              "productId": 101
            },
            "Disperseur, projecteur principal": {
              "categoryId": 101465,
              "categoryName": "Headlight/Parts",
              "level": 2,
              "children": {
                "Composants des projecteurs principaux": {
                  "categoryId": null,
                  "categoryName": "Composants des projecteurs principaux",
                  "level": 4,
                  "children": {
                    "Disperseur, projecteur principal": {
                      "categoryId": 101468,
                      "categoryName": "Headlight Parts",
                      "level": 3,
                      "children": [],
                      "productId": 3499
                    }
                  }
                }
              },
              "productId": 3499
            },
            "Douille de lampe, projecteur principal": {
              "categoryId": 101465,
              "categoryName": "Headlight/Parts",
              "level": 2,
              "children": {
                "Composants des projecteurs principaux": {
                  "categoryId": null,
                  "categoryName": "Composants des projecteurs principaux",
                  "level": 4,
                  "children": {
                    "Douille de lampe, projecteur principal": {
                      "categoryId": 101468,
                      "categoryName": "Headlight Parts",
                      "level": 3,
                      "children": [],
                      "productId": 489
                    }
                  }
                }
              },
              "productId": 489
            },
            "Enjoliveur, projecteur principal": {
              "categoryId": 101465,
              "categoryName": "Headlight/Parts",
              "level": 2,
              "children": {
                "Composants des projecteurs principaux": {
                  "categoryId": null,
                  "categoryName": "Composants des projecteurs principaux",
                  "level": 4,
                  "children": {
                    "Enjoliveur, projecteur principal": {
                      "categoryId": 101468,
                      "categoryName": "Headlight Parts",
                      "level": 3,
                      "children": [],
                      "productId": 60
                    }
                  }
                }
              },
              "productId": 60
            },
            "Fixation de phare, éclairage": {
              "categoryId": 101465,
              "categoryName": "Headlight/Parts",
              "level": 2,
              "children": {
                "Composants des projecteurs principaux": {
                  "categoryId": null,
                  "categoryName": "Composants des projecteurs principaux",
                  "level": 4,
                  "children": {
                    "Fixation de phare, éclairage": {
                      "categoryId": 101468,
                      "categoryName": "Headlight Parts",
                      "level": 3,
                      "children": [],
                      "productId": 2089
                    }
                  }
                }
              },
              "productId": 2089
            },
            "Jeu de câbles, projecteur principal": {
              "categoryId": 101465,
              "categoryName": "Headlight/Parts",
              "level": 2,
              "children": {
                "Composants des projecteurs principaux": {
                  "categoryId": null,
                  "categoryName": "Composants des projecteurs principaux",
                  "level": 4,
                  "children": {
                    "Jeu de câbles, projecteur principal": {
                      "categoryId": 101468,
                      "categoryName": "Headlight Parts",
                      "level": 3,
                      "children": [],
                      "productId": 704
                    }
                  }
                }
              },
              "productId": 704
            },
            "Joint d'étanchéité, projecteur principal": {
              "categoryId": 101465,
              "categoryName": "Headlight/Parts",
              "level": 2,
              "children": {
                "Composants des projecteurs principaux": {
                  "categoryId": null,
                  "categoryName": "Composants des projecteurs principaux",
                  "level": 4,
                  "children": {
                    "Joint d'étanchéité, projecteur principal": {
                      "categoryId": 101468,
                      "categoryName": "Headlight Parts",
                      "level": 3,
                      "children": [],
                      "productId": 1099
                    }
                  }
                }
              },
              "productId": 1099
            },
            "Joint, bonnette projecteur principal": {
              "categoryId": 101465,
              "categoryName": "Headlight/Parts",
              "level": 2,
              "children": {
                "Composants des projecteurs principaux": {
                  "categoryId": null,
                  "categoryName": "Composants des projecteurs principaux",
                  "level": 4,
                  "children": {
                    "Joint, bonnette projecteur principal": {
                      "categoryId": 101468,
                      "categoryName": "Headlight Parts",
                      "level": 3,
                      "children": [],
                      "productId": 4264
                    }
                  }
                }
              },
              "productId": 4264
            },
            "Joint, enjoliveur du projecteur principal": {
              "categoryId": 101465,
              "categoryName": "Headlight/Parts",
              "level": 2,
              "children": {
                "Composants des projecteurs principaux": {
                  "categoryId": null,
                  "categoryName": "Composants des projecteurs principaux",
                  "level": 4,
                  "children": {
                    "Joint, enjoliveur du projecteur principal": {
                      "categoryId": 101468,
                      "categoryName": "Headlight Parts",
                      "level": 3,
                      "children": [],
                      "productId": 2206
                    }
                  }
                }
              },
              "productId": 2206
            },
            "Kit de cache-projecteurs": {
              "categoryId": 101465,
              "categoryName": "Headlight/Parts",
              "level": 2,
              "children": {
                "Projecteurs principaux / à insérer": {
                  "categoryId": null,
                  "categoryName": "Projecteurs principaux / à insérer",
                  "level": 4,
                  "children": {
                    "Kit de cache-projecteurs": {
                      "categoryId": 101466,
                      "categoryName": "Headlight/Insert",
                      "level": 3,
                      "children": [],
                      "productId": 4075
                    }
                  }
                }
              },
              "productId": 4075
            },
            "Kit de projecteurs principaux": {
              "categoryId": 101465,
              "categoryName": "Headlight/Parts",
              "level": 2,
              "children": {
                "Projecteurs principaux / à insérer": {
                  "categoryId": null,
                  "categoryName": "Projecteurs principaux / à insérer",
                  "level": 4,
                  "children": {
                    "Kit de projecteurs principaux": {
                      "categoryId": 101466,
                      "categoryName": "Headlight/Insert",
                      "level": 3,
                      "children": [],
                      "productId": 3175
                    }
                  }
                }
              },
              "productId": 3175
            },
            "Optique, projecteur principal": {
              "categoryId": 101465,
              "categoryName": "Headlight/Parts",
              "level": 2,
              "children": {
                "Projecteurs principaux / à insérer": {
                  "categoryId": null,
                  "categoryName": "Projecteurs principaux / à insérer",
                  "level": 4,
                  "children": {
                    "Optique, projecteur principal": {
                      "categoryId": 101466,
                      "categoryName": "Headlight/Insert",
                      "level": 3,
                      "children": [],
                      "productId": 88
                    }
                  }
                }
              },
              "productId": 88
            },
            "Projecteur principal": {
              "categoryId": 101465,
              "categoryName": "Headlight/Parts",
              "level": 2,
              "children": {
                "Projecteurs principaux / à insérer": {
                  "categoryId": null,
                  "categoryName": "Projecteurs principaux / à insérer",
                  "level": 4,
                  "children": {
                    "Projecteur principal": {
                      "categoryId": 101466,
                      "categoryName": "Headlight/Insert",
                      "level": 3,
                      "children": [],
                      "productId": 259
                    }
                  }
                }
              },
              "productId": 259
            },
            "Réflecteur, projecteur principal": {
              "categoryId": 101465,
              "categoryName": "Headlight/Parts",
              "level": 2,
              "children": {
                "Composants des projecteurs principaux": {
                  "categoryId": null,
                  "categoryName": "Composants des projecteurs principaux",
                  "level": 4,
                  "children": {
                    "Réflecteur, projecteur principal": {
                      "categoryId": 101468,
                      "categoryName": "Headlight Parts",
                      "level": 3,
                      "children": [],
                      "productId": 702
                    }
                  }
                }
              },
              "productId": 702
            }
          }
        }
      }
    },
    "Système électrique": {
      "categoryId": 100010,
      "categoryName": "Système électrique",
      "level": 1,
      "children": {
        "Kit/pièces de câble": {
          "categoryId": null,
          "categoryName": "Kit/pièces de câble",
          "level": 2,
          "children": {
            "Jeu de câbles, projecteur principal": {
              "categoryId": 103066,
              "categoryName": "Cable Set/individual parts",
              "level": 2,
              "children": [],
              "productId": 704
            }
          }
        },
        "Phares supplémentaires/composants": {
          "categoryId": null,
          "categoryName": "Phares supplémentaires/composants",
          "level": 2,
          "children": {
            "Ampoule, projecteur longue portée": {
              "categoryId": 100787,
              "categoryName": "Additional Headlight/Parts",
              "level": 2,
              "children": {
                "Projecteur longue portée / composants": {
                  "categoryId": null,
                  "categoryName": "Projecteur longue portée / composants",
                  "level": 4,
                  "children": {
                    "Ampoule, projecteur longue portée": {
                      "categoryId": 100276,
                      "categoryName": "Spotlight/Parts",
                      "level": 3,
                      "children": {
                        "Ampoule /projecteur longue portée": {
                          "categoryId": null,
                          "categoryName": "Ampoule /projecteur longue portée",
                          "level": 6,
                          "children": {
                            "Ampoule, projecteur longue portée": {
                              "categoryId": 100442,
                              "categoryName": "Spotlight Bulb",
                              "level": 4,
                              "children": [],
                              "productId": 106
                            }
                          }
                        }
                      },
                      "productId": 106
                    }
                  }
                }
              },
              "productId": 106
            }
          }
        },
        "Projecteurs principaux / composants": {
          "categoryId": null,
          "categoryName": "Projecteurs principaux / composants",
          "level": 2,
          "children": {
            "Ampoule, feu de stationnement/de position": {
              "categoryId": 100143,
              "categoryName": "Headlight/Parts",
              "level": 2,
              "children": {
                "Ampoule pour projecteur principal": {
                  "categoryId": null,
                  "categoryName": "Ampoule pour projecteur principal",
                  "level": 4,
                  "children": {
                    "Ampoule, feu de stationnement/de position": {
                      "categoryId": 100427,
                      "categoryName": "Headlight Bulb",
                      "level": 3,
                      "children": [],
                      "productId": 1092
                    }
                  }
                }
              },
              "productId": 1092
            },
            "Ampoule, projecteur longue portée": {
              "categoryId": 100143,
              "categoryName": "Headlight/Parts",
              "level": 2,
              "children": {
                "Ampoule /projecteur longue portée": {
                  "categoryId": null,
                  "categoryName": "Ampoule /projecteur longue portée",
                  "level": 4,
                  "children": {
                    "Ampoule, projecteur longue portée": {
                      "categoryId": 706742,
                      "categoryName": "Spotlight Bulb",
                      "level": 3,
                      "children": [],
                      "productId": 106
                    }
                  }
                }
              },
              "productId": 106
            },
            "Ampoule, projecteur principal": {
              "categoryId": 100143,
              "categoryName": "Headlight/Parts",
              "level": 2,
              "children": {
                "Ampoule pour projecteur principal": {
                  "categoryId": null,
                  "categoryName": "Ampoule pour projecteur principal",
                  "level": 4,
                  "children": {
                    "Ampoule, projecteur principal": {
                      "categoryId": 100427,
                      "categoryName": "Headlight Bulb",
                      "level": 3,
                      "children": [],
                      "productId": 107
                    }
                  }
                }
              },
              "productId": 107
            },
            "Appareil de commande, phare principal": {
              "categoryId": 100143,
              "categoryName": "Headlight/Parts",
              "level": 2,
              "children": {
                "Module/composants du phare principal": {
                  "categoryId": null,
                  "categoryName": "Module/composants du phare principal",
                  "level": 4,
                  "children": {
                    "Appareil de commande, phare principal": {
                      "categoryId": 706161,
                      "categoryName": "Headlight Module/Individual Parts",
                      "level": 3,
                      "children": [],
                      "productId": 8414
                    }
                  }
                }
              },
              "productId": 8414
            },
            "Boîtier, projecteur principal": {
              "categoryId": 100143,
              "categoryName": "Headlight/Parts",
              "level": 2,
              "children": {
                "Composants des projecteurs principaux": {
                  "categoryId": null,
                  "categoryName": "Composants des projecteurs principaux",
                  "level": 4,
                  "children": {
                    "Boîtier, projecteur principal": {
                      "categoryId": 100430,
                      "categoryName": "Headlight Parts",
                      "level": 3,
                      "children": [],
                      "productId": 705
                    }
                  }
                }
              },
              "productId": 705
            },
            "Bonnette, projecteur principal": {
              "categoryId": 100143,
              "categoryName": "Headlight/Parts",
              "level": 2,
              "children": {
                "Composants des projecteurs principaux": {
                  "categoryId": null,
                  "categoryName": "Composants des projecteurs principaux",
                  "level": 4,
                  "children": {
                    "Bonnette, projecteur principal": {
                      "categoryId": 100430,
                      "categoryName": "Headlight Parts",
                      "level": 3,
                      "children": [],
                      "productId": 25
                    }
                  }
                }
              },
              "productId": 25
            },
            "Cadre, projecteur principal": {
              "categoryId": 100143,
              "categoryName": "Headlight/Parts",
              "level": 2,
              "children": {
                "Composants des projecteurs principaux": {
                  "categoryId": null,
                  "categoryName": "Composants des projecteurs principaux",
                  "level": 4,
                  "children": {
                    "Cadre, projecteur principal": {
                      "categoryId": 100430,
                      "categoryName": "Headlight Parts",
                      "level": 3,
                      "children": [],
                      "productId": 703
                    }
                  }
                }
              },
              "productId": 703
            },
            "Cuvelage, projecteur principal": {
              "categoryId": 100143,
              "categoryName": "Headlight/Parts",
              "level": 2,
              "children": {
                "Composants des projecteurs principaux": {
                  "categoryId": null,
                  "categoryName": "Composants des projecteurs principaux",
                  "level": 4,
                  "children": {
                    "Cuvelage, projecteur principal": {
                      "categoryId": 100430,
                      "categoryName": "Headlight Parts",
                      "level": 3,
                      "children": [],
                      "productId": 101
                    }
                  }
                }
              },
              "productId": 101
            },
            "Disperseur, projecteur principal": {
              "categoryId": 100143,
              "categoryName": "Headlight/Parts",
              "level": 2,
              "children": {
                "Composants des projecteurs principaux": {
                  "categoryId": null,
                  "categoryName": "Composants des projecteurs principaux",
                  "level": 4,
                  "children": {
                    "Disperseur, projecteur principal": {
                      "categoryId": 100430,
                      "categoryName": "Headlight Parts",
                      "level": 3,
                      "children": [],
                      "productId": 3499
                    }
                  }
                }
              },
              "productId": 3499
            },
            "Douille de lampe, projecteur principal": {
              "categoryId": 100143,
              "categoryName": "Headlight/Parts",
              "level": 2,
              "children": {
                "Composants des projecteurs principaux": {
                  "categoryId": null,
                  "categoryName": "Composants des projecteurs principaux",
                  "level": 4,
                  "children": {
                    "Douille de lampe, projecteur principal": {
                      "categoryId": 100430,
                      "categoryName": "Headlight Parts",
                      "level": 3,
                      "children": [],
                      "productId": 489
                    }
                  }
                }
              },
              "productId": 489
            },
            "Enjoliveur, projecteur principal": {
              "categoryId": 100143,
              "categoryName": "Headlight/Parts",
              "level": 2,
              "children": {
                "Composants des projecteurs principaux": {
                  "categoryId": null,
                  "categoryName": "Composants des projecteurs principaux",
                  "level": 4,
                  "children": {
                    "Enjoliveur, projecteur principal": {
                      "categoryId": 100430,
                      "categoryName": "Headlight Parts",
                      "level": 3,
                      "children": [],
                      "productId": 60
                    }
                  }
                }
              },
              "productId": 60
            },
            "Jeu de câbles, projecteur principal": {
              "categoryId": 100143,
              "categoryName": "Headlight/Parts",
              "level": 2,
              "children": {
                "Composants des projecteurs principaux": {
                  "categoryId": null,
                  "categoryName": "Composants des projecteurs principaux",
                  "level": 4,
                  "children": {
                    "Jeu de câbles, projecteur principal": {
                      "categoryId": 100430,
                      "categoryName": "Headlight Parts",
                      "level": 3,
                      "children": [],
                      "productId": 704
                    }
                  }
                }
              },
              "productId": 704
            },
            "Joint d'étanchéité, projecteur principal": {
              "categoryId": 100143,
              "categoryName": "Headlight/Parts",
              "level": 2,
              "children": {
                "Composants des projecteurs principaux": {
                  "categoryId": null,
                  "categoryName": "Composants des projecteurs principaux",
                  "level": 4,
                  "children": {
                    "Joint d'étanchéité, projecteur principal": {
                      "categoryId": 100430,
                      "categoryName": "Headlight Parts",
                      "level": 3,
                      "children": [],
                      "productId": 1099
                    }
                  }
                }
              },
              "productId": 1099
            },
            "Joint, bonnette projecteur principal": {
              "categoryId": 100143,
              "categoryName": "Headlight/Parts",
              "level": 2,
              "children": {
                "Composants des projecteurs principaux": {
                  "categoryId": null,
                  "categoryName": "Composants des projecteurs principaux",
                  "level": 4,
                  "children": {
                    "Joint, bonnette projecteur principal": {
                      "categoryId": 100430,
                      "categoryName": "Headlight Parts",
                      "level": 3,
                      "children": [],
                      "productId": 4264
                    }
                  }
                }
              },
              "productId": 4264
            },
            "Joint, enjoliveur du projecteur principal": {
              "categoryId": 100143,
              "categoryName": "Headlight/Parts",
              "level": 2,
              "children": {
                "Composants des projecteurs principaux": {
                  "categoryId": null,
                  "categoryName": "Composants des projecteurs principaux",
                  "level": 4,
                  "children": {
                    "Joint, enjoliveur du projecteur principal": {
                      "categoryId": 100430,
                      "categoryName": "Headlight Parts",
                      "level": 3,
                      "children": [],
                      "productId": 2206
                    }
                  }
                }
              },
              "productId": 2206
            },
            "Kit de cache-projecteurs": {
              "categoryId": 100143,
              "categoryName": "Headlight/Parts",
              "level": 2,
              "children": {
                "Projecteurs principaux / à insérer": {
                  "categoryId": null,
                  "categoryName": "Projecteurs principaux / à insérer",
                  "level": 4,
                  "children": {
                    "Kit de cache-projecteurs": {
                      "categoryId": 100433,
                      "categoryName": "Headlight/Insert",
                      "level": 3,
                      "children": [],
                      "productId": 4075
                    }
                  }
                }
              },
              "productId": 4075
            },
            "Kit de projecteurs principaux": {
              "categoryId": 100143,
              "categoryName": "Headlight/Parts",
              "level": 2,
              "children": {
                "Projecteurs principaux / à insérer": {
                  "categoryId": null,
                  "categoryName": "Projecteurs principaux / à insérer",
                  "level": 4,
                  "children": {
                    "Kit de projecteurs principaux": {
                      "categoryId": 100433,
                      "categoryName": "Headlight/Insert",
                      "level": 3,
                      "children": [],
                      "productId": 3175
                    }
                  }
                }
              },
              "productId": 3175
            },
            "Kit de réparation, phare principal": {
              "categoryId": 100143,
              "categoryName": "Headlight/Parts",
              "level": 2,
              "children": {
                "Composants des projecteurs principaux": {
                  "categoryId": null,
                  "categoryName": "Composants des projecteurs principaux",
                  "level": 4,
                  "children": {
                    "Kit de réparation, phare principal": {
                      "categoryId": 100430,
                      "categoryName": "Headlight Parts",
                      "level": 3,
                      "children": [],
                      "productId": 6327
                    }
                  }
                }
              },
              "productId": 6327
            },
            "Kit rép. de câble, élém. de réglage de la portée des phares": {
              "categoryId": 100143,
              "categoryName": "Headlight/Parts",
              "level": 2,
              "children": {
                "Correcteur de portée lumineuse": {
                  "categoryId": null,
                  "categoryName": "Correcteur de portée lumineuse",
                  "level": 4,
                  "children": {
                    "Kit rép. de câble, élém. de réglage de la portée des phares": {
                      "categoryId": 100279,
                      "categoryName": "Headlight Levelling",
                      "level": 3,
                      "children": [],
                      "productId": 7290
                    }
                  }
                }
              },
              "productId": 7290
            },
            "Kit réparation de câble, projecteur principal": {
              "categoryId": 100143,
              "categoryName": "Headlight/Parts",
              "level": 2,
              "children": {
                "Composants des projecteurs principaux": {
                  "categoryId": null,
                  "categoryName": "Composants des projecteurs principaux",
                  "level": 4,
                  "children": {
                    "Kit réparation de câble, projecteur principal": {
                      "categoryId": 100430,
                      "categoryName": "Headlight Parts",
                      "level": 3,
                      "children": [],
                      "productId": 6347
                    }
                  }
                }
              },
              "productId": 6347
            },
            "Module de phare principal": {
              "categoryId": 100143,
              "categoryName": "Headlight/Parts",
              "level": 2,
              "children": {
                "Module/composants du phare principal": {
                  "categoryId": null,
                  "categoryName": "Module/composants du phare principal",
                  "level": 4,
                  "children": {
                    "Module de phare principal": {
                      "categoryId": 706161,
                      "categoryName": "Headlight Module/Individual Parts",
                      "level": 3,
                      "children": [],
                      "productId": 8412
                    }
                  }
                }
              },
              "productId": 8412
            },
            "Optique, projecteur principal": {
              "categoryId": 100143,
              "categoryName": "Headlight/Parts",
              "level": 2,
              "children": {
                "Projecteurs principaux / à insérer": {
                  "categoryId": null,
                  "categoryName": "Projecteurs principaux / à insérer",
                  "level": 4,
                  "children": {
                    "Optique, projecteur principal": {
                      "categoryId": 100433,
                      "categoryName": "Headlight/Insert",
                      "level": 3,
                      "children": [],
                      "productId": 88
                    }
                  }
                }
              },
              "productId": 88
            },
            "Projecteur principal": {
              "categoryId": 100143,
              "categoryName": "Headlight/Parts",
              "level": 2,
              "children": {
                "Projecteurs principaux / à insérer": {
                  "categoryId": null,
                  "categoryName": "Projecteurs principaux / à insérer",
                  "level": 4,
                  "children": {
                    "Projecteur principal": {
                      "categoryId": 100433,
                      "categoryName": "Headlight/Insert",
                      "level": 3,
                      "children": [],
                      "productId": 259
                    }
                  }
                }
              },
              "productId": 259
            },
            "Réflecteur, projecteur principal": {
              "categoryId": 100143,
              "categoryName": "Headlight/Parts",
              "level": 2,
              "children": {
                "Composants des projecteurs principaux": {
                  "categoryId": null,
                  "categoryName": "Composants des projecteurs principaux",
                  "level": 4,
                  "children": {
                    "Réflecteur, projecteur principal": {
                      "categoryId": 100430,
                      "categoryName": "Headlight Parts",
                      "level": 3,
                      "children": [],
                      "productId": 702
                    }
                  }
                }
              },
              "productId": 702
            },
            "Ressort de retenue, ampoule (phare principal)": {
              "categoryId": 100143,
              "categoryName": "Headlight/Parts",
              "level": 2,
              "children": {
                "Ampoule pour projecteur principal": {
                  "categoryId": null,
                  "categoryName": "Ampoule pour projecteur principal",
                  "level": 4,
                  "children": {
                    "Ressort de retenue, ampoule (phare principal)": {
                      "categoryId": 100427,
                      "categoryName": "Headlight Bulb",
                      "level": 3,
                      "children": [],
                      "productId": 60582
                    }
                  }
                }
              },
              "productId": 60582
            },
            "Ventilateur, phare principal": {
              "categoryId": 100143,
              "categoryName": "Headlight/Parts",
              "level": 2,
              "children": {
                "Module/composants du phare principal": {
                  "categoryId": null,
                  "categoryName": "Module/composants du phare principal",
                  "level": 4,
                  "children": {
                    "Ventilateur, phare principal": {
                      "categoryId": 706161,
                      "categoryName": "Headlight Module/Individual Parts",
                      "level": 3,
                      "children": [],
                      "productId": 8413
                    }
                  }
                }
              },
              "productId": 8413
            },
            "Vis de réglage, phare principal": {
              "categoryId": 100143,
              "categoryName": "Headlight/Parts",
              "level": 2,
              "children": {
                "Composants des projecteurs principaux": {
                  "categoryId": null,
                  "categoryName": "Composants des projecteurs principaux",
                  "level": 4,
                  "children": {
                    "Vis de réglage, phare principal": {
                      "categoryId": 100430,
                      "categoryName": "Headlight Parts",
                      "level": 3,
                      "children": [],
                      "productId": 4327
                    }
                  }
                }
              },
              "productId": 4327
            }
          }
        }
      }
    }
  },
  "arborescenceText": "├── Carrosserie [ID: 100001] (Niveau 1)\n│   ├── Avant du véhicule (Niveau 2)\n│   │   ├── Vehicle Front [ID: 101648] (Niveau 2) → ProductId: 1092\n│   │   │   └── Projecteurs principaux / composants (Niveau 4)\n│   │   │       └── Headlight/Parts [ID: 101656] (Niveau 3) → ProductId: 1092\n│   │   │           └── Ampoule pour projecteur principal (Niveau 6)\n│   │   │               └── Headlight Bulb [ID: 101658] (Niveau 4) → ProductId: 1092\n│   │   ├── Vehicle Front [ID: 101648] (Niveau 2) → ProductId: 106\n│   │   │   └── Projecteur longue portée / composants (Niveau 4)\n│   │   │       └── Spotlight/Parts [ID: 101665] (Niveau 3) → ProductId: 106\n│   │   │           └── Ampoule /projecteur longue portée (Niveau 6)\n│   │   │               └── Spotlight Bulb [ID: 101667] (Niveau 4) → ProductId: 106\n│   │   ├── Vehicle Front [ID: 101648] (Niveau 2) → ProductId: 107\n│   │   │   └── Projecteurs principaux / composants (Niveau 4)\n│   │   │       └── Headlight/Parts [ID: 101656] (Niveau 3) → ProductId: 107\n│   │   │           └── Ampoule pour projecteur principal (Niveau 6)\n│   │   │               └── Headlight Bulb [ID: 101658] (Niveau 4) → ProductId: 107\n│   │   ├── Vehicle Front [ID: 101648] (Niveau 2) → ProductId: 705\n│   │   │   └── Projecteurs principaux / composants (Niveau 4)\n│   │   │       └── Headlight/Parts [ID: 101656] (Niveau 3) → ProductId: 705\n│   │   │           └── Composants des projecteurs principaux (Niveau 6)\n│   │   │               └── Headlight Parts [ID: 101659] (Niveau 4) → ProductId: 705\n│   │   ├── Vehicle Front [ID: 101648] (Niveau 2) → ProductId: 25\n│   │   │   └── Projecteurs principaux / composants (Niveau 4)\n│   │   │       └── Headlight/Parts [ID: 101656] (Niveau 3) → ProductId: 25\n│   │   │           └── Composants des projecteurs principaux (Niveau 6)\n│   │   │               └── Headlight Parts [ID: 101659] (Niveau 4) → ProductId: 25\n│   │   ├── Vehicle Front [ID: 101648] (Niveau 2) → ProductId: 703\n│   │   │   ├── Composants/suppléments (Niveau 4)\n│   │   │   │   └── Parts [ID: 101673] (Niveau 3) → ProductId: 703\n│   │   │   │       └── Fixation/Support/collerette (Niveau 6)\n│   │   │   │           └── Racks/Carriers/Frames [ID: 101773] (Niveau 4) → ProductId: 703\n│   │   │   └── Projecteurs principaux / composants (Niveau 4)\n│   │   │       └── Headlight/Parts [ID: 101656] (Niveau 3) → ProductId: 703\n│   │   │           └── Composants des projecteurs principaux (Niveau 6)\n│   │   │               └── Headlight Parts [ID: 101659] (Niveau 4) → ProductId: 703\n│   │   ├── Vehicle Front [ID: 101648] (Niveau 2) → ProductId: 101\n│   │   │   └── Projecteurs principaux / composants (Niveau 4)\n│   │   │       └── Headlight/Parts [ID: 101656] (Niveau 3) → ProductId: 101\n│   │   │           └── Composants des projecteurs principaux (Niveau 6)\n│   │   │               └── Headlight Parts [ID: 101659] (Niveau 4) → ProductId: 101\n│   │   ├── Vehicle Front [ID: 101648] (Niveau 2) → ProductId: 3499\n│   │   │   └── Projecteurs principaux / composants (Niveau 4)\n│   │   │       └── Headlight/Parts [ID: 101656] (Niveau 3) → ProductId: 3499\n│   │   │           └── Composants des projecteurs principaux (Niveau 6)\n│   │   │               └── Headlight Parts [ID: 101659] (Niveau 4) → ProductId: 3499\n│   │   ├── Vehicle Front [ID: 101648] (Niveau 2) → ProductId: 489\n│   │   │   └── Projecteurs principaux / composants (Niveau 4)\n│   │   │       └── Headlight/Parts [ID: 101656] (Niveau 3) → ProductId: 489\n│   │   │           └── Composants des projecteurs principaux (Niveau 6)\n│   │   │               └── Headlight Parts [ID: 101659] (Niveau 4) → ProductId: 489\n│   │   ├── Vehicle Front [ID: 101648] (Niveau 2) → ProductId: 60\n│   │   │   ├── Composants/suppléments (Niveau 4)\n│   │   │   │   └── Parts [ID: 101673] (Niveau 3) → ProductId: 60\n│   │   │   │       └── Fixation/Support/collerette (Niveau 6)\n│   │   │   │           └── Racks/Carriers/Frames [ID: 101773] (Niveau 4) → ProductId: 60\n│   │   │   └── Projecteurs principaux / composants (Niveau 4)\n│   │   │       └── Headlight/Parts [ID: 101656] (Niveau 3) → ProductId: 60\n│   │   │           └── Composants des projecteurs principaux (Niveau 6)\n│   │   │               └── Headlight Parts [ID: 101659] (Niveau 4) → ProductId: 60\n│   │   ├── Vehicle Front [ID: 101648] (Niveau 2) → ProductId: 2089\n│   │   │   ├── Composants/suppléments (Niveau 4)\n│   │   │   │   └── Parts [ID: 101673] (Niveau 3) → ProductId: 2089\n│   │   │   │       └── Fixation/Support/collerette (Niveau 6)\n│   │   │   │           └── Racks/Carriers/Frames [ID: 101773] (Niveau 4) → ProductId: 2089\n│   │   │   └── Projecteurs principaux / composants (Niveau 4)\n│   │   │       └── Headlight/Parts [ID: 101656] (Niveau 3) → ProductId: 2089\n│   │   │           └── Composants des projecteurs principaux (Niveau 6)\n│   │   │               └── Headlight Parts [ID: 101659] (Niveau 4) → ProductId: 2089\n│   │   ├── Vehicle Front [ID: 101648] (Niveau 2) → ProductId: 704\n│   │   │   └── Projecteurs principaux / composants (Niveau 4)\n│   │   │       └── Headlight/Parts [ID: 101656] (Niveau 3) → ProductId: 704\n│   │   │           └── Composants des projecteurs principaux (Niveau 6)\n│   │   │               └── Headlight Parts [ID: 101659] (Niveau 4) → ProductId: 704\n│   │   ├── Vehicle Front [ID: 101648] (Niveau 2) → ProductId: 1099\n│   │   │   └── Projecteurs principaux / composants (Niveau 4)\n│   │   │       └── Headlight/Parts [ID: 101656] (Niveau 3) → ProductId: 1099\n│   │   │           └── Composants des projecteurs principaux (Niveau 6)\n│   │   │               └── Headlight Parts [ID: 101659] (Niveau 4) → ProductId: 1099\n│   │   ├── Vehicle Front [ID: 101648] (Niveau 2) → ProductId: 4264\n│   │   │   └── Projecteurs principaux / composants (Niveau 4)\n│   │   │       └── Headlight/Parts [ID: 101656] (Niveau 3) → ProductId: 4264\n│   │   │           └── Composants des projecteurs principaux (Niveau 6)\n│   │   │               └── Headlight Parts [ID: 101659] (Niveau 4) → ProductId: 4264\n│   │   ├── Vehicle Front [ID: 101648] (Niveau 2) → ProductId: 2206\n│   │   │   └── Projecteurs principaux / composants (Niveau 4)\n│   │   │       └── Headlight/Parts [ID: 101656] (Niveau 3) → ProductId: 2206\n│   │   │           └── Composants des projecteurs principaux (Niveau 6)\n│   │   │               └── Headlight Parts [ID: 101659] (Niveau 4) → ProductId: 2206\n│   │   ├── Vehicle Front [ID: 101648] (Niveau 2) → ProductId: 4075\n│   │   │   └── Projecteurs principaux / composants (Niveau 4)\n│   │   │       └── Headlight/Parts [ID: 101656] (Niveau 3) → ProductId: 4075\n│   │   │           └── Projecteurs principaux / à insérer (Niveau 6)\n│   │   │               └── Headlight/Insert [ID: 101657] (Niveau 4) → ProductId: 4075\n│   │   ├── Vehicle Front [ID: 101648] (Niveau 2) → ProductId: 3175\n│   │   │   └── Projecteurs principaux / composants (Niveau 4)\n│   │   │       └── Headlight/Parts [ID: 101656] (Niveau 3) → ProductId: 3175\n│   │   │           └── Projecteurs principaux / à insérer (Niveau 6)\n│   │   │               └── Headlight/Insert [ID: 101657] (Niveau 4) → ProductId: 3175\n│   │   ├── Vehicle Front [ID: 101648] (Niveau 2) → ProductId: 88\n│   │   │   └── Projecteurs principaux / composants (Niveau 4)\n│   │   │       └── Headlight/Parts [ID: 101656] (Niveau 3) → ProductId: 88\n│   │   │           └── Projecteurs principaux / à insérer (Niveau 6)\n│   │   │               └── Headlight/Insert [ID: 101657] (Niveau 4) → ProductId: 88\n│   │   ├── Vehicle Front [ID: 101648] (Niveau 2) → ProductId: 259\n│   │   │   └── Projecteurs principaux / composants (Niveau 4)\n│   │   │       └── Headlight/Parts [ID: 101656] (Niveau 3) → ProductId: 259\n│   │   │           └── Projecteurs principaux / à insérer (Niveau 6)\n│   │   │               └── Headlight/Insert [ID: 101657] (Niveau 4) → ProductId: 259\n│   │   └── Vehicle Front [ID: 101648] (Niveau 2) → ProductId: 702\n│   │       └── Projecteurs principaux / composants (Niveau 4)\n│   │           └── Headlight/Parts [ID: 101656] (Niveau 3) → ProductId: 702\n│   │               └── Composants des projecteurs principaux (Niveau 6)\n│   │                   └── Headlight Parts [ID: 101659] (Niveau 4) → ProductId: 702\n│   ├── Fixation/Support/collerette (Niveau 2)\n│   │   ├── Racks/Carriers/Frames [ID: 101454] (Niveau 2) → ProductId: 703\n│   │   ├── Racks/Carriers/Frames [ID: 101454] (Niveau 2) → ProductId: 60\n│   │   └── Racks/Carriers/Frames [ID: 101454] (Niveau 2) → ProductId: 2089\n│   ├── Phares supplémentaires/composants (Niveau 2)\n│   │   └── Additional Headlight/Parts [ID: 101340] (Niveau 2) → ProductId: 106\n│   │       └── Projecteur longue portée / composants (Niveau 4)\n│   │           └── Spotlight/Parts [ID: 101345] (Niveau 3) → ProductId: 106\n│   │               └── Ampoule /projecteur longue portée (Niveau 6)\n│   │                   └── Spotlight Bulb [ID: 101347] (Niveau 4) → ProductId: 106\n│   └── Projecteurs principaux / composants (Niveau 2)\n│       ├── Headlight/Parts [ID: 101465] (Niveau 2) → ProductId: 1092\n│       │   └── Ampoule pour projecteur principal (Niveau 4)\n│       │       └── Headlight Bulb [ID: 101467] (Niveau 3) → ProductId: 1092\n│       ├── Headlight/Parts [ID: 101465] (Niveau 2) → ProductId: 107\n│       │   └── Ampoule pour projecteur principal (Niveau 4)\n│       │       └── Headlight Bulb [ID: 101467] (Niveau 3) → ProductId: 107\n│       ├── Headlight/Parts [ID: 101465] (Niveau 2) → ProductId: 705\n│       │   └── Composants des projecteurs principaux (Niveau 4)\n│       │       └── Headlight Parts [ID: 101468] (Niveau 3) → ProductId: 705\n│       ├── Headlight/Parts [ID: 101465] (Niveau 2) → ProductId: 25\n│       │   └── Composants des projecteurs principaux (Niveau 4)\n│       │       └── Headlight Parts [ID: 101468] (Niveau 3) → ProductId: 25\n│       ├── Headlight/Parts [ID: 101465] (Niveau 2) → ProductId: 703\n│       │   └── Composants des projecteurs principaux (Niveau 4)\n│       │       └── Headlight Parts [ID: 101468] (Niveau 3) → ProductId: 703\n│       ├── Headlight/Parts [ID: 101465] (Niveau 2) → ProductId: 101\n│       │   └── Composants des projecteurs principaux (Niveau 4)\n│       │       └── Headlight Parts [ID: 101468] (Niveau 3) → ProductId: 101\n│       ├── Headlight/Parts [ID: 101465] (Niveau 2) → ProductId: 3499\n│       │   └── Composants des projecteurs principaux (Niveau 4)\n│       │       └── Headlight Parts [ID: 101468] (Niveau 3) → ProductId: 3499\n│       ├── Headlight/Parts [ID: 101465] (Niveau 2) → ProductId: 489\n│       │   └── Composants des projecteurs principaux (Niveau 4)\n│       │       └── Headlight Parts [ID: 101468] (Niveau 3) → ProductId: 489\n│       ├── Headlight/Parts [ID: 101465] (Niveau 2) → ProductId: 60\n│       │   └── Composants des projecteurs principaux (Niveau 4)\n│       │       └── Headlight Parts [ID: 101468] (Niveau 3) → ProductId: 60\n│       ├── Headlight/Parts [ID: 101465] (Niveau 2) → ProductId: 2089\n│       │   └── Composants des projecteurs principaux (Niveau 4)\n│       │       └── Headlight Parts [ID: 101468] (Niveau 3) → ProductId: 2089\n│       ├── Headlight/Parts [ID: 101465] (Niveau 2) → ProductId: 704\n│       │   └── Composants des projecteurs principaux (Niveau 4)\n│       │       └── Headlight Parts [ID: 101468] (Niveau 3) → ProductId: 704\n│       ├── Headlight/Parts [ID: 101465] (Niveau 2) → ProductId: 1099\n│       │   └── Composants des projecteurs principaux (Niveau 4)\n│       │       └── Headlight Parts [ID: 101468] (Niveau 3) → ProductId: 1099\n│       ├── Headlight/Parts [ID: 101465] (Niveau 2) → ProductId: 4264\n│       │   └── Composants des projecteurs principaux (Niveau 4)\n│       │       └── Headlight Parts [ID: 101468] (Niveau 3) → ProductId: 4264\n│       ├── Headlight/Parts [ID: 101465] (Niveau 2) → ProductId: 2206\n│       │   └── Composants des projecteurs principaux (Niveau 4)\n│       │       └── Headlight Parts [ID: 101468] (Niveau 3) → ProductId: 2206\n│       ├── Headlight/Parts [ID: 101465] (Niveau 2) → ProductId: 4075\n│       │   └── Projecteurs principaux / à insérer (Niveau 4)\n│       │       └── Headlight/Insert [ID: 101466] (Niveau 3) → ProductId: 4075\n│       ├── Headlight/Parts [ID: 101465] (Niveau 2) → ProductId: 3175\n│       │   └── Projecteurs principaux / à insérer (Niveau 4)\n│       │       └── Headlight/Insert [ID: 101466] (Niveau 3) → ProductId: 3175\n│       ├── Headlight/Parts [ID: 101465] (Niveau 2) → ProductId: 88\n│       │   └── Projecteurs principaux / à insérer (Niveau 4)\n│       │       └── Headlight/Insert [ID: 101466] (Niveau 3) → ProductId: 88\n│       ├── Headlight/Parts [ID: 101465] (Niveau 2) → ProductId: 259\n│       │   └── Projecteurs principaux / à insérer (Niveau 4)\n│       │       └── Headlight/Insert [ID: 101466] (Niveau 3) → ProductId: 259\n│       └── Headlight/Parts [ID: 101465] (Niveau 2) → ProductId: 702\n│           └── Composants des projecteurs principaux (Niveau 4)\n│               └── Headlight Parts [ID: 101468] (Niveau 3) → ProductId: 702\n\n└── Système électrique [ID: 100010] (Niveau 1)\n    ├── Kit/pièces de câble (Niveau 2)\n    │   └── Cable Set/individual parts [ID: 103066] (Niveau 2) → ProductId: 704\n    ├── Phares supplémentaires/composants (Niveau 2)\n    │   └── Additional Headlight/Parts [ID: 100787] (Niveau 2) → ProductId: 106\n    │       └── Projecteur longue portée / composants (Niveau 4)\n    │           └── Spotlight/Parts [ID: 100276] (Niveau 3) → ProductId: 106\n    │               └── Ampoule /projecteur longue portée (Niveau 6)\n    │                   └── Spotlight Bulb [ID: 100442] (Niveau 4) → ProductId: 106\n    └── Projecteurs principaux / composants (Niveau 2)\n        ├── Headlight/Parts [ID: 100143] (Niveau 2) → ProductId: 1092\n        │   └── Ampoule pour projecteur principal (Niveau 4)\n        │       └── Headlight Bulb [ID: 100427] (Niveau 3) → ProductId: 1092\n        ├── Headlight/Parts [ID: 100143] (Niveau 2) → ProductId: 106\n        │   └── Ampoule /projecteur longue portée (Niveau 4)\n        │       └── Spotlight Bulb [ID: 706742] (Niveau 3) → ProductId: 106\n        ├── Headlight/Parts [ID: 100143] (Niveau 2) → ProductId: 107\n        │   └── Ampoule pour projecteur principal (Niveau 4)\n        │       └── Headlight Bulb [ID: 100427] (Niveau 3) → ProductId: 107\n        ├── Headlight/Parts [ID: 100143] (Niveau 2) → ProductId: 8414\n        │   └── Module/composants du phare principal (Niveau 4)\n        │       └── Headlight Module/Individual Parts [ID: 706161] (Niveau 3) → ProductId: 8414\n        ├── Headlight/Parts [ID: 100143] (Niveau 2) → ProductId: 705\n        │   └── Composants des projecteurs principaux (Niveau 4)\n        │       └── Headlight Parts [ID: 100430] (Niveau 3) → ProductId: 705\n        ├── Headlight/Parts [ID: 100143] (Niveau 2) → ProductId: 25\n        │   └── Composants des projecteurs principaux (Niveau 4)\n        │       └── Headlight Parts [ID: 100430] (Niveau 3) → ProductId: 25\n        ├── Headlight/Parts [ID: 100143] (Niveau 2) → ProductId: 703\n        │   └── Composants des projecteurs principaux (Niveau 4)\n        │       └── Headlight Parts [ID: 100430] (Niveau 3) → ProductId: 703\n        ├── Headlight/Parts [ID: 100143] (Niveau 2) → ProductId: 101\n        │   └── Composants des projecteurs principaux (Niveau 4)\n        │       └── Headlight Parts [ID: 100430] (Niveau 3) → ProductId: 101\n        ├── Headlight/Parts [ID: 100143] (Niveau 2) → ProductId: 3499\n        │   └── Composants des projecteurs principaux (Niveau 4)\n        │       └── Headlight Parts [ID: 100430] (Niveau 3) → ProductId: 3499\n        ├── Headlight/Parts [ID: 100143] (Niveau 2) → ProductId: 489\n        │   └── Composants des projecteurs principaux (Niveau 4)\n        │       └── Headlight Parts [ID: 100430] (Niveau 3) → ProductId: 489\n        ├── Headlight/Parts [ID: 100143] (Niveau 2) → ProductId: 60\n        │   └── Composants des projecteurs principaux (Niveau 4)\n        │       └── Headlight Parts [ID: 100430] (Niveau 3) → ProductId: 60\n        ├── Headlight/Parts [ID: 100143] (Niveau 2) → ProductId: 704\n        │   └── Composants des projecteurs principaux (Niveau 4)\n        │       └── Headlight Parts [ID: 100430] (Niveau 3) → ProductId: 704\n        ├── Headlight/Parts [ID: 100143] (Niveau 2) → ProductId: 1099\n        │   └── Composants des projecteurs principaux (Niveau 4)\n        │       └── Headlight Parts [ID: 100430] (Niveau 3) → ProductId: 1099\n        ├── Headlight/Parts [ID: 100143] (Niveau 2) → ProductId: 4264\n        │   └── Composants des projecteurs principaux (Niveau 4)\n        │       └── Headlight Parts [ID: 100430] (Niveau 3) → ProductId: 4264\n        ├── Headlight/Parts [ID: 100143] (Niveau 2) → ProductId: 2206\n        │   └── Composants des projecteurs principaux (Niveau 4)\n        │       └── Headlight Parts [ID: 100430] (Niveau 3) → ProductId: 2206\n        ├── Headlight/Parts [ID: 100143] (Niveau 2) → ProductId: 4075\n        │   └── Projecteurs principaux / à insérer (Niveau 4)\n        │       └── Headlight/Insert [ID: 100433] (Niveau 3) → ProductId: 4075\n        ├── Headlight/Parts [ID: 100143] (Niveau 2) → ProductId: 3175\n        │   └── Projecteurs principaux / à insérer (Niveau 4)\n        │       └── Headlight/Insert [ID: 100433] (Niveau 3) → ProductId: 3175\n        ├── Headlight/Parts [ID: 100143] (Niveau 2) → ProductId: 6327\n        │   └── Composants des projecteurs principaux (Niveau 4)\n        │       └── Headlight Parts [ID: 100430] (Niveau 3) → ProductId: 6327\n        ├── Headlight/Parts [ID: 100143] (Niveau 2) → ProductId: 7290\n        │   └── Correcteur de portée lumineuse (Niveau 4)\n        │       └── Headlight Levelling [ID: 100279] (Niveau 3) → ProductId: 7290\n        ├── Headlight/Parts [ID: 100143] (Niveau 2) → ProductId: 6347\n        │   └── Composants des projecteurs principaux (Niveau 4)\n        │       └── Headlight Parts [ID: 100430] (Niveau 3) → ProductId: 6347\n        ├── Headlight/Parts [ID: 100143] (Niveau 2) → ProductId: 8412\n        │   └── Module/composants du phare principal (Niveau 4)\n        │       └── Headlight Module/Individual Parts [ID: 706161] (Niveau 3) → ProductId: 8412\n        ├── Headlight/Parts [ID: 100143] (Niveau 2) → ProductId: 88\n        │   └── Projecteurs principaux / à insérer (Niveau 4)\n        │       └── Headlight/Insert [ID: 100433] (Niveau 3) → ProductId: 88\n        ├── Headlight/Parts [ID: 100143] (Niveau 2) → ProductId: 259\n        │   └── Projecteurs principaux / à insérer (Niveau 4)\n        │       └── Headlight/Insert [ID: 100433] (Niveau 3) → ProductId: 259\n        ├── Headlight/Parts [ID: 100143] (Niveau 2) → ProductId: 702\n        │   └── Composants des projecteurs principaux (Niveau 4)\n        │       └── Headlight Parts [ID: 100430] (Niveau 3) → ProductId: 702\n        ├── Headlight/Parts [ID: 100143] (Niveau 2) → ProductId: 60582\n        │   └── Ampoule pour projecteur principal (Niveau 4)\n        │       └── Headlight Bulb [ID: 100427] (Niveau 3) → ProductId: 60582\n        ├── Headlight/Parts [ID: 100143] (Niveau 2) → ProductId: 8413\n        │   └── Module/composants du phare principal (Niveau 4)\n        │       └── Headlight Module/Individual Parts [ID: 706161] (Niveau 3) → ProductId: 8413\n        └── Headlight/Parts [ID: 100143] (Niveau 2) → ProductId: 4327\n            └── Composants des projecteurs principaux (Niveau 4)\n                └── Headlight Parts [ID: 100430] (Niveau 3) → ProductId: 4327",
  "arborescencePaths": [
    {
      "path": [
        "Carrosserie",
        "Avant du véhicule",
        "Vehicle Front"
      ],
      "categoryIds": [
        100001,
        null,
        101648
      ],
      "finalCategoryId": 101648,
      "productId": 1092
    },
    {
      "path": [
        "Carrosserie",
        "Avant du véhicule",
        "Vehicle Front"
      ],
      "categoryIds": [
        100001,
        null,
        101648
      ],
      "finalCategoryId": 101648,
      "productId": 106
    },
    {
      "path": [
        "Carrosserie",
        "Avant du véhicule",
        "Vehicle Front"
      ],
      "categoryIds": [
        100001,
        null,
        101648
      ],
      "finalCategoryId": 101648,
      "productId": 107
    },
    {
      "path": [
        "Carrosserie",
        "Avant du véhicule",
        "Vehicle Front"
      ],
      "categoryIds": [
        100001,
        null,
        101648
      ],
      "finalCategoryId": 101648,
      "productId": 705
    },
    {
      "path": [
        "Carrosserie",
        "Avant du véhicule",
        "Vehicle Front"
      ],
      "categoryIds": [
        100001,
        null,
        101648
      ],
      "finalCategoryId": 101648,
      "productId": 25
    },
    {
      "path": [
        "Carrosserie",
        "Avant du véhicule",
        "Vehicle Front"
      ],
      "categoryIds": [
        100001,
        null,
        101648
      ],
      "finalCategoryId": 101648,
      "productId": 703
    },
    {
      "path": [
        "Carrosserie",
        "Avant du véhicule",
        "Vehicle Front"
      ],
      "categoryIds": [
        100001,
        null,
        101648
      ],
      "finalCategoryId": 101648,
      "productId": 101
    },
    {
      "path": [
        "Carrosserie",
        "Avant du véhicule",
        "Vehicle Front"
      ],
      "categoryIds": [
        100001,
        null,
        101648
      ],
      "finalCategoryId": 101648,
      "productId": 3499
    },
    {
      "path": [
        "Carrosserie",
        "Avant du véhicule",
        "Vehicle Front"
      ],
      "categoryIds": [
        100001,
        null,
        101648
      ],
      "finalCategoryId": 101648,
      "productId": 489
    },
    {
      "path": [
        "Carrosserie",
        "Avant du véhicule",
        "Vehicle Front"
      ],
      "categoryIds": [
        100001,
        null,
        101648
      ],
      "finalCategoryId": 101648,
      "productId": 60
    },
    {
      "path": [
        "Carrosserie",
        "Avant du véhicule",
        "Vehicle Front"
      ],
      "categoryIds": [
        100001,
        null,
        101648
      ],
      "finalCategoryId": 101648,
      "productId": 2089
    },
    {
      "path": [
        "Carrosserie",
        "Avant du véhicule",
        "Vehicle Front"
      ],
      "categoryIds": [
        100001,
        null,
        101648
      ],
      "finalCategoryId": 101648,
      "productId": 704
    },
    {
      "path": [
        "Carrosserie",
        "Avant du véhicule",
        "Vehicle Front"
      ],
      "categoryIds": [
        100001,
        null,
        101648
      ],
      "finalCategoryId": 101648,
      "productId": 1099
    },
    {
      "path": [
        "Carrosserie",
        "Avant du véhicule",
        "Vehicle Front"
      ],
      "categoryIds": [
        100001,
        null,
        101648
      ],
      "finalCategoryId": 101648,
      "productId": 4264
    },
    {
      "path": [
        "Carrosserie",
        "Avant du véhicule",
        "Vehicle Front"
      ],
      "categoryIds": [
        100001,
        null,
        101648
      ],
      "finalCategoryId": 101648,
      "productId": 2206
    },
    {
      "path": [
        "Carrosserie",
        "Avant du véhicule",
        "Vehicle Front"
      ],
      "categoryIds": [
        100001,
        null,
        101648
      ],
      "finalCategoryId": 101648,
      "productId": 4075
    },
    {
      "path": [
        "Carrosserie",
        "Avant du véhicule",
        "Vehicle Front"
      ],
      "categoryIds": [
        100001,
        null,
        101648
      ],
      "finalCategoryId": 101648,
      "productId": 3175
    },
    {
      "path": [
        "Carrosserie",
        "Avant du véhicule",
        "Vehicle Front"
      ],
      "categoryIds": [
        100001,
        null,
        101648
      ],
      "finalCategoryId": 101648,
      "productId": 88
    },
    {
      "path": [
        "Carrosserie",
        "Avant du véhicule",
        "Vehicle Front"
      ],
      "categoryIds": [
        100001,
        null,
        101648
      ],
      "finalCategoryId": 101648,
      "productId": 259
    },
    {
      "path": [
        "Carrosserie",
        "Avant du véhicule",
        "Vehicle Front"
      ],
      "categoryIds": [
        100001,
        null,
        101648
      ],
      "finalCategoryId": 101648,
      "productId": 702
    },
    {
      "path": [
        "Carrosserie",
        "Fixation/Support/collerette",
        "Racks/Carriers/Frames"
      ],
      "categoryIds": [
        100001,
        null,
        101454
      ],
      "finalCategoryId": 101454,
      "productId": 703
    },
    {
      "path": [
        "Carrosserie",
        "Fixation/Support/collerette",
        "Racks/Carriers/Frames"
      ],
      "categoryIds": [
        100001,
        null,
        101454
      ],
      "finalCategoryId": 101454,
      "productId": 60
    },
    {
      "path": [
        "Carrosserie",
        "Fixation/Support/collerette",
        "Racks/Carriers/Frames"
      ],
      "categoryIds": [
        100001,
        null,
        101454
      ],
      "finalCategoryId": 101454,
      "productId": 2089
    },
    {
      "path": [
        "Carrosserie",
        "Phares supplémentaires/composants",
        "Additional Headlight/Parts"
      ],
      "categoryIds": [
        100001,
        null,
        101340
      ],
      "finalCategoryId": 101340,
      "productId": 106
    },
    {
      "path": [
        "Carrosserie",
        "Projecteurs principaux / composants",
        "Headlight/Parts"
      ],
      "categoryIds": [
        100001,
        null,
        101465
      ],
      "finalCategoryId": 101465,
      "productId": 1092
    },
    {
      "path": [
        "Carrosserie",
        "Projecteurs principaux / composants",
        "Headlight/Parts"
      ],
      "categoryIds": [
        100001,
        null,
        101465
      ],
      "finalCategoryId": 101465,
      "productId": 107
    },
    {
      "path": [
        "Carrosserie",
        "Projecteurs principaux / composants",
        "Headlight/Parts"
      ],
      "categoryIds": [
        100001,
        null,
        101465
      ],
      "finalCategoryId": 101465,
      "productId": 705
    },
    {
      "path": [
        "Carrosserie",
        "Projecteurs principaux / composants",
        "Headlight/Parts"
      ],
      "categoryIds": [
        100001,
        null,
        101465
      ],
      "finalCategoryId": 101465,
      "productId": 25
    },
    {
      "path": [
        "Carrosserie",
        "Projecteurs principaux / composants",
        "Headlight/Parts"
      ],
      "categoryIds": [
        100001,
        null,
        101465
      ],
      "finalCategoryId": 101465,
      "productId": 703
    },
    {
      "path": [
        "Carrosserie",
        "Projecteurs principaux / composants",
        "Headlight/Parts"
      ],
      "categoryIds": [
        100001,
        null,
        101465
      ],
      "finalCategoryId": 101465,
      "productId": 101
    },
    {
      "path": [
        "Carrosserie",
        "Projecteurs principaux / composants",
        "Headlight/Parts"
      ],
      "categoryIds": [
        100001,
        null,
        101465
      ],
      "finalCategoryId": 101465,
      "productId": 3499
    },
    {
      "path": [
        "Carrosserie",
        "Projecteurs principaux / composants",
        "Headlight/Parts"
      ],
      "categoryIds": [
        100001,
        null,
        101465
      ],
      "finalCategoryId": 101465,
      "productId": 489
    },
    {
      "path": [
        "Carrosserie",
        "Projecteurs principaux / composants",
        "Headlight/Parts"
      ],
      "categoryIds": [
        100001,
        null,
        101465
      ],
      "finalCategoryId": 101465,
      "productId": 60
    },
    {
      "path": [
        "Carrosserie",
        "Projecteurs principaux / composants",
        "Headlight/Parts"
      ],
      "categoryIds": [
        100001,
        null,
        101465
      ],
      "finalCategoryId": 101465,
      "productId": 2089
    },
    {
      "path": [
        "Carrosserie",
        "Projecteurs principaux / composants",
        "Headlight/Parts"
      ],
      "categoryIds": [
        100001,
        null,
        101465
      ],
      "finalCategoryId": 101465,
      "productId": 704
    },
    {
      "path": [
        "Carrosserie",
        "Projecteurs principaux / composants",
        "Headlight/Parts"
      ],
      "categoryIds": [
        100001,
        null,
        101465
      ],
      "finalCategoryId": 101465,
      "productId": 1099
    },
    {
      "path": [
        "Carrosserie",
        "Projecteurs principaux / composants",
        "Headlight/Parts"
      ],
      "categoryIds": [
        100001,
        null,
        101465
      ],
      "finalCategoryId": 101465,
      "productId": 4264
    },
    {
      "path": [
        "Carrosserie",
        "Projecteurs principaux / composants",
        "Headlight/Parts"
      ],
      "categoryIds": [
        100001,
        null,
        101465
      ],
      "finalCategoryId": 101465,
      "productId": 2206
    },
    {
      "path": [
        "Carrosserie",
        "Projecteurs principaux / composants",
        "Headlight/Parts"
      ],
      "categoryIds": [
        100001,
        null,
        101465
      ],
      "finalCategoryId": 101465,
      "productId": 4075
    },
    {
      "path": [
        "Carrosserie",
        "Projecteurs principaux / composants",
        "Headlight/Parts"
      ],
      "categoryIds": [
        100001,
        null,
        101465
      ],
      "finalCategoryId": 101465,
      "productId": 3175
    },
    {
      "path": [
        "Carrosserie",
        "Projecteurs principaux / composants",
        "Headlight/Parts"
      ],
      "categoryIds": [
        100001,
        null,
        101465
      ],
      "finalCategoryId": 101465,
      "productId": 88
    },
    {
      "path": [
        "Carrosserie",
        "Projecteurs principaux / composants",
        "Headlight/Parts"
      ],
      "categoryIds": [
        100001,
        null,
        101465
      ],
      "finalCategoryId": 101465,
      "productId": 259
    },
    {
      "path": [
        "Carrosserie",
        "Projecteurs principaux / composants",
        "Headlight/Parts"
      ],
      "categoryIds": [
        100001,
        null,
        101465
      ],
      "finalCategoryId": 101465,
      "productId": 702
    },
    {
      "path": [
        "Système électrique",
        "Kit/pièces de câble",
        "Cable Set/individual parts"
      ],
      "categoryIds": [
        100010,
        null,
        103066
      ],
      "finalCategoryId": 103066,
      "productId": 704
    },
    {
      "path": [
        "Système électrique",
        "Phares supplémentaires/composants",
        "Additional Headlight/Parts"
      ],
      "categoryIds": [
        100010,
        null,
        100787
      ],
      "finalCategoryId": 100787,
      "productId": 106
    },
    {
      "path": [
        "Système électrique",
        "Projecteurs principaux / composants",
        "Headlight/Parts"
      ],
      "categoryIds": [
        100010,
        null,
        100143
      ],
      "finalCategoryId": 100143,
      "productId": 1092
    },
    {
      "path": [
        "Système électrique",
        "Projecteurs principaux / composants",
        "Headlight/Parts"
      ],
      "categoryIds": [
        100010,
        null,
        100143
      ],
      "finalCategoryId": 100143,
      "productId": 106
    },
    {
      "path": [
        "Système électrique",
        "Projecteurs principaux / composants",
        "Headlight/Parts"
      ],
      "categoryIds": [
        100010,
        null,
        100143
      ],
      "finalCategoryId": 100143,
      "productId": 107
    },
    {
      "path": [
        "Système électrique",
        "Projecteurs principaux / composants",
        "Headlight/Parts"
      ],
      "categoryIds": [
        100010,
        null,
        100143
      ],
      "finalCategoryId": 100143,
      "productId": 8414
    },
    {
      "path": [
        "Système électrique",
        "Projecteurs principaux / composants",
        "Headlight/Parts"
      ],
      "categoryIds": [
        100010,
        null,
        100143
      ],
      "finalCategoryId": 100143,
      "productId": 705
    },
    {
      "path": [
        "Système électrique",
        "Projecteurs principaux / composants",
        "Headlight/Parts"
      ],
      "categoryIds": [
        100010,
        null,
        100143
      ],
      "finalCategoryId": 100143,
      "productId": 25
    },
    {
      "path": [
        "Système électrique",
        "Projecteurs principaux / composants",
        "Headlight/Parts"
      ],
      "categoryIds": [
        100010,
        null,
        100143
      ],
      "finalCategoryId": 100143,
      "productId": 703
    },
    {
      "path": [
        "Système électrique",
        "Projecteurs principaux / composants",
        "Headlight/Parts"
      ],
      "categoryIds": [
        100010,
        null,
        100143
      ],
      "finalCategoryId": 100143,
      "productId": 101
    },
    {
      "path": [
        "Système électrique",
        "Projecteurs principaux / composants",
        "Headlight/Parts"
      ],
      "categoryIds": [
        100010,
        null,
        100143
      ],
      "finalCategoryId": 100143,
      "productId": 3499
    },
    {
      "path": [
        "Système électrique",
        "Projecteurs principaux / composants",
        "Headlight/Parts"
      ],
      "categoryIds": [
        100010,
        null,
        100143
      ],
      "finalCategoryId": 100143,
      "productId": 489
    },
    {
      "path": [
        "Système électrique",
        "Projecteurs principaux / composants",
        "Headlight/Parts"
      ],
      "categoryIds": [
        100010,
        null,
        100143
      ],
      "finalCategoryId": 100143,
      "productId": 60
    },
    {
      "path": [
        "Système électrique",
        "Projecteurs principaux / composants",
        "Headlight/Parts"
      ],
      "categoryIds": [
        100010,
        null,
        100143
      ],
      "finalCategoryId": 100143,
      "productId": 704
    },
    {
      "path": [
        "Système électrique",
        "Projecteurs principaux / composants",
        "Headlight/Parts"
      ],
      "categoryIds": [
        100010,
        null,
        100143
      ],
      "finalCategoryId": 100143,
      "productId": 1099
    },
    {
      "path": [
        "Système électrique",
        "Projecteurs principaux / composants",
        "Headlight/Parts"
      ],
      "categoryIds": [
        100010,
        null,
        100143
      ],
      "finalCategoryId": 100143,
      "productId": 4264
    },
    {
      "path": [
        "Système électrique",
        "Projecteurs principaux / composants",
        "Headlight/Parts"
      ],
      "categoryIds": [
        100010,
        null,
        100143
      ],
      "finalCategoryId": 100143,
      "productId": 2206
    },
    {
      "path": [
        "Système électrique",
        "Projecteurs principaux / composants",
        "Headlight/Parts"
      ],
      "categoryIds": [
        100010,
        null,
        100143
      ],
      "finalCategoryId": 100143,
      "productId": 4075
    },
    {
      "path": [
        "Système électrique",
        "Projecteurs principaux / composants",
        "Headlight/Parts"
      ],
      "categoryIds": [
        100010,
        null,
        100143
      ],
      "finalCategoryId": 100143,
      "productId": 3175
    },
    {
      "path": [
        "Système électrique",
        "Projecteurs principaux / composants",
        "Headlight/Parts"
      ],
      "categoryIds": [
        100010,
        null,
        100143
      ],
      "finalCategoryId": 100143,
      "productId": 6327
    },
    {
      "path": [
        "Système électrique",
        "Projecteurs principaux / composants",
        "Headlight/Parts"
      ],
      "categoryIds": [
        100010,
        null,
        100143
      ],
      "finalCategoryId": 100143,
      "productId": 7290
    },
    {
      "path": [
        "Système électrique",
        "Projecteurs principaux / composants",
        "Headlight/Parts"
      ],
      "categoryIds": [
        100010,
        null,
        100143
      ],
      "finalCategoryId": 100143,
      "productId": 6347
    },
    {
      "path": [
        "Système électrique",
        "Projecteurs principaux / composants",
        "Headlight/Parts"
      ],
      "categoryIds": [
        100010,
        null,
        100143
      ],
      "finalCategoryId": 100143,
      "productId": 8412
    },
    {
      "path": [
        "Système électrique",
        "Projecteurs principaux / composants",
        "Headlight/Parts"
      ],
      "categoryIds": [
        100010,
        null,
        100143
      ],
      "finalCategoryId": 100143,
      "productId": 88
    },
    {
      "path": [
        "Système électrique",
        "Projecteurs principaux / composants",
        "Headlight/Parts"
      ],
      "categoryIds": [
        100010,
        null,
        100143
      ],
      "finalCategoryId": 100143,
      "productId": 259
    },
    {
      "path": [
        "Système électrique",
        "Projecteurs principaux / composants",
        "Headlight/Parts"
      ],
      "categoryIds": [
        100010,
        null,
        100143
      ],
      "finalCategoryId": 100143,
      "productId": 702
    },
    {
      "path": [
        "Système électrique",
        "Projecteurs principaux / composants",
        "Headlight/Parts"
      ],
      "categoryIds": [
        100010,
        null,
        100143
      ],
      "finalCategoryId": 100143,
      "productId": 60582
    },
    {
      "path": [
        "Système électrique",
        "Projecteurs principaux / composants",
        "Headlight/Parts"
      ],
      "categoryIds": [
        100010,
        null,
        100143
      ],
      "finalCategoryId": 100143,
      "productId": 8413
    },
    {
      "path": [
        "Système électrique",
        "Projecteurs principaux / composants",
        "Headlight/Parts"
      ],
      "categoryIds": [
        100010,
        null,
        100143
      ],
      "finalCategoryId": 100143,
      "productId": 4327
    }
  ],
  "productIdsInArbo": [
    25,
    60,
    88,
    101,
    106,
    107,
    259,
    489,
    702,
    703,
    704,
    705,
    1092,
    1099,
    2089,
    2206,
    3175,
    3499,
    4075,
    4264,
    4327,
    6327,
    6347,
    7290,
    8412,
    8413,
    8414,
    60582
  ],
  "matchedProductIds": [
    259
  ]
}