{
  "productName": "Projecteur longue portée",
  "searchText": "Projecteur longue portée",
  "found": true,
  "hasMatch": true,
  "timestamp": "2025-12-03T07:04:45.316Z",
  "productId": 202,
  "arborescence": {
    "Carrosserie": {
      "categoryId": 100001,
      "categoryName": "Carrosserie",
      "level": 1,
      "children": {
        "Avant du véhicule": {
          "categoryId": null,
          "categoryName": "Avant du véhicule",
          "level": 2,
          "children": {
            "Ampoule, feu de route/diurne": {
              "categoryId": 101648,
              "categoryName": "Vehicle Front",
              "level": 2,
              "children": {
                "Projecteur longue portée / composants": {
                  "categoryId": null,
                  "categoryName": "Projecteur longue portée / composants",
                  "level": 4,
                  "children": {
                    "Ampoule, feu de route/diurne": {
                      "categoryId": 101665,
                      "categoryName": "Spotlight/Parts",
                      "level": 3,
                      "children": {
                        "Ampoule /projecteur longue portée": {
                          "categoryId": null,
                          "categoryName": "Ampoule /projecteur longue portée",
                          "level": 6,
                          "children": {
                            "Ampoule, feu de route/diurne": {
                              "categoryId": 101667,
                              "categoryName": "Spotlight Bulb",
                              "level": 4,
                              "children": [],
                              "productId": 60366
                            }
                          }
                        }
                      },
                      "productId": 60366
                    }
                  }
                }
              },
              "productId": 60366
            },
            "Ampoule, feu de route/diurne/position": {
              "categoryId": 101648,
              "categoryName": "Vehicle Front",
              "level": 2,
              "children": {
                "Projecteur longue portée / composants": {
                  "categoryId": null,
                  "categoryName": "Projecteur longue portée / composants",
                  "level": 4,
                  "children": {
                    "Ampoule, feu de route/diurne/position": {
                      "categoryId": 101665,
                      "categoryName": "Spotlight/Parts",
                      "level": 3,
                      "children": {
                        "Ampoule /projecteur longue portée": {
                          "categoryId": null,
                          "categoryName": "Ampoule /projecteur longue portée",
                          "level": 6,
                          "children": {
                            "Ampoule, feu de route/diurne/position": {
                              "categoryId": 101667,
                              "categoryName": "Spotlight Bulb",
                              "level": 4,
                              "children": [],
                              "productId": 60365
                            }
                          }
                        }
                      },
                      "productId": 60365
                    }
                  }
                }
              },
              "productId": 60365
            },
            "Ampoule, projecteur longue portée": {
              "categoryId": 101648,
              "categoryName": "Vehicle Front",
              "level": 2,
              "children": {
                "Projecteur longue portée / composants": {
                  "categoryId": null,
                  "categoryName": "Projecteur longue portée / composants",
                  "level": 4,
                  "children": {
                    "Ampoule, projecteur longue portée": {
                      "categoryId": 101665,
                      "categoryName": "Spotlight/Parts",
                      "level": 3,
                      "children": {
                        "Ampoule /projecteur longue portée": {
                          "categoryId": null,
                          "categoryName": "Ampoule /projecteur longue portée",
                          "level": 6,
                          "children": {
                            "Ampoule, projecteur longue portée": {
                              "categoryId": 101667,
                              "categoryName": "Spotlight Bulb",
                              "level": 4,
                              "children": [],
                              "productId": 106
                            }
                          }
                        }
                      },
                      "productId": 106
                    }
                  }
                }
              },
              "productId": 106
            },
            "Boîtier, projecteur longue portée": {
              "categoryId": 101648,
              "categoryName": "Vehicle Front",
              "level": 2,
              "children": {
                "Projecteur longue portée / composants": {
                  "categoryId": null,
                  "categoryName": "Projecteur longue portée / composants",
                  "level": 4,
                  "children": {
                    "Boîtier, projecteur longue portée": {
                      "categoryId": 101665,
                      "categoryName": "Spotlight/Parts",
                      "level": 3,
                      "children": {
                        "Projecteur longue portée / composants": {
                          "categoryId": null,
                          "categoryName": "Projecteur longue portée / composants",
                          "level": 6,
                          "children": {
                            "Boîtier, projecteur longue portée": {
                              "categoryId": 101668,
                              "categoryName": "Spotlight Parts",
                              "level": 4,
                              "children": [],
                              "productId": 716
                            }
                          }
                        }
                      },
                      "productId": 716
                    }
                  }
                }
              },
              "productId": 716
            },
            "Cadre, projecteur longue portée": {
              "categoryId": 101648,
              "categoryName": "Vehicle Front",
              "level": 2,
              "children": {
                "Composants/suppléments": {
                  "categoryId": null,
                  "categoryName": "Composants/suppléments",
                  "level": 4,
                  "children": {
                    "Cadre, projecteur longue portée": {
                      "categoryId": 101673,
                      "categoryName": "Parts",
                      "level": 3,
                      "children": {
                        "Fixation/Support/collerette": {
                          "categoryId": null,
                          "categoryName": "Fixation/Support/collerette",
                          "level": 6,
                          "children": {
                            "Cadre, projecteur longue portée": {
                              "categoryId": 101773,
                              "categoryName": "Racks/Carriers/Frames",
                              "level": 4,
                              "children": [],
                              "productId": 715
                            }
                          }
                        }
                      },
                      "productId": 715
                    }
                  }
                },
                "Projecteur longue portée / composants": {
                  "categoryId": null,
                  "categoryName": "Projecteur longue portée / composants",
                  "level": 4,
                  "children": {
                    "Cadre, projecteur longue portée": {
                      "categoryId": 101665,
                      "categoryName": "Spotlight/Parts",
                      "level": 3,
                      "children": {
                        "Projecteur longue portée / composants": {
                          "categoryId": null,
                          "categoryName": "Projecteur longue portée / composants",
                          "level": 6,
                          "children": {
                            "Cadre, projecteur longue portée": {
                              "categoryId": 101668,
                              "categoryName": "Spotlight Parts",
                              "level": 4,
                              "children": [],
                              "productId": 715
                            }
                          }
                        }
                      },
                      "productId": 715
                    }
                  }
                }
              },
              "productId": 715
            },
            "Capuchon, projecteur longue portée": {
              "categoryId": 101648,
              "categoryName": "Vehicle Front",
              "level": 2,
              "children": {
                "Projecteur longue portée / composants": {
                  "categoryId": null,
                  "categoryName": "Projecteur longue portée / composants",
                  "level": 4,
                  "children": {
                    "Capuchon, projecteur longue portée": {
                      "categoryId": 101665,
                      "categoryName": "Spotlight/Parts",
                      "level": 3,
                      "children": {
                        "Projecteur longue portée / composants": {
                          "categoryId": null,
                          "categoryName": "Projecteur longue portée / composants",
                          "level": 6,
                          "children": {
                            "Capuchon, projecteur longue portée": {
                              "categoryId": 101668,
                              "categoryName": "Spotlight Parts",
                              "level": 4,
                              "children": [],
                              "productId": 1076
                            }
                          }
                        }
                      },
                      "productId": 1076
                    }
                  }
                }
              },
              "productId": 1076
            },
            "Disperseur, projecteur longue portée": {
              "categoryId": 101648,
              "categoryName": "Vehicle Front",
              "level": 2,
              "children": {
                "Projecteur longue portée / composants": {
                  "categoryId": null,
                  "categoryName": "Projecteur longue portée / composants",
                  "level": 4,
                  "children": {
                    "Disperseur, projecteur longue portée": {
                      "categoryId": 101665,
                      "categoryName": "Spotlight/Parts",
                      "level": 3,
                      "children": {
                        "Projecteur longue portée / composants": {
                          "categoryId": null,
                          "categoryName": "Projecteur longue portée / composants",
                          "level": 6,
                          "children": {
                            "Disperseur, projecteur longue portée": {
                              "categoryId": 101668,
                              "categoryName": "Spotlight Parts",
                              "level": 4,
                              "children": [],
                              "productId": 16
                            }
                          }
                        }
                      },
                      "productId": 16
                    }
                  }
                }
              },
              "productId": 16
            },
            "Douille de lampe, projecteur longue portée": {
              "categoryId": 101648,
              "categoryName": "Vehicle Front",
              "level": 2,
              "children": {
                "Projecteur longue portée / composants": {
                  "categoryId": null,
                  "categoryName": "Projecteur longue portée / composants",
                  "level": 4,
                  "children": {
                    "Douille de lampe, projecteur longue portée": {
                      "categoryId": 101665,
                      "categoryName": "Spotlight/Parts",
                      "level": 3,
                      "children": {
                        "Projecteur longue portée / composants": {
                          "categoryId": null,
                          "categoryName": "Projecteur longue portée / composants",
                          "level": 6,
                          "children": {
                            "Douille de lampe, projecteur longue portée": {
                              "categoryId": 101668,
                              "categoryName": "Spotlight Parts",
                              "level": 4,
                              "children": [],
                              "productId": 488
                            }
                          }
                        }
                      },
                      "productId": 488
                    }
                  }
                }
              },
              "productId": 488
            },
            "Enjoliveur, projecteur longue portée": {
              "categoryId": 101648,
              "categoryName": "Vehicle Front",
              "level": 2,
              "children": {
                "Composants/suppléments": {
                  "categoryId": null,
                  "categoryName": "Composants/suppléments",
                  "level": 4,
                  "children": {
                    "Enjoliveur, projecteur longue portée": {
                      "categoryId": 101673,
                      "categoryName": "Parts",
                      "level": 3,
                      "children": {
                        "Fixation/Support/collerette": {
                          "categoryId": null,
                          "categoryName": "Fixation/Support/collerette",
                          "level": 6,
                          "children": {
                            "Enjoliveur, projecteur longue portée": {
                              "categoryId": 101773,
                              "categoryName": "Racks/Carriers/Frames",
                              "level": 4,
                              "children": [],
                              "productId": 856
                            }
                          }
                        }
                      },
                      "productId": 856
                    }
                  }
                },
                "Projecteur longue portée / composants": {
                  "categoryId": null,
                  "categoryName": "Projecteur longue portée / composants",
                  "level": 4,
                  "children": {
                    "Enjoliveur, projecteur longue portée": {
                      "categoryId": 101665,
                      "categoryName": "Spotlight/Parts",
                      "level": 3,
                      "children": {
                        "Projecteur longue portée / composants": {
                          "categoryId": null,
                          "categoryName": "Projecteur longue portée / composants",
                          "level": 6,
                          "children": {
                            "Enjoliveur, projecteur longue portée": {
                              "categoryId": 101668,
                              "categoryName": "Spotlight Parts",
                              "level": 4,
                              "children": [],
                              "productId": 856
                            }
                          }
                        }
                      },
                      "productId": 856
                    }
                  }
                }
              },
              "productId": 856
            },
            "Jeu de câbles, projecteur longue portée": {
              "categoryId": 101648,
              "categoryName": "Vehicle Front",
              "level": 2,
              "children": {
                "Projecteur longue portée / composants": {
                  "categoryId": null,
                  "categoryName": "Projecteur longue portée / composants",
                  "level": 4,
                  "children": {
                    "Jeu de câbles, projecteur longue portée": {
                      "categoryId": 101665,
                      "categoryName": "Spotlight/Parts",
                      "level": 3,
                      "children": {
                        "Projecteur longue portée / composants": {
                          "categoryId": null,
                          "categoryName": "Projecteur longue portée / composants",
                          "level": 6,
                          "children": {
                            "Jeu de câbles, projecteur longue portée": {
                              "categoryId": 101668,
                              "categoryName": "Spotlight Parts",
                              "level": 4,
                              "children": [],
                              "productId": 427
                            }
                          }
                        }
                      },
                      "productId": 427
                    }
                  }
                }
              },
              "productId": 427
            },
            "Kit de projecteurs longue portée": {
              "categoryId": 101648,
              "categoryName": "Vehicle Front",
              "level": 2,
              "children": {
                "Projecteur longue portée / composants": {
                  "categoryId": null,
                  "categoryName": "Projecteur longue portée / composants",
                  "level": 4,
                  "children": {
                    "Kit de projecteurs longue portée": {
                      "categoryId": 101665,
                      "categoryName": "Spotlight/Parts",
                      "level": 3,
                      "children": {
                        "Projecteur longue portée/ optique": {
                          "categoryId": null,
                          "categoryName": "Projecteur longue portée/ optique",
                          "level": 6,
                          "children": {
                            "Kit de projecteurs longue portée": {
                              "categoryId": 101666,
                              "categoryName": "Spotlight/Insert",
                              "level": 4,
                              "children": [],
                              "productId": 3330
                            }
                          }
                        }
                      },
                      "productId": 3330
                    }
                  }
                }
              },
              "productId": 3330
            },
            "Optique, projecteur longue portée": {
              "categoryId": 101648,
              "categoryName": "Vehicle Front",
              "level": 2,
              "children": {
                "Projecteur longue portée / composants": {
                  "categoryId": null,
                  "categoryName": "Projecteur longue portée / composants",
                  "level": 4,
                  "children": {
                    "Optique, projecteur longue portée": {
                      "categoryId": 101665,
                      "categoryName": "Spotlight/Parts",
                      "level": 3,
                      "children": {
                        "Projecteur longue portée/ optique": {
                          "categoryId": null,
                          "categoryName": "Projecteur longue portée/ optique",
                          "level": 6,
                          "children": {
                            "Optique, projecteur longue portée": {
                              "categoryId": 101666,
                              "categoryName": "Spotlight/Insert",
                              "level": 4,
                              "children": [],
                              "productId": 87
                            }
                          }
                        }
                      },
                      "productId": 87
                    }
                  }
                }
              },
              "productId": 87
            },
            "Projecteur longue portée": {
              "categoryId": 101648,
              "categoryName": "Vehicle Front",
              "level": 2,
              "children": {
                "Projecteur longue portée / composants": {
                  "categoryId": null,
                  "categoryName": "Projecteur longue portée / composants",
                  "level": 4,
                  "children": {
                    "Projecteur longue portée": {
                      "categoryId": 101665,
                      "categoryName": "Spotlight/Parts",
                      "level": 3,
                      "children": {
                        "Projecteur longue portée/ optique": {
                          "categoryId": null,
                          "categoryName": "Projecteur longue portée/ optique",
                          "level": 6,
                          "children": {
                            "Projecteur longue portée": {
                              "categoryId": 101666,
                              "categoryName": "Spotlight/Insert",
                              "level": 4,
                              "children": [],
                              "productId": 202
                            }
                          }
                        }
                      },
                      "productId": 202
                    }
                  }
                }
              },
              "productId": 202
            },
            "Réflecteur, projecteur longue portée": {
              "categoryId": 101648,
              "categoryName": "Vehicle Front",
              "level": 2,
              "children": {
                "Projecteur longue portée / composants": {
                  "categoryId": null,
                  "categoryName": "Projecteur longue portée / composants",
                  "level": 4,
                  "children": {
                    "Réflecteur, projecteur longue portée": {
                      "categoryId": 101665,
                      "categoryName": "Spotlight/Parts",
                      "level": 3,
                      "children": {
                        "Projecteur longue portée / composants": {
                          "categoryId": null,
                          "categoryName": "Projecteur longue portée / composants",
                          "level": 6,
                          "children": {
                            "Réflecteur, projecteur longue portée": {
                              "categoryId": 101668,
                              "categoryName": "Spotlight Parts",
                              "level": 4,
                              "children": [],
                              "productId": 713
                            }
                          }
                        }
                      },
                      "productId": 713
                    }
                  }
                }
              },
              "productId": 713
            },
            "Support, projecteur longue portée": {
              "categoryId": 101648,
              "categoryName": "Vehicle Front",
              "level": 2,
              "children": {
                "Projecteur longue portée / composants": {
                  "categoryId": null,
                  "categoryName": "Projecteur longue portée / composants",
                  "level": 4,
                  "children": {
                    "Support, projecteur longue portée": {
                      "categoryId": 101665,
                      "categoryName": "Spotlight/Parts",
                      "level": 3,
                      "children": {
                        "Projecteur longue portée / composants": {
                          "categoryId": null,
                          "categoryName": "Projecteur longue portée / composants",
                          "level": 6,
                          "children": {
                            "Support, projecteur longue portée": {
                              "categoryId": 101668,
                              "categoryName": "Spotlight Parts",
                              "level": 4,
                              "children": [],
                              "productId": 100
                            }
                          }
                        }
                      },
                      "productId": 100
                    }
                  }
                }
              },
              "productId": 100
            }
          }
        },
        "Fixation/Support/collerette": {
          "categoryId": null,
          "categoryName": "Fixation/Support/collerette",
          "level": 2,
          "children": {
            "Cadre, projecteur longue portée": {
              "categoryId": 101454,
              "categoryName": "Racks/Carriers/Frames",
              "level": 2,
              "children": [],
              "productId": 715
            },
            "Enjoliveur, projecteur longue portée": {
              "categoryId": 101454,
              "categoryName": "Racks/Carriers/Frames",
              "level": 2,
              "children": [],
              "productId": 856
            }
          }
        },
        "Phares supplémentaires/composants": {
          "categoryId": null,
          "categoryName": "Phares supplémentaires/composants",
          "level": 2,
          "children": {
            "Ampoule, feu de route/diurne": {
              "categoryId": 101340,
              "categoryName": "Additional Headlight/Parts",
              "level": 2,
              "children": {
                "Projecteur longue portée / composants": {
                  "categoryId": null,
                  "categoryName": "Projecteur longue portée / composants",
                  "level": 4,
                  "children": {
                    "Ampoule, feu de route/diurne": {
                      "categoryId": 101345,
                      "categoryName": "Spotlight/Parts",
                      "level": 3,
                      "children": {
                        "Ampoule /projecteur longue portée": {
                          "categoryId": null,
                          "categoryName": "Ampoule /projecteur longue portée",
                          "level": 6,
                          "children": {
                            "Ampoule, feu de route/diurne": {
                              "categoryId": 101347,
                              "categoryName": "Spotlight Bulb",
                              "level": 4,
                              "children": [],
                              "productId": 60366
                            }
                          }
                        }
                      },
                      "productId": 60366
                    }
                  }
                }
              },
              "productId": 60366
            },
            "Ampoule, feu de route/diurne/position": {
              "categoryId": 101340,
              "categoryName": "Additional Headlight/Parts",
              "level": 2,
              "children": {
                "Projecteur longue portée / composants": {
                  "categoryId": null,
                  "categoryName": "Projecteur longue portée / composants",
                  "level": 4,
                  "children": {
                    "Ampoule, feu de route/diurne/position": {
                      "categoryId": 101345,
                      "categoryName": "Spotlight/Parts",
                      "level": 3,
                      "children": {
                        "Ampoule /projecteur longue portée": {
                          "categoryId": null,
                          "categoryName": "Ampoule /projecteur longue portée",
                          "level": 6,
                          "children": {
                            "Ampoule, feu de route/diurne/position": {
                              "categoryId": 101347,
                              "categoryName": "Spotlight Bulb",
                              "level": 4,
                              "children": [],
                              "productId": 60365
                            }
                          }
                        }
                      },
                      "productId": 60365
                    }
                  }
                }
              },
              "productId": 60365
            },
            "Ampoule, projecteur longue portée": {
              "categoryId": 101340,
              "categoryName": "Additional Headlight/Parts",
              "level": 2,
              "children": {
                "Projecteur longue portée / composants": {
                  "categoryId": null,
                  "categoryName": "Projecteur longue portée / composants",
                  "level": 4,
                  "children": {
                    "Ampoule, projecteur longue portée": {
                      "categoryId": 101345,
                      "categoryName": "Spotlight/Parts",
                      "level": 3,
                      "children": {
                        "Ampoule /projecteur longue portée": {
                          "categoryId": null,
                          "categoryName": "Ampoule /projecteur longue portée",
                          "level": 6,
                          "children": {
                            "Ampoule, projecteur longue portée": {
                              "categoryId": 101347,
                              "categoryName": "Spotlight Bulb",
                              "level": 4,
                              "children": [],
                              "productId": 106
                            }
                          }
                        }
                      },
                      "productId": 106
                    }
                  }
                }
              },
              "productId": 106
            },
            "Boîtier, projecteur longue portée": {
              "categoryId": 101340,
              "categoryName": "Additional Headlight/Parts",
              "level": 2,
              "children": {
                "Projecteur longue portée / composants": {
                  "categoryId": null,
                  "categoryName": "Projecteur longue portée / composants",
                  "level": 4,
                  "children": {
                    "Boîtier, projecteur longue portée": {
                      "categoryId": 101345,
                      "categoryName": "Spotlight/Parts",
                      "level": 3,
                      "children": {
                        "Projecteur longue portée / composants": {
                          "categoryId": null,
                          "categoryName": "Projecteur longue portée / composants",
                          "level": 6,
                          "children": {
                            "Boîtier, projecteur longue portée": {
                              "categoryId": 101348,
                              "categoryName": "Spotlight Parts",
                              "level": 4,
                              "children": [],
                              "productId": 716
                            }
                          }
                        }
                      },
                      "productId": 716
                    }
                  }
                }
              },
              "productId": 716
            },
            "Cadre, projecteur longue portée": {
              "categoryId": 101340,
              "categoryName": "Additional Headlight/Parts",
              "level": 2,
              "children": {
                "Projecteur longue portée / composants": {
                  "categoryId": null,
                  "categoryName": "Projecteur longue portée / composants",
                  "level": 4,
                  "children": {
                    "Cadre, projecteur longue portée": {
                      "categoryId": 101345,
                      "categoryName": "Spotlight/Parts",
                      "level": 3,
                      "children": {
                        "Projecteur longue portée / composants": {
                          "categoryId": null,
                          "categoryName": "Projecteur longue portée / composants",
                          "level": 6,
                          "children": {
                            "Cadre, projecteur longue portée": {
                              "categoryId": 101348,
                              "categoryName": "Spotlight Parts",
                              "level": 4,
                              "children": [],
                              "productId": 715
                            }
                          }
                        }
                      },
                      "productId": 715
                    }
                  }
                }
              },
              "productId": 715
            },
            "Capuchon, projecteur longue portée": {
              "categoryId": 101340,
              "categoryName": "Additional Headlight/Parts",
              "level": 2,
              "children": {
                "Projecteur longue portée / composants": {
                  "categoryId": null,
                  "categoryName": "Projecteur longue portée / composants",
                  "level": 4,
                  "children": {
                    "Capuchon, projecteur longue portée": {
                      "categoryId": 101345,
                      "categoryName": "Spotlight/Parts",
                      "level": 3,
                      "children": {
                        "Projecteur longue portée / composants": {
                          "categoryId": null,
                          "categoryName": "Projecteur longue portée / composants",
                          "level": 6,
                          "children": {
                            "Capuchon, projecteur longue portée": {
                              "categoryId": 101348,
                              "categoryName": "Spotlight Parts",
                              "level": 4,
                              "children": [],
                              "productId": 1076
                            }
                          }
                        }
                      },
                      "productId": 1076
                    }
                  }
                }
              },
              "productId": 1076
            },
            "Disperseur, projecteur longue portée": {
              "categoryId": 101340,
              "categoryName": "Additional Headlight/Parts",
              "level": 2,
              "children": {
                "Projecteur longue portée / composants": {
                  "categoryId": null,
                  "categoryName": "Projecteur longue portée / composants",
                  "level": 4,
                  "children": {
                    "Disperseur, projecteur longue portée": {
                      "categoryId": 101345,
                      "categoryName": "Spotlight/Parts",
                      "level": 3,
                      "children": {
                        "Projecteur longue portée / composants": {
                          "categoryId": null,
                          "categoryName": "Projecteur longue portée / composants",
                          "level": 6,
                          "children": {
                            "Disperseur, projecteur longue portée": {
                              "categoryId": 101348,
                              "categoryName": "Spotlight Parts",
                              "level": 4,
                              "children": [],
                              "productId": 16
                            }
                          }
                        }
                      },
                      "productId": 16
                    }
                  }
                }
              },
              "productId": 16
            },
            "Douille de lampe, projecteur longue portée": {
              "categoryId": 101340,
              "categoryName": "Additional Headlight/Parts",
              "level": 2,
              "children": {
                "Projecteur longue portée / composants": {
                  "categoryId": null,
                  "categoryName": "Projecteur longue portée / composants",
                  "level": 4,
                  "children": {
                    "Douille de lampe, projecteur longue portée": {
                      "categoryId": 101345,
                      "categoryName": "Spotlight/Parts",
                      "level": 3,
                      "children": {
                        "Projecteur longue portée / composants": {
                          "categoryId": null,
                          "categoryName": "Projecteur longue portée / composants",
                          "level": 6,
                          "children": {
                            "Douille de lampe, projecteur longue portée": {
                              "categoryId": 101348,
                              "categoryName": "Spotlight Parts",
                              "level": 4,
                              "children": [],
                              "productId": 488
                            }
                          }
                        }
                      },
                      "productId": 488
                    }
                  }
                }
              },
              "productId": 488
            },
            "Enjoliveur, projecteur longue portée": {
              "categoryId": 101340,
              "categoryName": "Additional Headlight/Parts",
              "level": 2,
              "children": {
                "Projecteur longue portée / composants": {
                  "categoryId": null,
                  "categoryName": "Projecteur longue portée / composants",
                  "level": 4,
                  "children": {
                    "Enjoliveur, projecteur longue portée": {
                      "categoryId": 101345,
                      "categoryName": "Spotlight/Parts",
                      "level": 3,
                      "children": {
                        "Projecteur longue portée / composants": {
                          "categoryId": null,
                          "categoryName": "Projecteur longue portée / composants",
                          "level": 6,
                          "children": {
                            "Enjoliveur, projecteur longue portée": {
                              "categoryId": 101348,
                              "categoryName": "Spotlight Parts",
                              "level": 4,
                              "children": [],
                              "productId": 856
                            }
                          }
                        }
                      },
                      "productId": 856
                    }
                  }
                }
              },
              "productId": 856
            },
            "Jeu de câbles, projecteur longue portée": {
              "categoryId": 101340,
              "categoryName": "Additional Headlight/Parts",
              "level": 2,
              "children": {
                "Projecteur longue portée / composants": {
                  "categoryId": null,
                  "categoryName": "Projecteur longue portée / composants",
                  "level": 4,
                  "children": {
                    "Jeu de câbles, projecteur longue portée": {
                      "categoryId": 101345,
                      "categoryName": "Spotlight/Parts",
                      "level": 3,
                      "children": {
                        "Projecteur longue portée / composants": {
                          "categoryId": null,
                          "categoryName": "Projecteur longue portée / composants",
                          "level": 6,
                          "children": {
                            "Jeu de câbles, projecteur longue portée": {
                              "categoryId": 101348,
                              "categoryName": "Spotlight Parts",
                              "level": 4,
                              "children": [],
                              "productId": 427
                            }
                          }
                        }
                      },
                      "productId": 427
                    }
                  }
                }
              },
              "productId": 427
            },
            "Kit de projecteurs longue portée": {
              "categoryId": 101340,
              "categoryName": "Additional Headlight/Parts",
              "level": 2,
              "children": {
                "Projecteur longue portée / composants": {
                  "categoryId": null,
                  "categoryName": "Projecteur longue portée / composants",
                  "level": 4,
                  "children": {
                    "Kit de projecteurs longue portée": {
                      "categoryId": 101345,
                      "categoryName": "Spotlight/Parts",
                      "level": 3,
                      "children": {
                        "Projecteur longue portée/ optique": {
                          "categoryId": null,
                          "categoryName": "Projecteur longue portée/ optique",
                          "level": 6,
                          "children": {
                            "Kit de projecteurs longue portée": {
                              "categoryId": 101346,
                              "categoryName": "Spotlight/Insert",
                              "level": 4,
                              "children": [],
                              "productId": 3330
                            }
                          }
                        }
                      },
                      "productId": 3330
                    }
                  }
                }
              },
              "productId": 3330
            },
            "Optique, projecteur longue portée": {
              "categoryId": 101340,
              "categoryName": "Additional Headlight/Parts",
              "level": 2,
              "children": {
                "Projecteur longue portée / composants": {
                  "categoryId": null,
                  "categoryName": "Projecteur longue portée / composants",
                  "level": 4,
                  "children": {
                    "Optique, projecteur longue portée": {
                      "categoryId": 101345,
                      "categoryName": "Spotlight/Parts",
                      "level": 3,
                      "children": {
                        "Projecteur longue portée/ optique": {
                          "categoryId": null,
                          "categoryName": "Projecteur longue portée/ optique",
                          "level": 6,
                          "children": {
                            "Optique, projecteur longue portée": {
                              "categoryId": 101346,
                              "categoryName": "Spotlight/Insert",
                              "level": 4,
                              "children": [],
                              "productId": 87
                            }
                          }
                        }
                      },
                      "productId": 87
                    }
                  }
                }
              },
              "productId": 87
            },
            "Projecteur longue portée": {
              "categoryId": 101340,
              "categoryName": "Additional Headlight/Parts",
              "level": 2,
              "children": {
                "Projecteur longue portée / composants": {
                  "categoryId": null,
                  "categoryName": "Projecteur longue portée / composants",
                  "level": 4,
                  "children": {
                    "Projecteur longue portée": {
                      "categoryId": 101345,
                      "categoryName": "Spotlight/Parts",
                      "level": 3,
                      "children": {
                        "Projecteur longue portée/ optique": {
                          "categoryId": null,
                          "categoryName": "Projecteur longue portée/ optique",
                          "level": 6,
                          "children": {
                            "Projecteur longue portée": {
                              "categoryId": 101346,
                              "categoryName": "Spotlight/Insert",
                              "level": 4,
                              "children": [],
                              "productId": 202
                            }
                          }
                        }
                      },
                      "productId": 202
                    }
                  }
                }
              },
              "productId": 202
            },
            "Réflecteur, projecteur longue portée": {
              "categoryId": 101340,
              "categoryName": "Additional Headlight/Parts",
              "level": 2,
              "children": {
                "Projecteur longue portée / composants": {
                  "categoryId": null,
                  "categoryName": "Projecteur longue portée / composants",
                  "level": 4,
                  "children": {
                    "Réflecteur, projecteur longue portée": {
                      "categoryId": 101345,
                      "categoryName": "Spotlight/Parts",
                      "level": 3,
                      "children": {
                        "Projecteur longue portée / composants": {
                          "categoryId": null,
                          "categoryName": "Projecteur longue portée / composants",
                          "level": 6,
                          "children": {
                            "Réflecteur, projecteur longue portée": {
                              "categoryId": 101348,
                              "categoryName": "Spotlight Parts",
                              "level": 4,
                              "children": [],
                              "productId": 713
                            }
                          }
                        }
                      },
                      "productId": 713
                    }
                  }
                }
              },
              "productId": 713
            },
            "Support, projecteur longue portée": {
              "categoryId": 101340,
              "categoryName": "Additional Headlight/Parts",
              "level": 2,
              "children": {
                "Projecteur longue portée / composants": {
                  "categoryId": null,
                  "categoryName": "Projecteur longue portée / composants",
                  "level": 4,
                  "children": {
                    "Support, projecteur longue portée": {
                      "categoryId": 101345,
                      "categoryName": "Spotlight/Parts",
                      "level": 3,
                      "children": {
                        "Projecteur longue portée / composants": {
                          "categoryId": null,
                          "categoryName": "Projecteur longue portée / composants",
                          "level": 6,
                          "children": {
                            "Support, projecteur longue portée": {
                              "categoryId": 101348,
                              "categoryName": "Spotlight Parts",
                              "level": 4,
                              "children": [],
                              "productId": 100
                            }
                          }
                        }
                      },
                      "productId": 100
                    }
                  }
                }
              },
              "productId": 100
            }
          }
        }
      }
    },
    "Système électrique": {
      "categoryId": 100010,
      "categoryName": "Système électrique",
      "level": 1,
      "children": {
        "Interrupteur/Relais/Contrôle clignotant/Appareil d.commande": {
          "categoryId": null,
          "categoryName": "Interrupteur/Relais/Contrôle clignotant/Appareil d.commande",
          "level": 2,
          "children": {
            "Relais, projecteur longue portée": {
              "categoryId": 100307,
              "categoryName": "Light Switches/Relays/Controls",
              "level": 2,
              "children": {
                "Relais": {
                  "categoryId": null,
                  "categoryName": "Relais",
                  "level": 4,
                  "children": {
                    "Relais, projecteur longue portée": {
                      "categoryId": 100510,
                      "categoryName": "Relay",
                      "level": 3,
                      "children": [],
                      "productId": 1287
                    }
                  }
                }
              },
              "productId": 1287
            }
          }
        },
        "Kit/pièces de câble": {
          "categoryId": null,
          "categoryName": "Kit/pièces de câble",
          "level": 2,
          "children": {
            "Jeu de câbles, projecteur longue portée": {
              "categoryId": 103066,
              "categoryName": "Cable Set/individual parts",
              "level": 2,
              "children": [],
              "productId": 427
            }
          }
        },
        "Phares supplémentaires/composants": {
          "categoryId": null,
          "categoryName": "Phares supplémentaires/composants",
          "level": 2,
          "children": {
            "Ampoule, feu de route/diurne": {
              "categoryId": 100787,
              "categoryName": "Additional Headlight/Parts",
              "level": 2,
              "children": {
                "Projecteur longue portée / composants": {
                  "categoryId": null,
                  "categoryName": "Projecteur longue portée / composants",
                  "level": 4,
                  "children": {
                    "Ampoule, feu de route/diurne": {
                      "categoryId": 100276,
                      "categoryName": "Spotlight/Parts",
                      "level": 3,
                      "children": {
                        "Ampoule /projecteur longue portée": {
                          "categoryId": null,
                          "categoryName": "Ampoule /projecteur longue portée",
                          "level": 6,
                          "children": {
                            "Ampoule, feu de route/diurne": {
                              "categoryId": 100442,
                              "categoryName": "Spotlight Bulb",
                              "level": 4,
                              "children": [],
                              "productId": 60366
                            }
                          }
                        }
                      },
                      "productId": 60366
                    }
                  }
                }
              },
              "productId": 60366
            },
            "Ampoule, feu de route/diurne/position": {
              "categoryId": 100787,
              "categoryName": "Additional Headlight/Parts",
              "level": 2,
              "children": {
                "Projecteur longue portée / composants": {
                  "categoryId": null,
                  "categoryName": "Projecteur longue portée / composants",
                  "level": 4,
                  "children": {
                    "Ampoule, feu de route/diurne/position": {
                      "categoryId": 100276,
                      "categoryName": "Spotlight/Parts",
                      "level": 3,
                      "children": {
                        "Ampoule /projecteur longue portée": {
                          "categoryId": null,
                          "categoryName": "Ampoule /projecteur longue portée",
                          "level": 6,
                          "children": {
                            "Ampoule, feu de route/diurne/position": {
                              "categoryId": 100442,
                              "categoryName": "Spotlight Bulb",
                              "level": 4,
                              "children": [],
                              "productId": 60365
                            }
                          }
                        }
                      },
                      "productId": 60365
                    }
                  }
                }
              },
              "productId": 60365
            },
            "Ampoule, projecteur longue portée": {
              "categoryId": 100787,
              "categoryName": "Additional Headlight/Parts",
              "level": 2,
              "children": {
                "Projecteur longue portée / composants": {
                  "categoryId": null,
                  "categoryName": "Projecteur longue portée / composants",
                  "level": 4,
                  "children": {
                    "Ampoule, projecteur longue portée": {
                      "categoryId": 100276,
                      "categoryName": "Spotlight/Parts",
                      "level": 3,
                      "children": {
                        "Ampoule /projecteur longue portée": {
                          "categoryId": null,
                          "categoryName": "Ampoule /projecteur longue portée",
                          "level": 6,
                          "children": {
                            "Ampoule, projecteur longue portée": {
                              "categoryId": 100442,
                              "categoryName": "Spotlight Bulb",
                              "level": 4,
                              "children": [],
                              "productId": 106
                            }
                          }
                        }
                      },
                      "productId": 106
                    }
                  }
                }
              },
              "productId": 106
            },
            "Boîtier, projecteur longue portée": {
              "categoryId": 100787,
              "categoryName": "Additional Headlight/Parts",
              "level": 2,
              "children": {
                "Projecteur longue portée / composants": {
                  "categoryId": null,
                  "categoryName": "Projecteur longue portée / composants",
                  "level": 4,
                  "children": {
                    "Boîtier, projecteur longue portée": {
                      "categoryId": 100276,
                      "categoryName": "Spotlight/Parts",
                      "level": 3,
                      "children": {
                        "Projecteur longue portée / composants": {
                          "categoryId": null,
                          "categoryName": "Projecteur longue portée / composants",
                          "level": 6,
                          "children": {
                            "Boîtier, projecteur longue portée": {
                              "categoryId": 100443,
                              "categoryName": "Spotlight Parts",
                              "level": 4,
                              "children": [],
                              "productId": 716
                            }
                          }
                        }
                      },
                      "productId": 716
                    }
                  }
                }
              },
              "productId": 716
            },
            "Cadre, projecteur longue portée": {
              "categoryId": 100787,
              "categoryName": "Additional Headlight/Parts",
              "level": 2,
              "children": {
                "Projecteur longue portée / composants": {
                  "categoryId": null,
                  "categoryName": "Projecteur longue portée / composants",
                  "level": 4,
                  "children": {
                    "Cadre, projecteur longue portée": {
                      "categoryId": 100276,
                      "categoryName": "Spotlight/Parts",
                      "level": 3,
                      "children": {
                        "Projecteur longue portée / composants": {
                          "categoryId": null,
                          "categoryName": "Projecteur longue portée / composants",
                          "level": 6,
                          "children": {
                            "Cadre, projecteur longue portée": {
                              "categoryId": 100443,
                              "categoryName": "Spotlight Parts",
                              "level": 4,
                              "children": [],
                              "productId": 715
                            }
                          }
                        }
                      },
                      "productId": 715
                    }
                  }
                }
              },
              "productId": 715
            },
            "Capuchon, projecteur longue portée": {
              "categoryId": 100787,
              "categoryName": "Additional Headlight/Parts",
              "level": 2,
              "children": {
                "Projecteur longue portée / composants": {
                  "categoryId": null,
                  "categoryName": "Projecteur longue portée / composants",
                  "level": 4,
                  "children": {
                    "Capuchon, projecteur longue portée": {
                      "categoryId": 100276,
                      "categoryName": "Spotlight/Parts",
                      "level": 3,
                      "children": {
                        "Projecteur longue portée / composants": {
                          "categoryId": null,
                          "categoryName": "Projecteur longue portée / composants",
                          "level": 6,
                          "children": {
                            "Capuchon, projecteur longue portée": {
                              "categoryId": 100443,
                              "categoryName": "Spotlight Parts",
                              "level": 4,
                              "children": [],
                              "productId": 1076
                            }
                          }
                        }
                      },
                      "productId": 1076
                    }
                  }
                }
              },
              "productId": 1076
            },
            "Disperseur, projecteur longue portée": {
              "categoryId": 100787,
              "categoryName": "Additional Headlight/Parts",
              "level": 2,
              "children": {
                "Projecteur longue portée / composants": {
                  "categoryId": null,
                  "categoryName": "Projecteur longue portée / composants",
                  "level": 4,
                  "children": {
                    "Disperseur, projecteur longue portée": {
                      "categoryId": 100276,
                      "categoryName": "Spotlight/Parts",
                      "level": 3,
                      "children": {
                        "Projecteur longue portée / composants": {
                          "categoryId": null,
                          "categoryName": "Projecteur longue portée / composants",
                          "level": 6,
                          "children": {
                            "Disperseur, projecteur longue portée": {
                              "categoryId": 100443,
                              "categoryName": "Spotlight Parts",
                              "level": 4,
                              "children": [],
                              "productId": 16
                            }
                          }
                        }
                      },
                      "productId": 16
                    }
                  }
                }
              },
              "productId": 16
            },
            "Douille de lampe, projecteur longue portée": {
              "categoryId": 100787,
              "categoryName": "Additional Headlight/Parts",
              "level": 2,
              "children": {
                "Projecteur longue portée / composants": {
                  "categoryId": null,
                  "categoryName": "Projecteur longue portée / composants",
                  "level": 4,
                  "children": {
                    "Douille de lampe, projecteur longue portée": {
                      "categoryId": 100276,
                      "categoryName": "Spotlight/Parts",
                      "level": 3,
                      "children": {
                        "Projecteur longue portée / composants": {
                          "categoryId": null,
                          "categoryName": "Projecteur longue portée / composants",
                          "level": 6,
                          "children": {
                            "Douille de lampe, projecteur longue portée": {
                              "categoryId": 100443,
                              "categoryName": "Spotlight Parts",
                              "level": 4,
                              "children": [],
                              "productId": 488
                            }
                          }
                        }
                      },
                      "productId": 488
                    }
                  }
                }
              },
              "productId": 488
            },
            "Enjoliveur, projecteur longue portée": {
              "categoryId": 100787,
              "categoryName": "Additional Headlight/Parts",
              "level": 2,
              "children": {
                "Projecteur longue portée / composants": {
                  "categoryId": null,
                  "categoryName": "Projecteur longue portée / composants",
                  "level": 4,
                  "children": {
                    "Enjoliveur, projecteur longue portée": {
                      "categoryId": 100276,
                      "categoryName": "Spotlight/Parts",
                      "level": 3,
                      "children": {
                        "Projecteur longue portée / composants": {
                          "categoryId": null,
                          "categoryName": "Projecteur longue portée / composants",
                          "level": 6,
                          "children": {
                            "Enjoliveur, projecteur longue portée": {
                              "categoryId": 100443,
                              "categoryName": "Spotlight Parts",
                              "level": 4,
                              "children": [],
                              "productId": 856
                            }
                          }
                        }
                      },
                      "productId": 856
                    }
                  }
                }
              },
              "productId": 856
            },
            "Jeu de câbles, projecteur longue portée": {
              "categoryId": 100787,
              "categoryName": "Additional Headlight/Parts",
              "level": 2,
              "children": {
                "Projecteur longue portée / composants": {
                  "categoryId": null,
                  "categoryName": "Projecteur longue portée / composants",
                  "level": 4,
                  "children": {
                    "Jeu de câbles, projecteur longue portée": {
                      "categoryId": 100276,
                      "categoryName": "Spotlight/Parts",
                      "level": 3,
                      "children": {
                        "Projecteur longue portée / composants": {
                          "categoryId": null,
                          "categoryName": "Projecteur longue portée / composants",
                          "level": 6,
                          "children": {
                            "Jeu de câbles, projecteur longue portée": {
                              "categoryId": 100443,
                              "categoryName": "Spotlight Parts",
                              "level": 4,
                              "children": [],
                              "productId": 427
                            }
                          }
                        }
                      },
                      "productId": 427
                    }
                  }
                }
              },
              "productId": 427
            },
            "Jeu de supports, phare supplémentaire": {
              "categoryId": 100787,
              "categoryName": "Additional Headlight/Parts",
              "level": 2,
              "children": {
                "Phare chercheur / composants": {
                  "categoryId": null,
                  "categoryName": "Phare chercheur / composants",
                  "level": 4,
                  "children": {
                    "Jeu de supports, phare supplémentaire": {
                      "categoryId": 100281,
                      "categoryName": "Searchlight/Parts",
                      "level": 3,
                      "children": {
                        "Composants phare chercheur": {
                          "categoryId": null,
                          "categoryName": "Composants phare chercheur",
                          "level": 6,
                          "children": {
                            "Jeu de supports, phare supplémentaire": {
                              "categoryId": 100446,
                              "categoryName": "Searchlight Parts",
                              "level": 4,
                              "children": [],
                              "productId": 2977
                            }
                          }
                        }
                      },
                      "productId": 2977
                    }
                  }
                },
                "Projecteur antibrouillard/ composants": {
                  "categoryId": null,
                  "categoryName": "Projecteur antibrouillard/ composants",
                  "level": 4,
                  "children": {
                    "Jeu de supports, phare supplémentaire": {
                      "categoryId": 100277,
                      "categoryName": "Front Fog Light/Parts",
                      "level": 3,
                      "children": {
                        "Composants pour projecteur antibrouillard": {
                          "categoryId": null,
                          "categoryName": "Composants pour projecteur antibrouillard",
                          "level": 6,
                          "children": {
                            "Jeu de supports, phare supplémentaire": {
                              "categoryId": 100444,
                              "categoryName": "Fog Light Parts",
                              "level": 4,
                              "children": [],
                              "productId": 2977
                            }
                          }
                        }
                      },
                      "productId": 2977
                    }
                  }
                },
                "Projecteur de travail, composants": {
                  "categoryId": null,
                  "categoryName": "Projecteur de travail, composants",
                  "level": 4,
                  "children": {
                    "Jeu de supports, phare supplémentaire": {
                      "categoryId": 100280,
                      "categoryName": "Worklight/Parts",
                      "level": 3,
                      "children": {
                        "Projecteur de travail, composants": {
                          "categoryId": null,
                          "categoryName": "Projecteur de travail, composants",
                          "level": 6,
                          "children": {
                            "Jeu de supports, phare supplémentaire": {
                              "categoryId": 100445,
                              "categoryName": "Worklight Parts",
                              "level": 4,
                              "children": [],
                              "productId": 2977
                            }
                          }
                        }
                      },
                      "productId": 2977
                    }
                  }
                },
                "Projecteur longue portée / composants": {
                  "categoryId": null,
                  "categoryName": "Projecteur longue portée / composants",
                  "level": 4,
                  "children": {
                    "Jeu de supports, phare supplémentaire": {
                      "categoryId": 100276,
                      "categoryName": "Spotlight/Parts",
                      "level": 3,
                      "children": {
                        "Projecteur longue portée / composants": {
                          "categoryId": null,
                          "categoryName": "Projecteur longue portée / composants",
                          "level": 6,
                          "children": {
                            "Jeu de supports, phare supplémentaire": {
                              "categoryId": 100443,
                              "categoryName": "Spotlight Parts",
                              "level": 4,
                              "children": [],
                              "productId": 2977
                            }
                          }
                        }
                      },
                      "productId": 2977
                    }
                  }
                }
              },
              "productId": 2977
            },
            "Kit de projecteurs longue portée": {
              "categoryId": 100787,
              "categoryName": "Additional Headlight/Parts",
              "level": 2,
              "children": {
                "Projecteur longue portée / composants": {
                  "categoryId": null,
                  "categoryName": "Projecteur longue portée / composants",
                  "level": 4,
                  "children": {
                    "Kit de projecteurs longue portée": {
                      "categoryId": 100276,
                      "categoryName": "Spotlight/Parts",
                      "level": 3,
                      "children": {
                        "Projecteur longue portée/ optique": {
                          "categoryId": null,
                          "categoryName": "Projecteur longue portée/ optique",
                          "level": 6,
                          "children": {
                            "Kit de projecteurs longue portée": {
                              "categoryId": 100439,
                              "categoryName": "Spotlight/Insert",
                              "level": 4,
                              "children": [],
                              "productId": 3330
                            }
                          }
                        }
                      },
                      "productId": 3330
                    }
                  }
                }
              },
              "productId": 3330
            },
            "Kit réparation de câble, ampoule de feux de route": {
              "categoryId": 100787,
              "categoryName": "Additional Headlight/Parts",
              "level": 2,
              "children": {
                "Projecteur longue portée / composants": {
                  "categoryId": null,
                  "categoryName": "Projecteur longue portée / composants",
                  "level": 4,
                  "children": {
                    "Kit réparation de câble, ampoule de feux de route": {
                      "categoryId": 100276,
                      "categoryName": "Spotlight/Parts",
                      "level": 3,
                      "children": {
                        "Projecteur longue portée / composants": {
                          "categoryId": null,
                          "categoryName": "Projecteur longue portée / composants",
                          "level": 6,
                          "children": {
                            "Kit réparation de câble, ampoule de feux de route": {
                              "categoryId": 100443,
                              "categoryName": "Spotlight Parts",
                              "level": 4,
                              "children": [],
                              "productId": 8788
                            }
                          }
                        }
                      },
                      "productId": 8788
                    }
                  }
                }
              },
              "productId": 8788
            },
            "Optique, projecteur longue portée": {
              "categoryId": 100787,
              "categoryName": "Additional Headlight/Parts",
              "level": 2,
              "children": {
                "Projecteur longue portée / composants": {
                  "categoryId": null,
                  "categoryName": "Projecteur longue portée / composants",
                  "level": 4,
                  "children": {
                    "Optique, projecteur longue portée": {
                      "categoryId": 100276,
                      "categoryName": "Spotlight/Parts",
                      "level": 3,
                      "children": {
                        "Projecteur longue portée/ optique": {
                          "categoryId": null,
                          "categoryName": "Projecteur longue portée/ optique",
                          "level": 6,
                          "children": {
                            "Optique, projecteur longue portée": {
                              "categoryId": 100439,
                              "categoryName": "Spotlight/Insert",
                              "level": 4,
                              "children": [],
                              "productId": 87
                            }
                          }
                        }
                      },
                      "productId": 87
                    }
                  }
                }
              },
              "productId": 87
            },
            "Projecteur longue portée": {
              "categoryId": 100787,
              "categoryName": "Additional Headlight/Parts",
              "level": 2,
              "children": {
                "Projecteur longue portée / composants": {
                  "categoryId": null,
                  "categoryName": "Projecteur longue portée / composants",
                  "level": 4,
                  "children": {
                    "Projecteur longue portée": {
                      "categoryId": 100276,
                      "categoryName": "Spotlight/Parts",
                      "level": 3,
                      "children": {
                        "Projecteur longue portée/ optique": {
                          "categoryId": null,
                          "categoryName": "Projecteur longue portée/ optique",
                          "level": 6,
                          "children": {
                            "Projecteur longue portée": {
                              "categoryId": 100439,
                              "categoryName": "Spotlight/Insert",
                              "level": 4,
                              "children": [],
                              "productId": 202
                            }
                          }
                        }
                      },
                      "productId": 202
                    }
                  }
                }
              },
              "productId": 202
            },
            "Réflecteur, projecteur longue portée": {
              "categoryId": 100787,
              "categoryName": "Additional Headlight/Parts",
              "level": 2,
              "children": {
                "Projecteur longue portée / composants": {
                  "categoryId": null,
                  "categoryName": "Projecteur longue portée / composants",
                  "level": 4,
                  "children": {
                    "Réflecteur, projecteur longue portée": {
                      "categoryId": 100276,
                      "categoryName": "Spotlight/Parts",
                      "level": 3,
                      "children": {
                        "Projecteur longue portée / composants": {
                          "categoryId": null,
                          "categoryName": "Projecteur longue portée / composants",
                          "level": 6,
                          "children": {
                            "Réflecteur, projecteur longue portée": {
                              "categoryId": 100443,
                              "categoryName": "Spotlight Parts",
                              "level": 4,
                              "children": [],
                              "productId": 713
                            }
                          }
                        }
                      },
                      "productId": 713
                    }
                  }
                }
              },
              "productId": 713
            },
            "Support, phare supplémentaire": {
              "categoryId": 100787,
              "categoryName": "Additional Headlight/Parts",
              "level": 2,
              "children": {
                "Phare chercheur / composants": {
                  "categoryId": null,
                  "categoryName": "Phare chercheur / composants",
                  "level": 4,
                  "children": {
                    "Support, phare supplémentaire": {
                      "categoryId": 100281,
                      "categoryName": "Searchlight/Parts",
                      "level": 3,
                      "children": {
                        "Composants phare chercheur": {
                          "categoryId": null,
                          "categoryName": "Composants phare chercheur",
                          "level": 6,
                          "children": {
                            "Support, phare supplémentaire": {
                              "categoryId": 100446,
                              "categoryName": "Searchlight Parts",
                              "level": 4,
                              "children": [],
                              "productId": 2976
                            }
                          }
                        }
                      },
                      "productId": 2976
                    }
                  }
                },
                "Projecteur antibrouillard/ composants": {
                  "categoryId": null,
                  "categoryName": "Projecteur antibrouillard/ composants",
                  "level": 4,
                  "children": {
                    "Support, phare supplémentaire": {
                      "categoryId": 100277,
                      "categoryName": "Front Fog Light/Parts",
                      "level": 3,
                      "children": {
                        "Composants pour projecteur antibrouillard": {
                          "categoryId": null,
                          "categoryName": "Composants pour projecteur antibrouillard",
                          "level": 6,
                          "children": {
                            "Support, phare supplémentaire": {
                              "categoryId": 100444,
                              "categoryName": "Fog Light Parts",
                              "level": 4,
                              "children": [],
                              "productId": 2976
                            }
                          }
                        }
                      },
                      "productId": 2976
                    }
                  }
                },
                "Projecteur de travail, composants": {
                  "categoryId": null,
                  "categoryName": "Projecteur de travail, composants",
                  "level": 4,
                  "children": {
                    "Support, phare supplémentaire": {
                      "categoryId": 100280,
                      "categoryName": "Worklight/Parts",
                      "level": 3,
                      "children": {
                        "Projecteur de travail, composants": {
                          "categoryId": null,
                          "categoryName": "Projecteur de travail, composants",
                          "level": 6,
                          "children": {
                            "Support, phare supplémentaire": {
                              "categoryId": 100445,
                              "categoryName": "Worklight Parts",
                              "level": 4,
                              "children": [],
                              "productId": 2976
                            }
                          }
                        }
                      },
                      "productId": 2976
                    }
                  }
                },
                "Projecteur longue portée / composants": {
                  "categoryId": null,
                  "categoryName": "Projecteur longue portée / composants",
                  "level": 4,
                  "children": {
                    "Support, phare supplémentaire": {
                      "categoryId": 100276,
                      "categoryName": "Spotlight/Parts",
                      "level": 3,
                      "children": {
                        "Projecteur longue portée / composants": {
                          "categoryId": null,
                          "categoryName": "Projecteur longue portée / composants",
                          "level": 6,
                          "children": {
                            "Support, phare supplémentaire": {
                              "categoryId": 100443,
                              "categoryName": "Spotlight Parts",
                              "level": 4,
                              "children": [],
                              "productId": 2976
                            }
                          }
                        }
                      },
                      "productId": 2976
                    }
                  }
                }
              },
              "productId": 2976
            },
            "Support, projecteur longue portée": {
              "categoryId": 100787,
              "categoryName": "Additional Headlight/Parts",
              "level": 2,
              "children": {
                "Projecteur longue portée / composants": {
                  "categoryId": null,
                  "categoryName": "Projecteur longue portée / composants",
                  "level": 4,
                  "children": {
                    "Support, projecteur longue portée": {
                      "categoryId": 100276,
                      "categoryName": "Spotlight/Parts",
                      "level": 3,
                      "children": {
                        "Projecteur longue portée / composants": {
                          "categoryId": null,
                          "categoryName": "Projecteur longue portée / composants",
                          "level": 6,
                          "children": {
                            "Support, projecteur longue portée": {
                              "categoryId": 100443,
                              "categoryName": "Spotlight Parts",
                              "level": 4,
                              "children": [],
                              "productId": 100
                            }
                          }
                        }
                      },
                      "productId": 100
                    }
                  }
                }
              },
              "productId": 100
            }
          }
        },
        "Projecteurs principaux / composants": {
          "categoryId": null,
          "categoryName": "Projecteurs principaux / composants",
          "level": 2,
          "children": {
            "Ampoule, feu de route/diurne": {
              "categoryId": 100143,
              "categoryName": "Headlight/Parts",
              "level": 2,
              "children": {
                "Ampoule /projecteur longue portée": {
                  "categoryId": null,
                  "categoryName": "Ampoule /projecteur longue portée",
                  "level": 4,
                  "children": {
                    "Ampoule, feu de route/diurne": {
                      "categoryId": 706742,
                      "categoryName": "Spotlight Bulb",
                      "level": 3,
                      "children": [],
                      "productId": 60366
                    }
                  }
                }
              },
              "productId": 60366
            },
            "Ampoule, feu de route/diurne/position": {
              "categoryId": 100143,
              "categoryName": "Headlight/Parts",
              "level": 2,
              "children": {
                "Ampoule /projecteur longue portée": {
                  "categoryId": null,
                  "categoryName": "Ampoule /projecteur longue portée",
                  "level": 4,
                  "children": {
                    "Ampoule, feu de route/diurne/position": {
                      "categoryId": 706742,
                      "categoryName": "Spotlight Bulb",
                      "level": 3,
                      "children": [],
                      "productId": 60365
                    }
                  }
                }
              },
              "productId": 60365
            },
            "Ampoule, projecteur longue portée": {
              "categoryId": 100143,
              "categoryName": "Headlight/Parts",
              "level": 2,
              "children": {
                "Ampoule /projecteur longue portée": {
                  "categoryId": null,
                  "categoryName": "Ampoule /projecteur longue portée",
                  "level": 4,
                  "children": {
                    "Ampoule, projecteur longue portée": {
                      "categoryId": 706742,
                      "categoryName": "Spotlight Bulb",
                      "level": 3,
                      "children": [],
                      "productId": 106
                    }
                  }
                }
              },
              "productId": 106
            }
          }
        },
        "Relais": {
          "categoryId": null,
          "categoryName": "Relais",
          "level": 2,
          "children": {
            "Relais, projecteur longue portée": {
              "categoryId": 100785,
              "categoryName": "Relay",
              "level": 2,
              "children": [],
              "productId": 1287
            }
          }
        }
      }
    }
  },
  "arborescenceText": "├── Carrosserie [ID: 100001] (Niveau 1)\n│   ├── Avant du véhicule (Niveau 2)\n│   │   ├── Vehicle Front [ID: 101648] (Niveau 2) → ProductId: 60366\n│   │   │   └── Projecteur longue portée / composants (Niveau 4)\n│   │   │       └── Spotlight/Parts [ID: 101665] (Niveau 3) → ProductId: 60366\n│   │   │           └── Ampoule /projecteur longue portée (Niveau 6)\n│   │   │               └── Spotlight Bulb [ID: 101667] (Niveau 4) → ProductId: 60366\n│   │   ├── Vehicle Front [ID: 101648] (Niveau 2) → ProductId: 60365\n│   │   │   └── Projecteur longue portée / composants (Niveau 4)\n│   │   │       └── Spotlight/Parts [ID: 101665] (Niveau 3) → ProductId: 60365\n│   │   │           └── Ampoule /projecteur longue portée (Niveau 6)\n│   │   │               └── Spotlight Bulb [ID: 101667] (Niveau 4) → ProductId: 60365\n│   │   ├── Vehicle Front [ID: 101648] (Niveau 2) → ProductId: 106\n│   │   │   └── Projecteur longue portée / composants (Niveau 4)\n│   │   │       └── Spotlight/Parts [ID: 101665] (Niveau 3) → ProductId: 106\n│   │   │           └── Ampoule /projecteur longue portée (Niveau 6)\n│   │   │               └── Spotlight Bulb [ID: 101667] (Niveau 4) → ProductId: 106\n│   │   ├── Vehicle Front [ID: 101648] (Niveau 2) → ProductId: 716\n│   │   │   └── Projecteur longue portée / composants (Niveau 4)\n│   │   │       └── Spotlight/Parts [ID: 101665] (Niveau 3) → ProductId: 716\n│   │   │           └── Projecteur longue portée / composants (Niveau 6)\n│   │   │               └── Spotlight Parts [ID: 101668] (Niveau 4) → ProductId: 716\n│   │   ├── Vehicle Front [ID: 101648] (Niveau 2) → ProductId: 715\n│   │   │   ├── Composants/suppléments (Niveau 4)\n│   │   │   │   └── Parts [ID: 101673] (Niveau 3) → ProductId: 715\n│   │   │   │       └── Fixation/Support/collerette (Niveau 6)\n│   │   │   │           └── Racks/Carriers/Frames [ID: 101773] (Niveau 4) → ProductId: 715\n│   │   │   └── Projecteur longue portée / composants (Niveau 4)\n│   │   │       └── Spotlight/Parts [ID: 101665] (Niveau 3) → ProductId: 715\n│   │   │           └── Projecteur longue portée / composants (Niveau 6)\n│   │   │               └── Spotlight Parts [ID: 101668] (Niveau 4) → ProductId: 715\n│   │   ├── Vehicle Front [ID: 101648] (Niveau 2) → ProductId: 1076\n│   │   │   └── Projecteur longue portée / composants (Niveau 4)\n│   │   │       └── Spotlight/Parts [ID: 101665] (Niveau 3) → ProductId: 1076\n│   │   │           └── Projecteur longue portée / composants (Niveau 6)\n│   │   │               └── Spotlight Parts [ID: 101668] (Niveau 4) → ProductId: 1076\n│   │   ├── Vehicle Front [ID: 101648] (Niveau 2) → ProductId: 16\n│   │   │   └── Projecteur longue portée / composants (Niveau 4)\n│   │   │       └── Spotlight/Parts [ID: 101665] (Niveau 3) → ProductId: 16\n│   │   │           └── Projecteur longue portée / composants (Niveau 6)\n│   │   │               └── Spotlight Parts [ID: 101668] (Niveau 4) → ProductId: 16\n│   │   ├── Vehicle Front [ID: 101648] (Niveau 2) → ProductId: 488\n│   │   │   └── Projecteur longue portée / composants (Niveau 4)\n│   │   │       └── Spotlight/Parts [ID: 101665] (Niveau 3) → ProductId: 488\n│   │   │           └── Projecteur longue portée / composants (Niveau 6)\n│   │   │               └── Spotlight Parts [ID: 101668] (Niveau 4) → ProductId: 488\n│   │   ├── Vehicle Front [ID: 101648] (Niveau 2) → ProductId: 856\n│   │   │   ├── Composants/suppléments (Niveau 4)\n│   │   │   │   └── Parts [ID: 101673] (Niveau 3) → ProductId: 856\n│   │   │   │       └── Fixation/Support/collerette (Niveau 6)\n│   │   │   │           └── Racks/Carriers/Frames [ID: 101773] (Niveau 4) → ProductId: 856\n│   │   │   └── Projecteur longue portée / composants (Niveau 4)\n│   │   │       └── Spotlight/Parts [ID: 101665] (Niveau 3) → ProductId: 856\n│   │   │           └── Projecteur longue portée / composants (Niveau 6)\n│   │   │               └── Spotlight Parts [ID: 101668] (Niveau 4) → ProductId: 856\n│   │   ├── Vehicle Front [ID: 101648] (Niveau 2) → ProductId: 427\n│   │   │   └── Projecteur longue portée / composants (Niveau 4)\n│   │   │       └── Spotlight/Parts [ID: 101665] (Niveau 3) → ProductId: 427\n│   │   │           └── Projecteur longue portée / composants (Niveau 6)\n│   │   │               └── Spotlight Parts [ID: 101668] (Niveau 4) → ProductId: 427\n│   │   ├── Vehicle Front [ID: 101648] (Niveau 2) → ProductId: 3330\n│   │   │   └── Projecteur longue portée / composants (Niveau 4)\n│   │   │       └── Spotlight/Parts [ID: 101665] (Niveau 3) → ProductId: 3330\n│   │   │           └── Projecteur longue portée/ optique (Niveau 6)\n│   │   │               └── Spotlight/Insert [ID: 101666] (Niveau 4) → ProductId: 3330\n│   │   ├── Vehicle Front [ID: 101648] (Niveau 2) → ProductId: 87\n│   │   │   └── Projecteur longue portée / composants (Niveau 4)\n│   │   │       └── Spotlight/Parts [ID: 101665] (Niveau 3) → ProductId: 87\n│   │   │           └── Projecteur longue portée/ optique (Niveau 6)\n│   │   │               └── Spotlight/Insert [ID: 101666] (Niveau 4) → ProductId: 87\n│   │   ├── Vehicle Front [ID: 101648] (Niveau 2) → ProductId: 202\n│   │   │   └── Projecteur longue portée / composants (Niveau 4)\n│   │   │       └── Spotlight/Parts [ID: 101665] (Niveau 3) → ProductId: 202\n│   │   │           └── Projecteur longue portée/ optique (Niveau 6)\n│   │   │               └── Spotlight/Insert [ID: 101666] (Niveau 4) → ProductId: 202\n│   │   ├── Vehicle Front [ID: 101648] (Niveau 2) → ProductId: 713\n│   │   │   └── Projecteur longue portée / composants (Niveau 4)\n│   │   │       └── Spotlight/Parts [ID: 101665] (Niveau 3) → ProductId: 713\n│   │   │           └── Projecteur longue portée / composants (Niveau 6)\n│   │   │               └── Spotlight Parts [ID: 101668] (Niveau 4) → ProductId: 713\n│   │   └── Vehicle Front [ID: 101648] (Niveau 2) → ProductId: 100\n│   │       └── Projecteur longue portée / composants (Niveau 4)\n│   │           └── Spotlight/Parts [ID: 101665] (Niveau 3) → ProductId: 100\n│   │               └── Projecteur longue portée / composants (Niveau 6)\n│   │                   └── Spotlight Parts [ID: 101668] (Niveau 4) → ProductId: 100\n│   ├── Fixation/Support/collerette (Niveau 2)\n│   │   ├── Racks/Carriers/Frames [ID: 101454] (Niveau 2) → ProductId: 715\n│   │   └── Racks/Carriers/Frames [ID: 101454] (Niveau 2) → ProductId: 856\n│   └── Phares supplémentaires/composants (Niveau 2)\n│       ├── Additional Headlight/Parts [ID: 101340] (Niveau 2) → ProductId: 60366\n│       │   └── Projecteur longue portée / composants (Niveau 4)\n│       │       └── Spotlight/Parts [ID: 101345] (Niveau 3) → ProductId: 60366\n│       │           └── Ampoule /projecteur longue portée (Niveau 6)\n│       │               └── Spotlight Bulb [ID: 101347] (Niveau 4) → ProductId: 60366\n│       ├── Additional Headlight/Parts [ID: 101340] (Niveau 2) → ProductId: 60365\n│       │   └── Projecteur longue portée / composants (Niveau 4)\n│       │       └── Spotlight/Parts [ID: 101345] (Niveau 3) → ProductId: 60365\n│       │           └── Ampoule /projecteur longue portée (Niveau 6)\n│       │               └── Spotlight Bulb [ID: 101347] (Niveau 4) → ProductId: 60365\n│       ├── Additional Headlight/Parts [ID: 101340] (Niveau 2) → ProductId: 106\n│       │   └── Projecteur longue portée / composants (Niveau 4)\n│       │       └── Spotlight/Parts [ID: 101345] (Niveau 3) → ProductId: 106\n│       │           └── Ampoule /projecteur longue portée (Niveau 6)\n│       │               └── Spotlight Bulb [ID: 101347] (Niveau 4) → ProductId: 106\n│       ├── Additional Headlight/Parts [ID: 101340] (Niveau 2) → ProductId: 716\n│       │   └── Projecteur longue portée / composants (Niveau 4)\n│       │       └── Spotlight/Parts [ID: 101345] (Niveau 3) → ProductId: 716\n│       │           └── Projecteur longue portée / composants (Niveau 6)\n│       │               └── Spotlight Parts [ID: 101348] (Niveau 4) → ProductId: 716\n│       ├── Additional Headlight/Parts [ID: 101340] (Niveau 2) → ProductId: 715\n│       │   └── Projecteur longue portée / composants (Niveau 4)\n│       │       └── Spotlight/Parts [ID: 101345] (Niveau 3) → ProductId: 715\n│       │           └── Projecteur longue portée / composants (Niveau 6)\n│       │               └── Spotlight Parts [ID: 101348] (Niveau 4) → ProductId: 715\n│       ├── Additional Headlight/Parts [ID: 101340] (Niveau 2) → ProductId: 1076\n│       │   └── Projecteur longue portée / composants (Niveau 4)\n│       │       └── Spotlight/Parts [ID: 101345] (Niveau 3) → ProductId: 1076\n│       │           └── Projecteur longue portée / composants (Niveau 6)\n│       │               └── Spotlight Parts [ID: 101348] (Niveau 4) → ProductId: 1076\n│       ├── Additional Headlight/Parts [ID: 101340] (Niveau 2) → ProductId: 16\n│       │   └── Projecteur longue portée / composants (Niveau 4)\n│       │       └── Spotlight/Parts [ID: 101345] (Niveau 3) → ProductId: 16\n│       │           └── Projecteur longue portée / composants (Niveau 6)\n│       │               └── Spotlight Parts [ID: 101348] (Niveau 4) → ProductId: 16\n│       ├── Additional Headlight/Parts [ID: 101340] (Niveau 2) → ProductId: 488\n│       │   └── Projecteur longue portée / composants (Niveau 4)\n│       │       └── Spotlight/Parts [ID: 101345] (Niveau 3) → ProductId: 488\n│       │           └── Projecteur longue portée / composants (Niveau 6)\n│       │               └── Spotlight Parts [ID: 101348] (Niveau 4) → ProductId: 488\n│       ├── Additional Headlight/Parts [ID: 101340] (Niveau 2) → ProductId: 856\n│       │   └── Projecteur longue portée / composants (Niveau 4)\n│       │       └── Spotlight/Parts [ID: 101345] (Niveau 3) → ProductId: 856\n│       │           └── Projecteur longue portée / composants (Niveau 6)\n│       │               └── Spotlight Parts [ID: 101348] (Niveau 4) → ProductId: 856\n│       ├── Additional Headlight/Parts [ID: 101340] (Niveau 2) → ProductId: 427\n│       │   └── Projecteur longue portée / composants (Niveau 4)\n│       │       └── Spotlight/Parts [ID: 101345] (Niveau 3) → ProductId: 427\n│       │           └── Projecteur longue portée / composants (Niveau 6)\n│       │               └── Spotlight Parts [ID: 101348] (Niveau 4) → ProductId: 427\n│       ├── Additional Headlight/Parts [ID: 101340] (Niveau 2) → ProductId: 3330\n│       │   └── Projecteur longue portée / composants (Niveau 4)\n│       │       └── Spotlight/Parts [ID: 101345] (Niveau 3) → ProductId: 3330\n│       │           └── Projecteur longue portée/ optique (Niveau 6)\n│       │               └── Spotlight/Insert [ID: 101346] (Niveau 4) → ProductId: 3330\n│       ├── Additional Headlight/Parts [ID: 101340] (Niveau 2) → ProductId: 87\n│       │   └── Projecteur longue portée / composants (Niveau 4)\n│       │       └── Spotlight/Parts [ID: 101345] (Niveau 3) → ProductId: 87\n│       │           └── Projecteur longue portée/ optique (Niveau 6)\n│       │               └── Spotlight/Insert [ID: 101346] (Niveau 4) → ProductId: 87\n│       ├── Additional Headlight/Parts [ID: 101340] (Niveau 2) → ProductId: 202\n│       │   └── Projecteur longue portée / composants (Niveau 4)\n│       │       └── Spotlight/Parts [ID: 101345] (Niveau 3) → ProductId: 202\n│       │           └── Projecteur longue portée/ optique (Niveau 6)\n│       │               └── Spotlight/Insert [ID: 101346] (Niveau 4) → ProductId: 202\n│       ├── Additional Headlight/Parts [ID: 101340] (Niveau 2) → ProductId: 713\n│       │   └── Projecteur longue portée / composants (Niveau 4)\n│       │       └── Spotlight/Parts [ID: 101345] (Niveau 3) → ProductId: 713\n│       │           └── Projecteur longue portée / composants (Niveau 6)\n│       │               └── Spotlight Parts [ID: 101348] (Niveau 4) → ProductId: 713\n│       └── Additional Headlight/Parts [ID: 101340] (Niveau 2) → ProductId: 100\n│           └── Projecteur longue portée / composants (Niveau 4)\n│               └── Spotlight/Parts [ID: 101345] (Niveau 3) → ProductId: 100\n│                   └── Projecteur longue portée / composants (Niveau 6)\n│                       └── Spotlight Parts [ID: 101348] (Niveau 4) → ProductId: 100\n\n└── Système électrique [ID: 100010] (Niveau 1)\n    ├── Interrupteur/Relais/Contrôle clignotant/Appareil d.commande (Niveau 2)\n    │   └── Light Switches/Relays/Controls [ID: 100307] (Niveau 2) → ProductId: 1287\n    │       └── Relais (Niveau 4)\n    │           └── Relay [ID: 100510] (Niveau 3) → ProductId: 1287\n    ├── Kit/pièces de câble (Niveau 2)\n    │   └── Cable Set/individual parts [ID: 103066] (Niveau 2) → ProductId: 427\n    ├── Phares supplémentaires/composants (Niveau 2)\n    │   ├── Additional Headlight/Parts [ID: 100787] (Niveau 2) → ProductId: 60366\n    │   │   └── Projecteur longue portée / composants (Niveau 4)\n    │   │       └── Spotlight/Parts [ID: 100276] (Niveau 3) → ProductId: 60366\n    │   │           └── Ampoule /projecteur longue portée (Niveau 6)\n    │   │               └── Spotlight Bulb [ID: 100442] (Niveau 4) → ProductId: 60366\n    │   ├── Additional Headlight/Parts [ID: 100787] (Niveau 2) → ProductId: 60365\n    │   │   └── Projecteur longue portée / composants (Niveau 4)\n    │   │       └── Spotlight/Parts [ID: 100276] (Niveau 3) → ProductId: 60365\n    │   │           └── Ampoule /projecteur longue portée (Niveau 6)\n    │   │               └── Spotlight Bulb [ID: 100442] (Niveau 4) → ProductId: 60365\n    │   ├── Additional Headlight/Parts [ID: 100787] (Niveau 2) → ProductId: 106\n    │   │   └── Projecteur longue portée / composants (Niveau 4)\n    │   │       └── Spotlight/Parts [ID: 100276] (Niveau 3) → ProductId: 106\n    │   │           └── Ampoule /projecteur longue portée (Niveau 6)\n    │   │               └── Spotlight Bulb [ID: 100442] (Niveau 4) → ProductId: 106\n    │   ├── Additional Headlight/Parts [ID: 100787] (Niveau 2) → ProductId: 716\n    │   │   └── Projecteur longue portée / composants (Niveau 4)\n    │   │       └── Spotlight/Parts [ID: 100276] (Niveau 3) → ProductId: 716\n    │   │           └── Projecteur longue portée / composants (Niveau 6)\n    │   │               └── Spotlight Parts [ID: 100443] (Niveau 4) → ProductId: 716\n    │   ├── Additional Headlight/Parts [ID: 100787] (Niveau 2) → ProductId: 715\n    │   │   └── Projecteur longue portée / composants (Niveau 4)\n    │   │       └── Spotlight/Parts [ID: 100276] (Niveau 3) → ProductId: 715\n    │   │           └── Projecteur longue portée / composants (Niveau 6)\n    │   │               └── Spotlight Parts [ID: 100443] (Niveau 4) → ProductId: 715\n    │   ├── Additional Headlight/Parts [ID: 100787] (Niveau 2) → ProductId: 1076\n    │   │   └── Projecteur longue portée / composants (Niveau 4)\n    │   │       └── Spotlight/Parts [ID: 100276] (Niveau 3) → ProductId: 1076\n    │   │           └── Projecteur longue portée / composants (Niveau 6)\n    │   │               └── Spotlight Parts [ID: 100443] (Niveau 4) → ProductId: 1076\n    │   ├── Additional Headlight/Parts [ID: 100787] (Niveau 2) → ProductId: 16\n    │   │   └── Projecteur longue portée / composants (Niveau 4)\n    │   │       └── Spotlight/Parts [ID: 100276] (Niveau 3) → ProductId: 16\n    │   │           └── Projecteur longue portée / composants (Niveau 6)\n    │   │               └── Spotlight Parts [ID: 100443] (Niveau 4) → ProductId: 16\n    │   ├── Additional Headlight/Parts [ID: 100787] (Niveau 2) → ProductId: 488\n    │   │   └── Projecteur longue portée / composants (Niveau 4)\n    │   │       └── Spotlight/Parts [ID: 100276] (Niveau 3) → ProductId: 488\n    │   │           └── Projecteur longue portée / composants (Niveau 6)\n    │   │               └── Spotlight Parts [ID: 100443] (Niveau 4) → ProductId: 488\n    │   ├── Additional Headlight/Parts [ID: 100787] (Niveau 2) → ProductId: 856\n    │   │   └── Projecteur longue portée / composants (Niveau 4)\n    │   │       └── Spotlight/Parts [ID: 100276] (Niveau 3) → ProductId: 856\n    │   │           └── Projecteur longue portée / composants (Niveau 6)\n    │   │               └── Spotlight Parts [ID: 100443] (Niveau 4) → ProductId: 856\n    │   ├── Additional Headlight/Parts [ID: 100787] (Niveau 2) → ProductId: 427\n    │   │   └── Projecteur longue portée / composants (Niveau 4)\n    │   │       └── Spotlight/Parts [ID: 100276] (Niveau 3) → ProductId: 427\n    │   │           └── Projecteur longue portée / composants (Niveau 6)\n    │   │               └── Spotlight Parts [ID: 100443] (Niveau 4) → ProductId: 427\n    │   ├── Additional Headlight/Parts [ID: 100787] (Niveau 2) → ProductId: 2977\n    │   │   ├── Phare chercheur / composants (Niveau 4)\n    │   │   │   └── Searchlight/Parts [ID: 100281] (Niveau 3) → ProductId: 2977\n    │   │   │       └── Composants phare chercheur (Niveau 6)\n    │   │   │           └── Searchlight Parts [ID: 100446] (Niveau 4) → ProductId: 2977\n    │   │   ├── Projecteur antibrouillard/ composants (Niveau 4)\n    │   │   │   └── Front Fog Light/Parts [ID: 100277] (Niveau 3) → ProductId: 2977\n    │   │   │       └── Composants pour projecteur antibrouillard (Niveau 6)\n    │   │   │           └── Fog Light Parts [ID: 100444] (Niveau 4) → ProductId: 2977\n    │   │   ├── Projecteur de travail, composants (Niveau 4)\n    │   │   │   └── Worklight/Parts [ID: 100280] (Niveau 3) → ProductId: 2977\n    │   │   │       └── Projecteur de travail, composants (Niveau 6)\n    │   │   │           └── Worklight Parts [ID: 100445] (Niveau 4) → ProductId: 2977\n    │   │   └── Projecteur longue portée / composants (Niveau 4)\n    │   │       └── Spotlight/Parts [ID: 100276] (Niveau 3) → ProductId: 2977\n    │   │           └── Projecteur longue portée / composants (Niveau 6)\n    │   │               └── Spotlight Parts [ID: 100443] (Niveau 4) → ProductId: 2977\n    │   ├── Additional Headlight/Parts [ID: 100787] (Niveau 2) → ProductId: 3330\n    │   │   └── Projecteur longue portée / composants (Niveau 4)\n    │   │       └── Spotlight/Parts [ID: 100276] (Niveau 3) → ProductId: 3330\n    │   │           └── Projecteur longue portée/ optique (Niveau 6)\n    │   │               └── Spotlight/Insert [ID: 100439] (Niveau 4) → ProductId: 3330\n    │   ├── Additional Headlight/Parts [ID: 100787] (Niveau 2) → ProductId: 8788\n    │   │   └── Projecteur longue portée / composants (Niveau 4)\n    │   │       └── Spotlight/Parts [ID: 100276] (Niveau 3) → ProductId: 8788\n    │   │           └── Projecteur longue portée / composants (Niveau 6)\n    │   │               └── Spotlight Parts [ID: 100443] (Niveau 4) → ProductId: 8788\n    │   ├── Additional Headlight/Parts [ID: 100787] (Niveau 2) → ProductId: 87\n    │   │   └── Projecteur longue portée / composants (Niveau 4)\n    │   │       └── Spotlight/Parts [ID: 100276] (Niveau 3) → ProductId: 87\n    │   │           └── Projecteur longue portée/ optique (Niveau 6)\n    │   │               └── Spotlight/Insert [ID: 100439] (Niveau 4) → ProductId: 87\n    │   ├── Additional Headlight/Parts [ID: 100787] (Niveau 2) → ProductId: 202\n    │   │   └── Projecteur longue portée / composants (Niveau 4)\n    │   │       └── Spotlight/Parts [ID: 100276] (Niveau 3) → ProductId: 202\n    │   │           └── Projecteur longue portée/ optique (Niveau 6)\n    │   │               └── Spotlight/Insert [ID: 100439] (Niveau 4) → ProductId: 202\n    │   ├── Additional Headlight/Parts [ID: 100787] (Niveau 2) → ProductId: 713\n    │   │   └── Projecteur longue portée / composants (Niveau 4)\n    │   │       └── Spotlight/Parts [ID: 100276] (Niveau 3) → ProductId: 713\n    │   │           └── Projecteur longue portée / composants (Niveau 6)\n    │   │               └── Spotlight Parts [ID: 100443] (Niveau 4) → ProductId: 713\n    │   ├── Additional Headlight/Parts [ID: 100787] (Niveau 2) → ProductId: 2976\n    │   │   ├── Phare chercheur / composants (Niveau 4)\n    │   │   │   └── Searchlight/Parts [ID: 100281] (Niveau 3) → ProductId: 2976\n    │   │   │       └── Composants phare chercheur (Niveau 6)\n    │   │   │           └── Searchlight Parts [ID: 100446] (Niveau 4) → ProductId: 2976\n    │   │   ├── Projecteur antibrouillard/ composants (Niveau 4)\n    │   │   │   └── Front Fog Light/Parts [ID: 100277] (Niveau 3) → ProductId: 2976\n    │   │   │       └── Composants pour projecteur antibrouillard (Niveau 6)\n    │   │   │           └── Fog Light Parts [ID: 100444] (Niveau 4) → ProductId: 2976\n    │   │   ├── Projecteur de travail, composants (Niveau 4)\n    │   │   │   └── Worklight/Parts [ID: 100280] (Niveau 3) → ProductId: 2976\n    │   │   │       └── Projecteur de travail, composants (Niveau 6)\n    │   │   │           └── Worklight Parts [ID: 100445] (Niveau 4) → ProductId: 2976\n    │   │   └── Projecteur longue portée / composants (Niveau 4)\n    │   │       └── Spotlight/Parts [ID: 100276] (Niveau 3) → ProductId: 2976\n    │   │           └── Projecteur longue portée / composants (Niveau 6)\n    │   │               └── Spotlight Parts [ID: 100443] (Niveau 4) → ProductId: 2976\n    │   └── Additional Headlight/Parts [ID: 100787] (Niveau 2) → ProductId: 100\n    │       └── Projecteur longue portée / composants (Niveau 4)\n    │           └── Spotlight/Parts [ID: 100276] (Niveau 3) → ProductId: 100\n    │               └── Projecteur longue portée / composants (Niveau 6)\n    │                   └── Spotlight Parts [ID: 100443] (Niveau 4) → ProductId: 100\n    ├── Projecteurs principaux / composants (Niveau 2)\n    │   ├── Headlight/Parts [ID: 100143] (Niveau 2) → ProductId: 60366\n    │   │   └── Ampoule /projecteur longue portée (Niveau 4)\n    │   │       └── Spotlight Bulb [ID: 706742] (Niveau 3) → ProductId: 60366\n    │   ├── Headlight/Parts [ID: 100143] (Niveau 2) → ProductId: 60365\n    │   │   └── Ampoule /projecteur longue portée (Niveau 4)\n    │   │       └── Spotlight Bulb [ID: 706742] (Niveau 3) → ProductId: 60365\n    │   └── Headlight/Parts [ID: 100143] (Niveau 2) → ProductId: 106\n    │       └── Ampoule /projecteur longue portée (Niveau 4)\n    │           └── Spotlight Bulb [ID: 706742] (Niveau 3) → ProductId: 106\n    └── Relais (Niveau 2)\n        └── Relay [ID: 100785] (Niveau 2) → ProductId: 1287",
  "arborescencePaths": [
    {
      "path": [
        "Carrosserie",
        "Avant du véhicule",
        "Vehicle Front"
      ],
      "categoryIds": [
        100001,
        null,
        101648
      ],
      "finalCategoryId": 101648,
      "productId": 60366
    },
    {
      "path": [
        "Carrosserie",
        "Avant du véhicule",
        "Vehicle Front"
      ],
      "categoryIds": [
        100001,
        null,
        101648
      ],
      "finalCategoryId": 101648,
      "productId": 60365
    },
    {
      "path": [
        "Carrosserie",
        "Avant du véhicule",
        "Vehicle Front"
      ],
      "categoryIds": [
        100001,
        null,
        101648
      ],
      "finalCategoryId": 101648,
      "productId": 106
    },
    {
      "path": [
        "Carrosserie",
        "Avant du véhicule",
        "Vehicle Front"
      ],
      "categoryIds": [
        100001,
        null,
        101648
      ],
      "finalCategoryId": 101648,
      "productId": 716
    },
    {
      "path": [
        "Carrosserie",
        "Avant du véhicule",
        "Vehicle Front"
      ],
      "categoryIds": [
        100001,
        null,
        101648
      ],
      "finalCategoryId": 101648,
      "productId": 715
    },
    {
      "path": [
        "Carrosserie",
        "Avant du véhicule",
        "Vehicle Front"
      ],
      "categoryIds": [
        100001,
        null,
        101648
      ],
      "finalCategoryId": 101648,
      "productId": 1076
    },
    {
      "path": [
        "Carrosserie",
        "Avant du véhicule",
        "Vehicle Front"
      ],
      "categoryIds": [
        100001,
        null,
        101648
      ],
      "finalCategoryId": 101648,
      "productId": 16
    },
    {
      "path": [
        "Carrosserie",
        "Avant du véhicule",
        "Vehicle Front"
      ],
      "categoryIds": [
        100001,
        null,
        101648
      ],
      "finalCategoryId": 101648,
      "productId": 488
    },
    {
      "path": [
        "Carrosserie",
        "Avant du véhicule",
        "Vehicle Front"
      ],
      "categoryIds": [
        100001,
        null,
        101648
      ],
      "finalCategoryId": 101648,
      "productId": 856
    },
    {
      "path": [
        "Carrosserie",
        "Avant du véhicule",
        "Vehicle Front"
      ],
      "categoryIds": [
        100001,
        null,
        101648
      ],
      "finalCategoryId": 101648,
      "productId": 427
    },
    {
      "path": [
        "Carrosserie",
        "Avant du véhicule",
        "Vehicle Front"
      ],
      "categoryIds": [
        100001,
        null,
        101648
      ],
      "finalCategoryId": 101648,
      "productId": 3330
    },
    {
      "path": [
        "Carrosserie",
        "Avant du véhicule",
        "Vehicle Front"
      ],
      "categoryIds": [
        100001,
        null,
        101648
      ],
      "finalCategoryId": 101648,
      "productId": 87
    },
    {
      "path": [
        "Carrosserie",
        "Avant du véhicule",
        "Vehicle Front"
      ],
      "categoryIds": [
        100001,
        null,
        101648
      ],
      "finalCategoryId": 101648,
      "productId": 202
    },
    {
      "path": [
        "Carrosserie",
        "Avant du véhicule",
        "Vehicle Front"
      ],
      "categoryIds": [
        100001,
        null,
        101648
      ],
      "finalCategoryId": 101648,
      "productId": 713
    },
    {
      "path": [
        "Carrosserie",
        "Avant du véhicule",
        "Vehicle Front"
      ],
      "categoryIds": [
        100001,
        null,
        101648
      ],
      "finalCategoryId": 101648,
      "productId": 100
    },
    {
      "path": [
        "Carrosserie",
        "Fixation/Support/collerette",
        "Racks/Carriers/Frames"
      ],
      "categoryIds": [
        100001,
        null,
        101454
      ],
      "finalCategoryId": 101454,
      "productId": 715
    },
    {
      "path": [
        "Carrosserie",
        "Fixation/Support/collerette",
        "Racks/Carriers/Frames"
      ],
      "categoryIds": [
        100001,
        null,
        101454
      ],
      "finalCategoryId": 101454,
      "productId": 856
    },
    {
      "path": [
        "Carrosserie",
        "Phares supplémentaires/composants",
        "Additional Headlight/Parts"
      ],
      "categoryIds": [
        100001,
        null,
        101340
      ],
      "finalCategoryId": 101340,
      "productId": 60366
    },
    {
      "path": [
        "Carrosserie",
        "Phares supplémentaires/composants",
        "Additional Headlight/Parts"
      ],
      "categoryIds": [
        100001,
        null,
        101340
      ],
      "finalCategoryId": 101340,
      "productId": 60365
    },
    {
      "path": [
        "Carrosserie",
        "Phares supplémentaires/composants",
        "Additional Headlight/Parts"
      ],
      "categoryIds": [
        100001,
        null,
        101340
      ],
      "finalCategoryId": 101340,
      "productId": 106
    },
    {
      "path": [
        "Carrosserie",
        "Phares supplémentaires/composants",
        "Additional Headlight/Parts"
      ],
      "categoryIds": [
        100001,
        null,
        101340
      ],
      "finalCategoryId": 101340,
      "productId": 716
    },
    {
      "path": [
        "Carrosserie",
        "Phares supplémentaires/composants",
        "Additional Headlight/Parts"
      ],
      "categoryIds": [
        100001,
        null,
        101340
      ],
      "finalCategoryId": 101340,
      "productId": 715
    },
    {
      "path": [
        "Carrosserie",
        "Phares supplémentaires/composants",
        "Additional Headlight/Parts"
      ],
      "categoryIds": [
        100001,
        null,
        101340
      ],
      "finalCategoryId": 101340,
      "productId": 1076
    },
    {
      "path": [
        "Carrosserie",
        "Phares supplémentaires/composants",
        "Additional Headlight/Parts"
      ],
      "categoryIds": [
        100001,
        null,
        101340
      ],
      "finalCategoryId": 101340,
      "productId": 16
    },
    {
      "path": [
        "Carrosserie",
        "Phares supplémentaires/composants",
        "Additional Headlight/Parts"
      ],
      "categoryIds": [
        100001,
        null,
        101340
      ],
      "finalCategoryId": 101340,
      "productId": 488
    },
    {
      "path": [
        "Carrosserie",
        "Phares supplémentaires/composants",
        "Additional Headlight/Parts"
      ],
      "categoryIds": [
        100001,
        null,
        101340
      ],
      "finalCategoryId": 101340,
      "productId": 856
    },
    {
      "path": [
        "Carrosserie",
        "Phares supplémentaires/composants",
        "Additional Headlight/Parts"
      ],
      "categoryIds": [
        100001,
        null,
        101340
      ],
      "finalCategoryId": 101340,
      "productId": 427
    },
    {
      "path": [
        "Carrosserie",
        "Phares supplémentaires/composants",
        "Additional Headlight/Parts"
      ],
      "categoryIds": [
        100001,
        null,
        101340
      ],
      "finalCategoryId": 101340,
      "productId": 3330
    },
    {
      "path": [
        "Carrosserie",
        "Phares supplémentaires/composants",
        "Additional Headlight/Parts"
      ],
      "categoryIds": [
        100001,
        null,
        101340
      ],
      "finalCategoryId": 101340,
      "productId": 87
    },
    {
      "path": [
        "Carrosserie",
        "Phares supplémentaires/composants",
        "Additional Headlight/Parts"
      ],
      "categoryIds": [
        100001,
        null,
        101340
      ],
      "finalCategoryId": 101340,
      "productId": 202
    },
    {
      "path": [
        "Carrosserie",
        "Phares supplémentaires/composants",
        "Additional Headlight/Parts"
      ],
      "categoryIds": [
        100001,
        null,
        101340
      ],
      "finalCategoryId": 101340,
      "productId": 713
    },
    {
      "path": [
        "Carrosserie",
        "Phares supplémentaires/composants",
        "Additional Headlight/Parts"
      ],
      "categoryIds": [
        100001,
        null,
        101340
      ],
      "finalCategoryId": 101340,
      "productId": 100
    },
    {
      "path": [
        "Système électrique",
        "Interrupteur/Relais/Contrôle clignotant/Appareil d.commande",
        "Light Switches/Relays/Controls"
      ],
      "categoryIds": [
        100010,
        null,
        100307
      ],
      "finalCategoryId": 100307,
      "productId": 1287
    },
    {
      "path": [
        "Système électrique",
        "Kit/pièces de câble",
        "Cable Set/individual parts"
      ],
      "categoryIds": [
        100010,
        null,
        103066
      ],
      "finalCategoryId": 103066,
      "productId": 427
    },
    {
      "path": [
        "Système électrique",
        "Phares supplémentaires/composants",
        "Additional Headlight/Parts"
      ],
      "categoryIds": [
        100010,
        null,
        100787
      ],
      "finalCategoryId": 100787,
      "productId": 60366
    },
    {
      "path": [
        "Système électrique",
        "Phares supplémentaires/composants",
        "Additional Headlight/Parts"
      ],
      "categoryIds": [
        100010,
        null,
        100787
      ],
      "finalCategoryId": 100787,
      "productId": 60365
    },
    {
      "path": [
        "Système électrique",
        "Phares supplémentaires/composants",
        "Additional Headlight/Parts"
      ],
      "categoryIds": [
        100010,
        null,
        100787
      ],
      "finalCategoryId": 100787,
      "productId": 106
    },
    {
      "path": [
        "Système électrique",
        "Phares supplémentaires/composants",
        "Additional Headlight/Parts"
      ],
      "categoryIds": [
        100010,
        null,
        100787
      ],
      "finalCategoryId": 100787,
      "productId": 716
    },
    {
      "path": [
        "Système électrique",
        "Phares supplémentaires/composants",
        "Additional Headlight/Parts"
      ],
      "categoryIds": [
        100010,
        null,
        100787
      ],
      "finalCategoryId": 100787,
      "productId": 715
    },
    {
      "path": [
        "Système électrique",
        "Phares supplémentaires/composants",
        "Additional Headlight/Parts"
      ],
      "categoryIds": [
        100010,
        null,
        100787
      ],
      "finalCategoryId": 100787,
      "productId": 1076
    },
    {
      "path": [
        "Système électrique",
        "Phares supplémentaires/composants",
        "Additional Headlight/Parts"
      ],
      "categoryIds": [
        100010,
        null,
        100787
      ],
      "finalCategoryId": 100787,
      "productId": 16
    },
    {
      "path": [
        "Système électrique",
        "Phares supplémentaires/composants",
        "Additional Headlight/Parts"
      ],
      "categoryIds": [
        100010,
        null,
        100787
      ],
      "finalCategoryId": 100787,
      "productId": 488
    },
    {
      "path": [
        "Système électrique",
        "Phares supplémentaires/composants",
        "Additional Headlight/Parts"
      ],
      "categoryIds": [
        100010,
        null,
        100787
      ],
      "finalCategoryId": 100787,
      "productId": 856
    },
    {
      "path": [
        "Système électrique",
        "Phares supplémentaires/composants",
        "Additional Headlight/Parts"
      ],
      "categoryIds": [
        100010,
        null,
        100787
      ],
      "finalCategoryId": 100787,
      "productId": 427
    },
    {
      "path": [
        "Système électrique",
        "Phares supplémentaires/composants",
        "Additional Headlight/Parts"
      ],
      "categoryIds": [
        100010,
        null,
        100787
      ],
      "finalCategoryId": 100787,
      "productId": 2977
    },
    {
      "path": [
        "Système électrique",
        "Phares supplémentaires/composants",
        "Additional Headlight/Parts"
      ],
      "categoryIds": [
        100010,
        null,
        100787
      ],
      "finalCategoryId": 100787,
      "productId": 3330
    },
    {
      "path": [
        "Système électrique",
        "Phares supplémentaires/composants",
        "Additional Headlight/Parts"
      ],
      "categoryIds": [
        100010,
        null,
        100787
      ],
      "finalCategoryId": 100787,
      "productId": 8788
    },
    {
      "path": [
        "Système électrique",
        "Phares supplémentaires/composants",
        "Additional Headlight/Parts"
      ],
      "categoryIds": [
        100010,
        null,
        100787
      ],
      "finalCategoryId": 100787,
      "productId": 87
    },
    {
      "path": [
        "Système électrique",
        "Phares supplémentaires/composants",
        "Additional Headlight/Parts"
      ],
      "categoryIds": [
        100010,
        null,
        100787
      ],
      "finalCategoryId": 100787,
      "productId": 202
    },
    {
      "path": [
        "Système électrique",
        "Phares supplémentaires/composants",
        "Additional Headlight/Parts"
      ],
      "categoryIds": [
        100010,
        null,
        100787
      ],
      "finalCategoryId": 100787,
      "productId": 713
    },
    {
      "path": [
        "Système électrique",
        "Phares supplémentaires/composants",
        "Additional Headlight/Parts"
      ],
      "categoryIds": [
        100010,
        null,
        100787
      ],
      "finalCategoryId": 100787,
      "productId": 2976
    },
    {
      "path": [
        "Système électrique",
        "Phares supplémentaires/composants",
        "Additional Headlight/Parts"
      ],
      "categoryIds": [
        100010,
        null,
        100787
      ],
      "finalCategoryId": 100787,
      "productId": 100
    },
    {
      "path": [
        "Système électrique",
        "Projecteurs principaux / composants",
        "Headlight/Parts"
      ],
      "categoryIds": [
        100010,
        null,
        100143
      ],
      "finalCategoryId": 100143,
      "productId": 60366
    },
    {
      "path": [
        "Système électrique",
        "Projecteurs principaux / composants",
        "Headlight/Parts"
      ],
      "categoryIds": [
        100010,
        null,
        100143
      ],
      "finalCategoryId": 100143,
      "productId": 60365
    },
    {
      "path": [
        "Système électrique",
        "Projecteurs principaux / composants",
        "Headlight/Parts"
      ],
      "categoryIds": [
        100010,
        null,
        100143
      ],
      "finalCategoryId": 100143,
      "productId": 106
    },
    {
      "path": [
        "Système électrique",
        "Relais",
        "Relay"
      ],
      "categoryIds": [
        100010,
        null,
        100785
      ],
      "finalCategoryId": 100785,
      "productId": 1287
    }
  ],
  "productIdsInArbo": [
    16,
    87,
    100,
    106,
    202,
    427,
    488,
    713,
    715,
    716,
    856,
    1076,
    1287,
    2976,
    2977,
    3330,
    8788,
    60365,
    60366
  ],
  "matchedProductIds": [
    202
  ]
}