{
  "productName": "Projecteur antibrouillard",
  "searchText": "Projecteur antibrouillard",
  "found": true,
  "hasMatch": true,
  "timestamp": "2025-12-03T07:04:40.415Z",
  "productId": 289,
  "arborescence": {
    "Carrosserie": {
      "categoryId": 100001,
      "categoryName": "Carrosserie",
      "level": 1,
      "children": {
        "Avant du véhicule": {
          "categoryId": null,
          "categoryName": "Avant du véhicule",
          "level": 2,
          "children": {
            "Ampoule, projecteur antibrouillard": {
              "categoryId": 101648,
              "categoryName": "Vehicle Front",
              "level": 2,
              "children": {
                "Projecteur antibrouillard/ composants": {
                  "categoryId": null,
                  "categoryName": "Projecteur antibrouillard/ composants",
                  "level": 4,
                  "children": {
                    "Ampoule, projecteur antibrouillard": {
                      "categoryId": 101661,
                      "categoryName": "Front Fog Light/Parts",
                      "level": 3,
                      "children": {
                        "Ampoule pour projecteur antibrouillard": {
                          "categoryId": null,
                          "categoryName": "Ampoule pour projecteur antibrouillard",
                          "level": 6,
                          "children": {
                            "Ampoule, projecteur antibrouillard": {
                              "categoryId": 101663,
                              "categoryName": "Fog Light Bulb",
                              "level": 4,
                              "children": [],
                              "productId": 108
                            }
                          }
                        }
                      },
                      "productId": 108
                    }
                  }
                }
              },
              "productId": 108
            },
            "Boîtier, projecteur antibrouillard": {
              "categoryId": 101648,
              "categoryName": "Vehicle Front",
              "level": 2,
              "children": {
                "Projecteur antibrouillard/ composants": {
                  "categoryId": null,
                  "categoryName": "Projecteur antibrouillard/ composants",
                  "level": 4,
                  "children": {
                    "Boîtier, projecteur antibrouillard": {
                      "categoryId": 101661,
                      "categoryName": "Front Fog Light/Parts",
                      "level": 3,
                      "children": {
                        "Composants pour projecteur antibrouillard": {
                          "categoryId": null,
                          "categoryName": "Composants pour projecteur antibrouillard",
                          "level": 6,
                          "children": {
                            "Boîtier, projecteur antibrouillard": {
                              "categoryId": 101664,
                              "categoryName": "Fog Light Parts",
                              "level": 4,
                              "children": [],
                              "productId": 855
                            }
                          }
                        }
                      },
                      "productId": 855
                    }
                  }
                }
              },
              "productId": 855
            },
            "Cadre, projecteur antibrouillard": {
              "categoryId": 101648,
              "categoryName": "Vehicle Front",
              "level": 2,
              "children": {
                "Composants/suppléments": {
                  "categoryId": null,
                  "categoryName": "Composants/suppléments",
                  "level": 4,
                  "children": {
                    "Cadre, projecteur antibrouillard": {
                      "categoryId": 101673,
                      "categoryName": "Parts",
                      "level": 3,
                      "children": {
                        "Fixation/Support/collerette": {
                          "categoryId": null,
                          "categoryName": "Fixation/Support/collerette",
                          "level": 6,
                          "children": {
                            "Cadre, projecteur antibrouillard": {
                              "categoryId": 101773,
                              "categoryName": "Racks/Carriers/Frames",
                              "level": 4,
                              "children": [],
                              "productId": 712
                            }
                          }
                        }
                      },
                      "productId": 712
                    }
                  }
                },
                "Projecteur antibrouillard/ composants": {
                  "categoryId": null,
                  "categoryName": "Projecteur antibrouillard/ composants",
                  "level": 4,
                  "children": {
                    "Cadre, projecteur antibrouillard": {
                      "categoryId": 101661,
                      "categoryName": "Front Fog Light/Parts",
                      "level": 3,
                      "children": {
                        "Composants pour projecteur antibrouillard": {
                          "categoryId": null,
                          "categoryName": "Composants pour projecteur antibrouillard",
                          "level": 6,
                          "children": {
                            "Cadre, projecteur antibrouillard": {
                              "categoryId": 101664,
                              "categoryName": "Fog Light Parts",
                              "level": 4,
                              "children": [],
                              "productId": 712
                            }
                          }
                        }
                      },
                      "productId": 712
                    }
                  }
                }
              },
              "productId": 712
            },
            "Capuchon, projecteur antibrouillard": {
              "categoryId": 101648,
              "categoryName": "Vehicle Front",
              "level": 2,
              "children": {
                "Projecteur antibrouillard/ composants": {
                  "categoryId": null,
                  "categoryName": "Projecteur antibrouillard/ composants",
                  "level": 4,
                  "children": {
                    "Capuchon, projecteur antibrouillard": {
                      "categoryId": 101661,
                      "categoryName": "Front Fog Light/Parts",
                      "level": 3,
                      "children": {
                        "Composants pour projecteur antibrouillard": {
                          "categoryId": null,
                          "categoryName": "Composants pour projecteur antibrouillard",
                          "level": 6,
                          "children": {
                            "Capuchon, projecteur antibrouillard": {
                              "categoryId": 101664,
                              "categoryName": "Fog Light Parts",
                              "level": 4,
                              "children": [],
                              "productId": 1077
                            }
                          }
                        }
                      },
                      "productId": 1077
                    }
                  }
                }
              },
              "productId": 1077
            },
            "Disperseur, projecteur antibrouillard": {
              "categoryId": 101648,
              "categoryName": "Vehicle Front",
              "level": 2,
              "children": {
                "Projecteur antibrouillard/ composants": {
                  "categoryId": null,
                  "categoryName": "Projecteur antibrouillard/ composants",
                  "level": 4,
                  "children": {
                    "Disperseur, projecteur antibrouillard": {
                      "categoryId": 101661,
                      "categoryName": "Front Fog Light/Parts",
                      "level": 3,
                      "children": {
                        "Composants pour projecteur antibrouillard": {
                          "categoryId": null,
                          "categoryName": "Composants pour projecteur antibrouillard",
                          "level": 6,
                          "children": {
                            "Disperseur, projecteur antibrouillard": {
                              "categoryId": 101664,
                              "categoryName": "Fog Light Parts",
                              "level": 4,
                              "children": [],
                              "productId": 85
                            }
                          }
                        }
                      },
                      "productId": 85
                    }
                  }
                }
              },
              "productId": 85
            },
            "Douille de lampe, projecteur antibrouillard": {
              "categoryId": 101648,
              "categoryName": "Vehicle Front",
              "level": 2,
              "children": {
                "Projecteur antibrouillard/ composants": {
                  "categoryId": null,
                  "categoryName": "Projecteur antibrouillard/ composants",
                  "level": 4,
                  "children": {
                    "Douille de lampe, projecteur antibrouillard": {
                      "categoryId": 101661,
                      "categoryName": "Front Fog Light/Parts",
                      "level": 3,
                      "children": {
                        "Composants pour projecteur antibrouillard": {
                          "categoryId": null,
                          "categoryName": "Composants pour projecteur antibrouillard",
                          "level": 6,
                          "children": {
                            "Douille de lampe, projecteur antibrouillard": {
                              "categoryId": 101664,
                              "categoryName": "Fog Light Parts",
                              "level": 4,
                              "children": [],
                              "productId": 490
                            }
                          }
                        }
                      },
                      "productId": 490
                    }
                  }
                }
              },
              "productId": 490
            },
            "Enjoliveur, projecteur antibrouillard": {
              "categoryId": 101648,
              "categoryName": "Vehicle Front",
              "level": 2,
              "children": {
                "Composants/suppléments": {
                  "categoryId": null,
                  "categoryName": "Composants/suppléments",
                  "level": 4,
                  "children": {
                    "Enjoliveur, projecteur antibrouillard": {
                      "categoryId": 101673,
                      "categoryName": "Parts",
                      "level": 3,
                      "children": {
                        "Fixation/Support/collerette": {
                          "categoryId": null,
                          "categoryName": "Fixation/Support/collerette",
                          "level": 6,
                          "children": {
                            "Enjoliveur, projecteur antibrouillard": {
                              "categoryId": 101773,
                              "categoryName": "Racks/Carriers/Frames",
                              "level": 4,
                              "children": [],
                              "productId": 19
                            }
                          }
                        }
                      },
                      "productId": 19
                    }
                  }
                },
                "Projecteur antibrouillard/ composants": {
                  "categoryId": null,
                  "categoryName": "Projecteur antibrouillard/ composants",
                  "level": 4,
                  "children": {
                    "Enjoliveur, projecteur antibrouillard": {
                      "categoryId": 101661,
                      "categoryName": "Front Fog Light/Parts",
                      "level": 3,
                      "children": {
                        "Composants pour projecteur antibrouillard": {
                          "categoryId": null,
                          "categoryName": "Composants pour projecteur antibrouillard",
                          "level": 6,
                          "children": {
                            "Enjoliveur, projecteur antibrouillard": {
                              "categoryId": 101664,
                              "categoryName": "Fog Light Parts",
                              "level": 4,
                              "children": [],
                              "productId": 19
                            }
                          }
                        }
                      },
                      "productId": 19
                    }
                  }
                }
              },
              "productId": 19
            },
            "Joint, projecteur antibrouillard": {
              "categoryId": 101648,
              "categoryName": "Vehicle Front",
              "level": 2,
              "children": {
                "Projecteur antibrouillard/ composants": {
                  "categoryId": null,
                  "categoryName": "Projecteur antibrouillard/ composants",
                  "level": 4,
                  "children": {
                    "Joint, projecteur antibrouillard": {
                      "categoryId": 101661,
                      "categoryName": "Front Fog Light/Parts",
                      "level": 3,
                      "children": {
                        "Composants pour projecteur antibrouillard": {
                          "categoryId": null,
                          "categoryName": "Composants pour projecteur antibrouillard",
                          "level": 6,
                          "children": {
                            "Joint, projecteur antibrouillard": {
                              "categoryId": 101664,
                              "categoryName": "Fog Light Parts",
                              "level": 4,
                              "children": [],
                              "productId": 1100
                            }
                          }
                        }
                      },
                      "productId": 1100
                    }
                  }
                }
              },
              "productId": 1100
            },
            "Kit de câbles, projecteur antibrouillard": {
              "categoryId": 101648,
              "categoryName": "Vehicle Front",
              "level": 2,
              "children": {
                "Projecteur antibrouillard/ composants": {
                  "categoryId": null,
                  "categoryName": "Projecteur antibrouillard/ composants",
                  "level": 4,
                  "children": {
                    "Kit de câbles, projecteur antibrouillard": {
                      "categoryId": 101661,
                      "categoryName": "Front Fog Light/Parts",
                      "level": 3,
                      "children": {
                        "Composants pour projecteur antibrouillard": {
                          "categoryId": null,
                          "categoryName": "Composants pour projecteur antibrouillard",
                          "level": 6,
                          "children": {
                            "Kit de câbles, projecteur antibrouillard": {
                              "categoryId": 101664,
                              "categoryName": "Fog Light Parts",
                              "level": 4,
                              "children": [],
                              "productId": 426
                            }
                          }
                        }
                      },
                      "productId": 426
                    }
                  }
                }
              },
              "productId": 426
            },
            "Kit de projecteurs antibrouillard": {
              "categoryId": 101648,
              "categoryName": "Vehicle Front",
              "level": 2,
              "children": {
                "Projecteur antibrouillard/ composants": {
                  "categoryId": null,
                  "categoryName": "Projecteur antibrouillard/ composants",
                  "level": 4,
                  "children": {
                    "Kit de projecteurs antibrouillard": {
                      "categoryId": 101661,
                      "categoryName": "Front Fog Light/Parts",
                      "level": 3,
                      "children": {
                        "Projecteur antibrouillard / Optique": {
                          "categoryId": null,
                          "categoryName": "Projecteur antibrouillard / Optique",
                          "level": 6,
                          "children": {
                            "Kit de projecteurs antibrouillard": {
                              "categoryId": 101662,
                              "categoryName": "Front Fog Light/Insert",
                              "level": 4,
                              "children": [],
                              "productId": 3331
                            }
                          }
                        }
                      },
                      "productId": 3331
                    }
                  }
                }
              },
              "productId": 3331
            },
            "Optique, projecteur antibrouillard": {
              "categoryId": 101648,
              "categoryName": "Vehicle Front",
              "level": 2,
              "children": {
                "Projecteur antibrouillard/ composants": {
                  "categoryId": null,
                  "categoryName": "Projecteur antibrouillard/ composants",
                  "level": 4,
                  "children": {
                    "Optique, projecteur antibrouillard": {
                      "categoryId": 101661,
                      "categoryName": "Front Fog Light/Parts",
                      "level": 3,
                      "children": {
                        "Projecteur antibrouillard / Optique": {
                          "categoryId": null,
                          "categoryName": "Projecteur antibrouillard / Optique",
                          "level": 6,
                          "children": {
                            "Optique, projecteur antibrouillard": {
                              "categoryId": 101662,
                              "categoryName": "Front Fog Light/Insert",
                              "level": 4,
                              "children": [],
                              "productId": 89
                            }
                          }
                        }
                      },
                      "productId": 89
                    }
                  }
                }
              },
              "productId": 89
            },
            "Projecteur antibrouillard": {
              "categoryId": 101648,
              "categoryName": "Vehicle Front",
              "level": 2,
              "children": {
                "Projecteur antibrouillard/ composants": {
                  "categoryId": null,
                  "categoryName": "Projecteur antibrouillard/ composants",
                  "level": 4,
                  "children": {
                    "Projecteur antibrouillard": {
                      "categoryId": 101661,
                      "categoryName": "Front Fog Light/Parts",
                      "level": 3,
                      "children": {
                        "Projecteur antibrouillard / Optique": {
                          "categoryId": null,
                          "categoryName": "Projecteur antibrouillard / Optique",
                          "level": 6,
                          "children": {
                            "Projecteur antibrouillard": {
                              "categoryId": 101662,
                              "categoryName": "Front Fog Light/Insert",
                              "level": 4,
                              "children": [],
                              "productId": 289
                            }
                          }
                        }
                      },
                      "productId": 289
                    }
                  }
                }
              },
              "productId": 289
            },
            "Réflecteur, projecteur antibrouillard": {
              "categoryId": 101648,
              "categoryName": "Vehicle Front",
              "level": 2,
              "children": {
                "Projecteur antibrouillard/ composants": {
                  "categoryId": null,
                  "categoryName": "Projecteur antibrouillard/ composants",
                  "level": 4,
                  "children": {
                    "Réflecteur, projecteur antibrouillard": {
                      "categoryId": 101661,
                      "categoryName": "Front Fog Light/Parts",
                      "level": 3,
                      "children": {
                        "Composants pour projecteur antibrouillard": {
                          "categoryId": null,
                          "categoryName": "Composants pour projecteur antibrouillard",
                          "level": 6,
                          "children": {
                            "Réflecteur, projecteur antibrouillard": {
                              "categoryId": 101664,
                              "categoryName": "Fog Light Parts",
                              "level": 4,
                              "children": [],
                              "productId": 710
                            }
                          }
                        }
                      },
                      "productId": 710
                    }
                  }
                }
              },
              "productId": 710
            },
            "Support, phare antibrouillard": {
              "categoryId": 101648,
              "categoryName": "Vehicle Front",
              "level": 2,
              "children": {
                "Projecteur antibrouillard/ composants": {
                  "categoryId": null,
                  "categoryName": "Projecteur antibrouillard/ composants",
                  "level": 4,
                  "children": {
                    "Support, phare antibrouillard": {
                      "categoryId": 101661,
                      "categoryName": "Front Fog Light/Parts",
                      "level": 3,
                      "children": {
                        "Composants pour projecteur antibrouillard": {
                          "categoryId": null,
                          "categoryName": "Composants pour projecteur antibrouillard",
                          "level": 6,
                          "children": {
                            "Support, phare antibrouillard": {
                              "categoryId": 101664,
                              "categoryName": "Fog Light Parts",
                              "level": 4,
                              "children": [],
                              "productId": 102
                            }
                          }
                        }
                      },
                      "productId": 102
                    }
                  }
                }
              },
              "productId": 102
            }
          }
        },
        "Fixation/Support/collerette": {
          "categoryId": null,
          "categoryName": "Fixation/Support/collerette",
          "level": 2,
          "children": {
            "Cadre, projecteur antibrouillard": {
              "categoryId": 101454,
              "categoryName": "Racks/Carriers/Frames",
              "level": 2,
              "children": [],
              "productId": 712
            },
            "Enjoliveur, projecteur antibrouillard": {
              "categoryId": 101454,
              "categoryName": "Racks/Carriers/Frames",
              "level": 2,
              "children": [],
              "productId": 19
            }
          }
        },
        "Phares supplémentaires/composants": {
          "categoryId": null,
          "categoryName": "Phares supplémentaires/composants",
          "level": 2,
          "children": {
            "Ampoule, projecteur antibrouillard": {
              "categoryId": 101340,
              "categoryName": "Additional Headlight/Parts",
              "level": 2,
              "children": {
                "Projecteur antibrouillard/ composants": {
                  "categoryId": null,
                  "categoryName": "Projecteur antibrouillard/ composants",
                  "level": 4,
                  "children": {
                    "Ampoule, projecteur antibrouillard": {
                      "categoryId": 101341,
                      "categoryName": "Front Fog Light/Parts",
                      "level": 3,
                      "children": {
                        "Ampoule pour projecteur antibrouillard": {
                          "categoryId": null,
                          "categoryName": "Ampoule pour projecteur antibrouillard",
                          "level": 6,
                          "children": {
                            "Ampoule, projecteur antibrouillard": {
                              "categoryId": 101343,
                              "categoryName": "Fog Light Bulb",
                              "level": 4,
                              "children": [],
                              "productId": 108
                            }
                          }
                        }
                      },
                      "productId": 108
                    }
                  }
                }
              },
              "productId": 108
            },
            "Boîtier, projecteur antibrouillard": {
              "categoryId": 101340,
              "categoryName": "Additional Headlight/Parts",
              "level": 2,
              "children": {
                "Projecteur antibrouillard/ composants": {
                  "categoryId": null,
                  "categoryName": "Projecteur antibrouillard/ composants",
                  "level": 4,
                  "children": {
                    "Boîtier, projecteur antibrouillard": {
                      "categoryId": 101341,
                      "categoryName": "Front Fog Light/Parts",
                      "level": 3,
                      "children": {
                        "Composants pour projecteur antibrouillard": {
                          "categoryId": null,
                          "categoryName": "Composants pour projecteur antibrouillard",
                          "level": 6,
                          "children": {
                            "Boîtier, projecteur antibrouillard": {
                              "categoryId": 101344,
                              "categoryName": "Fog Light Parts",
                              "level": 4,
                              "children": [],
                              "productId": 855
                            }
                          }
                        }
                      },
                      "productId": 855
                    }
                  }
                }
              },
              "productId": 855
            },
            "Cadre, projecteur antibrouillard": {
              "categoryId": 101340,
              "categoryName": "Additional Headlight/Parts",
              "level": 2,
              "children": {
                "Projecteur antibrouillard/ composants": {
                  "categoryId": null,
                  "categoryName": "Projecteur antibrouillard/ composants",
                  "level": 4,
                  "children": {
                    "Cadre, projecteur antibrouillard": {
                      "categoryId": 101341,
                      "categoryName": "Front Fog Light/Parts",
                      "level": 3,
                      "children": {
                        "Composants pour projecteur antibrouillard": {
                          "categoryId": null,
                          "categoryName": "Composants pour projecteur antibrouillard",
                          "level": 6,
                          "children": {
                            "Cadre, projecteur antibrouillard": {
                              "categoryId": 101344,
                              "categoryName": "Fog Light Parts",
                              "level": 4,
                              "children": [],
                              "productId": 712
                            }
                          }
                        }
                      },
                      "productId": 712
                    }
                  }
                }
              },
              "productId": 712
            },
            "Capuchon, projecteur antibrouillard": {
              "categoryId": 101340,
              "categoryName": "Additional Headlight/Parts",
              "level": 2,
              "children": {
                "Projecteur antibrouillard/ composants": {
                  "categoryId": null,
                  "categoryName": "Projecteur antibrouillard/ composants",
                  "level": 4,
                  "children": {
                    "Capuchon, projecteur antibrouillard": {
                      "categoryId": 101341,
                      "categoryName": "Front Fog Light/Parts",
                      "level": 3,
                      "children": {
                        "Composants pour projecteur antibrouillard": {
                          "categoryId": null,
                          "categoryName": "Composants pour projecteur antibrouillard",
                          "level": 6,
                          "children": {
                            "Capuchon, projecteur antibrouillard": {
                              "categoryId": 101344,
                              "categoryName": "Fog Light Parts",
                              "level": 4,
                              "children": [],
                              "productId": 1077
                            }
                          }
                        }
                      },
                      "productId": 1077
                    }
                  }
                }
              },
              "productId": 1077
            },
            "Disperseur, projecteur antibrouillard": {
              "categoryId": 101340,
              "categoryName": "Additional Headlight/Parts",
              "level": 2,
              "children": {
                "Projecteur antibrouillard/ composants": {
                  "categoryId": null,
                  "categoryName": "Projecteur antibrouillard/ composants",
                  "level": 4,
                  "children": {
                    "Disperseur, projecteur antibrouillard": {
                      "categoryId": 101341,
                      "categoryName": "Front Fog Light/Parts",
                      "level": 3,
                      "children": {
                        "Composants pour projecteur antibrouillard": {
                          "categoryId": null,
                          "categoryName": "Composants pour projecteur antibrouillard",
                          "level": 6,
                          "children": {
                            "Disperseur, projecteur antibrouillard": {
                              "categoryId": 101344,
                              "categoryName": "Fog Light Parts",
                              "level": 4,
                              "children": [],
                              "productId": 85
                            }
                          }
                        }
                      },
                      "productId": 85
                    }
                  }
                }
              },
              "productId": 85
            },
            "Douille de lampe, projecteur antibrouillard": {
              "categoryId": 101340,
              "categoryName": "Additional Headlight/Parts",
              "level": 2,
              "children": {
                "Projecteur antibrouillard/ composants": {
                  "categoryId": null,
                  "categoryName": "Projecteur antibrouillard/ composants",
                  "level": 4,
                  "children": {
                    "Douille de lampe, projecteur antibrouillard": {
                      "categoryId": 101341,
                      "categoryName": "Front Fog Light/Parts",
                      "level": 3,
                      "children": {
                        "Composants pour projecteur antibrouillard": {
                          "categoryId": null,
                          "categoryName": "Composants pour projecteur antibrouillard",
                          "level": 6,
                          "children": {
                            "Douille de lampe, projecteur antibrouillard": {
                              "categoryId": 101344,
                              "categoryName": "Fog Light Parts",
                              "level": 4,
                              "children": [],
                              "productId": 490
                            }
                          }
                        }
                      },
                      "productId": 490
                    }
                  }
                }
              },
              "productId": 490
            },
            "Enjoliveur, projecteur antibrouillard": {
              "categoryId": 101340,
              "categoryName": "Additional Headlight/Parts",
              "level": 2,
              "children": {
                "Projecteur antibrouillard/ composants": {
                  "categoryId": null,
                  "categoryName": "Projecteur antibrouillard/ composants",
                  "level": 4,
                  "children": {
                    "Enjoliveur, projecteur antibrouillard": {
                      "categoryId": 101341,
                      "categoryName": "Front Fog Light/Parts",
                      "level": 3,
                      "children": {
                        "Composants pour projecteur antibrouillard": {
                          "categoryId": null,
                          "categoryName": "Composants pour projecteur antibrouillard",
                          "level": 6,
                          "children": {
                            "Enjoliveur, projecteur antibrouillard": {
                              "categoryId": 101344,
                              "categoryName": "Fog Light Parts",
                              "level": 4,
                              "children": [],
                              "productId": 19
                            }
                          }
                        }
                      },
                      "productId": 19
                    }
                  }
                }
              },
              "productId": 19
            },
            "Joint, projecteur antibrouillard": {
              "categoryId": 101340,
              "categoryName": "Additional Headlight/Parts",
              "level": 2,
              "children": {
                "Projecteur antibrouillard/ composants": {
                  "categoryId": null,
                  "categoryName": "Projecteur antibrouillard/ composants",
                  "level": 4,
                  "children": {
                    "Joint, projecteur antibrouillard": {
                      "categoryId": 101341,
                      "categoryName": "Front Fog Light/Parts",
                      "level": 3,
                      "children": {
                        "Composants pour projecteur antibrouillard": {
                          "categoryId": null,
                          "categoryName": "Composants pour projecteur antibrouillard",
                          "level": 6,
                          "children": {
                            "Joint, projecteur antibrouillard": {
                              "categoryId": 101344,
                              "categoryName": "Fog Light Parts",
                              "level": 4,
                              "children": [],
                              "productId": 1100
                            }
                          }
                        }
                      },
                      "productId": 1100
                    }
                  }
                }
              },
              "productId": 1100
            },
            "Kit de câbles, projecteur antibrouillard": {
              "categoryId": 101340,
              "categoryName": "Additional Headlight/Parts",
              "level": 2,
              "children": {
                "Projecteur antibrouillard/ composants": {
                  "categoryId": null,
                  "categoryName": "Projecteur antibrouillard/ composants",
                  "level": 4,
                  "children": {
                    "Kit de câbles, projecteur antibrouillard": {
                      "categoryId": 101341,
                      "categoryName": "Front Fog Light/Parts",
                      "level": 3,
                      "children": {
                        "Composants pour projecteur antibrouillard": {
                          "categoryId": null,
                          "categoryName": "Composants pour projecteur antibrouillard",
                          "level": 6,
                          "children": {
                            "Kit de câbles, projecteur antibrouillard": {
                              "categoryId": 101344,
                              "categoryName": "Fog Light Parts",
                              "level": 4,
                              "children": [],
                              "productId": 426
                            }
                          }
                        }
                      },
                      "productId": 426
                    }
                  }
                }
              },
              "productId": 426
            },
            "Kit de projecteurs antibrouillard": {
              "categoryId": 101340,
              "categoryName": "Additional Headlight/Parts",
              "level": 2,
              "children": {
                "Projecteur antibrouillard/ composants": {
                  "categoryId": null,
                  "categoryName": "Projecteur antibrouillard/ composants",
                  "level": 4,
                  "children": {
                    "Kit de projecteurs antibrouillard": {
                      "categoryId": 101341,
                      "categoryName": "Front Fog Light/Parts",
                      "level": 3,
                      "children": {
                        "Projecteur antibrouillard / Optique": {
                          "categoryId": null,
                          "categoryName": "Projecteur antibrouillard / Optique",
                          "level": 6,
                          "children": {
                            "Kit de projecteurs antibrouillard": {
                              "categoryId": 101342,
                              "categoryName": "Front Fog Light/Insert",
                              "level": 4,
                              "children": [],
                              "productId": 3331
                            }
                          }
                        }
                      },
                      "productId": 3331
                    }
                  }
                }
              },
              "productId": 3331
            },
            "Optique, projecteur antibrouillard": {
              "categoryId": 101340,
              "categoryName": "Additional Headlight/Parts",
              "level": 2,
              "children": {
                "Projecteur antibrouillard/ composants": {
                  "categoryId": null,
                  "categoryName": "Projecteur antibrouillard/ composants",
                  "level": 4,
                  "children": {
                    "Optique, projecteur antibrouillard": {
                      "categoryId": 101341,
                      "categoryName": "Front Fog Light/Parts",
                      "level": 3,
                      "children": {
                        "Projecteur antibrouillard / Optique": {
                          "categoryId": null,
                          "categoryName": "Projecteur antibrouillard / Optique",
                          "level": 6,
                          "children": {
                            "Optique, projecteur antibrouillard": {
                              "categoryId": 101342,
                              "categoryName": "Front Fog Light/Insert",
                              "level": 4,
                              "children": [],
                              "productId": 89
                            }
                          }
                        }
                      },
                      "productId": 89
                    }
                  }
                }
              },
              "productId": 89
            },
            "Projecteur antibrouillard": {
              "categoryId": 101340,
              "categoryName": "Additional Headlight/Parts",
              "level": 2,
              "children": {
                "Projecteur antibrouillard/ composants": {
                  "categoryId": null,
                  "categoryName": "Projecteur antibrouillard/ composants",
                  "level": 4,
                  "children": {
                    "Projecteur antibrouillard": {
                      "categoryId": 101341,
                      "categoryName": "Front Fog Light/Parts",
                      "level": 3,
                      "children": {
                        "Projecteur antibrouillard / Optique": {
                          "categoryId": null,
                          "categoryName": "Projecteur antibrouillard / Optique",
                          "level": 6,
                          "children": {
                            "Projecteur antibrouillard": {
                              "categoryId": 101342,
                              "categoryName": "Front Fog Light/Insert",
                              "level": 4,
                              "children": [],
                              "productId": 289
                            }
                          }
                        }
                      },
                      "productId": 289
                    }
                  }
                }
              },
              "productId": 289
            },
            "Réflecteur, projecteur antibrouillard": {
              "categoryId": 101340,
              "categoryName": "Additional Headlight/Parts",
              "level": 2,
              "children": {
                "Projecteur antibrouillard/ composants": {
                  "categoryId": null,
                  "categoryName": "Projecteur antibrouillard/ composants",
                  "level": 4,
                  "children": {
                    "Réflecteur, projecteur antibrouillard": {
                      "categoryId": 101341,
                      "categoryName": "Front Fog Light/Parts",
                      "level": 3,
                      "children": {
                        "Composants pour projecteur antibrouillard": {
                          "categoryId": null,
                          "categoryName": "Composants pour projecteur antibrouillard",
                          "level": 6,
                          "children": {
                            "Réflecteur, projecteur antibrouillard": {
                              "categoryId": 101344,
                              "categoryName": "Fog Light Parts",
                              "level": 4,
                              "children": [],
                              "productId": 710
                            }
                          }
                        }
                      },
                      "productId": 710
                    }
                  }
                }
              },
              "productId": 710
            },
            "Support, phare antibrouillard": {
              "categoryId": 101340,
              "categoryName": "Additional Headlight/Parts",
              "level": 2,
              "children": {
                "Projecteur antibrouillard/ composants": {
                  "categoryId": null,
                  "categoryName": "Projecteur antibrouillard/ composants",
                  "level": 4,
                  "children": {
                    "Support, phare antibrouillard": {
                      "categoryId": 101341,
                      "categoryName": "Front Fog Light/Parts",
                      "level": 3,
                      "children": {
                        "Composants pour projecteur antibrouillard": {
                          "categoryId": null,
                          "categoryName": "Composants pour projecteur antibrouillard",
                          "level": 6,
                          "children": {
                            "Support, phare antibrouillard": {
                              "categoryId": 101344,
                              "categoryName": "Fog Light Parts",
                              "level": 4,
                              "children": [],
                              "productId": 102
                            }
                          }
                        }
                      },
                      "productId": 102
                    }
                  }
                }
              },
              "productId": 102
            }
          }
        }
      }
    },
    "Système électrique": {
      "categoryId": 100010,
      "categoryName": "Système électrique",
      "level": 1,
      "children": {
        "Interrupteur/Relais/Contrôle clignotant/Appareil d.commande": {
          "categoryId": null,
          "categoryName": "Interrupteur/Relais/Contrôle clignotant/Appareil d.commande",
          "level": 2,
          "children": {
            "Relais, projecteur antibrouillard": {
              "categoryId": 100307,
              "categoryName": "Light Switches/Relays/Controls",
              "level": 2,
              "children": {
                "Relais": {
                  "categoryId": null,
                  "categoryName": "Relais",
                  "level": 4,
                  "children": {
                    "Relais, projecteur antibrouillard": {
                      "categoryId": 100510,
                      "categoryName": "Relay",
                      "level": 3,
                      "children": [],
                      "productId": 1294
                    }
                  }
                }
              },
              "productId": 1294
            }
          }
        },
        "Kit/pièces de câble": {
          "categoryId": null,
          "categoryName": "Kit/pièces de câble",
          "level": 2,
          "children": {
            "Kit de câbles, projecteur antibrouillard": {
              "categoryId": 103066,
              "categoryName": "Cable Set/individual parts",
              "level": 2,
              "children": [],
              "productId": 426
            }
          }
        },
        "Phares supplémentaires/composants": {
          "categoryId": null,
          "categoryName": "Phares supplémentaires/composants",
          "level": 2,
          "children": {
            "Ampoule, projecteur antibrouillard": {
              "categoryId": 100787,
              "categoryName": "Additional Headlight/Parts",
              "level": 2,
              "children": {
                "Projecteur antibrouillard/ composants": {
                  "categoryId": null,
                  "categoryName": "Projecteur antibrouillard/ composants",
                  "level": 4,
                  "children": {
                    "Ampoule, projecteur antibrouillard": {
                      "categoryId": 100277,
                      "categoryName": "Front Fog Light/Parts",
                      "level": 3,
                      "children": {
                        "Ampoule pour projecteur antibrouillard": {
                          "categoryId": null,
                          "categoryName": "Ampoule pour projecteur antibrouillard",
                          "level": 6,
                          "children": {
                            "Ampoule, projecteur antibrouillard": {
                              "categoryId": 100447,
                              "categoryName": "Fog Light Bulb",
                              "level": 4,
                              "children": [],
                              "productId": 108
                            }
                          }
                        }
                      },
                      "productId": 108
                    }
                  }
                }
              },
              "productId": 108
            },
            "Boîtier, projecteur antibrouillard": {
              "categoryId": 100787,
              "categoryName": "Additional Headlight/Parts",
              "level": 2,
              "children": {
                "Projecteur antibrouillard/ composants": {
                  "categoryId": null,
                  "categoryName": "Projecteur antibrouillard/ composants",
                  "level": 4,
                  "children": {
                    "Boîtier, projecteur antibrouillard": {
                      "categoryId": 100277,
                      "categoryName": "Front Fog Light/Parts",
                      "level": 3,
                      "children": {
                        "Composants pour projecteur antibrouillard": {
                          "categoryId": null,
                          "categoryName": "Composants pour projecteur antibrouillard",
                          "level": 6,
                          "children": {
                            "Boîtier, projecteur antibrouillard": {
                              "categoryId": 100444,
                              "categoryName": "Fog Light Parts",
                              "level": 4,
                              "children": [],
                              "productId": 855
                            }
                          }
                        }
                      },
                      "productId": 855
                    }
                  }
                }
              },
              "productId": 855
            },
            "Cadre, projecteur antibrouillard": {
              "categoryId": 100787,
              "categoryName": "Additional Headlight/Parts",
              "level": 2,
              "children": {
                "Projecteur antibrouillard/ composants": {
                  "categoryId": null,
                  "categoryName": "Projecteur antibrouillard/ composants",
                  "level": 4,
                  "children": {
                    "Cadre, projecteur antibrouillard": {
                      "categoryId": 100277,
                      "categoryName": "Front Fog Light/Parts",
                      "level": 3,
                      "children": {
                        "Composants pour projecteur antibrouillard": {
                          "categoryId": null,
                          "categoryName": "Composants pour projecteur antibrouillard",
                          "level": 6,
                          "children": {
                            "Cadre, projecteur antibrouillard": {
                              "categoryId": 100444,
                              "categoryName": "Fog Light Parts",
                              "level": 4,
                              "children": [],
                              "productId": 712
                            }
                          }
                        }
                      },
                      "productId": 712
                    }
                  }
                }
              },
              "productId": 712
            },
            "Capuchon, projecteur antibrouillard": {
              "categoryId": 100787,
              "categoryName": "Additional Headlight/Parts",
              "level": 2,
              "children": {
                "Projecteur antibrouillard/ composants": {
                  "categoryId": null,
                  "categoryName": "Projecteur antibrouillard/ composants",
                  "level": 4,
                  "children": {
                    "Capuchon, projecteur antibrouillard": {
                      "categoryId": 100277,
                      "categoryName": "Front Fog Light/Parts",
                      "level": 3,
                      "children": {
                        "Composants pour projecteur antibrouillard": {
                          "categoryId": null,
                          "categoryName": "Composants pour projecteur antibrouillard",
                          "level": 6,
                          "children": {
                            "Capuchon, projecteur antibrouillard": {
                              "categoryId": 100444,
                              "categoryName": "Fog Light Parts",
                              "level": 4,
                              "children": [],
                              "productId": 1077
                            }
                          }
                        }
                      },
                      "productId": 1077
                    }
                  }
                }
              },
              "productId": 1077
            },
            "Disperseur, projecteur antibrouillard": {
              "categoryId": 100787,
              "categoryName": "Additional Headlight/Parts",
              "level": 2,
              "children": {
                "Projecteur antibrouillard/ composants": {
                  "categoryId": null,
                  "categoryName": "Projecteur antibrouillard/ composants",
                  "level": 4,
                  "children": {
                    "Disperseur, projecteur antibrouillard": {
                      "categoryId": 100277,
                      "categoryName": "Front Fog Light/Parts",
                      "level": 3,
                      "children": {
                        "Composants pour projecteur antibrouillard": {
                          "categoryId": null,
                          "categoryName": "Composants pour projecteur antibrouillard",
                          "level": 6,
                          "children": {
                            "Disperseur, projecteur antibrouillard": {
                              "categoryId": 100444,
                              "categoryName": "Fog Light Parts",
                              "level": 4,
                              "children": [],
                              "productId": 85
                            }
                          }
                        }
                      },
                      "productId": 85
                    }
                  }
                }
              },
              "productId": 85
            },
            "Douille de lampe, projecteur antibrouillard": {
              "categoryId": 100787,
              "categoryName": "Additional Headlight/Parts",
              "level": 2,
              "children": {
                "Projecteur antibrouillard/ composants": {
                  "categoryId": null,
                  "categoryName": "Projecteur antibrouillard/ composants",
                  "level": 4,
                  "children": {
                    "Douille de lampe, projecteur antibrouillard": {
                      "categoryId": 100277,
                      "categoryName": "Front Fog Light/Parts",
                      "level": 3,
                      "children": {
                        "Composants pour projecteur antibrouillard": {
                          "categoryId": null,
                          "categoryName": "Composants pour projecteur antibrouillard",
                          "level": 6,
                          "children": {
                            "Douille de lampe, projecteur antibrouillard": {
                              "categoryId": 100444,
                              "categoryName": "Fog Light Parts",
                              "level": 4,
                              "children": [],
                              "productId": 490
                            }
                          }
                        }
                      },
                      "productId": 490
                    }
                  }
                }
              },
              "productId": 490
            },
            "Enjoliveur, projecteur antibrouillard": {
              "categoryId": 100787,
              "categoryName": "Additional Headlight/Parts",
              "level": 2,
              "children": {
                "Projecteur antibrouillard/ composants": {
                  "categoryId": null,
                  "categoryName": "Projecteur antibrouillard/ composants",
                  "level": 4,
                  "children": {
                    "Enjoliveur, projecteur antibrouillard": {
                      "categoryId": 100277,
                      "categoryName": "Front Fog Light/Parts",
                      "level": 3,
                      "children": {
                        "Composants pour projecteur antibrouillard": {
                          "categoryId": null,
                          "categoryName": "Composants pour projecteur antibrouillard",
                          "level": 6,
                          "children": {
                            "Enjoliveur, projecteur antibrouillard": {
                              "categoryId": 100444,
                              "categoryName": "Fog Light Parts",
                              "level": 4,
                              "children": [],
                              "productId": 19
                            }
                          }
                        }
                      },
                      "productId": 19
                    }
                  }
                }
              },
              "productId": 19
            },
            "Jeu de supports, phare supplémentaire": {
              "categoryId": 100787,
              "categoryName": "Additional Headlight/Parts",
              "level": 2,
              "children": {
                "Phare chercheur / composants": {
                  "categoryId": null,
                  "categoryName": "Phare chercheur / composants",
                  "level": 4,
                  "children": {
                    "Jeu de supports, phare supplémentaire": {
                      "categoryId": 100281,
                      "categoryName": "Searchlight/Parts",
                      "level": 3,
                      "children": {
                        "Composants phare chercheur": {
                          "categoryId": null,
                          "categoryName": "Composants phare chercheur",
                          "level": 6,
                          "children": {
                            "Jeu de supports, phare supplémentaire": {
                              "categoryId": 100446,
                              "categoryName": "Searchlight Parts",
                              "level": 4,
                              "children": [],
                              "productId": 2977
                            }
                          }
                        }
                      },
                      "productId": 2977
                    }
                  }
                },
                "Projecteur antibrouillard/ composants": {
                  "categoryId": null,
                  "categoryName": "Projecteur antibrouillard/ composants",
                  "level": 4,
                  "children": {
                    "Jeu de supports, phare supplémentaire": {
                      "categoryId": 100277,
                      "categoryName": "Front Fog Light/Parts",
                      "level": 3,
                      "children": {
                        "Composants pour projecteur antibrouillard": {
                          "categoryId": null,
                          "categoryName": "Composants pour projecteur antibrouillard",
                          "level": 6,
                          "children": {
                            "Jeu de supports, phare supplémentaire": {
                              "categoryId": 100444,
                              "categoryName": "Fog Light Parts",
                              "level": 4,
                              "children": [],
                              "productId": 2977
                            }
                          }
                        }
                      },
                      "productId": 2977
                    }
                  }
                },
                "Projecteur de travail, composants": {
                  "categoryId": null,
                  "categoryName": "Projecteur de travail, composants",
                  "level": 4,
                  "children": {
                    "Jeu de supports, phare supplémentaire": {
                      "categoryId": 100280,
                      "categoryName": "Worklight/Parts",
                      "level": 3,
                      "children": {
                        "Projecteur de travail, composants": {
                          "categoryId": null,
                          "categoryName": "Projecteur de travail, composants",
                          "level": 6,
                          "children": {
                            "Jeu de supports, phare supplémentaire": {
                              "categoryId": 100445,
                              "categoryName": "Worklight Parts",
                              "level": 4,
                              "children": [],
                              "productId": 2977
                            }
                          }
                        }
                      },
                      "productId": 2977
                    }
                  }
                },
                "Projecteur longue portée / composants": {
                  "categoryId": null,
                  "categoryName": "Projecteur longue portée / composants",
                  "level": 4,
                  "children": {
                    "Jeu de supports, phare supplémentaire": {
                      "categoryId": 100276,
                      "categoryName": "Spotlight/Parts",
                      "level": 3,
                      "children": {
                        "Projecteur longue portée / composants": {
                          "categoryId": null,
                          "categoryName": "Projecteur longue portée / composants",
                          "level": 6,
                          "children": {
                            "Jeu de supports, phare supplémentaire": {
                              "categoryId": 100443,
                              "categoryName": "Spotlight Parts",
                              "level": 4,
                              "children": [],
                              "productId": 2977
                            }
                          }
                        }
                      },
                      "productId": 2977
                    }
                  }
                }
              },
              "productId": 2977
            },
            "Joint, projecteur antibrouillard": {
              "categoryId": 100787,
              "categoryName": "Additional Headlight/Parts",
              "level": 2,
              "children": {
                "Projecteur antibrouillard/ composants": {
                  "categoryId": null,
                  "categoryName": "Projecteur antibrouillard/ composants",
                  "level": 4,
                  "children": {
                    "Joint, projecteur antibrouillard": {
                      "categoryId": 100277,
                      "categoryName": "Front Fog Light/Parts",
                      "level": 3,
                      "children": {
                        "Composants pour projecteur antibrouillard": {
                          "categoryId": null,
                          "categoryName": "Composants pour projecteur antibrouillard",
                          "level": 6,
                          "children": {
                            "Joint, projecteur antibrouillard": {
                              "categoryId": 100444,
                              "categoryName": "Fog Light Parts",
                              "level": 4,
                              "children": [],
                              "productId": 1100
                            }
                          }
                        }
                      },
                      "productId": 1100
                    }
                  }
                }
              },
              "productId": 1100
            },
            "Kit de câbles, projecteur antibrouillard": {
              "categoryId": 100787,
              "categoryName": "Additional Headlight/Parts",
              "level": 2,
              "children": {
                "Projecteur antibrouillard/ composants": {
                  "categoryId": null,
                  "categoryName": "Projecteur antibrouillard/ composants",
                  "level": 4,
                  "children": {
                    "Kit de câbles, projecteur antibrouillard": {
                      "categoryId": 100277,
                      "categoryName": "Front Fog Light/Parts",
                      "level": 3,
                      "children": {
                        "Composants pour projecteur antibrouillard": {
                          "categoryId": null,
                          "categoryName": "Composants pour projecteur antibrouillard",
                          "level": 6,
                          "children": {
                            "Kit de câbles, projecteur antibrouillard": {
                              "categoryId": 100444,
                              "categoryName": "Fog Light Parts",
                              "level": 4,
                              "children": [],
                              "productId": 426
                            }
                          }
                        }
                      },
                      "productId": 426
                    }
                  }
                }
              },
              "productId": 426
            },
            "Kit de projecteurs antibrouillard": {
              "categoryId": 100787,
              "categoryName": "Additional Headlight/Parts",
              "level": 2,
              "children": {
                "Projecteur antibrouillard/ composants": {
                  "categoryId": null,
                  "categoryName": "Projecteur antibrouillard/ composants",
                  "level": 4,
                  "children": {
                    "Kit de projecteurs antibrouillard": {
                      "categoryId": 100277,
                      "categoryName": "Front Fog Light/Parts",
                      "level": 3,
                      "children": {
                        "Projecteur antibrouillard / Optique": {
                          "categoryId": null,
                          "categoryName": "Projecteur antibrouillard / Optique",
                          "level": 6,
                          "children": {
                            "Kit de projecteurs antibrouillard": {
                              "categoryId": 100440,
                              "categoryName": "Front Fog Light/Insert",
                              "level": 4,
                              "children": [],
                              "productId": 3331
                            }
                          }
                        }
                      },
                      "productId": 3331
                    }
                  }
                }
              },
              "productId": 3331
            },
            "Kit réparation de câble, ampoule de feux antibrouillard": {
              "categoryId": 100787,
              "categoryName": "Additional Headlight/Parts",
              "level": 2,
              "children": {
                "Projecteur antibrouillard/ composants": {
                  "categoryId": null,
                  "categoryName": "Projecteur antibrouillard/ composants",
                  "level": 4,
                  "children": {
                    "Kit réparation de câble, ampoule de feux antibrouillard": {
                      "categoryId": 100277,
                      "categoryName": "Front Fog Light/Parts",
                      "level": 3,
                      "children": {
                        "Composants pour projecteur antibrouillard": {
                          "categoryId": null,
                          "categoryName": "Composants pour projecteur antibrouillard",
                          "level": 6,
                          "children": {
                            "Kit réparation de câble, ampoule de feux antibrouillard": {
                              "categoryId": 100444,
                              "categoryName": "Fog Light Parts",
                              "level": 4,
                              "children": [],
                              "productId": 8792
                            }
                          }
                        }
                      },
                      "productId": 8792
                    }
                  }
                }
              },
              "productId": 8792
            },
            "Kit réparation de câble, feu antibrouillard": {
              "categoryId": 100787,
              "categoryName": "Additional Headlight/Parts",
              "level": 2,
              "children": {
                "Projecteur antibrouillard/ composants": {
                  "categoryId": null,
                  "categoryName": "Projecteur antibrouillard/ composants",
                  "level": 4,
                  "children": {
                    "Kit réparation de câble, feu antibrouillard": {
                      "categoryId": 100277,
                      "categoryName": "Front Fog Light/Parts",
                      "level": 3,
                      "children": {
                        "Composants pour projecteur antibrouillard": {
                          "categoryId": null,
                          "categoryName": "Composants pour projecteur antibrouillard",
                          "level": 6,
                          "children": {
                            "Kit réparation de câble, feu antibrouillard": {
                              "categoryId": 100444,
                              "categoryName": "Fog Light Parts",
                              "level": 4,
                              "children": [],
                              "productId": 8003
                            }
                          }
                        }
                      },
                      "productId": 8003
                    }
                  }
                }
              },
              "productId": 8003
            },
            "Optique, projecteur antibrouillard": {
              "categoryId": 100787,
              "categoryName": "Additional Headlight/Parts",
              "level": 2,
              "children": {
                "Projecteur antibrouillard/ composants": {
                  "categoryId": null,
                  "categoryName": "Projecteur antibrouillard/ composants",
                  "level": 4,
                  "children": {
                    "Optique, projecteur antibrouillard": {
                      "categoryId": 100277,
                      "categoryName": "Front Fog Light/Parts",
                      "level": 3,
                      "children": {
                        "Projecteur antibrouillard / Optique": {
                          "categoryId": null,
                          "categoryName": "Projecteur antibrouillard / Optique",
                          "level": 6,
                          "children": {
                            "Optique, projecteur antibrouillard": {
                              "categoryId": 100440,
                              "categoryName": "Front Fog Light/Insert",
                              "level": 4,
                              "children": [],
                              "productId": 89
                            }
                          }
                        }
                      },
                      "productId": 89
                    }
                  }
                }
              },
              "productId": 89
            },
            "Projecteur antibrouillard": {
              "categoryId": 100787,
              "categoryName": "Additional Headlight/Parts",
              "level": 2,
              "children": {
                "Projecteur antibrouillard/ composants": {
                  "categoryId": null,
                  "categoryName": "Projecteur antibrouillard/ composants",
                  "level": 4,
                  "children": {
                    "Projecteur antibrouillard": {
                      "categoryId": 100277,
                      "categoryName": "Front Fog Light/Parts",
                      "level": 3,
                      "children": {
                        "Projecteur antibrouillard / Optique": {
                          "categoryId": null,
                          "categoryName": "Projecteur antibrouillard / Optique",
                          "level": 6,
                          "children": {
                            "Projecteur antibrouillard": {
                              "categoryId": 100440,
                              "categoryName": "Front Fog Light/Insert",
                              "level": 4,
                              "children": [],
                              "productId": 289
                            }
                          }
                        }
                      },
                      "productId": 289
                    }
                  }
                }
              },
              "productId": 289
            },
            "Réflecteur, projecteur antibrouillard": {
              "categoryId": 100787,
              "categoryName": "Additional Headlight/Parts",
              "level": 2,
              "children": {
                "Projecteur antibrouillard/ composants": {
                  "categoryId": null,
                  "categoryName": "Projecteur antibrouillard/ composants",
                  "level": 4,
                  "children": {
                    "Réflecteur, projecteur antibrouillard": {
                      "categoryId": 100277,
                      "categoryName": "Front Fog Light/Parts",
                      "level": 3,
                      "children": {
                        "Composants pour projecteur antibrouillard": {
                          "categoryId": null,
                          "categoryName": "Composants pour projecteur antibrouillard",
                          "level": 6,
                          "children": {
                            "Réflecteur, projecteur antibrouillard": {
                              "categoryId": 100444,
                              "categoryName": "Fog Light Parts",
                              "level": 4,
                              "children": [],
                              "productId": 710
                            }
                          }
                        }
                      },
                      "productId": 710
                    }
                  }
                }
              },
              "productId": 710
            },
            "Support, phare antibrouillard": {
              "categoryId": 100787,
              "categoryName": "Additional Headlight/Parts",
              "level": 2,
              "children": {
                "Projecteur antibrouillard/ composants": {
                  "categoryId": null,
                  "categoryName": "Projecteur antibrouillard/ composants",
                  "level": 4,
                  "children": {
                    "Support, phare antibrouillard": {
                      "categoryId": 100277,
                      "categoryName": "Front Fog Light/Parts",
                      "level": 3,
                      "children": {
                        "Composants pour projecteur antibrouillard": {
                          "categoryId": null,
                          "categoryName": "Composants pour projecteur antibrouillard",
                          "level": 6,
                          "children": {
                            "Support, phare antibrouillard": {
                              "categoryId": 100444,
                              "categoryName": "Fog Light Parts",
                              "level": 4,
                              "children": [],
                              "productId": 102
                            }
                          }
                        }
                      },
                      "productId": 102
                    }
                  }
                }
              },
              "productId": 102
            },
            "Support, phare supplémentaire": {
              "categoryId": 100787,
              "categoryName": "Additional Headlight/Parts",
              "level": 2,
              "children": {
                "Phare chercheur / composants": {
                  "categoryId": null,
                  "categoryName": "Phare chercheur / composants",
                  "level": 4,
                  "children": {
                    "Support, phare supplémentaire": {
                      "categoryId": 100281,
                      "categoryName": "Searchlight/Parts",
                      "level": 3,
                      "children": {
                        "Composants phare chercheur": {
                          "categoryId": null,
                          "categoryName": "Composants phare chercheur",
                          "level": 6,
                          "children": {
                            "Support, phare supplémentaire": {
                              "categoryId": 100446,
                              "categoryName": "Searchlight Parts",
                              "level": 4,
                              "children": [],
                              "productId": 2976
                            }
                          }
                        }
                      },
                      "productId": 2976
                    }
                  }
                },
                "Projecteur antibrouillard/ composants": {
                  "categoryId": null,
                  "categoryName": "Projecteur antibrouillard/ composants",
                  "level": 4,
                  "children": {
                    "Support, phare supplémentaire": {
                      "categoryId": 100277,
                      "categoryName": "Front Fog Light/Parts",
                      "level": 3,
                      "children": {
                        "Composants pour projecteur antibrouillard": {
                          "categoryId": null,
                          "categoryName": "Composants pour projecteur antibrouillard",
                          "level": 6,
                          "children": {
                            "Support, phare supplémentaire": {
                              "categoryId": 100444,
                              "categoryName": "Fog Light Parts",
                              "level": 4,
                              "children": [],
                              "productId": 2976
                            }
                          }
                        }
                      },
                      "productId": 2976
                    }
                  }
                },
                "Projecteur de travail, composants": {
                  "categoryId": null,
                  "categoryName": "Projecteur de travail, composants",
                  "level": 4,
                  "children": {
                    "Support, phare supplémentaire": {
                      "categoryId": 100280,
                      "categoryName": "Worklight/Parts",
                      "level": 3,
                      "children": {
                        "Projecteur de travail, composants": {
                          "categoryId": null,
                          "categoryName": "Projecteur de travail, composants",
                          "level": 6,
                          "children": {
                            "Support, phare supplémentaire": {
                              "categoryId": 100445,
                              "categoryName": "Worklight Parts",
                              "level": 4,
                              "children": [],
                              "productId": 2976
                            }
                          }
                        }
                      },
                      "productId": 2976
                    }
                  }
                },
                "Projecteur longue portée / composants": {
                  "categoryId": null,
                  "categoryName": "Projecteur longue portée / composants",
                  "level": 4,
                  "children": {
                    "Support, phare supplémentaire": {
                      "categoryId": 100276,
                      "categoryName": "Spotlight/Parts",
                      "level": 3,
                      "children": {
                        "Projecteur longue portée / composants": {
                          "categoryId": null,
                          "categoryName": "Projecteur longue portée / composants",
                          "level": 6,
                          "children": {
                            "Support, phare supplémentaire": {
                              "categoryId": 100443,
                              "categoryName": "Spotlight Parts",
                              "level": 4,
                              "children": [],
                              "productId": 2976
                            }
                          }
                        }
                      },
                      "productId": 2976
                    }
                  }
                }
              },
              "productId": 2976
            }
          }
        },
        "Relais": {
          "categoryId": null,
          "categoryName": "Relais",
          "level": 2,
          "children": {
            "Relais, projecteur antibrouillard": {
              "categoryId": 100785,
              "categoryName": "Relay",
              "level": 2,
              "children": [],
              "productId": 1294
            }
          }
        }
      }
    }
  },
  "arborescenceText": "├── Carrosserie [ID: 100001] (Niveau 1)\n│   ├── Avant du véhicule (Niveau 2)\n│   │   ├── Vehicle Front [ID: 101648] (Niveau 2) → ProductId: 108\n│   │   │   └── Projecteur antibrouillard/ composants (Niveau 4)\n│   │   │       └── Front Fog Light/Parts [ID: 101661] (Niveau 3) → ProductId: 108\n│   │   │           └── Ampoule pour projecteur antibrouillard (Niveau 6)\n│   │   │               └── Fog Light Bulb [ID: 101663] (Niveau 4) → ProductId: 108\n│   │   ├── Vehicle Front [ID: 101648] (Niveau 2) → ProductId: 855\n│   │   │   └── Projecteur antibrouillard/ composants (Niveau 4)\n│   │   │       └── Front Fog Light/Parts [ID: 101661] (Niveau 3) → ProductId: 855\n│   │   │           └── Composants pour projecteur antibrouillard (Niveau 6)\n│   │   │               └── Fog Light Parts [ID: 101664] (Niveau 4) → ProductId: 855\n│   │   ├── Vehicle Front [ID: 101648] (Niveau 2) → ProductId: 712\n│   │   │   ├── Composants/suppléments (Niveau 4)\n│   │   │   │   └── Parts [ID: 101673] (Niveau 3) → ProductId: 712\n│   │   │   │       └── Fixation/Support/collerette (Niveau 6)\n│   │   │   │           └── Racks/Carriers/Frames [ID: 101773] (Niveau 4) → ProductId: 712\n│   │   │   └── Projecteur antibrouillard/ composants (Niveau 4)\n│   │   │       └── Front Fog Light/Parts [ID: 101661] (Niveau 3) → ProductId: 712\n│   │   │           └── Composants pour projecteur antibrouillard (Niveau 6)\n│   │   │               └── Fog Light Parts [ID: 101664] (Niveau 4) → ProductId: 712\n│   │   ├── Vehicle Front [ID: 101648] (Niveau 2) → ProductId: 1077\n│   │   │   └── Projecteur antibrouillard/ composants (Niveau 4)\n│   │   │       └── Front Fog Light/Parts [ID: 101661] (Niveau 3) → ProductId: 1077\n│   │   │           └── Composants pour projecteur antibrouillard (Niveau 6)\n│   │   │               └── Fog Light Parts [ID: 101664] (Niveau 4) → ProductId: 1077\n│   │   ├── Vehicle Front [ID: 101648] (Niveau 2) → ProductId: 85\n│   │   │   └── Projecteur antibrouillard/ composants (Niveau 4)\n│   │   │       └── Front Fog Light/Parts [ID: 101661] (Niveau 3) → ProductId: 85\n│   │   │           └── Composants pour projecteur antibrouillard (Niveau 6)\n│   │   │               └── Fog Light Parts [ID: 101664] (Niveau 4) → ProductId: 85\n│   │   ├── Vehicle Front [ID: 101648] (Niveau 2) → ProductId: 490\n│   │   │   └── Projecteur antibrouillard/ composants (Niveau 4)\n│   │   │       └── Front Fog Light/Parts [ID: 101661] (Niveau 3) → ProductId: 490\n│   │   │           └── Composants pour projecteur antibrouillard (Niveau 6)\n│   │   │               └── Fog Light Parts [ID: 101664] (Niveau 4) → ProductId: 490\n│   │   ├── Vehicle Front [ID: 101648] (Niveau 2) → ProductId: 19\n│   │   │   ├── Composants/suppléments (Niveau 4)\n│   │   │   │   └── Parts [ID: 101673] (Niveau 3) → ProductId: 19\n│   │   │   │       └── Fixation/Support/collerette (Niveau 6)\n│   │   │   │           └── Racks/Carriers/Frames [ID: 101773] (Niveau 4) → ProductId: 19\n│   │   │   └── Projecteur antibrouillard/ composants (Niveau 4)\n│   │   │       └── Front Fog Light/Parts [ID: 101661] (Niveau 3) → ProductId: 19\n│   │   │           └── Composants pour projecteur antibrouillard (Niveau 6)\n│   │   │               └── Fog Light Parts [ID: 101664] (Niveau 4) → ProductId: 19\n│   │   ├── Vehicle Front [ID: 101648] (Niveau 2) → ProductId: 1100\n│   │   │   └── Projecteur antibrouillard/ composants (Niveau 4)\n│   │   │       └── Front Fog Light/Parts [ID: 101661] (Niveau 3) → ProductId: 1100\n│   │   │           └── Composants pour projecteur antibrouillard (Niveau 6)\n│   │   │               └── Fog Light Parts [ID: 101664] (Niveau 4) → ProductId: 1100\n│   │   ├── Vehicle Front [ID: 101648] (Niveau 2) → ProductId: 426\n│   │   │   └── Projecteur antibrouillard/ composants (Niveau 4)\n│   │   │       └── Front Fog Light/Parts [ID: 101661] (Niveau 3) → ProductId: 426\n│   │   │           └── Composants pour projecteur antibrouillard (Niveau 6)\n│   │   │               └── Fog Light Parts [ID: 101664] (Niveau 4) → ProductId: 426\n│   │   ├── Vehicle Front [ID: 101648] (Niveau 2) → ProductId: 3331\n│   │   │   └── Projecteur antibrouillard/ composants (Niveau 4)\n│   │   │       └── Front Fog Light/Parts [ID: 101661] (Niveau 3) → ProductId: 3331\n│   │   │           └── Projecteur antibrouillard / Optique (Niveau 6)\n│   │   │               └── Front Fog Light/Insert [ID: 101662] (Niveau 4) → ProductId: 3331\n│   │   ├── Vehicle Front [ID: 101648] (Niveau 2) → ProductId: 89\n│   │   │   └── Projecteur antibrouillard/ composants (Niveau 4)\n│   │   │       └── Front Fog Light/Parts [ID: 101661] (Niveau 3) → ProductId: 89\n│   │   │           └── Projecteur antibrouillard / Optique (Niveau 6)\n│   │   │               └── Front Fog Light/Insert [ID: 101662] (Niveau 4) → ProductId: 89\n│   │   ├── Vehicle Front [ID: 101648] (Niveau 2) → ProductId: 289\n│   │   │   └── Projecteur antibrouillard/ composants (Niveau 4)\n│   │   │       └── Front Fog Light/Parts [ID: 101661] (Niveau 3) → ProductId: 289\n│   │   │           └── Projecteur antibrouillard / Optique (Niveau 6)\n│   │   │               └── Front Fog Light/Insert [ID: 101662] (Niveau 4) → ProductId: 289\n│   │   ├── Vehicle Front [ID: 101648] (Niveau 2) → ProductId: 710\n│   │   │   └── Projecteur antibrouillard/ composants (Niveau 4)\n│   │   │       └── Front Fog Light/Parts [ID: 101661] (Niveau 3) → ProductId: 710\n│   │   │           └── Composants pour projecteur antibrouillard (Niveau 6)\n│   │   │               └── Fog Light Parts [ID: 101664] (Niveau 4) → ProductId: 710\n│   │   └── Vehicle Front [ID: 101648] (Niveau 2) → ProductId: 102\n│   │       └── Projecteur antibrouillard/ composants (Niveau 4)\n│   │           └── Front Fog Light/Parts [ID: 101661] (Niveau 3) → ProductId: 102\n│   │               └── Composants pour projecteur antibrouillard (Niveau 6)\n│   │                   └── Fog Light Parts [ID: 101664] (Niveau 4) → ProductId: 102\n│   ├── Fixation/Support/collerette (Niveau 2)\n│   │   ├── Racks/Carriers/Frames [ID: 101454] (Niveau 2) → ProductId: 712\n│   │   └── Racks/Carriers/Frames [ID: 101454] (Niveau 2) → ProductId: 19\n│   └── Phares supplémentaires/composants (Niveau 2)\n│       ├── Additional Headlight/Parts [ID: 101340] (Niveau 2) → ProductId: 108\n│       │   └── Projecteur antibrouillard/ composants (Niveau 4)\n│       │       └── Front Fog Light/Parts [ID: 101341] (Niveau 3) → ProductId: 108\n│       │           └── Ampoule pour projecteur antibrouillard (Niveau 6)\n│       │               └── Fog Light Bulb [ID: 101343] (Niveau 4) → ProductId: 108\n│       ├── Additional Headlight/Parts [ID: 101340] (Niveau 2) → ProductId: 855\n│       │   └── Projecteur antibrouillard/ composants (Niveau 4)\n│       │       └── Front Fog Light/Parts [ID: 101341] (Niveau 3) → ProductId: 855\n│       │           └── Composants pour projecteur antibrouillard (Niveau 6)\n│       │               └── Fog Light Parts [ID: 101344] (Niveau 4) → ProductId: 855\n│       ├── Additional Headlight/Parts [ID: 101340] (Niveau 2) → ProductId: 712\n│       │   └── Projecteur antibrouillard/ composants (Niveau 4)\n│       │       └── Front Fog Light/Parts [ID: 101341] (Niveau 3) → ProductId: 712\n│       │           └── Composants pour projecteur antibrouillard (Niveau 6)\n│       │               └── Fog Light Parts [ID: 101344] (Niveau 4) → ProductId: 712\n│       ├── Additional Headlight/Parts [ID: 101340] (Niveau 2) → ProductId: 1077\n│       │   └── Projecteur antibrouillard/ composants (Niveau 4)\n│       │       └── Front Fog Light/Parts [ID: 101341] (Niveau 3) → ProductId: 1077\n│       │           └── Composants pour projecteur antibrouillard (Niveau 6)\n│       │               └── Fog Light Parts [ID: 101344] (Niveau 4) → ProductId: 1077\n│       ├── Additional Headlight/Parts [ID: 101340] (Niveau 2) → ProductId: 85\n│       │   └── Projecteur antibrouillard/ composants (Niveau 4)\n│       │       └── Front Fog Light/Parts [ID: 101341] (Niveau 3) → ProductId: 85\n│       │           └── Composants pour projecteur antibrouillard (Niveau 6)\n│       │               └── Fog Light Parts [ID: 101344] (Niveau 4) → ProductId: 85\n│       ├── Additional Headlight/Parts [ID: 101340] (Niveau 2) → ProductId: 490\n│       │   └── Projecteur antibrouillard/ composants (Niveau 4)\n│       │       └── Front Fog Light/Parts [ID: 101341] (Niveau 3) → ProductId: 490\n│       │           └── Composants pour projecteur antibrouillard (Niveau 6)\n│       │               └── Fog Light Parts [ID: 101344] (Niveau 4) → ProductId: 490\n│       ├── Additional Headlight/Parts [ID: 101340] (Niveau 2) → ProductId: 19\n│       │   └── Projecteur antibrouillard/ composants (Niveau 4)\n│       │       └── Front Fog Light/Parts [ID: 101341] (Niveau 3) → ProductId: 19\n│       │           └── Composants pour projecteur antibrouillard (Niveau 6)\n│       │               └── Fog Light Parts [ID: 101344] (Niveau 4) → ProductId: 19\n│       ├── Additional Headlight/Parts [ID: 101340] (Niveau 2) → ProductId: 1100\n│       │   └── Projecteur antibrouillard/ composants (Niveau 4)\n│       │       └── Front Fog Light/Parts [ID: 101341] (Niveau 3) → ProductId: 1100\n│       │           └── Composants pour projecteur antibrouillard (Niveau 6)\n│       │               └── Fog Light Parts [ID: 101344] (Niveau 4) → ProductId: 1100\n│       ├── Additional Headlight/Parts [ID: 101340] (Niveau 2) → ProductId: 426\n│       │   └── Projecteur antibrouillard/ composants (Niveau 4)\n│       │       └── Front Fog Light/Parts [ID: 101341] (Niveau 3) → ProductId: 426\n│       │           └── Composants pour projecteur antibrouillard (Niveau 6)\n│       │               └── Fog Light Parts [ID: 101344] (Niveau 4) → ProductId: 426\n│       ├── Additional Headlight/Parts [ID: 101340] (Niveau 2) → ProductId: 3331\n│       │   └── Projecteur antibrouillard/ composants (Niveau 4)\n│       │       └── Front Fog Light/Parts [ID: 101341] (Niveau 3) → ProductId: 3331\n│       │           └── Projecteur antibrouillard / Optique (Niveau 6)\n│       │               └── Front Fog Light/Insert [ID: 101342] (Niveau 4) → ProductId: 3331\n│       ├── Additional Headlight/Parts [ID: 101340] (Niveau 2) → ProductId: 89\n│       │   └── Projecteur antibrouillard/ composants (Niveau 4)\n│       │       └── Front Fog Light/Parts [ID: 101341] (Niveau 3) → ProductId: 89\n│       │           └── Projecteur antibrouillard / Optique (Niveau 6)\n│       │               └── Front Fog Light/Insert [ID: 101342] (Niveau 4) → ProductId: 89\n│       ├── Additional Headlight/Parts [ID: 101340] (Niveau 2) → ProductId: 289\n│       │   └── Projecteur antibrouillard/ composants (Niveau 4)\n│       │       └── Front Fog Light/Parts [ID: 101341] (Niveau 3) → ProductId: 289\n│       │           └── Projecteur antibrouillard / Optique (Niveau 6)\n│       │               └── Front Fog Light/Insert [ID: 101342] (Niveau 4) → ProductId: 289\n│       ├── Additional Headlight/Parts [ID: 101340] (Niveau 2) → ProductId: 710\n│       │   └── Projecteur antibrouillard/ composants (Niveau 4)\n│       │       └── Front Fog Light/Parts [ID: 101341] (Niveau 3) → ProductId: 710\n│       │           └── Composants pour projecteur antibrouillard (Niveau 6)\n│       │               └── Fog Light Parts [ID: 101344] (Niveau 4) → ProductId: 710\n│       └── Additional Headlight/Parts [ID: 101340] (Niveau 2) → ProductId: 102\n│           └── Projecteur antibrouillard/ composants (Niveau 4)\n│               └── Front Fog Light/Parts [ID: 101341] (Niveau 3) → ProductId: 102\n│                   └── Composants pour projecteur antibrouillard (Niveau 6)\n│                       └── Fog Light Parts [ID: 101344] (Niveau 4) → ProductId: 102\n\n└── Système électrique [ID: 100010] (Niveau 1)\n    ├── Interrupteur/Relais/Contrôle clignotant/Appareil d.commande (Niveau 2)\n    │   └── Light Switches/Relays/Controls [ID: 100307] (Niveau 2) → ProductId: 1294\n    │       └── Relais (Niveau 4)\n    │           └── Relay [ID: 100510] (Niveau 3) → ProductId: 1294\n    ├── Kit/pièces de câble (Niveau 2)\n    │   └── Cable Set/individual parts [ID: 103066] (Niveau 2) → ProductId: 426\n    ├── Phares supplémentaires/composants (Niveau 2)\n    │   ├── Additional Headlight/Parts [ID: 100787] (Niveau 2) → ProductId: 108\n    │   │   └── Projecteur antibrouillard/ composants (Niveau 4)\n    │   │       └── Front Fog Light/Parts [ID: 100277] (Niveau 3) → ProductId: 108\n    │   │           └── Ampoule pour projecteur antibrouillard (Niveau 6)\n    │   │               └── Fog Light Bulb [ID: 100447] (Niveau 4) → ProductId: 108\n    │   ├── Additional Headlight/Parts [ID: 100787] (Niveau 2) → ProductId: 855\n    │   │   └── Projecteur antibrouillard/ composants (Niveau 4)\n    │   │       └── Front Fog Light/Parts [ID: 100277] (Niveau 3) → ProductId: 855\n    │   │           └── Composants pour projecteur antibrouillard (Niveau 6)\n    │   │               └── Fog Light Parts [ID: 100444] (Niveau 4) → ProductId: 855\n    │   ├── Additional Headlight/Parts [ID: 100787] (Niveau 2) → ProductId: 712\n    │   │   └── Projecteur antibrouillard/ composants (Niveau 4)\n    │   │       └── Front Fog Light/Parts [ID: 100277] (Niveau 3) → ProductId: 712\n    │   │           └── Composants pour projecteur antibrouillard (Niveau 6)\n    │   │               └── Fog Light Parts [ID: 100444] (Niveau 4) → ProductId: 712\n    │   ├── Additional Headlight/Parts [ID: 100787] (Niveau 2) → ProductId: 1077\n    │   │   └── Projecteur antibrouillard/ composants (Niveau 4)\n    │   │       └── Front Fog Light/Parts [ID: 100277] (Niveau 3) → ProductId: 1077\n    │   │           └── Composants pour projecteur antibrouillard (Niveau 6)\n    │   │               └── Fog Light Parts [ID: 100444] (Niveau 4) → ProductId: 1077\n    │   ├── Additional Headlight/Parts [ID: 100787] (Niveau 2) → ProductId: 85\n    │   │   └── Projecteur antibrouillard/ composants (Niveau 4)\n    │   │       └── Front Fog Light/Parts [ID: 100277] (Niveau 3) → ProductId: 85\n    │   │           └── Composants pour projecteur antibrouillard (Niveau 6)\n    │   │               └── Fog Light Parts [ID: 100444] (Niveau 4) → ProductId: 85\n    │   ├── Additional Headlight/Parts [ID: 100787] (Niveau 2) → ProductId: 490\n    │   │   └── Projecteur antibrouillard/ composants (Niveau 4)\n    │   │       └── Front Fog Light/Parts [ID: 100277] (Niveau 3) → ProductId: 490\n    │   │           └── Composants pour projecteur antibrouillard (Niveau 6)\n    │   │               └── Fog Light Parts [ID: 100444] (Niveau 4) → ProductId: 490\n    │   ├── Additional Headlight/Parts [ID: 100787] (Niveau 2) → ProductId: 19\n    │   │   └── Projecteur antibrouillard/ composants (Niveau 4)\n    │   │       └── Front Fog Light/Parts [ID: 100277] (Niveau 3) → ProductId: 19\n    │   │           └── Composants pour projecteur antibrouillard (Niveau 6)\n    │   │               └── Fog Light Parts [ID: 100444] (Niveau 4) → ProductId: 19\n    │   ├── Additional Headlight/Parts [ID: 100787] (Niveau 2) → ProductId: 2977\n    │   │   ├── Phare chercheur / composants (Niveau 4)\n    │   │   │   └── Searchlight/Parts [ID: 100281] (Niveau 3) → ProductId: 2977\n    │   │   │       └── Composants phare chercheur (Niveau 6)\n    │   │   │           └── Searchlight Parts [ID: 100446] (Niveau 4) → ProductId: 2977\n    │   │   ├── Projecteur antibrouillard/ composants (Niveau 4)\n    │   │   │   └── Front Fog Light/Parts [ID: 100277] (Niveau 3) → ProductId: 2977\n    │   │   │       └── Composants pour projecteur antibrouillard (Niveau 6)\n    │   │   │           └── Fog Light Parts [ID: 100444] (Niveau 4) → ProductId: 2977\n    │   │   ├── Projecteur de travail, composants (Niveau 4)\n    │   │   │   └── Worklight/Parts [ID: 100280] (Niveau 3) → ProductId: 2977\n    │   │   │       └── Projecteur de travail, composants (Niveau 6)\n    │   │   │           └── Worklight Parts [ID: 100445] (Niveau 4) → ProductId: 2977\n    │   │   └── Projecteur longue portée / composants (Niveau 4)\n    │   │       └── Spotlight/Parts [ID: 100276] (Niveau 3) → ProductId: 2977\n    │   │           └── Projecteur longue portée / composants (Niveau 6)\n    │   │               └── Spotlight Parts [ID: 100443] (Niveau 4) → ProductId: 2977\n    │   ├── Additional Headlight/Parts [ID: 100787] (Niveau 2) → ProductId: 1100\n    │   │   └── Projecteur antibrouillard/ composants (Niveau 4)\n    │   │       └── Front Fog Light/Parts [ID: 100277] (Niveau 3) → ProductId: 1100\n    │   │           └── Composants pour projecteur antibrouillard (Niveau 6)\n    │   │               └── Fog Light Parts [ID: 100444] (Niveau 4) → ProductId: 1100\n    │   ├── Additional Headlight/Parts [ID: 100787] (Niveau 2) → ProductId: 426\n    │   │   └── Projecteur antibrouillard/ composants (Niveau 4)\n    │   │       └── Front Fog Light/Parts [ID: 100277] (Niveau 3) → ProductId: 426\n    │   │           └── Composants pour projecteur antibrouillard (Niveau 6)\n    │   │               └── Fog Light Parts [ID: 100444] (Niveau 4) → ProductId: 426\n    │   ├── Additional Headlight/Parts [ID: 100787] (Niveau 2) → ProductId: 3331\n    │   │   └── Projecteur antibrouillard/ composants (Niveau 4)\n    │   │       └── Front Fog Light/Parts [ID: 100277] (Niveau 3) → ProductId: 3331\n    │   │           └── Projecteur antibrouillard / Optique (Niveau 6)\n    │   │               └── Front Fog Light/Insert [ID: 100440] (Niveau 4) → ProductId: 3331\n    │   ├── Additional Headlight/Parts [ID: 100787] (Niveau 2) → ProductId: 8792\n    │   │   └── Projecteur antibrouillard/ composants (Niveau 4)\n    │   │       └── Front Fog Light/Parts [ID: 100277] (Niveau 3) → ProductId: 8792\n    │   │           └── Composants pour projecteur antibrouillard (Niveau 6)\n    │   │               └── Fog Light Parts [ID: 100444] (Niveau 4) → ProductId: 8792\n    │   ├── Additional Headlight/Parts [ID: 100787] (Niveau 2) → ProductId: 8003\n    │   │   └── Projecteur antibrouillard/ composants (Niveau 4)\n    │   │       └── Front Fog Light/Parts [ID: 100277] (Niveau 3) → ProductId: 8003\n    │   │           └── Composants pour projecteur antibrouillard (Niveau 6)\n    │   │               └── Fog Light Parts [ID: 100444] (Niveau 4) → ProductId: 8003\n    │   ├── Additional Headlight/Parts [ID: 100787] (Niveau 2) → ProductId: 89\n    │   │   └── Projecteur antibrouillard/ composants (Niveau 4)\n    │   │       └── Front Fog Light/Parts [ID: 100277] (Niveau 3) → ProductId: 89\n    │   │           └── Projecteur antibrouillard / Optique (Niveau 6)\n    │   │               └── Front Fog Light/Insert [ID: 100440] (Niveau 4) → ProductId: 89\n    │   ├── Additional Headlight/Parts [ID: 100787] (Niveau 2) → ProductId: 289\n    │   │   └── Projecteur antibrouillard/ composants (Niveau 4)\n    │   │       └── Front Fog Light/Parts [ID: 100277] (Niveau 3) → ProductId: 289\n    │   │           └── Projecteur antibrouillard / Optique (Niveau 6)\n    │   │               └── Front Fog Light/Insert [ID: 100440] (Niveau 4) → ProductId: 289\n    │   ├── Additional Headlight/Parts [ID: 100787] (Niveau 2) → ProductId: 710\n    │   │   └── Projecteur antibrouillard/ composants (Niveau 4)\n    │   │       └── Front Fog Light/Parts [ID: 100277] (Niveau 3) → ProductId: 710\n    │   │           └── Composants pour projecteur antibrouillard (Niveau 6)\n    │   │               └── Fog Light Parts [ID: 100444] (Niveau 4) → ProductId: 710\n    │   ├── Additional Headlight/Parts [ID: 100787] (Niveau 2) → ProductId: 102\n    │   │   └── Projecteur antibrouillard/ composants (Niveau 4)\n    │   │       └── Front Fog Light/Parts [ID: 100277] (Niveau 3) → ProductId: 102\n    │   │           └── Composants pour projecteur antibrouillard (Niveau 6)\n    │   │               └── Fog Light Parts [ID: 100444] (Niveau 4) → ProductId: 102\n    │   └── Additional Headlight/Parts [ID: 100787] (Niveau 2) → ProductId: 2976\n    │       ├── Phare chercheur / composants (Niveau 4)\n    │       │   └── Searchlight/Parts [ID: 100281] (Niveau 3) → ProductId: 2976\n    │       │       └── Composants phare chercheur (Niveau 6)\n    │       │           └── Searchlight Parts [ID: 100446] (Niveau 4) → ProductId: 2976\n    │       ├── Projecteur antibrouillard/ composants (Niveau 4)\n    │       │   └── Front Fog Light/Parts [ID: 100277] (Niveau 3) → ProductId: 2976\n    │       │       └── Composants pour projecteur antibrouillard (Niveau 6)\n    │       │           └── Fog Light Parts [ID: 100444] (Niveau 4) → ProductId: 2976\n    │       ├── Projecteur de travail, composants (Niveau 4)\n    │       │   └── Worklight/Parts [ID: 100280] (Niveau 3) → ProductId: 2976\n    │       │       └── Projecteur de travail, composants (Niveau 6)\n    │       │           └── Worklight Parts [ID: 100445] (Niveau 4) → ProductId: 2976\n    │       └── Projecteur longue portée / composants (Niveau 4)\n    │           └── Spotlight/Parts [ID: 100276] (Niveau 3) → ProductId: 2976\n    │               └── Projecteur longue portée / composants (Niveau 6)\n    │                   └── Spotlight Parts [ID: 100443] (Niveau 4) → ProductId: 2976\n    └── Relais (Niveau 2)\n        └── Relay [ID: 100785] (Niveau 2) → ProductId: 1294",
  "arborescencePaths": [
    {
      "path": [
        "Carrosserie",
        "Avant du véhicule",
        "Vehicle Front"
      ],
      "categoryIds": [
        100001,
        null,
        101648
      ],
      "finalCategoryId": 101648,
      "productId": 108
    },
    {
      "path": [
        "Carrosserie",
        "Avant du véhicule",
        "Vehicle Front"
      ],
      "categoryIds": [
        100001,
        null,
        101648
      ],
      "finalCategoryId": 101648,
      "productId": 855
    },
    {
      "path": [
        "Carrosserie",
        "Avant du véhicule",
        "Vehicle Front"
      ],
      "categoryIds": [
        100001,
        null,
        101648
      ],
      "finalCategoryId": 101648,
      "productId": 712
    },
    {
      "path": [
        "Carrosserie",
        "Avant du véhicule",
        "Vehicle Front"
      ],
      "categoryIds": [
        100001,
        null,
        101648
      ],
      "finalCategoryId": 101648,
      "productId": 1077
    },
    {
      "path": [
        "Carrosserie",
        "Avant du véhicule",
        "Vehicle Front"
      ],
      "categoryIds": [
        100001,
        null,
        101648
      ],
      "finalCategoryId": 101648,
      "productId": 85
    },
    {
      "path": [
        "Carrosserie",
        "Avant du véhicule",
        "Vehicle Front"
      ],
      "categoryIds": [
        100001,
        null,
        101648
      ],
      "finalCategoryId": 101648,
      "productId": 490
    },
    {
      "path": [
        "Carrosserie",
        "Avant du véhicule",
        "Vehicle Front"
      ],
      "categoryIds": [
        100001,
        null,
        101648
      ],
      "finalCategoryId": 101648,
      "productId": 19
    },
    {
      "path": [
        "Carrosserie",
        "Avant du véhicule",
        "Vehicle Front"
      ],
      "categoryIds": [
        100001,
        null,
        101648
      ],
      "finalCategoryId": 101648,
      "productId": 1100
    },
    {
      "path": [
        "Carrosserie",
        "Avant du véhicule",
        "Vehicle Front"
      ],
      "categoryIds": [
        100001,
        null,
        101648
      ],
      "finalCategoryId": 101648,
      "productId": 426
    },
    {
      "path": [
        "Carrosserie",
        "Avant du véhicule",
        "Vehicle Front"
      ],
      "categoryIds": [
        100001,
        null,
        101648
      ],
      "finalCategoryId": 101648,
      "productId": 3331
    },
    {
      "path": [
        "Carrosserie",
        "Avant du véhicule",
        "Vehicle Front"
      ],
      "categoryIds": [
        100001,
        null,
        101648
      ],
      "finalCategoryId": 101648,
      "productId": 89
    },
    {
      "path": [
        "Carrosserie",
        "Avant du véhicule",
        "Vehicle Front"
      ],
      "categoryIds": [
        100001,
        null,
        101648
      ],
      "finalCategoryId": 101648,
      "productId": 289
    },
    {
      "path": [
        "Carrosserie",
        "Avant du véhicule",
        "Vehicle Front"
      ],
      "categoryIds": [
        100001,
        null,
        101648
      ],
      "finalCategoryId": 101648,
      "productId": 710
    },
    {
      "path": [
        "Carrosserie",
        "Avant du véhicule",
        "Vehicle Front"
      ],
      "categoryIds": [
        100001,
        null,
        101648
      ],
      "finalCategoryId": 101648,
      "productId": 102
    },
    {
      "path": [
        "Carrosserie",
        "Fixation/Support/collerette",
        "Racks/Carriers/Frames"
      ],
      "categoryIds": [
        100001,
        null,
        101454
      ],
      "finalCategoryId": 101454,
      "productId": 712
    },
    {
      "path": [
        "Carrosserie",
        "Fixation/Support/collerette",
        "Racks/Carriers/Frames"
      ],
      "categoryIds": [
        100001,
        null,
        101454
      ],
      "finalCategoryId": 101454,
      "productId": 19
    },
    {
      "path": [
        "Carrosserie",
        "Phares supplémentaires/composants",
        "Additional Headlight/Parts"
      ],
      "categoryIds": [
        100001,
        null,
        101340
      ],
      "finalCategoryId": 101340,
      "productId": 108
    },
    {
      "path": [
        "Carrosserie",
        "Phares supplémentaires/composants",
        "Additional Headlight/Parts"
      ],
      "categoryIds": [
        100001,
        null,
        101340
      ],
      "finalCategoryId": 101340,
      "productId": 855
    },
    {
      "path": [
        "Carrosserie",
        "Phares supplémentaires/composants",
        "Additional Headlight/Parts"
      ],
      "categoryIds": [
        100001,
        null,
        101340
      ],
      "finalCategoryId": 101340,
      "productId": 712
    },
    {
      "path": [
        "Carrosserie",
        "Phares supplémentaires/composants",
        "Additional Headlight/Parts"
      ],
      "categoryIds": [
        100001,
        null,
        101340
      ],
      "finalCategoryId": 101340,
      "productId": 1077
    },
    {
      "path": [
        "Carrosserie",
        "Phares supplémentaires/composants",
        "Additional Headlight/Parts"
      ],
      "categoryIds": [
        100001,
        null,
        101340
      ],
      "finalCategoryId": 101340,
      "productId": 85
    },
    {
      "path": [
        "Carrosserie",
        "Phares supplémentaires/composants",
        "Additional Headlight/Parts"
      ],
      "categoryIds": [
        100001,
        null,
        101340
      ],
      "finalCategoryId": 101340,
      "productId": 490
    },
    {
      "path": [
        "Carrosserie",
        "Phares supplémentaires/composants",
        "Additional Headlight/Parts"
      ],
      "categoryIds": [
        100001,
        null,
        101340
      ],
      "finalCategoryId": 101340,
      "productId": 19
    },
    {
      "path": [
        "Carrosserie",
        "Phares supplémentaires/composants",
        "Additional Headlight/Parts"
      ],
      "categoryIds": [
        100001,
        null,
        101340
      ],
      "finalCategoryId": 101340,
      "productId": 1100
    },
    {
      "path": [
        "Carrosserie",
        "Phares supplémentaires/composants",
        "Additional Headlight/Parts"
      ],
      "categoryIds": [
        100001,
        null,
        101340
      ],
      "finalCategoryId": 101340,
      "productId": 426
    },
    {
      "path": [
        "Carrosserie",
        "Phares supplémentaires/composants",
        "Additional Headlight/Parts"
      ],
      "categoryIds": [
        100001,
        null,
        101340
      ],
      "finalCategoryId": 101340,
      "productId": 3331
    },
    {
      "path": [
        "Carrosserie",
        "Phares supplémentaires/composants",
        "Additional Headlight/Parts"
      ],
      "categoryIds": [
        100001,
        null,
        101340
      ],
      "finalCategoryId": 101340,
      "productId": 89
    },
    {
      "path": [
        "Carrosserie",
        "Phares supplémentaires/composants",
        "Additional Headlight/Parts"
      ],
      "categoryIds": [
        100001,
        null,
        101340
      ],
      "finalCategoryId": 101340,
      "productId": 289
    },
    {
      "path": [
        "Carrosserie",
        "Phares supplémentaires/composants",
        "Additional Headlight/Parts"
      ],
      "categoryIds": [
        100001,
        null,
        101340
      ],
      "finalCategoryId": 101340,
      "productId": 710
    },
    {
      "path": [
        "Carrosserie",
        "Phares supplémentaires/composants",
        "Additional Headlight/Parts"
      ],
      "categoryIds": [
        100001,
        null,
        101340
      ],
      "finalCategoryId": 101340,
      "productId": 102
    },
    {
      "path": [
        "Système électrique",
        "Interrupteur/Relais/Contrôle clignotant/Appareil d.commande",
        "Light Switches/Relays/Controls"
      ],
      "categoryIds": [
        100010,
        null,
        100307
      ],
      "finalCategoryId": 100307,
      "productId": 1294
    },
    {
      "path": [
        "Système électrique",
        "Kit/pièces de câble",
        "Cable Set/individual parts"
      ],
      "categoryIds": [
        100010,
        null,
        103066
      ],
      "finalCategoryId": 103066,
      "productId": 426
    },
    {
      "path": [
        "Système électrique",
        "Phares supplémentaires/composants",
        "Additional Headlight/Parts"
      ],
      "categoryIds": [
        100010,
        null,
        100787
      ],
      "finalCategoryId": 100787,
      "productId": 108
    },
    {
      "path": [
        "Système électrique",
        "Phares supplémentaires/composants",
        "Additional Headlight/Parts"
      ],
      "categoryIds": [
        100010,
        null,
        100787
      ],
      "finalCategoryId": 100787,
      "productId": 855
    },
    {
      "path": [
        "Système électrique",
        "Phares supplémentaires/composants",
        "Additional Headlight/Parts"
      ],
      "categoryIds": [
        100010,
        null,
        100787
      ],
      "finalCategoryId": 100787,
      "productId": 712
    },
    {
      "path": [
        "Système électrique",
        "Phares supplémentaires/composants",
        "Additional Headlight/Parts"
      ],
      "categoryIds": [
        100010,
        null,
        100787
      ],
      "finalCategoryId": 100787,
      "productId": 1077
    },
    {
      "path": [
        "Système électrique",
        "Phares supplémentaires/composants",
        "Additional Headlight/Parts"
      ],
      "categoryIds": [
        100010,
        null,
        100787
      ],
      "finalCategoryId": 100787,
      "productId": 85
    },
    {
      "path": [
        "Système électrique",
        "Phares supplémentaires/composants",
        "Additional Headlight/Parts"
      ],
      "categoryIds": [
        100010,
        null,
        100787
      ],
      "finalCategoryId": 100787,
      "productId": 490
    },
    {
      "path": [
        "Système électrique",
        "Phares supplémentaires/composants",
        "Additional Headlight/Parts"
      ],
      "categoryIds": [
        100010,
        null,
        100787
      ],
      "finalCategoryId": 100787,
      "productId": 19
    },
    {
      "path": [
        "Système électrique",
        "Phares supplémentaires/composants",
        "Additional Headlight/Parts"
      ],
      "categoryIds": [
        100010,
        null,
        100787
      ],
      "finalCategoryId": 100787,
      "productId": 2977
    },
    {
      "path": [
        "Système électrique",
        "Phares supplémentaires/composants",
        "Additional Headlight/Parts"
      ],
      "categoryIds": [
        100010,
        null,
        100787
      ],
      "finalCategoryId": 100787,
      "productId": 1100
    },
    {
      "path": [
        "Système électrique",
        "Phares supplémentaires/composants",
        "Additional Headlight/Parts"
      ],
      "categoryIds": [
        100010,
        null,
        100787
      ],
      "finalCategoryId": 100787,
      "productId": 426
    },
    {
      "path": [
        "Système électrique",
        "Phares supplémentaires/composants",
        "Additional Headlight/Parts"
      ],
      "categoryIds": [
        100010,
        null,
        100787
      ],
      "finalCategoryId": 100787,
      "productId": 3331
    },
    {
      "path": [
        "Système électrique",
        "Phares supplémentaires/composants",
        "Additional Headlight/Parts"
      ],
      "categoryIds": [
        100010,
        null,
        100787
      ],
      "finalCategoryId": 100787,
      "productId": 8792
    },
    {
      "path": [
        "Système électrique",
        "Phares supplémentaires/composants",
        "Additional Headlight/Parts"
      ],
      "categoryIds": [
        100010,
        null,
        100787
      ],
      "finalCategoryId": 100787,
      "productId": 8003
    },
    {
      "path": [
        "Système électrique",
        "Phares supplémentaires/composants",
        "Additional Headlight/Parts"
      ],
      "categoryIds": [
        100010,
        null,
        100787
      ],
      "finalCategoryId": 100787,
      "productId": 89
    },
    {
      "path": [
        "Système électrique",
        "Phares supplémentaires/composants",
        "Additional Headlight/Parts"
      ],
      "categoryIds": [
        100010,
        null,
        100787
      ],
      "finalCategoryId": 100787,
      "productId": 289
    },
    {
      "path": [
        "Système électrique",
        "Phares supplémentaires/composants",
        "Additional Headlight/Parts"
      ],
      "categoryIds": [
        100010,
        null,
        100787
      ],
      "finalCategoryId": 100787,
      "productId": 710
    },
    {
      "path": [
        "Système électrique",
        "Phares supplémentaires/composants",
        "Additional Headlight/Parts"
      ],
      "categoryIds": [
        100010,
        null,
        100787
      ],
      "finalCategoryId": 100787,
      "productId": 102
    },
    {
      "path": [
        "Système électrique",
        "Phares supplémentaires/composants",
        "Additional Headlight/Parts"
      ],
      "categoryIds": [
        100010,
        null,
        100787
      ],
      "finalCategoryId": 100787,
      "productId": 2976
    },
    {
      "path": [
        "Système électrique",
        "Relais",
        "Relay"
      ],
      "categoryIds": [
        100010,
        null,
        100785
      ],
      "finalCategoryId": 100785,
      "productId": 1294
    }
  ],
  "productIdsInArbo": [
    19,
    85,
    89,
    102,
    108,
    289,
    426,
    490,
    710,
    712,
    855,
    1077,
    1100,
    1294,
    2976,
    2977,
    3331,
    8003,
    8792
  ],
  "matchedProductIds": [
    289
  ]
}