{
  "productName": "Raccord de tuyau",
  "searchText": "Raccord de tuyau",
  "found": true,
  "hasMatch": true,
  "timestamp": "2025-12-03T07:05:51.679Z",
  "productId": 1355,
  "arborescence": {
    "Alimentation carburant": {
      "categoryId": 100214,
      "categoryName": "Alimentation carburant",
      "level": 1,
      "children": {
        "Tuyauterie": {
          "categoryId": null,
          "categoryName": "Tuyauterie",
          "level": 2,
          "children": {
            "Raccord de tuyau, tuyau de carburant": {
              "categoryId": 100258,
              "categoryName": "Fuel Lines",
              "level": 2,
              "children": [],
              "productId": 612
            }
          }
        }
      }
    },
    "Carburation": {
      "categoryId": 100254,
      "categoryName": "Carburation",
      "level": 1,
      "children": {
        "Mélange air-carburant": {
          "categoryId": null,
          "categoryName": "Mélange air-carburant",
          "level": 2,
          "children": {
            "Raccord de tuyau, répartiteur de carburant (injection)": {
              "categoryId": 102793,
              "categoryName": "Mixture Formation",
              "level": 2,
              "children": {
                "Conduite de carburant / répartition du carburant": {
                  "categoryId": null,
                  "categoryName": "Conduite de carburant / répartition du carburant",
                  "level": 4,
                  "children": {
                    "Raccord de tuyau, répartiteur de carburant (injection)": {
                      "categoryId": 102804,
                      "categoryName": "Fuel Line/Distribution/Allocation",
                      "level": 3,
                      "children": [],
                      "productId": 5632
                    }
                  }
                }
              },
              "productId": 5632
            }
          }
        }
      }
    },
    "Dispositif de freinage": {
      "categoryId": 100006,
      "categoryName": "Dispositif de freinage",
      "level": 1,
      "children": {
        "Servofrein": {
          "categoryId": null,
          "categoryName": "Servofrein",
          "level": 2,
          "children": {
            "Raccord de tuyau": {
              "categoryId": 100025,
              "categoryName": "Brake Booster",
              "level": 2,
              "children": [],
              "productId": 1355
            }
          }
        }
      }
    },
    "Échappement": {
      "categoryId": 100004,
      "categoryName": "Échappement",
      "level": 1,
      "children": {
        "Catalyseur": {
          "categoryId": null,
          "categoryName": "Catalyseur",
          "level": 2,
          "children": {
            "Tube de réparation, catalyseur": {
              "categoryId": 100047,
              "categoryName": "Catalytic Converter",
              "level": 2,
              "children": [],
              "productId": 3466
            }
          }
        },
        "Filtre à particules": {
          "categoryId": null,
          "categoryName": "Filtre à particules",
          "level": 2,
          "children": {
            "Tube de réparation, filtre à particules/ à suie": {
              "categoryId": 100318,
              "categoryName": "Soot/Particulate Filter",
              "level": 2,
              "children": [],
              "productId": 4807
            }
          }
        },
        "Injection d'urée": {
          "categoryId": null,
          "categoryName": "Injection d'urée",
          "level": 2,
          "children": {
            "Raccord de tuyau, Tuyau d'urée": {
              "categoryId": 103019,
              "categoryName": "Urea Injection",
              "level": 2,
              "children": {
                "Flexibles/Conduites": {
                  "categoryId": null,
                  "categoryName": "Flexibles/Conduites",
                  "level": 4,
                  "children": {
                    "Raccord de tuyau, Tuyau d'urée": {
                      "categoryId": 103401,
                      "categoryName": "Radiator Hoses",
                      "level": 3,
                      "children": [],
                      "productId": 4853
                    }
                  }
                }
              },
              "productId": 4853
            }
          }
        },
        "Pièces de montage": {
          "categoryId": null,
          "categoryName": "Pièces de montage",
          "level": 2,
          "children": {
            "Raccord de tuyau, système d'échappement": {
              "categoryId": 100222,
              "categoryName": "Assembly Parts",
              "level": 2,
              "children": {
                "Pièces détachées de montage": {
                  "categoryId": null,
                  "categoryName": "Pièces détachées de montage",
                  "level": 4,
                  "children": {
                    "Raccord de tuyau, système d'échappement": {
                      "categoryId": 100317,
                      "categoryName": "Individual Assembly Parts",
                      "level": 3,
                      "children": {
                        "Collier": {
                          "categoryId": null,
                          "categoryName": "Collier",
                          "level": 6,
                          "children": {
                            "Raccord de tuyau, système d'échappement": {
                              "categoryId": 100323,
                              "categoryName": "Pipe Clamp",
                              "level": 4,
                              "children": [],
                              "productId": 1050
                            }
                          }
                        },
                        "Gaine de soudure": {
                          "categoryId": null,
                          "categoryName": "Gaine de soudure",
                          "level": 6,
                          "children": {
                            "Raccord de tuyau, système d'échappement": {
                              "categoryId": 100716,
                              "categoryName": "Welded Sleeve",
                              "level": 4,
                              "children": [],
                              "productId": 1050
                            }
                          }
                        }
                      },
                      "productId": 1050
                    }
                  }
                }
              },
              "productId": 1050
            },
            "Tuyau flexible, échappement": {
              "categoryId": 100222,
              "categoryName": "Assembly Parts",
              "level": 2,
              "children": {
                "Pièces détachées de montage": {
                  "categoryId": null,
                  "categoryName": "Pièces détachées de montage",
                  "level": 4,
                  "children": {
                    "Tuyau flexible, échappement": {
                      "categoryId": 100317,
                      "categoryName": "Individual Assembly Parts",
                      "level": 3,
                      "children": {
                        "Tuyaux": {
                          "categoryId": null,
                          "categoryName": "Tuyaux",
                          "level": 6,
                          "children": {
                            "Tuyau flexible, échappement": {
                              "categoryId": 102875,
                              "categoryName": "Exhaust Pipes",
                              "level": 4,
                              "children": [],
                              "productId": 3971
                            }
                          }
                        }
                      },
                      "productId": 3971
                    }
                  }
                }
              },
              "productId": 3971
            }
          }
        },
        "Silencieux": {
          "categoryId": null,
          "categoryName": "Silencieux",
          "level": 2,
          "children": {
            "Tube de réparation, Silencieux central": {
              "categoryId": 100314,
              "categoryName": "Muffler",
              "level": 2,
              "children": [],
              "productId": 4667
            }
          }
        },
        "Tuyaux": {
          "categoryId": null,
          "categoryName": "Tuyaux",
          "level": 2,
          "children": {
            "Tube de réparation, catalyseur": {
              "categoryId": 100315,
              "categoryName": "Exhaust Pipes",
              "level": 2,
              "children": [],
              "productId": 3466
            },
            "Tuyau d'échappement": {
              "categoryId": 100315,
              "categoryName": "Exhaust Pipes",
              "level": 2,
              "children": [],
              "productId": 17
            },
            "Tuyau flexible, échappement": {
              "categoryId": 100315,
              "categoryName": "Exhaust Pipes",
              "level": 2,
              "children": [],
              "productId": 3971
            }
          }
        }
      }
    },
    "Refroidissement": {
      "categoryId": 100007,
      "categoryName": "Refroidissement",
      "level": 1,
      "children": {
        "Tuyauterie et brides": {
          "categoryId": null,
          "categoryName": "Tuyauterie et brides",
          "level": 2,
          "children": {
            "Raccord de tuyau, durite de radiateur": {
              "categoryId": 100099,
              "categoryName": "Hoses/Pipes/Flanges",
              "level": 2,
              "children": {
                "Durite de refroidissement/conduite": {
                  "categoryId": null,
                  "categoryName": "Durite de refroidissement/conduite",
                  "level": 4,
                  "children": {
                    "Raccord de tuyau, durite de radiateur": {
                      "categoryId": 100100,
                      "categoryName": "Radiator Hoses",
                      "level": 3,
                      "children": [],
                      "productId": 9589
                    }
                  }
                }
              },
              "productId": 9589
            }
          }
        }
      }
    }
  },
  "arborescenceText": "├── Alimentation carburant [ID: 100214] (Niveau 1)\n│   └── Tuyauterie (Niveau 2)\n│       └── Fuel Lines [ID: 100258] (Niveau 2) → ProductId: 612\n\n├── Carburation [ID: 100254] (Niveau 1)\n│   └── Mélange air-carburant (Niveau 2)\n│       └── Mixture Formation [ID: 102793] (Niveau 2) → ProductId: 5632\n│           └── Conduite de carburant / répartition du carburant (Niveau 4)\n│               └── Fuel Line/Distribution/Allocation [ID: 102804] (Niveau 3) → ProductId: 5632\n\n├── Dispositif de freinage [ID: 100006] (Niveau 1)\n│   └── Servofrein (Niveau 2)\n│       └── Brake Booster [ID: 100025] (Niveau 2) → ProductId: 1355\n\n├── Échappement [ID: 100004] (Niveau 1)\n│   ├── Catalyseur (Niveau 2)\n│   │   └── Catalytic Converter [ID: 100047] (Niveau 2) → ProductId: 3466\n│   ├── Filtre à particules (Niveau 2)\n│   │   └── Soot/Particulate Filter [ID: 100318] (Niveau 2) → ProductId: 4807\n│   ├── Injection d'urée (Niveau 2)\n│   │   └── Urea Injection [ID: 103019] (Niveau 2) → ProductId: 4853\n│   │       └── Flexibles/Conduites (Niveau 4)\n│   │           └── Radiator Hoses [ID: 103401] (Niveau 3) → ProductId: 4853\n│   ├── Pièces de montage (Niveau 2)\n│   │   ├── Assembly Parts [ID: 100222] (Niveau 2) → ProductId: 1050\n│   │   │   └── Pièces détachées de montage (Niveau 4)\n│   │   │       └── Individual Assembly Parts [ID: 100317] (Niveau 3) → ProductId: 1050\n│   │   │           ├── Collier (Niveau 6)\n│   │   │           │   └── Pipe Clamp [ID: 100323] (Niveau 4) → ProductId: 1050\n│   │   │           └── Gaine de soudure (Niveau 6)\n│   │   │               └── Welded Sleeve [ID: 100716] (Niveau 4) → ProductId: 1050\n│   │   └── Assembly Parts [ID: 100222] (Niveau 2) → ProductId: 3971\n│   │       └── Pièces détachées de montage (Niveau 4)\n│   │           └── Individual Assembly Parts [ID: 100317] (Niveau 3) → ProductId: 3971\n│   │               └── Tuyaux (Niveau 6)\n│   │                   └── Exhaust Pipes [ID: 102875] (Niveau 4) → ProductId: 3971\n│   ├── Silencieux (Niveau 2)\n│   │   └── Muffler [ID: 100314] (Niveau 2) → ProductId: 4667\n│   └── Tuyaux (Niveau 2)\n│       ├── Exhaust Pipes [ID: 100315] (Niveau 2) → ProductId: 3466\n│       ├── Exhaust Pipes [ID: 100315] (Niveau 2) → ProductId: 17\n│       └── Exhaust Pipes [ID: 100315] (Niveau 2) → ProductId: 3971\n\n└── Refroidissement [ID: 100007] (Niveau 1)\n    └── Tuyauterie et brides (Niveau 2)\n        └── Hoses/Pipes/Flanges [ID: 100099] (Niveau 2) → ProductId: 9589\n            └── Durite de refroidissement/conduite (Niveau 4)\n                └── Radiator Hoses [ID: 100100] (Niveau 3) → ProductId: 9589",
  "arborescencePaths": [
    {
      "path": [
        "Alimentation carburant",
        "Tuyauterie",
        "Fuel Lines"
      ],
      "categoryIds": [
        100214,
        null,
        100258
      ],
      "finalCategoryId": 100258,
      "productId": 612
    },
    {
      "path": [
        "Carburation",
        "Mélange air-carburant",
        "Mixture Formation"
      ],
      "categoryIds": [
        100254,
        null,
        102793
      ],
      "finalCategoryId": 102793,
      "productId": 5632
    },
    {
      "path": [
        "Dispositif de freinage",
        "Servofrein",
        "Brake Booster"
      ],
      "categoryIds": [
        100006,
        null,
        100025
      ],
      "finalCategoryId": 100025,
      "productId": 1355
    },
    {
      "path": [
        "Échappement",
        "Catalyseur",
        "Catalytic Converter"
      ],
      "categoryIds": [
        100004,
        null,
        100047
      ],
      "finalCategoryId": 100047,
      "productId": 3466
    },
    {
      "path": [
        "Échappement",
        "Filtre à particules",
        "Soot/Particulate Filter"
      ],
      "categoryIds": [
        100004,
        null,
        100318
      ],
      "finalCategoryId": 100318,
      "productId": 4807
    },
    {
      "path": [
        "Échappement",
        "Injection d'urée",
        "Urea Injection"
      ],
      "categoryIds": [
        100004,
        null,
        103019
      ],
      "finalCategoryId": 103019,
      "productId": 4853
    },
    {
      "path": [
        "Échappement",
        "Pièces de montage",
        "Assembly Parts"
      ],
      "categoryIds": [
        100004,
        null,
        100222
      ],
      "finalCategoryId": 100222,
      "productId": 1050
    },
    {
      "path": [
        "Échappement",
        "Pièces de montage",
        "Assembly Parts"
      ],
      "categoryIds": [
        100004,
        null,
        100222
      ],
      "finalCategoryId": 100222,
      "productId": 3971
    },
    {
      "path": [
        "Échappement",
        "Silencieux",
        "Muffler"
      ],
      "categoryIds": [
        100004,
        null,
        100314
      ],
      "finalCategoryId": 100314,
      "productId": 4667
    },
    {
      "path": [
        "Échappement",
        "Tuyaux",
        "Exhaust Pipes"
      ],
      "categoryIds": [
        100004,
        null,
        100315
      ],
      "finalCategoryId": 100315,
      "productId": 3466
    },
    {
      "path": [
        "Échappement",
        "Tuyaux",
        "Exhaust Pipes"
      ],
      "categoryIds": [
        100004,
        null,
        100315
      ],
      "finalCategoryId": 100315,
      "productId": 17
    },
    {
      "path": [
        "Échappement",
        "Tuyaux",
        "Exhaust Pipes"
      ],
      "categoryIds": [
        100004,
        null,
        100315
      ],
      "finalCategoryId": 100315,
      "productId": 3971
    },
    {
      "path": [
        "Refroidissement",
        "Tuyauterie et brides",
        "Hoses/Pipes/Flanges"
      ],
      "categoryIds": [
        100007,
        null,
        100099
      ],
      "finalCategoryId": 100099,
      "productId": 9589
    }
  ],
  "productIdsInArbo": [
    17,
    612,
    1050,
    1355,
    3466,
    3971,
    4667,
    4807,
    4853,
    5632,
    9589
  ],
  "matchedProductIds": [
    1355
  ]
}