{
  "productName": "Ressort pneumatique, porte",
  "searchText": "Ressort pneumatique, porte",
  "found": true,
  "hasMatch": true,
  "timestamp": "2025-12-03T07:08:53.244Z",
  "productId": 4469,
  "arborescence": {
    "Carrosserie": {
      "categoryId": 100001,
      "categoryName": "Carrosserie",
      "level": 1,
      "children": {
        "Habitacle": {
          "categoryId": null,
          "categoryName": "Habitacle",
          "level": 2,
          "children": {
            "Ressort pneumatique, porte": {
              "categoryId": 101690,
              "categoryName": "Passenger Cabin",
              "level": 2,
              "children": {
                "Composants/suppléments": {
                  "categoryId": null,
                  "categoryName": "Composants/suppléments",
                  "level": 4,
                  "children": {
                    "Ressort pneumatique, porte": {
                      "categoryId": 101700,
                      "categoryName": "Parts",
                      "level": 3,
                      "children": {
                        "Ressorts pneumatiques": {
                          "categoryId": null,
                          "categoryName": "Ressorts pneumatiques",
                          "level": 6,
                          "children": {
                            "Ressort pneumatique, porte": {
                              "categoryId": 101703,
                              "categoryName": "Gas Springs",
                              "level": 4,
                              "children": [],
                              "productId": 4469
                            }
                          }
                        }
                      },
                      "productId": 4469
                    }
                  }
                },
                "Portière avant/composants": {
                  "categoryId": null,
                  "categoryName": "Portière avant/composants",
                  "level": 4,
                  "children": {
                    "Ressort pneumatique, porte": {
                      "categoryId": 101694,
                      "categoryName": "Doors/Parts",
                      "level": 3,
                      "children": [],
                      "productId": 4469
                    }
                  }
                }
              },
              "productId": 4469
            }
          }
        },
        "Ressorts pneumatiques": {
          "categoryId": null,
          "categoryName": "Ressorts pneumatiques",
          "level": 2,
          "children": {
            "Ressort pneumatique, porte": {
              "categoryId": 100826,
              "categoryName": "Gas Springs",
              "level": 2,
              "children": [],
              "productId": 4469
            }
          }
        },
        "Trappes/capots/portes/toit coul./toit panoram./toit pliant": {
          "categoryId": null,
          "categoryName": "Trappes/capots/portes/toit coul./toit panoram./toit pliant",
          "level": 2,
          "children": {
            "Ressort pneumatique, porte": {
              "categoryId": 100746,
              "categoryName": "Hatches/Bonnets/Doors/Sunroof/Panoramic Roof",
              "level": 2,
              "children": {
                "Portière avant/composants": {
                  "categoryId": null,
                  "categoryName": "Portière avant/composants",
                  "level": 4,
                  "children": {
                    "Ressort pneumatique, porte": {
                      "categoryId": 100189,
                      "categoryName": "Doors/Parts",
                      "level": 3,
                      "children": [],
                      "productId": 4469
                    }
                  }
                }
              },
              "productId": 4469
            }
          }
        }
      }
    }
  },
  "arborescenceText": "└── Carrosserie [ID: 100001] (Niveau 1)\n    ├── Habitacle (Niveau 2)\n    │   └── Passenger Cabin [ID: 101690] (Niveau 2) → ProductId: 4469\n    │       ├── Composants/suppléments (Niveau 4)\n    │       │   └── Parts [ID: 101700] (Niveau 3) → ProductId: 4469\n    │       │       └── Ressorts pneumatiques (Niveau 6)\n    │       │           └── Gas Springs [ID: 101703] (Niveau 4) → ProductId: 4469\n    │       └── Portière avant/composants (Niveau 4)\n    │           └── Doors/Parts [ID: 101694] (Niveau 3) → ProductId: 4469\n    ├── Ressorts pneumatiques (Niveau 2)\n    │   └── Gas Springs [ID: 100826] (Niveau 2) → ProductId: 4469\n    └── Trappes/capots/portes/toit coul./toit panoram./toit pliant (Niveau 2)\n        └── Hatches/Bonnets/Doors/Sunroof/Panoramic Roof [ID: 100746] (Niveau 2) → ProductId: 4469\n            └── Portière avant/composants (Niveau 4)\n                └── Doors/Parts [ID: 100189] (Niveau 3) → ProductId: 4469",
  "arborescencePaths": [
    {
      "path": [
        "Carrosserie",
        "Habitacle",
        "Passenger Cabin"
      ],
      "categoryIds": [
        100001,
        null,
        101690
      ],
      "finalCategoryId": 101690,
      "productId": 4469
    },
    {
      "path": [
        "Carrosserie",
        "Ressorts pneumatiques",
        "Gas Springs"
      ],
      "categoryIds": [
        100001,
        null,
        100826
      ],
      "finalCategoryId": 100826,
      "productId": 4469
    },
    {
      "path": [
        "Carrosserie",
        "Trappes/capots/portes/toit coul./toit panoram./toit pliant",
        "Hatches/Bonnets/Doors/Sunroof/Panoramic Roof"
      ],
      "categoryIds": [
        100001,
        null,
        100746
      ],
      "finalCategoryId": 100746,
      "productId": 4469
    }
  ],
  "productIdsInArbo": [
    4469
  ],
  "matchedProductIds": [
    4469
  ]
}