{
  "productName": "Revêtement avant",
  "searchText": "Revêtement avant",
  "found": true,
  "hasMatch": true,
  "timestamp": "2025-12-03T07:09:34.120Z",
  "productId": 208,
  "arborescence": {
    "Carrosserie": {
      "categoryId": 100001,
      "categoryName": "Carrosserie",
      "level": 1,
      "children": {
        "Avant du véhicule": {
          "categoryId": null,
          "categoryName": "Avant du véhicule",
          "level": 2,
          "children": {
            "Baguette et bande protectrice, revêtement avant": {
              "categoryId": 101648,
              "categoryName": "Vehicle Front",
              "level": 2,
              "children": {
                "Composants/suppléments": {
                  "categoryId": null,
                  "categoryName": "Composants/suppléments",
                  "level": 4,
                  "children": {
                    "Baguette et bande protectrice, revêtement avant": {
                      "categoryId": 101673,
                      "categoryName": "Parts",
                      "level": 3,
                      "children": {
                        "Enjoliveur/bande protectrice": {
                          "categoryId": null,
                          "categoryName": "Enjoliveur/bande protectrice",
                          "level": 6,
                          "children": {
                            "Baguette et bande protectrice, revêtement avant": {
                              "categoryId": 101679,
                              "categoryName": "Trim/Protection Strips",
                              "level": 4,
                              "children": [],
                              "productId": 1006
                            }
                          }
                        }
                      },
                      "productId": 1006
                    }
                  }
                }
              },
              "productId": 1006
            },
            "Kit de montage, revêtement avant": {
              "categoryId": 101648,
              "categoryName": "Vehicle Front",
              "level": 2,
              "children": {
                "Composants/suppléments": {
                  "categoryId": null,
                  "categoryName": "Composants/suppléments",
                  "level": 4,
                  "children": {
                    "Kit de montage, revêtement avant": {
                      "categoryId": 101673,
                      "categoryName": "Parts",
                      "level": 3,
                      "children": {
                        "Recouvrement/radiateur": {
                          "categoryId": null,
                          "categoryName": "Recouvrement/radiateur",
                          "level": 6,
                          "children": {
                            "Kit de montage, revêtement avant": {
                              "categoryId": 101675,
                              "categoryName": "Front Fairing/ Grille",
                              "level": 4,
                              "children": [],
                              "productId": 3715
                            }
                          }
                        }
                      },
                      "productId": 3715
                    }
                  }
                }
              },
              "productId": 3715
            },
            "Revêtement avant": {
              "categoryId": 101648,
              "categoryName": "Vehicle Front",
              "level": 2,
              "children": {
                "Composants/suppléments": {
                  "categoryId": null,
                  "categoryName": "Composants/suppléments",
                  "level": 4,
                  "children": {
                    "Revêtement avant": {
                      "categoryId": 101673,
                      "categoryName": "Parts",
                      "level": 3,
                      "children": {
                        "Recouvrement/radiateur": {
                          "categoryId": null,
                          "categoryName": "Recouvrement/radiateur",
                          "level": 6,
                          "children": {
                            "Revêtement avant": {
                              "categoryId": 101675,
                              "categoryName": "Front Fairing/ Grille",
                              "level": 4,
                              "children": [],
                              "productId": 208
                            }
                          }
                        }
                      },
                      "productId": 208
                    }
                  }
                }
              },
              "productId": 208
            }
          }
        },
        "Grilles décoratives, logos, anti-éclaboussures": {
          "categoryId": null,
          "categoryName": "Grilles décoratives, logos, anti-éclaboussures",
          "level": 2,
          "children": {
            "Baguette et bande protectrice, revêtement avant": {
              "categoryId": 100219,
              "categoryName": "Trim/Protection/Decorative Strips/Emblems",
              "level": 2,
              "children": {
                "Enjoliveur/bande protectrice": {
                  "categoryId": null,
                  "categoryName": "Enjoliveur/bande protectrice",
                  "level": 4,
                  "children": {
                    "Baguette et bande protectrice, revêtement avant": {
                      "categoryId": 100740,
                      "categoryName": "Trim/Protection Strips",
                      "level": 3,
                      "children": [],
                      "productId": 1006
                    }
                  }
                }
              },
              "productId": 1006
            }
          }
        },
        "Outils": {
          "categoryId": null,
          "categoryName": "Outils",
          "level": 2,
          "children": {
            "Dispositif de montage, revêtement avant": {
              "categoryId": 103132,
              "categoryName": "Tools",
              "level": 2,
              "children": [],
              "productId": 4450
            }
          }
        },
        "Pièces de carrosserie/ailes/pares-chocs": {
          "categoryId": null,
          "categoryName": "Pièces de carrosserie/ailes/pares-chocs",
          "level": 2,
          "children": {
            "Revêtement avant": {
              "categoryId": 100743,
              "categoryName": "Body Parts/Wing/Bumper",
              "level": 2,
              "children": {
                "Revêtement / grille avant": {
                  "categoryId": null,
                  "categoryName": "Revêtement / grille avant",
                  "level": 4,
                  "children": {
                    "Revêtement avant": {
                      "categoryId": 100191,
                      "categoryName": "Radiator Support/Grille",
                      "level": 3,
                      "children": [],
                      "productId": 208
                    }
                  }
                }
              },
              "productId": 208
            }
          }
        }
      }
    },
    "Outils spéciaux": {
      "categoryId": 706365,
      "categoryName": "Outils spéciaux",
      "level": 1,
      "children": {
        "Outils spéciaux carrosserie": {
          "categoryId": null,
          "categoryName": "Outils spéciaux carrosserie",
          "level": 2,
          "children": {
            "Dispositif de montage, revêtement avant": {
              "categoryId": 706366,
              "categoryName": "Body Special Tools",
              "level": 2,
              "children": {
                "Recouvrement": {
                  "categoryId": null,
                  "categoryName": "Recouvrement",
                  "level": 4,
                  "children": {
                    "Dispositif de montage, revêtement avant": {
                      "categoryId": 706368,
                      "categoryName": "Panelling",
                      "level": 3,
                      "children": [],
                      "productId": 4450
                    }
                  }
                }
              },
              "productId": 4450
            }
          }
        }
      }
    }
  },
  "arborescenceText": "├── Carrosserie [ID: 100001] (Niveau 1)\n│   ├── Avant du véhicule (Niveau 2)\n│   │   ├── Vehicle Front [ID: 101648] (Niveau 2) → ProductId: 1006\n│   │   │   └── Composants/suppléments (Niveau 4)\n│   │   │       └── Parts [ID: 101673] (Niveau 3) → ProductId: 1006\n│   │   │           └── Enjoliveur/bande protectrice (Niveau 6)\n│   │   │               └── Trim/Protection Strips [ID: 101679] (Niveau 4) → ProductId: 1006\n│   │   ├── Vehicle Front [ID: 101648] (Niveau 2) → ProductId: 3715\n│   │   │   └── Composants/suppléments (Niveau 4)\n│   │   │       └── Parts [ID: 101673] (Niveau 3) → ProductId: 3715\n│   │   │           └── Recouvrement/radiateur (Niveau 6)\n│   │   │               └── Front Fairing/ Grille [ID: 101675] (Niveau 4) → ProductId: 3715\n│   │   └── Vehicle Front [ID: 101648] (Niveau 2) → ProductId: 208\n│   │       └── Composants/suppléments (Niveau 4)\n│   │           └── Parts [ID: 101673] (Niveau 3) → ProductId: 208\n│   │               └── Recouvrement/radiateur (Niveau 6)\n│   │                   └── Front Fairing/ Grille [ID: 101675] (Niveau 4) → ProductId: 208\n│   ├── Grilles décoratives, logos, anti-éclaboussures (Niveau 2)\n│   │   └── Trim/Protection/Decorative Strips/Emblems [ID: 100219] (Niveau 2) → ProductId: 1006\n│   │       └── Enjoliveur/bande protectrice (Niveau 4)\n│   │           └── Trim/Protection Strips [ID: 100740] (Niveau 3) → ProductId: 1006\n│   ├── Outils (Niveau 2)\n│   │   └── Tools [ID: 103132] (Niveau 2) → ProductId: 4450\n│   └── Pièces de carrosserie/ailes/pares-chocs (Niveau 2)\n│       └── Body Parts/Wing/Bumper [ID: 100743] (Niveau 2) → ProductId: 208\n│           └── Revêtement / grille avant (Niveau 4)\n│               └── Radiator Support/Grille [ID: 100191] (Niveau 3) → ProductId: 208\n\n└── Outils spéciaux [ID: 706365] (Niveau 1)\n    └── Outils spéciaux carrosserie (Niveau 2)\n        └── Body Special Tools [ID: 706366] (Niveau 2) → ProductId: 4450\n            └── Recouvrement (Niveau 4)\n                └── Panelling [ID: 706368] (Niveau 3) → ProductId: 4450",
  "arborescencePaths": [
    {
      "path": [
        "Carrosserie",
        "Avant du véhicule",
        "Vehicle Front"
      ],
      "categoryIds": [
        100001,
        null,
        101648
      ],
      "finalCategoryId": 101648,
      "productId": 1006
    },
    {
      "path": [
        "Carrosserie",
        "Avant du véhicule",
        "Vehicle Front"
      ],
      "categoryIds": [
        100001,
        null,
        101648
      ],
      "finalCategoryId": 101648,
      "productId": 3715
    },
    {
      "path": [
        "Carrosserie",
        "Avant du véhicule",
        "Vehicle Front"
      ],
      "categoryIds": [
        100001,
        null,
        101648
      ],
      "finalCategoryId": 101648,
      "productId": 208
    },
    {
      "path": [
        "Carrosserie",
        "Grilles décoratives, logos, anti-éclaboussures",
        "Trim/Protection/Decorative Strips/Emblems"
      ],
      "categoryIds": [
        100001,
        null,
        100219
      ],
      "finalCategoryId": 100219,
      "productId": 1006
    },
    {
      "path": [
        "Carrosserie",
        "Outils",
        "Tools"
      ],
      "categoryIds": [
        100001,
        null,
        103132
      ],
      "finalCategoryId": 103132,
      "productId": 4450
    },
    {
      "path": [
        "Carrosserie",
        "Pièces de carrosserie/ailes/pares-chocs",
        "Body Parts/Wing/Bumper"
      ],
      "categoryIds": [
        100001,
        null,
        100743
      ],
      "finalCategoryId": 100743,
      "productId": 208
    },
    {
      "path": [
        "Outils spéciaux",
        "Outils spéciaux carrosserie",
        "Body Special Tools"
      ],
      "categoryIds": [
        706365,
        null,
        706366
      ],
      "finalCategoryId": 706366,
      "productId": 4450
    }
  ],
  "productIdsInArbo": [
    208,
    1006,
    3715,
    4450
  ],
  "matchedProductIds": [
    208
  ]
}