{
  "productName": "Rondelle de compensation, jeu des soupapes",
  "searchText": "Rondelle de compensation, jeu des soupapes",
  "found": true,
  "hasMatch": true,
  "timestamp": "2025-12-03T07:11:00.000Z",
  "productId": 1521,
  "arborescence": {
    "Moteur": {
      "categoryId": 100002,
      "categoryName": "Moteur",
      "level": 1,
      "children": {
        "Culasse / pieces de montage": {
          "categoryId": null,
          "categoryName": "Culasse / pieces de montage",
          "level": 2,
          "children": {
            "Rondelle de compensation, jeu des soupapes": {
              "categoryId": 100373,
              "categoryName": "Cylinder Head/Attachment Parts",
              "level": 2,
              "children": {
                "Guide de soupape / joint / réglage": {
                  "categoryId": null,
                  "categoryName": "Guide de soupape / joint / réglage",
                  "level": 4,
                  "children": {
                    "Rondelle de compensation, jeu des soupapes": {
                      "categoryId": 100377,
                      "categoryName": "Valve Guide/Stem Seal/Parts",
                      "level": 3,
                      "children": [],
                      "productId": 1521
                    }
                  }
                }
              },
              "productId": 1521
            }
          }
        },
        "Distribution moteur": {
          "categoryId": null,
          "categoryName": "Distribution moteur",
          "level": 2,
          "children": {
            "Rondelle de compensation, jeu des soupapes": {
              "categoryId": 100003,
              "categoryName": "Engine Timing",
              "level": 2,
              "children": {
                "Soupape / réglage de soupape": {
                  "categoryId": null,
                  "categoryName": "Soupape / réglage de soupape",
                  "level": 4,
                  "children": {
                    "Rondelle de compensation, jeu des soupapes": {
                      "categoryId": 100422,
                      "categoryName": "Valve Train",
                      "level": 3,
                      "children": {
                        "Réglage de soupape": {
                          "categoryId": null,
                          "categoryName": "Réglage de soupape",
                          "level": 6,
                          "children": {
                            "Rondelle de compensation, jeu des soupapes": {
                              "categoryId": 100424,
                              "categoryName": "Valve Actuation",
                              "level": 4,
                              "children": [],
                              "productId": 1521
                            }
                          }
                        }
                      },
                      "productId": 1521
                    }
                  }
                }
              },
              "productId": 1521
            }
          }
        }
      }
    }
  },
  "arborescenceText": "└── Moteur [ID: 100002] (Niveau 1)\n    ├── Culasse / pieces de montage (Niveau 2)\n    │   └── Cylinder Head/Attachment Parts [ID: 100373] (Niveau 2) → ProductId: 1521\n    │       └── Guide de soupape / joint / réglage (Niveau 4)\n    │           └── Valve Guide/Stem Seal/Parts [ID: 100377] (Niveau 3) → ProductId: 1521\n    └── Distribution moteur (Niveau 2)\n        └── Engine Timing [ID: 100003] (Niveau 2) → ProductId: 1521\n            └── Soupape / réglage de soupape (Niveau 4)\n                └── Valve Train [ID: 100422] (Niveau 3) → ProductId: 1521\n                    └── Réglage de soupape (Niveau 6)\n                        └── Valve Actuation [ID: 100424] (Niveau 4) → ProductId: 1521",
  "arborescencePaths": [
    {
      "path": [
        "Moteur",
        "Culasse / pieces de montage",
        "Cylinder Head/Attachment Parts"
      ],
      "categoryIds": [
        100002,
        null,
        100373
      ],
      "finalCategoryId": 100373,
      "productId": 1521
    },
    {
      "path": [
        "Moteur",
        "Distribution moteur",
        "Engine Timing"
      ],
      "categoryIds": [
        100002,
        null,
        100003
      ],
      "finalCategoryId": 100003,
      "productId": 1521
    }
  ],
  "productIdsInArbo": [
    1521
  ],
  "matchedProductIds": [
    1521
  ]
}