{
  "productName": "Réflecteur",
  "searchText": "Réflecteur",
  "found": true,
  "hasMatch": false,
  "timestamp": "2025-12-03T07:13:20.573Z",
  "productId": 1478,
  "arborescence": {
    "Carrosserie": {
      "categoryId": 100001,
      "categoryName": "Carrosserie",
      "level": 1,
      "children": {
        "Arrière de la voiture": {
          "categoryId": null,
          "categoryName": "Arrière de la voiture",
          "level": 2,
          "children": {
            "Réflecteur, feu clignotant": {
              "categoryId": 101705,
              "categoryName": "Vehicle Rear",
              "level": 2,
              "children": {
                "Feu clignotant/composants": {
                  "categoryId": null,
                  "categoryName": "Feu clignotant/composants",
                  "level": 4,
                  "children": {
                    "Réflecteur, feu clignotant": {
                      "categoryId": 101727,
                      "categoryName": "Direction Indicator/Parts",
                      "level": 3,
                      "children": {
                        "Composants de feu clignotant": {
                          "categoryId": null,
                          "categoryName": "Composants de feu clignotant",
                          "level": 6,
                          "children": {
                            "Réflecteur, feu clignotant": {
                              "categoryId": 101729,
                              "categoryName": "Indicator Parts",
                              "level": 4,
                              "children": [],
                              "productId": 2179
                            }
                          }
                        }
                      },
                      "productId": 2179
                    }
                  }
                }
              },
              "productId": 2179
            },
            "Réflecteur, feu de position/d'encombrement": {
              "categoryId": 101705,
              "categoryName": "Vehicle Rear",
              "level": 2,
              "children": {
                "Feu de position / d'encombrement / composants": {
                  "categoryId": null,
                  "categoryName": "Feu de position / d'encombrement / composants",
                  "level": 4,
                  "children": {
                    "Réflecteur, feu de position/d'encombrement": {
                      "categoryId": 101785,
                      "categoryName": "Side Marker/End Outline Marker Light/Parts",
                      "level": 3,
                      "children": {
                        "Feu d'encombrement": {
                          "categoryId": null,
                          "categoryName": "Feu d'encombrement",
                          "level": 6,
                          "children": {
                            "Réflecteur, feu de position/d'encombrement": {
                              "categoryId": 101787,
                              "categoryName": "End Outline Marker Light",
                              "level": 4,
                              "children": [],
                              "productId": 2180
                            }
                          }
                        }
                      },
                      "productId": 2180
                    }
                  }
                }
              },
              "productId": 2180
            }
          }
        },
        "Avant du véhicule": {
          "categoryId": null,
          "categoryName": "Avant du véhicule",
          "level": 2,
          "children": {
            "Réflecteur, feu clignotant": {
              "categoryId": 101648,
              "categoryName": "Vehicle Front",
              "level": 2,
              "children": {
                "Feu clignotant/composants": {
                  "categoryId": null,
                  "categoryName": "Feu clignotant/composants",
                  "level": 4,
                  "children": {
                    "Réflecteur, feu clignotant": {
                      "categoryId": 101669,
                      "categoryName": "Direction Indicator/Parts",
                      "level": 3,
                      "children": {
                        "Composants de feu clignotant": {
                          "categoryId": null,
                          "categoryName": "Composants de feu clignotant",
                          "level": 6,
                          "children": {
                            "Réflecteur, feu clignotant": {
                              "categoryId": 101671,
                              "categoryName": "Indicator Parts",
                              "level": 4,
                              "children": [],
                              "productId": 2179
                            }
                          }
                        }
                      },
                      "productId": 2179
                    }
                  }
                }
              },
              "productId": 2179
            },
            "Réflecteur, feu de position/d'encombrement": {
              "categoryId": 101648,
              "categoryName": "Vehicle Front",
              "level": 2,
              "children": {
                "Feu de position / d'encombrement / composants": {
                  "categoryId": null,
                  "categoryName": "Feu de position / d'encombrement / composants",
                  "level": 4,
                  "children": {
                    "Réflecteur, feu de position/d'encombrement": {
                      "categoryId": 101766,
                      "categoryName": "Side Marker/End Outline Marker Light/Parts",
                      "level": 3,
                      "children": {
                        "Feu d'encombrement": {
                          "categoryId": null,
                          "categoryName": "Feu d'encombrement",
                          "level": 6,
                          "children": {
                            "Réflecteur, feu de position/d'encombrement": {
                              "categoryId": 101768,
                              "categoryName": "End Outline Marker Light",
                              "level": 4,
                              "children": [],
                              "productId": 2180
                            }
                          }
                        }
                      },
                      "productId": 2180
                    }
                  }
                }
              },
              "productId": 2180
            },
            "Réflecteur, projecteur antibrouillard": {
              "categoryId": 101648,
              "categoryName": "Vehicle Front",
              "level": 2,
              "children": {
                "Projecteur antibrouillard/ composants": {
                  "categoryId": null,
                  "categoryName": "Projecteur antibrouillard/ composants",
                  "level": 4,
                  "children": {
                    "Réflecteur, projecteur antibrouillard": {
                      "categoryId": 101661,
                      "categoryName": "Front Fog Light/Parts",
                      "level": 3,
                      "children": {
                        "Composants pour projecteur antibrouillard": {
                          "categoryId": null,
                          "categoryName": "Composants pour projecteur antibrouillard",
                          "level": 6,
                          "children": {
                            "Réflecteur, projecteur antibrouillard": {
                              "categoryId": 101664,
                              "categoryName": "Fog Light Parts",
                              "level": 4,
                              "children": [],
                              "productId": 710
                            }
                          }
                        }
                      },
                      "productId": 710
                    }
                  }
                }
              },
              "productId": 710
            },
            "Réflecteur, projecteur longue portée": {
              "categoryId": 101648,
              "categoryName": "Vehicle Front",
              "level": 2,
              "children": {
                "Projecteur longue portée / composants": {
                  "categoryId": null,
                  "categoryName": "Projecteur longue portée / composants",
                  "level": 4,
                  "children": {
                    "Réflecteur, projecteur longue portée": {
                      "categoryId": 101665,
                      "categoryName": "Spotlight/Parts",
                      "level": 3,
                      "children": {
                        "Projecteur longue portée / composants": {
                          "categoryId": null,
                          "categoryName": "Projecteur longue portée / composants",
                          "level": 6,
                          "children": {
                            "Réflecteur, projecteur longue portée": {
                              "categoryId": 101668,
                              "categoryName": "Spotlight Parts",
                              "level": 4,
                              "children": [],
                              "productId": 713
                            }
                          }
                        }
                      },
                      "productId": 713
                    }
                  }
                }
              },
              "productId": 713
            },
            "Réflecteur, projecteur principal": {
              "categoryId": 101648,
              "categoryName": "Vehicle Front",
              "level": 2,
              "children": {
                "Projecteurs principaux / composants": {
                  "categoryId": null,
                  "categoryName": "Projecteurs principaux / composants",
                  "level": 4,
                  "children": {
                    "Réflecteur, projecteur principal": {
                      "categoryId": 101656,
                      "categoryName": "Headlight/Parts",
                      "level": 3,
                      "children": {
                        "Composants des projecteurs principaux": {
                          "categoryId": null,
                          "categoryName": "Composants des projecteurs principaux",
                          "level": 6,
                          "children": {
                            "Réflecteur, projecteur principal": {
                              "categoryId": 101659,
                              "categoryName": "Headlight Parts",
                              "level": 4,
                              "children": [],
                              "productId": 702
                            }
                          }
                        }
                      },
                      "productId": 702
                    }
                  }
                }
              },
              "productId": 702
            }
          }
        },
        "Feux": {
          "categoryId": null,
          "categoryName": "Feux",
          "level": 2,
          "children": {
            "Réflecteur, feu clignotant": {
              "categoryId": 101407,
              "categoryName": "Lights",
              "level": 2,
              "children": {
                "Feu clignotant/composants": {
                  "categoryId": null,
                  "categoryName": "Feu clignotant/composants",
                  "level": 4,
                  "children": {
                    "Réflecteur, feu clignotant": {
                      "categoryId": 101420,
                      "categoryName": "Direction Indicator/Parts",
                      "level": 3,
                      "children": {
                        "Composants de feu clignotant": {
                          "categoryId": null,
                          "categoryName": "Composants de feu clignotant",
                          "level": 6,
                          "children": {
                            "Réflecteur, feu clignotant": {
                              "categoryId": 101422,
                              "categoryName": "Indicator Parts",
                              "level": 4,
                              "children": [],
                              "productId": 2179
                            }
                          }
                        }
                      },
                      "productId": 2179
                    }
                  }
                }
              },
              "productId": 2179
            },
            "Réflecteur, feu de position/d'encombrement": {
              "categoryId": 101407,
              "categoryName": "Lights",
              "level": 2,
              "children": {
                "Feu de position / d'encombrement / composants": {
                  "categoryId": null,
                  "categoryName": "Feu de position / d'encombrement / composants",
                  "level": 4,
                  "children": {
                    "Réflecteur, feu de position/d'encombrement": {
                      "categoryId": 101441,
                      "categoryName": "Side Marker/End Outline Marker Light/Parts",
                      "level": 3,
                      "children": {
                        "Feu d'encombrement": {
                          "categoryId": null,
                          "categoryName": "Feu d'encombrement",
                          "level": 6,
                          "children": {
                            "Réflecteur, feu de position/d'encombrement": {
                              "categoryId": 101443,
                              "categoryName": "End Outline Marker Light",
                              "level": 4,
                              "children": [],
                              "productId": 2180
                            }
                          }
                        }
                      },
                      "productId": 2180
                    }
                  }
                }
              },
              "productId": 2180
            }
          }
        },
        "Phares supplémentaires/composants": {
          "categoryId": null,
          "categoryName": "Phares supplémentaires/composants",
          "level": 2,
          "children": {
            "Réflecteur, phare chercheur": {
              "categoryId": 101340,
              "categoryName": "Additional Headlight/Parts",
              "level": 2,
              "children": {
                "Phare chercheur / composants": {
                  "categoryId": null,
                  "categoryName": "Phare chercheur / composants",
                  "level": 4,
                  "children": {
                    "Réflecteur, phare chercheur": {
                      "categoryId": 101353,
                      "categoryName": "Searchlight/Parts",
                      "level": 3,
                      "children": {
                        "Composants phare chercheur": {
                          "categoryId": null,
                          "categoryName": "Composants phare chercheur",
                          "level": 6,
                          "children": {
                            "Réflecteur, phare chercheur": {
                              "categoryId": 101356,
                              "categoryName": "Searchlight Parts",
                              "level": 4,
                              "children": [],
                              "productId": 718
                            }
                          }
                        }
                      },
                      "productId": 718
                    }
                  }
                }
              },
              "productId": 718
            },
            "Réflecteur, projecteur antibrouillard": {
              "categoryId": 101340,
              "categoryName": "Additional Headlight/Parts",
              "level": 2,
              "children": {
                "Projecteur antibrouillard/ composants": {
                  "categoryId": null,
                  "categoryName": "Projecteur antibrouillard/ composants",
                  "level": 4,
                  "children": {
                    "Réflecteur, projecteur antibrouillard": {
                      "categoryId": 101341,
                      "categoryName": "Front Fog Light/Parts",
                      "level": 3,
                      "children": {
                        "Composants pour projecteur antibrouillard": {
                          "categoryId": null,
                          "categoryName": "Composants pour projecteur antibrouillard",
                          "level": 6,
                          "children": {
                            "Réflecteur, projecteur antibrouillard": {
                              "categoryId": 101344,
                              "categoryName": "Fog Light Parts",
                              "level": 4,
                              "children": [],
                              "productId": 710
                            }
                          }
                        }
                      },
                      "productId": 710
                    }
                  }
                }
              },
              "productId": 710
            },
            "Réflecteur, projecteur de travail": {
              "categoryId": 101340,
              "categoryName": "Additional Headlight/Parts",
              "level": 2,
              "children": {
                "Projecteur de travail, composants": {
                  "categoryId": null,
                  "categoryName": "Projecteur de travail, composants",
                  "level": 4,
                  "children": {
                    "Réflecteur, projecteur de travail": {
                      "categoryId": 101349,
                      "categoryName": "Worklight/Parts",
                      "level": 3,
                      "children": {
                        "Projecteur de travail, composants": {
                          "categoryId": null,
                          "categoryName": "Projecteur de travail, composants",
                          "level": 6,
                          "children": {
                            "Réflecteur, projecteur de travail": {
                              "categoryId": 101352,
                              "categoryName": "Worklight Parts",
                              "level": 4,
                              "children": [],
                              "productId": 725
                            }
                          }
                        }
                      },
                      "productId": 725
                    }
                  }
                }
              },
              "productId": 725
            },
            "Réflecteur, projecteur longue portée": {
              "categoryId": 101340,
              "categoryName": "Additional Headlight/Parts",
              "level": 2,
              "children": {
                "Projecteur longue portée / composants": {
                  "categoryId": null,
                  "categoryName": "Projecteur longue portée / composants",
                  "level": 4,
                  "children": {
                    "Réflecteur, projecteur longue portée": {
                      "categoryId": 101345,
                      "categoryName": "Spotlight/Parts",
                      "level": 3,
                      "children": {
                        "Projecteur longue portée / composants": {
                          "categoryId": null,
                          "categoryName": "Projecteur longue portée / composants",
                          "level": 6,
                          "children": {
                            "Réflecteur, projecteur longue portée": {
                              "categoryId": 101348,
                              "categoryName": "Spotlight Parts",
                              "level": 4,
                              "children": [],
                              "productId": 713
                            }
                          }
                        }
                      },
                      "productId": 713
                    }
                  }
                }
              },
              "productId": 713
            }
          }
        },
        "Projecteurs principaux / composants": {
          "categoryId": null,
          "categoryName": "Projecteurs principaux / composants",
          "level": 2,
          "children": {
            "Réflecteur, projecteur principal": {
              "categoryId": 101465,
              "categoryName": "Headlight/Parts",
              "level": 2,
              "children": {
                "Composants des projecteurs principaux": {
                  "categoryId": null,
                  "categoryName": "Composants des projecteurs principaux",
                  "level": 4,
                  "children": {
                    "Réflecteur, projecteur principal": {
                      "categoryId": 101468,
                      "categoryName": "Headlight Parts",
                      "level": 3,
                      "children": [],
                      "productId": 702
                    }
                  }
                }
              },
              "productId": 702
            }
          }
        }
      }
    },
    "Système électrique": {
      "categoryId": 100010,
      "categoryName": "Système électrique",
      "level": 1,
      "children": {
        "Cataphote arrière/Réflecteur latéral": {
          "categoryId": null,
          "categoryName": "Cataphote arrière/Réflecteur latéral",
          "level": 2,
          "children": {
            "Catadioptre": {
              "categoryId": 100295,
              "categoryName": "Reflectors/Side Reflectors",
              "level": 2,
              "children": [],
              "productId": 1093
            },
            "Support, catadioptre": {
              "categoryId": 100295,
              "categoryName": "Reflectors/Side Reflectors",
              "level": 2,
              "children": [],
              "productId": 2480
            }
          }
        },
        "Feux": {
          "categoryId": null,
          "categoryName": "Feux",
          "level": 2,
          "children": {
            "Réflecteur, feu clignotant": {
              "categoryId": 100043,
              "categoryName": "Lights",
              "level": 2,
              "children": {
                "Feu clignotant/composants": {
                  "categoryId": null,
                  "categoryName": "Feu clignotant/composants",
                  "level": 4,
                  "children": {
                    "Réflecteur, feu clignotant": {
                      "categoryId": 100145,
                      "categoryName": "Direction Indicator/Parts",
                      "level": 3,
                      "children": {
                        "Composants de feu clignotant": {
                          "categoryId": null,
                          "categoryName": "Composants de feu clignotant",
                          "level": 6,
                          "children": {
                            "Réflecteur, feu clignotant": {
                              "categoryId": 100480,
                              "categoryName": "Indicator Parts",
                              "level": 4,
                              "children": [],
                              "productId": 2179
                            }
                          }
                        }
                      },
                      "productId": 2179
                    }
                  }
                }
              },
              "productId": 2179
            },
            "Réflecteur, feu de position/d'encombrement": {
              "categoryId": 100043,
              "categoryName": "Lights",
              "level": 2,
              "children": {
                "Feu de position / d'encombrement / composants": {
                  "categoryId": null,
                  "categoryName": "Feu de position / d'encombrement / composants",
                  "level": 4,
                  "children": {
                    "Réflecteur, feu de position/d'encombrement": {
                      "categoryId": 100290,
                      "categoryName": "Side Marker/End Outline Marker Light/Parts",
                      "level": 3,
                      "children": {
                        "Feu d'encombrement": {
                          "categoryId": null,
                          "categoryName": "Feu d'encombrement",
                          "level": 6,
                          "children": {
                            "Réflecteur, feu de position/d'encombrement": {
                              "categoryId": 100469,
                              "categoryName": "End Outline Marker Light",
                              "level": 4,
                              "children": [],
                              "productId": 2180
                            }
                          }
                        }
                      },
                      "productId": 2180
                    }
                  }
                }
              },
              "productId": 2180
            },
            "Réflecteur, gyrophare": {
              "categoryId": 100043,
              "categoryName": "Lights",
              "level": 2,
              "children": {
                "Gyrophare / composants": {
                  "categoryId": null,
                  "categoryName": "Gyrophare / composants",
                  "level": 4,
                  "children": {
                    "Réflecteur, gyrophare": {
                      "categoryId": 100289,
                      "categoryName": "Rotating Beacon/Parts",
                      "level": 3,
                      "children": {
                        "Composants du gyrophare": {
                          "categoryId": null,
                          "categoryName": "Composants du gyrophare",
                          "level": 6,
                          "children": {
                            "Réflecteur, gyrophare": {
                              "categoryId": 100487,
                              "categoryName": "Rotating Beacon Parts",
                              "level": 4,
                              "children": [],
                              "productId": 1170
                            }
                          }
                        }
                      },
                      "productId": 1170
                    }
                  }
                }
              },
              "productId": 1170
            }
          }
        },
        "Phares supplémentaires/composants": {
          "categoryId": null,
          "categoryName": "Phares supplémentaires/composants",
          "level": 2,
          "children": {
            "Réflecteur, phare chercheur": {
              "categoryId": 100787,
              "categoryName": "Additional Headlight/Parts",
              "level": 2,
              "children": {
                "Phare chercheur / composants": {
                  "categoryId": null,
                  "categoryName": "Phare chercheur / composants",
                  "level": 4,
                  "children": {
                    "Réflecteur, phare chercheur": {
                      "categoryId": 100281,
                      "categoryName": "Searchlight/Parts",
                      "level": 3,
                      "children": {
                        "Composants phare chercheur": {
                          "categoryId": null,
                          "categoryName": "Composants phare chercheur",
                          "level": 6,
                          "children": {
                            "Réflecteur, phare chercheur": {
                              "categoryId": 100446,
                              "categoryName": "Searchlight Parts",
                              "level": 4,
                              "children": [],
                              "productId": 718
                            }
                          }
                        }
                      },
                      "productId": 718
                    }
                  }
                }
              },
              "productId": 718
            },
            "Réflecteur, projecteur antibrouillard": {
              "categoryId": 100787,
              "categoryName": "Additional Headlight/Parts",
              "level": 2,
              "children": {
                "Projecteur antibrouillard/ composants": {
                  "categoryId": null,
                  "categoryName": "Projecteur antibrouillard/ composants",
                  "level": 4,
                  "children": {
                    "Réflecteur, projecteur antibrouillard": {
                      "categoryId": 100277,
                      "categoryName": "Front Fog Light/Parts",
                      "level": 3,
                      "children": {
                        "Composants pour projecteur antibrouillard": {
                          "categoryId": null,
                          "categoryName": "Composants pour projecteur antibrouillard",
                          "level": 6,
                          "children": {
                            "Réflecteur, projecteur antibrouillard": {
                              "categoryId": 100444,
                              "categoryName": "Fog Light Parts",
                              "level": 4,
                              "children": [],
                              "productId": 710
                            }
                          }
                        }
                      },
                      "productId": 710
                    }
                  }
                }
              },
              "productId": 710
            },
            "Réflecteur, projecteur de travail": {
              "categoryId": 100787,
              "categoryName": "Additional Headlight/Parts",
              "level": 2,
              "children": {
                "Projecteur de travail, composants": {
                  "categoryId": null,
                  "categoryName": "Projecteur de travail, composants",
                  "level": 4,
                  "children": {
                    "Réflecteur, projecteur de travail": {
                      "categoryId": 100280,
                      "categoryName": "Worklight/Parts",
                      "level": 3,
                      "children": {
                        "Projecteur de travail, composants": {
                          "categoryId": null,
                          "categoryName": "Projecteur de travail, composants",
                          "level": 6,
                          "children": {
                            "Réflecteur, projecteur de travail": {
                              "categoryId": 100445,
                              "categoryName": "Worklight Parts",
                              "level": 4,
                              "children": [],
                              "productId": 725
                            }
                          }
                        }
                      },
                      "productId": 725
                    }
                  }
                }
              },
              "productId": 725
            },
            "Réflecteur, projecteur longue portée": {
              "categoryId": 100787,
              "categoryName": "Additional Headlight/Parts",
              "level": 2,
              "children": {
                "Projecteur longue portée / composants": {
                  "categoryId": null,
                  "categoryName": "Projecteur longue portée / composants",
                  "level": 4,
                  "children": {
                    "Réflecteur, projecteur longue portée": {
                      "categoryId": 100276,
                      "categoryName": "Spotlight/Parts",
                      "level": 3,
                      "children": {
                        "Projecteur longue portée / composants": {
                          "categoryId": null,
                          "categoryName": "Projecteur longue portée / composants",
                          "level": 6,
                          "children": {
                            "Réflecteur, projecteur longue portée": {
                              "categoryId": 100443,
                              "categoryName": "Spotlight Parts",
                              "level": 4,
                              "children": [],
                              "productId": 713
                            }
                          }
                        }
                      },
                      "productId": 713
                    }
                  }
                }
              },
              "productId": 713
            }
          }
        },
        "Projecteurs principaux / composants": {
          "categoryId": null,
          "categoryName": "Projecteurs principaux / composants",
          "level": 2,
          "children": {
            "Réflecteur, projecteur principal": {
              "categoryId": 100143,
              "categoryName": "Headlight/Parts",
              "level": 2,
              "children": {
                "Composants des projecteurs principaux": {
                  "categoryId": null,
                  "categoryName": "Composants des projecteurs principaux",
                  "level": 4,
                  "children": {
                    "Réflecteur, projecteur principal": {
                      "categoryId": 100430,
                      "categoryName": "Headlight Parts",
                      "level": 3,
                      "children": [],
                      "productId": 702
                    }
                  }
                }
              },
              "productId": 702
            }
          }
        }
      }
    }
  },
  "arborescenceText": "├── Carrosserie [ID: 100001] (Niveau 1)\n│   ├── Arrière de la voiture (Niveau 2)\n│   │   ├── Vehicle Rear [ID: 101705] (Niveau 2) → ProductId: 2179\n│   │   │   └── Feu clignotant/composants (Niveau 4)\n│   │   │       └── Direction Indicator/Parts [ID: 101727] (Niveau 3) → ProductId: 2179\n│   │   │           └── Composants de feu clignotant (Niveau 6)\n│   │   │               └── Indicator Parts [ID: 101729] (Niveau 4) → ProductId: 2179\n│   │   └── Vehicle Rear [ID: 101705] (Niveau 2) → ProductId: 2180\n│   │       └── Feu de position / d'encombrement / composants (Niveau 4)\n│   │           └── Side Marker/End Outline Marker Light/Parts [ID: 101785] (Niveau 3) → ProductId: 2180\n│   │               └── Feu d'encombrement (Niveau 6)\n│   │                   └── End Outline Marker Light [ID: 101787] (Niveau 4) → ProductId: 2180\n│   ├── Avant du véhicule (Niveau 2)\n│   │   ├── Vehicle Front [ID: 101648] (Niveau 2) → ProductId: 2179\n│   │   │   └── Feu clignotant/composants (Niveau 4)\n│   │   │       └── Direction Indicator/Parts [ID: 101669] (Niveau 3) → ProductId: 2179\n│   │   │           └── Composants de feu clignotant (Niveau 6)\n│   │   │               └── Indicator Parts [ID: 101671] (Niveau 4) → ProductId: 2179\n│   │   ├── Vehicle Front [ID: 101648] (Niveau 2) → ProductId: 2180\n│   │   │   └── Feu de position / d'encombrement / composants (Niveau 4)\n│   │   │       └── Side Marker/End Outline Marker Light/Parts [ID: 101766] (Niveau 3) → ProductId: 2180\n│   │   │           └── Feu d'encombrement (Niveau 6)\n│   │   │               └── End Outline Marker Light [ID: 101768] (Niveau 4) → ProductId: 2180\n│   │   ├── Vehicle Front [ID: 101648] (Niveau 2) → ProductId: 710\n│   │   │   └── Projecteur antibrouillard/ composants (Niveau 4)\n│   │   │       └── Front Fog Light/Parts [ID: 101661] (Niveau 3) → ProductId: 710\n│   │   │           └── Composants pour projecteur antibrouillard (Niveau 6)\n│   │   │               └── Fog Light Parts [ID: 101664] (Niveau 4) → ProductId: 710\n│   │   ├── Vehicle Front [ID: 101648] (Niveau 2) → ProductId: 713\n│   │   │   └── Projecteur longue portée / composants (Niveau 4)\n│   │   │       └── Spotlight/Parts [ID: 101665] (Niveau 3) → ProductId: 713\n│   │   │           └── Projecteur longue portée / composants (Niveau 6)\n│   │   │               └── Spotlight Parts [ID: 101668] (Niveau 4) → ProductId: 713\n│   │   └── Vehicle Front [ID: 101648] (Niveau 2) → ProductId: 702\n│   │       └── Projecteurs principaux / composants (Niveau 4)\n│   │           └── Headlight/Parts [ID: 101656] (Niveau 3) → ProductId: 702\n│   │               └── Composants des projecteurs principaux (Niveau 6)\n│   │                   └── Headlight Parts [ID: 101659] (Niveau 4) → ProductId: 702\n│   ├── Feux (Niveau 2)\n│   │   ├── Lights [ID: 101407] (Niveau 2) → ProductId: 2179\n│   │   │   └── Feu clignotant/composants (Niveau 4)\n│   │   │       └── Direction Indicator/Parts [ID: 101420] (Niveau 3) → ProductId: 2179\n│   │   │           └── Composants de feu clignotant (Niveau 6)\n│   │   │               └── Indicator Parts [ID: 101422] (Niveau 4) → ProductId: 2179\n│   │   └── Lights [ID: 101407] (Niveau 2) → ProductId: 2180\n│   │       └── Feu de position / d'encombrement / composants (Niveau 4)\n│   │           └── Side Marker/End Outline Marker Light/Parts [ID: 101441] (Niveau 3) → ProductId: 2180\n│   │               └── Feu d'encombrement (Niveau 6)\n│   │                   └── End Outline Marker Light [ID: 101443] (Niveau 4) → ProductId: 2180\n│   ├── Phares supplémentaires/composants (Niveau 2)\n│   │   ├── Additional Headlight/Parts [ID: 101340] (Niveau 2) → ProductId: 718\n│   │   │   └── Phare chercheur / composants (Niveau 4)\n│   │   │       └── Searchlight/Parts [ID: 101353] (Niveau 3) → ProductId: 718\n│   │   │           └── Composants phare chercheur (Niveau 6)\n│   │   │               └── Searchlight Parts [ID: 101356] (Niveau 4) → ProductId: 718\n│   │   ├── Additional Headlight/Parts [ID: 101340] (Niveau 2) → ProductId: 710\n│   │   │   └── Projecteur antibrouillard/ composants (Niveau 4)\n│   │   │       └── Front Fog Light/Parts [ID: 101341] (Niveau 3) → ProductId: 710\n│   │   │           └── Composants pour projecteur antibrouillard (Niveau 6)\n│   │   │               └── Fog Light Parts [ID: 101344] (Niveau 4) → ProductId: 710\n│   │   ├── Additional Headlight/Parts [ID: 101340] (Niveau 2) → ProductId: 725\n│   │   │   └── Projecteur de travail, composants (Niveau 4)\n│   │   │       └── Worklight/Parts [ID: 101349] (Niveau 3) → ProductId: 725\n│   │   │           └── Projecteur de travail, composants (Niveau 6)\n│   │   │               └── Worklight Parts [ID: 101352] (Niveau 4) → ProductId: 725\n│   │   └── Additional Headlight/Parts [ID: 101340] (Niveau 2) → ProductId: 713\n│   │       └── Projecteur longue portée / composants (Niveau 4)\n│   │           └── Spotlight/Parts [ID: 101345] (Niveau 3) → ProductId: 713\n│   │               └── Projecteur longue portée / composants (Niveau 6)\n│   │                   └── Spotlight Parts [ID: 101348] (Niveau 4) → ProductId: 713\n│   └── Projecteurs principaux / composants (Niveau 2)\n│       └── Headlight/Parts [ID: 101465] (Niveau 2) → ProductId: 702\n│           └── Composants des projecteurs principaux (Niveau 4)\n│               └── Headlight Parts [ID: 101468] (Niveau 3) → ProductId: 702\n\n└── Système électrique [ID: 100010] (Niveau 1)\n    ├── Cataphote arrière/Réflecteur latéral (Niveau 2)\n    │   ├── Reflectors/Side Reflectors [ID: 100295] (Niveau 2) → ProductId: 1093\n    │   └── Reflectors/Side Reflectors [ID: 100295] (Niveau 2) → ProductId: 2480\n    ├── Feux (Niveau 2)\n    │   ├── Lights [ID: 100043] (Niveau 2) → ProductId: 2179\n    │   │   └── Feu clignotant/composants (Niveau 4)\n    │   │       └── Direction Indicator/Parts [ID: 100145] (Niveau 3) → ProductId: 2179\n    │   │           └── Composants de feu clignotant (Niveau 6)\n    │   │               └── Indicator Parts [ID: 100480] (Niveau 4) → ProductId: 2179\n    │   ├── Lights [ID: 100043] (Niveau 2) → ProductId: 2180\n    │   │   └── Feu de position / d'encombrement / composants (Niveau 4)\n    │   │       └── Side Marker/End Outline Marker Light/Parts [ID: 100290] (Niveau 3) → ProductId: 2180\n    │   │           └── Feu d'encombrement (Niveau 6)\n    │   │               └── End Outline Marker Light [ID: 100469] (Niveau 4) → ProductId: 2180\n    │   └── Lights [ID: 100043] (Niveau 2) → ProductId: 1170\n    │       └── Gyrophare / composants (Niveau 4)\n    │           └── Rotating Beacon/Parts [ID: 100289] (Niveau 3) → ProductId: 1170\n    │               └── Composants du gyrophare (Niveau 6)\n    │                   └── Rotating Beacon Parts [ID: 100487] (Niveau 4) → ProductId: 1170\n    ├── Phares supplémentaires/composants (Niveau 2)\n    │   ├── Additional Headlight/Parts [ID: 100787] (Niveau 2) → ProductId: 718\n    │   │   └── Phare chercheur / composants (Niveau 4)\n    │   │       └── Searchlight/Parts [ID: 100281] (Niveau 3) → ProductId: 718\n    │   │           └── Composants phare chercheur (Niveau 6)\n    │   │               └── Searchlight Parts [ID: 100446] (Niveau 4) → ProductId: 718\n    │   ├── Additional Headlight/Parts [ID: 100787] (Niveau 2) → ProductId: 710\n    │   │   └── Projecteur antibrouillard/ composants (Niveau 4)\n    │   │       └── Front Fog Light/Parts [ID: 100277] (Niveau 3) → ProductId: 710\n    │   │           └── Composants pour projecteur antibrouillard (Niveau 6)\n    │   │               └── Fog Light Parts [ID: 100444] (Niveau 4) → ProductId: 710\n    │   ├── Additional Headlight/Parts [ID: 100787] (Niveau 2) → ProductId: 725\n    │   │   └── Projecteur de travail, composants (Niveau 4)\n    │   │       └── Worklight/Parts [ID: 100280] (Niveau 3) → ProductId: 725\n    │   │           └── Projecteur de travail, composants (Niveau 6)\n    │   │               └── Worklight Parts [ID: 100445] (Niveau 4) → ProductId: 725\n    │   └── Additional Headlight/Parts [ID: 100787] (Niveau 2) → ProductId: 713\n    │       └── Projecteur longue portée / composants (Niveau 4)\n    │           └── Spotlight/Parts [ID: 100276] (Niveau 3) → ProductId: 713\n    │               └── Projecteur longue portée / composants (Niveau 6)\n    │                   └── Spotlight Parts [ID: 100443] (Niveau 4) → ProductId: 713\n    └── Projecteurs principaux / composants (Niveau 2)\n        └── Headlight/Parts [ID: 100143] (Niveau 2) → ProductId: 702\n            └── Composants des projecteurs principaux (Niveau 4)\n                └── Headlight Parts [ID: 100430] (Niveau 3) → ProductId: 702",
  "arborescencePaths": [
    {
      "path": [
        "Carrosserie",
        "Arrière de la voiture",
        "Vehicle Rear"
      ],
      "categoryIds": [
        100001,
        null,
        101705
      ],
      "finalCategoryId": 101705,
      "productId": 2179
    },
    {
      "path": [
        "Carrosserie",
        "Arrière de la voiture",
        "Vehicle Rear"
      ],
      "categoryIds": [
        100001,
        null,
        101705
      ],
      "finalCategoryId": 101705,
      "productId": 2180
    },
    {
      "path": [
        "Carrosserie",
        "Avant du véhicule",
        "Vehicle Front"
      ],
      "categoryIds": [
        100001,
        null,
        101648
      ],
      "finalCategoryId": 101648,
      "productId": 2179
    },
    {
      "path": [
        "Carrosserie",
        "Avant du véhicule",
        "Vehicle Front"
      ],
      "categoryIds": [
        100001,
        null,
        101648
      ],
      "finalCategoryId": 101648,
      "productId": 2180
    },
    {
      "path": [
        "Carrosserie",
        "Avant du véhicule",
        "Vehicle Front"
      ],
      "categoryIds": [
        100001,
        null,
        101648
      ],
      "finalCategoryId": 101648,
      "productId": 710
    },
    {
      "path": [
        "Carrosserie",
        "Avant du véhicule",
        "Vehicle Front"
      ],
      "categoryIds": [
        100001,
        null,
        101648
      ],
      "finalCategoryId": 101648,
      "productId": 713
    },
    {
      "path": [
        "Carrosserie",
        "Avant du véhicule",
        "Vehicle Front"
      ],
      "categoryIds": [
        100001,
        null,
        101648
      ],
      "finalCategoryId": 101648,
      "productId": 702
    },
    {
      "path": [
        "Carrosserie",
        "Feux",
        "Lights"
      ],
      "categoryIds": [
        100001,
        null,
        101407
      ],
      "finalCategoryId": 101407,
      "productId": 2179
    },
    {
      "path": [
        "Carrosserie",
        "Feux",
        "Lights"
      ],
      "categoryIds": [
        100001,
        null,
        101407
      ],
      "finalCategoryId": 101407,
      "productId": 2180
    },
    {
      "path": [
        "Carrosserie",
        "Phares supplémentaires/composants",
        "Additional Headlight/Parts"
      ],
      "categoryIds": [
        100001,
        null,
        101340
      ],
      "finalCategoryId": 101340,
      "productId": 718
    },
    {
      "path": [
        "Carrosserie",
        "Phares supplémentaires/composants",
        "Additional Headlight/Parts"
      ],
      "categoryIds": [
        100001,
        null,
        101340
      ],
      "finalCategoryId": 101340,
      "productId": 710
    },
    {
      "path": [
        "Carrosserie",
        "Phares supplémentaires/composants",
        "Additional Headlight/Parts"
      ],
      "categoryIds": [
        100001,
        null,
        101340
      ],
      "finalCategoryId": 101340,
      "productId": 725
    },
    {
      "path": [
        "Carrosserie",
        "Phares supplémentaires/composants",
        "Additional Headlight/Parts"
      ],
      "categoryIds": [
        100001,
        null,
        101340
      ],
      "finalCategoryId": 101340,
      "productId": 713
    },
    {
      "path": [
        "Carrosserie",
        "Projecteurs principaux / composants",
        "Headlight/Parts"
      ],
      "categoryIds": [
        100001,
        null,
        101465
      ],
      "finalCategoryId": 101465,
      "productId": 702
    },
    {
      "path": [
        "Système électrique",
        "Cataphote arrière/Réflecteur latéral",
        "Reflectors/Side Reflectors"
      ],
      "categoryIds": [
        100010,
        null,
        100295
      ],
      "finalCategoryId": 100295,
      "productId": 1093
    },
    {
      "path": [
        "Système électrique",
        "Cataphote arrière/Réflecteur latéral",
        "Reflectors/Side Reflectors"
      ],
      "categoryIds": [
        100010,
        null,
        100295
      ],
      "finalCategoryId": 100295,
      "productId": 2480
    },
    {
      "path": [
        "Système électrique",
        "Feux",
        "Lights"
      ],
      "categoryIds": [
        100010,
        null,
        100043
      ],
      "finalCategoryId": 100043,
      "productId": 2179
    },
    {
      "path": [
        "Système électrique",
        "Feux",
        "Lights"
      ],
      "categoryIds": [
        100010,
        null,
        100043
      ],
      "finalCategoryId": 100043,
      "productId": 2180
    },
    {
      "path": [
        "Système électrique",
        "Feux",
        "Lights"
      ],
      "categoryIds": [
        100010,
        null,
        100043
      ],
      "finalCategoryId": 100043,
      "productId": 1170
    },
    {
      "path": [
        "Système électrique",
        "Phares supplémentaires/composants",
        "Additional Headlight/Parts"
      ],
      "categoryIds": [
        100010,
        null,
        100787
      ],
      "finalCategoryId": 100787,
      "productId": 718
    },
    {
      "path": [
        "Système électrique",
        "Phares supplémentaires/composants",
        "Additional Headlight/Parts"
      ],
      "categoryIds": [
        100010,
        null,
        100787
      ],
      "finalCategoryId": 100787,
      "productId": 710
    },
    {
      "path": [
        "Système électrique",
        "Phares supplémentaires/composants",
        "Additional Headlight/Parts"
      ],
      "categoryIds": [
        100010,
        null,
        100787
      ],
      "finalCategoryId": 100787,
      "productId": 725
    },
    {
      "path": [
        "Système électrique",
        "Phares supplémentaires/composants",
        "Additional Headlight/Parts"
      ],
      "categoryIds": [
        100010,
        null,
        100787
      ],
      "finalCategoryId": 100787,
      "productId": 713
    },
    {
      "path": [
        "Système électrique",
        "Projecteurs principaux / composants",
        "Headlight/Parts"
      ],
      "categoryIds": [
        100010,
        null,
        100143
      ],
      "finalCategoryId": 100143,
      "productId": 702
    }
  ],
  "productIdsInArbo": [
    702,
    710,
    713,
    718,
    725,
    1093,
    1170,
    2179,
    2180,
    2480
  ],
  "closestProductIds": [
    {
      "productId": 702,
      "productName": "Réflecteur, projecteur principal"
    },
    {
      "productId": 710,
      "productName": "Réflecteur, projecteur antibrouillard"
    },
    {
      "productId": 713,
      "productName": "Réflecteur, projecteur longue portée"
    },
    {
      "productId": 718,
      "productName": "Réflecteur, phare chercheur"
    },
    {
      "productId": 725,
      "productName": "Réflecteur, projecteur de travail"
    }
  ]
}