{
  "productName": "Soupape de surpression",
  "searchText": "Soupape de surpression",
  "found": true,
  "hasMatch": false,
  "timestamp": "2025-12-03T07:17:15.620Z",
  "productId": 2045,
  "arborescence": {
    "Carburation": {
      "categoryId": 100254,
      "categoryName": "Carburation",
      "level": 1,
      "children": {
        "Mélange air-carburant": {
          "categoryId": null,
          "categoryName": "Mélange air-carburant",
          "level": 2,
          "children": {
            "Soupape de surpression, système à rampe commune": {
              "categoryId": 102793,
              "categoryName": "Mixture Formation",
              "level": 2,
              "children": {
                "Pompe à injection/pompe à haute pression": {
                  "categoryId": null,
                  "categoryName": "Pompe à injection/pompe à haute pression",
                  "level": 4,
                  "children": {
                    "Soupape de surpression, système à rampe commune": {
                      "categoryId": 102803,
                      "categoryName": "Fuel Injection Pump/High Pressure Pump",
                      "level": 3,
                      "children": [],
                      "productId": 5656
                    }
                  }
                },
                "Soupapes/Bloc de soupapes": {
                  "categoryId": null,
                  "categoryName": "Soupapes/Bloc de soupapes",
                  "level": 4,
                  "children": {
                    "Soupape de surpression, système à rampe commune": {
                      "categoryId": 102811,
                      "categoryName": "Valves/Valve Unit",
                      "level": 3,
                      "children": [],
                      "productId": 5656
                    }
                  }
                }
              },
              "productId": 5656
            }
          }
        }
      }
    },
    "Suspension/Amortissement": {
      "categoryId": 100011,
      "categoryName": "Suspension/Amortissement",
      "level": 1,
      "children": {
        "Suspension pneumatique": {
          "categoryId": null,
          "categoryName": "Suspension pneumatique",
          "level": 2,
          "children": {
            "Kit de réparation, soupape de surpression (compresseur-air)": {
              "categoryId": 101884,
              "categoryName": "Air Suspension",
              "level": 2,
              "children": [],
              "productId": 6148
            }
          }
        }
      }
    }
  },
  "arborescenceText": "├── Carburation [ID: 100254] (Niveau 1)\n│   └── Mélange air-carburant (Niveau 2)\n│       └── Mixture Formation [ID: 102793] (Niveau 2) → ProductId: 5656\n│           ├── Pompe à injection/pompe à haute pression (Niveau 4)\n│           │   └── Fuel Injection Pump/High Pressure Pump [ID: 102803] (Niveau 3) → ProductId: 5656\n│           └── Soupapes/Bloc de soupapes (Niveau 4)\n│               └── Valves/Valve Unit [ID: 102811] (Niveau 3) → ProductId: 5656\n\n└── Suspension/Amortissement [ID: 100011] (Niveau 1)\n    └── Suspension pneumatique (Niveau 2)\n        └── Air Suspension [ID: 101884] (Niveau 2) → ProductId: 6148",
  "arborescencePaths": [
    {
      "path": [
        "Carburation",
        "Mélange air-carburant",
        "Mixture Formation"
      ],
      "categoryIds": [
        100254,
        null,
        102793
      ],
      "finalCategoryId": 102793,
      "productId": 5656
    },
    {
      "path": [
        "Suspension/Amortissement",
        "Suspension pneumatique",
        "Air Suspension"
      ],
      "categoryIds": [
        100011,
        null,
        101884
      ],
      "finalCategoryId": 101884,
      "productId": 6148
    }
  ],
  "productIdsInArbo": [
    5656,
    6148
  ],
  "closestProductIds": [
    {
      "productId": 5656,
      "productName": "Soupape de surpression, système à rampe commune"
    },
    {
      "productId": 6148,
      "productName": "Kit de réparation, soupape de surpression (compresseur-air)"
    }
  ]
}