{
  "productName": "Soupape, réaspiration des gaz",
  "searchText": "Soupape, réaspiration des gaz",
  "found": true,
  "hasMatch": true,
  "timestamp": "2025-12-03T07:18:04.958Z",
  "productId": 1129,
  "arborescence": {
    "Carburation": {
      "categoryId": 100254,
      "categoryName": "Carburation",
      "level": 1,
      "children": {
        "Épuration des gaz d'échappement": {
          "categoryId": null,
          "categoryName": "Épuration des gaz d'échappement",
          "level": 2,
          "children": {
            "Soupape, réaspiration des gaz": {
              "categoryId": 100790,
              "categoryName": "Exhaust Emission Control",
              "level": 2,
              "children": {
                "Recyclage des gaz d'échappement": {
                  "categoryId": null,
                  "categoryName": "Recyclage des gaz d'échappement",
                  "level": 4,
                  "children": {
                    "Soupape, réaspiration des gaz": {
                      "categoryId": 100791,
                      "categoryName": "Exhaust Gas Recirculation",
                      "level": 3,
                      "children": {
                        "Soupape, recyclage des gaz d'échappement": {
                          "categoryId": null,
                          "categoryName": "Soupape, recyclage des gaz d'échappement",
                          "level": 6,
                          "children": {
                            "Soupape, réaspiration des gaz": {
                              "categoryId": 100816,
                              "categoryName": "Valves, exhaust gas recirculation",
                              "level": 4,
                              "children": [],
                              "productId": 1129
                            }
                          }
                        }
                      },
                      "productId": 1129
                    }
                  }
                }
              },
              "productId": 1129
            }
          }
        }
      }
    },
    "Moteur": {
      "categoryId": 100002,
      "categoryName": "Moteur",
      "level": 1,
      "children": {
        "Épuration des gaz d'échappement": {
          "categoryId": null,
          "categoryName": "Épuration des gaz d'échappement",
          "level": 2,
          "children": {
            "Soupape, réaspiration des gaz": {
              "categoryId": 100541,
              "categoryName": "Exhaust Emission Control",
              "level": 2,
              "children": {
                "Recyclage des gaz d'échappement": {
                  "categoryId": null,
                  "categoryName": "Recyclage des gaz d'échappement",
                  "level": 4,
                  "children": {
                    "Soupape, réaspiration des gaz": {
                      "categoryId": 100542,
                      "categoryName": "Exhaust Gas Recirculation",
                      "level": 3,
                      "children": {
                        "Soupape, recyclage des gaz d'échappement": {
                          "categoryId": null,
                          "categoryName": "Soupape, recyclage des gaz d'échappement",
                          "level": 6,
                          "children": {
                            "Soupape, réaspiration des gaz": {
                              "categoryId": 100549,
                              "categoryName": "Valves, exhaust gas recirculation",
                              "level": 4,
                              "children": [],
                              "productId": 1129
                            }
                          }
                        }
                      },
                      "productId": 1129
                    }
                  }
                }
              },
              "productId": 1129
            }
          }
        }
      }
    }
  },
  "arborescenceText": "├── Carburation [ID: 100254] (Niveau 1)\n│   └── Épuration des gaz d'échappement (Niveau 2)\n│       └── Exhaust Emission Control [ID: 100790] (Niveau 2) → ProductId: 1129\n│           └── Recyclage des gaz d'échappement (Niveau 4)\n│               └── Exhaust Gas Recirculation [ID: 100791] (Niveau 3) → ProductId: 1129\n│                   └── Soupape, recyclage des gaz d'échappement (Niveau 6)\n│                       └── Valves, exhaust gas recirculation [ID: 100816] (Niveau 4) → ProductId: 1129\n\n└── Moteur [ID: 100002] (Niveau 1)\n    └── Épuration des gaz d'échappement (Niveau 2)\n        └── Exhaust Emission Control [ID: 100541] (Niveau 2) → ProductId: 1129\n            └── Recyclage des gaz d'échappement (Niveau 4)\n                └── Exhaust Gas Recirculation [ID: 100542] (Niveau 3) → ProductId: 1129\n                    └── Soupape, recyclage des gaz d'échappement (Niveau 6)\n                        └── Valves, exhaust gas recirculation [ID: 100549] (Niveau 4) → ProductId: 1129",
  "arborescencePaths": [
    {
      "path": [
        "Carburation",
        "Épuration des gaz d'échappement",
        "Exhaust Emission Control"
      ],
      "categoryIds": [
        100254,
        null,
        100790
      ],
      "finalCategoryId": 100790,
      "productId": 1129
    },
    {
      "path": [
        "Moteur",
        "Épuration des gaz d'échappement",
        "Exhaust Emission Control"
      ],
      "categoryIds": [
        100002,
        null,
        100541
      ],
      "finalCategoryId": 100541,
      "productId": 1129
    }
  ],
  "productIdsInArbo": [
    1129
  ],
  "matchedProductIds": [
    1129
  ]
}