{
  "productName": "Support, projecteur longue portée",
  "searchText": "Support, projecteur longue portée",
  "found": true,
  "hasMatch": true,
  "timestamp": "2025-12-03T07:22:01.583Z",
  "productId": 100,
  "arborescence": {
    "Carrosserie": {
      "categoryId": 100001,
      "categoryName": "Carrosserie",
      "level": 1,
      "children": {
        "Avant du véhicule": {
          "categoryId": null,
          "categoryName": "Avant du véhicule",
          "level": 2,
          "children": {
            "Support, projecteur longue portée": {
              "categoryId": 101648,
              "categoryName": "Vehicle Front",
              "level": 2,
              "children": {
                "Projecteur longue portée / composants": {
                  "categoryId": null,
                  "categoryName": "Projecteur longue portée / composants",
                  "level": 4,
                  "children": {
                    "Support, projecteur longue portée": {
                      "categoryId": 101665,
                      "categoryName": "Spotlight/Parts",
                      "level": 3,
                      "children": {
                        "Projecteur longue portée / composants": {
                          "categoryId": null,
                          "categoryName": "Projecteur longue portée / composants",
                          "level": 6,
                          "children": {
                            "Support, projecteur longue portée": {
                              "categoryId": 101668,
                              "categoryName": "Spotlight Parts",
                              "level": 4,
                              "children": [],
                              "productId": 100
                            }
                          }
                        }
                      },
                      "productId": 100
                    }
                  }
                }
              },
              "productId": 100
            }
          }
        },
        "Phares supplémentaires/composants": {
          "categoryId": null,
          "categoryName": "Phares supplémentaires/composants",
          "level": 2,
          "children": {
            "Support, projecteur longue portée": {
              "categoryId": 101340,
              "categoryName": "Additional Headlight/Parts",
              "level": 2,
              "children": {
                "Projecteur longue portée / composants": {
                  "categoryId": null,
                  "categoryName": "Projecteur longue portée / composants",
                  "level": 4,
                  "children": {
                    "Support, projecteur longue portée": {
                      "categoryId": 101345,
                      "categoryName": "Spotlight/Parts",
                      "level": 3,
                      "children": {
                        "Projecteur longue portée / composants": {
                          "categoryId": null,
                          "categoryName": "Projecteur longue portée / composants",
                          "level": 6,
                          "children": {
                            "Support, projecteur longue portée": {
                              "categoryId": 101348,
                              "categoryName": "Spotlight Parts",
                              "level": 4,
                              "children": [],
                              "productId": 100
                            }
                          }
                        }
                      },
                      "productId": 100
                    }
                  }
                }
              },
              "productId": 100
            }
          }
        }
      }
    },
    "Système électrique": {
      "categoryId": 100010,
      "categoryName": "Système électrique",
      "level": 1,
      "children": {
        "Phares supplémentaires/composants": {
          "categoryId": null,
          "categoryName": "Phares supplémentaires/composants",
          "level": 2,
          "children": {
            "Support, projecteur longue portée": {
              "categoryId": 100787,
              "categoryName": "Additional Headlight/Parts",
              "level": 2,
              "children": {
                "Projecteur longue portée / composants": {
                  "categoryId": null,
                  "categoryName": "Projecteur longue portée / composants",
                  "level": 4,
                  "children": {
                    "Support, projecteur longue portée": {
                      "categoryId": 100276,
                      "categoryName": "Spotlight/Parts",
                      "level": 3,
                      "children": {
                        "Projecteur longue portée / composants": {
                          "categoryId": null,
                          "categoryName": "Projecteur longue portée / composants",
                          "level": 6,
                          "children": {
                            "Support, projecteur longue portée": {
                              "categoryId": 100443,
                              "categoryName": "Spotlight Parts",
                              "level": 4,
                              "children": [],
                              "productId": 100
                            }
                          }
                        }
                      },
                      "productId": 100
                    }
                  }
                }
              },
              "productId": 100
            }
          }
        }
      }
    }
  },
  "arborescenceText": "├── Carrosserie [ID: 100001] (Niveau 1)\n│   ├── Avant du véhicule (Niveau 2)\n│   │   └── Vehicle Front [ID: 101648] (Niveau 2) → ProductId: 100\n│   │       └── Projecteur longue portée / composants (Niveau 4)\n│   │           └── Spotlight/Parts [ID: 101665] (Niveau 3) → ProductId: 100\n│   │               └── Projecteur longue portée / composants (Niveau 6)\n│   │                   └── Spotlight Parts [ID: 101668] (Niveau 4) → ProductId: 100\n│   └── Phares supplémentaires/composants (Niveau 2)\n│       └── Additional Headlight/Parts [ID: 101340] (Niveau 2) → ProductId: 100\n│           └── Projecteur longue portée / composants (Niveau 4)\n│               └── Spotlight/Parts [ID: 101345] (Niveau 3) → ProductId: 100\n│                   └── Projecteur longue portée / composants (Niveau 6)\n│                       └── Spotlight Parts [ID: 101348] (Niveau 4) → ProductId: 100\n\n└── Système électrique [ID: 100010] (Niveau 1)\n    └── Phares supplémentaires/composants (Niveau 2)\n        └── Additional Headlight/Parts [ID: 100787] (Niveau 2) → ProductId: 100\n            └── Projecteur longue portée / composants (Niveau 4)\n                └── Spotlight/Parts [ID: 100276] (Niveau 3) → ProductId: 100\n                    └── Projecteur longue portée / composants (Niveau 6)\n                        └── Spotlight Parts [ID: 100443] (Niveau 4) → ProductId: 100",
  "arborescencePaths": [
    {
      "path": [
        "Carrosserie",
        "Avant du véhicule",
        "Vehicle Front"
      ],
      "categoryIds": [
        100001,
        null,
        101648
      ],
      "finalCategoryId": 101648,
      "productId": 100
    },
    {
      "path": [
        "Carrosserie",
        "Phares supplémentaires/composants",
        "Additional Headlight/Parts"
      ],
      "categoryIds": [
        100001,
        null,
        101340
      ],
      "finalCategoryId": 101340,
      "productId": 100
    },
    {
      "path": [
        "Système électrique",
        "Phares supplémentaires/composants",
        "Additional Headlight/Parts"
      ],
      "categoryIds": [
        100010,
        null,
        100787
      ],
      "finalCategoryId": 100787,
      "productId": 100
    }
  ],
  "productIdsInArbo": [
    100
  ],
  "matchedProductIds": [
    100
  ]
}