{
  "productName": "Support moteur",
  "searchText": "Support moteur",
  "found": true,
  "hasMatch": true,
  "timestamp": "2025-12-03T07:20:20.355Z",
  "productId": 247,
  "arborescence": {
    "Entraînement hybride/électrique": {
      "categoryId": 706209,
      "categoryName": "Entraînement hybride/électrique",
      "level": 1,
      "children": {
        "Moteur électrique": {
          "categoryId": null,
          "categoryName": "Moteur électrique",
          "level": 2,
          "children": {
            "Kit de réparation, support (support moteur)": {
              "categoryId": 706682,
              "categoryName": "Electric Motor",
              "level": 2,
              "children": [],
              "productId": 60736
            },
            "Kit de réparation, support moteur (moteur électrique)": {
              "categoryId": 706682,
              "categoryName": "Electric Motor",
              "level": 2,
              "children": [],
              "productId": 60745
            },
            "Kit de réparation, support pendulaire (support moteur)": {
              "categoryId": 706682,
              "categoryName": "Electric Motor",
              "level": 2,
              "children": [],
              "productId": 60737
            }
          }
        }
      }
    },
    "Moteur": {
      "categoryId": 100002,
      "categoryName": "Moteur",
      "level": 1,
      "children": {
        "Outils": {
          "categoryId": null,
          "categoryName": "Outils",
          "level": 2,
          "children": {
            "Clé à douille, support moteur": {
              "categoryId": 103129,
              "categoryName": "Tools",
              "level": 2,
              "children": [],
              "productId": 4443
            },
            "Kit d'outils de réglage, épure de distribution": {
              "categoryId": 103129,
              "categoryName": "Tools",
              "level": 2,
              "children": [],
              "productId": 4463
            }
          }
        },
        "Recherche d'un article par graphique": {
          "categoryId": null,
          "categoryName": "Recherche d'un article par graphique",
          "level": 2,
          "children": {
            "Support moteur": {
              "categoryId": 102771,
              "categoryName": "Article Search via Graphic",
              "level": 2,
              "children": [],
              "productId": 3871
            }
          }
        },
        "Support du moteur": {
          "categoryId": null,
          "categoryName": "Support du moteur",
          "level": 2,
          "children": {
            "Amortisseur, support moteur": {
              "categoryId": 100535,
              "categoryName": "Engine Mounting System",
              "level": 2,
              "children": {
                "Amortisseurs de support moteur": {
                  "categoryId": null,
                  "categoryName": "Amortisseurs de support moteur",
                  "level": 4,
                  "children": {
                    "Amortisseur, support moteur": {
                      "categoryId": 100539,
                      "categoryName": "Engine Mounting Rubber Buffer",
                      "level": 3,
                      "children": [],
                      "productId": 271
                    }
                  }
                }
              },
              "productId": 271
            },
            "Butée élastique, support du moteur": {
              "categoryId": 100535,
              "categoryName": "Engine Mounting System",
              "level": 2,
              "children": {
                "Amortisseurs de support moteur": {
                  "categoryId": null,
                  "categoryName": "Amortisseurs de support moteur",
                  "level": 4,
                  "children": {
                    "Butée élastique, support du moteur": {
                      "categoryId": 100539,
                      "categoryName": "Engine Mounting Rubber Buffer",
                      "level": 3,
                      "children": [],
                      "productId": 1545
                    }
                  }
                },
                "Support moteur": {
                  "categoryId": null,
                  "categoryName": "Support moteur",
                  "level": 4,
                  "children": {
                    "Butée élastique, support du moteur": {
                      "categoryId": 100538,
                      "categoryName": "Engine Mounting",
                      "level": 3,
                      "children": [],
                      "productId": 1545
                    }
                  }
                }
              },
              "productId": 1545
            },
            "Kit rép. de câble, soupape de commutation support moteur": {
              "categoryId": 100535,
              "categoryName": "Engine Mounting System",
              "level": 2,
              "children": {
                "Support moteur": {
                  "categoryId": null,
                  "categoryName": "Support moteur",
                  "level": 4,
                  "children": {
                    "Kit rép. de câble, soupape de commutation support moteur": {
                      "categoryId": 100538,
                      "categoryName": "Engine Mounting",
                      "level": 3,
                      "children": [],
                      "productId": 9685
                    }
                  }
                }
              },
              "productId": 9685
            },
            "Kit réparation de câble, calculateur supports moteur": {
              "categoryId": 100535,
              "categoryName": "Engine Mounting System",
              "level": 2,
              "children": {
                "Support moteur": {
                  "categoryId": null,
                  "categoryName": "Support moteur",
                  "level": 4,
                  "children": {
                    "Kit réparation de câble, calculateur supports moteur": {
                      "categoryId": 100538,
                      "categoryName": "Engine Mounting",
                      "level": 3,
                      "children": [],
                      "productId": 9920
                    }
                  }
                }
              },
              "productId": 9920
            },
            "Kit réparation de câble, support moteur": {
              "categoryId": 100535,
              "categoryName": "Engine Mounting System",
              "level": 2,
              "children": {
                "Support moteur": {
                  "categoryId": null,
                  "categoryName": "Support moteur",
                  "level": 4,
                  "children": {
                    "Kit réparation de câble, support moteur": {
                      "categoryId": 100538,
                      "categoryName": "Engine Mounting",
                      "level": 3,
                      "children": [],
                      "productId": 9808
                    }
                  }
                }
              },
              "productId": 9808
            },
            "Rondelle d'arrêt, support moteur": {
              "categoryId": 100535,
              "categoryName": "Engine Mounting System",
              "level": 2,
              "children": {
                "Support moteur": {
                  "categoryId": null,
                  "categoryName": "Support moteur",
                  "level": 4,
                  "children": {
                    "Rondelle d'arrêt, support moteur": {
                      "categoryId": 100538,
                      "categoryName": "Engine Mounting",
                      "level": 3,
                      "children": [],
                      "productId": 5147
                    }
                  }
                }
              },
              "productId": 5147
            },
            "Support de couple": {
              "categoryId": 100535,
              "categoryName": "Engine Mounting System",
              "level": 2,
              "children": {
                "Support moteur": {
                  "categoryId": null,
                  "categoryName": "Support moteur",
                  "level": 4,
                  "children": {
                    "Support de couple": {
                      "categoryId": 100538,
                      "categoryName": "Engine Mounting",
                      "level": 3,
                      "children": [],
                      "productId": 60196
                    }
                  }
                }
              },
              "productId": 60196
            },
            "Support de palier, support du moteur": {
              "categoryId": 100535,
              "categoryName": "Engine Mounting System",
              "level": 2,
              "children": {
                "Support moteur": {
                  "categoryId": null,
                  "categoryName": "Support moteur",
                  "level": 4,
                  "children": {
                    "Support de palier, support du moteur": {
                      "categoryId": 100538,
                      "categoryName": "Engine Mounting",
                      "level": 3,
                      "children": [],
                      "productId": 483
                    }
                  }
                }
              },
              "productId": 483
            },
            "Support moteur": {
              "categoryId": 100535,
              "categoryName": "Engine Mounting System",
              "level": 2,
              "children": {
                "Support moteur": {
                  "categoryId": null,
                  "categoryName": "Support moteur",
                  "level": 4,
                  "children": {
                    "Support moteur": {
                      "categoryId": 100538,
                      "categoryName": "Engine Mounting",
                      "level": 3,
                      "children": [],
                      "productId": 247
                    }
                  }
                }
              },
              "productId": 247
            },
            "Vanne d'inversion, support moteur": {
              "categoryId": 100535,
              "categoryName": "Engine Mounting System",
              "level": 2,
              "children": {
                "Support moteur": {
                  "categoryId": null,
                  "categoryName": "Support moteur",
                  "level": 4,
                  "children": {
                    "Vanne d'inversion, support moteur": {
                      "categoryId": 100538,
                      "categoryName": "Engine Mounting",
                      "level": 3,
                      "children": [],
                      "productId": 3555
                    }
                  }
                }
              },
              "productId": 3555
            },
            "Vis, support de palier moteur": {
              "categoryId": 100535,
              "categoryName": "Engine Mounting System",
              "level": 2,
              "children": {
                "Fixation moteur": {
                  "categoryId": null,
                  "categoryName": "Fixation moteur",
                  "level": 4,
                  "children": {
                    "Vis, support de palier moteur": {
                      "categoryId": 100536,
                      "categoryName": "Engine Bracket",
                      "level": 3,
                      "children": [],
                      "productId": 8014
                    }
                  }
                },
                "Support moteur": {
                  "categoryId": null,
                  "categoryName": "Support moteur",
                  "level": 4,
                  "children": {
                    "Vis, support de palier moteur": {
                      "categoryId": 100538,
                      "categoryName": "Engine Mounting",
                      "level": 3,
                      "children": [],
                      "productId": 8014
                    }
                  }
                }
              },
              "productId": 8014
            }
          }
        }
      }
    }
  },
  "arborescenceText": "├── Entraînement hybride/électrique [ID: 706209] (Niveau 1)\n│   └── Moteur électrique (Niveau 2)\n│       ├── Electric Motor [ID: 706682] (Niveau 2) → ProductId: 60736\n│       ├── Electric Motor [ID: 706682] (Niveau 2) → ProductId: 60745\n│       └── Electric Motor [ID: 706682] (Niveau 2) → ProductId: 60737\n\n└── Moteur [ID: 100002] (Niveau 1)\n    ├── Outils (Niveau 2)\n    │   ├── Tools [ID: 103129] (Niveau 2) → ProductId: 4443\n    │   └── Tools [ID: 103129] (Niveau 2) → ProductId: 4463\n    ├── Recherche d'un article par graphique (Niveau 2)\n    │   └── Article Search via Graphic [ID: 102771] (Niveau 2) → ProductId: 3871\n    └── Support du moteur (Niveau 2)\n        ├── Engine Mounting System [ID: 100535] (Niveau 2) → ProductId: 271\n        │   └── Amortisseurs de support moteur (Niveau 4)\n        │       └── Engine Mounting Rubber Buffer [ID: 100539] (Niveau 3) → ProductId: 271\n        ├── Engine Mounting System [ID: 100535] (Niveau 2) → ProductId: 1545\n        │   ├── Amortisseurs de support moteur (Niveau 4)\n        │   │   └── Engine Mounting Rubber Buffer [ID: 100539] (Niveau 3) → ProductId: 1545\n        │   └── Support moteur (Niveau 4)\n        │       └── Engine Mounting [ID: 100538] (Niveau 3) → ProductId: 1545\n        ├── Engine Mounting System [ID: 100535] (Niveau 2) → ProductId: 9685\n        │   └── Support moteur (Niveau 4)\n        │       └── Engine Mounting [ID: 100538] (Niveau 3) → ProductId: 9685\n        ├── Engine Mounting System [ID: 100535] (Niveau 2) → ProductId: 9920\n        │   └── Support moteur (Niveau 4)\n        │       └── Engine Mounting [ID: 100538] (Niveau 3) → ProductId: 9920\n        ├── Engine Mounting System [ID: 100535] (Niveau 2) → ProductId: 9808\n        │   └── Support moteur (Niveau 4)\n        │       └── Engine Mounting [ID: 100538] (Niveau 3) → ProductId: 9808\n        ├── Engine Mounting System [ID: 100535] (Niveau 2) → ProductId: 5147\n        │   └── Support moteur (Niveau 4)\n        │       └── Engine Mounting [ID: 100538] (Niveau 3) → ProductId: 5147\n        ├── Engine Mounting System [ID: 100535] (Niveau 2) → ProductId: 60196\n        │   └── Support moteur (Niveau 4)\n        │       └── Engine Mounting [ID: 100538] (Niveau 3) → ProductId: 60196\n        ├── Engine Mounting System [ID: 100535] (Niveau 2) → ProductId: 483\n        │   └── Support moteur (Niveau 4)\n        │       └── Engine Mounting [ID: 100538] (Niveau 3) → ProductId: 483\n        ├── Engine Mounting System [ID: 100535] (Niveau 2) → ProductId: 247\n        │   └── Support moteur (Niveau 4)\n        │       └── Engine Mounting [ID: 100538] (Niveau 3) → ProductId: 247\n        ├── Engine Mounting System [ID: 100535] (Niveau 2) → ProductId: 3555\n        │   └── Support moteur (Niveau 4)\n        │       └── Engine Mounting [ID: 100538] (Niveau 3) → ProductId: 3555\n        └── Engine Mounting System [ID: 100535] (Niveau 2) → ProductId: 8014\n            ├── Fixation moteur (Niveau 4)\n            │   └── Engine Bracket [ID: 100536] (Niveau 3) → ProductId: 8014\n            └── Support moteur (Niveau 4)\n                └── Engine Mounting [ID: 100538] (Niveau 3) → ProductId: 8014",
  "arborescencePaths": [
    {
      "path": [
        "Entraînement hybride/électrique",
        "Moteur électrique",
        "Electric Motor"
      ],
      "categoryIds": [
        706209,
        null,
        706682
      ],
      "finalCategoryId": 706682,
      "productId": 60736
    },
    {
      "path": [
        "Entraînement hybride/électrique",
        "Moteur électrique",
        "Electric Motor"
      ],
      "categoryIds": [
        706209,
        null,
        706682
      ],
      "finalCategoryId": 706682,
      "productId": 60745
    },
    {
      "path": [
        "Entraînement hybride/électrique",
        "Moteur électrique",
        "Electric Motor"
      ],
      "categoryIds": [
        706209,
        null,
        706682
      ],
      "finalCategoryId": 706682,
      "productId": 60737
    },
    {
      "path": [
        "Moteur",
        "Outils",
        "Tools"
      ],
      "categoryIds": [
        100002,
        null,
        103129
      ],
      "finalCategoryId": 103129,
      "productId": 4443
    },
    {
      "path": [
        "Moteur",
        "Outils",
        "Tools"
      ],
      "categoryIds": [
        100002,
        null,
        103129
      ],
      "finalCategoryId": 103129,
      "productId": 4463
    },
    {
      "path": [
        "Moteur",
        "Recherche d'un article par graphique",
        "Article Search via Graphic"
      ],
      "categoryIds": [
        100002,
        null,
        102771
      ],
      "finalCategoryId": 102771,
      "productId": 3871
    },
    {
      "path": [
        "Moteur",
        "Support du moteur",
        "Engine Mounting System"
      ],
      "categoryIds": [
        100002,
        null,
        100535
      ],
      "finalCategoryId": 100535,
      "productId": 271
    },
    {
      "path": [
        "Moteur",
        "Support du moteur",
        "Engine Mounting System"
      ],
      "categoryIds": [
        100002,
        null,
        100535
      ],
      "finalCategoryId": 100535,
      "productId": 1545
    },
    {
      "path": [
        "Moteur",
        "Support du moteur",
        "Engine Mounting System"
      ],
      "categoryIds": [
        100002,
        null,
        100535
      ],
      "finalCategoryId": 100535,
      "productId": 9685
    },
    {
      "path": [
        "Moteur",
        "Support du moteur",
        "Engine Mounting System"
      ],
      "categoryIds": [
        100002,
        null,
        100535
      ],
      "finalCategoryId": 100535,
      "productId": 9920
    },
    {
      "path": [
        "Moteur",
        "Support du moteur",
        "Engine Mounting System"
      ],
      "categoryIds": [
        100002,
        null,
        100535
      ],
      "finalCategoryId": 100535,
      "productId": 9808
    },
    {
      "path": [
        "Moteur",
        "Support du moteur",
        "Engine Mounting System"
      ],
      "categoryIds": [
        100002,
        null,
        100535
      ],
      "finalCategoryId": 100535,
      "productId": 5147
    },
    {
      "path": [
        "Moteur",
        "Support du moteur",
        "Engine Mounting System"
      ],
      "categoryIds": [
        100002,
        null,
        100535
      ],
      "finalCategoryId": 100535,
      "productId": 60196
    },
    {
      "path": [
        "Moteur",
        "Support du moteur",
        "Engine Mounting System"
      ],
      "categoryIds": [
        100002,
        null,
        100535
      ],
      "finalCategoryId": 100535,
      "productId": 483
    },
    {
      "path": [
        "Moteur",
        "Support du moteur",
        "Engine Mounting System"
      ],
      "categoryIds": [
        100002,
        null,
        100535
      ],
      "finalCategoryId": 100535,
      "productId": 247
    },
    {
      "path": [
        "Moteur",
        "Support du moteur",
        "Engine Mounting System"
      ],
      "categoryIds": [
        100002,
        null,
        100535
      ],
      "finalCategoryId": 100535,
      "productId": 3555
    },
    {
      "path": [
        "Moteur",
        "Support du moteur",
        "Engine Mounting System"
      ],
      "categoryIds": [
        100002,
        null,
        100535
      ],
      "finalCategoryId": 100535,
      "productId": 8014
    }
  ],
  "productIdsInArbo": [
    247,
    271,
    483,
    1545,
    3555,
    3871,
    4443,
    4463,
    5147,
    8014,
    9685,
    9808,
    9920,
    60196,
    60736,
    60737,
    60745
  ],
  "matchedProductIds": [
    247
  ]
}