{
  "productName": "Tendeur, courroie trapézoïdale à nervures",
  "searchText": "Tendeur, courroie trapézoïdale à nervures",
  "found": true,
  "hasMatch": true,
  "timestamp": "2025-12-03T07:25:25.780Z",
  "productId": 540,
  "arborescence": {
    "Commande à courroie": {
      "categoryId": 100016,
      "categoryName": "Commande à courroie",
      "level": 1,
      "children": {
        "Jeu/ courroies trapézoïdales à nervures": {
          "categoryId": null,
          "categoryName": "Jeu/ courroies trapézoïdales à nervures",
          "level": 2,
          "children": {
            "Tendeur, courroie trapézoïdale à nervures": {
              "categoryId": 100082,
              "categoryName": "V-Ribbed Belt/Set",
              "level": 2,
              "children": {
                "Bras tendeur": {
                  "categoryId": null,
                  "categoryName": "Bras tendeur",
                  "level": 4,
                  "children": {
                    "Tendeur, courroie trapézoïdale à nervures": {
                      "categoryId": 100438,
                      "categoryName": "Tensioner",
                      "level": 3,
                      "children": [],
                      "productId": 540
                    }
                  }
                }
              },
              "productId": 540
            }
          }
        }
      }
    },
    "Moteur": {
      "categoryId": 100002,
      "categoryName": "Moteur",
      "level": 1,
      "children": {
        "Commande à courroie": {
          "categoryId": null,
          "categoryName": "Commande à courroie",
          "level": 2,
          "children": {
            "Tendeur, courroie trapézoïdale à nervures": {
              "categoryId": 104302,
              "categoryName": "Belt Drive",
              "level": 2,
              "children": {
                "Jeu/ courroies trapézoïdales à nervures": {
                  "categoryId": null,
                  "categoryName": "Jeu/ courroies trapézoïdales à nervures",
                  "level": 4,
                  "children": {
                    "Tendeur, courroie trapézoïdale à nervures": {
                      "categoryId": 104308,
                      "categoryName": "V-Ribbed Belt/Set",
                      "level": 3,
                      "children": {
                        "Bras tendeur": {
                          "categoryId": null,
                          "categoryName": "Bras tendeur",
                          "level": 6,
                          "children": {
                            "Tendeur, courroie trapézoïdale à nervures": {
                              "categoryId": 104313,
                              "categoryName": "Tensioner",
                              "level": 4,
                              "children": [],
                              "productId": 540
                            }
                          }
                        }
                      },
                      "productId": 540
                    }
                  }
                }
              },
              "productId": 540
            }
          }
        }
      }
    }
  },
  "arborescenceText": "├── Commande à courroie [ID: 100016] (Niveau 1)\n│   └── Jeu/ courroies trapézoïdales à nervures (Niveau 2)\n│       └── V-Ribbed Belt/Set [ID: 100082] (Niveau 2) → ProductId: 540\n│           └── Bras tendeur (Niveau 4)\n│               └── Tensioner [ID: 100438] (Niveau 3) → ProductId: 540\n\n└── Moteur [ID: 100002] (Niveau 1)\n    └── Commande à courroie (Niveau 2)\n        └── Belt Drive [ID: 104302] (Niveau 2) → ProductId: 540\n            └── Jeu/ courroies trapézoïdales à nervures (Niveau 4)\n                └── V-Ribbed Belt/Set [ID: 104308] (Niveau 3) → ProductId: 540\n                    └── Bras tendeur (Niveau 6)\n                        └── Tensioner [ID: 104313] (Niveau 4) → ProductId: 540",
  "arborescencePaths": [
    {
      "path": [
        "Commande à courroie",
        "Jeu/ courroies trapézoïdales à nervures",
        "V-Ribbed Belt/Set"
      ],
      "categoryIds": [
        100016,
        null,
        100082
      ],
      "finalCategoryId": 100082,
      "productId": 540
    },
    {
      "path": [
        "Moteur",
        "Commande à courroie",
        "Belt Drive"
      ],
      "categoryIds": [
        100002,
        null,
        104302
      ],
      "finalCategoryId": 104302,
      "productId": 540
    }
  ],
  "productIdsInArbo": [
    540
  ],
  "matchedProductIds": [
    540
  ]
}