{
  "productName": "Transmetteur de pression, contrôle des gaz d'échappement",
  "searchText": "Transmetteur de pression, contrôle des gaz d'échappement",
  "found": true,
  "hasMatch": true,
  "timestamp": "2025-12-03T07:27:07.069Z",
  "productId": 1134,
  "arborescence": {
    "Carburation": {
      "categoryId": 100254,
      "categoryName": "Carburation",
      "level": 1,
      "children": {
        "Épuration des gaz d'échappement": {
          "categoryId": null,
          "categoryName": "Épuration des gaz d'échappement",
          "level": 2,
          "children": {
            "Transmetteur de pression, contrôle des gaz d'échappement": {
              "categoryId": 100790,
              "categoryName": "Exhaust Emission Control",
              "level": 2,
              "children": {
                "Recyclage des gaz d'échappement": {
                  "categoryId": null,
                  "categoryName": "Recyclage des gaz d'échappement",
                  "level": 4,
                  "children": {
                    "Transmetteur de pression, contrôle des gaz d'échappement": {
                      "categoryId": 100791,
                      "categoryName": "Exhaust Gas Recirculation",
                      "level": 3,
                      "children": {
                        "Transmetteur de pression": {
                          "categoryId": null,
                          "categoryName": "Transmetteur de pression",
                          "level": 6,
                          "children": {
                            "Transmetteur de pression, contrôle des gaz d'échappement": {
                              "categoryId": 100812,
                              "categoryName": "EGR Pressure Transducer",
                              "level": 4,
                              "children": [],
                              "productId": 1134
                            }
                          }
                        }
                      },
                      "productId": 1134
                    }
                  }
                }
              },
              "productId": 1134
            }
          }
        }
      }
    },
    "Moteur": {
      "categoryId": 100002,
      "categoryName": "Moteur",
      "level": 1,
      "children": {
        "Épuration des gaz d'échappement": {
          "categoryId": null,
          "categoryName": "Épuration des gaz d'échappement",
          "level": 2,
          "children": {
            "Transmetteur de pression, contrôle des gaz d'échappement": {
              "categoryId": 100541,
              "categoryName": "Exhaust Emission Control",
              "level": 2,
              "children": {
                "Recyclage des gaz d'échappement": {
                  "categoryId": null,
                  "categoryName": "Recyclage des gaz d'échappement",
                  "level": 4,
                  "children": {
                    "Transmetteur de pression, contrôle des gaz d'échappement": {
                      "categoryId": 100542,
                      "categoryName": "Exhaust Gas Recirculation",
                      "level": 3,
                      "children": {
                        "Transmetteur de pression": {
                          "categoryId": null,
                          "categoryName": "Transmetteur de pression",
                          "level": 6,
                          "children": {
                            "Transmetteur de pression, contrôle des gaz d'échappement": {
                              "categoryId": 100543,
                              "categoryName": "Pressure Transducer",
                              "level": 4,
                              "children": [],
                              "productId": 1134
                            }
                          }
                        }
                      },
                      "productId": 1134
                    }
                  }
                }
              },
              "productId": 1134
            }
          }
        }
      }
    }
  },
  "arborescenceText": "├── Carburation [ID: 100254] (Niveau 1)\n│   └── Épuration des gaz d'échappement (Niveau 2)\n│       └── Exhaust Emission Control [ID: 100790] (Niveau 2) → ProductId: 1134\n│           └── Recyclage des gaz d'échappement (Niveau 4)\n│               └── Exhaust Gas Recirculation [ID: 100791] (Niveau 3) → ProductId: 1134\n│                   └── Transmetteur de pression (Niveau 6)\n│                       └── EGR Pressure Transducer [ID: 100812] (Niveau 4) → ProductId: 1134\n\n└── Moteur [ID: 100002] (Niveau 1)\n    └── Épuration des gaz d'échappement (Niveau 2)\n        └── Exhaust Emission Control [ID: 100541] (Niveau 2) → ProductId: 1134\n            └── Recyclage des gaz d'échappement (Niveau 4)\n                └── Exhaust Gas Recirculation [ID: 100542] (Niveau 3) → ProductId: 1134\n                    └── Transmetteur de pression (Niveau 6)\n                        └── Pressure Transducer [ID: 100543] (Niveau 4) → ProductId: 1134",
  "arborescencePaths": [
    {
      "path": [
        "Carburation",
        "Épuration des gaz d'échappement",
        "Exhaust Emission Control"
      ],
      "categoryIds": [
        100254,
        null,
        100790
      ],
      "finalCategoryId": 100790,
      "productId": 1134
    },
    {
      "path": [
        "Moteur",
        "Épuration des gaz d'échappement",
        "Exhaust Emission Control"
      ],
      "categoryIds": [
        100002,
        null,
        100541
      ],
      "finalCategoryId": 100541,
      "productId": 1134
    }
  ],
  "productIdsInArbo": [
    1134
  ],
  "matchedProductIds": [
    1134
  ]
}