{
  "productName": "Transmetteur de pression",
  "searchText": "Transmetteur de pression",
  "found": true,
  "hasMatch": true,
  "timestamp": "2025-12-03T07:27:04.808Z",
  "productId": 170,
  "arborescence": {
    "Carburation": {
      "categoryId": 100254,
      "categoryName": "Carburation",
      "level": 1,
      "children": {
        "Épuration des gaz d'échappement": {
          "categoryId": null,
          "categoryName": "Épuration des gaz d'échappement",
          "level": 2,
          "children": {
            "Kit réparation de câble, transmetteur de pression": {
              "categoryId": 100790,
              "categoryName": "Exhaust Emission Control",
              "level": 2,
              "children": {
                "Injection d'air secondaire": {
                  "categoryId": null,
                  "categoryName": "Injection d'air secondaire",
                  "level": 4,
                  "children": {
                    "Kit réparation de câble, transmetteur de pression": {
                      "categoryId": 100792,
                      "categoryName": "Secondary Air Injection",
                      "level": 3,
                      "children": {
                        "Kits de réparation pour câbles": {
                          "categoryId": null,
                          "categoryName": "Kits de réparation pour câbles",
                          "level": 6,
                          "children": {
                            "Kit réparation de câble, transmetteur de pression": {
                              "categoryId": 706503,
                              "categoryName": "Cable Repair Set",
                              "level": 4,
                              "children": [],
                              "productId": 9906
                            }
                          }
                        }
                      },
                      "productId": 9906
                    }
                  }
                },
                "Recyclage des gaz d'échappement": {
                  "categoryId": null,
                  "categoryName": "Recyclage des gaz d'échappement",
                  "level": 4,
                  "children": {
                    "Kit réparation de câble, transmetteur de pression": {
                      "categoryId": 100791,
                      "categoryName": "Exhaust Gas Recirculation",
                      "level": 3,
                      "children": {
                        "Transmetteur de pression": {
                          "categoryId": null,
                          "categoryName": "Transmetteur de pression",
                          "level": 6,
                          "children": {
                            "Kit réparation de câble, transmetteur de pression": {
                              "categoryId": 100812,
                              "categoryName": "EGR Pressure Transducer",
                              "level": 4,
                              "children": [],
                              "productId": 9213
                            }
                          }
                        }
                      },
                      "productId": 9213
                    }
                  }
                }
              },
              "productId": 9906
            },
            "Transmetteur de pression": {
              "categoryId": 100790,
              "categoryName": "Exhaust Emission Control",
              "level": 2,
              "children": {
                "Recyclage des gaz d'échappement": {
                  "categoryId": null,
                  "categoryName": "Recyclage des gaz d'échappement",
                  "level": 4,
                  "children": {
                    "Transmetteur de pression": {
                      "categoryId": 100791,
                      "categoryName": "Exhaust Gas Recirculation",
                      "level": 3,
                      "children": {
                        "Transmetteur de pression": {
                          "categoryId": null,
                          "categoryName": "Transmetteur de pression",
                          "level": 6,
                          "children": {
                            "Transmetteur de pression": {
                              "categoryId": 100812,
                              "categoryName": "EGR Pressure Transducer",
                              "level": 4,
                              "children": [],
                              "productId": 170
                            }
                          }
                        }
                      },
                      "productId": 170
                    }
                  }
                }
              },
              "productId": 170
            },
            "Transmetteur de pression, contrôle des gaz d'échappement": {
              "categoryId": 100790,
              "categoryName": "Exhaust Emission Control",
              "level": 2,
              "children": {
                "Recyclage des gaz d'échappement": {
                  "categoryId": null,
                  "categoryName": "Recyclage des gaz d'échappement",
                  "level": 4,
                  "children": {
                    "Transmetteur de pression, contrôle des gaz d'échappement": {
                      "categoryId": 100791,
                      "categoryName": "Exhaust Gas Recirculation",
                      "level": 3,
                      "children": {
                        "Transmetteur de pression": {
                          "categoryId": null,
                          "categoryName": "Transmetteur de pression",
                          "level": 6,
                          "children": {
                            "Transmetteur de pression, contrôle des gaz d'échappement": {
                              "categoryId": 100812,
                              "categoryName": "EGR Pressure Transducer",
                              "level": 4,
                              "children": [],
                              "productId": 1134
                            }
                          }
                        }
                      },
                      "productId": 1134
                    }
                  }
                }
              },
              "productId": 1134
            }
          }
        },
        "Mélange air-carburant": {
          "categoryId": null,
          "categoryName": "Mélange air-carburant",
          "level": 2,
          "children": {
            "Capteur de pression, actionneur (papillon)": {
              "categoryId": 102793,
              "categoryName": "Mixture Formation",
              "level": 2,
              "children": {
                "Papillon des gaz / tubulure / tuyau de dépression": {
                  "categoryId": null,
                  "categoryName": "Papillon des gaz / tubulure / tuyau de dépression",
                  "level": 4,
                  "children": {
                    "Capteur de pression, actionneur (papillon)": {
                      "categoryId": 102796,
                      "categoryName": "Throttle Valve/Throttle Body/Vacuum Pipe",
                      "level": 3,
                      "children": [],
                      "productId": 6102
                    }
                  }
                },
                "Transmetteur de pression": {
                  "categoryId": null,
                  "categoryName": "Transmetteur de pression",
                  "level": 4,
                  "children": {
                    "Capteur de pression, actionneur (papillon)": {
                      "categoryId": 104704,
                      "categoryName": "Pressure Transducer",
                      "level": 3,
                      "children": [],
                      "productId": 6102
                    }
                  }
                }
              },
              "productId": 6102
            },
            "Kit réparation de câble, papillon capteur de pression": {
              "categoryId": 102793,
              "categoryName": "Mixture Formation",
              "level": 2,
              "children": {
                "Papillon des gaz / tubulure / tuyau de dépression": {
                  "categoryId": null,
                  "categoryName": "Papillon des gaz / tubulure / tuyau de dépression",
                  "level": 4,
                  "children": {
                    "Kit réparation de câble, papillon capteur de pression": {
                      "categoryId": 102796,
                      "categoryName": "Throttle Valve/Throttle Body/Vacuum Pipe",
                      "level": 3,
                      "children": [],
                      "productId": 9693
                    }
                  }
                },
                "Transmetteur de pression": {
                  "categoryId": null,
                  "categoryName": "Transmetteur de pression",
                  "level": 4,
                  "children": {
                    "Kit réparation de câble, papillon capteur de pression": {
                      "categoryId": 104704,
                      "categoryName": "Pressure Transducer",
                      "level": 3,
                      "children": [],
                      "productId": 9693
                    }
                  }
                }
              },
              "productId": 9693
            }
          }
        }
      }
    },
    "Chauffage / Ventilation": {
      "categoryId": 100241,
      "categoryName": "Chauffage / Ventilation",
      "level": 1,
      "children": {
        "Régulation/soupapes": {
          "categoryId": null,
          "categoryName": "Régulation/soupapes",
          "level": 2,
          "children": {
            "Transmetteur de pression, vanne régul. liquide de refroid.": {
              "categoryId": 102219,
              "categoryName": "Valves/Controls",
              "level": 2,
              "children": [],
              "productId": 9297
            }
          }
        }
      }
    },
    "Échappement": {
      "categoryId": 100004,
      "categoryName": "Échappement",
      "level": 1,
      "children": {
        "Clapet de gaz d'échappement": {
          "categoryId": null,
          "categoryName": "Clapet de gaz d'échappement",
          "level": 2,
          "children": {
            "Capteur de pression, commande volets d’échappement": {
              "categoryId": 102451,
              "categoryName": "Exhaust Gas Door",
              "level": 2,
              "children": [],
              "productId": 9609
            }
          }
        },
        "Turbocompresseur": {
          "categoryId": null,
          "categoryName": "Turbocompresseur",
          "level": 2,
          "children": {
            "Capteur de pression, turbocompresseur": {
              "categoryId": 100872,
              "categoryName": "Charger",
              "level": 2,
              "children": [],
              "productId": 3553
            }
          }
        }
      }
    },
    "Moteur": {
      "categoryId": 100002,
      "categoryName": "Moteur",
      "level": 1,
      "children": {
        "Alimentation en air": {
          "categoryId": null,
          "categoryName": "Alimentation en air",
          "level": 2,
          "children": {
            "Capteur de pression, turbocompresseur": {
              "categoryId": 100383,
              "categoryName": "Air Supply",
              "level": 2,
              "children": {
                "Suralimentation": {
                  "categoryId": null,
                  "categoryName": "Suralimentation",
                  "level": 4,
                  "children": {
                    "Capteur de pression, turbocompresseur": {
                      "categoryId": 100390,
                      "categoryName": "Charging (supercharged/turbocharged)",
                      "level": 3,
                      "children": {
                        "Compresseur/composants": {
                          "categoryId": null,
                          "categoryName": "Compresseur/composants",
                          "level": 6,
                          "children": {
                            "Capteur de pression, turbocompresseur": {
                              "categoryId": 100391,
                              "categoryName": "Charger/-parts",
                              "level": 4,
                              "children": [],
                              "productId": 3553
                            }
                          }
                        }
                      },
                      "productId": 3553
                    }
                  }
                }
              },
              "productId": 3553
            },
            "Transmetteur de pression, tube d'admission": {
              "categoryId": 100383,
              "categoryName": "Air Supply",
              "level": 2,
              "children": {
                "Collecteur d'admission/Tuyau": {
                  "categoryId": null,
                  "categoryName": "Collecteur d'admission/Tuyau",
                  "level": 4,
                  "children": {
                    "Transmetteur de pression, tube d'admission": {
                      "categoryId": 100386,
                      "categoryName": "Intake Manifold",
                      "level": 3,
                      "children": [],
                      "productId": 4808
                    }
                  }
                }
              },
              "productId": 4808
            }
          }
        },
        "Épuration des gaz d'échappement": {
          "categoryId": null,
          "categoryName": "Épuration des gaz d'échappement",
          "level": 2,
          "children": {
            "Kit réparation de câble, transmetteur de pression": {
              "categoryId": 100541,
              "categoryName": "Exhaust Emission Control",
              "level": 2,
              "children": {
                "Injection d'air secondaire": {
                  "categoryId": null,
                  "categoryName": "Injection d'air secondaire",
                  "level": 4,
                  "children": {
                    "Kit réparation de câble, transmetteur de pression": {
                      "categoryId": 100552,
                      "categoryName": "Secondary Air Injection",
                      "level": 3,
                      "children": {
                        "Kits de réparation pour câbles": {
                          "categoryId": null,
                          "categoryName": "Kits de réparation pour câbles",
                          "level": 6,
                          "children": {
                            "Kit réparation de câble, transmetteur de pression": {
                              "categoryId": 706502,
                              "categoryName": "Cable Repair Set",
                              "level": 4,
                              "children": [],
                              "productId": 9906
                            }
                          }
                        }
                      },
                      "productId": 9906
                    }
                  }
                },
                "Recyclage des gaz d'échappement": {
                  "categoryId": null,
                  "categoryName": "Recyclage des gaz d'échappement",
                  "level": 4,
                  "children": {
                    "Kit réparation de câble, transmetteur de pression": {
                      "categoryId": 100542,
                      "categoryName": "Exhaust Gas Recirculation",
                      "level": 3,
                      "children": {
                        "Transmetteur de pression": {
                          "categoryId": null,
                          "categoryName": "Transmetteur de pression",
                          "level": 6,
                          "children": {
                            "Kit réparation de câble, transmetteur de pression": {
                              "categoryId": 100543,
                              "categoryName": "Pressure Transducer",
                              "level": 4,
                              "children": [],
                              "productId": 9213
                            }
                          }
                        }
                      },
                      "productId": 9213
                    }
                  }
                }
              },
              "productId": 9906
            },
            "Transmetteur de pression": {
              "categoryId": 100541,
              "categoryName": "Exhaust Emission Control",
              "level": 2,
              "children": {
                "Recyclage des gaz d'échappement": {
                  "categoryId": null,
                  "categoryName": "Recyclage des gaz d'échappement",
                  "level": 4,
                  "children": {
                    "Transmetteur de pression": {
                      "categoryId": 100542,
                      "categoryName": "Exhaust Gas Recirculation",
                      "level": 3,
                      "children": {
                        "Transmetteur de pression": {
                          "categoryId": null,
                          "categoryName": "Transmetteur de pression",
                          "level": 6,
                          "children": {
                            "Transmetteur de pression": {
                              "categoryId": 100543,
                              "categoryName": "Pressure Transducer",
                              "level": 4,
                              "children": [],
                              "productId": 170
                            }
                          }
                        }
                      },
                      "productId": 170
                    }
                  }
                }
              },
              "productId": 170
            },
            "Transmetteur de pression, contrôle des gaz d'échappement": {
              "categoryId": 100541,
              "categoryName": "Exhaust Emission Control",
              "level": 2,
              "children": {
                "Recyclage des gaz d'échappement": {
                  "categoryId": null,
                  "categoryName": "Recyclage des gaz d'échappement",
                  "level": 4,
                  "children": {
                    "Transmetteur de pression, contrôle des gaz d'échappement": {
                      "categoryId": 100542,
                      "categoryName": "Exhaust Gas Recirculation",
                      "level": 3,
                      "children": {
                        "Transmetteur de pression": {
                          "categoryId": null,
                          "categoryName": "Transmetteur de pression",
                          "level": 6,
                          "children": {
                            "Transmetteur de pression, contrôle des gaz d'échappement": {
                              "categoryId": 100543,
                              "categoryName": "Pressure Transducer",
                              "level": 4,
                              "children": [],
                              "productId": 1134
                            }
                          }
                        }
                      },
                      "productId": 1134
                    }
                  }
                }
              },
              "productId": 1134
            }
          }
        }
      }
    }
  },
  "arborescenceText": "├── Carburation [ID: 100254] (Niveau 1)\n│   ├── Épuration des gaz d'échappement (Niveau 2)\n│   │   ├── Exhaust Emission Control [ID: 100790] (Niveau 2) → ProductId: 9906\n│   │   │   ├── Injection d'air secondaire (Niveau 4)\n│   │   │   │   └── Secondary Air Injection [ID: 100792] (Niveau 3) → ProductId: 9906\n│   │   │   │       └── Kits de réparation pour câbles (Niveau 6)\n│   │   │   │           └── Cable Repair Set [ID: 706503] (Niveau 4) → ProductId: 9906\n│   │   │   └── Recyclage des gaz d'échappement (Niveau 4)\n│   │   │       └── Exhaust Gas Recirculation [ID: 100791] (Niveau 3) → ProductId: 9213\n│   │   │           └── Transmetteur de pression (Niveau 6)\n│   │   │               └── EGR Pressure Transducer [ID: 100812] (Niveau 4) → ProductId: 9213\n│   │   ├── Exhaust Emission Control [ID: 100790] (Niveau 2) → ProductId: 170\n│   │   │   └── Recyclage des gaz d'échappement (Niveau 4)\n│   │   │       └── Exhaust Gas Recirculation [ID: 100791] (Niveau 3) → ProductId: 170\n│   │   │           └── Transmetteur de pression (Niveau 6)\n│   │   │               └── EGR Pressure Transducer [ID: 100812] (Niveau 4) → ProductId: 170\n│   │   └── Exhaust Emission Control [ID: 100790] (Niveau 2) → ProductId: 1134\n│   │       └── Recyclage des gaz d'échappement (Niveau 4)\n│   │           └── Exhaust Gas Recirculation [ID: 100791] (Niveau 3) → ProductId: 1134\n│   │               └── Transmetteur de pression (Niveau 6)\n│   │                   └── EGR Pressure Transducer [ID: 100812] (Niveau 4) → ProductId: 1134\n│   └── Mélange air-carburant (Niveau 2)\n│       ├── Mixture Formation [ID: 102793] (Niveau 2) → ProductId: 6102\n│       │   ├── Papillon des gaz / tubulure / tuyau de dépression (Niveau 4)\n│       │   │   └── Throttle Valve/Throttle Body/Vacuum Pipe [ID: 102796] (Niveau 3) → ProductId: 6102\n│       │   └── Transmetteur de pression (Niveau 4)\n│       │       └── Pressure Transducer [ID: 104704] (Niveau 3) → ProductId: 6102\n│       └── Mixture Formation [ID: 102793] (Niveau 2) → ProductId: 9693\n│           ├── Papillon des gaz / tubulure / tuyau de dépression (Niveau 4)\n│           │   └── Throttle Valve/Throttle Body/Vacuum Pipe [ID: 102796] (Niveau 3) → ProductId: 9693\n│           └── Transmetteur de pression (Niveau 4)\n│               └── Pressure Transducer [ID: 104704] (Niveau 3) → ProductId: 9693\n\n├── Chauffage / Ventilation [ID: 100241] (Niveau 1)\n│   └── Régulation/soupapes (Niveau 2)\n│       └── Valves/Controls [ID: 102219] (Niveau 2) → ProductId: 9297\n\n├── Échappement [ID: 100004] (Niveau 1)\n│   ├── Clapet de gaz d'échappement (Niveau 2)\n│   │   └── Exhaust Gas Door [ID: 102451] (Niveau 2) → ProductId: 9609\n│   └── Turbocompresseur (Niveau 2)\n│       └── Charger [ID: 100872] (Niveau 2) → ProductId: 3553\n\n└── Moteur [ID: 100002] (Niveau 1)\n    ├── Alimentation en air (Niveau 2)\n    │   ├── Air Supply [ID: 100383] (Niveau 2) → ProductId: 3553\n    │   │   └── Suralimentation (Niveau 4)\n    │   │       └── Charging (supercharged/turbocharged) [ID: 100390] (Niveau 3) → ProductId: 3553\n    │   │           └── Compresseur/composants (Niveau 6)\n    │   │               └── Charger/-parts [ID: 100391] (Niveau 4) → ProductId: 3553\n    │   └── Air Supply [ID: 100383] (Niveau 2) → ProductId: 4808\n    │       └── Collecteur d'admission/Tuyau (Niveau 4)\n    │           └── Intake Manifold [ID: 100386] (Niveau 3) → ProductId: 4808\n    └── Épuration des gaz d'échappement (Niveau 2)\n        ├── Exhaust Emission Control [ID: 100541] (Niveau 2) → ProductId: 9906\n        │   ├── Injection d'air secondaire (Niveau 4)\n        │   │   └── Secondary Air Injection [ID: 100552] (Niveau 3) → ProductId: 9906\n        │   │       └── Kits de réparation pour câbles (Niveau 6)\n        │   │           └── Cable Repair Set [ID: 706502] (Niveau 4) → ProductId: 9906\n        │   └── Recyclage des gaz d'échappement (Niveau 4)\n        │       └── Exhaust Gas Recirculation [ID: 100542] (Niveau 3) → ProductId: 9213\n        │           └── Transmetteur de pression (Niveau 6)\n        │               └── Pressure Transducer [ID: 100543] (Niveau 4) → ProductId: 9213\n        ├── Exhaust Emission Control [ID: 100541] (Niveau 2) → ProductId: 170\n        │   └── Recyclage des gaz d'échappement (Niveau 4)\n        │       └── Exhaust Gas Recirculation [ID: 100542] (Niveau 3) → ProductId: 170\n        │           └── Transmetteur de pression (Niveau 6)\n        │               └── Pressure Transducer [ID: 100543] (Niveau 4) → ProductId: 170\n        └── Exhaust Emission Control [ID: 100541] (Niveau 2) → ProductId: 1134\n            └── Recyclage des gaz d'échappement (Niveau 4)\n                └── Exhaust Gas Recirculation [ID: 100542] (Niveau 3) → ProductId: 1134\n                    └── Transmetteur de pression (Niveau 6)\n                        └── Pressure Transducer [ID: 100543] (Niveau 4) → ProductId: 1134",
  "arborescencePaths": [
    {
      "path": [
        "Carburation",
        "Épuration des gaz d'échappement",
        "Exhaust Emission Control"
      ],
      "categoryIds": [
        100254,
        null,
        100790
      ],
      "finalCategoryId": 100790,
      "productId": 9906
    },
    {
      "path": [
        "Carburation",
        "Épuration des gaz d'échappement",
        "Exhaust Emission Control"
      ],
      "categoryIds": [
        100254,
        null,
        100790
      ],
      "finalCategoryId": 100790,
      "productId": 170
    },
    {
      "path": [
        "Carburation",
        "Épuration des gaz d'échappement",
        "Exhaust Emission Control"
      ],
      "categoryIds": [
        100254,
        null,
        100790
      ],
      "finalCategoryId": 100790,
      "productId": 1134
    },
    {
      "path": [
        "Carburation",
        "Mélange air-carburant",
        "Mixture Formation"
      ],
      "categoryIds": [
        100254,
        null,
        102793
      ],
      "finalCategoryId": 102793,
      "productId": 6102
    },
    {
      "path": [
        "Carburation",
        "Mélange air-carburant",
        "Mixture Formation"
      ],
      "categoryIds": [
        100254,
        null,
        102793
      ],
      "finalCategoryId": 102793,
      "productId": 9693
    },
    {
      "path": [
        "Chauffage / Ventilation",
        "Régulation/soupapes",
        "Valves/Controls"
      ],
      "categoryIds": [
        100241,
        null,
        102219
      ],
      "finalCategoryId": 102219,
      "productId": 9297
    },
    {
      "path": [
        "Échappement",
        "Clapet de gaz d'échappement",
        "Exhaust Gas Door"
      ],
      "categoryIds": [
        100004,
        null,
        102451
      ],
      "finalCategoryId": 102451,
      "productId": 9609
    },
    {
      "path": [
        "Échappement",
        "Turbocompresseur",
        "Charger"
      ],
      "categoryIds": [
        100004,
        null,
        100872
      ],
      "finalCategoryId": 100872,
      "productId": 3553
    },
    {
      "path": [
        "Moteur",
        "Alimentation en air",
        "Air Supply"
      ],
      "categoryIds": [
        100002,
        null,
        100383
      ],
      "finalCategoryId": 100383,
      "productId": 3553
    },
    {
      "path": [
        "Moteur",
        "Alimentation en air",
        "Air Supply"
      ],
      "categoryIds": [
        100002,
        null,
        100383
      ],
      "finalCategoryId": 100383,
      "productId": 4808
    },
    {
      "path": [
        "Moteur",
        "Épuration des gaz d'échappement",
        "Exhaust Emission Control"
      ],
      "categoryIds": [
        100002,
        null,
        100541
      ],
      "finalCategoryId": 100541,
      "productId": 9906
    },
    {
      "path": [
        "Moteur",
        "Épuration des gaz d'échappement",
        "Exhaust Emission Control"
      ],
      "categoryIds": [
        100002,
        null,
        100541
      ],
      "finalCategoryId": 100541,
      "productId": 170
    },
    {
      "path": [
        "Moteur",
        "Épuration des gaz d'échappement",
        "Exhaust Emission Control"
      ],
      "categoryIds": [
        100002,
        null,
        100541
      ],
      "finalCategoryId": 100541,
      "productId": 1134
    }
  ],
  "productIdsInArbo": [
    170,
    1134,
    3553,
    4808,
    6102,
    9213,
    9297,
    9609,
    9693,
    9906
  ],
  "matchedProductIds": [
    170
  ]
}