{
  "productName": "Tuyauterie, vanne EGR",
  "searchText": "Tuyauterie, vanne EGR",
  "found": true,
  "hasMatch": true,
  "timestamp": "2025-12-03T07:29:30.549Z",
  "productId": 4179,
  "arborescence": {
    "Carburation": {
      "categoryId": 100254,
      "categoryName": "Carburation",
      "level": 1,
      "children": {
        "Épuration des gaz d'échappement": {
          "categoryId": null,
          "categoryName": "Épuration des gaz d'échappement",
          "level": 2,
          "children": {
            "Tuyauterie, vanne EGR": {
              "categoryId": 100790,
              "categoryName": "Exhaust Emission Control",
              "level": 2,
              "children": {
                "Recyclage des gaz d'échappement": {
                  "categoryId": null,
                  "categoryName": "Recyclage des gaz d'échappement",
                  "level": 4,
                  "children": {
                    "Tuyauterie, vanne EGR": {
                      "categoryId": 100791,
                      "categoryName": "Exhaust Gas Recirculation",
                      "level": 3,
                      "children": {
                        "Vanne EGR/Tube d'aspiration": {
                          "categoryId": null,
                          "categoryName": "Vanne EGR/Tube d'aspiration",
                          "level": 6,
                          "children": {
                            "Tuyauterie, vanne EGR": {
                              "categoryId": 100811,
                              "categoryName": "EGR Valve/Intake Manifold",
                              "level": 4,
                              "children": [],
                              "productId": 4179
                            }
                          }
                        }
                      },
                      "productId": 4179
                    }
                  }
                }
              },
              "productId": 4179
            }
          }
        }
      }
    },
    "Moteur": {
      "categoryId": 100002,
      "categoryName": "Moteur",
      "level": 1,
      "children": {
        "Épuration des gaz d'échappement": {
          "categoryId": null,
          "categoryName": "Épuration des gaz d'échappement",
          "level": 2,
          "children": {
            "Tuyauterie, vanne EGR": {
              "categoryId": 100541,
              "categoryName": "Exhaust Emission Control",
              "level": 2,
              "children": {
                "Recyclage des gaz d'échappement": {
                  "categoryId": null,
                  "categoryName": "Recyclage des gaz d'échappement",
                  "level": 4,
                  "children": {
                    "Tuyauterie, vanne EGR": {
                      "categoryId": 100542,
                      "categoryName": "Exhaust Gas Recirculation",
                      "level": 3,
                      "children": {
                        "Vanne EGR/Tube d'aspiration": {
                          "categoryId": null,
                          "categoryName": "Vanne EGR/Tube d'aspiration",
                          "level": 6,
                          "children": {
                            "Tuyauterie, vanne EGR": {
                              "categoryId": 100551,
                              "categoryName": "EGR Valve/Intake Manifold",
                              "level": 4,
                              "children": [],
                              "productId": 4179
                            }
                          }
                        }
                      },
                      "productId": 4179
                    }
                  }
                }
              },
              "productId": 4179
            }
          }
        }
      }
    }
  },
  "arborescenceText": "├── Carburation [ID: 100254] (Niveau 1)\n│   └── Épuration des gaz d'échappement (Niveau 2)\n│       └── Exhaust Emission Control [ID: 100790] (Niveau 2) → ProductId: 4179\n│           └── Recyclage des gaz d'échappement (Niveau 4)\n│               └── Exhaust Gas Recirculation [ID: 100791] (Niveau 3) → ProductId: 4179\n│                   └── Vanne EGR/Tube d'aspiration (Niveau 6)\n│                       └── EGR Valve/Intake Manifold [ID: 100811] (Niveau 4) → ProductId: 4179\n\n└── Moteur [ID: 100002] (Niveau 1)\n    └── Épuration des gaz d'échappement (Niveau 2)\n        └── Exhaust Emission Control [ID: 100541] (Niveau 2) → ProductId: 4179\n            └── Recyclage des gaz d'échappement (Niveau 4)\n                └── Exhaust Gas Recirculation [ID: 100542] (Niveau 3) → ProductId: 4179\n                    └── Vanne EGR/Tube d'aspiration (Niveau 6)\n                        └── EGR Valve/Intake Manifold [ID: 100551] (Niveau 4) → ProductId: 4179",
  "arborescencePaths": [
    {
      "path": [
        "Carburation",
        "Épuration des gaz d'échappement",
        "Exhaust Emission Control"
      ],
      "categoryIds": [
        100254,
        null,
        100790
      ],
      "finalCategoryId": 100790,
      "productId": 4179
    },
    {
      "path": [
        "Moteur",
        "Épuration des gaz d'échappement",
        "Exhaust Emission Control"
      ],
      "categoryIds": [
        100002,
        null,
        100541
      ],
      "finalCategoryId": 100541,
      "productId": 4179
    }
  ],
  "productIdsInArbo": [
    4179
  ],
  "matchedProductIds": [
    4179
  ]
}