{
  "productName": "Valve de commande par dépression, réaspiration des gaz",
  "searchText": "Valve de commande par dépression, réaspiration des gaz",
  "found": true,
  "hasMatch": true,
  "timestamp": "2025-12-03T07:31:11.573Z",
  "productId": 758,
  "arborescence": {
    "Carburation": {
      "categoryId": 100254,
      "categoryName": "Carburation",
      "level": 1,
      "children": {
        "Épuration des gaz d'échappement": {
          "categoryId": null,
          "categoryName": "Épuration des gaz d'échappement",
          "level": 2,
          "children": {
            "Valve de commande par dépression, réaspiration des gaz": {
              "categoryId": 100790,
              "categoryName": "Exhaust Emission Control",
              "level": 2,
              "children": {
                "Recyclage des gaz d'échappement": {
                  "categoryId": null,
                  "categoryName": "Recyclage des gaz d'échappement",
                  "level": 4,
                  "children": {
                    "Valve de commande par dépression, réaspiration des gaz": {
                      "categoryId": 100791,
                      "categoryName": "Exhaust Gas Recirculation",
                      "level": 3,
                      "children": {
                        "Soupape de commande à dépression": {
                          "categoryId": null,
                          "categoryName": "Soupape de commande à dépression",
                          "level": 6,
                          "children": {
                            "Valve de commande par dépression, réaspiration des gaz": {
                              "categoryId": 103240,
                              "categoryName": "Vacuum Control Valve",
                              "level": 4,
                              "children": [],
                              "productId": 758
                            }
                          }
                        }
                      },
                      "productId": 758
                    }
                  }
                }
              },
              "productId": 758
            }
          }
        }
      }
    },
    "Moteur": {
      "categoryId": 100002,
      "categoryName": "Moteur",
      "level": 1,
      "children": {
        "Épuration des gaz d'échappement": {
          "categoryId": null,
          "categoryName": "Épuration des gaz d'échappement",
          "level": 2,
          "children": {
            "Valve de commande par dépression, réaspiration des gaz": {
              "categoryId": 100541,
              "categoryName": "Exhaust Emission Control",
              "level": 2,
              "children": {
                "Recyclage des gaz d'échappement": {
                  "categoryId": null,
                  "categoryName": "Recyclage des gaz d'échappement",
                  "level": 4,
                  "children": {
                    "Valve de commande par dépression, réaspiration des gaz": {
                      "categoryId": 100542,
                      "categoryName": "Exhaust Gas Recirculation",
                      "level": 3,
                      "children": {
                        "Soupape de commande par dépression": {
                          "categoryId": null,
                          "categoryName": "Soupape de commande par dépression",
                          "level": 6,
                          "children": {
                            "Valve de commande par dépression, réaspiration des gaz": {
                              "categoryId": 103236,
                              "categoryName": "EGR Vacuum Control Valve",
                              "level": 4,
                              "children": [],
                              "productId": 758
                            }
                          }
                        }
                      },
                      "productId": 758
                    }
                  }
                }
              },
              "productId": 758
            }
          }
        }
      }
    }
  },
  "arborescenceText": "├── Carburation [ID: 100254] (Niveau 1)\n│   └── Épuration des gaz d'échappement (Niveau 2)\n│       └── Exhaust Emission Control [ID: 100790] (Niveau 2) → ProductId: 758\n│           └── Recyclage des gaz d'échappement (Niveau 4)\n│               └── Exhaust Gas Recirculation [ID: 100791] (Niveau 3) → ProductId: 758\n│                   └── Soupape de commande à dépression (Niveau 6)\n│                       └── Vacuum Control Valve [ID: 103240] (Niveau 4) → ProductId: 758\n\n└── Moteur [ID: 100002] (Niveau 1)\n    └── Épuration des gaz d'échappement (Niveau 2)\n        └── Exhaust Emission Control [ID: 100541] (Niveau 2) → ProductId: 758\n            └── Recyclage des gaz d'échappement (Niveau 4)\n                └── Exhaust Gas Recirculation [ID: 100542] (Niveau 3) → ProductId: 758\n                    └── Soupape de commande par dépression (Niveau 6)\n                        └── EGR Vacuum Control Valve [ID: 103236] (Niveau 4) → ProductId: 758",
  "arborescencePaths": [
    {
      "path": [
        "Carburation",
        "Épuration des gaz d'échappement",
        "Exhaust Emission Control"
      ],
      "categoryIds": [
        100254,
        null,
        100790
      ],
      "finalCategoryId": 100790,
      "productId": 758
    },
    {
      "path": [
        "Moteur",
        "Épuration des gaz d'échappement",
        "Exhaust Emission Control"
      ],
      "categoryIds": [
        100002,
        null,
        100541
      ],
      "finalCategoryId": 100541,
      "productId": 758
    }
  ],
  "productIdsInArbo": [
    758
  ],
  "matchedProductIds": [
    758
  ]
}