{
  "productName": "Vanne EGR",
  "searchText": "Vanne EGR",
  "found": true,
  "hasMatch": true,
  "timestamp": "2025-12-03T07:32:05.702Z",
  "productId": 1145,
  "arborescence": {
    "Carburation": {
      "categoryId": 100254,
      "categoryName": "Carburation",
      "level": 1,
      "children": {
        "Épuration des gaz d'échappement": {
          "categoryId": null,
          "categoryName": "Épuration des gaz d'échappement",
          "level": 2,
          "children": {
            "Attache, vanne EGR": {
              "categoryId": 100790,
              "categoryName": "Exhaust Emission Control",
              "level": 2,
              "children": {
                "Recyclage des gaz d'échappement": {
                  "categoryId": null,
                  "categoryName": "Recyclage des gaz d'échappement",
                  "level": 4,
                  "children": {
                    "Attache, vanne EGR": {
                      "categoryId": 100791,
                      "categoryName": "Exhaust Gas Recirculation",
                      "level": 3,
                      "children": {
                        "Vanne EGR/Tube d'aspiration": {
                          "categoryId": null,
                          "categoryName": "Vanne EGR/Tube d'aspiration",
                          "level": 6,
                          "children": {
                            "Attache, vanne EGR": {
                              "categoryId": 100811,
                              "categoryName": "EGR Valve/Intake Manifold",
                              "level": 4,
                              "children": [],
                              "productId": 4177
                            }
                          }
                        }
                      },
                      "productId": 4177
                    }
                  }
                }
              },
              "productId": 4177
            },
            "Elément de réglage, soupape EGR": {
              "categoryId": 100790,
              "categoryName": "Exhaust Emission Control",
              "level": 2,
              "children": {
                "Recyclage des gaz d'échappement": {
                  "categoryId": null,
                  "categoryName": "Recyclage des gaz d'échappement",
                  "level": 4,
                  "children": {
                    "Elément de réglage, soupape EGR": {
                      "categoryId": 100791,
                      "categoryName": "Exhaust Gas Recirculation",
                      "level": 3,
                      "children": {
                        "Vanne EGR/Tube d'aspiration": {
                          "categoryId": null,
                          "categoryName": "Vanne EGR/Tube d'aspiration",
                          "level": 6,
                          "children": {
                            "Elément de réglage, soupape EGR": {
                              "categoryId": 100811,
                              "categoryName": "EGR Valve/Intake Manifold",
                              "level": 4,
                              "children": [],
                              "productId": 60983
                            }
                          }
                        }
                      },
                      "productId": 60983
                    }
                  }
                }
              },
              "productId": 60983
            },
            "Joint, attache vanne EGR": {
              "categoryId": 100790,
              "categoryName": "Exhaust Emission Control",
              "level": 2,
              "children": {
                "Recyclage des gaz d'échappement": {
                  "categoryId": null,
                  "categoryName": "Recyclage des gaz d'échappement",
                  "level": 4,
                  "children": {
                    "Joint, attache vanne EGR": {
                      "categoryId": 100791,
                      "categoryName": "Exhaust Gas Recirculation",
                      "level": 3,
                      "children": {
                        "Joints": {
                          "categoryId": null,
                          "categoryName": "Joints",
                          "level": 6,
                          "children": {
                            "Joint, attache vanne EGR": {
                              "categoryId": 103239,
                              "categoryName": "Gaskets",
                              "level": 4,
                              "children": [],
                              "productId": 4178
                            }
                          }
                        },
                        "Vanne EGR/Tube d'aspiration": {
                          "categoryId": null,
                          "categoryName": "Vanne EGR/Tube d'aspiration",
                          "level": 6,
                          "children": {
                            "Joint, attache vanne EGR": {
                              "categoryId": 100811,
                              "categoryName": "EGR Valve/Intake Manifold",
                              "level": 4,
                              "children": [],
                              "productId": 4178
                            }
                          }
                        }
                      },
                      "productId": 4178
                    }
                  }
                }
              },
              "productId": 4178
            },
            "Joint, flexible vanne EGR": {
              "categoryId": 100790,
              "categoryName": "Exhaust Emission Control",
              "level": 2,
              "children": {
                "Recyclage des gaz d'échappement": {
                  "categoryId": null,
                  "categoryName": "Recyclage des gaz d'échappement",
                  "level": 4,
                  "children": {
                    "Joint, flexible vanne EGR": {
                      "categoryId": 100791,
                      "categoryName": "Exhaust Gas Recirculation",
                      "level": 3,
                      "children": {
                        "Joints": {
                          "categoryId": null,
                          "categoryName": "Joints",
                          "level": 6,
                          "children": {
                            "Joint, flexible vanne EGR": {
                              "categoryId": 103239,
                              "categoryName": "Gaskets",
                              "level": 4,
                              "children": [],
                              "productId": 4180
                            }
                          }
                        },
                        "Vanne EGR/Tube d'aspiration": {
                          "categoryId": null,
                          "categoryName": "Vanne EGR/Tube d'aspiration",
                          "level": 6,
                          "children": {
                            "Joint, flexible vanne EGR": {
                              "categoryId": 100811,
                              "categoryName": "EGR Valve/Intake Manifold",
                              "level": 4,
                              "children": [],
                              "productId": 4180
                            }
                          }
                        }
                      },
                      "productId": 4180
                    }
                  }
                }
              },
              "productId": 4180
            },
            "Joint, vanne EGR": {
              "categoryId": 100790,
              "categoryName": "Exhaust Emission Control",
              "level": 2,
              "children": {
                "Recyclage des gaz d'échappement": {
                  "categoryId": null,
                  "categoryName": "Recyclage des gaz d'échappement",
                  "level": 4,
                  "children": {
                    "Joint, vanne EGR": {
                      "categoryId": 100791,
                      "categoryName": "Exhaust Gas Recirculation",
                      "level": 3,
                      "children": {
                        "Joints": {
                          "categoryId": null,
                          "categoryName": "Joints",
                          "level": 6,
                          "children": {
                            "Joint, vanne EGR": {
                              "categoryId": 103239,
                              "categoryName": "Gaskets",
                              "level": 4,
                              "children": [],
                              "productId": 3507
                            }
                          }
                        },
                        "Vanne EGR/Tube d'aspiration": {
                          "categoryId": null,
                          "categoryName": "Vanne EGR/Tube d'aspiration",
                          "level": 6,
                          "children": {
                            "Joint, vanne EGR": {
                              "categoryId": 100811,
                              "categoryName": "EGR Valve/Intake Manifold",
                              "level": 4,
                              "children": [],
                              "productId": 3507
                            }
                          }
                        }
                      },
                      "productId": 3507
                    }
                  }
                }
              },
              "productId": 3507
            },
            "Kit de réparation, vanne EGR": {
              "categoryId": 100790,
              "categoryName": "Exhaust Emission Control",
              "level": 2,
              "children": {
                "Recyclage des gaz d'échappement": {
                  "categoryId": null,
                  "categoryName": "Recyclage des gaz d'échappement",
                  "level": 4,
                  "children": {
                    "Kit de réparation, vanne EGR": {
                      "categoryId": 100791,
                      "categoryName": "Exhaust Gas Recirculation",
                      "level": 3,
                      "children": {
                        "Vanne EGR/Tube d'aspiration": {
                          "categoryId": null,
                          "categoryName": "Vanne EGR/Tube d'aspiration",
                          "level": 6,
                          "children": {
                            "Kit de réparation, vanne EGR": {
                              "categoryId": 100811,
                              "categoryName": "EGR Valve/Intake Manifold",
                              "level": 4,
                              "children": [],
                              "productId": 60001
                            }
                          }
                        }
                      },
                      "productId": 60001
                    }
                  }
                }
              },
              "productId": 60001
            },
            "Kit réparation de câble, vanne EGR": {
              "categoryId": 100790,
              "categoryName": "Exhaust Emission Control",
              "level": 2,
              "children": {
                "Recyclage des gaz d'échappement": {
                  "categoryId": null,
                  "categoryName": "Recyclage des gaz d'échappement",
                  "level": 4,
                  "children": {
                    "Kit réparation de câble, vanne EGR": {
                      "categoryId": 100791,
                      "categoryName": "Exhaust Gas Recirculation",
                      "level": 3,
                      "children": {
                        "Vanne EGR/Tube d'aspiration": {
                          "categoryId": null,
                          "categoryName": "Vanne EGR/Tube d'aspiration",
                          "level": 6,
                          "children": {
                            "Kit réparation de câble, vanne EGR": {
                              "categoryId": 100811,
                              "categoryName": "EGR Valve/Intake Manifold",
                              "level": 4,
                              "children": [],
                              "productId": 6349
                            }
                          }
                        }
                      },
                      "productId": 6349
                    }
                  }
                }
              },
              "productId": 6349
            },
            "Tuyauterie, vanne EGR": {
              "categoryId": 100790,
              "categoryName": "Exhaust Emission Control",
              "level": 2,
              "children": {
                "Recyclage des gaz d'échappement": {
                  "categoryId": null,
                  "categoryName": "Recyclage des gaz d'échappement",
                  "level": 4,
                  "children": {
                    "Tuyauterie, vanne EGR": {
                      "categoryId": 100791,
                      "categoryName": "Exhaust Gas Recirculation",
                      "level": 3,
                      "children": {
                        "Vanne EGR/Tube d'aspiration": {
                          "categoryId": null,
                          "categoryName": "Vanne EGR/Tube d'aspiration",
                          "level": 6,
                          "children": {
                            "Tuyauterie, vanne EGR": {
                              "categoryId": 100811,
                              "categoryName": "EGR Valve/Intake Manifold",
                              "level": 4,
                              "children": [],
                              "productId": 4179
                            }
                          }
                        }
                      },
                      "productId": 4179
                    }
                  }
                }
              },
              "productId": 4179
            },
            "Vanne EGR": {
              "categoryId": 100790,
              "categoryName": "Exhaust Emission Control",
              "level": 2,
              "children": {
                "Recyclage des gaz d'échappement": {
                  "categoryId": null,
                  "categoryName": "Recyclage des gaz d'échappement",
                  "level": 4,
                  "children": {
                    "Vanne EGR": {
                      "categoryId": 100791,
                      "categoryName": "Exhaust Gas Recirculation",
                      "level": 3,
                      "children": {
                        "Vanne EGR/Tube d'aspiration": {
                          "categoryId": null,
                          "categoryName": "Vanne EGR/Tube d'aspiration",
                          "level": 6,
                          "children": {
                            "Vanne EGR": {
                              "categoryId": 100811,
                              "categoryName": "EGR Valve/Intake Manifold",
                              "level": 4,
                              "children": [],
                              "productId": 1145
                            }
                          }
                        }
                      },
                      "productId": 1145
                    }
                  }
                }
              },
              "productId": 1145
            },
            "Vanne EGR, commande des gaz d'échappement": {
              "categoryId": 100790,
              "categoryName": "Exhaust Emission Control",
              "level": 2,
              "children": {
                "Recyclage des gaz d'échappement": {
                  "categoryId": null,
                  "categoryName": "Recyclage des gaz d'échappement",
                  "level": 4,
                  "children": {
                    "Vanne EGR, commande des gaz d'échappement": {
                      "categoryId": 100791,
                      "categoryName": "Exhaust Gas Recirculation",
                      "level": 3,
                      "children": {
                        "Contrôle des gaz d'échappement de RGE": {
                          "categoryId": null,
                          "categoryName": "Contrôle des gaz d'échappement de RGE",
                          "level": 6,
                          "children": {
                            "Vanne EGR, commande des gaz d'échappement": {
                              "categoryId": 100815,
                              "categoryName": "EGR Exhaust Control",
                              "level": 4,
                              "children": [],
                              "productId": 1137
                            }
                          }
                        }
                      },
                      "productId": 1137
                    }
                  }
                }
              },
              "productId": 1137
            }
          }
        }
      }
    },
    "Moteur": {
      "categoryId": 100002,
      "categoryName": "Moteur",
      "level": 1,
      "children": {
        "Épuration des gaz d'échappement": {
          "categoryId": null,
          "categoryName": "Épuration des gaz d'échappement",
          "level": 2,
          "children": {
            "Attache, vanne EGR": {
              "categoryId": 100541,
              "categoryName": "Exhaust Emission Control",
              "level": 2,
              "children": {
                "Recyclage des gaz d'échappement": {
                  "categoryId": null,
                  "categoryName": "Recyclage des gaz d'échappement",
                  "level": 4,
                  "children": {
                    "Attache, vanne EGR": {
                      "categoryId": 100542,
                      "categoryName": "Exhaust Gas Recirculation",
                      "level": 3,
                      "children": {
                        "Vanne EGR/Tube d'aspiration": {
                          "categoryId": null,
                          "categoryName": "Vanne EGR/Tube d'aspiration",
                          "level": 6,
                          "children": {
                            "Attache, vanne EGR": {
                              "categoryId": 100551,
                              "categoryName": "EGR Valve/Intake Manifold",
                              "level": 4,
                              "children": [],
                              "productId": 4177
                            }
                          }
                        }
                      },
                      "productId": 4177
                    }
                  }
                }
              },
              "productId": 4177
            },
            "Capteur de position, vanne EGR": {
              "categoryId": 100541,
              "categoryName": "Exhaust Emission Control",
              "level": 2,
              "children": {
                "Recyclage des gaz d'échappement": {
                  "categoryId": null,
                  "categoryName": "Recyclage des gaz d'échappement",
                  "level": 4,
                  "children": {
                    "Capteur de position, vanne EGR": {
                      "categoryId": 100542,
                      "categoryName": "Exhaust Gas Recirculation",
                      "level": 3,
                      "children": {
                        "Capteurs": {
                          "categoryId": null,
                          "categoryName": "Capteurs",
                          "level": 6,
                          "children": {
                            "Capteur de position, vanne EGR": {
                              "categoryId": 706702,
                              "categoryName": "Sensors",
                              "level": 4,
                              "children": [],
                              "productId": 60572
                            }
                          }
                        }
                      },
                      "productId": 60572
                    }
                  }
                }
              },
              "productId": 60572
            },
            "Elément de réglage, soupape EGR": {
              "categoryId": 100541,
              "categoryName": "Exhaust Emission Control",
              "level": 2,
              "children": {
                "Recyclage des gaz d'échappement": {
                  "categoryId": null,
                  "categoryName": "Recyclage des gaz d'échappement",
                  "level": 4,
                  "children": {
                    "Elément de réglage, soupape EGR": {
                      "categoryId": 100542,
                      "categoryName": "Exhaust Gas Recirculation",
                      "level": 3,
                      "children": {
                        "Vanne EGR/Tube d'aspiration": {
                          "categoryId": null,
                          "categoryName": "Vanne EGR/Tube d'aspiration",
                          "level": 6,
                          "children": {
                            "Elément de réglage, soupape EGR": {
                              "categoryId": 100551,
                              "categoryName": "EGR Valve/Intake Manifold",
                              "level": 4,
                              "children": [],
                              "productId": 60983
                            }
                          }
                        }
                      },
                      "productId": 60983
                    }
                  }
                }
              },
              "productId": 60983
            },
            "Joint, attache vanne EGR": {
              "categoryId": 100541,
              "categoryName": "Exhaust Emission Control",
              "level": 2,
              "children": {
                "Recyclage des gaz d'échappement": {
                  "categoryId": null,
                  "categoryName": "Recyclage des gaz d'échappement",
                  "level": 4,
                  "children": {
                    "Joint, attache vanne EGR": {
                      "categoryId": 100542,
                      "categoryName": "Exhaust Gas Recirculation",
                      "level": 3,
                      "children": {
                        "Joints": {
                          "categoryId": null,
                          "categoryName": "Joints",
                          "level": 6,
                          "children": {
                            "Joint, attache vanne EGR": {
                              "categoryId": 103235,
                              "categoryName": "Gaskets",
                              "level": 4,
                              "children": [],
                              "productId": 4178
                            }
                          }
                        },
                        "Vanne EGR/Tube d'aspiration": {
                          "categoryId": null,
                          "categoryName": "Vanne EGR/Tube d'aspiration",
                          "level": 6,
                          "children": {
                            "Joint, attache vanne EGR": {
                              "categoryId": 100551,
                              "categoryName": "EGR Valve/Intake Manifold",
                              "level": 4,
                              "children": [],
                              "productId": 4178
                            }
                          }
                        }
                      },
                      "productId": 4178
                    }
                  }
                }
              },
              "productId": 4178
            },
            "Joint, flexible vanne EGR": {
              "categoryId": 100541,
              "categoryName": "Exhaust Emission Control",
              "level": 2,
              "children": {
                "Recyclage des gaz d'échappement": {
                  "categoryId": null,
                  "categoryName": "Recyclage des gaz d'échappement",
                  "level": 4,
                  "children": {
                    "Joint, flexible vanne EGR": {
                      "categoryId": 100542,
                      "categoryName": "Exhaust Gas Recirculation",
                      "level": 3,
                      "children": {
                        "Joints": {
                          "categoryId": null,
                          "categoryName": "Joints",
                          "level": 6,
                          "children": {
                            "Joint, flexible vanne EGR": {
                              "categoryId": 103235,
                              "categoryName": "Gaskets",
                              "level": 4,
                              "children": [],
                              "productId": 4180
                            }
                          }
                        },
                        "Vanne EGR/Tube d'aspiration": {
                          "categoryId": null,
                          "categoryName": "Vanne EGR/Tube d'aspiration",
                          "level": 6,
                          "children": {
                            "Joint, flexible vanne EGR": {
                              "categoryId": 100551,
                              "categoryName": "EGR Valve/Intake Manifold",
                              "level": 4,
                              "children": [],
                              "productId": 4180
                            }
                          }
                        }
                      },
                      "productId": 4180
                    }
                  }
                }
              },
              "productId": 4180
            },
            "Joint, vanne EGR": {
              "categoryId": 100541,
              "categoryName": "Exhaust Emission Control",
              "level": 2,
              "children": {
                "Recyclage des gaz d'échappement": {
                  "categoryId": null,
                  "categoryName": "Recyclage des gaz d'échappement",
                  "level": 4,
                  "children": {
                    "Joint, vanne EGR": {
                      "categoryId": 100542,
                      "categoryName": "Exhaust Gas Recirculation",
                      "level": 3,
                      "children": {
                        "Joints": {
                          "categoryId": null,
                          "categoryName": "Joints",
                          "level": 6,
                          "children": {
                            "Joint, vanne EGR": {
                              "categoryId": 103235,
                              "categoryName": "Gaskets",
                              "level": 4,
                              "children": [],
                              "productId": 3507
                            }
                          }
                        },
                        "Vanne EGR/Tube d'aspiration": {
                          "categoryId": null,
                          "categoryName": "Vanne EGR/Tube d'aspiration",
                          "level": 6,
                          "children": {
                            "Joint, vanne EGR": {
                              "categoryId": 100551,
                              "categoryName": "EGR Valve/Intake Manifold",
                              "level": 4,
                              "children": [],
                              "productId": 3507
                            }
                          }
                        }
                      },
                      "productId": 3507
                    }
                  }
                }
              },
              "productId": 3507
            },
            "Kit de réparation, vanne EGR": {
              "categoryId": 100541,
              "categoryName": "Exhaust Emission Control",
              "level": 2,
              "children": {
                "Recyclage des gaz d'échappement": {
                  "categoryId": null,
                  "categoryName": "Recyclage des gaz d'échappement",
                  "level": 4,
                  "children": {
                    "Kit de réparation, vanne EGR": {
                      "categoryId": 100542,
                      "categoryName": "Exhaust Gas Recirculation",
                      "level": 3,
                      "children": {
                        "Vanne EGR/Tube d'aspiration": {
                          "categoryId": null,
                          "categoryName": "Vanne EGR/Tube d'aspiration",
                          "level": 6,
                          "children": {
                            "Kit de réparation, vanne EGR": {
                              "categoryId": 100551,
                              "categoryName": "EGR Valve/Intake Manifold",
                              "level": 4,
                              "children": [],
                              "productId": 60001
                            }
                          }
                        }
                      },
                      "productId": 60001
                    }
                  }
                }
              },
              "productId": 60001
            },
            "Tuyauterie, vanne EGR": {
              "categoryId": 100541,
              "categoryName": "Exhaust Emission Control",
              "level": 2,
              "children": {
                "Recyclage des gaz d'échappement": {
                  "categoryId": null,
                  "categoryName": "Recyclage des gaz d'échappement",
                  "level": 4,
                  "children": {
                    "Tuyauterie, vanne EGR": {
                      "categoryId": 100542,
                      "categoryName": "Exhaust Gas Recirculation",
                      "level": 3,
                      "children": {
                        "Vanne EGR/Tube d'aspiration": {
                          "categoryId": null,
                          "categoryName": "Vanne EGR/Tube d'aspiration",
                          "level": 6,
                          "children": {
                            "Tuyauterie, vanne EGR": {
                              "categoryId": 100551,
                              "categoryName": "EGR Valve/Intake Manifold",
                              "level": 4,
                              "children": [],
                              "productId": 4179
                            }
                          }
                        }
                      },
                      "productId": 4179
                    }
                  }
                }
              },
              "productId": 4179
            },
            "Vanne EGR": {
              "categoryId": 100541,
              "categoryName": "Exhaust Emission Control",
              "level": 2,
              "children": {
                "Recyclage des gaz d'échappement": {
                  "categoryId": null,
                  "categoryName": "Recyclage des gaz d'échappement",
                  "level": 4,
                  "children": {
                    "Vanne EGR": {
                      "categoryId": 100542,
                      "categoryName": "Exhaust Gas Recirculation",
                      "level": 3,
                      "children": {
                        "Vanne EGR/Tube d'aspiration": {
                          "categoryId": null,
                          "categoryName": "Vanne EGR/Tube d'aspiration",
                          "level": 6,
                          "children": {
                            "Vanne EGR": {
                              "categoryId": 100551,
                              "categoryName": "EGR Valve/Intake Manifold",
                              "level": 4,
                              "children": [],
                              "productId": 1145
                            }
                          }
                        }
                      },
                      "productId": 1145
                    }
                  }
                }
              },
              "productId": 1145
            },
            "Vanne EGR, commande des gaz d'échappement": {
              "categoryId": 100541,
              "categoryName": "Exhaust Emission Control",
              "level": 2,
              "children": {
                "Recyclage des gaz d'échappement": {
                  "categoryId": null,
                  "categoryName": "Recyclage des gaz d'échappement",
                  "level": 4,
                  "children": {
                    "Vanne EGR, commande des gaz d'échappement": {
                      "categoryId": 100542,
                      "categoryName": "Exhaust Gas Recirculation",
                      "level": 3,
                      "children": {
                        "Contrôle des gaz d'échappement de RGE": {
                          "categoryId": null,
                          "categoryName": "Contrôle des gaz d'échappement de RGE",
                          "level": 6,
                          "children": {
                            "Vanne EGR, commande des gaz d'échappement": {
                              "categoryId": 100545,
                              "categoryName": "EGR Exhaust Control",
                              "level": 4,
                              "children": [],
                              "productId": 1137
                            }
                          }
                        },
                        "Soupape, recyclage des gaz d'échappement": {
                          "categoryId": null,
                          "categoryName": "Soupape, recyclage des gaz d'échappement",
                          "level": 6,
                          "children": {
                            "Vanne EGR, commande des gaz d'échappement": {
                              "categoryId": 100549,
                              "categoryName": "Valves, exhaust gas recirculation",
                              "level": 4,
                              "children": [],
                              "productId": 1137
                            }
                          }
                        }
                      },
                      "productId": 1137
                    }
                  }
                }
              },
              "productId": 1137
            }
          }
        }
      }
    }
  },
  "arborescenceText": "├── Carburation [ID: 100254] (Niveau 1)\n│   └── Épuration des gaz d'échappement (Niveau 2)\n│       ├── Exhaust Emission Control [ID: 100790] (Niveau 2) → ProductId: 4177\n│       │   └── Recyclage des gaz d'échappement (Niveau 4)\n│       │       └── Exhaust Gas Recirculation [ID: 100791] (Niveau 3) → ProductId: 4177\n│       │           └── Vanne EGR/Tube d'aspiration (Niveau 6)\n│       │               └── EGR Valve/Intake Manifold [ID: 100811] (Niveau 4) → ProductId: 4177\n│       ├── Exhaust Emission Control [ID: 100790] (Niveau 2) → ProductId: 60983\n│       │   └── Recyclage des gaz d'échappement (Niveau 4)\n│       │       └── Exhaust Gas Recirculation [ID: 100791] (Niveau 3) → ProductId: 60983\n│       │           └── Vanne EGR/Tube d'aspiration (Niveau 6)\n│       │               └── EGR Valve/Intake Manifold [ID: 100811] (Niveau 4) → ProductId: 60983\n│       ├── Exhaust Emission Control [ID: 100790] (Niveau 2) → ProductId: 4178\n│       │   └── Recyclage des gaz d'échappement (Niveau 4)\n│       │       └── Exhaust Gas Recirculation [ID: 100791] (Niveau 3) → ProductId: 4178\n│       │           ├── Joints (Niveau 6)\n│       │           │   └── Gaskets [ID: 103239] (Niveau 4) → ProductId: 4178\n│       │           └── Vanne EGR/Tube d'aspiration (Niveau 6)\n│       │               └── EGR Valve/Intake Manifold [ID: 100811] (Niveau 4) → ProductId: 4178\n│       ├── Exhaust Emission Control [ID: 100790] (Niveau 2) → ProductId: 4180\n│       │   └── Recyclage des gaz d'échappement (Niveau 4)\n│       │       └── Exhaust Gas Recirculation [ID: 100791] (Niveau 3) → ProductId: 4180\n│       │           ├── Joints (Niveau 6)\n│       │           │   └── Gaskets [ID: 103239] (Niveau 4) → ProductId: 4180\n│       │           └── Vanne EGR/Tube d'aspiration (Niveau 6)\n│       │               └── EGR Valve/Intake Manifold [ID: 100811] (Niveau 4) → ProductId: 4180\n│       ├── Exhaust Emission Control [ID: 100790] (Niveau 2) → ProductId: 3507\n│       │   └── Recyclage des gaz d'échappement (Niveau 4)\n│       │       └── Exhaust Gas Recirculation [ID: 100791] (Niveau 3) → ProductId: 3507\n│       │           ├── Joints (Niveau 6)\n│       │           │   └── Gaskets [ID: 103239] (Niveau 4) → ProductId: 3507\n│       │           └── Vanne EGR/Tube d'aspiration (Niveau 6)\n│       │               └── EGR Valve/Intake Manifold [ID: 100811] (Niveau 4) → ProductId: 3507\n│       ├── Exhaust Emission Control [ID: 100790] (Niveau 2) → ProductId: 60001\n│       │   └── Recyclage des gaz d'échappement (Niveau 4)\n│       │       └── Exhaust Gas Recirculation [ID: 100791] (Niveau 3) → ProductId: 60001\n│       │           └── Vanne EGR/Tube d'aspiration (Niveau 6)\n│       │               └── EGR Valve/Intake Manifold [ID: 100811] (Niveau 4) → ProductId: 60001\n│       ├── Exhaust Emission Control [ID: 100790] (Niveau 2) → ProductId: 6349\n│       │   └── Recyclage des gaz d'échappement (Niveau 4)\n│       │       └── Exhaust Gas Recirculation [ID: 100791] (Niveau 3) → ProductId: 6349\n│       │           └── Vanne EGR/Tube d'aspiration (Niveau 6)\n│       │               └── EGR Valve/Intake Manifold [ID: 100811] (Niveau 4) → ProductId: 6349\n│       ├── Exhaust Emission Control [ID: 100790] (Niveau 2) → ProductId: 4179\n│       │   └── Recyclage des gaz d'échappement (Niveau 4)\n│       │       └── Exhaust Gas Recirculation [ID: 100791] (Niveau 3) → ProductId: 4179\n│       │           └── Vanne EGR/Tube d'aspiration (Niveau 6)\n│       │               └── EGR Valve/Intake Manifold [ID: 100811] (Niveau 4) → ProductId: 4179\n│       ├── Exhaust Emission Control [ID: 100790] (Niveau 2) → ProductId: 1145\n│       │   └── Recyclage des gaz d'échappement (Niveau 4)\n│       │       └── Exhaust Gas Recirculation [ID: 100791] (Niveau 3) → ProductId: 1145\n│       │           └── Vanne EGR/Tube d'aspiration (Niveau 6)\n│       │               └── EGR Valve/Intake Manifold [ID: 100811] (Niveau 4) → ProductId: 1145\n│       └── Exhaust Emission Control [ID: 100790] (Niveau 2) → ProductId: 1137\n│           └── Recyclage des gaz d'échappement (Niveau 4)\n│               └── Exhaust Gas Recirculation [ID: 100791] (Niveau 3) → ProductId: 1137\n│                   └── Contrôle des gaz d'échappement de RGE (Niveau 6)\n│                       └── EGR Exhaust Control [ID: 100815] (Niveau 4) → ProductId: 1137\n\n└── Moteur [ID: 100002] (Niveau 1)\n    └── Épuration des gaz d'échappement (Niveau 2)\n        ├── Exhaust Emission Control [ID: 100541] (Niveau 2) → ProductId: 4177\n        │   └── Recyclage des gaz d'échappement (Niveau 4)\n        │       └── Exhaust Gas Recirculation [ID: 100542] (Niveau 3) → ProductId: 4177\n        │           └── Vanne EGR/Tube d'aspiration (Niveau 6)\n        │               └── EGR Valve/Intake Manifold [ID: 100551] (Niveau 4) → ProductId: 4177\n        ├── Exhaust Emission Control [ID: 100541] (Niveau 2) → ProductId: 60572\n        │   └── Recyclage des gaz d'échappement (Niveau 4)\n        │       └── Exhaust Gas Recirculation [ID: 100542] (Niveau 3) → ProductId: 60572\n        │           └── Capteurs (Niveau 6)\n        │               └── Sensors [ID: 706702] (Niveau 4) → ProductId: 60572\n        ├── Exhaust Emission Control [ID: 100541] (Niveau 2) → ProductId: 60983\n        │   └── Recyclage des gaz d'échappement (Niveau 4)\n        │       └── Exhaust Gas Recirculation [ID: 100542] (Niveau 3) → ProductId: 60983\n        │           └── Vanne EGR/Tube d'aspiration (Niveau 6)\n        │               └── EGR Valve/Intake Manifold [ID: 100551] (Niveau 4) → ProductId: 60983\n        ├── Exhaust Emission Control [ID: 100541] (Niveau 2) → ProductId: 4178\n        │   └── Recyclage des gaz d'échappement (Niveau 4)\n        │       └── Exhaust Gas Recirculation [ID: 100542] (Niveau 3) → ProductId: 4178\n        │           ├── Joints (Niveau 6)\n        │           │   └── Gaskets [ID: 103235] (Niveau 4) → ProductId: 4178\n        │           └── Vanne EGR/Tube d'aspiration (Niveau 6)\n        │               └── EGR Valve/Intake Manifold [ID: 100551] (Niveau 4) → ProductId: 4178\n        ├── Exhaust Emission Control [ID: 100541] (Niveau 2) → ProductId: 4180\n        │   └── Recyclage des gaz d'échappement (Niveau 4)\n        │       └── Exhaust Gas Recirculation [ID: 100542] (Niveau 3) → ProductId: 4180\n        │           ├── Joints (Niveau 6)\n        │           │   └── Gaskets [ID: 103235] (Niveau 4) → ProductId: 4180\n        │           └── Vanne EGR/Tube d'aspiration (Niveau 6)\n        │               └── EGR Valve/Intake Manifold [ID: 100551] (Niveau 4) → ProductId: 4180\n        ├── Exhaust Emission Control [ID: 100541] (Niveau 2) → ProductId: 3507\n        │   └── Recyclage des gaz d'échappement (Niveau 4)\n        │       └── Exhaust Gas Recirculation [ID: 100542] (Niveau 3) → ProductId: 3507\n        │           ├── Joints (Niveau 6)\n        │           │   └── Gaskets [ID: 103235] (Niveau 4) → ProductId: 3507\n        │           └── Vanne EGR/Tube d'aspiration (Niveau 6)\n        │               └── EGR Valve/Intake Manifold [ID: 100551] (Niveau 4) → ProductId: 3507\n        ├── Exhaust Emission Control [ID: 100541] (Niveau 2) → ProductId: 60001\n        │   └── Recyclage des gaz d'échappement (Niveau 4)\n        │       └── Exhaust Gas Recirculation [ID: 100542] (Niveau 3) → ProductId: 60001\n        │           └── Vanne EGR/Tube d'aspiration (Niveau 6)\n        │               └── EGR Valve/Intake Manifold [ID: 100551] (Niveau 4) → ProductId: 60001\n        ├── Exhaust Emission Control [ID: 100541] (Niveau 2) → ProductId: 4179\n        │   └── Recyclage des gaz d'échappement (Niveau 4)\n        │       └── Exhaust Gas Recirculation [ID: 100542] (Niveau 3) → ProductId: 4179\n        │           └── Vanne EGR/Tube d'aspiration (Niveau 6)\n        │               └── EGR Valve/Intake Manifold [ID: 100551] (Niveau 4) → ProductId: 4179\n        ├── Exhaust Emission Control [ID: 100541] (Niveau 2) → ProductId: 1145\n        │   └── Recyclage des gaz d'échappement (Niveau 4)\n        │       └── Exhaust Gas Recirculation [ID: 100542] (Niveau 3) → ProductId: 1145\n        │           └── Vanne EGR/Tube d'aspiration (Niveau 6)\n        │               └── EGR Valve/Intake Manifold [ID: 100551] (Niveau 4) → ProductId: 1145\n        └── Exhaust Emission Control [ID: 100541] (Niveau 2) → ProductId: 1137\n            └── Recyclage des gaz d'échappement (Niveau 4)\n                └── Exhaust Gas Recirculation [ID: 100542] (Niveau 3) → ProductId: 1137\n                    ├── Contrôle des gaz d'échappement de RGE (Niveau 6)\n                    │   └── EGR Exhaust Control [ID: 100545] (Niveau 4) → ProductId: 1137\n                    └── Soupape, recyclage des gaz d'échappement (Niveau 6)\n                        └── Valves, exhaust gas recirculation [ID: 100549] (Niveau 4) → ProductId: 1137",
  "arborescencePaths": [
    {
      "path": [
        "Carburation",
        "Épuration des gaz d'échappement",
        "Exhaust Emission Control"
      ],
      "categoryIds": [
        100254,
        null,
        100790
      ],
      "finalCategoryId": 100790,
      "productId": 4177
    },
    {
      "path": [
        "Carburation",
        "Épuration des gaz d'échappement",
        "Exhaust Emission Control"
      ],
      "categoryIds": [
        100254,
        null,
        100790
      ],
      "finalCategoryId": 100790,
      "productId": 60983
    },
    {
      "path": [
        "Carburation",
        "Épuration des gaz d'échappement",
        "Exhaust Emission Control"
      ],
      "categoryIds": [
        100254,
        null,
        100790
      ],
      "finalCategoryId": 100790,
      "productId": 4178
    },
    {
      "path": [
        "Carburation",
        "Épuration des gaz d'échappement",
        "Exhaust Emission Control"
      ],
      "categoryIds": [
        100254,
        null,
        100790
      ],
      "finalCategoryId": 100790,
      "productId": 4180
    },
    {
      "path": [
        "Carburation",
        "Épuration des gaz d'échappement",
        "Exhaust Emission Control"
      ],
      "categoryIds": [
        100254,
        null,
        100790
      ],
      "finalCategoryId": 100790,
      "productId": 3507
    },
    {
      "path": [
        "Carburation",
        "Épuration des gaz d'échappement",
        "Exhaust Emission Control"
      ],
      "categoryIds": [
        100254,
        null,
        100790
      ],
      "finalCategoryId": 100790,
      "productId": 60001
    },
    {
      "path": [
        "Carburation",
        "Épuration des gaz d'échappement",
        "Exhaust Emission Control"
      ],
      "categoryIds": [
        100254,
        null,
        100790
      ],
      "finalCategoryId": 100790,
      "productId": 6349
    },
    {
      "path": [
        "Carburation",
        "Épuration des gaz d'échappement",
        "Exhaust Emission Control"
      ],
      "categoryIds": [
        100254,
        null,
        100790
      ],
      "finalCategoryId": 100790,
      "productId": 4179
    },
    {
      "path": [
        "Carburation",
        "Épuration des gaz d'échappement",
        "Exhaust Emission Control"
      ],
      "categoryIds": [
        100254,
        null,
        100790
      ],
      "finalCategoryId": 100790,
      "productId": 1145
    },
    {
      "path": [
        "Carburation",
        "Épuration des gaz d'échappement",
        "Exhaust Emission Control"
      ],
      "categoryIds": [
        100254,
        null,
        100790
      ],
      "finalCategoryId": 100790,
      "productId": 1137
    },
    {
      "path": [
        "Moteur",
        "Épuration des gaz d'échappement",
        "Exhaust Emission Control"
      ],
      "categoryIds": [
        100002,
        null,
        100541
      ],
      "finalCategoryId": 100541,
      "productId": 4177
    },
    {
      "path": [
        "Moteur",
        "Épuration des gaz d'échappement",
        "Exhaust Emission Control"
      ],
      "categoryIds": [
        100002,
        null,
        100541
      ],
      "finalCategoryId": 100541,
      "productId": 60572
    },
    {
      "path": [
        "Moteur",
        "Épuration des gaz d'échappement",
        "Exhaust Emission Control"
      ],
      "categoryIds": [
        100002,
        null,
        100541
      ],
      "finalCategoryId": 100541,
      "productId": 60983
    },
    {
      "path": [
        "Moteur",
        "Épuration des gaz d'échappement",
        "Exhaust Emission Control"
      ],
      "categoryIds": [
        100002,
        null,
        100541
      ],
      "finalCategoryId": 100541,
      "productId": 4178
    },
    {
      "path": [
        "Moteur",
        "Épuration des gaz d'échappement",
        "Exhaust Emission Control"
      ],
      "categoryIds": [
        100002,
        null,
        100541
      ],
      "finalCategoryId": 100541,
      "productId": 4180
    },
    {
      "path": [
        "Moteur",
        "Épuration des gaz d'échappement",
        "Exhaust Emission Control"
      ],
      "categoryIds": [
        100002,
        null,
        100541
      ],
      "finalCategoryId": 100541,
      "productId": 3507
    },
    {
      "path": [
        "Moteur",
        "Épuration des gaz d'échappement",
        "Exhaust Emission Control"
      ],
      "categoryIds": [
        100002,
        null,
        100541
      ],
      "finalCategoryId": 100541,
      "productId": 60001
    },
    {
      "path": [
        "Moteur",
        "Épuration des gaz d'échappement",
        "Exhaust Emission Control"
      ],
      "categoryIds": [
        100002,
        null,
        100541
      ],
      "finalCategoryId": 100541,
      "productId": 4179
    },
    {
      "path": [
        "Moteur",
        "Épuration des gaz d'échappement",
        "Exhaust Emission Control"
      ],
      "categoryIds": [
        100002,
        null,
        100541
      ],
      "finalCategoryId": 100541,
      "productId": 1145
    },
    {
      "path": [
        "Moteur",
        "Épuration des gaz d'échappement",
        "Exhaust Emission Control"
      ],
      "categoryIds": [
        100002,
        null,
        100541
      ],
      "finalCategoryId": 100541,
      "productId": 1137
    }
  ],
  "productIdsInArbo": [
    1137,
    1145,
    3507,
    4177,
    4178,
    4179,
    4180,
    6349,
    60001,
    60572,
    60983
  ],
  "matchedProductIds": [
    1145
  ]
}