{
  "productName": "Vis de fermeture",
  "searchText": "Vis de fermeture",
  "found": true,
  "hasMatch": false,
  "timestamp": "2025-12-03T07:33:39.825Z",
  "productId": 2312,
  "arborescence": {
    "Boîte de vitesses": {
      "categoryId": 100238,
      "categoryName": "Boîte de vitesses",
      "level": 1,
      "children": {
        "Boîte de vitesse automatique": {
          "categoryId": null,
          "categoryName": "Boîte de vitesse automatique",
          "level": 2,
          "children": {
            "Vis de fermeture, carter de boîte de vitesses automatique": {
              "categoryId": 100240,
              "categoryName": "Automatic Transmission",
              "level": 2,
              "children": {
                "Boîtier/composants": {
                  "categoryId": null,
                  "categoryName": "Boîtier/composants",
                  "level": 4,
                  "children": {
                    "Vis de fermeture, carter de boîte de vitesses automatique": {
                      "categoryId": 100775,
                      "categoryName": "Transmission Housing/Parts",
                      "level": 3,
                      "children": [],
                      "productId": 4918
                    }
                  }
                }
              },
              "productId": 4918
            }
          }
        },
        "Boîte de vitesses manuelle": {
          "categoryId": null,
          "categoryName": "Boîte de vitesses manuelle",
          "level": 2,
          "children": {
            "Vis de fermeture, carter de boîte de vitesses manuelle": {
              "categoryId": 100239,
              "categoryName": "Manual Transmission",
              "level": 2,
              "children": {
                "Carter/composants": {
                  "categoryId": null,
                  "categoryName": "Carter/composants",
                  "level": 4,
                  "children": {
                    "Vis de fermeture, carter de boîte de vitesses manuelle": {
                      "categoryId": 100774,
                      "categoryName": "Transmission Housing/Parts",
                      "level": 3,
                      "children": [],
                      "productId": 61183
                    }
                  }
                }
              },
              "productId": 61183
            }
          }
        },
        "Transmission à double embrayage": {
          "categoryId": null,
          "categoryName": "Transmission à double embrayage",
          "level": 2,
          "children": {
            "Vis de fermeture, carter de boîte vitesses à double embray.": {
              "categoryId": 706835,
              "categoryName": "Dual-Clutch Transmission",
              "level": 2,
              "children": {
                "Carter/composants": {
                  "categoryId": null,
                  "categoryName": "Carter/composants",
                  "level": 4,
                  "children": {
                    "Vis de fermeture, carter de boîte vitesses à double embray.": {
                      "categoryId": 706846,
                      "categoryName": "Transmission Housing/Parts",
                      "level": 3,
                      "children": [],
                      "productId": 61253
                    }
                  }
                }
              },
              "productId": 61253
            }
          }
        }
      }
    },
    "Carburation": {
      "categoryId": 100254,
      "categoryName": "Carburation",
      "level": 1,
      "children": {
        "Mélange air-carburant": {
          "categoryId": null,
          "categoryName": "Mélange air-carburant",
          "level": 2,
          "children": {
            "Vis de fermeture, logement du capteur NOx": {
              "categoryId": 102793,
              "categoryName": "Mixture Formation",
              "level": 2,
              "children": {
                "Capteur/sonde lambda": {
                  "categoryId": null,
                  "categoryName": "Capteur/sonde lambda",
                  "level": 4,
                  "children": {
                    "Vis de fermeture, logement du capteur NOx": {
                      "categoryId": 102809,
                      "categoryName": "Sensor/Probe",
                      "level": 3,
                      "children": [],
                      "productId": 60895
                    }
                  }
                }
              },
              "productId": 60895
            }
          }
        }
      }
    },
    "Échappement": {
      "categoryId": 100004,
      "categoryName": "Échappement",
      "level": 1,
      "children": {
        "Capteur/sonde lambda": {
          "categoryId": null,
          "categoryName": "Capteur/sonde lambda",
          "level": 2,
          "children": {
            "Vis de fermeture, logement du capteur NOx": {
              "categoryId": 103414,
              "categoryName": "Sensor/Probe",
              "level": 2,
              "children": [],
              "productId": 60895
            }
          }
        }
      }
    },
    "Entraînement des essieux": {
      "categoryId": 100400,
      "categoryName": "Entraînement des essieux",
      "level": 1,
      "children": {
        "Boîte de transfert": {
          "categoryId": null,
          "categoryName": "Boîte de transfert",
          "level": 2,
          "children": {
            "Vis de fermeture, boîte de transfert": {
              "categoryId": 100416,
              "categoryName": "Transfer Case",
              "level": 2,
              "children": [],
              "productId": 60991
            }
          }
        }
      }
    },
    "Moteur": {
      "categoryId": 100002,
      "categoryName": "Moteur",
      "level": 1,
      "children": {
        "Culasse / pieces de montage": {
          "categoryId": null,
          "categoryName": "Culasse / pieces de montage",
          "level": 2,
          "children": {
            "Bague d'étanchéité, vis de fermeture de culasse": {
              "categoryId": 100373,
              "categoryName": "Cylinder Head/Attachment Parts",
              "level": 2,
              "children": {
                "Culasse": {
                  "categoryId": null,
                  "categoryName": "Culasse",
                  "level": 4,
                  "children": {
                    "Bague d'étanchéité, vis de fermeture de culasse": {
                      "categoryId": 100380,
                      "categoryName": "Cylinder Head",
                      "level": 3,
                      "children": [],
                      "productId": 61080
                    }
                  }
                }
              },
              "productId": 61080
            }
          }
        },
        "Lubrification": {
          "categoryId": null,
          "categoryName": "Lubrification",
          "level": 2,
          "children": {
            "Ressort, vis de fermeture (boîtier de filtre à huile)": {
              "categoryId": 100245,
              "categoryName": "Lubrication",
              "level": 2,
              "children": {
                "Boîtier de filtres à huile / joint": {
                  "categoryId": null,
                  "categoryName": "Boîtier de filtres à huile / joint",
                  "level": 4,
                  "children": {
                    "Ressort, vis de fermeture (boîtier de filtre à huile)": {
                      "categoryId": 100472,
                      "categoryName": "Oil Filter Housing/Seal",
                      "level": 3,
                      "children": [],
                      "productId": 60869
                    }
                  }
                }
              },
              "productId": 60869
            }
          }
        }
      }
    },
    "Refroidissement": {
      "categoryId": 100007,
      "categoryName": "Refroidissement",
      "level": 1,
      "children": {
        "Tuyauterie et brides": {
          "categoryId": null,
          "categoryName": "Tuyauterie et brides",
          "level": 2,
          "children": {
            "Vis de fermeture, conduite du liquide de refroidissement": {
              "categoryId": 100099,
              "categoryName": "Hoses/Pipes/Flanges",
              "level": 2,
              "children": {
                "Durite de refroidissement/conduite": {
                  "categoryId": null,
                  "categoryName": "Durite de refroidissement/conduite",
                  "level": 4,
                  "children": {
                    "Vis de fermeture, conduite du liquide de refroidissement": {
                      "categoryId": 100100,
                      "categoryName": "Radiator Hoses",
                      "level": 3,
                      "children": [],
                      "productId": 2148
                    }
                  }
                }
              },
              "productId": 2148
            }
          }
        }
      }
    }
  },
  "arborescenceText": "├── Boîte de vitesses [ID: 100238] (Niveau 1)\n│   ├── Boîte de vitesse automatique (Niveau 2)\n│   │   └── Automatic Transmission [ID: 100240] (Niveau 2) → ProductId: 4918\n│   │       └── Boîtier/composants (Niveau 4)\n│   │           └── Transmission Housing/Parts [ID: 100775] (Niveau 3) → ProductId: 4918\n│   ├── Boîte de vitesses manuelle (Niveau 2)\n│   │   └── Manual Transmission [ID: 100239] (Niveau 2) → ProductId: 61183\n│   │       └── Carter/composants (Niveau 4)\n│   │           └── Transmission Housing/Parts [ID: 100774] (Niveau 3) → ProductId: 61183\n│   └── Transmission à double embrayage (Niveau 2)\n│       └── Dual-Clutch Transmission [ID: 706835] (Niveau 2) → ProductId: 61253\n│           └── Carter/composants (Niveau 4)\n│               └── Transmission Housing/Parts [ID: 706846] (Niveau 3) → ProductId: 61253\n\n├── Carburation [ID: 100254] (Niveau 1)\n│   └── Mélange air-carburant (Niveau 2)\n│       └── Mixture Formation [ID: 102793] (Niveau 2) → ProductId: 60895\n│           └── Capteur/sonde lambda (Niveau 4)\n│               └── Sensor/Probe [ID: 102809] (Niveau 3) → ProductId: 60895\n\n├── Échappement [ID: 100004] (Niveau 1)\n│   └── Capteur/sonde lambda (Niveau 2)\n│       └── Sensor/Probe [ID: 103414] (Niveau 2) → ProductId: 60895\n\n├── Entraînement des essieux [ID: 100400] (Niveau 1)\n│   └── Boîte de transfert (Niveau 2)\n│       └── Transfer Case [ID: 100416] (Niveau 2) → ProductId: 60991\n\n├── Moteur [ID: 100002] (Niveau 1)\n│   ├── Culasse / pieces de montage (Niveau 2)\n│   │   └── Cylinder Head/Attachment Parts [ID: 100373] (Niveau 2) → ProductId: 61080\n│   │       └── Culasse (Niveau 4)\n│   │           └── Cylinder Head [ID: 100380] (Niveau 3) → ProductId: 61080\n│   └── Lubrification (Niveau 2)\n│       └── Lubrication [ID: 100245] (Niveau 2) → ProductId: 60869\n│           └── Boîtier de filtres à huile / joint (Niveau 4)\n│               └── Oil Filter Housing/Seal [ID: 100472] (Niveau 3) → ProductId: 60869\n\n└── Refroidissement [ID: 100007] (Niveau 1)\n    └── Tuyauterie et brides (Niveau 2)\n        └── Hoses/Pipes/Flanges [ID: 100099] (Niveau 2) → ProductId: 2148\n            └── Durite de refroidissement/conduite (Niveau 4)\n                └── Radiator Hoses [ID: 100100] (Niveau 3) → ProductId: 2148",
  "arborescencePaths": [
    {
      "path": [
        "Boîte de vitesses",
        "Boîte de vitesse automatique",
        "Automatic Transmission"
      ],
      "categoryIds": [
        100238,
        null,
        100240
      ],
      "finalCategoryId": 100240,
      "productId": 4918
    },
    {
      "path": [
        "Boîte de vitesses",
        "Boîte de vitesses manuelle",
        "Manual Transmission"
      ],
      "categoryIds": [
        100238,
        null,
        100239
      ],
      "finalCategoryId": 100239,
      "productId": 61183
    },
    {
      "path": [
        "Boîte de vitesses",
        "Transmission à double embrayage",
        "Dual-Clutch Transmission"
      ],
      "categoryIds": [
        100238,
        null,
        706835
      ],
      "finalCategoryId": 706835,
      "productId": 61253
    },
    {
      "path": [
        "Carburation",
        "Mélange air-carburant",
        "Mixture Formation"
      ],
      "categoryIds": [
        100254,
        null,
        102793
      ],
      "finalCategoryId": 102793,
      "productId": 60895
    },
    {
      "path": [
        "Échappement",
        "Capteur/sonde lambda",
        "Sensor/Probe"
      ],
      "categoryIds": [
        100004,
        null,
        103414
      ],
      "finalCategoryId": 103414,
      "productId": 60895
    },
    {
      "path": [
        "Entraînement des essieux",
        "Boîte de transfert",
        "Transfer Case"
      ],
      "categoryIds": [
        100400,
        null,
        100416
      ],
      "finalCategoryId": 100416,
      "productId": 60991
    },
    {
      "path": [
        "Moteur",
        "Culasse / pieces de montage",
        "Cylinder Head/Attachment Parts"
      ],
      "categoryIds": [
        100002,
        null,
        100373
      ],
      "finalCategoryId": 100373,
      "productId": 61080
    },
    {
      "path": [
        "Moteur",
        "Lubrification",
        "Lubrication"
      ],
      "categoryIds": [
        100002,
        null,
        100245
      ],
      "finalCategoryId": 100245,
      "productId": 60869
    },
    {
      "path": [
        "Refroidissement",
        "Tuyauterie et brides",
        "Hoses/Pipes/Flanges"
      ],
      "categoryIds": [
        100007,
        null,
        100099
      ],
      "finalCategoryId": 100099,
      "productId": 2148
    }
  ],
  "productIdsInArbo": [
    2148,
    4918,
    60869,
    60895,
    60991,
    61080,
    61183,
    61253
  ],
  "closestProductIds": [
    {
      "productId": 2148,
      "productName": "Vis de fermeture, conduite du liquide de refroidissement"
    },
    {
      "productId": 4918,
      "productName": "Vis de fermeture, carter de boîte de vitesses automatique"
    },
    {
      "productId": 60869,
      "productName": "Ressort, vis de fermeture (boîtier de filtre à huile)"
    },
    {
      "productId": 60895,
      "productName": "Vis de fermeture, logement du capteur NOx"
    },
    {
      "productId": 60991,
      "productName": "Vis de fermeture, boîte de transfert"
    }
  ]
}