{
  "productName": "Vis de correction du carrossage",
  "searchText": "Vis de correction du carrossage",
  "found": true,
  "hasMatch": true,
  "timestamp": "2025-12-03T07:33:33.222Z",
  "productId": 2967,
  "arborescence": {
    "Suspension d'essieu/Guidage des roues/Roues": {
      "categoryId": 100013,
      "categoryName": "Suspension d'essieu/Guidage des roues/Roues",
      "level": 1,
      "children": {
        "Fixation jambe de force / suspension": {
          "categoryId": null,
          "categoryName": "Fixation jambe de force / suspension",
          "level": 2,
          "children": {
            "Vis de correction du carrossage": {
              "categoryId": 100735,
              "categoryName": "Mounting, suspension strut",
              "level": 2,
              "children": [],
              "productId": 2967
            }
          }
        }
      }
    },
    "Suspension/Amortissement": {
      "categoryId": 100011,
      "categoryName": "Suspension/Amortissement",
      "level": 1,
      "children": {
        "Jambe de suspension/Amortisseur/Pièces d'assemblage": {
          "categoryId": null,
          "categoryName": "Jambe de suspension/Amortisseur/Pièces d'assemblage",
          "level": 2,
          "children": {
            "Vis de correction du carrossage": {
              "categoryId": 100381,
              "categoryName": "Suspension Strut/Shock Absorber/Parts",
              "level": 2,
              "children": {
                "Pièces de montage": {
                  "categoryId": null,
                  "categoryName": "Pièces de montage",
                  "level": 4,
                  "children": {
                    "Vis de correction du carrossage": {
                      "categoryId": 100372,
                      "categoryName": "Assembly Parts",
                      "level": 3,
                      "children": [],
                      "productId": 2967
                    }
                  }
                }
              },
              "productId": 2967
            }
          }
        },
        "Jeu de suspensions complet": {
          "categoryId": null,
          "categoryName": "Jeu de suspensions complet",
          "level": 2,
          "children": {
            "Vis de correction du carrossage": {
              "categoryId": 100370,
              "categoryName": "Suspension Kit, complete",
              "level": 2,
              "children": [],
              "productId": 2967
            }
          }
        }
      }
    }
  },
  "arborescenceText": "├── Suspension d'essieu/Guidage des roues/Roues [ID: 100013] (Niveau 1)\n│   └── Fixation jambe de force / suspension (Niveau 2)\n│       └── Mounting, suspension strut [ID: 100735] (Niveau 2) → ProductId: 2967\n\n└── Suspension/Amortissement [ID: 100011] (Niveau 1)\n    ├── Jambe de suspension/Amortisseur/Pièces d'assemblage (Niveau 2)\n    │   └── Suspension Strut/Shock Absorber/Parts [ID: 100381] (Niveau 2) → ProductId: 2967\n    │       └── Pièces de montage (Niveau 4)\n    │           └── Assembly Parts [ID: 100372] (Niveau 3) → ProductId: 2967\n    └── Jeu de suspensions complet (Niveau 2)\n        └── Suspension Kit, complete [ID: 100370] (Niveau 2) → ProductId: 2967",
  "arborescencePaths": [
    {
      "path": [
        "Suspension d'essieu/Guidage des roues/Roues",
        "Fixation jambe de force / suspension",
        "Mounting, suspension strut"
      ],
      "categoryIds": [
        100013,
        null,
        100735
      ],
      "finalCategoryId": 100735,
      "productId": 2967
    },
    {
      "path": [
        "Suspension/Amortissement",
        "Jambe de suspension/Amortisseur/Pièces d'assemblage",
        "Suspension Strut/Shock Absorber/Parts"
      ],
      "categoryIds": [
        100011,
        null,
        100381
      ],
      "finalCategoryId": 100381,
      "productId": 2967
    },
    {
      "path": [
        "Suspension/Amortissement",
        "Jeu de suspensions complet",
        "Suspension Kit, complete"
      ],
      "categoryIds": [
        100011,
        null,
        100370
      ],
      "finalCategoryId": 100370,
      "productId": 2967
    }
  ],
  "productIdsInArbo": [
    2967
  ],
  "matchedProductIds": [
    2967
  ]
}