{
  "productName": "Vis creuse",
  "searchText": "Vis creuse",
  "found": true,
  "hasMatch": false,
  "timestamp": "2025-12-03T07:33:19.178Z",
  "productId": 2313,
  "arborescence": {
    "Échappement": {
      "categoryId": 100004,
      "categoryName": "Échappement",
      "level": 1,
      "children": {
        "Turbocompresseur": {
          "categoryId": null,
          "categoryName": "Turbocompresseur",
          "level": 2,
          "children": {
            "Vis creuse, compresseur": {
              "categoryId": 100872,
              "categoryName": "Charger",
              "level": 2,
              "children": [],
              "productId": 3740
            }
          }
        }
      }
    },
    "Moteur": {
      "categoryId": 100002,
      "categoryName": "Moteur",
      "level": 1,
      "children": {
        "Alimentation en air": {
          "categoryId": null,
          "categoryName": "Alimentation en air",
          "level": 2,
          "children": {
            "Vis creuse, compresseur": {
              "categoryId": 100383,
              "categoryName": "Air Supply",
              "level": 2,
              "children": {
                "Suralimentation": {
                  "categoryId": null,
                  "categoryName": "Suralimentation",
                  "level": 4,
                  "children": {
                    "Vis creuse, compresseur": {
                      "categoryId": 100390,
                      "categoryName": "Charging (supercharged/turbocharged)",
                      "level": 3,
                      "children": {
                        "Compresseur/composants": {
                          "categoryId": null,
                          "categoryName": "Compresseur/composants",
                          "level": 6,
                          "children": {
                            "Vis creuse, compresseur": {
                              "categoryId": 100391,
                              "categoryName": "Charger/-parts",
                              "level": 4,
                              "children": [],
                              "productId": 3740
                            }
                          }
                        }
                      },
                      "productId": 3740
                    }
                  }
                }
              },
              "productId": 3740
            }
          }
        },
        "Culasse / pieces de montage": {
          "categoryId": null,
          "categoryName": "Culasse / pieces de montage",
          "level": 2,
          "children": {
            "Vis creuse, remplissage d'huile": {
              "categoryId": 100373,
              "categoryName": "Cylinder Head/Attachment Parts",
              "level": 2,
              "children": {
                "Couvercle de remplissage d'huile/joint": {
                  "categoryId": null,
                  "categoryName": "Couvercle de remplissage d'huile/joint",
                  "level": 4,
                  "children": {
                    "Vis creuse, remplissage d'huile": {
                      "categoryId": 100379,
                      "categoryName": "Oil Filler Cap/Seal",
                      "level": 3,
                      "children": [],
                      "productId": 5648
                    }
                  }
                }
              },
              "productId": 5648
            }
          }
        }
      }
    }
  },
  "arborescenceText": "├── Échappement [ID: 100004] (Niveau 1)\n│   └── Turbocompresseur (Niveau 2)\n│       └── Charger [ID: 100872] (Niveau 2) → ProductId: 3740\n\n└── Moteur [ID: 100002] (Niveau 1)\n    ├── Alimentation en air (Niveau 2)\n    │   └── Air Supply [ID: 100383] (Niveau 2) → ProductId: 3740\n    │       └── Suralimentation (Niveau 4)\n    │           └── Charging (supercharged/turbocharged) [ID: 100390] (Niveau 3) → ProductId: 3740\n    │               └── Compresseur/composants (Niveau 6)\n    │                   └── Charger/-parts [ID: 100391] (Niveau 4) → ProductId: 3740\n    └── Culasse / pieces de montage (Niveau 2)\n        └── Cylinder Head/Attachment Parts [ID: 100373] (Niveau 2) → ProductId: 5648\n            └── Couvercle de remplissage d'huile/joint (Niveau 4)\n                └── Oil Filler Cap/Seal [ID: 100379] (Niveau 3) → ProductId: 5648",
  "arborescencePaths": [
    {
      "path": [
        "Échappement",
        "Turbocompresseur",
        "Charger"
      ],
      "categoryIds": [
        100004,
        null,
        100872
      ],
      "finalCategoryId": 100872,
      "productId": 3740
    },
    {
      "path": [
        "Moteur",
        "Alimentation en air",
        "Air Supply"
      ],
      "categoryIds": [
        100002,
        null,
        100383
      ],
      "finalCategoryId": 100383,
      "productId": 3740
    },
    {
      "path": [
        "Moteur",
        "Culasse / pieces de montage",
        "Cylinder Head/Attachment Parts"
      ],
      "categoryIds": [
        100002,
        null,
        100373
      ],
      "finalCategoryId": 100373,
      "productId": 5648
    }
  ],
  "productIdsInArbo": [
    3740,
    5648
  ],
  "closestProductIds": [
    {
      "productId": 3740,
      "productName": "Vis creuse, compresseur"
    },
    {
      "productId": 5648,
      "productName": "Vis creuse, remplissage d'huile"
    }
  ]
}