{
  "productName": "Élément de sécurité",
  "searchText": "Élément de sécurité",
  "found": true,
  "hasMatch": false,
  "timestamp": "2025-12-03T07:39:26.520Z",
  "productId": 1486,
  "arborescence": {
    "Alimentation carburant": {
      "categoryId": 100214,
      "categoryName": "Alimentation carburant",
      "level": 1,
      "children": {
        "Boîtier/filtre à carburant": {
          "categoryId": null,
          "categoryName": "Boîtier/filtre à carburant",
          "level": 2,
          "children": {
            "Goupille fendue à ressort, filtre à carburant (thermostat)": {
              "categoryId": 100253,
              "categoryName": "Fuel Filter/Housing",
              "level": 2,
              "children": [],
              "productId": 6309
            }
          }
        }
      }
    },
    "Boîte de vitesses": {
      "categoryId": 100238,
      "categoryName": "Boîte de vitesses",
      "level": 1,
      "children": {
        "Boîte de vitesse automatique": {
          "categoryId": null,
          "categoryName": "Boîte de vitesse automatique",
          "level": 2,
          "children": {
            "Goupille sécurité, fermeture jauge niveau d'huile boîte auto": {
              "categoryId": 100240,
              "categoryName": "Automatic Transmission",
              "level": 2,
              "children": {
                "Jauge d'huile": {
                  "categoryId": null,
                  "categoryName": "Jauge d'huile",
                  "level": 4,
                  "children": {
                    "Goupille sécurité, fermeture jauge niveau d'huile boîte auto": {
                      "categoryId": 105997,
                      "categoryName": "Oil Dipstick",
                      "level": 3,
                      "children": [],
                      "productId": 8013
                    }
                  }
                }
              },
              "productId": 8013
            }
          }
        },
        "Boîte de vitesses manuelle": {
          "categoryId": null,
          "categoryName": "Boîte de vitesses manuelle",
          "level": 2,
          "children": {
            "Circlip, synchroniseur": {
              "categoryId": 100239,
              "categoryName": "Manual Transmission",
              "level": 2,
              "children": {
                "Carter/composants": {
                  "categoryId": null,
                  "categoryName": "Carter/composants",
                  "level": 4,
                  "children": {
                    "Circlip, synchroniseur": {
                      "categoryId": 100774,
                      "categoryName": "Transmission Housing/Parts",
                      "level": 3,
                      "children": [],
                      "productId": 4139
                    }
                  }
                }
              },
              "productId": 4139
            }
          }
        }
      }
    },
    "Dispositif d'attelage/accessoires": {
      "categoryId": 100015,
      "categoryName": "Dispositif d'attelage/accessoires",
      "level": 1,
      "children": {
        "Composants / pièces de montage": {
          "categoryId": null,
          "categoryName": "Composants / pièces de montage",
          "level": 2,
          "children": {
            "Goupille, embrayage à mâchoires": {
              "categoryId": 100609,
              "categoryName": "Parts",
              "level": 2,
              "children": [],
              "productId": 5127
            }
          }
        }
      }
    },
    "Dispositif de freinage": {
      "categoryId": 100006,
      "categoryName": "Dispositif de freinage",
      "level": 1,
      "children": {
        "Frein à disque": {
          "categoryId": null,
          "categoryName": "Frein à disque",
          "level": 2,
          "children": {
            "Goupille élast., boulon de guidage (garnit. frein à disque)": {
              "categoryId": 100626,
              "categoryName": "Disc Brake",
              "level": 2,
              "children": {
                "Accessoires / composants": {
                  "categoryId": null,
                  "categoryName": "Accessoires / composants",
                  "level": 4,
                  "children": {
                    "Goupille élast., boulon de guidage (garnit. frein à disque)": {
                      "categoryId": 100630,
                      "categoryName": "Accessories/Parts",
                      "level": 3,
                      "children": [],
                      "productId": 61458
                    }
                  }
                }
              },
              "productId": 61458
            }
          }
        }
      }
    },
    "Échappement": {
      "categoryId": 100004,
      "categoryName": "Échappement",
      "level": 1,
      "children": {
        "Turbocompresseur": {
          "categoryId": null,
          "categoryName": "Turbocompresseur",
          "level": 2,
          "children": {
            "Rondelle d'arrêt, compresseur": {
              "categoryId": 100872,
              "categoryName": "Charger",
              "level": 2,
              "children": [],
              "productId": 3736
            }
          }
        }
      }
    },
    "Entraînement des essieux": {
      "categoryId": 100400,
      "categoryName": "Entraînement des essieux",
      "level": 1,
      "children": {
        "Différentiel": {
          "categoryId": null,
          "categoryName": "Différentiel",
          "level": 2,
          "children": {
            "Rondelle d'arrêt, fixation du bride-différentiel": {
              "categoryId": 100415,
              "categoryName": "Differential",
              "level": 2,
              "children": [],
              "productId": 4011
            }
          }
        }
      }
    },
    "Filtre": {
      "categoryId": 100005,
      "categoryName": "Filtre",
      "level": 1,
      "children": {
        "Filtre à carburant": {
          "categoryId": null,
          "categoryName": "Filtre à carburant",
          "level": 2,
          "children": {
            "Goupille fendue à ressort, filtre à carburant (thermostat)": {
              "categoryId": 100261,
              "categoryName": "Fuel Filter",
              "level": 2,
              "children": [],
              "productId": 6309
            }
          }
        }
      }
    },
    "Moteur": {
      "categoryId": 100002,
      "categoryName": "Moteur",
      "level": 1,
      "children": {
        "Alimentation en air": {
          "categoryId": null,
          "categoryName": "Alimentation en air",
          "level": 2,
          "children": {
            "Rondelle d'arrêt, compresseur": {
              "categoryId": 100383,
              "categoryName": "Air Supply",
              "level": 2,
              "children": {
                "Suralimentation": {
                  "categoryId": null,
                  "categoryName": "Suralimentation",
                  "level": 4,
                  "children": {
                    "Rondelle d'arrêt, compresseur": {
                      "categoryId": 100390,
                      "categoryName": "Charging (supercharged/turbocharged)",
                      "level": 3,
                      "children": {
                        "Compresseur/composants": {
                          "categoryId": null,
                          "categoryName": "Compresseur/composants",
                          "level": 6,
                          "children": {
                            "Rondelle d'arrêt, compresseur": {
                              "categoryId": 100391,
                              "categoryName": "Charger/-parts",
                              "level": 4,
                              "children": [],
                              "productId": 3736
                            }
                          }
                        }
                      },
                      "productId": 3736
                    }
                  }
                }
              },
              "productId": 3736
            }
          }
        }
      }
    },
    "Pièces de maintenance": {
      "categoryId": 100019,
      "categoryName": "Pièces de maintenance",
      "level": 1,
      "children": {
        "Travaux supplémentaires": {
          "categoryId": null,
          "categoryName": "Travaux supplémentaires",
          "level": 2,
          "children": {
            "Goupille fendue à ressort, filtre à carburant (thermostat)": {
              "categoryId": 100598,
              "categoryName": "Additional Repairs",
              "level": 2,
              "children": [],
              "productId": 6309
            }
          }
        }
      }
    },
    "Roues/Pneus": {
      "categoryId": 103099,
      "categoryName": "Roues/Pneus",
      "level": 1,
      "children": {
        "Accessoires": {
          "categoryId": null,
          "categoryName": "Accessoires",
          "level": 2,
          "children": {
            "Goupille fendue à ressort, pivot de roue": {
              "categoryId": 103102,
              "categoryName": "Accessories",
              "level": 2,
              "children": [],
              "productId": 3652
            }
          }
        }
      }
    },
    "Suspension d'essieu/Guidage des roues/Roues": {
      "categoryId": 100013,
      "categoryName": "Suspension d'essieu/Guidage des roues/Roues",
      "level": 1,
      "children": {
        "Fusée d'essieu / kit de réparation": {
          "categoryId": null,
          "categoryName": "Fusée d'essieu / kit de réparation",
          "level": 2,
          "children": {
            "Circlip, pivot de fusée d'essieu": {
              "categoryId": 100207,
              "categoryName": "Steering Knuckle/Repair Kit",
              "level": 2,
              "children": {
                "Pivot de fusée d'essieu": {
                  "categoryId": null,
                  "categoryName": "Pivot de fusée d'essieu",
                  "level": 4,
                  "children": {
                    "Circlip, pivot de fusée d'essieu": {
                      "categoryId": 100588,
                      "categoryName": "Kingpin",
                      "level": 3,
                      "children": [],
                      "productId": 3651
                    }
                  }
                }
              },
              "productId": 3651
            }
          }
        },
        "Roue / fixation de la roue": {
          "categoryId": null,
          "categoryName": "Roue / fixation de la roue",
          "level": 2,
          "children": {
            "Goupille fendue à ressort, pivot de roue": {
              "categoryId": 100213,
              "categoryName": "Wheel/Wheel Fastening",
              "level": 2,
              "children": [],
              "productId": 3652
            }
          }
        }
      }
    }
  },
  "arborescenceText": "├── Alimentation carburant [ID: 100214] (Niveau 1)\n│   └── Boîtier/filtre à carburant (Niveau 2)\n│       └── Fuel Filter/Housing [ID: 100253] (Niveau 2) → ProductId: 6309\n\n├── Boîte de vitesses [ID: 100238] (Niveau 1)\n│   ├── Boîte de vitesse automatique (Niveau 2)\n│   │   └── Automatic Transmission [ID: 100240] (Niveau 2) → ProductId: 8013\n│   │       └── Jauge d'huile (Niveau 4)\n│   │           └── Oil Dipstick [ID: 105997] (Niveau 3) → ProductId: 8013\n│   └── Boîte de vitesses manuelle (Niveau 2)\n│       └── Manual Transmission [ID: 100239] (Niveau 2) → ProductId: 4139\n│           └── Carter/composants (Niveau 4)\n│               └── Transmission Housing/Parts [ID: 100774] (Niveau 3) → ProductId: 4139\n\n├── Dispositif d'attelage/accessoires [ID: 100015] (Niveau 1)\n│   └── Composants / pièces de montage (Niveau 2)\n│       └── Parts [ID: 100609] (Niveau 2) → ProductId: 5127\n\n├── Dispositif de freinage [ID: 100006] (Niveau 1)\n│   └── Frein à disque (Niveau 2)\n│       └── Disc Brake [ID: 100626] (Niveau 2) → ProductId: 61458\n│           └── Accessoires / composants (Niveau 4)\n│               └── Accessories/Parts [ID: 100630] (Niveau 3) → ProductId: 61458\n\n├── Échappement [ID: 100004] (Niveau 1)\n│   └── Turbocompresseur (Niveau 2)\n│       └── Charger [ID: 100872] (Niveau 2) → ProductId: 3736\n\n├── Entraînement des essieux [ID: 100400] (Niveau 1)\n│   └── Différentiel (Niveau 2)\n│       └── Differential [ID: 100415] (Niveau 2) → ProductId: 4011\n\n├── Filtre [ID: 100005] (Niveau 1)\n│   └── Filtre à carburant (Niveau 2)\n│       └── Fuel Filter [ID: 100261] (Niveau 2) → ProductId: 6309\n\n├── Moteur [ID: 100002] (Niveau 1)\n│   └── Alimentation en air (Niveau 2)\n│       └── Air Supply [ID: 100383] (Niveau 2) → ProductId: 3736\n│           └── Suralimentation (Niveau 4)\n│               └── Charging (supercharged/turbocharged) [ID: 100390] (Niveau 3) → ProductId: 3736\n│                   └── Compresseur/composants (Niveau 6)\n│                       └── Charger/-parts [ID: 100391] (Niveau 4) → ProductId: 3736\n\n├── Pièces de maintenance [ID: 100019] (Niveau 1)\n│   └── Travaux supplémentaires (Niveau 2)\n│       └── Additional Repairs [ID: 100598] (Niveau 2) → ProductId: 6309\n\n├── Roues/Pneus [ID: 103099] (Niveau 1)\n│   └── Accessoires (Niveau 2)\n│       └── Accessories [ID: 103102] (Niveau 2) → ProductId: 3652\n\n└── Suspension d'essieu/Guidage des roues/Roues [ID: 100013] (Niveau 1)\n    ├── Fusée d'essieu / kit de réparation (Niveau 2)\n    │   └── Steering Knuckle/Repair Kit [ID: 100207] (Niveau 2) → ProductId: 3651\n    │       └── Pivot de fusée d'essieu (Niveau 4)\n    │           └── Kingpin [ID: 100588] (Niveau 3) → ProductId: 3651\n    └── Roue / fixation de la roue (Niveau 2)\n        └── Wheel/Wheel Fastening [ID: 100213] (Niveau 2) → ProductId: 3652",
  "arborescencePaths": [
    {
      "path": [
        "Alimentation carburant",
        "Boîtier/filtre à carburant",
        "Fuel Filter/Housing"
      ],
      "categoryIds": [
        100214,
        null,
        100253
      ],
      "finalCategoryId": 100253,
      "productId": 6309
    },
    {
      "path": [
        "Boîte de vitesses",
        "Boîte de vitesse automatique",
        "Automatic Transmission"
      ],
      "categoryIds": [
        100238,
        null,
        100240
      ],
      "finalCategoryId": 100240,
      "productId": 8013
    },
    {
      "path": [
        "Boîte de vitesses",
        "Boîte de vitesses manuelle",
        "Manual Transmission"
      ],
      "categoryIds": [
        100238,
        null,
        100239
      ],
      "finalCategoryId": 100239,
      "productId": 4139
    },
    {
      "path": [
        "Dispositif d'attelage/accessoires",
        "Composants / pièces de montage",
        "Parts"
      ],
      "categoryIds": [
        100015,
        null,
        100609
      ],
      "finalCategoryId": 100609,
      "productId": 5127
    },
    {
      "path": [
        "Dispositif de freinage",
        "Frein à disque",
        "Disc Brake"
      ],
      "categoryIds": [
        100006,
        null,
        100626
      ],
      "finalCategoryId": 100626,
      "productId": 61458
    },
    {
      "path": [
        "Échappement",
        "Turbocompresseur",
        "Charger"
      ],
      "categoryIds": [
        100004,
        null,
        100872
      ],
      "finalCategoryId": 100872,
      "productId": 3736
    },
    {
      "path": [
        "Entraînement des essieux",
        "Différentiel",
        "Differential"
      ],
      "categoryIds": [
        100400,
        null,
        100415
      ],
      "finalCategoryId": 100415,
      "productId": 4011
    },
    {
      "path": [
        "Filtre",
        "Filtre à carburant",
        "Fuel Filter"
      ],
      "categoryIds": [
        100005,
        null,
        100261
      ],
      "finalCategoryId": 100261,
      "productId": 6309
    },
    {
      "path": [
        "Moteur",
        "Alimentation en air",
        "Air Supply"
      ],
      "categoryIds": [
        100002,
        null,
        100383
      ],
      "finalCategoryId": 100383,
      "productId": 3736
    },
    {
      "path": [
        "Pièces de maintenance",
        "Travaux supplémentaires",
        "Additional Repairs"
      ],
      "categoryIds": [
        100019,
        null,
        100598
      ],
      "finalCategoryId": 100598,
      "productId": 6309
    },
    {
      "path": [
        "Roues/Pneus",
        "Accessoires",
        "Accessories"
      ],
      "categoryIds": [
        103099,
        null,
        103102
      ],
      "finalCategoryId": 103102,
      "productId": 3652
    },
    {
      "path": [
        "Suspension d'essieu/Guidage des roues/Roues",
        "Fusée d'essieu / kit de réparation",
        "Steering Knuckle/Repair Kit"
      ],
      "categoryIds": [
        100013,
        null,
        100207
      ],
      "finalCategoryId": 100207,
      "productId": 3651
    },
    {
      "path": [
        "Suspension d'essieu/Guidage des roues/Roues",
        "Roue / fixation de la roue",
        "Wheel/Wheel Fastening"
      ],
      "categoryIds": [
        100013,
        null,
        100213
      ],
      "finalCategoryId": 100213,
      "productId": 3652
    }
  ],
  "productIdsInArbo": [
    3651,
    3652,
    3736,
    4011,
    4139,
    5127,
    6309,
    8013,
    61458
  ],
  "closestProductIds": [
    {
      "productId": 3651,
      "productName": "Circlip, pivot de fusée d'essieu"
    },
    {
      "productId": 3652,
      "productName": "Goupille fendue à ressort, pivot de roue"
    },
    {
      "productId": 3736,
      "productName": "Rondelle d'arrêt, compresseur"
    },
    {
      "productId": 4011,
      "productName": "Rondelle d'arrêt, fixation du bride-différentiel"
    },
    {
      "productId": 4139,
      "productName": "Circlip, synchroniseur"
    }
  ]
}