{
  "productName": "Élément de raccordement",
  "searchText": "Élément de raccordement",
  "found": true,
  "hasMatch": false,
  "timestamp": "2025-12-03T07:39:14.653Z",
  "productId": 1493,
  "arborescence": {
    "Alimentation carburant": {
      "categoryId": 100214,
      "categoryName": "Alimentation carburant",
      "level": 1,
      "children": {
        "Tuyauterie": {
          "categoryId": null,
          "categoryName": "Tuyauterie",
          "level": 2,
          "children": {
            "Raccord de tuyau, tuyau de carburant": {
              "categoryId": 100258,
              "categoryName": "Fuel Lines",
              "level": 2,
              "children": [],
              "productId": 612
            }
          }
        }
      }
    },
    "Boîte de vitesses": {
      "categoryId": 100238,
      "categoryName": "Boîte de vitesses",
      "level": 1,
      "children": {
        "Boîte de vitesse automatique": {
          "categoryId": null,
          "categoryName": "Boîte de vitesse automatique",
          "level": 2,
          "children": {
            "Boîtier de connecteur, unité de commande boîte automatique": {
              "categoryId": 100240,
              "categoryName": "Automatic Transmission",
              "level": 2,
              "children": {
                "Boîtier/composants": {
                  "categoryId": null,
                  "categoryName": "Boîtier/composants",
                  "level": 4,
                  "children": {
                    "Boîtier de connecteur, unité de commande boîte automatique": {
                      "categoryId": 100775,
                      "categoryName": "Transmission Housing/Parts",
                      "level": 3,
                      "children": [],
                      "productId": 4743
                    }
                  }
                },
                "Contrôle / hydraulique": {
                  "categoryId": null,
                  "categoryName": "Contrôle / hydraulique",
                  "level": 4,
                  "children": {
                    "Boîtier de connecteur, unité de commande boîte automatique": {
                      "categoryId": 100776,
                      "categoryName": "Transmission Control/Hydraulics",
                      "level": 3,
                      "children": [],
                      "productId": 4743
                    }
                  }
                }
              },
              "productId": 4743
            },
            "Élément de liaison, durite rad. huile (boîte vitesses auto.)": {
              "categoryId": 100240,
              "categoryName": "Automatic Transmission",
              "level": 2,
              "children": {
                "Contrôle / hydraulique": {
                  "categoryId": null,
                  "categoryName": "Contrôle / hydraulique",
                  "level": 4,
                  "children": {
                    "Élément de liaison, durite rad. huile (boîte vitesses auto.)": {
                      "categoryId": 100776,
                      "categoryName": "Transmission Control/Hydraulics",
                      "level": 3,
                      "children": [],
                      "productId": 8233
                    }
                  }
                }
              },
              "productId": 8233
            }
          }
        }
      }
    },
    "Chauffage / Ventilation": {
      "categoryId": 100241,
      "categoryName": "Chauffage / Ventilation",
      "level": 1,
      "children": {
        "Caisse de volets de chauffage": {
          "categoryId": null,
          "categoryName": "Caisse de volets de chauffage",
          "level": 2,
          "children": {
            "Piéce intermédiaire, tirette de volets de chauffage-levier": {
              "categoryId": 100348,
              "categoryName": "Heater Flap Box",
              "level": 2,
              "children": [],
              "productId": 5976
            }
          }
        }
      }
    },
    "Dispositif de freinage": {
      "categoryId": 100006,
      "categoryName": "Dispositif de freinage",
      "level": 1,
      "children": {
        "Levier / câble / tirette": {
          "categoryId": null,
          "categoryName": "Levier / câble / tirette",
          "level": 2,
          "children": {
            "Élément de connexion, câble (frein de stationnement)": {
              "categoryId": 100635,
              "categoryName": "Control Levers/Cables",
              "level": 2,
              "children": [],
              "productId": 60438
            }
          }
        },
        "Servofrein": {
          "categoryId": null,
          "categoryName": "Servofrein",
          "level": 2,
          "children": {
            "Raccord de tuyau": {
              "categoryId": 100025,
              "categoryName": "Brake Booster",
              "level": 2,
              "children": [],
              "productId": 1355
            }
          }
        }
      }
    },
    "Échappement": {
      "categoryId": 100004,
      "categoryName": "Échappement",
      "level": 1,
      "children": {
        "Injection d'urée": {
          "categoryId": null,
          "categoryName": "Injection d'urée",
          "level": 2,
          "children": {
            "Raccord de tuyau, Tuyau d'urée": {
              "categoryId": 103019,
              "categoryName": "Urea Injection",
              "level": 2,
              "children": {
                "Flexibles/Conduites": {
                  "categoryId": null,
                  "categoryName": "Flexibles/Conduites",
                  "level": 4,
                  "children": {
                    "Raccord de tuyau, Tuyau d'urée": {
                      "categoryId": 103401,
                      "categoryName": "Radiator Hoses",
                      "level": 3,
                      "children": [],
                      "productId": 4853
                    }
                  }
                }
              },
              "productId": 4853
            }
          }
        }
      }
    },
    "Nettoyage des vitres": {
      "categoryId": 100018,
      "categoryName": "Nettoyage des vitres",
      "level": 1,
      "children": {
        "Réservoir d'eau de lavage / conduite": {
          "categoryId": null,
          "categoryName": "Réservoir d'eau de lavage / conduite",
          "level": 2,
          "children": {
            "Pièce de jonction, tuyauterie d'eau de nettoyage": {
              "categoryId": 100610,
              "categoryName": "Water Tank/ Pipe, windscreen",
              "level": 2,
              "children": [],
              "productId": 839
            }
          }
        }
      }
    },
    "Système pneumatique": {
      "categoryId": 103168,
      "categoryName": "Système pneumatique",
      "level": 1,
      "children": {
        "Connecteurs/Câbles": {
          "categoryId": null,
          "categoryName": "Connecteurs/Câbles",
          "level": 2,
          "children": {
            "Connecteur, conduite d'air comprimé": {
              "categoryId": 103197,
              "categoryName": "Hoses/Connector Pipes",
              "level": 2,
              "children": [],
              "productId": 373
            }
          }
        }
      }
    }
  },
  "arborescenceText": "├── Alimentation carburant [ID: 100214] (Niveau 1)\n│   └── Tuyauterie (Niveau 2)\n│       └── Fuel Lines [ID: 100258] (Niveau 2) → ProductId: 612\n\n├── Boîte de vitesses [ID: 100238] (Niveau 1)\n│   └── Boîte de vitesse automatique (Niveau 2)\n│       ├── Automatic Transmission [ID: 100240] (Niveau 2) → ProductId: 4743\n│       │   ├── Boîtier/composants (Niveau 4)\n│       │   │   └── Transmission Housing/Parts [ID: 100775] (Niveau 3) → ProductId: 4743\n│       │   └── Contrôle / hydraulique (Niveau 4)\n│       │       └── Transmission Control/Hydraulics [ID: 100776] (Niveau 3) → ProductId: 4743\n│       └── Automatic Transmission [ID: 100240] (Niveau 2) → ProductId: 8233\n│           └── Contrôle / hydraulique (Niveau 4)\n│               └── Transmission Control/Hydraulics [ID: 100776] (Niveau 3) → ProductId: 8233\n\n├── Chauffage / Ventilation [ID: 100241] (Niveau 1)\n│   └── Caisse de volets de chauffage (Niveau 2)\n│       └── Heater Flap Box [ID: 100348] (Niveau 2) → ProductId: 5976\n\n├── Dispositif de freinage [ID: 100006] (Niveau 1)\n│   ├── Levier / câble / tirette (Niveau 2)\n│   │   └── Control Levers/Cables [ID: 100635] (Niveau 2) → ProductId: 60438\n│   └── Servofrein (Niveau 2)\n│       └── Brake Booster [ID: 100025] (Niveau 2) → ProductId: 1355\n\n├── Échappement [ID: 100004] (Niveau 1)\n│   └── Injection d'urée (Niveau 2)\n│       └── Urea Injection [ID: 103019] (Niveau 2) → ProductId: 4853\n│           └── Flexibles/Conduites (Niveau 4)\n│               └── Radiator Hoses [ID: 103401] (Niveau 3) → ProductId: 4853\n\n├── Nettoyage des vitres [ID: 100018] (Niveau 1)\n│   └── Réservoir d'eau de lavage / conduite (Niveau 2)\n│       └── Water Tank/ Pipe, windscreen [ID: 100610] (Niveau 2) → ProductId: 839\n\n└── Système pneumatique [ID: 103168] (Niveau 1)\n    └── Connecteurs/Câbles (Niveau 2)\n        └── Hoses/Connector Pipes [ID: 103197] (Niveau 2) → ProductId: 373",
  "arborescencePaths": [
    {
      "path": [
        "Alimentation carburant",
        "Tuyauterie",
        "Fuel Lines"
      ],
      "categoryIds": [
        100214,
        null,
        100258
      ],
      "finalCategoryId": 100258,
      "productId": 612
    },
    {
      "path": [
        "Boîte de vitesses",
        "Boîte de vitesse automatique",
        "Automatic Transmission"
      ],
      "categoryIds": [
        100238,
        null,
        100240
      ],
      "finalCategoryId": 100240,
      "productId": 4743
    },
    {
      "path": [
        "Boîte de vitesses",
        "Boîte de vitesse automatique",
        "Automatic Transmission"
      ],
      "categoryIds": [
        100238,
        null,
        100240
      ],
      "finalCategoryId": 100240,
      "productId": 8233
    },
    {
      "path": [
        "Chauffage / Ventilation",
        "Caisse de volets de chauffage",
        "Heater Flap Box"
      ],
      "categoryIds": [
        100241,
        null,
        100348
      ],
      "finalCategoryId": 100348,
      "productId": 5976
    },
    {
      "path": [
        "Dispositif de freinage",
        "Levier / câble / tirette",
        "Control Levers/Cables"
      ],
      "categoryIds": [
        100006,
        null,
        100635
      ],
      "finalCategoryId": 100635,
      "productId": 60438
    },
    {
      "path": [
        "Dispositif de freinage",
        "Servofrein",
        "Brake Booster"
      ],
      "categoryIds": [
        100006,
        null,
        100025
      ],
      "finalCategoryId": 100025,
      "productId": 1355
    },
    {
      "path": [
        "Échappement",
        "Injection d'urée",
        "Urea Injection"
      ],
      "categoryIds": [
        100004,
        null,
        103019
      ],
      "finalCategoryId": 103019,
      "productId": 4853
    },
    {
      "path": [
        "Nettoyage des vitres",
        "Réservoir d'eau de lavage / conduite",
        "Water Tank/ Pipe, windscreen"
      ],
      "categoryIds": [
        100018,
        null,
        100610
      ],
      "finalCategoryId": 100610,
      "productId": 839
    },
    {
      "path": [
        "Système pneumatique",
        "Connecteurs/Câbles",
        "Hoses/Connector Pipes"
      ],
      "categoryIds": [
        103168,
        null,
        103197
      ],
      "finalCategoryId": 103197,
      "productId": 373
    }
  ],
  "productIdsInArbo": [
    373,
    612,
    839,
    1355,
    4743,
    4853,
    5976,
    8233,
    60438
  ],
  "closestProductIds": [
    {
      "productId": 373,
      "productName": "Connecteur, conduite d'air comprimé"
    },
    {
      "productId": 612,
      "productName": "Raccord de tuyau, tuyau de carburant"
    },
    {
      "productId": 839,
      "productName": "Pièce de jonction, tuyauterie d'eau de nettoyage"
    },
    {
      "productId": 1355,
      "productName": "Raccord de tuyau"
    },
    {
      "productId": 4743,
      "productName": "Boîtier de connecteur, unité de commande boîte automatique"
    }
  ]
}