{
  "productName": "Cylindre de frein à ressort",
  "productId": 354,
  "searchText": "Cylindre de frein à ressort",
  "originalFound": false,
  "tests": [
    {
      "typeId": 2,
      "found": true,
      "hasMatch": true,
      "arborescence": {
        "Dispositif de freinage": {
          "categoryId": 200058,
          "categoryName": "Dispositif de freinage",
          "level": 1,
          "children": {
            "Cylindres de frein / système d'air comprimé": {
              "categoryId": null,
              "categoryName": "Cylindres de frein / système d'air comprimé",
              "level": 2,
              "children": {
                "Cylindre de frein à ressort": {
                  "categoryId": 200925,
                  "categoryName": "Brake Cylinder/Compressed-air System",
                  "level": 2,
                  "children": {
                    "Cylindre de frein à ressort accumulateur": {
                      "categoryId": null,
                      "categoryName": "Cylindre de frein à ressort accumulateur",
                      "level": 4,
                      "children": {
                        "Cylindre de frein à ressort": {
                          "categoryId": 200903,
                          "categoryName": "Spring-loaded Brake Cylinder",
                          "level": 3,
                          "children": [],
                          "productId": 354
                        }
                      }
                    }
                  },
                  "productId": 354
                },
                "Diaphragme, cylindre à ressort": {
                  "categoryId": 200925,
                  "categoryName": "Brake Cylinder/Compressed-air System",
                  "level": 2,
                  "children": {
                    "Cylindre de frein à ressort accumulateur": {
                      "categoryId": null,
                      "categoryName": "Cylindre de frein à ressort accumulateur",
                      "level": 4,
                      "children": {
                        "Diaphragme, cylindre à ressort": {
                          "categoryId": 200903,
                          "categoryName": "Spring-loaded Brake Cylinder",
                          "level": 3,
                          "children": [],
                          "productId": 3010
                        }
                      }
                    }
                  },
                  "productId": 3010
                },
                "Tête de fourche, cylindre à ressort": {
                  "categoryId": 200925,
                  "categoryName": "Brake Cylinder/Compressed-air System",
                  "level": 2,
                  "children": {
                    "Cylindre de frein à ressort accumulateur": {
                      "categoryId": null,
                      "categoryName": "Cylindre de frein à ressort accumulateur",
                      "level": 4,
                      "children": {
                        "Tête de fourche, cylindre à ressort": {
                          "categoryId": 200903,
                          "categoryName": "Spring-loaded Brake Cylinder",
                          "level": 3,
                          "children": [],
                          "productId": 4374
                        }
                      }
                    }
                  },
                  "productId": 4374
                }
              }
            }
          }
        },
        "Système pneumatique": {
          "categoryId": 200059,
          "categoryName": "Système pneumatique",
          "level": 1,
          "children": {
            "Cylindres de frein/de travail": {
              "categoryId": null,
              "categoryName": "Cylindres de frein/de travail",
              "level": 2,
              "children": {
                "Cylindre de frein à ressort": {
                  "categoryId": 200116,
                  "categoryName": "Brake/Slave Cylinder",
                  "level": 2,
                  "children": {
                    "Cylindre de frein à ressort accumulateur": {
                      "categoryId": null,
                      "categoryName": "Cylindre de frein à ressort accumulateur",
                      "level": 4,
                      "children": {
                        "Cylindre de frein à ressort": {
                          "categoryId": 200874,
                          "categoryName": "Spring-loaded Brake Cylinder",
                          "level": 3,
                          "children": [],
                          "productId": 354
                        }
                      }
                    }
                  },
                  "productId": 354
                }
              }
            }
          }
        }
      },
      "arborescenceText": "├── Dispositif de freinage [ID: 200058] (Niveau 1)\n│   └── Cylindres de frein / système d'air comprimé (Niveau 2)\n│       ├── Brake Cylinder/Compressed-air System [ID: 200925] (Niveau 2) → ProductId: 354\n│       │   └── Cylindre de frein à ressort accumulateur (Niveau 4)\n│       │       └── Spring-loaded Brake Cylinder [ID: 200903] (Niveau 3) → ProductId: 354\n│       ├── Brake Cylinder/Compressed-air System [ID: 200925] (Niveau 2) → ProductId: 3010\n│       │   └── Cylindre de frein à ressort accumulateur (Niveau 4)\n│       │       └── Spring-loaded Brake Cylinder [ID: 200903] (Niveau 3) → ProductId: 3010\n│       └── Brake Cylinder/Compressed-air System [ID: 200925] (Niveau 2) → ProductId: 4374\n│           └── Cylindre de frein à ressort accumulateur (Niveau 4)\n│               └── Spring-loaded Brake Cylinder [ID: 200903] (Niveau 3) → ProductId: 4374\n\n└── Système pneumatique [ID: 200059] (Niveau 1)\n    └── Cylindres de frein/de travail (Niveau 2)\n        └── Brake/Slave Cylinder [ID: 200116] (Niveau 2) → ProductId: 354\n            └── Cylindre de frein à ressort accumulateur (Niveau 4)\n                └── Spring-loaded Brake Cylinder [ID: 200874] (Niveau 3) → ProductId: 354",
      "productIdsInArbo": [
        354,
        3010,
        4374
      ],
      "matchedProductIds": [
        354
      ]
    }
  ],
  "timestamp": "2025-12-03T10:15:57.031Z",
  "bestMatch": {
    "typeId": 2,
    "found": true,
    "hasMatch": true
  }
}