{
  "productName": "Cylindre de frein à piston",
  "productId": 360,
  "searchText": "Cylindre de frein à piston",
  "originalFound": false,
  "tests": [
    {
      "typeId": 2,
      "found": true,
      "hasMatch": true,
      "arborescence": {
        "Dispositif de freinage": {
          "categoryId": 200058,
          "categoryName": "Dispositif de freinage",
          "level": 1,
          "children": {
            "Cylindres de frein / système d'air comprimé": {
              "categoryId": null,
              "categoryName": "Cylindres de frein / système d'air comprimé",
              "level": 2,
              "children": {
                "Cylindre de frein à piston": {
                  "categoryId": 200925,
                  "categoryName": "Brake Cylinder/Compressed-air System",
                  "level": 2,
                  "children": {
                    "Cylindre de frein de piston": {
                      "categoryId": null,
                      "categoryName": "Cylindre de frein de piston",
                      "level": 4,
                      "children": {
                        "Cylindre de frein à piston": {
                          "categoryId": 200902,
                          "categoryName": "Piston Brake Cylinder",
                          "level": 3,
                          "children": [],
                          "productId": 360
                        }
                      }
                    }
                  },
                  "productId": 360
                }
              }
            }
          }
        },
        "Système pneumatique": {
          "categoryId": 200059,
          "categoryName": "Système pneumatique",
          "level": 1,
          "children": {
            "Cylindres de frein/de travail": {
              "categoryId": null,
              "categoryName": "Cylindres de frein/de travail",
              "level": 2,
              "children": {
                "Cylindre de frein à piston": {
                  "categoryId": 200116,
                  "categoryName": "Brake/Slave Cylinder",
                  "level": 2,
                  "children": {
                    "Cylindre de frein de piston": {
                      "categoryId": null,
                      "categoryName": "Cylindre de frein de piston",
                      "level": 4,
                      "children": {
                        "Cylindre de frein à piston": {
                          "categoryId": 200501,
                          "categoryName": "Piston Brake Cylinder",
                          "level": 3,
                          "children": [],
                          "productId": 360
                        }
                      }
                    }
                  },
                  "productId": 360
                }
              }
            }
          }
        }
      },
      "arborescenceText": "├── Dispositif de freinage [ID: 200058] (Niveau 1)\n│   └── Cylindres de frein / système d'air comprimé (Niveau 2)\n│       └── Brake Cylinder/Compressed-air System [ID: 200925] (Niveau 2) → ProductId: 360\n│           └── Cylindre de frein de piston (Niveau 4)\n│               └── Piston Brake Cylinder [ID: 200902] (Niveau 3) → ProductId: 360\n\n└── Système pneumatique [ID: 200059] (Niveau 1)\n    └── Cylindres de frein/de travail (Niveau 2)\n        └── Brake/Slave Cylinder [ID: 200116] (Niveau 2) → ProductId: 360\n            └── Cylindre de frein de piston (Niveau 4)\n                └── Piston Brake Cylinder [ID: 200501] (Niveau 3) → ProductId: 360",
      "productIdsInArbo": [
        360
      ],
      "matchedProductIds": [
        360
      ]
    }
  ],
  "timestamp": "2025-12-03T10:15:55.328Z",
  "bestMatch": {
    "typeId": 2,
    "found": true,
    "hasMatch": true
  }
}