{
  "productName": "Cylindre culbuteur, cabine",
  "productId": 523,
  "searchText": "Cylindre culbuteur, cabine",
  "originalFound": false,
  "tests": [
    {
      "typeId": 2,
      "found": true,
      "hasMatch": true,
      "arborescence": {
        "Cabine du conducteur/carrosserie": {
          "categoryId": 200022,
          "categoryName": "Cabine du conducteur/carrosserie",
          "level": 1,
          "children": {
            "Basculateur-cabine": {
              "categoryId": null,
              "categoryName": "Basculateur-cabine",
              "level": 2,
              "children": {
                "Cylindre culbuteur, cabine": {
                  "categoryId": 202897,
                  "categoryName": "Driver Cab Tilt Unit",
                  "level": 2,
                  "children": [],
                  "productId": 523
                },
                "Douille, cylindre culbuteur-cabine": {
                  "categoryId": 202897,
                  "categoryName": "Driver Cab Tilt Unit",
                  "level": 2,
                  "children": [],
                  "productId": 4409
                },
                "Kit de réparation, cylindre culbuteur": {
                  "categoryId": 202897,
                  "categoryName": "Driver Cab Tilt Unit",
                  "level": 2,
                  "children": [],
                  "productId": 4066
                },
                "Revêtement, cylindre culbuteur - cabine": {
                  "categoryId": 202897,
                  "categoryName": "Driver Cab Tilt Unit",
                  "level": 2,
                  "children": [],
                  "productId": 4398
                }
              }
            },
            "Suspension de la cabine": {
              "categoryId": null,
              "categoryName": "Suspension de la cabine",
              "level": 2,
              "children": {
                "Cylindre culbuteur, cabine": {
                  "categoryId": 200025,
                  "categoryName": "Driver Cab Suspension",
                  "level": 2,
                  "children": [],
                  "productId": 523
                },
                "Douille, cylindre culbuteur-cabine": {
                  "categoryId": 200025,
                  "categoryName": "Driver Cab Suspension",
                  "level": 2,
                  "children": [],
                  "productId": 4409
                },
                "Kit de réparation, cylindre culbuteur": {
                  "categoryId": 200025,
                  "categoryName": "Driver Cab Suspension",
                  "level": 2,
                  "children": [],
                  "productId": 4066
                },
                "Revêtement, cylindre culbuteur - cabine": {
                  "categoryId": 200025,
                  "categoryName": "Driver Cab Suspension",
                  "level": 2,
                  "children": [],
                  "productId": 4398
                }
              }
            }
          }
        },
        "Système hydraulique": {
          "categoryId": 200066,
          "categoryName": "Système hydraulique",
          "level": 1,
          "children": {
            "Cabine": {
              "categoryId": null,
              "categoryName": "Cabine",
              "level": 2,
              "children": {
                "Cylindre culbuteur, cabine": {
                  "categoryId": 200835,
                  "categoryName": "Driver Cab",
                  "level": 2,
                  "children": {
                    "Cylindre culbuteur, cabine": {
                      "categoryId": null,
                      "categoryName": "Cylindre culbuteur, cabine",
                      "level": 4,
                      "children": {
                        "Cylindre culbuteur, cabine": {
                          "categoryId": 200836,
                          "categoryName": "Tilt Cylinder, driver cab",
                          "level": 3,
                          "children": [],
                          "productId": 523
                        }
                      }
                    }
                  },
                  "productId": 523
                },
                "Douille, cylindre culbuteur-cabine": {
                  "categoryId": 200835,
                  "categoryName": "Driver Cab",
                  "level": 2,
                  "children": {
                    "Cylindre culbuteur, cabine": {
                      "categoryId": null,
                      "categoryName": "Cylindre culbuteur, cabine",
                      "level": 4,
                      "children": {
                        "Douille, cylindre culbuteur-cabine": {
                          "categoryId": 200836,
                          "categoryName": "Tilt Cylinder, driver cab",
                          "level": 3,
                          "children": [],
                          "productId": 4409
                        }
                      }
                    }
                  },
                  "productId": 4409
                },
                "Kit de réparation, cylindre culbuteur": {
                  "categoryId": 200835,
                  "categoryName": "Driver Cab",
                  "level": 2,
                  "children": {
                    "Cylindre culbuteur, cabine": {
                      "categoryId": null,
                      "categoryName": "Cylindre culbuteur, cabine",
                      "level": 4,
                      "children": {
                        "Kit de réparation, cylindre culbuteur": {
                          "categoryId": 200836,
                          "categoryName": "Tilt Cylinder, driver cab",
                          "level": 3,
                          "children": [],
                          "productId": 4066
                        }
                      }
                    }
                  },
                  "productId": 4066
                },
                "Revêtement, cylindre culbuteur - cabine": {
                  "categoryId": 200835,
                  "categoryName": "Driver Cab",
                  "level": 2,
                  "children": {
                    "Cylindre culbuteur, cabine": {
                      "categoryId": null,
                      "categoryName": "Cylindre culbuteur, cabine",
                      "level": 4,
                      "children": {
                        "Revêtement, cylindre culbuteur - cabine": {
                          "categoryId": 200836,
                          "categoryName": "Tilt Cylinder, driver cab",
                          "level": 3,
                          "children": [],
                          "productId": 4398
                        }
                      }
                    }
                  },
                  "productId": 4398
                }
              }
            }
          }
        }
      },
      "arborescenceText": "├── Cabine du conducteur/carrosserie [ID: 200022] (Niveau 1)\n│   ├── Basculateur-cabine (Niveau 2)\n│   │   ├── Driver Cab Tilt Unit [ID: 202897] (Niveau 2) → ProductId: 523\n│   │   ├── Driver Cab Tilt Unit [ID: 202897] (Niveau 2) → ProductId: 4409\n│   │   ├── Driver Cab Tilt Unit [ID: 202897] (Niveau 2) → ProductId: 4066\n│   │   └── Driver Cab Tilt Unit [ID: 202897] (Niveau 2) → ProductId: 4398\n│   └── Suspension de la cabine (Niveau 2)\n│       ├── Driver Cab Suspension [ID: 200025] (Niveau 2) → ProductId: 523\n│       ├── Driver Cab Suspension [ID: 200025] (Niveau 2) → ProductId: 4409\n│       ├── Driver Cab Suspension [ID: 200025] (Niveau 2) → ProductId: 4066\n│       └── Driver Cab Suspension [ID: 200025] (Niveau 2) → ProductId: 4398\n\n└── Système hydraulique [ID: 200066] (Niveau 1)\n    └── Cabine (Niveau 2)\n        ├── Driver Cab [ID: 200835] (Niveau 2) → ProductId: 523\n        │   └── Cylindre culbuteur, cabine (Niveau 4)\n        │       └── Tilt Cylinder, driver cab [ID: 200836] (Niveau 3) → ProductId: 523\n        ├── Driver Cab [ID: 200835] (Niveau 2) → ProductId: 4409\n        │   └── Cylindre culbuteur, cabine (Niveau 4)\n        │       └── Tilt Cylinder, driver cab [ID: 200836] (Niveau 3) → ProductId: 4409\n        ├── Driver Cab [ID: 200835] (Niveau 2) → ProductId: 4066\n        │   └── Cylindre culbuteur, cabine (Niveau 4)\n        │       └── Tilt Cylinder, driver cab [ID: 200836] (Niveau 3) → ProductId: 4066\n        └── Driver Cab [ID: 200835] (Niveau 2) → ProductId: 4398\n            └── Cylindre culbuteur, cabine (Niveau 4)\n                └── Tilt Cylinder, driver cab [ID: 200836] (Niveau 3) → ProductId: 4398",
      "productIdsInArbo": [
        523,
        4066,
        4398,
        4409
      ],
      "matchedProductIds": [
        523
      ]
    }
  ],
  "timestamp": "2025-12-03T10:15:50.175Z",
  "bestMatch": {
    "typeId": 2,
    "found": true,
    "hasMatch": true
  }
}