{
  "productName": "Levier-came",
  "productId": 3540,
  "searchText": "Levier-came",
  "originalFound": false,
  "tests": [
    {
      "typeId": 2,
      "found": true,
      "hasMatch": true,
      "arborescence": {
        "Dispositif de freinage": {
          "categoryId": 200058,
          "categoryName": "Dispositif de freinage",
          "level": 1,
          "children": {
            "Frein à tambour": {
              "categoryId": null,
              "categoryName": "Frein à tambour",
              "level": 2,
              "children": {
                "Axe d'ajustement, levier-came": {
                  "categoryId": 200098,
                  "categoryName": "Drum Brake",
                  "level": 2,
                  "children": {
                    "Régleur de timonerie / accessoires": {
                      "categoryId": null,
                      "categoryName": "Régleur de timonerie / accessoires",
                      "level": 4,
                      "children": {
                        "Axe d'ajustement, levier-came": {
                          "categoryId": 200365,
                          "categoryName": "Adjuster/Accessories",
                          "level": 3,
                          "children": [],
                          "productId": 4141
                        }
                      }
                    }
                  },
                  "productId": 4141
                },
                "Kit de réparation, régleur de timonerie": {
                  "categoryId": 200098,
                  "categoryName": "Drum Brake",
                  "level": 2,
                  "children": {
                    "Régleur de timonerie / accessoires": {
                      "categoryId": null,
                      "categoryName": "Régleur de timonerie / accessoires",
                      "level": 4,
                      "children": {
                        "Kit de réparation, régleur de timonerie": {
                          "categoryId": 200365,
                          "categoryName": "Adjuster/Accessories",
                          "level": 3,
                          "children": [],
                          "productId": 2721
                        }
                      }
                    }
                  },
                  "productId": 2721
                },
                "Poulie-cône, levier-came": {
                  "categoryId": 200098,
                  "categoryName": "Drum Brake",
                  "level": 2,
                  "children": {
                    "Régleur de timonerie / accessoires": {
                      "categoryId": null,
                      "categoryName": "Régleur de timonerie / accessoires",
                      "level": 4,
                      "children": {
                        "Poulie-cône, levier-came": {
                          "categoryId": 200365,
                          "categoryName": "Adjuster/Accessories",
                          "level": 3,
                          "children": [],
                          "productId": 3047
                        }
                      }
                    }
                  },
                  "productId": 3047
                },
                "Ressort, régleur de timonerie": {
                  "categoryId": 200098,
                  "categoryName": "Drum Brake",
                  "level": 2,
                  "children": {
                    "Régleur de timonerie / accessoires": {
                      "categoryId": null,
                      "categoryName": "Régleur de timonerie / accessoires",
                      "level": 4,
                      "children": {
                        "Ressort, régleur de timonerie": {
                          "categoryId": 200365,
                          "categoryName": "Adjuster/Accessories",
                          "level": 3,
                          "children": [],
                          "productId": 1096
                        }
                      }
                    }
                  },
                  "productId": 1096
                },
                "Rondelle d'écartement, levier-came": {
                  "categoryId": 200098,
                  "categoryName": "Drum Brake",
                  "level": 2,
                  "children": {
                    "Régleur de timonerie / accessoires": {
                      "categoryId": null,
                      "categoryName": "Régleur de timonerie / accessoires",
                      "level": 4,
                      "children": {
                        "Rondelle d'écartement, levier-came": {
                          "categoryId": 200365,
                          "categoryName": "Adjuster/Accessories",
                          "level": 3,
                          "children": [],
                          "productId": 3007
                        }
                      }
                    }
                  },
                  "productId": 3007
                },
                "Rondelle de butée, régleur de timonerie": {
                  "categoryId": 200098,
                  "categoryName": "Drum Brake",
                  "level": 2,
                  "children": {
                    "Régleur de timonerie / accessoires": {
                      "categoryId": null,
                      "categoryName": "Régleur de timonerie / accessoires",
                      "level": 4,
                      "children": {
                        "Rondelle de butée, régleur de timonerie": {
                          "categoryId": 200365,
                          "categoryName": "Adjuster/Accessories",
                          "level": 3,
                          "children": [],
                          "productId": 3008
                        }
                      }
                    }
                  },
                  "productId": 3008
                }
              }
            },
            "Recherche d'un article par graphique": {
              "categoryId": null,
              "categoryName": "Recherche d'un article par graphique",
              "level": 2,
              "children": {
                "Levier-came": {
                  "categoryId": 202430,
                  "categoryName": "Article Search via Graphic",
                  "level": 2,
                  "children": [],
                  "productId": 3540
                }
              }
            }
          }
        },
        "Recherche de l'article par image": {
          "categoryId": 202419,
          "categoryName": "Recherche de l'article par image",
          "level": 1,
          "children": {
            "Dispositif de freinage": {
              "categoryId": null,
              "categoryName": "Dispositif de freinage",
              "level": 2,
              "children": {
                "Levier-came": {
                  "categoryId": 202425,
                  "categoryName": "Braking System",
                  "level": 2,
                  "children": [],
                  "productId": 3540
                }
              }
            }
          }
        }
      },
      "arborescenceText": "├── Dispositif de freinage [ID: 200058] (Niveau 1)\n│   ├── Frein à tambour (Niveau 2)\n│   │   ├── Drum Brake [ID: 200098] (Niveau 2) → ProductId: 4141\n│   │   │   └── Régleur de timonerie / accessoires (Niveau 4)\n│   │   │       └── Adjuster/Accessories [ID: 200365] (Niveau 3) → ProductId: 4141\n│   │   ├── Drum Brake [ID: 200098] (Niveau 2) → ProductId: 2721\n│   │   │   └── Régleur de timonerie / accessoires (Niveau 4)\n│   │   │       └── Adjuster/Accessories [ID: 200365] (Niveau 3) → ProductId: 2721\n│   │   ├── Drum Brake [ID: 200098] (Niveau 2) → ProductId: 3047\n│   │   │   └── Régleur de timonerie / accessoires (Niveau 4)\n│   │   │       └── Adjuster/Accessories [ID: 200365] (Niveau 3) → ProductId: 3047\n│   │   ├── Drum Brake [ID: 200098] (Niveau 2) → ProductId: 1096\n│   │   │   └── Régleur de timonerie / accessoires (Niveau 4)\n│   │   │       └── Adjuster/Accessories [ID: 200365] (Niveau 3) → ProductId: 1096\n│   │   ├── Drum Brake [ID: 200098] (Niveau 2) → ProductId: 3007\n│   │   │   └── Régleur de timonerie / accessoires (Niveau 4)\n│   │   │       └── Adjuster/Accessories [ID: 200365] (Niveau 3) → ProductId: 3007\n│   │   └── Drum Brake [ID: 200098] (Niveau 2) → ProductId: 3008\n│   │       └── Régleur de timonerie / accessoires (Niveau 4)\n│   │           └── Adjuster/Accessories [ID: 200365] (Niveau 3) → ProductId: 3008\n│   └── Recherche d'un article par graphique (Niveau 2)\n│       └── Article Search via Graphic [ID: 202430] (Niveau 2) → ProductId: 3540\n\n└── Recherche de l'article par image [ID: 202419] (Niveau 1)\n    └── Dispositif de freinage (Niveau 2)\n        └── Braking System [ID: 202425] (Niveau 2) → ProductId: 3540",
      "productIdsInArbo": [
        1096,
        2721,
        3007,
        3008,
        3047,
        3540,
        4141
      ],
      "matchedProductIds": [
        3540
      ]
    }
  ],
  "timestamp": "2025-12-03T10:49:19.017Z",
  "bestMatch": {
    "typeId": 2,
    "found": true,
    "hasMatch": true
  }
}