{
  "productName": "Maître-cylindre, frein à pied (moto)",
  "productId": 5308,
  "searchText": "Maître-cylindre, frein à pied (moto)",
  "originalFound": false,
  "tests": [
    {
      "typeId": 2,
      "found": false,
      "hasMatch": false
    },
    {
      "typeId": 3,
      "found": true,
      "hasMatch": true,
      "arborescence": {
        "Moto": {
          "categoryId": 103671,
          "categoryName": "Moto",
          "level": 1,
          "children": {
            "Dispositif de freinage": {
              "categoryId": null,
              "categoryName": "Dispositif de freinage",
              "level": 2,
              "children": {
                "Levier de renvoi, cylindre de frein à pied (deux roues)": {
                  "categoryId": 103672,
                  "categoryName": "Braking System",
                  "level": 2,
                  "children": {
                    "Maître-cylindre, frein à main/pied": {
                      "categoryId": null,
                      "categoryName": "Maître-cylindre, frein à main/pied",
                      "level": 4,
                      "children": {
                        "Levier de renvoi, cylindre de frein à pied (deux roues)": {
                          "categoryId": 104086,
                          "categoryName": "Hand/Foot Brake Cylinder",
                          "level": 3,
                          "children": [],
                          "productId": 61467
                        }
                      }
                    }
                  },
                  "productId": 61467
                },
                "Maître-cylindre, frein à pied (moto)": {
                  "categoryId": 103672,
                  "categoryName": "Braking System",
                  "level": 2,
                  "children": {
                    "Maître-cylindre, frein à main/pied": {
                      "categoryId": null,
                      "categoryName": "Maître-cylindre, frein à main/pied",
                      "level": 4,
                      "children": {
                        "Maître-cylindre, frein à pied (moto)": {
                          "categoryId": 104086,
                          "categoryName": "Hand/Foot Brake Cylinder",
                          "level": 3,
                          "children": [],
                          "productId": 5308
                        }
                      }
                    }
                  },
                  "productId": 5308
                },
                "Manchette, cylindre de frein à pied (deux roues)": {
                  "categoryId": 103672,
                  "categoryName": "Braking System",
                  "level": 2,
                  "children": {
                    "Maître-cylindre, frein à main/pied": {
                      "categoryId": null,
                      "categoryName": "Maître-cylindre, frein à main/pied",
                      "level": 4,
                      "children": {
                        "Manchette, cylindre de frein à pied (deux roues)": {
                          "categoryId": 104086,
                          "categoryName": "Hand/Foot Brake Cylinder",
                          "level": 3,
                          "children": [],
                          "productId": 61446
                        }
                      }
                    }
                  },
                  "productId": 61446
                },
                "Membrane, cylindre de frein à pied (deux roues)": {
                  "categoryId": 103672,
                  "categoryName": "Braking System",
                  "level": 2,
                  "children": {
                    "Maître-cylindre, frein à main/pied": {
                      "categoryId": null,
                      "categoryName": "Maître-cylindre, frein à main/pied",
                      "level": 4,
                      "children": {
                        "Membrane, cylindre de frein à pied (deux roues)": {
                          "categoryId": 104086,
                          "categoryName": "Hand/Foot Brake Cylinder",
                          "level": 3,
                          "children": [],
                          "productId": 61483
                        }
                      }
                    }
                  },
                  "productId": 61483
                },
                "Piston, cylindre de frein à pied (deux roues)": {
                  "categoryId": 103672,
                  "categoryName": "Braking System",
                  "level": 2,
                  "children": {
                    "Maître-cylindre, frein à main/pied": {
                      "categoryId": null,
                      "categoryName": "Maître-cylindre, frein à main/pied",
                      "level": 4,
                      "children": {
                        "Piston, cylindre de frein à pied (deux roues)": {
                          "categoryId": 104086,
                          "categoryName": "Hand/Foot Brake Cylinder",
                          "level": 3,
                          "children": [],
                          "productId": 61451
                        }
                      }
                    }
                  },
                  "productId": 61451
                },
                "Ressort de piston, cylindre de frein à pied (deux roues)": {
                  "categoryId": 103672,
                  "categoryName": "Braking System",
                  "level": 2,
                  "children": {
                    "Maître-cylindre, frein à main/pied": {
                      "categoryId": null,
                      "categoryName": "Maître-cylindre, frein à main/pied",
                      "level": 4,
                      "children": {
                        "Ressort de piston, cylindre de frein à pied (deux roues)": {
                          "categoryId": 104086,
                          "categoryName": "Hand/Foot Brake Cylinder",
                          "level": 3,
                          "children": [],
                          "productId": 61473
                        }
                      }
                    }
                  },
                  "productId": 61473
                },
                "Tige de pression, cylindre de frein à pied (deux roues)": {
                  "categoryId": 103672,
                  "categoryName": "Braking System",
                  "level": 2,
                  "children": {
                    "Maître-cylindre, frein à main/pied": {
                      "categoryId": null,
                      "categoryName": "Maître-cylindre, frein à main/pied",
                      "level": 4,
                      "children": {
                        "Tige de pression, cylindre de frein à pied (deux roues)": {
                          "categoryId": 104086,
                          "categoryName": "Hand/Foot Brake Cylinder",
                          "level": 3,
                          "children": [],
                          "productId": 61468
                        }
                      }
                    }
                  },
                  "productId": 61468
                }
              }
            }
          }
        }
      },
      "arborescenceText": "└── Moto [ID: 103671] (Niveau 1)\n    └── Dispositif de freinage (Niveau 2)\n        ├── Braking System [ID: 103672] (Niveau 2) → ProductId: 61467\n        │   └── Maître-cylindre, frein à main/pied (Niveau 4)\n        │       └── Hand/Foot Brake Cylinder [ID: 104086] (Niveau 3) → ProductId: 61467\n        ├── Braking System [ID: 103672] (Niveau 2) → ProductId: 5308\n        │   └── Maître-cylindre, frein à main/pied (Niveau 4)\n        │       └── Hand/Foot Brake Cylinder [ID: 104086] (Niveau 3) → ProductId: 5308\n        ├── Braking System [ID: 103672] (Niveau 2) → ProductId: 61446\n        │   └── Maître-cylindre, frein à main/pied (Niveau 4)\n        │       └── Hand/Foot Brake Cylinder [ID: 104086] (Niveau 3) → ProductId: 61446\n        ├── Braking System [ID: 103672] (Niveau 2) → ProductId: 61483\n        │   └── Maître-cylindre, frein à main/pied (Niveau 4)\n        │       └── Hand/Foot Brake Cylinder [ID: 104086] (Niveau 3) → ProductId: 61483\n        ├── Braking System [ID: 103672] (Niveau 2) → ProductId: 61451\n        │   └── Maître-cylindre, frein à main/pied (Niveau 4)\n        │       └── Hand/Foot Brake Cylinder [ID: 104086] (Niveau 3) → ProductId: 61451\n        ├── Braking System [ID: 103672] (Niveau 2) → ProductId: 61473\n        │   └── Maître-cylindre, frein à main/pied (Niveau 4)\n        │       └── Hand/Foot Brake Cylinder [ID: 104086] (Niveau 3) → ProductId: 61473\n        └── Braking System [ID: 103672] (Niveau 2) → ProductId: 61468\n            └── Maître-cylindre, frein à main/pied (Niveau 4)\n                └── Hand/Foot Brake Cylinder [ID: 104086] (Niveau 3) → ProductId: 61468",
      "productIdsInArbo": [
        5308,
        61446,
        61451,
        61467,
        61468,
        61473,
        61483
      ],
      "matchedProductIds": [
        5308
      ]
    }
  ],
  "timestamp": "2025-12-03T10:56:49.259Z",
  "bestMatch": {
    "typeId": 3,
    "found": true,
    "hasMatch": true
  }
}