{
  "productName": "Pivot d'attelage",
  "productId": 1808,
  "searchText": "Pivot d'attelage",
  "originalFound": false,
  "tests": [
    {
      "typeId": 2,
      "found": true,
      "hasMatch": true,
      "arborescence": {
        "Dispositif d'attelage/d'accouplement": {
          "categoryId": 200941,
          "categoryName": "Dispositif d'attelage/d'accouplement",
          "level": 1,
          "children": {
            "Dispositif d'accouplement": {
              "categoryId": null,
              "categoryName": "Dispositif d'accouplement",
              "level": 2,
              "children": {
                "Crochet de fermeture, pivot d'attelage": {
                  "categoryId": 200946,
                  "categoryName": "Pulling Device",
                  "level": 2,
                  "children": [],
                  "productId": 5042
                },
                "Fermeture, pivot d'attelage": {
                  "categoryId": 200946,
                  "categoryName": "Pulling Device",
                  "level": 2,
                  "children": [],
                  "productId": 4262
                },
                "Levier d'arrêt, pivot d'attelage": {
                  "categoryId": 200946,
                  "categoryName": "Pulling Device",
                  "level": 2,
                  "children": [],
                  "productId": 5097
                },
                "Pivot d'attelage": {
                  "categoryId": 200946,
                  "categoryName": "Pulling Device",
                  "level": 2,
                  "children": [],
                  "productId": 1808
                },
                "Plaque d'admission, pivot d'attelage": {
                  "categoryId": 200946,
                  "categoryName": "Pulling Device",
                  "level": 2,
                  "children": [],
                  "productId": 2760
                },
                "Poignée de tirage, pivot d'attelage": {
                  "categoryId": 200946,
                  "categoryName": "Pulling Device",
                  "level": 2,
                  "children": [],
                  "productId": 5090
                },
                "Verrou à bascule, pivot d'attelage": {
                  "categoryId": 200946,
                  "categoryName": "Pulling Device",
                  "level": 2,
                  "children": [],
                  "productId": 5041
                }
              }
            },
            "Pièces": {
              "categoryId": null,
              "categoryName": "Pièces",
              "level": 2,
              "children": {
                "Crochet de fermeture, pivot d'attelage": {
                  "categoryId": 201024,
                  "categoryName": "Parts",
                  "level": 2,
                  "children": [],
                  "productId": 5042
                },
                "Fermeture, pivot d'attelage": {
                  "categoryId": 201024,
                  "categoryName": "Parts",
                  "level": 2,
                  "children": [],
                  "productId": 4262
                },
                "Poignée de tirage, pivot d'attelage": {
                  "categoryId": 201024,
                  "categoryName": "Parts",
                  "level": 2,
                  "children": [],
                  "productId": 5090
                },
                "Verrou à bascule, pivot d'attelage": {
                  "categoryId": 201024,
                  "categoryName": "Parts",
                  "level": 2,
                  "children": [],
                  "productId": 5041
                }
              }
            }
          }
        },
        "Équipement / accessoires": {
          "categoryId": 200067,
          "categoryName": "Équipement / accessoires",
          "level": 1,
          "children": {
            "Dispositif d'attelage/d'accouplement": {
              "categoryId": null,
              "categoryName": "Dispositif d'attelage/d'accouplement",
              "level": 2,
              "children": {
                "Crochet de fermeture, pivot d'attelage": {
                  "categoryId": 200796,
                  "categoryName": "Trailer Hitch/Pulling Device",
                  "level": 2,
                  "children": {
                    "Dispositif d'attelage": {
                      "categoryId": null,
                      "categoryName": "Dispositif d'attelage",
                      "level": 4,
                      "children": {
                        "Crochet de fermeture, pivot d'attelage": {
                          "categoryId": 200976,
                          "categoryName": "Pulling Device",
                          "level": 3,
                          "children": [],
                          "productId": 5042
                        }
                      }
                    }
                  },
                  "productId": 5042
                },
                "Levier d'arrêt, pivot d'attelage": {
                  "categoryId": 200796,
                  "categoryName": "Trailer Hitch/Pulling Device",
                  "level": 2,
                  "children": {
                    "Dispositif d'attelage": {
                      "categoryId": null,
                      "categoryName": "Dispositif d'attelage",
                      "level": 4,
                      "children": {
                        "Levier d'arrêt, pivot d'attelage": {
                          "categoryId": 200976,
                          "categoryName": "Pulling Device",
                          "level": 3,
                          "children": [],
                          "productId": 5097
                        }
                      }
                    }
                  },
                  "productId": 5097
                },
                "Pivot d'attelage": {
                  "categoryId": 200796,
                  "categoryName": "Trailer Hitch/Pulling Device",
                  "level": 2,
                  "children": {
                    "Dispositif d'attelage": {
                      "categoryId": null,
                      "categoryName": "Dispositif d'attelage",
                      "level": 4,
                      "children": {
                        "Pivot d'attelage": {
                          "categoryId": 200976,
                          "categoryName": "Pulling Device",
                          "level": 3,
                          "children": [],
                          "productId": 1808
                        }
                      }
                    }
                  },
                  "productId": 1808
                },
                "Poignée de tirage, pivot d'attelage": {
                  "categoryId": 200796,
                  "categoryName": "Trailer Hitch/Pulling Device",
                  "level": 2,
                  "children": {
                    "Dispositif d'attelage": {
                      "categoryId": null,
                      "categoryName": "Dispositif d'attelage",
                      "level": 4,
                      "children": {
                        "Poignée de tirage, pivot d'attelage": {
                          "categoryId": 200976,
                          "categoryName": "Pulling Device",
                          "level": 3,
                          "children": [],
                          "productId": 5090
                        }
                      }
                    }
                  },
                  "productId": 5090
                },
                "Verrou à bascule, pivot d'attelage": {
                  "categoryId": 200796,
                  "categoryName": "Trailer Hitch/Pulling Device",
                  "level": 2,
                  "children": {
                    "Dispositif d'attelage": {
                      "categoryId": null,
                      "categoryName": "Dispositif d'attelage",
                      "level": 4,
                      "children": {
                        "Verrou à bascule, pivot d'attelage": {
                          "categoryId": 200976,
                          "categoryName": "Pulling Device",
                          "level": 3,
                          "children": [],
                          "productId": 5041
                        }
                      }
                    }
                  },
                  "productId": 5041
                }
              }
            }
          }
        }
      },
      "arborescenceText": "├── Dispositif d'attelage/d'accouplement [ID: 200941] (Niveau 1)\n│   ├── Dispositif d'accouplement (Niveau 2)\n│   │   ├── Pulling Device [ID: 200946] (Niveau 2) → ProductId: 5042\n│   │   ├── Pulling Device [ID: 200946] (Niveau 2) → ProductId: 4262\n│   │   ├── Pulling Device [ID: 200946] (Niveau 2) → ProductId: 5097\n│   │   ├── Pulling Device [ID: 200946] (Niveau 2) → ProductId: 1808\n│   │   ├── Pulling Device [ID: 200946] (Niveau 2) → ProductId: 2760\n│   │   ├── Pulling Device [ID: 200946] (Niveau 2) → ProductId: 5090\n│   │   └── Pulling Device [ID: 200946] (Niveau 2) → ProductId: 5041\n│   └── Pièces (Niveau 2)\n│       ├── Parts [ID: 201024] (Niveau 2) → ProductId: 5042\n│       ├── Parts [ID: 201024] (Niveau 2) → ProductId: 4262\n│       ├── Parts [ID: 201024] (Niveau 2) → ProductId: 5090\n│       └── Parts [ID: 201024] (Niveau 2) → ProductId: 5041\n\n└── Équipement / accessoires [ID: 200067] (Niveau 1)\n    └── Dispositif d'attelage/d'accouplement (Niveau 2)\n        ├── Trailer Hitch/Pulling Device [ID: 200796] (Niveau 2) → ProductId: 5042\n        │   └── Dispositif d'attelage (Niveau 4)\n        │       └── Pulling Device [ID: 200976] (Niveau 3) → ProductId: 5042\n        ├── Trailer Hitch/Pulling Device [ID: 200796] (Niveau 2) → ProductId: 5097\n        │   └── Dispositif d'attelage (Niveau 4)\n        │       └── Pulling Device [ID: 200976] (Niveau 3) → ProductId: 5097\n        ├── Trailer Hitch/Pulling Device [ID: 200796] (Niveau 2) → ProductId: 1808\n        │   └── Dispositif d'attelage (Niveau 4)\n        │       └── Pulling Device [ID: 200976] (Niveau 3) → ProductId: 1808\n        ├── Trailer Hitch/Pulling Device [ID: 200796] (Niveau 2) → ProductId: 5090\n        │   └── Dispositif d'attelage (Niveau 4)\n        │       └── Pulling Device [ID: 200976] (Niveau 3) → ProductId: 5090\n        └── Trailer Hitch/Pulling Device [ID: 200796] (Niveau 2) → ProductId: 5041\n            └── Dispositif d'attelage (Niveau 4)\n                └── Pulling Device [ID: 200976] (Niveau 3) → ProductId: 5041",
      "productIdsInArbo": [
        1808,
        2760,
        4262,
        5041,
        5042,
        5090,
        5097
      ],
      "matchedProductIds": [
        1808
      ]
    }
  ],
  "timestamp": "2025-12-03T11:11:08.723Z",
  "bestMatch": {
    "typeId": 2,
    "found": true,
    "hasMatch": true
  }
}