{
  "productName": "Système de repose-pied",
  "productId": 5346,
  "searchText": "Système de repose-pied",
  "originalFound": false,
  "tests": [
    {
      "typeId": 2,
      "found": false,
      "hasMatch": false
    },
    {
      "typeId": 3,
      "found": true,
      "hasMatch": true,
      "arborescence": {
        "Moto": {
          "categoryId": 103671,
          "categoryName": "Moto",
          "level": 1,
          "children": {
            "Dispositif de freinage": {
              "categoryId": null,
              "categoryName": "Dispositif de freinage",
              "level": 2,
              "children": {
                "Levier de freinage, système de repose-pied": {
                  "categoryId": 103672,
                  "categoryName": "Braking System",
                  "level": 2,
                  "children": {
                    "Câbles et leviers de freins": {
                      "categoryId": null,
                      "categoryName": "Câbles et leviers de freins",
                      "level": 4,
                      "children": {
                        "Levier de freinage, système de repose-pied": {
                          "categoryId": 104085,
                          "categoryName": "Brake Lever/Cables",
                          "level": 3,
                          "children": [],
                          "productId": 7850
                        }
                      }
                    }
                  },
                  "productId": 7850
                }
              }
            },
            "Système de repose-pied": {
              "categoryId": null,
              "categoryName": "Système de repose-pied",
              "level": 2,
              "children": {
                "Bouchon de repose-pied": {
                  "categoryId": 103691,
                  "categoryName": "Footrest System",
                  "level": 2,
                  "children": {
                    "Resposes-pieds": {
                      "categoryId": null,
                      "categoryName": "Resposes-pieds",
                      "level": 4,
                      "children": {
                        "Bouchon de repose-pied": {
                          "categoryId": 103692,
                          "categoryName": "Footrests",
                          "level": 3,
                          "children": [],
                          "productId": 8131
                        }
                      }
                    }
                  },
                  "productId": 8131
                },
                "Entraîneur, levier commande/freinage (système repose-pied)": {
                  "categoryId": 103691,
                  "categoryName": "Footrest System",
                  "level": 2,
                  "children": {
                    "Levier de changement de vitesse": {
                      "categoryId": null,
                      "categoryName": "Levier de changement de vitesse",
                      "level": 4,
                      "children": {
                        "Entraîneur, levier commande/freinage (système repose-pied)": {
                          "categoryId": 105943,
                          "categoryName": "Foot Shift Lever",
                          "level": 3,
                          "children": [],
                          "productId": 8132
                        }
                      }
                    },
                    "Levier de frein": {
                      "categoryId": null,
                      "categoryName": "Levier de frein",
                      "level": 4,
                      "children": {
                        "Entraîneur, levier commande/freinage (système repose-pied)": {
                          "categoryId": 105942,
                          "categoryName": "Brake Lever",
                          "level": 3,
                          "children": [],
                          "productId": 8132
                        }
                      }
                    }
                  },
                  "productId": 8132
                },
                "Jeu de joints, repose-pieds": {
                  "categoryId": 103691,
                  "categoryName": "Footrest System",
                  "level": 2,
                  "children": {
                    "Resposes-pieds": {
                      "categoryId": null,
                      "categoryName": "Resposes-pieds",
                      "level": 4,
                      "children": {
                        "Jeu de joints, repose-pieds": {
                          "categoryId": 103692,
                          "categoryName": "Footrests",
                          "level": 3,
                          "children": [],
                          "productId": 5350
                        }
                      }
                    }
                  },
                  "productId": 5350
                },
                "Kit de repose-pieds": {
                  "categoryId": 103691,
                  "categoryName": "Footrest System",
                  "level": 2,
                  "children": {
                    "Resposes-pieds": {
                      "categoryId": null,
                      "categoryName": "Resposes-pieds",
                      "level": 4,
                      "children": {
                        "Kit de repose-pieds": {
                          "categoryId": 103692,
                          "categoryName": "Footrests",
                          "level": 3,
                          "children": [],
                          "productId": 5353
                        }
                      }
                    }
                  },
                  "productId": 5353
                },
                "Levier de commande, système de repose-pied": {
                  "categoryId": 103691,
                  "categoryName": "Footrest System",
                  "level": 2,
                  "children": {
                    "Levier de changement de vitesse": {
                      "categoryId": null,
                      "categoryName": "Levier de changement de vitesse",
                      "level": 4,
                      "children": {
                        "Levier de commande, système de repose-pied": {
                          "categoryId": 105943,
                          "categoryName": "Foot Shift Lever",
                          "level": 3,
                          "children": [],
                          "productId": 7851
                        }
                      }
                    }
                  },
                  "productId": 7851
                },
                "Levier de freinage, système de repose-pied": {
                  "categoryId": 103691,
                  "categoryName": "Footrest System",
                  "level": 2,
                  "children": {
                    "Levier de frein": {
                      "categoryId": null,
                      "categoryName": "Levier de frein",
                      "level": 4,
                      "children": {
                        "Levier de freinage, système de repose-pied": {
                          "categoryId": 105942,
                          "categoryName": "Brake Lever",
                          "level": 3,
                          "children": [],
                          "productId": 7850
                        }
                      }
                    }
                  },
                  "productId": 7850
                },
                "Marchepied": {
                  "categoryId": 103691,
                  "categoryName": "Footrest System",
                  "level": 2,
                  "children": {
                    "Marchepied": {
                      "categoryId": null,
                      "categoryName": "Marchepied",
                      "level": 4,
                      "children": {
                        "Marchepied": {
                          "categoryId": 103979,
                          "categoryName": "Foot Board",
                          "level": 3,
                          "children": [],
                          "productId": 5484
                        }
                      }
                    }
                  },
                  "productId": 5484
                },
                "Plaque d’adaptation, maître cylindre": {
                  "categoryId": 103691,
                  "categoryName": "Footrest System",
                  "level": 2,
                  "children": {
                    "Système de repose-pied": {
                      "categoryId": null,
                      "categoryName": "Système de repose-pied",
                      "level": 4,
                      "children": {
                        "Plaque d’adaptation, maître cylindre": {
                          "categoryId": 103693,
                          "categoryName": "Footrest System",
                          "level": 3,
                          "children": [],
                          "productId": 8130
                        }
                      }
                    }
                  },
                  "productId": 8130
                },
                "Plaque d’adaptation, système de repose-pied": {
                  "categoryId": 103691,
                  "categoryName": "Footrest System",
                  "level": 2,
                  "children": {
                    "Système de repose-pied": {
                      "categoryId": null,
                      "categoryName": "Système de repose-pied",
                      "level": 4,
                      "children": {
                        "Plaque d’adaptation, système de repose-pied": {
                          "categoryId": 103693,
                          "categoryName": "Footrest System",
                          "level": 3,
                          "children": [],
                          "productId": 8116
                        }
                      }
                    }
                  },
                  "productId": 8116
                },
                "Plaque de base, système de repose-pied": {
                  "categoryId": 103691,
                  "categoryName": "Footrest System",
                  "level": 2,
                  "children": {
                    "Système de repose-pied": {
                      "categoryId": null,
                      "categoryName": "Système de repose-pied",
                      "level": 4,
                      "children": {
                        "Plaque de base, système de repose-pied": {
                          "categoryId": 103693,
                          "categoryName": "Footrest System",
                          "level": 3,
                          "children": [],
                          "productId": 8161
                        }
                      }
                    }
                  },
                  "productId": 8161
                },
                "Protège-talons , repose-pieds": {
                  "categoryId": 103691,
                  "categoryName": "Footrest System",
                  "level": 2,
                  "children": {
                    "Système de repose-pied": {
                      "categoryId": null,
                      "categoryName": "Système de repose-pied",
                      "level": 4,
                      "children": {
                        "Protège-talons , repose-pieds": {
                          "categoryId": 103693,
                          "categoryName": "Footrest System",
                          "level": 3,
                          "children": [],
                          "productId": 5355
                        }
                      }
                    }
                  },
                  "productId": 5355
                },
                "Rallonge de tringle de commande, système de repose-pied": {
                  "categoryId": 103691,
                  "categoryName": "Footrest System",
                  "level": 2,
                  "children": {
                    "Tringle de commande/rallonge de tringle de commande": {
                      "categoryId": null,
                      "categoryName": "Tringle de commande/rallonge de tringle de commande",
                      "level": 4,
                      "children": {
                        "Rallonge de tringle de commande, système de repose-pied": {
                          "categoryId": 706033,
                          "categoryName": "Shift Rod/Shift Rod Extension",
                          "level": 3,
                          "children": [],
                          "productId": 8117
                        }
                      }
                    }
                  },
                  "productId": 8117
                },
                "Système de repose-pied": {
                  "categoryId": 103691,
                  "categoryName": "Footrest System",
                  "level": 2,
                  "children": {
                    "Système de repose-pied": {
                      "categoryId": null,
                      "categoryName": "Système de repose-pied",
                      "level": 4,
                      "children": {
                        "Système de repose-pied": {
                          "categoryId": 103693,
                          "categoryName": "Footrest System",
                          "level": 3,
                          "children": [],
                          "productId": 5346
                        }
                      }
                    }
                  },
                  "productId": 5346
                },
                "Tête sphérique, tringle de commande (système de repose-pied)": {
                  "categoryId": 103691,
                  "categoryName": "Footrest System",
                  "level": 2,
                  "children": {
                    "Tringle de commande/rallonge de tringle de commande": {
                      "categoryId": null,
                      "categoryName": "Tringle de commande/rallonge de tringle de commande",
                      "level": 4,
                      "children": {
                        "Tête sphérique, tringle de commande (système de repose-pied)": {
                          "categoryId": 706033,
                          "categoryName": "Shift Rod/Shift Rod Extension",
                          "level": 3,
                          "children": [],
                          "productId": 8133
                        }
                      }
                    }
                  },
                  "productId": 8133
                },
                "Tringle de commande, système de repose-pied": {
                  "categoryId": 103691,
                  "categoryName": "Footrest System",
                  "level": 2,
                  "children": {
                    "Tringle de commande/rallonge de tringle de commande": {
                      "categoryId": null,
                      "categoryName": "Tringle de commande/rallonge de tringle de commande",
                      "level": 4,
                      "children": {
                        "Tringle de commande, système de repose-pied": {
                          "categoryId": 706033,
                          "categoryName": "Shift Rod/Shift Rod Extension",
                          "level": 3,
                          "children": [],
                          "productId": 8127
                        }
                      }
                    }
                  },
                  "productId": 8127
                }
              }
            }
          }
        }
      },
      "arborescenceText": "└── Moto [ID: 103671] (Niveau 1)\n    ├── Dispositif de freinage (Niveau 2)\n    │   └── Braking System [ID: 103672] (Niveau 2) → ProductId: 7850\n    │       └── Câbles et leviers de freins (Niveau 4)\n    │           └── Brake Lever/Cables [ID: 104085] (Niveau 3) → ProductId: 7850\n    └── Système de repose-pied (Niveau 2)\n        ├── Footrest System [ID: 103691] (Niveau 2) → ProductId: 8131\n        │   └── Resposes-pieds (Niveau 4)\n        │       └── Footrests [ID: 103692] (Niveau 3) → ProductId: 8131\n        ├── Footrest System [ID: 103691] (Niveau 2) → ProductId: 8132\n        │   ├── Levier de changement de vitesse (Niveau 4)\n        │   │   └── Foot Shift Lever [ID: 105943] (Niveau 3) → ProductId: 8132\n        │   └── Levier de frein (Niveau 4)\n        │       └── Brake Lever [ID: 105942] (Niveau 3) → ProductId: 8132\n        ├── Footrest System [ID: 103691] (Niveau 2) → ProductId: 5350\n        │   └── Resposes-pieds (Niveau 4)\n        │       └── Footrests [ID: 103692] (Niveau 3) → ProductId: 5350\n        ├── Footrest System [ID: 103691] (Niveau 2) → ProductId: 5353\n        │   └── Resposes-pieds (Niveau 4)\n        │       └── Footrests [ID: 103692] (Niveau 3) → ProductId: 5353\n        ├── Footrest System [ID: 103691] (Niveau 2) → ProductId: 7851\n        │   └── Levier de changement de vitesse (Niveau 4)\n        │       └── Foot Shift Lever [ID: 105943] (Niveau 3) → ProductId: 7851\n        ├── Footrest System [ID: 103691] (Niveau 2) → ProductId: 7850\n        │   └── Levier de frein (Niveau 4)\n        │       └── Brake Lever [ID: 105942] (Niveau 3) → ProductId: 7850\n        ├── Footrest System [ID: 103691] (Niveau 2) → ProductId: 5484\n        │   └── Marchepied (Niveau 4)\n        │       └── Foot Board [ID: 103979] (Niveau 3) → ProductId: 5484\n        ├── Footrest System [ID: 103691] (Niveau 2) → ProductId: 8130\n        │   └── Système de repose-pied (Niveau 4)\n        │       └── Footrest System [ID: 103693] (Niveau 3) → ProductId: 8130\n        ├── Footrest System [ID: 103691] (Niveau 2) → ProductId: 8116\n        │   └── Système de repose-pied (Niveau 4)\n        │       └── Footrest System [ID: 103693] (Niveau 3) → ProductId: 8116\n        ├── Footrest System [ID: 103691] (Niveau 2) → ProductId: 8161\n        │   └── Système de repose-pied (Niveau 4)\n        │       └── Footrest System [ID: 103693] (Niveau 3) → ProductId: 8161\n        ├── Footrest System [ID: 103691] (Niveau 2) → ProductId: 5355\n        │   └── Système de repose-pied (Niveau 4)\n        │       └── Footrest System [ID: 103693] (Niveau 3) → ProductId: 5355\n        ├── Footrest System [ID: 103691] (Niveau 2) → ProductId: 8117\n        │   └── Tringle de commande/rallonge de tringle de commande (Niveau 4)\n        │       └── Shift Rod/Shift Rod Extension [ID: 706033] (Niveau 3) → ProductId: 8117\n        ├── Footrest System [ID: 103691] (Niveau 2) → ProductId: 5346\n        │   └── Système de repose-pied (Niveau 4)\n        │       └── Footrest System [ID: 103693] (Niveau 3) → ProductId: 5346\n        ├── Footrest System [ID: 103691] (Niveau 2) → ProductId: 8133\n        │   └── Tringle de commande/rallonge de tringle de commande (Niveau 4)\n        │       └── Shift Rod/Shift Rod Extension [ID: 706033] (Niveau 3) → ProductId: 8133\n        └── Footrest System [ID: 103691] (Niveau 2) → ProductId: 8127\n            └── Tringle de commande/rallonge de tringle de commande (Niveau 4)\n                └── Shift Rod/Shift Rod Extension [ID: 706033] (Niveau 3) → ProductId: 8127",
      "productIdsInArbo": [
        5346,
        5350,
        5353,
        5355,
        5484,
        7850,
        7851,
        8116,
        8117,
        8127,
        8130,
        8131,
        8132,
        8133,
        8161
      ],
      "matchedProductIds": [
        5346
      ]
    }
  ],
  "timestamp": "2025-12-03T11:37:45.984Z",
  "bestMatch": {
    "typeId": 3,
    "found": true,
    "hasMatch": true
  }
}